code,province,city,topic,date,url,content,content.1,label,score,is_match
227,四川省,成都市,成都市人民政府办公厅关于规范缔结国内友好城市管理工作的意见,2005-11-29,http://www.chengdu.gov.cn/gkml/cdsrmzfbgt/qtwj/1613191529696960512.shtml,成都市人民政府办公厅关于规范缔结国内友好城市管理工作的意见 - 其他文件 - 信息公开目录 - 成都市人民政府办公厅信息公开目录。各区（市）县政府，市政府各部门： 为规范我市缔结国内友好城市管理工作，有序发展国内友好城市关系，促进国内合作交流，经市政府同意，现提出如下意见。 一、指导思想 我市与具有一定合作交流基础的城市建立友好城市关系，促进双方的了解和友谊，开展友好城市间政府、经济、科技、文化等领域的交流与合作，推动双方经济和社会发展。 二、缔结对象 有利于实现优势互补、共同发展的直辖市、副省级城市、省会城市。 三、缔结程序 （一）意向提出。根据两市主要领导互有结好意向的提议。 （二）论证呈报。由市经合局负责对拟结友好城市进行调研考察，就双方近年来开展合作与交流的情况，经济、社会、文化等方面的互补性进行了解，对双方建立长期友好合作关系的可行性、必要性进行分析论证，并根据友好城市的类别提出相应的缔结建议。市经合局同时与拟结友好城市相关职能部门协商缔结友好城市的相关事宜，分别拟制缔结友好城市协议书和缔结友好城市签约仪式方案报市政府分管领导审核。 （三）协议审议。缔结友好城市协议书和缔结友好城市签约仪式方案经市政府分管领导审核后，提交市长办公会议或市政府常务会议审议。 （四）协议批准。缔结友好城市协议书经市长办公会议或市政府常务会议讨论审定后，报市委批准。 （五）协议签定。双方城市市长（或市长授权其他市领导）在缔结友好城市协议书上签字后，两市正式结为友好城市。 （六）协议备案。签字后的缔结友好城市协议书报市人大常委会备案。 四、友好城市交流 （一）由市领导带队不定期到各友好城市访问，互通情况，或者参与友好城市举办的重大节庆活动。我市与友好城市之间一般不举行周年纪念活动，可在结好周年互致祝贺函电。 （二）充分利用我市举办或参与的重大节庆、会展活动，有计划地邀请友好城市的领导来蓉参观、考察，推动友好城市关系不断发展。 （三）市政府有关部门要引导和组织我市企业到友好城市考察、学习、投资创业，促进生产要素自由流动，推动区域经济协调发展。同时，积极为友好城市来我市开展经贸活动、投资创业等提供帮助和服务。,成都市人民政府办公厅关于规范缔结国内友好城市管理工作的意见 - 其他文件 - 信息公开目录 - 成都市人民政府办公厅信息公开目录。各区（市）县政府，市政府各部门： 为规范我市缔结国内友好城市管理工作，有序发展国内友好城市关系，促进国内合作交流，经市政府同意，现提出如下意见。 一、指导思想 我市与具有一定合作交流基础的城市建立友好城市关系，促进双方的了解和友谊，开展友好城市间政府、经济、科技、文化等领域的交流与合作，推动双方经济和社会发展。 二、缔结对象 有利于实现优势互补、共同发展的直辖市、副省级城市、省会城市。 三、缔结程序 （一）意向提出。根据两市主要领导互有结好意向的提议。 （二）论证呈报。由市经合局负责对拟结友好城市进行调研考察，就双方近年来开展合作与交流的情况，经济、社会、文化等方面的互补性进行了解，对双方建立长期友好合作关系的可行性、必要性进行分析论证，并根据友好城市的类别提出相应的缔结建议。市经合局同时与拟结友好城市相关职能部门协商缔结友好城市的相关事宜，分别拟制缔结友好城市协议书和缔结友好城市签约仪式方案报市政府分管领导审核。 （三）协议审议。缔结友好城市协议书和缔结友好城市签约仪式方案经市政府分管领导审核后，提交市长办公会议或市政府常务会议审议。 （四）协议批准。缔结友好城市协议书经市长办公会议或市政府常务会议讨论审定后，报市委批准。 （五）协议签定。双方城市市长（或市长授权其他市领导）在缔结友好城市协议书上签字后，两市正式结为友好城市。 （六）协议备案。签字后的缔结友好城市协议书报市人大常委会备案。 四、友好城市交流 （一）由市领导带队不定期到各友好城市访问，互通情况，或者参与友好城市举办的重大节庆活动。我市与友好城市之间一般不举行周年纪念活动，可在结好周年互致祝贺函电。 （二）充分利用我市举办或参与的重大节庆、会展活动，有计划地邀请友好城市的领导来蓉参观、考察，推动友好城市关系不断发展。 （三）市政府有关部门要引导和组织我市企业到友好城市考察、学习、投资创业，促进生产要素自由流动，推动区域经济协调发展。同时，积极为友好城市来我市开展经贸活动、投资创业等提供帮助和服务。,政府领导到其他城市考察学习或访问,0.6799584772467298,True
227,四川省,成都市,施小琳等市领导在上海苏州考察学习开展项目对接,2022-11-07,https://www.chengdu.gov.cn/cdsrmzf/c169603/2023-12/11/content_ba6223d2c8db4c988b006220515b3fcf.shtml,全面领会贯彻党的二十大精神 学习借鉴先发城市经验 聚力开放创新 构筑高质量发展独特优势。11月4日至7日，四川省委常委、成都市委书记施小琳率队在上海、苏州考察学习，开展项目对接和投资促进活动。期间，施小琳等市领导参加了第五届中国国际进口博览会，先后来到上海城市规划展示馆、上海金桥经济技术开发区、苏州工业园、苏州高新区等地，交流学习各地在城市规划、产业发展、科技创新、营商环境等方面的先进经验。。施小琳指出，学习宣传贯彻党的二十大精神是当前和今后一个时期的首要政治任务。成都要按照省委部署要求，全面领会党的二十大精神并真抓实干见行见效，特别要坚定践行以人民为中心的发展思想，学习借鉴先发城市经验，积极借助进博会等开放平台，抢抓机遇、乘势而为，主动融入和服务新发展格局，以建设践行新发展理念的公园城市示范区为统领，深化改革开放，坚持自主创新，高效统筹疫情防控和经济社会发展，全力以赴拼经济、抓发展、惠民生，加快构建现代化产业体系，加速推动城市转型升级，培育构筑高质量发展、高品质生活、高效能治理独特优势，努力打造中国西部具有全球影响力和美誉度的现代化国际大都市。。第五届中国国际进口博览会11月4日在上海开幕。施小琳等市领导来到这里，认真学习了解新时代中国开放发展的成就，并和汽车、生物医药、电子信息等行业的重点企业深入交流。施小琳说，成都是“一带一路”建设和长江经济带发展的重要节点，正在加快建设国际门户枢纽，打造内陆改革开放新高地。成都将全面落实党中央和省委部署要求，坚定不移推进高水平对外开放，坚定不移推动创新驱动发展，坚定不移做优做强城市功能，坚定不移推动优质要素资源集聚，坚定不移持续优化营商环境，努力走出一条中国式现代化城市发展之路。希望大家充分发挥链主企业辐射带动作用，积极参与和支持成都产业建圈强链，帮助成都精准把握行业发展新趋势，携手抢占新赛道、壮大新动能，加快构建开放型现代产业体系。。在沪期间，施小琳等市领导先后来到上海城市规划展示馆和金桥经济技术开发区，实地考察上汽通用凯迪拉克工厂、金鼎天地项目和中国移动（上海）5G产业研究院等，学习了解城市规划理念和重点片区开发经验做法。她指出，成都加快建设公园城市示范区，持续推动“三个做优做强”，因地制宜划定了24个重点片区，促进区域协调发展，推动城市功能整体提升。各级各部门要持续深化对片区人口经济承载能力的研究，持续深化对产业发展趋势规律的认识，以重大项目集群建设为抓手，推进产城融合、职住平衡，推动优势产业集聚成群、公共服务均衡共享。。在苏州考察期间，施小琳一行与江苏省委常委、苏州市委书记曹路宝等苏州市领导进行了座谈交流，并先后参观考察苏州工业园区规划展示中心、苏州生物医药产业园、平江路历史文化街区、医疗器械产业园、中移（苏州）软件技术有限公司、清华苏州环境创新研究院等地，学习科技创新、现代产业、城市治理、历史文化保护等经验成果。。进博会期间，成都市还组织开展了“链接全球 汇聚天府”四川天府新区进口贸易创新促进示范区推介会、“港连亚欧 蓉通全球”亚蓉欧开放合作峰会等系列配套活动。部分区（市）县分别与重点企业、机构签约战略合作协议、项目投资协议28个。勃林格殷格翰成都霁达康复中心、赛默飞前沿生物技术联合创新实验室、岛津－未来医学城高性能医疗器械联合创新实验室等重点项目揭牌亮相。。市领导刘筱柳、曹俊杰、杜海波、刘任远分别参加相关活动。（成都日报锦观新闻记者 张家华）,全面领会贯彻党的二十大精神 学习借鉴先发城市经验 聚力开放创新 构筑高质量发展独特优势。11月4日至7日，四川省委常委、成都市委书记施小琳率队在上海、苏州考察学习，开展项目对接和投资促进活动。期间，施小琳等市领导参加了第五届中国国际进口博览会，先后来到上海城市规划展示馆、上海金桥经济技术开发区、苏州工业园、苏州高新区等地，交流学习各地在城市规划、产业发展、科技创新、营商环境等方面的先进经验。。施小琳指出，学习宣传贯彻党的二十大精神是当前和今后一个时期的首要政治任务。成都要按照省委部署要求，全面领会党的二十大精神并真抓实干见行见效，特别要坚定践行以人民为中心的发展思想，学习借鉴先发城市经验，积极借助进博会等开放平台，抢抓机遇、乘势而为，主动融入和服务新发展格局，以建设践行新发展理念的公园城市示范区为统领，深化改革开放，坚持自主创新，高效统筹疫情防控和经济社会发展，全力以赴拼经济、抓发展、惠民生，加快构建现代化产业体系，加速推动城市转型升级，培育构筑高质量发展、高品质生活、高效能治理独特优势，努力打造中国西部具有全球影响力和美誉度的现代化国际大都市。。第五届中国国际进口博览会11月4日在上海开幕。施小琳等市领导来到这里，认真学习了解新时代中国开放发展的成就，并和汽车、生物医药、电子信息等行业的重点企业深入交流。施小琳说，成都是“一带一路”建设和长江经济带发展的重要节点，正在加快建设国际门户枢纽，打造内陆改革开放新高地。成都将全面落实党中央和省委部署要求，坚定不移推进高水平对外开放，坚定不移推动创新驱动发展，坚定不移做优做强城市功能，坚定不移推动优质要素资源集聚，坚定不移持续优化营商环境，努力走出一条中国式现代化城市发展之路。希望大家充分发挥链主企业辐射带动作用，积极参与和支持成都产业建圈强链，帮助成都精准把握行业发展新趋势，携手抢占新赛道、壮大新动能，加快构建开放型现代产业体系。。在沪期间，施小琳等市领导先后来到上海城市规划展示馆和金桥经济技术开发区，实地考察上汽通用凯迪拉克工厂、金鼎天地项目和中国移动（上海）5G产业研究院等，学习了解城市规划理念和重点片区开发经验做法。她指出，成都加快建设公园城市示范区，持续推动“三个做优做强”，因地制宜划定了24个重点片区，促进区域协调发展，推动城市功能整体提升。各级各部门要持续深化对片区人口经济承载能力的研究，持续深化对产业发展趋势规律的认识，以重大项目集群建设为抓手，推进产城融合、职住平衡，推动优势产业集聚成群、公共服务均衡共享。。在苏州考察期间，施小琳一行与江苏省委常委、苏州市委书记曹路宝等苏州市领导进行了座谈交流，并先后参观考察苏州工业园区规划展示中心、苏州生物医药产业园、平江路历史文化街区、医疗器械产业园、中移（苏州）软件技术有限公司、清华苏州环境创新研究院等地，学习科技创新、现代产业、城市治理、历史文化保护等经验成果。。进博会期间，成都市还组织开展了“链接全球 汇聚天府”四川天府新区进口贸易创新促进示范区推介会、“港连亚欧 蓉通全球”亚蓉欧开放合作峰会等系列配套活动。部分区（市）县分别与重点企业、机构签约战略合作协议、项目投资协议28个。勃林格殷格翰成都霁达康复中心、赛默飞前沿生物技术联合创新实验室、岛津－未来医学城高性能医疗器械联合创新实验室等重点项目揭牌亮相。。市领导刘筱柳、曹俊杰、杜海波、刘任远分别参加相关活动。（成都日报锦观新闻记者 张家华）,政府领导到其他城市考察学习或访问,0.8668188691394194,True
227,四川省,成都市,合力谱写双城记建强都市圈推动成渝地区双城经济圈建设取得新的进展,2021-12-18,https://www.chengdu.gov.cn/cdsrmzf/c136804/2023-12/11/content_abfb0b270ddc47e78a12cd58395f3176.shtml,合力谱写“双城记” 建强都市圈 推动成渝地区双城经济圈建设取得新的进展-成都市人民政府。唐良智、王凤朝介绍有关情况。重庆市委副书记吴存荣，成都市人大常委会主任李仲彬、市政协主席张剡、市委副书记谢瑞武参加有关活动。。陈敏尔、唐良智代表重庆市委、市人大常委会、市政府、市政协欢迎成都市党政代表团来渝，向四川省及成都市长期以来对重庆发展的关心支持表示感谢。陈敏尔说，习近平总书记亲自作出推动成渝地区双城经济圈建设的重大战略决策，为新时代成渝发展提供了重大战略机遇。成渝“一家亲”，山水同源、人文同脉、发展同向。随着双城经济圈建设的深入推进，成渝交往更加密切、合作更加紧密。成都在经济社会发展中许多好经验好做法，值得重庆学习借鉴。我们要进一步提高政治站位、战略站位，深入学习贯彻党的十九届六中全会精神和中央经济工作会议精神，全面落实成渝地区双城经济圈建设规划纲要，携手谱写“双城记”、合力建设“经济圈”，加快建设带动全国高质量发展的重要增长极和新的动力源。。陈敏尔强调，推动成渝地区双城经济圈建设，要提升“双核”能级、增强辐射功能，更好服务和融入新发展格局，为全国发展大局作出新的更大贡献。要着力推进交通通道互联互通，加快实施成渝中线高铁等一批标志性项目，共同打造世界级机场群，积极拓展5G等通信通道，不断提升内联外通水平。要着力推进产业互联互通，强化先进制造业、现代服务业协同发展，持续完善产业链供应链协作格局，共同打造具有国际竞争力的世界级现代产业集群。要着力推进城市资源互联互通，优化城市空间布局，推动重庆主城都市区和成都市相向发展，辐射带动周边地区发展。要着力推进城市功能互联互通，强化金融要素集聚，共建西部金融中心，扩大全方位高水平开放，推动区域合作和对外开放取得更大成效。要着力推进公共政策互联互通，加强就业、科技、教育、文化、医疗卫生等共建共享，增加优质公共产品和服务供给，持续提高人民群众获得感、幸福感、安全感。。施小琳在讲话中说，按照四川省委、省政府要求，我们此次前往重庆考察学习交流，贯彻川渝党政联席会议第四次会议精神，着眼融入服务新发展格局、落实碳达峰碳中和目标、激发内生动力、提升群众幸福感获得感、推动战略实施成势见效，进一步在做强“双核”、联动“双圈”、融入“双循环”中落实成都任务。施小琳代表成都市委、市人大常委会、市政府、市政协对重庆长期以来给予的大力支持表示感谢。她说，重庆和成都山水相依、文脉相通、人缘相亲，交往融合历史源远流长。进入新时代，以习近平同志为核心的党中央着眼经略西部腹地、完善区域布局、促进协同发展，作出建设成渝地区双城经济圈的重大战略决策，为成渝地区协同联动、打造带动全国高质量发展的重要增长极和新的动力源擘画了发展蓝图。合力谱写“双城记”、建强都市圈，推动成渝地区双城经济圈建设走深走实，既赋予了成都重大职责使命，也是城市发展的重大战略机遇。。施小琳说，这次重庆之行，是深化党史学习教育的初心感悟之行，是融入和服务国家战略的对接落实之行，是对标先进的学习取经之行。下一步，成都将深入学习贯彻党的十九届六中全会精神，贯彻落实川渝党政联席会议工作部署，把学习考察的成果转化好，把协议确定的事项落实好，持续推进共建国际性综合交通枢纽、世界级先进制造业集群、西部科学城、西部金融中心、现代化国际都市取得新成果，为成渝地区双城经济圈建设作出积极贡献。。周五中午的成都东客站，一支40余人的队伍带着使命与期许，踏上了开往重庆的列车，这是由成都市委书记带队赴重庆考察学习的成都党政代表团。。龙门阵的主题，依旧是合作。有眼下的，有未来的。而这样的龙门阵，未来只会越来越多。（记者 王垚）,合力谱写“双城记” 建强都市圈 推动成渝地区双城经济圈建设取得新的进展-成都市人民政府。唐良智、王凤朝介绍有关情况。重庆市委副书记吴存荣，成都市人大常委会主任李仲彬、市政协主席张剡、市委副书记谢瑞武参加有关活动。。陈敏尔、唐良智代表重庆市委、市人大常委会、市政府、市政协欢迎成都市党政代表团来渝，向四川省及成都市长期以来对重庆发展的关心支持表示感谢。陈敏尔说，习近平总书记亲自作出推动成渝地区双城经济圈建设的重大战略决策，为新时代成渝发展提供了重大战略机遇。成渝“一家亲”，山水同源、人文同脉、发展同向。随着双城经济圈建设的深入推进，成渝交往更加密切、合作更加紧密。成都在经济社会发展中许多好经验好做法，值得重庆学习借鉴。我们要进一步提高政治站位、战略站位，深入学习贯彻党的十九届六中全会精神和中央经济工作会议精神，全面落实成渝地区双城经济圈建设规划纲要，携手谱写“双城记”、合力建设“经济圈”，加快建设带动全国高质量发展的重要增长极和新的动力源。。陈敏尔强调，推动成渝地区双城经济圈建设，要提升“双核”能级、增强辐射功能，更好服务和融入新发展格局，为全国发展大局作出新的更大贡献。要着力推进交通通道互联互通，加快实施成渝中线高铁等一批标志性项目，共同打造世界级机场群，积极拓展5G等通信通道，不断提升内联外通水平。要着力推进产业互联互通，强化先进制造业、现代服务业协同发展，持续完善产业链供应链协作格局，共同打造具有国际竞争力的世界级现代产业集群。要着力推进城市资源互联互通，优化城市空间布局，推动重庆主城都市区和成都市相向发展，辐射带动周边地区发展。要着力推进城市功能互联互通，强化金融要素集聚，共建西部金融中心，扩大全方位高水平开放，推动区域合作和对外开放取得更大成效。要着力推进公共政策互联互通，加强就业、科技、教育、文化、医疗卫生等共建共享，增加优质公共产品和服务供给，持续提高人民群众获得感、幸福感、安全感。。施小琳在讲话中说，按照四川省委、省政府要求，我们此次前往重庆考察学习交流，贯彻川渝党政联席会议第四次会议精神，着眼融入服务新发展格局、落实碳达峰碳中和目标、激发内生动力、提升群众幸福感获得感、推动战略实施成势见效，进一步在做强“双核”、联动“双圈”、融入“双循环”中落实成都任务。施小琳代表成都市委、市人大常委会、市政府、市政协对重庆长期以来给予的大力支持表示感谢。她说，重庆和成都山水相依、文脉相通、人缘相亲，交往融合历史源远流长。进入新时代，以习近平同志为核心的党中央着眼经略西部腹地、完善区域布局、促进协同发展，作出建设成渝地区双城经济圈的重大战略决策，为成渝地区协同联动、打造带动全国高质量发展的重要增长极和新的动力源擘画了发展蓝图。合力谱写“双城记”、建强都市圈，推动成渝地区双城经济圈建设走深走实，既赋予了成都重大职责使命，也是城市发展的重大战略机遇。。施小琳说，这次重庆之行，是深化党史学习教育的初心感悟之行，是融入和服务国家战略的对接落实之行，是对标先进的学习取经之行。下一步，成都将深入学习贯彻党的十九届六中全会精神，贯彻落实川渝党政联席会议工作部署，把学习考察的成果转化好，把协议确定的事项落实好，持续推进共建国际性综合交通枢纽、世界级先进制造业集群、西部科学城、西部金融中心、现代化国际都市取得新成果，为成渝地区双城经济圈建设作出积极贡献。。周五中午的成都东客站，一支40余人的队伍带着使命与期许，踏上了开往重庆的列车，这是由成都市委书记带队赴重庆考察学习的成都党政代表团。。龙门阵的主题，依旧是合作。有眼下的，有未来的。而这样的龙门阵，未来只会越来越多。（记者 王垚）,政府领导到其他城市考察学习或访问,0.0,True
