code,province,city,topic,date,url,content,content.1,label,score,is_match
273,陕西省,安康市,赴四川重庆五市县考察报告,2016-07-03,https://www.ankang.gov.cn/Content-1537029.html,按照市委、市政府统一安排，市政府副市长鲁琦、市政协副主席孟平率第二考察组，先后赴四川省巴中市、达州市，重庆市万州区、开县、奉节县5市县(区)，围绕扩大投资、促进消费、招商引资、产业发展等方面工作进行了考察学习，现报告如下：。本次考察学习所闻所见让我们眼界大开、心情激奋，无论是他们思想解放的程度、锐意进取的精神，还是他们竞相发展的状态、拼搏实干的作风，都使我们陪受鼓舞和感动。 对此，我们总结为“四个在变”。。一是城市形象在变。比如巴中市，在“十一五”末期还被人戏称为“市级镇”，2012年国家秦巴山片区扶贫规划出台，确立巴中为秦巴山片区三大中心城市之一后，他们迅速启动了大手笔的规划建设，短短5年时间，就基本形成了“一城三区三副五廊”的城市格局，成为川东北地区一座环境优美、产业发展、宜居宜业的魅力新城。。二是思想观念在变。思想决定出路，观念决定方向，多想一小步，前进一大步，思路有多远就能走多远，我们造访的这些市县，他们不但能够始终坚守思想、抓住机遇，更能够及时更新观念、创造机遇。。三是自身定位在变。中小城市是新型城镇化的主要战场，在开放发展的大背景下，只有找准自身的定位，才能充分发挥优势、扬长避短，融入城市群中借力发展。进入“十三五”，周边市县对于未来城市发展定位都有一些调整变化。巴中市自身定位是，西部绿色经济示范区、全国扶贫开发示范区、川陕渝重要的商贸物流中心和交通枢纽联结地、四川重要的北向东向开放高地、川东北重要中心城市。达州市自身定位是，川渝鄂陕结合部区域中心，以发展天然气能源和现代服务业为主的宜业宜居生态城市。万州区自身定位是，西三角经济区面向东部沿海地区的城市门户，成渝城镇群及三峡库区重要交通枢纽，“万开云”城镇群核心功能区。开县自身定位是，长江经济带重要节点，千亿工业基地，百亿农业园区，百亿商圈城市。奉节县自身定位是，渝东北生态涵养发展区，仅次于万州的次区域性中心城市，长江经济带上的生态旅游型区域中心城市。从这些发展定位上来看，他们既牢牢把握住了自身的比较优势，又有比较明确的方向和目标，把自己放在一个片区乃至全省、全国发展的大格局中，寻求最佳的方位和坐标，充分体现了开放发展的战略眼光。。四是发展路径在变。经济发展进入新常态，在保持经济平稳发展的同时，更要突出发展质量，为此中央提出了“五大发展理念”，其实就是发展路径选择的问题。这次考察5个市县，我们深切地感受到，他们不但“醒得早”而且还“跑得快”。比如巴中市，他们将目前发展阶段定性在“传统农业的转型期、工业化的初始期、城镇化的起步期、扶贫开发的攻坚期、后发地区加快发展的追赶期”，因势利导地走出了很多产业融合的新路子。比如奉节县，有着得天独厚的旅游资源，白帝城、瞿塘峡、八阵图、天坑地缝等各种自然和人文景观众多，是长江三峡旅游线上的一颗明珠。他们的特色农林产业也有很好的基础，目前拥有脐橙种植面积30多万亩，产量20多万吨，凭借响亮的旅游品牌和丰富的脐橙资源，他们另辟蹊径，主动与“阿里巴巴”达成战略合作，抢占“农村淘宝”先机，已建成120多个村级“淘宝网店”，不但实现了“农产品上线”而且实现了“网货下乡”，农民不出村就能卖出脐橙、买进商品，曾经创下单日交易额1200万元的纪录。同时有力带动区域仓储、物流、快递业发展，成为了一三产业融合的典型成功案例。。考察学习期间，我们一直为周边市县短时期、大幅度的变化而感到惊叹，但一路上的直观感受告诉我们，在这些巨大变化的背后，有很多本质的、宝贵的东西一直在传承、一直没有变。对此，我们总结为“四个没变”。,6月4日，市委政研室支部组织全体党员到所包抓的新农村示范村——平利县城关镇金华村支部，共同过了一次富有成效的组织生活。大家首先深入到该村产业园，实地考察学习他们在发展绞股蓝、茶叶、山药等产业及土地流转的好做法和成功经验，随后又与村上党员进行了座谈，每个党员争相发言，相互交流工作、生活情况，探讨党员在产业及新农村建设中应如何发挥模范带头作用，并对村上当前重点工作及下一步的发展问题进行了督促指导。接着，又顶着烈日赴城关镇龙头村农耕文化园，学习考察旅游村建设情况，逐一对10户精品农家乐进行参观了解，与业主座谈，指出了他们在发展建设中需进一步完善和改进的关键环节和措施，为该村做大做强旅游产业出谋划策。通过实地参观考察，使全体党员深受教育，纷纷表示，要立足岗位，多出成果，多做贡献。,政府领导到其他城市考察学习或访问,0.0,True
273,陕西省,安康市,我市代表团赴温州宁波两地考察招商和旅游推介,2010-09-17,https://www.ankang.gov.cn/Content-33542.html,继对上海杰隆生物工程股份有限公司和台湾润泰集团考察学习后，9月8日至9月9日，市长方玮峰率市发改委、市旅游局、市招商局等部分代表团成员赴浙江省部分地市进行拜访活动。这是我市借助上海世博会的平台加大招商引资和旅游推介的又一次重大活动。 两天来，方玮峰一行分别考察了位于温州的中国正泰集团、中国人民电器、山东博泰公司以及宁波的雅戈尔集团。同时对两地的城市规划和构建理念进行了详细了解。 中国人民电器集团和中国正泰集团股份有限公司都是依靠科技手段，以工业电器为核心产业的全国知名企业。走访时，方玮峰一行详细了解目前两家企业的运营情况和产业涉及范围，并深入制造车间，实地查看终端电器生产流水线，当看到生产流水线需要大量的技术员工来支撑时。方玮峰表示，如果能将这样的流水成产线引进安康，将解决我市大量的劳动力就业问题，从根本上推进城镇一体化的进程。 进入全国500强企业的雅戈尔集团创建于1979年，经过20多年的发展，目前已经形成了以纺织、服装、房地产、国际贸易为主体的多元并进，专业化发展的经营格局。方玮峰一行在考察中了解了集团发展的历程和目前运营情况，参观了集团服装产品品牌展示厅。当得知雅戈尔不断用高新技术和先进设备提升产业基础，完善产品品质时。方玮峰表示，如果能引进雅戈尔集团到安康投资发展，这种知名企业的品牌效益必将聚集大量的中小型企业，帮助安康加速发展。 在温州城市规划展览馆和宁波城市规划展览馆以及天一商业广场，方玮峰一行详细了解当地的城市规划现状和规划理念。他认为温州“双中心多组合”的城市格局和 宁波“东扩、北联、南统筹、中提升”的区域发展战略值得我市借鉴学习，尤其是宁波市“联镇带村”的规划方式不但提升了城市功能，而且成片连线的格局也推进了新农村建设。为此，他对随行人员指出，目前安康正在拉大城市骨架，今后的城建规划中一定要科学布局，合理安排，充分发挥城市功能。 在和企业的座谈交流时，方玮峰分别从我市的基本市情、区位优势、特色资源和发展前景等方面向企业家们进行了宣传推介。他希望双方可以在能源开发、产业转移、城市建设等方面加强联系，建立合作关系。安康将一定会提供良好的投资环境欢迎企业家们来我市投资兴业。同时，方玮峰指出，我市在招商引资的过程中可以将加工业作为重点，引进知名企业，逐渐将我市建设成为外地企业的产业转移基地。 据了解，下一步，方玮峰一行还将对杭州等沿海发达城市进行学习考察。,石泉县把强化新一届村干部培训作为学习贯彻十七届三中全会精神的关键环节，斥资10万元对村干部进行培训，首批组织一村一品示范村党支部书记35人由县委组织部副部长陈小平带队，于 11月11日至13日赴关中地区进行实地培训学习。。考察学习团先后参观学习了杨凌示范区的新天地设施农业、本香集团产业化养猪模式和农博园，礼泉县的白村“果畜沼”生态农业模式和党建经济互容模式、袁家村特色农家乐和古街旅游经济，旬邑县的特色旅游和基层党建工作和宝鸡金台区的东岭村村企合一发展模式和胜利村新农村建设。。为期3天的实地培训开阔了村干部的眼界，找到了差距，启迪了思维，得出了三点启示。首先，经济发展是各项工作的重中之重，突出一个“实”字。所到之处，有一个共同点就是始终咬住经济发展不动摇，在发展模式、发展举措、发展目标上都是一步一个脚印、实实在在地推进。杨凌本香集团坚持人本化管理理念，依托西北农林科技大学科研优势和人才优势，用10年时间，从一个小型养猪场发展到集养殖、屠宰、加工、销售、科研为一体的链条式发展之路。宝鸡金台区东岭村在改革开放大潮中始终坚持村企合一的发展模式，从一个小铁皮铺店开始，历时20余年打造了东岭集团，做到了“党的建设为企业发展保驾护航、企业发展为党的建设提供物质支撑”，带领群众走上了富裕之路。其次，村党支部书记是带领群众致富的“火车头”，突出一个“带”字。白村、袁家村，东岭村，他们的超速度发展都和这些村的村党支部书记的带头致富、带领群众致富是分不开的。白村党支部书记李朝鲜在改革开放的大浪潮中先在当地做小生意，然后进入城市独自创业，经过多年的摸爬滚打，先后创办了礼泉县昭陵饭店，咸阳市好望角大酒店、新好望角大酒店和花园酒店，成为咸阳市餐饮业的老大哥。然而，他并未就此满足，凭着对餐饮旅游业的谙熟和过人的市场胆略，力创名牌，借帆出海，一头扎进农村，以生他养他的白村为基地，带领乡亲摸索出极具特色的白村新农村经济发展模式，把一个贫困的白村建成了三秦大地上闻名遐迩的富裕村。宝鸡金台区东岭村党委书记李黑记从不足万元资产的黑白铁皮加工作坊起家，经历了20年不寻常的风雨历程，在家乡建起了称雄西部12省的大型股份制企业。连续4年挤身于“中国企业500强”，总资产已达80亿。2007年销售收入、利税分别达138亿、8.9亿，全村群众人人有股份，人均纯收入达到4.2万元，在全国63万个村排名第七。第三，文化历史沉淀是经济社会持续发展的内在动力，突出一个“融”字。文化是经济社会发展的灵魂，文化历史沉淀是经济社会发展的持续动力。东岭集团和本香集团中西结合的企业文化和礼泉县袁家村古今一体的关中乡土文化深深的应证了这句话的内涵。袁家村是关中的一个60多户200多人的小村，。在改革开放的初期，大力发展集体经济和村办工业，当时在全国都晓有名气。1993年，袁家村成立了农工贸为一体的集团型企业袁家农工商联合总公司，下辖12个子公司。近年来，该村斥巨资打造袁家村关中印象体验地，建成文化古街，发展特色农家乐，建立了袁家村史馆，成了陕西有名的风土文化旅游目的地。经过数十年的积累，袁家村固定资产从最初的5700元增加到现在的5亿多元。。参加培训的村干部纷纷表示，将以这次实地学习培训为动力，借鉴外地的好做法、好经验，立足我县农村实际，以更加有效的措施，带领村民早日过上富裕生活。,政府领导到其他城市考察学习或访问,0.0,True
273,陕西省,安康市,市国土资源局机关支部主题党日活动走进梁家河,2018-08-18,https://www.ankang.gov.cn/Content-149996.html,8月10日至11日，安康市国土资源局机关支部组织党员干部赴延安市梁家河村学习考察，举办“追寻领袖初心、奋力追赶超越”主题党日活动。 在延安市梁家河村，大家怀着崇敬的心情，先后参观了知青井、村史馆、沼气池、铁业社和知青旧居等旧址，现场重温了入党誓词，现场感受习近平总书记在梁家河七年的知青岁月，实地探寻梁家河蕴含的大学问，灵魂受到了洗礼，思想得到了升华。 在主题党日座谈中，党员干部首先集体学习了习近平总书记重要讲话和市委、市政府有关文件精神，通报了2017年综合目标责任、脱贫攻坚成效考核、市局上半年重点工作和机关支部上半年工作情况，对下一步重点任务进行了再安排、再强调。党员干部围绕学习梁家河精神、践行12666国土行动计划、保资源保发展保运转、守规矩改作风树形象进行了交流发言，畅谈心得体会，互相帮助制定落实工作措施。 通过学习考察，大家纷纷表示，梁家河不是一条河，是一个村，是中国社会发展进步的一个缩影，梁家河更像一条河，涵育了习近平总书记矢志不渝的信念、真挚为民的情怀、务实担当的品格、带头实干的作风，流淌着博大的家国情怀和浓浓的泥土芬芳，激荡着与民相守、带民致富、共奔小康、同建家园的磅礴力量。 此次学习考察，对党员干部思想政治是一次升华、对落实工作是一次推进，对打造国土铁军是一次锤炼，大家在实地学习中传承了延安精神、厚植了红色基因，大家将不忘初心、牢记使命，在“追寻领袖初心、奋力追赶超越”的主战场上建功立业、争创一流。,宁陕县认真贯彻落实中省市组织工作会议精神，持续推进新时代高素质公务员队伍建设，不断完善公务员选拔、培养、监督机制，切实提升公务员队伍综合素质和履职能力。。严把干部入口关，注重选好苗用对人。紧扣社会发展需求，聚焦全县重点工作，摸清人才缺口类型，找准干部队伍结构短板，充分听取用人单位意见，突出服务基层选人导向，科学制定公务员招录计划，严格公务员考录程序。全县2023年新招录公务员63人，2024年计划招录公务员90人，为公务员队伍注入新鲜血液，进一步优化干部队伍结构，激发干事创业动能。。严格干部培养关，聚焦搭好台铺好路。开展新录用公务员初任培训、新任科级领导培训、中青班培训，组织学习陕西干部网络学院课程，利用江口烈士陵园、寨沟党性教育基地红色教育资源，结合“三会一课”、主题党日活动，抓住“千名干部东部行”外出学习考察培训契机，实现线上线下同步学、理论实践一起学、先进经验走着学。2023年实现新录用公务员初任培训和陕西干部网络学院学习全覆盖、全县新任科级干部、中青班培训16批次，“千名干部东部行”外出学习考察正持续进行中。。严守干部监督关，确保知底线守规矩。坚持正向激励，突出导向作用，树牢重实干、重成效、重基层导向，确保年度考核、职级晋升、提拔任用向在乡村振兴、信访维稳、项目建设等方面表现突出的公务员倾斜，落实干部“三评两考”日常考核实施办法、落实干部约谈制度，加强干部考核监督，严格执纪问责，对庸政、懒政、怠政要动真碰硬整治，用钉钉子精神，推动干部作风持续优化。2023年度全县提拔使用科级干部40人，晋升职级124人，对部分违法违纪或者无法胜任岗位干部作出免职或调整岗位处理，推动形成了能者上、优者奖、庸者下、劣者汰的良好干部监督管理机制。,其他,0.5998432386226966,True
273,陕西省,安康市,市科技局带队赴咸阳市考察秦创原建设及省级高新区创建工作,2023-03-15,https://www.ankang.gov.cn/Content-2529665.html,近日，市科技局党组书记吴世珍带领紫阳县考察团赴咸阳市考察学习秦创原建设及省级高新区创建工作。咸阳市委科技工委书记、市科技局局长杨冲锋，咸阳市科技局副局长张军营，兴平市委副书记、市长马鸿，市委常委、常务副市长武剑，市政府党组成员白选周，武功县委副书记、县长姚俊峰，县委常委、常务副县长孙波陪同考察。 考察团一行先后深入武功高新区电商直播基地、隆翔停车设备有限公司、美农网络科技有限公司、三元科技产业园、东方环保产业集团及兴平高新区的陕西奉航科技有限公司、陕西瑞森金属复合材料有限公司、兴平市双创孵化基地，详细了解秦创原建设及武功、兴平高新区的战略规划、产业布局、企业研发及创新平台建设等情况。 在随后召开的座谈会上，咸阳市科技局领导分别就秦创原建设和省级高新区创建工作有关情况作了经验介绍和分享。兴平市领导详细介绍了省级高新区创建的组织架构、机制保障、规划编制及申报流程。双方还就省级高新区体制机制、创建流程、土地规划、环境评价等进行了深入交流，双方表示将以此次考察为契机，进一步加强合作，互通信息，取长补短，共同促进两市科技事业发展。 通过此次考察学习，进一步明确了我市秦创原建设及省级高新区创建工作思路，考察团成员纷纷表示将认真学习借鉴兄弟地市的先进经验，创新工作举措，健全工作体系，全面建好用好秦创原创新驱动平台，积极配合省级高新区创建工作，加速科技成果转化，为在中国式现代化道路上聚力建设幸福安康提供科技支撑。,近日，市富硒产品研发中心副主任唐德剑带领我市元辰集团公司、石泉博硒公司等企业赴中国农业科学院相关研究所对接富硒鲜食玉米种植加工、富硒大米深加工、富硒杂粮精深加工、富硒果酒生产、魔芋病害防治及精深加工、富硒有机猪肉生产等科研技术取得了丰硕成果，有力的推进了我市与中国农业科学院院地务实合作，进一步强化了我市富硒产品加工企业的科技支撑。 唐德剑带领企业负责人先后深入中国农科院农产品加工研究所、植物保护研究所、农业信息研究所、作物科学研究所等研究所考察学习，与国内行业顶尖专家面对面座谈请教，专家现场为我市企业富硒产品研发答疑解惑。中国农科院农产品加工研究所专家为我市企业现场展示了鲜食玉米、玉米汁、米粉、马铃薯馒头等研发产品以及富硒基础研究、富硒功能食品研究成果；植物保护研究所专家带领我市企业参观了该所国家级重点实验室，介绍了在我市魔芋软腐病采样病检情况，并初步提出了魔芋软腐病综合防治方案；农业信息研究所为我市企业现场展示了“科学数字共享”、“数字果园”、“园区三维展示系统”等农业信息研发成果，探讨对接下一步合作点；作物科学研究所专家带领我市企业参观了该所国家级重点实验室以及国家种子资源库，同时，作物科学研究所专家还抽出一天时间，带领我市企业考察学习了河北德力食品有限公司（全国最大种植及鲜食玉米加工、速冻果蔬加工企业）以及黄金佳投资集团有限公司（全国品质最优、包装最精的种植及鲜食玉米加工企业）。,其他,0.5480173451088705,True
273,陕西省,安康市,我市到河南光山调研考察脱贫攻坚工作,2016-11-24,https://www.ankang.gov.cn/Content-101149.html,11月21日，市长徐启方、副市长何邦军、市政协副主席马晓旬带领有关部门、县区和中办挂职宁陕、药大挂职镇坪的干部来到河南省信阳市光山县学习考察脱贫攻坚工作。信阳市市长尚朝阳、市委副书记刘国栋、副市长郑志强一同调研。。赵一德：突出产业就业 强化兜底保障 扎实推进巩固拓展脱贫攻坚成果同乡村振兴有效衔接。赵一德在安康市汉阴县调研时强调 突出产业就业 强化兜底保障 扎实推进巩固拓展脱贫…,3月31日，省直机关“陕南移民搬迁工程工地行”学习考察分团一行36人在省直机关工委副书记张小文团长带领下来我市开展“三问三解”活动。。在副市长邹顺生的陪同下，张小文一行先后来到石泉县城关镇杨柳集中安置小区、紫阳县蒿坪镇双星村、汉滨区七堰集中安置小区建设现场，实地查看了新村建设进度、扶贫重点村建设、移民搬迁安置等情况，听取我市移民搬迁安置工作进展情况和经验介绍。考察团成员还走进搬迁户家中认真查看房屋设计，详细询问搬迁安置政策落实情况和安置后生产生活等情况。。在汉滨区七堰集中安置小区，考察团与市、县区领导和搬迁户代表进行了座谈，听取了安康市移民搬迁安置建设总体情况和七堰集中安置小区建设情况介绍，考察团一致认为安康按照赵省长提出的“搬得出、稳得住、能致富”要求，把移民安置点与农民进城和小城镇新农村园区化建设结合起来，兼顾基础设施、产业发展和社会保障，移民搬迁工作思路新、规模大、标准高、进度快、工作实、方法活、成效显，实现了“搬一批农户，建一批社区，兴一项产业、富一方群众”的目标，通过这次学习考察，让省直机关干部走出机关，看到了安康落实科学发展观的新成效，感受到了秦巴汉水翻天覆地的变化，感受到了党的惠民、富民政策在基层中取得的丰硕成果，切身体验了群众生产生活的新变化和群众建设者攻坚克难的精神状态，进一步增强了机关干部为民服务创先争优的责任感和使命感，深化了省直机关“看变化、访民情、帮民富”活动。,政府领导到其他城市考察学习或访问,0.0,True
