code,province,city,topic,date,url,content,content.1,label,score,is_match
8,河北省,保定市,闫继红带队赴上海学习考察,,https://www.baoding.gov.cn/content-173-396916.html,4月23日至24日，市长闫继红带队赴上海学习考察，参观第二十届上海国际汽车工业展览会长城汽车展位，学习上海城市运行管理等工作。她强调，要支持企业高质量发展，加强城市智慧化管理，加快打造软硬实力相得益彰的现代化品质生活之城。。在第二十届上海国际汽车工业展览会上，长城汽车携哈弗、魏牌、欧拉、坦克、长城炮5大品牌近30款产品重磅亮相，多款力作全球首秀，国内首个6×6超级越野平台、越野超级混动架构等技术引发关注热潮。闫继红参观长城汽车展区，与工作人员现场交流，察看新品设计、了解技术创新、询问销售情况，勉励企业抓住当前汽车产业电动化、智能化加速转轨机遇，适应新消费需求，持续加大创新投入，提高研发强度和开发效率，打造具有鲜明标识度和技术领先度的爆款产品，不断提升企业核心竞争力。在上海燃料电池汽车动力系统有限公司、长城汽车上海研究院，闫继红听取产业发展、技术攻关、成果应用等情况汇报，对长城汽车在战略布局、技术储备、科研创新等方面工作给予肯定。她指出，要创新人才培养模式，做好员工技能培训和职业规划，为企业高质量发展打下坚实的人才基础。要强化品牌运营，坚持以客户为中心，采取媒体宣传、参加会展、网络直播等多种形式，加大品牌宣传推介力度，让更多消费者了解企业新产品、新技术、新理念，全面提升品牌影响力和美誉度。。超级越野平台、越野超级混动架构等技术引发关注热潮。闫继红参观长城汽车展区，与工作人员现场交流，察看新品设计、了解技术创新、询问销售情况，勉励企业抓住当前汽车产业电动化、智能化加速转轨机遇，适应新消费需求，持续加大创新投入，提高研发强度和开发效率，打造具有鲜明标识度和技术领先度的爆款产品，不断提升企业核心竞争力。在上海燃料电池汽车动力系统有限公司、长城汽车上海研究院，闫继红听取产业发展、技术攻关、成果应用等情况汇报，对长城汽车在战略布局、技术储备、科研创新等方面工作给予肯定。她指出，要创新人才培养模式，做好员工技能培训和职业规划，为企业高质量发展打下坚实的人才基础。要强化品牌运营，坚持以客户为中心，采取媒体宣传、参加会展、网络直播等多种形式，加大品牌宣传推介力度，让更多消费者了解企业新产品、新技术、新理念，全面提升品牌影响力和美誉度。。上海市城市运行管理服务平台综合利用物联网、大数据分析等技术手段，有效整合治理资源，推动城市治理向智慧化、精细化迈进。闫继红参观服务平台，观看工作人员现场演示，详细了解平台数据模型、功能模块、场景应用、运营维护等情况。她指出，要认真学习借鉴上海在城市数字化治理方面的先进理念和管理经验，做强数据采集、数据交换和应用维护三个支撑，汇聚全市城市运行管理服务数据资源，加快建设我市城市运行管理服务平台。要持续优化完善。城市运行和管理体制机制，实现一屏观全域、一网管全城，系统提升城市智慧化、精细化管理水平。要聚焦城市治理难点痛点，不断丰富拓展城市数字治理应用场景，通过对多维城市运行生命体征的感知分析，及时发现和快速处置城市运行管理问题，推进数据和业务深度融合，为人民群众提供便捷高效的公共服务，加快建设高品质、有韧性的现代化新保定。,4月23日至24日，市长闫继红带队赴上海学习考察，参观第二十届上海国际汽车工业展览会长城汽车展位，学习上海城市运行管理等工作。她强调，要支持企业高质量发展，加强城市智慧化管理，加快打造软硬实力相得益彰的现代化品质生活之城。。在第二十届上海国际汽车工业展览会上，长城汽车携哈弗、魏牌、欧拉、坦克、长城炮5大品牌近30款产品重磅亮相，多款力作全球首秀，国内首个6×6超级越野平台、越野超级混动架构等技术引发关注热潮。闫继红参观长城汽车展区，与工作人员现场交流，察看新品设计、了解技术创新、询问销售情况，勉励企业抓住当前汽车产业电动化、智能化加速转轨机遇，适应新消费需求，持续加大创新投入，提高研发强度和开发效率，打造具有鲜明标识度和技术领先度的爆款产品，不断提升企业核心竞争力。在上海燃料电池汽车动力系统有限公司、长城汽车上海研究院，闫继红听取产业发展、技术攻关、成果应用等情况汇报，对长城汽车在战略布局、技术储备、科研创新等方面工作给予肯定。她指出，要创新人才培养模式，做好员工技能培训和职业规划，为企业高质量发展打下坚实的人才基础。要强化品牌运营，坚持以客户为中心，采取媒体宣传、参加会展、网络直播等多种形式，加大品牌宣传推介力度，让更多消费者了解企业新产品、新技术、新理念，全面提升品牌影响力和美誉度。。超级越野平台、越野超级混动架构等技术引发关注热潮。闫继红参观长城汽车展区，与工作人员现场交流，察看新品设计、了解技术创新、询问销售情况，勉励企业抓住当前汽车产业电动化、智能化加速转轨机遇，适应新消费需求，持续加大创新投入，提高研发强度和开发效率，打造具有鲜明标识度和技术领先度的爆款产品，不断提升企业核心竞争力。在上海燃料电池汽车动力系统有限公司、长城汽车上海研究院，闫继红听取产业发展、技术攻关、成果应用等情况汇报，对长城汽车在战略布局、技术储备、科研创新等方面工作给予肯定。她指出，要创新人才培养模式，做好员工技能培训和职业规划，为企业高质量发展打下坚实的人才基础。要强化品牌运营，坚持以客户为中心，采取媒体宣传、参加会展、网络直播等多种形式，加大品牌宣传推介力度，让更多消费者了解企业新产品、新技术、新理念，全面提升品牌影响力和美誉度。。上海市城市运行管理服务平台综合利用物联网、大数据分析等技术手段，有效整合治理资源，推动城市治理向智慧化、精细化迈进。闫继红参观服务平台，观看工作人员现场演示，详细了解平台数据模型、功能模块、场景应用、运营维护等情况。她指出，要认真学习借鉴上海在城市数字化治理方面的先进理念和管理经验，做强数据采集、数据交换和应用维护三个支撑，汇聚全市城市运行管理服务数据资源，加快建设我市城市运行管理服务平台。要持续优化完善。城市运行和管理体制机制，实现一屏观全域、一网管全城，系统提升城市智慧化、精细化管理水平。要聚焦城市治理难点痛点，不断丰富拓展城市数字治理应用场景，通过对多维城市运行生命体征的感知分析，及时发现和快速处置城市运行管理问题，推进数据和业务深度融合，为人民群众提供便捷高效的公共服务，加快建设高品质、有韧性的现代化新保定。,政府领导到其他城市考察学习或访问,0.0,True
8,河北省,保定市,闫继红带队赴深圳东莞考察学习,,https://www.baoding.gov.cn/content-173-395340.html,3月23日至25日，市长闫继红带队赴深圳市、东莞市考察学习，对标先进、招商引资，深化合作、真抓实干，巩固拓展市委书记党晓龙2月份带领我市党政代表团赴广东考察学习招商推介成果，以前瞻性视野和创新性思维，加快打造新场景，奋力开辟新赛道，不断开创保定高质量发展新局面。。月份带领我市党政代表团赴广东考察学习招商推介成果，以前瞻性视野和创新性思维，加快打造新场景，奋力开辟新赛道，不断开创保定高质量发展新局面。。在粤期间，闫继红与深圳市国资委、深圳市投资控股有限公司、深圳能源集团、深圳市燃气集团、深圳市智慧城市科技发展集团、中国广核集团、华侨城集团等深入对接交流，对长期以来给予保定的关心支持表示感谢，希望进一步巩固合作成果，拓展合作领域，深耕保定、共赢发展。围绕我市电力及新能源高端装备、汽车及零部件、新一代信息技术、生命健康、新材料等优势产业，聚焦产业链精准招商，闫继红走访了中泰模具、天域半导体、松山湖半导体检测分析实验室、荣耀终端、英伦科技、华迈兴微医疗科技等科技创新型企业，进一步沟通解决合作中存在问题，加快推进项目落地。大家对保定加快构建京雄保一体化发展新格局给予高度赞扬，纷纷表示保定区位优势明显、发展潜力巨大，产业体系完备、营商环境优越，将进一步投资保定，助力保定加快高质量发展。。24日，第七届中国国际食品及配料博览会暨首届中国国际预制菜产业博览会在东莞开幕。保定是河北省唯一设独立展区的地级市，充分展示了“粤品北上、冀品南下”成果。目前，正在加快建设广东预制菜京津冀一条街、一个前置仓、一个原材料集采地、一个产业园、一个高质量发展预制菜产业，打造高碑店中国预制菜“新义乌”。会上，原农业部党组成员、中国农产品市场协会会长张玉香为我市“京津冀（保定）预制菜贸易促进创新发展示范基地”授牌，闫继红代表我市接牌。期间，我市还举办了预制菜专场推介会，保定市中央厨房预制菜产业联盟(联合会)与青田中智物产贸易有限公司、广东海润发展集团有限公司签约。。成果。目前，正在加快建设广东预制菜京津冀一条街、一个前置仓、一个原材料集采地、一个产业园、一个高质量发展预制菜产业，打造高碑店中国预制菜。授牌，闫继红代表我市接牌。期间，我市还举办了预制菜专场推介会，保定市中央厨房预制菜产业联盟。24日晚，闫继红组织召开保定市赴广东跟班学习年轻干部代表座谈会，听取学习情况汇报，勉励他们珍惜学习机会，更新思想理念，提升能力素养，大力弘扬“激情实干、好学创造、务实担当”的新时代保定干部精神，在奋力推动保定高质量发展中加快成长、扛起担当。,3月23日至25日，市长闫继红带队赴深圳市、东莞市考察学习，对标先进、招商引资，深化合作、真抓实干，巩固拓展市委书记党晓龙2月份带领我市党政代表团赴广东考察学习招商推介成果，以前瞻性视野和创新性思维，加快打造新场景，奋力开辟新赛道，不断开创保定高质量发展新局面。。月份带领我市党政代表团赴广东考察学习招商推介成果，以前瞻性视野和创新性思维，加快打造新场景，奋力开辟新赛道，不断开创保定高质量发展新局面。。在粤期间，闫继红与深圳市国资委、深圳市投资控股有限公司、深圳能源集团、深圳市燃气集团、深圳市智慧城市科技发展集团、中国广核集团、华侨城集团等深入对接交流，对长期以来给予保定的关心支持表示感谢，希望进一步巩固合作成果，拓展合作领域，深耕保定、共赢发展。围绕我市电力及新能源高端装备、汽车及零部件、新一代信息技术、生命健康、新材料等优势产业，聚焦产业链精准招商，闫继红走访了中泰模具、天域半导体、松山湖半导体检测分析实验室、荣耀终端、英伦科技、华迈兴微医疗科技等科技创新型企业，进一步沟通解决合作中存在问题，加快推进项目落地。大家对保定加快构建京雄保一体化发展新格局给予高度赞扬，纷纷表示保定区位优势明显、发展潜力巨大，产业体系完备、营商环境优越，将进一步投资保定，助力保定加快高质量发展。。24日，第七届中国国际食品及配料博览会暨首届中国国际预制菜产业博览会在东莞开幕。保定是河北省唯一设独立展区的地级市，充分展示了“粤品北上、冀品南下”成果。目前，正在加快建设广东预制菜京津冀一条街、一个前置仓、一个原材料集采地、一个产业园、一个高质量发展预制菜产业，打造高碑店中国预制菜“新义乌”。会上，原农业部党组成员、中国农产品市场协会会长张玉香为我市“京津冀（保定）预制菜贸易促进创新发展示范基地”授牌，闫继红代表我市接牌。期间，我市还举办了预制菜专场推介会，保定市中央厨房预制菜产业联盟(联合会)与青田中智物产贸易有限公司、广东海润发展集团有限公司签约。。成果。目前，正在加快建设广东预制菜京津冀一条街、一个前置仓、一个原材料集采地、一个产业园、一个高质量发展预制菜产业，打造高碑店中国预制菜。授牌，闫继红代表我市接牌。期间，我市还举办了预制菜专场推介会，保定市中央厨房预制菜产业联盟。24日晚，闫继红组织召开保定市赴广东跟班学习年轻干部代表座谈会，听取学习情况汇报，勉励他们珍惜学习机会，更新思想理念，提升能力素养，大力弘扬“激情实干、好学创造、务实担当”的新时代保定干部精神，在奋力推动保定高质量发展中加快成长、扛起担当。,政府领导到其他城市考察学习或访问,0.8996041875531405,True
8,河北省,保定市,我省党政代表团到天津市学习考察,,https://www.baoding.gov.cn/content-173-395195.html,日，我省党政代表团在天津市滨海新区“美丽滨城”会客厅学习考察。 河北日报记者 赵海江 摄。日，我省党政代表团到天津市学习考察，深入贯彻习近平总书记重要指示精神和党中央决策部署，全面落实党的二十大和全国两会精神，学习借鉴天津经验，深化冀津交流合作，推动京津冀协同发展向更高层次迈进。。天津市委书记陈敏尔，市委副书记、市长张工，市人大常委会主任喻云林，市政协主席王常松；省委书记、省人大常委会主任倪岳峰，省委副书记、省长王正谱，省政协主席廉毅敏等参加活动。。“美丽滨城”会客厅，认真学习天津市在新区规划建设、港产城融合、科技研发、先进制造等方面经验。在天津港第二集装箱码头，代表团详细听取天津港优化营商环境、建设智慧港口和绿色港口等情况介绍，现场观看集装箱码头自动化作业。国家超级计算天津中心依托先进技术，实现了超级计算、云计算、大数据、人工智能和物联网的深度融合。代表团深入了解天河系列超算创新成果，观看新一代超级计算机展示，学习借鉴天津市在推动超级计算、壮大数字经济等方面的宝贵经验。。在两省市工作交流座谈会上，陈敏尔指出，推动京津冀协同发展是以习近平同志为核心的党中央作出的重大决策部署。我们要深入领会、全面贯彻习近平总书记重要讲话和重要指示批示精神，把党的二十大精神行动化、具体化、实践化，推动京津冀协同发展走深走实，全力支持服务雄安新区建设，以签署战略合作协议为契机，推动津冀合作取得更大成效。共下港口集群。“一盘棋”，加强津冀港口高效协作，优化资源配置，完善功能分工，以港口带物流、以物流带经贸、以经贸带产业，实现错位发展、联动发展、融合发展，共同构建现代化的津冀港口群。共抓产业协作“一条链”，共同承接北京非首都功能疏解，加强科技创新协同，推动重点产业建链强链、重点企业成龙配套、重点园区深化合作，促进产业集群发展。共建基础设施“一张网”，畅通轨道交通网、公路交通网、信息通信网，强化运营组织和管理调度协同，增强区域运输服务能力。共筑生态环境“一道屏”，持续开展大气、水、土壤污染跨界联合治理，培育壮大循环经济、生态产业和节能环保产业，协力扩大生态空间、推动绿色发展，共同建设环首都生态屏障带。共推公共服务“一卡通”，推出更多通办事项，进一步扩大医保、社保、养老等事项互联互通范围，深化商贸文旅合作，不断增强两地企业、人民群众的获得感。。倪岳峰说，京津冀协同发展是习近平总书记亲自谋划、亲自部署、亲自推动的重大国家战略。九年来，从夯基垒台、立柱架梁到加速推进、纵深发展，取得历史性成就、发生历史性变革，充分彰显了习近平总书记高超的政治智慧、深邃的历史眼光、宏阔的战略视野、强烈的使命担当，让我们切身领悟到。“两个确立”的决定性意义。在学习考察中，天津市先进的城市规划建设理念、辐射全球的一流大港、生机勃勃的现代化产业，让河北省党政代表团深感震撼、深受启发。我们要向天津全面学习，进一步解放思想、奋发进取，加快建设经济强省、美丽河北。要认真学习天津全面建设社会主义现代化大都市宝贵经验，扎实推动中国式现代化在河北展现美好图景。认真学习天津港产城融合发展宝贵经验，大力推动港口转型升级，积极推进通关便利化，加快建设临港产业强省，构建向海图强、向海发展新格局。认真学习天津建设现代化产业体系宝贵经验，深入推进创新驱动发展，加快制造业高端化、智能化、绿色化发展，大力推动战略性新兴产业融合集群发展。认真学习天津打造一流营商环境宝贵经验，坚持以深化改革增强动力活力，着力建设高标准市场体系，支持民营经济健康发展、高质量发展。,日，我省党政代表团在天津市滨海新区“美丽滨城”会客厅学习考察。 河北日报记者 赵海江 摄。日，我省党政代表团到天津市学习考察，深入贯彻习近平总书记重要指示精神和党中央决策部署，全面落实党的二十大和全国两会精神，学习借鉴天津经验，深化冀津交流合作，推动京津冀协同发展向更高层次迈进。。天津市委书记陈敏尔，市委副书记、市长张工，市人大常委会主任喻云林，市政协主席王常松；省委书记、省人大常委会主任倪岳峰，省委副书记、省长王正谱，省政协主席廉毅敏等参加活动。。“美丽滨城”会客厅，认真学习天津市在新区规划建设、港产城融合、科技研发、先进制造等方面经验。在天津港第二集装箱码头，代表团详细听取天津港优化营商环境、建设智慧港口和绿色港口等情况介绍，现场观看集装箱码头自动化作业。国家超级计算天津中心依托先进技术，实现了超级计算、云计算、大数据、人工智能和物联网的深度融合。代表团深入了解天河系列超算创新成果，观看新一代超级计算机展示，学习借鉴天津市在推动超级计算、壮大数字经济等方面的宝贵经验。。在两省市工作交流座谈会上，陈敏尔指出，推动京津冀协同发展是以习近平同志为核心的党中央作出的重大决策部署。我们要深入领会、全面贯彻习近平总书记重要讲话和重要指示批示精神，把党的二十大精神行动化、具体化、实践化，推动京津冀协同发展走深走实，全力支持服务雄安新区建设，以签署战略合作协议为契机，推动津冀合作取得更大成效。共下港口集群。“一盘棋”，加强津冀港口高效协作，优化资源配置，完善功能分工，以港口带物流、以物流带经贸、以经贸带产业，实现错位发展、联动发展、融合发展，共同构建现代化的津冀港口群。共抓产业协作“一条链”，共同承接北京非首都功能疏解，加强科技创新协同，推动重点产业建链强链、重点企业成龙配套、重点园区深化合作，促进产业集群发展。共建基础设施“一张网”，畅通轨道交通网、公路交通网、信息通信网，强化运营组织和管理调度协同，增强区域运输服务能力。共筑生态环境“一道屏”，持续开展大气、水、土壤污染跨界联合治理，培育壮大循环经济、生态产业和节能环保产业，协力扩大生态空间、推动绿色发展，共同建设环首都生态屏障带。共推公共服务“一卡通”，推出更多通办事项，进一步扩大医保、社保、养老等事项互联互通范围，深化商贸文旅合作，不断增强两地企业、人民群众的获得感。。倪岳峰说，京津冀协同发展是习近平总书记亲自谋划、亲自部署、亲自推动的重大国家战略。九年来，从夯基垒台、立柱架梁到加速推进、纵深发展，取得历史性成就、发生历史性变革，充分彰显了习近平总书记高超的政治智慧、深邃的历史眼光、宏阔的战略视野、强烈的使命担当，让我们切身领悟到。“两个确立”的决定性意义。在学习考察中，天津市先进的城市规划建设理念、辐射全球的一流大港、生机勃勃的现代化产业，让河北省党政代表团深感震撼、深受启发。我们要向天津全面学习，进一步解放思想、奋发进取，加快建设经济强省、美丽河北。要认真学习天津全面建设社会主义现代化大都市宝贵经验，扎实推动中国式现代化在河北展现美好图景。认真学习天津港产城融合发展宝贵经验，大力推动港口转型升级，积极推进通关便利化，加快建设临港产业强省，构建向海图强、向海发展新格局。认真学习天津建设现代化产业体系宝贵经验，深入推进创新驱动发展，加快制造业高端化、智能化、绿色化发展，大力推动战略性新兴产业融合集群发展。认真学习天津打造一流营商环境宝贵经验，坚持以深化改革增强动力活力，着力建设高标准市场体系，支持民营经济健康发展、高质量发展。,政府领导到其他城市考察学习或访问,0.0,True
