code,province,city,topic,date,url,content,content.1,label,score,is_match
254,云南省,保山市,云南省党政代表团赴上海学习考察,2023-05-12,http://www.yn.gov.cn/ywdt/ynyw/202305/t20230512_258945.html,沪滇对口协作第二十六次联席会议举行 在新征程上打造东西部协作新典范 陈吉宁王宁讲话 龚正王予波董云虎石玉钢出席。5月11日至12日，云南省党政代表团赴上海学习考察，并于11日下午与上海市共同举行上海云南对口协作第二十六次联席会议，贯彻落实习近平总书记关于深化东西部协作的重要指示精神，学习上海先进经验，深化沪滇协作，携手推进现代化建设。。上海市委书记陈吉宁主持联席会议并讲话，云南省委书记王宁出席会议并讲话；上海市市长龚正、云南省省长王予波分别介绍两地经济社会发展和沪滇对口协作情况；上海市人大常委会主任董云虎、云南省委副书记石玉钢出席。。5月11日下午，云南省党政代表团与上海市共同举行上海云南对口协作第二十六次联席会议。。陈吉宁代表市委、市人大常委会、市政府、市政协，感谢云南省长期以来给予上海发展的支持帮助和对援滇干部人才的关心爱护。他说，云南省坚持以习近平新时代中国特色社会主义思想为指导，加速融入新发展格局、奋力推进高质量发展，云南广大干部群众知重负重、苦干实干、求真求新的精气神和形成的好经验、好做法、好作风，值得上海认真学习借鉴。。陈吉宁说，当前，我国已踏上全面建设社会主义现代化国家新征程，共同富裕是共同奋斗的过程，也是东西部协作的目的之一。上海与云南在结对帮扶中结下深厚情谊，随着沪滇结对范围扩大到全省，两地对口协作达到新高度。上海将深入贯彻落实习近平总书记关于深化东西部协作和定点帮扶工作的重要指示精神，坚决按照中央要求，全力扛起政治责任，围绕“上海所能、云南所需”，突出精准和实效，完善对口协作机制，巩固脱贫攻坚成果，加快乡村振兴步伐，与云南干部群众一道，奋力开创更加幸福美好的生活。沪滇协作是两地服务构建新发展格局、服务国家高质量发展的内在需要，要更好深化对接、携手并进，在落实国家战略上紧密互动，在提升产业现代化水平上优势互补，在扩内需促消费上相互赋能，共同把枢纽、平台和通道的文章做足，深化产业链供应链上下游协同，推动产业有序转移，在更大范围内优化资源配置，在新征程上共同谱写沪滇协作新篇章。。王宁代表云南省委、省政府和全省各族人民对上海市长期以来的对口帮扶表示衷心感谢，对奋战在云南艰苦一线的上海援滇干部致以崇高敬意。他说，上海对云南真情帮扶、倾力支持，为云南脱贫攻坚、经济社会发展、民生改善等作出了重要贡献，充分体现了习近平总书记和党中央对云南的亲切关怀，凝聚了上海市委、市政府和上海人民的深情厚谊，为云南脱贫地区加快发展注入了强劲动力，双方协作路子越走越宽、惠民成果越来越多。。王宁表示，新征程上，云南愿与上海携手共进，发挥各自优势、拓展协作空间，打造东西部协作新典范。希望双方在推进乡村振兴上深化协作，加强农产品产销对接，促进上海大市场和云南大基地紧密协作，共同深化文旅融合，推出一批乡村旅游新业态、新产品；在承接产业转移上深化协作，加强园区和口岸协作共建，开展“上海企业家云南行”活动，引导上海企业到云南布局和转移产业；在教育卫生科技发展上深化协作，继续加大对云南“组团式”帮扶力度，帮助培养更多教育卫生人才，促成上海更多科技项目和团队到云南合作。。11日晚，王予波在沪主持举行云南省产业宣传推介座谈会，与上海市有关开发区和企业负责人进行深入交流，介绍云南产业发展和承接产业转移的综合优势，热忱欢迎广大上海企业来滇投资兴业。双方还就具体项目进行沟通对接，签署相关合作协议。。5月11日，云南省党政代表团一行到中山医院考察智慧医院建设最新成果，以及对云南开展医疗帮扶情况。,沪滇对口协作第二十六次联席会议举行 在新征程上打造东西部协作新典范 陈吉宁王宁讲话 龚正王予波董云虎石玉钢出席。5月11日至12日，云南省党政代表团赴上海学习考察，并于11日下午与上海市共同举行上海云南对口协作第二十六次联席会议，贯彻落实习近平总书记关于深化东西部协作的重要指示精神，学习上海先进经验，深化沪滇协作，携手推进现代化建设。。上海市委书记陈吉宁主持联席会议并讲话，云南省委书记王宁出席会议并讲话；上海市市长龚正、云南省省长王予波分别介绍两地经济社会发展和沪滇对口协作情况；上海市人大常委会主任董云虎、云南省委副书记石玉钢出席。。5月11日下午，云南省党政代表团与上海市共同举行上海云南对口协作第二十六次联席会议。。陈吉宁代表市委、市人大常委会、市政府、市政协，感谢云南省长期以来给予上海发展的支持帮助和对援滇干部人才的关心爱护。他说，云南省坚持以习近平新时代中国特色社会主义思想为指导，加速融入新发展格局、奋力推进高质量发展，云南广大干部群众知重负重、苦干实干、求真求新的精气神和形成的好经验、好做法、好作风，值得上海认真学习借鉴。。陈吉宁说，当前，我国已踏上全面建设社会主义现代化国家新征程，共同富裕是共同奋斗的过程，也是东西部协作的目的之一。上海与云南在结对帮扶中结下深厚情谊，随着沪滇结对范围扩大到全省，两地对口协作达到新高度。上海将深入贯彻落实习近平总书记关于深化东西部协作和定点帮扶工作的重要指示精神，坚决按照中央要求，全力扛起政治责任，围绕“上海所能、云南所需”，突出精准和实效，完善对口协作机制，巩固脱贫攻坚成果，加快乡村振兴步伐，与云南干部群众一道，奋力开创更加幸福美好的生活。沪滇协作是两地服务构建新发展格局、服务国家高质量发展的内在需要，要更好深化对接、携手并进，在落实国家战略上紧密互动，在提升产业现代化水平上优势互补，在扩内需促消费上相互赋能，共同把枢纽、平台和通道的文章做足，深化产业链供应链上下游协同，推动产业有序转移，在更大范围内优化资源配置，在新征程上共同谱写沪滇协作新篇章。。王宁代表云南省委、省政府和全省各族人民对上海市长期以来的对口帮扶表示衷心感谢，对奋战在云南艰苦一线的上海援滇干部致以崇高敬意。他说，上海对云南真情帮扶、倾力支持，为云南脱贫攻坚、经济社会发展、民生改善等作出了重要贡献，充分体现了习近平总书记和党中央对云南的亲切关怀，凝聚了上海市委、市政府和上海人民的深情厚谊，为云南脱贫地区加快发展注入了强劲动力，双方协作路子越走越宽、惠民成果越来越多。。王宁表示，新征程上，云南愿与上海携手共进，发挥各自优势、拓展协作空间，打造东西部协作新典范。希望双方在推进乡村振兴上深化协作，加强农产品产销对接，促进上海大市场和云南大基地紧密协作，共同深化文旅融合，推出一批乡村旅游新业态、新产品；在承接产业转移上深化协作，加强园区和口岸协作共建，开展“上海企业家云南行”活动，引导上海企业到云南布局和转移产业；在教育卫生科技发展上深化协作，继续加大对云南“组团式”帮扶力度，帮助培养更多教育卫生人才，促成上海更多科技项目和团队到云南合作。。11日晚，王予波在沪主持举行云南省产业宣传推介座谈会，与上海市有关开发区和企业负责人进行深入交流，介绍云南产业发展和承接产业转移的综合优势，热忱欢迎广大上海企业来滇投资兴业。双方还就具体项目进行沟通对接，签署相关合作协议。。5月11日，云南省党政代表团一行到中山医院考察智慧医院建设最新成果，以及对云南开展医疗帮扶情况。,政府领导到其他城市考察学习或访问,0.0,True
254,云南省,保山市,云南省党政代表团赴上海考察学习学习改革创新经验深化协作共谋发展,2024-05-22,https://www.yn.gov.cn/ywdt/ynyw/202405/t20240522_299757.html,5月21日至22日，云南省党政代表团赴上海市考察学习，共同贯彻落实习近平总书记在新时代推动西部大开发座谈会上的重要讲话精神和关于深化东西部协作的重要指示精神，学习上海改革发展先进经验，对接沪滇协作工作，携手推动两地现代化建设不断取得新成效。。上海市委书记陈吉宁，云南省委书记王宁，省委副书记、省长王予波；上海市人大常委会主任黄莉新、市政协主席胡文容，云南省委副书记石玉钢参加有关活动。。上海市深入贯彻落实习近平总书记考察上海重要讲话精神，聚焦“五个中心”建设，统筹牵引经济社会发展不断取得新成就，充分彰显了我国改革开放前沿阵地和深度链接全球国际大都市的重要地位和作用。我省党政代表团围绕发展新质生产力、科技创新、数字经济、智能制造、城市规划建设、乡村全面振兴等，认真考察学习上海先进经验和做法。。代表团走进上海科技创新成果展，参观基础研究、人工智能、生物医药等领域科技创新成果，学习创新驱动发展新质生产力的思路举措；来到全国首个大模型专业孵化和加速载体上海模速空间创新生态社区，了解上海汇聚尖端科技构建产业生态、打造世界级人工智能产业集群的做法；在美团、携程等消费服务平台企业，观看大数据应用场景，交流拓展在滇业务，探讨推动上海与云南合作打造国际化深度旅游目的地。考察途中，代表团深刻感受到上海城市风貌提升和治理成效，并到上海城市规划展示馆，了解城市规划建设历程，学习上海建设“人民城市”的理念做法。代表团还到上海电气集团和上海振华重工集团，考察企业科技研发、大国重器制造情况，就新能源开发、储能、装备制造等对接合作。超大城市如何推进农业农村现代化，代表团前往崇明区合兴村、由由中荷农业创新园“取经”，与当地基层干部交流农民增收致富办法，走进种植大棚考察高科技设施农业，希望加强种质资源等合作，推进农业高质高效和乡村全面振兴。考察学习中，代表团成员们再次感受到上海勇当全国改革开放排头兵、创新发展先行者的决心魄力和卓著成绩，表示要将学习收获切实转化为具体思路举措，推动本地区本部门工作取得新的进步。。沪滇协作28年，彼此情谊深厚，合作历久弥新。两地同志在交流中表示，要共同贯彻落实好习近平总书记重要指示精神，聚焦更好服务国家发展战略，进一步推动上海技术、管理、资金、人才与云南区位、资源、劳动力等优势融合互补，在产业转移、对外开放、绿色制造、文旅发展等领域取得更多合作成果，在拓展教育、医疗帮扶和劳务协作等民生事业上惠及更多群众，共同谱写新征程上沪滇协作新篇章。。王宁在考察中要求，我省各州（市）各有关部门要认真总结运用学习成果，结合各自实际，主动求变谋变，积极加强与上海工作对接，把沪滇协作抓实在抓具体，取得更多成果成效。要对标先进、借鉴经验，拓宽视野、更新观念，树立更高目标，在中国式现代化云南实践中努力开拓奋进。。22日晚，王予波在沪主持召开云南省与长三角地区知名企业座谈会，与有关企业负责人进行深入交流，介绍云南产业发展优势、优化营商环境等情况，欢迎广大企业来滇投资发展。。上海市领导李仰哲、朱芝松、张为、李政、张小宏、陈宇剑，云南省领导刘洪建、邱江、刘非、杨斌、王浩参加相关活动。云南省各州（市）党委或政府主要负责同志、省直有关部门负责同志参加考察学习。。各省市政府网站 北京 天津 河北 山西 内蒙古 辽宁 吉林 黑龙江 上海 江苏 浙江 安徽 福建 江西 山东 河南 湖北 湖南 广东 广西 海南 重庆 四川 贵州 云南 西藏 陕西 甘肃 青海 宁夏 新疆 香港 澳门 台湾 新疆生产建设兵团,5月21日至22日，云南省党政代表团赴上海市考察学习，共同贯彻落实习近平总书记在新时代推动西部大开发座谈会上的重要讲话精神和关于深化东西部协作的重要指示精神，学习上海改革发展先进经验，对接沪滇协作工作，携手推动两地现代化建设不断取得新成效。。上海市委书记陈吉宁，云南省委书记王宁，省委副书记、省长王予波；上海市人大常委会主任黄莉新、市政协主席胡文容，云南省委副书记石玉钢参加有关活动。。上海市深入贯彻落实习近平总书记考察上海重要讲话精神，聚焦“五个中心”建设，统筹牵引经济社会发展不断取得新成就，充分彰显了我国改革开放前沿阵地和深度链接全球国际大都市的重要地位和作用。我省党政代表团围绕发展新质生产力、科技创新、数字经济、智能制造、城市规划建设、乡村全面振兴等，认真考察学习上海先进经验和做法。。代表团走进上海科技创新成果展，参观基础研究、人工智能、生物医药等领域科技创新成果，学习创新驱动发展新质生产力的思路举措；来到全国首个大模型专业孵化和加速载体上海模速空间创新生态社区，了解上海汇聚尖端科技构建产业生态、打造世界级人工智能产业集群的做法；在美团、携程等消费服务平台企业，观看大数据应用场景，交流拓展在滇业务，探讨推动上海与云南合作打造国际化深度旅游目的地。考察途中，代表团深刻感受到上海城市风貌提升和治理成效，并到上海城市规划展示馆，了解城市规划建设历程，学习上海建设“人民城市”的理念做法。代表团还到上海电气集团和上海振华重工集团，考察企业科技研发、大国重器制造情况，就新能源开发、储能、装备制造等对接合作。超大城市如何推进农业农村现代化，代表团前往崇明区合兴村、由由中荷农业创新园“取经”，与当地基层干部交流农民增收致富办法，走进种植大棚考察高科技设施农业，希望加强种质资源等合作，推进农业高质高效和乡村全面振兴。考察学习中，代表团成员们再次感受到上海勇当全国改革开放排头兵、创新发展先行者的决心魄力和卓著成绩，表示要将学习收获切实转化为具体思路举措，推动本地区本部门工作取得新的进步。。沪滇协作28年，彼此情谊深厚，合作历久弥新。两地同志在交流中表示，要共同贯彻落实好习近平总书记重要指示精神，聚焦更好服务国家发展战略，进一步推动上海技术、管理、资金、人才与云南区位、资源、劳动力等优势融合互补，在产业转移、对外开放、绿色制造、文旅发展等领域取得更多合作成果，在拓展教育、医疗帮扶和劳务协作等民生事业上惠及更多群众，共同谱写新征程上沪滇协作新篇章。。王宁在考察中要求，我省各州（市）各有关部门要认真总结运用学习成果，结合各自实际，主动求变谋变，积极加强与上海工作对接，把沪滇协作抓实在抓具体，取得更多成果成效。要对标先进、借鉴经验，拓宽视野、更新观念，树立更高目标，在中国式现代化云南实践中努力开拓奋进。。22日晚，王予波在沪主持召开云南省与长三角地区知名企业座谈会，与有关企业负责人进行深入交流，介绍云南产业发展优势、优化营商环境等情况，欢迎广大企业来滇投资发展。。上海市领导李仰哲、朱芝松、张为、李政、张小宏、陈宇剑，云南省领导刘洪建、邱江、刘非、杨斌、王浩参加相关活动。云南省各州（市）党委或政府主要负责同志、省直有关部门负责同志参加考察学习。。各省市政府网站 北京 天津 河北 山西 内蒙古 辽宁 吉林 黑龙江 上海 江苏 浙江 安徽 福建 江西 山东 河南 湖北 湖南 广东 广西 海南 重庆 四川 贵州 云南 西藏 陕西 甘肃 青海 宁夏 新疆 香港 澳门 台湾 新疆生产建设兵团,政府领导到其他城市考察学习或访问,0.5893226749599427,True
254,云南省,保山市,杨军率队赴甘肃考察学习,2023-03-31,https:////www.baoshan.gov.cn/info/5288/9438964.htm,3月25日至27日，市委书记杨军率保山市党政企业代表团赴甘肃省大数据中心、兰州市、兰州新区、酒泉市就数字经济、数字政府、城市治理、产业发展等进行考察学习。。在甘肃省数字政府运营指挥中心，代表団与甘肃省大数据中心、甘肃移动、数字政府工作部等部门进行座谈，结合保山实际，就数字政府建设进行了深入交流探讨，为推进保山市数字政府建设进一步理清了思路，拓宽了视野。。在酒泉市，代表团就智慧文旅工作与敦煌研究院、鸣沙山数控中心负责人进行了深入探讨，围绕智慧文旅运营模式、信息化建设、大数据运用等内容，就提升旅游景区运营质量，打造标准化、规范化的智慧文旅体系等进行了考察学习。。在兰州新区，代表团先后走进现代农业示范园、兰州新区展览馆等地，考察学习了新区城市规划建设、产业集群发展、数字园区建设、招商引资等工作，交流学习了党建引领推动经济社会发展经验。。杨军表示，甘肃省在管理体制机制改革创新、文旅创新发展、城市治理能力提升以及高端产业集群发展等方面形成了许多好经验、好做法，值得保山学习借鉴。保山市要加快“数字保山”建设，组建专家库、成立工作专班，认真研究推进关键领域数字化转型，持续开展数字政府、城市大脑、智慧城市、智慧文旅项目建设。希望与甘肃省大数据中心、兰州市、兰州新区、酒泉市加强联动协作，在建设现代化产业体系、推进数字政府、数字经济、智慧文旅、科技创新、实施“东数西算”和推动产业发展方面加强合作，实现共同发展。。副市长成德君，市发展改革委、市工信局、市公安局、市文旅局、市投促局、中国移动保山分公司及腾冲市政府等相关单位负责同志参加以上活动。（市发展改革委钟志供稿）,3月25日至27日，市委书记杨军率保山市党政企业代表团赴甘肃省大数据中心、兰州市、兰州新区、酒泉市就数字经济、数字政府、城市治理、产业发展等进行考察学习。。在甘肃省数字政府运营指挥中心，代表団与甘肃省大数据中心、甘肃移动、数字政府工作部等部门进行座谈，结合保山实际，就数字政府建设进行了深入交流探讨，为推进保山市数字政府建设进一步理清了思路，拓宽了视野。。在酒泉市，代表团就智慧文旅工作与敦煌研究院、鸣沙山数控中心负责人进行了深入探讨，围绕智慧文旅运营模式、信息化建设、大数据运用等内容，就提升旅游景区运营质量，打造标准化、规范化的智慧文旅体系等进行了考察学习。。在兰州新区，代表团先后走进现代农业示范园、兰州新区展览馆等地，考察学习了新区城市规划建设、产业集群发展、数字园区建设、招商引资等工作，交流学习了党建引领推动经济社会发展经验。。杨军表示，甘肃省在管理体制机制改革创新、文旅创新发展、城市治理能力提升以及高端产业集群发展等方面形成了许多好经验、好做法，值得保山学习借鉴。保山市要加快“数字保山”建设，组建专家库、成立工作专班，认真研究推进关键领域数字化转型，持续开展数字政府、城市大脑、智慧城市、智慧文旅项目建设。希望与甘肃省大数据中心、兰州市、兰州新区、酒泉市加强联动协作，在建设现代化产业体系、推进数字政府、数字经济、智慧文旅、科技创新、实施“东数西算”和推动产业发展方面加强合作，实现共同发展。。副市长成德君，市发展改革委、市工信局、市公安局、市文旅局、市投促局、中国移动保山分公司及腾冲市政府等相关单位负责同志参加以上活动。（市发展改革委钟志供稿）,政府领导到其他城市考察学习或访问,0.851489463185389,True
