province,topic,date,content,label,score,is_match
云南省,云南省党政代表团赴浙江考察两省举行经济社会发展情况交流会提出携手提升浙滇联动发展水平夏宝龙李纪恒李强陈豪出席,2016-04-25,云南省党政代表团赴浙江考察，两省举行经济社会发展情况交流会提出 携手提升浙滇联动发展水平 夏宝龙李纪恒李强陈豪出席。4月24日，云南省党政代表团离开江苏南京乘高铁前往浙江继续考察学习之旅，并在杭州举行浙江、云南两省经济社会发展情况交流会。 4月24日的杭州，烟雨蒙蒙、满眼新绿。在浙江省委书记夏宝龙、省长李强分别陪同下，省委书记李纪恒、省长陈豪率团先后到钱江新城城市阳台、杭州华三通信技术公司、梦想小镇考察新区规划建设、现代企业发展、创业创新等情况，到阿里巴巴集团了解集团运营情况并与集团领导层交流探讨合作议题。 傍晚时分，夏宝龙主持两省交流会，李纪恒讲话。李强、陈豪分别介绍了两省经济社会发展和合作交流情况。 夏宝龙对云南省党政代表团赴浙考察表示欢迎。他说，云南是一片美丽神奇、令人向往的土地，也是一个创造奇迹、成就梦想的地方。近年来，云南闯出了一条具有地方特色和时代特点的跨越式发展路子，云南推进经济社会发展中所展现的大思路、大气魄、大手笔、大动作，值得浙江好好学习。浙江与云南在践行新发展理念的追求上是一致的，希望双方互通有无、取长补短，共同为两省发展构筑新优势、注入新动力，在全面建成小康社会的征程中携手并进、共谱新篇。浙滇两省联系一直比较紧密，友好往来、互利合作的历史源远流长。当前，随着国家“一带一路”、长江经济带战略的深入实施，为两省合作打开了新的空间、带来了新的机遇。希望双方贯彻落实好习近平总书记分别考察两省的重要讲话精神，更好融入和服务国家发展战略的共同使命担当，进一步健全合作交流机制，建好交流合作平台，拓展交流合作的层次和领域，进一步发挥各自优势，积极探索合作交流的新模式新路径，让浙滇合作结出更加丰硕的果实。 李纪恒说，浙江省是我国经济最发达、最具活力的省份之一，践行五大发展理念抓得实、抓得早、成效好，发展的大格局、高定位、勇担当让人敬佩，敢为天下先的创新精神、善作善成的改革魄力、宜人宜居的生态环境给我们留下深刻印象。云南与浙江在产业、市场、资源、人才等各个方面有着很强的互补性，特别是在服务和融入国家“一带一路”、长江经济带建设战略中，合作空间巨大、前景广阔。当前，贯彻落实好习近平总书记分别考察两省的重要讲话精神，为深化拓展双方合作交流创造更好契机，云南将积极借鉴浙江深化改革开放、强化创新驱动、加快产业转型升级、建设美丽浙江等方面的成功做法和经验，努力推动跨越发展。希望两省更加紧密地携起手来，进一步对接工作机制，密切交流互动；对接产业发展，推动优势互补；对接高铁经济，实现合作共赢；对接生态建设，体现共同担当，把双方互利合作提升到新的水平，谱写浙江云南联动发展时代新篇。 浙江省领导赵一德、陈金彪、茅临生、黄旭明、陈加元、李卫宁，云南省领导李培、张百如、高峰、刘慧晏、杨嘉武、李邑飞、何金平、李正阳等分别出席上述活动。。各省市政府网站 北京 天津 河北 山西 内蒙古 辽宁 吉林 黑龙江 上海 江苏 浙江 安徽 福建 江西 山东 河南 湖北 湖南 广东 广西 海南 重庆 四川 贵州 云南 西藏 陕西 甘肃 青海 宁夏 新疆 香港 澳门 台湾 新疆生产建设兵团,政府领导到其他城市考察学习或访问,0.6430041741329703,True
云南省,昆明市纪委以工作新成效检验专题教育效果,2015-04-03,2日，昆明市纪委举行中心组（扩大）理论学习会议，贯彻落实习近平总书记在云南考察工作时的重要讲话精神，深入学习“三严三实”和“忠诚干净担当”的要求。市委副书记、市纪委书记应永生强调，“三严三实”和“忠诚干净担当”是对干部提出的新要求，全市纪检监察干部要主动适应党风廉政建设和反腐败斗争的新常态，以工作新成效检验专题教育的效果。。集中学习讨论中，市纪委常委、监察局副局长围绕贯彻习近平总书记重要讲话精神，就如何践行“三严三实”和“忠诚干净担当”的要求进行了深入交流。与会人员一致认为，贯彻“三严三实”和“忠诚干净担当”要求，要做到：以绝对忠诚体现坚定信念，以干净用权树立良好形象，以担当精神履职尽责。。应永生要求，要以“三严三实”和“忠诚干净担当”要求加强干部队伍建设，主动适应党风廉政建设和反腐败斗争的新常态。当前，党风廉政建设和反腐败斗争依然严峻复杂，这对纪检监察干部队伍的思想作风、能力素质、纪律约束提出了新要求。纪检监察干部要践行对党绝对忠诚的政治承诺，通过扎实开展“三严三实”和“忠诚干净担当”专题教育，始终做到政治上坚定清醒、重大问题上旗帜鲜明、关键时刻经得起考验，真正成为党的忠诚卫士；要加强监督，严格管理，以严的纪律要求干部，以严的措施管理干部，坚决防止不想监督、不敢监督的现象，要完善内部监督机制，坚决防止“灯下黑”，用铁的纪律打造党和人民信任的纪检监察干部队伍。。应永生强调，践行“三严三实”和“忠诚干净担当”要求，关键是要落实到工作中，体现在行动上。要把专题教育活动贯穿到实际工作中，强化监督执纪问责，坚持不懈纠正“四风”，坚定不移惩治腐败，以党风廉政建设和反腐败斗争的新成效检验专题教育的效果。下一步，要重点抓好五个方面的工作：一是抓严明纪律，督促各级党组织和党员干部自觉严守政治纪律和政治规矩，结合“六个严禁”专项整治，重点解决好权力寻租、损害群众利益、领导干部违反廉洁自律规定和用人不正之风等问题；二是抓责任落实，各级纪检监察机关要协助党委抓好党风廉政建设主体责任的落实，加强对主体责任、监督责任落实情况的监督检查；三是抓作风整治，持续加强对重点领域、重要节点、要害部门、盲点地带的监督检查，加大“四风”突出问题的专项整治力度，始终保持正风肃纪的高压态势；四要抓惩治腐败，始终保持反腐败的坚定决心，敢于负责，勇于担当，增强突破大案要案的合力，严肃查处腐败分子，坚决遏制腐败现象蔓延势头；五要抓制度建设，针对目前制度不健全等问题，标本兼治，扎紧制度的笼子。。各省市政府网站 北京 天津 河北 山西 内蒙古 辽宁 吉林 黑龙江 上海 江苏 浙江 安徽 福建 江西 山东 河南 湖北 湖南 广东 广西 海南 重庆 四川 贵州 云南 西藏 陕西 甘肃 青海 宁夏 新疆 香港 澳门 台湾 新疆生产建设兵团。省重要机构网站 省委统战部 省委政法委员会 省委省直机关工委 省委机构编制办公室 云南省投资促进局 云南省社会科学院 云南省农业科学院 云南省文史研究馆 云南省供销合作社 云南省地方志编纂委员会办公室 昆明海关 云南省税务局 国家统计局云南调查总队 商务部驻昆明特派员办事处 省妇联 省残疾人联合会 云南共青团 信用云南 云南省政府采购 云南标准化服务信息网 云南省对外投资合作网 云南省图书馆 云南人才 云南招考频道 云南省高校毕业生智慧就业平台 云南电子口岸,其他,0.8725932082298331,True
云南省,上海代表团在滇调研携手推动沪滇协作迈上新台阶,2021-10-24,沪滇一家，山海情深。10月21日至23日，由上海市委副书记、市长龚正率领的上海市代表团在省委副书记、省长王予波陪同下，前往怒江傈僳族自治州、大理白族自治州、昭通市，详细了解沪滇对口协作重点工作进展情况，认真听取当地干部群众意见建议，探索推进具有新阶段特点、更可持续的协作机制，更好助力云南乡村全面振兴。。上海市与云南省对口帮扶25年来，援建各类项目10673个，培训各类人才59万余人次，逾110万群众直接受益。今年，上海与云南东西部协作结对关系调整为云南全省，沪滇对口协作迈上新征程。。代表团首先来到怒江减贫交流中心，了解独龙族等少数民族“一步跨千年”的感人历程。在怒江州职教中心，代表团实地了解技能人才培养和就业情况。在百花岭傈僳音乐小镇，负责人向代表团介绍，这里在上海帮扶支持下提升人居环境、完善旅游体验，可带动逾4000人就业。龚正指出，就业是最大的民生，职校要紧贴产业需求、增强特色，鼓励人才返乡创业，带动更多人就业。上海要发挥所长，助力云南更好发挥文旅等资源禀赋，为乡亲们创造更多就业和致富机会。代表团还走进怒江州中医医院新院区，察看当地中医学科建设等情况。龚正叮嘱发挥远程医疗成本低、效率高的优势，不断提升医疗保障水平，造福当地百姓。。在大理州永平县曲硐村，代表团实地考察当地以古村落保护开发带动旅游业发展的有关情况。在大理洱海生态廊道，代表团了解到，在上海交大环境科学与工程学院团队的助力下，大理经过艰苦努力遏制了洱海水质下滑趋势，让一度消失的海菜花重现湖中。龚正指出，绿水青山就是金山银山，上海要以科技优势助力当地生态保护，推动实现保护与发展的良性互动。王予波表示，多年来，上海市积极组织各类人才来滇开展帮扶，有力助推了云南各项事业发展。希望双方继续加强人才交流，为云南培养更多高水平专业人才。。以产业振兴巩固脱贫成果，是新一轮对口协作的重要抓手。代表团在昭通市昭阳区考察上海帮扶建设的5000亩高标准苹果园，了解当地依托苹果产业兴农富农的新探索。在鲁甸县，代表团参观了上海企业投资建设的高原生态肉牛产业示范园。龚正详细了解苹果园、养牛场的规模化、现代化建设情况，以及农产品运输、销售安排，鼓励一产二产三产有机衔接，实现效益倍增。王予波要求充分发挥项目示范效应和导向作用，培育更多助农增收项目，打造沪滇产业协作“升级版”。在鲁甸县卯家湾易地扶贫搬迁点产业园，代表团察看净菜、服装等扶贫车间。龚正指出，要坚守生态绿色之路，用好科技创新、品牌建设、营销网络三大法宝，更好满足市场多样化需求，将当地特色产业打造为支柱产业。王予波指出，要用好沪滇协作机制，加大招商引资力度，借助上海大市场、大平台、大流通优势，延伸产业链、提升价值链，提高特色产品知名度、美誉度和市场占有率。。各省市政府网站 北京 天津 河北 山西 内蒙古 辽宁 吉林 黑龙江 上海 江苏 浙江 安徽 福建 江西 山东 河南 湖北 湖南 广东 广西 海南 重庆 四川 贵州 云南 西藏 陕西 甘肃 青海 宁夏 新疆 香港 澳门 台湾 新疆生产建设兵团。省重要机构网站 省委统战部 省委政法委员会 省委省直机关工委 省委机构编制办公室 云南省投资促进局 云南省社会科学院 云南省农业科学院 云南省文史研究馆 云南省供销合作社 云南省地方志编纂委员会办公室 昆明海关 云南省税务局 国家统计局云南调查总队 商务部驻昆明特派员办事处 省妇联 省残疾人联合会 云南共青团 信用云南 云南省政府采购 云南标准化服务信息网 云南省对外投资合作网 云南省图书馆 云南人才 云南招考频道 云南省高校毕业生智慧就业平台 云南电子口岸,政府领导到其他城市考察学习或访问,0.924247919316104,True
云南省,钟勉在省文明委全会上强调深入推进十三五精神文明建设为跨越发展全面小康提供强大精神支撑,2016-04-26,钟勉在省文明委全会上强调深入推进“十三五”精神文明建设 为跨越发展全面小康提供强大精神支撑。4月25日下午，省文明委举行全体会议，审议并原则通过《云南省精神文明建设“十三五”规划纲要》。 省委副书记、省文明委主任钟勉出席会议并讲话。 会议肯定了“十二五”以来特别是去年以来全省精神文明建设工作取得的成绩。会议指出，规划纲要是全省加强精神文明建设，推动物质文明和精神文明协调发展的指导性文件，各级各部门要抓好规划纲要的贯彻落实，为跨越发展全面小康提供思想保证、精神力量、道德滋养和文化条件。 钟勉就做好“十三五”时期全省精神文明建设工作提出7点要求。要坚持把加强理想信念教育作为根本任务，强化思想理论武装，突出习近平总书记系列重要讲话和考察云南重要讲话精神学习，巩固各族群众团结奋斗的共同思想基础。要坚持把围绕中心服务大局作为着力方向，深入宣传阐释新发展理念、供给侧结构性改革和省委、省政府重大决策部署，为跨越发展全面小康提供强大精神支撑。要坚持把爱国主义教育作为鲜明主题，贯穿精神文明建设的全过程、各方面，培养升华爱党爱国爱社会主义的深厚感情。要坚持把持续推进社会主义核心价值观建设作为重点内容，深入宣传学习道德模范，健全各行各业规章制度，扎实开展志愿服务，强化全社会共同价值追求。要坚持把群众性精神文明创建活动作为重要载体，深化文明城市、文明村镇、文明单位、文明家庭、文明校园和边境地区精神文明创建活动，不断提升群众素质和社会文明程度。要坚持把治理突出问题作为关键环节，加强社会文化环境、旅游不文明行为、行风和网络治理，营造积极健康向上的社会氛围。要坚持把加强领导落实责任作为重要保障，强化组织领导，创新工作方式，加强队伍建设，不断完善领导体制工作机制。 钟勉强调，要统筹做好今年全省精神文明建设各项工作，重点抓好精神文明建设系统“两学一做”学习教育，抓好精神文明建设工作顶层设计，抓好重大主题宣传教育活动，抓好文明城市创建工作，确保全省“十三五”精神文明建设工作开好局起好步。 省委常委、省委宣传部部长、省文明委副主任赵金主持会议，省军区副政委、省文明委副主任刘华荣出席会议。。各省市政府网站 北京 天津 河北 山西 内蒙古 辽宁 吉林 黑龙江 上海 江苏 浙江 安徽 福建 江西 山东 河南 湖北 湖南 广东 广西 海南 重庆 四川 贵州 云南 西藏 陕西 甘肃 青海 宁夏 新疆 香港 澳门 台湾 新疆生产建设兵团。省政府部门网站 云南省发展和改革委员会 云南省工业和信息化厅 云南省教育厅 云南省科学技术厅 云南省民族宗教事务委员会 云南省公安厅 云南省民政厅 云南省司法厅 云南省财政厅 云南省人力资源和社会保障厅 云南省自然资源厅 云南省生态环境厅 云南省住房和城乡建设厅 云南省交通运输厅 云南省农业农村厅 云南省水利厅 云南省商务厅 云南省文化和旅游厅 云南省卫生健康委员会 云南省退役军人事务厅 云南省应急管理厅 云南省审计厅 云南省人民政府外事办公室 云南省人民政府国有资产监督管理委员会 云南省人民政府研究室 云南省市场监督管理局 云南省广播电视局 云南省能源局 云南省林业和草原局 云南省体育局 云南省统计局 云南省机关事务管理局 云南省信访局 云南省滇中引水工程建设管理局 云南省人民政府国防动员办公室 云南省医疗保障局 云南省粮食和物资储备局 云南省监狱管理局 云南省戒毒管理局 云南省药品监督管理局,不属于政府领导到其他城市考察学习的新闻,0.5979617321221486,True
云南省,省政府党组扩大会议学习习近平总书记重要讲话精神时强调坚定奋斗意志努力为党和人民争取更大光荣,2021-07-05,省政府党组（扩大）会议学习习近平总书记重要讲话精神时强调 坚定奋斗意志 努力为党和人民争取更大光荣。7月4日，省政府党组书记、省长王予波主持召开第十三届省人民政府党组第91次（扩大）会议，专题学习习近平总书记在庆祝中国共产党成立100周年大会上的重要讲话精神，研究部署有关工作。。会议指出，习近平总书记的重要讲话，具有时空穿透力、理论说服力、心灵震撼力，是一篇充满真理力量的马克思主义纲领性文献，为全党全国各族人民向第二个百年奋斗目标迈进指明了前进方向、提供了根本遵循。我们要带着信仰学、带着使命学、带着感情学、带着职责学，准确把握、深刻领会其思想精髓和精神实质，牢记初心使命，坚定理想信念，践行党的宗旨，坚定奋斗意志，奋力谱写好中国梦的云南篇章，努力为党和人民争取更大光荣。。会议强调，要把学习贯彻习近平总书记重要讲话精神同习近平总书记两次考察云南重要讲话精神结合起来，一体学习、一体领会，全面贯彻落实到各项工作中。一要全面贯彻落实到践行“两个维护”上来，坚定不移忠诚核心、信赖核心、维护核心，确保云南工作始终置于以习近平同志为核心的党中央绝对领导下。始终牢记“国之大者”，确保习近平总书记考察云南重要讲话精神和党中央决策部署在云南落地生根、开花结果。二要全面贯彻落实到推动高质量发展上来，坚持发展为大、发展为要，坚持产业兴省、产业强省，全力以赴做强产业、做活企业、做优就业。三要全面贯彻落实到推进民族团结进步示范区建设上来，铸牢中华民族共同体意识，引导各族群众坚定不移感党恩、听党话、跟党走。加强强边固防工作。四要全面贯彻落实到推进生态文明建设排头兵建设上来，在生态优先、绿色发展上作出示范。五要全面贯彻落实到推进面向南亚东南亚辐射中心建设上来，加快形成全方位、多层次、宽领域的全面开放新格局。六要全面贯彻落实到改善民生凝聚人心上来，着力解决发展不平衡不充分问题和人民群众急难愁盼问题，推动共同富裕取得更为明显的实质性进展。七要全面贯彻落实到推进自我革命上来，推动政府系统党的建设、全面从严治党向纵深发展，为云南高质量发展提供坚强保障。。各省市政府网站 北京 天津 河北 山西 内蒙古 辽宁 吉林 黑龙江 上海 江苏 浙江 安徽 福建 江西 山东 河南 湖北 湖南 广东 广西 海南 重庆 四川 贵州 云南 西藏 陕西 甘肃 青海 宁夏 新疆 香港 澳门 台湾 新疆生产建设兵团。省政府部门网站 云南省发展和改革委员会 云南省工业和信息化厅 云南省教育厅 云南省科学技术厅 云南省民族宗教事务委员会 云南省公安厅 云南省民政厅 云南省司法厅 云南省财政厅 云南省人力资源和社会保障厅 云南省自然资源厅 云南省生态环境厅 云南省住房和城乡建设厅 云南省交通运输厅 云南省农业农村厅 云南省水利厅 云南省商务厅 云南省文化和旅游厅 云南省卫生健康委员会 云南省退役军人事务厅 云南省应急管理厅 云南省审计厅 云南省人民政府外事办公室 云南省人民政府国有资产监督管理委员会 云南省人民政府研究室 云南省市场监督管理局 云南省广播电视局 云南省能源局 云南省林业和草原局 云南省体育局 云南省统计局 云南省机关事务管理局 云南省信访局 云南省滇中引水工程建设管理局 云南省人民政府国防动员办公室 云南省医疗保障局 云南省粮食和物资储备局 云南省监狱管理局 云南省戒毒管理局 云南省药品监督管理局,不属于政府领导到其他城市考察学习的新闻,0.629442886381612,True
云南省,云南省全面推行林长制新闻发布会,2021-09-24,9月18日下午，云南省人民政府新闻办公室在海埂会堂召开云南省全面推行林长制新闻发布会，并回答记者提问。。森林和草原是重要的自然生态系统，对维护国家生态安全、推进生态文明建设具有基础性、战略性作用。为贯彻落实中共中央办公厅、国务院办公厅印发《关于全面推行林长制的意见》，省林草局在开展林长制试点，广泛学习考察、调研座谈、征求意见和协商讨论的基础上，坚持国家要求和云南特色相结合，起草了我省《关于全面推行林长制的实施意见》，并经省政府常务会议和省委深改会审议通过，于9月9日正式印发实施。。今天的新闻发布会，我们邀请到省林草局主要领导和我省林长制试点县市代表，对我省《关于全面推行林长制的实施意见》的出台背景、意义及主要内容进行发布，并回答记者提问。。参加今天新闻发布会的有中央驻滇、香港驻滇、云南省内各新闻媒体的记者朋友，欢迎大家！。首先，请云南省林业和草原局局长万勇先生对《关于全面推行林长制的实施意见》进行发布。。首先，我代表省林草局对大家长期以来对云南林草资源保护的关心关注，对云南林草事业改革发展的鼎力支持表示衷心感谢。下面，我就《关于全面推行林长制的实施意见》的起草背景和目的、意义、主要内容向大家作简要通报。。2019年新修订的《森林法》提出，“地方人民政府可以根据本行政区域森林资源保护发展的需要，建立林长制”。《中共中央关于制定国民经济和社会发展第十四个五年规划和二〇三五年远景目标的建议》也明确提出要“推行林长制”。2020年11月，中央深改会审议通过了《关于全面推行林长制的意见》，12月，由中共中央办公厅、国务院办公厅正式印发实施。。为深入践行习近平生态文明思想，贯彻落实中办、国办《关于全面推行林长制的意见》，省委、省政府主要领导亲自研究部署，省林草局牵头会同省级相关部门全力推动林长制工作。期间，我们在新平、弥勒、西盟等10个县区开展了试点，在广泛深入开展学习考察、调研座谈、意见征求、协商讨论基础上，结合云南实际，研究起草了《实施意见》征求意见稿，组织多轮论证修改和专家评审，经省政府常务会和省委深改会审议通过，于2021年9月9日，由省委办公厅、省政府办公厅正式印发。。林长制是以保护发展森林草原资源为目标，以压实地方党政领导干部责任为核心，以制度体系建设为保障，以监督考核为手段，构建由地方党委、政府主要领导担任林长，省、市、县、乡、村分级设立林（草）长，聚焦林草资源保护发展重点难点工作，实现党委领导、党政同责、属地负责、部门协同、全域覆盖、源头治理的长效责任体系。全面推行林长制，是以习近平同志为核心的党中央站在中华民族永续发展和增进民生福祉战略高度作出的重大决策部署，是我国生态文明建设领域又一重大制度创新，是必须完成好的政治任务。全面推行林长制，对于守护云南丰富的林草资源具有重大意义。。《实施意见》为我省全面推行林长制指明了工作方向、确定了目标任务和工作措施，是我省深入贯彻落实习近平生态文明思想和习近平总书记考察云南重要讲话精神，努力争当全国生态文明建设排头兵的重要举措，充分彰显了省委、省政府加强林草生态保护的鲜明态度和坚定决心。《实施意见》的出台，将进一步压实各级党委、政府保护发展林草资源的主体责任，抓住“关键少数”强化组织领导，进一步增强林草资源保护合力，推动构建云南林草资源保护发展新格局。。《实施意见》包括总体要求、主要任务、全面建立林长制体系、建立考核监督体系和强化工作保障等五个部分内容。《实施意见》还明确了省级林长名单，省委书记和省长担任我省总林长。,不属于政府领导到其他城市考察学习的新闻,0.7477583548180878,True
