province,topic,date,content,label,score,is_match
云南省,李纪恒率云南代表团在香港考察学习借鉴先进经验,2013-05-09,5月6日至8日，在香港开展经济交流活动的云南代表团，见缝插针地开展考察学习，面对面邀请大企业大财团掌门人参加参展南博会和昆交会，到云南投资兴业。。5月7日上午，代表团全体成员到香港规划及建设展览馆参观学习。原本休馆的展览馆特地为云南代表团开放。而香港规划署署长凌嘉勤亲自为大家讲解，使参观考察变成了现场学习咨询。。“香港怎样杜绝违章建筑？” “如何处理好城市区域功能混合度？”“城市基础设施建设的融资方式？”“香港的交通如何管理？”等问题，代表团成员不仅仔细了解香港城市规划的原则、策略以及交通运输网络构建、绿色城市建设、天然资源保护及利用等方面的经验，还纷纷就内地城市建设中的热点问题请教凌嘉勤。。“从香港望九龙能看到20%的山脉，从九龙望香港也要看到20%的山脉，这是我们城市规划的基本原则。”“同意拆迁者超过80%，法院就可按相关法律强制执行。”。“香港的城市规划、建设以及管理和服务，都值得我们认真学习借鉴。”省长李纪恒叮嘱随行的州市负责人。。华润集团是在中国内地和香港最具实力的多元化企业集团之一。昨日一早，李纪恒率团到华润集团总部，与集团董事长宋林率领的集团高管们就进一步推进《推进桥头堡建设战略合作投资协议》的落实进行磋商。 “十二五”期间，华润集团将在云南投资1000亿元，发展以水电为主的能源产业，以燃气、水泥为主的基础设施与服务业，以生物制药、医疗为主的医药卫生产业。会谈中，双方就推动在建项目取得实质进展、在谈项目早日落地提出许多务实的建议。。昨日中午，代表团与香港贸易发展局和香港近40位各行业的精英和商界领袖们座谈。李纪恒希望香港贸易发展局能够一如既往地关心支持云南经济社会发展，邀请与会的嘉宾到云南旅游观光、投资考察，把先进发展理念、管理经验及方式方法、生产技术等带入云南。同时，也希望大家能带动更多的香港业界成功人士投资云南，并以云南为前沿和窗口，开拓东南亚、南亚广阔市场。香港贸发局主席苏泽光表示，继续为滇港两地合作交流牵线搭桥，促进滇港合作迈上新台阶。与会者纷纷表示，云南是香港工商界投资的热土，希望借助南博会这一新的发展平台，谋求更多合作共赢的机会。。5月8日下午，代表团到香港中文大学访问。李纪恒一行参观了生物医学学院实验室，与陈伟仪教授、谭兆祥教授以及来自于昆明医科大学第一附属医院的李玉叶博士就生物制药、艾滋病病毒研究等课题进行交流探讨。。李纪恒说，香港中文大学是亚洲首屈一指的大学，在生物医学科学、信息科学、经济与金融、地球信息与地球科学以及数学等领域学科优势明显，科研水平一流。希望通过与香港中文大学的合作，为深入实施“科技入滇”战略树立一杆旗帜，示范带动更多的科研平台、科技企业、科技成果、科技人才和团队加入到助推云南发展的行列中来。同时希望香港中文大学利用自身影响，引导更多的高端人才到滇创业，带动更多的香港科技型企业入滇发展。。香港中文大学署理校长程伯中说，近年来，香港中文大学积极深化与云南在各个学科领域的合作与交流，并于去年6月与云南省科技厅签署了全面合作协议，为双方进一步达成合作共识、创新合作模式打下坚实的基础。相信此次访问一定会促进双方的合作跨越发展。。李纪恒等还出席了昆明医科大学与孔祥复院士云南省院士工作站协议签约仪式、省人力资源和社会保障厅与香港中文大学香港亚太研究所关于人才研修项目意向书签订仪式。。各省市政府网站 北京 天津 河北 山西 内蒙古 辽宁 吉林 黑龙江 上海 江苏 浙江 安徽 福建 江西 山东 河南 湖北 湖南 广东 广西 海南 重庆 四川 贵州 云南 西藏 陕西 甘肃 青海 宁夏 新疆 香港 澳门 台湾 新疆生产建设兵团,政府领导到其他城市考察学习或访问,0.81009718048301,True
云南省,云南党政代表团赴广西贵州学习考察带着使命去带着干劲回,2016-03-28,3月22日至26日，云南党政代表团赴广西、贵州两省区学习考察，27日上午在昆明召开总结会，把学习考察两省区的好经验、好做法转化为推动云南跨越发展的动力和活力— 带着使命去 带着干劲回。● 一定要加强和改进党的领导，把创新、协调、绿色、开放、共享的新发展理念作为指挥棒和红绿灯，因势而谋、应势而动、顺势而为，弯道取直，后发赶超。。● 一定要牢牢抓住发展第一要务不放松，努力保持调结构与稳增长之间的平衡，在坚持以提高经济发展质量和效益的基础上，能快就不慢，推动经济社会又好又快发展。。● 一定要解放思想、开拓创新，从资源依赖、政府依赖中解放出来，从传统模式的思维定式和路径依赖中解放出来，从守成求稳的心态中解放出来，从局部利益、部门利益和个人得失的束缚中解放出来，以思想的大解放推动发展思路的大转变、改革深化的大突破和开放水平的大提高。。● 一定要凝心聚力、团结干事，把一切可以团结的力量都团结起来，把一切可以调动的积极因素都调动起来，心往一处想，劲往一处使，形成推动跨越式发展的强大合力。。带着增进交流深化合作的使命，带着为云南赶超跨越寻找发展经验的任务，3月22日至26日，省委书记李纪恒、省长陈豪率领我省党政代表团赴广西、贵州两省区学习考察。短短5天时间，代表团一行先后到广西南宁、钦州、柳州、桂林，贵州贵安新区、贵阳市、毕节市，实地考察两省区经济转型、产业升级、扩大开放、文化旅游、生态文明、扶贫开发和城市建设管理，学习取经、开阔视野、增进感情、深化合作。。结束紧张的行程，风尘仆仆回到昆明。27日一大早，云南党政代表团学习考察总结会就在云南海埂会堂召开。李纪恒和陈豪带着大家一起找差距、查原因、理思路、明措施。。行前，对我们的近邻广西和贵州，大家都不陌生，觉得都是欠发达省区、发展阶段特征相似，面临的挑战和困难都差不多。但这一趟下来，印象却从“差不多”变成了“差不少”。。敢想敢做、会想会做、立想立做——广西五象新区建设不等不靠，积极主动加强与国家部委和国内外大企业对接，较短时间内取得较好成效；贵州贵安新区、国家大数据综合试验区大胆试大胆闯，获得了国家一大批项目、资金和政策支持，提升了自身发展地位。。把握机遇，用足、用好、用活政策——贵州努力将区域发展战略推升为国家发展战略，攻坚克难弯道超车。全省经济增速连续5年居全国前3位，经济总量和人均生产总值实现赶超进位的历史性突破。值得一提的是，2015年底，贵州成为西部地区第一个县县通高速公路的省份，9个州市实现通航机场全覆盖。广西抓住开发开放的机遇，北部湾经济区、珠江—西江经济带、左右江革命老区、桂林国际旅游胜地等上升为国家战略，14个市实现国家战略规划全覆盖，发挥了带动地方经济发展的龙头效应。。大项目支撑，超常规投入、超常规发展——广西集中力量发展食品、汽车、冶金、石化、电子信息等产业，全区两千亿元产业增至7个，千亿元工业产业从“十一五”末的3个增加到10个。贵州做大做强现代山地特色高效农业、旅游业、装备制造业、特色轻工业，尤其是大数据项目风生水起，成为全国互联网发展的新“风口”。。还有山水融合、焕然一新的城乡面貌，精准扶贫，产业富民的创新实践，展现了高起点规划、高水平建设、高效能管理释放的巨大效应。。“说一千、道一万，广西和贵州发展取得的成绩，归根结底在干部。” 李纪恒提及，广西五象新区还未获批就已经是大资金投入大建设的热火朝天，贵安新区3年来还在活动板房里办公，考察中毕节市委书记陈志刚的一句话让他印象深刻——人生因挑战而精彩，事业因成就而自豪。这不禁让人感慨，只有构筑“精神高地”才能奋力冲出“经济洼地”。,政府领导到其他城市考察学习或访问,0.6686692315855622,True
云南省,云南省党政代表团赴上海考察学习学习改革创新经验深化协作共谋发展,2024-05-22,5月21日至22日，云南省党政代表团赴上海市考察学习，共同贯彻落实习近平总书记在新时代推动西部大开发座谈会上的重要讲话精神和关于深化东西部协作的重要指示精神，学习上海改革发展先进经验，对接沪滇协作工作，携手推动两地现代化建设不断取得新成效。。上海市委书记陈吉宁，云南省委书记王宁，省委副书记、省长王予波；上海市人大常委会主任黄莉新、市政协主席胡文容，云南省委副书记石玉钢参加有关活动。。上海市深入贯彻落实习近平总书记考察上海重要讲话精神，聚焦“五个中心”建设，统筹牵引经济社会发展不断取得新成就，充分彰显了我国改革开放前沿阵地和深度链接全球国际大都市的重要地位和作用。我省党政代表团围绕发展新质生产力、科技创新、数字经济、智能制造、城市规划建设、乡村全面振兴等，认真考察学习上海先进经验和做法。。代表团走进上海科技创新成果展，参观基础研究、人工智能、生物医药等领域科技创新成果，学习创新驱动发展新质生产力的思路举措；来到全国首个大模型专业孵化和加速载体上海模速空间创新生态社区，了解上海汇聚尖端科技构建产业生态、打造世界级人工智能产业集群的做法；在美团、携程等消费服务平台企业，观看大数据应用场景，交流拓展在滇业务，探讨推动上海与云南合作打造国际化深度旅游目的地。考察途中，代表团深刻感受到上海城市风貌提升和治理成效，并到上海城市规划展示馆，了解城市规划建设历程，学习上海建设“人民城市”的理念做法。代表团还到上海电气集团和上海振华重工集团，考察企业科技研发、大国重器制造情况，就新能源开发、储能、装备制造等对接合作。超大城市如何推进农业农村现代化，代表团前往崇明区合兴村、由由中荷农业创新园“取经”，与当地基层干部交流农民增收致富办法，走进种植大棚考察高科技设施农业，希望加强种质资源等合作，推进农业高质高效和乡村全面振兴。考察学习中，代表团成员们再次感受到上海勇当全国改革开放排头兵、创新发展先行者的决心魄力和卓著成绩，表示要将学习收获切实转化为具体思路举措，推动本地区本部门工作取得新的进步。。沪滇协作28年，彼此情谊深厚，合作历久弥新。两地同志在交流中表示，要共同贯彻落实好习近平总书记重要指示精神，聚焦更好服务国家发展战略，进一步推动上海技术、管理、资金、人才与云南区位、资源、劳动力等优势融合互补，在产业转移、对外开放、绿色制造、文旅发展等领域取得更多合作成果，在拓展教育、医疗帮扶和劳务协作等民生事业上惠及更多群众，共同谱写新征程上沪滇协作新篇章。。王宁在考察中要求，我省各州（市）各有关部门要认真总结运用学习成果，结合各自实际，主动求变谋变，积极加强与上海工作对接，把沪滇协作抓实在抓具体，取得更多成果成效。要对标先进、借鉴经验，拓宽视野、更新观念，树立更高目标，在中国式现代化云南实践中努力开拓奋进。。22日晚，王予波在沪主持召开云南省与长三角地区知名企业座谈会，与有关企业负责人进行深入交流，介绍云南产业发展优势、优化营商环境等情况，欢迎广大企业来滇投资发展。。上海市领导李仰哲、朱芝松、张为、李政、张小宏、陈宇剑，云南省领导刘洪建、邱江、刘非、杨斌、王浩参加相关活动。云南省各州（市）党委或政府主要负责同志、省直有关部门负责同志参加考察学习。。各省市政府网站 北京 天津 河北 山西 内蒙古 辽宁 吉林 黑龙江 上海 江苏 浙江 安徽 福建 江西 山东 河南 湖北 湖南 广东 广西 海南 重庆 四川 贵州 云南 西藏 陕西 甘肃 青海 宁夏 新疆 香港 澳门 台湾 新疆生产建设兵团,政府领导到其他城市考察学习或访问,0.8153715205280158,True
云南省,云南党政代表团赴广西学习考察深化云桂合作共创美好未来,2016-03-23,22日，省委书记李纪恒、省长陈豪率云南党政代表团赴广西学习考察。广西壮族自治区党委书记彭清华、自治区主席陈武陪同考察。22日下午，两省区在南宁举行经济社会发展情况交流座谈会。会议提出，主动融入和服务国家发展战略，深化两省区全方位合作，同心谱写中国梦的云桂篇章。。彭清华主持会议并讲话。他说，云南文化灿烂、风光秀美、民族和谐、区位独特，近年来在省委、省政府领导下，各项工作都开创了新局面，我们深深为云南的大战略、大气魄、大手笔、大变化感到钦佩。广西与云南既是好邻居，更是好兄弟、好伙伴。特别是泛珠合作启动以来，两地合作更加紧密，互联互通格局更加完善，云电送桂工程加快推进，共建产业园区取得新进展，旅游合作成果丰硕，石漠化治理合作切实加强，合作势头很好。广西与云南同属西部、边境、民族地区，当前都处在与全国同步全面建成小康社会的决胜阶段，处在贯彻落实习近平总书记赋予的新定位新使命、加快发展的关键时期，面临的发展任务、机遇和挑战大体相同，深化合作具有较好的现实基础，也有很多共同点。我们愿同云南一道，深化交通、能源、产业园区、旅游、全方位开放、生态环保、扶贫攻坚等各领域合作，共同推动桂滇合作迈上新台阶。。李纪恒代表省委、省政府对广西长期以来给予云南发展的关心、支持、帮助表示感谢。他说，近年来广西谋划发展理念新、手笔大，对外开放站位高、落子准，产业转型升级行动快、抓得实，综合交通建设标准高、成效好，广西抢抓机遇、苦干实干的精神，快人一步、高人一筹的气魄，开放包容、创新争先的干劲，值得认真学习借鉴。作为“一带一路”战略的重要连接带和交汇处，如何更好地服务和融入国家战略，是云南和广西面临的共同使命和重大历史机遇。我们期待与广西进一步强化双方全方位的合作对接，增强经济发展耦合度，通过基础设施互通、开放互动、产业融合、优势叠加，催生一加一大于二的聚合效应，推动面向南亚东南亚辐射中心与“一带一路”有机衔接的重要门户建设联合联动、七彩云南与八桂大地相得益彰，真正把两省区的区位优势转化为开放优势、发展优势。希望两省区进一步健全完善合作机制，进一步加强区域协同创新，进一步推进全方位开放合作。。陈武说，广西与云南两地优势互补，合作交流源远流长。随着国家实施“一带一路”战略及泛珠合作上升为国家战略，广西与云南同时面临多重发展机遇，需要充分发挥各自优势，创新合作机制，拓宽合作领域，提升合作层次，构建两区省合作共赢的新格局。建议加强大通道建设和物流合作，加快云桂高铁经济带前期研究，进一步加强面向东盟和南亚的开放合作，共同推进左右江革命老区振兴规划实施。相信两区省合作一定能取得更加丰硕的成果。。陈豪说，此行充分感受到广西的生机活力与滇桂兄弟之情，完全同意广西提出的合作建议。希望通过双方共同努力，力争到“十三五”末，联系两省区的交通网络主骨架全面形成，内外开放和产业合作空间持续拓展，社会文化交流合作不断深化，生态环境不断改善，双方经济社会融合度显著提升，携手与全国同步全面建成小康社会，在服务国家发展战略中作出更大贡献。。广西方面陪同考察或参加座谈会的领导有：陈际瓦、黄道伟、唐仁健、李康、范晓莉、王小东、杨道喜、张晓钦、陈刚、胡焯、莫恭明。。李江、赵金、李培、程连元、刘慧晏、董华、白成亮，李邑飞、何金平、李正阳等云南省领导一同考察。。各省市政府网站 北京 天津 河北 山西 内蒙古 辽宁 吉林 黑龙江 上海 江苏 浙江 安徽 福建 江西 山东 河南 湖北 湖南 广东 广西 海南 重庆 四川 贵州 云南 西藏 陕西 甘肃 青海 宁夏 新疆 香港 澳门 台湾 新疆生产建设兵团,政府领导到其他城市考察学习或访问,0.608786089798281,True
云南省,省政府召开常务会议陈豪主持传达学习近期国务院常务会议我省党政代表团赴沪苏浙学习考察活动总结会精神通过云南省人民政府年稳增长督查激励和问责办法,2016-04-30,省政府召开常务会议 陈豪主持 传达学习近期国务院常务会议、我省党政代表团赴沪苏浙学习考察活动总结会精神，通过《云南省人民政府2016年稳增长督查激励和问责办法》。4月29日上午，省长陈豪主持召开省政府第85次常务会议，传达学习近期国务院常务会议和我省党政代表团赴沪苏浙学习考察活动总结会精神，通过《云南省政府2016年稳增长督查激励和问责办法》。 会议要求，要牢固树立疫苗质量安全“红线”意识，进一步完善食品药品监管体制和疫苗管理长效机制，强化事中事后监管，保障人民群众生命健康；抓紧提出阶段性降低企业社保缴费费率和规范住房公积金缴存比例决定的具体方案，减轻企业负担，增强企业活力，增加职工收入，多研究出台与群众利益密切相关的公共政策；抢抓国家开展交通基础设施扶贫的重大机遇，加快推进交通扶贫，造福广大人民群众；抓实我省“双创”示范基地建设，努力构筑完备的创业创新服务链；抓紧落实国务院促进进出口回稳向好的政策措施，推进我省外贸转型升级；加强研究和对接，使国家支持中西部地区教育发展的政策措施在云南尽快落地，补齐教育落后这块云南发展“短板”之中的“短板”；深度挖掘文化文物单位馆藏资源，推动植根民族文化的文化创意产品开发；依法依规做好农田水利规划建设等工作，推进农业现代化。 会议强调，要认真学习借鉴长三角地区在改革开放、创业创新、开拓进取等方面的新理念、好经验，学习长三角地区干在实处永无止境、走在前列要谋新篇的精神状态，建立起政府、省校和企业间长效联动发展机制，抓实抓细当前着力推动的重点工作，增强云南发展新动能。 会议提出，当前供给侧结构性改革和稳增长任务繁重，需要建立健全奖惩分明的正向激励和整改问责机制。会议通过《云南省人民政府2016年稳增长督查激励和问责办法》。《办法》旨在强化督查抓落实，奖惩并举激励各地竞相推动科学发展，使政策、资金、项目等向想干事、能干事、干得成事的地区倾斜，在全省形成奖勤罚懒的竞争格局，大力营造干事创业的良好环境，确保全面完成全年经济社会发展目标任务。 会议还研究了其他事宜。。各省市政府网站 北京 天津 河北 山西 内蒙古 辽宁 吉林 黑龙江 上海 江苏 浙江 安徽 福建 江西 山东 河南 湖北 湖南 广东 广西 海南 重庆 四川 贵州 云南 西藏 陕西 甘肃 青海 宁夏 新疆 香港 澳门 台湾 新疆生产建设兵团。省政府部门网站 云南省发展和改革委员会 云南省工业和信息化厅 云南省教育厅 云南省科学技术厅 云南省民族宗教事务委员会 云南省公安厅 云南省民政厅 云南省司法厅 云南省财政厅 云南省人力资源和社会保障厅 云南省自然资源厅 云南省生态环境厅 云南省住房和城乡建设厅 云南省交通运输厅 云南省农业农村厅 云南省水利厅 云南省商务厅 云南省文化和旅游厅 云南省卫生健康委员会 云南省退役军人事务厅 云南省应急管理厅 云南省审计厅 云南省人民政府外事办公室 云南省人民政府国有资产监督管理委员会 云南省人民政府研究室 云南省市场监督管理局 云南省广播电视局 云南省能源局 云南省林业和草原局 云南省体育局 云南省统计局 云南省机关事务管理局 云南省信访局 云南省滇中引水工程建设管理局 云南省人民政府国防动员办公室 云南省医疗保障局 云南省粮食和物资储备局 云南省监狱管理局 云南省戒毒管理局 云南省药品监督管理局,政府领导到其他城市考察学习或访问,0.5346855338233082,True
