province,topic,date,content,label,score,is_match
云南省,昆明市招商引资提速增质,2022-04-19,今年以来，昆明认真贯彻落实省第十一次党代会、省委经济工作会、省两会、全省优化营商环境与招商引资工作视频会议等会议精神，以实际行动践行省委、省政府决策部署，牢固树立“抓发展就要抓招商、抓发展必须抓招商”的鲜明导向，招商引资工作全面提速增质。。今年一季度，全市内外资项目实际到位资金417.6亿元，其中内资到位资金415.8亿元，与去年同期相比增长23.2%；工业类项目到位资金51.16亿元，同比增长115.2%。在到位资金实现稳步增长的同时，招商引资项目结构也呈现逐步优化态势。。2月14日至15日，市委、市政府召开春节后第一个重要会议——全市产业发展暨招商引资、项目建设工作会议。会议强调，要认真落实省委、省政府部署要求，推动产业发展实现大提升、招商引资实现大突破、项目建设实现大发展，坚决打好经济工作翻身仗，真正当好全省经济社会发展排头兵。。会议召开后的第二天，省委常委、市委书记刘洪建就率队赴深圳招商引资，先后到正威国际集团、世纪云芯、华润集团、德方纳米、鹏瑞集团、华强方特集团、闻泰科技、华为公司等企业，与企业负责人就相关合作事宜进行深入交流，并就进一步深化合作达成新的共识。3月6日至7日，刘洪建再次率队赴福建省招商引资、考察学习，向外界传递昆明市大抓招商引资的信号。。3月1日至3日，市委副书记、市长刘佳晨率队赴杭州、宁波招商引资，先后到迪安诊断、阿里巴巴、树兰教育、华立集团、方特东方神画、杉杉新材料等企业，与企业负责人就双方深化合作、加快项目落地和建设达成共识。。以上率下，勠力同心。2月，呈贡区政府主要领导带队赴杭州、上海开展招商引资考察工作，西山区政府主要领导带队赴上海考察学习并开展招商引资活动；3月，富民县政府主要领导带队赴上海、广州进行招商考察学习，盘龙区政府主要领导带队赴福建考察企业，开展招商活动；安宁市成立以市委、市政府主要领导为双组长的工作领导小组，围绕“客商库”和“项目库”，先后赴深圳、衢州、宁波等地招商，在绿色新能源电池产业建链、补链、强链上下功夫……。统计显示，今年一季度，全市各县（市）区、开发（度假）区党政“一把手”赴省外招商37 次，省内会见客商 979 次，切实担起招商引资的主体责任，比学赶超、争先创优氛围日益浓厚。。招商引资没有局外人、没有旁观者，在“一把手”招商、全员招商的大背景下，昆明市不断夯实招商引资的制度保障和环境保障，按照“重点聚焦、靶向发力、精准出击、统分结合、务求实效”的原则，构建起全市“一盘棋”招商引资工作格局。。3月，市政务服务管理局（市投资服务中心）与市应急管理局联动，到东川区为企业现场办公，帮助云南金山矿业有限公司完成《安全生产许可证》到期换证申报工作。在工作人员的指导下，企业仅用10分钟就完成资料整理和填报工作。随后，工作人员现场电话通知后台审核，当天办理完成并将证件从市政务服务大厅寄往东川区企业所在地，让企业足不出户免费办成事。这是今年以来两部门第二次联动上门为东川区企业送服务，今年2月也以同样的方式为华新水泥（昆明东川）股份有限公司免费办理了相关事项。。与此同时，昆明还制定出台一系列政策措施，从机制上加强区域间招商和产业协作，进一步优化全市产业招商项目布局。2月13日，市委办公室、市政府办公室印发《关于建立完善“链长制”工作机制的通知》，成立“链长制”工作指挥部，指挥部统筹重点产业链招商引资和发展培育工作。。2月14日，市招商委印发了《2022年昆明市产业招商提质增效实施意见》、《2022年昆明市产业招商考评办法（试行）的通知》等文件，建立精准招商机制，明确目标任务和考核办法，突出“招大引强”。,政府领导到其他城市考察学习或访问,0.967766266273243,True
云南省,陈豪简化和优化流程方便群众办事创业,2016-04-01,31日上午，省长陈豪主持召开省政府第83次常务会议，决定进一步简化优化公共服务流程，方便群众办事创业；审议并原则通过《云南省人民政府关于贯彻中国制造2025的实施意见》。。会议传达学习了近期国务院常务会议精神，强调要抓好省政府工作报告主要任务的协调推进，持续推动2016年我省深化经济体制改革各项工作得以落实；做好营改增改革、加强与国家自主创新示范区合作等工作。会议传达学习了我省党政代表团赴广西、贵州考察学习总结会精神，强调要虚心学习两省先进经验，提振干事创业的精气神，更加重视规划引领、综合交通等基础设施建设、城乡生态环境建设、产业发展与园区建设、旅游与文化深度融合发展、功能布局和供给侧结构性改革等工作，奋力开创云南经济社会发展新局面。。会议听取了我省简政放权放管结合工作情况汇报，强调要深入贯彻落实党中央和省委决策部署，推动简政放权、放管结合、优化服务向纵深发展。要健全完善政府权责清单制度，加快制定和实施市场准入负面清单制度，加强事中事后监管，营造公平竞争环境，加快推进行政审批标准化建设。会议审议通过《云南省人民政府办公厅关于进一步简化优化公共服务流程方便群众办事创业的意见》，强调要继续转变政府职能，依法管好权用好权，大力推进办事流程简化优化和服务方式创新，为群众办事创业提供公平、可及的公共服务。。会议提出，云南要实现跨越发展，必须坚决贯彻落实新发展理念，坚决贯彻落实党中央、国务院关于“中国制造2025”的决策部署，坚定走“两型三化”的产业发展路子，以制造业创新发展为核心，以新一代信息技术与制造业深度融合为主线，以智能制造为主攻方向，推进重点领域、项目和企业发展壮大，切实加快我省工业转型升级，助推云南实现后发赶超。。会议审议并原则通过《怒江州脱贫攻坚旅游建设发展规划（2016—2020年）》《云南省“十三五”农村电网建设攻坚工程实施方案》《云南省人民政府关于加快推进项目前期工作的若干意见》和《云南省2016—2018年“十、百、千”项目投资计划》。。国务院部门网站 外交部 国防部 国家发展和改革委员会 教育部 科学技术部 工业和信息化部 国家民族事务委员会 公安部 国家安全部 民政部 司法部 财政部 人力资源和社会保障部 自然资源部 生态环境部 住房和城乡建设部 交通运输部 水利部 农业农村部 商务部 文化和旅游部 国家卫生健康委员会 退役军人事务部 应急管理部 人民银行 审计署 国家语言文字工作委员会 国家航天局 国家原子能机构 国家外国专家局 国家海洋局 国家核安全局 国家乡村振兴局 国务院国有资产监督管理委员会 海关总署 国家税务总局 国家市场监督管理总局 国家金融监督管理总局 中国证券监督管理委员会 国家广播电视总局 国家体育总局 国家信访局 国家统计局 国家知识产权局 国家国际发展合作署 国家医疗保障局 国务院参事室 国家机关事务管理局 国家反垄断局 国家认证认可监督管理委员会 国家标准化管理委员会 国家新闻出版署（国家版权局） 国家宗教事务局 国务院研究室 国务院侨务办公室 国务院港澳事务办公室 国务院台湾事务办公室 国家互联网信息办公室 国务院新闻办公室 新华通讯社 中国科学院 中国社会科学院 中国工程院 国务院发展研究中心 中央广播电视总台 中国气象局 国家行政学院 国家粮食和物资储备局 国家能源局 国家数据局 国家国防科技工业局 国家烟草专卖局 国家移民管理局 国家林业和草原局 国家铁路局 中国民用航空局 国家邮政局 国家文物局 国家中医药管理局 国家疾病预防控制局 国家矿山安全监察局 国家消防救援局 国家外汇管理局 国家药品监督管理局,政府领导到其他城市考察学习或访问,0.9240348813566892,True
云南省,第十二届省人民政府第次常务会议,2016-04-01,3月31日上午，省长陈豪主持召开省政府第83次常务会议，决定进一步简化优化公共服务流程，方便群众办事创业；审议并原则通过《云南省人民政府关于贯彻中国制造2025的实施意见》。。会议传达学习了近期国务院常务会议精神，强调要抓好省政府工作报告主要任务的协调推进，持续推动2016年我省深化经济体制改革各项工作得以落实；做好营改增改革、加强与国家自主创新示范区合作等工作。会议传达学习了我省党政代表团赴广西、贵州考察学习总结会精神，强调要虚心学习两省先进经验，提振干事创业的精气神，更加重视规划引领、综合交通等基础设施建设、城乡生态环境建设、产业发展与园区建设、旅游与文化深度融合发展、功能布局和供给侧结构性改革等工作，奋力开创云南经济社会发展新局面。。会议听取了我省简政放权放管结合工作情况汇报，强调要深入贯彻落实党中央和省委决策部署，推动简政放权、放管结合、优化服务向纵深发展。要健全完善政府权责清单制度，加快制定和实施市场准入负面清单制度，加强事中事后监管，营造公平竞争环境，加快推进行政审批标准化建设。会议审议通过《云南省人民政府办公厅关于进一步简化优化公共服务流程方便群众办事创业的意见》，强调要继续转变政府职能，依法管好权用好权，大力推进办事流程简化优化和服务方式创新，为群众办事创业提供公平、可及的公共服务。。会议提出，云南要实现跨越发展，必须坚决贯彻落实新发展理念，坚决贯彻落实党中央、国务院关于“中国制造2025”的决策部署，坚定走“两型三化”的产业发展路子，以制造业创新发展为核心，以新一代信息技术与制造业深度融合为主线，以智能制造为主攻方向，推进重点领域、项目和企业发展壮大，切实加快我省工业转型升级，助推云南实现后发赶超。。会议审议并原则通过《怒江州脱贫攻坚旅游建设发展规划（2016—2020年）》《云南省“十三五”农村电网建设攻坚工程实施方案》《云南省人民政府关于加快推进项目前期工作的若干意见》和《云南省2016—2018年“十、百、千”项目投资计划》。。国务院部门网站 外交部 国防部 国家发展和改革委员会 教育部 科学技术部 工业和信息化部 国家民族事务委员会 公安部 国家安全部 民政部 司法部 财政部 人力资源和社会保障部 自然资源部 生态环境部 住房和城乡建设部 交通运输部 水利部 农业农村部 商务部 文化和旅游部 国家卫生健康委员会 退役军人事务部 应急管理部 人民银行 审计署 国家语言文字工作委员会 国家航天局 国家原子能机构 国家外国专家局 国家海洋局 国家核安全局 国家乡村振兴局 国务院国有资产监督管理委员会 海关总署 国家税务总局 国家市场监督管理总局 国家金融监督管理总局 中国证券监督管理委员会 国家广播电视总局 国家体育总局 国家信访局 国家统计局 国家知识产权局 国家国际发展合作署 国家医疗保障局 国务院参事室 国家机关事务管理局 国家反垄断局 国家认证认可监督管理委员会 国家标准化管理委员会 国家新闻出版署（国家版权局） 国家宗教事务局 国务院研究室 国务院侨务办公室 国务院港澳事务办公室 国务院台湾事务办公室 国家互联网信息办公室 国务院新闻办公室 新华通讯社 中国科学院 中国社会科学院 中国工程院 国务院发展研究中心 中央广播电视总台 中国气象局 国家行政学院 国家粮食和物资储备局 国家能源局 国家数据局 国家国防科技工业局 国家烟草专卖局 国家移民管理局 国家林业和草原局 国家铁路局 中国民用航空局 国家邮政局 国家文物局 国家中医药管理局 国家疾病预防控制局 国家矿山安全监察局 国家消防救援局 国家外汇管理局 国家药品监督管理局,政府领导到其他城市考察学习或访问,0.9183841160732552,True
云南省,习近平解放思想改革创新再接再厉谱写陕西高质量发展新篇章,2021-09-16,中共中央总书记、国家主席、中央军委主席习近平近日在陕西省榆林市考察时强调，要坚决落实党中央决策部署，坚持稳中求进工作总基调，完整、准确、全面贯彻新发展理念，弘扬光荣革命传统，解放思想、改革创新、再接再厉，切实抓好统筹疫情防控和经济社会发展各项工作，更好统筹发展和安全，更好服务和融入新发展格局，谱写陕西高质量发展新篇章。。9月13日至14日，习近平在陕西省委书记刘国中、省长赵一德陪同下，深入企业、农村、学校、革命旧址等进行调研。。9月13日至14日，中共中央总书记、国家主席、中央军委主席习近平在陕西省榆林市考察。这是13日上午，习近平在国家能源集团榆林化工有限公司中心控制室考察。新华社记者 李学仁 摄。13日上午，习近平首先来到国家能源集团榆林化工有限公司，了解循环经济煤炭综合利用项目规划建设运行情况。在中心控制室，习近平观看项目产品展示，对企业坚持创新发展，坚持安全、稳定、清洁运行的做法表示肯定。随后，习近平到年产40万吨乙二醇项目现场察看，询问煤化工深度发展有关情况，同企业职工代表亲切交流。他强调，榆林是国家重要能源基地，为国家经济社会发展作出了重要贡献。煤炭作为我国主体能源，要按照绿色低碳的发展方向，对标实现碳达峰、碳中和目标任务，立足国情、控制总量、兜住底线，有序减量替代，推进煤炭消费转型升级。煤化工产业潜力巨大、大有前途，要提高煤炭作为化工原料的综合利用效能，促进煤化工产业高端化、多元化、低碳化发展，把加强科技创新作为最紧迫任务，加快关键核心技术攻关，积极发展煤基特种燃料、煤基生物可降解材料等。。13日下午，习近平前往米脂县银州街道高西沟村考察调研。山谷间果园、林地、梯田、淤地坝错落有致，初秋的黄土高原一片绿意盎然。途中，习近平临时下车走进田间，察看谷子、糜子、玉米长势，同正在田间劳作的老乡拉家常，询问他们生产经营、家庭收入、医疗保障、子女上学就业等情况。在高西沟村龙头山山顶，习近平听取了陕西省生态文明建设和高西沟村探索黄土丘陵沟壑区综合治理情况介绍。习近平指出，高西沟村是黄土高原生态治理的一个样板，你们坚持不懈开展生态文明建设、与时俱进发展农村事业，路子走的是对的。要深入贯彻绿水青山就是金山银山的理念，把生态治理和发展特色产业有机结合起来，走出一条生态和经济协调发展、人与自然和谐共生之路。。离开高西沟村，习近平来到位于米脂县城东南的杨家沟革命旧址。1947年底，毛泽东同志率领中央机关来到杨家沟村，在这里战斗生活了4个多月，指挥了全国解放战争和西北战场，领导开展土地改革运动。习近平参观中共中央“十二月会议”旧址、毛泽东旧居、周恩来旧居等，追忆革命历史，缅怀革命先辈丰功伟绩。习近平强调，政策和策略是党的生命。一百年来，我们党之所以能够统一思想、统一步调、团结一致向前进，之所以能够取得革命、建设、改革的伟大胜利和辉煌成就，就在于我们党坚持马克思主义指导，高瞻远瞩、见微知著，既解决现实问题，又解决战略问题，准确判断和把握形势，制定切合实际的目标任务、政策策略。要始终坚持和完善党的领导，不断提高党科学执政、民主执政、依法执政水平，充分发挥党总揽全局、协调各方的领导核心作用。要坚持马克思主义基本原理，用马克思主义观察时代、把握时代、引领时代，同时坚持实事求是，从我国实际出发，不断推进马克思主义中国化、时代化。习近平指出，要充分运用红色资源，深化党史学习教育，赓续红色血脉。,政府领导到其他城市考察学习或访问,0.0,True
云南省,重大决策解读云南东行问道长三角取到哪些真经,2016-04-29,【导读】4月20日11时，一架飞往上海的航班从昆明长水机场起飞，由省委书记李纪恒、省长陈豪率领的云南省党政代表团正式开启赴上海、江苏、浙江的考察学习活动。6天的时间里，代表团马不停蹄，收获满满，成果丰硕。他们去了哪些地方？签了哪些协议？学习到了哪些经验？让云南网一分钟带你看明白。。国务院部门网站 外交部 国防部 国家发展和改革委员会 教育部 科学技术部 工业和信息化部 国家民族事务委员会 公安部 国家安全部 民政部 司法部 财政部 人力资源和社会保障部 自然资源部 生态环境部 住房和城乡建设部 交通运输部 水利部 农业农村部 商务部 文化和旅游部 国家卫生健康委员会 退役军人事务部 应急管理部 人民银行 审计署 国家语言文字工作委员会 国家航天局 国家原子能机构 国家外国专家局 国家海洋局 国家核安全局 国家乡村振兴局 国务院国有资产监督管理委员会 海关总署 国家税务总局 国家市场监督管理总局 国家金融监督管理总局 中国证券监督管理委员会 国家广播电视总局 国家体育总局 国家信访局 国家统计局 国家知识产权局 国家国际发展合作署 国家医疗保障局 国务院参事室 国家机关事务管理局 国家反垄断局 国家认证认可监督管理委员会 国家标准化管理委员会 国家新闻出版署（国家版权局） 国家宗教事务局 国务院研究室 国务院侨务办公室 国务院港澳事务办公室 国务院台湾事务办公室 国家互联网信息办公室 国务院新闻办公室 新华通讯社 中国科学院 中国社会科学院 中国工程院 国务院发展研究中心 中央广播电视总台 中国气象局 国家行政学院 国家粮食和物资储备局 国家能源局 国家数据局 国家国防科技工业局 国家烟草专卖局 国家移民管理局 国家林业和草原局 国家铁路局 中国民用航空局 国家邮政局 国家文物局 国家中医药管理局 国家疾病预防控制局 国家矿山安全监察局 国家消防救援局 国家外汇管理局 国家药品监督管理局。各省市政府网站 北京 天津 河北 山西 内蒙古 辽宁 吉林 黑龙江 上海 江苏 浙江 安徽 福建 江西 山东 河南 湖北 湖南 广东 广西 海南 重庆 四川 贵州 云南 西藏 陕西 甘肃 青海 宁夏 新疆 香港 澳门 台湾 新疆生产建设兵团。省政府部门网站 云南省发展和改革委员会 云南省工业和信息化厅 云南省教育厅 云南省科学技术厅 云南省民族宗教事务委员会 云南省公安厅 云南省民政厅 云南省司法厅 云南省财政厅 云南省人力资源和社会保障厅 云南省自然资源厅 云南省生态环境厅 云南省住房和城乡建设厅 云南省交通运输厅 云南省农业农村厅 云南省水利厅 云南省商务厅 云南省文化和旅游厅 云南省卫生健康委员会 云南省退役军人事务厅 云南省应急管理厅 云南省审计厅 云南省人民政府外事办公室 云南省人民政府国有资产监督管理委员会 云南省人民政府研究室 云南省市场监督管理局 云南省广播电视局 云南省能源局 云南省林业和草原局 云南省体育局 云南省统计局 云南省机关事务管理局 云南省信访局 云南省滇中引水工程建设管理局 云南省人民政府国防动员办公室 云南省医疗保障局 云南省粮食和物资储备局 云南省监狱管理局 云南省戒毒管理局 云南省药品监督管理局,政府领导到其他城市考察学习或访问,0.563714469409656,True
云南省,省政府党组扩大会议强调高质量组织开展党纪学习教育推动全面从严治党向纵深发展,2024-04-15,省政府党组（扩大）会议强调 高质量组织开展党纪学习教育 推动全面从严治党向纵深发展。4月15日，省政府党组书记、省长王予波主持召开省政府党组第39次（扩大）会议，传达学习习近平总书记近期重要讲话精神，落实省委工作要求，研究部署党纪学习教育工作。。会议指出，要深学笃行习近平总书记关于党的自我革命的重要思想，认真贯彻中央政治局会议精神，切实增强接受巡视监督的政治自觉，不折不扣抓好巡视整改任务落实，确保总书记重要指示批示精神和党中央决策部署落实落地。要深入整治省委巡视中发现的省属企业突出问题，持之以恒做强做优做大国有企业。要认真整改各类审计监督指出的问题，把整改成效转化为推动工作、促进发展的强大动力。。会议集体学习习近平总书记关于党纪学习教育的重要讲话和重要指示批示精神，学习中办通知和中央、省委有关会议精神，审议省政府党组领导班子有关工作方案。会议强调，开展党纪学习教育是加强党的纪律建设、推动全面从严治党向纵深发展的重要举措，是维护党的团结统一、确保令行禁止的必然要求，是凝聚干事创业精气神、激励干部担当作为的重要保证。我们要站在坚定拥护“两个确立”、坚决做到“两个维护”的政治高度，高质量组织开展党纪学习教育，把握目标要求，突出学习重点，从严从实推进，做到学纪、知纪、明纪、守纪，永葆忠诚干净担当的政治品格。要把开展党纪学习教育同学习贯彻总书记考察云南重要讲话和重要指示批示精神、落实党中央决策部署及省委工作要求结合起来，同深化“两场革命”、持续整治形式主义为基层减负结合起来，同完成全年目标任务结合起来，注重融入日常、抓在经常，以严明的纪律护航改革发展稳定各项事业行稳致远。。会议要求，要认真学习贯彻习近平总书记在参加首都义务植树活动时的重要讲话精神，坚持扩绿、兴绿、护绿并举，抓实森林草原防灭火，推进绿美云南建设，大力发展现代林业，不断增厚“绿色家底”。。国务院部门网站 外交部 国防部 国家发展和改革委员会 教育部 科学技术部 工业和信息化部 国家民族事务委员会 公安部 国家安全部 民政部 司法部 财政部 人力资源和社会保障部 自然资源部 生态环境部 住房和城乡建设部 交通运输部 水利部 农业农村部 商务部 文化和旅游部 国家卫生健康委员会 退役军人事务部 应急管理部 人民银行 审计署 国家语言文字工作委员会 国家航天局 国家原子能机构 国家外国专家局 国家海洋局 国家核安全局 国家乡村振兴局 国务院国有资产监督管理委员会 海关总署 国家税务总局 国家市场监督管理总局 国家金融监督管理总局 中国证券监督管理委员会 国家广播电视总局 国家体育总局 国家信访局 国家统计局 国家知识产权局 国家国际发展合作署 国家医疗保障局 国务院参事室 国家机关事务管理局 国家反垄断局 国家认证认可监督管理委员会 国家标准化管理委员会 国家新闻出版署（国家版权局） 国家宗教事务局 国务院研究室 国务院侨务办公室 国务院港澳事务办公室 国务院台湾事务办公室 国家互联网信息办公室 国务院新闻办公室 新华通讯社 中国科学院 中国社会科学院 中国工程院 国务院发展研究中心 中央广播电视总台 中国气象局 国家行政学院 国家粮食和物资储备局 国家能源局 国家数据局 国家国防科技工业局 国家烟草专卖局 国家移民管理局 国家林业和草原局 国家铁路局 中国民用航空局 国家邮政局 国家文物局 国家中医药管理局 国家疾病预防控制局 国家矿山安全监察局 国家消防救援局 国家外汇管理局 国家药品监督管理局,其他,0.7750734766920654,True
