province,topic,date,content,label,score,is_match
云南省,云南省主要领导干部学习贯彻党的十九届四中全会和习近平总书记考察云南重要讲话精神研讨班结业在学思用贯通知信行统一上带好头做表率,2020-07-24,云南省主要领导干部学习贯彻党的十九届四中全会和 习近平总书记考察云南重要讲话精神研讨班结业 在学思用贯通知信行统一上带好头做表率。7月23日，全省主要领导干部学习贯彻党的十九届四中全会和习近平总书记考察云南重要讲话精神研讨班结业。省委副书记王予波作培训小结讲话时强调，努力在深学细研、联系实际上下功夫，在学思用贯通、知信行统一上带好头、做表率，沿着习近平总书记指引的方向前进，奋力谱写好中国梦的云南篇章。。王予波指出，省委书记陈豪在研讨班上的讲话政治性、思想性、指导性都很强，充分体现了省委坚决贯彻习近平总书记重要讲话精神的政治自觉和政治担当。。王予波强调，要提高政治站位抓落实，按照习近平总书记对云南作出的四个方面重要指示，排除万难、奋勇前进。要坚持目标导向抓落实，围绕云南发展“三个定位”明确努力方向，既为一域争光，又为全局添彩。要坚持问题导向抓落实，善于发现问题、敢于揭示问题、深入研究问题、着力解决问题，在破解问题中推动工作、发展事业、造福群众。要坚持结果导向抓落实，强化责任担当，抓好跟踪问效，以奋勇争先的姿态开创发展新格局。。国务院部门网站 外交部 国防部 国家发展和改革委员会 教育部 科学技术部 工业和信息化部 国家民族事务委员会 公安部 国家安全部 民政部 司法部 财政部 人力资源和社会保障部 自然资源部 生态环境部 住房和城乡建设部 交通运输部 水利部 农业农村部 商务部 文化和旅游部 国家卫生健康委员会 退役军人事务部 应急管理部 人民银行 审计署 国家语言文字工作委员会 国家航天局 国家原子能机构 国家外国专家局 国家海洋局 国家核安全局 国家乡村振兴局 国务院国有资产监督管理委员会 海关总署 国家税务总局 国家市场监督管理总局 国家金融监督管理总局 中国证券监督管理委员会 国家广播电视总局 国家体育总局 国家信访局 国家统计局 国家知识产权局 国家国际发展合作署 国家医疗保障局 国务院参事室 国家机关事务管理局 国家反垄断局 国家认证认可监督管理委员会 国家标准化管理委员会 国家新闻出版署（国家版权局） 国家宗教事务局 国务院研究室 国务院侨务办公室 国务院港澳事务办公室 国务院台湾事务办公室 国家互联网信息办公室 国务院新闻办公室 新华通讯社 中国科学院 中国社会科学院 中国工程院 国务院发展研究中心 中央广播电视总台 中国气象局 国家行政学院 国家粮食和物资储备局 国家能源局 国家数据局 国家国防科技工业局 国家烟草专卖局 国家移民管理局 国家林业和草原局 国家铁路局 中国民用航空局 国家邮政局 国家文物局 国家中医药管理局 国家疾病预防控制局 国家矿山安全监察局 国家消防救援局 国家外汇管理局 国家药品监督管理局。各省市政府网站 北京 天津 河北 山西 内蒙古 辽宁 吉林 黑龙江 上海 江苏 浙江 安徽 福建 江西 山东 河南 湖北 湖南 广东 广西 海南 重庆 四川 贵州 云南 西藏 陕西 甘肃 青海 宁夏 新疆 香港 澳门 台湾 新疆生产建设兵团。省重要机构网站 省委统战部 省委政法委员会 省委省直机关工委 省委机构编制办公室 云南省投资促进局 云南省社会科学院 云南省农业科学院 云南省文史研究馆 云南省供销合作社 云南省地方志编纂委员会办公室 昆明海关 云南省税务局 国家统计局云南调查总队 商务部驻昆明特派员办事处 省妇联 省残疾人联合会 云南共青团 信用云南 云南省政府采购 云南标准化服务信息网 云南省对外投资合作网 云南省图书馆 云南人才 云南招考频道 云南省高校毕业生智慧就业平台 云南电子口岸,其他,0.6609416765355086,True
云南省,王予波率队在海南省学习调研时强调学习先进经验推动改革创新加快建设世界级多样性生态旅游目的地,2021-05-09,王予波率队在海南省学习调研时强调 学习先进经验 推动改革创新 加快建设世界级多样性生态旅游目的地。5月7日至8日，省委副书记、省长王予波在参加首届中国国际消费品博览会后，率队到海南省部分市学习调研，强调要深入贯彻落实习近平新时代中国特色社会主义思想和习近平总书记考察云南重要讲话精神，学习先进经验，深化交流合作，推动改革创新，加快建设世界级多样性生态旅游目的地。。王予波一行先后到海口市观澜湖旅游园区、琼海市中国（海南）南海博物馆、博鳌亚洲论坛永久会址、博鳌乐城国际医疗旅游先行区、博鳌中法康复中心、三亚亚特兰蒂斯酒店、国际免税城等地，学习调研文旅融合、现代医疗健康、免税产业等情况。。王予波指出，海南省在推进全面深化改革、扩大对外开放和中国特色自由贸易港建设方面的做法和经验，值得云南认真学习借鉴。要学习海南“敢闯敢试、敢为人先、埋头苦干”的特区精神，解放思想、大胆探索，加快推动我国面向南亚东南亚辐射中心建设取得新成效。要学习借鉴博鳌乐城国际医疗旅游先行区经验做法，促进旅游与文化体育、健康医疗、养老养生等深度融合，加快推进云南国际康养旅游示范区建设。要学习借鉴博鳌亚洲论坛成功经验，提高我省办展办会水平，高标准高质量做好COP15筹备工作。。王予波还与中国旅游集团有限公司董事长万敏在三亚市举行了工作座谈。王予波对中国旅游集团给予云南经济社会发展特别是脱贫攻坚的大力支持表示感谢。双方围绕携手打造世界一流健康生活目的地、促进云南旅游产业转型升级、助力乡村振兴，推进相关合作项目等进行了深入交流。。国务院部门网站 外交部 国防部 国家发展和改革委员会 教育部 科学技术部 工业和信息化部 国家民族事务委员会 公安部 国家安全部 民政部 司法部 财政部 人力资源和社会保障部 自然资源部 生态环境部 住房和城乡建设部 交通运输部 水利部 农业农村部 商务部 文化和旅游部 国家卫生健康委员会 退役军人事务部 应急管理部 人民银行 审计署 国家语言文字工作委员会 国家航天局 国家原子能机构 国家外国专家局 国家海洋局 国家核安全局 国家乡村振兴局 国务院国有资产监督管理委员会 海关总署 国家税务总局 国家市场监督管理总局 国家金融监督管理总局 中国证券监督管理委员会 国家广播电视总局 国家体育总局 国家信访局 国家统计局 国家知识产权局 国家国际发展合作署 国家医疗保障局 国务院参事室 国家机关事务管理局 国家反垄断局 国家认证认可监督管理委员会 国家标准化管理委员会 国家新闻出版署（国家版权局） 国家宗教事务局 国务院研究室 国务院侨务办公室 国务院港澳事务办公室 国务院台湾事务办公室 国家互联网信息办公室 国务院新闻办公室 新华通讯社 中国科学院 中国社会科学院 中国工程院 国务院发展研究中心 中央广播电视总台 中国气象局 国家行政学院 国家粮食和物资储备局 国家能源局 国家数据局 国家国防科技工业局 国家烟草专卖局 国家移民管理局 国家林业和草原局 国家铁路局 中国民用航空局 国家邮政局 国家文物局 国家中医药管理局 国家疾病预防控制局 国家矿山安全监察局 国家消防救援局 国家外汇管理局 国家药品监督管理局。各省市政府网站 北京 天津 河北 山西 内蒙古 辽宁 吉林 黑龙江 上海 江苏 浙江 安徽 福建 江西 山东 河南 湖北 湖南 广东 广西 海南 重庆 四川 贵州 云南 西藏 陕西 甘肃 青海 宁夏 新疆 香港 澳门 台湾 新疆生产建设兵团,政府领导到其他城市考察学习或访问,0.8328355751537044,True
云南省,云南跨越式发展专题培训班学以致用大胆创新推动跨越发展,2015-09-28,这期培训班为期6天半，部分省直有关部门主要负责同志和州市、县（市、区）党政负责人参加了培训。在省委组织部、省委党校、省发改委的组织和安排下，培训班紧紧围绕学习贯彻习近平总书记考察云南重要讲话精神，结合“三个定位”和“跨越式发展”要求，本着“缺什么、补什么”和“学以致用”的原则进行了课程设置。学习内容包括当前最前沿、最热点的理论和实践，并与学员的实际工作紧密联系，针对性、指导性很强。培训过程中，学员们认真学习了省委书记李纪恒和省委副书记、省长陈豪所作的专题辅导报告，为做好今后工作、推动跨越发展理清了思路，明确了任务。工信部、财政部、商务部、国务院国资委、国务院发展研究中心、国务院研究室、中国信息通信研究所、北京大学、上海财经大学的领导和专家学者，针对中国制造与云南选择、PPP模式与激活社会资本、新一轮改革开放与云南辐射中心建设、国有资本运营管理、经济新常态、当前经济形势与主要任务、互联网+、当前宏观金融形势、当前金融形势与产业发展等9个专题课程为大家作了讲授和分析。23日至24日，由高树勋带队，学员们赴广西，实地考察广西经济社会发展情况，学习借鉴广西成功的发展经验，着力研究区域定位、产业选择、产业集群发展和产业转型升级等重要问题。。培训小结中，高树勋要求学员们要学以致用，充分运用所学的新知识、新理论，认真借鉴先进地区的经验和做法，紧密结合本地区、本部门工作实际，真正把学习的成果转化为推动云南跨越式发展的强大动力；要扎实推进发展，抓住“闯”、“跨”、“发”3个字，以更广的视野、更高的定位来谋划跨越式发展的新思路、新举措，努力实现“三个定位”的目标要求；要抓住当前“一带一路”、长江经济带、孟中印缅经济走廊、大湄公河次区域合作及泛珠三角区域合作等重大战略在云南交汇叠加的发展机遇，担起推动所在地区和部门跨越发展的责任，大胆创新，奋力闯出一条跨越式发展的路子来。。学员们表示，要把这次培训的成果带回去，运用到实际工作中，进一步加强和改进各项工作，切实把干部群众的主动性、积极性调动起来，发挥思想先导作用，形成上下一致谋发展、促跨越的生动局面，推动经济社会全面协调可持续发展，共同谱写好中国梦的云南篇章。。各省市政府网站 北京 天津 河北 山西 内蒙古 辽宁 吉林 黑龙江 上海 江苏 浙江 安徽 福建 江西 山东 河南 湖北 湖南 广东 广西 海南 重庆 四川 贵州 云南 西藏 陕西 甘肃 青海 宁夏 新疆 香港 澳门 台湾 新疆生产建设兵团。省政府部门网站 云南省发展和改革委员会 云南省工业和信息化厅 云南省教育厅 云南省科学技术厅 云南省民族宗教事务委员会 云南省公安厅 云南省民政厅 云南省司法厅 云南省财政厅 云南省人力资源和社会保障厅 云南省自然资源厅 云南省生态环境厅 云南省住房和城乡建设厅 云南省交通运输厅 云南省农业农村厅 云南省水利厅 云南省商务厅 云南省文化和旅游厅 云南省卫生健康委员会 云南省退役军人事务厅 云南省应急管理厅 云南省审计厅 云南省人民政府外事办公室 云南省人民政府国有资产监督管理委员会 云南省人民政府研究室 云南省市场监督管理局 云南省广播电视局 云南省能源局 云南省林业和草原局 云南省体育局 云南省统计局 云南省机关事务管理局 云南省信访局 云南省滇中引水工程建设管理局 云南省人民政府国防动员办公室 云南省医疗保障局 云南省粮食和物资储备局 云南省监狱管理局 云南省戒毒管理局 云南省药品监督管理局,政府领导到其他城市考察学习或访问,0.8461844538853128,True
云南省,习近平在河北承德考察时强调贯彻新发展理念弘扬塞罕坝精神努力完成全年经济社会发展主要目标任务,2021-08-26,习近平在河北承德考察时强调：贯彻新发展理念弘扬塞罕坝精神 努力完成全年经济社会发展主要目标任务。习近平在河北承德考察时强调 贯彻新发展理念弘扬塞罕坝精神 努力完成全年经济社会发展主要目标任务。中共中央总书记、国家主席、中央军委主席习近平近日在河北省承德市考察时强调，要全面落实党中央决策部署，坚持稳中求进工作总基调，完整、准确、全面贯彻新发展理念，弘扬塞罕坝精神，切实抓好统筹疫情防控和经济社会发展各项工作，更好统筹发展和安全，推动高质量发展，努力完成全年经济社会发展主要目标任务，实现“十四五”良好开局。。8月23日至24日，习近平在河北省委书记王东峰、省长许勤陪同下，深入国有林场、文物保护单位、农村、社区等进行调研。。8月23日至24日，中共中央总书记、国家主席、中央军委主席习近平在河北省承德市考察。这是23日下午，习近平在塞罕坝机械林场月亮山考察。新华社记者 谢环驰 摄。23日下午，习近平首先考察了位于河北省最北部的塞罕坝机械林场。八月的塞罕坝，林海苍翠连绵。林场始建于1962年。近60年来，塞罕坝林场的建设者们听从党的召唤，在“黄沙遮天日，飞鸟无栖树”的荒漠沙地上艰苦奋斗、甘于奉献，创造了荒原变林海的人间奇迹。习近平来到海拔1900米的月亮山，远眺林场自然风貌，听取河北省统筹推进山水林田湖草沙系统治理和塞罕坝机械林场情况介绍，对林场打造人防、技防、物防相结合的一体化资源管护体系，守护森林资源安全取得的成绩给予肯定。习近平强调，我国人工林面积世界第一，这是非常伟大的成绩。塞罕坝成功营造起百万亩人工林海，创造了世界生态文明建设史上的典型，林场建设者获得联合国环保最高荣誉——地球卫士奖，机械林场荣获全国脱贫攻坚楷模称号。希望你们珍视荣誉、继续奋斗，在深化国有林场改革、推动绿色发展、增强碳汇能力等方面大胆探索，切实筑牢京津生态屏障。月亮山上建有集防火瞭望和资源管护为一体的望海楼。习近平亲切看望驻守望海楼13年的护林员刘军、王娟夫妇，并登上望海楼，详细了解他们的日常工作和饮食起居情况，称赞他们默默坚守、无私奉献，守护了塞罕坝生态安全。。尚海纪念林位于塞罕坝机械林场原马蹄坑造林会战区，是百万亩林海起源地。习近平来到这里，沿木栈道步行察看林木长势，了解动植物保护等情况。习近平对林场的工作给予肯定，并再三叮嘱，防火责任重于泰山，要处理好防火和旅游的关系，坚持安全第一，切实把半个多世纪接续奋斗的重要成果抚育好、管理好、保障好。要加强林业科研，推动林业高质量发展。离开纪念林前，习近平同林场三代职工代表亲切交流，询问他们工作生活情况，共话林场沧桑巨变，共谋林场未来发展。习近平强调，塞罕坝林场建设史是一部可歌可泣的艰苦奋斗史。你们用实际行动铸就了牢记使命、艰苦创业、绿色发展的塞罕坝精神，这对全国生态文明建设具有重要示范意义。抓生态文明建设，既要靠物质，也要靠精神。要传承好塞罕坝精神，深刻理解和落实生态文明理念，再接再厉、二次创业，在实现第二个百年奋斗目标新征程上再建功立业。。24日上午，习近平考察了承德避暑山庄。承德避暑山庄始建于1703年，是第一批全国重点文物保护单位，被列入世界遗产名录。习近平察看山庄主要建筑和旅游服务设施，详细了解山庄历史和文物保护工作。习近平指出，我国是世界文化和自然遗产大国。承德避暑山庄底蕴深厚，在民族交往交流交融、宗教与社会相适应、传统文化保护和传承、人与自然和谐相处等方面具有重要历史价值和时代意义。要保护好、传承好、利用好中华优秀传统文化，挖掘其丰富内涵，以利于更好坚定文化自信、凝聚民族精神。游客们纷纷向总书记问好，习近平向大家挥手致意。,不属于政府领导到其他城市考察学习的新闻,0.5942779139959329,True
云南省,中共云南省委关于制定云南省国民经济和社会发展第十四个五年规划和二三五年远景目标的建议提出找准定位深度融入新发展格局,2021-01-07,《中共云南省委关于制定云南省国民经济和社会发展第十四个五年规划和二〇三五年远景目标的建议》提出—— 找准定位 深度融入新发展格局。“十三五”收官在即，“十四五”即将启程，中国正进入新的发展阶段，迎来中华民族伟大复兴历史进程新的重大跨越。。“全省各地区各部门要深入学习贯彻党的十九届五中全会精神，全面把握新发展阶段，坚定不移贯彻新发展理念，着力构建新发展格局，推动经济社会高质量发展，为实现第二个百年奋斗目标、实现中华民族伟大复兴的中国梦作出云南贡献。”立足新发展阶段，谋划云南未来发展蓝图，省委十届十一次全会通过的《中共云南省委关于制定云南省国民经济和社会发展第十四个五年规划和二〇三五年远景目标的建议》（以下简称《建议》）作出战略布局，令人瞩目、值得期待。。深度融入新发展格局，关键要正确认识和把握云南在全国发展大局中的地位和作用，深入研究分析云南的比较优势，找准定位、明确目标：成为部分领域先进制造节点，成为加工贸易梯度转移重点承接地，成为要素循环重要节点，成为国内国际深化合作的桥梁纽带，增强对南亚和东南亚的辐射力和带动力。。展望未来五年乃至更长一段时期，云南将努力打造强大国内市场与南亚东南亚国际市场之间的战略纽带，成为“大循环、双循环”的重要支撑，在我国未来发展中扮演重要角色。。构建以国内大循环为主体、国内国际双循环相互促进的新发展格局，是习近平总书记和党中央着眼“两个大局”，根据我国发展阶段、环境、条件变化，特别是基于我国比较优势变化，审时度势作出的重大决策，也是适应我国发展新阶段要求、塑造国际经济合作和竞争新优势的必然选择，这对“十四五”时期发展具有纲举目张的重大意义。。“党中央提出构建新发展格局，是实现全方位全要素、更高层次更高效率的大循环，是事关全局的系统性、深层次变革，这既给云南提供了又一次历史性重大机遇，又提出了新的更高要求。”省委书记阮成发在省委十届十一次全会指出，从云南“三个定位”特别是建设我国面向南亚东南亚辐射中心的内涵看，与党中央构建新发展格局的战略决策一脉相承，是国家构建新发展格局“大棋局”的重要组成部分，进一步突出了云南发展的历史使命和时代责任，云南完全可以也必须在深度融入新发展格局中有所作为、大有作为。。《建议》深入分析了云南在国内大循环、国内国际双循环中的位置和比较优势，找准云南深度融入新发展格局的发力点和突破口，提出打造国内大循环、国内国际双循环的战略链接点和重要支撑点，并从产业、互联互通、国际物流、国际贸易、金融开放、科技等领域作出部署，全面提升云南在国内国际“大循环、双循环”中的嵌入度、贡献度和价值链地位。。经济总量实现历史性突破，迈上2万亿元台阶，在全国的排位前移5位；地区生产总值和城乡居民收入提前实现比2010年“翻一番”的目标；556.06万建档立卡贫困人口全面脱贫，脱贫攻坚取得决定性成就；基础设施建设实现历史性突破，5年新增高速公路里程5000公里……回顾“十三五”时期，云南经济社会取得跨越式发展，全省综合交通、产业基础、资源条件、生态环境、改革创新、对外开放等正逐步形成协同效应，发展方向目标思路措施更加明确，发展基础更加厚实，发展动力更加强劲。特别是随着以国内大循环为主体、国内国际双循环相互促进的新发展格局形成，“一带一路”建设、长江经济带发展、西部大开发等国家重大发展战略和政策在云南交汇叠加，我省独特的区位优势、资源优势、开放优势将更加凸显。。从《建议》提出的我省“十四五”时期经济社会发展主要目标来看，“面向南亚东南亚辐射中心建设迈出新步伐”被放到了更加优先、突出的位置。,政府领导到其他城市考察学习或访问,0.0,True
