province,topic,date,content,label,score,is_match
海南省,助力制度集成创新首批名首席创新官三亚上岗,2023-04-05,省第八次党代会(以下简称“省党代会”)提出一系列新论断、新部署、新要求，明确“一本三基四梁八柱”战略框架，科学描绘海南未来五年发展的宏伟蓝图，“做优做精三亚经济圈，打造国际旅游胜地、自由贸易港科创高地。”写入省党代会报告。。省委常委、三亚市委书记周红波在接受海南日报记者专访时表示，省委赋予三亚新使命，三亚将对标“当好转型发展的示范，打造国际旅游胜地和自由贸易港科创高地”要求，以党建为引领，以制度集成创新为抓手，着力打造“六个标杆”、建设“六个三亚”，为加快建设具有世界影响力的中国特色自由贸易港扛起三亚担当。。“省党代会报告以‘解放思想 开拓创新 团结奋斗 攻坚克难 加快建设具有世界影响力的中国特色自由贸易港’为主题，全面贯彻习近平总书记在海南考察时的重要讲话精神，主旨就是引领全省上下牢记习近平总书记的殷切嘱托，准确把握新的历史使命，始终胸怀‘两个大局’、心系‘国之大者’，以建设具有世界影响力的中国特色自由贸易港的实际成效回报党中央和总书记的亲切关怀。”周红波指出，贯彻落实省党代会精神，要与贯彻落实习近平总书记关于海南工作的系列重要讲话和指示批示精神，特别是总书记在海南考察时的重要讲话精神紧密结合起来，做到原原本本学、深入思考学、联系实际学，推动省党代会精神学深悟透做实、入脑入心见行动。。周红波表示，三亚市要迅速掀起学习宣传贯彻省党代会精神的热潮，各级党组织要通过理论学习中心组学习会、党支部“三会一课”、干部主体培训班等方式开展多种形式、分层分类的全覆盖学习研讨和专题培训，把学习宣传贯彻不断引向深入，引导广大党员干部群众把思想和行动、智慧和力量凝聚到省党代会的部署要求上来。。对标省党代会和省委书记沈晓明提出的“三亚要当好转型发展的示范，打造国际旅游胜地和自由贸易港科创高地”要求，周红波强调，三亚要持续聚焦“一中心、一城、一区、三重点”，坚持“四大主导产业”发展不动摇，以“三大工程”和“三个行动”为抓手，着力打造“六个标杆”、建设“六个三亚”，推动转型发展、提质升级，努力打造海南自由贸易港建设新标杆。。一要打造自贸港科创高地。举全市之力加快崖州湾科技城建设，全力推动崖州湾种子实验室创建国家实验室，助力国家打好种业翻身仗。瞄准“深海进入、深海探测、深海开发”关键技术和核心环节，争取海洋国家实验室深海基地落户，打造国家深海技术创新中心。努力建设“一室两基地五中心”科技创新主体框架和争当科技体制改革“试验田”。。二要建设国际旅游胜地。高标准布局建设一批大型文旅消费综合体，加快建设国际一流水平的免税购物中心和时尚消费中心，加快建设邮轮旅游试验区、游艇产业改革发展创新试验区，加快建设国内替代出境旅游和吸引消费回流目的地城市。。三要打造国家生态文明建设示范区。建立健全生态产品价值实现机制，建好国际碳排放权交易中心，深化生态环境六大专项整治，聚焦美丽乡村建设管理提升三年行动、“六水共治”以及环岛高铁、旅游公路沿线环境改造整治等，不断擦亮三亚生态环境“金字招牌”。。周红波说，要始终把政治建设摆在首位，坚定捍卫“两个确立”，不断增强“四个意识”、坚定“四个自信”、做到“两个维护”。牢固树立大抓基层的鲜明导向，以提升组织力为重点，全面提升基层党建阵地服务水平，加强新兴领域、新型业态党建工作，统筹推动各领域基层党组织全面进步、全面过硬。,其他,0.8383167988362462,True
海南省,乐东县积极抓好干部教育培训和人才工作,2010-08-03,海南日报海口6月22日讯（记者 陈蔚林）6月22日，在第35个国际禁毒日来临之际，我省“禁毒宣传进万家”活动暨毒品销毁启动仪式在海口举行。省委副书记、政法委书记、省禁毒委主任徐启方出席并讲话。省领导闫希军、张毅出席。。近年来，我省深入贯彻习近平总书记关于禁毒工作的重要指示精神，大力开展禁毒斗争，综合治理毒品问题，两轮禁毒三年大会战成效明显。本次活动依法销毁1.29吨各类毒品，各市县也将相继开展形式多样的禁毒宣传活动，彰显我省严厉打击毒品违法犯罪的坚定决心。。活动强调，要认真学习贯彻习近平总书记考察海南重要讲话精神，按照省第八次党代会部署，坚决打赢新一轮禁毒三年大会战收官之战；扎实开展“禁毒宣传进万家”活动，弘扬主旋律、传播正能量，讲好海南禁毒故事、发好海南禁毒声音，奋力建设平安法治、文明和谐的自由贸易港，以实际行动迎接党的二十大胜利召开。,其他,0.9629558421622456,True
海南省,我省组团赴南航集团考察推动与南航集团多领域深入合作,2020-07-29,沈晓明：牢记职责使命 坚决守好祖国南大门 -- 领导活动_海南自由贸易港_海南省人民政府网。海南日报永兴岛6月7日电(记者 况昌勋 特约记者 王江顺)近日，省委书记沈晓明在三沙市调研并主持召开座谈会，强调要深入学习贯彻习近平总书记考察海南重要讲话精神，按照省第八次党代会部署要求，牢记职责使命，坚决守好祖国南大门。。调研期间，沈晓明详细了解三沙市生态环境保护、社区建设、基础设施建设和民生保障等情况。座谈会上，沈晓明听取了三沙市工作汇报，对各项工作取得的成效给予肯定。他强调，要胸怀国之大者，不断增强系统思维，开展好各项工作。要坚持生态立市，推进“护蓝”“保滩”“增绿”“固碳”工作，筑牢生态屏障，精心呵护蓝色国土，让海更蓝、沙更白、岛礁更迷人。要加强与自由贸易港政策的衔接，推动经济社会发展。要加强党的领导，建强基层组织，严管厚爱干部，抓好风险防控，正风肃纪反腐，做到忠诚履行职责使命。,其他,0.8321384310674822,True
海南省,我省禁毒宣传进万家活动暨毒品销毁启动仪式举行,2022-06-23,省委常委会召开会议 以超常规的决心和力度应对超预期的困难 努力完成全年经济社会发展任务 -- 领导活动_海南自由贸易港_海南省人民政府网。海南日报海口9月8日讯(记者 况昌勋 特约记者 王江顺)9月8日，省委常委会召开会议，传达学习习近平总书记在7月28日中央政治局会议上的重要讲话，传达学习《中共中央、国务院转发〈国家发展和改革委员会关于上半年经济形势和做好下半年经济工作的建议〉的通知》，研究我省贯彻意见。省委书记沈晓明主持会议。。会议强调，当前我省疫情防控取得了重要成果，锻炼出团结一致、能打硬仗的队伍，淬炼出众志成城、一往无前的精气神，锤炼出斗志昂扬、勇夺胜利的信心，这是来之不易的宝贵财富，是推动海南全面深化改革开放和自由贸易港建设的精神力量。下一阶段，全省上下要进一步认真学习领会习近平总书记重要讲话精神，切实把思想和行动统一到中央关于经济形势的分析判断和对经济工作的决策部署上来，坚定信心，鼓足干劲，以超常规的决心和力度应对超预期的困难，努力完成全年经济社会发展任务。要坚持“外防输入、内防反弹”总策略和“动态清零”总方针不动摇，慎终如始做好疫情防控工作，持续巩固扩大防控成果，齐心协力打赢这场大仗。要加强组织领导，坚持经济社会发展和自由贸易港建设相统一、市县主体责任和省直部门统筹协调相统一、增收与节支相统一、抓今年与谋明年相统一，切实做到疫情要防住、经济要稳住、发展要安全。。会议传达学习习近平总书记在辽宁考察时的重要讲话精神，要求全省上下认真学习领会，在推进科技高水平自立自强、践行绿色发展理念、圆好百姓“幸福梦”、推动党史学习教育常态化长效化等方面下功夫，确保经济社会高质量发展。。会议传达学习《关于建立健全领导干部自然资源资产离任审计评价指标体系的意见》，要求结合海南陆海统筹、山海联动、资源融通的特点，科学制定我省评价指标体系，将审计结果作为干部考核、奖惩、任免的重要参考。。会议研究解决疫情防控期间农产品产供销车辆和人员通行难问题，强调要通过闭环管理、人员白名单、扫码验码等措施，保障农产品产供销车辆和人员合理有序流动，对层层加码、搞“一刀切”、损害农民利益的要严肃问责。,不属于政府领导到其他城市考察学习的新闻,0.5814327210364074,True
海南省,海南省有序推进营改增试点工作,2012-08-31,6月24日，由农业部国际交流服务中心主办的“中拉农业投资与经贸合作培训班”在琼海博鳌正式开班，来自我国16个省市区的农业有关部门及企业选派了40多位学员前来参加。农业部国际交流服务中心副主任蔡春河、海南省农业厅副厅长周燕华以及琼海市副市长郑庆智等领导出席开班仪式并分别讲话。。蔡春河副主任指出，中国与拉美农业各有特点，互补性强，合作潜力巨大，合作领域广阔，合作影响深远。拉美国家水土资源丰富、气候环境适宜、生产条件优越，素有世界粮仓美称，不少农产品极具特色、品质优良，深受中国消费者欢迎。他强调，开展本次培训的目的是让大家进一步了解拉美国家农业投资政策及经贸合作的有关情况，使大家以更加积极的态度、更加有力的举措，打造中拉农业合作更加美好的未来，为发展中国与拉美国家全面合作伙伴关系作出新的贡献。周燕华副厅长在致辞中说，通过本次系统的培训，必将提高各省市农业部门及企业的国际交流经验和应对能力，进一步推动我国与拉美国家的农业经贸往来与合作，她还特别给全体学员介绍我省关于海南农产品“两进两出”（即进宾馆进超市，出岛出口）的战略蓝图，并希望大家多交流经验、互相学习、取长补短、共同提高。。为期6天的培训除了围绕拉美概况、重点国家政策法规、拉美投资金融概况、外语交流技能培训等内容展开学习外，还组织全体学员到三亚兰花世界、保亭永基文昌鸡公司和兴隆植物园等企业进行实地考察。,其他,0.5321307481264592,True
海南省,沈晓明坚持一本三基四梁八柱战略框架加快建设具有世界影响力的中国特色自由贸易港,2022-04-27,冯飞会见澳门特别行政区行政长官贺一诚 -- 领导活动_海南自由贸易港_海南省人民政府网。海南日报博鳌4月20日电(记者 李磊)4月20日晚，省长冯飞在博鳌会见了澳门特别行政区行政长官贺一诚。。冯飞向贺一诚一行来琼出席博鳌亚洲论坛2022年年会表示欢迎。他说，当前海南全省上下正深入学习贯彻习近平总书记考察海南时的重要讲话精神，加快建设具有世界影响力的中国特色自由贸易港。希望与澳门加强交流沟通，在制度集成创新、金融、人才等领域充分借鉴澳门先进经验，开展务实合作。。贺一诚说，海南自贸港建设取得明显进展，澳门对此深受鼓舞。澳门经济社会发展与海南有广阔的合作空间，当前，澳门正努力降低疫情带来的影响，全力恢复经济，希望与海南在文化旅游、打造法治化营商环境等领域开展更深层次合作，实现合作共赢、共同发展。。外交部驻澳门特派员公署特派员刘显法，省委常委、统战部部长苻彩香，国务院港澳事务办公室有关负责人，省政府秘书长符宣朝，澳门特区政府和省有关部门负责人参加会见。,其他,0.6805659990267406,True
海南省,年海南褒扬纪念工作培训班在澄迈举办,2020-12-30,海南以“关键少数”示范带动“绝大多数”，确保党史学习教育走深走实_今日海南_海南省人民政府网。注重家风建设既是中华民族传统美德，也是中国共产党的优良传统。近日，省委书记沈晓明参加他所在的省委常委办党支部党史学习教育主题党日活动，参观“中国共产党人的家风”主题展，学习了解不同历史时期中国共产党人的家风故事。。省级领导干部以普通党员身份参加所在支部主题党日活动，是海南创新开展的“省领导党史学习教育‘十个一’主题活动”的内容之一。。党史学习教育开展以来，省委坚决贯彻落实习近平总书记在党史学习教育动员大会上的重要讲话精神和党中央部署要求，切实提高政治站位，扛起政治责任，始终把党史学习教育作为重大政治任务和重大政治责任来抓，坚持在顶层设计上下功夫，发挥领导干部“关键少数”作用，以上率下、高位推进，确保党史学习教育落地生效、走深走实。。省委高度重视党史学习教育，党史学习教育动员大会召开后，第一时间成立由沈晓明担任组长的省委党史学习教育领导小组(以下简称领导小组)，抽调相关单位精干人员开展集中办公，为全省党史学习教育开好局、起好步打下了坚实基础。。马不停蹄，全省党史学习教育动员大会、全省党史学习教育巡回指导工作会议、全省党史学习教育座谈会、市县党史学习教育推进会、省委党史学习教育领导小组(扩大)会议等先后召开，传达学习党中央部署要求，研究部署落实措施，交流学习经验做法，不断将党史学习教育引向深入;。紧锣密鼓，《关于扎实有序开展党史学习教育工作的通知》《关于做好党史学习教育指定用书发行和使用工作的通知》《海南省党史学习教育党史专题宣讲方案》等一系列通知密集下发，指导全省各地各部门把潜心自学作为重要基点、把集中学习作为重要方法、把现场学习作为重要形式突出抓好党史学习教育;。强化督导，10个巡回指导组及时成立，创新性地制定“一听、二看、三问”的巡回指导工作方法，针对不同层级、不同领域、不同对象开展督促指导，并通过召开协调会、见面会，以及电话沟通、建立微信工作群等多种形式，做到科学指导、严格把关，切实提高党史学习教育质量……。人们注意到，从全省党史学习教育动员大会到全省作风整顿建设年动员部署会，再到全省“查堵点、破难题、促发展”活动动员部署会;从儋州市歃血结盟纪念园到琼海市红色娘子军纪念园，再到参加所在党支部党史学习教育主题党日活动……沈晓明在多场活动、多个场合反复强调，要以高度政治自觉和行动自觉抓好党史学习教育，并对相关工作提出具体要求、作出具体部署。。军号响，万剑发，省级领导干部在政治站位上“先强”，在理论武装上“先学”，在调查研究上“先行”，党史学习教育在琼岛各地蓬勃开展。。从延安整风运动以来，我们党开展的历次集中教育活动，都以思想教育、理论学习打头，重点解决思想根子问题。。6月7日召开的省委党史学习教育领导小组(扩大)会议强调，要坚持在“学与悟”上再下功夫，坚持党员领导干部带头，继续把感悟思想伟力、强化理论武装摆在重要位置，探索行之有效的学习方式和办法，带着问题学、结合实际学，深学笃用习近平新时代中国特色社会主义思想。。率先垂范，党史学习教育开展以来，省委多次召开理论中心组学习会，深入学习贯彻习近平总书记关于学习党史的重要论述。3月19日党史学习教育中央宣讲团来琼宣讲时，省委还将宣讲报告会与省委理论中心组(扩大)学习会合并召开，并以视频形式将此会议开到各市县，确保统一思想、步调一致。。这次考察中，在粤琼两省领导见证下，广州市政府与海口市政府签署了战略合作框架协议。这一成果的取得，为海南知行合一开展党史学习教育写下了一笔生动的注脚。,其他,0.7600666261956325,True
海南省,李荣灿率团参加中国品牌日活动,2023-05-15,刘赐贵：做大做强海南特色自贸港会展业 加快国际旅游消费中心建设_省府要闻_海南省人民政府网。刘赐贵在海南国际会展中心二期扩建项目调研时要求 做大做强海南特色自贸港会展业 加快国际旅游消费中心建设。本报海口8月14日讯(记者 周元)8月13日上午，省委书记刘赐贵赴海南国际会展中心二期扩建项目现场，实地考察项目建设进展情况，现场研究自贸港会展业发展工作。刘赐贵强调，要认真学习贯彻习近平总书记“4·13”重要讲话、中央12号文件和《海南自由贸易港建设总体方案》精神，充分用好海南自贸港政策优势，坚持政府引导与市场参与相结合，加快会展业重大基础设施建设，放大会展业综合带动效应，积极引进和培育一批重大会展品牌，做大做强海南特色自贸港会展业，加快国际旅游消费中心建设。。8月13日，省委书记刘赐贵来到海南国际会展中心二期扩建项目现场，实地考察项目建设进展情况。海南日报记者 李英挺 摄。海南国际会展中心二期扩建项目总建筑面积约20.18万平方米，室内展览面积约7.5万平方米，项目建成后将与一期连接成为有机整体，达到12万平方米的展览面积，成为国内领先的现代化绿色智能会展场馆。在项目建设现场，刘赐贵详细了解展馆建设、规划布局和各项工程进展情况，对近年来会展业的迅速发展给予充分肯定。他说，会展业是现代服务业的重要组成部分，是省委省政府确定的十二个重点产业之一，市场前景广阔，特色优势明显，对推动海南自贸港建设具有重要作用。各级各部门要高度重视会展业发展，坚持政府引导与市场参与相结合，坚持科学规划、合理布局，推动会展业持续健康发展。。刘赐贵强调，会展产业是一个跨行业、跨区域的综合经济业态，对经济社会发展的拉动作用明显。海南拥有得天独厚的生态环境，还有独一无二的自贸港优惠政策，这些都对境内外客商形成了很强的吸引力。要用足用好自贸港有关政策，学习借鉴国内大型展会办展办会经验，积极争取各行业主管部门支持，精准开展招商对接，引进更多经营主体，打造具有国际影响力的知名会展品牌，广泛带动酒店、餐饮、旅游、交通、免税购物和贸易投资等领域协同发展。。刘赐贵指出，发展会展业不仅要重视会展基础设施等硬件建设，各级部门还要加强软件环境建设，自觉提供好服务保障，广泛听取企业意见，及时协调解决产业发展中的重大问题。要加强统筹规划，进一步提升周边交通等服务配套便利化程度，充分利用好剧院、体育馆、科研院所等资源，带旺人气、做大流量，力争天天有展览、天天有会议。他特别叮嘱，由于会展活动人流密集，一定要高度重视疫情防控和安全工作，毫不松懈落实防控措施，牢牢守住来之不易的疫情防控成果，统筹抓好常态化疫情防控和经济社会发展。,政府领导到其他城市考察学习或访问,0.0,True
海南省,年海南省中青年领导干部培训班结业,2020-08-14,4月8日至10日，中共中央总书记、国家主席、中央军委主席习近平在海南考察工作。8日下午，习近平在琼海市潭门镇渔民协会了解组织渔民生产等情况。 新华社记者 李学仁 摄。海南作为全国最大经济特区，后发优势多，发展潜力大，要以国际旅游岛建设为总抓手，闯出一条跨越式发展路子来，争创中国特色社会主义实践范例，谱写美丽中国海南篇章。。保护生态环境就是保护生产力，改善生态环境就是发展生产力。良好生态环境是最公平的公共产品，是最普惠的民生福祉。青山绿水、碧海蓝天是建设国际旅游岛的最大本钱，必须倍加珍爱、精心呵护。希望海南处理好发展和保护的关系，着力在“增绿”、“护蓝”上下功夫，为全国生态文明建设当个表率，为子孙后代留下可持续发展的“绿色银行”。。中共中央总书记、国家主席、中央军委主席习近平4月8日至10日在海南考察时强调，海南作为全国最大经济特区，后发优势多，发展潜力大，要以国际旅游岛建设为总抓手，闯出一条跨越式发展路子来，争创中国特色社会主义实践范例，谱写美丽中国海南篇章。。4月的海南，阳光璀璨，万木葱茏。习近平在出席博鳌亚洲论坛2013年年会有关活动后，在海南省委书记罗保铭、省长蒋定之陪同下，到琼海、三亚等地深入渔港、特色农业产业园、国际邮轮港考察调研。。一路上，习近平集中了解国际旅游岛建设的进展，实地调研海南转变经济发展方式、保障和改善民生、加强生态文明建设、转变工作作风的情况。他强调，加快建设国际旅游岛是中央的重大决策，也是海南的最大机遇和最强比较优势。要坚持以邓小平理论、“三个代表”重要思想、科学发展观为指导，认真贯彻党的十八大和十八届一中、二中全会精神，以更大的力度解放思想、深化改革、扩大开放，充分调动广大干部群众的积极性，通过锲而不舍、艰苦奋斗创造美好未来。。习近平十分关心海南生态文明建设，每到一地都要同当地干部共商生态环境保护大计。他指出，保护生态环境就是保护生产力，改善生态环境就是发展生产力。良好生态环境是最公平的公共产品，是最普惠的民生福祉。青山绿水、碧海蓝天是建设国际旅游岛的最大本钱，必须倍加珍爱、精心呵护。他希望海南处理好发展和保护的关系，着力在“增绿”、“护蓝”上下功夫，为全国生态文明建设当个表率，为子孙后代留下可持续发展的“绿色银行”。。习近平惦记着海南各族群众的生产生活。8日下午，他来到琼海市潭门镇看望渔民群众。自古以来，潭门渔民就远涉南海捕鱼为生，把南海称为“祖宗海”。习近平来到渔民协会了解组织渔民生产等情况，随后登上一艘从南海捕鱼归来的渔船，沿着狭窄通道察看鱼舱、驾驶室、休息室、厨房等地，询问渔民出海捕鱼和收入情况。“出去一次需要多少天？”“船上有多少人？”“捕的鱼主要是什么品种？”总书记问得十分详细。习近平同淳朴的渔民一一握手，祝愿他们家庭幸福、出海平安，收入越来越多，日子越过越好。习近平指出，抓民生要抓住人民最关心最直接最现实的利益问题，抓住最需要关心的人群，一件事情接着一件事情办、一年接着一年干，锲而不舍向前走。。习近平亲切看望了由潭门渔民组成的海上民兵连，看连史展览，听事迹介绍，勉励他们努力学习现代装备知识，提高作业能力，在带领渔民耕海致富的同时，积极做好收集远洋信息、支援岛礁建设等工作。。海南热带农业资源丰富，发展特色农业有得天独厚的条件。4月9日下午，习近平来到亚龙湾兰德玫瑰风情产业园考察。他对产业园实行“公司＋合作社＋农户”模式种植经营玫瑰花、示范带动农民增收致富的做法表示肯定。他强调，小康不小康，关键看老乡。要把中央制定的强农惠农富农政策贯彻落实好，使热带特色农业真正成为优势产业和海南经济的一张王牌，不断开创“三农”工作新局面。,政府领导到其他城市考察学习或访问,0.0,True
