province,topic,date,content,label,score,is_match
海南省,定安以项目推进为抓手推动干部在实战实干实践中提升能力,2022-11-11,海南加快推进自贸试验区和自贸港建设，深化对外交往与合作，构建全面开放新格局—— 开放新高地 潮涌海之南。“抢占先机。”最近，海南国际经济发展局推出全球投资服务热线4008-413-413，陆续接到来自美国、荷兰、加拿大、俄罗斯、新西兰、新加坡等国家投资者和机构的电话。这句话道出了许多企业家的共同心声。。新冠肺炎疫情影响之下，加快推进自贸港建设的海南，不断收获开放发展的讯息：国内外投资者积极投资海南，一批政策和措施在海南落地，外资外贸发展显现新亮点……一个个亮点中，透出海南发展的潜力和活力，也清晰可见海南加快推动开放的不懈努力。。“海南要坚持开放为先，实行更加积极主动的开放战略，加快建立开放型经济新体制，推动形成全面开放新格局。”“在这里，我郑重宣布，党中央决定支持海南全岛建设自由贸易试验区，支持海南逐步探索、稳步推进中国特色自由贸易港建设，分步骤、分阶段建立自由贸易港政策和制度体系。”2018年4月13日，在庆祝海南建省办经济特区30周年大会上，习近平总书记对海南进一步扩大对外开放提出了新的更高要求，也赋予了海南新的重大责任和使命。。习近平总书记发表“4·13”重要讲话以来，海南牢记总书记的嘱托，加快推进自由贸易试验区和自由贸易港建设，打造开放层次更高、营商环境更优、辐射作用更强的开放新高地，深化对外交往与合作，努力成为新时代全面深化改革开放的新标杆，在开放发展方面结出累累硕果。一个更加开放的海南，向着梦想奋力奔跑。。“要深入贯彻习近平总书记重要讲话精神和党中央决策部署，坚持质量优先，快字当头，全力实现‘三个确保’，充分体现自贸港速度。”省委书记刘赐贵强调。。开放发展，需要推动政策和措施落地——海南全力推动自贸港政策落地，紧抓自贸港政策研究和承接准备工作，力求早安排早收获。我省首批滚装运输平行进口汽车顺利抵港，国际航行船舶加注燃料油实行出口退（免）税等政策陆续在海南落地。。开放发展，呼唤全球投资者的参与——海南国际经济发展局推出全球投资服务热线， 海口江东新区推出全球投资服务热线，海招网上线22场网上招商推介会，海南自由贸易港官方网站上线， 海口“云”签约13个项目，三亚与8家龙头企业“云”签约一批重大产业项目……短时间内，新举措一个接一个，新合作一个接一个，为开放的海南蓄足后劲。。开放发展，期待项目快落地、企业有活力——英国哈罗公学等一批项目加快建设，重点外资外贸企业全部复工复产，部分企业业务量实现逆势增长。今年前2个月，海南实际利用外资同比增长100.94%。。省委书记刘赐贵反复强调，以习近平同志为核心的党中央赋予新时代海南全面深化改革开放的新使命，责任重大、使命光荣。全省广大干部一定要拿出“一天当三天用”“不惜脱几层皮”的干劲，紧锣密鼓、日夜兼程抓好学习贯彻落实，切实把全省干部群众的思想和行动统一到习近平总书记重要讲话精神上来。。自由贸易试验区、自由贸易港的本质和最大特色是开放，自由贸易港更是当今世界最高水平的开放形态。面对千载难逢的发展机遇，海南加快推进自贸试验区和自贸港建设，全面深化改革开放，加快建立开放型经济新体制。。思想开放是开放行动的先声。在海南，大学习、大宣传、大研讨广泛开展，各种主题的专题培训、专家授课、理论研讨相继召开，一轮轮有关思想大解放、观念大讨论的学习交流在海南广大干部群众中掀起热潮。。为了拓视野、学经验、促合作，2018年4月17日至19日，由省委常委带队，省委组织11个考察团分赴全国其他11个自由贸易试验区，考察学习各地区在深化体制机制改革、发展开放型经济、打造一流营商环境、激活创新创业要素等方面的好经验好做法。,政府领导到其他城市考察学习或访问,0.0,True
海南省,如何将绿水青山变金山银山儋州市海头镇老市村开启一场生态实践,2022-03-24,儋州科学引领 精准滴灌 因时因地因户施策 帮助贫困地区脱贫_市县_海南省人民政府网。北边，85%以上的火山岩裸露地表，上世纪七十年代搭建的石砌瓦房;中间，黄泥沟地貌，不靠山不濒海，人均耕地不足4分;南边，少数民族聚集区，指靠的主要经济来源是橡胶，而橡胶价格已多年连续低迷。。百万人口的城市，贫困地区人口有6万多人，占到我省贫困人口总数的12%以上，要立下怎样的愚公志，方能拔掉这穷根?。2015年，儋州全市减贫对象户均增收5600元，比上年同比增长34.3%。让贫困地区从拖“后腿”变成发展的有力“后劲”，儋州近年来在探求精准扶贫中解析了答案，示范出一道市县脱贫攻坚的实践样本。。自然资源禀赋并不十分突出的儋州，数十年来还面临着退场队划归地方管理、农业基础设施滞后、水利工程不畅等历史“肌瘤”。。因为缺水，雅星镇文山村委会大吉村人直至去年还在挑井水喝，村里人戏谑地说，“其他地方的扁担进了博物馆，我们村的扁担在挑农活。”。“鹅岛、饿倒”，雅星镇鹅岛村过去数十年一下暴雨就积水，小村子像一只鹅浮在水面，可因为退场队的农民们太贫困，小村子被调侃为“饿倒村”。。要填平历史欠账，并非易事，若要彻底拔掉穷根，则更要立下愚公移山之志，打下一场脱贫攻坚战!。“扶持谁”“扶什么”“怎么扶”?党的十八届五中全会提出2020年我国农村贫困人口全部脱贫是全面建成小康社会的基本标志。海南力争三年脱贫攻坚，两年巩固提升的总目标，让儋州明晰了全面小康普惠儋州的历史方向。。省委书记罗保铭指出，扶贫先扶智，治贫先治愚，要从根本上拔掉穷根，就要多管齐下精准扶贫，精准脱贫。。“精准”二字，就是改变过去“大水漫灌”式的粗放扶贫，从实际出发，精准滴灌，尊重群众意愿，避开“花架子”，找到脱贫致富的“金点子”。。儋州市委书记严朝君说，儋州采取得力措施，大力推行精准扶贫，把产业扶贫与扶智、扶志相融相合，变短期效果为可持续的长期效应，让老百姓真正共享发展成果。。对适宜发展特色产业的贫困地区，就要立足当地资源，先行解决道路、通电、通水、通网络等问题。充分认识扶贫瓶颈的儋州，从强筋骨、健体魄、夯实基础入手。近年来，儋州全市投入各项扶贫专项资金1.55亿元，建成饮水安全工程21宗，解决1.3万群众的喊渴问题，大雅水库建成贯通，引得汩汩清流;硬化176公里、222个村道路，解决近10万人的行路难。。东成镇福安村过去的砂土路，遇到雨天，越野车都开不进，如今路通财通，“南宝—光村”线贯通福安，不但让福安村大批的瓜菜常年顺畅出岛，村里还建立起一批特色养殖场，富裕了当地群众。。一束束灵芝在大棚里拔节似地生长，在光照下耀着几分灵气。靠养鸡供给有机肥料的莲雾果林，绿叶间舞动着一派清新。。精准扶贫，就是要找准特色下药方。正是盯准了鹅岛村相对良好的农业基础条件，儋州在鹅岛规划建设休闲度假观光农业，土鸡、毛木耳、灵芝等林下经济大力发展起来，仅两三年功夫，鹅岛村农民收入很快便扭转了颓势，今年一举突破人均收入8000元大关，比退场时人均增加了5000元，甩掉了贫困帽子。。精准扶贫，就是要增强贫困地区的造血功能。扶贫攻坚，不但要丰实农民的口袋，更要富裕农民的脑袋，“输血”过后，要让贫困农村都能“造血”，方可攻坚拔寨，啃下硬骨头。。蓝天白云映衬下，宽大的香蕉叶青翠欲滴。在儋州市大成镇新龙村，连片栽培1200亩橡胶苗后，农民们接连套种了香蕉苗。在新龙村，记者感受到了精准脱贫计划表单的细致，按计划，3年内农民每年在林地收获香蕉，3年后橡胶树长大砍掉老化蕉树，改养殖鸡猪等，推动林下经济不间断发展。,其他,0.9758132019548597,True
海南省,我省支乡村振兴工作队驻村一年多来共绘乡村振兴壮美画卷,2020-11-10,"突击整治——巩固成果——常态管理，这是“五大工程”战略实施的演进路线。在这一路线图中，交织着的，不仅是利益的冲突、道德的拷问，还有公民意识的觉醒和管理者革新的勇气。。在今年发起的全省环境综合整治大会战中，海口很“显眼”，原因并不单纯是来自媒体曝光的高频率，而是因为，从一开始，海口行动的力度和系统性就不同寻常。6月23日，海口在全省打响环境综合整治“第一枪”，正式启动“五大工程”，采取了全面开花、重点推进的方式，动辄上万人次的“地毯式清理”，就像是一把把篦子从城市的脏乱之处扫过，卫生死角、占道经营、乱停乱放、噪声污染、非法违建，无一“幸免”。。海口市副市长、市政市容管理委员会主任徐敏生坦言，城市环境问题在很大程度上影响了海口的形象。在今年市政府深入学习科学发展观活动中，群众意见最大的，就是城市环境脏乱差!为此，该市从2月份开始就已经部署环境整治行动，可以说，“五大工程”的整治，不是一时之计，是一起早有谋划的城市环境变革，并做好了长期坚持的准备。。海口“五大工程”的整治活动进行至今，已成为名副其实的“一把手”工程，构建了市、区、街道(镇)、社区四级网络。。丁村市场原先管理极不规范，曾被市民形容为全国最差的农贸市场。市场内菜头烂叶随处丢弃，污水横流。市场外乱摆乱卖，秩序混乱。经过这半年的环境整治，市民好评如潮。在市场门前疏导点卖水果的一位女摊主说，现在要求规范摆摊，摊主、顾客都注意不随意乱扔垃圾，环境确实比以前整洁多了。。在开展大规模集中突击整治行动同时，海口环境综合整治更重视制度化建设，力求整体提升，纵深推进。据介绍，目前该市已经完成《关于深入开展文明创建活动，推进环境综合整治“五大工程”实施方案》《海口市人民政府关于加强城市管理工作的意见》《海口市城市环境综合整治“五大工程”工作方案》《“五大工程”检查考评细则与问责规定》等108项各类制度规定，建立起了日检查、周通报、月评比、年考核的机制。。为借助新闻舆论的力量推动“五大工程”,海口市每月向媒体通报上月整治动态、各区排名等情况。排名最后的区政府主要领导向媒体说明原因并向市民道歉。此举在社会上引起很大反响，对各区触动很大。。另外，海口还在全市77条路段设置154块路段管理标志牌，4个区按照属地管理要求，明确三套班子的领导责任与分管路段，将路段管理成效与街道、居委会的领导责任相挂钩。因工作责任不落实、不作为、慢作为等原因，4个区已有35人被问责。。徐敏生认为，海口吸取过去的经验教训，将突击整治和长效管理有机结合，将“五大工程”为主要内容的环境综合整治视为一场没有“休战”期的持久战役。近半年的突击整治是对以前长期积留问题的必要清除，是所谓“治标”，真正的意图还是在建立长效机制，实现“治本”!。11月9日，海口市市政市容管理委员会挂牌成立，实现了城市管理“一体化”的模式，其担负全市城市管理综合执法、环境卫生、市政、园林、排水管道管养和城市市容环境综合整治等工作。。“大城管”的运行，是海口“做实”城市环境综合整治长效管理的革新举措，它将实现了一事一部门负责，从根本上杜绝徐唐先所痛斥的“6个部门管不好一条街”的现象。。而在此前，海口为建立城市环境管理的长效模式，在考察国内许多城市成功经验的基础上，开始引进“数字化城管”。该系统运用了现代化信息技术，将海口市4个区划分为3800个网格，将公共设施、道路交通、市容环境、园林绿化、房屋土地等五大类近27万个城市部件列入巡查范围。每天250名城管巡查员全城巡查，发现违章违规行为和脏乱差现象，立即上报指挥监督中心。",其他,0.9721241167449812,True
海南省,云龙改编同仇敌忾,2020-03-27,海南省政协六届五次会议隆重开幕 罗保铭刘赐贵李军到会祝贺 于迅作工作报告 王应际主持。2月19日上午9时，中国人民政治协商会议海南省第六届委员会第五次会议在省人大会堂开幕。记者 张杰 摄。本报海口2月19日讯（记者金昌波）又是春潮涌动时，琼州大地尽朝晖。今天上午，中国人民政治协商会议海南省第六届委员会第五次会议在省人大会堂隆重开幕。来自我省各党派团体、各族各界的省政协委员齐聚一堂，将紧紧围绕我省经济社会发展重大问题，积极咨政建言、共谋良策，为海南全面建设国际旅游岛、全面建成小康社会贡献智慧和力量。。省政协主席于迅，副主席赵莉莎、史贻云、陈莉、王应际、丁尚清、王勇，秘书长李言静在主席台前排就座。。省委书记、省人大常委会主任罗保铭，省委副书记、省长刘赐贵，省委副书记李军等在主席台就座，祝贺大会召开。。于迅代表政协海南省第六届委员会常务委员会，向大会作工作报告。报告从着力加强思想理论建设，始终坚持正确政治方向；围绕全省工作大局开展调研协商，全面提高履行职能的质量和水平；牢固树立履职为民理念，更好发挥政协民主监督作用；积极促进大团结大联合，广泛汇聚各方面智慧和力量；深入开展对外联谊和交往，进一步推动海南与“一带一路”沿线国家和地区的经济文化交流；统筹推进履职能力建设， 不断增强政协工作活力和成效等六个方面总结回顾了过去一年政协海南省第六届委员会常务委员会的工作。。于迅说，2016年，省政协认真落实年度协商工作计划，围绕我省医疗健康产业发展、“候鸟”人才问题、餐饮产业发展、打造王牌农业、美丽乡村建设、生态保护等工作，组织政协委员、专家学者、有关部门负责人深入实地调查研究，凝聚各方智慧，形成了一批有价值、有分量的调研成果，协商议政的成果和委员们提出的建议，在省委省政府出台的相关文件中得到了充分采纳和体现。过去一年，省政协认真贯彻落实中央和省委关于打赢脱贫攻坚战的系列决策部署，开展我省脱贫攻坚情况视察，推动精准扶贫的深入开展，并主动参与扶贫开发各项工作，主席会议成员先后30多次下村调研考察，助力我省脱贫攻坚工作。。于迅指出，过去一年，全省人民政协事业取得了新的成就和发展。这是中共海南省委正确领导的结果，是省政府大力支持和社会各界密切配合的结果，是省政协各参加单位和全体委员团结奋斗的结果。他代表省政协常委会向大家表示崇高的敬意和衷心的感谢。。面向2017年，于迅强调，今年是党和国家事业发展中具有重大意义的一年，中国共产党将召开第十九次全国代表大会，我省将召开第七次党代会，也是本届省政协的收官之年，我们一定要牢记使命、珍惜荣誉，一如既往地扎实工作，一以贯之地履职尽责，不负人民群众和社会各界的重托。就今年省政协工作，他作出七项部署：深入学习贯彻习近平总书记系列重要讲话精神和中央、省委决策部署，引领政协工作继续前进；紧扣改革发展重大问题咨政建言，有序有效推进协商民主；积极推进政协民主监督，不断提高监督水平和实效；强化爱国统一战线组织作用，凝聚海南改革发展稳定正能量；发挥政协特色平台优势，为文化强省建设助力添彩；做好经常性工作，有效提升履职质量；着力加强自身建设，进一步增强履职能力。。于迅最后强调，当前，海南正处在重大发展机遇期和发展上升期，前景光明，任务艰巨。让我们更加紧密地团结在以习近平同志为核心的中共中央周围，在中共海南省委的领导下，不忘初心、继续前进，与全省人民一道，撸起袖子加油干，不断开创我省人民政协事业发展新局面，以服务改革发展的实际行动和优异成绩，迎接中共十九大和省第七次党代会胜利召开！,其他,0.6799708772632439,True
海南省,海南省政协六届五次会议隆重开幕,2017-02-20,海南以制度创新推动高水平对外开放，向具有世界影响力的国际旅游消费中心迈进 开放加速天地宽。再过一个多月，柬埔寨王国驻海口总领事馆将正式开馆。这是新中国成立以来外国在海南设立的第一家领事机构，体现了海南为推动中柬关系不断迈上新台阶作出了新努力，同时也表明了当前海南的对外交往水平上升到了新层面。。2018年4月13日，习近平总书记在庆祝海南建省办经济特区30周年大会上发表重要讲话，指出在推进新一轮改革开放中，海南要坚持开放为先，实行更加积极主动的开放战略，加快建立开放型经济新体制，推动形成全面开放新格局。。岛屿发展，需不拒众流，方为江海。海南具有面向东盟最前沿的区位优势，又是一个独立的地理单元，对外开放基础较好。开放与合作，是海南迈向新一轮发展的坚定步伐。一年多来，海南深入贯彻落实习近平总书记“4·13”重要讲话和中央12号文件精神，坚持大胆闯、大胆试、自主改，以制度创新为引领，加快推动一批重要扩大开放措施的相继落地——。四小时、八小时飞行经济圈逐步成形；国际旅游消费不断升级；外国人工作许可审批时限压缩一半；一批跨国企业和国际专业机构相继落户海南；利用外资、进出口贸易额、新增外资企业等经济指标大幅增长……海南全面扩大开放之路蹄疾步稳。。今年年初，海南自由贸易（FT）账户体系创新运行后，海南国贸有限公司总经理郑晓波很快完成了第一笔业务，也从中感受到了它的快捷便利。。“通过FT账户，发出一个指令就可以完成币种转换，不再需专人买卖外汇，极大便利了企业开展国际业务。”郑晓波说，特别是海南、上海两地自贸区FT账户业务可以实现合作联动及资金的有效互通运用，这在全国还是首例。。目前，逾3000家企业开设FT账户，为国际企业进驻海南和海南企业的国际化提供开放的金融基础环境。。自贸港是当今世界最高水平的开放形态。海南想要扩大高水平开放，就要做好顶层设计、创新制度，力争为我国建设开放型经济新体制提供有效制度供给。。正如省委书记刘赐贵所说，我们不仅把招商引资的重心全部放在国内的存量上，更要加大全球招商力度，引进符合中国国情、符合海南实际、符合高质量发展要求的产业项目和市场主体，形成资本增量，既为海南也为全国作贡献。。全面实行准入前国民待遇加负面清单制度、设立国际经济发展局、在全国率先实施境外游艇入境关税保证保险制度……一年多来，海南各级各部门敢闯敢试、主动作为，在管理制度、法律、金融、人才、投资、风险管控、合作平台、人员往来和文化交流等对外开放的各方面探索创新，完善相关政策制度，优化开放环境，积极推进国际合作，为实施更加积极主动的开放战略提供了动力。。这些举措有个共同点，就是通过体制机制上的创新突破，连接起国际国内两端的市场，商机无限、前景广阔令更多国际市场主体和人才有了实际行动。。一年多来，海南招商更注重引进外资，引才更注重引进国际人才，不断畅通引才渠道。当前全省新增外资企业304家，5445名外籍人才来琼创业就业居留，他们活跃在旅游、教育、医疗、海洋、科技等行业一线，为海南建设发展注入更多“国际活力”。。提高海南国际知名度和吸引力，除了请进来，还要“走出去”——海南在外交部蓝厅举办全球推介活动；借省领导出访之际推介海南发展新机遇；邀请49国主流媒体来海南采访，接待驻华使节率团访琼，并与俄罗斯塔斯社联合举办海南自由贸易试验区专题推介会，宣传海南建设发展成就与机遇……一系列活动，让海南在国际上的“能见度”大大提升。。每一项摆在游客面前的新选择，都是海南建设国际旅游消费中的有益探索。建设国际旅游消费中心，是党中央赋予海南“三区一中心”发展战略定位之一，是新时代海南深化改革开放的重要篇章。,其他,0.7513647211906861,True
