province,topic,date,content,label,score,is_match
海南省,沈丹阳在海垦集团调研,2024-02-21,沈丹阳在海垦集团调研时指出 发扬海垦精神 把主题教育成果 转化为海垦高质量发展动能。海南日报海口2月20日讯（记者 袁宇）2月20日，省委副书记沈丹阳到海垦集团调研农垦改革发展情况，并主持召开座谈会。。沈丹阳到海垦国际金融中心走访海垦集团总部相关部门，看望慰问干部职工，向他们致以新春祝福。他指出，过去一年海垦集团深入学习贯彻党的二十大精神和习近平总书记考察海南时的重要讲话精神，坚决落实中央决策部署和省委、省政府工作要求，讲政治、有担当、顾大局、善作为，交出了一份令人振奋的答卷，希望大家在新的一年再接再厉、再创佳绩。。沈丹阳强调，海垦集团要按照省委、省政府工作部署，聚焦“天然橡胶国家战略物资的提供者、农业现代化的引领者、深化国有企业改革的探路者”的定位，以作风能力建设为抓手，以深化改革为动力，认真做好主题教育“后半篇文章”。聚焦迈入中国企业500强中游行列的目标，健全完善企业管理体制，不断提升企业发展效益，高质量完成全年目标任务。研究好、利用好海南自贸港政策，围绕加工贸易、冷链物流、政策便利化应用等方面深化研究，吸引更多企业参与自贸港建设。持续发扬“艰苦奋斗、无私奉献、开拓进取、求实创新”的海垦精神，不断加强干部队伍建设，落实全面从严治党要求，把主题教育成果转化为海垦高质量发展动能。,政府领导到其他城市考察学习或访问,0.0,True
海南省,冯飞刘小明会见广西壮族自治区主席蓝天立共商深化琼桂合作事宜,2024-04-27,冯飞刘小明会见广西壮族自治区主席蓝天立 共商深化琼桂合作事宜_图片库_海南省人民政府网。4月27日，省委书记冯飞、省长刘小明在海口会见率代表团来琼考察交流的广西壮族自治区主席蓝天立一行，共商深化琼桂合作事宜。。冯飞代表海南省委、省政府欢迎蓝天立一行，并介绍海南自由贸易港建设最新进展。他表示，海南正加快建设具有世界影响力的中国特色自由贸易港，全力推进封关运作准备工作，加快构建现代化产业体系，发挥自由贸易港政策和开放优势，坚持“向种图强”“向海图强”“向天图强”“向绿图强”“向数图强”，培育壮大具有海南特色的新质生产力。两省区近年来交流合作日益密切、成效明显。海南将深入学习贯彻习近平总书记在新时代推动西部大开发座谈会上的重要讲话精神，与广西加强重大战略对接联动，并深化南繁合作，拓展水路交通，携手推动两省区合作迈上新台阶。。蓝天立代表自治区党委、政府感谢海南对广西发展给予的大力支持，对海南以自贸港建设引领高质量发展取得的成绩表示钦佩和祝贺。他说，当前广西正深入学习贯彻习近平总书记对广西重大方略要求，着力推进铸牢中华民族共同体意识示范区和国内国际双循环市场经营便利地、粤港澳大湾区重要战略腹地“一区两地”建设。广西与海南经济互补性强，合作空间巨大，将深入学习借鉴海南先进经验，持续深化农业合作，共同推动海南自贸港与广西自贸区联动发展，加强跨区域跨境产业合作，深化西部陆海新通道共建共享，为两区省高质量发展塑造新动能新优势。。会见结束后，海南省农业农村厅与广西壮族自治区农业农村厅签订农业合作协议，双方将在种养产业、农业科技、农产品产销与监管、渔业等领域开展交流合作。签约仪式上，广西壮族自治区农业农村厅还与中国热带农业科学院签订战略合作框架协议，将在广西热带亚热带特色作物资源开发、特色经济作物选育种等方面开展合作。。广西壮族自治区领导许显辉，海南省领导倪强、顾刚参加活动。（海南日报记者 李磊 摄像记者 封烁）,政府领导到其他城市考察学习或访问,0.0,True
海南省,刘小明会见越南计划投资部部长阮志勇,2024-04-01,刘小明代表省委、省政府对大家的到访表示欢迎，并介绍了海南自贸港建设进展。他表示，近年来，海南与越南在贸易、会展、教育、农业等领域的合作取得积极成效。今天阮志勇部长一行来访，再次显示了双方对强化交流合作的高度重视和建立更紧密关系的强烈意愿。希望越南与海南共同推动交通互联互通、扩大双方经贸投资、拓展双向旅游消费、加强人文交流互鉴、深化热带农业合作，进一步增进了解、深化友谊、扩大合作，为中越睦邻友好和构建具有战略意义的中越命运共同体作出积极贡献。。阮志勇对海南方面的热情接待表示感谢。他表示，通过在海口江东新区等地实地考察，代表团一行对海南自贸港建设和高质量发展有了深入了解，初步总结了许多值得学习借鉴的经验。越南和海南合作交流空间广阔、前景可期，希望双方政府、企业、学界之间多走动、多交流，着力推动交通互联互通，携手开发国际市场，持续深化贸易、农业、旅游、教育、卫生、会展，以及数字经济、绿色经济、循环经济等各领域合作，共同推动越中经济快速可持续发展。。省委常委、常务副省长巴特尔，省政府秘书长符宣朝参加会见。(海南日报记者 陈蔚林 摄影 武威),政府领导到其他城市考察学习或访问,0.52136210201903,True
海南省,海南省党政代表团赴天津学习考察,2024-06-13,海南省党政代表团赴天津学习考察 携手提高服务保障重大国家战略能力水平 推动在更宽领域更深层次更高水平交流合作 陈敏尔冯飞张工刘小明参加。6月12日至13日，海南省党政代表团在天津市学习考察，并召开天津·海南工作交流座谈会，学习天津在贯彻落实习近平新时代中国特色社会主义思想、全面深化改革开放、因地制宜发展新质生产力等方面重要经验，寻求和推动两地在更宽领域、更深层次、更高水平交流合作。天津市委书记陈敏尔，市委副书记、市长张工；海南省委书记、省人大常委会主任冯飞，省委副书记、省长刘小明参加有关活动。。陈敏尔对海南省长期以来对天津发展的大力支持表示感谢。他说，当前，天津深入学习贯彻习近平总书记视察天津重要讲话精神，以推进京津冀协同发展为战略牵引，努力在发展新质生产力、进一步全面深化改革开放、推动文化传承发展、提升城市治理现代化水平上善作善成，奋力谱写中国式现代化天津篇章。天津和海南都是“一带一路”的重要节点，在国家改革开放大局中都肩负着重要使命。我们要共同落实好习近平总书记关于加强国家重大战略对接的重要指示精神，从全局谋划一域、以一域服务全局，进一步拓宽两地多领域交流合作。在深化改革开放上携手共进，学习借鉴海南的经验做法，着力提升改革的精准性、针对性、实效性，进一步扩大制度型开放，深入实施自贸试验区提升行动，加强港口合作，深度融入共建“一带一路”。在发展新质生产力上优势互补，坚持科技创新和产业创新一起抓，推动两地高校、科研院所、企业合作，强化种业、海洋经济、航空航天等领域协同创新和产业协作。在生态文明建设上深化合作，探索海洋碳汇、渔业碳汇和森林碳汇方面合作新模式，完善生态产品价值实现机制，推动生态环境治理取得更大成效。在商文旅深度融合上协同联动，加强文旅产业、商贸消费、会展经济等领域合作，互为资源、互为市场、互为目的地，更好服务推动高质量发展，创造高品质生活。。冯飞对天津长期以来支持海南经济社会发展表示感谢。他指出，天津是国家中心城市、首批沿海开放城市，区位条件优越，产业基础雄厚，创新资源丰富，人文底蕴厚重，发展势头良好。近年来，天津深入学习贯彻习近平总书记视察天津重要讲话精神，牢牢把握推动京津冀协同发展的战略机遇和光荣使命，取得了辉煌的发展成就，积累了丰富的改革经验，值得海南对标学习、充分借鉴。天津和海南在国家全面深化改革开放和中国式现代化建设大局中有重要地位和使命，希望同天津加强经验互鉴、优势互补、发展互促，携手提高服务和保障重大国家战略的能力和水平，不断推动两地经济社会高质量发展。密切对外开放领域合作，在制度型开放、要素型开放、参与全国统一大市场建设等方面推出融合创新成果，共同服务和融入新发展格局；密切科技创新领域合作，提升科技创新和产业发展合作水平，深化商业航天、海洋、农业等领域合作，共同培育和发展新质生产力；密切文旅消费领域合作，推动两地客源互送、产品互推、市场共拓，开发更具国际竞争力的消费品和服务，共同做大消费“蛋糕”；建立更加系统完善、战略上互相支持、发展上互利共赢的交流合作机制，共同推动津琼合作再上新台阶。。6月12日，海南省党政代表团实地探访天开高教科创园，考察学习科研成果转化先进经验。。6月13日，海南省党政代表团实地探访“美丽滨城”会客厅，考察学习港产城融合先进经验。。6月13日，海南省党政代表团实地探访天津港第二集装箱码头有限公司，考察学习智慧绿色码头建设先进经验。。天津市领导刘桂平、连茂君、王力军、张玲；海南省领导周红波、罗增斌、巴特尔、倪强、顾刚、尹丽波参加有关活动。（海南日报记者 李磊 摄影 封烁）,政府领导到其他城市考察学习或访问,0.7617526122912323,True
海南省,海南省党政代表团赴北京学习考察,2024-06-14,海南省党政代表团赴北京学习考察 对标学习先进拓宽发展思路 持续深化合作实现互利共赢 尹力冯飞殷勇刘小明参加。6月14日，海南省党政代表团在北京市学习考察，并召开北京·海南工作交流座谈会，学习北京全面深化改革开放的宝贵经验，深化两地交流合作。北京市委书记尹力，市委副书记、市长殷勇；海南省委书记、省人大常委会主任冯飞，省委副书记、省长刘小明参加有关活动。。尹力感谢海南长期以来对北京工作的关心和支持。他说，海南是国家南大门，也是最大的经济特区。党的十八大以来，海南全面贯彻习近平总书记关于海南工作的系列重要讲话和重要指示批示精神，紧紧围绕“三区一中心”的战略定位，坚决扛起建设中国特色自由贸易港的使命担当，各项事业全面进步，一系列先进经验值得北京学习借鉴。京琼两地当前都处在推动高水平对外开放向纵深发展的阶段，希望进一步深化各领域务实合作，共同书写高水平开放、高质量发展的时代新篇。加强改革开放交流合作，围绕双方共同关注的改革议题和自贸区、综合保税区建设，强化经验交流和政策互鉴。加强科技创新合作，在航天、低空经济、生物医药、新能源汽车等赛道强化技术交流，协同打造产业集群，培育壮大新质生产力。加强文旅发展合作，共同培育一批文旅特色品牌、热门消费打卡地。加强现代种业合作，促进农业中关村和“南繁硅谷”对接协作，开展种业关键核心技术联合攻关。加强绿色能源合作，围绕培育壮大氢能产业，支持两地企业开展供需对接、配套协作，共同提升产业层次和竞争力。。冯飞感谢北京给予海南自由贸易港建设的关心厚爱和大力支持。他表示，近年来，北京深入贯彻落实习近平总书记对北京重要讲话精神，加强“四个中心”功能建设，提高“四个服务”水平，城市综合实力和国际影响力不断跃上新台阶，在全面建设社会主义现代化国家进程中持续走在全国前列。在考察学习中深切感受到北京在落实国家战略上的大思路大手笔，在贯彻新发展理念、推动高质量发展上取得的新成就新气象，以及干部群众拼搏奋进、一往无前、奋力开创新时代首都改革开放新局面的蓬勃朝气，这些都值得海南对标学习借鉴。京琼两地来往密切，功能定位互补性强，交流合作潜力巨大，希望北京一如既往支持海南、帮助海南，推动两地以产业合作为主要抓手，建立更加紧密的交流合作机制，在高新技术产业、数字经济、现代服务业、教育医疗等领域深化合作，在种业、深海、航天等产业发展上优势互补，在服务业扩大开放上协同推进，并希望在人才交流合作上得到北京更多指导支持。。6月14日，海南省党政代表团来到中关村国家自主创新示范区展示中心，了解北京市加快培育和发展新质生产力相关工作进展和成效。。6月14日，海南省党政代表团来到北京旷视科技有限公司，察看最新研发成果及产品应用展示。。6月14日，海南省党政代表团来到北京市高级别自动驾驶示范区创新运营中心，察看自动驾驶应用场景。。6月14日，海南省党政代表团来到大兴国际机场临空经济区自由贸易试验区创新服务中心，了解临空经济区总体发展等情况。。在京考察期间，海南省党政代表团来到中关村国家自主创新示范区展示中心，了解北京市加快培育和发展新质生产力相关工作进展和成效，走进北京旷视科技有限公司察看最新研发成果及产品应用展示，在北京市高级别自动驾驶示范区创新运营中心察看自动驾驶应用场景，来到大兴国际氢能示范区了解氢能产业发展情况，走进大兴国际机场临空经济区自由贸易试验区创新服务中心了解临空经济区总体发展等情况。。北京市领导夏林茂、赵磊、穆鹏；海南省领导周红波、罗增斌、巴特尔、倪强、顾刚、尹丽波参加有关活动。（海南日报记者 李磊 摄影 封烁）,政府领导到其他城市考察学习或访问,0.0,True
海南省,冯飞主持召开海南省党政代表团赴京津冀学习考察小结座谈会,2024-06-14,冯飞主持召开海南省党政代表团赴京津冀学习考察小结座谈会_省府要闻_海南省人民政府网。冯飞主持召开海南省党政代表团赴京津冀学习考察小结座谈会强调 解放思想 开拓创新 真抓实干 奋勇争先 加快推进海南高质量发展 刘小明参加。赴京津冀学习考察期间，海南省党政代表团在北京举行学习考察小结座谈会，交流总结如何学习借鉴京津冀先进经验，进一步开拓思路、促进合作、激励斗志，推动海南高质量发展。省委书记冯飞主持会议并讲话，省长刘小明等省领导出席。。冯飞指出，海南自由贸易港建设和京津冀协同发展、雄安新区建设是习近平总书记亲自谋划、亲自部署、亲自推动的重大国家战略。当前全国各地竞相发展、百舸争流，发展不进则退、慢进亦退。在京津冀协同发展十周年的关键节点，海南省党政代表团赴京津冀学习考察，目的是学习先进经验、深化省（市）际合作、激发争先斗志。要进一步增强加快推进高质量发展的使命感和紧迫感，总结分析京津冀地区的好经验好做法，有效传导责任压力、激发发展动力，把学习考察成果转化为推进各项工作的实际成效，努力实现全年发展目标，确保在高质量发展上走在全国前列。要进一步抓项目扩投资促消费支撑经济持续增长，海口要发挥省会和自由贸易港核心区作用，全力提升主要经济发展指标；三亚要加快打造国际旅游消费中心核心区，促进消费提质扩容；儋州要深入推进儋洋一体化发展，进一步扩大产业投资规模；琼海、文昌、东方、澄迈等市县要深挖潜力促投资，努力打造全省高质量发展的重要增长点；13个重点园区要充分发挥主力军作用，优服务、促投资，加快补齐投资短板；全省各市县、各部门、各单位要确保上半年推动经济发展时间过半、任务过半。要进一步解放思想、开拓创新、真抓实干，坚持担当作为、求真务实、不做虚功，更加注重“抢人才、抢招商、大开放、大改革”，把人才资源开发放在优先位置，推进招商引资提质增量，集中精力推动自由贸易港关键核心政策落地见效，努力打造新时代中国改革开放的示范。。与会省领导和省发改委、省工信厅、省商务厅、省住建厅和海口市、三亚市、儋州市相关负责同志等海南省党政代表团成员就如何学习和用好京津冀经验，更好谋划和推动分管领域和本地区、本部门工作进行交流发言。（海南日报记者 李磊 摄影 封烁）。省政府党组（扩大）会议暨理论学习中心组学习会议召开 传达学习习近平总书记有关重要讲话重要指示精神,政府领导到其他城市考察学习或访问,0.0,True
海南省,沈丹阳会见古巴共产党省市委领导干部考察团,2024-06-07,海南日报海口6月6日讯(记者 袁宇)6月5日，省委副书记沈丹阳在海口会见古巴共产党中央政治局委员、阿特米萨省委第一书记马丁内斯率领的古巴共产党省市委领导干部考察团一行。。沈丹阳代表海南省委、省政府，欢迎古巴考察团来访海南，并介绍海南自贸港建设情况。他表示，希望双方深入开展党际交流，相互学习借鉴，共同探索写好以党建引领自贸港(区)建设这篇文章。进一步深化双方经贸往来合作，扩大进出口贸易规模，推动更多古巴企业来琼投资，在农业、医疗技术、生态环保方面深化合作交流，共同探讨开通直航航线，共享海南自贸港建设机遇。。马丁内斯表示，古巴共产党省市委领导干部考察团访问海南，再一次展现出中国共产党对古巴共产党建设社会主义事业的支持，为两党之间开展合作交流提供了宝贵的机会。希望古巴与海南在农产品加工、可再生能源开发、生物技术、电信通讯等领域进一步加强合作，共同落实古中两党两国领导人达成的重要共识。,政府领导到其他城市考察学习或访问,0.5525666685853194,True
海南省,王东峰率全国政协无党派人士界别考察团来琼考察,2024-04-19,4月15日至19日，全国政协副主席兼秘书长王东峰率全国政协无党派人士界别考察团，围绕“推进海南自由贸易港高水平开放”赴海南考察。期间，省委书记冯飞、省长刘小明在三亚拜会王东峰一行，省政协主席李荣灿参加相关活动。。考察团深入三亚市、陵水黎族自治县、东方市，上海岛，进园区，看企业，访群众，实地感受到海南省抓住自由贸易港建设的历史性机遇，深化改革、扩大开放，高新技术、对外贸易、旅游产业、现代农业、生态环境保护等方面不断取得新成效，“三区一中心”建设迈上新台阶。座谈会上，委员们围绕推进海南自由贸易港高水平开放的主题，听取有关情况介绍，并与重点园区、特色企业负责同志交流互动，建言献策。。考察团表示，要深入学习贯彻习近平总书记一系列重要讲话和指示批示精神，认真落实党中央决策部署，深刻领悟“两个确立”的决定性意义，增强“四个意识”、坚定“四个自信”、做到“两个维护”，用党的创新理论凝心铸魂，以服务高水平开放助推国家战略大局。。参加考察的委员们认为，海南自由贸易港建设有力有序有效扎实推进，各项政策逐步落地见效，充分体现了党的领导和制度优势，反映了海南省政治站位、规划先行、制度创新、产业支撑及统筹高质量发展和高水平开放的责任与担当。考察团将认真总结相关经验，广泛凝聚共识，为推进海南自由贸易港高水平开放贡献政协智慧和力量。。全国政协副秘书长张茂于，全国政协委员王晶、伍爱群、李国红、肖琦、何清湖、张树新、蒋颖及国家发展和改革委员会有关司局负责同志参加考察。。省领导周红波、倪强，省政协秘书长罗时祥参加相关活动。（海南日报记者 刘操 通讯员 李发强 摄影 封烁）,政府领导到其他城市考察学习或访问,0.0,True
