province,topic,date,content,label,score,is_match
海南省,海口三大项目在建三大项目引进,2013-07-20,沈晓明：高标准高质量开展村“两委”换届工作 为全面推进乡村振兴提供坚强组织保证_领导活动_海南省人民政府网。沈晓明在调研抓基层党建促乡村振兴和村“两委”换届工作时强调 高标准高质量开展村“两委”换届工作 为全面推进乡村振兴提供坚强组织保证。海南日报保城2月8日电（记者 况昌勋 特约记者 王江顺）2月8日，省委书记沈晓明在保亭黎族苗族自治县调研抓基层党建促乡村振兴和村“两委”换届工作。他强调，要深入学习贯彻习近平总书记关于基层党组织建设的重要论述精神以及关于海南工作的系列重要讲话和指示批示精神，高标准高质量开展村“两委”换届工作，确保换出新班子、新作为、新气象，为全面推进乡村振兴提供坚强组织保证。。2021年2月8日，省委书记沈晓明在保亭黎族苗族自治县响水镇合口村主持召开座谈会，听取县、乡(镇)、村三级党组织书记关于做好村“两委”换届工作的情况汇报和意见建议。海南日报记者 宋国强 摄。沈晓明来到响水镇合口村，考察了解基层党建、脱贫攻坚、环境整治、电商发展等情况。他要求，要牢固树立大抓基层的鲜明导向，推动基层建设全面进步、全面过硬，以基层党建促进乡村振兴；要认真总结、客观评估农村电商发展的成效与不足，研究提出可持续发展的思路，促进电商更好服务乡村振兴；要立足村民需求，盘活村集体闲置资源，持续提升农村公共服务水平。。随后，沈晓明主持召开座谈会，听取县、乡（镇）、村三级党组织书记关于做好村“两委”换届工作的情况汇报和意见建议。他指出，这次村“两委”换届是在“三农”工作重心实现历史性转移和推进海南自由贸易港建设的背景下进行的一次换届，要切实把中央关于村“两委”换届的决策部署和省委工作要求落到实处，坚持目标导向，严格人选标准，提高人选质量，特别是要着眼优化班子年龄结构、知识结构、民族结构和性别结构，充分吸纳返乡务工人员、回乡创业青年和退役军人进基层组织，确保选出能力强、作风正、愿意为村集体和村民服务的优秀干部。要加强党的全面领导，强化督促指导，严守法律法规，严肃换届纪律，广泛发动群众积极参与并监督换届工作，确保换届选举风清气正。。沈晓明强调，要把此次村“两委”换届作为推进乡村振兴的新起点，选出的新班子要认真落实惠民政策，谋划产业发展，改善人居环境，提升治理水平，做好巩固拓展脱贫攻坚成果与实施乡村振兴战略有效衔接工作，推动我省乡村全面振兴。,其他,0.9517639286672408,True
海南省,沈晓明切实增强责任感紧迫感更好扛起省会城市担当,2022-05-08,2019年9月6日，省长沈晓明率队在广西壮族自治区东兴市缉私二号哨塔实地调研出入境监管工作。海南日报记者 宋国强 摄。本报广西东兴9月7日电 （记者罗霞）9月6日至7日，省长沈晓明率队到广西壮族自治区东兴市调研出入境监管工作，要求充分认识加强海南出入境监管工作的紧迫性和复杂性，以开拓创新的精神，努力探索建设符合自贸港发展需要的“管得住”的制度体系。。2019年9月6日，省长沈晓明率队在广西壮族自治区东兴市东兴边民互市贸易区实地调研出入境监管工作。海南日报记者 宋国强 摄。在广西南宁参加2019年泛珠三角区域合作行政首长联席会议后，沈晓明立即前往东兴市，先后来到东兴边民互市贸易区、缉私二号哨塔、中越北仑河二桥，实地考察互市贸易管理和产业发展、北仑河非设关地反走私综合治理、边境综合管控拦阻设施建设、中越跨境经济合作区规划建设和管理等情况。沈晓明走进东兴市反走私联合指挥中心，听取了东兴市反走私综合治理工作介绍，要求认真学习东兴采取疏堵结合等方式推进反走私工作的经验，结合海南实际，研究推进海南反走私工作。。调研过程中，沈晓明利用间隙时间，在住地和机场候机室组织召开调研心得交流会。与会人员就调研体会、下一步工作建议和设想等进行了讨论交流。。沈晓明指出，要结合海南建设自贸试验区和中国特色自贸港的新形势、新任务，在借鉴外地经验的基础上，不断开拓创新，推进出入境监管工作；要发挥团队协作精神，统筹海关、公安、边防、海警等多方力量，加强群防群治；要进一步巩固共识，解决突出重点问题，以跨境感知为目的，充分运用信息化手段，加强人流、物流、资金流进出岛信息管理系统和社会管理信息化平台建设的联动，实现信息共享，加强海关信用管理，做好“三无”船舶管理，将“疏堵结合”理念融入到实际工作中。。沈晓明强调，全面深化改革开放必须以“管得住”为前提，要从感知、处置、协调等方面不断优化流程，健全制度法规体系，更好地推动出入境监管工作。。广西壮族自治区党委常委、政法委书记黄世勇陪同调研，海南省副省长沈丹阳、省政府秘书长倪强参加调研。。我省结合主题教育建立市县和省直单位工作交流机制并通报表扬先进典型，激励广大党员干部——立足岗位 解放思想 担当作为 开拓创新,其他,0.6061395119389185,True
海南省,沈晓明高标准高质量开展村两委换届工作为全面推进乡村振兴提供坚强组织保证,2021-02-08,冯飞在琼中五指山开展生态环保专题调研时要求 树立一流目标，探索生态产品价值实现机制。海南日报五指山12月11日电(记者 李磊)12月11日，省委副书记、代省长冯飞赴琼中、五指山就国家生态文明试验区建设情况开展专题调研，并召开座谈会研究部署推进相关工作。他强调，要在自贸港建设中深入贯彻落实习近平生态文明思想，充分认识海南生态环境保护工作的重要性，以标志性项目为牵引，高水平推进国家生态文明试验区建设。。2020年12月11日下午，省委副书记、代省长冯飞来到五指山热带雨林风景区，调研旅游区生态保护及热带旅游发展情况。当天，冯飞先后到琼中、五指山就国家生态文明试验区建设情况开展专题调研并召开座谈会。海南日报记者 封烁 摄。冯飞先后来到琼中百花岭热带雨林文化旅游区、五指山热带雨林风景区，了解旅游区生态保护及热带旅游发展情况。他指出，海南拥有得天独厚的生态资源，要牢固树立生态优先、绿色发展理念，进一步整合旅游要素，形成山海联动、串珠成链、数字赋能的旅游发展格局，实现“绿水青山”向“金山银山”的价值转化。在五指山椰仙有机茶园考察时，冯飞要求充分挖掘生态保护蕴含的经济价值，发展特色产业，促进一二三产业融合，推动农民增收致富，助推脱贫攻坚与乡村振兴有效衔接。。冯飞以不提前通知的方式，突击检查五指山市毛阳镇污水处理厂污水收集、处理情况。他指出，污水处理设施的建设管理，要按照抓好部门统筹、落实市县属地责任、建立市场主体健康规范运作机制、强化管理能力等原则推进，实现“建管用”一体化发展。。在五指山市召开的座谈会上，省直有关部门汇报了我省国家生态文明试验区建设进展、海南热带雨林国家公园建设、城镇污水处理及水库河流水环境保护等方面情况，并进行讨论交流。。冯飞同与会人员重温了习近平总书记对海南生态环境保护工作的系列重要指示精神，并就做好下一阶段工作提出要求。他强调，要深刻学习、自觉践行习近平生态文明思想，充分认识生态工作的重要性，正确处理好发展和保护等重大关系，在建设国家生态文明试验区的明确定位中抓好工作落实。要对照中央要求，全面客观准确把握当前工作形势，切实解决存在的问题。要以标志性项目为牵引，在推进国家生态文明试验区建设中，树立一流目标，加强系统集成推进，加快探索生态产品价值实现机制，坚持以人为本增强群众获得感、幸福感，推动与海南热带雨林国家公园相关的科学研究和科普教育，完善相关体制机制，加强执法队伍建设。,其他,0.5975764822822747,True
海南省,跃上潮头启新程写在省第八次党代会召开之际,2022-04-26,今天（11月30日）上午，2013年海南省博士协会年会暨海南科技创新研讨会在海南大学举行。省委副书记李宪生在会上强调，要抢抓机遇、再接再厉，在海南争创中国特色社会主义实践范例中，有新的更大作为。。李宪生代表省委、省政府对会议的召开表示祝贺。他说，近年来，省委、省政府通过采取刚性调入、柔性流动、环境项目产业吸引等多种举措，为引进、留住、用好高层次创新创业人才和团队提供了良好的环境，吸引了包括博士在内的越来越多的高层次人才来琼工作。省博士协会自去年6月成立以来，坚持“汇聚博士群贤、弘扬科学精神、服务海南建设、促进事业发展”的宗旨，充分发挥博士人才的聪明才智和主观能动性，在开展重大课题研究、前沿学术探讨、基层科技帮扶、决策咨询服务等方面开展了许多富有成效的工作，作出了特殊贡献。。李宪生指出，新目标、新使命需要包括博士协会全体会员在内的各类人才更加积极主动、更加有效地发挥聪明才智、贡献力量，需要更多英才聚集到建设海南的洪流中来。他强调，协会要完善组织建设，增强凝聚力，增强汇聚高端智力、发挥群体效应的积极作用；提高服务水平，增强创造力，深化信息资源共享，促进学科优势互补；推动交流合作，增强影响力，促进科研成果转化和推广应用，积极开展前瞻性研究，主动为政府决策提供参考。。据了解，省博士协会会员已达556名，占在琼博士的50%以上。今年协会年会的主题是“汇集博士精英，献计科技创新，服务海南建设”。。会上，副省长王路就“科技创新战略―――海南科技创新发展的路径选择”做主题报告，中国（海南）改革发展研究院院长迟福林就“十八届三中全会与海南改革发展的新机遇”做主旨演讲。省博士协会名誉会长、老干部王学萍参加会议。（记者张谯星）。又讯 中改院作为省博士协会的发起单位之一，2012年12月就成立了海南本土第一个博士生实践服务团，鼓励博士生开展调研和智力服务活动。30日，该院博士生实践服务团一行30人在博士生导师殷仲义教授率领下，赴儋州滨海新区学习考察，并与管委会有关负责人进行了座谈。。服务团围绕新区转型升级积极建言，涉及开发区定位、创建金融改革试验区、扶持企业融资、控制土地利用、发展服务业及海洋产业等方面。服务团的意见获得了相关单位的高度评价。会后服务团将汇总意见向管委会提交专题调研报告。 （记者张谯星）,其他,0.5223564333305583,True
海南省,海口秀英区多个村庄村道装上太阳能路灯,2021-11-02,不断从百年党史汲取智慧和力量，赓续红色血脉，奋力推进儋州洋浦一体化发展 儋州：激发爱党情怀 办实事开新局。1月19日，儋州市党史学习教育总结大会在那大镇召开。会议强调把学习党史作为永恒课题、终身课题，不断汲取开拓前行的智慧和力量，以更加昂扬的精神状态和更加饱满的干事热情，奋力推进儋州洋浦一体化发展，以优异成绩迎接党的二十大和省第八次党代会胜利召开。。“百年党史表明党的领导是党和国家的根本所在、命脉所在。要坚持旗帜鲜明讲政治，始终牢记嘱托，把党的政治建设摆在首位，把坚持和加强党的领导、党的建设贯穿儋州洋浦一体化发展和全面深化改革开放全过程，确保始终沿着正确的政治方向行稳致远。”儋州市委主要负责人说，要巩固拓展党史学习教育成果，始终把学懂弄通习近平新时代中国特色社会主义思想作为首要政治任务，深刻领会其核心要义、精神实质、丰富内涵和实践要求，推动党史学习教育往心里走、往实里走、往深里走，引导党员干部进一步深刻领会“两个确立”的决定性意义，不断夯实信仰信念的思想根基。充分发挥理论学习中心组龙头作用，领导干部带头学、经常学，以更高标准和更严要求学习宣传贯彻习近平新时代中国特色社会主义思想。坚持站稳人民立场，自觉与人民共建共享儋州洋浦一体化发展成果;坚持以人民为中心，顺应人民日益增长的美好生活需要，在发展中不断改善和提高民生水平;坚持发展为民、坚持民生优先、坚持依靠人民，让发展成果更多更公平惠及全体人民。。儋州市委主要负责人指出，抓好风险防控是当前和今后一个时期推进儋州洋浦一体化发展的重要任务。要善于从百年党史中汲取防范化解风险挑战的经验，增强预见性、紧迫感、系统性，不断提高应对风险、迎接挑战、化险为夷的能力水平，确保各类风险找得准、防得住、控得牢。坚持务实创新强作风，全面提振干事创业的精气神，持续深化作风整顿建设年和“查堵点、破难题、促发展”、比学赶超活动成果，认真履职尽责、敢于攻坚克难、大胆改革创新、保持恒心耐心，敢担当善作为。从百年党史中不断汲取全面从严治党的成功经验，强化监督管理、持续减负增效、严格执纪问责，努力为推进儋州洋浦一体化发展营造良好的政治环境和发展环境。。开展党史学习教育是党中央立足百年党史新起点、着眼开创事业发展新局面作出的一项重大战略决策。儋州洋浦深入贯彻党中央和省委决策部署，在省委党史学习教育巡回指导组的指导下，按照“学史明理、学史增信、学史崇德、学史力行”的要求，推动党史学习教育扎实有序开展，在省级会议上作为先进典型单位交流发言5次，得到党史学习教育中央第七指导组和省委领导充分肯定，达到学党史、悟思想、办实事、开新局的目的。儋州市委常委、宣传部部长，市委党史学习教育领导小组副组长陶涛说：“今年将结合儋州洋浦一体化发展实际，建立健全长效工作机制，深化巩固拓展党史学习教育成果，激励党员干部干事创业热情，为打造海南高质量发展第三极作贡献。”。儋州市委压实责任链条，确保党史学习教育扎实有序开展。儋州洋浦分别成立由市委书记、工委书记为组长的党史学习教育领导小组，主要负责人带头深入基层调研指导、开展学习宣讲、带头解决实际问题。周密部署党史学习教育工作，将作风整顿建设年、“查堵点、破难题、促发展”活动统筹安排、一体推进。开展党史学习教育以来，儋州市委组建6个巡回指导组，对全市90家单位开展巡回指导5次;洋浦工委党史学习教育领导小组办开展现场督导检查4轮。。儋州洋浦各基层党支部召开专题组织生活会，党员干部对照查摆问题共2022个，已全部完成整改。儋州各镇各部门聚焦群众关心关注的热点难点，召开座谈会，收集乡镇及企事业单位意见和建议28条，推动解决16条。,其他,0.7788824652452919,True
海南省,探索生态文明建设海南经验,2022-04-29,“省第八次党代会描绘了未来五年海南自贸港建设的宏伟蓝图，万宁市将紧扣习近平总书记考察海南重要讲话精神，全面、系统、深入地学习宣传贯彻省党代会精神，凝聚起高质量发展磅礴力量。”近日，万宁市委书记盖文启接受海南日报记者专访时表示，万宁市正通过市委理论学习中心组会议集中研讨学、市领导到驻点单位上党课带头学、分级分类举办培训班邀请专家授课深度学、党支部“三会一课”全体党员普遍学等多种形式，开展全覆盖学习研讨，并组织“8595”宣讲团，运用群众喜闻乐见的方式到基层开展宣传宣讲，确保将省第八次党代会精神学深悟透、入脑入心。。盖文启说，立足实际，万宁将把省第八次党代会精神细化为“一张张清单、一个个项目、一条条措施”，不折不扣抓好落实，争当高质量发展优等生，为加快建设具有世界影响力的中国特色自由贸易港贡献万宁力量。。以热作高新产业为重点构建现代产业体系。万宁将发挥资源、区位和科研优势，引进一批国家重点科研机构和团队，推动兴隆咖啡等特色产业规模化、标准化、品牌化发展，全力构建以热带特色高效农业、体育旅游消费、新型工业、海洋经济为主导的现代产业体系。坚持“项目为王”理念，招引一批产业项目落地建设，健全市领导从项目招引到落地投产运营的全流程服务机制，全力以赴促投资稳增长。。以发展体育旅游产业打造“活力海岸”。万宁将以冲浪为主打产业，推动“体育+旅游”产业融合发展，招引大型企业开发建设日月湾体育旅游示范园区。利用日月湾等湾区做好“旅游+消费”文章，常态化举办世界级冲浪赛事，衍生出精品体旅项目。每年固定举办3场以上精品沙滩音乐节，打造万宁沙滩音乐节固定“IP”，做大海湾“夜经济”，推动外来游客“玩在万宁、吃在万宁、住在万宁”。。以制度集成创新推进自贸港建设。配合省里做好封关运作准备和压力测试，高标准完成5个沿海综合执法点建设，抓紧抓实风险防控。全面深化“准入即准营”改革，将全市所有市场主体的历史数据录入“审管法信”四位一体信息系统，打通审批服务、事中事后监管和信用管理间的数据壁垒。完善信用惩戒体系，一体建设诚信政府、诚信企业和诚信个人。。以小海治理作为全省“六水共治”样板，打造最美滨海城市。加快打通小海南汊道疏浚潮汐通道，推进红树林种植、海草床修复与海藻种植，开展海洋碳汇增汇工作。建设万亩工厂化渔业养殖基地，稳妥有序引导3000名小海和老爷海渔民向工厂化养殖、向深远海养殖、向休闲渔业转产转业。依托热带雨林国家公园资源，形成山海联动，融合发展生态旅游和全域旅游。。以“时时放心不下”的责任感，把所有精力都用在让老百姓过好日子上。万宁持续推广“军训+职业技能培训”模式，引导农村劳动力就近就业及到企业务工。加快建设北师大万宁附小，积极争取省高职分校落户万宁，加快构建现代职业教育体系。深化“三医联动”改革，落实分级诊疗制度。发挥“万事通”APP平台大数据功效和网格员队伍作用，以“数字化+网格化”推进基层治理现代化。加快城市更新，推进老旧小区改造，建设宜居宜业宜游的美好城市。。以高质量党的建设引领经济社会高质量发展。万宁持续在全市建强基层党组织，扩大党组织有形有效覆盖。深入开展能力提升建设年活动，推动各系统干部成为所在领域的“行家里手”。完善引才、育才、用才、留才机制，以更加开放姿态和更高待遇吸引全国各地的优秀人才和万籍人才来万（回乡）干事创业。强化对各级领导班子特别是“一把手”的监督，以零容忍态度惩治腐败，在土地批租出让、项目招投标、工程建设等领域扎紧制度笼子，以清廉万宁建设为清廉自贸港建设探索路径。,其他,0.7251031437831751,True
海南省,年琼粤港澳美食文化交流系列活动圆满结束,2021-09-28,在中国共产党百年华诞的重大历史时刻，以习近平同志为核心的党中央立足百年党史新起点、着眼开创事业发展新局面作出重大战略决策——在全党开展党史学习教育。。令出即行。近一年来，海南深入学习贯彻习近平总书记在党史学习教育动员大会、庆祝中国共产党成立100周年大会、党的十九届六中全会上的重要讲话精神，将党史学习教育作为重要政治任务，精心组织实施、有力有序推进，求实、务实、扎实开展好各项工作。。慎始敬终，全省上下涌动着学史明理、学史增信、学史崇德、学史力行的热潮，党员干部受到了全面深刻的政治教育、思想淬炼、精神洗礼，各级党组织的创造力、凝聚力、战斗力大大提升，将学习成果转化为继续前进的勇气和力量，有力推动了海南全面深化改革开放和中国特色自由贸易港建设蓬勃展开。。省委始终把党史学习教育作为重大政治任务和重大政治责任来抓，坚持在顶层设计上下功夫，发挥领导干部“关键少数”作用，确保党史学习教育在海南落地生根、取得实效。。党史学习教育动员大会召开后，海南第一时间成立由省委主要领导担任组长的省委党史学习教育领导小组，抽调相关单位精干人员开展集中办公，建立了五级书记一起抓的工作机制，以更高的政治站位、更强的思想自觉和行动自觉推动形成上下联动局面。。以上率下、率先垂范——省委先后召开11次省委常委会会议、4次省委党史学习教育领导小组（扩大）会议，传达学习习近平总书记重要讲话精神和中央有关会议精神，研究部署我省党史学习教育工作。省级领导干部第一时间指导推动分管领域党史学习教育深入开展，第一时间进高校、进企业、进社区讲授党史学习教育专题党课，以普通党员身份参加所在党支部的专题组织生活会。。有条不紊，有序推进——全省党史学习教育动员大会、全省党史学习教育巡回指导工作会议、全省党史学习教育座谈会、省委党史学习教育领导小组（扩大）会议、海南省庆祝中国共产党成立100周年座谈会、省委七届十一次全会等会议先后召开，研究部署落实措施，交流学习经验做法，不断将党史学习教育引向深入。。科学指导，加强引领——《关于扎实有序开展党史学习教育工作的通知》《关于做好党史学习教育指定用书发行和使用工作的通知》《海南省党史学习教育党史专题宣讲方案》等文件密集下发，指导全省各地各部门把潜心自学作为重要基点、把集中学习作为重要方法、把现场学习作为重要形式突出抓好党史学习教育。。近一年来，省委主要领导积极带头开展各项学党史活动，通过一次次亲身示范，教育引导全省广大党员，在党史学习教育中启迪智慧、砥砺品格，继往开来、开拓前进。。夏季的海口骄阳似火，如这骄阳一般炽热的还有共产党员字字铿锵的入党誓词——“我志愿加入中国共产党，拥护党的纲领，遵守党的章程……为共产主义奋斗终身，随时准备为党和人民牺牲一切，永不叛党。”。位于海口市竹林里的中共琼崖一大旧址，是琼崖党组织的诞生地，是琼崖革命的历史坐标，在琼崖人民武装革命斗争史上具有划时代的重大意义。2021年7月1日，现职省级党员领导干部重温入党誓词暨新党员代表入党宣誓活动在这里举行。。省委书记沈晓明带领全体同志整齐列队，面对鲜红的党旗，举起右拳，庄严宣誓。久久回荡的宣誓声，阐明了新时代共产党员的责任与担当，许下了对党忠诚、永不叛党的坚定承诺。。在中共琼崖一大旧址，在母瑞山革命根据地纪念园，在《中国共产党人的家风》主题展展厅，在海口江东新区的工地，在洋浦保税港区码头……从红色教育基地到自由贸易港建设一线，现职省级领导干部带头深入基层，抓住各种机会、利用各类场景，向党员干部群众深刻阐述了开展党史学习教育的重大意义。,其他,0.8579796727072507,True
