province,topic,date,content,label,score,is_match
辽宁省,职称评审向抗疫一线专业技术人才倾斜,2020-02-18,8月29日，省委书记、省人大常委会主任张国清来到沈阳康平县和法库县，就深入贯彻习近平总书记重要指示精神，扎实践行新发展理念，因地制宜发展特色产业，全面推进乡村振兴进行调研。。位于康平县的沈阳富莱碳纤维有限公司主要从事高端碳纤维产品研发制造，其研发的改性石墨毡处于领先水平。在产品陈列室，张国清听取了石墨烯电池毡等产品介绍，并走进生产车间，了解生产工艺，询问科技研发、市场订单等情况。当听到今明两年订单饱满、现有产能已不能满足客户需求时，张国清鼓励企业加大研发投入，保持技术领先，在此基础上扩大再生产。张国清叮嘱市县政府和有关部门要在研发、融资等方面给予支持，主动服务企业实现更快更好发展。。法库县山山伟业食品有限公司是一家从事山楂果深加工的企业，带动当地1500余农户增收。张国清来到这家企业，察看山楂长势，观看产品展示，询问销售收入，鼓励企业不断提升品牌价值，拓展销售渠道，实现规模效益，带动更多农户增收。。辽宁联航神燕飞机有限公司是中国首批取得民航进口机型生产许可证的企业。张国清走进企业产品交付中心和组装生产车间，观看产品展示，考察组装调试生产线，与负责人和一线员工交流，鼓励企业继续加大人才引育力度，加强人才团队建设。张国清要求市县和有关部门要科学做好产业规划，大力发展上下游产业配套，做强做大通航产业。。张国清十分关心县域生态环境保护和生态文明建设工作。在我省最大的平原淡水湖泊——卧龙湖湿地生态保护区，张国清听取并考察了湿地生态保护、水资源开发利用和流域综合治理等工作。经过各级共同努力，卧龙湖湿地生态修复和综合治理取得明显成效，野生动植物种类丰富。张国清要求当地和有关部门在保护好生态前提下，做活水资源文章，把生态效益更好转化为经济效益、社会效益。。张国清强调，乡村振兴，关键是产业要振兴，要狠抓项目建设，积极谋划富有时代感的高质量项目，坚定不移走生态优先、绿色低碳的高质量发展道路，坚决遏制“两高”项目盲目发展。要立足本地资源禀赋，大力发展特色产业，延长农业产业链条，推进农村一二三产业融合发展。要完善乡村振兴项目和各类工商资本下乡项目与农民的利益联结机制，让农民更多分享产业增值收益。要坚持城乡统筹，强化以工补农、以城带乡，加快推进农业农村现代化。,其他,0.6492460596772632,True
辽宁省,李克强考察中国医科院早一天发现有效药这个病毒就不可怕了,2020-02-10,为深入贯彻习近平总书记关于退役军人工作重要论述，按照省委、省政府部署要求，做好常态化疫情防控形势下退役军人工作，5月16日至17日，省退役军人厅党组书记、厅长李国伟带领调研组到阜新市开展调研，实地了解退役军人合法权益维护、就业创业、服务保障体系建设等重点任务推进落实情况。。李国伟与阜新市委书记胡涛、市长周鹏举座谈交流，就做好退役军人工作交换了意见，市委常委、副市长赖化平陪同调研。期间，调研组实地考察了阜新市退役军人事务局“直播带岗”工作室、市退役军人事务服务中心军休干部东苑活动站、退役军人与就业创业金融服务驿站等；召开座谈会，全面了解阜新市退役军人工作开展情况，听取各方面关于加强和改进退役军人工作的意见建议。。李国伟指出，要胸怀“国之大者”，紧紧围绕“两个服务”，带着感情、带着责任，用心用情用力做好工作，让退役军人获得感成色更足。要深入学习贯彻习近平总书记关于加强和改进人民信访工作的重要思想，充分认识领会《信访工作条例》颁布实施的重要意义，切实维护退役军人合法权益，千方百计为退役军人排忧解难，着力在退役军人中营造办事依法、遇事找法、解决问题用法、化解矛盾靠法的良好环境。。李国伟强调，就业是民本之本、发展之基，做好退役军人就业创业是退役军人工作的重中之重。要认真贯彻落实国家和省关于就业创业工作的决策部署，贯彻落实全省稳就业工作会议、退役军人事务部高职扩招退役军人毕业生就业工作会议等要求，千方百计拓宽退役军人就业渠道，提供质量更优和覆盖面更广的就业服务，创造条件更好的就业环境，实现退役军人更高质量和更充分就业。抓住退役军人就业创业信息系统在我省试点时机，弄清做实数据，突出精准化、精细化服务，建立协作机制，加大培训力度，发挥就业率“指挥棒”作用，有针对地“稳就业”“促创业”。要着力打造“辽宁军创”品牌，举办及组织参加好首届创业创新成果展交流活动。要立足退役军人优势特长，推动退役军人在基层治理、乡村振兴、应急处突、志愿服务、国防教育等领域发挥积极作用。。李国伟要求，要浓厚尊崇尊重氛围。以双拥模范城中期考评为契机，紧贴部队急需、官兵急盼，深入落实“双清单”制度，推动形成双拥共建生动局面。抓实抓细优待、抚恤，着力提高优待证“含金量”，狠抓建档立卡、优待证申领发放等举措落实落地，不断增强广大退役军人和优抚对象的归属感、幸福感、荣誉感。要建强做实服务保障体系，充分发挥基层服务站功能，加强思想政治引领，做实常态化联系工作，为退役军人提供“全生命周期”服务，打造“退役军人之家”。要统筹疫情防控和退役军人工作开展，以“时时放心不下”的责任感，围绕“实”字做文章，凝聚共识、同频共振，不断推动退役军人工作再上新台阶。。李国伟对阜新市委、市政府高度重视、大力支持退役军人工作表示感谢，对阜新市在促进退役军人作用发挥、推动退役军人就业创业以及服务保障体系建设等方面的探索创新和取得的成效给予充分肯定。希望阜新市深化改革创新，精准精细服务，为全省退役军人工作高质量发展创造经验，以优异成绩迎接党的二十大胜利召开。,其他,0.651280928918661,True
辽宁省,我省举办文化市场综合执法岗位练兵技能竞赛,2022-12-17,为深入贯彻习近平生态文明思想，经党中央、国务院批准，根据中央生态环境保护督察工作领导小组第二次会议精神，中央第二生态环境保护督察组近日进驻辽宁省开展生态环境保护督察。4月6日，督察进驻动员会在沈阳召开，督察组组长朱之鑫、副组长刘炤就做好督察工作分别作了讲话，省委书记张国清进行了进驻动员，省委副书记、省长刘宁主持。。朱之鑫指出，党的十八大以来，以习近平同志为核心的党中央高度重视生态文明建设和生态环境保护，将生态文明建设纳入中国特色社会主义事业“五位一体”总体布局和“四个全面”战略布局。习近平总书记亲自谋划部署、亲自指导推动，提出一系列新理念新战略新举措，形成习近平生态文明思想，成为全党全国推进生态文明建设和生态环境保护、建设美丽中国的根本遵循。。2020年以来，面对错综复杂的国际形势、艰巨繁重的改革发展稳定任务，特别是新冠肺炎疫情严重冲击，习近平总书记始终心系生态文明建设和生态环境保护，在赴地方考察，以及出席国内外重大会议时，反复强调要牢固树立绿水青山就是金山银山的理念，坚持生态优先、绿色发展，并向国际社会作出了二氧化碳排放力争于2030年前达到峰值，努力争取2060年前实现碳中和的庄严承诺。这充分体现了党中央坚持新发展理念的战略定力和推进生态文明建设的坚定决心。。学习贯彻党的十九届五中全会精神，是当前和今后一段时期重要的政治任务。深入领会党的十九届五中全会精神，关键在于准确把握立足新发展阶段，贯彻新发展理念，构建新发展格局的核心要义和战略考量，把思想和行动统一到党中央的重大判断和决策部署上来。要充分认识生态文明建设和生态环境保护是党和国家事业的重要组成部分，充分发挥生态环境保护的引导和倒逼作用，促进经济社会发展全面绿色转型，让绿色成为高质量发展的鲜明底色。。朱之鑫强调，中央生态环境保护督察是贯彻落实习近平生态文明思想，推动高质量发展的重大制度安排，这一批督察是“十四五”开局之年的首批督察，要深入学习贯彻党的十九届五中全会精神，立足服务国家发展大局，坚持系统观念，坚持问题导向，坚持精准、科学、依法，统筹把握好督察方向和重点。将重点关注习近平总书记等中央领导同志有关生态环境保护重要指示批示件的办理情况；辽宁省推动高质量发展情况，特别是严格控制“两高”项目盲目上马，以及去产能“回头看”落实情况；党中央、国务院有关重大战略部署贯彻落实情况；重大环境污染、生态破坏、生态环境风险及处理情况；第一轮督察及“回头看”发现问题整改落实情况；人民群众反映突出的生态环境问题立行立改情况；生态环境保护思想认识、责任落实，党政同责、一岗双责落实情况等。。张国清表示，开展生态环境保护督察，对辽宁贯彻落实习近平生态文明思想和党中央、国务院关于生态文明建设和生态环境保护工作的决策部署，深入打好污染防治攻坚战，推进绿色低碳发展，必将起到有力的推动作用。我们要自觉接受、主动配合中央生态环境保护督察，以高度负责的精神和严肃认真的态度，做好情况汇报、资料提供、协调保障、督察整改、信息公开等各项工作，确保督察工作顺利推进，取得实实在在的效果。我们要把接受生态环境保护督察作为重大契机，完整、准确、全面贯彻新发展理念，坚定不移走高质量发展道路，加强生态环境保护、治理和修复，努力提升生态文明建设水平。,其他,0.7720845953333638,True
辽宁省,李克强要想尽一切办法让中小微企业和个体户生存下来,2020-03-20,8月1日至2日，省委副书记、代省长刘宁在盘锦市和营口市调研时强调，要深入贯彻习近平总书记在中共中央政治局会议上重要讲话精神，落实省委十二届十三次全会部署要求，坚持新发展理念，毫不放松抓好常态化疫情防控，扎实做好“六稳”工作，全面落实“六保”任务，努力完成全年经济社会发展目标任务。。盘锦缘油而建、因油而兴。刘宁实地考察辽河储气库群、信汇新材料和宝来集团项目建设现场，他强调，要认真贯彻习近平总书记关于东北、辽宁振兴发展的重要讲话和指示批示精神，充分发挥重大项目建设对经济社会持续健康发展的关键性、引领性和支撑性作用，对标国际先进，对接市场需求，创新体制机制，激发各类市场主体活力，大力提升产业发展水平和竞争力。。期间，刘宁主持召开座谈会，听取我省与国家发展改革委会商成果落实，压小上大、推动现实生产力提升、加快石化产业转型升级情况。他指出，要坚持以供给侧结构性改革为主线，腾笼换鸟、握拳聚力，下大力气优布局、补链条，积极开拓市场，拓展融资渠道，推动石化产业集群式联动和全产业链发展，加快打造世界级石化产业基地。要坚决守住生态环保和安全生产两条底线，在危机中育新机、于变局中开新局，抢占行业制高点，打造经济增长点，为辽宁全面振兴提供强有力的能源保障和产业支撑。。调研中，刘宁来到盘锦中蓝电子和营口金龙集团、金天马专用车制造、华峰动力等企业，了解市场开拓、创新驱动、产业结构优化升级情况。他强调，要深入贯彻习近平总书记在企业家座谈会上的重要讲话精神，大力弘扬企业家精神，发展战略性新兴产业，把实体经济特别是制造业做实做优做强。。在辽宁自贸试验区营口片区政务服务中心、网红自贸小镇和营口人力资源服务产业园，刘宁强调，要深入贯彻习近平总书记在吉林考察时重要讲话精神，着力培育市场化法治化国际化营商环境，推动经济高质量发展。要坚定不移落实就业优先政策，以创新促创业，以创业保就业，全力稳住就业基本盘。。在营口港盖州物流有限公司、中粮糖业辽宁有限公司和仙人岛码头有限公司，刘宁指出，盘锦和营口作为沿海开放城市，要认真贯彻党中央决策部署，落实好省委全会精神，更好统筹疫情防控和经济社会发展工作，实行口岸人物同查，严防疫情境外输入，坚决守好疫情防控的国门。,政府领导到其他城市考察学习或访问,0.0,True
辽宁省,夏德仁会见法国北方华人协会代表团,2019-11-22,6月7日，高考第一天，省委副书记、省长刘宁来到鞍山市国家教育考试考务指挥中心，视频调度全省高考组织工作，并实地考察鞍山第一中学考务管理工作。他强调，今年是我省新高考首考之年，各地各相关部门要深入贯彻落实习近平总书记关于教育的重要论述，严之又严抓牢考试安全，实之又实抓紧服务保障，细之又细抓好疫情防控，确保新高考首考安全有序、万无一失。。刘宁指出，此刻，新高考首考战役已经打响，要保持高度戒备，坚持常抓不懈，把各种可能出现的场景考虑周全，决不能顾此失彼。要科学周密部署，强化服务保障，坚决做好常态化疫情防控，决不能掉以轻心。要把考卷安全放在第一位，严加守护、严密防护，决不能有任何闪失。要强化考务组织，切实把考试规则、管理流程、依法治考等各项要求贯穿全过程，决不能麻痹松懈。要坚决扛起责任，严肃考风考纪，每个环节都要落实责任人，每个细节都要尽到责任心，把责任留给自己，把机会留给考生，以新高考工作的“零差错”“零失误”“零事故”，确保首考必胜、首考必成、首考必得。。走进鞍山第一中学考点，刘宁实地检查入校体温检测、试题试卷保密、考场实时监控情况。他强调，要以对党和人民极端负责的态度，采取人技联防、一岗多控等措施，坚决防止有损教育公平事情发生。要为考生在志愿填报、政策解读等方面提供细致服务，务求圆满完成高考各项工作。随后，他来到守候在考场外的家长中间，与大家亲切交谈。他说，你们放松了孩子才能不紧张，要舒缓好孩子情绪压力，鼓励他们轻装上阵、从容应试，发挥最好水平，考出理想成绩。。在鞍期间，刘宁还考察了南沙河流域水环境综合整治、二三街坊社区老旧小区改造情况，强调要坚持以人民为中心的发展思想，深入实施城市更新行动，高质量高标准做好生态修复、城市修补，完善功能，美化环境，提升品质，更好满足人民群众对美好生活的需要。,其他,0.9899107135023892,True
辽宁省,全面振兴全方位振兴谱新篇,2022-06-01,11月5日至8日，市长张成中率队赴上海参加第三届中国国际进口博览会，走访参会企业，考察产业项目，并在上海、江苏无锡、山东蓬莱等地开展上门招商活动。。第三届中国国际进口博览会是在疫情防控常态化下我国举办的一场重大国际经贸活动。在进博会现场，张成中结合阜新市产业发展实际，重点参观了技术装备、汽车、食品及农产品等展区，并走访正大集团等企业展区，与展区负责人深入交流，详细了解新技术、新产品、新趋势，探讨合作发展机会。。在沪期间，张成中专程到深兰科技（上海）有限公司，与董事长陈海波举行工作会谈，并共同见证了阜新百年国际赛道城与深兰科技智慧公共交通示范区域项目签约。张成中表示，希望以此次签约为新起点，通过项目合作，把阜新百年国际赛道城建设成废弃矿山综合治理的示范项目，让现代科技为高质量发展赋能。陈海波表示，将进一步加强沟通对接，发挥核心技术优势，在城市智能化、工业智能化、教育智能化等方面开展务实合作。。7日下午，张成中到远景能源江阴制造总装基地开展上门招商、敲门招商，深入对接源网荷储一体化示范项目。他希望双方密切配合，确保阜蒙县智能风机总装基地项目早日建成投产，进一步做好源网荷储项目规划等前期工作，推动合作再上新台阶。远景集团副总裁胡迎春表示，将加快推进新能源装备产业园项目进程，拓宽合作领域，助力阜新转型发展。。活动期间，张成中赴山东蓬莱大金海洋重工有限公司实地参观，推进大金辽宁（阜新）风电产业园项目合作，双方就阜新公司做大做强、加快产业园项目建设等方面达成广泛共识。6日下午，张成中还随省政府领导赴北京推进巴新铁路路矿一体战略重组工作，参加会见了中国信达总裁张卫东。。8日，张成中在北京拜访了中国工程院院士欧阳晓平，双方就电解制氢、石墨烯电池及新能源车、环保产业等方面进行了深入交流。他希望欧阳院士团队指导支持阜新，团队和阜新市尽快形成全面对接合作机制，与阜新开展更紧密合作，推动更多创新成果在阜新转化落地。欧阳晓平表示，阜新市对创新科技成果转化的重视程度、敏锐性和前瞻性谋划让团队对阜新市未来充满信心，团队和阜新将在成果孵化、产业转化等方面进行全面对接合作，并将于近期率队到阜新深入考察交流。团队将着力把最前沿的创新成果转化为阜新转型振兴的强大动力。,政府领导到其他城市考察学习或访问,0.8536368316094548,True
辽宁省,大力发展特色产业全面推进乡村振兴,2021-08-30,9月5日，辽宁宝来企业集团利安德巴赛尔工业公司合资合作谅解备忘录签署及政府支持协议签约仪式在盘锦举行。省委书记、省人大常委会主任陈求发出席仪式，会见利安德巴赛尔工业公司总裁鲍勃·帕特尔，并考察辽宁宝来企业集团轻烃综合利用一期项目建设情况。。辽宁宝来企业集团与利安德巴赛尔工业公司开展合资合作，共同建设轻烃综合利用及产业链延伸项目，这是省委、省政府深入贯彻落实习近平总书记在辽宁考察时和在深入推进东北振兴座谈会上重要讲话精神，全面扩大高水平开放，解决“原”字号“初”字号产品居多问题，实现产业提档升级、提质增效的又一标志性成果。。辽宁宝来企业集团是中国民营企业500强，是集石油化工、精细化工、成品油批发、物流贸易于一体的现代企业集团。世界500强企业利安德巴赛尔工业公司是一家注册在荷兰、运营总部位于美国和英国的跨国化工公司，产品遍布120多个国家和地区。利安德巴塞尔公司抓住中国进一步扩大对外开放的重大机遇，决定投资辽宁，与辽宁宝来集团开展合资合作，为辽宁优化石化产业布局、加快实现产业链现代化提供了新动力，同时也为企业自身拓展中国市场、优化全球布局、实现合作共赢创造了更为广阔的新空间。。会见中，陈求发代表省委、省政府，对鲍勃·帕特尔一行的到来表示欢迎。陈求发指出，这次辽宁宝来集团与利安德巴赛尔公司签署合资合作谅解备忘录，是强强联合、优势互补、互利共赢的战略性合作。辽宁是中国重要的工业大省，工业门类齐全，制造业实力强。辽宁也是重要的科教大省，有115所高等院校，职业教育发达，对工业发展的支撑强而有力。在中央高度重视、大力支持下，辽宁正在加快推进全面振兴、全方位振兴，各地呈现出竞相发展的积极态势。利安德巴赛尔公司选择落户辽宁，与辽宁宝来集团展开合作恰逢其时。希望双方充分发挥各自优势，加快建设进度，同步推进一二期项目，力争早日投产、早日抢占市场、提高市场份额，不断把双方优势转化为更大合作成果。辽宁省委、省政府及盘锦市将一如既往地支持双方合资合作，实现更好发展。。鲍勃·帕特尔感谢辽宁省及盘锦市党委、政府对双方合作给予的大力支持，表示与辽宁宝来集团的合作将成为利安德巴赛尔公司发展中的里程碑，坚信双方合作一定会取得成功。,其他,0.5749602786374292,True
辽宁省,中央第二生态环境保护督察组督察辽宁省动员会在沈阳召开,2021-04-07,6月17日至18日，省委副书记、省长李乐成在大连庄河市、丹东东港市调研时强调，辽宁发展壮大海洋经济优势突出，加快形成海洋新质生产力大有可为。要深入贯彻习近平总书记关于东北、辽宁全面振兴重要讲话和指示批示精神，按照省委部署要求，坚持生态优先，加快文旅融合，促进海洋生态与海洋产业协同发展，在全面振兴新突破三年行动中推动海洋经济强省建设迈上新台阶。。庄河港是国家一类开放口岸。在货运码头，门机舞动长臂，作业繁忙有序。李乐成现场考察港口建设、管理、运营情况，他表示，辽宁港口资源得天独厚，希望庄河港瞄准功能定位，大力推进港口智慧化绿色化建设，提升航运服务能力，促进物流降本增效，更好发挥港口以点带面、以一域服务全局的作用。。我省海洋空间资源丰富，海岛众多，如同珍珠镶嵌在渤海和黄海之上。李乐成一行先后登上庄河的海王九岛和东港的大鹿岛，实地察看生态环境、村容村貌，详细了解海洋产业、文旅项目、民生保障等情况。他指出，海岛是辽宁独特的资源和财富。要把保护生态环境摆在优先位置，坚持绿色发展，守护蓝色家园。要立足自然地理位势，大力发展海洋经济，积极推进海洋产业改造升级“老字号”、深度开发“原字号”、培育壮大“新字号”，不断提高海洋产业对经济增长的贡献率。海王九岛和大鹿岛要分别瞄准创建国家级旅游度假区和国家5A级旅游景区目标，着力提升基础设施、公共服务水平，深度挖掘并讲好海岛的历史文化故事、自然生态故事、百姓共富故事，更好推动文旅融合。在前往海王九岛时，他沿途考察庄河海上风电项目和海洋牧场，希望当地发挥资源优势，大力发展风电等清洁能源，厚植高质量发展的绿色底色。践行大食物观，持续耕海牧渔，筑牢“蓝色粮仓”。他走进庄河市王家镇智慧海岛综合协同指挥中心，察看海上监管平台，强调要以港定船、以港管船，落实好党员干部包保责任制，确保水上运输和渔业安全。。李乐成来到中国船舶集团所属大连海装风电设备有限公司，了解生产经营情况，希望企业持续加强技术研发，提高本地配套率和产品综合竞争力。在大连富谷现代渔业生态园区，他察看养殖车间，勉励企业在种质资源保护、品种选育、良种繁育等方面下功夫，做优精深加工，延长产业链条，提升品牌形象，在推动海洋牧场一二三产业融合发展上奋楫争先。李乐成还前往丹东大东沟边民互市贸易区调研，要求完善边民贸易、落地加工、仓储物流等功能，促进人员往来和边民增收致富。,政府领导到其他城市考察学习或访问,0.6206766975361976,True
