province,topic,date,content,label,score,is_match
辽宁省,姜小林田树槐出席招商推介会,2020-08-24,6月10日上午，市委书记王德佳会见了专程来锦州市参加锦州·江浙精细化工产业合作推进活动的常州滨江经济开发区党工委书记胥亚伟一行。。会见中，王德佳代表市委、市政府对胥亚伟及数十位江浙企业家的到来表示欢迎。他说，当前，锦州正处于加快振兴发展的关键时期，全市上下围绕贯彻落实习近平总书记在辽宁考察时和在深入推进东北振兴座谈会上重要讲话精神，大力实施对外开放、创新驱动、以港兴市、工业强市、生态立市五大战略，正在全面加快辽西区域中心城市和美丽宜居充满活力的现代化港口城市建设。发展精细化工产业，锦州有传统、有优势，希望以此次推介为契机，加强对接合作，盘活资产，延长产业链条，携手做大做强石化板块。。近年来，锦州通过一系列“放管服”改革，不断提高工作效能，营商环境持续优化，真诚欢迎江浙企业家来锦州投资兴业，市委、市政府将一如既往地全力支持企业发展，做优服务，推动项目落地建设。。胥亚伟简要介绍了滨江经济开发区的发展历程和现状，同时表示愿意加强与锦州滨海新区展开进一步的交流与合作，共同努力帮助企业打造最佳的发展平台，加快提档升级，实现互利共赢。。随后，王德佳和胥亚伟还一同出席了已落户滨海新区产业园区的信凯实业有限公司1万吨偶氮染颜料及3000吨中间体项目开工奠基仪式。来锦的江浙企业家们还对滨海新区化工园B区和锦州港进行了实地考察，同时参观了阳光能源、汉拿电机等企业。,其他,0.922805094651602,True
辽宁省,田树槐率团访问日韩推进合作项目,2019-12-10,5月13日，铁岭市委书记、市人大常委会主任李士伟会见来铁岭市考察的腾讯云东北区总经理阎旭一行。。李士伟代表市委市政府对阎旭一行的到来表示欢迎，他说，铁岭生态环境优美，区位优势明显，自然资源富集，干事创业氛围浓厚，是一座具有鲜明特色、极具发展潜力的城市。腾讯公司是中国知名的互联网企业，在技术、人才、资金等方面占据领先、走在前列。希望阎旭女士以此次交流考察为良好开端，在铁岭多走走、多看看，与铁岭各界加深交流、互通有无，进一步深化各地各部门对互联网行业发展的认识，更好地践行创新发展理念。同时，希望腾讯公司紧跟国家政策导向、选准发展契合点，在数字经济、大数据服务平台建设等方面与铁岭加强合作，为铁岭乃至东北转型升级发展带来新技术、培植新业态、激活新动能、提升新境界。市委市政府将持续优化营商环境，为企业在铁投资兴业提供优质高效的服务。。阎旭表示，铁岭产业基础扎实，要素成本低廉，后发优势明显，在铁岭投资兴业大有可为。公司将以此次考察为契机，为铁岭量身定制合作规划，在数字经济升级、健康产业发展等方面与铁岭开展务实对接，尽快进入操作层面，早日实现共赢发展。,政府领导到其他城市考察学习或访问,0.0,True
辽宁省,王德佳会见常州滨江经济开发区党工委书记胥亚伟一行,2020-06-11,7月20日上午，市长张成中在市西山宾馆会见了北京首食供应链管理有限责任公司董事长兼总经理孙子涵一行。。张成中对孙子涵一行来阜考察投资表示欢迎。他说，阜新是农业大市，是全国重要的商品粮、畜牧业基地。近年来，阜新市高度重视农产品加工业发展，“双汇”“新希望六和”“伊利”“鲁花”等一批农产品加工龙头企业先后落户阜新，为阜新市建设打造东北地区农产品加工业核心区和京津冀地区副食品供应基地注入了强劲动力。欢迎“首食供应链公司”深入阜新考察对接，与阜新市农事企业开展深度合作。希望发挥品牌、平台优势，积极宣传推介阜新市特色优势农畜果蔬产品，让北京的“菜篮子”装入更多“阜新菜”。阜新市将全力为双方合作营造良好环境，提供优质服务，实现互利共赢发展。。孙子涵表示，阜新农业资源丰富，产业基础好，双方合作前景十分广阔。下一步将深入考察对接合作，发挥公司优势，积极助力阜新现代物流、品牌培育、农产品质量体系构建，助力阜新农业增效、农民增收。,政府领导到其他城市考察学习或访问,0.0,True
辽宁省,习近平在广东考察调研,2023-04-11,8月23日，省委书记、省人大常委会主任张国清，省委副书记、省长李乐成在沈阳会见了中国人民保险集团党委书记、董事长罗熹一行。。张国清、李乐成代表省委、省政府，对中国人保集团在金融服务实体经济、保障改善民生和加强社会治理精细化等方面给予辽宁的支持表示感谢。张国清说，习近平总书记对辽宁高度重视、深情牵挂、亲切关怀。在全面振兴全方位振兴关键时期，习近平总书记再次亲临辽宁考察调研，要求辽宁在新时代东北振兴上展现更大担当和作为，全省干部群众备受鼓舞、充满干劲。我们正深入学习贯彻习近平总书记重要讲话精神，以更高站位、更大格局谋划推动辽宁振兴发展，努力在新时代东北振兴中发挥更大作用，更好履行维护国家“五大安全”政治使命，加快实现全面振兴全方位振兴新突破，形成对国家重大战略强有力支撑。希望中国人保集团继续支持辽宁振兴发展，希望双方在履行维护国家“五大安全”政治使命、做好结构调整“三篇大文章”等方面，找好切口、加深合作，不断创新金融产品供给，更好发挥金融保险作用，共同为实现国家科技高水平自立自强、维护产业链供应链安全可控贡献智慧和力量。。罗熹感谢辽宁省委省政府给予企业发展的支持，表示中国人保集团将进一步加大力度，精选项目，继续在辽宁扩大投资，提供更多金融保险服务，更多参与、更好支持辽宁振兴发展。。随后，张国清、李乐成、罗熹共同出席辽宁省政府与中国人保集团合作备忘录签约仪式。根据合作备忘录，双方将在支持实体经济转型发展、助力民生领域建设、推动绿色低碳转型、支持“走出去”战略、服务社会治理创新等方面加强合作、共谋发展。,其他,0.6235647654692887,True
辽宁省,李士伟会见腾讯云东北区总经理阎旭,2020-05-14,"北京鞍山企业商会成立仪式 暨“鞍山振兴 邀您共赢”主题推介会及项目签约仪式在京举行。12月11日，北京鞍山企业商会成立仪式在京举行，市委副书记、市长余功斌出席仪式，并亲自洽谈推动京津冀企业与鞍山合作项目。。余功斌指出，在习近平总书记亲自关怀推动下，东北振兴战略深入实施，辽宁“一圈一带两区”布局渐次展开，鞍山市“两翼一体化”经济发展战略有力推进，“人人都是营商环境、个个都是开放形象”的理念深入人心，鞍山进入了新发展阶段，具备全面振兴、全方位振兴的“天时”、“地利”、“人和”，投资机遇良多，合作空间广阔。。余功斌强调，广大鞍商是鞍山最珍贵、最有潜力的战略资源。北京鞍山企业商会要牢记宗旨、找准定位，当好广大鞍商的“引路者”“联络员”和“娘家人”，多做了解需求、反映诉求、助力发展的工作，以实际行动体现商会大家庭的温暖，更好地把广大鞍商团结起来、凝聚起来、组织起来。同时，抓住历史机遇，发挥纽带作用，做好展示鞍山、宣传鞍山的窗口，引导广大鞍商坚持产业报国、心系鞍山，以各种方式支持、参与家乡建设，吸引更多的优秀企业家、高层次人才到鞍山投资兴业、共创未来。。在京期间，余功斌率队考察了航天科技集团、中国节能环保集团有限公司、北京中央金创金融服务股份有限公司等重点企业，会见了红色江山集团有限公司、河北沙河市鑫磊实业集团有限公司、今麦郎集团、北京北元电器有限公司、北京易子微科技有限公司等客商，洽谈推进15个项目。会见和考察过程中，余功斌详细介绍鞍山资源优势、产业基础、政策环境和发展规划，并诚挚邀请京津冀地区企业来鞍开拓市场、投资兴业。与会企业家表示，对鞍山全面振兴、全方位振兴前景满怀期待，对鞍山发展环境充满信心，愿意与鞍山加强交流合作，积极推进在谈在建项目,吸引上下游企业来鞍考察投资。",政府领导到其他城市考察学习或访问,0.0,True
辽宁省,习近平在内蒙古考察时强调把握战略定位坚持绿色发展奋力书写中国式现代化内蒙古新篇章,2023-06-08,9月23日上午，市委书记王德佳主持召开市委常委会(扩大)会议，传达习近平总书记在湖南调研时的重要讲话精神、习近平总书记在长沙主持召开基层代表座谈会上的重要讲话精神、习近平总书记致中国延安精神研究会第六次会员大会的贺信和省委书记张国清在全省港口整合与发展座谈会上的讲话精神、省长刘宁率省党政代表团赴江苏省考察交流工作时的讲话精神，并研究部署锦州市贯彻落实工作。市人大常委会主任张晓光、市政协主席韩彤出席会议。。会议强调，一是全力推动高质量发展。要认真贯彻新发展理念，坚持稳中求进工作总基调，扎实做好“六稳”工作，全面落实“六保”任务，高质量高标准编制好“十四五”规划。二是深入实施乡村振兴战略。深化农业农村改革，推进农业供给侧结构性改革，确保粮食安全。全面推广义县、北镇“三变”改革经验，发展壮大村集体经济。建立健全防止返贫长效机制，高质量完成脱贫攻坚任务。三是扎实推进生态文明建设。要坚决打好蓝天、碧水、净土保卫战，确保高标准完成中央和省环保督察整改任务。四是树牢以人民为中心的发展思想。全面强化就业优先政策，做好重点群体就业工作。五是不断锤炼优良的干部作风。始终把党的政治建设摆在首位，持之以恒推进党风廉政建设和反腐败斗争，推动全面从严治党向纵深发展。。会议指出，延安精神是中华优秀传统文化的继承和发扬。要把习近平总书记的贺信学习领悟好、贯彻落实好。要把延安精神与新时代辽宁精神、辽沈战役精神结合起来，在创新和突破上下功夫，力争在延安精神的学习、宣传、弘扬、践行方面探索出新方法和新路子。同时，深入挖掘锦州市红色历史文化，进一步保护和利用红色旅游资源，持续做大做强锦州市红色旅游品牌。。会议要求，要提高政治站位，充分认识到“以港兴市”的重要性，加快构建“大港口、大物流、大产业、大城市”的发展新格局。要全力支持全省港口整合发展，抢抓机遇，率先突破。要大力服务锦州港快速发展，严格对标对表省相关会议要求，确保省委、省政府各项决策部署在锦州落实落细落到位。。会议强调，要深入贯彻落实好中央和省对口合作部署安排，开展好与苏州的对口合作工作。要学习苏州的先进理念和成功经验，不断创新体制机制，补齐经济发展短板。要依托锦州市省级以上经济开发区设立的“飞地园区”，有效承接苏州等先进地区产业转移。要加快推进对口合作项目建设，争取早日竣工达产。要加快将锦州市的资源优势与苏州的资本优势有机结合，努力实现合作互补双赢。此外，还要不断提高对口合作的广度和深度，确保各项对口合作任务圆满完成、取得实效。,其他,0.5496394002423373,True
辽宁省,调查研究关键看实效人民论坛,2023-08-28,6月15日，沈阳市党政代表团到大连市考察调研，并举行沈阳市·大连市合作交流座谈会。省委副书记、沈阳市委书记王新伟，省委常委、大连市委书记熊茂平出席会议并讲话。。区域协调发展是推动高质量发展的重要内容，是推进中国式现代化辽宁实践的关键支撑。沈大强，则辽宁兴。沈阳、大连两市把持续深化交流合作，作为深入贯彻习近平总书记关于东北、辽宁全面振兴的重要讲话和指示批示精神，全面落实省委决策部署的具体举措，进一步拓宽合作领域、深化合作层次，深入实施全面振兴新突破三年行动，携手当好辽宁打造新时代“六地”排头兵。。两市表示，今后双方在构建现代化产业体系、推动科技创新、强化对外开放、促进文体旅融合、深化市场合作、发展社会事业、健全合作机制等方面协同发力，不断拓展合作空间、提升合作水平，清单化、项目化、工程化抓好合作事项落实，奋力谱写沈大合作交流新篇章。会上，两市签署共同深化沈大合作交流框架协议。。在连期间，沈阳市党政代表团先后到大连冰山集团有限公司、斯凯孚（大连）轴承与精密技术产品有限公司、RCEP（大连）国际商务区、大连融科储能技术发展有限公司、中国科学院大连化物所等进行了考察。,政府领导到其他城市考察学习或访问,0.506104709821681,True
辽宁省,弘扬雷锋精神推动辽宁振兴发展取得新突破人民要论,2023-03-15,20多年前，时任福建省省长的习近平来到南平市光泽县调研。在与江西省紧邻的止马镇杉关村，习近平与几位农民聊了起来。。“我们这里不通有线电视，用小锅盖收台，因为靠近江西，平时新闻里看到的都是江西的省长，就是没见过我们自己的省长！”。农民又举例说，因为两省边界地区长途电话不通，要到邻近的江西邮局打长途电话到省内，省内长途变成了省际长途，既多花钱又不方便。。看得深——“近的远的都要去，好的差的都要看，干部群众表扬和批评都要听，真正把情况摸实摸透”。。听得深——“要用好交换、比较、反复的方法，重视听取各方面意见包括少数人的意见、反对的意见”。。2004年3月的一个下午，时任浙江省委书记习近平坐上了嘉兴101路公交车，调研城乡基础设施建设一体化。。“现在不管是城里、农村，公交车都由公交公司统一运营。座位多了，车里也宽敞了，沿线有固定的停靠站点，还有规范的发车时间，乘客满意多了。特别是沿线的农民，进趟城比以前方便很多哩。”小金很自豪。。调研过程中，有村民反映，余新镇乍嘉苏高速公路接口处人来车往，希望能安装交通红绿灯。习近平当即要求有关部门解决。。从公交车售票员、多位村民再到政府工作人员，习近平带着问题而来，看得仔细、问得深入。。调研中，习近平一般不打招呼、不让人家事先准备，而是直接下乡、下厂、入户，在他看来，要同群众身挨身坐、心贴心聊才能听得到他们的真实想法。。△2012年12月30日，在河北省阜平县龙泉关镇骆驼湾村，习近平总书记看望唐荣斌老人一家。。在一次全国两会“下团组”时，习近平总书记说：“我如果光是看好地方，就难免乐观，感觉指日可待，就会作出错误决策。不要文过饰非，不要因为我们看了心情沉重就遮遮掩掩。”。志不求易，事不避难。在考察调研时，习近平总书记沿着弯曲狭窄的通道走进北京雨儿胡同的大杂院，听取老街坊对老城区改造的想法；来到大凉山深处的土坯房，同乡亲们展开“火塘对话”谋划精准脱贫之策；在贵阳一社区便民服务大厅，翻看群众工作来访台账，仔细询问“居民们平时都反映哪些问题比较多？”。1983年夏收后的一天，在河北正定县委工作的习近平骑车来到永安公社三角村村外，十来个人正在锄草、间苗。看到地头还放着几把锄头，习近平就拿起锄头下了地。。干完了活，习近平站起身擦了把汗，跟生产队长说明了来意：“队长，我们是来向大家征求意见的，趁着歇晌咱们一起开个会吧。”。大伙儿七嘴八舌，“三角村离县城很近，种点经济作物供给县城，不是更好吗？”听到大家的建议，习近平当场表态：“这个问题我们会认真研究。”。△今年4月11日，在广东茂名高州市根子镇柏桥村荔枝种植园，习近平总书记同现场技术人员亲切交流。。群众作为面对问题、备受问题困扰的当事人，对这些问题了解最多、体会最深，也往往对破解问题有着独到见解和认识。。2020年9月，习近平总书记在湖南长沙主持召开基层代表座谈会，就“十四五”时期经济社会发展问计于民。农民工、快递员、乡村教师、餐馆店主、货车司机等都被请进会场。会上的一段话，令大家深受感动——。“大家都处在改革发展和生产一线，参与经济社会生活最直接，同群众联系最经常，对党的路线方针政策落地见效感知最真切，提出的意见和建议能够更加贴近基层实际、反映群众心声。”。近期在广东考察时，习近平总书记也召开了一场别开生面的“调研会”。参加调研的有战略科学家、企业家、科技人员、大国工匠，还有外资企业代表……大家踊跃发言，习近平总书记凝神倾听。他指出：“经济要持续发展，不要大起大落。这里面很重要的就是科技、教育、人才。”。调查研究求“深”，就要真正发现群众面临的问题，反映群众的意见呼声，总结群众创造的经验，才能获得真知灼见的源头活水。,政府领导到其他城市考察学习或访问,0.5367820598436945,True
辽宁省,牢牢把握重要使命展现更大担当作为,2023-09-29,3月10日，省委教育工委副书记、省教育厅党组书记、厅长冯守权一行到鞍山职业技术学院、鞍山师范学院、辽宁科技大学和岫岩县一中调研指导学校内涵发展工作。他强调，要全面贯彻党的教育方针，落实立德树人根本任务，紧密结合辽宁发展实际，奋力推进高质量教育体系建设。要深入贯彻“带头抓落实、善于抓落实、层层抓落实”专项行动要求，把狠抓落实作为学校各项工作的主基调，增强转变工作作风抓落实的思想自觉、政治自觉和行动自觉，用创新的思路解决好事业发展中的问题，全面提升我省人才培养质量，提高教育服务辽宁振兴的竞争力、创新力、贡献力、影响力，为加快推进教育现代化、建成教育强省贡献力量，以优异成绩庆祝建党100周年。。在鞍山职业技术学院调研时，冯守权一行考察了现代制造技术、现代服务、交通运输等实训基地，听取了学校工作汇报。他强调，学校要紧紧围绕辽宁“十四五”期间重点产业发展，加强高职专业建设，强化内涵发展，深化校企合作，办出品牌特色，推动学校做大做强做精，为辽宁经济社会发展提供高层次技术技能人才保障。。冯守权在鞍山师范学院考察了教师教育中心，听取了学校有关工作汇报，并与在场师生进行了亲切交流。冯守权对学校师范生培养工作给予肯定，并强调，学校要充分发挥区域优势，科学制定“十四五”发展规划，主动融入地区发展，不断提升办学实力；要坚持立德树人、以人为本，积极探索教考分离，不断提高人才培养质量；要坚守教师教育办学特色，加强师范生师德师风和文明养成教育，进一步提升师范生培养质量，着力培育新时代“四有好老师”。。在辽宁科技大学调研时，冯守权一行到产品设计专业玉雕专业实验中心和省镁质材料工程技术研究中心，了解学校科技成果转化、菱镁产业研究、玉雕专业实习实训及产教融合等情况。他强调，要紧紧围绕做好“三篇大文章”，结合鞍山菱镁、玉雕等产业的转型升级，进一步深化校地合作、校企合作，做辽宁创新发展的支持者、服务者与践行者，为辽宁经济社会发展作出更大贡献；要开展好党史学习教育，通过学史明理、学史增信、学史崇德、学史力行，悟创新理论伟力，强“两个维护”自觉，守立德树人初心使命，开学校高质量发展新局。。在岫岩县一中，冯守权与岫岩县一中、龙潭中学、偏岭小学和实验小学等中小学校长就教育“十四五”规划和中小学体音美教育进行座谈。他强调，做好体音美教育，一是要提高对体音美学科教育的认识，补齐短板，适应时代；二是要创新课程教学模式，适应学生特点，适应教育规律，适应地域特点，利用网络平台强化教学科研工作，促进教育公平均衡；三是要打造鞍山和岫岩体音美教育品牌特色；四是要地方党委政府加强领导，高度重视教育，关心支持教育。同时，要做好教育系统安全稳定工作，加强疫情防控，做好突发事件的应急处置工作。,其他,0.8129634421489778,True
辽宁省,时政微观察丨跟着总书记学调查研究求深,2023-06-16,军地领导在抚顺西露天矿参加义务植树活动 人人动手全社会参与植树造林 绘出美丽中国的辽宁新画卷。四月的辽宁大地，春意盎然、生机勃发，正是植树的好时节。4月14日，北部战区司令员王强，省委书记、省人大常委会主任郝鹏，省委副书记、省长李乐成，省政协主席周波等省及驻辽部队领导来到位于抚顺市的抚矿集团西露天矿，与干部群众、部队官兵一起参加义务植树活动，为百年矿坑增添新绿。。2018年9月28日，习近平总书记在辽宁考察时专程来到抚矿集团西露天矿，就开展采煤沉陷区综合治理作出重要指示，强调要本着科学的态度和精神，搞好评估论证，做好整合利用这篇大文章。为进一步深入贯彻习近平总书记重要指示精神，从今年开始，我省启动废弃矿山复绿新突破三年行动，今年计划治理废弃矿山3354个、面积12.6万亩，其中复绿面积8.2万亩，林地面积7万亩、植树1624.6万株。作为全国7个科学绿化试点示范省之一，当前，我省锚定三年攻坚绿化目标任务，全省已掀起植树造林新热潮，今年将完成营造林面积125万亩。。植树点位于西露天矿矿坑。近年来，抚矿集团全力实施矿坑综合治理与生态修复，目前复绿面积已达5505亩，占矿坑总面积的1/3，今年还将栽植苗木146.8万株，复绿4875亩。王强、郝鹏、李乐成、周波等领导在植树点听取了植树复绿情况，随后便与现场干部群众一起忙碌起来。挥锹铲土、扶正树苗、培实新土、提桶浇水……现场一片繁忙，劳动气氛热烈。经过4000余名干部群众紧张细致的劳作，当日上午，杨、柳、榆、槐等8万余株乡土树苗挺立起来。。植树期间，郝鹏一边劳动一边同身边的干部群众交流。他说，辽宁是矿业大省、矿山众多，废弃矿山治理和复绿任务艰巨繁重。我们要牢记习近平总书记在考察西露天矿矿坑时的重要指示，以科学的态度和精神，深入调查研究，加强评估论证，以钉钉子精神，加快废弃矿山治理和复绿，着力做好整合利用这篇大文章。抚矿集团要坚定信心、科学施策，持续深入开展好西露天矿综合整治和生态修复工作，坚决完成习近平总书记交给我们的重要任务，推动产业转型和可持续发展，努力交出一份矿坑综合改造利用的合格答卷。。郝鹏强调，以习近平同志为核心的党中央高度重视生态文明建设，习近平总书记多次发表重要讲话、作出重要指示，亲自参加义务植树活动，为我们加强生态文明建设作出了示范。全省各级各部门要结合正在开展的学习贯彻习近平新时代中国特色社会主义思想主题教育，深入贯彻习近平生态文明思想，牢固树立绿水青山就是金山银山理念，坚定不移走生态优先、绿色发展之路，大力弘扬彰武治沙精神，在绿色低碳发展上实现新突破，让辽宁大地更加山清水秀、生态宜居，让人民群众更有获得感幸福感，筑牢生态安全屏障，加快建设美丽辽宁，为绘出美丽中国的更新画卷贡献辽宁力量。各地各有关部门要积极组织开展义务植树活动，各级领导干部要身体力行，自觉参加义务植树，引导和动员全社会都参与到植树造林、保护生态的行动中来，营造植绿护绿的浓厚氛围，人人动手、积极行动，共同建设好我们的美丽家园。,其他,0.9806738248363036,True
