province,topic,date,content,label,score,is_match
辽宁省,为强国建设民族复兴提供坚强组织保证,2023-06-28,今年一季度，全国出入境人员超1.41亿人次，同比上升117.8%；“五一”假期入出境游客合计达367.2万人次，其中入境游客177.5万人次，出境游客189.7万人次……近期公布的一组组数字展现出中外人员往来的密度和“双向奔赴”的热度。得益于航线恢复、入境便利化措施落地以及互免签证国家增多等多重利好，中国与世界在“你来我往”中看见真实的彼此，拉近心与心的距离，发现和创造合作的机遇。。“中国欢迎你”不只是一个口号。去年12月，中国对法国、德国、意大利、荷兰、西班牙、马来西亚6个国家试行免签政策。今年3月，中国又进一步对瑞士、爱尔兰、匈牙利、奥地利、比利时、卢森堡6国试行免签政策，近日又实施外国旅游团乘坐邮轮入境免签。与此同时，随着今年一系列互免签证协定等出入境政策逐步落地，中国与新加坡、马来西亚、泰国等多国迈入“免签时代”。来到中国的外国游客发现，在华旅游、支付更加方便，越来越多的机场、景点、购物场所支持境外银行卡刷卡支付，很多城市专门发布入境游支付服务指南和宣传视频。。为了欢迎中国游客，许多国家和地区也对中国公民推出免签和落地签，并配套各种暖心服务。马来西亚在多个入境点聘请能说普通话的工作人员，新加坡旅游局与微信支付和银联国际等机构签署谅解备忘录，古巴在宣布对持普通护照中国公民免签同时也为中国游客量身定制旅游产品……法国欧洲新闻电视台认为，一条“双向奔赴”的快捷畅通之路正在铺就。。人流中有信息流，“你来我往”为民心相通注入新动力，让世界看到真实中国。宏伟的历史古迹、新奇的现代科技，乃至独具风情的小众乡村、私房餐厅都成为外国游客到中国“打卡”的选项，“眼见为实”刷新了不少外国游客对中国的认知。新加坡《联合早报》刊文说，不少外国博主都表示亲眼所见的中国打破了他们原有的印象。他们对上海市容的整洁大方印象深刻，对满街跑的新能源车充满好奇，有人爱上了茶叶蛋和豆浆，还有人感叹一路遇到的中国人都是热心肠。。去法国品尝红酒，去瑞士滑雪，去非洲看动物大迁徙……中国游客走出国门，在了解不同国家文化、历史、风俗习惯的同时，也在展示中国形象，在与当地人交往的一言一行中，展现中国人昂扬向上的姿态、开放包容的胸怀。正如中国旅游研究院院长戴斌所说，中外游客正在加速进入彼此的日常生活场景，人们在旅途中感悟文化、增进了解、加强人文交流。。人流中也有机遇流，伴随着人员流动，互利共赢的机遇不断涌现。旅游业的兴旺带动酒店、餐饮、交通、购物等各行业发展，创造大量就业机会。据中国旅游研究院预测，今年入出境旅游人数合计将超过2.6亿人次，助推国际旅游收入重新攀上千亿美元关口。跨境游快速带火一方经济，比如张家界受韩国游客青睐，韩式餐馆上座率明显上升，一些饭店日营业额可达万元以上。泰国曼谷市长差察·西迪汶表示，抵泰中国游客数量不断增加，泰国游客也赴华旅游，有利于泰国经济发展和增进两国人民友谊。“这不仅是为了娱乐，也加强了两国合作”。。英国《金融时报》报道说，欧洲企业人士希望借机拓展中国市场。他们可以更加灵活地参加各类商贸展会和洽谈活动，更加便利地拓展合作伙伴和商业网络。许多欧洲游客表示，15天的免签非常实用，不论是去中国旅游还是商务考察等都能很从容地完成。或旅游观光，或学习工作，或投资兴业……“你来我往”的人群怀揣的目标不同，但都在热烈的交流中找寻人生机遇，共享中国与世界“双向奔赴”的时代红利。,其他,0.996352762214236,True
辽宁省,明确责任强化担当奋力实现三年行动首战告捷,2023-10-21,继6月15日沈阳市党政代表团到大连市考察调研之后，7月11日，大连市党政代表团来沈阳市考察交流，并推进相关合作事宜。省委副书记、沈阳市委书记王新伟，省委常委、大连市委书记熊茂平，省政协副主席、中国科学院院士、辽宁材料实验室主任卢柯参加有关活动。。辽宁实现全面振兴新突破，沈阳市、大连市必须更好发挥“双核”引领作用，在全省高质量发展中打头阵、当先锋。两市围绕深入学习贯彻习近平总书记关于东北、辽宁全面振兴的重要讲话和指示批示精神，全面落实习近平总书记关于区域协调发展的重要论述，着眼新时代“六地”目标定位，深入交流推动高质量发展的经验做法，携手打造互学互鉴共赢发展区域合作典范。。在沈期间，大连市党政代表团到华晨宝马大东工厂、拓荆科技股份有限公司、芯源微电子设备股份有限公司、辽宁材料实验室、沈阳方城考察调研，两市就推动科技创新、加快制造业转型升级、培育战略性新兴产业、加强历史文化街区保护利用等深入交流探讨。。两市表示，将按照省委要求及两市签署的合作协议，深入开展对接，不断拓展合作空间、提升合作水平，奋力谱写沈大合作共赢新篇章，为辽宁打造新时代“六地”提供强有力支撑。,政府领导到其他城市考察学习或访问,0.87611830930102,True
辽宁省,把学习贯彻习近平新时代中国特色社会主义思想不断引向深入,2023-05-16,2022年，辽宁省坚持以习近平新时代中国特色社会主义思想为指导，全面学习贯彻党的十九大、十九届历次全会和党的二十大精神，深入学习贯彻习近平总书记在辽宁考察时的重要讲话精神，坚持以人民为中心的发展思想，认真落实党中央、国务院关于全面推进政务公开的决策部署和省委、省政府工作要求，认真贯彻执行《条例》规定，依法全面做好主动公开、依申请公开、政府信息管理、公开平台建设等各项工作，积极发挥服务经济发展和社会稳定大局作用。。（二）依申请公开方面。搜集依申请公开典型案例，完善各类型依申请公开答复模板，为各单位规范办理提供参考。探索构建协同办理和专业律师参与机制，提升答复质量。各级行政机关累计办理政府信息公开申请11238件，结转下年度继续办理246件。涉行政复议、行政诉讼案件743件，结果维持461件，较上年提升5个百分点。。（四）政府信息公开平台建设方面。开展政府信息公开专栏建设专项检查，确保专栏建设符合《条例》要求。坚持抓好全省政府网站和政务新媒体日常监管，按季度开展全覆盖检查，并印发监管通报。统筹做好政府网站整合和政务新媒体清理工作，全省保留政府网站557家、政务新媒体2012家。编发《辽宁省人民政府公报》正刊24期、增刊24期。。（五）监督保障方面。召开省政务公开领导小组会议，印发年度工作要点，将政务公开工作纳入政府系统绩效考核体系，扎实推进全年工作。组织开展全省2021年度政务公开第三方评估、省政府各部门政务公开工作社会评议调查、省政府公报利用情况调查等，切实加强评估评议结果运用。完善政府信息公开保密审查制度，对公开文件全部进行了公开前保密审查。。存在的主要问题：一是全省政务公开区域发展不均衡问题有待进一步改善；二是行政规范性文件的梳理认定和公开发布工作流程有待进一步优化；三是政策解读工作质量水平有待进一步提升；四是基层政务公开标准化规范化建设有待进一步加强。。针对上述问题，将从以下几方面改进提升：一是加强全省政务公开工作指导监督，科学开展考评培训，着力解决区域发展不平衡问题。二是优化行政规范性文件公开工作流程，完善动态更新机制，确保新制发文件和文件清理结果及时规范公开。三是推动政策解读提质增效，探索创新多渠道、全方位、立体式解读方式，发挥12345政务服务便民热线平台作用，加强政策集中公开成果运用，提升针对性解读回应效果。四是督促省政府有关部门加强对基层重点领域政务公开工作的指导监督，健全标准规范，完善保障体系，确保公开到位。。（一）积极开展“政务公开日”宣传活动。组织开展第十六届“5・15政务公开日”活动。省长李乐成在《辽宁日报》发表署名文章，对全省政务公开工作进行再动员、再部署。全省195个部门录制221期访谈节目，678位专家接听企业群众来电，现场解答904件，活动参与人数180余万人次，20余家新闻媒体关注报道。。（二）全面规范政策解读工作。省政府办公厅印发《政策文件解读工作规范（试行）》，规范政策解读的范围、主体、程序、内容、形式等，公开了政策解读部门、解读人及联系方式，方便企业群众咨询。全省人社系统深入企业、基层开展“直播带岗”“就业政策解读讲座”“人社科长讲政策”等活动，促进各项惠企利民政策落地。沈阳市在沈阳广播电视台推出《新政“零距离”》栏目，创新政策解读新形式。大连市营商局推出“秒懂营商”“营商小剧场”“营商侦探”等短视频栏目，进一步提升政策传播力度和解读效果。。（五）政府信息公开信息处理费收缴情况。根据《国务院办公厅关于印发〈政府信息公开信息处理费管理办法〉的通知》（国办函〔2020〕109号）规定，全省收取政府信息公开信息处理费3620元。,不属于政府领导到其他城市考察学习的新闻,0.674505206148886,True
辽宁省,镜观领航六次集中教育一项伟大工程,2023-05-06,为进一步深化营口市与浙江省温州市友好城市关系，促进两市经济高质量发展，4月30日，市委副书记、市长许桂清率队赴温州市开展考察。。考察期间，许桂清会见了浙江省委常委、温州市委书记陈伟俊、温州市委副书记、市长姚高员等温州市党政领导，许桂清说，营口市与温州市缔结友好城市以来，两市之间建立了广泛的交流与合作，取得了可喜成绩。温州在民营经济发展等方面有很多经验、做法，值得营口学习，希望双方在更广泛领域开展经济合作，实现优势互补，共同发展。温州市党政领导表示温州和营口都是民营经济发达的城市，希望双方立足实际，创新合作模式，推动两地合作再上新台阶。双方还就推进营口市辽河经济开发区、辽宁（营口）沿海产业基地与温州经济技术开发区以及营口自贸区与温州高新区交流合作等事宜进行了深入交谈，并共同见证了营口市辽河经济开发区与温州市经济技术开发区区域经济合作协议的签署。。许桂清还实地考察了浙南经济总部大厦、福达合金有限公司、瑞浦能源有限公司、激光与光电智能制造研究院。,政府领导到其他城市考察学习或访问,0.6951008375597046,True
辽宁省,许桂清率队赴温州市开展考察,2020-05-06,政务服务事项90％以上网上办理，铁岭智慧工业云平台为上云企业发展增添数据动力，森林防火预警监测系统有效提升火灾预警和快速反应能力……。近年来，市委市政府把加快大数据产业发展和5G新基建作为推进产业转型升级、实现振兴发展的重大机遇，全市大数据产业发展顺利开局起步，数字经济正悄然改变市民的工作和生活，助推全市经济社会发展。。5月17日，世界电信日暨铁岭市大数据产业创新发展工作座谈会举行，省内行业主管部门、国内数字经济领军企业应约云集如意湖畔，为铁岭市发展大数据产业把脉问诊、出谋划策……。近年来，市委市政府高度重视铁岭市大数据产业发展，按照中央和省决策部署，启动了5G网络建设。先后制定出台了《关于落实辽宁省数字经济工作部署的通知》《铁岭市加快5G通讯网络投资建设方案》《关于深化互联网＋先进制造业发展工业互联网的实施意见》等系列文件，为全市大数据产业发展提供遵循；市委市政府主要领导多次召开专题会议研究筹划大数据产业基础设施建设，组织有关部门赴贵阳对贵州大数据产业进行专题学习调研，亲自带队到省铁塔公司对接考察5G网络建设工作；铁岭智慧工业云平台、精准扶贫大数据平台、政务信息资源共享交换平台等相继上线，全市大数据产业发展顺利开局起步。。目前，全市获批5G基站524个，已交付5G基站361个，完成全年计划的68.9％；开通5G基站272个，开通率51.9％，铁岭铁塔公司交付率全省排名第一，铁岭移动公司5G基站开通率全省排名第一，铁岭联通、电信5G基站开通率排名全省前列。“5G新基建成绩的取得，离不开市委市政府的大力支持，离不开兄弟单位的通力配合。”谈到5G新型基础设施建设的工作成果时，中国铁塔股份有限公司铁岭市分公司副总经理于宏亮表示。。为保证5G建设顺利实施，铁岭市成立了5G建设工作领导小组，由市政府主要领导任组长，相关副市长全部任副组长，全面负责5G建设的规划、指导和协调工作。针对普遍存在的“进场难”“电价贵”等问题，领导小组连续召开两次协调会议，将全市党政机关、企事业单位、公园绿地、市政设施等公共资源全部向5G开放，全面加强各居民小区的科普宣传，比照先进地区简化5G审批手续和办事流程，严格按照省政府规定给予最低用电价格保障。特别是对铁塔公司提出的102个疑难点位，已经全部落实到各县（市）区，要求在5月底前排迁到位。。新基建建设也得到了供电部门的大力支持，国网铁岭供电公司无偿为铁岭铁塔公司扩容站址88个，帮助节省投资近百万元。。6月2日一大早，铁岭铁塔公司通信发展部经理陈新就带领共产党员突击队到凡河新区指挥调度安装5G基站抱杆。成立共产党员突击队只是公司积极主动向内挖潜、推动新基建建设的一个缩影。于宏亮介绍，在总经理黄坤枢的推动下，公司与三家电信运营企业成立5G建设联合工作组，紧密配合，提高工作效率。努力克服疫情影响，提前启动5G建设工作。施工人员节假日不休息，采用统一施工方案、统一工作流程、统一施工队伍、统一进场时间、统一数据口径、统一验收标的“六统一工作法”，加快5G建设、开通的整体进度。今年，全市力争实现建设5G基站1100个、室内分布系统72套，实现市内主城区、重点企事业单位、重要交通枢纽、学校等城市热点地区5G网络连续覆盖，各县（市）区城区重点区域网络覆盖的目标。,政府领导到其他城市考察学习或访问,0.933281559836492,True
辽宁省,铁岭市新基建和大数据产业发展按下快进键,2020-06-11,习近平在河北考察并主持召开深入推进京津冀协同发展座谈会时强调 以更加奋发有为的精神状态推进各项工作 推动京津冀协同发展不断迈上新台阶 李强丁薛祥出席座谈会 蔡奇陪同考察并出席座谈会。以更加奋发有为的精神状态推进各项工作 推动京津冀协同发展不断迈上新台阶 李强丁薛祥出席座谈会 蔡奇陪同考察并出席座谈会。5月11日至12日，中共中央总书记、国家主席、中央军委主席习近平在河北考察，并主持召开深入推进京津冀协同发展座谈会。这是12日下午，习近平在石家庄市主持召开深入推进京津冀协同发展座谈会并发表重要讲话。新华社记者 申宏 摄。新华社石家庄5月12日电 中共中央总书记、国家主席、中央军委主席习近平近日在河北考察，主持召开深入推进京津冀协同发展座谈会并发表重要讲话。他强调，要坚定信心，保持定力，增强抓机遇、应挑战、化危机、育先机的能力，统筹发展和安全，以更加奋发有为的精神状态推进各项工作，推动京津冀协同发展不断迈上新台阶，努力使京津冀成为中国式现代化建设的先行区、示范区。。中共中央政治局常委、国务院总理李强，中共中央政治局常委、国务院副总理丁薛祥出席座谈会。中共中央政治局常委、中央办公厅主任蔡奇陪同考察并出席座谈会。。5月11日至12日，习近平在河北省委书记倪岳峰、省长王正谱陪同下，先后来到沧州、石家庄等地，深入农村、港口、科研单位等，实地了解京津冀协同发展情况。。11日上午，习近平来到沧州市，考察了黄骅市旧城镇仙庄片区旱碱地麦田，了解盐碱地整治、旱碱麦种植推广及产业化情况。习近平走进麦田，仔细察看小麦长势，并向正在田里劳作的种植户、农技专家询问旱碱麦产量、价格、品质、收益等。习近平指出，开展盐碱地综合利用，是一个战略问题，必须摆上重要位置。要立足我国盐碱地多、开发潜力大的实际，发挥科技创新的关键作用，加大盐碱地改造提升力度，加强适宜盐碱地作物品种开发推广，有效拓展适宜作物播种面积，积极发展深加工，做好盐碱地特色农业这篇大文章。。11日下午，习近平来到黄骅港煤炭港区码头，了解河北省港口整合发展和黄骅港生产经营、发展规划等情况。习近平强调，河北区位优势独特，海运条件便利，要持续推进港口转型升级和资源整合，优化港口功能布局，主动对接京津冀协同发展、高标准高质量建设雄安新区、共建“一带一路”等国家重大战略需求，在推动区域经济协调发展、建设现代化产业体系中发挥更大作用。黄骅港作为我国西煤东运、北煤南运的重要枢纽港口，要加强港口能力建设，创新管理体制机制，打造多功能、综合性、现代化大港。。12日上午，习近平来到位于石家庄市的中国电科产业基础研究院考察调研，了解企业发展历程及产品研发、加强军民融合发展、提升自主保障能力建设等情况，走进生产车间察看芯片生产流程。习近平指出，加快建设科技强国是全面建设社会主义现代化国家、全面推进中华民族伟大复兴的战略支撑，必须瞄准国家战略需求，系统布局关键创新资源，发挥产学研深度融合优势，不断在关键核心技术上取得新突破。他勉励科技工作者再接再厉、勇攀科技高峰，不断攻克前沿技术，打造更多科技自立自强的大国重器。。业基础研究院考察调研，了解企业发展历程及产品研发、加强军民融合发展、提升自主保障能力建设等情况，走进生产车间察看芯片生产流程。习近平指出，加快建设科技强国是全面建设社会主义现代化国家、全面推进中华民族伟大复兴的战略支撑，必须瞄准国家战略需求，系统布局关键创新资源，发挥产学研深度融合优势，不断在关键核心技术上取得新突破。他勉励科技工作者再接再厉、勇攀科技高峰，不断攻克前沿技术，打造更多科技自立自强的大国重器。,政府领导到其他城市考察学习或访问,0.0,True
辽宁省,习近平在河北考察并主持召开深入推进京津冀协同发展座谈会,2023-05-13,习近平在山东考察时强调 以进一步全面深化改革为动力 奋力谱写中国式现代化山东篇章 蔡奇陪同考察。5月22日至24日，中共中央总书记、国家主席、中央军委主席习近平在山东考察。这是22日下午，习近平在日照港亲切慰问港口科技工作者、运营人员、航运人员。新华社记者 谢环驰 摄。新华社济南5月24日电 中共中央总书记、国家主席、中央军委主席习近平近日在山东考察时强调，山东要在全国发展大局中定好位、挑大梁，完整准确全面贯彻新发展理念，以进一步全面深化改革为动力，继续在服务和融入新发展格局上走在前、在增强经济社会发展创新力上走在前、在推动黄河流域生态保护和高质量发展上走在前，加快建设绿色低碳高质量发展先行区，打造高水平对外开放新高地，奋力谱写中国式现代化山东篇章。。5月22日至24日，习近平在山东省委书记林武和省长周乃翔陪同下，先后来到日照、济南等地进行调研。。22日下午，习近平首先来到日照港考察。日照港是重要的能源和大宗原材料中转基地，近年来推进智慧化、绿色化建设，建成顺岸开放式全自动化集装箱码头。习近平听取山东省港口发展建设和日照港规划布局等情况介绍，并察看全自动化集装箱码头作业场景。他说，日照港是改革开放后新建的港口，近年来推进科技创新，将传统港口改造升级为现代化港口，不仅货物吞吐量跻身全国前列，还积累了通过传统产业改造升级发展新质生产力的经验，值得肯定。习近平亲切慰问港口科技工作者、运营人员、航运人员，希望大家再接再厉、继续奋斗，推动日照港管理运营更上一层楼。。随后，习近平考察了日照市阳光海岸绿道。近年来，日照市对沿海裸露场地及岸线破损处进行生态修复，建成约28公里的阳光海岸绿道，为市民和游客提供了运动休闲好去处。习近平听取绿道整体建设情况介绍，察看修复治理后的海岸线生态环境，了解当地升级文旅产业、提升人民生活品质的做法和成效，并不时同市民和游客亲切交流。他指出，建设绿道应市民所需，是得民心之事。推进中国式现代化，就是要让人民群众的生活越来越好。生态环境好，老百姓就多了一份实实在在的幸福感。大家要一起动手，共同建设和呵护美好家园。。24日上午，习近平在济南市听取了山东省委和省政府工作汇报，对山东各项工作取得的成绩给予肯定。。习近平指出，山东在推进科技创新与产业创新深度融合、发展新质生产力、完善现代化产业体系上大有可为。要着眼国家战略需求，统筹推进传统产业改造提升、新兴产业培育壮大、未来产业超前布局，全面释放实体经济和数字经济融合效能，因地制宜发展新质生产力。要大力推动发展方式绿色低碳转型，推进绿色环保科技创新和产业发展。要深度对接区域协调发展战略，努力成为北方地区经济重要增长极。要发挥海洋资源丰富的得天独厚优势，经略海洋、向海图强，打造世界级海洋港口群，打造现代海洋经济发展高地。。习近平强调，山东要在进一步全面深化改革、推进高水平对外开放上勇争先。要聚焦推进中国式现代化，在解决制约高质量发展的突出矛盾上下功夫，在完善制度、健全机制、激发活力、增添动力上用实劲。要积极构建国际物流大通道，大力推动自由贸易区联动创新，建设好制度型开放示范区，深度融入高质量共建“一带一路”，精心打造重大国际交流合作高能级平台，努力成为畅通国内国际双循环的重要节点。。习近平强调，各级党委和政府要统筹发展和安全，扎实抓好中小金融机构、地方政府债务、房地产等重点领域风险防控和化解工作，落细落实安全生产责任，及早预防可能出现的洪涝等灾害，全面加强各领域安全风险隐患排查整治，切实防患于未然，守住安全底线。,政府领导到其他城市考察学习或访问,0.0,True
