code,province,city,topic,date,url,content,content.1,label,score,is_match,是否为“学习考察”新闻
229,四川省,攀枝花市,攀枝花市西区市场监督管理局召开安全生产及食品安全领域相关会议文件精神专题学习会,2024-07-05,http://www.pzhsxq.gov.cn//zwgk/xwzx/bmgz/10132182.shtml,为进一步深入学习领会习近平总书记和中央、省、市、区关于安全生产及食品安全领域相关会议、文件的重要精神要义，7月3日，区市场监管局党组召开了专题学习会，会议由党组书记、局长蒋海莹主持。。会上，蒋海莹传达学习了习近平总书记关于食品安全重要指示和讲话精神、《中共中央 国务院关于学习运用“千村示范、万村整治”工程经验有力有效推进乡村全面振兴的意见》《中共中央 国务院关于全面推进美丽中国建设的意见》 等中央、省、市、区重要会议、文件精神，并进行了深入解读。结合实际情况，提出了具体的思路和措施。党组成员认真聆听、积极思考，就怎样开展下一步工作进行了深入的交流、研讨。。会议强调：一是要深化思想认识，坚守安全底线。深刻认识到安全生产及食品安全工作是重大的政治任务，始终坚持“人民至上、生命至上”，切实增强“保安全、守底线”的政治自觉；二是要加强执法监督力度，及时排查安全风险隐患。加强日常巡查和专项整治力度，始终保持高压态势，对违法、违规行为零容忍，发现一起查处一起。完善风险排查机制，对发现的问题要建立整改清单，督促限期整改并开展回头看，将风险隐患消除在萌芽阶段；三是要压实安全生产责任，推动社会共治。明确各部门的监管责任和各经营管理服务对象的主体责任，划定责任区、明确责任人。同时加强宣传引导，利用多种形式广泛开展宣传教育，提高公众安全意识，营造良好的舆论氛围，推动社会共治。,《中国共产党纪律处分条例》第九十四条第二款、第九十五条、第九十六条、第一百零四条对违规为特定关系人谋利行为及处分作出了规定，共分为4类：。1.特定关系人收受财物。《条例》第九十四条第二款规定，利用职权或者职务上的影响为他人谋取利益，本人的配偶、子女及其配偶等亲属和其他特定关系人收受对方财物，情节较重的，给予警告或者严重警告处分；情节严重的，给予撤销党内职务、留党察看或者开除党籍处分。。适用这一规定的前提，是党员干部不知道亲属和其他特定关系人收受财物，如果党员干部利用职权或者职务上的影响为他人谋利，且对亲属和其他特定关系人收受对方财物知情而不纠正的，则涉嫌受贿违法犯罪。。2.搞权权交易。《条例》第九十五条规定，相互利用职权或者职务上的影响为对方及其配偶、子女及其配偶等亲属、身边工作人员和其他特定关系人谋取利益搞权权交易的，给予警告或者严重警告处分；情节较重的，给予撤销党内职务或者留党察看处分；情节严重的，给予开除党籍处分。。实践中，有的党员干部为他人谋取利益后，以此为由要求对方为自己或者特定关系人谋取利益；有的是党员干部为他人谋利后，对方提出为该党员干部谋利以作为回报，该党员干部同意或接受。双方达成共识或者默契，相互利用手中掌握的权力为对方谋取利益。此类行为，只要存在，就要被给予相应处分。。3.纵容、默许特定关系人谋取私利。《条例》第九十六条规定，纵容、默许配偶、子女及其配偶等亲属、身边工作人员和其他特定关系人利用党员干部本人职权或者职务上的影响谋取私利，情节较轻的，给予警告或者严重警告处分；情节较重的，给予撤销党内职务或者留党察看处分；情节严重的，给予开除党籍处分。党员干部的配偶、子女及其配偶等亲属和其他特定关系人不实际工作而获取薪酬或者虽实际工作但领取明显超出同职级标准薪酬，党员干部知情未予纠正的，依照前款规定处理。。实践中，有的党员干部的配偶利用党员干部的职务影响力插手土地使用权出让、工程建设、招标投标等事项以收取好处费；有的党员干部子女倚仗权势，打着“做生意”名头，空手套白狼，敛取巨额“利润”，有的党员干部亲属“吃空饷”或者超标准领取薪酬。诸如此类行为，看似发生在党员干部的配偶、子女等特定关系人身上，根子在党员干部自己身上。纵容、默许特定关系人利用自己的职务影响谋取私利，实际上是将党和人民赋予的权力变成谋私工具。党员干部不仅要自身过得硬，还要管好家属和身边工作人员，决不允许他们利用特殊身份谋取非法利益。。4.违规为特定关系人经营活动谋利。《条例》第一百零四条规定，利用职权或者职务上的影响，为配偶、子女及其配偶等亲属和其他特定关系人在审批监管、资源开发、金融信贷、大宗采购、土地使用权出让、房地产开发、工程招投标以及公共财政收支等方面谋取利益，情节较轻的，给予警告或者严重警告处分；情节较重的，给予撤销党内职务或者留党察看处分；情节严重的，给予开除党籍处分。利用职权或者职务上的影响，为配偶、子女及其配偶等亲属和其他特定关系人吸收存款、推销金融产品、经营名贵特产类特殊资源等提供帮助谋取利益的，依照前款规定处理。,其他,0.9125897622703286,False,否
229,四川省,攀枝花市,深入学习地标法规助推米易特色产业发展,2024-04-19,http://www.scmiyi.gov.cn//zwgk/zdlyxxgk/jgzf/10098282.shtml,"《地理标志产品保护办法》（国家知识产权局令第八十号）自2024年2月1日起施行，地理标志产品开启了商标保护和专门保护两种模式并行运作、相融互补、有机衔接新阶段。为做好《办法》的学习宣传贯彻工作，提高地理标志保护法治化水平，4月15日，米易县市场监管局组织干部职工集中学习《地理标志产品保护办法》。。会上，相关负责人重点领学了《办法》中地理标志产品的认定、管理和保护三方面内容。明确了地理标志产品管理和保护各个环节涉及的相关主体的职责和义务，普及了地理标志产品审查、异议、变更和撤销程序，指出了地理标志产品的全部或者主要生产环节的限定地域范围要求，产品质量特色、特定声誉等要求。。会议指出,要切实加强对米易县地理标志产品的管理和保护，引导企业在营销宣传和产品外包装中规范使用“米易红糖”“米易枇杷”等地理标志，提升地理标志品牌效应，打造地理标志“金字招牌”，不断增加产品附加值，提高市场竞争力。。会议要求，要深入企业宣讲地理标志品牌知识，指导督促企业按照地理标志产品标准组织生产，确保米易县地理标志产品的质量和特色，着力营造“用活一枚地标、带动一个产业、造富一方百姓”良好社会氛围。。会议强调，要提高地理标志产品保护标准，加强执法检查和日常监管，重点查看辖区企业是否拥有“米易红糖”“米易枇杷”“米易何首乌”地理标志使用资质，是否存在伪造或者擅自使用地理标志和专用标志行为，是否存在使用与地理标志相近、易产生误解的名称或标识及可能误导消费者的文字或图案标志等，依法打击冒用、伪造或者擅自使用地理标志专用标志违法行为。。下一步，县市场监管局将继续深入开展《办法》学习宣传贯彻活动，全面落实地理标志保护制度，更好促进地理标志运用，助力区域特色产业高质量发展。",近日，盐边县经济信息化和科学技术局为做好《四川省社会信用条例》学习宣传和贯彻落实工作，局党组成员、副局长马世杰主持召开职工例会，在会上学习《四川省社会信用条例》，以下简称《条例》。。会上学习了《条例》内容。内容分为总则、社会信用环境建设、社会信用信息管理、社会信用信息应用、信用主体权益保障、信用服务业规范与发展、法律责任、附则，共八章六十六条。重点学习了总则、社会信用环境建设、社会信用信息应用等部分。。通过此次学习，县经信科技局全体干部职工形成“知信用、守信用、用信用”的良好宣传氛围，提高了全局干部职工的诚信意识、服务意识和责任意识。,其他,0.843789085758334,False,否
229,四川省,攀枝花市,党纪学习教育每日一课丨违规为特定关系人谋利的情形和处分规定,2024-05-31,http://www.pzhjjjc.gov.cn//zhyw/ywyl/10122639.shtml,《中国共产党纪律处分条例》第九十四条第二款、第九十五条、第九十六条、第一百零四条对违规为特定关系人谋利行为及处分作出了规定，共分为4类：。1.特定关系人收受财物。《条例》第九十四条第二款规定，利用职权或者职务上的影响为他人谋取利益，本人的配偶、子女及其配偶等亲属和其他特定关系人收受对方财物，情节较重的，给予警告或者严重警告处分；情节严重的，给予撤销党内职务、留党察看或者开除党籍处分。。适用这一规定的前提，是党员干部不知道亲属和其他特定关系人收受财物，如果党员干部利用职权或者职务上的影响为他人谋利，且对亲属和其他特定关系人收受对方财物知情而不纠正的，则涉嫌受贿违法犯罪。。2.搞权权交易。《条例》第九十五条规定，相互利用职权或者职务上的影响为对方及其配偶、子女及其配偶等亲属、身边工作人员和其他特定关系人谋取利益搞权权交易的，给予警告或者严重警告处分；情节较重的，给予撤销党内职务或者留党察看处分；情节严重的，给予开除党籍处分。。实践中，有的党员干部为他人谋取利益后，以此为由要求对方为自己或者特定关系人谋取利益；有的是党员干部为他人谋利后，对方提出为该党员干部谋利以作为回报，该党员干部同意或接受。双方达成共识或者默契，相互利用手中掌握的权力为对方谋取利益。此类行为，只要存在，就要被给予相应处分。。3.纵容、默许特定关系人谋取私利。《条例》第九十六条规定，纵容、默许配偶、子女及其配偶等亲属、身边工作人员和其他特定关系人利用党员干部本人职权或者职务上的影响谋取私利，情节较轻的，给予警告或者严重警告处分；情节较重的，给予撤销党内职务或者留党察看处分；情节严重的，给予开除党籍处分。党员干部的配偶、子女及其配偶等亲属和其他特定关系人不实际工作而获取薪酬或者虽实际工作但领取明显超出同职级标准薪酬，党员干部知情未予纠正的，依照前款规定处理。。实践中，有的党员干部的配偶利用党员干部的职务影响力插手土地使用权出让、工程建设、招标投标等事项以收取好处费；有的党员干部子女倚仗权势，打着“做生意”名头，空手套白狼，敛取巨额“利润”，有的党员干部亲属“吃空饷”或者超标准领取薪酬。诸如此类行为，看似发生在党员干部的配偶、子女等特定关系人身上，根子在党员干部自己身上。纵容、默许特定关系人利用自己的职务影响谋取私利，实际上是将党和人民赋予的权力变成谋私工具。党员干部不仅要自身过得硬，还要管好家属和身边工作人员，决不允许他们利用特殊身份谋取非法利益。。4.违规为特定关系人经营活动谋利。《条例》第一百零四条规定，利用职权或者职务上的影响，为配偶、子女及其配偶等亲属和其他特定关系人在审批监管、资源开发、金融信贷、大宗采购、土地使用权出让、房地产开发、工程招投标以及公共财政收支等方面谋取利益，情节较轻的，给予警告或者严重警告处分；情节较重的，给予撤销党内职务或者留党察看处分；情节严重的，给予开除党籍处分。利用职权或者职务上的影响，为配偶、子女及其配偶等亲属和其他特定关系人吸收存款、推销金融产品、经营名贵特产类特殊资源等提供帮助谋取利益的，依照前款规定处理。,2024年5月24日，东区市场监督管理局召开《四川省社会信用条例》学习宣贯会。会议由局党组副书记，机关党委书记向思杰主持，局机关干部职工参加会议。。会上，政策法规股就《四川省社会信用条例》的立法背景、出台意义进行了讲解，并组织干部职工对《条例》主要内容展开了系统深入的学习。。向思杰强调，全局干部中要深刻认识社会信用体系建设对优化营商环境、推进社会信用体系建设高质量发展的深远意义，确保《条例》宣传到位、执行到位；抓好《条例》贯彻落实，不断提高自身依法履职能力。。会议要求，将《条例》规定与市场监管工作相结合，建立健全守信践诺、诚信监测治理机制和失信记录、失信责任追究制度；大力引导市场主体增强法治意识和契约精神，加强信用自律，诚实履约、公平竞争。。下一步，利用各种宣传渠道提高社会对《条例》的知晓率，推动东区社会信用体系建设稳步发展。,其他,0.873752646760723,False,否
229,四川省,攀枝花市,县经信科技局组织学习四川省社会信用条例,2024-05-17,http://www.scyanbian.gov.cn//zwgk/xwzx/ybyw/10117768.shtml,近日，盐边县经济信息化和科学技术局为做好《四川省社会信用条例》学习宣传和贯彻落实工作，局党组成员、副局长马世杰主持召开职工例会，在会上学习《四川省社会信用条例》，以下简称《条例》。。会上学习了《条例》内容。内容分为总则、社会信用环境建设、社会信用信息管理、社会信用信息应用、信用主体权益保障、信用服务业规范与发展、法律责任、附则，共八章六十六条。重点学习了总则、社会信用环境建设、社会信用信息应用等部分。。通过此次学习，县经信科技局全体干部职工形成“知信用、守信用、用信用”的良好宣传氛围，提高了全局干部职工的诚信意识、服务意识和责任意识。,为了进一步提高干部职工对新修订《中华人民共和国保守国家秘密法》的认识，加强保密工作管理，切实做好保密工作，县行政审批局组织了专题学习。学习会上，对《中华人民共和国保守国家秘密法》进行了解读，并结合日常工作实际，分析了当前保密工作面临的形势。通过此次学习，大家表示受益匪浅，在今后的工作中也将不断提高保密意识，严守保密纪律，切实做好新形势下的保密工作。,其他,0.8199065733114782,False,否
229,四川省,攀枝花市,东区市场监管局召开四川省社会信用条例学习宣贯会,2024-05-24,http://www.scdongqu.gov.cn//zzjg/qzfgzbm/qscjdglj/bmdty/10120528.shtml,2024年5月24日，东区市场监督管理局召开《四川省社会信用条例》学习宣贯会。会议由局党组副书记，机关党委书记向思杰主持，局机关干部职工参加会议。。会上，政策法规股就《四川省社会信用条例》的立法背景、出台意义进行了讲解，并组织干部职工对《条例》主要内容展开了系统深入的学习。。向思杰强调，全局干部中要深刻认识社会信用体系建设对优化营商环境、推进社会信用体系建设高质量发展的深远意义，确保《条例》宣传到位、执行到位；抓好《条例》贯彻落实，不断提高自身依法履职能力。。会议要求，将《条例》规定与市场监管工作相结合，建立健全守信践诺、诚信监测治理机制和失信记录、失信责任追究制度；大力引导市场主体增强法治意识和契约精神，加强信用自律，诚实履约、公平竞争。。下一步，利用各种宣传渠道提高社会对《条例》的知晓率，推动东区社会信用体系建设稳步发展。,为深入贯彻落实《四川省社会信用条例》，积极营造诚信为本、重诺守信的社会环境，提高社会信用体系建设法治化、规范化水平，。召开专题会议，对《四川省社会信用条例》制定的立法背景、出台意义、总体思路和主要内容进行了系统学习。。会上将《条例》纳入年度学法计划，由领导干部带头对《条例》进行学习解读，将《条例》的精神内涵、基本理念融入为民服务和依法审批工作全过程，进一步提升行政审批能力和政务服务水平。同时在。政务服务大厅LED显示屏滚动播放《四川省社会信用条例》图解及相关问答，积极营造学条例、懂条例、遵条例的浓厚氛围。。将持续扩大《条例》宣传覆盖面、知晓度，引导市场主体和社会公众知法用法，让“诚实守信”理念深入人心，全力营造人人参与社会信用体系建设的良好社会氛围，促进,其他,0.8132462822296066,False,否
229,四川省,攀枝花市,米易县行政审批局开展中华人民共和国保守国家秘密法专题学习,2024-06-22,http://www.scmiyi.gov.cn//zwgk/zzjg/xjbm/zwfwzx/gzdt/10127433.shtml,为了进一步提高干部职工对新修订《中华人民共和国保守国家秘密法》的认识，加强保密工作管理，切实做好保密工作，县行政审批局组织了专题学习。学习会上，对《中华人民共和国保守国家秘密法》进行了解读，并结合日常工作实际，分析了当前保密工作面临的形势。通过此次学习，大家表示受益匪浅，在今后的工作中也将不断提高保密意识，严守保密纪律，切实做好新形势下的保密工作。,为进一步推动市教育考试院党纪学习教育走深走实，筑牢干部职工廉洁自律防线，5月23日，市教育考试院召开党纪学习教育警示教育会。全院干部职工参加会议。。会议集中学习了《中国共产党巡视工作条例》等党纪法规；通报了《四川省纪委公开通报4起违规吃喝典型问题》；集体观看了《蜀地清风——永远的最后一次》警示教育片，教育引导党员干部从反面案例中汲取教训，明规矩、知敬畏，不断增强拒腐防变能力，自觉守牢廉洁底线。。会议强调，全体干部职工要进一步提高思想认识，常态化开展警示教育，强化政治意识和防范风险意识，紧盯“关键少数”“关键岗位”“关键领域”“关键节点”，切实增强履职尽责、遵规守纪的自觉性、主动性、积极性；要加强政治学习，坚持举一反三，强化严守党纪的行动自觉，立足本职工作，聚焦上级决策部署不折不扣抓落实，齐心协力、全力以赴，确保高考、中考顺利实施。,其他,0.8459551917776581,False,否
229,四川省,攀枝花市,东区行政审批局学习宣传四川省社会信用条例,2024-05-24,http://www.scdongqu.gov.cn//zzjg/qzfgzbm/qxzspj/bmdty/10120375.shtml,为深入贯彻落实《四川省社会信用条例》，积极营造诚信为本、重诺守信的社会环境，提高社会信用体系建设法治化、规范化水平，。召开专题会议，对《四川省社会信用条例》制定的立法背景、出台意义、总体思路和主要内容进行了系统学习。。会上将《条例》纳入年度学法计划，由领导干部带头对《条例》进行学习解读，将《条例》的精神内涵、基本理念融入为民服务和依法审批工作全过程，进一步提升行政审批能力和政务服务水平。同时在。政务服务大厅LED显示屏滚动播放《四川省社会信用条例》图解及相关问答，积极营造学条例、懂条例、遵条例的浓厚氛围。。将持续扩大《条例》宣传覆盖面、知晓度，引导市场主体和社会公众知法用法，让“诚实守信”理念深入人心，全力营造人人参与社会信用体系建设的良好社会氛围，促进,坚持以习近平总书记关于党纪学习教育的重要讲话和重要指示精神为引领，不折不扣将党纪学习教育贯彻禁毒工作和禁毒队伍建设各方面，持续夯实党的政治纪律建设的思想根基。。深入实施支队包片督导工作机制，走下去帮助各县（区）分析问题短板，寻找解决措施，对于工作推进停滞不前的，要用好市局。年关爱家访，切实将组织温暖传递到每一位民辅警及家属；另一方面，强化能力训练，做到集中练和自我练相结合，不断提升全体民辅警自身素质能力，确保测试全员达标。,其他,0.7845301254004516,False,否
229,四川省,攀枝花市,市教育考试院召开党纪学习教育警示教育会,2024-05-25,http://jytyj.panzhihua.gov.cn//zwgk/gzdt/dldt/10120825.shtml,为进一步推动市教育考试院党纪学习教育走深走实，筑牢干部职工廉洁自律防线，5月23日，市教育考试院召开党纪学习教育警示教育会。全院干部职工参加会议。。会议集中学习了《中国共产党巡视工作条例》等党纪法规；通报了《四川省纪委公开通报4起违规吃喝典型问题》；集体观看了《蜀地清风——永远的最后一次》警示教育片，教育引导党员干部从反面案例中汲取教训，明规矩、知敬畏，不断增强拒腐防变能力，自觉守牢廉洁底线。。会议强调，全体干部职工要进一步提高思想认识，常态化开展警示教育，强化政治意识和防范风险意识，紧盯“关键少数”“关键岗位”“关键领域”“关键节点”，切实增强履职尽责、遵规守纪的自觉性、主动性、积极性；要加强政治学习，坚持举一反三，强化严守党纪的行动自觉，立足本职工作，聚焦上级决策部署不折不扣抓落实，齐心协力、全力以赴，确保高考、中考顺利实施。,各位领导好！我是一名在读研究生，非常关心家乡的发展，有志于毕业后回到家乡从事乡村振兴工作，帮助农民走向更美好的生活！但目前我处于非常茫然的状态，不知从何入手来学习相关问题。可否请问是否有专门的平台或资料讲述帮扶的具体事例？。希望您一如既往关心关注家乡发展，对您热爱并在未来有志于投身乡村振兴事业我们热忱欢迎，十分感谢您对我们工作的理解和支持！,其他,0.809174534601499,False,否
