code,province,city,topic,date,url,content,content.1,label,score,is_match,是否为“学习考察”新闻
238,四川省,眉山市,青神县组织考察学习企业安全生产标准化建设工作经验,2013-11-11,http://www.ms.gov.cn/info/5569/247154.htm,为学习借鉴其他地区企业安全生产标准化创建工作先进经验，加快推进我县企业安全生产标准化创建工作。11月5日，县安监局组织经信等县级部门、丹甫等企业分管安全领导、工作人员共20余人赴眉山市科技工业园区、东坡区铝硅工业园区考察学习安全生产标准化创建工作经验。 学习考察团实地参观了攀钢集团眉山中铁冷弯型钢有限责任公司、蒙牛乳业眉山公司等企业作业现场、生产车间，听取了东坡区安监局、各企业安全生产标准化创建工作的经验、做法的情况介绍，学习了眉山市安监局关于企业安全生产标准化创建工作流程、工作标准、工作方法及相关内容的讲解，详细咨询了在安全生产标准化创建过程中出现的问题及解决方法，与眉山市安监局、东坡区安监局及企业负责人就创建工作中应如何结合安全生产实际，创新方式，取得实效等问题，进行了广泛交流与探讨。 通过考察学习，学到了经验，取回了真经，增强了信心，理清了思路，开拓了眼界。,为学习借鉴其他地区企业安全生产标准化创建工作先进经验，加快推进我县企业安全生产标准化创建工作。11月5日，县安监局组织经信等县级部门、丹甫等企业分管安全领导、工作人员共20余人赴眉山市科技工业园区、东坡区铝硅工业园区考察学习安全生产标准化创建工作经验。 学习考察团实地参观了攀钢集团眉山中铁冷弯型钢有限责任公司、蒙牛乳业眉山公司等企业作业现场、生产车间，听取了东坡区安监局、各企业安全生产标准化创建工作的经验、做法的情况介绍，学习了眉山市安监局关于企业安全生产标准化创建工作流程、工作标准、工作方法及相关内容的讲解，详细咨询了在安全生产标准化创建过程中出现的问题及解决方法，与眉山市安监局、东坡区安监局及企业负责人就创建工作中应如何结合安全生产实际，创新方式，取得实效等问题，进行了广泛交流与探讨。 通过考察学习，学到了经验，取回了真经，增强了信心，理清了思路，开拓了眼界。,政府领导到其他城市考察学习或访问,0.0,False,否
238,四川省,眉山市,眉山市民政局赴成都市考察学习居家和社区基本养老服务提升行动项目工作经验,2024-05-13,http://www.ms.gov.cn/info/6940/1166557.htm,近日，我市成功入选民政部 财政部2024年居家和社区基本养老服务提升行动项目地区。为推动项目工作顺利开展，5月9日，眉山市民政局党组书记、局长王建祥带队赴成都市实地考察学习，成都市民政局党组成员、副局长张军陪同。。考察组一行先后参观了抚琴街道西南街社区幸福食堂、营门口街道综合为老服务中心、蓉逸好邻·新安居社区康养中心，听取了他们关于养老服务设施建设、运营、管理的先进经验，以及如何承接项目工作的先进做法。。座谈会上，成都市民政局、金牛区民政局负责人介绍了项目工作经验，王建祥对如何做好项目工作提出了具体工作要求。。一要明白居家和社区基本养老服务提升行动项目工作的重大意义，做到系统性思考，全局性谋划。。三要抓住项目关键点，提前做好采购规划，做好全流程信息化管理，按时序进度推进，做好随时调度准备。。四要抓住契机，规范、科学、合理做好项目实施、绩效评价等工作，切实提升全市居家社区养老服务能力。。大家纷纷表示，成都市先行先试，工作成效显著，考察之行既解答了疑惑，又注入了工作动力，回去后将迅速理清工作思路，快速打开工作局面，不折不扣抓好落实，确保项目工作平稳有序推进。,近日，我市成功入选民政部 财政部2024年居家和社区基本养老服务提升行动项目地区。为推动项目工作顺利开展，5月9日，眉山市民政局党组书记、局长王建祥带队赴成都市实地考察学习，成都市民政局党组成员、副局长张军陪同。。考察组一行先后参观了抚琴街道西南街社区幸福食堂、营门口街道综合为老服务中心、蓉逸好邻·新安居社区康养中心，听取了他们关于养老服务设施建设、运营、管理的先进经验，以及如何承接项目工作的先进做法。。座谈会上，成都市民政局、金牛区民政局负责人介绍了项目工作经验，王建祥对如何做好项目工作提出了具体工作要求。。一要明白居家和社区基本养老服务提升行动项目工作的重大意义，做到系统性思考，全局性谋划。。三要抓住项目关键点，提前做好采购规划，做好全流程信息化管理，按时序进度推进，做好随时调度准备。。四要抓住契机，规范、科学、合理做好项目实施、绩效评价等工作，切实提升全市居家社区养老服务能力。。大家纷纷表示，成都市先行先试，工作成效显著，考察之行既解答了疑惑，又注入了工作动力，回去后将迅速理清工作思路，快速打开工作局面，不折不扣抓好落实，确保项目工作平稳有序推进。,政府领导到其他城市考察学习或访问,0.0,False,否
238,四川省,眉山市,眉山市应急管理局考察组赴乐山市考察学习清单制管理工作,2019-11-12,http://www.ms.gov.cn/info/5569/1072333.htm,为认真贯彻落实王宁副省长和省安办有关清单制管理工作的重要部署和要求，学习借鉴兄弟市（州）清单制管理工作先进经验和做法，进一步提升改进我市清单制管理工作模式和方法，11月7日，眉山市应急局考察学习小组，由市应急局陈一江副局长带队，市应急局总工程师刘建富、金象赛瑞公司安全管理人员等一行7人，赴乐山市五通桥区四川永祥股份有限公司学习清单制管理工作。。考察组一行与乐山市应急局相关领导在永祥公司以座谈会形式，深入交流学习清单制管理工作和烟花爆竹“禁限放”等方面的工作经验和做法。。考察组一行在乐山市应急局和永祥公司相关领导和同志的陪同下先后到生产车间、重大风险区域、消防站、中控室开展考察学习。在考察过程中，主要对日常工作如何运用清单制进行管理和日常风险管控工作等方面进行了解。考察组一行，通过自身工作实际并结合乐山市的经验和做法，与乐山市应急局陪同的领导和同志进行积极广泛的交流。。通过此次考察学习，眉山市考察组学到了更多的工作经验，有利于指导清单制管理工作下一步在全市的广泛运用。,为认真贯彻落实王宁副省长和省安办有关清单制管理工作的重要部署和要求，学习借鉴兄弟市（州）清单制管理工作先进经验和做法，进一步提升改进我市清单制管理工作模式和方法，11月7日，眉山市应急局考察学习小组，由市应急局陈一江副局长带队，市应急局总工程师刘建富、金象赛瑞公司安全管理人员等一行7人，赴乐山市五通桥区四川永祥股份有限公司学习清单制管理工作。。考察组一行与乐山市应急局相关领导在永祥公司以座谈会形式，深入交流学习清单制管理工作和烟花爆竹“禁限放”等方面的工作经验和做法。。考察组一行在乐山市应急局和永祥公司相关领导和同志的陪同下先后到生产车间、重大风险区域、消防站、中控室开展考察学习。在考察过程中，主要对日常工作如何运用清单制进行管理和日常风险管控工作等方面进行了解。考察组一行，通过自身工作实际并结合乐山市的经验和做法，与乐山市应急局陪同的领导和同志进行积极广泛的交流。。通过此次考察学习，眉山市考察组学到了更多的工作经验，有利于指导清单制管理工作下一步在全市的广泛运用。,其他,0.5374672315597844,False,否
238,四川省,眉山市,眉山市工投公司赴泸州工投集团考察学习,2019-03-27,http://www.ms.gov.cn/info/5469/1056463.htm,为学习借鉴先进管理经验，培育企业核心竞争力，3月21日－22日，市工投公司董事长杨艾、总经理郭松带队赴泸州工投集团考察学习，实地考察了泸州工投下属企业，与泸州工投主要负责同志进行了座谈交流。。日，市工投公司董事长杨艾、总经理郭松带队赴泸州工投集团考察学习，实地考察了泸州工投下属企业，与泸州工投主要负责同志进行了座谈交流。。3月21日下午，考察组一行在泸州工投有关领导陪同下，先后参观了中蓝新材料公司、黄舣酒业园区、川南自贸区。，并分别与三家单位负责人就企业标准化生产、现代产业园区建设以及对外贸易等方面情况进行了交。22日上午，考察组与泸州工投集团领导班子进行了座谈。座谈会上，泸州工投主要负责同志详细介绍了泸州工投从成立到发展壮大的创业历程，分享了泸州工投创业过程中所面临的问题和。公司董事长杨艾向泸州工投领导班子介绍了眉山产业发展现状，企业目前所处的发展阶段、主要业务板块，并重点介绍了。所面临的困惑和主要问题。随后，双方各业务板块负责同志就产业基金组建、项目投资、安全生产、供应链金融等方面具体问题进行了深入且富有成效的务实交流。。通过此次考察学习，市工投公司进一步统一了思想，提高了开放合作、对标管理水平，为企业市场化、实体化、多元化发展提供了有益借鉴。,为学习借鉴先进管理经验，培育企业核心竞争力，3月21日－22日，市工投公司董事长杨艾、总经理郭松带队赴泸州工投集团考察学习，实地考察了泸州工投下属企业，与泸州工投主要负责同志进行了座谈交流。。日，市工投公司董事长杨艾、总经理郭松带队赴泸州工投集团考察学习，实地考察了泸州工投下属企业，与泸州工投主要负责同志进行了座谈交流。。3月21日下午，考察组一行在泸州工投有关领导陪同下，先后参观了中蓝新材料公司、黄舣酒业园区、川南自贸区。，并分别与三家单位负责人就企业标准化生产、现代产业园区建设以及对外贸易等方面情况进行了交。22日上午，考察组与泸州工投集团领导班子进行了座谈。座谈会上，泸州工投主要负责同志详细介绍了泸州工投从成立到发展壮大的创业历程，分享了泸州工投创业过程中所面临的问题和。公司董事长杨艾向泸州工投领导班子介绍了眉山产业发展现状，企业目前所处的发展阶段、主要业务板块，并重点介绍了。所面临的困惑和主要问题。随后，双方各业务板块负责同志就产业基金组建、项目投资、安全生产、供应链金融等方面具体问题进行了深入且富有成效的务实交流。。通过此次考察学习，市工投公司进一步统一了思想，提高了开放合作、对标管理水平，为企业市场化、实体化、多元化发展提供了有益借鉴。,其他,0.5723866244072003,False,否
238,四川省,眉山市,眉山市文联赴资阳市文联考察学习,2022-03-25,http://www.ms.gov.cn/info/1307/1128589.htm,3月24日，眉山市文联、市音协、美协、作协负责人赴资阳市文联考察学习，与资阳市文联主席魏华，副主席、作协主席唐俊高，音乐舞蹈家协会主席邓孟祥等领导和文艺家作了深入的交流。。考察团一行先后实地考察了资阳市文艺界则思法律维权工作室、资阳大众网，观看了文艺维权接待日现场接待情况，了解了“网络＋文艺”工作情况。每到一处，考察组都耐心的聆听讲解，饶有兴趣的询问有关问题，认真考察学习。在随后的两地文联座谈交流会上，两地文联就文艺名家培育、文艺阵地建设、文艺精品创作扶持、文艺维权、“网络＋文艺”、文艺志愿服务和文艺助力乡村振兴、协会管理、评协筹备工作等工作进行了交流。两地文联纷纷表示将共同携手，在文艺创作、文艺扶持、文艺宣传、文艺为民、文艺惠民、文艺交流等方面开展深度合作，共谋两地文化艺术事业的繁荣发展。,3月24日，眉山市文联、市音协、美协、作协负责人赴资阳市文联考察学习，与资阳市文联主席魏华，副主席、作协主席唐俊高，音乐舞蹈家协会主席邓孟祥等领导和文艺家作了深入的交流。。考察团一行先后实地考察了资阳市文艺界则思法律维权工作室、资阳大众网，观看了文艺维权接待日现场接待情况，了解了“网络＋文艺”工作情况。每到一处，考察组都耐心的聆听讲解，饶有兴趣的询问有关问题，认真考察学习。在随后的两地文联座谈交流会上，两地文联就文艺名家培育、文艺阵地建设、文艺精品创作扶持、文艺维权、“网络＋文艺”、文艺志愿服务和文艺助力乡村振兴、协会管理、评协筹备工作等工作进行了交流。两地文联纷纷表示将共同携手，在文艺创作、文艺扶持、文艺宣传、文艺为民、文艺惠民、文艺交流等方面开展深度合作，共谋两地文化艺术事业的繁荣发展。,政府领导到其他城市考察学习或访问,0.0,False,否
238,四川省,眉山市,学经验促提升眉山市应急管理系统赴雅安甘孜考察学习全国自然灾害综合风险普查工作,2020-12-09,http://www.ms.gov.cn/info/5569/1103685.htm,学经验，促提升，眉山市应急管理系统赴雅安、甘孜考察学习全国自然灾害综合风险普查工作。日，市应急管理局组织眉山天府新区、各县（区）应急部门分管领导组成考察学习组，赴全国试点县（市）雅安市芦山县、甘孜州康定市考察学习第一次全国自然灾害综合风险普查工作先进经验。。考察组一行通过座谈交流、查阅资料、实地查看等方式，详细学习了解了试点县（市）风险普查工作开展情况，查阅了普查成果相关资料，并就普查方案编制、组织形式、经费保障、人员队伍、灾害风险隐患底数调查等工作与相关领导同志进行了面对面交流和探讨。。全国自然灾害综合风险普查是一项重大的国情国力调查，是深入学习贯彻习近平总书记关于防灾减灾救灾和自然灾害防治工作重要论述的具体行动，是提升自然灾害防治能力的基础性工作。本次普查需要应急管理、自然资源、生态环境、住房建设、交通运输、水利、气象、林业等多个部门直接参加，涉及范围广、参与部门多、协同任务重、工作难度大。。一步，市应急管理局将根据国家和省级部署安排，在充分吸收借鉴试点县（市）先进经验成果的基础上，进一步创新工作思路，压实工作责任，组织相关部门通力协作，形成工作合力，为全面铺开第一次全国自然灾害综合风险普查工作提供坚实保障，开创眉山市防灾减灾救灾工作新局面。,学经验，促提升，眉山市应急管理系统赴雅安、甘孜考察学习全国自然灾害综合风险普查工作。日，市应急管理局组织眉山天府新区、各县（区）应急部门分管领导组成考察学习组，赴全国试点县（市）雅安市芦山县、甘孜州康定市考察学习第一次全国自然灾害综合风险普查工作先进经验。。考察组一行通过座谈交流、查阅资料、实地查看等方式，详细学习了解了试点县（市）风险普查工作开展情况，查阅了普查成果相关资料，并就普查方案编制、组织形式、经费保障、人员队伍、灾害风险隐患底数调查等工作与相关领导同志进行了面对面交流和探讨。。全国自然灾害综合风险普查是一项重大的国情国力调查，是深入学习贯彻习近平总书记关于防灾减灾救灾和自然灾害防治工作重要论述的具体行动，是提升自然灾害防治能力的基础性工作。本次普查需要应急管理、自然资源、生态环境、住房建设、交通运输、水利、气象、林业等多个部门直接参加，涉及范围广、参与部门多、协同任务重、工作难度大。。一步，市应急管理局将根据国家和省级部署安排，在充分吸收借鉴试点县（市）先进经验成果的基础上，进一步创新工作思路，压实工作责任，组织相关部门通力协作，形成工作合力，为全面铺开第一次全国自然灾害综合风险普查工作提供坚实保障，开创眉山市防灾减灾救灾工作新局面。,政府领导到其他城市考察学习或访问,0.0,False,否
238,四川省,眉山市,区国资金融局会同相关部门赴成都市考察学习企业先进模式,2019-03-18,http://www.ms.gov.cn/info/5469/1055139.htm,日上午，区国资金融局会同彭山发展控股有限责任公司、区经信局、纪委第一派出纪检组赴四川中德禄江装备科技有限公司学习企业发展先进的先进理念和现代企业管理运作模式。。考察团一行在企业负责人的陪同下对中德禄江进行了全面的考察学习，每到一处，考察团都认真听取项目情况介绍，详细了解企业建设、生产情况以及精细化管理等方面的先进经验。考察团一行对中德禄江的建筑垃圾资源化处理表现出极大兴趣，此项目将建筑垃圾处理推向健康的发展道路，实现城市建筑垃圾减量化、资源化、无害化处理，变废为宝。。参观结束后，召开了座谈会，相关部门领导进行了交流发言，对中德禄江从新产品研发、人才引进、转调升级等方面入手，持续优化发展环境，助推区域经济快速发展的做法表示赞赏，特别是他们依靠科技创新和先进的环保理念做大做强优势产业、推动企业可持续发展的思路让考察团受益匪浅。大家纷纷表示，通过参观学习，进一步开阔了视野，拓展了思路，要以此次学习考察为契机，深入学习借鉴优秀企业先进经验和做法，期待贵公司把优秀的人才、技术引进彭山，助力彭山发展控股公司做优做强，合作共赢！,日上午，区国资金融局会同彭山发展控股有限责任公司、区经信局、纪委第一派出纪检组赴四川中德禄江装备科技有限公司学习企业发展先进的先进理念和现代企业管理运作模式。。考察团一行在企业负责人的陪同下对中德禄江进行了全面的考察学习，每到一处，考察团都认真听取项目情况介绍，详细了解企业建设、生产情况以及精细化管理等方面的先进经验。考察团一行对中德禄江的建筑垃圾资源化处理表现出极大兴趣，此项目将建筑垃圾处理推向健康的发展道路，实现城市建筑垃圾减量化、资源化、无害化处理，变废为宝。。参观结束后，召开了座谈会，相关部门领导进行了交流发言，对中德禄江从新产品研发、人才引进、转调升级等方面入手，持续优化发展环境，助推区域经济快速发展的做法表示赞赏，特别是他们依靠科技创新和先进的环保理念做大做强优势产业、推动企业可持续发展的思路让考察团受益匪浅。大家纷纷表示，通过参观学习，进一步开阔了视野，拓展了思路，要以此次学习考察为契机，深入学习借鉴优秀企业先进经验和做法，期待贵公司把优秀的人才、技术引进彭山，助力彭山发展控股公司做优做强，合作共赢！,其他,0.5446208260994838,False,否
