code,province,city,topic,date,url,content,content.1,label,score,is_match
93,安徽省,合肥市,市委副书记熊建辉率团赴渝成武学习考察城乡统筹工作,2009-06-12,http://nyncj.hefei.gov.cn/nyzx/nyxw/8873361.html,为深入贯彻落实科学发展观，推进我市又好又快发展，近日，市委副书记熊建辉率团前往重庆、成都、武汉，学习考察三地在推进统筹城乡综合配套改革，培育高新技术产业等方面的先进经验，扩大交流合作。市委常委、统战部长张进，市直有关部门负责同志参加了考察。 几天来，熊建辉一行风尘仆仆，进园区，入企业，到社区，下地头，看展馆，听介绍。在重庆，考察了九龙坡区白市驿国家级花卉苗木产业示范园、陶然居社会主义新农村建设示范基地、重庆城市规划展览馆等；在成都，考察了锦江区三圣街道、成都高新区、都江堰市灌口镇等；在武汉，考察了东西湖区百步亭社区、武汉农村综合产权交易所等。三地党政负责同志分别会见了考察团一行，并陪同参观考察。 我市还分别与三地举行座谈会，就推进经济社会发展和城乡统筹进行深入交流。大家一路学习考察，思考交流，受到深刻启发。 近年来，重庆、成都、武汉坚持以科学发展观为统揽，着力推进统筹城乡发展、解决“三农”问题，努力形成城乡一体化发展新格局，取得一定成效。２００７年重庆获批“全国统筹城乡综合配套改革试验区”后，九龙坡即被确定为“重庆市城乡统筹发展综合改革先行示范区”。成都２００７年被批准为“全国统筹城乡综合配套改革试验区”。武汉２００７年成为“全国‘两型社会’建设综合配套改革试验区”，城乡统筹是其综合配套改革试验的６大领域之一。三地统筹城乡、加快新农村建设的思路与做法，具有较强的代表性和典型性，值得我市深入研究和借鉴。 熊建辉在考察时指出，推进城乡统筹、构建城乡一体化新格局是顺应城市发展客观规律的重大决策，是建设现代化滨湖大城市的客观需要，是我们破解发展难题、落实科学发展观的具体体现。这次到成渝武考察，就是要虚心学习先进经验，进一步理清发展思路。他强调，要认真学习三地深化综合配套改革、统筹城乡和区域协调发展的先进理念和战略举措，增强加快推进我市全省城乡一体化综合配套改革试点市建设的紧迫感和使命感。要学习先进地区的创新理念，以推进制度创新为关键，激发城乡一体化的新活力；要学习先进地区的发展经验，以加快县域工业化为核心，强化城乡一体化的支撑力；要学习先进地区的规划理念，以壮大中心城市为基础，增强城乡一体化的源动力；要学习先进地区的推进方式，以加强组织领导为保证，凝聚城乡一体化的新合力，加快推进我市城乡一体化发展进程。。我市还分别与三地举行座谈会，就推进经济社会发展和城乡统筹进行深入交流。大家一路学习考察，思考交流，受到深刻启发。。近年来，重庆、成都、武汉坚持以科学发展观为统揽，着力推进统筹城乡发展、解决“三农”问题，努力形成城乡一体化发展新格局，取得一定成效。２００７年重庆获批“全国统筹城乡综合配套改革试验区”后，九龙坡即被确定为“重庆市城乡统筹发展综合改革先行示范区”。成都２００７年被批准为“全国统筹城乡综合配套改革试验区”。武汉２００７年成为“全国‘两型社会’建设综合配套改革试验区”，城乡统筹是其综合配套改革试验的６大领域之一。三地统筹城乡、加快新农村建设的思路与做法，具有较强的代表性和典型性，值得我市深入研究和借鉴。,近日，为进一步开拓眼界、激发创新活力，由市局党组成员、市经济责任审计局局长徐伟带领的经济责任审计学习考察组，赴昆明、柳州市审计局进行了专题学习考察交流。通过座谈学习和赴县局实地走访进一步感受了两地在经济责任审计全覆盖的诠释和制度建设，村居负责人审计组织实施和操作流程，审计结果陈述（质询），以及环保责任和自然资源审计实施和筹备等方面的积极实践和探索。同时，双方还就经济责任审计评价、责任界定、内管干部审计、信息平台建设、资源整合、机构设置等进行了广泛交流。。此次学习考察不仅开阔了视野，找准了定位，也为下一步创新和探索新形势下经济责任审计工作提供了有益借鉴和思路。,政府领导到其他城市考察学习或访问,0.0,True
93,安徽省,合肥市,杨增权副市长率团赴苏州学习考察体育大会工作,2008-03-06,https://tyj.hefei.gov.cn/public/20201/42555291.html,为了积极推进第四届全国体育大会的筹备工作，3月6日—3月8日，副市长杨增权率市体育局、建委、规划局等部门负责同志一行8人，赴苏州市学习考察承办第三届全国体育大会的成功经验和做法。。苏州市政府副市长王鸿声、副秘书长陆俊秀热情接待了杨增权副市长一行。苏州市体育局、文广局等负责同志和曾在第三届全国体育大会组织委员会相关部室工作过的同志分别就组织机构设置、场馆设施建设情况、市场开发情况、经费使用情况、新闻宣传工作、接待工作、大型活动组织、开闭幕式组织策划等方面的内容，详细介绍了经验、做法、体会。杨增权副市长一行还实地考察了苏州体育中心。。考察中，杨增权副市长要求市体育局、建委、规划局要积极学习借鉴苏州的成功经验，并结合合肥实际，制定相关工作方案，启动各项筹备工作，努力体现合肥特色，办出合肥水平，务求精彩、和谐、成功！,区财政局一行赴苏州市金融办、苏州银行学习考察金融综合服务平台建设工作。徽商银行相关负责人和技术人员参加学习考察。考察小组一行听取了苏州金融办、苏州银行对服务平台建设情况的介绍，围绕平台建设开发、日常运行、信息维护等相关内容进行了详细了解和深入探讨，重点是对数据收集、推广使用等进行重点了解。下一步将结合,其他,0.5642225120111707,True
93,安徽省,合肥市,合肥滨湖科学城直属机关党委召开理论学习中心组学习扩大会议,2021-05-10,http://bhkxc.hefei.gov.cn/bhdt/18069289.html,合肥滨湖科学城直属机关党委召开理论学习中心组学习（扩大）会议_合肥滨湖科学城管委会。会前，编发了习近平总书记关于青年工作重要论述综述、习近平在广西考察时的重要讲话精神、李锦斌在省委专题会议暨中央生态环保督察安徽省整改工作领导小组会议上重要讲话精神、市委全面深化改革委员会第八次会议虞爱华重要讲话精神等学习材料，中心组成员在会前进行了认真自学。。直属机关党委专职副书记、党群工作部部长刘剑传达学习中共中央政治局研究当前经济形势和经济工作会议精神。办公室（财务审计部）主任张生传达学习安徽省党政代表团赴沪苏浙学习考察对接合作李锦斌重要讲话精神。杨伟表示，我们要深刻理解李锦斌书记在省党政代表团赴沪苏浙学习考察交流会上提出的五个震撼，并对照先进找差距。要破除思想上的因循守旧，争做创造一流的搏击者；破除工作上的小进即满，争做高质量发展的奋进者；破除能力上的本领恐慌，争做善作善成的佼佼者；破除章法上的简单粗放，争做匠心独运的践行者；破除作风上的假大虚浮，争做脚踏实地的实干者。。杨伟强调，为深入贯彻长三角一体化发展国家战略，我们要深刻领会虞爱华书记在市委常委会会议上提出的“扬长、补短”，重点围绕“五个方面”学习提高，加强制度设计和机制创新、做大体量、提高城市品质、讲好一体化和滨湖科学城高质量发展的故事、提升领导力和执行力，争当长三角一体化高质量发展“上进生”。,为加快推进诚信庐阳和社会信用体系建设，更好地发挥守信激励和失信惩戒机制作用，引导用人单位增强社会责任感，强化劳动用工管理自律，区人社局积极开展劳动保障诚信红黑名单制度建设。2017年6月，合肥市劳动监察支队组织全市劳动监察负责同志赴浙江泰州、丽水学习考察用人单位劳动保障诚信红黑名单公布制度，区人社局相关同志参加此次学习。。本次考察学习先后赴浙江丽水、泰州，学习了丽水市、泰州市劳动保障行政部门关于用人单位诚信管理的《泰州市用人单位劳动保障诚信红黑名单公布暂行办法》、《丽水市劳动保障诚信红黑名单管理暂行办法》等规章制度和实际操作运行过程中的工作方法和先进经验。作为先发地区较早开展诚信红黑名单制度的地区，丽水、泰州在劳动保障诚信建设方面各有特色，为下一步庐阳区劳动保障红黑名单制度建设提供了有益的借鉴。。在总结相关学习经验的前提下，同时结合庐阳区每年对外公布的用人单位违法用工公示名单制度，将积极开展劳动保障诚信红黑榜制度。结合《安徽省用人单位劳动保障守法诚信等级评价实施办法》，庐阳区将按照全市统一部署，将自觉遵守劳动法律法规，年度劳动保障书面审核信用A级单位；年度内无举报投诉；年度内无集体上访事件发生等单位列入劳动保障诚信红名单。将发生二次以上劳动保障违法行为；因劳动保障违法行为发生影响社会稳定的突发性群体性事件；存在使用童工；无理抗拒劳动保障监察；欠薪逃匿等行为的用人单位列入劳动保障诚信黑名单，并予以公布。,其他,0.5838248329240922,True
93,安徽省,合肥市,政务服务中心负责人一周工作预安排表月日至日,2017-09-25,https://www.chaohu.gov.cn/public/15241/77023341.html,1.参加分管市长每周工作调度会；2..会同规划局、设计公司的专业人员赴周边先发中心考察调研;3.处理机关事务。1.指导半岛各乡镇街道、村 （社区）申报为民服务全程代理工作示范单位； 2.针对新中心设计方案赴上海等 地考察学习。1.赴乡镇街道为民服务中心指导为民服务全程代理工作示范点建设工作；2.处理机关事务。1.做好文明创建工作；2.处理市长热线日常工作 3.赴柘皋镇开展精准扶贫工作调研 ；,合肥作为长三角世界级城市群副中心，发展速度快、态势好、潜力大，与中心城市上海的合作是现实需要。我市高度重视，市政府工作报告、市“十三五”规划纲要等，都将双城合作工作纳入其中、提出要求。市直有关单位和各县（市）区、开发区纷纷响应，积极推进。为进一步推动合肥上海双城合作，今后将重点推进以下几项工作：。在前期上海、合肥两市政协交流合作工作基础上，拟成立市委、市政府、市政协领导和有关部门负责人参加的双城合作联席会议，研究双城合作中的重要问题，制定双城合作的扶持政策，统筹双城合作工作的推进。建立以市发改委为主体、有关部门参加的双城合作工作推进机构，负责联席会议的日常工作。。借鉴上海与杭州、南京的战略框架协议，结合我市实际，经双方会商，拟签订全面战略合作框架协议，围绕两市中长期发展战略重点和需求，以互补互动、共享为基点，主要内容为：加强两地基础设施互联互通，推进科技创新合作。推进教育、卫生、社保等社会事业合作，推进文化旅游等方面合作，推进城市治理、人才合作，建立更具协同高效的合作机制。重点促进园区共建。根据上海与合肥产业发展的共同需要，在合肥共建承接产业转移或按产业链分工协作的工业园区，科研成果转化和产业化的高新技术园区，借鉴“新加坡工业园”模式，探讨园区开发建设和运营管理的新模式；两地每年开展。次联合招商活动。注重推进产业体系升级合作。依托双方各自产业基础、科教基础及资源禀赋，发挥比较优势，联合开展产业合作；开展工业品牌互认，建立跨区域产业技术创新战略联盟，推动双方在家电、汽车、电子信息及软件、生物医药、新材料等产业领域分工合作；优化区域间产业布局，打造一批有较强竞争力优势特色产业基地或集聚区，构建具有区域特色现代产业体系，推动长三角地区形成具有国际竞争力的产业集群。。此项工作市政府已向省政府做了专题报告，并发函至上海市政府征求《上海合肥战略合作框架协议》意见，目前，正在积极跟进。委员提出的安徽合肥商贸物流开发区建设，我市也与上海合作交流办取得联系。。今年，我市将适时组织党政代表团到上海学习考察，并邀请上海市党政代表团到肥考察。届时，计划签署两地战略合作框架协议和具体项目合作。,其他,0.599073935671806,True
93,安徽省,合肥市,找差距取真经谋发展,2017-08-04,https://www.hfss.gov.cn/public/14981/72243121.html,本报讯 7月25日上午，区委书记李学明率队赴巢湖市学习考察文明创建及城市管理工作，区领导叶志明、崔学章、彭兆耀、卢磊，区直有关部门、各镇街开发区负责同志参加考察。市委常委、巢湖市委书记胡启生会见考察人员，巢湖市委副书记许汉生率党政班子相关领导和有关部门负责人陪同考察。。当天上午，李学明一行深入现场，先后学习考察了巢湖市一中巷口环卫、团结路“牛皮癣”清理整治、陆家河公厕改造和管理、岗岭社区老旧小区改造、洗耳池公园园林绿化养护以及巢湖路与长江路交口交通秩序管理等工作。每到一处，李学明都要求相关区直部门和镇街开发区要善于取长补短，积极学习借鉴当地在文明创建和城市管理方面好的经验做法。。在随后举行的座谈会上，听取了巢湖市城乡环卫一体化、“牛皮癣”整治、“厕所革命”、老旧小区改造、园林绿化管护以及市区交通秩序管理等工作的经验交流后，李学明代表全体学习考察人员对巢湖市精心组织的学习考察活动表示感谢，现场各单位均虚心地向巢湖市学习文明创建和城市管理经验。李学明说，近年来巢湖市在文明创建和城市管理工作中敢于动真碰硬、善于学习创新、注重考核管理，变化令人耳目一新。李学明要求全体学习考察人员，要充分认识到与巢湖市的差距。要认识到与巢湖市在工作上、作风上以及管理上的差距，巢湖市决心之大、作风之实、标杆之高，值得蜀山区每一位领导干部深刻反思、虚心学习。要认真学习巢湖市干部的精神风貌。要学习他们身先士卒、真抓实干的作风，学习他们海纳百川、开放包容的胸怀，学习他们科学求实、与时俱进的创新精神，学习他们无私奉献、心系民生的为民情怀。要认真消化抓好整改落实。巢湖市许多工作为我们树立了标杆，各相关单位要认真消化学习考察成果，深琢细嚼、结合实际、认真践行，以抓铁有痕的精神抓好整改落实和改进提升。。会上，许汉生简要介绍了巢湖市当前经济社会发展取得的最新成就，并系统地梳理了该市文明创建和城市管理工作的主要做法。许汉生表示，希望两地今后多相互交流学习，互相吸收和消化好的经验做法，共同推动发展，助力大湖名城建设。。叶志明在座谈会上说，巢湖市在文明创建和城市管理工作中力度大、动真格、体制好、敢担当，通过拉高标杆、系统谋划和抓协调推进、抓分块调度，各方面均取得较大成果。叶志明要求各单位要加强与巢湖市相关部门的沟通对接，同时希望巢湖市常来蜀山区传经送宝，并祝愿巢湖市创城工作取得圆满成功，共同推进合肥市文明创建和城市管理工作再上新的台阶。,近年来，我县高度重视教育督导工作，以五大措施为保障，创新工作机制，改进督导方式，提高督导实效，努力实现挂牌督导工作的科学化、规范化、制度化。。健全组织，提供机制保障。2013年以来，我县制定系列文件，将全县划分为5个督学责任区，每个督学责任区配备3名专职督学和5名兼职督学，每位责任督学负责4至5所学校，并在县内每所学校门口醒目位置悬挂专职督学公示牌，为每位专职督学印制胸牌，实行挂牌督导，实现县域内中小学校责任督学挂牌督导全覆盖。出台系列配套管理文件，规定责任区督学的聘任、管理、培训、考核和定期交流等办法，实现督学佩证督查、公正督查、廉洁督查。。科学配备责任督学队伍，提供人员保障。县政府从具有丰富学校管理经验的原中小学校长中，选聘15名专职督学，从全县不同学科骨干教师和中层干部中选配29名兼职督学，督学队伍的专业、年龄、层次结构合理，基本覆盖相关学科专业和教育管理领域。。畅通责任督学培训渠道，提供素质保障。出台《督学培训大纲》，组织督学岗前培训和全员培训。组织督学到教育督导先进地区进行实地考察学习培训，2016年，组织督学到合肥市包河区、瑶海区学习考察；暑期又组织督学赴北京师范大学参加督学工作培训；兼职督学与学校校级培训班赴北京培训；连续3年在肥西师范组织专职督学进行学习交流。通过一系列形式多样、内容丰富的学习培训，初步形成了一支相对稳定、凝聚力强、水准较高、形象良好的责任督学队伍。。加大投入，提供经费保障。督导经费逐年增长并纳入财政预算，2014、2015、2016年每年安排督导专项经费70万元，其中督学责任区工作经费30万元，教育督导考核经费10万元，义务教育均衡发展督导评估考核经费30万元。为保障教育督导工作的正常开展，教育督导经费实行实报实销。。落实待遇，提供条件保障。5个督学责任区办公场所设在交通条件便捷的完全中学或者中心校。办公室配备了电脑、打印机、照相机、档案柜等设备，订购有关督导报刊杂志等。督学区办公条件优越，办公设备齐全，有力地促进了教育督导工作的顺利开展。同时，督学个人待遇进一步提升，专职督学绩效工资按照全县教师标准的130%，岗位提升绩效奖励按Ａ档发放。,政府领导到其他城市考察学习或访问,0.5094558655306753,True
93,安徽省,合肥市,我市召开学习成渝武统筹城乡发展综合改革座谈会,2009-06-19,http://nyncj.hefei.gov.cn/nyzx/nyxw/8857541.html,6月18日下午，合肥市召开学习成渝武统筹城乡发展综合改革座谈会。市委副书记熊建辉、市委常委、统战部长张进、副市长江洪出席会议并讲话，我市赴成渝武3市学习考察组成员和农口部门负责人参会。会议由市委副秘书长刘锡成主持。 市直农口部门负责人介绍了我市农业农村发展现状，提出了统筹城乡发展中遇到的突出问题，考察组成员交流了学习考察重庆、成都、武汉3市城乡一体化发展的体会和收获，就合肥如何更好更快的推进城乡一体化进程进行了深入研讨。 座谈会上，市委副书记熊建辉指出，近年来，市委、市政府高度重视城乡统筹发展战略，出台了一系列政策，部署了具体措施，合肥的城乡一体化进程取得了显著成效，但仍然需要不断持续地加快推进。他强调，这次学习考察的重庆、成都、武汉3市在统筹城乡发展、构建城乡一体化新格局方面有很多值得合肥学习借鉴的地方，我市要很好的学习成功经验，破解发展难题，走出一条具有合肥特色的城乡统筹道路。,日前，庐阳区委常委、组织部部长曹佑华同志带领区人社局局长王新成、区教体局党委书记张振发等相关人员，前往山东省潍坊市学习考察中小学校长职级制度改革的成功经验，为庐阳区实施校长职级制度改革做准备。 这次考察学习，曹部长带领大家认真聆听潍坊市教育局及学校相关人员的详细介绍，仔细询问实施办法和攻坚克难的经验，还深入潍坊一中、潍坊高新双语学校等实地考察实施效果。山东省潍坊市于2004年新学年开学后，先在全市普通高中学校及二至三个县市区进行试点。在此基础上，于2011年3月与8月分别出台了《中共潍坊市委、潍坊市人民政府关于加快教育体制机制改革全面实现教育现代化的决定》和《中共潍坊市委办公室、潍坊市人民政府办公室关于转发市委组织部等四部门<关于深化和完善中小学校长职级制度改革的实施意见>的通知》，在全市范围实行中小学校长职级制度改革，全面取消了校长的行政级别。为了进一步规范校长职级评定，潍坊市教育局于2012年1月制定出台了《关于印发市教育局直属学校和区属高中学校校长职级评审认定办法的通知》（试行），分别从指导思想、评审范围、申报条件、职级结构、认定程序、组织领导等六个方面作了明确规定，并进入实质性操作。 潍坊市教育局实行校长职级制度改革成效明显，主要有六点：一是解决了非常热爱教育的人员进入教育系统任职的问题。二是解决了校长忙于繁杂的社会事务不能专注于教学研究问题。三是解决了校长到龄“一刀切”造成的资源浪费问题。四是解决了校长付出与待遇不对称的问题。五是为现代教育制度建设提供了前提和保障。六是校长成为可以公开追求的职业。 通过考察，大家开拓了思维，开阔了眼界，明晰了下一步的工作思路，更增强了区委区政府加强全区中小学校长队伍建设与改革的信心。打造高素质校长、教师队伍是庐阳教育高位发展的关键。这次中小学校长职级制度改革，将拉开庐阳教育再次腾飞的帷幕。,政府领导到其他城市考察学习或访问,0.5909182681982116,True
