code,province,city,topic,date,url,content,content.1,label,score,is_match
93,安徽省,合肥市,市党政代表团赴太原学习考察,2007-12-25,http://tzcjj.hefei.gov.cn/tzdt/gzdt/14268591.html,时值岁末，正当全市上下深入学习贯彻党的十七大和中央经济工作会议精神，回顾总结２００７年工作，认真谋划２００８年和今后一个时期发展之时，１２月２２日至２３日，省委常委、市委书记孙金龙亲率合肥市党政代表团，利用双休日赶赴山西省会太原学习考察深入贯彻落实科学发展观，促进经济社会又好又快发展的好经验、好做法，共商加强两地合作、推动区域发展大计。。虽是隆冬，朔风扑面，但龙城太原却处处洋溢着蓬勃发展的生机。２２日上午，市党政考察团一下飞机，顾不上休息，就来到世界５００强企业之一的富士康（太原）科技工业园，深入车间考察其生产过程和技术研发流程等，感受现代高科技企业发展脉搏。。下午，考察团又马不停蹄地考察了两个大企业、大集团。第一个是不锈钢产能世界第一的太原钢铁（集团）有限公司。所到之处，空中现代化钢炉林立、管道密集，一根根高耸的烟囱排出经净化的一团团白烟；地面花木成行，干净整洁。另一个是大型老字号工业企业——太原重型机械集团有限公司的生产一线，每一个考察团成员都切身感受该企业红火的生产场景。。２３日上午，考察团又先后考察了太原城市规划展示大厅，参观了位于汾河岸边的生态长廊——汾河湿地公园，沿途还考察了新晋祠路、迎宾路、古唐路等城市基础设施建设。两天的考察学习，三晋大地古老深厚的历史文化，太原市近年来取得的现代化建设成果，太原人民勇于创新、率先探索的胆识和魄力，昂扬向上、奋发有为的精神状态，给合肥市党政代表团留下了深刻印象。。２３日下午，“太原—合肥经济社会发展交流座谈会”举行。太原市委副书记、纪委书记李永林主持会议。会上，太原市委副书记、市长张兵生，合肥市委副书记、市长吴存荣分别介绍了两市的基本市情、工作思路和战略布局。。近年来，太原市国民经济和各项社会事业取得长足进步，综合经济实力大增，特别是具有代表性的不锈钢生产、铝镁合金加工、焦煤和热电生产等数个产业在全国都堪称“龙头”，其重点工业企业在经济发展中的比重、对全市经济社会发展具有的重要作用是合肥难以企及的。。孙金龙指出，太原之行时间虽短，但合肥党政代表团印象深刻、感想颇多，既开阔了视野，启发了思路，学到了经验，又看到了差距，增加了压力，激发了干劲。太原干部群众开拓务实、敢闯敢试的拼搏精神更令人备受鼓舞，更加坚定了我们在新的起点上继续推进合肥跨越式发展的决心和信心，其中很多好的经验和做法，值得合肥认真学习和借鉴。同太原一样，近年来，合肥经济社会也持续快速健康发展，各项事业取得长足进步；当前，中央支持“中部崛起”的大政方针已经付诸实施，国内外产业和资本正加速向中西部转移，这对太原和合肥来说都是难得的发展机遇。两市既有广泛的交流基础，又有进一步加强合作的现实条件，希望以此次考察学习为契机，进一步增进两市友谊，扩大交流与合作，共同促进经济社会又好又快发展。。山西省委常委、太原市委书记申维辰对合肥党政代表团的到来表示欢迎，并指出此次合肥代表团匆匆来并考察，这种务实高效，以特殊形式思考自身工作、及时谋划２００８年大计的工作作风和方法值得太原学习和借鉴。在简要介绍太原经济社会发展的有关情况后，申维辰强调太原与合肥在经济社会发展过程中面临很多共同机遇和挑战，这些为两市扩大友好交流与合作、促进共同进步提供了良好的基础和前景，他真诚希望今后两市的交流与合作更上一层楼。。合肥市领导黄同文、周富如、董昭礼、方军、杜平太、安列、杨思松、林存安、雍成瀚、章义、许立华、刘烈东、甄长琢、江明、张进、杨增权等参加考察并出席座谈会；太原市领导李荣怀、姬和平、陈森、范世康、张贵元、李俊明、李怀民、荣彤、张春根、王建生等陪同考察并出席座谈。,10月13日—14日，由区委书记吴劲，区委副书记、代区长黄卫东，区人大常委会主任虞基浩，区政协主席谭峰，区委副书记张家祥以及区四套班子其他领导，区直相关部门、各乡镇街道、庐阳工业区主要负责人组成的代表团，先后赴肥西县、庐江县、肥东县、巢湖市、巢湖经开区、长丰县等地参观考察，学习借鉴兄弟县市在项目招商与建设、旧城区改造征迁、美好乡村建设、旅游资源挖掘开发等方面的先进经验与做法，自我加压鼓劲，进一步激发全区领导干部奋力赶超、干事创业的信心和动力。。家电（合肥）产业园、上派金寨南路及旧城区改造征迁工程项目，庐江县凯迪绿色能源有限公司、冶父山牡丹园苗木花卉基地以及汤池国轩天体温泉宫项目，肥东县马钢（合肥）公司薄板深加工、长临古街项目，巢湖市中李村美好乡村建设、烔炀河口湿地以及巢湖娃哈哈工业园项目，巢湖经开区北大未名研究院、郁金香高地旅游项目，长丰县双凤工业区北城世纪购物中心、世纪金源酒店项目。一天半的时间里，代表团马不停蹄，细致考察，虚心请教。所到之处各项目建设一派欣荣景象给我区各级领导干部留下深刻印象。。日上午，此次外出考察学习总结座谈会在区政务中心召开。会上，区住建局、区农林水务局、区商务局、庐阳工业区四家单位负责人结合所见所闻，分别围绕项目推进和大建设、美好乡村建设、现代服务业发展、工业转型升级等内容进行了交流发言。。吴劲在讲话时指出，我们组织这次考察学习，就是为了走出去实地感受兄弟县市干事创业的浓厚氛围，看到他们近年来在经济社会发展方面时不我待、你追我赶的劲头，从而增强我们自身的紧迫感，思考谋划下一步工作举措。。他强调，要进一步提振精神，把全省“首善之区”和辐射源建设的旗帜高高举起。要看到“状态”而不仅是“成果”，找到差距，把奋发有为的工作状态、昂扬向上的干事激情和首善庐阳的自觉自信，充分融进全区各项工作中去，不能“等一等、歇一歇、松一松”。要进一步坚定信心，攻坚克难，再掀全区经济社会发展的新局面。老城区有自己的问题和困难，如产业转型、城市管理、城中村危旧房改造等，但实践证明，只要肯琢磨、下功夫、有信心，并理顺体制，形成合力，事情就会往好的方向发展。要进一步改革创新，在“大湖名城、创新高地”建设中谱写好庐阳文章。全区深化改革已进入深水期和攻坚期，要结合群众路线教育实践活动，在新形势下不断调适工作体制机制，完善各项工作制度，服务于全区经济社会发展。。黄卫东说，要认识到差距与不足，找准自身定位，切实增强责任感和紧迫感，在经济指标完成、重大项目推进、产业转型升级以及商业旅游资源挖掘等工作上，研究新问题，找到新举措，发挥庐阳自身优势，进一步提升城乡发展品质。要客观分析原因，在精神上加压再加压、认识上强化再强化，以只争朝夕的状态、雷厉风行的作风和锐意进取的精神，推动下一步各项工作。同时要加强工作督导力度，用结果衡量、以效果评价工作的推动落实。要对照梳理年初制定的各项工作任务，主动而为、自我补缺，树立全区一盘棋的思想，持续紧抓重大项目推进、加快市政基础设施建设、深入谋划产业转型升级、破解信访维稳难题。在全面完成今年目标任务的同时，还要切实谋划好明年的各项工作。,政府领导到其他城市考察学习或访问,0.8006932957202721,True
93,安徽省,合肥市,蜀山区赴宣城市考察学习创卫工作,2016-06-14,https://www.hfss.gov.cn/public/14701/101589623.html,宣城市在创建省级卫生城市工作中:一是高度重视。市委书记亲自任总指挥政委，参与工作，市长任指挥部指挥长，政府从人力和财力予以保障。二是措施得力，彰显特色。定期召开创卫推进会、调度会，市委、市政府与各责任部门签订目标责任书，细化创建任务、完成时限和奖惩措施，各单位积极融入到创卫工作中。三是督查到位，全面覆盖。把创卫工作列入各级政府和部门年度目标责任考核，成立6个创卫巡查组，建立包保责任制覆盖全市各个街道。四是宣传到位，联点共建。在全市广泛进行创卫工作宣传，加强各类新媒体宣传力度，设立百姓问政、直播宣城、曝光台等专栏，形成强有力媒体宣传态势。通过网格化管理、上门入户宣传和对接，开展丰富的宣传活动，提高老百姓的支持率和参与率，为省级创卫顺利通过奠定了基础。。金飞燕副区长指出，通过这次考察学习，感受到了宣城市创卫工作所带来的成效，首先是创卫思想强烈，从上到下各级各部门所展现出来的创卫工作的积极性和协调性。其次在于市、区对创卫工作管理的规范化、工作要求的严格性；三是创卫工作群众基础坚实，部门主动作为，创卫工作特色鲜明，可圈可点。各部门要认真消化考察结果，理清思路，形成共识，用宣城市的创卫经验指导创卫行动，扎实推进全区创卫工作。（屈晓茜）,为进一步提高巢湖市城市社区服务与管理水平，更好地服务城市居民，2月28日至3月3日，市委常委、政法委书记葛世新带领市民政局、组织部、编办、城区街道负责人一行赴上海、杭州考察，学习借鉴外地社区建设先进经验，拓宽社区建设新思路，提升社区建设水平，促进城市社区建设创新发展。。在为期4天的考察里，考察组一行赴上海普陀区、黄埔区、虹口区以及杭州下城区，就城市社区建设工作等情况进行了考察，实地参观了普陀区万里街道的社区综合为老服务中心、社区事务受理服务中心、城市网格化综合管理中心、香泉路社区居民委员会、爱照护长着照护之家，黄浦区南京东路街道办事处、新上海人老娘舅工作室，虹口区嘉兴路街道新港居民委员会，杭州下城区文晖街道打铁关社区居委会、现代城社区服务中心，并就街道、城市社区建设及管理、居委会改革、社区社会组织培育等工作进行了座谈。（高启云）,政府领导到其他城市考察学习或访问,0.9104472599963036,True
93,安徽省,合肥市,贵州省遵义市新蒲新区来我区学习考察,2017-11-16,https://www.hfss.gov.cn/public/14271/72095581.html,此次新蒲新区考察组一行主要考察学习了蜀山区编制外人员管理的经验做法，包括编外人员岗位设置、工资薪酬及晋升、绩效考核、人员招用以及人才管理工作。。李兵指出，蜀山区人事制度改革之所以能够成功，主要有三点经验，一是领导高度重视；二是部门间通力合作；三是充分调研和广泛征求意见。最后，还针对新蒲新区考察组对人事制度改革系列文件提出的相关问题，一一进行了解答。。近年来，蜀山区创新人事制度管理模式，激发人才队伍活力，于2017年1月正式出台并实施了《蜀山区机关事业单位人事管理办法》等“1+4”系列配套文件，。从岗位设置、编制外人员管理、编制外人员薪酬待遇、引进紧缺专业人才四个方面配套推行改革举措，对全区机关事业单位人员依责设岗、以岗定人，严把编制外人员入口关，统一编制外人员薪酬待遇。。由于改革力度大、举措新、效果实，该项改革经验受到新华社等中央主流媒体关注，并在内参上作了报道，受到省委常委、市委书记宋国权的批示肯定。也吸引了来自。新蒲新区考察组一行对蜀山区人社工作给予了高度评价，认为区人社局人事制度改革工作思路新、措施实、亮点多。希望今后能够继续加强与蜀山区的沟通联系，相互借鉴先进经验和做法，促进优势互补、携手并进、共同发展。,带着对长三角发达城市经济社会发展成就的仰慕、对先进地区商务工作经验学习借鉴的渴望，4月10日—13日，由市商务局党组成员、纪检组长杨修利带队，局审批处、法规处以及肥东、庐江、蜀山、瑶海商务局分管领导一行9人，赶赴杭州、宁波市外经贸局、贸易局考察学习。。杭、甬两市无论是外贸进出口，还是国内商贸，对当地经济社会发展都有着举足轻重的作用，他们始终把发展放在第一位，坚持在扩大总量中提高发展质量，地方党委和政府对内外贸工作也予以高度重视和大力支持。。两市内外贸主管部门，注重抓大放小，行政权力能放则放，工作层面能广则广，利用全社会资源和力量，寓宏观管理于协调服务之中，共同发展商务经济。遇到发展中出现新情况、新问题时，他们不等不靠，敢为人先，朝着科学发展的大方向，走出解决困难的新路子。。两市对发展过程中的不足和薄弱环节，早预见，早调整。在近些年产业发展中，重点鼓励和支持高新技术、节能环保、商贸金融、现代服务等新兴产业，在发展国际服务外包业务短短的几年里，2011年杭州就实现了离岸外包业务23亿美元。早调整，抢先机使他们在全球经济发展复杂困难的形势下，保持着科学发展，可持续发展的态势。。两市坚持实事求是、科学发展的指导思想，对一些没有明确法规或实施细则的问题，敢于突破，善于变通，坚持原则范围内的灵活性，在行政审批、促进政策、调控市场副食品的余缺、市场改造、工作激励、酒类流通监管、公车改革等方面，都有一些改革的举措，并收到明显的成效。,其他,0.6096617880786275,True
93,安徽省,合肥市,市招商局率队赴沈阳等地考察学习,2013-06-04,http://tzcjj.hefei.gov.cn/public/8241/42087191.html,时期以装备制造业为主的老工业基地。改革开放特别是实施振兴东北战略以来，沈阳市装备制造业获得长足发展，现代服务业、高新技术产业、现代农业迅速崛起。城市综合竞争力连续多年进入全国百强城市前十名。。亿元，分别列全国省会城市第六位。引进了美国通用、德国宝马、法国米其林、日本山之内等世界。的美誉。随着轻工业的发展延伸，目前形成以交通运输设备制造、农副产品加工、能源、金属矿开采及冶炼、纺织服装、机械设备制造等六大主导产业。。年的历史，也是全国城市综合实力百强市、中国优秀旅游城市。该市是全国重要的化工化纤原料生产基地，拥有集。于一体的中石油辽阳石化分公司，世界第三、亚洲第一的工业铝型材研发制造企业辽宁忠旺集团，世界第五、亚洲最大的天然脂肪醇生产加工企业辽宁华兴集团，芳烃基地晋升为。上述三个城市，作为东北亚经济圈的重要城市，能够紧紧抓住国家深入实施振兴东北老工业基地战略以及沈阳经济区上升为国家战略的难得机遇，充分发挥比较优势，不断创新举措，大力推进区域经济发展，其在招商引资中一些成功经验值得我们学习与借鉴。。年提出产业集群招商，依托产业规划、现有工业基础、资源和人才等优势，进行产业规划设计，以产业规划引导产业集群发展。瞄准国际企业的高端技术，侧重引入海外研发团队，打造主题概念，以引进先进技术推进传统产业升级改造。通过五年的努力，沈阳市合理配置了空间资源，进一步丰富创新了。五大发展空间、南北金廊、东西银带建设内涵，形成了以发展先进装备制造业为主的沈西工业走廊、东部汽车产业聚集区和航空高技术产业基地；以发展农产品精深加工为主的沈北新区；以发展旅游观光和文化创意产业为主的棋盘山国际风景旅游区；以发展现代服务业为主的都市中央走廊（南北金廊）。各区县立足自身优势，大力发展特色性主导产业。如法库县利用丰富的陶土资源发展陶瓷产业，产值已达。个超百亿元。产业集群的发展，推进了地方区域经济壮大发展。据介绍，去年仅华晨宝马汽车一个项目就实现地税收入。责任落实，形成各级主要领导亲自抓招商策划、推进、建设的工作机制。市长每年年初五就去温州招商，连续跑了。个主要经济部门都建立了招商分局，市直单位招商任务与单位目标考核相挂钩；县区招商任务与财政收入挂钩，一季一考核、半年一兑现、年终算总帐。二是灵活的用人机制。沈阳市实行招商雇员制，聘用招商局长，业绩突出者，年薪可达。万元。沈阳市沈北新区主要是食品、农产品深加工，按重点产业和重点区域设立招商分局，最多时达。个招商分局。目前，沈北模式已在该市全面推广。三是鲜活的考核机制。沈阳市以各县区、开发区为引进责任主体，驻外办事处为协办责任单位，明确招商责任主体，细化任务分解，签订目标责任状。市中小企业局负责内资项目协调调度，每月在《沈阳日报》等媒体上通报各县区引进内资情况，并开设《招商工作动态》专版，为领导和县区决策提出参考。丹东市采取年中由市招商局抽查、年终从县区抽调人员组织考核组共同互查的办法，增加考核公正性。。。沈阳市启动大浑南新区战略，丹东市着力发展政务新区建设，辽阳市大手笔建设河东新城区。三市手法不同，思路相似，都是在合理配置空间资源、优化招商载体上布局谋篇、开拓创新。以辽阳市为例，。。为把辽阳建设成开放大市，辽阳市委、市政府以先进的理念、高水平的规划，着力打造河东新城，吸引了恒大绿洲、意航世纪城、泛华泛美华庭、红星美凯龙、中南中央广场、祥祺太子河左岸高尔夫新城、保利保莱城市综合体等一大批项目纷纷落户，一座全新的滨水型城市跨河而立，展现在世人眼前，成为该市对外开放的最重要的载体和最闪亮的,9月24日诚信公司一行10人赴合肥滨湖投资控股集团有限公司考察学习，由公司主要领导带队，各部门业务骨干随行。此次考察的内容以商业管理、物业管理、文旅产业及乡村振兴项目等方面汲取优秀经验为契机，积极寻找与滨湖投资公司的合作模式，共同搭建发展平台。。整个考察活动分两个阶段。第一阶段诚信公司与滨湖投资公司就商业管理、文旅产业发展等方面交流经验。合肥滨湖投资控股集团有限公司党委副书记、总经理李锐锋深入分享了滨湖投资公司的发展历史，从特色街区打造、老城改造、乡村振兴三个维度向我们展示了集商业管理、物业管理、乡村振兴于一体的发展模式，点面结合，开拓了我们的发展思路。。第二阶段为项目实地调研。重点调研由滨湖投资公司打造的罍街、贡街等特色街区，集文化场馆、医院、商业、办公等于一体的望湖城综合楼项目，集物业管理、绿化管养、环卫保洁、市政设施养护等于一体的大型公众类综合管养项目圩美·磨滩。。此次学习考察活动从理论到实践，进一步拓展了我们的视野，开阔了思路，为集团公司组建，国资监管、运营管理及发展模式提供了有益借鉴。诚信公司领导强调，要进一步消化吸收、深入谋划，切实用好滨湖投资公司在市场化运作中的成功经验，不断对标对表，查找自身不足。下一步要提升自身站位，切实整合资源，将就文旅项目及物业管理等方面与滨湖投资公司谋求深层次多方位的合作。,其他,0.6435443582138614,True
