code,province,city,topic,date,url,content,content.1,label,score,is_match
93,安徽省,合肥市,市党政代表团赴桐城市学习考察,2012-07-11,http://drc.hefei.gov.cn/zxdt/zhxx/13013681.html,为深入贯彻落实省委省政府决策部署，进一步推进我市与桐城市合作发展、加快合肥经济圈建设，7月9日，省委常委、市委书记吴存荣率合肥市党政代表团，专程赴桐城市学习考察。其间，举行了合肥-桐城合作发展工作座谈会，并签署《合肥市-桐城市合作发展备忘录》。。桐城是合肥经济圈城市之一，近年来迈上了科学发展的快车道，工业立市一直是其经济发展的主旋律，活跃的民营经济是其显著特色。顶着骄阳，吴存荣一行先后来到安徽盛运机械股份有限公司、安徽白兔湖动力有限公司、金田集团（桐城）塑业有限公司、安徽鸿润（集团）股份有限公司，深入车间察看生产流程，具体了解生产经营等相关情况，勉励企业负责人加强与合肥各类企业的交流合作，不断做大做强做优。。桐城是桐城派故里、黄梅戏之乡，享有“文都”盛誉。近年来发展中一个突出亮点是文化旅游业的快速发展。孔城老街国际旅游度假区、桐城文庙、六尺巷等都是其中的杰出代表。吴存荣一行来到这里，对桐城大力实施文化项目带动战略，扎实推进文化产业、文化事业协调发展交口称赞。。座谈会上，吴存荣、朱读稳分别讲话，王强主持，吴三九汇报了桐城经济社会发展情况，合肥、桐城两市发改委负责人分别汇报了合作发展情况。。吴存荣说，这次来桐城学习考察，其深厚的文化底蕴、强劲的发展态势、高水平的城市建设与管理等，都给我们留下了深刻的印象，并为之感到由衷的高兴。目前，合肥经济圈合作发展态势良好，规划体系日益完善，整体实力大幅提升，地位和作用日益凸显。作为经济圈城市，合肥和桐城一直保持着“好邻居、好兄弟、好伙伴”的关系。特别是近两年来，在双方共同努力下，合作交流更加主动、务实、深入，经济接轨明显加快，社会关联度越来越高，合作成果显著，正在迎来一体化、同城化的美好前景。。吴存荣指出，当前和今后一个时期，要认真贯彻落实省委省政府的决策部署，深入推进合肥经济圈建设；要以这次两市签署的备忘录为总揽，抓紧抓好最现实、最迫切、最容易办成的事项，使合作发展在短时间内取得实实在在的成果。特别是，要积极推进产业发展联动、交通基础设施对接、旅游文化教育合作、联合招商引资平台搭建、干部人才交流、要素市场一体化建设等方面工作。。吴存荣强调，合肥与安庆同属皖江城市带承接产业转移示范区，桐城作为安庆经济发展的排头兵，也是合肥经济圈的重要一员。合肥的建设与发展，离不开包括桐城在内的经济圈城市和省内其他兄弟城市的支持与合作；作为省会城市，合肥理应进一步增强辐射带动力，不断推进合肥经济圈建设，努力为建设美好安徽多作贡献，为全省人民提供更多更好的服务。当前，合肥正在围绕落实省市党代会部署和“十二五”规划，着力发挥行政区划调整的后续效应，以“城湖共生”的理念，致力打造大湖名城、创新高地。希望合肥、桐城两市，在已有的良好基础之上，进一步强化互利合作、携手发展的意识，合力拓展更加广阔的合作空间，共同创造更加美好的未来，让两市人民共享一体化、同城化带来的便捷与实惠，充分发挥圈带聚合效应，不辜负省委省政府的重托。。王强说，桐城市将认真贯彻落实此次会议精神，进一步与合肥健全完善交流合作机制、推进发展规划对接、加速文化旅游合作进程、强化合作共建，不断推动合肥经济圈大发展、快发展。,10月23日—27日，市发改委主任王厚亮率市发改委、市招商局有关处室负责人赴福建省泉州、福州等地学习考察，了解当地产业发展情况，深入走访当地企业，诚邀企业家来安徽投资发展。。王厚亮一行在泉州先后走访了中国利郎有限公司、福建格林集团、鸿星尔克集团、福建东能光电科技有限公司等企业，与企业主要负责人座谈交流。座谈中，企业家表示由于劳动力缺失，用工成本快速上升，当地服装、鞋帽等劳动力密集型企业迫切需要向劳动力丰富的内地转移，部分企业已经在安徽省宿州等地投资建厂。安徽合肥良好的区位优势、丰富的人力资源以及一系列优惠政策对企业有非常强的吸引力，企业家均表示将适时来肥考察，全面了解合肥的投资环境，商洽投资合作事宜。。此外，王厚亮一行还考察了福建平潭综合实验区，参观了实验区的整体规划，了解其下一步发展思路。双方表示，希望加强交流合作，促进两地共同发展。平潭综合实验区的发展定位为探索两岸交流合作先行先试的示范区和海峡西岸经济区科学发展的先行区，将积极构建具有较强竞争力的产业支撑体系，积极承接台湾产业转移。,政府领导到其他城市考察学习或访问,0.8505456477037167,True
93,安徽省,合肥市,遂宁市客人来我县学习考察,2010-09-13,https://www.ahfeixi.gov.cn/zwdt/zwyw/43569375.html,9月10日下午，四川遂宁市市委常委、宣传部长何大海、副市长胡家正率代表团，在市委宣传部常务副部长胡守祝、市旅游局局长桑林兵等陪同下到三河镇考察调研。县委常委、宣传部长姚则邦向何大海一行介绍了我县县情。遂宁客人对我县城乡建设、旅游开发及经济社会发展取得的成绩给予高度评。,月23日，河北省人力资源和社会保障厅就业服务局王仲群副局长，带领石家庄市劳动保障局相关部门负责人一行9人，来我市考察学习创业服务工作，实地考察了庐阳区百帮创业服务大厅、百帮创业园。市劳动保障局就我市创业孵化园区建立运作、创业服务机构建设、创业服务专家志愿团、创业促就业等情况进行了介绍。王副局长一行对我市创业服务工作给予了高度评价。,政府领导到其他城市考察学习或访问,0.0,True
93,安徽省,合肥市,蚌埠市学习考察团莅临我县,2009-04-17,https://www.ahfeixi.gov.cn/zwdt/zwyw/43580885.html,4月16日，蚌埠市学习考察团一行在副市长杨利民的带领下来我县参观考察。县领导陈晓波、李海鹰、夏伦平、罗平、黄卫东，县长助理鲍亚宁，相关县直单位的负责同志等陪同。 座谈会上，县委书记陈晓波对杨利明一行的到来表示欢迎，并简要介绍了我县近年来的经济社会发展情况。县长李海鹰就我县工业、农业、旅游等方面的工作作了进一步的说明。杨利明表示，此行主要是结合正在开展的科学发展观学习实践活动，来肥西交流取经，肥西近年来在经济社会发展中取得了长足的进步，有很多做法值得学习和借鉴。县委常委、常务副县长夏伦平主持座谈会。 杨利明一行还实地考察了江汽集团商务车生产基地、桃花工业园拓展区、格力空调生产基地。 （汪莉丽）,为了把“解放思想、改革创新，促进合肥体育跨越式发展”大讨论活动引向深入，元月4日，市体育局党组成员、副局长王淮生、江运率县区体育行政部门负责人、局属单位负责人、局机关各处室负责人20多人赴湖南省会长沙市学习考察。 在中部省会城市中，长沙市的群众体育、竞技体育、体育产业、体育管理、体育场地设施建设等体育工作的各个方面都取得了巨大的进步。合肥市体育局此次组团赴长沙，就是要全面学习先进经验，借鉴成功做法，查摆自身工作的差距和不足，通过大讨论活动，进一步解放思想，理清思路，明确目标，改革创新，奋力拼搏，促进合肥体育事业取得新成绩，实现新跨越。,其他,0.5045351483420255,True
93,安徽省,合肥市,我省党政代表团启程赴浙江学习考察,2005-11-23,http://swj.hefei.gov.cn/swdt/gndt/12375851.html,由安徽省委书记、省人大常委会主任郭金龙，省委副书记、省长王金山率领的我省党政代表团今天启程赴浙江，开展为期4天的学习考察活动。。这次学习考察活动是我省大力实施东向战略，进一步加强皖浙两省全面合作，推进我省经济社会发展的一项重要举措。改革开放以 来，浙江人民解放思想，创新观念，锐意进取，顽强拼搏，实现了经济繁荣发展和社会全面进步，创造了具有浙江特色的“浙江奇迹”和“浙江经验”。皖浙优势互补，相得益彰，自2002年两省在合肥开展大型经济技术合作活动以后，双方全方位、多领域的合作格局初步形成。此次学习考察，目的就是学习借鉴浙江经济社会发展方面的经验，特别是发展民营经济、推动全民创业的经验，把我省与浙江省之间的经济技术合作引向深入。。据悉，在浙江学习考察期间，我省党政代表团将与浙江方面举行皖浙经济社会发展情况座谈会及两省党政高层会谈。同时，深入有关市的厂矿企业、科技中心，实地考察浙江近年来经济社会发展情况。。省党政代表团成员有省几套班子的有关领导，17个市的市委书记或市长，省直有关部门负责同志。,近日，副市长张明权率队赴岭南股份公司华东区域总部考察学习，市大建办、市住建局、市重点局、市旅游局、市林业局、市规划局负责人陪同参观考察。。考察组先后参观了长丰县“511”景观提升PPP项目、肥东和睦湖、合肥万达旅游城等项目，并在岭南股份公司华东区域总部观看了PPT，听取了公司负责人就岭南公司成产运营情况的汇报，并就生态景观、水务水环境、文化创意、投资与运营等相关议题进行了充分的交流。。考察组一致认为此次考察进一步拓宽了巢湖城市生态景观，文化创意旅游等方面建设思路，借鉴学习先进的城市生态环境与园林景观建设的管理模式和经验。通过此次考察学习，感触颇深，启发很大，收获很多，为下一步提升我市园林城市品质，打下了很好的基础。（朱映波）,政府领导到其他城市考察学习或访问,0.0,True
93,安徽省,合肥市,张明权率队赴岭南公司华东区域总部考察学习,2018-06-22,https://www.chaohu.gov.cn/tszf/jrch/9578165.html,近日，副市长张明权率队赴岭南股份公司华东区域总部考察学习，市大建办、市住建局、市重点局、市旅游局、市林业局、市规划局负责人陪同参观考察。。考察组先后参观了长丰县“511”景观提升PPP项目、肥东和睦湖、合肥万达旅游城等项目，并在岭南股份公司华东区域总部观看了PPT，听取了公司负责人就岭南公司成产运营情况的汇报，并就生态景观、水务水环境、文化创意、投资与运营等相关议题进行了充分的交流。。考察组一致认为此次考察进一步拓宽了巢湖城市生态景观，文化创意旅游等方面建设思路，借鉴学习先进的城市生态环境与园林景观建设的管理模式和经验。通过此次考察学习，感触颇深，启发很大，收获很多，为下一步提升我市园林城市品质，打下了很好的基础。（朱映波）,4月27日，市商务局主要负责人带队赴绩溪县考察学习电子商务工作，市商务局分管负责人、市电商办负责人、电子商务进农村综合示范项目承办企业负责人、市电子商务协会负责人参加考察。。考察组一行先后实地考察了绩溪县综合服务配送中心、“上街去”大众创业万众创新基地，听取运营企业关于物流配送模式、物流整合等方面先进经验和“双创”基地建设理念、运营模式、辐射成效等方面的介绍。与绩溪县商务局、安徽“上街去”网络科技股份有限公司，围绕促进县域电商发展，品牌培育、电商精准扶贫、电子商务进农村全覆盖等方面工作进行了深入交流与探讨。。下一步工作中，巢湖市商务局将奋力前行，全力推进电子商务进农村全覆盖工；全面拓展思路，完善电商产业园、“创客巢”等创业基地建设；更加务实重干，完善电子商务公共服务中心和平台功能，突出农特产品上行，叫响巢湖品牌，打造县域经济新蓝海。（王雪花）,其他,0.5463499207189936,True
93,安徽省,合肥市,无为县来我市学习考察校车运营管理工作,2018-07-12,https://www.chaohu.gov.cn/tszf/jrch/9578305.html,7月11日上午，无为县副县长刘萍率县教育、财政等部门来我市学习考察校车运营管理工作，副市长李雪及市教体局、市财政局、市经纬城乡客运公司相关负责人陪同考察。。座谈会上，巢湖市教体局向考察组一行详细介绍了我市实施校车工程的背景、校车运营的具体模式和日常管理情况等，同时就实施校车工程以来对均衡农村教育资源、改善农村学生上学等方面带来的良好社会影响进行了阐述。。与会双方还就校车的接送运行路线、经费保障方式、日常管理制度及今后的努力方向等方面细节进行了深入的交流和探讨。。在听取了我市的经验介绍后，刘萍表示，巢湖市校车运营管理科学规范，无为县将认真学习借鉴我市校车运营管理的好经验、好做法，真正探索一条符合地方实际的校车发展之路。（解文锦）,近日，六安市人大常委会副主任李建民一行在合肥市人大副主任宋家伟及相关工作人员陪同下，来到位于我县撮镇镇的合肥普洛斯物流园参观考察，学习现代服务业的先进经验和做法。考察团一行先是参观了整体园区建设，了解了入园的企业，随后在园区进行简短的座谈，交流了普洛斯物流园的建设规模、配套设施、管理模式及运营经验等情况。考察团对我县现代服务业的发展给予充分肯定，认为普洛斯物流园区许多经验值得六安市学习和借鉴。,政府领导到其他城市考察学习或访问,0.0,True
93,安徽省,合肥市,巢湖市赴无为县考察学习公墓建设工作,2017-05-18,https://www.chaohu.gov.cn/tszf/jrch/9575911.html,为学习先进经验，推动我市公益性公墓建设步伐，进一步提升殡葬服务能力，5月17日上午，副市长、公安局局长李加权率领相关部门负责人一行17人，赴无为县考察学习公墓建设工作。。考察组一行实地查看了太平山陵园，听取了无为县民政局负责人关于公墓规划设计、资金筹措、墓区建设、公墓管理等方面的经验介绍。。通过考察学习，我市将在借鉴兄弟县区好的经验和做法的基础上，进一步加强宣传引导，从转变丧葬观念入手，使广大群众充分认识到绿色殡葬、文明祭奠对保护土地资源、造福子孙后代的重要性，达到绿色殡葬、生态殡葬、文明殡葬、惠民殡葬的目的。从而加快我市公益性公墓建设步伐，切实将这项惠民工程实施好、落实好。（胡健楠）,2012年3月9日，县教育局副局长莫申根带领职成科高家达科长、周义银同志和县职成中心、沙溪职中、育才职中相关负责同志一行6人，赴长丰县考察学习。重点考察学习该县社区教育、农村成人文化技术培训等工作情况。长丰县教育体育局杨祥枝副局长、职成科卢健等同志陪同考察。。在长丰县职成教中心，该校校长介绍了学校的办学历史及开展农民文化技术培训等情况；在岗集镇成人文化技校，考察组在听取该校负责同志关于成人文化技校的组织机构、开展科技培训、科技推广和为民服务等情况后，认真翻阅了该镇的培训图片及资料，实地考察了该镇养殖示范基地；在杨庙镇成人文化技校，考察组参观了该校的办学设施等；在陶湖成人文化技校，下塘镇副镇长张明同志介绍了镇党委、政府加大投入，支持、指导技校开展科技培训的基本情况，重点介绍了该镇“公司+农户+基地”带动地方经济发展模式的做法。。考察中，莫申根强调，一要认真学习总结先进经验，向局党委汇报；二要争取县委县政府的政策支持，尽快建立相应的组织机构；三要切实开展社区及成人文化技术培训，为我县经济社会发展做贡献。莫申根还对长丰县教育体育局的热情接待表示了由衷的感谢。,其他,0.5240935148658705,True
93,安徽省,合肥市,王民生副市长率队考察颍上县园林绿化工作,2017-07-17,http://lyj.hefei.gov.cn/xwzx/lyyw/16820641.html,7月15日，市政府副市长王民生率队专题考察学习颍上县城区园林绿化规划建设管理工作，市政府副秘书长徐昌及办公厅有关负责同志；市林园局局长张世军及局系统有关人员；四城区、三大开发区、滨湖新区（含功能区）分管负责人及园林绿化管理部门主要负责人等约40人参加考察学习。。考察团一行深入颍右堤改造工程、外城河改造工程、保丰河景观治理工程、五里河生态湿地公园、花园小镇等项目现场，认真听取颍上县有关负责同志的情况介绍，遇到问题详细发问并细致交流。现场考察完成后，考察团紧接着在颍上县召开座谈会，大家热烈畅谈学习体会，并就各自关心的问题与颍上县的有关同志进行了进一步的深入交流。 考察途中，王民生对颍上县园林绿化工作取得的成绩表示赞赏并多次使用“令人震撼”等词语，他指出，颍上县深入践行“五大发展”理念，特别是“绿色发展”方面闯出了一条“颍上之路”，堪称典型。王民生指出，颍上县坚持高起点规划，始终将园林绿化作为构筑县城特色风貌的最有力抓手，“一张蓝图绘到底”、“一任接着一任干”，坚持水绿共融，着力彰显和绘就了滨水园林县城的美丽画卷，值得大家认真消化学习。,近日，合肥市审计局党组书记、局长昂朝晖带队赴蚌埠、宿州开展工作调研。期间，在蚌埠市审计局开展了座谈交流，实地考察了宿州高标准农田建设项目。机关党委专职副书记、企业审计处处长、办公室主任参加考察调研。。调研组一行首先来到蚌埠市审计局进行学习考察，并参加座谈交流。蚌埠市审计局党组书记、局长毛大忠主持座谈会，对昂朝晖局长一行表示欢迎，并详细介绍了蚌埠市情、市审计局基本情况以及审计工作突出亮点。有关科室负责人作了专题发言。双方就经济责任审计、自然资源资产审计、企业审计、投资审计、机关党建、审计项目管理、审计信息宣传等工作进行了深入交流和探讨。。昂朝晖表示，蚌埠市审计局大胆创新、积极作为，干事创业有氛围、主责主业有深度，先进做法和经验值得合肥审计系统认真学习、积极采纳。一是互学互鉴，取长补短。以此次交流为契机，促进两地审计工作进一步互学互鉴、取长补短、拓宽工作思路，继续聚焦主责主业，践行研究型审计理念，共同为安徽审计事业“打头阵”、“做标兵”。二是持续交流，加强协作。合肥、蚌埠两地山水相连，人文相亲，要充分发挥地域毗邻优势，构建协作共进的发展格局，形成跨区域审计监督合力，深化经济监督职能，实现双赢双促。三是提升站位，服务大局。随着长三角一体化纵深推进，以本次学习考察为契机，营造持续交流协作的良好氛围，强化信息互联互通，成果共享共用，不断提升审计监督服务效能，共同为经济社会高质量发展贡献审计力量。。高标准农田建设是落实粮食安全战略的重要抓手。昂朝晖一行来到宿州萧县考察学习高标准农田审计工作。昂朝晖表示，对高标准农田进行全面审计，是国家为农业事业设置的大舞台，是让“粮田”变成“良田”的重要举措，审计干部要始终牢记“国之大者”，围绕藏粮于地、藏粮于技任务落实，用履职尽责弘扬审计精神，助力耕地高效利用，保障粮食安全，促进农民增收。,政府领导到其他城市考察学习或访问,0.0,True
93,安徽省,合肥市,活动中心迎来桐城市考察团参观学习,2018-05-21,https://www.ahhfly.gov.cn/public/17551/95551411.html,日前，桐城市委常委、纪委书记严卫江，桐城市副市长张文芳，桐城市纪委副书记张文胜，桐城市教育局局长张星生，桐城市孔城镇党委书记高光柏，桐城市教育局副局长胡长胜，桐城市青少年校外活动中心主任张冬冬一行，前往合肥市庐阳区青少年校外活动中心，考察学习校外活动中心的建设和运行管理方面的先进经验和做法。活动中心领导班子热情接待了来访的客人。。考察团走进活动中心校园，参观了小剧场、真人CS等环境设施，来到古法造纸、动漫创意造型、3D创客等功能室，详细询问了课程研发、采购招标，活动开展等情况，了解到3D创客和模拟飞行等多个功能室的设备投入数百万而且全部政府支持，赞叹值得学习！考察团还认真仔细的翻阅了活动中心开展一日校外综合实践活动、教师队伍建设、青少年思想道德建设、爱国主义主题教育、青少年法治教育、安全教育等相关资料。。严卫江感谢庐阳活动中心的无私分享和热情接待，对活动中心的环境氛围赞赏有加，认为很有特色，处处体现了校外教育特点；活动中心工作开展扎实，活动丰富，特别是对活动中心能纯公益全免费开展“一日校外综合实践活动”给予高度评价。他表示桐城市新建青少年校外活动中心，将学习参照庐阳校外模式开展青少年校外素质教育活动，希望今后进一步加强交流与合作，共同为校外教育事业的发展作出更大的贡献。,近日，扬州市邗江区政协主席陈佳宏、副主席徐晟及该区政务办、编办、建设局等部门负责人一行来包河区公共资源交易中心考察学习。。考察中，公共资源交易中心主任罗艳丽向考察组一行简要汇报了包河区公共资源交易中心的发展历程和重要举措。2012年6月，建章立制，政府招标采购工作步入法制化管理的轨道。2013年，成立了省内首家区级公共资源交易网；设立省内首个小额交易网上竞标服务窗口；首次在省内竞争性谈判项目评审中引入淘汰机制。2014年7月，建立了省内首个“政府采购网上商城”，全过程实施“痕迹化管理”，目前已升级到2.0版，实现了县区级共享的政府采购网上商城。2014年9月起，在全国率先实现政府招标采购信息全公开，内容涵盖项目信息发布到确定中标单位、合同签署，验收情况以及质疑、投诉、答复和处理内容等关键节点信息。2016年底，在全省率先实现了“线下无交易，线上全公开”的政府招标采购“阳光下操作”模式。近年来，在区委、区政府的高度重视下，在上级主管部门的大力支持下，包河区公共资源交易工作以创新为引领，在提速增效中实现新跨越，走出了一条“网上商城+网上竞价”的特色发展之路。。邗江区政协主席陈佳宏等一行认真听取有关情况介绍后，对包河区公共资源交易工作的发展历程和创新举措给予了充分肯定，考察组认为包河区许多先进理念和好的做法，为邗江区公共资源交易中心的成立和建设提供了许多宝贵经验。,政府领导到其他城市考察学习或访问,0.0,True
