code,province,city,topic,date,url,content,content.1,label,score,is_match
93,安徽省,合肥市,图李加权接待无为县副县长朱本芳一行来巢考察,2017-07-27,https://www.chaohu.gov.cn/tszf/jrch/9576633.html,7月26日上午，无为县副县长朱本芳一行来巢考察学习。副市长、公安局长李加权接待了朱本芳一行，市政府办、市环保局、市住建局、槐林镇、坝镇、中国水环境集团公司相关负责人参加接待。。朱本芳一行先后考察了坝镇污水处理厂、槐林镇污水处理厂，并举行座谈会。朱本芳介绍了无为县目前在污水处理方面的具体工作开展情况。。李加权具体介绍了坝镇污水处理厂、槐林镇污水处理厂的相关情况，他表示双方要互相学习，共同将此类公共民生事业做实做好。。与会的各地、各部门负责人分别就我市污水处理基础设施、发展运营情况和下一步发展、项目建设等方面情况进行了沟通交流。(周必锋),近日，肥东县纪委、县教体局组织部分学校主要负责人和具体工作人员，赴繁昌县学习考察廉政文化进校园创建工作。 考察组一行先后来到繁昌县田家炳中学、繁昌县职教中心两所省级示范点，受到了繁昌县纪委、教体局及受访学校领导的热情接待。考察活动包括倾听报告、座谈交流、实地参观、资料共享等，开阔了视野，拓宽了思路，为下一步创建省市廉政文化进校园示范点工作打下了坚实的基础。考察组一行还应邀参观了位于该县孙村镇中分村的新四军三支队司令部旧址，接受了一次爱国主义教育。,政府领导到其他城市考察学习或访问,0.0,True
93,安徽省,合肥市,我市社区治理体制改革有序推进,2017-07-20,https://mzj.hefei.gov.cn/public/14161/44002121.html,号），按照省委常委、市委书记宋国权在文件上的重要批示，我局迅速行动，认真学习消化，开展实地调研，分别赴上海、武汉、铜陵等地进行了专题考察学习，并主动与省厅对接汇报。在此基础上，初步提出了“建平台、强街道、活社区、补短板”的改革内容，先理顺、后调整的“两步走”改革路径和区直管社区的“大社区”模式的改革方向，形成了一整套改革思路，得到省、市有关领导的充分认可。,为进一步加强公园干部职工工作作风、加强组织纪律性、提升队伍战斗力，9月7日上午，逍遥津公园组织召开园区办公工作例会，并在会上传达了《关于重申外出参会学习考察及病事假有关规定的通知》以及“公园考勤与假期管理暂行规定”的相关内容，再次强化公园“考勤与请销假制度”和“外出报备制度”的具体落实情况。通过这次学习活动，进一步加深了广大干部职工对相关规定的理解和落实，从而保证园区各项工作有序顺利开展和推进，不断提升为民服务的水平和能力。（赵静）,其他,0.6855444621084327,True
93,安徽省,合肥市,安庆市考察团来我县考察招商引资工作,2014-09-27,https://www.ahfeixi.gov.cn/public/15281/75321111.html,月26日，安庆市副市长张君毅率该市各县、区招商局局长一行，来我县考察学习招商引资工作。听取了我县招商引资工作情况的介绍，考察团对我县近年来在招商引资方面所取得的成绩，给予了高度评价。认为，我县高度重视招商引资工作，不断创新招商模式和机制，制订了各项招商措施。尤其是坚持县领导招商等七项机制，使考察团备受启发。希望两地今后进一步加强沟通与交流，相互学习，促进双方共同发展。。在市政府、市招商局等相关负责人陪同下，考察团实地参观了华南城、TCL、安利等企业。,●7 月5 日，市科协副主席尹维堂一行来我县对“基层科普行动计划”资金使用情况进行检查。 ●日前，桃花工业园召开烟墩新区群众办理回迁房产权证问题协调会。县领导盛开、丁海鹰出席会议。 ●7 月3 日，县委常委、桃花工业园管委会主任丁海鹰一行赴宁国经济技术开发区考察学习国家级开发区申报经验。 ●7 月6 日，县委常委、宣传部长刘波率县委宣传部、文广新局到泾县查济考察画家村。 ●7 月5 日，县人大常委会副主任沈和勤前往柿树岗乡督查指导防汛准备工作。,政府领导到其他城市考察学习或访问,0.6233175945016024,True
93,安徽省,合肥市,巢湖市来我县考察重大项目,2014-03-21,https://www.ahfeixi.gov.cn/zwdt/zwyw/43391001.html,"3月20日，巢湖市委常委、副市长闫永华一行来我县考察重大项目。县委常委、常务副县长盛开陪同考察,并介绍了我县经济社会发展情况。 闫永华一行实地考察了华南城项目和TCL项目。他指出，肥西近几年的发展很快，各项事业均位于全省前列。此次来肥西学习考察感触很深，收获很大。虽然巢湖近几年来发展较快，但是与肥西相比还存在很大差距。感谢肥西在重大项目推进举措上提供了很多的宝贵经验。闫永华表示，回去后将结合巢湖自身的实际把肥西的好经验好做法运用到大项目上，使巢湖重大项目有所提升，同时希望肥西能与巢湖加强交流合作，促进双方又好又快发展。 （吴学谨）",●7月4日， 市委常委、 市委组织部长凌云看望了省委第五巡视组。 ●7月4日， 省妇联副主席孙传琴来我县调研妇女专项经费项目工作。市妇联主席江玲，县委常委、 组织部长刘波等陪同。 ●7月4日， 市政协副主席王世清、 许天锡率调研组来我县考察巢湖综合治理开发工作。县领导盛开、 卫先毓等陪同。 ●7月4日， 安徽农业大学教授张承祥一行来官亭调研新农村建设。 ●昨天， 四川省资阳市副市长何正月， 原市委常委、 副市长、 现市政府顾问陈能刚， 市政协副主席周齐铭率考察团来我县考察旅游业发展。县委常委、 副县长许文继等陪同。 ●昨天， 江西省瑞昌市市委办一行来我县考察学习工业立县及城市化进程。,政府领导到其他城市考察学习或访问,0.5251447585795271,True
93,安徽省,合肥市,巢湖市来我区考察夜市食品安全监管工作,2013-08-23,https://www.hfyaohai.gov.cn/zwdt/bdyw/9753867.html,8月22日，巢湖市政府副市长郑连胜一行来我区考察学习夜市食品安全监管工作，区委常务、副区长张晓峰及区有关单位主要负责同志参加座谈。会上，考察组听取了我区关于夜市食品安全监管工作的情况汇报，双方并就夜市食品卫生安全、城市环境管理等有关情况展开深入交流。会后，郑连胜实地考察了大通路夜市，区卫生局、明光路街道主要负责同志现场详细介绍了该夜市日常食品安全监管工作机制、安全形势及特色做法等。考察组一行充分肯定了我区对夜市食品安全监管工作的大胆探索，表示将吸收好、借鉴好我区的好经验、好做法。,按省、市商务部门工作部署，近期我局增加了多项工作任务：《关于印发合肥市现代服务业发展“十二五”规划的通知》、《加快发展家庭服务业促进就业的实施意见》，尤其《关于引发合肥市再生资源回收行业产业发展规划的通知》，均属我局牵头组织实施，包括构建社区回收、集散交易、综合利用网络体系安排就业等，提高社会和经济效益为目的。为此我局拟将着手抽调部分人员开展前期策划调研、外出考察学习等工作。现恳请增加二十万元经费支持为感。,其他,0.7510904519248885,True
93,安徽省,合肥市,巢湖市来区考察夜市监管工作,2013-08-23,https://www.hfyaohai.gov.cn/zwdt/bdyw/9753869.html,8月22日，巢湖市政府副市长郑连胜一行来我区考察学习夜市食品安全监管工作，区委常务、副区长张晓峰及区有关单位主要负责同志参加座谈。。会上，区直相关部门介绍了我区关于夜市食品安全监管工作的情况汇报，双方并就夜市食品卫生安全、城市环境管理等有关情况展开深入交流。会后，郑连胜实地考察了大通路夜市，区卫生局、明光路街道主要负责同志现场详细介绍了该夜市日常食品安全监管工作机制、安全形势及特色做法等。考察组一行充分肯定了我区对夜市食品安全监管工作的有益做法，表示将吸收好、借鉴好我区的好经验、好做法。,●9月5日，县委书记陈晓波率县党政代表团赴蜀山区考察学习。县领导孙明权、张志林、胡明文、吴娅娟、盛开、胡戈宁、卢磊及部分乡镇、园区负责同志参加考察。蜀山区委书记阮永兴、区人大副主任、党组书记骆克海、区政协主席包德中等区四大班子领导陪同。 ●县委县政府给县地税局发去贺信，祝贺该局提前4个月完成全年税收任务。 ●9月11日至17日是第14届全国推广普通话宣传周，我县将结合全县文明县城创建和语言文字工作实际，开展丰富多彩的宣传活动。,其他,0.6293765275067852,True
93,安徽省,合肥市,标题新闻,2012-07-06,https://www.ahfeixi.gov.cn/zwdt/zwyw/43553997.html,●7月4日， 市委常委、 市委组织部长凌云看望了省委第五巡视组。 ●7月4日， 省妇联副主席孙传琴来我县调研妇女专项经费项目工作。市妇联主席江玲，县委常委、 组织部长刘波等陪同。 ●7月4日， 市政协副主席王世清、 许天锡率调研组来我县考察巢湖综合治理开发工作。县领导盛开、 卫先毓等陪同。 ●7月4日， 安徽农业大学教授张承祥一行来官亭调研新农村建设。 ●昨天， 四川省资阳市副市长何正月， 原市委常委、 副市长、 现市政府顾问陈能刚， 市政协副主席周齐铭率考察团来我县考察旅游业发展。县委常委、 副县长许文继等陪同。 ●昨天， 江西省瑞昌市市委办一行来我县考察学习工业立县及城市化进程。,●昨日，合肥华峰暖通设备有限公司举办１０周年庆典暨乔迁仪式。市委副书记熊建辉、市委副秘书长刘锡成、市委办公厅副主任王德艺，县领导陈晓波、李海鹰、孙明权、张志林、吴松保、罗平、王永定、张书芳、汪厚云、颜德继等出席庆典。市委副书记熊建辉宣布仪式开始，县委书记陈晓波致词。 ●昨日，市人大副主任梁虹率市相关单位负责人，到三河镇开展立法调研，县领导夏伦平、孙贵早陪同。 ●昨日，阜阳市副市长胡明莹一行１７人到三河等地考察学习旅游工作。合肥市政府副秘书长项贤峻、市旅游局局长桑林兵、副县长吴光艳陪同。,政府领导到其他城市考察学习或访问,0.5196567999315518,True
93,安徽省,合肥市,标题新闻,2010-06-11,https://www.ahfeixi.gov.cn/zwdt/zwyw/43571859.html,●昨日，合肥华峰暖通设备有限公司举办１０周年庆典暨乔迁仪式。市委副书记熊建辉、市委副秘书长刘锡成、市委办公厅副主任王德艺，县领导陈晓波、李海鹰、孙明权、张志林、吴松保、罗平、王永定、张书芳、汪厚云、颜德继等出席庆典。市委副书记熊建辉宣布仪式开始，县委书记陈晓波致词。 ●昨日，市人大副主任梁虹率市相关单位负责人，到三河镇开展立法调研，县领导夏伦平、孙贵早陪同。 ●昨日，阜阳市副市长胡明莹一行１７人到三河等地考察学习旅游工作。合肥市政府副秘书长项贤峻、市旅游局局长桑林兵、副县长吴光艳陪同。,"关于做好“保持党的纯洁性，迎接党的十大”主题教育实践活动整改落实阶段工作的通知_合肥市自然资源和规划局。根据《合肥市国土资源系统集中开展“保持党的纯洁性，迎接党的十八大”主题教育实践活动实施方案》（以下简称“主题教育实践活动”）的安排，从9月份开始正式进入整改落实阶段。为认真做好整改落实阶段的各项工作，现就有关事项通知如下：。整改落实阶段是收官之战，是整个主题教育实践活动取得成果的集中展示。各党支部要针对分析检查阶段中对照“六查六看”和发放征求意见表等方式找出的问题和不足，研究制定出行之有效的整改措施。。各支部要对分析检查阶段所查找出来的在保持党的纯洁性方面存在的问题与差距，以及征求到的意见和建议，进行认真细致研究，明确整改重点，并提出切实可行的整改措施，进一步深化保持党的纯洁性教育。各支部整改意见要明确每一个问题的解决办法、解决时限和具体的责任人。。各支部要对整改意见在规定时间进行自查，查看整改措施是否落实并收到实效，形成“边学边改、边查边改、边整边改”的良性整改机制，保纯办公室督查小组要在规定时间对各党支部的自查情况进行复查，进一步深入贯彻落实整改阶段文件精神。。各支部党员领导干部要针对在保持党的纯洁性方面存在的问题与差距，结合思想实际，结合工作职责，结合整改内容，深入基层进行调查研究，听民情、察民意，形成一份保持党的纯洁性的思想总结；广大党员也要结合各自实际，形成一份有内容、有深度的保持党的纯洁性思想总结。。各党支部要着眼于长远，把落实整改措施和建章立制结合起来，切实把学习教育活动成果巩固下来，深入持久地发挥作用，真正形成保持党的纯洁性长效机制。重点要结合实际，组织精干力量，按照“保持党员干部思想纯洁、队伍纯洁、作风纯洁和清正廉洁”的要求，健全和完善党员“始终保持党的性质与宗旨，永葆共产党人政治本色”的有关制度，并切实做好贯彻实施。。对纯洁性学习教育活动进行全面总结，并对巩固和扩大整改成果做出具体安排部署。在各支部、党员之间进行评比，促进各支部、党员将在保持党的纯洁性活动中取得的成果长效化、日常化，对“保持党的纯洁性、迎接党的十八大”主题教育实践活动各阶段工作中表现突出、成效显著的集体和个人进行表彰。。各支部党员要深入学习局网站上党课材料，并在10月15号前对各支部书记党课进行评选，对评选出的优秀党课，要求各支部学习借鉴，在各支部间形成相互学习，不断完善、相互赶超的良好作风。邀请省、市委党校老师对各支部党员进行党性知识讲座，重温党的发展历程，听取党的先进事迹。组织开展党务干部培训班和党基层组织实施条例学习，党务干部培训要求各支部组织委员及以上的党员干部参加，认真学习党务知识,切实做到夯实基础，纯洁思想、落实行动。。组织全体党员或以各支部为单位开展考察学习活动，学习先进的经验和做法，把理论和实际相结合，在考察学习过程中对照自身实际情况不断完善，并在考察结束后形成考察报告。。各党支部要加强领导，周密部署，精心组织，不断巩固和扩大学习教育阶段和检查分析阶段的成果，扎实有序地开展好整改落实阶段各个环节的工作。要严格落实领导责任，主要负责同志要亲自抓，分管领导具体抓，班子成员合力抓。既要高标准完成“规定动作”，又要尽可能推出“自选动作”，努力丰富活动内容。。要把学习贯穿始终，在前期学习教育的基础上，继续组织广大党员干部精读原著，深入学习党的十七大、十七届五中、六中全会精神和胡锦涛同志最近一系列重要讲话精神，认真学习中央和省委应对当前经济形势、促进经济平稳较快发展的一系列决策部署。通过深化学习，进一步解放思想、转变观念，为深入查找问题、解决问题打下坚实的理论基础。",其他,0.9251663656291904,True
93,安徽省,合肥市,巢湖考察我县旅游镇建设,2007-10-24,https://www.ahfeixi.gov.cn/zwdt/zwyw/43588153.html,10月21日，巢湖市委副书记孙丽芳、副市长薛少云率领巢湖市党政代表团，在合肥市委副书记董昭礼、副市长杨增权和市旅游局以及县委、县政府主要领导陪同下，考察了我县旅游镇建设情况。 考察团一行先后考察了安徽省农家乐示范点三岗和古镇三河。在三河国际大酒店召开的“巢湖市考察组赴肥西学习考察旅游镇建设会议”上，县委书记卢仕仁向考察团一行介绍了肥西今年经济社会发展总体情况和打造“旅游肥西”、发展旅游经济的主要做法和体会。当晚，考察团成员还兴致勃勃地来到小南河两岸，参观三河今年着力打造的夜景。（汪杰）,为了学习园区基础设施建设高质量发展新路径，拓展大建设项目融资新举措，有效解决园区城市建设“钱袋子”问题，5月30日，区建发局会同东鑫集团及东鑫建发赴肥西产投，考察学习有关园区大建设、片区开发、项目融资等做法。。会上肥西产投介绍了集团重组和专业化整合基本情况，从“投、融、建、管、运”一体化发展模式为切入点，重点介绍了“产业投资”“建设开发”“融资管理”等三个方面成效。思路新、举措实、力度大、效果显。。下一步将学习成果和自身实际相结合，找准基础设施建设短板，重点学习借鉴相关做法。一是夯实主体主业，采取多种方式扩展融资渠道，持续推动专项债申报工作不动摇，重点争取市级投资支持项目不松劲，保障园区大建设项目资金落实，助力园区城市换新颜。二是谋划片区开发模式及路径，围绕园区“十四五”经济和社会发展目标，加强顶层规划，聚焦产业赛道，精心做好产业布局，打造功能完善的片区组团，谋划“打包代建”延展模式，项目“化零为整”，招大招强，奋力打造高标准、高效率、高品质的精品工程。,其他,0.6358920127326897,True
93,安徽省,合肥市,罗云峰主持召开市政府第次常务会议,2021-07-08,https://www.chaohu.gov.cn/ztzl/zt/srxxgcddsjjwzqhjs/11138979.html,7月7日上午，市长罗云峰主持召开市政府第93次常务会议，审议并原则通过《合肥市推动长三角G60科创走廊建设工作方案》《合肥市贯彻落实省党政代表团赴沪苏浙学习考察有关精神 奋力推进长三角更高质量一体化发展实施方案》。。会议指出，G60科创走廊是长三角一体化发展国家战略重要平台。要提高认识，高度重视，从自身向外找资源、找战略、找思路、找差距，攻坚克难谋发展。要突出特点，发挥特色，推动合肥加快融入长三角一体化发展。要形成合力，各司其职，确保各项优势资源为我所用。要确定目标，紧抓落实，以丰硕务实成果为长三角一体化发展作出新贡献。。会议强调，长三角区域一体化发展是习近平总书记亲自谋划、亲自部署、亲自推动的重大国家战略。要以更高站位认识长三角一体化的新阶段，拓展对标城市范围，丰富产业指标体系，充分发挥智库力量，扬长补短对标追赶。要以更大力度开创长三角一体化的新局面，坚持问题导向，对照先进找差距，做到心中有数，着力完善重要政策。要以更实举措谋划长三角一体化的新路径，明确“施工图”“任务书”和责任单位，全方位、全领域、全维度推动长三角地区更高质量一体化发展。,9月5日上午，由阜阳市颍东区市场监管局、财政局、教育局、民政局负责人组成的考察组一行5人，来瑶海区考察学习食品安全智慧化监管工作，区市场监管局党委委员、副局长黄率等陪同考察。。考察组一行首先来到瑶海区市场监管局机关进行了座谈讨论，座谈会上，黄率详细介绍了瑶海区食品安全智慧化监管工作情况，基层所代表介绍了智慧化监管APP应用情况，同时，与会人员就推进食品安全智慧化监管工作进行了深入的交流讨论。。随后，考察组实地查看了安徽省社家健康养老产业集团有限公司和合肥市铜陵新村幼儿园2家单位，实地观看了“明厨亮灶”智慧化监管系统操作演示。。通过听取相关情况介绍和实地参观后，考察组对瑶海区在推进食品安全智慧化监管工作方面的经验做法给予高度评价。瑶海区市场监管局也将以此次交流为契机，继续深入推进“互联网+食品”智慧监管，不断提升瑶海区食品安全保障水平，推动食品安全监管工作再上新台阶。,其他,0.5001685246761401,True
93,安徽省,合肥市,王斌率队赴海门生物医药科技创业园考察,2019-12-13,https://www.chaohu.gov.cn/tszf/ldhd/10876875.html,12月11日下午，市委常委、常务副市长王斌带队前往江苏省南通市海门生物医药科技创业园考察学习，创业园常务副总经理张汉超、蓝湾科创资本集团合伙人谭志虎接待了考察组一行，市投资促进中心、居巢经开区相关负责人等陪同考察。。王斌一行首先参观了海门生物医药科技创业园，听取产业园从推进医药研发转化到聚集企业和研发机构，并最终实现规模效益的医药创新体系的全过程。。座谈会上，张汉超着重介绍了创业园的“产业+平台+资本+运营”的发展模式，目标就是为入园的生物医药企业、研发机构、工程技术人员、导师和研究生提供专业的孵化平台和全面的政策、服务和环境支持；谭志虎介绍了蓝湾资本在创业园的产业投资方面一些成功案例，并强调招商和育商应并重，精准培育打造产业链。。王斌表示，巢湖市将与蓝湾资本保持无缝对接，充分黏合巢湖在医药等方面的优势资源和蓝湾的产业投资优势，共同打造具有巢湖特色的生物医药产业园。（吕雄）,合肥市医保局关于“合肥市规范性文件数据库”海报宣传开展的情况报告_合肥市医疗保障局。年大调研、“四送一服”、“四联四定”等需要，领取了“合肥市规范性文件数据库”纸质海报。份放在下属单位市医保中心宣传，剩余海报根据各调研组需求分发。目前，纸质海报各调研组已领取完毕，暂未开始调研；电子海报已推送至各调研小组。留存海报宣传情况如下：。公示栏处粘贴，无论是单位工作人员还是上访群众又或是咨询、办事人员等待电梯时可了解海报详情。。在单位宣传栏旁边粘贴，与单位内容一起宣传，省内外单位来我局考察学习以及其他单位来我局调研时可了解详情。,其他,0.7271987335651372,True
