code,province,city,topic,date,url,content,content.1,label,score,is_match
97,安徽省,马鞍山市,市民政局党委书记杨继鹏一行赴上海学习考察养老服务工作,2019-10-28,https://www.mas.gov.cn/zxzx/bmdt/10028306.html,为认真贯彻长三角一体化发展战略，学习借鉴长三角地区民政工作先进经验，加快我市养老服务体系建设，10月23日-24日，局党委书记杨继鹏、局调研员郭玮莲、局养老科负责人和县区民政部门负责人赴上海市长宁区、虹口区学习考察养老服务工作。。学习考察采取看点和座谈相结合的模式，先后实地考察长宁区智慧养老信息中心、仙霞新村街道养老服务点、安康通企业、虹口区市民驿站等养老服务机构，并与当地民政部门、养老机构负责人就养老服务体系建设开展了深入探讨和交流，仔细询问了解当地的有关政策和具体措施。。杨继鹏指出，这次到上海学习考察，是开阔工作视野、拓展工作思路的重要方式，同时也是长见识、找差距、明目标的一次难得机会，通过参观体验和学习交流，收获颇丰、受益匪浅。此次学习考察一定要把长三角地区好的经验带回去，消化好、吸收好、转化好，引领和带动我市民政养老事业持续加速发展。。牢记总书记殷殷嘱托扎实做好防汛救灾各项工作 加快打造安徽的“杭嘉湖”长三角的“白菜心”,为认真贯彻长三角一体化发展战略，学习借鉴长三角地区民政工作先进经验，加快我市养老服务体系建设，10月23日-24日，局党委书记杨继鹏、局调研员郭玮莲、局养老科负责人和县区民政部门负责人赴上海市长宁区、虹口区学习考察养老服务工作。。学习考察采取看点和座谈相结合的模式，先后实地考察长宁区智慧养老信息中心、仙霞新村街道养老服务点、安康通企业、虹口区市民驿站等养老服务机构，并与当地民政部门、养老机构负责人就养老服务体系建设开展了深入探讨和交流，仔细询问了解当地的有关政策和具体措施。。杨继鹏指出，这次到上海学习考察，是开阔工作视野、拓展工作思路的重要方式，同时也是长见识、找差距、明目标的一次难得机会，通过参观体验和学习交流，收获颇丰、受益匪浅。此次学习考察一定要把长三角地区好的经验带回去，消化好、吸收好、转化好，引领和带动我市民政养老事业持续加速发展。。牢记总书记殷殷嘱托扎实做好防汛救灾各项工作 加快打造安徽的“杭嘉湖”长三角的“白菜心”,政府领导到其他城市考察学习或访问,0.0,True
97,安徽省,马鞍山市,市生态环境局派员参加赴南通学习考察两法衔接工作,2019-10-28,https://www.mas.gov.cn/zxzx/bmdt/10028003.html,为加强行政执法和刑事司法衔接工作，完善行政执法机关与司法机关信息共享、案情通报、规范取证、案件移送等机制。10月23日，由市政府副秘书长张圣祥带队，市公安局副局长徐平、市司法局副局长张长来，市检察院、市人社局、市生态环境局等业务科室人员，赴南通市学习考察“两法衔接”工作。。考察组一行，先后深入南通市公安局食药环支队，参观了快检室，现场观摩了快检设备的运行演试，查阅了“两法衔接”相关档案资料。在南通市政府，与南通市公安局、检察院、生态环境等行政执法部门的有关领导和同志举行了座谈，就 “两法衔接” 工作的组织领导体制、案件移送标准和移送程序实施、部门联席会议及案件协作机制、专项行动、信息平台建设等情况等方面进行了广泛而深入的交流。。南通市开展“两法衔接”工作较早，通过学习考察他们的工作开展情况，突出表现在以下几个方面：一是领导重视，高位推动。时任市长韩立明专题批示推进“两法衔接”工作，对“两法衔接”工作进行部署、指导，紧抓工作落实。二是建立机构，人员到位。专门设立食药环支队，确定10名行政编制和4名技术岗位，加强“两法衔接”工作力量。三是配齐设备，保障到位。在食药环支队设立快检室，并配备相关设备，为“两法衔接”提供技术辅助支持。四是机制健全、形成合力。专门出台了《南通市环境保护部门与公安机关执法衔接工作办法（试行）》，在市级层面创新健全“两法衔接”机制。特别是公安机关提前介入、主动作为，明确“依靠不依赖”的工作定位，与生态环境行政执法部门在移送程序、取证环节等方面形成了运转高效、沟通顺畅的工作机制。。张圣祥代表考察组表示，做好“两法衔接”工作是全面深化执法改革的需要，是规范执法的迫切要求。马鞍山市将以此次学习考察为契机，将南通好的经验和启示带回去，努力增强“两法衔接”工作的针对性和实效性，切实解决“两法衔接”工作中存在的问题，推动“两法衔接”工作全面有序开展。。牢记总书记殷殷嘱托扎实做好防汛救灾各项工作 加快打造安徽的“杭嘉湖”长三角的“白菜心”,为加强行政执法和刑事司法衔接工作，完善行政执法机关与司法机关信息共享、案情通报、规范取证、案件移送等机制。10月23日，由市政府副秘书长张圣祥带队，市公安局副局长徐平、市司法局副局长张长来，市检察院、市人社局、市生态环境局等业务科室人员，赴南通市学习考察“两法衔接”工作。。考察组一行，先后深入南通市公安局食药环支队，参观了快检室，现场观摩了快检设备的运行演试，查阅了“两法衔接”相关档案资料。在南通市政府，与南通市公安局、检察院、生态环境等行政执法部门的有关领导和同志举行了座谈，就 “两法衔接” 工作的组织领导体制、案件移送标准和移送程序实施、部门联席会议及案件协作机制、专项行动、信息平台建设等情况等方面进行了广泛而深入的交流。。南通市开展“两法衔接”工作较早，通过学习考察他们的工作开展情况，突出表现在以下几个方面：一是领导重视，高位推动。时任市长韩立明专题批示推进“两法衔接”工作，对“两法衔接”工作进行部署、指导，紧抓工作落实。二是建立机构，人员到位。专门设立食药环支队，确定10名行政编制和4名技术岗位，加强“两法衔接”工作力量。三是配齐设备，保障到位。在食药环支队设立快检室，并配备相关设备，为“两法衔接”提供技术辅助支持。四是机制健全、形成合力。专门出台了《南通市环境保护部门与公安机关执法衔接工作办法（试行）》，在市级层面创新健全“两法衔接”机制。特别是公安机关提前介入、主动作为，明确“依靠不依赖”的工作定位，与生态环境行政执法部门在移送程序、取证环节等方面形成了运转高效、沟通顺畅的工作机制。。张圣祥代表考察组表示，做好“两法衔接”工作是全面深化执法改革的需要，是规范执法的迫切要求。马鞍山市将以此次学习考察为契机，将南通好的经验和启示带回去，努力增强“两法衔接”工作的针对性和实效性，切实解决“两法衔接”工作中存在的问题，推动“两法衔接”工作全面有序开展。。牢记总书记殷殷嘱托扎实做好防汛救灾各项工作 加快打造安徽的“杭嘉湖”长三角的“白菜心”,政府领导到其他城市考察学习或访问,0.0,True
97,安徽省,马鞍山市,市委副书记钱沙泉带队赴南京市江宁区考察学习,2019-07-12,https://www.mas.gov.cn/zxzx/zwyw/9847307.html,◇7月11日下午，市委副书记钱沙泉带队赴南京市江宁区考察学习，并与南京市委常委、江宁区委书记李世贵等进行了座谈交流，双方重点就慈湖高新区与江宁滨江开发区之间的交通互联互通、产业协同协作、环保联防联治进行了深入的对接。。牢记总书记殷殷嘱托扎实做好防汛救灾各项工作 加快打造安徽的“杭嘉湖”长三角的“白菜心”,◇7月11日下午，市委副书记钱沙泉带队赴南京市江宁区考察学习，并与南京市委常委、江宁区委书记李世贵等进行了座谈交流，双方重点就慈湖高新区与江宁滨江开发区之间的交通互联互通、产业协同协作、环保联防联治进行了深入的对接。。牢记总书记殷殷嘱托扎实做好防汛救灾各项工作 加快打造安徽的“杭嘉湖”长三角的“白菜心”,政府领导到其他城市考察学习或访问,0.0,True
97,安徽省,马鞍山市,习近平在湖北省考察新冠肺炎疫情防控工作,2020-03-11,https://www.mas.gov.cn/zxzx/xxzz/dzy/20601131.html,看望慰问奋战在一线的医务工作者解放军指战员社区工作者公安干警基层干部下沉干部志愿者和居民群众时强调。3月10日，中共中央总书记、国家主席、中央军委主席习近平专门赴湖北省武汉市考察新冠肺炎疫情防控工作。这是习近平在火神山医院指挥中心视频连线感染科病房，与病房内患者和医务人员亲切交流。新华社记者 鞠鹏 摄。新华社武汉3月10日电 在抗击新冠肺炎疫情的关键时刻，中共中央总书记、国家主席、中央军委主席习近平10日专门赴湖北省武汉市考察疫情防控工作。他强调，湖北和武汉是这次疫情防控斗争的重中之重和决胜之地。经过艰苦努力，湖北和武汉疫情防控形势发生积极向好变化，取得阶段性重要成果，但疫情防控任务依然艰巨繁重。越是在这个时候，越是要保持头脑清醒，越是要慎终如始，越是要再接再厉、善作善成，继续把疫情防控作为当前头等大事和最重要的工作，不麻痹、不厌战、不松劲，毫不放松抓紧抓实抓细各项防控工作，坚决打赢湖北保卫战、武汉保卫战。。习近平指出，在这场严峻斗争中，湖北各级党组织和广大党员、干部冲锋在前、英勇奋战，全省医务工作者和援鄂医疗队员白衣执甲、逆行出征，人民解放军指战员闻令即动、勇挑重担，广大社区工作者、公安干警、基层干部、下沉干部、志愿者不惧风雨、坚守一线，广大群众众志成城、踊跃参与，涌现出一大批可歌可泣的先进典型和感人事迹。。习近平强调，在这场严峻斗争中，武汉人民识大体、顾大局，不畏艰险、顽强不屈，自觉服从疫情防控大局需要，主动投身疫情防控斗争，作出了重大贡献，让全国全世界看到了武汉人民的坚韧不拔、高风亮节。正是因为有了武汉人民的牺牲和奉献，有了武汉人民的坚持和努力，才有了今天疫情防控的积极向好态势。武汉人民用自己的实际行动，展现了中国力量、中国精神，彰显了中华民族同舟共济、守望相助的家国情怀。武汉不愧为英雄的城市，武汉人民不愧为英雄的人民，必将通过打赢这次抗击新冠肺炎疫情斗争再次被载入史册！全党全国各族人民都为你们而感动、而赞叹！党和人民感谢武汉人民！。习近平代表党中央，向湖北和武汉广大党员、干部、群众致以诚挚的问候，向奋战在疫情防控第一线的广大医务工作者、人民解放军指战员、社区工作者、公安干警、基层干部、下沉干部、志愿者以及各个方面的同志们表示崇高的敬意，向正在同病魔作斗争的患者及其家属、因公殉职人员家属、病亡者家属表示诚挚的慰问，向在这场疫情中不幸罹难的同胞、牺牲的一线工作人员表示深切的哀悼。。习近平始终高度关注湖北省和武汉市的疫情防控工作，一下飞机，就在中共中央政治局委员、国务院副总理、中央指导组组长孙春兰，湖北省委书记应勇，湖北省委常委、武汉市委书记王忠林陪同下，乘汽车前往集中收治重症患者的火神山医院。。在火神山医院指挥中心，习近平听取医院建设运行、患者收治、医务人员防护保障、科研攻关等情况介绍。习近平指出，疫情发生以来，包括军队在内的广大医务工作者发扬特别能吃苦、特别能战斗的精神，义无反顾奔赴湖北和武汉，毫无畏惧投入防控救治工作，日夜奋战，舍生忘死，不负重托，不辱使命，同时间赛跑，与病魔较量，为武汉疫情防控工作作出了重要贡献。军队医务人员牢记我军宗旨，召之即来，来之能战，战之能胜，为党旗、军旗增添了光彩。沧海横流，方显英雄本色。你们真正做到了救死扶伤、大爱无疆。你们是光明的使者、希望的使者，是最美的天使，是真正的英雄！党和人民感谢你们！。实地考察结束后，习近平主持召开会议，听取中央指导组、湖北省委和省政府关于疫情防控工作汇报。。牢记总书记殷殷嘱托扎实做好防汛救灾各项工作 加快打造安徽的“杭嘉湖”长三角的“白菜心”,看望慰问奋战在一线的医务工作者解放军指战员社区工作者公安干警基层干部下沉干部志愿者和居民群众时强调。3月10日，中共中央总书记、国家主席、中央军委主席习近平专门赴湖北省武汉市考察新冠肺炎疫情防控工作。这是习近平在火神山医院指挥中心视频连线感染科病房，与病房内患者和医务人员亲切交流。新华社记者 鞠鹏 摄。新华社武汉3月10日电 在抗击新冠肺炎疫情的关键时刻，中共中央总书记、国家主席、中央军委主席习近平10日专门赴湖北省武汉市考察疫情防控工作。他强调，湖北和武汉是这次疫情防控斗争的重中之重和决胜之地。经过艰苦努力，湖北和武汉疫情防控形势发生积极向好变化，取得阶段性重要成果，但疫情防控任务依然艰巨繁重。越是在这个时候，越是要保持头脑清醒，越是要慎终如始，越是要再接再厉、善作善成，继续把疫情防控作为当前头等大事和最重要的工作，不麻痹、不厌战、不松劲，毫不放松抓紧抓实抓细各项防控工作，坚决打赢湖北保卫战、武汉保卫战。。习近平指出，在这场严峻斗争中，湖北各级党组织和广大党员、干部冲锋在前、英勇奋战，全省医务工作者和援鄂医疗队员白衣执甲、逆行出征，人民解放军指战员闻令即动、勇挑重担，广大社区工作者、公安干警、基层干部、下沉干部、志愿者不惧风雨、坚守一线，广大群众众志成城、踊跃参与，涌现出一大批可歌可泣的先进典型和感人事迹。。习近平强调，在这场严峻斗争中，武汉人民识大体、顾大局，不畏艰险、顽强不屈，自觉服从疫情防控大局需要，主动投身疫情防控斗争，作出了重大贡献，让全国全世界看到了武汉人民的坚韧不拔、高风亮节。正是因为有了武汉人民的牺牲和奉献，有了武汉人民的坚持和努力，才有了今天疫情防控的积极向好态势。武汉人民用自己的实际行动，展现了中国力量、中国精神，彰显了中华民族同舟共济、守望相助的家国情怀。武汉不愧为英雄的城市，武汉人民不愧为英雄的人民，必将通过打赢这次抗击新冠肺炎疫情斗争再次被载入史册！全党全国各族人民都为你们而感动、而赞叹！党和人民感谢武汉人民！。习近平代表党中央，向湖北和武汉广大党员、干部、群众致以诚挚的问候，向奋战在疫情防控第一线的广大医务工作者、人民解放军指战员、社区工作者、公安干警、基层干部、下沉干部、志愿者以及各个方面的同志们表示崇高的敬意，向正在同病魔作斗争的患者及其家属、因公殉职人员家属、病亡者家属表示诚挚的慰问，向在这场疫情中不幸罹难的同胞、牺牲的一线工作人员表示深切的哀悼。。习近平始终高度关注湖北省和武汉市的疫情防控工作，一下飞机，就在中共中央政治局委员、国务院副总理、中央指导组组长孙春兰，湖北省委书记应勇，湖北省委常委、武汉市委书记王忠林陪同下，乘汽车前往集中收治重症患者的火神山医院。。在火神山医院指挥中心，习近平听取医院建设运行、患者收治、医务人员防护保障、科研攻关等情况介绍。习近平指出，疫情发生以来，包括军队在内的广大医务工作者发扬特别能吃苦、特别能战斗的精神，义无反顾奔赴湖北和武汉，毫无畏惧投入防控救治工作，日夜奋战，舍生忘死，不负重托，不辱使命，同时间赛跑，与病魔较量，为武汉疫情防控工作作出了重要贡献。军队医务人员牢记我军宗旨，召之即来，来之能战，战之能胜，为党旗、军旗增添了光彩。沧海横流，方显英雄本色。你们真正做到了救死扶伤、大爱无疆。你们是光明的使者、希望的使者，是最美的天使，是真正的英雄！党和人民感谢你们！。实地考察结束后，习近平主持召开会议，听取中央指导组、湖北省委和省政府关于疫情防控工作汇报。。牢记总书记殷殷嘱托扎实做好防汛救灾各项工作 加快打造安徽的“杭嘉湖”长三角的“白菜心”,政府领导到其他城市考察学习或访问,0.0,True
97,安徽省,马鞍山市,市政府党组扩大会学习贯彻习近平总书记视察安徽重要讲话精神,2020-08-25,https://www.mas.gov.cn/ztzj/rzxxxcgcxjpzsjscahzyjhjs/rzxxxcgcxjpzsjscahzyjhjs/20249451.html,8月24日上午，在市委常委会扩大会议结束后，市政府党组书记、市长袁方主持召开市政府党组（扩大）会暨理论学习中心组学习会议，传达学习习近平总书记视察安徽重要讲话精神，研究政府系统学习贯彻落实工作。。会议指出，习近平总书记此次安徽视察特别是马鞍山视察，在马鞍山发展史上具有极其重大而深远的里程碑意义；视察期间发表的重要讲话，是引领马鞍山发展的总方针、总遵循。我们要高站位领会精神实质，特别是习近平总书记对人民的深厚情怀、关于生态环保与经济发展的辩证思维、对长三角一体化发展的殷切期望、做实做强做优实体经济的殷殷嘱托和全面加强党的领导的谆谆教诲，坚决把思想和行动统一到习近平总书记重要讲话精神上来。。会议强调，要高起点推进长远高质量发展，确保习近平总书记重要讲话精神在马鞍山落地生根。要坚持目标引领，科学编制我市“十四五”规划，积极稳妥谋划未来发展。要坚持绿色发展，加力推进“生态福地、智造名城”建设。要坚持对接融入，着力增强对沪苏浙资源要素吸引力，加大对马钢服务支持力度。要坚持人民至上，协同推进长三角基本公共服务便利共享，不断补齐民生短板。要坚持勇于担当，把习近平总书记的关怀鼓励，转化为推动发展的强大动力，努力创造更多走在全省乃至全国前列的好经验好做法。。会议要求，要立足长远、干在当下，高效率抓好年内重点工作，奋力完成全年目标任务，统筹推进灾后恢复重建、脱贫攻坚、常态化疫情防控、制止餐饮浪费等工作，努力用新作为、新举措开创马鞍山高质量发展新局面。。牢记总书记殷殷嘱托扎实做好防汛救灾各项工作 加快打造安徽的“杭嘉湖”长三角的“白菜心”,8月24日上午，在市委常委会扩大会议结束后，市政府党组书记、市长袁方主持召开市政府党组（扩大）会暨理论学习中心组学习会议，传达学习习近平总书记视察安徽重要讲话精神，研究政府系统学习贯彻落实工作。。会议指出，习近平总书记此次安徽视察特别是马鞍山视察，在马鞍山发展史上具有极其重大而深远的里程碑意义；视察期间发表的重要讲话，是引领马鞍山发展的总方针、总遵循。我们要高站位领会精神实质，特别是习近平总书记对人民的深厚情怀、关于生态环保与经济发展的辩证思维、对长三角一体化发展的殷切期望、做实做强做优实体经济的殷殷嘱托和全面加强党的领导的谆谆教诲，坚决把思想和行动统一到习近平总书记重要讲话精神上来。。会议强调，要高起点推进长远高质量发展，确保习近平总书记重要讲话精神在马鞍山落地生根。要坚持目标引领，科学编制我市“十四五”规划，积极稳妥谋划未来发展。要坚持绿色发展，加力推进“生态福地、智造名城”建设。要坚持对接融入，着力增强对沪苏浙资源要素吸引力，加大对马钢服务支持力度。要坚持人民至上，协同推进长三角基本公共服务便利共享，不断补齐民生短板。要坚持勇于担当，把习近平总书记的关怀鼓励，转化为推动发展的强大动力，努力创造更多走在全省乃至全国前列的好经验好做法。。会议要求，要立足长远、干在当下，高效率抓好年内重点工作，奋力完成全年目标任务，统筹推进灾后恢复重建、脱贫攻坚、常态化疫情防控、制止餐饮浪费等工作，努力用新作为、新举措开创马鞍山高质量发展新局面。。牢记总书记殷殷嘱托扎实做好防汛救灾各项工作 加快打造安徽的“杭嘉湖”长三角的“白菜心”,其他,0.7349705987813002,True
