code,province,city,topic,date,url,content,content.1,label,score,is_match
97,安徽省,马鞍山市,市党政代表团赴德清溧阳学习考察,2021-07-09,http://www.mas.gov.cn/zxzx/zwyw/20505781.html,7月7日至8日，市委书记张岳峰、市长袁方率市党政代表团赴湖州市德清县、常州市溧阳市，学习考察两地在保护修复生态环境、发展绿色经济等方面的好经验、好做法。市领导钱沙泉、杨善斌、夏劲松、方文、程彰德、阚青鹤，宝武马钢集团总经理刘国旺，宝钢资源公司董事长陆克从、高级副总裁王铁成，市政府秘书长易茂林，各县区、园区和市直相关部门负责同志参加考察。。7日，市党政代表团前往湖州市德清县考察。湖州市领导马晓晖、王纲、夏坚定，德清县领导敖煜新、王波等分别陪同。。▲洛舍镇东衡村 洛舍镇东衡村2009年下决心关停了全部矿产企业，开展废弃矿山综合整治，利用废弃矿地建设农民新村、垦造农田、发展产业，实现了生态美、百姓富、产业强。代表团一行认真听取东衡村闭矿转型和德清县废弃矿地综合开发利用等情况介绍，表示要学习借鉴、复制推广这些先进经验。。▲代表团考察德清地理信息产业 在联合国全球地理信息管理德清论坛会址，代表团一行详细了解地理信息产业发展情况，得知德清地理信息产业“无中生有”、不断壮大，已集聚相关企业400余家，大家纷纷表示赞赏。。在联合国全球地理信息管理德清论坛会址，代表团一行详细了解地理信息产业发展情况，得知德清地理信息产业“无中生有”、不断壮大，已集聚相关企业400余家，大家纷纷表示赞赏。。▲在莫干山镇五四村考察 在莫干山镇五四村，代表团一行先后来到游客服务中心、幸福邻里中心、党群服务中心考察，认真观看该村创新打造的“数字乡村一张图”系统演示，学习乡村治理的经验做法。。在莫干山镇五四村，代表团一行先后来到游客服务中心、幸福邻里中心、党群服务中心考察，认真观看该村创新打造的“数字乡村一张图”系统演示，学习乡村治理的经验做法。。▲在郡安里度假区考察 郡安里度假区项目是莫干山镇推进“坡地村镇”土地综合利用、发展旅游休闲产业的成功实践，代表团成员一边参观学习，一边就各自关心的具体问题与当地干部交流探讨。。郡安里度假区项目是莫干山镇推进“坡地村镇”土地综合利用、发展旅游休闲产业的成功实践，代表团成员一边参观学习，一边就各自关心的具体问题与当地干部交流探讨。。▲在浙江泰普森实业集团有限公司考察 浙江泰普森实业集团有限公司主要生产户外家具、渔具装备、帐篷等户外休闲用品，是德清县发展绿色经济的重点项目，代表团一行详细了解企业经营模式和发展状况，并参观了产品展厅。 8日，市党政代表团在常州市溧阳市考察。常州市领导陈金虎、方国强、梁一波、张耀钢，溧阳市领导徐华勤、叶明华等陪同考察。。浙江泰普森实业集团有限公司主要生产户外家具、渔具装备、帐篷等户外休闲用品，是德清县发展绿色经济的重点项目，代表团一行详细了解企业经营模式和发展状况，并参观了产品展厅。。8日，市党政代表团在常州市溧阳市考察。常州市领导陈金虎、方国强、梁一波、张耀钢，溧阳市领导徐华勤、叶明华等陪同考察。。▲代表团一行参观生态创新展示馆 代表团一行首先乘船察看沙河水库水质及周边生态环境，了解水环境整治工作成效和水源地保护措施。随后，代表团一行参观了生态创新展示馆，详细了解溧阳在生态保护、美丽乡村建设、矿山修复、构建生态产品交易市场等方面的成功经验，对当地以生态创新打通“绿水青山就是金山银山”生态价值转化路径的创造性实践给予高度评价。。代表团一行首先乘船察看沙河水库水质及周边生态环境，了解水环境整治工作成效和水源地保护措施。随后，代表团一行参观了生态创新展示馆，详细了解溧阳在生态保护、美丽乡村建设、矿山修复、构建生态产品交易市场等方面的成功经验，对当地以生态创新打通“绿水青山就是金山银山”生态价值转化路径的创造性实践给予高度评价。,7月7日至8日，市委书记张岳峰、市长袁方率市党政代表团赴湖州市德清县、常州市溧阳市，学习考察两地在保护修复生态环境、发展绿色经济等方面的好经验、好做法。市领导钱沙泉、杨善斌、夏劲松、方文、程彰德、阚青鹤，宝武马钢集团总经理刘国旺，宝钢资源公司董事长陆克从、高级副总裁王铁成，市政府秘书长易茂林，各县区、园区和市直相关部门负责同志参加考察。。7日，市党政代表团前往湖州市德清县考察。湖州市领导马晓晖、王纲、夏坚定，德清县领导敖煜新、王波等分别陪同。。▲洛舍镇东衡村 洛舍镇东衡村2009年下决心关停了全部矿产企业，开展废弃矿山综合整治，利用废弃矿地建设农民新村、垦造农田、发展产业，实现了生态美、百姓富、产业强。代表团一行认真听取东衡村闭矿转型和德清县废弃矿地综合开发利用等情况介绍，表示要学习借鉴、复制推广这些先进经验。。▲代表团考察德清地理信息产业 在联合国全球地理信息管理德清论坛会址，代表团一行详细了解地理信息产业发展情况，得知德清地理信息产业“无中生有”、不断壮大，已集聚相关企业400余家，大家纷纷表示赞赏。。在联合国全球地理信息管理德清论坛会址，代表团一行详细了解地理信息产业发展情况，得知德清地理信息产业“无中生有”、不断壮大，已集聚相关企业400余家，大家纷纷表示赞赏。。▲在莫干山镇五四村考察 在莫干山镇五四村，代表团一行先后来到游客服务中心、幸福邻里中心、党群服务中心考察，认真观看该村创新打造的“数字乡村一张图”系统演示，学习乡村治理的经验做法。。在莫干山镇五四村，代表团一行先后来到游客服务中心、幸福邻里中心、党群服务中心考察，认真观看该村创新打造的“数字乡村一张图”系统演示，学习乡村治理的经验做法。。▲在郡安里度假区考察 郡安里度假区项目是莫干山镇推进“坡地村镇”土地综合利用、发展旅游休闲产业的成功实践，代表团成员一边参观学习，一边就各自关心的具体问题与当地干部交流探讨。。郡安里度假区项目是莫干山镇推进“坡地村镇”土地综合利用、发展旅游休闲产业的成功实践，代表团成员一边参观学习，一边就各自关心的具体问题与当地干部交流探讨。。▲在浙江泰普森实业集团有限公司考察 浙江泰普森实业集团有限公司主要生产户外家具、渔具装备、帐篷等户外休闲用品，是德清县发展绿色经济的重点项目，代表团一行详细了解企业经营模式和发展状况，并参观了产品展厅。 8日，市党政代表团在常州市溧阳市考察。常州市领导陈金虎、方国强、梁一波、张耀钢，溧阳市领导徐华勤、叶明华等陪同考察。。浙江泰普森实业集团有限公司主要生产户外家具、渔具装备、帐篷等户外休闲用品，是德清县发展绿色经济的重点项目，代表团一行详细了解企业经营模式和发展状况，并参观了产品展厅。。8日，市党政代表团在常州市溧阳市考察。常州市领导陈金虎、方国强、梁一波、张耀钢，溧阳市领导徐华勤、叶明华等陪同考察。。▲代表团一行参观生态创新展示馆 代表团一行首先乘船察看沙河水库水质及周边生态环境，了解水环境整治工作成效和水源地保护措施。随后，代表团一行参观了生态创新展示馆，详细了解溧阳在生态保护、美丽乡村建设、矿山修复、构建生态产品交易市场等方面的成功经验，对当地以生态创新打通“绿水青山就是金山银山”生态价值转化路径的创造性实践给予高度评价。。代表团一行首先乘船察看沙河水库水质及周边生态环境，了解水环境整治工作成效和水源地保护措施。随后，代表团一行参观了生态创新展示馆，详细了解溧阳在生态保护、美丽乡村建设、矿山修复、构建生态产品交易市场等方面的成功经验，对当地以生态创新打通“绿水青山就是金山银山”生态价值转化路径的创造性实践给予高度评价。,政府领导到其他城市考察学习或访问,0.559935096487249,True
97,安徽省,马鞍山市,团市委赴张家港团市委学习考察交流,2021-03-03,https://www.mas.gov.cn/zxzx/bmdt/20420631.html,为促进我市共青团事业发展，学习借鉴先进地市在共青团改革、创新创业、志愿服务、权益维护等领域经验做法，3月1日，团市委副书记、市青联主席胡宏扬带领市第四人民医院纪委书记周玉军、市第四人民医院副院长、市社会心理服务体系专家组成员陶德刚、团市委青少年发展和权益维护部部长王俊等一行7人赴张家港团市委考察交流。张家港团市委书记王苏嘉、副书记朱镕博陪同考察或参加座谈交流。。上午，考察组一行先后实地考察了城市综合展示馆、步行街青年志愿服务站、新兴青年青春服务站。。在城市综合展示馆，考察组一行在工作人员介绍下详细了解了张家港经济社会发展的沧桑巨变及工作理念，直观感受了创新实干地“张家港精神”以及全国文明城市创建的实践经验和丰硕成果。。在步行街青年志愿服务站，在该市青年志愿者协会秘书长马杰讲解下，考察组深入学习了解了服务站运营模式、志愿服务品牌等工作，对该市创新开发自助服务终端、打造志愿服务一条龙的做法点赞。。在新兴青年青春服务站，考察组仔细听取了工作人员的介绍，对该市探索建立新兴青年群体“4567”工作模式表示赞扬。。下午，考察组一行首先走访调研了红堡·张家港市青年中心，详细询问了解了党建带团建、中心运转、社会组织入驻、创业服务等情况，现场体验了团建地图系统并举行了交流座谈会。。随后，考察组一行深入张家港市社会心理服务指导中心，参观了个体咨询室、团体活动室、减压放松室、心理剧工作室等功能室以及“社会心理科普馆”，了解了“全民健心云平台”，体验了虚拟VR心理测试等多项心理服务，并与服务中心工作人员就如何服务广大青少年身心健康发展、减少和预防青少年违法犯罪、提升社会治理能力进行了探讨。。考察组一致认为，张家港共青团工作理念新、举措实、效果好，通过学习考察交流，开阔了眼界，拓宽了思路，找准了差距。在今后的工作中，团市委将进一步解放思想、拉高标杆，全面对照先进地市找差距、查不足，建立健全寻标对标达标措施，推动我市共青团各项事业迈上新台阶，以优异成绩为建党100周年献礼。。牢记总书记殷殷嘱托扎实做好防汛救灾各项工作 加快打造安徽的“杭嘉湖”长三角的“白菜心”,为促进我市共青团事业发展，学习借鉴先进地市在共青团改革、创新创业、志愿服务、权益维护等领域经验做法，3月1日，团市委副书记、市青联主席胡宏扬带领市第四人民医院纪委书记周玉军、市第四人民医院副院长、市社会心理服务体系专家组成员陶德刚、团市委青少年发展和权益维护部部长王俊等一行7人赴张家港团市委考察交流。张家港团市委书记王苏嘉、副书记朱镕博陪同考察或参加座谈交流。。上午，考察组一行先后实地考察了城市综合展示馆、步行街青年志愿服务站、新兴青年青春服务站。。在城市综合展示馆，考察组一行在工作人员介绍下详细了解了张家港经济社会发展的沧桑巨变及工作理念，直观感受了创新实干地“张家港精神”以及全国文明城市创建的实践经验和丰硕成果。。在步行街青年志愿服务站，在该市青年志愿者协会秘书长马杰讲解下，考察组深入学习了解了服务站运营模式、志愿服务品牌等工作，对该市创新开发自助服务终端、打造志愿服务一条龙的做法点赞。。在新兴青年青春服务站，考察组仔细听取了工作人员的介绍，对该市探索建立新兴青年群体“4567”工作模式表示赞扬。。下午，考察组一行首先走访调研了红堡·张家港市青年中心，详细询问了解了党建带团建、中心运转、社会组织入驻、创业服务等情况，现场体验了团建地图系统并举行了交流座谈会。。随后，考察组一行深入张家港市社会心理服务指导中心，参观了个体咨询室、团体活动室、减压放松室、心理剧工作室等功能室以及“社会心理科普馆”，了解了“全民健心云平台”，体验了虚拟VR心理测试等多项心理服务，并与服务中心工作人员就如何服务广大青少年身心健康发展、减少和预防青少年违法犯罪、提升社会治理能力进行了探讨。。考察组一致认为，张家港共青团工作理念新、举措实、效果好，通过学习考察交流，开阔了眼界，拓宽了思路，找准了差距。在今后的工作中，团市委将进一步解放思想、拉高标杆，全面对照先进地市找差距、查不足，建立健全寻标对标达标措施，推动我市共青团各项事业迈上新台阶，以优异成绩为建党100周年献礼。。牢记总书记殷殷嘱托扎实做好防汛救灾各项工作 加快打造安徽的“杭嘉湖”长三角的“白菜心”,政府领导到其他城市考察学习或访问,0.0,True
97,安徽省,马鞍山市,市广播电视台赴浙江学习考察,2015-11-30,https://www.mas.gov.cn/xxgk/openness/detail/content/57a5b23cd439eb9403411ea9.html,为了更好谋划2016年的工作，实现马鞍山广电转型升级、加快发展，11月25日至27日，市广播电视台赴浙江开展学习考察活动。考察团先后参观考察了浙江省台州市、杭州市、湖州市长兴县等三地的广播电视集团、文化传媒集团，就电视节目创新与研发、传统媒体与新媒体融合、全媒体融合与运行，以及新形势下广电媒体如何转变发展模式等多个课题同当地广电传媒同行进行了座谈交流。。工作效率得到提高，工作业绩获得提升，多重积极效应逐步显现。但与浙江发达地区相比，还存在不小的差距。通过考察学习，大家坚定了对广播电视必须突破传统思维、创新理念加快发展的认识，增强了用发展的眼光看问题解难题、加快转型步伐、建设马鞍山新广电的信心和勇气。为了推进改革，深化改革，打造马鞍山新广电,为了更好谋划2016年的工作，实现马鞍山广电转型升级、加快发展，11月25日至27日，市广播电视台赴浙江开展学习考察活动。考察团先后参观考察了浙江省台州市、杭州市、湖州市长兴县等三地的广播电视集团、文化传媒集团，就电视节目创新与研发、传统媒体与新媒体融合、全媒体融合与运行，以及新形势下广电媒体如何转变发展模式等多个课题同当地广电传媒同行进行了座谈交流。。工作效率得到提高，工作业绩获得提升，多重积极效应逐步显现。但与浙江发达地区相比，还存在不小的差距。通过考察学习，大家坚定了对广播电视必须突破传统思维、创新理念加快发展的认识，增强了用发展的眼光看问题解难题、加快转型步伐、建设马鞍山新广电的信心和勇气。为了推进改革，深化改革，打造马鞍山新广电,其他,0.5814414970835384,True
97,安徽省,马鞍山市,市党政代表团赴杭州嘉兴湖州学习考察,2023-08-18,https://www.mas.gov.cn/zxzx/zwyw/21111331.html,8月15日至17日，市委书记袁方、市长葛斌率市党政代表团，就认真学习贯彻习近平总书记关于长三角一体化发展的重要论述，深入践行习近平总书记赋予马鞍山打造安徽的“杭嘉湖”、长三角的“白菜心”新发展定位，赴浙江省杭州市、嘉兴市、湖州市学习考察。市领导钱沙泉、吴桂林、方文、范奇、程彰德、陈永红、左年文、阙方俊，市政府秘书长汪强，各县区、园区和市直相关部门负责同志参加。。15日下午至16日上午，市党政代表团前往杭州市考察。杭州市市长姚高员，市政协副主席陈国妹，市政府秘书长高国飞分别参加。良渚遗址是实证中华五千年文明史的圣地，于2019年入选《世界遗产名录》。代表团走进良渚博物院、良渚古城遗址公园，详细了解良渚遗址在资源活化、申遗等方面工作情况，表示将深入学习良渚遗址保护、传承、利用的经验做法，大力挖掘我市凌家滩遗址的历史文化价值，加快申遗步伐。在杭州城市大脑运营指挥中心，代表团观看了城市大脑在数字治疫、数字治堵、政务服务等多场景中的应用演示，表示要充分借鉴杭州做法，加快推动数字政府、数字城市建设。新华三集团主要为金融、医疗、教育等多个领域提供数字化转型解决方案，代表团认真听取企业产品、技术等情况介绍，并参观了企业创新体验中心。杭州高新区（滨江）是国家自主创新示范区，打造形成了多个千亿级智慧经济产业，代表团对他们积极创新体制机制、大力发展数字经济等做法给予高度评价。杭州在全国率先推进未来社区建设，代表团来到西兴街道缤纷未来社区，参观了缤纷会客厅、缤纷食堂等场所，并就如何做好基层治理工作与社区干部深入交流。。16日下午，市党政代表团前往嘉兴市嘉善县考察。嘉兴市委书记陈伟，市委秘书长沈雨祥参加。嘉善县是长三角生态绿色一体化发展示范区的重要组成部分，代表团走进示范区（嘉善）企业交流服务基地，详细了解嘉善片区规划和建设情况，高度肯定嘉善的绿色创新发展成就。随后，代表团来到祥符荡科创绿谷研发总部，步行考察祥符荡水域生态修复情况，察看浙大未来食品实验室和祥符实验室，表示要学习借鉴嘉善在引进科研机构和科创人才等方面经验，加快建设高能级创新平台，推动更多科技创新成果就地转化和产业化。在兰钧新能源科技有限公司，代表团听取了企业产品研发和生产经营情况介绍，对企业节约集约利用土地的做法给予好评。大云镇缪家村是浙江深入推进“千万工程”、引领乡村美丽蝶变的典型代表。代表团参观了缪家村史馆，沿着幸福广场、便民服务一条街边走边看，详细了解抓党建促乡村振兴、壮大村级集体经济、服务惠民等方面情况。。17日上午，市党政代表团前往湖州市考察。湖州市委书记陈浩、市长洪湖鹏，副市长夏坚定、市政协副主席李全明，市委秘书长宋波分别参加。万邦德·栋梁铝业有限公司是国内首家主营建筑铝材的上市企业，通过运用智能管理、调度和物流系统实现生产全程数字化。代表团走进生产车间，参观铝型材生产加工过程，详细了解企业生产经营、技术改造等情况。浙江东尼电子股份有限公司是国家级高新技术企业，主要产品包括金刚石切割线、无线充电隔磁片等。在产品展示厅，代表团听取了企业产品研发、人才引进等情况介绍，纷纷点赞企业的创新发展成效。在吴兴区社会治理中心，代表团详细了解矛盾纠纷化解“只进一扇门”“最多跑一地”模式，观摩了基层智治驾驶舱应用演示，认为这些做法对我市加快推进社会治理现代化具有借鉴意义。吴兴区潞村是世界乡村旅游大会永久会址，代表团步行考察了双源馆、《典籍里的中国》陈列馆、潞村水街，详细了解古村落保护开发、文旅融合等方面创新做法。。牢记总书记殷殷嘱托扎实做好防汛救灾各项工作 加快打造安徽的“杭嘉湖”长三角的“白菜心”,8月15日至17日，市委书记袁方、市长葛斌率市党政代表团，就认真学习贯彻习近平总书记关于长三角一体化发展的重要论述，深入践行习近平总书记赋予马鞍山打造安徽的“杭嘉湖”、长三角的“白菜心”新发展定位，赴浙江省杭州市、嘉兴市、湖州市学习考察。市领导钱沙泉、吴桂林、方文、范奇、程彰德、陈永红、左年文、阙方俊，市政府秘书长汪强，各县区、园区和市直相关部门负责同志参加。。15日下午至16日上午，市党政代表团前往杭州市考察。杭州市市长姚高员，市政协副主席陈国妹，市政府秘书长高国飞分别参加。良渚遗址是实证中华五千年文明史的圣地，于2019年入选《世界遗产名录》。代表团走进良渚博物院、良渚古城遗址公园，详细了解良渚遗址在资源活化、申遗等方面工作情况，表示将深入学习良渚遗址保护、传承、利用的经验做法，大力挖掘我市凌家滩遗址的历史文化价值，加快申遗步伐。在杭州城市大脑运营指挥中心，代表团观看了城市大脑在数字治疫、数字治堵、政务服务等多场景中的应用演示，表示要充分借鉴杭州做法，加快推动数字政府、数字城市建设。新华三集团主要为金融、医疗、教育等多个领域提供数字化转型解决方案，代表团认真听取企业产品、技术等情况介绍，并参观了企业创新体验中心。杭州高新区（滨江）是国家自主创新示范区，打造形成了多个千亿级智慧经济产业，代表团对他们积极创新体制机制、大力发展数字经济等做法给予高度评价。杭州在全国率先推进未来社区建设，代表团来到西兴街道缤纷未来社区，参观了缤纷会客厅、缤纷食堂等场所，并就如何做好基层治理工作与社区干部深入交流。。16日下午，市党政代表团前往嘉兴市嘉善县考察。嘉兴市委书记陈伟，市委秘书长沈雨祥参加。嘉善县是长三角生态绿色一体化发展示范区的重要组成部分，代表团走进示范区（嘉善）企业交流服务基地，详细了解嘉善片区规划和建设情况，高度肯定嘉善的绿色创新发展成就。随后，代表团来到祥符荡科创绿谷研发总部，步行考察祥符荡水域生态修复情况，察看浙大未来食品实验室和祥符实验室，表示要学习借鉴嘉善在引进科研机构和科创人才等方面经验，加快建设高能级创新平台，推动更多科技创新成果就地转化和产业化。在兰钧新能源科技有限公司，代表团听取了企业产品研发和生产经营情况介绍，对企业节约集约利用土地的做法给予好评。大云镇缪家村是浙江深入推进“千万工程”、引领乡村美丽蝶变的典型代表。代表团参观了缪家村史馆，沿着幸福广场、便民服务一条街边走边看，详细了解抓党建促乡村振兴、壮大村级集体经济、服务惠民等方面情况。。17日上午，市党政代表团前往湖州市考察。湖州市委书记陈浩、市长洪湖鹏，副市长夏坚定、市政协副主席李全明，市委秘书长宋波分别参加。万邦德·栋梁铝业有限公司是国内首家主营建筑铝材的上市企业，通过运用智能管理、调度和物流系统实现生产全程数字化。代表团走进生产车间，参观铝型材生产加工过程，详细了解企业生产经营、技术改造等情况。浙江东尼电子股份有限公司是国家级高新技术企业，主要产品包括金刚石切割线、无线充电隔磁片等。在产品展示厅，代表团听取了企业产品研发、人才引进等情况介绍，纷纷点赞企业的创新发展成效。在吴兴区社会治理中心，代表团详细了解矛盾纠纷化解“只进一扇门”“最多跑一地”模式，观摩了基层智治驾驶舱应用演示，认为这些做法对我市加快推进社会治理现代化具有借鉴意义。吴兴区潞村是世界乡村旅游大会永久会址，代表团步行考察了双源馆、《典籍里的中国》陈列馆、潞村水街，详细了解古村落保护开发、文旅融合等方面创新做法。。牢记总书记殷殷嘱托扎实做好防汛救灾各项工作 加快打造安徽的“杭嘉湖”长三角的“白菜心”,政府领导到其他城市考察学习或访问,0.8361543848865072,True
