code,province,city,topic,date,url,content,content.1,label,score,is_match,是否为“学习考察”新闻
58,黑龙江省,鸡西市,鸡西市司法局召开姜国文案件警示教育党组中心组专题学习会,2020-05-09,http://www.jixi.gov.cn/jixi/c100004/202005/c06_17865.shtml,5月9日，鸡西市司法局组织召开了“姜国文案件警示教育”党组中心组专题学习会。会议由市司法局党组书记、局长武建忠主持，市纪委派驻市司法局纪检组组长刘长祥出席会议并讲话。局党组成员和副处级以上干部17人参加会议。。市司法局党组书记、局长武建忠同志传达了中共中央纪委关于姜国文严重违纪违法问题及其教训警示的通报并做了表态发言。武建忠指出，姜国文严重违纪违法问题性质严重、影响恶劣，严重损害了党员干部形象，严重破坏了当地的政治生态环境。中央纪委、国家监委对姜国文严重违纪违法案件的查处，充分体现了以习近平同志为核心的党中央持续推进全面从严治党的鲜明态度，充分表明了党中央将党风廉政建设和反腐败斗争进行到底的坚定决心，充分彰显了我们党勇于自我革命、自我净化的政治勇气。姜国文一心信奉庸俗“关系学”，精心编织权力“关系网”是对党内政治规矩的严重破坏，司法行政干部必须以姜国文为鉴戒，牢记初心使命、坚定理想信念，对党忠诚、表里如一，坚持党性、严肃政治生活，公正廉洁用权、自觉接受监督，始终树牢制度意识，维护制度权威。。市纪委派驻市司法局纪检组组长刘长祥要求，全市司法行政干部要切实提高政治站位，深刻认识姜国文及发生在我市的于金才、周春雁、刘立、孔令宝等干部严重违纪违法案件的危害，汲取警示教训，充分体会党中央、中央纪委、国家监委查处姜国文案件的重要意义，提高政治觉悟，坚定政治立场，敢于担当、勇于作为，永葆共产党员的政治本色，以实际行动维护司法行政干部良好形象，营造风清气正的政治生态环境。,5月9日，鸡西市司法局组织召开了“姜国文案件警示教育”党组中心组专题学习会。会议由市司法局党组书记、局长武建忠主持，市纪委派驻市司法局纪检组组长刘长祥出席会议并讲话。局党组成员和副处级以上干部17人参加会议。。市司法局党组书记、局长武建忠同志传达了中共中央纪委关于姜国文严重违纪违法问题及其教训警示的通报并做了表态发言。武建忠指出，姜国文严重违纪违法问题性质严重、影响恶劣，严重损害了党员干部形象，严重破坏了当地的政治生态环境。中央纪委、国家监委对姜国文严重违纪违法案件的查处，充分体现了以习近平同志为核心的党中央持续推进全面从严治党的鲜明态度，充分表明了党中央将党风廉政建设和反腐败斗争进行到底的坚定决心，充分彰显了我们党勇于自我革命、自我净化的政治勇气。姜国文一心信奉庸俗“关系学”，精心编织权力“关系网”是对党内政治规矩的严重破坏，司法行政干部必须以姜国文为鉴戒，牢记初心使命、坚定理想信念，对党忠诚、表里如一，坚持党性、严肃政治生活，公正廉洁用权、自觉接受监督，始终树牢制度意识，维护制度权威。。市纪委派驻市司法局纪检组组长刘长祥要求，全市司法行政干部要切实提高政治站位，深刻认识姜国文及发生在我市的于金才、周春雁、刘立、孔令宝等干部严重违纪违法案件的危害，汲取警示教训，充分体会党中央、中央纪委、国家监委查处姜国文案件的重要意义，提高政治觉悟，坚定政治立场，敢于担当、勇于作为，永葆共产党员的政治本色，以实际行动维护司法行政干部良好形象，营造风清气正的政治生态环境。,其他,0.827063929425921,False,否
58,黑龙江省,鸡西市,市政府研究室开展全民国家安全教育日学习教育活动,2020-04-17,http://www.jixi.gov.cn/jixi/c100004/202004/c06_17564.shtml,的政治安全、国土安全、军事安全、经济安全、文化安全、社会安全、科技安全、网络安全、核安全、生态安全、资源安全、生物安全等12个重点领域。做到履行维护国家安全、保守国家秘密的责任和义务，提高风险防范意识，筑牢维护国家安全防线。,的政治安全、国土安全、军事安全、经济安全、文化安全、社会安全、科技安全、网络安全、核安全、生态安全、资源安全、生物安全等12个重点领域。做到履行维护国家安全、保守国家秘密的责任和义务，提高风险防范意识，筑牢维护国家安全防线。,其他,0.6250267682278317,False,否
58,黑龙江省,鸡西市,市政府研究室党组召开理论学习中心组扩大学习会议,2020-04-24,http://www.jixi.gov.cn/jixi/c100004/202004/c06_17670.shtml,4月23日，在第25个世纪读书日到来之际，市政府研究室党组召开理论学习中心组（扩大）集中学习会。会议由研究室党组书记、主任安军同志主持，研究室党组中心组成员、全体党员干部参加会议。。大家还对《习近平新时代中国特色社会主义思想学习纲要》第七部分“将全面深化改革进行到底”进行自学。学习会后，党组班子成员结合个人学习和分管工作情况开展交流研讨。。通过此次学习，让全体党员干部深刻认识到改革开放是坚持和发展中国特色社会主义的必由之路，对做好我市新形势下经济工作有了更深刻。爱岗敬业，恪尽职守，为党和人民的事业努力奋斗，为推动鸡西转型升级高质量发展贡献力量。,4月23日，在第25个世纪读书日到来之际，市政府研究室党组召开理论学习中心组（扩大）集中学习会。会议由研究室党组书记、主任安军同志主持，研究室党组中心组成员、全体党员干部参加会议。。大家还对《习近平新时代中国特色社会主义思想学习纲要》第七部分“将全面深化改革进行到底”进行自学。学习会后，党组班子成员结合个人学习和分管工作情况开展交流研讨。。通过此次学习，让全体党员干部深刻认识到改革开放是坚持和发展中国特色社会主义的必由之路，对做好我市新形势下经济工作有了更深刻。爱岗敬业，恪尽职守，为党和人民的事业努力奋斗，为推动鸡西转型升级高质量发展贡献力量。,其他,0.7054032742193567,False,否
58,黑龙江省,鸡西市,张常荣在主持市委理论学习中心组集体学习时强调贯彻落实总书记重要讲话精神坚决夺取脱贫攻坚战全面胜利于洪涛赵广东参加学习,2020-04-16,http://www.jixi.gov.cn/jixi/c100386/202004/c06_3647.shtml,张常荣在主持市委理论学习中心组集体学习时强调 贯彻落实总书记重要讲话精神 坚决夺取脱贫攻坚战全面胜利 于洪涛赵广东参加学习。4月15日，市委理论学习中心组集体学习《国务院扶贫开发领导小组关于学习贯彻习近平总书记在决战决胜脱贫攻坚座谈会上重要讲话精神的通知》和《中共黑龙江省委办公厅关于认真贯彻落实习近平总书记重要批示精神进一步做好重大事项请示报告工作的通知》。。与会市委常委围绕学习习近平总书记脱贫攻坚重要论述作重点发言，其他成员书面交流学习体会。。张常荣强调，要深入学习贯彻习近平总书记重要讲话精神和关于扶贫工作的重要论述，切实把思想和行动统一到党中央的决策部署上来，坚定必胜信心，咬定目标、一鼓作气、克难奋进，坚决夺取我市脱贫攻坚收官之战全面胜利。。张常荣强调，全市各地要采取有力措施，以钢牙啃骨头的劲头抓好各项工作。对密山、虎林、鸡东三个县（市）实行挂牌督战，重点督战22个扶贫任务重的乡镇和24个贫困村，及时解决制约完成脱贫攻坚任务的突出问题。在抓好疫情防控同时，不断创新工作方式方法，统筹推进疫情防控和脱贫攻坚，多渠道开发就业岗位，鼓励复工复产企业和开工的重大项目优先组织使用贫困劳动力。强化产业扶贫、就业扶贫，开展消费扶贫行动，激发贫困人口内生动力，建立防止返贫监测和帮扶机制，巩固脱贫成果。加强对脱贫不稳定户、边缘易致贫户以及因疫情或其它原因收入骤减户的监测，及时采取有针对性帮扶措施，防止发生新的贫困。对特殊贫困人口要落实社会保障措施，确保应保尽保。。张常荣强调，全市各级党组织要履职尽责，充分调动各方面积极性、主动性和创造性，狠抓责任落实。强化支持保障，鼓励担当作为，做好宣传引导，用坚强的党性确保脱贫攻坚质量和成色，坚决夺取脱贫攻坚战全面胜利，向党和人民交出合格答卷。,张常荣在主持市委理论学习中心组集体学习时强调 贯彻落实总书记重要讲话精神 坚决夺取脱贫攻坚战全面胜利 于洪涛赵广东参加学习。4月15日，市委理论学习中心组集体学习《国务院扶贫开发领导小组关于学习贯彻习近平总书记在决战决胜脱贫攻坚座谈会上重要讲话精神的通知》和《中共黑龙江省委办公厅关于认真贯彻落实习近平总书记重要批示精神进一步做好重大事项请示报告工作的通知》。。与会市委常委围绕学习习近平总书记脱贫攻坚重要论述作重点发言，其他成员书面交流学习体会。。张常荣强调，要深入学习贯彻习近平总书记重要讲话精神和关于扶贫工作的重要论述，切实把思想和行动统一到党中央的决策部署上来，坚定必胜信心，咬定目标、一鼓作气、克难奋进，坚决夺取我市脱贫攻坚收官之战全面胜利。。张常荣强调，全市各地要采取有力措施，以钢牙啃骨头的劲头抓好各项工作。对密山、虎林、鸡东三个县（市）实行挂牌督战，重点督战22个扶贫任务重的乡镇和24个贫困村，及时解决制约完成脱贫攻坚任务的突出问题。在抓好疫情防控同时，不断创新工作方式方法，统筹推进疫情防控和脱贫攻坚，多渠道开发就业岗位，鼓励复工复产企业和开工的重大项目优先组织使用贫困劳动力。强化产业扶贫、就业扶贫，开展消费扶贫行动，激发贫困人口内生动力，建立防止返贫监测和帮扶机制，巩固脱贫成果。加强对脱贫不稳定户、边缘易致贫户以及因疫情或其它原因收入骤减户的监测，及时采取有针对性帮扶措施，防止发生新的贫困。对特殊贫困人口要落实社会保障措施，确保应保尽保。。张常荣强调，全市各级党组织要履职尽责，充分调动各方面积极性、主动性和创造性，狠抓责任落实。强化支持保障，鼓励担当作为，做好宣传引导，用坚强的党性确保脱贫攻坚质量和成色，坚决夺取脱贫攻坚战全面胜利，向党和人民交出合格答卷。,其他,0.6272458770360183,False,否
58,黑龙江省,鸡西市,经开区党工委召开视频学习会议,2020-04-22,http://www.jixi.gov.cn/jixi/c100004/202004/c06_17624.shtml,在全市防疫工作进入关键时期，为推进我单位学习、业务、防疫等工作全面提升，做到防疫不松懈、学习在路上。党工委于4月16日以网络视频形式组织开发区机关干部进行政治理论学习。党工委副书记常文生主持。。由党群办高宏宇同志辅导学习了中共中央《关于在全党开展“不忘初心、牢记使命”主题教育总结报告》的精神。由办公室于凯同志辅导学习了《2020年全市深化机关作风整顿优化营商环境实施方案》。。常文生副书记要求，疫情的关键时期就是考验党员干部的素质与能力，开发区在抓经济发展上不能掉队，防疫服务上不能松懈，这是每一个党员和机关干部的责任和初心，更是领导干部的工作和使命，我们要共同携手真抓实干，推动开发区各项工作不断上台阶、见成效。,在全市防疫工作进入关键时期，为推进我单位学习、业务、防疫等工作全面提升，做到防疫不松懈、学习在路上。党工委于4月16日以网络视频形式组织开发区机关干部进行政治理论学习。党工委副书记常文生主持。。由党群办高宏宇同志辅导学习了中共中央《关于在全党开展“不忘初心、牢记使命”主题教育总结报告》的精神。由办公室于凯同志辅导学习了《2020年全市深化机关作风整顿优化营商环境实施方案》。。常文生副书记要求，疫情的关键时期就是考验党员干部的素质与能力，开发区在抓经济发展上不能掉队，防疫服务上不能松懈，这是每一个党员和机关干部的责任和初心，更是领导干部的工作和使命，我们要共同携手真抓实干，推动开发区各项工作不断上台阶、见成效。,其他,0.6623934936953203,False,否
58,黑龙江省,鸡西市,鸡西经济开发区管委会迅速传达学习省委经济工作会议精神,2019-12-25,http://www.jixi.gov.cn/jixi/c100004/201912/c06_14946.shtml,2019年12月24日，鸡西经济开发区管委会召开主任办公（扩大）会议，传达学习省委经济工作会议精神。管委会主任、党工委副书记袁东胜同志主持会议，管委会班子成员和各局办负责人参加会议。。会议强调，要深入学习贯彻省委经济工作会议精神，紧紧围绕省委的战略部署，按照市委、市政府的工作要求，扎实推进开发区规划、建设、招商、服务等方面工作，推动鸡西经济开发区快速发展。,2019年12月24日，鸡西经济开发区管委会召开主任办公（扩大）会议，传达学习省委经济工作会议精神。管委会主任、党工委副书记袁东胜同志主持会议，管委会班子成员和各局办负责人参加会议。。会议强调，要深入学习贯彻省委经济工作会议精神，紧紧围绕省委的战略部署，按照市委、市政府的工作要求，扎实推进开发区规划、建设、招商、服务等方面工作，推动鸡西经济开发区快速发展。,其他,0.6035917606638661,False,否
58,黑龙江省,鸡西市,年鸡西市引进高层次硕士博士人才面试成绩及进入体检考察阶段人选名单公告,2019-12-20,http://www.jixi.gov.cn/jixi/c100007/201912/c06_533.shtml,年鸡西市引进高层次（硕士博士）人才哈尔滨师范大学、哈尔滨理工大学考点面试签约工作已经结束，按照《2019年鸡西市引进高层次（硕士博士）人才的公告》，经过网上预报名、现场报名和资格审查、面试（面谈）等规定程序，现将考生面试成绩及拟进入体检考察阶段人选名单予以公告。。对面试成绩有异议，可在公告期内反映。反映的情况和问题必须实事求是，反映人应签署真实姓名、工作单位和联系方式；对线索不清的匿名信和匿名电话，公告期间不予受理。,年鸡西市引进高层次（硕士博士）人才哈尔滨师范大学、哈尔滨理工大学考点面试签约工作已经结束，按照《2019年鸡西市引进高层次（硕士博士）人才的公告》，经过网上预报名、现场报名和资格审查、面试（面谈）等规定程序，现将考生面试成绩及拟进入体检考察阶段人选名单予以公告。。对面试成绩有异议，可在公告期内反映。反映的情况和问题必须实事求是，反映人应签署真实姓名、工作单位和联系方式；对线索不清的匿名信和匿名电话，公告期间不予受理。,其他,0.966425149620878,False,否
58,黑龙江省,鸡西市,市贸促会深入学习宣传贯彻党的十九届四中全会精神,2019-12-20,http://www.jixi.gov.cn/jixi/c100004/201912/c06_14870.shtml,学习好、宣传好、贯彻好十九届四中全会精神，是当前和今后一个时期的重大政治任务。市贸促会以深入学习贯彻党的十九届四中全会精神和扎实开展好主题教育为动力，不断增强“四个意识”、坚定“四个自信”、做到“两个维护”，高标准做好贸促各项工作，持续助力我市转型发展升级。。一是组织专题学习。全文传达了习近平总书记关于《中共中央关于坚持和完善中国特色社会主义制度、推进国家治理体系和治理能力现代化若干重大问题的决定》的说明以及《中国共产党第十九届中央委员会第四次全体会议公报》。。二是组织干部职工逐字逐句研读全会公报、《决定》及其说明。督促党员干部职工通过自学，迅速掀起学习贯彻全会精神的热潮，确保把全会精神及时传达到每一名党员、每一位干部。。三是进一步增强“四个意识”、坚定“四个自信”、做到“两个维护”。结合“不忘初心、牢记使命”主题教育“回头看”工作，对照整改事项进行认真梳理，对照全会精神进行深化整改，确保各项整改任务落实到位，为开展贸促工作开展提供了坚强政治保证。,学习好、宣传好、贯彻好十九届四中全会精神，是当前和今后一个时期的重大政治任务。市贸促会以深入学习贯彻党的十九届四中全会精神和扎实开展好主题教育为动力，不断增强“四个意识”、坚定“四个自信”、做到“两个维护”，高标准做好贸促各项工作，持续助力我市转型发展升级。。一是组织专题学习。全文传达了习近平总书记关于《中共中央关于坚持和完善中国特色社会主义制度、推进国家治理体系和治理能力现代化若干重大问题的决定》的说明以及《中国共产党第十九届中央委员会第四次全体会议公报》。。二是组织干部职工逐字逐句研读全会公报、《决定》及其说明。督促党员干部职工通过自学，迅速掀起学习贯彻全会精神的热潮，确保把全会精神及时传达到每一名党员、每一位干部。。三是进一步增强“四个意识”、坚定“四个自信”、做到“两个维护”。结合“不忘初心、牢记使命”主题教育“回头看”工作，对照整改事项进行认真梳理，对照全会精神进行深化整改，确保各项整改任务落实到位，为开展贸促工作开展提供了坚强政治保证。,其他,0.7444325766723544,False,否
58,黑龙江省,鸡西市,市外事办开展宪法学习活动,2019-12-20,http://www.jixi.gov.cn/jixi/c100004/201912/c06_14878.shtml,为弘扬宪法精神，维护宪法权威，以国家宪法日宣传活动为依托，市外事办组织全办人员开展了宪法学习活动。。学习会上，市外事办副主任陈志强领学了《宪法》有关章节，全办党员干部进行学习研讨。办党组书记、主任梁东红同志对当前学习宪法提出要求，一是要结合习近平新时代中国特色社会主义思想学，把握全面依法治国新理念新思想新战略；二是要结合党的十九大和十九届四中全会精神学，全面掌握中央关于推进国家治理体系和治理能力现代化的决策部署；三是要深入了解宪法的发展历程和地位作用，正确理解依宪治国、依宪执政的内涵和意义，增强“四个意识”、坚定“四个自信”，做到“两个维护”；四是融会贯通，学以致用，讲好中国宪法故事，推进国家治理体系和治理能力现代化。,为弘扬宪法精神，维护宪法权威，以国家宪法日宣传活动为依托，市外事办组织全办人员开展了宪法学习活动。。学习会上，市外事办副主任陈志强领学了《宪法》有关章节，全办党员干部进行学习研讨。办党组书记、主任梁东红同志对当前学习宪法提出要求，一是要结合习近平新时代中国特色社会主义思想学，把握全面依法治国新理念新思想新战略；二是要结合党的十九大和十九届四中全会精神学，全面掌握中央关于推进国家治理体系和治理能力现代化的决策部署；三是要深入了解宪法的发展历程和地位作用，正确理解依宪治国、依宪执政的内涵和意义，增强“四个意识”、坚定“四个自信”，做到“两个维护”；四是融会贯通，学以致用，讲好中国宪法故事，推进国家治理体系和治理能力现代化。,其他,0.7741550059220041,False,否
58,黑龙江省,鸡西市,市政府研究室召开中心组学习扩大会议暨不忘初心牢记使命主题教育自学成果交流会,2019-12-23,http://www.jixi.gov.cn/jixi/c100004/201912/c06_14916.shtml,市政府研究室召开中心组学习(扩大)会议暨“不忘初心、牢记使命”主题教育自学成果交流会。12月20日，市政府研究室召开党组理论学习中心组第十五次（扩大）会议，组织党员干部开展“不忘初心、牢记使命”主题教育第二次学习成果交流活动。会议由室党组书记、主任安军同志主持，全体党员干部参加会议。。精华内容，复习了省委十二届六次全会精神和中共鸡西市委十三届六次全会精神。随后，进行第二阶段成果交流，室党组。交流发言过后，大家一致认为，通过此次集中学习，进一步深刻领会了党的十九届四中全会精神实质，。发现了自身学习不足，为今后理论学习找到了好方法、好经验。集中学习还让大家对理论学习内容有了更深层次的认识，避免了在学习上出现“温差、落差、偏差”情况。,市政府研究室召开中心组学习(扩大)会议暨“不忘初心、牢记使命”主题教育自学成果交流会。12月20日，市政府研究室召开党组理论学习中心组第十五次（扩大）会议，组织党员干部开展“不忘初心、牢记使命”主题教育第二次学习成果交流活动。会议由室党组书记、主任安军同志主持，全体党员干部参加会议。。精华内容，复习了省委十二届六次全会精神和中共鸡西市委十三届六次全会精神。随后，进行第二阶段成果交流，室党组。交流发言过后，大家一致认为，通过此次集中学习，进一步深刻领会了党的十九届四中全会精神实质，。发现了自身学习不足，为今后理论学习找到了好方法、好经验。集中学习还让大家对理论学习内容有了更深层次的认识，避免了在学习上出现“温差、落差、偏差”情况。,其他,0.7698259691230596,False,否
