code,province,city,topic,date,url,content,content.1,label,score,is_match,是否为“学习考察”新闻
58,黑龙江省,鸡西市,鸡西市政协组织开展党史学习教育专题党课,2021-06-30,http://www.jixi.gov.cn/jixi/c100003/202106/c06_7635.shtml,按照市委党史学习教育领导小组安排部署，6月24日，市政协组织开展党史学习教育专题党课，市委副书记，市政协主席、党组书记王钢为与会政协委员讲授了一堂生动、精彩的党课。。市政协副主席郑君、杨敏、左晖、王均兵、崔长杰，秘书长候选人李军出席会议。左晖主持会议。。王钢以《“回望光辉历程把握性质定位”不断开创新时代人民政协事业发展新局面》为题，为与会政协委员作专题党课辅导。党课分别从要寻根溯源，以铁心向党的坚定不忘来时路；要知责奋进，以铁肩负重的担当迈步新时代；要真抓实干，以铁画银钩的作为绘就同心圆三个方面进行了全面系统的深刻阐述。详细讲解了社会主义协商民主经历的五个阶段、社会主义协商民主的价值意义以及社会主义协商民主的历史启示。深入浅出揭示了心怀国之大者的具体体现；弘扬龙江四大精神，传承鸡西红色文化，聚焦鸡西振兴发展目标的深刻内涵。。党课强调，在真抓实干过程中要做到准、专、实、新、聚，充分展示了不断开创新时代人民政协事业发展新局面的重大现实意义和历史意义，并对全市政协委员机关干部做好履职尽责工作提出明确要求。。党课站位高远、思想深邃，旁征博引、事例鲜活、饱含深情，思想性和政治性强，对全市政协组织学党史、悟思想、办实事、开新局，具有重要指导意义。。党课要求，各单位党组、党委要在党史学习教育中充分发挥党组织的引导作用，围绕市委、市政府中心工作，发挥好党组织的凝聚力、向心力和战斗力，在“七一”前夕组织开展形式多样、富有成效的活动，促进党史学习教育走深走实，为群众办好事、办实事，以优异的成绩迎接建党100周年，为打造有为政协、书香政协和智慧政协作出新的更大贡献。,按照市委党史学习教育领导小组安排部署，6月24日，市政协组织开展党史学习教育专题党课，市委副书记，市政协主席、党组书记王钢为与会政协委员讲授了一堂生动、精彩的党课。。市政协副主席郑君、杨敏、左晖、王均兵、崔长杰，秘书长候选人李军出席会议。左晖主持会议。。王钢以《“回望光辉历程把握性质定位”不断开创新时代人民政协事业发展新局面》为题，为与会政协委员作专题党课辅导。党课分别从要寻根溯源，以铁心向党的坚定不忘来时路；要知责奋进，以铁肩负重的担当迈步新时代；要真抓实干，以铁画银钩的作为绘就同心圆三个方面进行了全面系统的深刻阐述。详细讲解了社会主义协商民主经历的五个阶段、社会主义协商民主的价值意义以及社会主义协商民主的历史启示。深入浅出揭示了心怀国之大者的具体体现；弘扬龙江四大精神，传承鸡西红色文化，聚焦鸡西振兴发展目标的深刻内涵。。党课强调，在真抓实干过程中要做到准、专、实、新、聚，充分展示了不断开创新时代人民政协事业发展新局面的重大现实意义和历史意义，并对全市政协委员机关干部做好履职尽责工作提出明确要求。。党课站位高远、思想深邃，旁征博引、事例鲜活、饱含深情，思想性和政治性强，对全市政协组织学党史、悟思想、办实事、开新局，具有重要指导意义。。党课要求，各单位党组、党委要在党史学习教育中充分发挥党组织的引导作用，围绕市委、市政府中心工作，发挥好党组织的凝聚力、向心力和战斗力，在“七一”前夕组织开展形式多样、富有成效的活动，促进党史学习教育走深走实，为群众办好事、办实事，以优异的成绩迎接建党100周年，为打造有为政协、书香政协和智慧政协作出新的更大贡献。,其他,0.7108901243049909,True,是
58,黑龙江省,鸡西市,鲁长友赴北京上海考察招商洽谈对接项目,2021-06-30,http://www.jixi.gov.cn/jixi/c100038/202106/c06_16071.shtml,在中国亚洲经济发展协会，鲁长友拜会了会长权顺基，详细介绍了我市基本情况、资源禀赋和发展优势。。自身优势，积极牵线搭桥，引导支持会员企业在鸡西投资。近期将带领相关企业前往鸡西考察，。在中国煤矿机械装备有限责任公司，鲁长友会见了董事长倪嘉宇、总经理马利，介绍了我市煤炭产业发展情况。他指出，鸡西煤炭资源丰富，煤机制造是鸡西的传统产业，双方开展合作有基础、有市场、有潜力。希望企业能够到鸡西实地考察，。来到上海红星美凯龙控股集团有限公司，在集团总裁蒋小忠的陪同下，鲁长友参观了上海红星云总部、欧丽洛雅家居城、爱琴海购物公园等地，双方就在鸡西建设爱琴海购物公园及家居城项目达成合作协议。鲁长友表示，鸡西市委、市政府将全力为项目做好各项服务保障，。材料科技有限公司，鲁长友与总经理丁古巧就石墨烯产业发展进行了深入交流。鲁长友表示，鸡西石墨产业发展空间巨大、潜力无限，希望企业在加快既有项目建设的基础上，积极谋划新项目、研发新产品，抢占市场制高点。丁古巧表示，将全力推进鸡西石墨烯项目建设，打造全国石墨烯原材料基地。近期将派专业团队进一步考察洽谈，助力鸡西石墨烯产业加快发展。,在中国亚洲经济发展协会，鲁长友拜会了会长权顺基，详细介绍了我市基本情况、资源禀赋和发展优势。。自身优势，积极牵线搭桥，引导支持会员企业在鸡西投资。近期将带领相关企业前往鸡西考察，。在中国煤矿机械装备有限责任公司，鲁长友会见了董事长倪嘉宇、总经理马利，介绍了我市煤炭产业发展情况。他指出，鸡西煤炭资源丰富，煤机制造是鸡西的传统产业，双方开展合作有基础、有市场、有潜力。希望企业能够到鸡西实地考察，。来到上海红星美凯龙控股集团有限公司，在集团总裁蒋小忠的陪同下，鲁长友参观了上海红星云总部、欧丽洛雅家居城、爱琴海购物公园等地，双方就在鸡西建设爱琴海购物公园及家居城项目达成合作协议。鲁长友表示，鸡西市委、市政府将全力为项目做好各项服务保障，。材料科技有限公司，鲁长友与总经理丁古巧就石墨烯产业发展进行了深入交流。鲁长友表示，鸡西石墨产业发展空间巨大、潜力无限，希望企业在加快既有项目建设的基础上，积极谋划新项目、研发新产品，抢占市场制高点。丁古巧表示，将全力推进鸡西石墨烯项目建设，打造全国石墨烯原材料基地。近期将派专业团队进一步考察洽谈，助力鸡西石墨烯产业加快发展。,政府领导到其他城市考察学习或访问,0.0,False,否
58,黑龙江省,鸡西市,鸡西市政协开展党史学习教育我为群众办实事进社区活动,2021-06-28,http://www.jixi.gov.cn/jixi/c100003/202106/c06_7606.shtml,在党的百年华诞即将到来之际，6月 25日，为推动党史学习教育不断走深走实，市政协部分委员和机关部分党员走进麻山区中心社区，开展党史学习教育“我为群众办实事”系列活动。。在中心社区义诊现场，市政协医药卫生界别的部分委员及铁路医院的医疗专家们，设立心内科、妇科、中医科等诊台，为居民群众提供常见病、多发病及慢性病等咨询和诊断，把健康送到百姓家门口。铁路医院还向中心社区赠送了2 万余元的常用药品。。在中心社区困难党员李琦家中，左晖详细询问李琦女儿的病情和生活状况，鼓励他们要树立起生活信心，并为他们送去米、面、油、鲜奶等生活物品。。在困难党员于庆娥家中，左晖亲切地与于庆娥交谈，了解家庭情况，鼓励他们要乐观生活，并为他们送去了生活慰问品，让他们切实感受到党组织的温暖。。市政协人口资源环境委副主任邹本忠以《共产党员的楷模》为题，为中心社区居民群众上了一堂生动精彩的党课。,在党的百年华诞即将到来之际，6月 25日，为推动党史学习教育不断走深走实，市政协部分委员和机关部分党员走进麻山区中心社区，开展党史学习教育“我为群众办实事”系列活动。。在中心社区义诊现场，市政协医药卫生界别的部分委员及铁路医院的医疗专家们，设立心内科、妇科、中医科等诊台，为居民群众提供常见病、多发病及慢性病等咨询和诊断，把健康送到百姓家门口。铁路医院还向中心社区赠送了2 万余元的常用药品。。在中心社区困难党员李琦家中，左晖详细询问李琦女儿的病情和生活状况，鼓励他们要树立起生活信心，并为他们送去米、面、油、鲜奶等生活物品。。在困难党员于庆娥家中，左晖亲切地与于庆娥交谈，了解家庭情况，鼓励他们要乐观生活，并为他们送去了生活慰问品，让他们切实感受到党组织的温暖。。市政协人口资源环境委副主任邹本忠以《共产党员的楷模》为题，为中心社区居民群众上了一堂生动精彩的党课。,其他,0.6558846664814847,False,否
58,黑龙江省,鸡西市,中国建材集团来我市考察调研石墨产业于洪涛鲁长友会见考察调研组一行,2021-06-25,http://www.jixi.gov.cn/jixi/c100003/202106/c06_7582.shtml,6月22日、23日，中国建材集团有限公司党委常委、副总经理魏如山带领考察调研组一行4人，来我市考察调研石墨产业发展情况和产业前景。。我市是“中国石墨之都”，石墨产业是转型发展的主导产业，秉承着向精深加工要发展的理念，全力推动石墨产业向中高端迈进。考察调研组参观了中国鸡西石墨展厅及国家石墨产品质量监督检验中心，并先后深入贝特瑞石墨产业园、多凌新材料科技、长源矿业、柳毛石墨矿、普莱德新材料等多家企业调研。察看了企业的生产车间、机械设备、重点产品等，并分别在贝特瑞和普莱德公司召开了座谈会，详细了解石墨产品性能、生产工艺、技术研发、市场容量、市场前景、矿产分布及矿业权等情况，就石墨产业发展的方向和趋势进行了深入交流。,6月22日、23日，中国建材集团有限公司党委常委、副总经理魏如山带领考察调研组一行4人，来我市考察调研石墨产业发展情况和产业前景。。我市是“中国石墨之都”，石墨产业是转型发展的主导产业，秉承着向精深加工要发展的理念，全力推动石墨产业向中高端迈进。考察调研组参观了中国鸡西石墨展厅及国家石墨产品质量监督检验中心，并先后深入贝特瑞石墨产业园、多凌新材料科技、长源矿业、柳毛石墨矿、普莱德新材料等多家企业调研。察看了企业的生产车间、机械设备、重点产品等，并分别在贝特瑞和普莱德公司召开了座谈会，详细了解石墨产品性能、生产工艺、技术研发、市场容量、市场前景、矿产分布及矿业权等情况，就石墨产业发展的方向和趋势进行了深入交流。,其他,0.624376517192521,False,否
58,黑龙江省,鸡西市,虎林百余名民兵开展党史学习教育系列活动,2021-06-23,http://www.jixi.gov.cn/jixi/c100003/202106/c06_7532.shtml,军旗飘扬、歌声嘹亮。蓝天白云之下，矗立的纪念碑前，120名身着迷彩服的民兵静默驻立，献花默哀、集体宣誓，铮铮誓言回荡在虎林市虎头镇的二战终结地纪念园上空……。在中国共产党成立100周年之际，为检验民兵组织建设情况，强化民兵队伍应对突发事件的集结反应能力和应急备战水平，激发民兵队伍使命担当和爱党爱国情怀，虎林市人武部集结民兵应急连120名民兵，来到虎头镇爱国主义教育基地，开展“打卡红色教育基地、追寻红色记忆”党史学习教育系列活动。。向纪念碑敬献花篮、向党旗军旗宣誓、参观侵华日军虎头要塞博物馆、在东北抗联英雄雕像前唱红歌、重走抗联路等一系列活动中，民兵们整齐列队，怀着敬畏、感恩之心追寻着烈士的足迹，感受着烽火岁月，接受着教育和洗礼。大家立志在今后的工作中传承红色基因、赓续英雄血脉、发扬革命精神，争做一名合格民兵。,军旗飘扬、歌声嘹亮。蓝天白云之下，矗立的纪念碑前，120名身着迷彩服的民兵静默驻立，献花默哀、集体宣誓，铮铮誓言回荡在虎林市虎头镇的二战终结地纪念园上空……。在中国共产党成立100周年之际，为检验民兵组织建设情况，强化民兵队伍应对突发事件的集结反应能力和应急备战水平，激发民兵队伍使命担当和爱党爱国情怀，虎林市人武部集结民兵应急连120名民兵，来到虎头镇爱国主义教育基地，开展“打卡红色教育基地、追寻红色记忆”党史学习教育系列活动。。向纪念碑敬献花篮、向党旗军旗宣誓、参观侵华日军虎头要塞博物馆、在东北抗联英雄雕像前唱红歌、重走抗联路等一系列活动中，民兵们整齐列队，怀着敬畏、感恩之心追寻着烈士的足迹，感受着烽火岁月，接受着教育和洗礼。大家立志在今后的工作中传承红色基因、赓续英雄血脉、发扬革命精神，争做一名合格民兵。,其他,0.8504353261368361,False,否
58,黑龙江省,鸡西市,鸡冠区重温红色电影凝聚奋进力量鸡冠区开展红色电影进乡村党史学习进万家活动,2021-06-15,http://www.jixi.gov.cn/jixi/c100003/202106/c06_7465.shtml,为进一步推动党史题材影视作品走进寻常百姓家，连日来，鸡冠区在城乡基层组织开展“七个一”系列学习教育活动中，创新学习教育形式，开展电影进村、社区活动，把具有革命精神的党史题材影视作品送到农村、社区居民心田，引导广大群众学党史，坚定广大群众感党恩、跟党走的信念。。在西郊乡新发村村部，村民们聚精会神观看电影《金刚川》，志愿军战士在物质匮乏、敌我武装悬殊的情况下，不断抵御敌机狂轰乱炸，一次次用血肉之躯筑起金刚川上和平之桥，跌宕起伏的剧情牵动着观众的心，革命先辈英勇奋战的一幕幕场景感染着现场每一位观众。在文化广场，月秀社区的居民们观看电影《建党伟业》，电影以毛泽东、李大钊、陈独秀、蔡和森、周恩来等第一批中国共产党党员为中心，讲述了他们在风雨飘摇的时代为国家赴汤蹈火的精彩故事。。据悉，此次活动鸡冠区以中宣部(国家电影局)推荐和我省创作的革命题材影片为重点，组织广大党员、干部、群众开展“重温红色电影凝聚奋进力量”主题学习活动和“红色电影进乡村党史学习进万家”百场电影公益播放活动，掀起重温红色经典，赓续革命精神的学习热潮。,为进一步推动党史题材影视作品走进寻常百姓家，连日来，鸡冠区在城乡基层组织开展“七个一”系列学习教育活动中，创新学习教育形式，开展电影进村、社区活动，把具有革命精神的党史题材影视作品送到农村、社区居民心田，引导广大群众学党史，坚定广大群众感党恩、跟党走的信念。。在西郊乡新发村村部，村民们聚精会神观看电影《金刚川》，志愿军战士在物质匮乏、敌我武装悬殊的情况下，不断抵御敌机狂轰乱炸，一次次用血肉之躯筑起金刚川上和平之桥，跌宕起伏的剧情牵动着观众的心，革命先辈英勇奋战的一幕幕场景感染着现场每一位观众。在文化广场，月秀社区的居民们观看电影《建党伟业》，电影以毛泽东、李大钊、陈独秀、蔡和森、周恩来等第一批中国共产党党员为中心，讲述了他们在风雨飘摇的时代为国家赴汤蹈火的精彩故事。。据悉，此次活动鸡冠区以中宣部(国家电影局)推荐和我省创作的革命题材影片为重点，组织广大党员、干部、群众开展“重温红色电影凝聚奋进力量”主题学习活动和“红色电影进乡村党史学习进万家”百场电影公益播放活动，掀起重温红色经典，赓续革命精神的学习热潮。,其他,0.8531504362536614,False,否
58,黑龙江省,鸡西市,参观红色教育基地开展党史学习教育,2021-06-11,http://www.jixi.gov.cn/jixi/c100004/202106/c06_19810.shtml,为深入贯彻习近平总书记在党史学习教育动员大会上重要讲话精神，进一步提升市投资合作促进局全体党员的政治判断力、政治领悟力、政治执行力。。6月4日上午，市投资合作促进局组织局机关干部职工开展党史学习教育基地参观学习活动，参观了鸡西石墨博物馆、黑龙江工业学院矿山博物馆、青岛啤酒博物馆等地，重温一代代共产党人坚守初心、浴血奋战、团结奋斗，带领人民谱写宏伟壮丽篇章的光辉历程。。首先参观的是鸡西市石墨博物馆。讲解员向我们讲述了鸡西石墨悠久的发展历史，通过图片、视频、实物展览的方式展示了鸡西丰富的石墨资源、雄厚的产业基础和广阔的发展前景，让大家了解了石墨产业对鸡西发展的重要作用、石墨矿产资源分布以及鸡西的各个石墨产业园区，突出了鸡西。“煤城”之称，有着悠久的煤炭开采历史。矿山博物馆通过展示煤炭资源勘探、规划建井、采煤方法、灾害治理、初选加工、精深加工的全过程，进行了煤炭资源开发、开采、利用的全景展现。通过参观矿山博物馆，能够重温我们先辈不怕吃苦、攻坚克难的北大荒开拓精神，也激励着我们不断开拓进取、奋勇向前。。最后参观了青岛啤酒博物馆，博物馆以青岛啤酒的百年历程以及工艺流程为主线共分三个游览区域，分别为历史文化区域、生产工艺流程区域以及多功能区域。在青岛啤酒博物馆内，干部职工沿着青岛啤酒文化的萌芽历程，通过图片、文字和实物等共同回忆青岛啤酒的百年历史。从。“百年起点”、“易主经营”、“艰难岁月”、“新的征程”四个阶段，一幅幅画卷生动地展示了青岛啤酒的发展历程，为大家树立了文化自信。。100周年为契机，认真学习党史、新中国史、改革开放史、社会主义发展史，从党的关辉历程、优良传统中汲取精神力量，在学习中升华初心、强化担当、全力作为，以更加昂扬的精神状态和奋斗姿态，创造新业绩，展现新气象，真正做到学党史、悟思想、办实事、开新局。,为深入贯彻习近平总书记在党史学习教育动员大会上重要讲话精神，进一步提升市投资合作促进局全体党员的政治判断力、政治领悟力、政治执行力。。6月4日上午，市投资合作促进局组织局机关干部职工开展党史学习教育基地参观学习活动，参观了鸡西石墨博物馆、黑龙江工业学院矿山博物馆、青岛啤酒博物馆等地，重温一代代共产党人坚守初心、浴血奋战、团结奋斗，带领人民谱写宏伟壮丽篇章的光辉历程。。首先参观的是鸡西市石墨博物馆。讲解员向我们讲述了鸡西石墨悠久的发展历史，通过图片、视频、实物展览的方式展示了鸡西丰富的石墨资源、雄厚的产业基础和广阔的发展前景，让大家了解了石墨产业对鸡西发展的重要作用、石墨矿产资源分布以及鸡西的各个石墨产业园区，突出了鸡西。“煤城”之称，有着悠久的煤炭开采历史。矿山博物馆通过展示煤炭资源勘探、规划建井、采煤方法、灾害治理、初选加工、精深加工的全过程，进行了煤炭资源开发、开采、利用的全景展现。通过参观矿山博物馆，能够重温我们先辈不怕吃苦、攻坚克难的北大荒开拓精神，也激励着我们不断开拓进取、奋勇向前。。最后参观了青岛啤酒博物馆，博物馆以青岛啤酒的百年历程以及工艺流程为主线共分三个游览区域，分别为历史文化区域、生产工艺流程区域以及多功能区域。在青岛啤酒博物馆内，干部职工沿着青岛啤酒文化的萌芽历程，通过图片、文字和实物等共同回忆青岛啤酒的百年历史。从。“百年起点”、“易主经营”、“艰难岁月”、“新的征程”四个阶段，一幅幅画卷生动地展示了青岛啤酒的发展历程，为大家树立了文化自信。。100周年为契机，认真学习党史、新中国史、改革开放史、社会主义发展史，从党的关辉历程、优良传统中汲取精神力量，在学习中升华初心、强化担当、全力作为，以更加昂扬的精神状态和奋斗姿态，创造新业绩，展现新气象，真正做到学党史、悟思想、办实事、开新局。,其他,0.575574763123156,False,否
