code,province,city,topic,date,url,content,content.1,label,score,is_match,是否为“学习考察”新闻
58,黑龙江省,鸡西市,重庆日报报业集团智慧城市建设考察组到我市考察调研,2024-07-01,http://www.jixi.gov.cn/jixi/c100003/202407/c06_300346.shtml,6月26至27日，受民盟鸡西市委会邀请，以民盟重庆市江北区委会社会与法制委员会秘书长、重庆重报人力资源服务有限公司总经理王志刚为组长的重庆日报报业集团智慧城市建设考察组到我市考察调研智慧城市建设情况，并召开座谈会。。王志刚还先后深入市人社局、市住建局、鸡冠区房产物管中心参观考察，就智慧政务、智慧物业、智慧人力资源管理等方向的投资合作进行了深入调研并参观了民盟鸡西市委会的“盟员之家”之一“红色教育之家”。,6月26至27日，受民盟鸡西市委会邀请，以民盟重庆市江北区委会社会与法制委员会秘书长、重庆重报人力资源服务有限公司总经理王志刚为组长的重庆日报报业集团智慧城市建设考察组到我市考察调研智慧城市建设情况，并召开座谈会。。王志刚还先后深入市人社局、市住建局、鸡冠区房产物管中心参观考察，就智慧政务、智慧物业、智慧人力资源管理等方向的投资合作进行了深入调研并参观了民盟鸡西市委会的“盟员之家”之一“红色教育之家”。,政府领导到其他城市考察学习或访问,0.0,False,否
58,黑龙江省,鸡西市,赴台学习签注签发,2024-07-14,https://www.zwfw.hlj.gov.cn/zhcx/bszn?syncItemId=ad6c2958-52ed-4be5-9d8c-9b1c4be439a2&areaCode=230300000000,"大陆居民前往台湾旅游、探亲、定居、学习、访友、处理财产和婚丧事宜，或者参加经济、科技、文化、体育、学术等活动的，可以向公安机关出入境管理机构申请往来台湾通行证件和前往台湾签注。。学习：在教育部批准开放大陆学生赴台学习的省份参加本年度普通高校招生全国统一考试的高中毕业生，或在上述开放赴台就学省份且毕业于台湾主管部门承认学历的大陆高校的应届本科或硕士毕业生。。审批机构进行审核,作出批准或不予批准的决定.批准的,签发证件;不予批准的,审批机构向申请人出具《不予批准决定书》。。受理机构对符合申请条件,申请材料齐全且符合法定形式的,向申请人出具《受理申请回执单》；对申请材料不齐全或者不符合法定形式的，一次性告知申请人需要补正的全部内容；对不属于本部门职责范围或不符合受理要求的，不予受理，并向申请人说明理由。。第二十二条：大陆居民往来台湾的旅行证件系指大陆居民往来台湾通行证和其他有效旅行证件。。第三条：大陆居民前往台湾，凭公安机关出入境管理部门签发的旅行证件，从开放的或者指定的出入境口岸通行。。第六条：大陆居民前往台湾定居、探亲、访友、旅游、接受和处理财产、处理婚丧事宜或者参加经济、科技、文化、教育、体育、学术等活动，须向户口所在地的市、县公安局提出申请。。第二十五条：大陆居民往来台湾通行证实行逐次签注。签注分一次往返有效和多次往返有效。","大陆居民前往台湾旅游、探亲、定居、学习、访友、处理财产和婚丧事宜，或者参加经济、科技、文化、体育、学术等活动的，可以向公安机关出入境管理机构申请往来台湾通行证件和前往台湾签注。。学习：在教育部批准开放大陆学生赴台学习的省份参加本年度普通高校招生全国统一考试的高中毕业生，或在上述开放赴台就学省份且毕业于台湾主管部门承认学历的大陆高校的应届本科或硕士毕业生。。审批机构进行审核,作出批准或不予批准的决定.批准的,签发证件;不予批准的,审批机构向申请人出具《不予批准决定书》。。受理机构对符合申请条件,申请材料齐全且符合法定形式的,向申请人出具《受理申请回执单》；对申请材料不齐全或者不符合法定形式的，一次性告知申请人需要补正的全部内容；对不属于本部门职责范围或不符合受理要求的，不予受理，并向申请人说明理由。。第二十二条：大陆居民往来台湾的旅行证件系指大陆居民往来台湾通行证和其他有效旅行证件。。第三条：大陆居民前往台湾，凭公安机关出入境管理部门签发的旅行证件，从开放的或者指定的出入境口岸通行。。第六条：大陆居民前往台湾定居、探亲、访友、旅游、接受和处理财产、处理婚丧事宜或者参加经济、科技、文化、教育、体育、学术等活动，须向户口所在地的市、县公安局提出申请。。第二十五条：大陆居民往来台湾通行证实行逐次签注。签注分一次往返有效和多次往返有效。",其他,0.9295759076102984,False,否
58,黑龙江省,鸡西市,外国人对国家重点保护陆生野生动物进行野外考察或在野外拍摄电影录像审批,2024-07-14,https://www.zwfw.hlj.gov.cn/zhcx/bszn?syncItemId=83e21c30-9999-469b-9a0e-fd31075ca599&areaCode=230300000000,1.外国人（含自然人、法人） 2.因从事科研教学等工作需要，对我国重点保护野生动物进行野外考察或者野外拍摄电影、录像。。第四十三条 外国人在我国对国家重点保护野生动物进行野外考察或者在野外拍摄电影、录像，应当经省、自治区、直辖市人民政府野生动物保护主管部门或者其授权的单位批准，并遵守有关法律法规的规定。,1.外国人（含自然人、法人） 2.因从事科研教学等工作需要，对我国重点保护野生动物进行野外考察或者野外拍摄电影、录像。。第四十三条 外国人在我国对国家重点保护野生动物进行野外考察或者在野外拍摄电影、录像，应当经省、自治区、直辖市人民政府野生动物保护主管部门或者其授权的单位批准，并遵守有关法律法规的规定。,其他,0.7918242150073888,False,否
58,黑龙江省,鸡西市,提供政审考察服务,2024-07-14,https://www.zwfw.hlj.gov.cn/zhcx/bszn?syncItemId=53f0876a-c473-448d-9942-9d4c03df2d64&areaCode=230300000000,（一）人事档案委托黑龙江省内流动人员人事档案管理服务机构保管；（二）为相关单位提供入党、参军、录（聘）用、出国（境）等政审考察服务。,（一）人事档案委托黑龙江省内流动人员人事档案管理服务机构保管；（二）为相关单位提供入党、参军、录（聘）用、出国（境）等政审考察服务。,其他,0.8386820847448369,False,否
58,黑龙江省,鸡西市,市委党纪学习教育廉洁纪律专题研讨会议召开,2024-06-26,http://www.jixi.gov.cn/jixi/c100003/202406/c06_299932.shtml,会议强调，要带头学习遵守廉洁纪律，永葆清正廉洁政治本色。要深学悟透作表率，发挥领学促学作用。要严格遵守执行，时刻引以为鉴，决不能突破底线。要树立正确的权力观，坚持公正用权、依法用权、为民用权、廉洁用权，决不能以权谋私，确保惩恶扬善利剑永不蒙尘。。会议强调，要从严精准执纪，坚决维护纪律的刚性、严肃性。要坚决落实市委“十个务必从严”要求，以零容忍态度惩贪治腐，让干部知敬畏、存戒惧、守底线。要严惩严治享乐主义、奢靡之风，深入开展违规吃喝问题专项整治，严肃查处顶风违纪行为。要强化以案促改促治促教，用好典型案例，全面营造廉荣贪耻浓厚氛围。。会议强调，要扛起政治责任，推动党纪学习教育走深走实。要根据市委党纪学习教育工作方案，逐条逐项抓好落实。要强化监督推动，把开展党纪学习教育纳入政治监督、日常监督和派驻监督。要抓好纪检监察系统党纪学习教育，注重与全会重点任务落实、能力作风建设有机结合，强力调度推进，推动党纪学习教育取得扎实成效。。会上，部分县（市）区纪委书记、市直单位派驻纪检监察组组长、乡镇纪委书记、街道纪工委书记作交流发言。,会议强调，要带头学习遵守廉洁纪律，永葆清正廉洁政治本色。要深学悟透作表率，发挥领学促学作用。要严格遵守执行，时刻引以为鉴，决不能突破底线。要树立正确的权力观，坚持公正用权、依法用权、为民用权、廉洁用权，决不能以权谋私，确保惩恶扬善利剑永不蒙尘。。会议强调，要从严精准执纪，坚决维护纪律的刚性、严肃性。要坚决落实市委“十个务必从严”要求，以零容忍态度惩贪治腐，让干部知敬畏、存戒惧、守底线。要严惩严治享乐主义、奢靡之风，深入开展违规吃喝问题专项整治，严肃查处顶风违纪行为。要强化以案促改促治促教，用好典型案例，全面营造廉荣贪耻浓厚氛围。。会议强调，要扛起政治责任，推动党纪学习教育走深走实。要根据市委党纪学习教育工作方案，逐条逐项抓好落实。要强化监督推动，把开展党纪学习教育纳入政治监督、日常监督和派驻监督。要抓好纪检监察系统党纪学习教育，注重与全会重点任务落实、能力作风建设有机结合，强力调度推进，推动党纪学习教育取得扎实成效。。会上，部分县（市）区纪委书记、市直单位派驻纪检监察组组长、乡镇纪委书记、街道纪工委书记作交流发言。,其他,0.7176065824012886,False,否
58,黑龙江省,鸡西市,鸡西市自然资源和规划局召开学习贯彻中华人民共和国保守国家秘密法主题宣讲会,2024-06-26,http://www.jixi.gov.cn/jixi/c100004/202406/c06_299934.shtml,"为深入学习贯彻学习习近平总书记关于保密工作重要指示批示精神,增强保密意识、筑牢安全防线,近日,鸡西市自然资源和规划局举办保密工作宣讲活动,邀请鸡西市委党校教务处主任、市青年讲师团优秀讲师杨浚枢解读新修订的《中华人民共和国保守国家秘密法》(以下简称《保密法》)。分管局领导、各分局负责人及保密工作人员、机关各科室(事业单位)负责人、局专职保密员以及近三年新考录年轻干部参加了本次主题宣讲会。。杨浚枢主任就《保密法》的修订背景、精神实质和重点内容等作了全面系统的解读。授课内容政治站位高,涵盖范围广,实用性、操作性强,让参会干部职工对保密工作有了更深刻的理解,对保密技能有了更全面的掌握。。宣讲活动结束后,参会干部职工纷纷表示,要深入系统学习《保密法》的各项内容,把保密工作各项要求落实到具体行动中,进一步增强保密工作的责任感和紧迫感,遵守各项保密制度,推动自然资源战线保密工作再上新台阶。","为深入学习贯彻学习习近平总书记关于保密工作重要指示批示精神,增强保密意识、筑牢安全防线,近日,鸡西市自然资源和规划局举办保密工作宣讲活动,邀请鸡西市委党校教务处主任、市青年讲师团优秀讲师杨浚枢解读新修订的《中华人民共和国保守国家秘密法》(以下简称《保密法》)。分管局领导、各分局负责人及保密工作人员、机关各科室(事业单位)负责人、局专职保密员以及近三年新考录年轻干部参加了本次主题宣讲会。。杨浚枢主任就《保密法》的修订背景、精神实质和重点内容等作了全面系统的解读。授课内容政治站位高,涵盖范围广,实用性、操作性强,让参会干部职工对保密工作有了更深刻的理解,对保密技能有了更全面的掌握。。宣讲活动结束后,参会干部职工纷纷表示,要深入系统学习《保密法》的各项内容,把保密工作各项要求落实到具体行动中,进一步增强保密工作的责任感和紧迫感,遵守各项保密制度,推动自然资源战线保密工作再上新台阶。",其他,0.8304212296125112,False,否
58,黑龙江省,鸡西市,鸡西市举办全市两级理论学习中心组集体学习暨鸡西大讲堂年第六场报告会张行斌参加,2024-06-25,http://www.jixi.gov.cn/jixi/c100003/202406/c06_299892.shtml,鸡西市举办全市两级理论学习中心组集体学习暨“鸡西大讲堂”2024年第六场报告会 张行斌参加。6月24日上午，我市举办全市两级理论学习中心组集体学习暨“鸡西大讲堂”2024年第六场报告会（解放思想大讲堂），邀请中国安全生产科学研究院原院长、研究员、博士生导师刘铁民，为全市两级理论学习中心组成员作专题辅导报告。。张行斌、苑芳江、高启民、王清源、李福胜、王景章、谢喆、高运禄等市委理论学习中心组成员参加报告会。战明秀主持报告会。。刘铁民，中国安全生产科学研究院原院长，研究员，博士生导师。长期从事安全生产科技工作，负责完成了安全科技领域国家七五、八五、九五和十五科技攻关和国际合作项目多项，参与国家组织的安全科技发展战略和重大项目规划制定，是国务院应急专家组成员和国家安全生产专家组成员。承担国家“十五”科技攻关和国家自然科学基金资助等重大项目。。报告会采取视频的形式召开。报告会上，刘铁民以《重大事故灾难风险治理与应急准备》为主题，围绕重大事故灾难是当前安全工作的主要风险；系统脆弱性是导致事故灾难最本质的原因；传统安全管理向现代风险治理重大转变；以应急准备为核心的应急管理新概念、新思想和新战略等4个方面，对如何抓好安全生产和应急管理工作进行了全面系统的阐释和深入浅出的解读。报告既有理论高度，又有实践深度，对于我市各级干部提升应急管理能力、抓好安全工作具有十分重要的理论和现实意义。。报告会上，还开展了解放思想大讲堂“一把手上讲台”活动，恒山区和市应急管理局负责同志，聚焦深入学习习近平总书记关于安全生产和应急管理的重要论述，依次进行授课式分享，结合工作实际，畅谈了学习体会、分享了感悟认识、提出了实现路径。。报告会在各县（市）区设分会场，市四个班子副秘书长以上领导，部分县（市）区党委主要负责同志，市委各部委办、市直各单位主要负责同志在主会场参加报告会。,鸡西市举办全市两级理论学习中心组集体学习暨“鸡西大讲堂”2024年第六场报告会 张行斌参加。6月24日上午，我市举办全市两级理论学习中心组集体学习暨“鸡西大讲堂”2024年第六场报告会（解放思想大讲堂），邀请中国安全生产科学研究院原院长、研究员、博士生导师刘铁民，为全市两级理论学习中心组成员作专题辅导报告。。张行斌、苑芳江、高启民、王清源、李福胜、王景章、谢喆、高运禄等市委理论学习中心组成员参加报告会。战明秀主持报告会。。刘铁民，中国安全生产科学研究院原院长，研究员，博士生导师。长期从事安全生产科技工作，负责完成了安全科技领域国家七五、八五、九五和十五科技攻关和国际合作项目多项，参与国家组织的安全科技发展战略和重大项目规划制定，是国务院应急专家组成员和国家安全生产专家组成员。承担国家“十五”科技攻关和国家自然科学基金资助等重大项目。。报告会采取视频的形式召开。报告会上，刘铁民以《重大事故灾难风险治理与应急准备》为主题，围绕重大事故灾难是当前安全工作的主要风险；系统脆弱性是导致事故灾难最本质的原因；传统安全管理向现代风险治理重大转变；以应急准备为核心的应急管理新概念、新思想和新战略等4个方面，对如何抓好安全生产和应急管理工作进行了全面系统的阐释和深入浅出的解读。报告既有理论高度，又有实践深度，对于我市各级干部提升应急管理能力、抓好安全工作具有十分重要的理论和现实意义。。报告会上，还开展了解放思想大讲堂“一把手上讲台”活动，恒山区和市应急管理局负责同志，聚焦深入学习习近平总书记关于安全生产和应急管理的重要论述，依次进行授课式分享，结合工作实际，畅谈了学习体会、分享了感悟认识、提出了实现路径。。报告会在各县（市）区设分会场，市四个班子副秘书长以上领导，部分县（市）区党委主要负责同志，市委各部委办、市直各单位主要负责同志在主会场参加报告会。,其他,0.6910372109731183,False,否
58,黑龙江省,鸡西市,习近平在青海考察时强调持续推进青藏高原生态保护和高质量发展奋力谱写中国式现代化青海篇章,2024-06-21,http://www.jixi.gov.cn/jixi/c100003/202406/c06_299574.shtml,习近平在青海考察时强调 持续推进青藏高原生态保护和高质量发展 奋力谱写中国式现代化青海篇章。新华社西宁6月20日电 中共中央总书记、国家主席、中央军委主席习近平近日在青海考察时强调，青海要认真贯彻党中央决策部署，完整准确全面贯彻新发展理念，牢牢把握青海在全国发展大局中的战略定位，充分发挥自身优势，坚持深化改革、扩大开放，坚持生态优先、绿色发展，坚持民族团结、共同富裕，在推进青藏高原生态保护和高质量发展上取得更大进展，奋力谱写中国式现代化青海篇章。。6月18日至19日，习近平在青海省委书记陈刚和省长吴晓军陪同下，深入西宁市的学校、宗教场所等进行调研。。6月18日至19日，中共中央总书记、国家主席、中央军委主席习近平在青海考察。这是18日下午，习近平在果洛西宁民族中学食堂察看学生就餐条件。 新华社记者 谢环驰 摄。18日下午，习近平首先来到果洛西宁民族中学考察。这是一所隶属于果洛藏族自治州的寄宿制中学，由上海市投资援建。习近平听取上海等东部地区援助青海教育工作和学校建设情况介绍，详细询问学生构成、课程设置、体育锻炼、普通话水平等情况，走进食堂、宿舍楼察看学生就餐和住宿条件，嘱咐食堂工作人员一定要确保学生饮食安全、营养可口。之后，他来到高一（1）班教室，观摩“新时代、新家乡”主题思政课。了解到学校将思政课内容融入日常教学，听了孩子们讲述新时代家乡的可喜变化，看了孩子们的画作，习近平十分高兴。他说，包括教育在内的东西部协作和对口支援取得显著成效，充分彰显了中国共产党领导和中国特色社会主义制度的优势，充分体现了中华民族大家庭的温暖。要把铸牢中华民族共同体意识作为学校思政课的一个重点，讲好中国共产党和中国特色社会主义的故事，讲好新时代以中国式现代化全面推进强国建设、民族复兴伟业的故事，讲好中华民族共同体和民族团结进步的故事，把中华民族共同体意识从小就植入孩子们的心灵。。教学楼前广场上，师生们纷纷围拢过来，高声向总书记问好。习近平亲切地对大家说，我到西宁第一站就来看望老师和同学们。上海援建的这所中学，培养来自果洛牧区的各民族孩子，成效明显，意义深远。希望孩子们倍加珍惜这里的良好条件，心怀感恩、好好学习，德智体美劳全面发展，立志成为中国特色社会主义事业的接班人和建设者，努力为自己赢得人生出彩的机会。他祝孩子们学有所成、健康成长。。随后，习近平来到位于西宁市城中区的宏觉寺。在寺前院落，宏觉寺民主管理委员会负责人向总书记敬献哈达，僧人提香炉、持宝伞迎接总书记。习近平参观青海省民族团结进步教育基地展陈等，了解寺庙历史沿革、老一辈革命家关心推动民族工作和宗教工作的情况。他走进大殿，听取寺庙加强日常管理、促进民族团结进步等情况介绍。习近平指出，宏觉寺这座千年古刹，在增进历代中央政府与藏传佛教联系方面发挥了重要的桥梁纽带作用。要保护好这份珍贵的历史文化遗产，为铸牢中华民族共同体意识、促进民族团结进步作出新贡献。要向老一辈革命家学习，把新时代党的统战工作、民族工作、宗教工作做得更好。习近平强调，以中国式现代化全面推进强国建设、民族复兴伟业，需要全国各族人民包括广大信教群众团结奋斗。希望青海藏传佛教界弘扬爱国爱教优良传统，促进宗教和顺、社会和谐、民族和睦，在中国式现代化进程中发挥积极作用。。19日上午，习近平听取青海省委和省政府工作汇报，对青海各项工作取得的成绩给予肯定。,习近平在青海考察时强调 持续推进青藏高原生态保护和高质量发展 奋力谱写中国式现代化青海篇章。新华社西宁6月20日电 中共中央总书记、国家主席、中央军委主席习近平近日在青海考察时强调，青海要认真贯彻党中央决策部署，完整准确全面贯彻新发展理念，牢牢把握青海在全国发展大局中的战略定位，充分发挥自身优势，坚持深化改革、扩大开放，坚持生态优先、绿色发展，坚持民族团结、共同富裕，在推进青藏高原生态保护和高质量发展上取得更大进展，奋力谱写中国式现代化青海篇章。。6月18日至19日，习近平在青海省委书记陈刚和省长吴晓军陪同下，深入西宁市的学校、宗教场所等进行调研。。6月18日至19日，中共中央总书记、国家主席、中央军委主席习近平在青海考察。这是18日下午，习近平在果洛西宁民族中学食堂察看学生就餐条件。 新华社记者 谢环驰 摄。18日下午，习近平首先来到果洛西宁民族中学考察。这是一所隶属于果洛藏族自治州的寄宿制中学，由上海市投资援建。习近平听取上海等东部地区援助青海教育工作和学校建设情况介绍，详细询问学生构成、课程设置、体育锻炼、普通话水平等情况，走进食堂、宿舍楼察看学生就餐和住宿条件，嘱咐食堂工作人员一定要确保学生饮食安全、营养可口。之后，他来到高一（1）班教室，观摩“新时代、新家乡”主题思政课。了解到学校将思政课内容融入日常教学，听了孩子们讲述新时代家乡的可喜变化，看了孩子们的画作，习近平十分高兴。他说，包括教育在内的东西部协作和对口支援取得显著成效，充分彰显了中国共产党领导和中国特色社会主义制度的优势，充分体现了中华民族大家庭的温暖。要把铸牢中华民族共同体意识作为学校思政课的一个重点，讲好中国共产党和中国特色社会主义的故事，讲好新时代以中国式现代化全面推进强国建设、民族复兴伟业的故事，讲好中华民族共同体和民族团结进步的故事，把中华民族共同体意识从小就植入孩子们的心灵。。教学楼前广场上，师生们纷纷围拢过来，高声向总书记问好。习近平亲切地对大家说，我到西宁第一站就来看望老师和同学们。上海援建的这所中学，培养来自果洛牧区的各民族孩子，成效明显，意义深远。希望孩子们倍加珍惜这里的良好条件，心怀感恩、好好学习，德智体美劳全面发展，立志成为中国特色社会主义事业的接班人和建设者，努力为自己赢得人生出彩的机会。他祝孩子们学有所成、健康成长。。随后，习近平来到位于西宁市城中区的宏觉寺。在寺前院落，宏觉寺民主管理委员会负责人向总书记敬献哈达，僧人提香炉、持宝伞迎接总书记。习近平参观青海省民族团结进步教育基地展陈等，了解寺庙历史沿革、老一辈革命家关心推动民族工作和宗教工作的情况。他走进大殿，听取寺庙加强日常管理、促进民族团结进步等情况介绍。习近平指出，宏觉寺这座千年古刹，在增进历代中央政府与藏传佛教联系方面发挥了重要的桥梁纽带作用。要保护好这份珍贵的历史文化遗产，为铸牢中华民族共同体意识、促进民族团结进步作出新贡献。要向老一辈革命家学习，把新时代党的统战工作、民族工作、宗教工作做得更好。习近平强调，以中国式现代化全面推进强国建设、民族复兴伟业，需要全国各族人民包括广大信教群众团结奋斗。希望青海藏传佛教界弘扬爱国爱教优良传统，促进宗教和顺、社会和谐、民族和睦，在中国式现代化进程中发挥积极作用。。19日上午，习近平听取青海省委和省政府工作汇报，对青海各项工作取得的成绩给予肯定。,政府领导到其他城市考察学习或访问,0.0,False,否
