code,province,city,topic,date,url,content,content.1,label,score,is_match,是否为“学习考察”新闻
129,山东省,济南市,济南市党政代表团到西藏白朗县考察调研对口支援工作,2023-07-14,http://www.jinan.gov.cn/art/2023/7/14/art_96449_4954250.html,7月11日至12日，市委书记刘强率济南市党政代表团到西藏自治区日喀则市白朗县，深入贯彻习近平总书记关于西藏工作的重要指示精神和新时代党的治藏方略，学习感悟“老西藏精神”，落实鲁藏两省区工作座谈会部署，考察调研对口支援工作，推动对口支援工作进一步走深走实。西藏自治区政府副主席、日喀则市委书记斯朗尼玛参加活动。。在西藏期间，刘强拜访了西藏自治区党委主要负责同志，汇报了济南市贯彻落实习近平总书记关于西藏工作的重要指示精神，扎实开展对口支援工作情况以及下一步工作打算。。在日喀则市白朗县巴扎乡彭仓村，刘强走进村史馆、蔬菜大棚，详细了解彭仓村发展历程、果蔬产业发展、乡村振兴援藏项目建设等情况。在珠峰现代农业科技创新博览园，刘强察看了玻璃温室、蔬菜大棚建设运营情况，听取了济南市对口支援工作开展情况的汇报。在白朗县退役军人事务局，刘强详细了解济南市帮扶白朗县退役军人事务局解决基础设施问题及双拥共建工作开展等情况，参加援助资金捐赠仪式。在济南援藏公寓，刘强看望慰问了援藏干部人才，并走进餐厅、宿舍等处，详细了解援藏干部人才生活情况，向大家表示问候和感谢，希望大家勇于奉献、团结担当，忠实履行职责使命，在对口支援工作中作出更大贡献。。刘强指出，对口支援白朗县是党中央和山东省委交给济南市的重大政治任务，做好对口支援工作是济南的分内之事、应尽之责。对口支援工作启动以来，济南市始终把白朗县的事当作自己的事，双方携手在促进发展、保障民生、增进交流等方面做了大量工作。新起点上，济南市将坚决贯彻落实习近平总书记在中央第七次西藏工作座谈会上的重要讲话精神和在西藏考察时的重要指示要求，全面贯彻新时代党的治藏方略，认真落实好鲁藏两省区工作座谈会部署，把白朗县的需求作为努力方向和工作重点，用心用情用力做好对口支援工作，以实际行动坚定拥护“两个确立”、坚决做到“两个维护”。济南市各级各部门要进一步提高政治站位，切实增强使命感、责任感，落实好省区各项工作部署，进一步抓紧抓实、优化完善重点工作，不断深化拓宽合作领域，高质量做好对口支援各项工作。要支持白朗县培育壮大特色产业，在果蔬、育种、畜牧等领域进一步加强合作。要扎实推进乡村振兴，着重做好产业振兴、组织振兴，推动基层党组织结对帮扶与协作交流。要深入推进医疗教育帮扶，加强医疗教育人才跟班培训、线上培训，深化“组团式”援藏。要积极推进劳务合作，提供便利、精准的就业服务。要深化拓展合作领域，加强人文交流、文旅合作等，实现优势互补、共同发展。要加强援藏队伍建设，不断提升工作质效，关心援藏队员的身心健康和工作生活。援藏干部和专技人才要切实发扬好“老西藏精神”，在工作中展现出济南干部良好的精神风貌和务实的工作作风，努力在“第二故乡”建功立业、书写精彩。济南市委、市政府将为援藏干部人才全身心投入工作创造良好条件。,7月11日至12日，市委书记刘强率济南市党政代表团到西藏自治区日喀则市白朗县，深入贯彻习近平总书记关于西藏工作的重要指示精神和新时代党的治藏方略，学习感悟“老西藏精神”，落实鲁藏两省区工作座谈会部署，考察调研对口支援工作，推动对口支援工作进一步走深走实。西藏自治区政府副主席、日喀则市委书记斯朗尼玛参加活动。。在西藏期间，刘强拜访了西藏自治区党委主要负责同志，汇报了济南市贯彻落实习近平总书记关于西藏工作的重要指示精神，扎实开展对口支援工作情况以及下一步工作打算。。在日喀则市白朗县巴扎乡彭仓村，刘强走进村史馆、蔬菜大棚，详细了解彭仓村发展历程、果蔬产业发展、乡村振兴援藏项目建设等情况。在珠峰现代农业科技创新博览园，刘强察看了玻璃温室、蔬菜大棚建设运营情况，听取了济南市对口支援工作开展情况的汇报。在白朗县退役军人事务局，刘强详细了解济南市帮扶白朗县退役军人事务局解决基础设施问题及双拥共建工作开展等情况，参加援助资金捐赠仪式。在济南援藏公寓，刘强看望慰问了援藏干部人才，并走进餐厅、宿舍等处，详细了解援藏干部人才生活情况，向大家表示问候和感谢，希望大家勇于奉献、团结担当，忠实履行职责使命，在对口支援工作中作出更大贡献。。刘强指出，对口支援白朗县是党中央和山东省委交给济南市的重大政治任务，做好对口支援工作是济南的分内之事、应尽之责。对口支援工作启动以来，济南市始终把白朗县的事当作自己的事，双方携手在促进发展、保障民生、增进交流等方面做了大量工作。新起点上，济南市将坚决贯彻落实习近平总书记在中央第七次西藏工作座谈会上的重要讲话精神和在西藏考察时的重要指示要求，全面贯彻新时代党的治藏方略，认真落实好鲁藏两省区工作座谈会部署，把白朗县的需求作为努力方向和工作重点，用心用情用力做好对口支援工作，以实际行动坚定拥护“两个确立”、坚决做到“两个维护”。济南市各级各部门要进一步提高政治站位，切实增强使命感、责任感，落实好省区各项工作部署，进一步抓紧抓实、优化完善重点工作，不断深化拓宽合作领域，高质量做好对口支援各项工作。要支持白朗县培育壮大特色产业，在果蔬、育种、畜牧等领域进一步加强合作。要扎实推进乡村振兴，着重做好产业振兴、组织振兴，推动基层党组织结对帮扶与协作交流。要深入推进医疗教育帮扶，加强医疗教育人才跟班培训、线上培训，深化“组团式”援藏。要积极推进劳务合作，提供便利、精准的就业服务。要深化拓展合作领域，加强人文交流、文旅合作等，实现优势互补、共同发展。要加强援藏队伍建设，不断提升工作质效，关心援藏队员的身心健康和工作生活。援藏干部和专技人才要切实发扬好“老西藏精神”，在工作中展现出济南干部良好的精神风貌和务实的工作作风，努力在“第二故乡”建功立业、书写精彩。济南市委、市政府将为援藏干部人才全身心投入工作创造良好条件。,政府领导到其他城市考察学习或访问,0.0,True,是
129,山东省,济南市,市委常委会召开会议,2023-06-06,http://www.jinan.gov.cn/art/2023/6/6/art_1861_4951569.html,6月5日，市委常委会召开会议，学习贯彻习近平总书记在中央政治局第五次集体学习时的重要讲话精神和二十届中央国家安全委员会第一次会议、二十届中央审计委员会第一次会议精神，学习贯彻习近平总书记在文化传承发展座谈会上、在北京育英学校考察时的重要讲话精神以及习近平总书记近期有关重要回信、贺信精神，研究贯彻落实意见；研究主题教育、夏季高考和初中学业水平考试等工作。。会议指出，习近平总书记的重要讲话和重要回信贺信站位高远、内涵丰富，我们要结合济南实际，抓好贯彻落实。要全面落实加快建设教育强国的部署要求，加强学校思政教育，推进教育均衡发展，做好中高考准备工作。要提高审计监督服务保障能力，抓好审计问题整改，提升审计干部队伍专业能力水平，推动我市审计工作高质量发展。要坚持底线思维和极限思维，持续增强维护国家安全的能力，更好统筹发展和安全。要扎实推进文化“两创”，推动济南文化事业文化产业发展。会议学习了《领导干部报告个人有关事项规定》，强调各级各部门要认真履行全面从严治党主体责任，切实抓好《规定》贯彻执行，坚决维护报告制度的严肃性和权威性。。会议听取了关于全市主题教育开展情况和下步工作安排的汇报，强调要完善提醒机制，严明纪律要求，深入开展专项整治，确保主题教育取得扎实成效。。会议听取了关于2023年夏季高考和初中学业水平考试准备情况的汇报，强调各级各部门要以极端负责的精神精心安排部署，确保“两考”安全平稳顺利进行。,6月5日，市委常委会召开会议，学习贯彻习近平总书记在中央政治局第五次集体学习时的重要讲话精神和二十届中央国家安全委员会第一次会议、二十届中央审计委员会第一次会议精神，学习贯彻习近平总书记在文化传承发展座谈会上、在北京育英学校考察时的重要讲话精神以及习近平总书记近期有关重要回信、贺信精神，研究贯彻落实意见；研究主题教育、夏季高考和初中学业水平考试等工作。。会议指出，习近平总书记的重要讲话和重要回信贺信站位高远、内涵丰富，我们要结合济南实际，抓好贯彻落实。要全面落实加快建设教育强国的部署要求，加强学校思政教育，推进教育均衡发展，做好中高考准备工作。要提高审计监督服务保障能力，抓好审计问题整改，提升审计干部队伍专业能力水平，推动我市审计工作高质量发展。要坚持底线思维和极限思维，持续增强维护国家安全的能力，更好统筹发展和安全。要扎实推进文化“两创”，推动济南文化事业文化产业发展。会议学习了《领导干部报告个人有关事项规定》，强调各级各部门要认真履行全面从严治党主体责任，切实抓好《规定》贯彻执行，坚决维护报告制度的严肃性和权威性。。会议听取了关于全市主题教育开展情况和下步工作安排的汇报，强调要完善提醒机制，严明纪律要求，深入开展专项整治，确保主题教育取得扎实成效。。会议听取了关于2023年夏季高考和初中学业水平考试准备情况的汇报，强调各级各部门要以极端负责的精神精心安排部署，确保“两考”安全平稳顺利进行。,其他,0.7386715595935841,False,否
129,山东省,济南市,市政府研究室赴杭州市学习考察数字社区建设工作,2023-06-13,http://www.jinan.gov.cn/art/2023/6/13/art_73714_4952065.html,按照市政府研究室主题教育安排，6月7日至9日，市政府研究室党组成员、副主任徐龙义带领市政府研究室、山东大学组成的联合调研组赴杭州市，学习考察数字社区建设工作。。调研组一行首先来到杭州市上城区杨柳郡未来社区，实地参观了杨柳郡社区邻里生活服务中心、智慧健康站、党群服务中心等数字社会应用场景，学习了社区融合“交通+商业+住宅+公园”的创新模式、“5-10-15”分钟生活圈、“156+X”第三空间体系等未来社区建设的经验做法。。在杭州市上城区红梅社区，调研组实地参观了红梅社区未来邻里中心。该中心集社区服务、老年康养、商业便民、文化活动于一体，同步推进提升社区党建、共建融合、数字治理体系建设，着力构建“远亲不如近邻”的未来邻里场景。。随后，调研组与杭州市政府研究室、滨江区政府办公室、滨江区综合执法局、滨江区住建局、滨江区社会治理中心等单位，就推进数字社区建设工作进行座谈交流，围绕推进机制、资源力量、考核评价、居民参与等方面进行了深入交流研讨。下一步，市政府研究室将进一步聚焦居民需求，深入研究数字社区建设实施路径，切实将主题教育学习成果转化为提升基层治理水平和促进高质量发展的实际成效。,按照市政府研究室主题教育安排，6月7日至9日，市政府研究室党组成员、副主任徐龙义带领市政府研究室、山东大学组成的联合调研组赴杭州市，学习考察数字社区建设工作。。调研组一行首先来到杭州市上城区杨柳郡未来社区，实地参观了杨柳郡社区邻里生活服务中心、智慧健康站、党群服务中心等数字社会应用场景，学习了社区融合“交通+商业+住宅+公园”的创新模式、“5-10-15”分钟生活圈、“156+X”第三空间体系等未来社区建设的经验做法。。在杭州市上城区红梅社区，调研组实地参观了红梅社区未来邻里中心。该中心集社区服务、老年康养、商业便民、文化活动于一体，同步推进提升社区党建、共建融合、数字治理体系建设，着力构建“远亲不如近邻”的未来邻里场景。。随后，调研组与杭州市政府研究室、滨江区政府办公室、滨江区综合执法局、滨江区住建局、滨江区社会治理中心等单位，就推进数字社区建设工作进行座谈交流，围绕推进机制、资源力量、考核评价、居民参与等方面进行了深入交流研讨。下一步，市政府研究室将进一步聚焦居民需求，深入研究数字社区建设实施路径，切实将主题教育学习成果转化为提升基层治理水平和促进高质量发展的实际成效。,政府领导到其他城市考察学习或访问,0.550555317498719,False,否
129,山东省,济南市,市供销社党组书记理事会主任黄波到山东供销资本投资集团有限公司学习考察,2023-06-08,http://www.jinan.gov.cn/art/2023/6/8/art_4115_4951772.html,6月6日下午，济南市供销社党组书记、理事会主任黄波带队一行，到山东供销资本投资（集团）有限公司考察学习社有企业改革和资本运营平台组建、合作发展基金运作等情况，对接参与、跟进、服务“山东供销智能仓配和应急保障（济南）基地”项目情况。市供销社党组成员、理事会副主任齐玉鹏和市供销社有关处室负责同志参加学习考察。省供销社二级巡视员、山东供销资本投资（集团）有限公司党委书记、董事长吴俊英陪同参加考察座谈。。考察组在山东供销资本投资（集团）有限公司会议室举办座谈会，听取了山东供销资本投资（集团）有限公司的组织架构、制度建设、管理运营及发展规划等工作情况，听取了“山东供销智能仓配和应急保障（济南）基地”项目前期筹建、规划设计、运作模式等相关情况，并分别就资本运营平台筹建中遇到的问题和困难、参与“山东供销智能仓配和应急保障（济南）基地”项目建设等，与公司负责同志进行了深入交流探讨。。此次学习考察既开阔了眼界，又学到了解决问题推动工作的真答案、好办法，进一步坚定了抢抓机遇，加快发展的信心和决心。下一步，济南市供销社将进一步统一思想认识，强化制度建设，凝聚工作合力，理顺社企关系，强化顶层设计，通过机制改革、资源整合、制度建设等方式，优化社有资本布局，加快形成社有资产整合发展的格局，不断提升为农服务综合能力，持续推动在乡村振兴中发挥更大作用，为加快建设“强新优富美高”新时代现代化强省会和打造乡村振兴齐鲁样板省会标杆作出供销贡献。,6月6日下午，济南市供销社党组书记、理事会主任黄波带队一行，到山东供销资本投资（集团）有限公司考察学习社有企业改革和资本运营平台组建、合作发展基金运作等情况，对接参与、跟进、服务“山东供销智能仓配和应急保障（济南）基地”项目情况。市供销社党组成员、理事会副主任齐玉鹏和市供销社有关处室负责同志参加学习考察。省供销社二级巡视员、山东供销资本投资（集团）有限公司党委书记、董事长吴俊英陪同参加考察座谈。。考察组在山东供销资本投资（集团）有限公司会议室举办座谈会，听取了山东供销资本投资（集团）有限公司的组织架构、制度建设、管理运营及发展规划等工作情况，听取了“山东供销智能仓配和应急保障（济南）基地”项目前期筹建、规划设计、运作模式等相关情况，并分别就资本运营平台筹建中遇到的问题和困难、参与“山东供销智能仓配和应急保障（济南）基地”项目建设等，与公司负责同志进行了深入交流探讨。。此次学习考察既开阔了眼界，又学到了解决问题推动工作的真答案、好办法，进一步坚定了抢抓机遇，加快发展的信心和决心。下一步，济南市供销社将进一步统一思想认识，强化制度建设，凝聚工作合力，理顺社企关系，强化顶层设计，通过机制改革、资源整合、制度建设等方式，优化社有资本布局，加快形成社有资产整合发展的格局，不断提升为农服务综合能力，持续推动在乡村振兴中发挥更大作用，为加快建设“强新优富美高”新时代现代化强省会和打造乡村振兴齐鲁样板省会标杆作出供销贡献。,其他,0.5273916270159444,False,否
129,山东省,济南市,专家解读济南市数字人民币试点工作实施方案,2023-06-07,http://www.jinan.gov.cn/art/2023/6/7/art_2607_4958387.html,曹廷求，男，管理学博士，“泰山学者”特聘教授，教育部“新世纪优秀人才支持计划”入选者，国家社科基金重大招标项目首席专家，山东省政协港澳台侨和外事委员会特聘专家，山东省人大常委会预算审查监督专家咨询委员会成员。现为山东大学银行治理研究中心主任、教授、博士生导师。。山东大学银行治理研究中心主任曹廷求表示，济南市坚持以习近平新时代中国特色社会主义思想为指导，认真贯彻落实党的二十大精神，统筹发展和安全，实现高质量发展和高水平安全的良性互动。坚持顶层设计、系统谋划、形成合力，落实数字中国建设整体布局规划与数字济南建设目标任务，全市数字化转型步伐不断加快，支持高质量发展的动力不断增强。。曹廷求：济南是山东省省会，既是全省的政治、经济、科教、文化、金融中心，也是黄河流域中心城市，开展数字人民币试点，具有良好的优势条件。。2021年11月25日，中国人民银行等八部委联合印发了《山东省济南市建设科创金融改革试验区总体方案》，济南正式获批建设全国首个科创金融改革试验区，数字人民币试点正是在科创金融改革试验区建设的大框架下，服务于重大战略，通过金融支持推动各项改革创新举措不断涌现。济南市高度重视金融科技的发展，今年3月份印发了《关于加快推进金融科技发展的实施意见》，重点任务包括完善金融科技基础设施建设，加快数字人民币配套设施建设，全面引导金融科技企业落实央行数字人民币试点要求，以深化试点促进技术创新，积极推动驻济金融机构、商户、企业完成数字人民币系统改造，加强创新场景应用开发。7月26日，市政府召开新闻发布会，对《济南市建设科创金融改革试验区加快现代金融产业发展若干扶持政策》进行发布，并针对社会各界关心的问题作出解答。这些政策的出台体现了济南市推进金融改革发展事业，推进创新试点的态度和决心。。济南市作为山东数字强省建设的龙头城市，率先提出打造数字先锋城市。在产业基础方面，数字经济核心产业占比达17%以上、数字经济占GDP比重达到47%，在2022年数字经济排行榜上，位居全国第六位。济南市齐鲁软件园为我国最早成立的“四大软件园”之一，目前已经是山东省首批数字经济园区和省内唯一国家新型工业化产业示范基地，形成了大数据、集成电路、人工智能等主导产业，涌现出浪潮、金现代、华天软件、神思电子等数字经济领域的龙头企业。此外，位于市中区的山东数字经济产业园正加快发展，章丘区龙山数字经济产业园等园区载体建设提速加力，济南市数字产业的雄厚优势正逐步显现。。积极引导各类金融机构推出科创专项信贷产品，鼓励支持科技创新类企业发展。相继推出了“人才贷”等人才金融品牌，启动高层次人才创业保险试点，发挥保险对创业活动的支持保障作用。组织开展“金融创新”项目评选，鼓励各金融机构推动产品和服务的创新，以创新型金融服务支持产业数字化、数字产业化转型，助力地区经济社会高质量发展。推行“金融辅导员+科技辅导员”服务模式，精准对接科技型企业融资服务需求，助力新型试点工作在济南的落地推进。,曹廷求，男，管理学博士，“泰山学者”特聘教授，教育部“新世纪优秀人才支持计划”入选者，国家社科基金重大招标项目首席专家，山东省政协港澳台侨和外事委员会特聘专家，山东省人大常委会预算审查监督专家咨询委员会成员。现为山东大学银行治理研究中心主任、教授、博士生导师。。山东大学银行治理研究中心主任曹廷求表示，济南市坚持以习近平新时代中国特色社会主义思想为指导，认真贯彻落实党的二十大精神，统筹发展和安全，实现高质量发展和高水平安全的良性互动。坚持顶层设计、系统谋划、形成合力，落实数字中国建设整体布局规划与数字济南建设目标任务，全市数字化转型步伐不断加快，支持高质量发展的动力不断增强。。曹廷求：济南是山东省省会，既是全省的政治、经济、科教、文化、金融中心，也是黄河流域中心城市，开展数字人民币试点，具有良好的优势条件。。2021年11月25日，中国人民银行等八部委联合印发了《山东省济南市建设科创金融改革试验区总体方案》，济南正式获批建设全国首个科创金融改革试验区，数字人民币试点正是在科创金融改革试验区建设的大框架下，服务于重大战略，通过金融支持推动各项改革创新举措不断涌现。济南市高度重视金融科技的发展，今年3月份印发了《关于加快推进金融科技发展的实施意见》，重点任务包括完善金融科技基础设施建设，加快数字人民币配套设施建设，全面引导金融科技企业落实央行数字人民币试点要求，以深化试点促进技术创新，积极推动驻济金融机构、商户、企业完成数字人民币系统改造，加强创新场景应用开发。7月26日，市政府召开新闻发布会，对《济南市建设科创金融改革试验区加快现代金融产业发展若干扶持政策》进行发布，并针对社会各界关心的问题作出解答。这些政策的出台体现了济南市推进金融改革发展事业，推进创新试点的态度和决心。。济南市作为山东数字强省建设的龙头城市，率先提出打造数字先锋城市。在产业基础方面，数字经济核心产业占比达17%以上、数字经济占GDP比重达到47%，在2022年数字经济排行榜上，位居全国第六位。济南市齐鲁软件园为我国最早成立的“四大软件园”之一，目前已经是山东省首批数字经济园区和省内唯一国家新型工业化产业示范基地，形成了大数据、集成电路、人工智能等主导产业，涌现出浪潮、金现代、华天软件、神思电子等数字经济领域的龙头企业。此外，位于市中区的山东数字经济产业园正加快发展，章丘区龙山数字经济产业园等园区载体建设提速加力，济南市数字产业的雄厚优势正逐步显现。。积极引导各类金融机构推出科创专项信贷产品，鼓励支持科技创新类企业发展。相继推出了“人才贷”等人才金融品牌，启动高层次人才创业保险试点，发挥保险对创业活动的支持保障作用。组织开展“金融创新”项目评选，鼓励各金融机构推动产品和服务的创新，以创新型金融服务支持产业数字化、数字产业化转型，助力地区经济社会高质量发展。推行“金融辅导员+科技辅导员”服务模式，精准对接科技型企业融资服务需求，助力新型试点工作在济南的落地推进。,其他,0.680006298921934,False,否
