code,province,city,topic,date,url,content,content.1,label,score,is_match,是否为“学习考察”新闻
129,山东省,济南市,重庆市武隆区党政代表团来济开展济风武韵共赴山海鲁渝协作交流,2024-05-31,http://www.jinan.gov.cn/art/2024/5/31/art_1861_4981546.html,5月30日，重庆市武隆区党政代表团来济开展“济风武韵·共赴山海”鲁渝协作交流活动。其间，两地联合召开济南·武隆东西部协作联席会议，济南市委书记刘强出席并讲话，济南市委副书记、市长于海田主持，武隆区委书记何庆出席并讲话。。联席会议上，武隆区介绍了两地东西部协作工作推进情况；举行了济南武隆东西部协作项目集中签约仪式，武隆仙女山山泉水加工等6个企业项目进行了现场签约。。刘强对武隆区党政代表团一行来济表示欢迎。他说，习近平总书记在视察重庆和山东时的重要讲话重要指示，为两地深化东西部协作、推动经济社会高质量发展指明了前进方向，提供了根本遵循。我们要深入学习贯彻习近平总书记重要讲话重要指示精神，切实扛起东西部协作和对口支援政治责任，以实际行动坚定拥护“两个确立”、坚决做到“两个维护”。今年以来，在重庆市委、市政府的坚强领导下，武隆区委、区政府团结带领广大干部群众奋勇争先，各项工作都保持了好势头、取得了新进展。武隆区在加快高质量发展中的好经验好做法值得济南市学习借鉴。做好今年的协作工作，要聚焦济南·武隆东西部协作联席会议确定的重点任务，在产业培育、文旅宣传、人力资源、消费帮扶等领域，进一步深化交流协作，把各项目标任务落实落细，共同开创两地高质量发展新篇章。。何庆首先代表武隆区委、区政府和全区干部群众，向济南市委、市政府长期以来给予的支持表示感谢。他说，两地结缘14年以来，济南市始终坚持自身所能、武隆所需、群众所盼，真情实意帮、真金白银投，为武隆巩固拓展脱贫攻坚成果、全面推进乡村振兴提供了强大助力。特别是习近平总书记在视察重庆和山东时的重要讲话重要指示赋予了重庆市和山东省新的使命和定位，也为我们深化东西部协作进一步指明了方向。接下来，真诚期盼济南武隆立足双方旅游资源禀赋，在营销推广、展会活动、客源互送等方面进一步深化交流合作，持续开展好“十万山东人游重庆”“亿元渝货进山东”等主题活动，引导更多文旅企业到武隆投资兴业，推动两地文化旅游资源共享、特色互助、优势互补，带动打造工业、农业、人才交流等更多协作“升级版”，共同谱写山海情谊新篇章。。会后，济南市和武隆区领导同志共同出席了“济风武韵·共赴山海”鲁渝协作交流暨旅游宣传推介活动，参观了武隆农副产品展、“武隆旅游30年”成果展和“文盛武隆”旅游文创产品展，观看了鲁渝协作文艺演出。。当天下午，武隆区党政代表团先后来到济南外国语学校和山东省农业科学院，考察了解国际教育开展、畜禽遗传繁育与疫病防控等情况。。济南市领导王宏志、戴龙成、马保岭、韩伟、任广锋，市政府秘书长韩振国，山东省协作重庆干部管理组、济南市有关区、市直有关部门负责同志；重庆市直有关部门、武隆区有关负责同志参加活动。,5月30日，重庆市武隆区党政代表团来济开展“济风武韵·共赴山海”鲁渝协作交流活动。其间，两地联合召开济南·武隆东西部协作联席会议，济南市委书记刘强出席并讲话，济南市委副书记、市长于海田主持，武隆区委书记何庆出席并讲话。。联席会议上，武隆区介绍了两地东西部协作工作推进情况；举行了济南武隆东西部协作项目集中签约仪式，武隆仙女山山泉水加工等6个企业项目进行了现场签约。。刘强对武隆区党政代表团一行来济表示欢迎。他说，习近平总书记在视察重庆和山东时的重要讲话重要指示，为两地深化东西部协作、推动经济社会高质量发展指明了前进方向，提供了根本遵循。我们要深入学习贯彻习近平总书记重要讲话重要指示精神，切实扛起东西部协作和对口支援政治责任，以实际行动坚定拥护“两个确立”、坚决做到“两个维护”。今年以来，在重庆市委、市政府的坚强领导下，武隆区委、区政府团结带领广大干部群众奋勇争先，各项工作都保持了好势头、取得了新进展。武隆区在加快高质量发展中的好经验好做法值得济南市学习借鉴。做好今年的协作工作，要聚焦济南·武隆东西部协作联席会议确定的重点任务，在产业培育、文旅宣传、人力资源、消费帮扶等领域，进一步深化交流协作，把各项目标任务落实落细，共同开创两地高质量发展新篇章。。何庆首先代表武隆区委、区政府和全区干部群众，向济南市委、市政府长期以来给予的支持表示感谢。他说，两地结缘14年以来，济南市始终坚持自身所能、武隆所需、群众所盼，真情实意帮、真金白银投，为武隆巩固拓展脱贫攻坚成果、全面推进乡村振兴提供了强大助力。特别是习近平总书记在视察重庆和山东时的重要讲话重要指示赋予了重庆市和山东省新的使命和定位，也为我们深化东西部协作进一步指明了方向。接下来，真诚期盼济南武隆立足双方旅游资源禀赋，在营销推广、展会活动、客源互送等方面进一步深化交流合作，持续开展好“十万山东人游重庆”“亿元渝货进山东”等主题活动，引导更多文旅企业到武隆投资兴业，推动两地文化旅游资源共享、特色互助、优势互补，带动打造工业、农业、人才交流等更多协作“升级版”，共同谱写山海情谊新篇章。。会后，济南市和武隆区领导同志共同出席了“济风武韵·共赴山海”鲁渝协作交流暨旅游宣传推介活动，参观了武隆农副产品展、“武隆旅游30年”成果展和“文盛武隆”旅游文创产品展，观看了鲁渝协作文艺演出。。当天下午，武隆区党政代表团先后来到济南外国语学校和山东省农业科学院，考察了解国际教育开展、畜禽遗传繁育与疫病防控等情况。。济南市领导王宏志、戴龙成、马保岭、韩伟、任广锋，市政府秘书长韩振国，山东省协作重庆干部管理组、济南市有关区、市直有关部门负责同志；重庆市直有关部门、武隆区有关负责同志参加活动。,政府领导到其他城市考察学习或访问,0.0,True,是
129,山东省,济南市,聚焦产业发展释放自贸红利,2024-05-13,http://www.jinan.gov.cn/art/2024/5/13/art_81014_4980741.html,为进一步发挥自贸试验区制度型开放优势，推动更多市场主体享受贸易便利化创新政策，5月10日，自贸试验区济南片区联合济南海关、济南市市场监督管理局、济南市商务局赴山东省万兴食品有限公司考察，聚焦企业参与药食同源商品进口便利化改革试点进行调研，推动先行先试政策不断深化，将自贸制度创新红利覆盖至更多市场主体。。山东万兴食品为我省农业产业化国家重点龙头企业，位于济南市莱芜区，主打品牌“姜老大”在2008年被评为奥运生姜专供产品，远销日本、欧盟、韩国、新加坡等100多个国家和地区，在国际市场享有良好声誉和口碑。该企业在布局全球化香辛料市场过程中，受限于现有药食同源商品进口管理制度，无法在国际市场直接采购原料，在国内二级市场采购成本偏高，企业产能释放和发展受阻。。为解决食品生产企业药食同源商品原料进口难问题，降低企业生产经营成本，2022年，山东自贸试验区发挥自贸改革开放“试验田”作用，在海关、市场监管、药监等部门支持下，开展药食同源商品进口通关便利化改革试点，取得良好成效，国内多个食品生产产业集聚地区前来学习借鉴。下一步，自贸试验区济南片区将持续发挥改革开放新高地创新优势，聚焦市场主体发展需求，探索在更大范围复制推广先行先试创新政策，服务更多企业享受制度创新红利，推动全省开放型经济高质量发展。,为进一步发挥自贸试验区制度型开放优势，推动更多市场主体享受贸易便利化创新政策，5月10日，自贸试验区济南片区联合济南海关、济南市市场监督管理局、济南市商务局赴山东省万兴食品有限公司考察，聚焦企业参与药食同源商品进口便利化改革试点进行调研，推动先行先试政策不断深化，将自贸制度创新红利覆盖至更多市场主体。。山东万兴食品为我省农业产业化国家重点龙头企业，位于济南市莱芜区，主打品牌“姜老大”在2008年被评为奥运生姜专供产品，远销日本、欧盟、韩国、新加坡等100多个国家和地区，在国际市场享有良好声誉和口碑。该企业在布局全球化香辛料市场过程中，受限于现有药食同源商品进口管理制度，无法在国际市场直接采购原料，在国内二级市场采购成本偏高，企业产能释放和发展受阻。。为解决食品生产企业药食同源商品原料进口难问题，降低企业生产经营成本，2022年，山东自贸试验区发挥自贸改革开放“试验田”作用，在海关、市场监管、药监等部门支持下，开展药食同源商品进口通关便利化改革试点，取得良好成效，国内多个食品生产产业集聚地区前来学习借鉴。下一步，自贸试验区济南片区将持续发挥改革开放新高地创新优势，聚焦市场主体发展需求，探索在更大范围复制推广先行先试创新政策，服务更多企业享受制度创新红利，推动全省开放型经济高质量发展。,其他,0.6470894325054901,False,否
129,山东省,济南市,一票到底山东省跨关区海铁联运首批进口测试货物顺利通关,2024-05-30,http://www.jinan.gov.cn/art/2024/5/30/art_81014_4981416.html,5月27日，满载30吨进口植脂末的2个集装箱通过海铁联运班列运抵济南董家铁路场站，在泉城海关监管下完成通关验放手续。。本票货物由迈大食品（山东）有限公司在印度尼西亚采购，通过海运抵达黄岛口岸，再以铁路运输方式转关到董家铁路场站，经泉城海关监管后放行。。“感谢泉城海关和黄岛海关的支持。我们集装箱入境后就不需要在入境口岸办理查验、清关等手续了，使用海铁联运‘一票到底’直达董家铁路场站，对我们内陆企业来说更加方便快捷。”迈大食品（山东）有限公司负责人刘志锐说。。本次货物是济南、青岛海关携手推进山东内陆港，多式联运物流通道建设，开展口岸“陆海联动、海铁直运”模式与属地“铁海E通”系统融合对接以来首批进口测试货物，标志着青岛港与山东内陆区域进口转关快速物流通道初步具备正式运行条件。。该模式实现关港数据共享、业务互联、自动监管，打通了多式联运至内陆港的进口转关通道，进口企业在“家门口”就可以完成通关和查验放行，极大提高了通关便捷效率。与传统运输方式相比，新模式将为内陆企业缩减运输时间近1/3，降低成本20%以上。。泉城海关副关长贺娟介绍：“下一步，我们将认真学习领会习近平总书记在山东考察时的重要讲话精神，在进一步全面深化改革、推进高水平对外开放上勇争先，积极构建国际物流大通道，助力地方外贸高质量发展。”,5月27日，满载30吨进口植脂末的2个集装箱通过海铁联运班列运抵济南董家铁路场站，在泉城海关监管下完成通关验放手续。。本票货物由迈大食品（山东）有限公司在印度尼西亚采购，通过海运抵达黄岛口岸，再以铁路运输方式转关到董家铁路场站，经泉城海关监管后放行。。“感谢泉城海关和黄岛海关的支持。我们集装箱入境后就不需要在入境口岸办理查验、清关等手续了，使用海铁联运‘一票到底’直达董家铁路场站，对我们内陆企业来说更加方便快捷。”迈大食品（山东）有限公司负责人刘志锐说。。本次货物是济南、青岛海关携手推进山东内陆港，多式联运物流通道建设，开展口岸“陆海联动、海铁直运”模式与属地“铁海E通”系统融合对接以来首批进口测试货物，标志着青岛港与山东内陆区域进口转关快速物流通道初步具备正式运行条件。。该模式实现关港数据共享、业务互联、自动监管，打通了多式联运至内陆港的进口转关通道，进口企业在“家门口”就可以完成通关和查验放行，极大提高了通关便捷效率。与传统运输方式相比，新模式将为内陆企业缩减运输时间近1/3，降低成本20%以上。。泉城海关副关长贺娟介绍：“下一步，我们将认真学习领会习近平总书记在山东考察时的重要讲话精神，在进一步全面深化改革、推进高水平对外开放上勇争先，积极构建国际物流大通道，助力地方外贸高质量发展。”,其他,0.801929729326131,False,否
129,山东省,济南市,市政府党组召开扩大会议,2024-05-01,http://www.jinan.gov.cn/art/2024/5/1/art_1861_4975501.html,4月30日，市政府党组召开扩大会议，传达学习习近平总书记在新时代推动西部大开发座谈会、重庆考察时的重要讲话等近期系列重要讲话重要指示精神，研究贯彻落实意见。市委副书记、市长、市政府党组书记于海田主持会议并讲话。。会议指出，习近平总书记的重要讲话、重要指示，高屋建瓴、思想深邃、内涵丰富，具有很强的政治性、思想性、指导性，要结合实际抓好贯彻落实。要在发展特色优势产业上下功夫，加强科技创新和产业创新深度融合，不断塑强主导产业新优势，积极抢占新兴产业制高点。要以高水平保护支撑高质量发展，深入打好污染防治攻坚战，持续强化生态资源保护，加快推进绿色低碳转型。要进一步全面深化改革开放，深入推进国有企业改革，促进民营经济发展壮大，激发各类经营主体活力，扩大高水平对外开放。要更好统筹发展和安全，持续深化安全生产“审计式”监督检查服务，不断提升社会治理体系和治理能力现代化水平。要扛牢耕地保护和粮食安全政治责任，加快发展现代农业，深化农业农村改革，有力有效推进乡村全面振兴。。会议学习了《党史学习教育工作条例》，强调，要以史为鉴加强政治建设、强化责任担当，把党史学习教育同做好中心工作结合起来，切实把学习成果转化为干事创业的强大动力。要扎实开展党纪学习教育，以彻底的自我革命精神推动全面从严治党向纵深发展。。会议对“五一”假期重点工作进行安排部署，要求各级各部门加强值班值守，严格落实“三管三必须”要求，抓紧抓实森林防火、道路交通、旅游景区、食品药品等各领域安全生产工作，扎实做好节日保供稳价、市场监管，多措并举优化旅游消费环境，确保人民群众过一个安定欢乐祥和的假期。,4月30日，市政府党组召开扩大会议，传达学习习近平总书记在新时代推动西部大开发座谈会、重庆考察时的重要讲话等近期系列重要讲话重要指示精神，研究贯彻落实意见。市委副书记、市长、市政府党组书记于海田主持会议并讲话。。会议指出，习近平总书记的重要讲话、重要指示，高屋建瓴、思想深邃、内涵丰富，具有很强的政治性、思想性、指导性，要结合实际抓好贯彻落实。要在发展特色优势产业上下功夫，加强科技创新和产业创新深度融合，不断塑强主导产业新优势，积极抢占新兴产业制高点。要以高水平保护支撑高质量发展，深入打好污染防治攻坚战，持续强化生态资源保护，加快推进绿色低碳转型。要进一步全面深化改革开放，深入推进国有企业改革，促进民营经济发展壮大，激发各类经营主体活力，扩大高水平对外开放。要更好统筹发展和安全，持续深化安全生产“审计式”监督检查服务，不断提升社会治理体系和治理能力现代化水平。要扛牢耕地保护和粮食安全政治责任，加快发展现代农业，深化农业农村改革，有力有效推进乡村全面振兴。。会议学习了《党史学习教育工作条例》，强调，要以史为鉴加强政治建设、强化责任担当，把党史学习教育同做好中心工作结合起来，切实把学习成果转化为干事创业的强大动力。要扎实开展党纪学习教育，以彻底的自我革命精神推动全面从严治党向纵深发展。。会议对“五一”假期重点工作进行安排部署，要求各级各部门加强值班值守，严格落实“三管三必须”要求，抓紧抓实森林防火、道路交通、旅游景区、食品药品等各领域安全生产工作，扎实做好节日保供稳价、市场监管，多措并举优化旅游消费环境，确保人民群众过一个安定欢乐祥和的假期。,其他,0.8276481125727297,True,是
129,山东省,济南市,济南国际医学中心管委会赴苏州上海考察调研,2024-05-21,http://www.jinan.gov.cn/art/2024/5/21/art_57650_4980798.html,为学习借鉴先进地区在基金运作、孵化器建设方面的经验做法，加快推进济南国际医学中心优质项目培育和产业生态打造，5月13日至15日，医学中心管委会副主任徐宁波带队赴苏州、上海实地考察调研。。在苏州工业园区，调研组会同北京先通国际医药科技有限公司转化医学部副研究员、山东大学医药行业校友会执行副秘书长沈恩允，来到东沙湖基金小镇，详细了解小镇规划设计、建设运营、政策优势、科创服务体系等方面具体情况，并在小镇与长三角科技要素交易中心相关负责人就概念验证、成果转化等内容进行交流。随后调研组走访调研苏州工业园区自主创新医疗器械联盟协会（独墅联盟），现场考察了联盟成员单位——苏州艾隆科技股份有限公司、艾信智慧医疗科技发展（苏州）有限公司、苏州众创云集信息科技有限公司，并围绕独墅联盟协作模式及“创小二”孵化器发展流程、运营模式、服务内容与公司相关负责人进行座谈交流。。在上海，调研组会同山东未来先导私募基金管理有限公司总经理王凯，拜访了上海科创中心股权投资基金管理有限公司，上海创投基金总裁杨斌、副总裁袁智德等领导参加座谈。杨斌向调研组介绍了上海科创基金重点投向及一期、二期母基金运作情况；徐宁波向其介绍了医学中心建设发展情况。随后双方就医学中心产业基金组建及落地运营模式交流意见。调研组还走访调研了上海虹桥基金小镇，德同资本总经理辛强详细介绍了基金小镇规划布局及入驻机构情况。此外，调研组应邀赴绿叶医疗（中国）考察调研，就前期沟通的康复医院等产业合作进一步探讨交流。。通过此次调研，调研组深切感受到了苏州、上海两地在产业基金运作、孵化器建设等方面所取得的显著成就和宝贵经验，拓宽了视野和思路，同时也加强了与苏州、上海相关创投机构及孵化器的沟通联系，为今后加强合作奠定了良好的基础。下一步，医学中心将在对标先进中奋力追赶、埋头苦干，全面落实“项目深化年”工作要求，推动基金组建、项目孵化等工作向纵深发展。,为学习借鉴先进地区在基金运作、孵化器建设方面的经验做法，加快推进济南国际医学中心优质项目培育和产业生态打造，5月13日至15日，医学中心管委会副主任徐宁波带队赴苏州、上海实地考察调研。。在苏州工业园区，调研组会同北京先通国际医药科技有限公司转化医学部副研究员、山东大学医药行业校友会执行副秘书长沈恩允，来到东沙湖基金小镇，详细了解小镇规划设计、建设运营、政策优势、科创服务体系等方面具体情况，并在小镇与长三角科技要素交易中心相关负责人就概念验证、成果转化等内容进行交流。随后调研组走访调研苏州工业园区自主创新医疗器械联盟协会（独墅联盟），现场考察了联盟成员单位——苏州艾隆科技股份有限公司、艾信智慧医疗科技发展（苏州）有限公司、苏州众创云集信息科技有限公司，并围绕独墅联盟协作模式及“创小二”孵化器发展流程、运营模式、服务内容与公司相关负责人进行座谈交流。。在上海，调研组会同山东未来先导私募基金管理有限公司总经理王凯，拜访了上海科创中心股权投资基金管理有限公司，上海创投基金总裁杨斌、副总裁袁智德等领导参加座谈。杨斌向调研组介绍了上海科创基金重点投向及一期、二期母基金运作情况；徐宁波向其介绍了医学中心建设发展情况。随后双方就医学中心产业基金组建及落地运营模式交流意见。调研组还走访调研了上海虹桥基金小镇，德同资本总经理辛强详细介绍了基金小镇规划布局及入驻机构情况。此外，调研组应邀赴绿叶医疗（中国）考察调研，就前期沟通的康复医院等产业合作进一步探讨交流。。通过此次调研，调研组深切感受到了苏州、上海两地在产业基金运作、孵化器建设等方面所取得的显著成就和宝贵经验，拓宽了视野和思路，同时也加强了与苏州、上海相关创投机构及孵化器的沟通联系，为今后加强合作奠定了良好的基础。下一步，医学中心将在对标先进中奋力追赶、埋头苦干，全面落实“项目深化年”工作要求，推动基金组建、项目孵化等工作向纵深发展。,政府领导到其他城市考察学习或访问,0.5855235717635251,False,否
