code,province,city,topic,date,url,content,content.1,label,score,is_match
249,贵州省,毕节市,周舟带队赴北京市考察学习并开展招商引资,2023-05-15,https://www.bijie.gov.cn/hhbj/zs/tzzx/202305/t20230515_79735978.html,5月9日至12日，市委副书记、区委书记、毕节高新区党工委书记周舟带队到北京市考察学习并开展招商引资。。在京期间，周舟先后到同方股份有限公司、中国科学院工程热物理研究所、北京城市副中心等地考察座谈，详细介绍七星关区政策、资源、人口、区位、市场优势等情况，了解企业发展愿景和投资方向，诚邀广大北京企业家到七星关区考察投资。。2022年，同方计算机有限公司在毕节高新区设立清华同方生产基地。2014年，毕节市人民政府与中国科学院工程热物理研究所签署协议，共建毕节高新技术产业开发区国家能源大规模物理储能技术研发中心。周舟先后来到同方股份有限公司、中国科学院工程热物理研究所，与企业负责人深入交流，详细了解企业发展历程、生产经营情况和发展规划。他说，当前七星关区正按照“一个产业园区，一个主导产业、一个行业领军企业、一条完整产业链和供应链”的工作思路，坚持走“两换行动”路径，围绕强龙头、补链条、聚集群，全力打造千亿级产业集群。希望企业能聚焦建链、延链、补链、强链，全力打造集聚平台，做大做强优势产业集群，充分引导上下游企业和配套企业落地，加快构建支撑高质量发展的现代产业体系。七星关区将持续优化营商环境，深入践行“一线工作法”，为企业提供“店小二”“保姆式”服务，助力企业不断做大做强。。位于京杭大运河北首的通州，是北京城市副中心，也是举北京全市之力重点打造的“千年之城”。周舟先后到运河奥体公园二号码头、北京城市副中心规划展厅、张家湾设计小镇创新中心元宇宙展厅、北京华洋奎龙药业公司，详细了解北京城市副中心在城市规划建设、老工业园区转型升级、生态景观建设等方面的先进做法。他指出，北京市创新能力强、产业生态好、城市治理水平高，要充分学习借鉴、全面消化吸收北京城市副中心的先进理论、先进做法、先进模式、先进经验，以更高视野、更高站位，加快转化学习成果，着力提升七星关中心城区吸引力、吸纳力，加快推动区域性中心城市建设。。致公党中央有关负责同志，毕节市政府驻北京办事处，七星关区、毕节高新区有关部门负责同志参加。,5月9日至12日，市委副书记、区委书记、毕节高新区党工委书记周舟带队到北京市考察学习并开展招商引资。。在京期间，周舟先后到同方股份有限公司、中国科学院工程热物理研究所、北京城市副中心等地考察座谈，详细介绍七星关区政策、资源、人口、区位、市场优势等情况，了解企业发展愿景和投资方向，诚邀广大北京企业家到七星关区考察投资。。2022年，同方计算机有限公司在毕节高新区设立清华同方生产基地。2014年，毕节市人民政府与中国科学院工程热物理研究所签署协议，共建毕节高新技术产业开发区国家能源大规模物理储能技术研发中心。周舟先后来到同方股份有限公司、中国科学院工程热物理研究所，与企业负责人深入交流，详细了解企业发展历程、生产经营情况和发展规划。他说，当前七星关区正按照“一个产业园区，一个主导产业、一个行业领军企业、一条完整产业链和供应链”的工作思路，坚持走“两换行动”路径，围绕强龙头、补链条、聚集群，全力打造千亿级产业集群。希望企业能聚焦建链、延链、补链、强链，全力打造集聚平台，做大做强优势产业集群，充分引导上下游企业和配套企业落地，加快构建支撑高质量发展的现代产业体系。七星关区将持续优化营商环境，深入践行“一线工作法”，为企业提供“店小二”“保姆式”服务，助力企业不断做大做强。。位于京杭大运河北首的通州，是北京城市副中心，也是举北京全市之力重点打造的“千年之城”。周舟先后到运河奥体公园二号码头、北京城市副中心规划展厅、张家湾设计小镇创新中心元宇宙展厅、北京华洋奎龙药业公司，详细了解北京城市副中心在城市规划建设、老工业园区转型升级、生态景观建设等方面的先进做法。他指出，北京市创新能力强、产业生态好、城市治理水平高，要充分学习借鉴、全面消化吸收北京城市副中心的先进理论、先进做法、先进模式、先进经验，以更高视野、更高站位，加快转化学习成果，着力提升七星关中心城区吸引力、吸纳力，加快推动区域性中心城市建设。。致公党中央有关负责同志，毕节市政府驻北京办事处，七星关区、毕节高新区有关部门负责同志参加。,政府领导到其他城市考察学习或访问,0.8828034759035036,True
249,贵州省,毕节市,赵琳同志带队到黔南州公安局学习考察,2018-11-26,https://www.bijie.gov.cn/bm/bjsgaj/dt/bmdt/201811/t20181126_74680444.html,受毕节市人民政府副市长、市委政法委书记、公安局长王治军委派，11月21日至22日，市公安局党委委员、机关党委书记赵琳带领指挥中心（办公室）、治安支队、各县（区）公安局治安大队长和部分派出所所长一行23人到黔南州公安局学习考察数据警务、户籍制度改革、派出所便民利民窗口建设、派出所“两会”（警民议事会，警务联席会）机制、派出所正规化建设、民爆物品管理等工作。黔南州公安局党委委员、副局长付光耀，黔南州公安局指挥中心（办公室）、治安支队、人口管理支队等部门同志陪同考察。。交流座谈会上，付光耀同志代表黔南州公安局党委对毕节市公安机关学习考察组一行表示欢迎，并从防范打击、指挥调度、数据警务、警务改革、执法规范化建设等方面介绍了黔南州公安局相关工作情况。。赵琳同志代表考察组一行对黔南州公安局热情周到的接待表示感谢，她表示：王治军副市长为两地公安机关开启了进一步增强感情交流的新起点，通过学习考察黔南公安相关工作，考察组一行受到了启发，增长了见识，收获良多。在黔南州公安局党委的领导下，黔南公安工作取得了可喜可贺的好成绩，主要表现在：一是工作创新能力非常强，黔南公安“三级一网考”、政务110建设、三台合一等工作，充分体现了黔南公安在工作创新上成效明显；二是信息化应用能力非常强，黔南州公安局数据警务资源中心建设情况，展示了信息化应用成效明显；三是高效服务群众能力非常强，黔南州公安机关在便民利民工作中实现了群众办理户籍线上“一网通办”、线下“只进一扇门”，现场办理“最多跑一次”的目标，群众满意度高。。赵琳同志希望两地公安机关相关部门以此为契机，继续加强沟通交流，互相学习，互相帮助，推动两地公安工作迈上新台阶。。学习考察期间，考察组一行实地参观了黔南州政务110、数据警务资源中心、都匀市人民政府政务服务中心、都匀市公安局绿茵湖派出所。,受毕节市人民政府副市长、市委政法委书记、公安局长王治军委派，11月21日至22日，市公安局党委委员、机关党委书记赵琳带领指挥中心（办公室）、治安支队、各县（区）公安局治安大队长和部分派出所所长一行23人到黔南州公安局学习考察数据警务、户籍制度改革、派出所便民利民窗口建设、派出所“两会”（警民议事会，警务联席会）机制、派出所正规化建设、民爆物品管理等工作。黔南州公安局党委委员、副局长付光耀，黔南州公安局指挥中心（办公室）、治安支队、人口管理支队等部门同志陪同考察。。交流座谈会上，付光耀同志代表黔南州公安局党委对毕节市公安机关学习考察组一行表示欢迎，并从防范打击、指挥调度、数据警务、警务改革、执法规范化建设等方面介绍了黔南州公安局相关工作情况。。赵琳同志代表考察组一行对黔南州公安局热情周到的接待表示感谢，她表示：王治军副市长为两地公安机关开启了进一步增强感情交流的新起点，通过学习考察黔南公安相关工作，考察组一行受到了启发，增长了见识，收获良多。在黔南州公安局党委的领导下，黔南公安工作取得了可喜可贺的好成绩，主要表现在：一是工作创新能力非常强，黔南公安“三级一网考”、政务110建设、三台合一等工作，充分体现了黔南公安在工作创新上成效明显；二是信息化应用能力非常强，黔南州公安局数据警务资源中心建设情况，展示了信息化应用成效明显；三是高效服务群众能力非常强，黔南州公安机关在便民利民工作中实现了群众办理户籍线上“一网通办”、线下“只进一扇门”，现场办理“最多跑一次”的目标，群众满意度高。。赵琳同志希望两地公安机关相关部门以此为契机，继续加强沟通交流，互相学习，互相帮助，推动两地公安工作迈上新台阶。。学习考察期间，考察组一行实地参观了黔南州政务110、数据警务资源中心、都匀市人民政府政务服务中心、都匀市公安局绿茵湖派出所。,政府领导到其他城市考察学习或访问,0.0,True
249,贵州省,毕节市,毕节市人社局赴铜仁市考察学习保障农民工工资支付工作,2019-06-28,https://www.bijie.gov.cn/bm/bjsrsj/dt/gzdt/201906/t20190628_74825797.html,根据安排，6月12日至13日，毕节市人社局党组成员、副局长梅品伦带队到铜仁市考察学习保障农民工工资支付工作。考察学习组通过对铜仁市在建工程项目现场观摩和召开座谈会了解到，铜仁市在保障农民工工资支付工作方面的主要做法如下。。市委书记多次研究解决“根治欠薪”工作中的重点难点问题，并作出批示指示。市长亲自统筹调度、安排部署，召开市政府常务会议及专题会议5次，研究部署清欠工作。市政府常务副市长、各分管副市长对所分管涉及的部门进行安排调度，并率队开展专项检查工作。。2018年以来，铜仁市提前谋划，提出所有在建工程项目的存储工资保障金、农民工实名制管理、开设银行工资专户、按月足额发放工资、设置维权告示牌等核心指标完成率必须达到100%要求。同时，创新出台《铜仁市农民工工资支付保障办法》，实行“关口前移”制度，由劳动保障监察部门对政府性工程项目拨款进行把关。。。研究出台《铜仁市保障农民工工资支付工作问责办法（试行）》，形成保障农民工工资支付工作问责长效机制。市长与各县（区）、市直有关部门主要负责人签订目标责任状，明确工作标准、责任义务和完成时限。针对问题较多、工作滞后的县（区）、部门，市长亲自写信给各县（区）、部门主要负责人，提出存在的问题、整改要求和完成时限，督促相关县（区）、部门限时整改落实。。将保障农民工工资支付工作纳入各级政府目标绩效考核。明确由市政府督查室、市保障农民工工资支付工作领导小组办公室牵头，根据通报中反馈的问题进行督办督查，跟踪问题整改落实。下发《铜仁市人民检察院 铜仁市人力资源和社会保障局关于印发关于在保护农民工合法权益工作中加强协作配合的意见的通知》，加大检察机关在治理农民工工资工作中的监督作用。。行业主管部门派驻人员到劳动监察大队，联动开展督查，对不落实农民工实名制管理、未认真执行实名制考勤记录的项目责令停工；联合督查方面，铜仁市人社局联合检察院进行暗访暗查，对出现问题的项目或县（区）立即下达意见书，对问题严重的负责人直接提起公益诉讼；技术方面，对难以执行农民工实名制通道的开放式工地，引进“电子围栏”技术。在维护稳定方面，万山区政府为解决讨薪困难农民工的吃饭问题，安排了10万元的“盒饭钱”，做法深得人心，大大提高了维护稳定的效率。。梅品伦同志表示：“此次毕节市人社局考察学习组来到铜仁进行考察学习，感受了毕节市与铜仁市在保障农民工工资支付工作方面的差距。同时，学到了很多宝贵的经验和做法，下一步将会借鉴铜仁市的经验和做法，结合毕节实际，开展好毕节市保障农民工工资支付工作”。,根据安排，6月12日至13日，毕节市人社局党组成员、副局长梅品伦带队到铜仁市考察学习保障农民工工资支付工作。考察学习组通过对铜仁市在建工程项目现场观摩和召开座谈会了解到，铜仁市在保障农民工工资支付工作方面的主要做法如下。。市委书记多次研究解决“根治欠薪”工作中的重点难点问题，并作出批示指示。市长亲自统筹调度、安排部署，召开市政府常务会议及专题会议5次，研究部署清欠工作。市政府常务副市长、各分管副市长对所分管涉及的部门进行安排调度，并率队开展专项检查工作。。2018年以来，铜仁市提前谋划，提出所有在建工程项目的存储工资保障金、农民工实名制管理、开设银行工资专户、按月足额发放工资、设置维权告示牌等核心指标完成率必须达到100%要求。同时，创新出台《铜仁市农民工工资支付保障办法》，实行“关口前移”制度，由劳动保障监察部门对政府性工程项目拨款进行把关。。。研究出台《铜仁市保障农民工工资支付工作问责办法（试行）》，形成保障农民工工资支付工作问责长效机制。市长与各县（区）、市直有关部门主要负责人签订目标责任状，明确工作标准、责任义务和完成时限。针对问题较多、工作滞后的县（区）、部门，市长亲自写信给各县（区）、部门主要负责人，提出存在的问题、整改要求和完成时限，督促相关县（区）、部门限时整改落实。。将保障农民工工资支付工作纳入各级政府目标绩效考核。明确由市政府督查室、市保障农民工工资支付工作领导小组办公室牵头，根据通报中反馈的问题进行督办督查，跟踪问题整改落实。下发《铜仁市人民检察院 铜仁市人力资源和社会保障局关于印发关于在保护农民工合法权益工作中加强协作配合的意见的通知》，加大检察机关在治理农民工工资工作中的监督作用。。行业主管部门派驻人员到劳动监察大队，联动开展督查，对不落实农民工实名制管理、未认真执行实名制考勤记录的项目责令停工；联合督查方面，铜仁市人社局联合检察院进行暗访暗查，对出现问题的项目或县（区）立即下达意见书，对问题严重的负责人直接提起公益诉讼；技术方面，对难以执行农民工实名制通道的开放式工地，引进“电子围栏”技术。在维护稳定方面，万山区政府为解决讨薪困难农民工的吃饭问题，安排了10万元的“盒饭钱”，做法深得人心，大大提高了维护稳定的效率。。梅品伦同志表示：“此次毕节市人社局考察学习组来到铜仁进行考察学习，感受了毕节市与铜仁市在保障农民工工资支付工作方面的差距。同时，学到了很多宝贵的经验和做法，下一步将会借鉴铜仁市的经验和做法，结合毕节实际，开展好毕节市保障农民工工资支付工作”。,其他,0.5727674523677897,True
249,贵州省,毕节市,七星关区委书记崔英魁带队到深圳考察学习智慧城市如何建,2019-04-08,https://www.bijie.gov.cn/xxfb/qxdt/201904/t20190408_74922926.html,城市是市民生活的共同体，城市的管理服务和市政设施配置关系到每一位市民的幸福感和获得感。近年来，随着大数据产业物联网技术的不断发展，“智慧城市”概念成了城市管理服务瓶颈的突破口。。如何让七星关的城市管理服务更加有效和高效，让广大市民的生活更便捷，带着问题，近日，市委常委、区委书记崔英魁带队到深圳考察学习。区委常委、常务副区长严琪，七星关经济开发区副主任米良，区综合行政执法局局长张治国参加此次考察。。在深圳市捷顺科技实业股份有限公司，考察组一行对城市智慧停车系统和智慧社区管理服务系统进行深入了解。崔英魁表示，科学技术是第一生产力，也是生活水平提升的重要保障。七星关区要继续加大投入力度，积极引入社会力量，充分利用好现代技术手段，注重涉及群众生活的方方面面，不断完善基础设施，努力提升城市服务管理的科学化水平，让广大市民享受到现代科学技术带来便捷和高效，为七星关“五城同创”工作奠定坚实基础。。深圳市诺威实业有限公司是一家集新能源电力系统及照明设施的研发、设计、生产、销售等业务为一体的科技研发生产企业，在该公司，崔英魁一行对其城市照明系统生产车间进行认真考察。。崔英魁在考察中指出，创新是企业的生命，七星关经济开发区和各相关部门要加大扶持、服务和引导力度，鼓励企业积极创新升级提质，加强核心竞争意识，努力打造科技含量高的优质品牌，推动企业不断做优做强。要积极营造更好的投资营商环境，结合七星关经济开发区产业规划布局，有针对性地引入相关企业入驻，推动相关产业链不断延伸和完善，努力打造西南地区的光电产业和服装产业聚集区，为我区经济社会发展和脱贫攻坚作出积极贡献。。在与该公司负责人座谈时，崔英魁详细介绍了我区“致福光谷”产业布局和相关招商引资政策，诚挚邀请该公司到我区考察投资，改善城市照明设施，提升城市品位和形象，共同做大光电产业。。此次深圳之行，既有对“智慧城市”的考察学习，又有招商活动，对我区打造“智慧城市”和拓展科技产业意义深远。“智慧城市”管理服务系统不仅仅是停车和照明，它包含着市民生活的整体智能化，通过对“智慧城市”的深入学习和认真思考，结合七星关实际大胆实践探索，七星关城市管理服务必将实现新跨越。,城市是市民生活的共同体，城市的管理服务和市政设施配置关系到每一位市民的幸福感和获得感。近年来，随着大数据产业物联网技术的不断发展，“智慧城市”概念成了城市管理服务瓶颈的突破口。。如何让七星关的城市管理服务更加有效和高效，让广大市民的生活更便捷，带着问题，近日，市委常委、区委书记崔英魁带队到深圳考察学习。区委常委、常务副区长严琪，七星关经济开发区副主任米良，区综合行政执法局局长张治国参加此次考察。。在深圳市捷顺科技实业股份有限公司，考察组一行对城市智慧停车系统和智慧社区管理服务系统进行深入了解。崔英魁表示，科学技术是第一生产力，也是生活水平提升的重要保障。七星关区要继续加大投入力度，积极引入社会力量，充分利用好现代技术手段，注重涉及群众生活的方方面面，不断完善基础设施，努力提升城市服务管理的科学化水平，让广大市民享受到现代科学技术带来便捷和高效，为七星关“五城同创”工作奠定坚实基础。。深圳市诺威实业有限公司是一家集新能源电力系统及照明设施的研发、设计、生产、销售等业务为一体的科技研发生产企业，在该公司，崔英魁一行对其城市照明系统生产车间进行认真考察。。崔英魁在考察中指出，创新是企业的生命，七星关经济开发区和各相关部门要加大扶持、服务和引导力度，鼓励企业积极创新升级提质，加强核心竞争意识，努力打造科技含量高的优质品牌，推动企业不断做优做强。要积极营造更好的投资营商环境，结合七星关经济开发区产业规划布局，有针对性地引入相关企业入驻，推动相关产业链不断延伸和完善，努力打造西南地区的光电产业和服装产业聚集区，为我区经济社会发展和脱贫攻坚作出积极贡献。。在与该公司负责人座谈时，崔英魁详细介绍了我区“致福光谷”产业布局和相关招商引资政策，诚挚邀请该公司到我区考察投资，改善城市照明设施，提升城市品位和形象，共同做大光电产业。。此次深圳之行，既有对“智慧城市”的考察学习，又有招商活动，对我区打造“智慧城市”和拓展科技产业意义深远。“智慧城市”管理服务系统不仅仅是停车和照明，它包含着市民生活的整体智能化，通过对“智慧城市”的深入学习和认真思考，结合七星关实际大胆实践探索，七星关城市管理服务必将实现新跨越。,政府领导到其他城市考察学习或访问,0.5659507517045314,True
