code,province,city,topic,date,url,content,content.1,label,score,is_match
247,贵州省,遵义市,王宏率队赴年服贸会考察学习,2023-09-06,https://www.zunyi.gov.cn/xwdt/zyyw/202309/t20230906_82323653.html,近日，2023年中国国际服务贸易交易会在北京举行。为学习借鉴国内国际服务贸易先进经验，着力提升遵义开放型经济发展水平，促进遵义服务贸易高质量发展，遵义市派出工作队赴京实地观摩学习并开展招商洽谈。市委副书记王宏率队，副市长曹鸣凤参加。。据了解，本届服贸会由商务部和北京市人民政府共同主办，主题为“开放引领发展、合作共赢未来”，共有2400余家企业线下参展，其中世界500强和行业龙头企业500多家，展览展示总规模达15.5万平方米。贵州作为双主宾省之一，组织了28家企业参展，茅台集团、正安娜塔莎乐器制造公司、遵义演艺集团携相关产品随团参展。。展会期间，王宏一行先后到国家会议中心展区、首钢园展区、贵荟馆·贵京荟考察学习，深入文旅服务、供应链及商务服务、教育服务、金融服务等15个展馆详细了解参展企业发展情况，与企业现场负责人进行沟通交流，开展企地供需对接，宣传招商引资政策，邀请企业到遵投资兴业。王宏强调，本届服贸会集聚了众多世界500强和行业龙头企业，覆盖了28个服务贸易前30强的国家和地区，是我们观察服务贸易现状和发展趋势的重要窗口。各成员要用好此次难得的学习机会，多深入展区观摩，多与企业沟通，多作宣传推介，多向先进学习，进一步革新思维、务实方法、集智聚力，加快推动我市服务贸易高质量发展。,近日，2023年中国国际服务贸易交易会在北京举行。为学习借鉴国内国际服务贸易先进经验，着力提升遵义开放型经济发展水平，促进遵义服务贸易高质量发展，遵义市派出工作队赴京实地观摩学习并开展招商洽谈。市委副书记王宏率队，副市长曹鸣凤参加。。据了解，本届服贸会由商务部和北京市人民政府共同主办，主题为“开放引领发展、合作共赢未来”，共有2400余家企业线下参展，其中世界500强和行业龙头企业500多家，展览展示总规模达15.5万平方米。贵州作为双主宾省之一，组织了28家企业参展，茅台集团、正安娜塔莎乐器制造公司、遵义演艺集团携相关产品随团参展。。展会期间，王宏一行先后到国家会议中心展区、首钢园展区、贵荟馆·贵京荟考察学习，深入文旅服务、供应链及商务服务、教育服务、金融服务等15个展馆详细了解参展企业发展情况，与企业现场负责人进行沟通交流，开展企地供需对接，宣传招商引资政策，邀请企业到遵投资兴业。王宏强调，本届服贸会集聚了众多世界500强和行业龙头企业，覆盖了28个服务贸易前30强的国家和地区，是我们观察服务贸易现状和发展趋势的重要窗口。各成员要用好此次难得的学习机会，多深入展区观摩，多与企业沟通，多作宣传推介，多向先进学习，进一步革新思维、务实方法、集智聚力，加快推动我市服务贸易高质量发展。,政府领导到其他城市考察学习或访问,0.0,True
247,贵州省,遵义市,遵义市党政代表团赴筑学习考察,2023-07-21,https://www.zunyi.gov.cn/xwdt/zyyw/202307/t20230721_81122974.html,7月20日，遵义市党政代表团赴贵阳贵安学习考察，双方举行深化战略合作联席会议。省委常委、贵阳市委书记胡忠雄，省委常委、遵义市委书记李睿出席并讲话。。贵阳市委副书记、市长马宁宇，遵义市委副书记、市长黄伟分别介绍经济社会发展和合作推进情况。贵阳市人大常委会主任聂雪松，市委副书记滕伟华，贵阳贵安领导刘本立、范辉政、黄波、熊国玺、吴宏春、吴熙、侯胜鹏、黄成虹、宋旭升、高杨、付涛；遵义市委副书记王宏，市领导刘承东、向承强、刘东明、李旭、王继松、陈钊参加。。胡忠雄代表贵阳贵安对遵义市党政代表团一行的到来表示欢迎，对遵义近年来取得的显著业绩和工作突破表示钦佩。他说，贵阳贵安与遵义是地缘相接、人缘相连、文缘相融的情感共同体、发展共同体、命运共同体，双方在交流互动中展现出良好的发展势头、合作苗头、共赢劲头，共同唱好“双城记”其时已至、其势已成、其风正盛。希望双方深入贯彻党的二十大精神和习近平总书记视察贵州重要讲话精神，严格落实省委、省政府赋予两地的职责使命，共同规划全景图，更好服务国之大者、省之大计、市之所需；共同绘制施工图，年度化、项目化推进各阶段目标任务；共同聚焦项目图，以项目为纽带，加快把合作共识转化为发展实效；共同落实作战图，机制化推动双方各领域交流合作，为全省高质量发展贡献更多力量。贵阳贵安将充分学习借鉴遵义在锐意进取中形成的新思路、新举措、新成就，全力为双方合作迈上新台阶创造良好条件。。李睿代表遵义市对贵阳贵安长期以来对遵义经济社会发展的支持表示感谢。他说，自今年3月份双方签订战略合作协议以来，筑遵两地按照省委、省政府关于“强省会”、“加快建设省域副中心”的决策部署，推动优势互补、错位发展、互利共赢，战略合作取得初步成效。贵阳贵安大力发展数字经济，建设智慧城市，强化招商引资，加快项目建设，积极推动大数据赋能城市管理，运用大数据提升服务发展、服务群众水平的经验做法令人深受启发。希望两市在中国式现代化贵州实践中，进一步完善合作机制、搭建合作平台、拓宽合作领域，加强在工业能矿、科技创新、交通基础设施建设、文化旅游产业发展等方面深化合作，共同推动高质量发展。遵义将认真学习贵阳贵安锚定目标、实干快干的精神，奋勇争先、乘势而上的劲头，全力以赴、勇于突破的担当，以实际行动推动筑遵合作取得更大成效。。学习考察期间，遵义市党政代表团实地参观了贵安华为云数据中心（云上屯）、比亚迪10GWh动力电池项目、贵州吉利整车产业化项目、贵阳市城市运行管理中心。,7月20日，遵义市党政代表团赴贵阳贵安学习考察，双方举行深化战略合作联席会议。省委常委、贵阳市委书记胡忠雄，省委常委、遵义市委书记李睿出席并讲话。。贵阳市委副书记、市长马宁宇，遵义市委副书记、市长黄伟分别介绍经济社会发展和合作推进情况。贵阳市人大常委会主任聂雪松，市委副书记滕伟华，贵阳贵安领导刘本立、范辉政、黄波、熊国玺、吴宏春、吴熙、侯胜鹏、黄成虹、宋旭升、高杨、付涛；遵义市委副书记王宏，市领导刘承东、向承强、刘东明、李旭、王继松、陈钊参加。。胡忠雄代表贵阳贵安对遵义市党政代表团一行的到来表示欢迎，对遵义近年来取得的显著业绩和工作突破表示钦佩。他说，贵阳贵安与遵义是地缘相接、人缘相连、文缘相融的情感共同体、发展共同体、命运共同体，双方在交流互动中展现出良好的发展势头、合作苗头、共赢劲头，共同唱好“双城记”其时已至、其势已成、其风正盛。希望双方深入贯彻党的二十大精神和习近平总书记视察贵州重要讲话精神，严格落实省委、省政府赋予两地的职责使命，共同规划全景图，更好服务国之大者、省之大计、市之所需；共同绘制施工图，年度化、项目化推进各阶段目标任务；共同聚焦项目图，以项目为纽带，加快把合作共识转化为发展实效；共同落实作战图，机制化推动双方各领域交流合作，为全省高质量发展贡献更多力量。贵阳贵安将充分学习借鉴遵义在锐意进取中形成的新思路、新举措、新成就，全力为双方合作迈上新台阶创造良好条件。。李睿代表遵义市对贵阳贵安长期以来对遵义经济社会发展的支持表示感谢。他说，自今年3月份双方签订战略合作协议以来，筑遵两地按照省委、省政府关于“强省会”、“加快建设省域副中心”的决策部署，推动优势互补、错位发展、互利共赢，战略合作取得初步成效。贵阳贵安大力发展数字经济，建设智慧城市，强化招商引资，加快项目建设，积极推动大数据赋能城市管理，运用大数据提升服务发展、服务群众水平的经验做法令人深受启发。希望两市在中国式现代化贵州实践中，进一步完善合作机制、搭建合作平台、拓宽合作领域，加强在工业能矿、科技创新、交通基础设施建设、文化旅游产业发展等方面深化合作，共同推动高质量发展。遵义将认真学习贵阳贵安锚定目标、实干快干的精神，奋勇争先、乘势而上的劲头，全力以赴、勇于突破的担当，以实际行动推动筑遵合作取得更大成效。。学习考察期间，遵义市党政代表团实地参观了贵安华为云数据中心（云上屯）、比亚迪10GWh动力电池项目、贵州吉利整车产业化项目、贵阳市城市运行管理中心。,政府领导到其他城市考察学习或访问,0.0,True
247,贵州省,遵义市,遵义市党政代表团赴重庆市学习考察并举行渝遵合作交流座谈会,2024-07-13,https://www.zunyi.gov.cn/xwdt/zyyw/202407/t20240713_85095929.html,7月10日至11日，遵义市党政代表团赴重庆市学习考察，深入贯彻落实习近平总书记在新时代推动西部大开发座谈会上的重要讲话精神和视察贵州重要讲话精神，对标先进学习经验，推动渝遵合作向更深层次、更宽领域拓展。。7月11日下午，渝遵合作交流座谈会召开。重庆市委副书记李明清主持座谈会并讲话，贵州省委常委、遵义市委书记李睿讲话。重庆市副市长江敦涛，遵义市委副书记、市长黄伟分别介绍两地经济社会发展情况。。李明清指出，遵义市经济社会发展成绩显著，中国式现代化遵义实践的经验做法值得重庆借鉴。他说，我们要深入贯彻落实重庆·贵州经济社会发展情况交流座谈会精神，认真落实重庆市与贵州省签订的《深化战略合作框架协议》，持续深化务实合作，共同打造更多合作标志性成果。希望携手加强重大战略规划协同联动，共同服务国家战略腹地建设，推动遵义融入成渝地区双城经济圈建设。携手推进基础设施互联互通，强化铁路大通道建设，深化区域水资源开发利用合作，推进航空网络建设，推动通道物流联网成势。携手推动渝遵产业联动发展，打造特色优势产业集群，深化数字经济合作，推动文旅资源共建共享，完善协同创新体系。携手共建能源保障基地，共同建设全国煤电化工基地，共同开展清洁能源高效开发利用，共同推进区域能源市场建设。携手推进公共服务共建共享，深化教育合作，拓展医疗联动协作，加强政务服务合作。。李睿代表遵义市委、市政府感谢重庆长期以来给予遵义发展的关心支持，对重庆经济社会发展取得的显著成就表示钦佩和祝贺。他说，近年来，重庆深入学习贯彻习近平总书记视察重庆重要讲话重要指示精神，不断推动现代化新重庆建设展现新气象，好思路好做法好经验值得遵义学习借鉴。希望双方进一步深入落实渝黔战略合作框架协议，深化战略对接和发展联动，携手推动两地经济社会高质量发展。进一步深化产业合作，推动红色旅游、绿色生态、现代农业、金属加工等产业协同发展，加快推进产业链、创新链、生活链深度融合。进一步强化互联互通，共同推进航空、铁路、公路、水运等大通道建设，深化中欧班列市场拓展、线路优化，共建西部陆海新通道渝遵综合服务区。进一步推动资源共享，提高跨区域就业、就医、就学等生产生活便捷度，共建新型研发机构和创新应用平台，共同打造区域资源共享新样板。。会上，在李明清、李睿、江敦涛、黄伟共同见证下，两地签署了《重庆市人民政府 遵义市人民政府深化战略合作框架协议》《遵义市人民政府 西南政法大学战略合作框架协议》等。。在渝期间，代表团考察了西部（重庆）科学城对外合作交流中心、重庆航天火箭电子技术有限公司、重庆金世利航空材料有限公司、赛力斯超级工厂、长安汽车全球研发中心、华润微电子（重庆）有限公司、内陆国际物流枢纽展示中心、磁器口古镇、重庆市数字化城市运行和治理中心等。。重庆市领导陈新武、张国智，遵义市领导孟麟、熊新强、常文松、刘东明、汪能科、王继松、陈钊、曾征，重庆市有关部门负责人，遵义市有关县（市、区）和市有关部门负责人参加相关活动。,7月10日至11日，遵义市党政代表团赴重庆市学习考察，深入贯彻落实习近平总书记在新时代推动西部大开发座谈会上的重要讲话精神和视察贵州重要讲话精神，对标先进学习经验，推动渝遵合作向更深层次、更宽领域拓展。。7月11日下午，渝遵合作交流座谈会召开。重庆市委副书记李明清主持座谈会并讲话，贵州省委常委、遵义市委书记李睿讲话。重庆市副市长江敦涛，遵义市委副书记、市长黄伟分别介绍两地经济社会发展情况。。李明清指出，遵义市经济社会发展成绩显著，中国式现代化遵义实践的经验做法值得重庆借鉴。他说，我们要深入贯彻落实重庆·贵州经济社会发展情况交流座谈会精神，认真落实重庆市与贵州省签订的《深化战略合作框架协议》，持续深化务实合作，共同打造更多合作标志性成果。希望携手加强重大战略规划协同联动，共同服务国家战略腹地建设，推动遵义融入成渝地区双城经济圈建设。携手推进基础设施互联互通，强化铁路大通道建设，深化区域水资源开发利用合作，推进航空网络建设，推动通道物流联网成势。携手推动渝遵产业联动发展，打造特色优势产业集群，深化数字经济合作，推动文旅资源共建共享，完善协同创新体系。携手共建能源保障基地，共同建设全国煤电化工基地，共同开展清洁能源高效开发利用，共同推进区域能源市场建设。携手推进公共服务共建共享，深化教育合作，拓展医疗联动协作，加强政务服务合作。。李睿代表遵义市委、市政府感谢重庆长期以来给予遵义发展的关心支持，对重庆经济社会发展取得的显著成就表示钦佩和祝贺。他说，近年来，重庆深入学习贯彻习近平总书记视察重庆重要讲话重要指示精神，不断推动现代化新重庆建设展现新气象，好思路好做法好经验值得遵义学习借鉴。希望双方进一步深入落实渝黔战略合作框架协议，深化战略对接和发展联动，携手推动两地经济社会高质量发展。进一步深化产业合作，推动红色旅游、绿色生态、现代农业、金属加工等产业协同发展，加快推进产业链、创新链、生活链深度融合。进一步强化互联互通，共同推进航空、铁路、公路、水运等大通道建设，深化中欧班列市场拓展、线路优化，共建西部陆海新通道渝遵综合服务区。进一步推动资源共享，提高跨区域就业、就医、就学等生产生活便捷度，共建新型研发机构和创新应用平台，共同打造区域资源共享新样板。。会上，在李明清、李睿、江敦涛、黄伟共同见证下，两地签署了《重庆市人民政府 遵义市人民政府深化战略合作框架协议》《遵义市人民政府 西南政法大学战略合作框架协议》等。。在渝期间，代表团考察了西部（重庆）科学城对外合作交流中心、重庆航天火箭电子技术有限公司、重庆金世利航空材料有限公司、赛力斯超级工厂、长安汽车全球研发中心、华润微电子（重庆）有限公司、内陆国际物流枢纽展示中心、磁器口古镇、重庆市数字化城市运行和治理中心等。。重庆市领导陈新武、张国智，遵义市领导孟麟、熊新强、常文松、刘东明、汪能科、王继松、陈钊、曾征，重庆市有关部门负责人，遵义市有关县（市、区）和市有关部门负责人参加相关活动。,政府领导到其他城市考察学习或访问,0.0,True
247,贵州省,遵义市,遵义市党政代表团赴珠海市学习考察并召开珠海遵义东西部协作和对口合作联席会议,2024-06-27,https://www.zunyi.gov.cn/xwdt/zyyw/202406/t20240627_84918822.html,"为深入学习贯彻习近平总书记关于深化东西部协作的重要指示精神和在新时代推动西部大开发座谈会上的重要讲话精神,认真落实贵州省党政代表团赴广东学习考察和粤黔东西部协作联席会议精神,持续深化珠遵协作,推动珠海遵义东西部协作各项工作落地落实,着力打造东西部协作典范,6月25日至26日,遵义市党政代表团赴广东省珠海市学习考察。26日下午,两市在珠海召开珠海·遵义东西部协作和对口合作联席会议。遵义市委副书记、市长黄伟,珠海市委副书记、市长黄志豪出席会议并讲话,珠海市领导郭才武、黄振球,遵义市领导吴起、曾征参加。。联席会议上,黄伟代表遵义市委、市政府对珠海市给予遵义的帮扶支持表示衷心感谢。他指出,珠海与遵义开展东西部协作以来,珠海市委、市政府用真情、出实招、真帮扶,推动两地在互访交流中厚植了山水情谊、在务实合作中打造了协作样板,为遵义巩固拓展脱贫攻坚成果和乡村全面振兴注入了强劲动力。他说,当前,遵义正深入学习贯彻习近平总书记视察贵州重要讲话精神,牢牢把握“伟大转折地”历史地位和“省域副中心”战略定位,坚持以高质量发展统揽全局,扎实推进中国式现代化遵义实践。希望双方紧扣各自所需所能,进一步拓展协作领域、深化文旅互动、做好提质文章、扩大开放合作,围绕产业发展、园区共建、招商引资、教育医疗、全域旅游、劳务消费等重点领域,推动更广范围、更深层次、更高水平的交流合作,共同推动珠遵协作不断迈上新台阶、取得更大成果。。黄志豪对黄伟一行表示欢迎。他表示,珠海和遵义自2021年建立结对关系以来,交往越来越密切、合作越来越深入,共同推动东西部协作和对口合作取得积极成效。珠海将深入贯彻落实习近平总书记关于深化东西部协作和革命老区振兴发展的重要指示精神,强化使命担当,充分发挥两市资源禀赋、比较优势、区域特色,拓展协作合作新空间。要强化产业共建,以共同打造“全国新茶饮供应链中心”战略目标为牵引,创新产业园共建、产业转移、招商引资等方面协作模式,在激活发展动能上探索新路径。要强化民生共惠,在劳务协作、消费协作、教育医疗等方面持续强化合作,谋划更多惠及面广、效果良好的项目,更好满足群众美好生活新期待。要强化交流协作,各区、各部门、各结对单位之间要加强对接、紧密合作,不断学习借鉴好经验、好做法,在推进干部人才交流上取得新成效。。会上,珠海市驻遵义工作组汇报了两市东西部协作和对口合作工作情况,两市签署了《珠海市 遵义市2024年度东西部协作协议》。。考察期间,代表团一行先后到珠海鹏辉能源、泰坦新动力电子、高凌信息科技和横琴粤澳深度合作区实地考察,深入学习珠海服务国家战略、深化改革开放、加快科技创新、发展新质生产力等先进经验和成功做法。","为深入学习贯彻习近平总书记关于深化东西部协作的重要指示精神和在新时代推动西部大开发座谈会上的重要讲话精神,认真落实贵州省党政代表团赴广东学习考察和粤黔东西部协作联席会议精神,持续深化珠遵协作,推动珠海遵义东西部协作各项工作落地落实,着力打造东西部协作典范,6月25日至26日,遵义市党政代表团赴广东省珠海市学习考察。26日下午,两市在珠海召开珠海·遵义东西部协作和对口合作联席会议。遵义市委副书记、市长黄伟,珠海市委副书记、市长黄志豪出席会议并讲话,珠海市领导郭才武、黄振球,遵义市领导吴起、曾征参加。。联席会议上,黄伟代表遵义市委、市政府对珠海市给予遵义的帮扶支持表示衷心感谢。他指出,珠海与遵义开展东西部协作以来,珠海市委、市政府用真情、出实招、真帮扶,推动两地在互访交流中厚植了山水情谊、在务实合作中打造了协作样板,为遵义巩固拓展脱贫攻坚成果和乡村全面振兴注入了强劲动力。他说,当前,遵义正深入学习贯彻习近平总书记视察贵州重要讲话精神,牢牢把握“伟大转折地”历史地位和“省域副中心”战略定位,坚持以高质量发展统揽全局,扎实推进中国式现代化遵义实践。希望双方紧扣各自所需所能,进一步拓展协作领域、深化文旅互动、做好提质文章、扩大开放合作,围绕产业发展、园区共建、招商引资、教育医疗、全域旅游、劳务消费等重点领域,推动更广范围、更深层次、更高水平的交流合作,共同推动珠遵协作不断迈上新台阶、取得更大成果。。黄志豪对黄伟一行表示欢迎。他表示,珠海和遵义自2021年建立结对关系以来,交往越来越密切、合作越来越深入,共同推动东西部协作和对口合作取得积极成效。珠海将深入贯彻落实习近平总书记关于深化东西部协作和革命老区振兴发展的重要指示精神,强化使命担当,充分发挥两市资源禀赋、比较优势、区域特色,拓展协作合作新空间。要强化产业共建,以共同打造“全国新茶饮供应链中心”战略目标为牵引,创新产业园共建、产业转移、招商引资等方面协作模式,在激活发展动能上探索新路径。要强化民生共惠,在劳务协作、消费协作、教育医疗等方面持续强化合作,谋划更多惠及面广、效果良好的项目,更好满足群众美好生活新期待。要强化交流协作,各区、各部门、各结对单位之间要加强对接、紧密合作,不断学习借鉴好经验、好做法,在推进干部人才交流上取得新成效。。会上,珠海市驻遵义工作组汇报了两市东西部协作和对口合作工作情况,两市签署了《珠海市 遵义市2024年度东西部协作协议》。。考察期间,代表团一行先后到珠海鹏辉能源、泰坦新动力电子、高凌信息科技和横琴粤澳深度合作区实地考察,深入学习珠海服务国家战略、深化改革开放、加快科技创新、发展新质生产力等先进经验和成功做法。",政府领导到其他城市考察学习或访问,0.0,True
