code,province,city,topic,date,url,content,content.1,label,score,is_match
174,湖南省,长沙市,吴桂英深入学习宣传党的二十大精神以工作实绩检验学习贯彻成效,2022-10-27,http://www.changsha.gov.cn/szf/zfld/ldjh/202210/t20221027_10875443.html,10月26日下午，湖南省委常委、长沙市委书记吴桂英深入宁乡市宣讲党的二十大精神，督导抗旱保收、森林防火等工作。她强调，全市上下要切实把思想统一到党的二十大精神上来，把力量凝聚到实现党的二十大确定的目标任务上来，始终保持“时时放心不下”的责任感和“箭在弦上”的备战姿态，统筹发展和安全，守住粮食安全底线，科学高效抗旱保收，毫不放松抓好森林防火工作，推动党的二十大精神落地生根，以工作实绩检验学习贯彻成效。 长沙市领导刘拥兵、周志凯、邹特参加。 为有效应对旱情，宁乡市横市镇组织一千余名党员干部下沉抗旱一线，让挂着穗子的水稻喝到了“救命水”。在横市社区白马山组，吴桂英详细了解晚稻种植面积和产量。她强调，党的二十大报告明确提出“全方位夯实粮食安全根基，牢牢守住十八亿亩耕地红线”。当前正值粮食收储的关键时期，要坚决扛牢粮食安全政治责任，充分发挥农业机械在农业生产中的主力军作用，扎实做好收获、加工、储备等各项工作，确保颗粒归仓。要严守耕地保护红线，切实遏制耕地“非农化”“非粮化”，加快高标准农田建设。要强化科技支撑，打通农技推广“最后一公里”，不断提高粮食生产现代化水平。 持续干旱的极端天气下，森林防火形势严峻。吴桂英来到沩山乡沩山社区陈家组毗卢峰，实地检查人员值守备勤、森林防灭火器材、物资储备等情况，强调要把做好森林防灭火工作作为贯彻落实党的二十大精神、践行“人民至上、生命至上”理念的具体实践，以高度的政治责任感和极端负责的工作态度，扎实做好森林防灭火各项工作。要进一步强化火险防范、火源管理、火情处置，加大宣传力度，引导群众摒弃陈规陋习，强化监测预警、巡逻巡查，统筹抓好景区的疫情防控、生态环保、公共安全等工作。 督导调研期间，吴桂英与基层党员干部进行现场交流，强调要把学习好、宣传好、贯彻好党的二十大精神，作为当前和今后一个时期的首要政治任务，深入领会精神实质，深刻把握核心要义。全市各级党组织和广大党员干部要始终坚持人民至上，强化红线意识、底线思维，高效统筹疫情防控和经济社会发展，统筹发展和安全，扎实抓好防风险、保安全、护稳定、促发展各项工作，一步一个脚印把党的二十大作出的重大决策部署付诸行动、见到实效。,10月26日下午，湖南省委常委、长沙市委书记吴桂英深入宁乡市宣讲党的二十大精神，督导抗旱保收、森林防火等工作。她强调，全市上下要切实把思想统一到党的二十大精神上来，把力量凝聚到实现党的二十大确定的目标任务上来，始终保持“时时放心不下”的责任感和“箭在弦上”的备战姿态，统筹发展和安全，守住粮食安全底线，科学高效抗旱保收，毫不放松抓好森林防火工作，推动党的二十大精神落地生根，以工作实绩检验学习贯彻成效。 长沙市领导刘拥兵、周志凯、邹特参加。 为有效应对旱情，宁乡市横市镇组织一千余名党员干部下沉抗旱一线，让挂着穗子的水稻喝到了“救命水”。在横市社区白马山组，吴桂英详细了解晚稻种植面积和产量。她强调，党的二十大报告明确提出“全方位夯实粮食安全根基，牢牢守住十八亿亩耕地红线”。当前正值粮食收储的关键时期，要坚决扛牢粮食安全政治责任，充分发挥农业机械在农业生产中的主力军作用，扎实做好收获、加工、储备等各项工作，确保颗粒归仓。要严守耕地保护红线，切实遏制耕地“非农化”“非粮化”，加快高标准农田建设。要强化科技支撑，打通农技推广“最后一公里”，不断提高粮食生产现代化水平。 持续干旱的极端天气下，森林防火形势严峻。吴桂英来到沩山乡沩山社区陈家组毗卢峰，实地检查人员值守备勤、森林防灭火器材、物资储备等情况，强调要把做好森林防灭火工作作为贯彻落实党的二十大精神、践行“人民至上、生命至上”理念的具体实践，以高度的政治责任感和极端负责的工作态度，扎实做好森林防灭火各项工作。要进一步强化火险防范、火源管理、火情处置，加大宣传力度，引导群众摒弃陈规陋习，强化监测预警、巡逻巡查，统筹抓好景区的疫情防控、生态环保、公共安全等工作。 督导调研期间，吴桂英与基层党员干部进行现场交流，强调要把学习好、宣传好、贯彻好党的二十大精神，作为当前和今后一个时期的首要政治任务，深入领会精神实质，深刻把握核心要义。全市各级党组织和广大党员干部要始终坚持人民至上，强化红线意识、底线思维，高效统筹疫情防控和经济社会发展，统筹发展和安全，扎实抓好防风险、保安全、护稳定、促发展各项工作，一步一个脚印把党的二十大作出的重大决策部署付诸行动、见到实效。,其他,0.619041434271147,True
174,湖南省,长沙市,欧美同学会专家组来长考察夏建平谭小平参加,2020-12-24,http://www.changsha.gov.cn/szf/zfld/ldhd/202012/t20201224_9689077.html,12月23日，欧美同学会（中国留学人员联谊会）专家考察组对长沙市申建海归小镇（长沙·智能制造）情况进行实地考察，并召开汇报交流会。市委常委、常务副市长夏建平，市委常委、市委统战部部长谭小平出席相关活动。。夏建平在汇报交流会上介绍了长沙市情以及今年长沙市统筹疫情防控与经济社会发展取得的成绩。他表示，欢迎专家考察组对长沙申建海归小镇工作提建议、出主意，长沙市将对各位专家的宝贵意见认真进行吸纳，更好地开展下一阶段申建工作。。李志坚代表专家考察组，对长沙申建工作给予了充分肯定。他认为，长沙申建工作聚焦关键领域和环节，工作措施实，组织保障好，营商环境优。他还对长沙市如何进一步把申建工作落细、落地、落实提出了意见。。谭小平表示，长沙市将对专家考察组的指导意见进行消化吸收，抓紧时间完善细化相关政策措施，进一步做好申建工作，实现预定目标，吸引更多海归人才来长沙创新创业，为实施“三高四新”战略、促进高质量发展作出贡献。,12月23日，欧美同学会（中国留学人员联谊会）专家考察组对长沙市申建海归小镇（长沙·智能制造）情况进行实地考察，并召开汇报交流会。市委常委、常务副市长夏建平，市委常委、市委统战部部长谭小平出席相关活动。。夏建平在汇报交流会上介绍了长沙市情以及今年长沙市统筹疫情防控与经济社会发展取得的成绩。他表示，欢迎专家考察组对长沙申建海归小镇工作提建议、出主意，长沙市将对各位专家的宝贵意见认真进行吸纳，更好地开展下一阶段申建工作。。李志坚代表专家考察组，对长沙申建工作给予了充分肯定。他认为，长沙申建工作聚焦关键领域和环节，工作措施实，组织保障好，营商环境优。他还对长沙市如何进一步把申建工作落细、落地、落实提出了意见。。谭小平表示，长沙市将对专家考察组的指导意见进行消化吸收，抓紧时间完善细化相关政策措施，进一步做好申建工作，实现预定目标，吸引更多海归人才来长沙创新创业，为实施“三高四新”战略、促进高质量发展作出贡献。,其他,0.67442859559272,True
174,湖南省,长沙市,岳阳市政府代表团来长考察产业链建设,2019-08-24,http://www.changsha.gov.cn/szf/ywdt/zwdt/201908/t20190824_5640153.html,8月22日，岳阳市政府代表团来长沙考察产业链建设发展。长沙市委副书记、市长、湖南湘江新区党工委书记胡忠雄，岳阳市委副书记、市长李爱武，长沙市领导夏建平、邱继兴，岳阳市领导李挚、杨昆参加考察座谈。。岳阳市政府代表团实地走访了长沙经开区产业链办公室和蓝思科技、国科微电子、国家智能网联汽车(长沙)测试区等地，重点考察长沙工程机械、汽车制造、先进轨道交通装备、集成电路、显示功能器件、人工智能及机器人等工业新兴及优势产业链的发展情况。。座谈中，李爱武表示，省委、省政府要求“外学华为、内学长沙”，为长沙经济社会发展尤其是产业链发展取得的巨大成绩由衷点赞。岳阳明确“一区两带”的空间发展格局，致力于打造长岳经济走廊，将认真学习长沙、交流合作长沙、深度融入长沙，重点在工业飞地、交通对接等方面加强合作，加快形成长岳一体化发展新格局。。胡忠雄欢迎代表团来长考察，对岳阳市近年来务实发展取得的显著成绩表示赞赏，并对长沙产业链建设发展经验进行解读。他指出，省委将长沙产业链发展经验总结为两条，即“思路对头、干部能干”。具体地说，抓住了三个关键：一是抓顶层设计，以产业链思维营造产业链生态，推动产业集群发展；二是抓干部到位，充分发挥链长、链办主任、链办专职人员、科技特派员作用，加强产业发展规划统筹，推动工作落地，实现精准发力；三是抓基础工作，即“两图两库两池两报告”，以“两图”明确产业链发展定位，以“两库”促进精准招商，以“两池”强化政府推动，以“两报告”加快动态发展，让产业链发展效率更高、效果更好。。胡忠雄指出，长沙与岳阳共同面临着产业发展“窗口期”“风口期”，下一步可在规划、交通、产业、生态环保等方面加强对接、深化合作。加强规划对接，强化长岳一体化发展理念，打通接壤地区合作通道，为两市发展留足空间；加强交通对接，缩短两地交通的时空距离，做到道路更畅、通道更多、流速更快、出行更便捷；加强产业对接，打破地域界限，加强产业互补，放大工业飞地经济效应；加强生态环保对接，推进生态环境共治，提升生态环境对产业发展的承载能力，共同推动长岳两地资源互补、分工合理、共赢发展，为全省高质量发展作出更大贡献。,8月22日，岳阳市政府代表团来长沙考察产业链建设发展。长沙市委副书记、市长、湖南湘江新区党工委书记胡忠雄，岳阳市委副书记、市长李爱武，长沙市领导夏建平、邱继兴，岳阳市领导李挚、杨昆参加考察座谈。。岳阳市政府代表团实地走访了长沙经开区产业链办公室和蓝思科技、国科微电子、国家智能网联汽车(长沙)测试区等地，重点考察长沙工程机械、汽车制造、先进轨道交通装备、集成电路、显示功能器件、人工智能及机器人等工业新兴及优势产业链的发展情况。。座谈中，李爱武表示，省委、省政府要求“外学华为、内学长沙”，为长沙经济社会发展尤其是产业链发展取得的巨大成绩由衷点赞。岳阳明确“一区两带”的空间发展格局，致力于打造长岳经济走廊，将认真学习长沙、交流合作长沙、深度融入长沙，重点在工业飞地、交通对接等方面加强合作，加快形成长岳一体化发展新格局。。胡忠雄欢迎代表团来长考察，对岳阳市近年来务实发展取得的显著成绩表示赞赏，并对长沙产业链建设发展经验进行解读。他指出，省委将长沙产业链发展经验总结为两条，即“思路对头、干部能干”。具体地说，抓住了三个关键：一是抓顶层设计，以产业链思维营造产业链生态，推动产业集群发展；二是抓干部到位，充分发挥链长、链办主任、链办专职人员、科技特派员作用，加强产业发展规划统筹，推动工作落地，实现精准发力；三是抓基础工作，即“两图两库两池两报告”，以“两图”明确产业链发展定位，以“两库”促进精准招商，以“两池”强化政府推动，以“两报告”加快动态发展，让产业链发展效率更高、效果更好。。胡忠雄指出，长沙与岳阳共同面临着产业发展“窗口期”“风口期”，下一步可在规划、交通、产业、生态环保等方面加强对接、深化合作。加强规划对接，强化长岳一体化发展理念，打通接壤地区合作通道，为两市发展留足空间；加强交通对接，缩短两地交通的时空距离，做到道路更畅、通道更多、流速更快、出行更便捷；加强产业对接，打破地域界限，加强产业互补，放大工业飞地经济效应；加强生态环保对接，推进生态环境共治，提升生态环境对产业发展的承载能力，共同推动长岳两地资源互补、分工合理、共赢发展，为全省高质量发展作出更大贡献。,其他,0.510103982739194,True
174,湖南省,长沙市,吴桂英与长三角知名企业家赴湘投资考察团会谈,2023-08-29,http://www.changsha.gov.cn/szf/ywdt/zwdt/202308/t20230829_11203902.html,8月28日，省委常委、市委书记吴桂英与由上海证券报社党委书记、董事长叶国标带队的长三角知名企业家赴湘投资考察团会谈。。吴桂英对考察团一行表示欢迎。她指出，长沙正全面落实习近平总书记擘画的“三高四新”美好蓝图，全力建设全球研发中心城市，推动高质量发展。各位企业家来自经济活跃、创新能力强、开放程度高的长三角，企业实力雄厚、资源丰富，与长沙科技创新、产业发展契合度高、协同性强。欢迎大家走进长沙、融入长沙、投资长沙，搭建合作平台、落地优质项目，更好实现互利共赢。。叶国标及考察团成员分别介绍了企业发展情况，并表示长沙产业基础坚实、发展空间广阔，是投资兴业、干事创业的沃土。将以此次考察为契机，加强联动、整合资源、集聚要素，为长沙高质量发展贡献力量。,8月28日，省委常委、市委书记吴桂英与由上海证券报社党委书记、董事长叶国标带队的长三角知名企业家赴湘投资考察团会谈。。吴桂英对考察团一行表示欢迎。她指出，长沙正全面落实习近平总书记擘画的“三高四新”美好蓝图，全力建设全球研发中心城市，推动高质量发展。各位企业家来自经济活跃、创新能力强、开放程度高的长三角，企业实力雄厚、资源丰富，与长沙科技创新、产业发展契合度高、协同性强。欢迎大家走进长沙、融入长沙、投资长沙，搭建合作平台、落地优质项目，更好实现互利共赢。。叶国标及考察团成员分别介绍了企业发展情况，并表示长沙产业基础坚实、发展空间广阔，是投资兴业、干事创业的沃土。将以此次考察为契机，加强联动、整合资源、集聚要素，为长沙高质量发展贡献力量。,其他,0.5120852004208873,True
174,湖南省,长沙市,易炼红会见欧洲左翼党青年政治家考察团一行,2014-10-18,http://www.changsha.gov.cn/szf/zfld/ldhd/201410/t20141020_6130130.html,10月17日，省委常委、市委书记易炼红会见了来长就两型社会建设等进行交流访问的欧洲左翼党青年政治家考察团一行。。易炼红对考察团一行的到来表示欢迎。他说，长沙作为国家批复的两型社会建设综合配套改革试验区，多年来一直致力于探索资源节约型和环境友好型发展之路，通过积极实施产业转型升级，淘汰高耗能、高污染、高排放的落后产能，大力实施节地、节水、节能措施，推广绿色建筑模式，倡导绿色低碳出行的生活方式，两型发展已经成为长沙鲜明的标签和靓丽的名片。在长沙美丽的湘江西岸，我们高起点、高标准规划建设了湘江新区，更多的两型元素、绿色理念将在新区生根开花，全市乃至全省人民充满期待。在未来，长沙将一如既往勇担省会责任，大胆改革创新，以更多有力有效的措施，努力实现“天更蓝、山更绿、水更清”的目标。。欧洲左翼党副主席、保加利亚左翼党联合主席玛格丽特·米列娃表示，代表团此行深切感受到长沙所展示的独特魅力，特别是山清水秀的自然风貌与现代都市气息的完美融合，给大家留下了深刻印象，希望通过此次交流访问进一步增进欧洲各国对长沙的了解，把中国内地城市推动环境治理、生态建设创造的好经验推广到更多地方。,10月17日，省委常委、市委书记易炼红会见了来长就两型社会建设等进行交流访问的欧洲左翼党青年政治家考察团一行。。易炼红对考察团一行的到来表示欢迎。他说，长沙作为国家批复的两型社会建设综合配套改革试验区，多年来一直致力于探索资源节约型和环境友好型发展之路，通过积极实施产业转型升级，淘汰高耗能、高污染、高排放的落后产能，大力实施节地、节水、节能措施，推广绿色建筑模式，倡导绿色低碳出行的生活方式，两型发展已经成为长沙鲜明的标签和靓丽的名片。在长沙美丽的湘江西岸，我们高起点、高标准规划建设了湘江新区，更多的两型元素、绿色理念将在新区生根开花，全市乃至全省人民充满期待。在未来，长沙将一如既往勇担省会责任，大胆改革创新，以更多有力有效的措施，努力实现“天更蓝、山更绿、水更清”的目标。。欧洲左翼党副主席、保加利亚左翼党联合主席玛格丽特·米列娃表示，代表团此行深切感受到长沙所展示的独特魅力，特别是山清水秀的自然风貌与现代都市气息的完美融合，给大家留下了深刻印象，希望通过此次交流访问进一步增进欧洲各国对长沙的了解，把中国内地城市推动环境治理、生态建设创造的好经验推广到更多地方。,政府领导到其他城市考察学习或访问,0.0,True
174,湖南省,长沙市,胡衡华赴珠海格力电器股份有限公司考察,2019-09-03,http://www.changsha.gov.cn/szf/zfld/ldhd/201909/t20190903_6131538.html,9月1日，省委常委、市委书记胡衡华带队赴珠海格力电器股份有限公司考察并见证格力电器长沙冰箱洗衣机项目签约仪式，格力电器董事长、总裁董明珠参加活动。。胡衡华一行在格力电器总部先后参观了展厅、模具工厂、商用空调工厂、国家重点实验室等，详细了解格力的产品特点、生产工艺和智能生产设备等情况。。在座谈会上，胡衡华表示，再次到格力总部考察，进一步感受到了格力在智能制造，特别是在核心科技研发、基础工业上的执着和投入，它真正走在了行业前列，体现了企业的担当。胡衡华充分肯定格力创新进取、精益求精的企业工匠精神。他指出，格力电器是中国企业的骄傲，是世界级的制造企业，格力电器的“四个创新”文化是对习近平总书记“四个自信”的最好实践和生动诠释。胡衡华强调，长沙将进一步优化营商环境，继续深化与格力的合作，将长沙基地不断做优、做大、做强，打造成中部地区展示格力的重要窗口。。董明珠表示，格力电器自落户长沙以来，与长沙结下了深厚的情谊，真切地感受到了长沙这座城市的温度、热情。格力长沙基地遇到的困难，都能及时顺利解决。格力将进一步扩大在长沙的投资，一方面扩大家用空调产能，加快商用空调项目的建设并满负荷生产；另一方面，尽快完善冰箱洗衣机项目的前期工作，启动项目建设，同时考虑模具等后续项目的投资，把长沙基地作为格力扩大产能的首选。。座谈会结束后，双方举行了格力电器长沙冰箱洗衣机项目签约仪式。冰箱洗衣机项目总投资约50亿元，用地961亩，年产洗衣机200万台、冰箱250万台，年销售额约100亿元。目前，格力电器已完成市场调研及投资计划、平面布局初步设计等前期工作，项目预计在年内启动建设。,9月1日，省委常委、市委书记胡衡华带队赴珠海格力电器股份有限公司考察并见证格力电器长沙冰箱洗衣机项目签约仪式，格力电器董事长、总裁董明珠参加活动。。胡衡华一行在格力电器总部先后参观了展厅、模具工厂、商用空调工厂、国家重点实验室等，详细了解格力的产品特点、生产工艺和智能生产设备等情况。。在座谈会上，胡衡华表示，再次到格力总部考察，进一步感受到了格力在智能制造，特别是在核心科技研发、基础工业上的执着和投入，它真正走在了行业前列，体现了企业的担当。胡衡华充分肯定格力创新进取、精益求精的企业工匠精神。他指出，格力电器是中国企业的骄傲，是世界级的制造企业，格力电器的“四个创新”文化是对习近平总书记“四个自信”的最好实践和生动诠释。胡衡华强调，长沙将进一步优化营商环境，继续深化与格力的合作，将长沙基地不断做优、做大、做强，打造成中部地区展示格力的重要窗口。。董明珠表示，格力电器自落户长沙以来，与长沙结下了深厚的情谊，真切地感受到了长沙这座城市的温度、热情。格力长沙基地遇到的困难，都能及时顺利解决。格力将进一步扩大在长沙的投资，一方面扩大家用空调产能，加快商用空调项目的建设并满负荷生产；另一方面，尽快完善冰箱洗衣机项目的前期工作，启动项目建设，同时考虑模具等后续项目的投资，把长沙基地作为格力扩大产能的首选。。座谈会结束后，双方举行了格力电器长沙冰箱洗衣机项目签约仪式。冰箱洗衣机项目总投资约50亿元，用地961亩，年产洗衣机200万台、冰箱250万台，年销售额约100亿元。目前，格力电器已完成市场调研及投资计划、平面布局初步设计等前期工作，项目预计在年内启动建设。,政府领导到其他城市考察学习或访问,0.0,True
