code,province,city,topic,date,url,content,content.1,label,score,is_match
174,湖南省,长沙市,谭勇带队赴北京学习考察,2024-05-31,http://www.changsha.gov.cn/szf/ywdt/zwdt/202405/t20240531_11461121.html,5月30日，长沙市委副书记、湖南湘江新区（长沙高新区）党工委书记、岳麓区委书记、市智能网联汽车产业链链长谭勇带队赴北京学习考察。他要求，要深入贯彻落实习近平总书记在湖南考察时的重要讲话和重要指示精神，学习借鉴发展经验，加速培育、聚集、壮大智能网联汽车产业生态，为长沙市发展新质生产力提供强有力支撑。。在北京期间，谭勇先后考察了北京市高级别自动驾驶示范区、北京亦庄新石器无人车智能化物流共配工厂、极越北京亦庄交付中心（Apollo Park）工厂，并与东华软件股份公司负责人交流，了解示范区在顶层设计、体制机制、运营模式、政策法规等方面的先进经验和企业科技创新及成果转化等情况，在对标先进中进一步明晰长沙智能网联汽车产业发展方向和工作重点。。谭勇指出，北京亦庄作为全球首个车路云一体化高级别自动驾驶示范区，在探索车、路、云、网、图五位一体建设、开放自动驾驶出行等方面的经验做法，值得长沙借鉴学习。当前，长沙正深入学习贯彻习近平总书记关于发展新质生产力的重要论述，坚持把智能网联汽车产业作为发展新兴产业的主攻方向。要充分学习借鉴示范区的经验做法，高标准谋划长沙智能网联汽车产业顶层设计、应用场景体系和重点项目，吸引更多生态企业落户。希望两地进一步加强沟通协作，共同探索改革创新举措，在智能网联汽车应用场景拓展、关键核心技术攻关等方面深化务实合作，谋划实施一批面向全国具有影响力的可复制、可示范、可推广的先进成果，共同谱写智能网联产业协同发展新篇章。,5月30日，长沙市委副书记、湖南湘江新区（长沙高新区）党工委书记、岳麓区委书记、市智能网联汽车产业链链长谭勇带队赴北京学习考察。他要求，要深入贯彻落实习近平总书记在湖南考察时的重要讲话和重要指示精神，学习借鉴发展经验，加速培育、聚集、壮大智能网联汽车产业生态，为长沙市发展新质生产力提供强有力支撑。。在北京期间，谭勇先后考察了北京市高级别自动驾驶示范区、北京亦庄新石器无人车智能化物流共配工厂、极越北京亦庄交付中心（Apollo Park）工厂，并与东华软件股份公司负责人交流，了解示范区在顶层设计、体制机制、运营模式、政策法规等方面的先进经验和企业科技创新及成果转化等情况，在对标先进中进一步明晰长沙智能网联汽车产业发展方向和工作重点。。谭勇指出，北京亦庄作为全球首个车路云一体化高级别自动驾驶示范区，在探索车、路、云、网、图五位一体建设、开放自动驾驶出行等方面的经验做法，值得长沙借鉴学习。当前，长沙正深入学习贯彻习近平总书记关于发展新质生产力的重要论述，坚持把智能网联汽车产业作为发展新兴产业的主攻方向。要充分学习借鉴示范区的经验做法，高标准谋划长沙智能网联汽车产业顶层设计、应用场景体系和重点项目，吸引更多生态企业落户。希望两地进一步加强沟通协作，共同探索改革创新举措，在智能网联汽车应用场景拓展、关键核心技术攻关等方面深化务实合作，谋划实施一批面向全国具有影响力的可复制、可示范、可推广的先进成果，共同谱写智能网联产业协同发展新篇章。,政府领导到其他城市考察学习或访问,0.5238138524641804,True
174,湖南省,长沙市,易炼红率团赴株洲学习考察,2015-08-22,http://www.changsha.gov.cn/szf/zfld/ldhd/201508/t20150824_6130341.html,作为长株潭国家两型社会建设综合配套改革试验区、长株潭国家自主创新示范区的重要两极，长沙和株洲同饮湘江水，共同肩负着城市群转型创新发展的重大使命。8月21日，省委常委、市委书记易炼红率团前往株洲市考察，围绕产业转型升级、园区建设发展、城市规划建设管理等主题进行深入交流。株洲市委书记贺安杰参加考察。。近年来，长株两地融合发展的步伐越走越快，从城区出发，经长株高速仅用时45分钟就抵达了株洲。一路上，道路宽敞干净，在绿树鲜花的映衬下，一栋栋高品质的建筑物、一个个精心打造的城市景观、一座座点缀城中的休闲公园，带来了株洲城市面貌日新月异的变化。过去的老工业基地已经嬗变为宜居宜业的现代化都市。。行走在湘江株洲城区段，滨江路、自行车道、沙滩广场、篮球场等活动设施造就了绝佳的亲水空间，一幅山水亲和、城景交融的东岸画卷徐徐展开；神农城突出神农文化主题，布局了9大标志性建筑和景观，打造出集文化、旅游、商业于一体的新型城市开放空间；通过水系贯通，占地1800亩的湘水湾生态公园则与神农城景观融为一体，构成了株洲城市南北轴向上一道特别的景观……城市美景的背后是一整套严密的管理机制。株洲数字化城管指挥中心通过执行“管理网格化、作业精细化、考评标准化、运作市场化”的机制，极大提高了城市管理的效率、精度和力度。考察团成员们一边看、一边交流，在纷纷点赞的同时，大家也一致认为，株洲在打造开放宜居城市中的大气魄、精细化为长沙提供了不少值得借鉴学习的好经验，回来将认真总结提炼，结合各自工作实际，推动城市规划建设管理再提质、再升级。。在大力提升城市品质的同时，株洲并没有放慢经济转型升级的步伐。近年来，株洲大力实施创新驱动发展战略，传统产业在自主创新中得到全面升级。在中车株洲电力机车有限公司，企业凭借国际一流的研发能力和全球最大生产能力，产品销售在国内外市场全面开花，成为中国装备“走出去”的代表作，长沙正大力发展的轨道交通也有不少采用了株洲制造的地铁列车。考察团一行走进生产车间，详细了解产品研发、销售等情况，对做精做强传统产业、培育做大新兴产业的转型思路给予赞赏。“长沙、株洲产业互补性强，双方要深度合作、差异化生存，推动两市的企业和产业同步向高附加值、高技术含量转型升级。”易炼红给随行的区县市、园区单位负责人交任务，要求他们考察途中就要开始项目对接，将学习之旅变成收获之旅。。既有城市品质，又有产业基础，产城融合式发展便成了水到渠成的事情。株洲正全力建设“中国动力谷”，努力打造轨道交通、通用航空、新能源汽车三大千亿级产业集群。考察团在抓紧建设之中的中国动力谷自主创新园看到，创业者能够获得从创意、研发、孵化、创业、生产的全流程、一站式服务，花园式的厂区外各种生活配套一应俱全，在这里工作生活，你很难想象这是一个工业园区。此外，位于云龙示范区的职业教育科技园依靠邻近企业的优势，落户了五所各具特色的高职院校，每年培养高技能人才5万人，为园区企业提供了坚实的人才支撑，也给园区带来了人气和活力。“要学习株洲园区的创意设计、创新理念，加快打造产城融合、宜居宜业的现代城市经济综合体！”易炼红说，长沙的园区要深入推进集群化项目满园扩园和两型化管理提标提档行动，把创意创新创业结合起来，进一步做优做强转型创新发展的主阵地，打造开放合作、投资兴业的新高地。,作为长株潭国家两型社会建设综合配套改革试验区、长株潭国家自主创新示范区的重要两极，长沙和株洲同饮湘江水，共同肩负着城市群转型创新发展的重大使命。8月21日，省委常委、市委书记易炼红率团前往株洲市考察，围绕产业转型升级、园区建设发展、城市规划建设管理等主题进行深入交流。株洲市委书记贺安杰参加考察。。近年来，长株两地融合发展的步伐越走越快，从城区出发，经长株高速仅用时45分钟就抵达了株洲。一路上，道路宽敞干净，在绿树鲜花的映衬下，一栋栋高品质的建筑物、一个个精心打造的城市景观、一座座点缀城中的休闲公园，带来了株洲城市面貌日新月异的变化。过去的老工业基地已经嬗变为宜居宜业的现代化都市。。行走在湘江株洲城区段，滨江路、自行车道、沙滩广场、篮球场等活动设施造就了绝佳的亲水空间，一幅山水亲和、城景交融的东岸画卷徐徐展开；神农城突出神农文化主题，布局了9大标志性建筑和景观，打造出集文化、旅游、商业于一体的新型城市开放空间；通过水系贯通，占地1800亩的湘水湾生态公园则与神农城景观融为一体，构成了株洲城市南北轴向上一道特别的景观……城市美景的背后是一整套严密的管理机制。株洲数字化城管指挥中心通过执行“管理网格化、作业精细化、考评标准化、运作市场化”的机制，极大提高了城市管理的效率、精度和力度。考察团成员们一边看、一边交流，在纷纷点赞的同时，大家也一致认为，株洲在打造开放宜居城市中的大气魄、精细化为长沙提供了不少值得借鉴学习的好经验，回来将认真总结提炼，结合各自工作实际，推动城市规划建设管理再提质、再升级。。在大力提升城市品质的同时，株洲并没有放慢经济转型升级的步伐。近年来，株洲大力实施创新驱动发展战略，传统产业在自主创新中得到全面升级。在中车株洲电力机车有限公司，企业凭借国际一流的研发能力和全球最大生产能力，产品销售在国内外市场全面开花，成为中国装备“走出去”的代表作，长沙正大力发展的轨道交通也有不少采用了株洲制造的地铁列车。考察团一行走进生产车间，详细了解产品研发、销售等情况，对做精做强传统产业、培育做大新兴产业的转型思路给予赞赏。“长沙、株洲产业互补性强，双方要深度合作、差异化生存，推动两市的企业和产业同步向高附加值、高技术含量转型升级。”易炼红给随行的区县市、园区单位负责人交任务，要求他们考察途中就要开始项目对接，将学习之旅变成收获之旅。。既有城市品质，又有产业基础，产城融合式发展便成了水到渠成的事情。株洲正全力建设“中国动力谷”，努力打造轨道交通、通用航空、新能源汽车三大千亿级产业集群。考察团在抓紧建设之中的中国动力谷自主创新园看到，创业者能够获得从创意、研发、孵化、创业、生产的全流程、一站式服务，花园式的厂区外各种生活配套一应俱全，在这里工作生活，你很难想象这是一个工业园区。此外，位于云龙示范区的职业教育科技园依靠邻近企业的优势，落户了五所各具特色的高职院校，每年培养高技能人才5万人，为园区企业提供了坚实的人才支撑，也给园区带来了人气和活力。“要学习株洲园区的创意设计、创新理念，加快打造产城融合、宜居宜业的现代城市经济综合体！”易炼红说，长沙的园区要深入推进集群化项目满园扩园和两型化管理提标提档行动，把创意创新创业结合起来，进一步做优做强转型创新发展的主阵地，打造开放合作、投资兴业的新高地。,政府领导到其他城市考察学习或访问,0.0,True
174,湖南省,长沙市,周海兵率团赴南昌市景德镇市考察学习,2023-11-15,http://www.changsha.gov.cn/szf/ywdt/zwdt/202311/t20231115_11286906.html,11月13—14日，副省长、市长周海兵率团赴江西省考察学习，贯彻落实习近平总书记在进一步推动长江经济带高质量发展座谈会上的重要讲话精神，深入南昌市、景德镇市学习先进经验、深化交流合作。南昌市领导万广明、梅峰、江新洪、王强，南昌市政府秘书长邹晓东；景德镇市领导刘锋、胡雪梅、邓永翔，景德镇市政府秘书长黄建平；长沙市领导周志凯、周敏，长沙市政府秘书长许凡参加。。周海兵一行来到南昌，先后走进699文化创意园、万寿宫历史文化街区、雷公坳文化体育产业园，认真考察学习城市建设运营管理、有机更新、历史文化街区建设运营等方面的经验做法。。“陶阳十三里，烟火十万家”。在“千年瓷都”景德镇，周海兵一行走进景德镇市陶溪川文创街区、陶阳里历史文化街区、景德镇中国陶瓷博物馆、中国景德镇国际陶博城等地考察学习，深入了解千年窑火越燃越旺的“密码”，学习景德镇市保护传承陶瓷文化、培育文化旅游新业态、以文化赋能城市发展的先进经验。。周海兵指出，南昌市、景德镇市是长沙市的好邻居，也是互学互鉴的好朋友、常来常往的好兄弟。全市各级各相关部门要学习两市先进做法，坚持解放思想，不断创新思路，优化历史文化街区建设运营管理机制，实现街区集中打造、精细管理、有序运营。要坚持文化为先，抢抓文博文创消费风口，深入挖掘湖湘文化内涵，将文化资源导入城市重点街区，打造湖湘文化街区博物馆，推动资源变资产、“流量”变“销量”，增添商圈文化内涵，带动城市品质提升。要坚持保护为要，高度重视铜官窑陶瓷文化保护传承工作，加强与景德镇等其他陶瓷产区的互动交流，共同推动陶瓷产业发展。要推进全民健身，积极发展体育产业，引入专业团队规划建设运营体育场馆、设施，推动群众体育与经济、文化、旅游等事业融合发展，为城市发展增添活力。。南昌市委副书记、市长万广明代表南昌市委、市政府对长沙市政府代表团一行表示欢迎。他说，长沙市与南昌市有着深厚的历史渊源和合作基础。希望两地充分发挥资源优势，共享发展机遇，推动两市在更高层次、更广领域开展务实合作，携手走好高质量发展之路。。景德镇市委书记刘锋，市委副书记、市长胡雪梅代表景德镇市委、市政府对长沙市政府代表团一行表示欢迎。刘锋表示，长沙市与景德镇市具有广泛合作空间，期待两市加强交流沟通，互鉴经验做法，深化各领域合作，推动互利共赢“双向奔赴”，续写两地友好情谊新篇。,11月13—14日，副省长、市长周海兵率团赴江西省考察学习，贯彻落实习近平总书记在进一步推动长江经济带高质量发展座谈会上的重要讲话精神，深入南昌市、景德镇市学习先进经验、深化交流合作。南昌市领导万广明、梅峰、江新洪、王强，南昌市政府秘书长邹晓东；景德镇市领导刘锋、胡雪梅、邓永翔，景德镇市政府秘书长黄建平；长沙市领导周志凯、周敏，长沙市政府秘书长许凡参加。。周海兵一行来到南昌，先后走进699文化创意园、万寿宫历史文化街区、雷公坳文化体育产业园，认真考察学习城市建设运营管理、有机更新、历史文化街区建设运营等方面的经验做法。。“陶阳十三里，烟火十万家”。在“千年瓷都”景德镇，周海兵一行走进景德镇市陶溪川文创街区、陶阳里历史文化街区、景德镇中国陶瓷博物馆、中国景德镇国际陶博城等地考察学习，深入了解千年窑火越燃越旺的“密码”，学习景德镇市保护传承陶瓷文化、培育文化旅游新业态、以文化赋能城市发展的先进经验。。周海兵指出，南昌市、景德镇市是长沙市的好邻居，也是互学互鉴的好朋友、常来常往的好兄弟。全市各级各相关部门要学习两市先进做法，坚持解放思想，不断创新思路，优化历史文化街区建设运营管理机制，实现街区集中打造、精细管理、有序运营。要坚持文化为先，抢抓文博文创消费风口，深入挖掘湖湘文化内涵，将文化资源导入城市重点街区，打造湖湘文化街区博物馆，推动资源变资产、“流量”变“销量”，增添商圈文化内涵，带动城市品质提升。要坚持保护为要，高度重视铜官窑陶瓷文化保护传承工作，加强与景德镇等其他陶瓷产区的互动交流，共同推动陶瓷产业发展。要推进全民健身，积极发展体育产业，引入专业团队规划建设运营体育场馆、设施，推动群众体育与经济、文化、旅游等事业融合发展，为城市发展增添活力。。南昌市委副书记、市长万广明代表南昌市委、市政府对长沙市政府代表团一行表示欢迎。他说，长沙市与南昌市有着深厚的历史渊源和合作基础。希望两地充分发挥资源优势，共享发展机遇，推动两市在更高层次、更广领域开展务实合作，携手走好高质量发展之路。。景德镇市委书记刘锋，市委副书记、市长胡雪梅代表景德镇市委、市政府对长沙市政府代表团一行表示欢迎。刘锋表示，长沙市与景德镇市具有广泛合作空间，期待两市加强交流沟通，互鉴经验做法，深化各领域合作，推动互利共赢“双向奔赴”，续写两地友好情谊新篇。,政府领导到其他城市考察学习或访问,0.8367211540284635,True
174,湖南省,长沙市,长沙市党政代表团赴江苏苏州学习考察,2024-05-16,http://www.changsha.gov.cn/szf/ywdt/zwdt/202405/t20240516_11443492.html,5月15日下午，江苏省委常委、苏州市委书记刘小涛会见湖南省委常委、长沙市委书记吴桂英率领的代表团一行。。会见中，刘小涛代表苏州市委市政府向长沙市党政代表团的到来表示欢迎，向长沙一直以来给予苏州发展的关心支持表示感谢。他说，长沙科教资源丰富、产业基础雄厚，近年来在产业培育、文化传承、城市建设、乡村振兴等方面成效显著，值得苏州认真学习。当前，苏州正深入学习贯彻习近平总书记重要讲话精神，围绕加快发展新质生产力，深入实施“苏州智造”强基提质行动，奋力打造“智造之城”。苏州和长沙经济互补性强、产业关联度高，合作空间广阔。希望双方充分发挥各自优势，在创新协同、产业转型、江海河联运、文创旅游、跨境电商等方面深化合作，共同探索发展新质生产力的实践路径，更好服务长江经济带等国家战略，携手为全国发展大局多作贡献。。吴桂英代表长沙市委市政府向苏州长期以来给予的关心支持表示感谢。她说，苏州是历史文化名城，也是我国改革开放的一面旗帜。在此次学习考察中，我们直观地感受到苏州“走在前列”的使命担当、“勇立潮头”的改革气魄、“强富美高”的实践成果，发展成就令人钦佩，宝贵经验值得学习。长沙和苏州同为长江经济带重要中心城市，承载着习近平总书记和党中央的殷切期望。长沙将以此次学习考察为新起点，携手苏州在创新研发和成果转化、构建现代化产业体系、深化改革开放、文旅深度融合等方面深化合作，大力支持产业园区联动、先进制造业产业链高效协同、优势领域联合技术攻关，共同在服务区域协调发展大局、推进中国式现代化中作出新的更大贡献。。在苏州期间，长沙市党政代表团先后走进苏州工业园区展示中心、苏州纳米城、协鑫（集团）控股有限公司、宝时得科技（中国）有限公司、苏州市智能制造融合发展中心、平江历史文化街区、苏州市规划展示馆进行考察。。苏州市领导王飏、陈嵘、李赞，长沙市领导朱东铁、陈澎、邹特、周志凯、彭涛、周春晖参加相关活动。,5月15日下午，江苏省委常委、苏州市委书记刘小涛会见湖南省委常委、长沙市委书记吴桂英率领的代表团一行。。会见中，刘小涛代表苏州市委市政府向长沙市党政代表团的到来表示欢迎，向长沙一直以来给予苏州发展的关心支持表示感谢。他说，长沙科教资源丰富、产业基础雄厚，近年来在产业培育、文化传承、城市建设、乡村振兴等方面成效显著，值得苏州认真学习。当前，苏州正深入学习贯彻习近平总书记重要讲话精神，围绕加快发展新质生产力，深入实施“苏州智造”强基提质行动，奋力打造“智造之城”。苏州和长沙经济互补性强、产业关联度高，合作空间广阔。希望双方充分发挥各自优势，在创新协同、产业转型、江海河联运、文创旅游、跨境电商等方面深化合作，共同探索发展新质生产力的实践路径，更好服务长江经济带等国家战略，携手为全国发展大局多作贡献。。吴桂英代表长沙市委市政府向苏州长期以来给予的关心支持表示感谢。她说，苏州是历史文化名城，也是我国改革开放的一面旗帜。在此次学习考察中，我们直观地感受到苏州“走在前列”的使命担当、“勇立潮头”的改革气魄、“强富美高”的实践成果，发展成就令人钦佩，宝贵经验值得学习。长沙和苏州同为长江经济带重要中心城市，承载着习近平总书记和党中央的殷切期望。长沙将以此次学习考察为新起点，携手苏州在创新研发和成果转化、构建现代化产业体系、深化改革开放、文旅深度融合等方面深化合作，大力支持产业园区联动、先进制造业产业链高效协同、优势领域联合技术攻关，共同在服务区域协调发展大局、推进中国式现代化中作出新的更大贡献。。在苏州期间，长沙市党政代表团先后走进苏州工业园区展示中心、苏州纳米城、协鑫（集团）控股有限公司、宝时得科技（中国）有限公司、苏州市智能制造融合发展中心、平江历史文化街区、苏州市规划展示馆进行考察。。苏州市领导王飏、陈嵘、李赞，长沙市领导朱东铁、陈澎、邹特、周志凯、彭涛、周春晖参加相关活动。,政府领导到其他城市考察学习或访问,0.0,True
