code,province,city,topic,date,url,content,content.1,label,score,is_match
197,广东省,惠州市,台湾电电工会参访团到我区考察,2012-08-22,http://www.hzzk.gov.cn/zzgxqgwhmhwz/zwgk/zwdt/content/post_571904.html,8月21日下午，在市委副书记陈训廷，省台办副主任陈林佐的陪同下，由台湾区电机电子工业同业会（简称台湾电电工会）成员组成的参访团一行10余人到我区参观考察，主要就电子产业未来发展方向及双方在电子产业方面合作的可能性进行了交流探讨。市委副秘书长、市台办主任廖巍，区委副书记、管委会常务副主任文绍良，区委常委，管委会副主任钳颖杰及省、市台办负责人、区直相关部门负责人参加了座谈并陪同参访代表到TCL液晶模组、德赛西威等企业进行了实地参观。 座谈会上，陈训廷向来访代表介绍了惠州市近年来的经济社会发展情况，他总结了惠州在吸引投资者方面的三大优势。一是营商环境好，政府对企业服务到位。二是生态环境好，宜居宜业城市建设卓有成效。三是人文环境好，城市包容性强，幸福指数高。陈训廷希望以此次考察为契机，增进彼此了解，加强交流合作，实现互利双赢，共创惠台合作美好未来。 文绍良、钳颖杰向来宾介绍了仲恺高新区经济社会发展情况，表达了与台湾电电工会进行更深入交流合作的意愿。参访团代表对仲恺高新区的产业发展及人才工作等给出了意见和建议，表示将在这次访问的基础上建立长久友谊，期待未来的进一步合作。 据介绍，台湾电电工会的相关企业产品技术含量高、管理先进、人才济济，引领着电子工业的潮流。仲恺高新区电子信息、新能源产业发展有非常好的基础，加强双方合作，前景将十分广阔。。座谈会上，陈训廷向来访代表介绍了惠州市近年来的经济社会发展情况，他总结了惠州在吸引投资者方面的三大优势。一是营商环境好，政府对企业服务到位。二是生态环境好，宜居宜业城市建设卓有成效。三是人文环境好，城市包容性强，幸福指数高。陈训廷希望以此次考察为契机，增进彼此了解，加强交流合作，实现互利双赢，共创惠台合作美好未来。。文绍良、钳颖杰向来宾介绍了仲恺高新区经济社会发展情况，表达了与台湾电电工会进行更深入交流合作的意愿。参访团代表对仲恺高新区的产业发展及人才工作等给出了意见和建议，表示将在这次访问的基础上建立长久友谊，期待未来的进一步合作。。据介绍，台湾电电工会的相关企业产品技术含量高、管理先进、人才济济，引领着电子工业的潮流。仲恺高新区电子信息、新能源产业发展有非常好的基础，加强双方合作，前景将十分广阔。,5月22日下午，博罗分中心主任钟健活同志率该中心中层以上干部一行11人到我中心进行了考察交流。。考察组一行首先在凌云志同志等我中心领导的陪同下参观了中心交易服务大厅、开标评标区和办公区等场地设施，详细询问了监控系统、监控视频自动刻录打印设备的使用状况，对我中心近年来在争取场所增加所取得的成效和对设施规范配备工作的重视、投入等表示肯定。随后，双方在。楼会议室开展了工作业务上的交流座谈，就各自分中心交易信息化系统使用状况、村集体征地留用地挂牌交易、评标专家抽取管理、招标代理规范履职监督管理等问题展开了深入探讨。。凌云志主任表示，感谢博罗同行前来传经送宝，这次交流学习，让惠阳分中心干部职工受益匪浅；通过这次良好的沟通与交流，也让惠阳分中心发现了一些工作上的不足。,其他,0.5823490525804675,True
197,广东省,惠州市,国际华人科技工商协会到惠考察,2017-03-25,http://www.huizhou.gov.cn/zwgk/hzsz/zwyw/content/post_202235.html,昨日，以国际华人科技工商协会主席李大西博士为团长的国际华人科技工商协会代表团一行到我市考察。市委书记、市人大常委会主任陈奕威，市委副书记、市长麦教猛，市委常委、市政府党组成员胡建斌参加活动。。座谈中，陈奕威代表市委、市政府对李大西博士一行的到来表示欢迎，并简要介绍了我市经济社会发展情况。他说，惠州区位优势突出、生态环境优良、经济发展快速、发展前景广阔。当前，惠州处于“五位一体”跨越发展的黄金时期，正大力推进一批重大项目建设，着力构建“2＋2＋N”现代产业体系，努力建设绿色化现代山水城市。希望国际华人科技工商协会积极参与惠州经济社会建设和推动创新驱动发展，进一步加强合作，发挥桥梁纽带作用，多宣传推介惠州。。李大西博士对我市优美的生态环境和巨大的发展潜力表示赞赏。他说，希望通过此次考察，推介高新技术项目，寻找新的合作商机，探讨与惠州合作建立创新孵化基地以及搭建信息技术、高端汽车制造、生物研究等产业平台。（记者杨 熠）,为进一步助力惠东跨境电商行业发展，切实做好招商引资工作，推动惠东县经济高质量发展，2024年3月11日-14日，县商务局副局长叶小健同志带队，赴山东省考察跨境电商项目，了解企业信息及运营情况，深入探讨合作事宜。。万物视界（青岛）跨境电子商务有限公司负责人表示，惠东区位交通优越，时尚女鞋产业基础扎实，根据前期调研，发展跨境电商产业潜力大前景好，万物视界落户惠东意向强烈，希望双方下来可以强化对接交流，推动项目取得实质性进展。,其他,0.5101296450668282,True
197,广东省,惠州市,永亨银行中国行长抵惠考察,2011-11-20,http://www.huizhou.gov.cn/wsfw/ggfw/gysy/zxdt/content/post_185361.html,11月18日，永亨银行（中国）行长兼执行董事何国浩一行到我市考察，受到副市长邓庆忠的热情欢迎。。邓庆忠向何国浩一行介绍了我市经济社会发展情况。他说，永亨银行历史悠久，资本雄厚，希望永亨银行（中国）有限公司在我市设立的支行早日开业，进一步加强银政、银企合作，共同为升华惠民之州、建设幸福惠州提供更多支持。我市金融等有关部门要进一步提升服务水平，营造良好的投资环境，大力支持永亨银行等金融机构发展，实现合作共赢。。何国浩介绍了永亨银行在惠发展计划。他表示，永亨银行非常看好惠州良好的发展态势和广阔的发展空间，将更多关注中小企业等融资需求，全力支持惠州经济社会发展。（记者田铁流 通讯员李莉）,5月23日，河源市和平县科协党组书记、主席陈宏淡率队到我区考察交流提升基层科协组织力“3+1”工作及镇街科协组织建设等工作，受到我会及淡水街道科协、秋长街道科协等有关负责人的热烈欢迎。。上午，和平县科协一行到淡水街道开展学习考察活动。淡水街道党工委委员、科协主席黄春容向考察组详细介绍了街道科协的机构设立、人员配置、设施建设、日常运行及活动开展等有关情况，并就科协“3+1”工作及基层科普宣传工作中遇到的困难和问题进行了交流和探讨。同时，考察组一行实地察看了淡水街道科普活动室、科普阅览室及科普宣传栏等科普设施。考察组对街道党工委高度重视科协工作及街道科协健全的组织机构、完善的场馆设施、强大的科普队伍、充足的工作经费、丰富的科普活动和突出的工作成效给予了高度赞扬。。下午，考察组又到秋长街道参观交流。考察组一行首先与街道科协相关负责人座谈交流，详细了解街道科协近几年来开展科普宣传活动有关情况及基层科协组织建设和科协换届等工作。随后来到叶挺将军纪念园缅怀革命先烈，先后参观了纪念馆和故居的各个展厅，通过珍藏的战争史料图片、文史资料和战斗场景、雕塑等，全面了解了叶挺将军戎马倥偬的一生，追寻叶挺将军曾经走过的足迹，缅怀叶挺将军的革命斗志和历史功勋。最后，考察组一行来到秋长茶园村木公幌“凤悦.秋长谷里” 参观我区乡村振兴市场化试点项目，对该项目通过政府引导，加强规划引领，引进产业集团，发挥村民主体作用，利用社会资本激活农村资源资产活力，在相对完整的保存村庄原有生态风貌的基础上，以乡村承载产业，以产业发展带动农民就业增收的发展模式赞叹不已，并表示一定要好好借鉴和推广。。此外，考察组一行还到我区科技体验中心参观和现场体验科技展品，对该中心布局的科学性、合理性和展品的趣味性、可操作性等表示十分赞赏，同时对我区科协的基层组织建设、科普活动开展、信息动态发布、方法内容创新等工作给予了高度评价，并表示本次考察学习活动使惠阳、和平两地科协加深了了解、增进了友谊、促进了工作，以后要不断加强两地科协的交流合作，共同推动新时代科协工作创新发展。,政府领导到其他城市考察学习或访问,0.0,True
197,广东省,惠州市,墨西哥政务和经贸代表团到我县考察,2017-08-24,http://www.boluo.gov.cn/xzygdw/xgbdst/blxw/content/post_2938060.html,近日，墨西哥金字塔市主席、市长顾问布兰达.内格雷特.罗萨斯学士率墨西哥政务和经贸代表团一行到我县考察，实地参观了罗阳镇观背村、五矿哈施塔特小镇。副县长李林、潘燕梅参加相关活动。。交流会上，墨西哥代表团和我县分别介绍了两地的基本情况和投资环境，并就如何加强两地人文交流与合作，充分发挥友城平台作用，投资合作意向等进行了交流。。据了解，去年我县与墨西哥金字塔市共同签署了友好交流与合作谅解备忘录，双方一致同意通过旅游、文化、教育、经济等方面的交流活动加强友好关系，推动旅游、经济等方面的长期合作，实现双赢。,5月22日下午，博罗分中心主任钟健活率该中心中层以上干部一行11人到我中心进行了考察交流。。考察组一行首先在凌云志同志等我中心领导的陪同下参观了中心交易服务大厅、开标评标区和办公区等场地设施，详细询问了监控系统、监控视频自动刻录打印设备的使用状况，对我中心近年来在争取场所增加所取得的成效和对设施规范配备工作的重视、投入等表示肯定。随后，双方在。楼会议室开展了工作业务上的交流座谈，就各自分中心交易信息化系统使用状况、村集体征地留用地挂牌交易、评标专家抽取管理、招标代理规范履职监督管理等问题展开了深入探讨。。凌云志主任表示，在这次交流学习中，大家受益匪浅，希望中心能够继续保持良好的交流氛围，相互学习，共同进步。,其他,0.5629277633850827,True
197,广东省,惠州市,惠州市主要领导赴深交所考察,2017-10-16,http://jinrong.huizhou.gov.cn/gkmlpt/content/3/3196/post_3196602.html,为加强与深圳证券交易所的交流，落实我市与深交所去年签订的战略合作协议成果，10月13日市委书记陈奕威同志一行赴深圳证券交易所进行考察。考察团一行受到深交所王建军总经理、李辉副总经理的热烈欢迎。。考察团参观了深交所“希望之路”展厅，听取了深交所历史发展的介绍，并与王建军总经理、李辉副总经理及深交所有关部门主要负责人进行了热情、友好的交流座谈，双方形成了加大交流合作的共识，达到了预期效果。座谈会上陈奕威书记向深交所领导介绍了我市近年来经济发展等情况，并着重介绍了我市良好的金融生态环境，提出我市上市企业倍增计划，力争于2020年全市上市企业数目达30家左右。。陈奕威书记还提出四点希望，一是请深交所加大对我市上市工作的支持力度，包括帮助我市企业通过发行债券等手段募集发展资金；二是加大对我市企业的指导力度，利用深交所强大的信息库为我市企业提供融资指导；三是加强对我市企业的辅导力度，请深交所多在我市举办企业融资路演等有关活动；四是继续加强双方合作，在现有基础上进一步深化沟通交流，推动更多惠州企业在深交所挂牌上市。,"“在履职过程中,我们坚持‘小切口、大问题’‘小题目、大民生’的思路,认真选题撰写提案和建议,并积极推进提案办理工作,为推动全市教科文卫体事业献计出力。”市政协教科文卫体委员会负责人介绍,2018年,市政协教科文卫体委员会紧扣我市教科文卫体事业发展中的重要课题和群众关注的社会民生热点,充分发挥委员会的基础作用、政协委员的主体作用,认真履行职能,一年来提交提案1件、参与提交有关教科文卫体方面的提案105件,占立案提案总数的三分之一。。办好学前教育,关系千千万万儿童的健康成长。随着国家“全面二孩”政策的实施,学前教育更是成为我市政协委员关注的焦点。。在有关教科文卫体的众多提案中,《关于推进学前教育健康发展的建议》被确定为市政协“3+2+N”重点履职工作的主要内容。为助力我市学前教育健康发展,市政协教科文卫体委员会开展专题调研、视察和跟踪督办等活动,不断推动提案提出的意见建议落实。。去年6月,市委召开全面深化改革领导小组第八次会议,审议了《关于发展学前教育第三期行动计划实施方案(2017-2020年)》。为深入贯彻此次会议精神,市政协教科文卫体委围绕学前教育综合改革的热点问题和民生关切,开展了主题为“推进学前教育健康发展”的调研活动,邀请部分幼儿园园长、幼儿教育主管单位、办园单位、幼儿家长及市、县(区)政协委员等相关人士进行座谈,并就此专题持续开展了调研活动,向全市公开征求意见、建议。。调研组针对我市存在的普惠资源不足、经费投入和成本分担机制不够健全、幼儿园教师数量不足、小区配套幼儿园隐患多等问题,提出了大力发展普惠性民办幼儿园、建立公益普惠性幼儿园财政补助机制、加强幼儿教师队伍建设、科学规划幼儿园布局、出台农村地区保教质量提升方案等建议。。为促进我市全民健身运动的有序开展,去年8月,市政协教科文卫体委员会进行了主题为“广泛开展全民健身活动,完善全民健身活动设施,提升公共体育服务水平”的专题调研。。调研组还赴内蒙古自治区呼和浩特市、锡林郭勒盟、赤峰市等地考察,学习借鉴外地开展全民健身运动的先进经验和做法。通过调研,委员们提出了注重科学规划,扎实推进全民健身工程工作均衡发展;创新工作理念,加大对全民健身工作的宣传力度;挖掘特色资源,继续举办丰富多样的群众性活动等意见建议。",政府领导到其他城市考察学习或访问,0.6872564425035046,True
197,广东省,惠州市,市领导率团考察台湾社会管理,2011-06-09,http://www.huizhou.gov.cn/wsfw/ggfw/gysy/zxdt/content/post_184119.html,在不同社会背景下，地方政府社会管理是否可有相互借鉴之处？带着这个课题，从6月5日起，以市委常委、秘书长吴卫华为团长，市政协副主席刘冠贤为副团长的惠州市社会管理考察团抵达台湾，进行为期8天的社会调研，受到新竹市市长许明财、副市长曾国修，苗栗县县长刘政鸿、副县长林久翔，还有当地地方议员蔡锟钰、许文栋、陈启源、郑宏辉、段孝芳、黎旭钦等和惠州市台商协会的热情欢迎。 由市直有关部门负责人和大亚湾开发区有关领导组成的惠州市社会管理考察团一行，深入到高雄市垦丁区、屏东县恒春镇、新竹市北区区公所民政办事大厅、苗栗县政府民众陈情与申诉中心以及该县西湖乡公所调解委员会、县农会、将军奶场等，与当地政府公务人员、基层民众广泛接触、互动交流。台湾地方政府社会管理的做法，尤其是服务民众、关注民生以及受理民众陈情与申诉案件处理机制，引起了考察团关注。 在与台湾各界交流接触中，考察团一行深切感受到海峡两岸同胞血浓于水的深情厚谊。在与我市缔结为友好城市的新竹市，从政府官员、议会议员到灯光夜市普通民众，均表现出了对来自祖国大陆惠州人民的诚挚之意、手足之情。在以客家人居多的苗栗县西湖乡，当地民众对同属客家地区、同样拥有西湖名胜的惠州分外向往。在苗栗县造桥乡大西村力马生活工坊，考察团一行与当地原住民和客家乡亲共同联谊。亲切的客家山歌唱出了两岸人民血肉相联之情。 考察团一行还将深入到花莲县调研考察，并与台塑集团进行经贸交流。（惠 信）,11月12—13日，法国国家药学科学院院士张勇民、巴黎第五大学赫夫·加伦教授及其团队在省人社厅副厅长劳帜红陪同下，来我市考察创新创业环境并开展学术交流和项目对接。副市长刘小军等参加活动。。考察团一行先后参观了大亚湾科技创新园，考察了信立泰药业有限公司、莱佛士制药技术有限公司，并前往市中心人民医院与相关教授、专家就团队合作、药物实验、专利申请、学术研发等进行了交流探讨。。考察团对我市经济社会发展取得的成就，相关园区、企业的规模和未来发展表示赞赏，表示将积极对接洽谈，尽快推动包括鼻咽癌小分子药物项目在内的多个抗肿瘤药物项目与相关企事业单位开展合作。,其他,0.500365085834948,True
197,广东省,惠州市,法国专家来惠考察开展项目对接,2017-11-14,http://www.huizhou.gov.cn/zwgk/hzsz/zwyw/content/post_204491.html,11月12—13日，法国国家药学科学院院士张勇民、巴黎第五大学赫夫·加伦教授及其团队在省人社厅副厅长劳帜红陪同下，来我市考察创新创业环境并开展学术交流和项目对接。副市长刘小军等参加活动。。考察团一行先后参观了大亚湾科技创新园，考察了信立泰药业有限公司、莱佛士制药技术有限公司，并前往市中心人民医院与相关教授、专家就团队合作、药物实验、专利申请、学术研发等进行了交流探讨。。考察团对我市经济社会发展取得的成就，相关园区、企业的规模和未来发展表示赞赏，表示将积极对接洽谈，尽快推动包括鼻咽癌小分子药物项目在内的多个抗肿瘤药物项目与相关企事业单位开展合作。,1993年05月20日成立，经营范围包括机械设备制造，机床制造，机械加工，进出口贸易。创新，现已成为国内生产规模最大的综合性机床制造厂和国家级数控机床开发制造基地。工厂从投产至今，已为国内外制造行业提供了近三十万台金属切削设备，并以精良的品质著称。,其他,0.8250832012636616,True
197,广东省,惠州市,市领导带队考察惠州物流基地,2014-04-22,http://www.huizhou.gov.cn/hzgktzx/gkmlpt/content/2/2011/post_2011019.html,上午，风急雨骤，惠州市委常委、常务副市长张瑛，市纲要办主任李娜，市发改局局长胡建斌在惠州市大亚湾区委副书记、管委会主任黄伟才等人陪同下冒雨对惠州物流基地进行实地考察。张副市长一行重点考察了惠州物流基地码头，惠州物流公司经理陈奉友向张副市长一行现场介绍了惠州物流基地建设及投产运营情况，着重汇报了公司产业发展规划。张瑛常务副市长对惠州物流基地建设及公司产业发展规划给予了高度评价和肯定，她表示，惠州物流基地作为惠州市重点建设项目，市委、市政府一直非常关注并寄予厚望，希望惠州物流基地早日全面建成投产，努力将物流产业做大做强，为中海油和惠州市的经济发展多做贡献,为推进与华为公司合作，探讨双方下一步合作计划，8月9日，应华为公司邀请，我局会同县发改局、县统计局一行共15人前往华为公司参观考察，由我局党组成员、副局长卢大罗同志带队。。上午来到深圳坂田总部，参观了华为企业展厅。华为企业展厅聚焦企业业务场景，围绕智慧城市、智慧园区、广域网络、全栈数据中心、行业数字化转型方案、华为数字化转型实践等产品组合解决方案，80+展点全面展示华为数字基础设施差异化竞争优势。双方就有关合作事项的可行性进行了深入交流探讨。下午参观华为松山湖园区。。据了解，华为公司是我国鼎鼎有名的科技公司，是全球领先的信息与通信技术(ICT)解决方案供应商，业务遍及全球170多个国家和地区，2022年全球销售收入6423亿，全球财富500强排名96位。,其他,0.5495696225348947,True
197,广东省,惠州市,招玉芳副省长率队到我市调研考察,2011-07-27,http://swj.huizhou.gov.cn/gkmlpt/content/3/3161/post_3161858.html,7月19至20日，招玉芳副省长率省外经贸厅、海关总署广东分署、广东出入境检验检疫局等部门有关负责人到我市调研外经贸工作，受到市委副书记、市长李汝求，副市长李选民等的热情欢迎。我局有关领导及科室负责人参加了有关调研活动。。7月20日上午，招玉芳副省长一行先后到索尼精密部件（惠州）有限公司、TCL光电科技（惠州）有限公司等实地调研，仔细听取相关介绍，详细询问企业在生产、经营过程中遇到的困难和问题，鼓励企业加强自主品牌建设，大力提升核心竞争力，抓好节能减排，积极增资扩产，推动加工贸易转型升级。。在下午的座谈会上，招玉芳副省长听取了李选民副市长作的关于我市去年至今年上半年的外经贸有关情况汇报，充分肯定了我市外经贸所取得的成绩。她指出，要加快外经贸战略转型，推动惠州外经贸又好又快发展。各级、各部门要树立忧患意识，结合“十二五”规划和惠州发展战略，推动招商引资工作重心下移，加大力度对外招商引资，努力实现从“量的增加”到“质的提升”转变。一要明确招商引资的主攻方向。要把利用外资与推动自主创新、产业升级紧密结合起来，围绕“2+8”产业体系，加快引进精细化工产品、LED、新一代移动通信、汽车电子及软件、信息技术服务等配套项目，尤其要注重引进发展战略性新兴产业和现代服务业。二要瞄准优质大项目，实现新突破。三要积极参加全省招商活动。四要把握机遇，加大招商引资、引技、引智力度。同时，积极“走出去”，大力拓展海外市场。。招玉芳强调，要全力推进加工贸易转型升级。惠州要抢抓机遇，积极创立自主品牌，大力提升品牌价值。要在推进建设电子围网上有突破，在创新加工贸易监管模式上有突破，在推进加工贸易就地转型延伸产业链上有突破，在加快海关特殊监管区建设上有突破，积极发挥“惠州市加工贸易转型升级辅导平台”作用，推动加工贸易企业绿色低碳发展。同时，要成立加快加工贸易转型升级工作领导小组，认真制订本市推进加工贸易转型升级的工作方案，安排配套扶持资金，出台相关配套政策。。招玉芳强调，要落实责任，强化考核，确保各项任务顺利完成。要抓好任务和责任的分解落实，抓好工作的检查考核，抓好队伍的自身建设，推动惠州外经贸和旅游业更好更快发展，为加快转型升级、建设幸福广东作出新贡献。,我市20多家民营企业的当家人日前在市工商联（总商会）组织下，到贵州遵义、都匀学习考察。期间，市工商联（总商会）与遵义市工商联（总商会）牵手结为友好商会，同促民营企业新发展。。学习考察中，我市民营企业家参观了遵义会议会址，考察了遵义市部分企业，与遵义市工商联（总商会）民营企业家就投资项目意向进行座谈、衔接。带队的市工商联（总商会）副主席、市罗浮山水泥集团有限公司董事长吴国强说，目前企业正面临转型升级，要学习遵义会议精神，不断改革创新，脚踏实地克服企业发展中的困难，推进企业实现新发展。（记者杨剑辉 通讯员王广兴）,其他,0.5100373094062794,True
