code,province,city,topic,date,url,content,content.1,label,score,is_match
197,广东省,惠州市,高诚苗带队前往西藏林芝市朗县考察对口支援建设情况,2019-03-27,http://www.huizhou.gov.cn/gkmlpt/content/1/1977/post_1977398.html,副市长、市公安局局长高诚苗近日带队前往西藏林芝市朗县考察对口支援建设情况，慰问我市对口支援朗县工作组和医疗队，并召开对口支援工作座谈会。市有关单位负责同志一同参与考察。 考察组先后深入实地考察了朗县冲康庄园及千年核桃园一体化等项目。高诚苗充分肯定我市援藏干部援建工作成效，表示惠州市委、市政府将一如既往按照中央和省委的部署全力支持援藏工作，增强对口援藏工作紧迫感、责任感，突出精准扶贫，提升对口援藏的质量和效果。朗县地处偏远，基础设施薄弱，产业优势尚未形成，在援藏工作上要稳步推进，坚决做好援藏的长期性、持久性工作，切实把中央和省的决策部署领会透彻、落到实处。 （记者冯丽均 通讯员张力科）,李德友一行先后实地察看了双岗村旧村改造与天益城二期旧城镇改造项目的建设推进情况，详细听取了项目改造规划报建、容居率确定、城市规划等建设情况汇报。李德友对我街道提出的“城中村”改造工作大致方向予以充分的肯定；他强调，作为全区“排头兵”与“火车头”，陈江街道要加强“三旧”改造政策研究，结合“仲恺大道改造”方案，各部门全面联动，抓好旧城改造、加快城市更新，坚持创新推动，确保项目顺利落地建设。 据悉，五一村村民小组旧村庄改造项目是一个集住宅、购物、餐饮、文化、娱乐、商务、休闲等多功能为一体的大型城市综合体，提供一站式、全功能、足不出户的生活配套，满足老百姓衣食住行等需求，目前此项目正与相关村民小组积极协商规划方案。天益城位于轻轨仲恺站附近，是惠州首个双轻轨枢纽综合体，商业预计2016年年底正式开业，同时，二期改造项目正在办理相关报建手续，预计2017年动工建设。,其他,0.6756158323412064,True
197,广东省,惠州市,余金富副市长到河南岸街道考察投资项目暨首席服务官活动,2018-04-12,http://www.hcq.gov.cn/hzhchnajdb/gkmlpt/content/1/1856/post_1856499.html,月11日，余金富副市长带队到河南岸街道考察投资项目暨首席服务官及宣传贯彻习近平总书记参加十三届人大一次会议广东代表团审议时重要讲话精神专项服务活动。区政府副区长钟阳光同志、市直相关单位领导、区直相关单位领导及河南岸街道党政主要领导陪同参加活动。。在沃尔玛世界购物中心选址现场，沃尔玛、万达项目方代表和相关单位汇报了项目进展情况。余金富副市长在听取汇报后指出，市直相关部门要发扬“马上就办，真抓实干”的精神，全力推进项目建设。余副市长强调：宣传贯彻习近平总书记在参加十三届人大一次会议广东代表团审议时重要讲话精神是今后一个时期的重要政治任务，要深刻领会总书记对广东工作的肯定，为全省发展大局作出新的更大贡献。要深刻领会总书记关于改革开放的重要论述，坚决按照总书记指引的方向推进改革开放。要深刻领会总书记提出的“四个走在全国前列”重要要求，把新时代发展的路子走对走实走好。“四个走在全国前列”是广东新的历史使命，惠州作为珠三角城市的重要一员，要有走在全省前列的责任、勇气和担当。他同时强调，每一位党员干部都要时刻牢记总书记对广东工作提出的四个“走在全国前列”的重托，以强烈的担当精神和责任意识自觉扛起责任，以“马上就办，真抓实干”的作风把学习宣传贯彻成效体现到做好各项工作的具体行动。各相关部门要按照时间节点，明确任务分工、倒排工作进度，确保各项工作落实落细。,日，区商务局副局长吴铁彪同志带领由区商务局、区环保局相关工作人员组成的考察组赴深圳考察了远特信电子（深圳）有限公司，与公司总经理史传来及相关高层进行了深入座谈。会上，吴铁彪副局长极力推介了了惠阳区投资环境。并对我区新引进项目的审核标准和注意事项进行了详细的说明。在充分了解远特信电子有限公司的经营现状和投资意向后，考察组表示接下来将做积极好项目对接工作。随后，史传来总经理带领考察组参观了公司的生产车间。,其他,0.5668892947596126,True
197,广东省,惠州市,开启创新驱动新征程杨鹏飞将率团赴台开展交流推介考察活动,2015-04-06,http://www.hzzk.gov.cn/zzgxqgwhmhwz/zwgk/zwdt/content/post_565202.html,为进一步加强仲恺与台湾的科技交流与经贸合作，强化创新驱动能力，仲恺高新区区委副书记、管委会主任杨鹏飞将于4月8日率公务团和企业团赴台进行以创新驱动为主题的交流推介考察活动，区委副书记、政法委书记文绍良，区委常委、区宣教文卫办主任钳颖杰，区经济发展局、区科技创新局、陈江街道办、沥林镇、潼侨镇有关负责人以及信利集团、龙旗电子、伟乐科技等10家企业负责人将一同参加此次交流活动，奋力开启仲恺创新驱动新征程。。2015年是高新区“三次创业”的开局之年，我区将大力实施“恺旋人才计划”和“恺炬创新行动”，全面掀起创新驱动发展新浪潮，进一步完善全球化择商选资、招才引智体系，大力提升仲恺高新区创新创业水平，吸引海内外高科技研发人才。杨鹏飞此行行程十分紧凑，内容特别丰富，将举办择商选资引智推介会、企业交流座谈会，考察台湾高新科技园区，访问台湾著名高校，并与台湾行业联盟协会进行深度交流，大力推介我区创新创业环境及潼湖生态智慧区，力求引进更多台湾 “高”、“精”、“尖”的科技项目落户我区，还将致力于推动台湾高校和科研机构与我区产业优势进行产学研对接整合，为区内企业寻求更多的合作伙伴，开辟更开阔的发展空间。。据悉，此次宝岛之行的重头戏是两场“惠州仲恺高新区台湾推介会”，将于9日和10日上午分别在台北市和新竹县举行，国民党中常委、台湾工商建研会理事长廖万隆等嘉宾以及台湾高科技企业龙头、上市公司等企业家将应邀出席，仲恺的企业家代表团也将积极参与到对高新区的推介中，与台湾企业家进行广泛深入的交流，探讨当今世界科技发展新常态和新趋势，寻求全方位、深层次合作，共同推动两地科技交流和社会发展。。杨鹏飞一行将要考察访问的新竹科学工业园区是台湾高科技产业的“心脏”，是被誉为 “亚洲硅谷”的全球第三大工业园区，台湾著名的理工科院校国立清华大学、交通大学等都位于该园区的所在地新竹县。新竹工业园区主要产业包括有半导体业、电脑业、通讯业、光电业、精密机械产业与生物技术产业，是全球半导体制造业最密集的地方之一，带动了台湾经济转型，使台湾的半导体及科技产业名列世界前茅。以杨鹏飞为团长的代表团一行将受到新竹原县长、原农业部长范振宗，竹北市长何淦铭，新竹科学园区科技管理局局长杜启祥等的接待。。据了解，截至2014年底，在惠台资企业已发展到1600多家，投资总额超45亿美元，投资额排全省第四位，成为推动惠州经济发展的重要力量。,为进一步做好招商选资工作，11月24日，县投资促进中心副主任王嘉杰及相关人员赴博罗县拜访考察惠州晟泽新材料有限公司。。考察团一行先后参观考察企业生产车间、设备及产品等，并向企业负责人详细介绍了龙门县基本情况、交通区位优势、生态环境优势、龙门工业园等投资环境情况，以及了解企业运营情况、行业发展机遇和意向投资计划。通过洽谈，晟泽新材料企业负责人高度认可龙门的生态、区位优势和产业发展定位，表示下来会进一步加强沟通对接，争取在新材料产业方面早日达成合作事宜，实现互利共赢。,其他,0.5596279049724406,True
197,广东省,惠州市,省专家咨询组抵惠考察我市历史文化名城申报工作,2013-07-30,http://zjj.huizhou.gov.cn/zwgk/gzdt/content/post_27855.html,7月25日至26日，应市政府邀请，省住建厅和省文化厅、省文物局联合组织专家组一行九人，对我市国家历史文化名城申报工作开展了为期两天的实地考察和专家咨询活动。专家组一行受到市委常委、常务副市长张瑛，副市长刘冠贤的热情欢迎。 专家组一行先后实地考察了惠州西湖景区、水东街、铁炉湖和淡水老城等历史文化街区、中国历史文化名镇——惠阳区秋长镇和省级历史文化名城——惠东县平海古城，并听取了相关工作汇报。专家组对我市名城申报工作给予充分肯定，并对我市历史文化保护规划的编制、历史文化街区的整治提升、申报工作存在的不足等方面提出了宝贵意见和建议。,9月25～27日，市委副书记、市长温金荣率惠州市党政代表团赴西藏林芝朗县考察调研对接对口支援工作，深入学习贯彻习近平总书记关于西藏工作的重要指示和新时代党的治藏方略，贯彻落实广东省对口支援西藏新疆工作领导小组会议精神，持续推动对口支援工作走深走实。林芝市副市长秦松茂；惠州市政协副主席、市发展和改革局局长吴欣参加活动。。在惠州·朗县对口支援工作座谈会上，温金荣表示，对口支援朗县是党中央和广东省交给惠州的一项重要政治任务，是惠州应当承担起的政治责任。惠州将按照广东省、西藏自治区的部署安排，全力做好对口支援各项工作，把坚持“两个确立”、做到“两个维护”落到具体行动上。惠州各级各有关部门要深化思想认识，用心用情扛起对口支援责任，真正把朗县的事情当作惠州自己的事情抓实办好。要精心组织援建项目施工，加强项目监管，严格落实安全生产责任，推动项目建设提速提质提效，加快把“美好蓝图”变为“现实场景”。要充分发挥资源优势，推动特色农牧业以及文旅、藏药产业项目落地，大力推广农牧特色产品，助力朗县本地特色产业做大做强。要完善对口支援工作机制，继续谋划推动一批教育、医疗等朗县群众可感可知的项目，实现多方面深层次合作，为推动朗县经济高质量发展和社会和谐稳定作出更大贡献。。秦松茂对惠州对口支援朗县表示感谢。他说，惠州全方位、宽领域、多层次开展对口支援工作，为林芝做好稳定生态强边工作注入了强劲动力。林芝、朗县将积极做好受援工作，关爱援藏干部，努力为惠州对口支援工作创造良好条件。希望惠州一如既往加大对朗县对口支援力度，在人才培养交流、产业开发合作等方面进一步加强沟通、深化合作，为朗县高质量发展注入新的活力。。考察期间，代表团深入朗县惠州大桥、冲康景区、拉多乡新扎村小康示范村、藏药材晾晒厂、苏卡药香厂，以及嘎拉村“团结颂”红色研学主题教育展览馆、雅尼湿地等地，调研惠州援建项目建设运营情况，考察林芝、朗县经济社会发展情况，并看望慰问援藏干部。,政府领导到其他城市考察学习或访问,0.0,True
197,广东省,惠州市,深圳市副市长黄敏带队莅临白盆珠水库工程管理局考察调研,2018-04-20,http://www.huizhou.gov.cn/bmpd/hzswj/zwgk/gzdt/content/post_2706729.html,4月18日，为解决深汕特别合作区供水问题，深圳市副市长黄敏带队莅临白盆珠水库考察调研，深圳市水务局局长王立新等陪同调研，受到了白盆珠水库工程管理局党委书记、局长黄志宁的热烈欢迎。。黄敏一行在黄志宁陪同下实地考察了白盆珠水库副坝、主坝等工程设施和坝容坝貌，听取了设计单位对深汕特别合作区引水的设计方案。据了解，深汕特别合作区目前拟定的引水方案有三个：一是从海丰县公平水库引水；二是从白盆珠水库引水；三是从稔平半岛供水工程引水。其中从白盆珠水库引水方案显示每年取水量约2亿m3。。考察过程，黄志宁向黄敏介绍了白盆珠水库的基本情况，水文情况，下游供水情况及管理情况，对白盆珠水库通过严格管理，水质长期保持一至二类水标准，黄敏给予了充分的肯定。黄敏表示，深汕特别合作区的用水是该区发展的首要问题，各部门要认真对待，充分调研，拿出一个切实可行的方案，为合作区的发展解决后顾之忧。,12月4日下午，香港环境卫生署访问团一行24人，专程对惠州市的病媒生物防制工作进行了考察和交流。访问团由该署总行政主任郑区凤珍女士率领，成员为前线管工联系及小贩管理主任联系人员。考察以座谈交流和现场察看的形式进行。。在考察座谈会上，惠州市爱卫办相关人员向考察团详细介绍了该市病媒生物防制工作的总体情况。从工作制度、队伍管理、防治措施、经费管理等几方面与访问团进行了详细交流。市卫生局黄洁秋副局长、市爱卫办陈立明主任参加了座谈。。座谈会后，考察团参观了惠城区桥东街道居民区消杀队的办公场所及居民小区，详细了解了惠州市居民区病媒生物防制工作所采取的各项措施，如灭鼠屋的设置使用、沙井口吊缓释药物等等。对我市居民区采取的有效措施大加赞许。随后，访问团还参观考察了市区南门市场的病媒生物防制工作。,其他,0.6095570668922242,True
197,广东省,惠州市,惠州市党政代表团赴西藏林芝朗县考察调研对接对口支援工作,2023-09-28,http://jhj.huizhou.gov.cn/fzgg/tsxz/content/post_5094317.html,9月25～27日，市委副书记、市长温金荣率惠州市党政代表团赴西藏林芝朗县考察调研对接对口支援工作，深入学习贯彻习近平总书记关于西藏工作的重要指示和新时代党的治藏方略，贯彻落实广东省对口支援西藏新疆工作领导小组会议精神，持续推动对口支援工作走深走实。林芝市副市长秦松茂；惠州市政协副主席、市发展和改革局局长吴欣参加活动。。在惠州·朗县对口支援工作座谈会上，温金荣表示，对口支援朗县是党中央和广东省交给惠州的一项重要政治任务，是惠州应当承担起的政治责任。惠州将按照广东省、西藏自治区的部署安排，全力做好对口支援各项工作，把坚持“两个确立”、做到“两个维护”落到具体行动上。惠州各级各有关部门要深化思想认识，用心用情扛起对口支援责任，真正把朗县的事情当作惠州自己的事情抓实办好。要精心组织援建项目施工，加强项目监管，严格落实安全生产责任，推动项目建设提速提质提效，加快把“美好蓝图”变为“现实场景”。要充分发挥资源优势，推动特色农牧业以及文旅、藏药产业项目落地，大力推广农牧特色产品，助力朗县本地特色产业做大做强。要完善对口支援工作机制，继续谋划推动一批教育、医疗等朗县群众可感可知的项目，实现多方面深层次合作，为推动朗县经济高质量发展和社会和谐稳定作出更大贡献。。秦松茂对惠州对口支援朗县表示感谢。他说，惠州全方位、宽领域、多层次开展对口支援工作，为林芝做好稳定生态强边工作注入了强劲动力。林芝、朗县将积极做好受援工作，关爱援藏干部，努力为惠州对口支援工作创造良好条件。希望惠州一如既往加大对朗县对口支援力度，在人才培养交流、产业开发合作等方面进一步加强沟通、深化合作，为朗县高质量发展注入新的活力。。考察期间，代表团深入朗县惠州大桥、冲康景区、拉多乡新扎村小康示范村、藏药材晾晒厂、苏卡药香厂，以及嘎拉村“团结颂”红色研学主题教育展览馆、雅尼湿地等地，调研惠州援建项目建设运营情况，考察林芝、朗县经济社会发展情况，并看望慰问援藏干部。,日上午，香港特别行政区行政长官梁振英一行在省港澳办主任廖京生的陪同下，到我街道伯恩光学（惠州）有限公司考察企业发展情况，市委书记、市人大常委会主任陈奕威，市委副书记、市长麦教猛，市委常委、秘书长、潼湖生态智慧区建设指挥部总指挥范中杰，副市长胡建斌等陪同考察。香港特别行政区创新及科技局局长杨伟雄，香港工业总会主席郑文聪等随行考察。。梁振英一行观看了企业宣传片，参观了产品展示，深入车间，了解企业自主创新、生产工艺等情况。在伯恩光学展厅，梁振英认真听取了惠州经济社会发展、惠港两地合作等情况介绍，并询问了惠州打造。考察期间，梁振英高度评价我辖区经济社会发展取得的成就，盛赞惠州大力支持企业发展的系列举措，并详细介绍了香港科技创新发展情况，且希望港惠两地进一步加强交流合作特别是科技创新方面的合作，共同促进繁荣发展。,其他,0.5165442495431224,True
197,广东省,惠州市,副市长余金富带队到惠南科技园考察重点项目建设情况,2019-07-19,http://www.hzzk.gov.cn/bmpd/hngxkjy/ztzl/zsyz/zsdt/content/post_3650596.html,7月18日上午，副市长余金富带队到惠南科技园高盛达项目现场考察项目建设、投产情况。市直、区直有关单位负责人，园区党委副书记、管委会副主任唐巧明陪同调研。。余金富一行深入高盛达项目施工现场，考察项目建设情况，详细听取高盛达项目有关负责人汇报公司产业与科技创新布局、项目进展、未来发展计划以及需要协调解决等有关事项。企业负责人表示，在市、区、园区的大力支持下，公司将全力发展高端产业，在惠南科技园实现跨越式发展。。余金富对园区盘活闲置资源、舒缓土地供给难题，强化企业服务等工作给予了充分的肯定，并指示有关部门要落实好各项政策，给企业减轻负担，希望企业继续发力，加快投产，利用好各种创新资源，加大研发投入，加速转型升级，为实现全市高质量发展做更大贡献。（文/黄翠婷 图/林婧）,6月15日，广东方直集团有限公司旗下产城研究院品牌管理中心总经理葛琳女士与广佛区域公司投资总经理罗西先生率策划团队一行到龙门县考察投资环境，考察团一行前往地派镇天堂山等项目地块进行了深入的实地考察。16日上午，县投资促进中心主任江丽超同志与企业一行会见并进行座谈交流，对方直集团拟在龙门投资大健康文旅综合体项目整体规划进行了深入探讨，并表达了进一步合作的愿望，希望双方继续加强沟通，力促项目尽快顺利落户龙门，实现互利共赢。,其他,0.6640233399908653,True
