code,province,city,topic,date,url,content,content.1,label,score,is_match
197,广东省,惠州市,全市科技创新大会与会领导到东江产业园考察,2015-04-10,http://www.hzzk.gov.cn/bmpd/jywhwsjkj/gzdt/content/post_537039.html,上午，全市科技创新大会在仲恺高新区召开。市委副书记、市长麦教猛在会上强调，要深入实施创新驱动发展战略，全面建设创新型城市，推动我市尽快进入珠三角第二梯队。市委副书记、市政协主席陈训廷主持会议。市委常委、环大亚湾新区党工委书记、大亚湾区委书记张瑛，市委常委、秘书长范中杰，市人大常委会副主任华红，市政府党组副书记、副市长王胜，区委书记钟一尔，区委副书记、东江产业园管委会主任卢伟航，各县区、各有关职能部门负责人参加活动。。麦教猛一行首站来到东江产业园，实地考察了东江产业园项目建设情况，听取了卢伟航关于园区战略性新兴产业引进、创新平台建设、创新环境营造等情况汇报，其中详细了解了科技企业孵化器、科技企业加速器、科技金融大厦、软件园及创客中心（众创空间）等创新平台、载体的规划、建设情况，对东江产业园实施创新驱动发展战略取得的成绩表示充分肯定。。随后，麦教猛一行参观了仲恺区科技创业服务中心、惠州市迪森照明科技有限公司等，详细了解我市科技创新战略实施情况，并召开座谈会。麦教猛指出，全市上下要深刻认识到，实施创新驱动发展战略，创新是灵魂，政策是先导，服务是基础，企业是主体，人才是根本。各县（区）和广大企业要认真学习借鉴先进经验，结合实际，找准方向，脚踏实地推动科技创新工作。。麦教猛强调，一要提高认识，强化自觉。大力实施创新驱动发展战略，是贯彻中央和省决策部署的必然要求，是经济结构调整、产业转型升级、推动惠州尽快进入珠三角第二梯队的重要内容，是适应经济新常态、实现惠州新发展的迫切需要，是企业成长壮大、在竞争中立于不败之地的制胜法宝。二要突出重点，全力攻坚。要做强“蓝色引擎”环大亚湾新区、“绿色引擎”潼湖生态智慧区，加快新型研发机构建设，提升高校科研水平，大力推进工业技术改造，积极培育科技创新企业。三要完善政策，加强引导。要完善配套政策体系，加大财政投入，强化金融与科技融合，优化科技服务环境。四要深化改革，激发活力。要改革科技投入机制、科技合作交流机制、人才培育引进机制和科技成果应用转化机制。五要加强领导，狠抓落实。要加强组织领导，形成工作合力，强化督导考核，确保好的政策在我市落地生根、开花结果。,月20日，区委常委黄树文率区经信局局长胡冠文一行到联东Ｕ谷北京金桥项目参观考察。此次考察标志着联东U谷和我区的合作向前迈进了坚实的一步。。考察过程中，黄树文一行在联东集团地产事业部副总经理梁环宇的陪同下，先后参观了联东Ｕ谷总部商务楼、科技研发楼、标准厂房和定制厂房以及园区配套设施等项目。梁环宇详细地讲解了联东Ｕ谷北京金桥项目的园区概况，发展战略和入园企业情况。。随后，黄树文一行到达北京联东U谷商务中心，双方进行了深入的交流，黄树文对联东U谷产业园区开发建设方面取得的成绩给予了高度的评价，详细询问了产业园区开发建设和运营模式等方面的内容，并希望联东U谷能将这种模式带到惠阳去。。联东U谷作为中国产业地产运营商的领先者，具有9年开发运营成功经验累积，在环渤海、长三角、珠三角等全国重要经济圈已投资开发了十大产业园区，包括宝马、DHL、国际纸业、多乐、李宁、天语手机等，全球超过2000家企业入驻，为企业建立了全球化的企业俱乐部合作平台。2012年，。在由国务院发展研究中心企业研究所、清华大学房地产研究所和中国指数研究院三家研究机构共同组成的“中国房地产TOP10研究组”的最新发布的2012年中国房地产百强企业研究成果发布会上，联东集团在产业园区优秀企业排行榜中名列首位。,政府领导到其他城市考察学习或访问,0.0,True
197,广东省,惠州市,余金富副市长带队前往华为总部调研考察,2020-05-21,http://www.huizhou.gov.cn/zwgk/hzsz/jgdt/content/post_3881273.html,5月20日，市政府副市长余金富带队前往深圳华为公司总部（坂田基地）参观考察，市政府副秘书长周海英，市工信局局长吴欣、副局长扈伟参加调研。。在华为公司相关部门主要负责人的陪同下，调研组一行参观了华为的企业ICT技术展厅、数字能源创新体验中心和智能协作开放实验室，全面了解华为公司在信息与通信基础设施、智能终端、云计算和新基建的高科技产品和领先技术，特别是华为以“极简、绿色、智能、安全”的发展理念，通过研发和运用先进技术，建设中大型智能模块化数据中心、边缘智能数据中心，能源能耗管理方面的先进经验。。余金富副市长表示，华为公司先进的发展理念和经验对惠州发展粤港澳大湾区数据中心产业园及关联产业具有非常好的参考借鉴意义。余金富指出，当前，惠州正在加快部署和推进5G通信基站和数据中心建设进度，欢迎华为加入惠州新基建建设队伍。同时，惠州也将积极发挥在电子信息产业和资源生产要素的优势，希望华为公司与惠州在鲲鹏生态系统、智能网联企业、智慧屏、5G通信和云业务等方面进一步深化合作。,2021年2月24日，县领导杨伟斌率队考察力合科创集团有限公司，县府办、县商务局、县自然资源局、县文广旅体局、县发改局、县科工信局、县教育局、九龙峰管委会陪同考察。考察团参观了清华信息港园区及相关企业，了解企业信息及经营状态。座谈会上，县商务局党组成员、县投资促进中心主任陈勃从惠东的区位交通优势、土地供应等多方面作了介绍。同时，考察团与投资方就“九龙峰菁英智创谷”项目建设工作协调推动事项深入交流。。该公司成立于1999年，是深圳清华大学研究院创办的科技创新服务公司，致力于推动科技成果转化，2019年通过重组在A股成功上市。目前，已在国内重点城市建设和运营超过30个科技企业孵化器和创新基地，累计孵化企业2500多家，投资孵化上市公司24家，培育国家高新技术企业300多家、明星科技企业200多家。,政府领导到其他城市考察学习或访问,0.0,True
197,广东省,惠州市,市领导率队考察对口支援朗县工作,2020-11-03,http://www.huizhou.gov.cn/zwgk/hzsz/zwyw/content/post_4095361.html,为深入贯彻落实习近平总书记在中央第七次西藏工作座谈会上的重要讲话精神和广东西藏对口支援工作座谈会精神，近日，受市委书记、市人大常委会主任李贻伟，市委副书记、市长刘吉委托，市委常委、常务副市长、市对口支援工作领导小组副组长何广延率队赴西藏林芝市朗县考察调研对口支援工作，召开对口支援工作座谈会，并慰问我市援藏工作人员。。何广延一行前往我市拟援建项目朗县光明新区跨江大桥、援建项目朗镇冲康庄园和拉多乡新扎小康示范村等地，了解项目的规划建设情况，要求高质量建成每个项目。在惠州朗县对口支援工作座谈会上，何广延感谢朗县县委、县政府对我市援藏干部的关心爱护，并表示惠州将一如既往按照中央和省委的部署做好对口支援工作，在贯彻落实好中央第七次西藏工作座谈会精神的同时，结合当地发展目标要求，着重解决好民生问题。接下来要进一步密切惠朗双方的沟通联系，把惠州市的优质资源引进到朗县，推动朗县文化旅游产业、藏医藏药产业等特色优势产业做大做强。我市援建朗县工作组要做好朗县光明新区跨江大桥的科学规划，加强与广东省援藏工作队的沟通汇报，争取将更多项目纳入省“十四五”援藏规划，确保按时按质完成对口支援各项工作任务。。期间，考察团还前往拜会了国家援藏队、广东省第九批援藏工作队相关领导，汇报了惠州对口支援相关工作。,2017年1月14日，惠东县人民政府副县长周永坤和环大亚湾新区管委会副主任李传红带工作组到杭州颐高集团实地考察，县政府纲要办、商务局、经信局等部门相关负责人陪同考察。颐高电子商务产业园副总裁、发展中心总经理翁国明等接待了考察组一行，并组织召开了座谈会。。据了解，颐高电子商务产业园成立于2009年，是颐高集团旗下核心产业之一，致力于打造全国首屈一指的电子商务产业园区。颐高电子商务产业园是集特色产业园、商贸物流、电子商务于一体的大型现代服务业平台，构建了当地最大的网商群体生态链和电子商务产业链，先后荣获“中国电子商务百强企业”“中国电子商务行业优秀产业园区”等荣誉。。考察组先后参观了颐居草堂、颐高智能体验馆、楼友会创业咖啡、众创空间以及颐高集团总部等地方，并认真听取了工作人员的讲解。座谈会上，颐高翁国明总经理介绍了颐高集团的“颐高数码”“颐居美丽乡村”“颐居养生小镇”“颐高电子商务产业园”“颐高科技创业园”“楼友会”“颐高智能广场”几大核心产业，并着重介绍了颐高电商园互联网+双创模式。他表示，颐高电商园致力于打造具有地方特色的互联网创新平台，帮助传统产业与互联网完美结合，实现产业优化升级。。周永坤副县长对颐高电商园的运营模式给予高度评价，并介绍了惠东的经济社会发展情况。他强调，惠东县是粤东商贸物流重镇，有着良好发展电子商务的基础，也相信与颐高在美丽乡村、智慧旅游、双创孵化、特色小镇等方面有着非常广阔的合作前景，也真诚邀请颐高的领导走进惠东、了解惠东、投资惠东。,政府领导到其他城市考察学习或访问,0.0,True
197,广东省,惠州市,农业部领导到我区考察调研农业农村工作,2013-11-14,http://www.huiyang.gov.cn/hzhyncslj/gkmlpt/content/2/2340/post_2340996.html,9月30日，农业部副部长张桃林在省农业厅厅长郑伟仪和市长麦教猛的陪同下到我区考察调研美丽乡村建设和农业科技创新发展情况。区领导胡斯平、杨远辉陪同调研。。美丽乡村建设情况，并参观了叶挺纪念园。在周田村，考察组详细了解了周田村经济发展、农民主要收入来源、农村医疗等方面情况。张桃林副部长充分肯定了周田村在新农村建设方面取得的成绩，并希望周田村。在国家、省、市专项资金支持的基础上，区级财政要相应增加农技推广经费投入，确保农业科技创新工作的持续推进,为进一步做好招商引资工作，着力引进高端新材料及其机械加工设备等配套研发生产项目，12月30日，县投资促进中心主任江丽超同志会同市生态环境局龙门分局、惠州产业转移工业园管委会等单位相关负责人赴东莞市分别拜访考察了3家企业。。考察团一行先后参观考察各企业生产车间及产品，并向各企业负责人详细介绍了龙门县基本情况、交通区位优势、生态环境优势、龙门工业园等投资环境情况，以及了解企业运营情况、行业发展机遇和意向投资计划。通过洽谈，各企业均高度认可龙门的生态、区位优势和产业发展定位，表示下来会进一步加强沟通对接，争取项目尽快落户龙门，实现互利共赢。,其他,0.5213562993120169,True
197,广东省,惠州市,省专家组抵惠考察历史文化名城申报,2013-07-26,http://www.huizhou.gov.cn/wsfw/ggfw/sb/sbkx/content/post_190319.html,昨日上午，由省住建厅和省文化厅、省文物局联合组织的专家组抵惠，对我市国家历史文化名城申报工作，开展为期两天的实地考察和专家咨询活动。专家组一行受到市委常委、常务副市长张瑛，副市长刘冠贤的热情欢迎。 专家组一行首先来到惠州西湖景区，考察了东坡纪念馆、九曲桥、芳华洲、元妙观。听取相关工作汇报后，专家组对我市国家历史文化名城申报工作给予充分肯定。 刘冠贤指出，惠州历史悠久，具有1400多年建城史，素以“人文古邹鲁，山水小蓬瀛”著称，成为岭南地区文明的重要传承之地。他说，市委、市政府对申报工作高度重视，非常感谢省专家组的到来，为我市申报工作把脉，希望专家组多提意见和建议，推动我市申报工作开展。 当天下午，专家组到水东街、淡水老街等历史文化街区，以及中国历史文化名镇惠阳秋长考察。 据悉，专家组今日还将前往惠东平海古城考察。同时，听取省城乡规划设计研究院汇报 《惠州市历史文化保护规划》有关工作。（记者袁 畅 实习生吴智欣）,4月21日，省科技厅党组副书记、副厅长张明一行抵惠考察我市重点实验室建设情况，受到市委常委、常务副市长张瑛等领导的热情欢迎。。张明一行先后深入TCL集团、德赛集团、惠州亿纬锂能股份有限公司现场考察重点实验室建设情况并认真听取了我市相关情况汇报。在详细了解我市相关情况后，张明对我市科技创新体系建设工作给予肯定，认为在市委、市政府的高度重视下，我市创新资源丰富、创新平台建设的基础良好。同时，我市推进以政府为引导、企业为主体、市场为向导、产学研相结合的科技创新体系建设，使得企业创新水平显著提升。他希望我市加大科技资源整合力度，进一步加强重点实验室等科技创新平台建设，促进科技综合实力进一步提高。。据悉，我市以企业为主体的技术创新体系和产学研合作体系初步形成，创新服务体系日趋完善。全市企业共组建技术研究开发中心和农业科技创新中心115家，建立了省级工业技术研究院1家，博士后工作站4个，市级重点实验室6个，省级专业镇13个；目前，全市科技中介服务机构有12家，建立科技企业孵化器4家。我市分别与中山大学、华南理工大学、武汉大学等高校和科研院所签订了校（院）地合作协议，成立了华工研究院、武大研究院、中科院技术转移分中心等。2010年，大亚湾开发区联合7所高校共建石油化工研究院，组建了科技创业中心和科技数据查询平台。国家石油石化产品质量监督检验中心（广东）在我市成立，成为华南区首家国家级石油石化产品质检中心。,其他,0.5847644311387636,True
197,广东省,惠州市,张明副厅长到惠考察重点实验室建设情况,2011-10-08,http://sti.huizhou.gov.cn/gkmlpt/content/3/3168/post_3168321.html,4月21日，省科技厅党组副书记、副厅长张明一行抵惠考察我市重点实验室建设情况，受到市委常委、常务副市长张瑛等领导的热情欢迎。。张明一行先后深入TCL集团、德赛集团、惠州亿纬锂能股份有限公司现场考察重点实验室建设情况并认真听取了我市相关情况汇报。在详细了解我市相关情况后，张明对我市科技创新体系建设工作给予肯定，认为在市委、市政府的高度重视下，我市创新资源丰富、创新平台建设的基础良好。同时，我市推进以政府为引导、企业为主体、市场为向导、产学研相结合的科技创新体系建设，使得企业创新水平显著提升。他希望我市加大科技资源整合力度，进一步加强重点实验室等科技创新平台建设，促进科技综合实力进一步提高。。据悉，我市以企业为主体的技术创新体系和产学研合作体系初步形成，创新服务体系日趋完善。全市企业共组建技术研究开发中心和农业科技创新中心115家，建立了省级工业技术研究院1家，博士后工作站4个，市级重点实验室6个，省级专业镇13个；目前，全市科技中介服务机构有12家，建立科技企业孵化器4家。我市分别与中山大学、华南理工大学、武汉大学等高校和科研院所签订了校（院）地合作协议，成立了华工研究院、武大研究院、中科院技术转移分中心等。2010年，大亚湾开发区联合7所高校共建石油化工研究院，组建了科技创业中心和科技数据查询平台。国家石油石化产品质量监督检验中心（广东）在我市成立，成为华南区首家国家级石油石化产品质检中心。,5月10日上午，中央党校第81期新疆地厅班一行44人在市委副书记、政法委书记李敏及相关部门负责同志的陪同下到我中心考察。。受市政府副秘书长、中心党组书记、主任胡志威的委托，中心党组成员、副主任杨志刚向考察组汇报了惠州近年来公共资源交易深化改革情况，一是管办分离，规范运行。市委、市政府高屋建瓴，勇于改革，勇于创新，大力推进公共资源交易改革，按公共资源交易“一委一办一中心”的模式，于2012年6月28日组建成立了惠州市公共资源交易中心，实现彻底的“管办分离”，这种管理机制模式受到省委省政府充分肯定，并在全省予以推广；二是实现全流程网上“背靠背”交易。运用制度加科技的手段打造全新的交易平台，建立了有效的市场监管体系，让市场在公共资源的配置中更好地发挥决定性作用，使公共资源交易更加规范、阳光，构建起制度的“防火墙”从源头上预防和治理了腐败，初步形成干部不能腐的机制；三是应进必进，实现市县镇三级全覆盖。按照市委市政府要求应进必进的原则，交易项目从初期的28类拓展到54类，其中包括出租车、旅游汽车、公路客运、公交线路、迎春花市、农村集体荒山荒地等的承包经营权、户外广告设置权、PPP项目等等。我市为全省进场的项目门类最多，整合最彻底的交易平台；四是成效显著，得到上级领导高度肯定。中心成立至2017年4月底，全市公共资源交易中心完成交易项目24329宗，成交金额1623.79亿元，增收节支90.42亿元，充分释放了改革的红利。2015年9月20日，我市公共资源交易改革获评为全国行政服务大厅典型案例“十佳”称号，多次得到《人民日报》、《紫光阁》、《中国纪检监察报》、《南方日报》等主流媒体的推介和报道，受到国家部委（国家发展和改革委员会）的重视和省委省政府领导的充分肯定。。考察组对我市公共资源交易改革所取得的成效表示赞赏，认为值得新疆各地市进行学习借鉴。,政府领导到其他城市考察学习或访问,0.0,True
197,广东省,惠州市,深圳市副市长黄敏带队莅临我局考察调研,2018-04-19,http://www.huizhou.gov.cn/bmpd/hzsbpzskgcglj/zwgk/gzdt/content/post_2745778.html,月18日，为解决深汕特别合作区供水问题，深圳市副市长黄敏带队莅临白盆珠水库考察调研，深圳市水务局局长王立新等陪同调研，受到了我局党委书记、局长黄志宁的热烈欢迎。。黄敏一行在黄志宁陪同下实地考察了白盆珠水库副坝、主坝等工程设施和坝容坝貌，听取了设计单位对深汕特别合作区引水的设计方案。据了解，。深汕特别合作区目前拟定的引水方案有三个：一是从海丰县公平水库引水；二是从白盆珠水库引水；三是从稔平半岛供水工程引水。其中从白盆珠水库引水方案显示每年取水量约2亿m3。。考察过程，黄志宁向黄敏介绍了白盆珠水库的基本情况，水文情况，下游供水情况及管理情况，对白盆珠水库通过严格管理，水质长期保持一至二类水标准，黄敏给予了充分的肯定。黄敏表示，深汕特别合作区的用水是该区发展的首要问题，各部门要认真对待，充分调研，拿出一个切实可行的方案，为合作区的发展解决后顾之忧。,5月10日上午，中央党校第81期新疆地厅班一行44人在市委副书记、政法委书记李敏及相关部门负责同志的陪同下到市交易中心考察。。受市政府副秘书长、中心党组书记、主任胡志威的委托，市交易中心党组成员、副主任杨志刚向考察组汇报了惠州近年来公共资源交易深化改革情况，一是管办分离，规范运行。市委、市政府高屋建瓴，勇于改革，勇于创新，大力推进公共资源交易改革，按公共资源交易“一委一办一中心”的模式，于2012年6月28日组建成立了惠州市公共资源交易中心，实现彻底的“管办分离”，这种管理机制模式受到省委省政府充分肯定，并在全省予以推广；二是实现全流程网上“背靠背”交易。运用制度加科技的手段打造全新的交易平台，建立了有效的市场监管体系，让市场在公共资源的配置中更好地发挥决定性作用，使公共资源交易更加规范、阳光，构建起制度的“防火墙”从源头上预防和治理了腐败，初步形成干部不能腐的机制；三是应进必进，实现市县镇三级全覆盖。按照市委市政府要求应进必进的原则，交易项目从初期的28类拓展到54类，其中包括出租车、旅游汽车、公路客运、公交线路、迎春花市、农村集体荒山荒地等的承包经营权、户外广告设置权、PPP项目等等。我市为全省进场的项目门类最多，整合最彻底的交易平台；四是成效显著，得到上级领导高度肯定。市交易中心成立至2017年4月底，全市公共资源交易中心完成交易项目24329宗，成交金额1623.79亿元，增收节支90.42亿元，充分释放了改革的红利。2015年9月20日，我市公共资源交易改革获评为全国行政服务大厅典型案例“十佳”称号，多次得到《人民日报》、《紫光阁》、《中国纪检监察报》、《南方日报》等主流媒体的推介和报道，受到国家部委（国家发展和改革委员会）的重视和省委省政府领导的充分肯定。。考察组对我市公共资源交易改革所取得的成效表示赞赏，认为值得新疆各地市进行学习借鉴。,政府领导到其他城市考察学习或访问,0.0,True
