code,province,city,topic,date,url,content,content.1,label,score,is_match
191,广东省,汕头市,习近平在上海考察时强调聚焦建设五个中心重要使命加快建成社会主义现代化国际大都市返京途中在江苏盐城考察,2024-03-06,https://www.shantou.gov.cn/stsxfj/gkmlpt/content/2/2286/post_2286668.html,习近平在上海考察时强调 聚焦建设“五个中心”重要使命 加快建成社会主义现代化国际大都市 返京途中在江苏盐城考察。11月28日至12月2日，中共中央总书记、国家主席、中央军委主席习近平在上海考察。这是11月29日下午，习近平在闵行区新时代城市建设者管理者之家，向社区居民挥手致意。新华社记者 王晔 摄。中共中央总书记、国家主席、中央军委主席习近平近日在上海考察时强调，上海要完整、准确、全面贯彻新发展理念，围绕推动高质量发展、构建新发展格局，聚焦建设国际经济中心、金融中心、贸易中心、航运中心、科技创新中心的重要使命，以科技创新为引领，以改革开放为动力，以国家重大战略为牵引，以城市治理现代化为保障，勇于开拓、积极作为，加快建成具有世界影响力的社会主义现代化国际大都市，在推进中国式现代化中充分发挥龙头带动和示范引领作用。。11月28日至12月2日，习近平在中共中央政治局委员、上海市委书记陈吉宁和市长龚正陪同下，先后来到金融机构、科技创新园区、保障性租赁住房项目等进行调研。。28日下午，习近平一下列车就前往上海期货交易所考察。他结合电子屏幕和重要上市品种交割品展示，听取交易所增强全球资源配置能力、服务实体经济和国家战略等情况介绍，了解交易所日常资金管理和交割结算等事项。习近平强调，上海建设国际金融中心目标正确、步伐稳健、前景光明，上海期货交易所要加快建成世界一流交易所，为探索中国特色期货监管制度和业务模式、建设国际金融中心作出更大贡献。。习近平随后乘车来到浦东新区张江科学城，参观上海科技创新成果展。他结合视频短片了解上海市科技创新整体情况，走进展厅详细察看基础研究、人工智能、生物医药等领域的科技创新成果展示，并同科研人员代表亲切交流。习近平指出，推进中国式现代化离不开科技、教育、人才的战略支撑，上海在这方面要当好龙头，加快向具有全球影响力的科技创新中心迈进。要着力造就大批胸怀使命感的尖端人才，为他们发挥聪明才智创造良好条件。。近年来，上海市加快保障性租赁住房建设，为许多来沪新市民、青年人和一线务工人员提供了住房保障。29日下午，习近平到闵行区新时代城市建设者管理者之家考察。听了当地加大保障性租赁住房筹措建设力度、构建“一张床、一间房、一套房”多层次租赁住房供应体系的情况介绍，习近平给予充分肯定。他先后走进社区住宅型、宿舍型出租房源租户的住房和公共厨房、公共洗衣房等共享空间，仔细了解在此居住的城市一线工作者的生活状况。总书记无微不至的殷切关怀，让在场所有人感动。离开时，社区居民纷纷围拢过来欢送总书记。习近平说，看到来自五湖四海的建设者在这里安居乐业，感到很高兴。城市不仅要有高度，更要有温度。我们的社会主义就是要走共同富裕的路子。外来务工人员来上海作贡献，同样是城市的主人。要践行人民城市理念，不断满足人民群众对住房的多样化、多元化需求，确保外来人口进得来、留得下、住得安、能成业。。12月1日上午，习近平听取了上海市委和市政府工作汇报，对上海各项工作取得的成绩给予肯定。。习近平强调，要贯彻新时代中国特色社会主义文化思想，深化文化体制改革，激发文化创新创造活力，大力提升文化软实力。坚持不懈用新时代中国特色社会主义思想凝心铸魂，广泛践行社会主义核心价值观，巩固马克思主义在意识形态领域的指导地位，在各种文化交汇融合中进一步壮大主流价值、主流舆论、主流文化。要注重传承城市文脉，加强文物和文化遗产保护，传承弘扬红色文化，深入实施文化惠民工程，扎实推进群众性精神文明创建，深化拓展新时代文明实践中心建设，推进书香社会建设，全面提升市民文明素质和城市文明程度。,习近平在上海考察时强调 聚焦建设“五个中心”重要使命 加快建成社会主义现代化国际大都市 返京途中在江苏盐城考察。11月28日至12月2日，中共中央总书记、国家主席、中央军委主席习近平在上海考察。这是11月29日下午，习近平在闵行区新时代城市建设者管理者之家，向社区居民挥手致意。新华社记者 王晔 摄。中共中央总书记、国家主席、中央军委主席习近平近日在上海考察时强调，上海要完整、准确、全面贯彻新发展理念，围绕推动高质量发展、构建新发展格局，聚焦建设国际经济中心、金融中心、贸易中心、航运中心、科技创新中心的重要使命，以科技创新为引领，以改革开放为动力，以国家重大战略为牵引，以城市治理现代化为保障，勇于开拓、积极作为，加快建成具有世界影响力的社会主义现代化国际大都市，在推进中国式现代化中充分发挥龙头带动和示范引领作用。。11月28日至12月2日，习近平在中共中央政治局委员、上海市委书记陈吉宁和市长龚正陪同下，先后来到金融机构、科技创新园区、保障性租赁住房项目等进行调研。。28日下午，习近平一下列车就前往上海期货交易所考察。他结合电子屏幕和重要上市品种交割品展示，听取交易所增强全球资源配置能力、服务实体经济和国家战略等情况介绍，了解交易所日常资金管理和交割结算等事项。习近平强调，上海建设国际金融中心目标正确、步伐稳健、前景光明，上海期货交易所要加快建成世界一流交易所，为探索中国特色期货监管制度和业务模式、建设国际金融中心作出更大贡献。。习近平随后乘车来到浦东新区张江科学城，参观上海科技创新成果展。他结合视频短片了解上海市科技创新整体情况，走进展厅详细察看基础研究、人工智能、生物医药等领域的科技创新成果展示，并同科研人员代表亲切交流。习近平指出，推进中国式现代化离不开科技、教育、人才的战略支撑，上海在这方面要当好龙头，加快向具有全球影响力的科技创新中心迈进。要着力造就大批胸怀使命感的尖端人才，为他们发挥聪明才智创造良好条件。。近年来，上海市加快保障性租赁住房建设，为许多来沪新市民、青年人和一线务工人员提供了住房保障。29日下午，习近平到闵行区新时代城市建设者管理者之家考察。听了当地加大保障性租赁住房筹措建设力度、构建“一张床、一间房、一套房”多层次租赁住房供应体系的情况介绍，习近平给予充分肯定。他先后走进社区住宅型、宿舍型出租房源租户的住房和公共厨房、公共洗衣房等共享空间，仔细了解在此居住的城市一线工作者的生活状况。总书记无微不至的殷切关怀，让在场所有人感动。离开时，社区居民纷纷围拢过来欢送总书记。习近平说，看到来自五湖四海的建设者在这里安居乐业，感到很高兴。城市不仅要有高度，更要有温度。我们的社会主义就是要走共同富裕的路子。外来务工人员来上海作贡献，同样是城市的主人。要践行人民城市理念，不断满足人民群众对住房的多样化、多元化需求，确保外来人口进得来、留得下、住得安、能成业。。12月1日上午，习近平听取了上海市委和市政府工作汇报，对上海各项工作取得的成绩给予肯定。。习近平强调，要贯彻新时代中国特色社会主义文化思想，深化文化体制改革，激发文化创新创造活力，大力提升文化软实力。坚持不懈用新时代中国特色社会主义思想凝心铸魂，广泛践行社会主义核心价值观，巩固马克思主义在意识形态领域的指导地位，在各种文化交汇融合中进一步壮大主流价值、主流舆论、主流文化。要注重传承城市文脉，加强文物和文化遗产保护，传承弘扬红色文化，深入实施文化惠民工程，扎实推进群众性精神文明创建，深化拓展新时代文明实践中心建设，推进书香社会建设，全面提升市民文明素质和城市文明程度。,政府领导到其他城市考察学习或访问,0.6360225551134164,True
191,广东省,汕头市,汕头市考察团赴清远市惠州市考察学习,2024-04-22,https://www.shantou.gov.cn/cnst/ztzl/zyjhjs/content/post_2326832.html,近日，我市组织考察团赴清远市、惠州市开展“百千万工程”考察学习活动，深入了解清远市、惠州市推进“百千万工程”的工作成效，学习借鉴先进经验做法，助力我市“百千万工程”走深走实。清远市委副书记翟雪梅、副市长苏锦丹，惠州市委副书记陈宇航，市领导赖小卫、赵志涛参加相关活动。。在清远市，考察团参观了佛冈县水头镇高质量发展展示馆、水头镇群众文化广场与王田村新党群服务中心，详细了解当地推进美丽圩镇和美丽乡村建设工作经验，近距离感受镇村面貌新变化；在莲瑶村驿站、水头国际医养中心等地，考察团听取了水头镇抢抓乡村振兴示范带建设契机，建成集旅游观光、医疗养生、文化体验、现代农业为一体的沿江休闲农业和乡村旅游路线的经验做法，以及盘活利用村集体闲置资源，创建省级魔芋产业技术创新中心，以技术创新为带动产业发展的创新举措。。在惠州市，考察团前往龙门县永汉镇，实地考察学习美丽圩镇“七个一”建设，了解当地在风貌管控提升工作中，创造性引入南昆山国家二级保护动物“豹猫”元素，用巧思赋予永汉镇独特韵味；在龙城街道城西村百果里农业综合体，城西村展示了运用绣花功夫打造现代化新乡村的先进经验，通过传统工艺和就地取材，改造设计乡村民居外立面，既经济耐用又美观大方，给大家留下深刻印象。。考察团表示，通过此次考察学习充分感受清远市、惠州市推进“百千万工程”取得的成效和变化，进一步增强以更大力度推进“头号工程”的使命感、责任感、紧迫感，希望与清远、惠州两市进一步加强交流，推动“百千万工程”上新水平。同时，要以此次考察学习为契机，认真学典型、找差距、增动力，把先进经验转化为推进典型培育的具体实践，围绕富民兴村产业培育、人居环境整治和风貌管控提升、农文旅融合发展等重点领域积极探索、开拓创新，打造城乡区域协调发展示范样板，推动汕头“百千万工程”加力提速、全面突破。,近日，我市组织考察团赴清远市、惠州市开展“百千万工程”考察学习活动，深入了解清远市、惠州市推进“百千万工程”的工作成效，学习借鉴先进经验做法，助力我市“百千万工程”走深走实。清远市委副书记翟雪梅、副市长苏锦丹，惠州市委副书记陈宇航，市领导赖小卫、赵志涛参加相关活动。。在清远市，考察团参观了佛冈县水头镇高质量发展展示馆、水头镇群众文化广场与王田村新党群服务中心，详细了解当地推进美丽圩镇和美丽乡村建设工作经验，近距离感受镇村面貌新变化；在莲瑶村驿站、水头国际医养中心等地，考察团听取了水头镇抢抓乡村振兴示范带建设契机，建成集旅游观光、医疗养生、文化体验、现代农业为一体的沿江休闲农业和乡村旅游路线的经验做法，以及盘活利用村集体闲置资源，创建省级魔芋产业技术创新中心，以技术创新为带动产业发展的创新举措。。在惠州市，考察团前往龙门县永汉镇，实地考察学习美丽圩镇“七个一”建设，了解当地在风貌管控提升工作中，创造性引入南昆山国家二级保护动物“豹猫”元素，用巧思赋予永汉镇独特韵味；在龙城街道城西村百果里农业综合体，城西村展示了运用绣花功夫打造现代化新乡村的先进经验，通过传统工艺和就地取材，改造设计乡村民居外立面，既经济耐用又美观大方，给大家留下深刻印象。。考察团表示，通过此次考察学习充分感受清远市、惠州市推进“百千万工程”取得的成效和变化，进一步增强以更大力度推进“头号工程”的使命感、责任感、紧迫感，希望与清远、惠州两市进一步加强交流，推动“百千万工程”上新水平。同时，要以此次考察学习为契机，认真学典型、找差距、增动力，把先进经验转化为推进典型培育的具体实践，围绕富民兴村产业培育、人居环境整治和风貌管控提升、农文旅融合发展等重点领域积极探索、开拓创新，打造城乡区域协调发展示范样板，推动汕头“百千万工程”加力提速、全面突破。,政府领导到其他城市考察学习或访问,0.7026616535819925,True
191,广东省,汕头市,濠江区政协领导带队赴珠海市香洲区高新区学习考察,2024-06-18,https://mp.weixin.qq.com/s/cEAWspwWhGb1p4eKx8u_xg,为学习借鉴珠海市在民生保障与教育医疗卫生服务等方面的先进经验做法，扎实推动区政协年度协商调研工作，6月12日至14日，区政协副主席马烈坤带领社会和法制委员会、教育卫生体育委员会部分委员前往珠海市香洲区、高新技术开发区开展学习考察。。考察组首站前往珠海市香洲区香湾街道婴幼儿照护服务中心参观学习。作为珠海市首家由政府采取“公建民营”模式建设的集婴幼儿照护服务指导和托育为一体的机构，香湾街道婴幼儿照护服务中心践行“幼有所育”的发展理念，专注于3岁以下婴幼儿全日制照护。考察组实地察看了服务中心托育环境、课堂教学等方面情况，听取服务中心负责同志关于托幼园管理机制、服务理念、课程设置、师资配备等情况介绍，详细了解香洲区托育服务工作先进经验做法。。珠海市长者饭堂起步早、布点多、形式多样，2020年以来已累计服务老年人229万人次，提供助餐优惠2132.8万元，其“政企合作、市场运作”的运营方式更是此次学习考察的重点。在香洲区神前社区美好食堂、优特社区餐厅等社区长者饭堂，考察组参观饭堂厨房、就餐区域、活动室等场所，与长者饭堂负责同志深入交流，详细了解饭堂服务范围、菜品搭配、就餐形式、收费标准、日均用餐人数和相关扶持政策落实等方面经验做法。。唐家湾镇卫生院始建于1951年5月，是珠海市成立最早的全民所有制公立医院，为国家一级甲等医疗机构。在卫生院院长的带领下，考察组参观了卫生院综合服务区、国医馆、家庭医生签约服务区、健康管理区、妇女儿童关爱家园等区域，详细了解卫生院基本医疗、基本公卫服务、家庭医生签约服务、疾病预防控制工作等方面情况。。考察组最后一站来到珠海元朗食品有限公司，据介绍，珠海元朗食品有限公司创立于1988年，是珠海改革开放的首批内地与香港合资食品企业，现坐落于珠海（国家）高新技术开发区，企业拥有50000㎡ 现代化自动化管理厂区和全国最大的智能自动化蛋卷生产车间。在企业负责人的带领下，考察组走进产品展厅、生产车间，详细了解企业生产工艺、产品质量、市场销售等情况，并与企业负责人深入交流探讨食品监督管理工作经验做法。。此次学习考察活动，既开阔了视野、增长了见识，又看到了差距、增强了干劲。参加学习考察人员纷纷表示，要以此次学习考察为契机，汲取经验、鼓足干劲，进一步发挥委员主体作用和优势，积极履行职责，为我区民生保障和教育医疗事业发展建言献策，为推动濠江高质量发展贡献力量。。● 强劲电力赋能“百千万工程”：汕头濠江召开汕头供电深度参与濠江区“百千万工程”工作推进会,为学习借鉴珠海市在民生保障与教育医疗卫生服务等方面的先进经验做法，扎实推动区政协年度协商调研工作，6月12日至14日，区政协副主席马烈坤带领社会和法制委员会、教育卫生体育委员会部分委员前往珠海市香洲区、高新技术开发区开展学习考察。。考察组首站前往珠海市香洲区香湾街道婴幼儿照护服务中心参观学习。作为珠海市首家由政府采取“公建民营”模式建设的集婴幼儿照护服务指导和托育为一体的机构，香湾街道婴幼儿照护服务中心践行“幼有所育”的发展理念，专注于3岁以下婴幼儿全日制照护。考察组实地察看了服务中心托育环境、课堂教学等方面情况，听取服务中心负责同志关于托幼园管理机制、服务理念、课程设置、师资配备等情况介绍，详细了解香洲区托育服务工作先进经验做法。。珠海市长者饭堂起步早、布点多、形式多样，2020年以来已累计服务老年人229万人次，提供助餐优惠2132.8万元，其“政企合作、市场运作”的运营方式更是此次学习考察的重点。在香洲区神前社区美好食堂、优特社区餐厅等社区长者饭堂，考察组参观饭堂厨房、就餐区域、活动室等场所，与长者饭堂负责同志深入交流，详细了解饭堂服务范围、菜品搭配、就餐形式、收费标准、日均用餐人数和相关扶持政策落实等方面经验做法。。唐家湾镇卫生院始建于1951年5月，是珠海市成立最早的全民所有制公立医院，为国家一级甲等医疗机构。在卫生院院长的带领下，考察组参观了卫生院综合服务区、国医馆、家庭医生签约服务区、健康管理区、妇女儿童关爱家园等区域，详细了解卫生院基本医疗、基本公卫服务、家庭医生签约服务、疾病预防控制工作等方面情况。。考察组最后一站来到珠海元朗食品有限公司，据介绍，珠海元朗食品有限公司创立于1988年，是珠海改革开放的首批内地与香港合资食品企业，现坐落于珠海（国家）高新技术开发区，企业拥有50000㎡ 现代化自动化管理厂区和全国最大的智能自动化蛋卷生产车间。在企业负责人的带领下，考察组走进产品展厅、生产车间，详细了解企业生产工艺、产品质量、市场销售等情况，并与企业负责人深入交流探讨食品监督管理工作经验做法。。此次学习考察活动，既开阔了视野、增长了见识，又看到了差距、增强了干劲。参加学习考察人员纷纷表示，要以此次学习考察为契机，汲取经验、鼓足干劲，进一步发挥委员主体作用和优势，积极履行职责，为我区民生保障和教育医疗事业发展建言献策，为推动濠江高质量发展贡献力量。。● 强劲电力赋能“百千万工程”：汕头濠江召开汕头供电深度参与濠江区“百千万工程”工作推进会,政府领导到其他城市考察学习或访问,0.5677583980523484,True
