code,province,city,topic,date,url,content,content.1,label,score,is_match
191,广东省,汕头市,朱小丹考察我市文化传承与保护工作,2011-10-22,https://www.shantou.gov.cn/cnst/ywdt/content/post_1261860.html,（记者陈静莹）昨天上午，莅汕出席汕头经济特区建立30周年庆祝活动的省委常委、常务副省长朱小丹在市委书记李锋的陪同下，考察我市文化传承与保护工作。朱小丹强调，要进一步做好文化传承与保护工作，借鉴国内外先进城市经验，以保护促传承，加大物质文化遗产和非物质文化遗产挖掘、保护和利用力度，提升城市文化品位，增强城市文化软实力。省人大常委会副主任王宁生，省政协副主席徐尚武一同参加考察活动。。朱小丹一行首先来到华侨公园，参加庄世平先生塑像揭幕仪式。随后又实地察看了小公园中山纪念亭、汕头开埠文化陈列馆、海关博物馆。在小公园中山纪念亭，朱小丹听取了金平区旧城区改造规划情况介绍，指出历史文化是城市之根、城市之魂，在城市化和现代化进程中，要将历史文化保护利用与城市现代化建设紧密结合起来，认真做好规划，更加重视对潮汕优秀传统文化的发掘、保护和利用，在改造的同时尽量保留原有的建筑风貌。在汕头开埠文化陈列馆，朱小丹饶有兴致地听取工作人员的讲解，仔细观看一件件记载汕头埠辉煌历史的珍贵文物，并指出，开埠文化是汕头值得珍惜的宝贵财富，要继续做好文物的挖掘、整理和保护工作，让汕头埠文化通过陈列馆这个窗口展示魅力、大放光彩。最后，朱小丹一行来到同样见证了汕头开埠历史的汕头海关关史陈列馆，了解潮海关设立、收回海关主权的斗争以及改革开放以来汕头海关与粤东经济息息相关的发展史，对陈列馆按照修旧如旧原则，对原貌进行恢复和馆内布展表示肯定，并要求要不断推动公共文化场馆的建设，以公共文化场馆为依托开展丰富多彩的公共文化服务，让市民了解汕头的历史和文化，享受文化艺术的熏陶。,2013年6月24日，韩国农林水产食品部检查团官员一行4人在国家认证认可监督管理委员会以及广东检验检疫局有关领导陪同下，对获得韩国注册水产加工企业的“汕头市龙胜水产食品有限公司”进行了现场考察。韩方对检查结果非常满意，认为企业的加工设备、设施运行及维护状况良好，管理非常到位。至此，汕头市龙胜水产食品有限公司顺利通过韩方检查。。长期以来，汕头检验检疫局坚持以服务外贸、促进地方经济发展为己任，对认证监管长效机制和国外迎检快速反应机制建设常抓不懈，通过多次举办出口备案企业质量管理人员培训班，显著提高企业管理人员素质和企业管理水平，为企业随时应对国外官方检查创造了良好的条件。,其他,0.9021045579962172,True
191,广东省,汕头市,茂名市党政代表团莅汕参观考察,2016-11-08,https://www.shantou.gov.cn/cnst/ywdt/content/post_1308051.html,昨天，茂名市委书记许光、市长李红军率领茂名市党政代表团莅汕参观考察。市委书记陈良贤、代市长刘小涛陪同考察，并与代表团深入交流。陈良贤表示，要抓住省委、省政府促进粤东西北振兴发展的战略机遇，不断深化汕头、茂名两市合作，合力推动两地加快振兴发展，推动粤东粤西“两翼齐飞”。。座谈中，陈良贤代表市委、市政府对茂名市党政代表团一行莅汕表示欢迎，并介绍了汕头经济社会发展情况。他指出，当前汕头正加快供给侧结构性改革，坚持问题导向，以创建全国文明城市为总抓手，按照“补短板，促发展”的工作思路，大力抓交通、建平台、造环境、强管理、创文明，全面推进港口、铁路、高速公路以及轨道交通建设，补齐区位优势短板；构建临港经济区、国家级高新区、华侨试验区“三大平台”，推动产业高端化；加强城市管理，优化政务服务，打造生态、宜居、美丽的城市环境和国际化法治化便利化的营商环境，得到了社会各界和海内外潮人的广泛支持和普遍认可，为振兴发展提供了新的动能。。陈良贤表示，汕头和茂名都是海滨城市，同样肩负着粤东西北振兴发展的历史重任。近年来，茂名市经济总量连续多年位居粤东西北各市首位，发展步伐之快值得钦佩，在城市建设、产业发展、干部队伍建设等方面创造了很多好经验、好做法，值得汕头学习借鉴。希望茂名市党政领导多来汕头传经送宝，把脉支招，加强双方交流合作，进一步深化“汕茂一家亲”的兄弟情谊，携手推动振兴发展。。许光对近期汕头市创建全国文明城市，城乡面貌发生喜人的变化表示赞赏，认为汕头经济社会发展呈现出良好态势。他指出，当前茂名市正全力打造振兴发展平台，全面推进“三大抓手”，大力发展县域经济，加快创新驱动发展。汕头在创建国家级高新技术开发区、创建全国文明城市、城市建设和管理、旧城区保育活化等方面的经验做法值得茂名学习。下来将进一步加强沟通交流，为加快振兴发展奠定坚实的基础。。在汕期间，茂名市党政代表团一行先后实地到东海岸新城、广澳港区、中海信（汕头）创新产业城、汕头侨批文物馆和小公园开埠区等处参观考察。。汕头市领导谢泽生、郑通声、钟挥锷、李耿坚、林依民、谢铿，茂名市领导黄心强、陈小锋、赵广辉、何成华、邓永明、李多民，茂名市中级法院院长林建辉参加相关活动。,4月19日至21日，中国侨联党组成员、副主席隋军带队莅汕考察调研，汕头市委副书记、市长曾风保会见隋军副主席一行。广东省侨联副主席戴文威，汕头市委常委、组织部部长熊松，汕头市侨联主席林健等陪同调研。。调研组一行先后考察了汕头开埠文化陈列馆、汕头侨批文物馆、小公园历史文化街区、红色交通站及华侨经济文化合作试验区、亚青会主场馆建设工地，详细了解汕头开埠以来的城市发展、人文历史和侨批、潮汕华侨文化，感受汕头百载商埠起源地的人文建筑风情，了解中共中央至中央苏区秘密交通线汕头交通中站的历史贡献，以及汕头筹办亚青会、优化营商环境及聚侨引资创新发展情况。。调研中，隋军副主席强调，汕头正处于历史发展的关键时期、大好时期，汕头各级侨联组织要深入贯彻落实习近平总书记重要讲话、重要指示精神，加强侨界思想引领，把握机遇，强化担当，敢于作为，切实为侨界群众做好事、办实事、解难事，全力做好“侨”的文章，把学习贯彻习近平总书记重要讲话、重要指示精神转化为围绕中心履职尽责的实际行动。。在汕期间，隋军副主席还会见了汕头市侨界青年联合会、市侨界海归协会、市侨界博士发展促进会筹委会主要骨干，并与他们亲切交谈，听取新侨们的发言，鼓励他们发扬侨界爱国爱党爱乡的光荣传统，利用自身的资源优势，积极作为，加强交流合作，发挥智库作用，服务项目落地，为城市发展再立新功。,其他,0.5213731719541952,True
191,广东省,汕头市,中国侨联副主席隋军莅汕调研考察,2021-04-21,https://www.shantou.gov.cn/hqsyq/hqxx/content/post_2199703.html,4月19日至21日，中国侨联党组成员、副主席隋军带队莅汕考察调研，汕头市委副书记、市长曾风保会见隋军副主席一行。广东省侨联副主席戴文威，汕头市委常委、组织部部长熊松，汕头市侨联主席林健等陪同调研。。调研组一行先后考察了汕头开埠文化陈列馆、汕头侨批文物馆、小公园历史文化街区、红色交通站及华侨经济文化合作试验区、亚青会主场馆建设工地，详细了解汕头开埠以来的城市发展、人文历史和侨批、潮汕华侨文化，感受汕头百载商埠起源地的人文建筑风情，了解中共中央至中央苏区秘密交通线汕头交通中站的历史贡献，以及汕头筹办亚青会、优化营商环境及聚侨引资创新发展情况。。调研中，隋军副主席强调，汕头正处于历史发展的关键时期、大好时期，汕头各级侨联组织要深入贯彻落实习近平总书记重要讲话、重要指示精神，加强侨界思想引领，把握机遇，强化担当，敢于作为，切实为侨界群众做好事、办实事、解难事，全力做好“侨”的文章，把学习贯彻习近平总书记重要讲话、重要指示精神转化为围绕中心履职尽责的实际行动。。在汕期间，隋军副主席还会见了汕头市侨界青年联合会、市侨界海归协会、市侨界博士发展促进会筹委会主要骨干，并与他们亲切交谈，听取新侨们的发言，鼓励他们发扬侨界爱国爱党爱乡的光荣传统，利用自身的资源优势，积极作为，加强交流合作，发挥智库作用，服务项目落地，为城市发展再立新功。,昨天，湛江市人大常委会常务副主任郑日强一行26人莅汕，对我市城市建设、城乡规划等方面进行参观考察。市人大常委会常务副主任黄俊潮会见郑日强一行，副主任林梃、秘书长李绿岸参加相关活动。。昨天下午，考察团一行参观了陈慈黉故居、广东骅威玩具工艺股份有限公司、广东宜华木业股份有限公司等处。在随后召开的座谈会上，考察团听取了我市的经济社会发展情况和市人大常委会工作的经验和做法介绍。。黄俊潮表示，下来市人大常委会将继续提高履职能力，积极稳妥地行使好立法权，推进民主立法、科学立法，提高立法质量，探索推进立法创新，强化特区立法的针对性、可操作性，充分发挥特区立法先行先试的作用，推动体制机制创新，真正把特区立法权优势转化为特区发展优势，为汕头科学发展提供良好的法治环境和有力的法律制度保障。。郑日强表示，湛江和汕头同为港口城市，分别是粤西、粤东区域发展的龙头，是实现广东区域经济协调发展的关键。此次参观考察让他们获益匪浅，汕头无论是经济社会发展、社会管理还是人大常委会工作都值得湛江市人大常委会学习，希望今后两市多交流沟通，互相借鉴经验，共同发展。,政府领导到其他城市考察学习或访问,0.0,True
191,广东省,汕头市,民政部副部长李立国莅汕调研考察,2010-03-23,https://www.shantou.gov.cn/cnst/ywdt/bmdt/content/post_1625438.html,22—23日，民政部党组副书记、常务副部长李立国在省民政厅厅长刘洪、办公室主任刘平波的陪同下，莅汕调研民政工作并了解汕头经济社会发展情况。在汕期间，市委书记黄志光、市长蔡宗泽拜会并宴请了李立国一行。李立国对汕头近年来的民政工作给予了高度评价，希望汕头的民政工作以深入学习实践科学发展观为动力，更好地服务地方经济社会发展，争当全省民政工作排头兵。。在汕期间，李立国一行先后视察了市福利院、市装饰行业协会等。据悉，近年来，我市各级民政部门以依法维护和保障人民群众基本生活权益为主线，以提高民政工作整体水平、争当全省民政工作排头兵为目标，突出重点、攻克难点、培育亮点，努力推进民政事业改革创新，为汕头市的经济发展、社会稳定和文明进步作出了应有的贡献。1997年至今，各级财政共投入低保资金4.6亿余元，累计近68万人次享受过低保救济；从2002年开始，全市推进了“星光计划”等福利项目建设，共投入资金4600多万元，建成“星光老年之家”162个，建设面积达4万多平方米。其它社会福利机构也初具规模；自1997年以来连续四次被评为全国双拥模范城。 李立国还对近年来汕头经济社会的发展，尤其是产业升级、城市建设、市容市貌发生的可喜变化感到十分高兴，希望汕头继续解放思想，抢抓机遇，擦亮特区牌子，加快发展步伐，早日实现全面振兴和崛起。 李立国一行在汕期间，市领导郑人豪、苏耀光、余健明等先后陪同其参观了东征军史迹陈列馆、汕头市城乡规划展示厅、海滨长廊亲水平台、陈慈黉故居及广东奥飞动漫文化股份公司。,1月24日，国家知名无机化工专家、中国工程院院士、中石化石油化工科学研究院学术委员会副主任舒兴田，率中石化北京石油化工科学研究院、中国科学院理化技术研究所专家一行莅临金平区调研考察。专家组一行首先来到西陇科学股份有限公司，。深入生产、研发基地考察，听取企业介绍并详细了解企业的研发创新成果及生产销售情况。舒兴田院士充分肯定西陇科学近年来取得的成绩，并对企业的未来发展提出了指导意见和殷切期望。。随后，舒兴田院士一行拜访汕头市科技局，进行座谈交流，深入了解我市科技创新发展情况，并就化学与精细化工广东省实验室建设进行了详细深入的交流与探讨，并积极表达合作意向，表示愿意参与助力省实验室建设，为汕头建设省域副中心城市、增创特区新优势贡献力量。。据了解，舒兴田院士是分子筛和炼油催化剂制造专家，多项研究成果均已工业化生产和应用，经济效益显著。此次造访，正是看中金平区以西陇科学为首的精细化工产业长期以来发展势头良好，企业发展成熟，规模日益壮大，在国内外占有重要地位。接下来，金平区将继续发挥区位优势突出、产业基础扎实等优势，深度对接各方面科技、创新、人才、产业优势资源，为省实验室建设与发展贡献力量。（区科技局）,政府领导到其他城市考察学习或访问,0.0,True
191,广东省,汕头市,太平洋保险集团一行到华侨试验区考察调研,2021-04-20,https://www.shantou.gov.cn/hqsyq/zwdt/gzdt/content/post_2199182.html,4月20日下午，太平洋资产管理公司另类投资管理中心总经理齐伟山一行到华侨试验区考察调研并举行座谈交流。市政府李钊副市长、市政府办公室一级调研员陈基平同志和华侨试验区党工委书记林定亮以及华侨试验区、市发改局、市金融局、银保监汕头监管分局有关领导同志参加了活动。。齐伟山一行在林定亮书记的陪同下，实地参观考察了汕头市城市发展和产业展示厅、亚青会主场馆等项目，详细了解了华侨试验区规划建设情况。座谈会上，林定亮书记向太平洋保险集团一行介绍了华侨试验区在国家和省的大力支持下，具有独特的政策、交通、环境等方面的优势，希望太平洋保险集团能发挥集团资源优势参与华侨试验区建设发展。。齐伟山总经理介绍了太平洋保险集团的业务发展情况，对来华侨试验区投资发展表现出浓厚的兴趣，并希望双方接下来在康养项目、总部大厦以及支持试验区建设项目融资等方面加强沟通交流，争取达成合作意向。,4月3日下午，惠州仲裁委员会副主任林锐等一行到汕头仲裁委员会进行考察调研。我委副主任黄晓明等接待了惠州仲裁委一行考察团，并与考察团进行了座谈交流。。本次考察活动双方主要围绕网络仲裁、智能仲裁业务的开展；仲裁员及仲裁秘书的聘用、培训、管理及考核；机构治理、仲裁宣传推广、案件处理等内容进行了深入交流。。黄晓明副主任介绍了汕头仲裁的基本情况，重点介绍了我委在开展互联网仲裁和智能仲裁方面的工作情况。为了适应互联网等新经济新业态的发展需要，适应智能仲裁的发展和技术创新，我委今年开始启用仲裁办案系统“云平台2.0”，通过开展在线立案、电子送达、在线管理、在线仲裁等工作，提升汕头仲裁信息技术服务水平和案件管理规范化、流程化的水平。黄主任还介绍了我委在这方面的工作安排，希望通过依托网络化的案件管理系统来建立一套与电子商务、互联网金融平台对接的仲裁平台，探索线上仲裁及线上线下协同发展的仲裁机制。双方在这方面就互联网仲裁规则、网上审理流程等进行了沟通交流。。林锐副主任介绍了惠州仲裁的基本情况，介绍了惠州仲裁在机构管理、宣传推广、人员培训、队伍建设、案件处理等经验，介绍了目前开展信用体系建设的做法。。座谈会上，双方还就仲裁发展内部管理机制改革，推进秘书职业化和专业化建设交换了意见，并表示要进一步加强沟通交流，互相学习，共同促进仲裁事业的发展壮大。,其他,0.6556752304409981,True
191,广东省,汕头市,湛江市政协调研组莅汕考察,2017-11-10,https://www.shantou.gov.cn/cnst/zwgk/jcxxgk/leader/wdhd/content/post_1327804.html,11月8日至9日，湛江市政协调研组莅汕，围绕城市扩容提质、城市规划建设和管理等主题进行考察。市长郑剑戈，市政协主席谢泽生，湛江市政协主席许顺，副主席刘耀辉、林家萍，秘书长戚兆蓓，市政协副主席谢永忠、蔡佩侬，秘书长卢壁辉等参加相关活动。。在汕期间，调研组到华侨经济文化合作试验区参观了解重点建设项目情况；并到汕头开埠邮局陈列馆、侨批文物馆、汕头开埠文化陈列馆等地考察，深入了解我市协调推进城市扩容提质、城市规划建设与重要历史文化建筑保育活化等方面的做法和经验。。近年来，我市全面实施粤东西北振兴发展战略，着力推进中心城区扩容提质，不断强化和提升粤东中心城市地位。特别是去年以来，我市以“创文强管”为总抓手，着力抓交通、建平台、造环境、强管理、创文明，不断完善城市治理体系，提升城市环境质量，城市规划和扩容提质工作取得扎实成效，实现经济社会平稳较快发展。当前，我市正加快构建“一湾一岸两河三平台”发展新格局，拉开城市框架。同时，全力推动“一一三五六六”工程，进一步完善汕头的内外交通体系，打造全国性综合交通枢纽，推动汕头加快全面振兴、协调发展。。调研组对我市通过创文强管，推动经济社会发展和呈现出的良好态势给予高度评价，表示汕头在推进城市扩容提质、城市规划建设和管理等方面取得了明显成效，特别是强化规划引领，坚持“一张蓝图干到底”；强化基础设施建设，拓宽城市发展空间；强化平台建设，提升城市产业支撑水平；强化城市管理，提升宜居宜业宜游等工作中许多好的做法和经验值得学习借鉴；同时，希望两地政协不断加强交流、密切合作，携手推进两地经济社会各项事业更好发展。,10月28日下午，省政府参事蔡高声带队到澄海区考察中小型企业。汕头市副市长林依民、澄海区长柯茂陪同考察。。蔡高声一行先后到我区的澄星航模、广东雅威和韩江机械等企业进行实地考察。察看了企业的展厅、车间，了解企业的设计、生产、销售等情况，听取我区关于扶持中小型企业发展的相关措施。。近年来，澄海区大力扶持中小型企业发展，出台《扶持企业健康发展的若干措施(2014-2016年)》，加大财政资金支持力度，帮扶中小微企业做强做大。主要通过大力扶持出口企业，每年安排市场开拓专项资金500万元，重点支持企业参加国内外展览展销、开设营销网点、宣传推介产品以及区域国际品牌建设；奖励企业上市融资；帮扶小微企业发展，加大对小微企业信贷支持，解决融资难题；支持企业技术创新。每年安排科技三项经费，重点用于扶持重点骨干企业技术研究和开发投入，以及小微企业新技术新工艺的研究开发费用的补助。。蔡高声肯定了澄海区扶持中小企业的一系列措施，认为在我区的努力下，澄海中小型企业有了良好经营环境，希望我区继续与企业保持密切联系，了解企业需求，及时帮助企业解决困难，促进企业发展。,其他,0.5609125648794671,True
