code,province,city,topic,date,url,content,content.1,label,score,is_match
191,广东省,汕头市,省管干部考察对象公示通告粤组考公号,2012-09-11,https://www.shantou.gov.cn/cnst/ywdt/content/post_1272309.html,根据工作需要和民主推荐情况，经研究，汕头市濠江区委书记、区人大常委会主任林广华同志被确定为汕头经济特区保税区党委书记考察对象，市政府党组成员、市长助理蔡炳锐同志被确定为汕头经济特区保税区管委会主任考察对象，南澳县委书记、县人大常委会主任吴健彦同志被确定为汕头高新技术产业开发区管委会主任考察对象。省委组织部干部考察组将于9月10日起对其进行考察。根据《省管干部考察对象公示试行办法》规定，现予公示，征求党员、群众和单位的意见。。在公示期间，个人和单位均可通过来信、来电、来访等形式，向公示受理单位或干部考察组反映公示对象在德、能、勤、绩、廉等方面的情况和问题。以个人名义反映的提倡留真实姓名；以单位名义反映的应加盖本单位印章。,【政务动态】“牢记嘱托再出发”，12345热线组织重走习近平总书记在汕考察调研路线。为贯彻落实习近平总书记在党的十九届五中全会上的重要讲话以及出席深圳经济特区建立40周年庆祝大会和视察广东重要讲话、重要指示精神，12月1日及2日，12345热线组织全体话务员重走习近平总书记在汕考察调研路线，重温总书记谆谆教导。。12345热线全体话务员循着习近平总书记在汕考察调研路线，先后来到汕头开埠文化陈列馆及汕头侨批文化馆。在汕头开埠文化陈列馆，话务员通过馆内的陈列布置，深入了解汕头开埠历史和经济特区自成立以来发生的巨大成就。在汕头侨批文化馆，12345热线话务员通过一封封“侨批”，进一步了解侨批历史和潮汕华侨文化。。参加活动的话务员纷纷表示，将深入学习贯彻习近平总书记在党的十九届五中全会上的重要讲话以及出席深圳经济特区建立40周年庆祝大会和视察广东重要讲话、重要指示精神，不忘初心、牢记使命，接续奋斗、砥砺前行，为全力以赴开创新时代汕头改革开放发展新局面作出贡献。,其他,0.570392083794724,True
191,广东省,汕头市,新一届市委常委会召开第一次会议重走习近平总书记在汕考察路线重温入党誓词,2021-12-01,https://www.shantou.gov.cn/cnst/zwgk/jcxxgk/leader/szwdhd/content/post_1998539.html,11月29日下午，市委书记温湛滨主持召开市委十二届第一次常委会会议，率新一届市委常委班子赴汕头开埠文化陈列馆、汕头侨批文物馆、小公园历史文化街区，重走习近平总书记在汕考察路线，实地实景感悟总书记的谆谆教诲。温湛滨指出，新一届市委常委班子的第一次集体活动来到小公园开埠区，深情回顾总书记视察汕头时的感人场景和殷殷嘱托，就是要牢记嘱托、感恩奋进、接续奋斗，深入学习贯彻总书记视察广东、视察汕头重要讲话重要指示精神，把总书记山高水长的关心关爱和厚望重托转化为攻坚克难、锐意进取的具体行动，切实走好新的赶考之路，努力把市第十二次党代会描绘的发展蓝图，变成汕头在新时代经济特区建设中迎头赶上的美好现实，向总书记、党中央，向历史和人民交出一份合格的答卷。。温湛滨一行随后来到中共中央至中央苏区秘密交通线汕头中站旧址，认真观看馆藏珍贵的历史图片和文献资料，倾听汕头红色革命的光辉历史，缅怀先烈大无畏的革命精神，汲取不畏艰难、砥砺奋进的力量。参观结束后，在红色交通站旧址前，面对鲜红的中国共产党党旗，温湛滨带领新一届市委常委班子一起重温入党誓词。大家举起右手，以坚定有力的宣誓声，表达高举理想之旗、终身为党奋斗的信念决心。。市委常委班子成员一致表示，历史是最好的教科书，中国革命历史是最好的营养剂。作为汕头改革发展事业的领导者、组织者和推动者，要时刻牢记肩负的光荣使命和重大责任，从党的百年奋斗历程中感悟初心使命、坚定理想信念，忠诚拥护“两个确立”，坚决做到“两个维护”，始终沿着总书记指引的方向坚毅前行、不懈奋斗，拿出“起跑就是冲刺、开赛即是决赛”的劲头，以“事事走在前列”的胆识魄力，以“不待扬鞭自奋蹄”的高度自觉，团结带领全市干部群众走好新的赶考之路，加快建设现代化活力经济特区，奋力谱写全面建设社会主义现代化国家的汕头篇章，以优异成绩迎接党的二十大召开。。会议对常委的分工作了安排。市领导曾风保、赖小卫、黄果、吴刚、许宏华、张宏俊、田晖、蔡永明、叶娴、林锐武参加会议。,习近平在山西考察时强调 全面建成小康社会 乘势而上书写新时代中国特色社会主义新篇章。中共中央总书记、国家主席、中央军委主席习近平近日在山西考察时强调，要全面贯彻党的十九大和十九届二中、三中、四中全会精神，坚持稳中求进工作总基调，坚持新发展理念，坚持以供给侧结构性改革为主线，扎实做好“六稳”工作，全面落实“六保”任务，努力克服新冠肺炎疫情带来的不利影响，在高质量转型发展上迈出更大步伐，确保完成决战决胜脱贫攻坚目标任务，全面建成小康社会，乘势而上书写山西践行新时代中国特色社会主义的新篇章。。初夏时节，三晋大地山峦叠翠，万物勃发。5月11日至12日，习近平在山西省委书记楼阳生和省长林武陪同下，先后来到大同、太原等地，深入农业产业基地、移民新村、文物保护单位、改革示范区和企业等，就统筹推进常态化疫情防控和经济社会发展工作、巩固脱贫攻坚成果进行调研。。11日下午，习近平首先来到大同市云州区，考察有机黄花标准化种植基地。大同黄花种植有600多年历史，是当地主导产业。近年来，在龙头企业、合作社引领下，黄花产量品质稳定，销路和价格也有保障，去年带动贫困户户均收入1万多元。习近平步入田间，察看黄花长势。正在劳作的村民们围拢过来，习近平向他们了解黄花的田间管理、市场价格、产品销路等。他指出，乡亲们脱贫后，我最关心的是如何巩固脱贫、防止返贫，确保乡亲们持续增收致富。希望把黄花产业保护好、发展好，做成大产业，做成全国知名品牌，让黄花成为乡亲们的“致富花”。习近平强调，中国共产党把为民办事、为民造福作为最重要的政绩，把为老百姓做了多少好事实事作为检验政绩的重要标准。离开种植基地，习近平来到邻近的云州区西坪镇坊城新村考察调研。这个村是易地搬迁村，有建档立卡贫困户77户158人，2018年开始入住以来，依靠发展黄花特色产业等实现了全部脱贫。习近平走进村技能培训服务站，了解新村易地扶贫搬迁情况，察看黄花产业相关产品展示，对大同市开展产业扶贫、就业扶贫，巩固脱贫攻坚成果的做法给予肯定。他指出，易地搬迁不仅是为了解决住得好的问题，更是为了群众能致富。要加强易地搬迁后续扶持，因地制宜发展乡村产业，精心选择产业项目，确保成功率和可持续发展。要把群众受益摆在突出位置，从产业扶持、金融信贷、农业保险等方面出台政策，为农村经济发展提供有力支持。基层党组织和党员干部既要当好乡村产业项目的组织者、推动者，又要当好群众利益的维护者。习近平对广大基层干部为帮助贫困人口脱贫所做的艰苦努力表示肯定。。在搬迁户白高山家，习近平察看了院落、客厅、厨房、卫生间等，并同一家人坐在炕沿儿上拉家常。白高山告诉总书记，过去他们住的是土窑洞，如今搬进了独门独院的大瓦房，就近务工，生活条件大为改善，去年儿子娶了媳妇，今年老两口就抱上了孙子，日子越过越红火。习近平高兴地说，共产党是一心一意为人民谋利益的，现在不收提留、不收税、不收费、不交粮，而是给贫困群众送医送药、建房子、教技术、找致富门路，相信乡亲们更好的日子还在后头。今年是决战决胜脱贫攻坚和全面建成小康社会的收官之年，要千方百计巩固好脱贫攻坚成果，接下来要把乡村振兴这篇文章做好，让乡亲们生活越来越美好。易地搬迁群众来自不同的村，由过去的分散居住变为集中居住。要加强社区建设和管理，加强社区环境整治，开展乡村精神文明建设和爱国卫生运动，确保群众既能住上新居所，又能过上新生活。。习近平强调，要充分挖掘和利用丰富多彩的历史文化、红色文化资源加强文化建设，坚持不懈开展社会主义核心价值观宣传教育，深入挖掘优秀传统文化，引导广大干部群众提升道德情操、树立良好风尚、增强文化自信。,政府领导到其他城市考察学习或访问,0.5051124679680903,True
191,广东省,汕头市,中国社会科学院副院长朱佳木莅汕对我市地方志工作进行考察,2011-04-02,https://www.shantou.gov.cn/cnst/ywdt/styw/content/post_1254882.html,3月31日、4月1日，中国社会科学院副院长、中国地方志指导小组常务副组长朱佳木莅汕对汕头地方志工作进行考察。中国地方志指导小组人事处副处长陈旭，省地方志办公室主任陈强，省地方志办公室副主任孟凡华等陪同考察。市委常委、常务副市长郑人豪会见朱佳木一行并介绍了汕头的经济社会发展情况。。在汕期间，朱佳木一行先后参观考察了广东奥飞动漫文化股份有限公司、汕头市城乡规划展示厅、汕头开埠文化陈列馆、汕头海关关史陈列馆、汕头市东征军革命史迹陈列馆等地。他充分肯定了汕头的地方志工作，并指出，地方志是对行政区政治、经济、文化等各方面的记载，汕头有良好的自然条件和深厚的历史积淀，这些都是修志的重要资源；地方志工作说到底就是地情调研工作，为党委、政府提供决策依据，从事地方志工作的同志要坚持“质量第一”的原则，要精雕细琢，推敲打磨。,根据《汕头市潮南区人民医院公开招聘医学类人员公告》等有关规定，体检合格的人员确定为考察对象。现就汕头市潮南区人民医院公开招聘医学类人员考察对象名单予以公告，详见《汕头市潮南区人民医院公开招聘医学类人员考察对象名单》（附件）。。考察工作将按有关规定组织实施，请考生保持联络畅通，以便工作人员及时与考生联系，安排相关考察事宜。,其他,0.9846266992813052,True
191,广东省,汕头市,刘艺良率澳门潮属社团总会访问团莅汕考察,2016-05-03,https://www.shantou.gov.cn/cnst/ywdt/bmdt/content/post_1639484.html,日下午，市委书记陈良贤、市长郑人豪在市委迎宾厅会见访问团一行。市政协主席谢泽生、访问团副团长李莱德、邱金海等会见时在座。。陈良贤代表市委、市政府对访问团一行的到来表示欢迎，并简要介绍汕头经济社会发展近况。他指出，旅居澳门的潮籍乡亲精英荟萃，是家乡的骄傲，澳门潮属社团总会是澳门最重要的潮籍社团，在支持特区政府依法施政、造福社会、支援家乡建设和发展等方面作出了卓越贡献。刘艺良先生担任全国侨联副主席、连任四届全国人大代表，在侨界和国际潮团享有盛誉，积极推动汕澳交流与合作，成绩斐然。陈书记对旅澳乡亲所取得的成就表示祝贺，对他们情系桑梓、爱国爱乡的情怀表示崇高的敬意。。个加强建设的港口之一。当前，汕头迎来了重要的发展机遇，正紧紧围绕实施振兴发展和创新驱动发展。，加快建设粤东中心城市。希望广大澳门潮籍乡亲多回家乡走走看看，加强双方在旅游对接合作、打造澳门年轻一代创新创业基地、传承潮汕文化，以及向广大的葡语国家和地区宣传推广汕头品牌方面的交流与合作。汕头市委、市政府将进一步提高行政服务水平，致力营造法治化国际化营商环境，共同推进汕澳文化交流与经贸合作，实现互惠共赢，共创美好未来。。刘艺良主席对汕头经济社会发展取得的成就感到高兴。他表示，广大澳门潮籍乡亲对汕头未来发展充满期待，随着汕头对外交通基础设施的快步建设，潮属社团定能更多地发挥桥梁、纽带、平台作用，推动汕澳两地在经贸往来、潮汕文化交流等方面密切合作，优势互补，互惠互利。。在汕期间，访问团一行考察了华侨经济文化合作试验区、汕头大学和广东以色列理工学院（筹）。（撰稿：林逸环，摄影：李馥芝）,新年伊始，黑龙江省鹤岗市副市长谢殿才带领鹤岗市商务局、双创办、贸促会主要负责人莅汕考察汕头年货节暨鹤岗市优质产品展示活动和鹤岗市优质产品展示中心（筹）场地，汕头市委常委、副市长李宇陪同考察。。日上午，谢殿才副市长一行先后参观了潮海关、侨批纪念馆，饶有兴趣地了解汕头百年商埠历史、潮汕华侨创业史、汕头经济特区改革开放历程。。新春年货节暨鹤岗市名优产品展示活动现场、鹤岗市优质产品展示中心（筹）场地。两市领导还就下一步深化汕鹤商务合作工作进行深入讨论，取得重要共识。。汕头市商务局局长刘文华、鹤岗市商务局局长刘延丽、鹤岗市双创办主任王海晶、鹤岗市贸促会会长孙纯贵等参加相关活动。,政府领导到其他城市考察学习或访问,0.0,True
191,广东省,汕头市,鹤岗市领导莅汕考察汕鹤两地商务合作工作,2019-01-03,https://www.shantou.gov.cn/cnst/ywdt/bmdt/content/post_1644240.html,新年伊始，黑龙江省鹤岗市副市长谢殿才带领鹤岗市商务局、双创办、贸促会主要负责人莅汕考察汕头年货节暨鹤岗市优质产品展示活动和鹤岗市优质产品展示中心（筹）场地，汕头市委常委、副市长李宇陪同考察。。日上午，谢殿才副市长一行先后参观了潮海关、侨批纪念馆，饶有兴趣地了解汕头百年商埠历史、潮汕华侨创业史、汕头经济特区改革开放历程。。新春年货节暨鹤岗市名优产品展示活动现场、鹤岗市优质产品展示中心（筹）场地。两市领导还就下一步深化汕鹤商务合作工作进行深入讨论，取得重要共识。。汕头市商务局局长刘文华、鹤岗市商务局局长刘延丽、鹤岗市双创办主任王海晶、鹤岗市贸促会会长孙纯贵等参加相关活动。,2018年8月14日，宿迁市住房和城乡建设局朱伟副局长一行7人来汕调研考察建筑工程抗震设防及装配式建筑推进工作情况，市住建副局长林永安及质安科、市场科、质监站和审图单位负责同志与调研组进行了亲切的会谈交流。。交流会上，市住建局林永安副局长就我市建筑行业的发展情况、住建工作的近况向调研组作简要介绍，重点就建筑抗震设防、装配式建筑发展工作方面做了详细的介绍。宿迁市调研组对汕头市住建局的热情接待表示感谢，介绍了宿迁市住建工作的相关情况，并同与会同志、专家就建筑物抗震设计、施工图审查行政管理、绿色建筑实施推广及工程质量、安全监管等各专项领域进行了广泛深入的交流探讨。。在汕期间，调研组还实地考察了我市的装配式建筑生产基地广东东泓住工科技有限公司。此次调研活动增进了两市住建管理部门之间的信息沟通，为双方下一步工作提供了有益参考，促进两市在建设专项领域的进步与提高。,其他,0.590444448125224,True
191,广东省,汕头市,梁振英在汕考察访问时表示支持更多港企来汕发展,2014-03-29,https://www.shantou.gov.cn/cnst/ywdt/styw/content/post_1289733.html,带着共促繁荣、共同发展的美好期望，香港特别行政区行政长官梁振英本月27至28日率经贸代表团莅汕考察访问。在市委书记陈茂辉、市长郑人豪的陪同下，梁振英深入我市重点项目建设现场和港资企业，与在汕工作、生活、学习的港人亲切交流，希望借助日益便捷的交通基础设施，港汕两地政府、企业界、社会团体不断加强交流合作，共同促进繁荣发展。。首次莅汕的梁振英特意选择乘坐自己一直关注的厦深高铁，从深圳北出发，两个多小时到达汕头，亲身体验了这条铁路把汕头和香港的距离拉近、时间缩短、费用降低带来的好处。甫一抵汕，梁振英一行便来到位于万吉工业区内的骏码科技集团，这是一家集研发、生产、销售、应用服务为一体的高新科技港资企业。在听取企业负责人的介绍后，梁振英仔细了解汕头市对高科技产业发展的扶持政策和措施，当得知经评定符合标准的企业不仅可以获得政策性扶持，还可以有奖励时，梁振英十分高兴，他表示，将支持更多香港企业到汕头乃至内地各个城市发展。。作为汕头最大的外商投资来源地、最重要的贸易伙伴之一，香港与汕头的经贸合作可谓源远流长。截止到去年，由香港客商在汕投资设立的企业共有4844家；实际吸收投资超过65亿美元，占全市实际吸收外资金额的75%。去年两地进出口总额11亿美元，同比增长8.7%。集友工艺玻璃工程有限公司和四洲集团也是其中两家在汕发展蒸蒸日上的港企，梁振英先后来到企业的生产车间，详细了解产品的研发、生产、销售等情况。。他高兴地说，汕头已形成了一个港资企业群，这些港企给汕头提供了经济发展动力，同时汕头也为香港企业的发展提供了很好的平台，为港人创造了更好的发展机会。。汕头城市总体规划以及正在推进的重大平台建设是梁振英和代表团的企业家们此行关注的重点。省市重点项目东海岸新城是汕头实现城市扩容提质的重大载体，梁振英一行深入施工现场，察看项目规划图，当了解到汕头将依托这一填海项目和“一湾两岸”的规划建设，在海湾新区核心区高水平规划建设华侨经济文化合作试验区，努力建成全球华侨华人文化深度融合先行区、经济发展转型升级引领区和华侨资产管理区域中心，有关工作正加紧推进并积极争取上级支持时，梁振英频频点头说，汕头发展前景可期，令人振奋。。在汕期间，梁振英还与在汕工作、创业的港人和就读于汕头大学的香港学生亲切交流，关心大家的工作、学习、生活情况，希望在汕港人敢闯敢拼，抓住机遇，为推动香港和汕头两地的合作与发展作出更大努力。,我市第11批市优秀拔尖人才选拔工作自今年9月底启动以来，受到社会各界的广泛关注和各类人才的积极响应。截至报名日期，经基层单位层层严格审核把关，共接受申报224人，涵盖专业技术、企业经营管理、高技能和农村实用等人才类别。据统计，224名申报人选平均年龄43.6岁，大学以上学历占74.5%，其中博士19人，硕士32人，在职研究生5人，大学本科111人。专业技术人才类中有高级职称131人，其中正高42人，副高89人，占同类别申报数的73.6％。这次市优秀拔尖人才选拔申报人数之多，质量之高，前所未有。这既是市委、市政府高度重视人才工作的积极反馈，也充分说明了我市跨越发展中人才集聚效应正逐步形成。 为确保好中选优，优中拔尖，市委组织部按人才类别和学科相近的原则，邀请相关职能部门领导和专家组成了9个评审小组，采取审阅材料、集中评议和民主投票办法进行评审。评审工作坚持“四个原则”：一是严格标准、总量控制的原则。评审过程中，坚持选拔标准，总量控制，严格把关，保证评审工作的有序性和权威性。二是德才兼备、注重实绩的原则。贯穿“重成果、重业绩、看能力、看贡献”的指导思想，审核每名人选近三年取得的成绩，包括获奖情况、论文著作、专业技术成果、荣誉称号、课题立项等指标。三是突出重点、服务发展的原则。从服务我市经济社会发展大局出发，落实“三个优先”，即优先从产业界选拔人才，优先从我市支柱产业、重点行业和关键领域选拔人才，优先选拔研究成果面向市场、能较好转化为现实生产力、在一线做贡献创业绩的优秀人才。四是优化结构、综合平衡的原则。评审过程中，既突出重点，又统筹兼顾；既注意学科平衡，也注意整体布局；既体现对高水平人才的重点支持，也注意激发基层人才干事创业的热情，力争使各行各业、各种学科、各层次人才均衡发展。 根据评审组评审结果，目前已确定79名差额考察对象，今起进入考察环节。（祖才） 相关稿件,其他,0.8701051296025831,True
