code,province,city,topic,date,url,content,content.1,label,score,is_match
188,广东省,韶关市,李再丰副市长到爱尔眼科总部考察调研,2023-02-24,https://www.sg.gov.cn/bmpdlm/mzj/ywgz/content/post_2376274.html,2月23日下午，韶关市人民政府副市长、市红十字会会长、九三学社韶关市委主委李再丰一行前往爱尔眼科长沙总部进行考察调研，双方深入座谈交流，就共同推动韶关市眼健康公益事业发展达成合作共识。。座谈会上，爱尔眼科集团副总裁、湖南爱尔眼视光研究所所长杨智宽教授对李再丰副市长一行的到来表示欢迎，就集团目前的整体发展情况作了介绍。他表示，爱尔眼科是一家具有全球规模的眼科医院集团，在全球范围内拥有800余家医疗机构，一直以来积极践行国家方针政策，努力发挥自身专业优势，致力于防盲治盲、眼病义诊、眼健康教育等公益事业并发挥积极作用。。李再丰副市长高度肯定了爱尔眼科的社会担当与责任，“我今天来到爱尔眼科总部，通过参观以及听取介绍，为爱尔眼科能够有今天这样的成绩，而备受鼓舞。”他表示，韶关市“乡村健康快车”作为善美韶关“招善引爱”工作的民生工程，秉承了中华健康快车“扶贫治盲”的宗旨，2018年以来深入广大乡村一线免费为困难白内障患者提供复明手术治疗，并对糖尿病视网膜病变患者进行免费的筛查和随访工作，打通了健康扶贫的“最后一公里”；希望爱尔眼科能够积极参与韶关乡村健康快车建设，并将儿童青少年近视防控工作也一同纳入到乡村健康快车建设里来，一同为建设健康中国注入积极力量，共同助力韶关慈善事业高质量发展。,"6月27日，湛江市老促会会长麦马佑率领该会领导及湛江各县（市、区）老促会领导共30多人，在韶关市老促会第一副会长梁聪等陪同下，到原“中央苏区县”南雄市考察老区建设工作。。当天上午，南雄市召开座谈会与湛江市老促会一行进行交流互动。南雄市老促会副会长兼秘书长何哲瑜主持。。南雄市委常委、统战部部长陈志光首先致辞。他代表市委、市政府对湛江市老促会一行的到来表示热烈的欢迎和致以崇高的敬意。。陈志光深情地说，说起湛江，就连南雄普通民众都有不少的认知。这里有历史脉络把我们南雄湛江两地连接了起来。南雄珠玑巷后裔联谊会每每开展的大型姓氏节活动的场面上，会场的寻根队伍站位排列中也都有“湛江市”赫然其中。两地先民因为部分姓氏族系，在岭南迁徙文化长河中散居在湛江的广袤大地上。真可谓南雄和湛江是地处广东最南端与最北端的一对天涯若比邻的近亲。近期我们在媒体上获悉无论是大型工业项目、大型省级农业产业园以及在国家海洋战略的推动下，许多的海港、海产、海景建设等大手笔项目都不断落户湛江，可以说，湛江老区建设步伐在南雄之前已先走一步，这也为我们南雄先期积累了先进理念和建设经验。。陈志光说，南雄革命历程辉煌，不仅是全国著名的革命老区，在土地革命战争时期，还是毛泽东、朱德创建中央苏区的重要组成部分。毛泽东、朱德、彭德怀等老一辈无产阶级革命家都曾在南雄开展革命活动，著名的苏区保卫战“水口战役”、中央红军长征入粤第一仗均发生在南雄。中央红军长征后，项英、陈毅率部在南雄油山、梅岭、北山一带坚持了艰苦卓绝的三年游击战争。南雄老区人民为新中国的建立作出了很大的牺牲与贡献，有名字记载的南雄籍革命烈士就达676名。。陈志光希望,湛江市老促会的同行们以这次交流的机会，多给南雄介绍先进理念，成功经验，同谋发展之路，齐参发展之策，共进发展之道。。南雄市老促会会长涂运发向客人介绍了南雄老区建设和老促会工作情况。他说，南雄市老促会2016年11月换届以来，通过不懈努力，全市老区建设及老促会工作取得了令人瞩目的成绩。2018年9月，南雄市老促会被中国老区建设促进会评为“全国先进老区建设促进会”，成为广东省获此殊荣的唯一县（市）。2018年，南雄市老促会还分别荣获中国老区宣传工作、广东省老区宣传工作三等奖。2018年5月，南雄市老促会出席了中国老促会在吉林省延吉市召开的全国《革命老区县发展史》编纂工作座谈会，并在会上作了经验介绍，再次受到中国老促会对南雄市编纂《革命老区发展史》工作的充分肯定和表扬。目前已基本完成了《南雄革命老区发展史》终审稿的审定，前不久还被中共党史出版社和中国老促会作为高质量的精品样书推荐到中央宣传部，这是从全国1599个老区县中首批推荐的两部样书之一，申报列入中央宣传部主题出版重点选题并作为优秀读物向全国青少年推荐。。涂运发在谈工作体会时说，做好老区工作，必须要领导重视、有老区情怀和责任担当；老促会工作者要有自愿、自觉和奉献精神。。韶关市老促会副会长甘义娣高度评价了南雄老区工作成就，认为南雄市老促会工作走在了韶关甚至全省的前列。“领导重视、选好班子、勇于创新、加强宣传和牢记为老区人民服务的宗旨”，是南雄做好老区工作的“法宝”。。麦马佑指出，前不久省委、省政府在梅州市大埔县召开了全省推动老区苏区振兴发展工作现场会，湛江市以此为动力，决定借此东风加快老区苏区振兴发展。这次在省老促会的引荐下，湛江市老促会率队来到苏区南雄参观考察。听了南雄真诚、毫不保留的经验介绍后，我们受益匪浅，收获颇多，不枉此行。我们将把“南雄经验”带回去，好好消化，汲取营养，付诸实践，以实际行动推动湛江老区工作上新水平。",政府领导到其他城市考察学习或访问,0.0,True
188,广东省,韶关市,我市组织考察团外出考察循环经济环保园项目建设,2019-03-19,http://www.lechang.gov.cn/zwgk/zwdt/content/post_1060709.html,为加快推进我市循环经济环保园项目建设，深入学习其他县市区循环经济环保园项目建设的先进经验，从3月15日开始，我市组织市四套班子成员、各相关单位负责人以及乐城、长来等街道、镇村干部和村民分批次赴惠州、东莞等地进行实地考察学习。。3月15、16日，由市委书记、市长沈河民带队、市领导林柏居、杨剑云、王昭良、李锡洪及有关部门和乐城街道镇村干部以及村民组成的第一批考察组，先后到了光大环保能源（惠东）有限公司、光大环保（博罗）生态园以及东莞市粤丰环保电力有限公司实地参观，对各地生活垃圾收集运送、焚烧发电、滤液处理回用等垃圾循环处理的各个流程进行详细了解，并听取了相关介绍。。惠东生活垃圾焚烧处理发电项目于2018年1月投产，位于惠东平山街道坣陂村，占地面积118亩，项目设计日处理垃圾1200吨，每年可处理惠东县生活垃圾约43.8万吨，提供绿色电力超过1.7亿千瓦时；光大环保（博罗）生态园占地530亩，分为生产区、办公生活区和生态种植休闲区，建设总规模生活垃圾日处理量1050吨，年处理量38.33万吨，是一家集再生资源综合利用、生态旅游、绿色植被和环保教育为一体的环保生态园；东莞市粤丰环保电力有限公司位于东莞南城区，是一家专门从事垃圾焚烧发电的企业，垃圾日处理量约3300吨。。【乐昌市住房和城乡建设管理局党组成员 何四成：按照我们乐昌2019年民生实事的工作目标，我们拟建设一座生活垃圾终端处理设施项目。为了把这个建设项目更顺利地推进，今天我们组织有关的干部，还有村干部、村民代表进行学习，目的就是为了使他们提高这个知晓率。为了把这项工作做得更好，我们的实施计划从今年3月份启动，预计4月份完成这个选址，5月份做完两评估一方案，6月份同步做好环评工作，7月份招投标，8月份开始动工。预计工期是一年时间，到明年的9月、10月交付使用。】。据了解，此次考察学习共分三批，其中第二批于3月16、17日，由市人大常委会主任许新华带队、市领导刘允曾、徐国秀、邹志忠、邓洪炜、黎跃飞、谭桂明和乐城街道干部以及村民到达项目现场进行了实地考察学习。,“中国丹霞”申遗系列提名地互检考察团到丹霞山考察指导 - 丹霞山风景名胜区官方网站。本月7—8日，“中国丹霞”申遗系列提名地互检考察团到丹霞山考察指导申遗工作。国家住房和城乡建设部城建司风景与世界遗产管理处副处长左小平、申遗咨询专家组组长梁永宁、申遗专家组组长彭华、申遗协调小组办公室副主任王晓良、省建设厅城建处副处长宋健、中国丹霞申遗系列提名地申遗办负责人和专家学者冒着炎炎烈日先后到景区森林生态旅游步道卧龙岗观景台、老山门拆迁遗址绿化改造现场、展示中心建设工地、瑶塘新村及断石村村貌改造现场、景区监控中心等地进行了考察互检，并听取了相关人员对丹霞山申遗整改方案及进展情况的汇报。。据了解，丹霞山根据联合申遗办的统一部署安排，按照国际专家考察评估标准和要求，强化运作、全力攻坚，截止目前，丹霞山已基本完成拆迁工作，进入最后的绿化和环境整治阶段，至八月底将全面完成整治和建设任务。考察结束后市申遗办组织召开了“中国丹霞申遗联合互检组检查工作总结会”。 市申遗办、规划局、旅游局、国土局、建设局、丹霞山管委会及仁化县政府共同参加了会议。。会上首先听取了相关部门的工作汇报，考察团专家组为丹霞山的申遗工作出谋献策，提出了众多的宝贵建议。国家建设部副处长左小平在会上代表考察团讲话，他对丹霞山申遗工作给予了肯定，认为丹霞山资源价值极高，特别是省、市、县高度重视申遗工作，全民积极参与，各部门真抓实干，通力配合做了大量的工作，在任务重、工作难度大、涉及面广的情况下已基本完成了申遗拆迁及环境整治工作。同时，按照国际专家考察评估的标准，丹霞山申遗工作还存在诸多的不足，要求丹霞山整改有待进一步提升，做到尽善尽美。,其他,0.6407384772923607,True
188,广东省,韶关市,河源市考察组到南雄考察南粤古驿道重点线路规划建设,2018-03-26,https://www.gdnx.gov.cn/sgnxzfjsj/gkmlpt/content/0/585/post_585789.html,3月23日，河源市政府副秘书长王少锋一行26人到南雄就南粤古驿道重点线路规划建设进行交流和实地考察。南雄市副市长吴良彬和住建局、文广新局、旅游局、兴雄公司等单位负责人参加了座谈会并陪同考察。。座谈会上，吴良彬就我市南粤古驿道项目进行了简要介绍。市住建局相关负责人也介绍了南雄市南粤古驿道保护利用总体策划。其后，与会双方就古驿道的规划建设和保护进行了深入交流。,上午，市检察院召开了由阙定胜检察长主持的中心组（扩大）学习会议，集中学习了中央实践领导小组《关于在教育实践活动中学习弘扬焦裕禄精神践行“三严三实”要求的通知》、《习近平总书记在参加兰考县委常委班子专题民主生活会时的讲话》和省委实践办《关于佛山市南海区委专题民主生活会情况的通报》。市院班子成员、副处级干部及各部门负责人参加了学习会。。会上，阙定胜结合市院正在开展的党的群众路线教育实践活动，对以上三份文件进行了全面的解读。他指出，上述三份文件对于我们开展教育实践活动很有指导意义，当前，我院的教育实践活动已进入查摆问题、开展批评阶段，各位班子成员都已经撰写了个人对照检查材料。从督导组反馈回来的情况看，个人对照检查材料还不到位，还有许多需要修改完善的地方。希望各位班子成员动真格，下真功夫，好好改一改，尤其是要结合实际举例说明存在问题，不要抹不开面子，放不下架子，对照检查就是要敢于给自己揭短亮丑，出出汗，红红脸，达到查摆问题，整改提高的目的。。阙定胜专门就学习《习近平总书记在参加兰考县委常委班子专题民主生活会时的讲话》进行了深入细致的解读。他指出，习总书记的讲话分为三个部分：第一部分是对兰考县委常委专题民主生活会的准备情况和会议特点进行了分析，总结出了4个特点：一是规定动作做得实；二是特色载体用得好；三是闻过即改抓得早；四是两手并进力度大。习总书记的评价，实际上就是在用实际例子，指导全国第二批教育实践活动单位如何开好专题民主生活会。第二部分是对下一步的整改工作提要求，要在抓常、抓细、抓长上下功夫。抓常，就是要经常抓、见常态；抓细，就是要深入抓，见实招；抓长，就是要持久抓，见长效。第三部分是对作风建设提出了三点意见：一是必须坚定理想信念；二是必须坚持求真务实；三是必须坚持清正严明。。最后，阙定胜希望全院党员干部要认真学习上级的文件精神，认真查找差距，切实解决问题，使教育实践活动取得实效。（市检察院）,其他,0.6323964682855159,True
188,广东省,韶关市,专家考察组顺利到达中国丹霞贵州赤水进行考察,2013-09-17,http://dxs.sg.gov.cn/ztzl/sjyczl/zgdx/content/post_62628.html,9月20日中午12：15，IUCN考察专家和全程陪同成员在贵州省建设厅伍祥华副厅长、赤水市政府张集智市长等领导陪同下，乘MU5710包机于15：15分飞抵泸州。赤水市四套班子领导在机场迎接。考察团当即分乘两辆小车、一辆卡斯特于17：30分到达赤水。赤水市组织民众夹道欢迎。贵州省辛维光副省长等领导在赤水中悦大酒店会见并宴请考察团全体成员。,为加快推动我县大健康产业发展，7月11日，百城千镇（华南）产业发展研究中心博士杨伦斌率考察组到我县考察。县委常委，统战部部长秦正京，县工信局、县高新区等相关单位负责同志参加考察和座谈会。。考察组先后来到广科（乳源）孵化器有限公司、富源工业园标准厂房、广东珍好制药有限公司、一六大健康产业园项目建设现场进行实地考察，详细深入了解我县大健康产业规划、产业发展等情况。。最后，在县高新区会议室召开座谈会。秦正京介绍了我县交通区位优势及产业发展情况，并侧重就大健康产业招商引资政策资源优势等进行了宣推。杨伦斌就百城千镇（华南）产业发展研究中心建设，研究方向做了详情介绍，对我县大健康产业发展规划发表了专业见解，并对乳源良好的生态、优越的区位、丰富的资源和巨大的发展潜力给予充分肯定。他表示，希望有机会邀请有意向企业共同参与乳源大健康产业建设发展，深化合作交流，探索创新发展模式，实现互利共赢。,其他,0.5056358666130486,True
188,广东省,韶关市,中国电子材料行业协会来韶开展考察交流,2020-01-14,https://www.sg.gov.cn/gxj/gkmlpt/content/2/2338/post_2338212.html,2020年1月6日-9日，中国电子材料行业协会2020年秘书长会议在韶胜利召开。协会及下属的半导体材料分会、覆铜板材料分会、压电晶体材料分会、真空电子与专用金属材料分会、磁性材料分会、电子陶瓷材料分会、锡焊料材料分会、电子铜箔材料分会、石英材料分会9个分会参会。会议总结了2019年电子材料产业发展情况，分析重点企业现状，并对2020年产业发展趋势进行研讨和展望。。在会议期间，经市工信局积极协调，由市政府副秘书长石文带队，韶关新区、市发改局、市科技局、市工信局、市商务局领导与协会理事长潘林、秘书长何耀洪、高级顾问袁桐及9个下属分会的领导进行了座谈对接，双方就服务、合作、招商引资等事项进行了热烈、深入的讨论，达成了初步合作意向。同时，还参观考察了韶关高新区展厅。。座谈会后，殷焕明市长会见了协会理事长潘林一行，并进行了亲切交谈，要求市直相关部门加强和中国电子材料行业协会以及下属分会的沟通交流，加快推进我市新型液晶显示材料等产业发展。。在会议期间，协会理事长潘林、秘书长何耀洪和分会领导、中国光学光电子行业协会液晶分会常务副秘书长胡春明和市政府及相关部门领导出席了韶关市欧莱高新材料有限公司“半导体集成电路用高纯溅射靶材项目”的启动仪式。,4月29日，清远市英德市委统战部考察组一行到深渡水瑶族乡就少数民族特色村寨建设情况进行调研考察，县委统战部副部长、县民宗局局长叶雨林及深渡水乡有关负责同志陪同调研。。考察组一行首先来到深渡水乡镇街参观了风度书房和深渡水乡民族文化展示馆情况，了解深渡水乡文化宣传工作；随后实地查看了深渡水乡长梅一组特色村寨建设及（镇街）整治提升项目建设情况。在乡政府会议室，考察组与县民宗局及深渡水乡负责同志进行了座谈，重点就少数民族特色村寨建设进行了深入探讨。调研组详细了解了深渡水乡包括产业发展、教育医疗和公共文化等各项经济社会发展现状，双方重点就少数民族特色村寨建设前期资金筹措、项目设计及整治提升等方面问题进行了深入交流。。考察组表示，要充分借鉴深渡水瑶族乡在发挥资源禀赋，整合各方资金，有效推进少数民族特色村寨建设的经验做法。双方均表示，今后要进一步密切联系，并将此次交流的经验所得与本地区社会发展实际相结合，共同推动少数民族地区实现高质量发展。,政府领导到其他城市考察学习或访问,0.0,True
188,广东省,韶关市,瑞士上市公司艾尔康电子元器件有限公司莅乐考察,2017-07-01,http://www.lechang.gov.cn/zfxxgkml/content/post_1312596.html,月27至28日，瑞士上市公司艾尔康电子元器件有限公司商务考察团一行莅临乐昌考察。市委常委、副市长、大朗乐昌对口帮扶指挥部总指挥曾悦，副市长谭桂明陪同考察。。考察团一行先后考察了乐昌新城、武广高铁乐昌东站、产业园、乐昌市职业技术学校、广东省工商高级技工学校等，实地了解了乐昌的经济发展、基础设施、城市建设等情况。。曾悦同志对艾尔康考察团的到来表示欢迎，并向考察团一行详细介绍了乐昌的自然环境、土地成本、产业布局等情况，并对企业关心的政策优惠和营商环境等问题进行了讲解。曾悦同志表示，乐昌正处于“天时、地利、人和”的发展良机，“天时”指的是广东省政府正大力振兴粤东西北发展，大朗乐昌两地结对帮扶、产业共建等大环境；“地利”指的是乐昌地处四省交界，具备高速、高铁、机场等多位一体的交通区位优势；“人和”指的是乐昌干部、群众、乡贤齐心干事创业的热情高涨，营商环境日益优化。曾悦同志表示，乐昌诚挚欢迎各地的企业家能到乐昌投资兴业。。艾尔康考察团一行表示，对乐昌的投资环境很感兴趣，希望双方能进行深入合作，及早促进项目落地。,近日，中国古生物化石保护基金会一行来我市考察调研古生物化石保护等工作，并于10月13日召开座谈会。市委书记林小龙出席会议并讲话，副市长、市委统战部部长杨耀轩主持会议。。座谈会上，双方就我市恐龙化石资源保护利用以及南雄文化产业发展进行了交流探讨。考察组表示，通过前几天的实地考察和听取汇报，了解到南雄化石资源、红色资源丰富独特，建议我市要树立尊重自然、保护自然的生态文明理念，采取切实可行的措施来保护好这些珍贵的遗迹资源，建设科普研学基地，把南雄的化石资源与红色文化、历史文化相融合，推动南雄文旅产业以及地方经济的发展。同时，要进一步提升管理水平，增强互动性，加强解说力量，要创新理念，增加高科技等新元素，进一步推动我市生态资源的保护与利用，实现可持续发展。。在听取与会人员对我市古生物化石开发和利用的意见和建议后，林小龙表示，近年来，我市一直努力利用资源项目库的建设进行招商引资，力争将南雄红色文化、化石文化、银杏文化、姓氏文化、非遗文化等多种文化资源进行融合发展。他指出，文化发展要做到发掘保护与开发利用统筹推进，学术研究与科普教育统筹推进，专业保护与民间保护统筹推进。同时，他希望基金会能够发挥专家委员会的人才优势，支持我市恐龙资源开发项目的策划规划工作，积极帮助引荐投资公司参与项目的策划规划及投资合作，提供更多优势资源，提高南雄在恐龙化石资源方面的影响力，让南雄的古生物化石“活”起来。,其他,0.5513085633927444,True
188,广东省,韶关市,中国古生物化石保护基金会一行到我市考察,2021-10-13,http://www.gdnx.gov.cn/xwdt/nxyw/content/post_2061595.html,近日，中国古生物化石保护基金会一行来我市考察调研古生物化石保护等工作，并于10月13日召开座谈会。市委书记林小龙出席会议并讲话，副市长、市委统战部部长杨耀轩主持会议。。座谈会上，双方就我市恐龙化石资源保护利用以及南雄文化产业发展进行了交流探讨。考察组表示，通过前几天的实地考察和听取汇报，了解到南雄化石资源、红色资源丰富独特，建议我市要树立尊重自然、保护自然的生态文明理念，采取切实可行的措施来保护好这些珍贵的遗迹资源，建设科普研学基地，把南雄的化石资源与红色文化、历史文化相融合，推动南雄文旅产业以及地方经济的发展。同时，要进一步提升管理水平，增强互动性，加强解说力量，要创新理念，增加高科技等新元素，进一步推动我市生态资源的保护与利用，实现可持续发展。。在听取与会人员对我市古生物化石开发和利用的意见和建议后，林小龙表示，近年来，我市一直努力利用资源项目库的建设进行招商引资，力争将南雄红色文化、化石文化、银杏文化、姓氏文化、非遗文化等多种文化资源进行融合发展。他指出，文化发展要做到发掘保护与开发利用统筹推进，学术研究与科普教育统筹推进，专业保护与民间保护统筹推进。同时，他希望基金会能够发挥专家委员会的人才优势，支持我市恐龙资源开发项目的策划规划工作，积极帮助引荐投资公司参与项目的策划规划及投资合作，提供更多优势资源，提高南雄在恐龙化石资源方面的影响力，让南雄的古生物化石“活”起来。,9月15日，江苏腾信新材料有限公司董事长朱德洪一行五人前往南雄园区进行项目考察。市政府党组成员、园区党工委书记吴少华在六楼会议室主持召开了考察座谈会。。会上，吴少华对江苏腾信新材料有限公司前来考察投资表示热烈的欢迎，并向朱德洪一行介绍了南雄的基本情况、投资环境、招商项目。南雄产业转移工业园以精细化工、新材料(竹纤维、银杏深加工)电气机械及器材制造为主导产业，有污水处理厂，消防应急救援中心、精细化学品质量检测中心、人才驿站党群服务中心等完善的配套设施。截至8月底，园区入驻企业115家，试产或投产企业88家，规模以上企业39家，高新技术企业26家，省、市工程技术研究中心25家，上市挂牌企业4家，有院士工作站3家，通过“腾笼换鸟”等方式置换企业34家。,其他,0.7347765217330212,True
