code,province,city,topic,date,url,content,content.1,label,score,is_match
188,广东省,韶关市,我市党政代表团赴江苏省徐州市考察,2024-06-16,https://www.sg.gov.cn/xw/ztjj/dhgzl/content/post_2641603.html,"6月13日至15日，市委书记陈少荣，市长陈志清率韶关市党政代表团前往江苏省徐州市考察，认真落实全省深入推动区域协调发展座谈会精神，学习借鉴徐州市建设区域中心城市、区域科创中心，推动产业转型升级、发展县域经济、产业园区管理及生态修复等方面的成功经验做法，以更开放的思维、更有力的举措推动省委“1310”具体部署、市委“363”工作安排落地落实，推动韶关高质量发展取得新进展新成效。徐州市市长王剑锋，市委副书记、政法委书记韩冬梅参加有关活动。。带着解放思想、对标先进、奋发进取的强烈愿望，代表团一行先后走进徐工消防高空作业平台车新基地项目，徐州矿务集团，江苏协鑫硅材料科技发展公司，徐工集团徐州重型机械公司、高端工程机械及核心零部件创新中心，徐州徐工矿业机械公司、江苏恩华药业公司、徐州国家安全科技产业园、淮海国际陆港供应链服务中心、云龙湖文旅开发项目、潘安湖采煤沉陷区生态修复治理工程、潘安湖街道马庄村、格雷博电驱动总成设备项目、徐州龙兴泰能源科技公司、江苏澳思柏恩装饰材料公司，学习推动传统企业转型升级、制造业延链强链、科技赋能产业发展、营商环境提升、历史文化资源转化利用、矿山生态修复与利用和党建引领乡村振兴的创新思路、方法举措，实地感受徐州经济社会发展的蓬勃态势。。陈少荣指出，韶关与徐州同为省际交界城市、老工业基地，同处在深化产业转型升级、加快发展动能转换的关键时期。徐州创造了半导体产业链从无到有、不断壮大，老矿企从破产到样板等许多好经验好做法。韶关要认真学习借鉴徐州在推动传统产业转型蝶变和培育新兴产业发展壮大等方面的好经验好做法，解放思想、改革创新、敢于担当、不畏艰难，把资源优势转化为发展胜势。要抓住省推动“一中心三极点”综合交通枢纽布局机遇，加快构建畅通省内外交通大通道，提升区域互联互通水平。要做大做强各产业链主企业，着力延长产业链，提升产业集聚度，不断提高产品附加值，持续壮大产业规模。要坚持把招商引资作为推动高质量发展的有力抓手，在政策支持、要素保障、机制建设等方面持续加力。要充分发挥国有资本战略性、基础性、先导性功能作用，在重点产业、项目建设中发挥优势，赋能地方发展。要深入开展资源盘活行动，立足资源禀赋，在资源开发、资产盘活上下狠功夫，实现老旧资源更新利用、闲置资源盘活增值、低效资源提能增效。要持续优化营商环境，大力推进“帮代办”服务，创新政务服务机制，有效解决企业难题，推进项目建设，助力企业发展。要持续深化体制机制改革，深化投融资、金融管理、园区平台体制改革,推进政策性创新，释放市场活力,增强内生动力。。王剑锋对我市党政代表团到徐州考察表示欢迎。他说，志合者，不以山海为远。韶关有良好的工业基础、丰富的自然资源，是广东北部生态发展区的中坚力量，电子信息、机械装备、生物医药等产业发展取得的成效令人钦佩，在数字经济培育、重大项目建设、推动绿色发展等方面创造的先进经验令人鼓舞，值得徐州认真学习借鉴。徐州与韶关虽远隔千里，但两地经济互补性强、协同联动性高，有着广阔的合作前景。当前，徐州正因地制宜加快发展新质生产力，加快建设淮海经济区中心城市，奋力打造全省高质量发展的强劲支点，扎实稳健推进中国式现代化徐州新实践。希望两地携手发挥互补优势，进一步深化区域协同、科技创新、产业发展、文旅交流合作，做深互动文章、共创发展胜势，推动两地合作蓝图越绘越美，以徐韶深层次交流、高质效合作为中国式现代化建设作出更大贡献。。市领导蒋红林、邹振宇、颜玉明、肖智勇；徐州市领导王先正、戴敏捷、龚维芳、孙文华参加有关活动。（转载韶关日报 黄俊）","6月13日至15日，市委书记陈少荣，市长陈志清率韶关市党政代表团前往江苏省徐州市考察，认真落实全省深入推动区域协调发展座谈会精神，学习借鉴徐州市建设区域中心城市、区域科创中心，推动产业转型升级、发展县域经济、产业园区管理及生态修复等方面的成功经验做法，以更开放的思维、更有力的举措推动省委“1310”具体部署、市委“363”工作安排落地落实，推动韶关高质量发展取得新进展新成效。徐州市市长王剑锋，市委副书记、政法委书记韩冬梅参加有关活动。。带着解放思想、对标先进、奋发进取的强烈愿望，代表团一行先后走进徐工消防高空作业平台车新基地项目，徐州矿务集团，江苏协鑫硅材料科技发展公司，徐工集团徐州重型机械公司、高端工程机械及核心零部件创新中心，徐州徐工矿业机械公司、江苏恩华药业公司、徐州国家安全科技产业园、淮海国际陆港供应链服务中心、云龙湖文旅开发项目、潘安湖采煤沉陷区生态修复治理工程、潘安湖街道马庄村、格雷博电驱动总成设备项目、徐州龙兴泰能源科技公司、江苏澳思柏恩装饰材料公司，学习推动传统企业转型升级、制造业延链强链、科技赋能产业发展、营商环境提升、历史文化资源转化利用、矿山生态修复与利用和党建引领乡村振兴的创新思路、方法举措，实地感受徐州经济社会发展的蓬勃态势。。陈少荣指出，韶关与徐州同为省际交界城市、老工业基地，同处在深化产业转型升级、加快发展动能转换的关键时期。徐州创造了半导体产业链从无到有、不断壮大，老矿企从破产到样板等许多好经验好做法。韶关要认真学习借鉴徐州在推动传统产业转型蝶变和培育新兴产业发展壮大等方面的好经验好做法，解放思想、改革创新、敢于担当、不畏艰难，把资源优势转化为发展胜势。要抓住省推动“一中心三极点”综合交通枢纽布局机遇，加快构建畅通省内外交通大通道，提升区域互联互通水平。要做大做强各产业链主企业，着力延长产业链，提升产业集聚度，不断提高产品附加值，持续壮大产业规模。要坚持把招商引资作为推动高质量发展的有力抓手，在政策支持、要素保障、机制建设等方面持续加力。要充分发挥国有资本战略性、基础性、先导性功能作用，在重点产业、项目建设中发挥优势，赋能地方发展。要深入开展资源盘活行动，立足资源禀赋，在资源开发、资产盘活上下狠功夫，实现老旧资源更新利用、闲置资源盘活增值、低效资源提能增效。要持续优化营商环境，大力推进“帮代办”服务，创新政务服务机制，有效解决企业难题，推进项目建设，助力企业发展。要持续深化体制机制改革，深化投融资、金融管理、园区平台体制改革,推进政策性创新，释放市场活力,增强内生动力。。王剑锋对我市党政代表团到徐州考察表示欢迎。他说，志合者，不以山海为远。韶关有良好的工业基础、丰富的自然资源，是广东北部生态发展区的中坚力量，电子信息、机械装备、生物医药等产业发展取得的成效令人钦佩，在数字经济培育、重大项目建设、推动绿色发展等方面创造的先进经验令人鼓舞，值得徐州认真学习借鉴。徐州与韶关虽远隔千里，但两地经济互补性强、协同联动性高，有着广阔的合作前景。当前，徐州正因地制宜加快发展新质生产力，加快建设淮海经济区中心城市，奋力打造全省高质量发展的强劲支点，扎实稳健推进中国式现代化徐州新实践。希望两地携手发挥互补优势，进一步深化区域协同、科技创新、产业发展、文旅交流合作，做深互动文章、共创发展胜势，推动两地合作蓝图越绘越美，以徐韶深层次交流、高质效合作为中国式现代化建设作出更大贡献。。市领导蒋红林、邹振宇、颜玉明、肖智勇；徐州市领导王先正、戴敏捷、龚维芳、孙文华参加有关活动。（转载韶关日报 黄俊）",政府领导到其他城市考察学习或访问,0.5625067115244903,True
188,广东省,韶关市,市商务局赴梅州考察学习,2021-03-15,https://www.sg.gov.cn/xw/xwzx/bmdt/content/post_1948991.html,日前，市商务局局长张雯带队赴梅州考察学习，梅州市副市长曾尚忠会见了考察组一行，梅州商务局局长刘冲等局领导参加活动。。座谈会上，考察组就梅州在跨境电商综合试验区申报、跨境电商清关中心运营、综合保税区申报建设情况以及招商引资工作等内容与梅州市商务局进行了深入交流。刘冲和梅州商务局同事详细介绍了梅州市综合保税区和跨境电商综合试验区的发展现状、功能定位、创新举措等内容以及近年来梅州在招商引资工作的新做法。刘冲表示，梅州、韶关两地有着很好的合作基础和历史渊源，去年他带队到韶关学习考察招商引资工作经验，得到韶关市商务局的大力支持，获益良多。希望两地商务部门下一步能继续开展更广泛、更深入的互动交流。。张雯表示，近年来，梅州市陆续获批跨境电商综合试验区和综合保税区，对梅州未来的社会经济发展具有重要意义，这次来梅州考察学习，主要是学习借鉴梅州在跨境电商综合试验区申报、综合保税区申报建设等方面的好经验、好做法，进一步开拓视野，希望两地商务局继续加强交流合作，促进两地商务工作发展。。座谈会后，考察组一行分别到梅州市跨境电商清关中心和梅州综合保税区实地考察学习。（市商务局 丘俊军）,日前，市商务局局长张雯带队赴梅州考察学习，梅州市副市长曾尚忠会见了考察组一行，梅州商务局局长刘冲等局领导参加活动。。座谈会上，考察组就梅州在跨境电商综合试验区申报、跨境电商清关中心运营、综合保税区申报建设情况以及招商引资工作等内容与梅州市商务局进行了深入交流。刘冲和梅州商务局同事详细介绍了梅州市综合保税区和跨境电商综合试验区的发展现状、功能定位、创新举措等内容以及近年来梅州在招商引资工作的新做法。刘冲表示，梅州、韶关两地有着很好的合作基础和历史渊源，去年他带队到韶关学习考察招商引资工作经验，得到韶关市商务局的大力支持，获益良多。希望两地商务部门下一步能继续开展更广泛、更深入的互动交流。。张雯表示，近年来，梅州市陆续获批跨境电商综合试验区和综合保税区，对梅州未来的社会经济发展具有重要意义，这次来梅州考察学习，主要是学习借鉴梅州在跨境电商综合试验区申报、综合保税区申报建设等方面的好经验、好做法，进一步开拓视野，希望两地商务局继续加强交流合作，促进两地商务工作发展。。座谈会后，考察组一行分别到梅州市跨境电商清关中心和梅州综合保税区实地考察学习。（市商务局 丘俊军）,政府领导到其他城市考察学习或访问,0.0,True
188,广东省,韶关市,我县党政考察团到英德市佛冈县考察学习,2016-06-22,http://www.sgrh.gov.cn/xwzx/bdxw/content/post_122961.html,日，县委书记、县人大常委会主任刘锋，县长王晓梅，县政协主席廖志常率领我县党政考察团。到清远市的英德市、佛冈县考察学习当地县域经济发展、农村综合改革、园区与产业发展、城市规划和建设、旅游等方面的先进经验和做法，探索我县农村工作与城市建设的新路子，推动全县经济社会各项工作的新发展。。当天上午，刘锋一行首先来到英德市西牛镇，在英德市委书记汪耿东等当地党政领导的陪同下，实地考察了该镇小湾片区新城村和金竹片区公共服务站，深入了解、学习当地农村综合改革、土地整合工作及社会公共服务下移等工作情况。刘锋一行边走边看，不时向当地工作人员了解具体的做法。当了解到金竹片区以。的方式创新农村金融改革，按照社员入股、政府提供扶贫改革互助金的方式解决群众壮大生产发展的资金问题时，刘锋指出，我县各镇（街）要在民信档案的基础上，引导、鼓励村民将闲散资金聚集起来，建立经济联合互助金，在帮助其他有困难的群众的同时，自己也可享受分红，一举多得。。介绍、观看视频，进一步了解当地城市规划、功能改造、城市道路建设及交通组织管理等情况。在英红镇和望埠镇，考察团分别考察。旅游度假村项目，重点了解了产业发展平台建设、产业园区管理、重大基础设施建设及旅游配套设施建设、生态旅游项目发展等工作情况。。当天下午，考察团来到佛冈县，在佛冈县委书记吴定移等当地党政领导的陪同下，对科惠白井电路有限公司、勤天城。规划、广清产业园佛冈集聚区（汤塘片区）、雅典广东电动车项目进行了考察，并参观了清远加多宝草本植物科技有限公司和佛冈县城市规划沙盘。考察中，刘锋指出，他山之石。实际工作中，推动我县农村改革、城市管理、生态旅游发展，促进全县经济的均衡、快速发展。。县领导区毅明、谢庆伟、邱志坚、李湘柱、张云勃、张元展、杨云、郭葳，各镇（街）党（工）委书记、镇长（主任），县各职能部门负责人参加了当天的考察活动。,日，县委书记、县人大常委会主任刘锋，县长王晓梅，县政协主席廖志常率领我县党政考察团。到清远市的英德市、佛冈县考察学习当地县域经济发展、农村综合改革、园区与产业发展、城市规划和建设、旅游等方面的先进经验和做法，探索我县农村工作与城市建设的新路子，推动全县经济社会各项工作的新发展。。当天上午，刘锋一行首先来到英德市西牛镇，在英德市委书记汪耿东等当地党政领导的陪同下，实地考察了该镇小湾片区新城村和金竹片区公共服务站，深入了解、学习当地农村综合改革、土地整合工作及社会公共服务下移等工作情况。刘锋一行边走边看，不时向当地工作人员了解具体的做法。当了解到金竹片区以。的方式创新农村金融改革，按照社员入股、政府提供扶贫改革互助金的方式解决群众壮大生产发展的资金问题时，刘锋指出，我县各镇（街）要在民信档案的基础上，引导、鼓励村民将闲散资金聚集起来，建立经济联合互助金，在帮助其他有困难的群众的同时，自己也可享受分红，一举多得。。介绍、观看视频，进一步了解当地城市规划、功能改造、城市道路建设及交通组织管理等情况。在英红镇和望埠镇，考察团分别考察。旅游度假村项目，重点了解了产业发展平台建设、产业园区管理、重大基础设施建设及旅游配套设施建设、生态旅游项目发展等工作情况。。当天下午，考察团来到佛冈县，在佛冈县委书记吴定移等当地党政领导的陪同下，对科惠白井电路有限公司、勤天城。规划、广清产业园佛冈集聚区（汤塘片区）、雅典广东电动车项目进行了考察，并参观了清远加多宝草本植物科技有限公司和佛冈县城市规划沙盘。考察中，刘锋指出，他山之石。实际工作中，推动我县农村改革、城市管理、生态旅游发展，促进全县经济的均衡、快速发展。。县领导区毅明、谢庆伟、邱志坚、李湘柱、张云勃、张元展、杨云、郭葳，各镇（街）党（工）委书记、镇长（主任），县各职能部门负责人参加了当天的考察活动。,政府领导到其他城市考察学习或访问,0.7732627052576152,True
188,广东省,韶关市,沈河民率队赴仁化县学习考察,2019-11-12,http://www.lechang.gov.cn/xwzx/lcyw/content/post_1343273.html,根据我市“不忘初心、牢记使命”主题教育工作安排，11月9日，市委书记沈河民率队到红军长征粤北纪念馆，缅怀先烈丰功伟绩，接受爱国主义教育。市人大常委会主任许新华、市政协主席邬贤有等市四套班子领导参加活动。。在红军长征粤北纪念馆，沈河民一行怀着崇敬的心情，认真倾听纪念馆工作人员的详细讲解。一段段历史事件、一件件红军文物、一张张历史照片，在场人员不时驻足，细细品读，逐步深入地了解红军长征经过粤北的历史事件和粤北红色文化历史。。据了解，红军长征粤北纪念馆是广东省内唯一以红军长征为主题的纪念馆，该馆依托红军长征过境粤北的丰富红色遗迹资料，展出了大量红军在粤北地区的历史文物、文献，展现了南昌起义军余部、红军主力部队的转战粤北，中央红军长征粤北突围，留守红军和游击队坚持三年游击战争的光辉历史，展示了粤北人民积极支援红军的军民相依鱼水情谊。。沈河民强调，全市上下要深入学习贯彻习近平总书记关于在“不忘初心、牢记使命”主题教育中学习党史、新中国史的重要指示精神，铭记党的光辉历史，弘扬革命精神，立足本职岗位，守初心担使命，为我市全力打造粤北绿色发展先行地作出应有的贡献。同时，要深入发掘好我市红色文化资源，加强对红色文化资源的保护和利用，传承红色基因，做好弘扬红色文化这篇大文章。。学习考察期间，沈河民一行还沿途考察了国、省道路景观、外立面提升以及旅游基础设施建设等情况。,根据我市“不忘初心、牢记使命”主题教育工作安排，11月9日，市委书记沈河民率队到红军长征粤北纪念馆，缅怀先烈丰功伟绩，接受爱国主义教育。市人大常委会主任许新华、市政协主席邬贤有等市四套班子领导参加活动。。在红军长征粤北纪念馆，沈河民一行怀着崇敬的心情，认真倾听纪念馆工作人员的详细讲解。一段段历史事件、一件件红军文物、一张张历史照片，在场人员不时驻足，细细品读，逐步深入地了解红军长征经过粤北的历史事件和粤北红色文化历史。。据了解，红军长征粤北纪念馆是广东省内唯一以红军长征为主题的纪念馆，该馆依托红军长征过境粤北的丰富红色遗迹资料，展出了大量红军在粤北地区的历史文物、文献，展现了南昌起义军余部、红军主力部队的转战粤北，中央红军长征粤北突围，留守红军和游击队坚持三年游击战争的光辉历史，展示了粤北人民积极支援红军的军民相依鱼水情谊。。沈河民强调，全市上下要深入学习贯彻习近平总书记关于在“不忘初心、牢记使命”主题教育中学习党史、新中国史的重要指示精神，铭记党的光辉历史，弘扬革命精神，立足本职岗位，守初心担使命，为我市全力打造粤北绿色发展先行地作出应有的贡献。同时，要深入发掘好我市红色文化资源，加强对红色文化资源的保护和利用，传承红色基因，做好弘扬红色文化这篇大文章。。学习考察期间，沈河民一行还沿途考察了国、省道路景观、外立面提升以及旅游基础设施建设等情况。,政府领导到其他城市考察学习或访问,0.0,True
