code,province,city,topic,date,url,content,content.1,label,score,is_match
188,广东省,韶关市,韶关市信访维稳工作会议与会人员到乐昌产业园参观考察,2012-07-11,http://www.lechang.gov.cn/zfxxgkml/content/post_1310422.html,上午，在乐昌参加韶关市全市信访维稳工作会议的各县（市、区）分管领导及信访局长，在中共韶关市委副书记陈向新率领下，到东莞东坑（乐昌）产业转移工业园参观考察。中共乐昌市委书记、市人大常委会主任李维员和乐昌市委副书记、市长罗海俊陪同参观考察。。乐昌市经济开发试验区党工委副书记邱鑑林代表园区管委会向韶关市信访维稳工作会议与会人员汇报了园区信访维稳工作情况。他在汇报中说：乐昌市委、市政府高度重视产业园的建设发展，极力优化园区建设环境，维护园区正常秩序及和谐稳定大局。我们的做法和体会概括为“六个力”：政府保障有力、部门配合得力、干部尽心尽力、打击非法有力、善后费心费力、发展群策群力。,会议强调，各级各部门要深入学习贯彻习近平总书记关于推进城乡区域协调发展重要论述，学习浙江“千万工程”的好经验好做法，准确把握区域协调发展的新形势新任务新要求，学思践悟，加快推动我县城乡区域协调发展取得新突破。要以头号工程的力度抓紧抓实“百千万工程”，践行“不能说不行、要说怎么办”的工作要求，做到时间精力倾斜、人员力量倾斜、资金投入倾斜，切实抓好产业发展、人居环境建设、公共服务和社会治理工作及城口典型镇、丹霞街道黄屋村等6个典型村培育等工作，把“百千万工程”各项工作落到实处。要认真对照省、市方案及县委县政府既定目标，全面梳理排查，补短板强弱项，在高质量发展赛道上奋勇争先，坚决完成各项工作任务。。县委理论学习中心组成员，县人大常委会、县政府、县政协领导同志，法检“两长”，县各有关单位主要负责同志，各镇（街）党（工）委书记参加学习会。,其他,0.5785621603705764,True
188,广东省,韶关市,市委理论学习中心组召开专题学习会,2019-06-18,https://www.sg.gov.cn/gkmlpt/content/1/1593/post_1593750.html,6月11日上午，市委理论学习中心组召开专题学习会，学习贯彻习近平总书记关于网络意识形态安全的重要论述和为第五批全国干部学习培训教材所作《序言》精神。市委书记李红军主持会议，市长殷焕明、市政协主席王青西出席会议。。会议全面贯彻习近平总书记关于网络意识形态安全的重要论述，要求全市各级领导干部要全面领悟精髓要义，始终深信笃行，努力把网络这个最大变量转化为最大正能量。。会议强调，要全面贯彻习近平总书记为第五批全国干部培训教材所作《序言》精神，切实抓好党员干部大学习大培训。要坚持把习近平新时代中国特色社会主义思想作为干部学习培训的重中之重，积极推动广大党员干部全面系统学、深入思考学、联系实际学，自觉在思想上政治上行动上同以习近平同志为核心的党中央保持高度一致。要坚持把学习习近平新时代中国特色社会主义思想成果体现在决胜全面建成小康社会目标，全面深化改革，全面从严治党、不断提高执政能力和领导水平上，努力把各级党组织建设得更加坚强有力。要加强习近平新时代中国特色社会主义思想学习教育的组织领导，全市各级组织部门和各级党校要紧扣新时代新任务新要求，不断增强学习培训的时代性、针对性、有效性，使干部的思想、能力、行动跟上党中央要求，跟上时代前进步伐，跟上事业发展需要，坚定不移用习近平新时代中国特色社会主义思想武装头脑，指导实践，推动工作，为我市全力筑牢粤北生态屏障，打造绿色发展韶关样板，争当北部生态发展区高质量发展排头兵，建设北部生态发展区核心城市作出新的更大贡献。。会上，市委常委、宣传部长刘启宇作学习贯彻习近平总书记关于网络意识形态的重要论述导学，市委常委、组织部长肖展欣作学习贯彻习近平总书记为第五批全国干部学习培训教材所作《序言》精神导学。。市委理论学习中心组成员及不是市委理论学习中心组成员的市政府领导同志、副厅级干部等参加会议。（转载韶关日报 曹智辉）,开学初，始兴县太平镇江口小学每位教师都领到了一本2011版新课标。学校通过自主学习和集中培训、检测的形式组织全校教师学习新课标。课余时间，各学科教师结合本学科实际认真研读新课标，掌握新理念；教研活动时间，由各科组长组织观看专家解读新课标视频。为了检测全校教师学习新课标的效果，学校统一命题进行各学科新课标的考试，并作为教师业务学习的一次检测。 通过2011版新课标学习考试，老师们进一步更新了教学理念，在新课标理念指导下，更积极地投入到“阳光高效课堂”的探索与实践中。,其他,0.9244664022962922,True
188,广东省,韶关市,市委理论学习中心组召开专题学习会议,2020-11-02,https://www.sg.gov.cn/gkmlpt/content/1/1882/post_1882473.html,10月9日，市委理论学习中心组召开专题学习会议，深入学习贯彻《中共广东省委、广东省人民政府关于加大有效投资力度加快构建“一核一带一区”区域发展格局的意见》精神。市委书记王瑞军主持会议并讲话。市委副书记、代理市长陈少荣，市政协主席王青西参加会议。。王瑞军指出，省委、省政府出台《意见》，旨在抢抓扩大内需的战略机遇，充分发挥投资稳定经济增长的重要作用，通过推进重大项目建设、扩大有效投资，不断激发民间投资活力，为稳增长、优结构、拓空间、促循环提供持续动力，为构建“一核一带一区”区域发展格局打好基础、创造条件。《意见》结合“一核”“一带”“一区”功能定位和发展方向，明确了当前和今后一段时间各功能区需重点加强投资的领域和急需补齐的短板弱项，并作出了相应的项目安排和政策保障。。王瑞军强调，要认真学习领会习近平生态文明思想，以及习近平总书记在中共中央政治局、中央经济工作等会议上的重要讲话精神，贯彻落实省委十二届十次全会精神，充分认识加大有效投资对加快构建“一核一带一区”区域发展格局的重要意义，全面把握《意见》的具体要求、蕴含的政策机遇，按照省委、省政府的部署和要求，把握韶关在“一核一带一区”区域发展格局中的定位和发展方向，找准今后工作的切入口和着力点，以扩大有效投资为重要抓手，推动韶关高质量发展。要聚焦生态建设、交通基础设施建设、绿色产业发展、城乡融合发展、保障和改善民生等重点领域和关键环节，加大政府有效投资，引领韶关争当北部生态发展区高质量发展排头兵。要主动担当作为，大力解决发展过程中遇到的困难和问题，全力补齐发展短板，推动《意见》落实落地。要积极争取上级支持，争取更多政策、项目、资金向韶关倾斜，加大要素保障力度，确保各项工作举措取得实效。。市委理论学习中心组成员，副市长，市直有关单位主要负责同志参加会议。（转载韶关日报 李方静）,根据乳源瑶族自治县普法办公室《关于做好2016年全县领导干部及公职人员学法考试的通知》（乳普办[2016]4号）文件精神，近日，乳源局组织全局公职人员开展年度学法用法学习及考试。。每年的学法用法考试是一项集中检验干部职工学法用法成效、推动学法用法深入开展的重要措施，为此，我局领导高度重视，精心组织人员及时开展学法用法的学习和考试工作。本年度考学利用《广东省国家公职人员学法用法系统》进行，主要考学内容有：《宪法》、《公务员法》、《国家安全法》、《反恐怖主义法》、《反间谍法》、《反家庭暴力法》、《保守国家秘密法》、《刑法》和《中共广东省委贯彻落实“中共中央关于全面推进依法治国若干重大问题的决定”的意见》等。。为保证考学的严谨，考前学习情况及考试成绩将上报县普法办，并纳入个人今年的绩效考核。（乳源局 林慧明）,其他,0.9405628227074848,True
188,广东省,韶关市,一把手招商市委书记王碧安率队前往广州东莞考察招商项目,2020-12-31,https://www.gdnx.gov.cn/sgnxswj/gkmlpt/content/1/1917/post_1917833.html,12月23日，市委书记王碧安率队赴广州市俊达手套有限公司、东莞市丰华集团有限公司进行实地考察。市领导温鑫、李福全、吴少华及市场监管局、商务局、生态环境局有关部门主要负责同志陪同考察。。碧安书记一行与广州市俊达手套有限公司总经理曹焰平等企业主要负责人进行座谈交流。双方就俊达南雄卫生医疗用品投资项目作深入探讨，我市相关部门对企业项目落地南雄密切关心的问题进行一一解答。目前已初步达成合同意向，下一步双方将围绕对具体的投资细节做更详细的对接。。据悉，广州市俊达手套有限公司围绕医疗、卫生、健康、防护等产业做出产业链全面开展，是使用橡胶防护用品及橡胶生态产业地领先企业，是受邀参加12月15日韶关绿色发展产业招商大会的客商。在听完南雄市市长林小龙的招商推介后，公司总经理曹焰平于12月16日上午来到南雄考察。。随后，碧安书记一行赴东莞市松山湖丰华悦园、东莞市丰华集团有限公司进行考察，并与公司董事长卢淦波、总经理卢沛芳召开了项目座谈会。。会上，卢淦波董事长介绍公司的基本情况、拟在雄投资计划等内容，双方就温泉康养项目投资建设进行了对接交流。,2018年1月4日至5日，惠州市财政局组织本辖区各县（市、区）农发办主任一行7人到我市进行农业综合开发工作考察交流活动。。他们依次参观考察了我市国家农业综合开发高标模式创新试点项目（现代农业示范区项目）基地、广东慧园粮油有限公司项目，2016年翁源县翁城镇国家农业综合开发高标准农田建设项目，2016年新丰县国家农业综合开发高标准农田建设项目，随后在新丰县财政局召开座谈会。。基地、广东慧园粮油有限公司项目，2016年翁源县翁城镇国家农业综合开发高标准农田建设项目，2016年新丰县国家农业综合开发高标准农田建设项目，随后在新丰县财政局召开座谈会。。座谈会上大家围绕七个方面进行了热烈交流探讨。一是如何做好项目建设前期准备工作，特别是市级如何开展土地治理项目评审工作；二是如何加快项目建设进度；三是如何加快预算支出进度；四是如何抓好项目工程质量；五是如何减少项目调整变更，如何办理调整手续；六是如何做好市级竣工验收、县级单项验收工作。七是如何做好产业化发展项目报账管理。。如何做好项目建设前期准备工作，特别是市级如何开展土地治理项目评审工作；二是如何加快项目建设进度；三是如何加快预算支出进度；四是如何抓好项目工程质量；五是如何减少项目调整变更，如何办理调整手续；六是如何做好市级竣工验收、县级单项验收工作。七是,其他,0.6257739603940755,True
188,广东省,韶关市,新加坡驻广州总领事馆商务副领事招诗玲一行到我市考察交流,2023-02-27,https://www.sg.gov.cn/bmpdlm/zgsgswwsgzwyhbgs/gzdt/content/post_2373822.html,2月23日至24日，新加坡驻广州总领事馆商务副领事、新加坡企业发展局中国司华南区主任招诗玲一行访问我市。副市长蒋红林会见招诗玲一行，就双方加强产业合作进行深入交流。市外事局、市发改局、市工信局和市商务局负责同志参加会见。。蒋红林对招诗玲一行来韶考察表示欢迎。他指出，韶关历史文化底蕴深厚，生态资源丰富，成本要素优越，产业基础厚实。当前韶关正在加快推动高质量发展，欢迎新加坡企业家到韶关考察投资，韶关将全力营造良好营商环境，希望双方能携手合作共同发展，实现双方互利共赢。。招诗玲表示，韶关资源禀赋独特，投资环境优越，新加坡企业来韶投资发展前景广阔，双方合作未来可期。她将引荐更多新加坡企业界人士到韶关考察投资，推动越来越多新加坡优秀企业来韶关开拓市场。。会见前，招诗玲一行与市外事局等部门进行了座谈，市发改局、市商务局围绕我市数据中心产业、招商引资优惠政策等内容作宣传推介，新加坡博瑞集团、狮城资本、裕新国际和益阁新能源集团分别介绍了公司情况和合作意向，并就双方在大数据以及新能源等产业合作开展交流。。访韶期间，招诗玲一行还到广东明阳智慧能源有限公司、华韶数据谷和韶关铂瑞环保科技有限公司等企业参观考察，进一步探寻双方合作机会。,为加强省内重点城市文旅交流合作，拓展粤东地区旅游市场，进一步宣传推介韶关秋冬季禅宗祈福、温泉养生、红色研学等旅游产品，11月17—19日，市文广旅体局邀请潮州市、汕尾市文旅部门、旅行社及媒体代表等来韶进行3天2晚的采风踩线活动，助推韶关文旅产业发展，振兴文旅市场。。在为期三天的行程中，采风团先后考察了南华禅寺、马坝人遗址公园、丹霞山、红军长征粤北纪念馆、红军街、南雄帽子峰林场等地，亲身体验了我市的如画美景与文化特色，深入体验了韶关的乡村休闲、温泉度假、红色研学、历史人文等多种不同旅游业态和旅游要素，见证了韶关文旅融合及乡村振兴的丰硕成果。。采风团对我市特色文化旅游资源和产品表示肯定与赞赏，并表示会在今后的日子里多开发韶关的旅游线路，积极推介韶关，让更多的游客来韶关体验独具特色的文旅资源。汕尾市研学旅行协会秘书长李鹏飞说：“韶关的旅游资源丰富，红色文化、研学资源等底蕴深厚，非常值得大家来观光体验。此次采风活动有助于我们更加深入地了解韶关，搭建起一座沟通合作的桥梁，对于实现韶关与粤东地区旅游合作共赢具有重要意义。”（转载韶关日报 冯兆宇）,其他,0.6220653087439266,True
188,广东省,韶关市,深圳农科集团来韶考察共谋项目合作盘活文旅资源,2022-04-02,https://www.sg.gov.cn/whgdlv/gkmlpt/content/2/2415/post_2415344.html,4月1日，应韶关市文化广电旅游体育局邀请，深圳农科集团韶关区域负责人陈灿辉一行来韶考察并座谈交流。副市长蒋文泓、市文广旅体局局长黄宣剑以及市自然资源局、市农业农村局、仁化县政府相关负责人参加了座谈会。。陈灿辉介绍了深圳农科集团的基本情况、发展方向以及投资意向，并就相关文旅项目的概念性规划进行了详细介绍。他表示，下一步，将安排专业团队来韶充分考察，并就文旅、农业等方面的项目进行深度对接，期待双方真诚合作、发展共赢。。蒋文泓诚挚欢迎深圳农科集团来韶关考察投资，他表示，韶关文旅资源丰富、自然环境优越、产业基础好、发展潜力大，希望双方深入沟通交流，尽早敲定合作事宜，尽快推动相关项目落地，共同推动韶关文旅产业提档升级，把韶关的资源资产优势转化为经济发展优势，把韶关的绿水青山变为金山银山。,今天上午，中国制笔协会理事长王淑琴一行到我县考察办公文具企业建设发展情况。县人大常委会主任赖根、副县长张智光陪同参加考察。。王淑琴一行先后来到我县广东三信科技有限公司、韶关益而高文具科技有限公司、盛怡实业（韶关）有限公司等地，听取了相关负责人情况介绍，查看了各企业生产间。据了解，近年来，我县为加快推进始兴“中国制笔研发制造基地”建设，坚持把文具制笔产业作为全县主导产业之一，出台了《始兴县关于加快推进文具制笔产业集聚发展的实施意见》，着力推动文具制笔产业集聚发展。截至2018年底，始兴“中国制笔研发制造基地”已完成开发面积达1200亩，累计完成固定资产投资约8亿元，基地内路网、水网、电网贯通，绿化亮化、污水处理等基础设施及配套设施日趋完善。目前，始兴“中国制笔研发制造基地”已入住办公文具制笔企业10家，去年，我县文具制笔产业产值2.68亿元，同比增长101.96%；创税1027.65万元，同比增长63.21%；企业用工人数达1300人。。下一步，我县将以打造文具制笔百亿特色支柱产业集群为目标，突出“中国制笔研发制造基地”核心主体，进一步加快推进文具制笔产业集聚发展，力争在东湖坪打造全国知名的集制笔研发、文具电子商务、文具品牌孵化、亚太文具城、民俗体验、禅宗文化等休闲度假多种功能于一体的文笔特色小镇。,其他,0.543474627536237,True
188,广东省,韶关市,广东省韶关商会一行返韶考察为韶关高质量发展添砖加瓦,2021-09-19,https://www.sg.gov.cn/xw/xwzx/bdxw/content/post_2052309.html,至18日，广东省韶关商会一行返韶考察，走访调研我市工商业发展情况以及招商引资政策。市长陈少荣会见考察团一行，充分肯定商会为家乡作出积极贡献的同时，希望大家更好发挥商会作用，广泛开展交流活动，为韶关市高质量发展作出新的更大贡献。。考察团一行先后到城市规划馆、韶关新区展览馆、莞韶园、华南装备园、浈江产业园和丹霞机场等实地考察了解我市经济发展、城市建设、投资环境及产业发展等情况。。陈少荣对广东省韶关商会返韶考察表示热烈欢迎，并从生态、区位、资源、政策等方面简要介绍了韶关的优势。他表示，韶关市具有文化特色鲜明、水资源丰沛、森林覆盖率高、水陆空区位交通便利等特色和优势，后发潜力巨大、发展前景广阔。当前韶关正按照省委、省政府“1+1+9”工作部署和构建“一核一带一区”区域发展格局的部署要求，积极对接融入“双区”建设，大力发展文化旅游、健康养老、新能源、大数据及现代中药、高端装备制造等产业，诚挚欢迎大家返韶投资兴业，全市各级政府将为企业发展当好“店小二”。。广东省韶关商会第二届筹委会主任、林昌中国控股集团有限公司总裁谢林昌表示，回到韶关，映入眼帘的是蓝天、白云，韶关的空气也特别好，自然环境优越。通过接触交流，切实感受到韶关潜在的巨大发展空间，也感受到市委、市政府务实的工作作风，广东省韶关商会将踊跃参与并动员更多力量投入到韶关高质量发展中来，为创造家乡更加美好的明天作出更大贡献。。市领导兰茵、王德雄，市政协、市侨联、市商务局、市文广旅体局、市自然资源局、市工信局等部门负责同志参加活动。（转载韶关日报 邱日欣 张伟杰）,10月15日，乳源县政协副主席禤继文一行来我县考察产业发展和农村人居环境整治。县政协副主席刘晓梅陪同考察。。考察组一行先后来到我县创发生态农业开发有限公司、美青农业发展有限公司、城南镇周前村，认真听取有关单位和企业负责人介绍相关情况，详细了解我县在特色产业发展及农村人居环境整治方面取得的成效。。禤继文对我县取得的成绩给予了赞赏，并表示希望通过此次考察，吸取借鉴成功经验，进一步加强沟通交流，共同促进乳源始兴两县工作再上新台阶。,政府领导到其他城市考察学习或访问,0.0,True
188,广东省,韶关市,德国专家莅韶考察我市双元制技工培训模式情况,2012-10-18,https://www.sg.gov.cn/xw/xwzx/bdxw/content/post_1355580.html,日，德国汉斯·赛德尔基金会专家维尔克、魏茨勒莅临我市，就我市引入德国的职业教育体系和“双元制”培训模式进行考察。。自2005年以来该基金会与我省建立技工培训合作关系，双方在技工教育方面有着较全面的合作。近年来，中国经济处于转型期，对技工的需求不论从质量上和数量上都不断提高。以今年市委书记、市人大常委会主任郑振涛率我市考察团前往德国考察为契机，我市开展“双元制”培训模式的尝试，提升我市技工培训质量。本次德国汉斯·赛德尔基金会专家一行，重点了解了我市莞韶产业园开展“双元制”培训模式，开展校园对接产业园工程，通过“校企双制办”、共建实训基地、在职技能与学历培训，逐步探索开展校企对接工作情况。。通过走访，维尔克充分肯定我市积极发展“双元制”培训模式的做法，他勉励我市技工培训管理部门和技工学校，要克服“双元制”培训模式发展初期的困难，坚定发展思路，走出一条有韶关特色的德国“双元制”培训模式。他表示，在中德双方的共同努力下，韶关“双元制”技工培训将取得成功。。魏茨勒建议，在重视实操能力的技工培训领域，可以打破目前中国惯常采用的从学校到工厂的模式，让技工更早地进入工厂一线，通过更多的实践培训，和与之相结合的专业知识学习，提高技工人员与工厂生产需要的吻合度。（转载韶关日报 黄捷文）,5月19日下午，由韩国海南郡企划弘报室长郑镇培率领的海南郡友好交流访问团一行到兰花基地、涂志伟美术馆、陈璘公园、陈璘史迹陈列馆、翁山诗书画院等地进行了参观考察。县委常委、常务副县长朱增志，县委常委、宣传部长丘雪媚陪同考察。。在粤台农业合作试验区，韩国海南郡友好交流访问团一行，分别来到巨扬园艺公司翁源生产基地、泽雨农科石斛基地和德芳兰园，实地察看了花卉、药材、兰花种植的情况，并与种植户进行了深入交流，详细了解基地的种植模式、生产销售等情况。当了解到每年我县都有大量的兰花出口到韩国时，韩国海南郡友好交流访问团成员表示可以在这个方面进一步加强联系与沟通。。在涂志伟美术馆，韩国海南郡友好交流访问团一行参观了美术馆展厅涂志伟不同时期创作的作品，听取了涂志伟美术作品介绍和他作画的历史情节，韩国海南郡友好交流访问团成员被涂志伟的美术作品深深吸引，尤其对以中国历史为题材的作品大加赞赏，并在画作前拍照留影。。考察期间，韩国海南郡友好交流访问团一行参观了陈璘公园、陈璘史迹展览馆，瞻仰了陈璘将军塑像，详细了解了陈璘生平、相关史实和伟大功绩。同时，还到翁山诗书画院进行了参观交流。,其他,0.5289584705599422,True
