code,province,city,topic,date,url,content,content.1,label,score,is_match
25,内蒙古省,呼和浩特市,呼和浩特市政府考察团赴上海考察学习,2021-04-26,http://www.huhhot.gov.cn/2022_zwgk/2022_ldzc/hhd/ldhd_53123/202203/t20220321_1216607.html,4月24日至25日，市委副书记、市长、和林格尔新区党工委书记贺海东带领呼和浩特市政府考察团赴上海考察学习，就城市规划建设、智能化管理、城市更新、老旧小区改造等方面进行考察学习。上海市政府合作交流办副主任强程鹏陪同考察。。考察团一行先后考察了花博会项目、金砖银行项目、黄浦区滨江公共岸线贯通工程项目、浦东开发开放30周年主题展、浦东新区城市运行综合管理中心、浦东新区企业服务中心、上海大数据中心、长宁区“上生·新所”、长宁区敬老邨改造项目，详细了解城市规划建设理念、智慧城市打造、政府服务“一网通办、一网通管”、老旧小区改造和城市更新等情况。每到一处，考察团成员都认真参观学习，并就关心的问题进行详细提问了解。先进的城市设计理念，科学化、智能化的城市管理水平，便捷高效的政务服务体系给考察团留下了深刻印象。。每天考察学习结束后，考察团都及时召开座谈会总结部署。考察团成员依次谈感受、谈想法、谈运用，贺海东最后强调，在新时代推进首府城市规划、设计、建设、管理，必须深入贯彻落实习近平总书记提出的“城市是人民的城市，人民城市为人民”的重要论断，坚持以人民为中心，聚焦人民群众的需求，对标上海，学习先进机制、经验、成果，高水平规划、高水平建设、高标准管理，在完善功能提升品位中扮靓首府新形象。智慧城市建设要借鉴上海做法，以“一网通办、一网通管”为目标，打造政务服务升级;要明确职责、突出重点、强化监督，科学整合相关平台，尽快提高我市城市大脑的应用水平。老旧小区改造和城市更新要精细设计、以民为本，突出群众需求导向，切实提高群众的参与度、认同感，全力调动居民参与老旧小区改造工作的积极性和主动性，同时努力做好老旧小区改造后物业管理跟进工作。,4月24日至25日，市委副书记、市长、和林格尔新区党工委书记贺海东带领呼和浩特市政府考察团赴上海考察学习，就城市规划建设、智能化管理、城市更新、老旧小区改造等方面进行考察学习。上海市政府合作交流办副主任强程鹏陪同考察。。考察团一行先后考察了花博会项目、金砖银行项目、黄浦区滨江公共岸线贯通工程项目、浦东开发开放30周年主题展、浦东新区城市运行综合管理中心、浦东新区企业服务中心、上海大数据中心、长宁区“上生·新所”、长宁区敬老邨改造项目，详细了解城市规划建设理念、智慧城市打造、政府服务“一网通办、一网通管”、老旧小区改造和城市更新等情况。每到一处，考察团成员都认真参观学习，并就关心的问题进行详细提问了解。先进的城市设计理念，科学化、智能化的城市管理水平，便捷高效的政务服务体系给考察团留下了深刻印象。。每天考察学习结束后，考察团都及时召开座谈会总结部署。考察团成员依次谈感受、谈想法、谈运用，贺海东最后强调，在新时代推进首府城市规划、设计、建设、管理，必须深入贯彻落实习近平总书记提出的“城市是人民的城市，人民城市为人民”的重要论断，坚持以人民为中心，聚焦人民群众的需求，对标上海，学习先进机制、经验、成果，高水平规划、高水平建设、高标准管理，在完善功能提升品位中扮靓首府新形象。智慧城市建设要借鉴上海做法，以“一网通办、一网通管”为目标，打造政务服务升级;要明确职责、突出重点、强化监督，科学整合相关平台，尽快提高我市城市大脑的应用水平。老旧小区改造和城市更新要精细设计、以民为本，突出群众需求导向，切实提高群众的参与度、认同感，全力调动居民参与老旧小区改造工作的积极性和主动性，同时努力做好老旧小区改造后物业管理跟进工作。,政府领导到其他城市考察学习或访问,0.5017896930623138,True
25,内蒙古省,呼和浩特市,呼和浩特市党政考察团赴天津学习考察,2021-06-21,http://www.huhhot.gov.cn/2022_zwgk/2022_ldzc/hhd/ldhd_53123/202203/t20220321_1216534.html,6月19日，自治区党委常委、市委书记王莉霞，市委副书记、市长、和林格尔新区党工委书记贺海东利用周六休息时间，带领呼和浩特市党政考察团赴天津市，就生态环保、光伏产业智能化发展等深入企业进行了为期一天的考察学习并座谈，市政府与相关企业签订了合作协议。。考察期间，王莉霞、贺海东一行在天津泰达投资控股有限公司党委书记、董事长王志勇，天津中环半导体股份有限公司副董事长、总经理沈浩平的陪同下，先后参观了天津泰达股份有限公司生产线、天津中环股份公司年产25GW高效太阳能超薄单晶片智慧工厂项目等。。在当日举行的签约仪式上，贺海东与天津泰达股份有限公司董事长张旺签署了《战略合作框架协议》，双方将围绕生态环保领域，建设呼和浩特循环经济产业园、城市垃圾分类、生物质(农林)热电联产等项目开展合作;就“内蒙古中环产业园产业提升项目群”与天津中环半导体股份有限公司总经理沈浩平进行签约，企业将在呼建设中环五期扩能项目，内蒙古中环光伏材料有限公司G12智慧化切片项目、内蒙古中环领先半导体材料有限公司二期项目、智慧仓储物流中心建设项目等，总投资89亿元。。王莉霞在座谈中对于上述企业在呼投资兴业表示热烈欢迎，希望双方长久合作，共同携手，深入贯彻落实习近平总书记对内蒙古重要讲话重要指示批示精神，围绕立足新发展阶段、贯彻新发展理念、构建新发展格局带来的新形势、提出的新要求，立足首府，深耕内蒙古。。王志勇表示，愿意增强彼此了解，加强互惠合作，打造一批政企合作的精品项目、示范项目，携手共创“草原青山同城、低碳宜居共享”的现代化都市。沈浩平表示，将继续加速智能制造转型，加速技术创新转化，加快项目投产达产，为早日实现碳中和目标努力奋斗。。市委常委、秘书长吴文明，副市长毕国臣及相关旗县区、市属相关部门主要负责同志参加上述活动。,6月19日，自治区党委常委、市委书记王莉霞，市委副书记、市长、和林格尔新区党工委书记贺海东利用周六休息时间，带领呼和浩特市党政考察团赴天津市，就生态环保、光伏产业智能化发展等深入企业进行了为期一天的考察学习并座谈，市政府与相关企业签订了合作协议。。考察期间，王莉霞、贺海东一行在天津泰达投资控股有限公司党委书记、董事长王志勇，天津中环半导体股份有限公司副董事长、总经理沈浩平的陪同下，先后参观了天津泰达股份有限公司生产线、天津中环股份公司年产25GW高效太阳能超薄单晶片智慧工厂项目等。。在当日举行的签约仪式上，贺海东与天津泰达股份有限公司董事长张旺签署了《战略合作框架协议》，双方将围绕生态环保领域，建设呼和浩特循环经济产业园、城市垃圾分类、生物质(农林)热电联产等项目开展合作;就“内蒙古中环产业园产业提升项目群”与天津中环半导体股份有限公司总经理沈浩平进行签约，企业将在呼建设中环五期扩能项目，内蒙古中环光伏材料有限公司G12智慧化切片项目、内蒙古中环领先半导体材料有限公司二期项目、智慧仓储物流中心建设项目等，总投资89亿元。。王莉霞在座谈中对于上述企业在呼投资兴业表示热烈欢迎，希望双方长久合作，共同携手，深入贯彻落实习近平总书记对内蒙古重要讲话重要指示批示精神，围绕立足新发展阶段、贯彻新发展理念、构建新发展格局带来的新形势、提出的新要求，立足首府，深耕内蒙古。。王志勇表示，愿意增强彼此了解，加强互惠合作，打造一批政企合作的精品项目、示范项目，携手共创“草原青山同城、低碳宜居共享”的现代化都市。沈浩平表示，将继续加速智能制造转型，加速技术创新转化，加快项目投产达产，为早日实现碳中和目标努力奋斗。。市委常委、秘书长吴文明，副市长毕国臣及相关旗县区、市属相关部门主要负责同志参加上述活动。,政府领导到其他城市考察学习或访问,0.5093144521301607,True
25,内蒙古省,呼和浩特市,呼和浩特市政府考察团赴苏州考察学习并座谈交流,2021-04-27,http://www.huhhot.gov.cn/2022_zwgk/2022_ldzc/hhd/ldhd_53123/202203/t20220321_1216606.html,4月26日，市委副书记、市长、和林格尔新区党工委书记贺海东带领呼和浩特市政府考察团赴苏州考察学习，并与苏州市委副书记、市长李亚平就推动经济高质量发展进行座谈交流。。考察团一行首先来到苏州工业园区展示中心，全面了解园区发展历程、辉煌成就和未来规划。在园区智慧城市运行中心，工作人员现场进行了城市管理、生态环境保护、应急救援、公共安全管控等四个方面的展示，智能感知、精细治理的“一网统管”模式给考察团成员留下了深刻印象。在园区一站式服务中心，大家认真听取了自贸区制度创新、政务服务供给体系创新等情况介绍。在苏州纳米城，考察团成员深入了解载体建设、人才引进、产业培育与创新能力建设等，感受苏州工业园区强化创新驱动、推动产业转型升级的活力。。随后，贺海东与李亚平座谈交流。贺海东指出，苏州经济社会各项事业走在全国前列，非常值得学习借鉴。一直以来，呼和浩特按照习近平总书记和党中央赋予内蒙古“两个屏障”“两个基地”和“一个桥头堡”的战略定位，围绕打造区域性“科技创新、交通物流、生活消费、休闲度假中心”目标，全力建设现代化首府城市。虽然经济社会发展取得显著成效，但与苏州相比还有很大差距。希望能与苏州在产业发展、科技创新、对外开放、生态环保等领域密切对接沟通、加强深度合作，共同努力推动两地经济实现高质量发展。。李亚平说，呼和浩特历史文化丰富、资源优势显著，目前正在加快产业转型升级，积极融入全国大循环。希望双方互相学习借鉴，加强交流互动，深化务实合作，推动两市经济社会发展取得新成绩。。市领导王浩雷、毕国臣，和林格尔新区管委会副主任朱建国，呼和浩特经济技术开发区党工委书记李晓东，市政府秘书长张仲东及相关地区和部门负责同志参加考察学习并座谈交流。苏州市政府秘书长周伟及相关部门负责同志参加座谈交流。,4月26日，市委副书记、市长、和林格尔新区党工委书记贺海东带领呼和浩特市政府考察团赴苏州考察学习，并与苏州市委副书记、市长李亚平就推动经济高质量发展进行座谈交流。。考察团一行首先来到苏州工业园区展示中心，全面了解园区发展历程、辉煌成就和未来规划。在园区智慧城市运行中心，工作人员现场进行了城市管理、生态环境保护、应急救援、公共安全管控等四个方面的展示，智能感知、精细治理的“一网统管”模式给考察团成员留下了深刻印象。在园区一站式服务中心，大家认真听取了自贸区制度创新、政务服务供给体系创新等情况介绍。在苏州纳米城，考察团成员深入了解载体建设、人才引进、产业培育与创新能力建设等，感受苏州工业园区强化创新驱动、推动产业转型升级的活力。。随后，贺海东与李亚平座谈交流。贺海东指出，苏州经济社会各项事业走在全国前列，非常值得学习借鉴。一直以来，呼和浩特按照习近平总书记和党中央赋予内蒙古“两个屏障”“两个基地”和“一个桥头堡”的战略定位，围绕打造区域性“科技创新、交通物流、生活消费、休闲度假中心”目标，全力建设现代化首府城市。虽然经济社会发展取得显著成效，但与苏州相比还有很大差距。希望能与苏州在产业发展、科技创新、对外开放、生态环保等领域密切对接沟通、加强深度合作，共同努力推动两地经济实现高质量发展。。李亚平说，呼和浩特历史文化丰富、资源优势显著，目前正在加快产业转型升级，积极融入全国大循环。希望双方互相学习借鉴，加强交流互动，深化务实合作，推动两市经济社会发展取得新成绩。。市领导王浩雷、毕国臣，和林格尔新区管委会副主任朱建国，呼和浩特经济技术开发区党工委书记李晓东，市政府秘书长张仲东及相关地区和部门负责同志参加考察学习并座谈交流。苏州市政府秘书长周伟及相关部门负责同志参加座谈交流。,政府领导到其他城市考察学习或访问,0.516724041456803,True
25,内蒙古省,呼和浩特市,呼和浩特市党政考察团赴包头考察学习,2021-09-03,http://www.huhhot.gov.cn/2022_zwgk/2022_ldzc/hhd/ldhd_53123/202203/t20220321_1216438.html,9月1日，市委副书记、市长、和林格尔新区党工委书记贺海东带领呼和浩特市党政考察团赴包头市，就着力优化营商环境、推动重点项目建设等方面进行了为期一天的考察学习，返呼后连夜召开总结会，交流考察学习心得体会，凝聚共识。包头市委副书记、市长张锐，副市长王秀莲、刘永祥陪同考察。。近年来，包头市把打造一流营商环境作为推动经济社会高质量发展的长久之策和服务、融入新发展格局的关键之举，不断提升全市产业基础高级化和产业链现代化水平。当日，考察团一行先后走进内蒙古光威碳纤有限公司、双良硅材料(包头)有限公司、金力永磁(包头)科技有限公司、北奔重型汽车集团有限公司、一机集团和新特能源股份有限公司，每到一处，考察团成员都详细了解包头市在重大项目推进、营商环境打造等方面的经验和做法，积极寻找差距、虚心学习经验。。总结会上，考察团成员结合地区和部门实际，从学什么、解决什么、抓什么三个方面进行深入交流，一致表示要进一步理清工作思路，加大创新力度，主动对标对表，查找自身不足，积极推动全市经济社会高质量发展。。贺海东在讲话中指出，抓项目就是抓发展，抓投资就是抓未来，各级各部门要通过考察学习做到“五个要”，即认识要到位、谋划要主动、推动要有力、方式要创新、服务要精准。要找准定位，发挥优势，形成“抓一把手、一把手抓”的良好氛围，敢于担当、勇于担当，推动各项工作扎实开展。。贺海东强调，首府就要有首府的样子，各地区各部门要学习借鉴先进地区的经验和做法，围绕产业谋项目、研究政策争项目、优化环境强项目，谋定后动、谋定快动，切实增强推进项目的能力。要坚持领导带头、率先垂范，一级带着一级干、一级干给一级看，形成比、学、赶、帮、超的浓厚氛围，以实实在在的成效推动我市各项工作再上新台阶。。市领导刘程民、魏红军、王彦军、张永文，市政府党组成员、和林格尔新区管委会主任朱建国，呼和浩特经济技术开发区党工委书记李晓东及各旗县区、市属相关部门主要负责同志参加考察学习。,9月1日，市委副书记、市长、和林格尔新区党工委书记贺海东带领呼和浩特市党政考察团赴包头市，就着力优化营商环境、推动重点项目建设等方面进行了为期一天的考察学习，返呼后连夜召开总结会，交流考察学习心得体会，凝聚共识。包头市委副书记、市长张锐，副市长王秀莲、刘永祥陪同考察。。近年来，包头市把打造一流营商环境作为推动经济社会高质量发展的长久之策和服务、融入新发展格局的关键之举，不断提升全市产业基础高级化和产业链现代化水平。当日，考察团一行先后走进内蒙古光威碳纤有限公司、双良硅材料(包头)有限公司、金力永磁(包头)科技有限公司、北奔重型汽车集团有限公司、一机集团和新特能源股份有限公司，每到一处，考察团成员都详细了解包头市在重大项目推进、营商环境打造等方面的经验和做法，积极寻找差距、虚心学习经验。。总结会上，考察团成员结合地区和部门实际，从学什么、解决什么、抓什么三个方面进行深入交流，一致表示要进一步理清工作思路，加大创新力度，主动对标对表，查找自身不足，积极推动全市经济社会高质量发展。。贺海东在讲话中指出，抓项目就是抓发展，抓投资就是抓未来，各级各部门要通过考察学习做到“五个要”，即认识要到位、谋划要主动、推动要有力、方式要创新、服务要精准。要找准定位，发挥优势，形成“抓一把手、一把手抓”的良好氛围，敢于担当、勇于担当，推动各项工作扎实开展。。贺海东强调，首府就要有首府的样子，各地区各部门要学习借鉴先进地区的经验和做法，围绕产业谋项目、研究政策争项目、优化环境强项目，谋定后动、谋定快动，切实增强推进项目的能力。要坚持领导带头、率先垂范，一级带着一级干、一级干给一级看，形成比、学、赶、帮、超的浓厚氛围，以实实在在的成效推动我市各项工作再上新台阶。。市领导刘程民、魏红军、王彦军、张永文，市政府党组成员、和林格尔新区管委会主任朱建国，呼和浩特经济技术开发区党工委书记李晓东及各旗县区、市属相关部门主要负责同志参加考察学习。,政府领导到其他城市考察学习或访问,0.0,True
25,内蒙古省,呼和浩特市,我市党政代表团赴包头市考察学习,2023-08-23,https://mp.weixin.qq.com/s?__biz=MzA5NzEyODA4OQ==&mid=2650096386&idx=3&sn=39e217cf26e7a2f49efd1e15308d4257&scene=0,传递政务信息，提供服务资讯，倾听您的诉求。呼和浩特市人民政府办公室公众平台欢迎朋友们与我们互动交流。。8月22日，自治区党委常委、呼和浩特市委书记包钢，呼和浩特市委副书记、市长贺海东率我市党政代表团赴包头市考察学习。。考察中，市党政代表团直奔企业、园区，进车间、看项目、听介绍，在明阳北方智慧能源、弘元新材料、通威高纯晶硅、双良硅材料、英思特稀磁新材料等企业，详细了解了包头市风电装备制造、晶硅光伏、稀土产业发展情况，对项目建设、产业集聚、园区配套等进行了重点考察。在青山区自由路二号街坊，市党政代表团一行考察了老旧小区改造及兵工文化特色完整社区建设情况。代表团一路走、一路看、一路议，切身感受到了包头在坚持“两新”导向抓项目、强化增量意识谋发展中取得的突出成效。。代表团返呼后，当晚召开会议，交流学习收获。包钢指出，包头工业基础雄厚，产业特色突出，特别是在运用系统思维谋划推进全产业链发展和强化发展质效考核方面，形成了很多好经验好做法，非常值得我市学习借鉴。大家要学习包头抓机遇的敏锐和高效、抓项目的韧劲和精细、抓发展的担当和魄力，切实把握新一轮发展机遇，乘势而上，敢闯敢干。要聚焦产业抓项目，强招商会招商，站在利当下、谋长远的高度推动“六大产业集群”链式化发展，为城市未来发展赢得更多主动。。市领导张海峰、王海瑜、魏红军、刘继英、李晓燕、付金在、朱建国及各旗县区、相关部门主要负责同志参加考察学习。,传递政务信息，提供服务资讯，倾听您的诉求。呼和浩特市人民政府办公室公众平台欢迎朋友们与我们互动交流。。8月22日，自治区党委常委、呼和浩特市委书记包钢，呼和浩特市委副书记、市长贺海东率我市党政代表团赴包头市考察学习。。考察中，市党政代表团直奔企业、园区，进车间、看项目、听介绍，在明阳北方智慧能源、弘元新材料、通威高纯晶硅、双良硅材料、英思特稀磁新材料等企业，详细了解了包头市风电装备制造、晶硅光伏、稀土产业发展情况，对项目建设、产业集聚、园区配套等进行了重点考察。在青山区自由路二号街坊，市党政代表团一行考察了老旧小区改造及兵工文化特色完整社区建设情况。代表团一路走、一路看、一路议，切身感受到了包头在坚持“两新”导向抓项目、强化增量意识谋发展中取得的突出成效。。代表团返呼后，当晚召开会议，交流学习收获。包钢指出，包头工业基础雄厚，产业特色突出，特别是在运用系统思维谋划推进全产业链发展和强化发展质效考核方面，形成了很多好经验好做法，非常值得我市学习借鉴。大家要学习包头抓机遇的敏锐和高效、抓项目的韧劲和精细、抓发展的担当和魄力，切实把握新一轮发展机遇，乘势而上，敢闯敢干。要聚焦产业抓项目，强招商会招商，站在利当下、谋长远的高度推动“六大产业集群”链式化发展，为城市未来发展赢得更多主动。。市领导张海峰、王海瑜、魏红军、刘继英、李晓燕、付金在、朱建国及各旗县区、相关部门主要负责同志参加考察学习。,政府领导到其他城市考察学习或访问,0.0,True
