code,province,city,topic,date,url,content,content,label,score
124,江西省,赣州市,县工信局牵头组织多单位及企业赴广州学习考察,2020-12-14,http://www.yudu.gov.cn/ydxxxgk/c100263ur/202012/ffd377dcd2064c04bf4c7a8400e067e4.shtml,"11月20日至22日,11月20日至22日,我局组织县发改委、县商务局、县工业园、县财政局等10家纺织服装产业研究院成员单位以及20多家我县创新能力提升计划项目成员企业赴广州学习考察。考察团实地走访了广州罗斯软件、广州汇美集团总部,并参观了广州面辅料市场及广州大学城智创中心,多方面、多维度的学习了纺织服装行业的时尚前沿资讯和创新创业新业态。 。",取经龙泉厦，问道快发展，无处不在、无时不有的创新，是留给我市党政代表团的至深印象之一。无论发展理念、发展方式，还是体制机制、干部作风建设等，福建三市都是坚持在创新中谋发展，在创新中求突破。。近年来，我市深入实施创新驱动发展战略，在优环境、强载体、谋合作、促转化等方面持续发力，创新型赣州建设取得了新进展、新成效。但是，对标龙泉厦，我们的创新工作还存在理念滞后、人才短缺、重点不突出、机制不完善、发展不均衡、整体氛围还不够浓郁等诸多短板。。思想的解放、理念的更新，是一切创新的源头活水。思想固化，发展则受制；理念不新，一切都难新。泉州把大众创业、万众创新作为助推经济增长的新引擎和新动力，积极搭建创新创业平台；厦门千方百计推进创新驱动，不遗余力打造高端产业高地、自主创新高地；和赣州同属山区市的龙岩，也在“无中生有、变废为宝”方面探索出新路径、创造出新经验……这些，都启示我们，创新，理念上的差距是最大的差距，思维上的落后是最大的落后。赣州发展基础差、底子薄，要加快振兴发展、实现同步小康，首先就必须创新理念，我们可以此次学习考察的福建三市为参照系，全面审视，逐一对标，着力破除阻碍理念创新的思想障碍。。发展活力在科技，科技源泉在创新。福建三市的实践证明，推动科技创新，不能“眉毛胡子一把抓”，要把握主攻方向，精准发力。既要突出企业的创新主体地位，让企业“唱主角”“挑大梁”，又要发挥创新平台的骨干作用，建设一批创新公共服务平台，还要围绕重点产业推动创新，以创新链支撑产业链。纵观龙泉厦，正是科技创新给他们带来了勃勃生机，特别是泉州市的“智能制造”“数控一代”示范工程、石墨烯新技术等，都是当地着力推动传统优势产业和产品向价值链中高端跃升的创新结晶 。从产业发展看，赣州的落后，主要在于工业的落后。市委、市政府吹响打好六大攻坚战和“主攻工业，三年翻番”的进军号，没有科技创新无以破题，更遑论交卷。我们必须紧紧抓住科技创新这个“牛鼻子”，充分利用互联网、大数据、区块链等新技术，推动新能源汽车、稀土钨新材料、生物制药、电子信息、家具等优势产业转型升级，进一步培育和释放经济发展新动能。。培育和释放经济发展新动能，破除体制机制桎梏、优化创新环境至关重要。福建三市的创新环境为什么这么好，创新成果转化率为什么那么高？一个重要的原因，就是他们重视发挥体制机制改革对推动科技创新、统筹要素资源配置、促进创新成果转化运用的激励和催化作用 。学习龙泉厦，我们要在传统优势产业、新兴战略产业等重点领域和关键环节，改革科技创新评价机制、转化运用机制，激活科技创新和运用的“一池春水”，建立以科技创新质量、贡献、绩效为导向的分类评价体系，为科研人员潜心研究、安心创新创业创造良好条件。还要有计划、有重点地建设一批科技成果转化中试基地，着力解决好科技成果转化“最后一公里”问题。。创新驱动，实质上是人才驱动，谁拥有一流的科技人才、创新人才，谁就拥有了科技创新的优势和主导权。目前，人才稀缺、人才结构不合理、优秀人才难以留住等问题，是制约赣州创新驱动发展的重大瓶颈。我们要把培养、引进、留住、用好人才，放在推进科技创新最优先的位置，大兴识才爱才敬才用才之风，打破地域、身份、人事关系等刚性制约，开辟“绿色通道”，实现人尽其才、才尽其用、用当其时。,其他,0.5166854179655747
124,江西省,赣州市,肖年生带队赴惠州市学习考察林业放管服改革,2022-10-27,http://lyj.ganzhou.gov.cn/gnlyw/c102331/202210/da89faa58c7549798d72a48d1a65225d.shtml,10月26日，市林业局党组书记肖年生带队赴广东省惠州市学习考察林业“放管服”改革、森林资源保护管理、林业系统党建与业务融合发展等工作。 同惠州市林业局负责同志座谈交流 肖年生一行考察参观了惠州市植物园，并围绕深化林业“放管服”改革、优化营商环境，森林资源保护管理，林业行政执法，林业系统党建与业务工作融合发展等方面，同惠州市林业局主要负责同志及有关负责同志进行深入座谈交流。 在惠州市植物园考察参观 肖年生高度评价惠州市林业局推动森林资源保护发展各项工作取得的显著成效。他指出，惠州市作为粤港澳大湾区的林业大市，在林业生态建设各方面思想解放、视野开阔、思路创新、措施有力，创造了很多好经验、好做法。要结合贯彻落实党的二十大精神，认真践行“绿水青山就是金山银山”理念，按照市委、市政府“三大战略、八大行动”决策部署，向先进看齐、对标提升，创新思路举措，强力推进全市林业高质量发展迈上新台阶，为建设革命老区高质量发展示范区贡献新的更大力量。 在惠州市植物园考察参观 肖年生强调，要建立完善工作沟通联系渠道，加强同粤港澳大湾区城市林业主管部门尤其是惠州市林业局的常态化联络，建成结对友好单位关系，进一步深入学习粤港澳大湾区优化林业服务、助力区域经济社会发展的思路、理念和措施，结合全市林业工作实际加以借鉴吸收，加强学习成果转化运用，切实提高全市林业改革发展尤其是深化林业“放管服”改革、优化营商环境的能力和水平。要认真学习惠州市林业局推动党的建设和林业业务工作融合发展的经验做法，拿出有力有效举措，进一步深化基层党组织“三化”建设，着力打造“让党放心、人民满意”模范机关，在森林资源保护发展、助力乡村全面振兴、统筹推进新冠肺炎疫情防控、服务全市经济社会发展等工作中充分发挥党支部战斗堡垒和党员先锋模范带头作用，努力创造全市林业系统“党建促林建”、“党建助力‘三大战略’”党建特色品牌。（黎林华）,8月28日至30日，江西省代表团在新疆维吾尔自治区学习考察，深入学习贯彻习近平总书记关于新疆工作的重要讲话精神，推动江西和新疆对口支援、交流协作迈上新台阶。新疆维吾尔自治区党委书记、新疆生产建设兵团党委第一书记、第一政委马兴瑞出席有关活动，江西省委书记、省人大常委会主任尹弘率团学习考察。。·吐尼亚孜，自治区人大常委会党组书记、主任祖木热提·吾布力，自治区领导张春林、陈伟俊、哈丹·卡宾，江西省领导李红军、任珠峰参加。。26年来对口援疆工作的成效。三天时间，尹弘率团深入克州、阿克陶县等地，走产业园区、看学校医院、听文化润心、访农户家庭，全方位了解江西对口援疆各项工作情况。。在克孜勒苏职业技术学院，江西理工大学与克州人民政府合作共建了战略资源开发与利用研究院。马兴瑞、尹弘等详细了解项目成果和产业化应用，鼓励用好江西智力支持和人才资源，扎实推进克州有色金属和新能源等优势资源开发与利用，加快产业项目落地转化。走进柯尔克孜族刺绣研发中心，做工精美的各种刺绣和工艺品琳琅满目。马兴瑞、尹弘等与传承人亲切交谈，并饶有兴致观看民族史诗《玛纳斯》展演。他们指出，中华文明博大精深、源远流长。要加强非物质文化遗产保护传承，把各民族优秀传统文化发扬光大。。克孜勒苏中医医院新院是我省重点援疆项目。马兴瑞、尹弘等察看项目现场，了解新院规划设计、功能布局，希望充分发挥江西中医药优良传统和技术优势，有力推动南疆地区中医药事业发展，促进中医药与各族传统医学融合发展。阿克陶县人民医院是我省对口支援医院，尹弘走访了中医康复等科室，通过视频问候正在远程会诊的江西医生，看望慰问江西援疆医务工作者。尹弘说，要扎实开展医疗援助，助力医疗学科建设，完善医疗人才。“组团式”帮扶有效推动了克州阿克陶教育质量逐年攀升。在克州江西实验中学，尹弘听取学校情况介绍，察看“红杜鹃”社团活动，为师生们作品和表演点赞，鼓励大家唱响“红杜鹃”品牌，传承红色基因，赓续红色血脉，让中华民族共同体意识根植心灵深处。尹弘衷心感谢各位援疆教师的真情付出和无私奉献，希望大家珍惜援疆的每一天时光，毫无保留地把教育理念和智慧知识传授给当地广大师生，办好人民满意的教育。阿克陶瑞金幼儿园拥有一流的硬件设施。在孩子们的小手拉大手下，尹弘走进幼儿园察看教学设施，对幼儿园突出特色、寓教于乐的做法给予肯定，要求培根铸魂、启智润心，帮助孩子系好“第一粒扣子”，促进各族孩子在中华民族大家庭中健康茁壮成长。。“石头屋”，到如今宽敞明亮、设施齐全的现代家园……我省援建的昆仑佳苑安置了1665户易地扶贫搬迁牧民，尹弘走进社区了解搬迁前后群众生产生活发生的翻天覆地变化。小区广场连廊里，居民纷纷表达搬迁后的喜悦之情。尹弘说，全面建成小康社会、全面推进现代化建设，一个民族也不能少。我们要铸牢中华民族共同体意识，共画民族团结同心圆，共同创造更加美好生活。尹弘来到柯尔克孜族群众萨热·库尔班家中，与他们全家人围坐在一起拉家常，鼓励他们用勤劳和智慧把日子越过越好。。在昆仑佳苑对面，我省发挥农业技术优势，支持帮助易地扶贫搬迁牧民建立了现代设施农业示范园区。。在疆期间，尹弘看望了我省援疆干部人才和在疆赣商代表。他希望广大援疆干部人才珍惜难得援疆机遇，强化使命担当，增进民族团结，提升能力水平，树立良好形象，真正把岗位当阵地守、把工作当事业干、把奉献当本分看，扑下身、沉下心、扎下根，与各族干部群众同甘共苦、并肩奋斗，努力交上具有江西情怀的援疆新答卷。希望广大赣商进一步发扬新时代赣商精神，扎根新疆、建设新疆，助力新疆经济社会发展；更好发挥桥梁和纽带作用，为现代化江西建设添砖加瓦、贡献力量。,政府领导到其他城市考察学习或访问,0.0
124,江西省,赣州市,我县党政考察团赴福建省厦门龙岩等地学习考察,2017-03-28,http://www.jxdy.gov.cn/dyxxxgk/c102406/201703/b9c4f2ef23a24ff39db199b5263031dd.shtml,3月19日至21日，县委书记曹爱珍率我县党政考察团赴福建省厦门、龙岩等地，学习考察两地在城市古街打造、红色文化旅游、循环经济利用与发展等方面工作的好经验、好做法。。县委书记曹爱珍，县委副书记、县长钟旭辉，以及李细妹、邓金健、黄刚、刘裕裕、刘晓明、罗少贵、邹隆春、周凤来等领导出席考察活动，各乡镇党委书记及有关部门单位负责人随团参加考察。,日，由孙传忠常务副市长带队组成学习考察团，赴瑞金市、于都县学习瑞兴于快速交通走廓项目前期、融资、建设工作经验。通过这次学习考察，学习好的经验做法，助力龙南市开创经济发展新辉煌。,政府领导到其他城市考察学习或访问,0.0
124,江西省,赣州市,我市党政代表团赴闽学习考察系列评论之四,2016-12-23,http://www.jxdy.gov.cn/dyxxxgk/c102472/201612/6b6acda1ef0942b589765b5ed26b9399.shtml,取经龙泉厦，问道快发展，无处不在、无时不有的创新，是留给我市党政代表团的至深印象之一。无论发展理念、发展方式，还是体制机制、干部作风建设等，福建三市都是坚持在创新中谋发展，在创新中求突破。。近年来，我市深入实施创新驱动发展战略，在优环境、强载体、谋合作、促转化等方面持续发力，创新型赣州建设取得了新进展、新成效。但是，对标龙泉厦，我们的创新工作还存在理念滞后、人才短缺、重点不突出、机制不完善、发展不均衡、整体氛围还不够浓郁等诸多短板。。思想的解放、理念的更新，是一切创新的源头活水。思想固化，发展则受制；理念不新，一切都难新。泉州把大众创业、万众创新作为助推经济增长的新引擎和新动力，积极搭建创新创业平台；厦门千方百计推进创新驱动，不遗余力打造高端产业高地、自主创新高地；和赣州同属山区市的龙岩，也在“无中生有、变废为宝”方面探索出新路径、创造出新经验……这些，都启示我们，创新，理念上的差距是最大的差距，思维上的落后是最大的落后。赣州发展基础差、底子薄，要加快振兴发展、实现同步小康，首先就必须创新理念，我们可以此次学习考察的福建三市为参照系，全面审视，逐一对标，着力破除阻碍理念创新的思想障碍。。发展活力在科技，科技源泉在创新。福建三市的实践证明，推动科技创新，不能“眉毛胡子一把抓”，要把握主攻方向，精准发力。既要突出企业的创新主体地位，让企业“唱主角”“挑大梁”，又要发挥创新平台的骨干作用，建设一批创新公共服务平台，还要围绕重点产业推动创新，以创新链支撑产业链。纵观龙泉厦，正是科技创新给他们带来了勃勃生机，特别是泉州市的“智能制造”“数控一代”示范工程、石墨烯新技术等，都是当地着力推动传统优势产业和产品向价值链中高端跃升的创新结晶 。从产业发展看，赣州的落后，主要在于工业的落后。市委、市政府吹响打好六大攻坚战和“主攻工业，三年翻番”的进军号，没有科技创新无以破题，更遑论交卷。我们必须紧紧抓住科技创新这个“牛鼻子”，充分利用互联网、大数据、区块链等新技术，推动新能源汽车、稀土钨新材料、生物制药、电子信息、家具等优势产业转型升级，进一步培育和释放经济发展新动能。。培育和释放经济发展新动能，破除体制机制桎梏、优化创新环境至关重要。福建三市的创新环境为什么这么好，创新成果转化率为什么那么高？一个重要的原因，就是他们重视发挥体制机制改革对推动科技创新、统筹要素资源配置、促进创新成果转化运用的激励和催化作用 。学习龙泉厦，我们要在传统优势产业、新兴战略产业等重点领域和关键环节，改革科技创新评价机制、转化运用机制，激活科技创新和运用的“一池春水”，建立以科技创新质量、贡献、绩效为导向的分类评价体系，为科研人员潜心研究、安心创新创业创造良好条件。还要有计划、有重点地建设一批科技成果转化中试基地，着力解决好科技成果转化“最后一公里”问题。。创新驱动，实质上是人才驱动，谁拥有一流的科技人才、创新人才，谁就拥有了科技创新的优势和主导权。目前，人才稀缺、人才结构不合理、优秀人才难以留住等问题，是制约赣州创新驱动发展的重大瓶颈。我们要把培养、引进、留住、用好人才，放在推进科技创新最优先的位置，大兴识才爱才敬才用才之风，打破地域、身份、人事关系等刚性制约，开辟“绿色通道”，实现人尽其才、才尽其用、用当其时。,2月21日，进贤县党政考察团一行来我区学习考察。考察团一行先后参观了开发区第一期标准厂房及香港工业园标准厂房。参观后就我区标准厂房的建设、运营情况等举行了座谈会。区党委委员、管委会副主任郑世飘出席会议，区招商局、区企业服务局、区项目办、国土分局、规划分局、香港工业园开发公司、锦城开发公司、区建设投资有限公司等单位代表参加座谈会。考察团一行认为，我区在标准厂房建设、招商政策、管理等方面都运作的很成熟，这种成功的经验做法非常值得学习和借鉴。,政府领导到其他城市考察学习或访问,0.0
124,江西省,赣州市,江西省代表团赴新疆学习考察对接对口支援工作,2023-09-01,http://www.ganxian.gov.cn/gxqxxgk/c110828/202309/999c16d4a583419e9669dcf15d639bec.shtml,8月28日至30日，江西省代表团在新疆维吾尔自治区学习考察，深入学习贯彻习近平总书记关于新疆工作的重要讲话精神，推动江西和新疆对口支援、交流协作迈上新台阶。新疆维吾尔自治区党委书记、新疆生产建设兵团党委第一书记、第一政委马兴瑞出席有关活动，江西省委书记、省人大常委会主任尹弘率团学习考察。。·吐尼亚孜，自治区人大常委会党组书记、主任祖木热提·吾布力，自治区领导张春林、陈伟俊、哈丹·卡宾，江西省领导李红军、任珠峰参加。。26年来对口援疆工作的成效。三天时间，尹弘率团深入克州、阿克陶县等地，走产业园区、看学校医院、听文化润心、访农户家庭，全方位了解江西对口援疆各项工作情况。。在克孜勒苏职业技术学院，江西理工大学与克州人民政府合作共建了战略资源开发与利用研究院。马兴瑞、尹弘等详细了解项目成果和产业化应用，鼓励用好江西智力支持和人才资源，扎实推进克州有色金属和新能源等优势资源开发与利用，加快产业项目落地转化。走进柯尔克孜族刺绣研发中心，做工精美的各种刺绣和工艺品琳琅满目。马兴瑞、尹弘等与传承人亲切交谈，并饶有兴致观看民族史诗《玛纳斯》展演。他们指出，中华文明博大精深、源远流长。要加强非物质文化遗产保护传承，把各民族优秀传统文化发扬光大。。克孜勒苏中医医院新院是我省重点援疆项目。马兴瑞、尹弘等察看项目现场，了解新院规划设计、功能布局，希望充分发挥江西中医药优良传统和技术优势，有力推动南疆地区中医药事业发展，促进中医药与各族传统医学融合发展。阿克陶县人民医院是我省对口支援医院，尹弘走访了中医康复等科室，通过视频问候正在远程会诊的江西医生，看望慰问江西援疆医务工作者。尹弘说，要扎实开展医疗援助，助力医疗学科建设，完善医疗人才。“组团式”帮扶有效推动了克州阿克陶教育质量逐年攀升。在克州江西实验中学，尹弘听取学校情况介绍，察看“红杜鹃”社团活动，为师生们作品和表演点赞，鼓励大家唱响“红杜鹃”品牌，传承红色基因，赓续红色血脉，让中华民族共同体意识根植心灵深处。尹弘衷心感谢各位援疆教师的真情付出和无私奉献，希望大家珍惜援疆的每一天时光，毫无保留地把教育理念和智慧知识传授给当地广大师生，办好人民满意的教育。阿克陶瑞金幼儿园拥有一流的硬件设施。在孩子们的小手拉大手下，尹弘走进幼儿园察看教学设施，对幼儿园突出特色、寓教于乐的做法给予肯定，要求培根铸魂、启智润心，帮助孩子系好“第一粒扣子”，促进各族孩子在中华民族大家庭中健康茁壮成长。。“石头屋”，到如今宽敞明亮、设施齐全的现代家园……我省援建的昆仑佳苑安置了1665户易地扶贫搬迁牧民，尹弘走进社区了解搬迁前后群众生产生活发生的翻天覆地变化。小区广场连廊里，居民纷纷表达搬迁后的喜悦之情。尹弘说，全面建成小康社会、全面推进现代化建设，一个民族也不能少。我们要铸牢中华民族共同体意识，共画民族团结同心圆，共同创造更加美好生活。尹弘来到柯尔克孜族群众萨热·库尔班家中，与他们全家人围坐在一起拉家常，鼓励他们用勤劳和智慧把日子越过越好。。在昆仑佳苑对面，我省发挥农业技术优势，支持帮助易地扶贫搬迁牧民建立了现代设施农业示范园区。。在疆期间，尹弘看望了我省援疆干部人才和在疆赣商代表。他希望广大援疆干部人才珍惜难得援疆机遇，强化使命担当，增进民族团结，提升能力水平，树立良好形象，真正把岗位当阵地守、把工作当事业干、把奉献当本分看，扑下身、沉下心、扎下根，与各族干部群众同甘共苦、并肩奋斗，努力交上具有江西情怀的援疆新答卷。希望广大赣商进一步发扬新时代赣商精神，扎根新疆、建设新疆，助力新疆经济社会发展；更好发挥桥梁和纽带作用，为现代化江西建设添砖加瓦、贡献力量。,留守儿童和困境儿童摸底排查、未成年人救助保护中心关爱服务留守儿童和困境儿童、儿童福利院关爱服务困境儿童等。儿童福利工作。局儿童福利和慈善事业促进科、市儿童福利院、市未成年人保护中心负责同志和南康区、于都县分管负责同志一同参加学习考察。。史方现一行先后来到吉安市未成年人保护中心、吉州区社会福利院、万安县罗塘村和十八口塘“一老一小幸福院”、鹰潭市未成年人保护中心、鹰潭市社会福利院、余江区未成年人保护中心、抚州市社会福利中心、抚州市未成年人保护中心等地学习考察，详细了解儿童福利院“养治教康社”一体化服务开展，未成年人保护中心关心关爱服务留守儿童和困境儿童具体活动情况，以及“一老一小幸福院”的选点布局、常态长效运营管理和政策宣传等工作。。史方现强调，要进一步捋清工作职责，明晰工作任务，注重分工配合，促进未成年人救助保护工作上新台阶；要进一步全面查缺补漏，注重扬长补短，补齐类家庭养育、儿童中医康复方面的不足，在提升儿童福利院精准化管理、精细化服务上达到新高度；要进一步统筹资金调度，强化绩效管理，充分发挥困难群众救助补助资金在基本生活保障、政府购买服务、未成年人关爱保护等方面的积极作用，助力儿童福利工作高质量发展上取得新成效。,政府领导到其他城市考察学习或访问,0.0
124,江西省,赣州市,孙常务副市长带队赴瑞金市于都县学习考察,2020-08-10,http://www.jxln.gov.cn/lnxxxgk/c100564/202008/0ea9d8ad3367447fa359f7c0d422be1b.shtml,日，由孙传忠常务副市长带队组成学习考察团，赴瑞金市、于都县学习瑞兴于快速交通走廓项目前期、融资、建设工作经验。通过这次学习考察，学习好的经验做法，助力龙南市开创经济发展新辉煌。,"8月20日,湖南省资兴市关工委学习参观团来我县参观学习。县委常委、组织部部长梁敏辉陪同。。参观团一行实地参观了中央红军长征出发地纪念园、中央红军长征出发纪念馆、长征前夕毛泽东同志旧居、赣南省苏维埃政府旧址、段屋乡红一军团军团部旧址和寒信古村、寒信村“初心讲堂”等景点,听取了我县关心下一代工作情况汇报,察看了我县关心下一代工作有关资料。参观团表示,通过来我县学习参观,对自身深入推进“传承红色基因、争做时代新人”主题教育活动和利用党史国史教育基地,激发青少年爱党爱国爱社会主义热情以及做好新时代关心下一代工作有很大的帮助作用。(曾长生)",政府领导到其他城市考察学习或访问,0.0
