code,province,city,topic,date,url,content,content,label,score
124,江西省,赣州市,广东省民政厅厅长卓志强一行在赣州学习考察,2023-03-10,http://mzw.ganzhou.gov.cn/gzsmzjy/tzgg/202303/2c817d91db7f4eef9cf0d2d3d47fbd63.shtml,3月7日-9日，广东省民政厅厅长卓志强、副厅长聂元松、区划地名处处长陈爱兵、养老服务处二级调研员程红伶、办公室副主任谭钊明、河源市民政局长黄亿芳、梅州市民政局长王健等一行在我市学习考察养老服务、地名管理等工作。江西省民政厅党组书记、厅长李明生，厅党组成员、副厅长李晖，区划地名处处长吴新传、养老服务处二级调研员陈剑锋，赣州市委副书记、统战部部长熊运浪，市政府副市长罗瑞华、市政协原副主席孔刃非、市政府副秘书长李正鹏，市民政局党组书记、局长华晓斌，市民政局党组成员、副局长康仁禄等分段陪同考察。。卓志强同志一行深入章贡区、南康区、于都县、瑞金市，先后实地考察了赣州国投天同官园里康养园、南康区龙岭敬老院、南康蟠桃园老年公寓、于都县岭背镇敬老院、于都县贡江镇红峰村、梓山镇潭头社区农村互助养老点、瑞金市叶坪红色康养小镇等养老机构和康养项目，详细了解我市养老服务特别是“1+1+N”农村养老服务体系建设、特困失能人员的集中照护、乡镇敬老院的改造提升以及农村互助养老服务、旅居养老、地名管理等工作，与相关负责人进行了深入交流。,12月7日，省委书记尹弘、省长叶建春率江西省党政代表团在江苏南京、苏州等地学习考察，并与江苏省举行会谈交流，认真学习江苏好经验好做法，推动赣苏合作向更高层次、更宽领域迈进。。江西省领导吴忠琼、李红军、任珠峰、庄兆林、谢茹，江苏省领导沈莹、张爱军、韩立明、刘小涛、储永宏、马欣、姚晓东出席有关活动。。尹弘、叶建春代表江西省委、省政府向江苏长期以来给予江西的支持帮助表示感谢。尹弘说，江苏是经济大省、科教文化大省，是我国现代化建设的排头兵和标杆。近年来特别是今年以来，江苏深入贯彻习近平总书记考察江苏重要讲话精神，全面落实“四个走在前”“四个新”重大任务，推动经济社会发展取得显著成效。江西和江苏同饮长江水，渊源深厚、交往频繁。习近平总书记时隔四年再次亲临江西考察，提出了“走在前、勇争先、善作为”的目标要求，赋予了江西新的时代重任。我们真诚希望强化两省战略协作，密切往来交流，支持江西成为长三角一体化发展的战略腹地，共促长江经济带高质量发展；加强产业互补，推进装备制造、新材料、生物医药等产业协作配套，积极承接江苏产业转移，助力江西产业升级；深化创新协同，鼓励更多科教资源、创新人才支持老区发展，携手共促科技成果转化落地；加强文化交流交融，促进文旅合作向更高水平迈进，共同开创新时代赣苏合作新局面。。信长星、许昆林代表江苏省委、省政府对江西省党政代表团的到来表示欢迎，对江西长期以来给予江苏发展的大力支持表示感谢。信长星说，江西不仅人杰地灵、区位优越，更是革命摇篮、红色热土，孕育了伟大的井冈山精神、苏区精神和长征精神，在国家发展大局中战略地位十分重要。近年来，江西深入贯彻落实习近平总书记考察江西重要讲话精神，大力实施高质量发展首要战略，经济社会发展取得新成就，许多好经验好做法值得我们认真学习借鉴。习近平总书记和党中央对苏赣两省高质量发展、现代化建设都寄予厚望，既是我们做好各项工作的根本遵循，也是深化交流合作的方向指引。我们将与江西一道，聚焦国家重大战略实施，充分发挥各自区位、功能、平台等优势，加强协同发展、联动发展，围绕重点产业延链补链、科技创新、长江生态保护、文化旅游、能源资源等方面拓宽合作领域、提升合作层次、丰富合作成果，在新征程上谱写苏赣合作共赢新篇章，为推进中国式现代化作出更大贡献。。在苏期间，尹弘、叶建春等代表团成员实地感受了江苏现代化建设的强劲脉动。苏州工业园创造了“一张蓝图绘到底”的成功典范，开放发展取得了举世瞩目的成就。尹弘、叶建春等来到展示中心，深入了解园区规划建设和发展情况，强调要学习苏州工业园先进理念和经验，坚持高水平规划引领、高质量产业培育，持续深化我省开发区改革和创新发展。苏州华兴源创科技公司深耕半导体检测设备领域自主创新，是我国科创板第一家上市企业，尹弘、叶建春等对企业以创新不断赢得竞争新优势表示赞赏，希望加强科技创新合作，助力江西电子信息等特色优势产业发展升级。在南京南瑞继保电气公司，尹弘、叶建春听取公司有关情况介绍，实地考察智能生产车间，希望加强产业对接协作，推动江西制造业转型发展。江苏省产业技术研究院勇拓科技体制改革“试验田”，一头连着科研、一头连着市场，转移转化成果7000多项，尹弘、叶建春等表示，江苏产研院通过把行业技术需求“引上来”，让创新成果和项目“落下去”，实现创新资源与关键技术需求有效对接。我们要学习江苏敢为人先、勇于创新的精神，在深化改革上大胆探索，聚焦产业需求、集聚创新资源，打造产学研用深度融合的产业技术创新体系。尹弘、叶建春等还考察了昆山陆家未来智慧田园，表示要促进两省现代农业合作交流，加强农文旅融合发展，实现两省互促共赢。,政府领导到其他城市考察学习或访问,0.6823482070388561
124,江西省,赣州市,吉安市青原区学习考察团深入章贡区调研火灾隐患治理工作,2019-04-17,http://www.zgq.gov.cn/zgqxxgk/c109054/201904/35805fe91e224bcab9390c82b28e86a0.shtml,4月16日上午，吉安市青原区委常委、常务副区长龙蛟率学习考察团深入章贡区调研赣南贸易广场火灾隐患治理工作，章贡区委常委王子康，东外街办、城管、市监、消防等部门主要领导陪同考察调研。。龙蛟副区长一行实地查看了赣南贸易广场“三合一”场所整治和火灾防控措施情况，以及消防设施器材配置和小型消防站、单位微型消防站等建设情况。随后，考察团一行与章贡区各单位主要领导进行了座谈交流，认真听取了章贡区政府关于赣南贸易广场火灾隐患整治的经验介绍，并围绕贸易市场火灾隐患治理中存在的重点、难点问题进行了深入交流和探讨。。通过此次考察调研，进一步加强了双方各项工作的交流与合作，达到了取长补短、互学共进的效果，有力推动了各项工作再上新台阶。,"2月6日上午,寻乌县县委常委李茂进、李正鹏率县考察团一行来我区学习考察。区领导李志坚、钟春华等陪同考察或参加相关活动。。考察团一行来到赣州杉杉奥特莱斯新能源充电桩项目实地参观考察,认真听取相关负责人的介绍,详细了解项目引进、投资、建设、研发与核心技术等情况,以及我区新基建、人工智能、新能源产业等方面的发展情况。。通过实地参观和听取介绍,考察团一行对我区推进新基建、新能源等项目建设等领域的经验和做法给予高度评价。大家纷纷表示,此次学习考察开阔了视野,章贡区在项目引进和建设、新基建、人工智能、新能源产业等方面的好方法、好经验值得学习借鉴。同时,也希望今后与章贡区在相关领域,进一步加强交流学习,积极开展合作,取长补短,相互学习,共同推进经济社会高质量快速发展。",政府领导到其他城市考察学习或访问,0.0
124,江西省,赣州市,婺源县考察团到我县学习考察丫山乡村旅游示范点建设,2018-07-09,http://www.jxdy.gov.cn/dyxzf/c104368/201807/ec9af66d204848a587bbb94d3fda89cd.shtml,7月4日至5日，婺源县考察团到我县学习考察丫山乡村旅游示范点建设。 在县委副书记、县长钟旭辉，县人大常委会副主任周红英，副县长邹隆春的陪同下，婺源县委副书记、县长吴云飞一行先后来到丫山乡村旅游示范点、丫山民宿、九成山舍等地参观考察，听取丫山A哆乡村、A哆森林规划、建设、运营和发展情况介绍，了解了丫山景区的整体规划、旅游模式和发展思路，考察了解了我县发展乡村旅游的经验做法和我县重点旅游项目规划建设情况。 丫山景区充分发挥生态优势，围绕原生态的秀美景色和“乡、土、野”的乡村风情，突出主题，打造基地，营造氛围，走出了一条生态保护与旅游产业发展良性循环之路。短短几年时间，就打造成为了一处集健身、娱乐、休闲、探险、观光、度假、养生、修心为一体的综合性生态旅游景区。 这一系列行之有效的做法得到考察团一行的高度评价。大家一致认为，我县乡村旅游发展思路新、定位准、速度快，符合绿色生态的发展趋势，令人耳目一新，深受启发。大家表示，婺源县生态环境优美、旅游产业底子好，要充分借鉴大余乡村旅游发展的好经验、好做法，结合婺源实际，利用好资源，理清思路、合理规划，全面推动婺源县旅游产业发展。,7月26日，定南县政协副主席李柳琴一行莅临全南县学习考察提升县城周边及高速（国省道）沿线可视范围林相改造品质和国家园林城市创建工作。全南县政协副主席曾慧华全程陪同，县林业局教授级高级工程师江军全程进行讲解，考察组一行先后在高峰公司国土绿化更替改造试点示范基地、小叶岽林场水尾坑山场，城厢镇镇仔村形湾山场以及梅子山森林公园等地实地查看项目成效。 李柳琴深入了解了我县林业部门在林地清理、树种选择、抚育管理、绿化美化等工作方面采取的积极措施，对全县在提升县城周边及高速（国省道）沿线的林相改造品质方面所做的工作成绩表示赞赏。 此外，李柳琴对全南县在国家园林城市创建工作方面也表示了高度评价，她认为，全南县注重将自然生态与城市建设相结合，积极推进园林城市的创建工作，不仅提升了城市形象，也为居民提供了更好的生活环境和休闲空间。 考察结束后，李柳琴表示，全南县在林相改造品质和国家园林城市创建方面的工作给她们留下了深刻的印象，希望两县能够加强合作与交流，为两县的发展注入新的活力，共同推动林业事业和城市建设的发展。（谢琪妍）,政府领导到其他城市考察学习或访问,0.0
124,江西省,赣州市,尹弘叶建春率我省党政代表团在江苏学习考察,2023-12-08,http://www.jiangxi.gov.cn/art/2023/12/8/art_395_4706659.html,12月7日，省委书记尹弘、省长叶建春率江西省党政代表团在江苏南京、苏州等地学习考察，并与江苏省举行会谈交流，认真学习江苏好经验好做法，推动赣苏合作向更高层次、更宽领域迈进。。江西省领导吴忠琼、李红军、任珠峰、庄兆林、谢茹，江苏省领导沈莹、张爱军、韩立明、刘小涛、储永宏、马欣、姚晓东出席有关活动。。尹弘、叶建春代表江西省委、省政府向江苏长期以来给予江西的支持帮助表示感谢。尹弘说，江苏是经济大省、科教文化大省，是我国现代化建设的排头兵和标杆。近年来特别是今年以来，江苏深入贯彻习近平总书记考察江苏重要讲话精神，全面落实“四个走在前”“四个新”重大任务，推动经济社会发展取得显著成效。江西和江苏同饮长江水，渊源深厚、交往频繁。习近平总书记时隔四年再次亲临江西考察，提出了“走在前、勇争先、善作为”的目标要求，赋予了江西新的时代重任。我们真诚希望强化两省战略协作，密切往来交流，支持江西成为长三角一体化发展的战略腹地，共促长江经济带高质量发展；加强产业互补，推进装备制造、新材料、生物医药等产业协作配套，积极承接江苏产业转移，助力江西产业升级；深化创新协同，鼓励更多科教资源、创新人才支持老区发展，携手共促科技成果转化落地；加强文化交流交融，促进文旅合作向更高水平迈进，共同开创新时代赣苏合作新局面。。信长星、许昆林代表江苏省委、省政府对江西省党政代表团的到来表示欢迎，对江西长期以来给予江苏发展的大力支持表示感谢。信长星说，江西不仅人杰地灵、区位优越，更是革命摇篮、红色热土，孕育了伟大的井冈山精神、苏区精神和长征精神，在国家发展大局中战略地位十分重要。近年来，江西深入贯彻落实习近平总书记考察江西重要讲话精神，大力实施高质量发展首要战略，经济社会发展取得新成就，许多好经验好做法值得我们认真学习借鉴。习近平总书记和党中央对苏赣两省高质量发展、现代化建设都寄予厚望，既是我们做好各项工作的根本遵循，也是深化交流合作的方向指引。我们将与江西一道，聚焦国家重大战略实施，充分发挥各自区位、功能、平台等优势，加强协同发展、联动发展，围绕重点产业延链补链、科技创新、长江生态保护、文化旅游、能源资源等方面拓宽合作领域、提升合作层次、丰富合作成果，在新征程上谱写苏赣合作共赢新篇章，为推进中国式现代化作出更大贡献。。在苏期间，尹弘、叶建春等代表团成员实地感受了江苏现代化建设的强劲脉动。苏州工业园创造了“一张蓝图绘到底”的成功典范，开放发展取得了举世瞩目的成就。尹弘、叶建春等来到展示中心，深入了解园区规划建设和发展情况，强调要学习苏州工业园先进理念和经验，坚持高水平规划引领、高质量产业培育，持续深化我省开发区改革和创新发展。苏州华兴源创科技公司深耕半导体检测设备领域自主创新，是我国科创板第一家上市企业，尹弘、叶建春等对企业以创新不断赢得竞争新优势表示赞赏，希望加强科技创新合作，助力江西电子信息等特色优势产业发展升级。在南京南瑞继保电气公司，尹弘、叶建春听取公司有关情况介绍，实地考察智能生产车间，希望加强产业对接协作，推动江西制造业转型发展。江苏省产业技术研究院勇拓科技体制改革“试验田”，一头连着科研、一头连着市场，转移转化成果7000多项，尹弘、叶建春等表示，江苏产研院通过把行业技术需求“引上来”，让创新成果和项目“落下去”，实现创新资源与关键技术需求有效对接。我们要学习江苏敢为人先、勇于创新的精神，在深化改革上大胆探索，聚焦产业需求、集聚创新资源，打造产学研用深度融合的产业技术创新体系。尹弘、叶建春等还考察了昆山陆家未来智慧田园，表示要促进两省现代农业合作交流，加强农文旅融合发展，实现两省互促共赢。,为学习借鉴大湾区先进经验，拓宽供销事业发展思路，5月10日，市供销联社党组书记、理事会主任彭民生率队到广州市天河区供销联社学习考察。。广州市供销总社党组书记、理事会主任吴尚伟，天河区供销联社党组书记、理事会主任钟伟峰，民革天河基层委员会主委、天河区供销协会会长吴小妹陪同考察。。河供销社、天河区供销协会，详细了解天河区供销社在农产品供应链、基层社改造提升、社有资产监管、弘扬供销企业文化等方面经验做法，并围绕农产品供应链建设、产品品牌打造、赣穗两地产销对接进行座谈交流。。交流座谈会上，双方围绕农产品流通、共促消费帮扶、社有企业发展、供应链网络建设、品牌打造等方面进行了深入交流。一致表示，一是要加强赣穗两地特色农产品产销对接，组织开展展销会、产品推广等活动，把赣州特色农产品推广至。要积极探索“老区+湾区”供销合作新模式，在信息、人才、管理等改革经验上加强互学互鉴，助推流通网络互融、社有企业互联，形成发展合力，共同推动供销合作事业再上新台阶。。市供销联社党组成员、理事会副主任孔青山，党组成员、监事会主任刘芃成，部分县（市、区）供销合作社、相关科室负责人参加考察。,政府领导到其他城市考察学习或访问,0.0
124,江西省,赣州市,寻乌县考察团一行来我区学习考察,2021-02-08,https://www.zgq.gov.cn/zgqzf/jryd/202102/dbe3e924944544778d34b456fda86b0c.shtml,"2月6日上午,寻乌县县委常委李茂进、李正鹏率县考察团一行来我区学习考察。区领导李志坚、钟春华等陪同考察或参加相关活动。。考察团一行来到赣州杉杉奥特莱斯新能源充电桩项目实地参观考察,认真听取相关负责人的介绍,详细了解项目引进、投资、建设、研发与核心技术等情况,以及我区新基建、人工智能、新能源产业等方面的发展情况。。通过实地参观和听取介绍,考察团一行对我区推进新基建、新能源等项目建设等领域的经验和做法给予高度评价。大家纷纷表示,此次学习考察开阔了视野,章贡区在项目引进和建设、新基建、人工智能、新能源产业等方面的好方法、好经验值得学习借鉴。同时,也希望今后与章贡区在相关领域,进一步加强交流学习,积极开展合作,取长补短,相互学习,共同推进经济社会高质量快速发展。",3月18日，县委书记曹爱珍率我县党政考察团赴章贡区，学习考察章贡区在文明城市创建工作方面的先进经验做法，促进我县文明城市创建工作再上新台阶。。在章贡区委副书记、区长连天浪的陪同下，县委书记曹爱珍，县委副书记、县长钟旭辉，以及邓增顺、李细妹、邓金健、包礼斌、温岩松、何选明等考察团一行先后来到文清路小学豪德校区、金洲城农贸市场、三康庙社区、马扎巷和赣江街道综合文化站等地，就市民宣传教育、社会主义核心价值观学习宣传及城市建设管理、农贸市场整治等重点内容进行考察学习，了解章贡区相关工作的具体推进举措，听取有关情况介绍，深入学习章贡区在文明城市创建过程中的好经验、好做法。。在文清路小学豪德校区，章贡区将文明城市建设的内容融入到学校教育教学、校园环境当中，给孩子们营造出浓厚的文明氛围；在金洲城农贸市场，“菜上架、肉上台、鱼入池、鸡入笼、货入柜”，布局合理、管理规范、环境优良、配套完善；在各街道社区，环境整洁、功能健全，未成年人活动室、文化活动室、图书馆、4点半课堂等一应俱全，真正成为方便百姓办事、反映社情民意、开展文化体育活动的有效阵地。。在每个参观考察点，考察团一行都认真听仔细看。大家一致认为，章贡区注重建立健全创文长效机制，各项体制机制健全，工作扎实细致到位，很多先进经验做法值得认真学习借鉴。将以此为契机，认真学习借鉴章贡区文明城市创建中的好做法和好经验，取长补短，并结合大余实际加以推广，推进大余创文工作向更深层次发展。,政府领导到其他城市考察学习或访问,0.5067715099334001
