code,province,city,topic,date,url,content,content,label,score
124,江西省,赣州市,吴忠琼率赣州党政考察团继续在厦门学习考察,2022-06-02,http://www.jxxf.gov.cn/xfxxxgk/c101198/202206/a380eefd46af47a7897dbaee47d93422.shtml,5月26日上午，省委副书记、市委书记吴忠琼率赣州市党政考察团继续在厦门学习考察，走访大集团大企业，现场感受厦门创新创业高质量发展、产业转型升级的“加速度”，进一步坚定推进赣州工业倍增升级、做优做强做大产业的信心决心。。厦门市委副书记、市长黄文辉，厦门市领导连坤明等陪同考察。赣州市领导何琦、孙敏、陈水连参加。。考察团一行首先来到厦门天马微电子有限公司，参观企业展厅和生产车间。该公司是全球显示行业领军企业天马微电子股份有限公司的全资子公司，主要生产应用于智能手机、平板电脑等高端移动终端的消费类显示屏及模块，填补了我国高端显示领域的空白。企业负责人向考察团一行详细介绍了企业发展历程、企业文化、技术研发、产品应用场景、未来发展规划和产品智能化生产流程等，大家边听边看、边走边问，深入了解企业科技研发、人才引进、市场开拓等情况。大家认为，厦门市着力打造千亿元光电产业集群，吸引配套企业聚集，形成产业“链群配”效应的先进经验非常值得赣州学习借鉴。要持续深化改革创新，进一步延链补链强链，坚定不移招大引强、完善配套、服务企业，不断做大做强“1+5+N”产业集群。。厦门弘信电子科技集团股份有限公司是一家主板上市、国内排名第一的专业从事柔性印制电路板研发生产的企业，其产品主要应用于智能手机、可穿戴电子产品、智能汽车、智能家居、虚拟现实、柔性显示等领域。考察团一行来到这里，参观了生产车间及产品展示厅，详细了解产品研发及市场销售等情况。该企业坚持自主创新，通过整合国内知名高校资源，大力引进创新人才，不断探索和开拓柔性电子应用领域，以及节约集约用地、精细化管理等做法，给大家留下了深刻印象。大家纷纷表示，要进一步加大人才、技术引进力度，推动我市电子信息产业升级，抢占行业高端。。银鹭食品创始于1985年，是厦门乃至全国名列前茅的罐头食品、饮料生产基地之一，是农业产业化国家重点龙头企业。考察团一行参观了企业文化展示中心、无菌灌装生产线等，听取了银鹭集团的发展历程、产品生产、灌装、科研等情况介绍，对银鹭集团世界领先的灌装技术、产品的研发及产品市场投放给予赞许。大家表示，要学习银鹭集团艰苦奋斗、拼搏创新的精神，围绕我市特色优势产业，做大做强农业龙头企业，凝心聚力推进乡村全面振兴。（特派记者张宗兴/文 刘青/图）,1月30日，南昌市安义县常委、政法委书记吴志强带领该县学习考察团一行22人，到我县学习考察农旅和多种生产模式及规模的先进经验和做法。市政府副秘书长杨维田，县委常委、县政府副县长冯靖哲陪同。。人，到我县学习考察农旅和多种生产模式及规模的先进经验和做法。市政府副秘书长杨维田，县委常委、县政府副县长冯靖哲陪同。。考察团一行来到梓山镇万亩富硒蔬菜产业基地实地考察，通过看现场、听介绍，详细了解了各项农旅及多种生产做法，深入交流探讨了生产模式的先进经验。。考察团一行对我县农旅产业发展给予了充分认可，通过此次参观考察，进一步加强了沟通交流。并表示回去以后将结合实际，推进农旅工作，争取取得更大的成效。（张淑华、曾小茂）,政府领导到其他城市考察学习或访问,0.0
124,江西省,赣州市,赣州市党政代表团在广州学习考察,2021-05-29,http://www.jxxf.gov.cn/xfxxxgk/c101222/202105/6c88d5f9a2a94baba9270f19d6fed29b.shtml,日，赣州市党政代表团在广州学习考察，学习广州的好理念、好思路和好经验、好做法，进一步深化合作交流。。李希代表广东省委、省政府对赣州市党政代表团的到来表示欢迎，对江西和赣州长期以来给予广东工作的支持表示感谢。他说，广东和江西是近邻，是兄弟省份。赣州是全国著名的革命老区，是江西省域副中心城市，支持革命老区高质量发展是我们义不容辞的责任。当前，广东正深入学习贯彻习近平总书记对广东重要讲话、重要指示批示精神，扎实抓好。”工作部署落实，全力打造新发展格局战略支点，奋力在全面建设社会主义现代化国家新征程中走在全国前列、创造新的辉煌。我们坚决贯彻落实以习近平同志为核心的党中央的决策部署，进一步加强与革命老区交流合作，全力支持赣州高质量跨越式发展，推动新发展阶段粤赣合作再上新水平。。吴忠琼转达了省委、省政府主要领导的问候，对广东长期以来给予江西和赣州的帮助和支持表示感谢。她说，习近平总书记一直关心赣南的发展，。月视察江西和赣州时，提出了“在加快革命老区高质量发展上作示范”的重要要求。《国务院关于新时代支持革命老区振兴发展的意见》明确提出研究建立发达省市与革命老区重点城市对口合作机制，支持赣南等原中央苏区深度参与粤港澳大湾区建设，支持赣州与大湾区共建产业合作试验区。加快对接融入粤港澳大湾区，是赣州全力推动的重大战略，是高质量跨越式发展的重要路径。希望广东省一如既往关心支持江西和赣州发展，支持赣州市深度参与粤港澳大湾区建设，在科技创新、产业发展、基础设施、双向开放、干部培养等领域深化合作，助推赣州打造对接融入粤港澳大湾区的桥头堡。。其间，代表团一行先后考察了新能源汽车及配套产业发展、科技创新及成果转化、城市规划建设和生物医药产业发展等工作。在广州明珞汽车装备有限公司，代表团一行参观了明珞装备创新体验中心，详细了解明珞研发、技术、产品、服务以及数字化、智能化等发展情况。大家表示，要把智能制造解决方案运用到赣州的工业领域，推动我市工业倍增升级，实现高质量发展。来到广州科学城初心使命馆，大家通过观看图片、文字、视频、模型、互动展示等，深入了解黄埔区、广州开发区以高质量党建推进高质量发展的建设成果。登上广州东塔（周大福金融中心），大家俯瞰珠江两岸，察看城市规划建设和生态保护情况，认真听取广州城市规划建设概要介绍，表示要认真学习借鉴广州的先进理念，促进城乡规划建设水平不断提升。金域医学检验集团有限公司是中国。年领先行业。代表团一行来到这里，实地参观金域医学展厅，详细了解金域医学创业发展历程、服务网络、科技创新等情况及未来发展规划。吴忠琼说，希望金域医学将区域中心布局赣州，助力赣州提升公共卫生服务能力，更好满足群众健康需求，造福老区人民。,为推动县域学前教育普及普惠发展，县委教科体工委委员谢先将，县委教科体工委委员、总督学林珏率我县学前教育普及普惠考察团赴上犹县学习考察。相关股室负责人、幼儿园园长参加考察活动。。考察团一行先后来到上犹县城区第二幼儿园、城区第四幼儿园、社溪镇公立幼儿园、社溪镇石崇幼儿园、沿湖中心幼儿园，通过查看资料、座谈会与实地观摩相结合的方式，认真学习了上犹县创建学前教育普及普惠县的先进经验，详细了解了几所幼儿园的办园理念、环境创设、师资配备、课程建设等情况，并与相关业务领导和职能股室交流探讨，对工作中存在的共性难题深入交流，共同探索工作新思路、新举措。。此次考察学习活动，为我县开展县域学前教育普及普惠创建工作拓展思路提供了重要借鉴，我县将以此次学习考察为契机，增强创建工作的责任感和紧迫感，不断健全保障机制，进一步推进学前教育普及普惠优质发展。,政府领导到其他城市考察学习或访问,0.0
124,江西省,赣州市,南昌市安义县学习考察团来我县考察,2018-02-01,https://www.yudu.gov.cn/yudu/jryd/201802/4d3456f466594610aa68a7fd40e4446c.shtml,1月30日，南昌市安义县常委、政法委书记吴志强带领该县学习考察团一行22人，到我县学习考察农旅和多种生产模式及规模的先进经验和做法。市政府副秘书长杨维田，县委常委、县政府副县长冯靖哲陪同。。人，到我县学习考察农旅和多种生产模式及规模的先进经验和做法。市政府副秘书长杨维田，县委常委、县政府副县长冯靖哲陪同。。考察团一行来到梓山镇万亩富硒蔬菜产业基地实地考察，通过看现场、听介绍，详细了解了各项农旅及多种生产做法，深入交流探讨了生产模式的先进经验。。考察团一行对我县农旅产业发展给予了充分认可，通过此次参观考察，进一步加强了沟通交流。并表示回去以后将结合实际，推进农旅工作，争取取得更大的成效。（张淑华、曾小茂）,国务院批复同意在沈阳等6个城市暂时调整实施有关行政法规和经国务院批准的部门规章规定2024-07-11。中办国办印发《关于做好全国民族团结进步模范推荐评选工作的通知》2024-06-18,其他,0.7105985543232448
124,江西省,赣州市,我县党政考察团赴全南定南学习考察,2022-05-24,http://www.jxdy.gov.cn/dyxxxgk/c102598/202205/535172ec89a14b4d99ca757100091f22.shtml,,1月10日，九江市德安县县委书记周三连率领党政考察团到我县学习考察。县委副书记郭书珑，县委常委钟财亮陪同。。考察团一行先后来到县体育中心、赢家时装（赣州）有限公司、翡俪文德时尚服饰发展有限公司、江西卫棉纺织集团有限公司、于都-FDC时尚产业综合体等地参观考察。考察团对于我县深入推进体育融合、纺织服装产业发展所取得的成果给予了高度赞扬。。在随召开交流座谈会上，郭书珑向考察团一行介绍了我县纺织服装产业发展的状况，观看了于都招商宣传片。考察团认为我县纺织服装产业发展迅猛，这次考察收获颇丰，有许多好经验、好做法值得学习借鉴，希望两地能够进一步加强合作交流，推动两县共同发展。,政府领导到其他城市考察学习或访问,0.0
124,江西省,赣州市,大余县学前教育考察团赴上犹县学习考察,2023-03-07,http://www.jxdy.gov.cn/dyxxxgk/c101062/202303/3e3c6a3c8ff6460b946e0a9b18121ad6.shtml,为推动县域学前教育普及普惠发展，县委教科体工委委员谢先将，县委教科体工委委员、总督学林珏率我县学前教育普及普惠考察团赴上犹县学习考察。相关股室负责人、幼儿园园长参加考察活动。。考察团一行先后来到上犹县城区第二幼儿园、城区第四幼儿园、社溪镇公立幼儿园、社溪镇石崇幼儿园、沿湖中心幼儿园，通过查看资料、座谈会与实地观摩相结合的方式，认真学习了上犹县创建学前教育普及普惠县的先进经验，详细了解了几所幼儿园的办园理念、环境创设、师资配备、课程建设等情况，并与相关业务领导和职能股室交流探讨，对工作中存在的共性难题深入交流，共同探索工作新思路、新举措。。此次考察学习活动，为我县开展县域学前教育普及普惠创建工作拓展思路提供了重要借鉴，我县将以此次学习考察为契机，增强创建工作的责任感和紧迫感，不断健全保障机制，进一步推进学前教育普及普惠优质发展。,"3月22日,新余市市监局总工程师李晓丰一行,来我局考察学习“平安电梯”创建工作。市局党组成员、副局长刘平陪同并介绍相关情况。。座谈会上,刘平简要介绍了我市创建全省“平安电梯”安全监管示范区主要经验和做法。会后,陪同考察组一行前往兴国县局实地观摩电梯物联网建设情况。考察组认为赣州市局“平安电梯”创建工作走在全省前列,此次学习考察为新余市局创建“平安电梯”有很大的启发和帮助。。双方均表示,今后将继续加强两局的经验交流,共同探索在新形势下创建“平安电梯”的新思路和新方法,为今后双方在特种设备安全领域加强合作夯实基础。",其他,0.6081716949654049
124,江西省,赣州市,李卫国带队前往深圳学习考察,2021-12-15,http://rsj.ganzhou.gov.cn/gzsrsj/bsyw/202203/73664725724549d08ae1c5a7de93eb99.shtml,国务院批复同意在沈阳等6个城市暂时调整实施有关行政法规和经国务院批准的部门规章规定2024-07-11。中办国办印发《关于做好全国民族团结进步模范推荐评选工作的通知》2024-06-18,"9月26日至28日，为学习借鉴粤港澳大湾区供销合作社发展经验，在打造对接融入粤港澳大湾区桥头堡进程中贡献供销力量，赣州市供销联社党组书记、主任罗红梅带队赴广州、珠海、惠州三地供销合作社开展对接粤港澳大湾区学习考察，党组成员、监事会主任刘。成，三级调研员廖德军、王文杰，机关相关科室负责人，章贡区、大余县、定南县、信丰县供销社主任参加了学习考察活动。。26日，考察组到珠海市供销合作社，参观考察了珠海市供销社百分百商业有限公司、珠海市供销社社员资金互助中心、三灶镇供销社助农服务中心,学习日用消费品经营、合作金融和助农服务中心建设经验。。27日，考察组到广州市供销合作社，参观考察了广州市农产品公司小鲜驿站门店、如意果品批发市场，学习农产品批发市场运营和农产品流通经验。。28日，考察组到惠州市，参观考察了粤港澳大湾区（广东·惠州）绿色农产品生产供应基地、博罗县供销社助农服务综合平台、博罗县为民光华农产品专业合作社，学习农产品基地建设、助农服务综合平台和农产品生产加工经验。。考察组每到一处，都认真学习，深入思考，并积极主动与对方进行沟通，增进了解，争取支持，促进合作。广州、珠海、惠州供销合作社对考察组一行予以了热情接待，周到安排。考察组与广州、珠海、惠州供销合作社分别进行了座谈，一致认为，赣州与广东山水相连、人文相通，合作空间很大，大湾区是赣州优质农产品的理想销售目的地，赣州是大湾区的休闲度假旅游后花园，双方应进一步密切沟通交流，并初步就大米供销和专业合作社产品销售达成了合作意向。",政府领导到其他城市考察学习或访问,0.0
124,江西省,赣州市,九江市德安县党政考察团到我县学习考察,2023-01-13,http://www.yudu.gov.cn/ydxxxgk/c100263gter/202301/bb10968338094d6598bcbc9f5d40cbd9.shtml,1月10日，九江市德安县县委书记周三连率领党政考察团到我县学习考察。县委副书记郭书珑，县委常委钟财亮陪同。。考察团一行先后来到县体育中心、赢家时装（赣州）有限公司、翡俪文德时尚服饰发展有限公司、江西卫棉纺织集团有限公司、于都-FDC时尚产业综合体等地参观考察。考察团对于我县深入推进体育融合、纺织服装产业发展所取得的成果给予了高度赞扬。。在随召开交流座谈会上，郭书珑向考察团一行介绍了我县纺织服装产业发展的状况，观看了于都招商宣传片。考察团认为我县纺织服装产业发展迅猛，这次考察收获颇丰，有许多好经验、好做法值得学习借鉴，希望两地能够进一步加强合作交流，推动两县共同发展。,为进一步解放思想、开拓视野，学习先进地区水利工程谋划、资金项目争取、河流治理保护等方面的成功做法和典型经验，加快推动赣州市水利事业高质量跨越式发展。。局党组书记、局长何世林率学习考察组前往福建省泉州市、三明市和浙江省衢州市学习考察，同当地市、县（区）水利局座谈交流了水利工作。。在泉州市，学习考察组详细了解白濑水利枢纽谋划储备、向上申报、落地开工的全过程及主要经验做法，听取了虎邱镇安全生态水系统筹水系整治、生态农业、文化旅游建设的情况介绍。。在三明市，学习考察组参观了沙县双溪水库、东溪安全生态水系工程、河长指挥调度中心，深入了解工程建设管理、综合治水、河湖长制等方面的先进理念和工作方法，现场观看了“智慧河长”处置事例视频。。在衢州市，学习考察组实地考察了衢江治理二期（百家塘段）、柯城区石梁溪治理工程，全面了解衢州市“美丽河湖”建设及“退堤还河”的创新做法，就浙赣粤运河建设等内容进行了深入交流探讨。。通过学习考察和座谈交流，学习考察组结合赣州实际，带着问题学习，全方位、多层次了解到先进地区水利改革发展情况，深切感受到自身的差距和不足，找准了工作目标和方向，为推进赣州水利建设三年行动计划、加快谋划建设一批重大水利项目拓宽了思路。下一步，市、县水利部门将以学促干，用实际行动为赣州建设革命老区高质量发展示范区提供水利支撑。,政府领导到其他城市考察学习或访问,0.0
124,江西省,赣州市,新余市局来我局学习考察平安电梯创建工作,2018-04-03,https://www.ganzhou.gov.cn/zfxxgk/c100449se/201804/f734fdcbbe30478885c67815303f2c77.shtml,"3月22日,新余市市监局总工程师李晓丰一行,来我局考察学习“平安电梯”创建工作。市局党组成员、副局长刘平陪同并介绍相关情况。。座谈会上,刘平简要介绍了我市创建全省“平安电梯”安全监管示范区主要经验和做法。会后,陪同考察组一行前往兴国县局实地观摩电梯物联网建设情况。考察组认为赣州市局“平安电梯”创建工作走在全省前列,此次学习考察为新余市局创建“平安电梯”有很大的启发和帮助。。双方均表示,今后将继续加强两局的经验交流,共同探索在新形势下创建“平安电梯”的新思路和新方法,为今后双方在特种设备安全领域加强合作夯实基础。",、业主委员会指导和监督、物业服务等级标准和收费标准等工作进行了介绍。随后，双方就物业服务事中事后监管、维修资金使用和管理、物业矛盾纠纷处理等做法经验进行了深入的交流。。在物业管理工作中的经验和做法给予高度肯定。物业管理工作是涉及广大城市居民的民生工程，得到各级政府的高度重视。这次来到,政府领导到其他城市考察学习或访问,0.0
124,江西省,赣州市,赣州市供销联社赴粤港澳大湾区学习考察,2020-10-05,http://www.yudu.gov.cn/ydxxxgk/c100264k/202010/1953a5e44d0d4a6189e692c4fd977ca3.shtml,"9月26日至28日，为学习借鉴粤港澳大湾区供销合作社发展经验，在打造对接融入粤港澳大湾区桥头堡进程中贡献供销力量，赣州市供销联社党组书记、主任罗红梅带队赴广州、珠海、惠州三地供销合作社开展对接粤港澳大湾区学习考察，党组成员、监事会主任刘。成，三级调研员廖德军、王文杰，机关相关科室负责人，章贡区、大余县、定南县、信丰县供销社主任参加了学习考察活动。。26日，考察组到珠海市供销合作社，参观考察了珠海市供销社百分百商业有限公司、珠海市供销社社员资金互助中心、三灶镇供销社助农服务中心,学习日用消费品经营、合作金融和助农服务中心建设经验。。27日，考察组到广州市供销合作社，参观考察了广州市农产品公司小鲜驿站门店、如意果品批发市场，学习农产品批发市场运营和农产品流通经验。。28日，考察组到惠州市，参观考察了粤港澳大湾区（广东·惠州）绿色农产品生产供应基地、博罗县供销社助农服务综合平台、博罗县为民光华农产品专业合作社，学习农产品基地建设、助农服务综合平台和农产品生产加工经验。。考察组每到一处，都认真学习，深入思考，并积极主动与对方进行沟通，增进了解，争取支持，促进合作。广州、珠海、惠州供销合作社对考察组一行予以了热情接待，周到安排。考察组与广州、珠海、惠州供销合作社分别进行了座谈，一致认为，赣州与广东山水相连、人文相通，合作空间很大，大湾区是赣州优质农产品的理想销售目的地，赣州是大湾区的休闲度假旅游后花园，双方应进一步密切沟通交流，并初步就大米供销和专业合作社产品销售达成了合作意向。",派考察组一行到赣州综合保税区学习考察。区领导毛瑞林、叶爱英、陈华洪先后陪同考察或参加座谈会。。考察组一行先后参观了经开区城展馆、美橙进出口商品交易展示中心，并召开座谈会，详细了解赣州综保区机构设置、规划建设、运营管理、招商引资、管理体制等情况。考察组一行充分肯定了赣州综保区融入经开区联动发展的体制机制创新做法，赞许综保区开发建设取得的成效，希望今后双方在园区开发、建设管理、信息互通等方面进一步加强交流，深化合作，实现互惠互利。,不属于政府领导到其他城市考察学习的新闻,0.5092246178389354
