code,province,city,topic,date,url,content,content.1,label,score,is_match
115,福建省,南平市,甘肃省临夏回族自治州党政考察团来南平考察交流,2020-06-21,http://www.np.gov.cn/cms/siteresource/article.shtml?id=430498641597880000&siteId=340328840390080000,19日至20日，甘肃省临夏回族自治州州委书记郭鹤立率党政考察团来南平考察交流。市委书记袁毅会见考察团并座谈交流。 袁毅代表市委市政府对临夏州党政考察团来南平考察表示欢迎，并简要介绍了我市有关情况。他说，近年来临夏州委州政府牢记习近平总书记嘱托，举全州之力向深度贫困堡垒发起总攻，在精准脱贫、项目建设、提振士气等方面采取了一系列创新举措，脱贫攻坚取得决定性成效，民族团结进步、社会安定稳定，经济社会发展迈上了新台阶。这次临夏州党政考察团来南平考察，充分彰显了闽甘两省互帮互学互助的亲密关系，对进一步加强区域交流合作，推动南临两地高质量发展具有重要意义。袁毅说，南平最大的特色是绿色，最具竞争力的优势是生态。当前，我们正深入学习贯彻习近平生态文明思想，积极探索绿水青山转化为金山银山的有效路径，全方位推动绿色发展高质量发展超越。南平与临夏文化生态资源富集、特色优势互补，希望双方以此次考察为契机，进一步加强在脱贫攻坚、文旅产业等领域的交流合作，携手推动两地高质量发展。 郭鹤立对南平市委市政府的精心安排表示感谢，他说，南平山清水秀、人文荟萃，近年来南平市委市政府围绕加快推动绿水青山转化为金山银山，先行先试、创新创业，经济社会发展发生日新月异的变化，特别是创新推进“武夷品牌”“生态银行”“水美经济”建设，为“两山”转化提供了可复制可推广的模式经验，十分值得临夏学习。郭鹤立说，临夏州历史悠久、文化灿烂、风景优美、人杰地灵，是国家重点支持的“三区三州”之一，去年以来我们以超常规的力度和举措推动脱贫攻坚取得决定性成效，全州上下精神振奋、斗志昂扬，有信心夺取脱贫攻坚的最后胜利，与全国全省同步全面建成小康社会。当前，临夏正处在大建设大发展的关键时期，希望通过这次考察学习，将南平的好经验、好做法带回去，助推临夏高质量打赢脱贫攻坚战。 在南平期间，临夏党政考察团一行先后考察了武夷新区、建阳文创产业、武夷山香江名苑、五夫镇“生态银行”建设等。临夏州领导邱武伟、安华山、马军、尹宝山，南平市领导丘毅、林旭阳、何明星、江建华参加有关活动。 扫一扫在手机打开当前页。袁毅代表市委市政府对临夏州党政考察团来南平考察表示欢迎，并简要介绍了我市有关情况。他说，近年来临夏州委州政府牢记习近平总书记嘱托，举全州之力向深度贫困堡垒发起总攻，在精准脱贫、项目建设、提振士气等方面采取了一系列创新举措，脱贫攻坚取得决定性成效，民族团结进步、社会安定稳定，经济社会发展迈上了新台阶。这次临夏州党政考察团来南平考察，充分彰显了闽甘两省互帮互学互助的亲密关系，对进一步加强区域交流合作，推动南临两地高质量发展具有重要意义。袁毅说，南平最大的特色是绿色，最具竞争力的优势是生态。当前，我们正深入学习贯彻习近平生态文明思想，积极探索绿水青山转化为金山银山的有效路径，全方位推动绿色发展高质量发展超越。南平与临夏文化生态资源富集、特色优势互补，希望双方以此次考察为契机，进一步加强在脱贫攻坚、文旅产业等领域的交流合作，携手推动两地高质量发展。。在南平期间，临夏党政考察团一行先后考察了武夷新区、建阳文创产业、武夷山香江名苑、五夫镇“生态银行”建设等。临夏州领导邱武伟、安华山、马军、尹宝山，南平市领导丘毅、林旭阳、何明星、江建华参加有关活动。,19日至20日，甘肃省临夏回族自治州州委书记郭鹤立率党政考察团来南平考察交流。市委书记袁毅会见考察团并座谈交流。 袁毅代表市委市政府对临夏州党政考察团来南平考察表示欢迎，并简要介绍了我市有关情况。他说，近年来临夏州委州政府牢记习近平总书记嘱托，举全州之力向深度贫困堡垒发起总攻，在精准脱贫、项目建设、提振士气等方面采取了一系列创新举措，脱贫攻坚取得决定性成效，民族团结进步、社会安定稳定，经济社会发展迈上了新台阶。这次临夏州党政考察团来南平考察，充分彰显了闽甘两省互帮互学互助的亲密关系，对进一步加强区域交流合作，推动南临两地高质量发展具有重要意义。袁毅说，南平最大的特色是绿色，最具竞争力的优势是生态。当前，我们正深入学习贯彻习近平生态文明思想，积极探索绿水青山转化为金山银山的有效路径，全方位推动绿色发展高质量发展超越。南平与临夏文化生态资源富集、特色优势互补，希望双方以此次考察为契机，进一步加强在脱贫攻坚、文旅产业等领域的交流合作，携手推动两地高质量发展。 郭鹤立对南平市委市政府的精心安排表示感谢，他说，南平山清水秀、人文荟萃，近年来南平市委市政府围绕加快推动绿水青山转化为金山银山，先行先试、创新创业，经济社会发展发生日新月异的变化，特别是创新推进“武夷品牌”“生态银行”“水美经济”建设，为“两山”转化提供了可复制可推广的模式经验，十分值得临夏学习。郭鹤立说，临夏州历史悠久、文化灿烂、风景优美、人杰地灵，是国家重点支持的“三区三州”之一，去年以来我们以超常规的力度和举措推动脱贫攻坚取得决定性成效，全州上下精神振奋、斗志昂扬，有信心夺取脱贫攻坚的最后胜利，与全国全省同步全面建成小康社会。当前，临夏正处在大建设大发展的关键时期，希望通过这次考察学习，将南平的好经验、好做法带回去，助推临夏高质量打赢脱贫攻坚战。 在南平期间，临夏党政考察团一行先后考察了武夷新区、建阳文创产业、武夷山香江名苑、五夫镇“生态银行”建设等。临夏州领导邱武伟、安华山、马军、尹宝山，南平市领导丘毅、林旭阳、何明星、江建华参加有关活动。 扫一扫在手机打开当前页。袁毅代表市委市政府对临夏州党政考察团来南平考察表示欢迎，并简要介绍了我市有关情况。他说，近年来临夏州委州政府牢记习近平总书记嘱托，举全州之力向深度贫困堡垒发起总攻，在精准脱贫、项目建设、提振士气等方面采取了一系列创新举措，脱贫攻坚取得决定性成效，民族团结进步、社会安定稳定，经济社会发展迈上了新台阶。这次临夏州党政考察团来南平考察，充分彰显了闽甘两省互帮互学互助的亲密关系，对进一步加强区域交流合作，推动南临两地高质量发展具有重要意义。袁毅说，南平最大的特色是绿色，最具竞争力的优势是生态。当前，我们正深入学习贯彻习近平生态文明思想，积极探索绿水青山转化为金山银山的有效路径，全方位推动绿色发展高质量发展超越。南平与临夏文化生态资源富集、特色优势互补，希望双方以此次考察为契机，进一步加强在脱贫攻坚、文旅产业等领域的交流合作，携手推动两地高质量发展。。在南平期间，临夏党政考察团一行先后考察了武夷新区、建阳文创产业、武夷山香江名苑、五夫镇“生态银行”建设等。临夏州领导邱武伟、安华山、马军、尹宝山，南平市领导丘毅、林旭阳、何明星、江建华参加有关活动。,政府领导到其他城市考察学习或访问,0.0,True
115,福建省,南平市,认真学习贯彻习近平总书记在江苏考察和在全面推动长江经济带发展座谈会浦东开发开放三十周年庆祝大会上的重要讲话精神,2020-11-22,http://www.np.gov.cn/cms/siteresource/article.shtml?id=430511935703760002&siteId=340328840390080000,"认真学习贯彻习近平总书记在江苏考察和在全面推动长江经济带 发展座谈会、浦东开发开放三十周年庆祝大会上的重要讲话精神 - 南平要闻。20日，市委书记袁毅主持召开市委常委会会议，认真学习贯彻习近平总书记在江苏考察和在全面推动长江经济带发展座谈会、浦东开发开放30周年庆祝大会上的重要讲话精神，研究我市贯彻意见。 会议指出，习近平总书记的重要讲话，立意深远、内涵丰富，深刻阐明了事关当前、关系长远发展的一系列重大理论和实践问题，为我们融入新发展格局，全面推进高水平改革开放，全方位推动绿色高质量发展超越，进一步指明了前进方向、注入了强大动力。我们要深入学习领会,坚决贯彻落实，进一步增强“四个意识”、坚定“四个自信”、做到“两个维护”，切实把思想和行动统一到习近平总书记重要讲话和党中央决策部署上来。 会议强调，要坚持生态优先，更强定力推进绿色发展。坚定不移贯彻新发展理念，认真践行习近平生态文明思想，把保护生态环境摆在更加突出位置，持续深化探索绿水青山转化为金山银山的有效路径，进一步厚植绿色生态、做大绿色经济、推进绿色惠民，促进需求牵引和供给创造有机结合，推动经济社会高质量发展、可持续发展，着力在绿色发展上当先锋、走前列。要坚持系统集成，更大力度深化改革创新。要统筹推进重要领域和关键环节改革，总结提升、系统集成“三大创新”、“放管服”改革、“大督查”等富有南平特色的改革举措，持续放大改革综合效应。要推进市域社会治理现代化，结合创建全国文明城市提名城市，建立健全激励惩戒、群众参与的长效机制，推动治理手段、模式、理念创新，不断提升城市治理水平。要坚持融入大局，更高水平扩大对外开放。进一步打开山门、发挥优势，主动融入长江经济带、长三角一体化发展和“一带一路”、闽东北协同发展区，在服务构建新发展格局中抢先机、育新机。 扫一扫在手机打开当前页。会议指出，习近平总书记的重要讲话，立意深远、内涵丰富，深刻阐明了事关当前、关系长远发展的一系列重大理论和实践问题，为我们融入新发展格局，全面推进高水平改革开放，全方位推动绿色高质量发展超越，进一步指明了前进方向、注入了强大动力。我们要深入学习领会,坚决贯彻落实，进一步增强“四个意识”、坚定“四个自信”、做到“两个维护”，切实把思想和行动统一到习近平总书记重要讲话和党中央决策部署上来。。会议强调，要坚持生态优先，更强定力推进绿色发展。坚定不移贯彻新发展理念，认真践行习近平生态文明思想，把保护生态环境摆在更加突出位置，持续深化探索绿水青山转化为金山银山的有效路径，进一步厚植绿色生态、做大绿色经济、推进绿色惠民，促进需求牵引和供给创造有机结合，推动经济社会高质量发展、可持续发展，着力在绿色发展上当先锋、走前列。要坚持系统集成，更大力度深化改革创新。要统筹推进重要领域和关键环节改革，总结提升、系统集成“三大创新”、“放管服”改革、“大督查”等富有南平特色的改革举措，持续放大改革综合效应。要推进市域社会治理现代化，结合创建全国文明城市提名城市，建立健全激励惩戒、群众参与的长效机制，推动治理手段、模式、理念创新，不断提升城市治理水平。要坚持融入大局，更高水平扩大对外开放。进一步打开山门、发挥优势，主动融入长江经济带、长三角一体化发展和“一带一路”、闽东北协同发展区，在服务构建新发展格局中抢先机、育新机。","认真学习贯彻习近平总书记在江苏考察和在全面推动长江经济带 发展座谈会、浦东开发开放三十周年庆祝大会上的重要讲话精神 - 南平要闻。20日，市委书记袁毅主持召开市委常委会会议，认真学习贯彻习近平总书记在江苏考察和在全面推动长江经济带发展座谈会、浦东开发开放30周年庆祝大会上的重要讲话精神，研究我市贯彻意见。 会议指出，习近平总书记的重要讲话，立意深远、内涵丰富，深刻阐明了事关当前、关系长远发展的一系列重大理论和实践问题，为我们融入新发展格局，全面推进高水平改革开放，全方位推动绿色高质量发展超越，进一步指明了前进方向、注入了强大动力。我们要深入学习领会,坚决贯彻落实，进一步增强“四个意识”、坚定“四个自信”、做到“两个维护”，切实把思想和行动统一到习近平总书记重要讲话和党中央决策部署上来。 会议强调，要坚持生态优先，更强定力推进绿色发展。坚定不移贯彻新发展理念，认真践行习近平生态文明思想，把保护生态环境摆在更加突出位置，持续深化探索绿水青山转化为金山银山的有效路径，进一步厚植绿色生态、做大绿色经济、推进绿色惠民，促进需求牵引和供给创造有机结合，推动经济社会高质量发展、可持续发展，着力在绿色发展上当先锋、走前列。要坚持系统集成，更大力度深化改革创新。要统筹推进重要领域和关键环节改革，总结提升、系统集成“三大创新”、“放管服”改革、“大督查”等富有南平特色的改革举措，持续放大改革综合效应。要推进市域社会治理现代化，结合创建全国文明城市提名城市，建立健全激励惩戒、群众参与的长效机制，推动治理手段、模式、理念创新，不断提升城市治理水平。要坚持融入大局，更高水平扩大对外开放。进一步打开山门、发挥优势，主动融入长江经济带、长三角一体化发展和“一带一路”、闽东北协同发展区，在服务构建新发展格局中抢先机、育新机。 扫一扫在手机打开当前页。会议指出，习近平总书记的重要讲话，立意深远、内涵丰富，深刻阐明了事关当前、关系长远发展的一系列重大理论和实践问题，为我们融入新发展格局，全面推进高水平改革开放，全方位推动绿色高质量发展超越，进一步指明了前进方向、注入了强大动力。我们要深入学习领会,坚决贯彻落实，进一步增强“四个意识”、坚定“四个自信”、做到“两个维护”，切实把思想和行动统一到习近平总书记重要讲话和党中央决策部署上来。。会议强调，要坚持生态优先，更强定力推进绿色发展。坚定不移贯彻新发展理念，认真践行习近平生态文明思想，把保护生态环境摆在更加突出位置，持续深化探索绿水青山转化为金山银山的有效路径，进一步厚植绿色生态、做大绿色经济、推进绿色惠民，促进需求牵引和供给创造有机结合，推动经济社会高质量发展、可持续发展，着力在绿色发展上当先锋、走前列。要坚持系统集成，更大力度深化改革创新。要统筹推进重要领域和关键环节改革，总结提升、系统集成“三大创新”、“放管服”改革、“大督查”等富有南平特色的改革举措，持续放大改革综合效应。要推进市域社会治理现代化，结合创建全国文明城市提名城市，建立健全激励惩戒、群众参与的长效机制，推动治理手段、模式、理念创新，不断提升城市治理水平。要坚持融入大局，更高水平扩大对外开放。进一步打开山门、发挥优势，主动融入长江经济带、长三角一体化发展和“一带一路”、闽东北协同发展区，在服务构建新发展格局中抢先机、育新机。",其他,0.5356066607854885,True
115,福建省,南平市,认真学习贯彻习近平总书记在深圳经济特区建立周年庆祝大会上和在广东考察时的重要讲话精神,2020-10-20,http://www.np.gov.cn/cms/siteresource/article.shtml?id=430509057185180000&siteId=340328840390080000,认真学习贯彻习近平总书记在深圳经济特区建立40周年庆祝大会上和在广东考察时的重要讲话精神 - 南平要闻。19日，市委书记袁毅主持召开市委常委会（扩大）会议，认真学习贯彻习近平总书记在深圳经济特区建立40周年庆祝大会上和在广东考察时的重要讲话精神及《中共中央办公厅、国务院办公厅<关于印发《深圳建设中国特色社会主义先行示范区综合改革试点实施方案（2020-2025年）》>的通知》精神，研究我市贯彻意见。市委副书记、市长袁超洪，市人大常委会主任罗志坚、市政协主席黄健平出席会议。 会议指出，习近平总书记的重要讲话，高屋建瓴、思想深邃、内涵丰富，既是对深圳经济特区和广东的重要要求，也是对各地各部门的重要要求，更是向世界宣示中国改革不停顿、开放不止步。全市各级各部门要认真学习贯彻习近平总书记重要讲话精神，秉承习近平总书记在福建工作时关于改革开放和特区建设的重要理念、重大实践，增强“四个意识”、坚定“四个自信”、做到“两个维护”，学习借鉴深圳特区建设先进经验，全方位推动绿色高质量发展超越。 会议强调，要对标深圳特区，更大力度推进解放思想。持续深化学深圳活动，学习敢闯敢试、敢为人先、埋头苦干的特区精神，强化拼闯意识，激发干事热情，努力在发挥优势中抢抓机遇，在先行先试中开拓进取，集中精力办好南平的事情。要聚焦绿色发展，更新理念推进创新突破。紧扣全方位推动绿色高质量发展超越，保持定力、久久为功，守正创新、系统集成，加快把绿水青山转化为金山银山，打造绿色生态的城市标杆，创建领跑全国的绿色品牌，努力做“两山”转化、创新创业的先行者。要勇于打开山门，更高起点推进改革开放。坚持供给侧结构性改革这条主线，积极融入国家生态文明试验区建设，蹄疾步稳深化重要领域和关键环节改革。要提升开放水平，积极承接福建“多区叠加”政策辐射，做好“侨”的文章，主动走出去、请进来，为南平发展注入更多动力活力。要加强党的全面领导，引导广大党员干部坚定理想信念、更新知识观念、掌握过硬本领，确保新时代改革开放行稳致远。 会议强调，要坚决贯彻党中央战略部署，进一步真抓实干、奋发进取，围绕选准做优七大绿色产业，顺应市场变化，深挖消费需求，引导企业找准定位、自主创新，积极融入“双循环”新发展格局，走更高水平的自力更生之路。要以筹办世界遗产大会为契机，进一步加强非物质文化遗产保护和传承，深入挖掘武夷茶文化、闽越文化、建盏建本文化、红色文化等，让传统文化绽放出更加迷人的光彩。要真抓实干践行以人民为中心的发展思想，办好民生实事，提升城市治理水平，努力让群众有更多幸福感获得感安全感。 扫一扫在手机打开当前页。会议指出，习近平总书记的重要讲话，高屋建瓴、思想深邃、内涵丰富，既是对深圳经济特区和广东的重要要求，也是对各地各部门的重要要求，更是向世界宣示中国改革不停顿、开放不止步。全市各级各部门要认真学习贯彻习近平总书记重要讲话精神，秉承习近平总书记在福建工作时关于改革开放和特区建设的重要理念、重大实践，增强“四个意识”、坚定“四个自信”、做到“两个维护”，学习借鉴深圳特区建设先进经验，全方位推动绿色高质量发展超越。,认真学习贯彻习近平总书记在深圳经济特区建立40周年庆祝大会上和在广东考察时的重要讲话精神 - 南平要闻。19日，市委书记袁毅主持召开市委常委会（扩大）会议，认真学习贯彻习近平总书记在深圳经济特区建立40周年庆祝大会上和在广东考察时的重要讲话精神及《中共中央办公厅、国务院办公厅<关于印发《深圳建设中国特色社会主义先行示范区综合改革试点实施方案（2020-2025年）》>的通知》精神，研究我市贯彻意见。市委副书记、市长袁超洪，市人大常委会主任罗志坚、市政协主席黄健平出席会议。 会议指出，习近平总书记的重要讲话，高屋建瓴、思想深邃、内涵丰富，既是对深圳经济特区和广东的重要要求，也是对各地各部门的重要要求，更是向世界宣示中国改革不停顿、开放不止步。全市各级各部门要认真学习贯彻习近平总书记重要讲话精神，秉承习近平总书记在福建工作时关于改革开放和特区建设的重要理念、重大实践，增强“四个意识”、坚定“四个自信”、做到“两个维护”，学习借鉴深圳特区建设先进经验，全方位推动绿色高质量发展超越。 会议强调，要对标深圳特区，更大力度推进解放思想。持续深化学深圳活动，学习敢闯敢试、敢为人先、埋头苦干的特区精神，强化拼闯意识，激发干事热情，努力在发挥优势中抢抓机遇，在先行先试中开拓进取，集中精力办好南平的事情。要聚焦绿色发展，更新理念推进创新突破。紧扣全方位推动绿色高质量发展超越，保持定力、久久为功，守正创新、系统集成，加快把绿水青山转化为金山银山，打造绿色生态的城市标杆，创建领跑全国的绿色品牌，努力做“两山”转化、创新创业的先行者。要勇于打开山门，更高起点推进改革开放。坚持供给侧结构性改革这条主线，积极融入国家生态文明试验区建设，蹄疾步稳深化重要领域和关键环节改革。要提升开放水平，积极承接福建“多区叠加”政策辐射，做好“侨”的文章，主动走出去、请进来，为南平发展注入更多动力活力。要加强党的全面领导，引导广大党员干部坚定理想信念、更新知识观念、掌握过硬本领，确保新时代改革开放行稳致远。 会议强调，要坚决贯彻党中央战略部署，进一步真抓实干、奋发进取，围绕选准做优七大绿色产业，顺应市场变化，深挖消费需求，引导企业找准定位、自主创新，积极融入“双循环”新发展格局，走更高水平的自力更生之路。要以筹办世界遗产大会为契机，进一步加强非物质文化遗产保护和传承，深入挖掘武夷茶文化、闽越文化、建盏建本文化、红色文化等，让传统文化绽放出更加迷人的光彩。要真抓实干践行以人民为中心的发展思想，办好民生实事，提升城市治理水平，努力让群众有更多幸福感获得感安全感。 扫一扫在手机打开当前页。会议指出，习近平总书记的重要讲话，高屋建瓴、思想深邃、内涵丰富，既是对深圳经济特区和广东的重要要求，也是对各地各部门的重要要求，更是向世界宣示中国改革不停顿、开放不止步。全市各级各部门要认真学习贯彻习近平总书记重要讲话精神，秉承习近平总书记在福建工作时关于改革开放和特区建设的重要理念、重大实践，增强“四个意识”、坚定“四个自信”、做到“两个维护”，学习借鉴深圳特区建设先进经验，全方位推动绿色高质量发展超越。,其他,0.5351272981075739,True
