code,province,city,topic,date,url,content,content.1,label,score,is_match
113,福建省,泉州市,鲤城组团赴京苏等地考察学习,2023-04-14,http://www.quanzhou.gov.cn/zfb/xxgk/zfxxgkzl/ztzl/yshjzchj/xsqzf/lcq/202305/t20230505_2876462.htm,为贯彻落实省委“深学争优、敢为争先、实干争效”行动精神，推动鲤城区行政审批制度改革全面深化，3月6日-3月10日，鲤城区人大常委会主任林清泉带队赴北京、江苏等地，考察学习各地在行政审批制度改革、“互联网+政务服务”、政务服务中心建设、营商环境提升等方面的经验做法。区政府副区长吴小纲参加。。在北京市东城区政务服务中心，考察团一行深入了解该中心推行事项颗粒化梳理、综合受理、“一业一证”及“一件事”等改革举措。据悉，东城区已对全区67项“证照分离”改革事项、改革类型进行核查，更好解决市场主体“准入不准营”问题，有效提升大厅政务服务效能。。在江苏省宿迁市政务服务中心，考察团一行实地参观“一件事一次办”专区、帮扶救助中心、政务公开互动体验区等区域，详细了解该中心“超级管理员政务数据有序共享改革”项目的经验做法。据悉，为破解数据共享难题，宿迁首创超级管理员制度，通过开设“市长账号”方式，实现高频政务数据通畅补充调用，为企业群众办事提供便利。该项改革荣获国家2021政府信息化大会创新奖，被评为江苏省法治政府建设示范项目。。在南京市鼓楼区政务服务中心，考察团一行全面了解该中心深化“不见面审批”模式、推进“证照分离”改革等经验做法。据了解，该中心依托“政务版微信”，窗口人员化身云上“小鼓”，在线为企业提供“一对一”服务，并通过提供“鼓利您”818创业宝典，帮助企业快捷办理登记注册等高频事项。同时，该中心开创项目审批新模式，通过电子通道、视频通道、电子签字等形式，推行“容缺审批”“不见面审批”、全流程电子化交易，大大提升审批效率。。以此次考察学习为契机，鲤城区政务服务中心分别与江苏省宿迁市政务服务中心、南京市鼓楼区政务服务中心签署“跨省通办”合作协议，将实现77项政务服务事项“跨省通办”。今后，合作双方将聚焦企业群众办事需求，共同梳理推出“跨省通办”事项清单，并不断优化“跨省通办”办事指南，进一步提升政务服务水平。。他山之石，可以攻玉。每到一处，考察团都积极求经问道，吸取各地的先进经验和做法，为鲤城区深化行政审批制度改革、优化营商环境拓展思路。考察团表示，此次考察行程满满、收获多多，各地的做法具有很强的启发性和针对性，值得学习借鉴。下一步，将结合此次考察学习的所见所思所得，对标先进地区，结合鲤城实际，聚焦重点领域和关键环节，不断探索行政审批服务再改革、再优化、再提升的工作新思路、新机制、新方法，持续深化行政审批制度改革。进一步出台促进优化营商环境的相关措施，以提升良好营商环境，充分激发鲤城发展潜力和活力。,为贯彻落实省委“深学争优、敢为争先、实干争效”行动精神，推动鲤城区行政审批制度改革全面深化，3月6日-3月10日，鲤城区人大常委会主任林清泉带队赴北京、江苏等地，考察学习各地在行政审批制度改革、“互联网+政务服务”、政务服务中心建设、营商环境提升等方面的经验做法。区政府副区长吴小纲参加。。在北京市东城区政务服务中心，考察团一行深入了解该中心推行事项颗粒化梳理、综合受理、“一业一证”及“一件事”等改革举措。据悉，东城区已对全区67项“证照分离”改革事项、改革类型进行核查，更好解决市场主体“准入不准营”问题，有效提升大厅政务服务效能。。在江苏省宿迁市政务服务中心，考察团一行实地参观“一件事一次办”专区、帮扶救助中心、政务公开互动体验区等区域，详细了解该中心“超级管理员政务数据有序共享改革”项目的经验做法。据悉，为破解数据共享难题，宿迁首创超级管理员制度，通过开设“市长账号”方式，实现高频政务数据通畅补充调用，为企业群众办事提供便利。该项改革荣获国家2021政府信息化大会创新奖，被评为江苏省法治政府建设示范项目。。在南京市鼓楼区政务服务中心，考察团一行全面了解该中心深化“不见面审批”模式、推进“证照分离”改革等经验做法。据了解，该中心依托“政务版微信”，窗口人员化身云上“小鼓”，在线为企业提供“一对一”服务，并通过提供“鼓利您”818创业宝典，帮助企业快捷办理登记注册等高频事项。同时，该中心开创项目审批新模式，通过电子通道、视频通道、电子签字等形式，推行“容缺审批”“不见面审批”、全流程电子化交易，大大提升审批效率。。以此次考察学习为契机，鲤城区政务服务中心分别与江苏省宿迁市政务服务中心、南京市鼓楼区政务服务中心签署“跨省通办”合作协议，将实现77项政务服务事项“跨省通办”。今后，合作双方将聚焦企业群众办事需求，共同梳理推出“跨省通办”事项清单，并不断优化“跨省通办”办事指南，进一步提升政务服务水平。。他山之石，可以攻玉。每到一处，考察团都积极求经问道，吸取各地的先进经验和做法，为鲤城区深化行政审批制度改革、优化营商环境拓展思路。考察团表示，此次考察行程满满、收获多多，各地的做法具有很强的启发性和针对性，值得学习借鉴。下一步，将结合此次考察学习的所见所思所得，对标先进地区，结合鲤城实际，聚焦重点领域和关键环节，不断探索行政审批服务再改革、再优化、再提升的工作新思路、新机制、新方法，持续深化行政审批制度改革。进一步出台促进优化营商环境的相关措施，以提升良好营商环境，充分激发鲤城发展潜力和活力。,政府领导到其他城市考察学习或访问,0.8221186070799765,True
113,福建省,泉州市,收获满满鲤城组团赴京苏等地考察学习,2023-03-14,http://www.qzlc.gov.cn/xxgk/gzdt/lcxw/202303/t20230314_2856972.htm,为贯彻落实省委“深学争优、敢为争先、实干争效”行动精神，推动我区行政审批制度改革全面深化，3月6日-3月10日，区人大常委会主任林清泉带队赴北京、江苏等地，考察学习各地在行政审批制度改革、“互联网+政务服务”、政务服务中心建设、营商环境提升等方面的经验做法。区政府副区长吴小纲参加。。在北京市东城区政务服务中心，考察团一行深入了解该中心推行事项颗粒化梳理、综合受理、“一业一证”及“一件事”等改革举措。据悉，东城区已对全区67项“证照分离”改革事项、改革类型进行核查，更好解决市场主体“准入不准营”问题，有效提升大厅政务服务效能。。在江苏省宿迁市政务服务中心，考察团一行实地参观“一件事一次办”专区、帮扶救助中心、政务公开互动体验区等区域，详细了解该中心“超级管理员政务数据有序共享改革”项目的经验做法。据悉，为破解数据共享难题，宿迁首创超级管理员制度，通过开设“市长账号”方式，实现高频政务数据通畅补充调用，为企业群众办事提供便利。该项改革荣获国家2021政府信息化大会创新奖，被评为江苏省法治政府建设示范项目。。在南京市鼓楼区政务服务中心，考察团一行全面了解该中心深化“不见面审批”模式、推进“证照分离”改革等经验做法。据了解，该中心依托“政务版微信”，窗口人员化身云上“小鼓”，在线为企业提供“一对一”服务，并通过提供“鼓利您”818创业宝典，帮助企业快捷办理登记注册等高频事项。同时，该中心开创项目审批新模式，通过电子通道、视频通道、电子签字等形式，推行“容缺审批”“不见面审批”、全流程电子化交易，大大提升审批效率。。以此次考察学习为契机，鲤城区政务服务中心分别与江苏省宿迁市政务服务中心、南京市鼓楼区政务服务中心签署“跨省通办”合作协议，将实现77项政务服务事项“跨省通办”。今后，合作双方将聚焦企业群众办事需求，共同梳理推出“跨省通办”事项清单，并不断优化“跨省通办”办事指南，进一步提升政务服务水平。。他山之石，可以攻玉。每到一处，考察团都积极求经问道，吸取各地的先进经验和做法，为我区深化行政审批制度改革、优化营商环境开拓思路。考察团表示，此次考察行程满满、收获多多，各地的做法具有很强的启发性和针对性，值得学习借鉴。下一步，将结合此次考察学习的所见所思所得，对标先进地区，结合鲤城实际，聚焦重点领域和关键环节，不断探索行政审批服务再改革、再优化、再提升的工作新思路、新机制、新方法，持续深化行政审批制度改革。进一步出台促进优化营商环境的相关措施，以提升良好营商环境，充分激发鲤城发展潜力和活力。,为贯彻落实省委“深学争优、敢为争先、实干争效”行动精神，推动我区行政审批制度改革全面深化，3月6日-3月10日，区人大常委会主任林清泉带队赴北京、江苏等地，考察学习各地在行政审批制度改革、“互联网+政务服务”、政务服务中心建设、营商环境提升等方面的经验做法。区政府副区长吴小纲参加。。在北京市东城区政务服务中心，考察团一行深入了解该中心推行事项颗粒化梳理、综合受理、“一业一证”及“一件事”等改革举措。据悉，东城区已对全区67项“证照分离”改革事项、改革类型进行核查，更好解决市场主体“准入不准营”问题，有效提升大厅政务服务效能。。在江苏省宿迁市政务服务中心，考察团一行实地参观“一件事一次办”专区、帮扶救助中心、政务公开互动体验区等区域，详细了解该中心“超级管理员政务数据有序共享改革”项目的经验做法。据悉，为破解数据共享难题，宿迁首创超级管理员制度，通过开设“市长账号”方式，实现高频政务数据通畅补充调用，为企业群众办事提供便利。该项改革荣获国家2021政府信息化大会创新奖，被评为江苏省法治政府建设示范项目。。在南京市鼓楼区政务服务中心，考察团一行全面了解该中心深化“不见面审批”模式、推进“证照分离”改革等经验做法。据了解，该中心依托“政务版微信”，窗口人员化身云上“小鼓”，在线为企业提供“一对一”服务，并通过提供“鼓利您”818创业宝典，帮助企业快捷办理登记注册等高频事项。同时，该中心开创项目审批新模式，通过电子通道、视频通道、电子签字等形式，推行“容缺审批”“不见面审批”、全流程电子化交易，大大提升审批效率。。以此次考察学习为契机，鲤城区政务服务中心分别与江苏省宿迁市政务服务中心、南京市鼓楼区政务服务中心签署“跨省通办”合作协议，将实现77项政务服务事项“跨省通办”。今后，合作双方将聚焦企业群众办事需求，共同梳理推出“跨省通办”事项清单，并不断优化“跨省通办”办事指南，进一步提升政务服务水平。。他山之石，可以攻玉。每到一处，考察团都积极求经问道，吸取各地的先进经验和做法，为我区深化行政审批制度改革、优化营商环境开拓思路。考察团表示，此次考察行程满满、收获多多，各地的做法具有很强的启发性和针对性，值得学习借鉴。下一步，将结合此次考察学习的所见所思所得，对标先进地区，结合鲤城实际，聚焦重点领域和关键环节，不断探索行政审批服务再改革、再优化、再提升的工作新思路、新机制、新方法，持续深化行政审批制度改革。进一步出台促进优化营商环境的相关措施，以提升良好营商环境，充分激发鲤城发展潜力和活力。,政府领导到其他城市考察学习或访问,0.8341299651662334,True
113,福建省,泉州市,再学习再调研再落实鲤城区陈志慧副区长带队考察晋江梧林古村落,2021-03-06,http://www.qzlc.gov.cn/zwgk/qzbm/wtly/gzdt/202103/t20210316_2525114.htm,【再学习、再调研、再落实】鲤城区陈志慧副区长带队考察晋江梧林古村落-鲤城区人民政府。为传达贯彻省、市、区 “再学习、再调研、再落实”相关会议精神，推动鲤城区文旅产业发展，3月4日，陈志慧副区长带队到晋江梧林考察学习旅游古村落开发建设情况 。考察团一行实地观摩了当地的洋楼、闽南官式大厝、番仔楼等建筑群的保护利用情况，并召开现场座谈会，就传统村落保护、文旅市场运营管理等进行经验交流。 座谈会上，晋江市黄少伟副市长详细介绍了梧林古村落的保护发展规划、控股模式、运营方式及业态布局。陈志慧副区长指出，梧林古村落的开发建设对鲤城区文旅产业发展有着重要的借鉴意义。鲤城区有丰富的历史文化资源，具备发展文旅产业的天然优势。要求鲤城区各相关部门要大力发展文化旅游产业，一是 积极盘活如高山古村落、常泰99间、聚宝城南、王顺兴信局等特色建筑，坚持活态保护方式，合理进行开发利用。二是 由政府主导，引入社会资本、专业团队共同进行开发，合理布局业态，避免无序竞争。三是引入文创、非遗等高端文旅业态，让传统建筑鲜活时尚、焕发生机，做到 “留人留形留乡愁，见人见物见生活”。。“再学习、再调研、再落实”相关会议精神，推动鲤城区文旅产业发展，3月4日，陈志慧副区长带队到晋江梧林考察学习旅游。。考察团一行实地观摩了当地的洋楼、闽南官式大厝、番仔楼等建筑群的保护利用情况，并召开现场座谈会，就传统村落保护、文旅市场运营管理等进行经验交流。。座谈会上，晋江市黄少伟副市长详细介绍了梧林古村落的保护发展规划、控股模式、运营方式及业态布局。陈志慧副区长指出，梧林古村落的开发建设对鲤城区文旅产业发展有着重要的借鉴意义。鲤城区有丰富的历史文化资源，具备发展文旅产业的天然优势。要求鲤城区各相关部门要大力发展文化旅游产业，。积极盘活如高山古村落、常泰99间、聚宝城南、王顺兴信局等特色建筑，坚持活态保护方式，合理进行开发利用。,【再学习、再调研、再落实】鲤城区陈志慧副区长带队考察晋江梧林古村落-鲤城区人民政府。为传达贯彻省、市、区 “再学习、再调研、再落实”相关会议精神，推动鲤城区文旅产业发展，3月4日，陈志慧副区长带队到晋江梧林考察学习旅游古村落开发建设情况 。考察团一行实地观摩了当地的洋楼、闽南官式大厝、番仔楼等建筑群的保护利用情况，并召开现场座谈会，就传统村落保护、文旅市场运营管理等进行经验交流。 座谈会上，晋江市黄少伟副市长详细介绍了梧林古村落的保护发展规划、控股模式、运营方式及业态布局。陈志慧副区长指出，梧林古村落的开发建设对鲤城区文旅产业发展有着重要的借鉴意义。鲤城区有丰富的历史文化资源，具备发展文旅产业的天然优势。要求鲤城区各相关部门要大力发展文化旅游产业，一是 积极盘活如高山古村落、常泰99间、聚宝城南、王顺兴信局等特色建筑，坚持活态保护方式，合理进行开发利用。二是 由政府主导，引入社会资本、专业团队共同进行开发，合理布局业态，避免无序竞争。三是引入文创、非遗等高端文旅业态，让传统建筑鲜活时尚、焕发生机，做到 “留人留形留乡愁，见人见物见生活”。。“再学习、再调研、再落实”相关会议精神，推动鲤城区文旅产业发展，3月4日，陈志慧副区长带队到晋江梧林考察学习旅游。。考察团一行实地观摩了当地的洋楼、闽南官式大厝、番仔楼等建筑群的保护利用情况，并召开现场座谈会，就传统村落保护、文旅市场运营管理等进行经验交流。。座谈会上，晋江市黄少伟副市长详细介绍了梧林古村落的保护发展规划、控股模式、运营方式及业态布局。陈志慧副区长指出，梧林古村落的开发建设对鲤城区文旅产业发展有着重要的借鉴意义。鲤城区有丰富的历史文化资源，具备发展文旅产业的天然优势。要求鲤城区各相关部门要大力发展文化旅游产业，。积极盘活如高山古村落、常泰99间、聚宝城南、王顺兴信局等特色建筑，坚持活态保护方式，合理进行开发利用。,政府领导到其他城市考察学习或访问,0.0,True
113,福建省,泉州市,学习贯彻总书记来闽考察重要讲话精神高质量开展好党史学习教育,2021-06-29,http://www.nanan.gov.cn/zwgk/xwzx/nayw/202106/t20210629_2579763.htm,学习贯彻总书记来闽考察重要讲话精神 高质量开展好党史学习教育-南安要闻-新闻中心-政务公开-南安市人民政府。25日，市管领导干部学习贯彻习近平总书记来闽考察重要讲话精神专题研讨班暨市级领导班子党史学习教育专题读书班开班。。南安市委书记林荣忠作动员讲话，党史学习教育泉州市委第五巡回指导组副组长周明星，张桂森、洪顺昌、黄华强、王连赞等南安市四套班子在家领导参加会议。。林荣忠强调，要持续深入学习贯彻习近平总书记来闽考察重要讲话精神，把习近平总书记来闽考察重要讲话精神，与习近平总书记对福建、对泉州、对南安工作的一系列重要讲话重要指示批示精神紧密结合起来，作为有机统一的整体学习领悟，系统学习、学出感情、学做结合，把学习成效体现到增强党性、提高能力、推动工作上来。要高质量开展好党史学习教育，严格对标对表，将规定动作做到位，将自选工作做出色，深入挖掘本地资源，用活地方党史，讲好南安故事，深入开展“我为群众办实事”“我为企业解难题”“我为社会做好事”实践活动，精心策划实施“七一”主题活动，不断把资源优势转化成南安新一轮发展的胜势。。林荣忠要求，要落深落细“再学习、再调研、再落实”活动，抓调研成果转化、健全完善工作机制、突出实践实效，把“再学习、再调研、再落实”活动过程变成找问题短板、谋工作思路、抓工作落实的过程，变成调动干部积极性、鼓干劲抓发展的过程，以更大的力度推动活动往深里走、往实里走。。开班后，林荣忠还为与会人员上了一堂专题党史党课，围绕新民主主义革命时期、社会主义革命和建设时期、改革开放和社会主义现代化建设新时期、中国特色社会主义新时代等“四个时期”，系统回顾了中国共产党百年奋斗的光辉历程和历史性贡献，阐述了各个时期南安的革命史和发展史，全面解读了各个时期南安的贡献和成就。。林荣忠表示，作为东南沿海最具活力和吸引力的现代城市，当前的南安迎来了崭新的、最有价值、最难得的黄金发展机遇期，正朝着现代化南安建设新征程阔步前行，我们比以往任何时期，都更有条件、更有能力、更有机会创造发展“新奇迹”。。林荣忠强调，翻开百年党史，既是要回顾百年光辉历程，更要从中汲取前行的智慧和力量。希望大家认真学习党史、地方史，用心领悟宝贵的精神财富，把伟大的苏区精神，转化成更加饱满的热情、更加昂扬的斗志、更加务实的举措，投入推进南安全方位高质量发展超越实践中去，在新时代再立新功、再谱新篇！。开班当天，泉州市委讲师团四级调研员、副教授童宝平作了《在党史学习教育中做到学史明理——学习贯彻习近平总书记在福建考察时的重要讲话精神》专题辅导报告，中央党校国际战略研究院全球治理与国际组织研究所副所长、副教授熊洁作了《世界大变局与发展新格局》专题辅导报告。,学习贯彻总书记来闽考察重要讲话精神 高质量开展好党史学习教育-南安要闻-新闻中心-政务公开-南安市人民政府。25日，市管领导干部学习贯彻习近平总书记来闽考察重要讲话精神专题研讨班暨市级领导班子党史学习教育专题读书班开班。。南安市委书记林荣忠作动员讲话，党史学习教育泉州市委第五巡回指导组副组长周明星，张桂森、洪顺昌、黄华强、王连赞等南安市四套班子在家领导参加会议。。林荣忠强调，要持续深入学习贯彻习近平总书记来闽考察重要讲话精神，把习近平总书记来闽考察重要讲话精神，与习近平总书记对福建、对泉州、对南安工作的一系列重要讲话重要指示批示精神紧密结合起来，作为有机统一的整体学习领悟，系统学习、学出感情、学做结合，把学习成效体现到增强党性、提高能力、推动工作上来。要高质量开展好党史学习教育，严格对标对表，将规定动作做到位，将自选工作做出色，深入挖掘本地资源，用活地方党史，讲好南安故事，深入开展“我为群众办实事”“我为企业解难题”“我为社会做好事”实践活动，精心策划实施“七一”主题活动，不断把资源优势转化成南安新一轮发展的胜势。。林荣忠要求，要落深落细“再学习、再调研、再落实”活动，抓调研成果转化、健全完善工作机制、突出实践实效，把“再学习、再调研、再落实”活动过程变成找问题短板、谋工作思路、抓工作落实的过程，变成调动干部积极性、鼓干劲抓发展的过程，以更大的力度推动活动往深里走、往实里走。。开班后，林荣忠还为与会人员上了一堂专题党史党课，围绕新民主主义革命时期、社会主义革命和建设时期、改革开放和社会主义现代化建设新时期、中国特色社会主义新时代等“四个时期”，系统回顾了中国共产党百年奋斗的光辉历程和历史性贡献，阐述了各个时期南安的革命史和发展史，全面解读了各个时期南安的贡献和成就。。林荣忠表示，作为东南沿海最具活力和吸引力的现代城市，当前的南安迎来了崭新的、最有价值、最难得的黄金发展机遇期，正朝着现代化南安建设新征程阔步前行，我们比以往任何时期，都更有条件、更有能力、更有机会创造发展“新奇迹”。。林荣忠强调，翻开百年党史，既是要回顾百年光辉历程，更要从中汲取前行的智慧和力量。希望大家认真学习党史、地方史，用心领悟宝贵的精神财富，把伟大的苏区精神，转化成更加饱满的热情、更加昂扬的斗志、更加务实的举措，投入推进南安全方位高质量发展超越实践中去，在新时代再立新功、再谱新篇！。开班当天，泉州市委讲师团四级调研员、副教授童宝平作了《在党史学习教育中做到学史明理——学习贯彻习近平总书记在福建考察时的重要讲话精神》专题辅导报告，中央党校国际战略研究院全球治理与国际组织研究所副所长、副教授熊洁作了《世界大变局与发展新格局》专题辅导报告。,其他,0.583690437794224,True
