code,province,city,topic,date,url,content,content.1,label,score,is_match
113,福建省,泉州市,党史学习教育泉州市委第巡回指导组来南安巡回指导,2021-05-17,http://www.nanan.gov.cn/zwgk/xwzx/nayw/202105/t20210517_2558763.htm,党史学习教育泉州市委第5巡回指导组来南安巡回指导-南安要闻-新闻中心-政务公开-南安市人民政府。南安市委党史学习教育领导小组组长、副组长、成员，各乡镇（街道、开发区）党委（党工委）党史学习教育领导小组组长参加会议。。会上，南安市委书记、市委党史学习教育领导小组组长林荣忠汇报南安市前一阶段党史学习教育工作情况及下一步工作计划。。泉州市委第5巡回指导组组长庄金平对南安党史学习教育开展以来所取得的成效表示肯定，并作了指导讲话。他强调，要进一步提高政治站位，认真学习贯彻习近平总书记在党史学习教育动员大会上的重要讲话精神，进一步学深悟透习近平总书记来闽考察期间重要讲话精神，把握目标任务，突出工作重点，高标准高质量完成党史学习教育各项任务，真正做到学习教育无盲区、无遗漏、全覆盖，以实际行动增强“四个意识”、坚定“四个自信”、做到“两个维护”。要进一步加强组织领导，各级领导干部要发挥关键少数表率带头作用，先学一步、学深一层，以身作则、以上率下，形成一层抓一层、层层抓学习的良好局面，进一步健全完善领导小组办公室各项机制，抓紧培训本级巡回指导组下沉基层开展指导督导，推动学习教育高质量完成。要进一步创新方式方法，因地制宜开展特色鲜明、形式多样的学习教育，让学习教育接地气、入人心，要将党史学习教育与推动非公企业高质量发展结合起来，进一步抓好流动党员、非公有制组织和社会组织党员的主题教育。要进一步深化实践活动，坚持以人民为中心的发展思路，持续深入开展“我为群众办实事”实践活动，把学习党史同总结经验、观照现实、推动工作结合起来，立足南安实际，用心、用情、用力解决群众急难愁盼等具体问题，结合推进“再学习、再调研、再落实”活动，大力弘扬“四下基层”“四个万家”优良作风，力戒形式主义，鼓励提升实践活动实效，确实把实践活动办好，把好事做实，真正让群众实实在在地看到变化，得到实惠。。林荣忠指出，党史学习教育泉州市委第5巡回指导组来南安巡回指导，将有力推动南安市党史学习教育不断引向深入。他表示，南安市将以此次巡回指导为契机，严格对标对表，以更高要求做实党史学习教育，把接受指导督导的过程转化为发现问题、改进工作、提升水平的过程，对巡回指导组指出的问题、提出的建议照单全收、立行立改，不折不扣地抓好落实，确保件件有着落、事事有回音。坚持以上率下，以更高标准做实党史学习教育，注重发挥市领导的头雁效应，带头参加专题学习、带头上台讲好专题党课、带头为群众办实事解难题，用关键少数带动绝大多数。突出以学促干，以更高质量做实党史学习教育，把开展党史学习教育与学习贯彻习近平总书记来闽考察重要讲话精神的具体行动结合起来，与全方位推动南安高质量发展超越的目标任务结合起来，统筹做好“五促一防一控”工作，以“十四五”开好局起好步的优异成绩检验学习教育成果。,泉州市政府党组理论学习中心组（扩大）学习会召开-图片新闻-泉州动态-政府信息公开-政务公开-泉州市人民政府。18日，市政府党组书记、市长蔡战胜主持召开市政府党组理论学习中心组（扩大）学习会，邀请招商银行首席经济学家丁安华作宏观经济与金融专题报告。。会上，丁安华用通俗易懂的语言和丰富翔实的事例，对货币、财政、金融等政策进行详细解读，并就全球资本市场走势和中国经济展望发表了自己的观点，令在场干部深受启发、收获良多。。蔡战胜强调，要深入学习贯彻习近平总书记关于金融工作的重要论述，充分认识当前经济发展环境的复杂性、严峻性、不确定性，全力做好“两稳一保一防”工作，确保经济运行在合理区间。要抓住有利窗口期，聚焦城市品质提升、工业（产业）园区标准化、民生保障等重点领域，进一步加大政府专项债券争取和使用力度，为项目建设提供有力资金保障。各级领导干部要牢牢抓住金融这个经济发展的“牛鼻子”，用心学金融、努力懂金融、善于用金融，切实掌握应知应会知识，用好用活各项金融政策和金融工具，不断提升金融服务实体经济发展的质效，助力“强产业、兴城市”。,其他,0.5699499388811623,True
113,福建省,泉州市,泉州市政府党组理论学习中心组扩大学习会召开,2022-07-20,http://www.quanzhou.gov.cn/zfb/xxgk/zfxxgkzl/qzdt/tpxw/202207/t20220720_2752721.htm,泉州市政府党组理论学习中心组（扩大）学习会召开-图片新闻-泉州动态-政府信息公开-政务公开-泉州市人民政府。18日，市政府党组书记、市长蔡战胜主持召开市政府党组理论学习中心组（扩大）学习会，邀请招商银行首席经济学家丁安华作宏观经济与金融专题报告。。会上，丁安华用通俗易懂的语言和丰富翔实的事例，对货币、财政、金融等政策进行详细解读，并就全球资本市场走势和中国经济展望发表了自己的观点，令在场干部深受启发、收获良多。。蔡战胜强调，要深入学习贯彻习近平总书记关于金融工作的重要论述，充分认识当前经济发展环境的复杂性、严峻性、不确定性，全力做好“两稳一保一防”工作，确保经济运行在合理区间。要抓住有利窗口期，聚焦城市品质提升、工业（产业）园区标准化、民生保障等重点领域，进一步加大政府专项债券争取和使用力度，为项目建设提供有力资金保障。各级领导干部要牢牢抓住金融这个经济发展的“牛鼻子”，用心学金融、努力懂金融、善于用金融，切实掌握应知应会知识，用好用活各项金融政策和金融工具，不断提升金融服务实体经济发展的质效，助力“强产业、兴城市”。,泉州市新增3个省级党史学习教育参观学习点-泉州要闻-泉州动态-政府信息公开-政务公开-泉州市人民政府。近日，省委党史学习教育领导小组办公室公布20个第三批党史学习教育参观学习点。泉州市的中国闽台缘博物馆、安溪县安南永德苏维埃政府旧址、安溪县城厢镇经兜村3个点入选。。省委党史学习教育领导小组办公室要求，各级党组织要持续推动党史学习教育往深里走、往心里走、往实里走，引导广大党员在参观学习过程中，由点到面、由此及彼，加深对党的光辉历程、精神谱系、历史经验的理解领悟，汲取奋进前行的智慧与力量。各参观学习点要充分挖掘特色文化、阐释独特内涵，积极充实完善展示内容，把好展示讲解导览的政治关、史实关，认真做好服务保障工作，落实疫情防控各项措施，确保参观学习活动安全有序有效。,其他,0.7548256053324498,True
113,福建省,泉州市,泉州市政府党组理论学习中心组学习会召开,2022-10-14,http://www.quanzhou.gov.cn/zfb/xxgk/zfxxgkzl/qzdt/qzyw/202210/t20221014_2787174.htm,泉州市政府党组理论学习中心组学习会召开-泉州要闻-泉州动态-政府信息公开-政务公开-泉州市人民政府。13日，泉州市政府党组书记、市长蔡战胜主持召开市政府党组理论学习中心组学习会，学习研讨习近平总书记在省部级主要领导干部“学习习近平总书记重要讲话精神，迎接党的二十大”专题研讨班上重要讲话精神；集中观看《闽山闽水物华新——习近平福建足迹》读书特别节目。会上，市政府党组成员结合工作实际，交流学习体会。。会议指出，习近平总书记在省部级主要领导干部专题研讨班上的重要讲话精神，系统阐述了过去5年工作和新时代10年的伟大变革，深刻阐明了未来一个时期党和国家事业发展的大政方针和行动纲领。。会议强调，要学深细悟，深刻理解、准确把握习近平总书记重要讲话的核心要义、思想内涵，深刻领悟“两个确立”的决定性意义，不断增强“四个意识”、坚定“四个自信”、做到“两个维护”，坚定战略自信、保持战略清醒、增强信心斗志。要全面落实“疫情要防住、经济要稳住、发展要安全”重要要求，高效统筹疫情防控和经济社会发展工作，确保社会大局安全稳定。要把学习宣传贯彻习近平总书记重要讲话精神作为一项重要政治任务，同当前正在开展的工作结合起来，对标对表找差距，切实增强学习的针对性和实效性，把学习成果转化为做好工作的强大动力和实际成效。,泉州市政协党组召开理论学习中心组学习会 集中学习研讨党的二十大精神-泉州要闻-泉州动态-政府信息公开-政务公开-泉州市人民政府。市政协党组书记、主席肖汉辉主持会议并讲话，党组成员洪川夫、蔡萌芽、庄灿霞、黄碧煌出席会议。副主席戴仲川、肖惠中列席会议。会上，与会党组成员结合工作实际，交流学习体会。。会议指出，党的二十大是在全党全国各族人民迈上全面建设社会主义现代化国家新征程、向第二个百年奋斗目标进军的关键时刻召开的一次十分重要的大会。二十大报告是党团结带领人民全面建设社会主义现代化国家、全面推进中华民族伟大复兴的政治宣言和行动纲领，是马克思主义的纲领性文献。。会议要求，要提高政治站位，把学习宣传贯彻党的二十大精神作为当前和今后一个时期的首要政治任务，深刻把握大会的鲜明主题、精神实质和战略部署，深刻领悟“两个确立”的决定性意义，坚决做到“两个维护”。要结合政协工作实际，丰富学习载体，以建设“书香政协”为抓手，深入界别群众、基层一线和“党建+”邻里中心委员工作室，持续开展多形式、多层次、全方位的集中学习活动。要坚持发展全过程人民民主，不断提高建言资政和凝聚共识水平，确实把学习成效转化为推进政协工作、服务高质量发展的实际行动。,其他,0.6208396368207736,True
113,福建省,泉州市,泉州市级党员领导干部开展党史学习教育集体现场学习,2021-03-24,http://www.quanzhou.gov.cn/zfb/xxgk/zfxxgkzl/gzdt/zwyw/202103/t20210324_2528874.htm,泉州市级党员领导干部开展党史学习教育集体现场学习-政务要闻-工作动态-政府信息公开-政务公开-泉州市人民政府。绿树掩映下的官桥岭兜革命烈士纪念碑，显得格外庄严肃穆。康涛、陈灿辉、李转生、孔繁军、林万明、刘文儒、季翔峰、傅藏荣等市领导来到纪念碑前低头默哀，深情缅怀为革命胜利献出宝贵生命的英雄儿女。在中共泉州中心县委机关旧址，大家认真听取岭兜的革命斗争史专题讲解，重温入党誓词，接受深刻的思想洗礼。走进泉州革命斗争史展馆，展馆以中国近现代革命斗争重大事件发生时间为轴，讲述中共泉州革命斗争的红色征程。珍贵的历史文物，逼真的场景还原，让大家在重温伟大历史和精神中深受教育。。在现场学习时，市委书记康涛指出，要从百年党史中汲取奋进力量，深切缅怀革命先辈，大力弘扬革命传统、传承红色基因，真正做到学史明理、学史增信、学史崇德、学史力行。。康涛强调，要学习共产党人理论与实践相结合的创新历史，夯实思想之基，带头持续学懂弄通做实习近平新时代中国特色社会主义思想，不断提高政治判断力、政治领悟力、政治执行力。要学习共产党人为理想信念奋斗的历史，始终坚定信仰，坚持正确政治方向，经受住各种风险和困难考验，永葆共产党人政治本色。要学习共产党人心系人民、造福人民的历史，担当为民之责，以开展“我为群众办实事”实践活动为载体，结合开展“我为企业解难题”实践活动，着力解决好群众和企业“急难愁盼”问题。要学习共产党人应对危局困境、不断攻坚克难的历史，增强斗争之力，坚决扛起全方位推动高质量发展超越的主力军担当，全力实施民营经济发展年、营商环境提升年、城乡品质提升年，确保各项工作做实做细做成，努力打造“海丝名城、制造强市”。,泉州各地扎实开展“再学习、再调研、再落实”活动-政务要闻-工作动态-政府信息公开-政务公开-泉州市人民政府。“再学习、再调研、再落实”活动开展以来，泉州市各地迅速行动，边学习边调研边落实，努力以发展成果和群众满意度来检验活动成效。。泉港区印发关于开展“再学习、再调研、再落实”活动的通知，要求各级各部门提高认识，把准谋划方向，集中精力突破制约泉港发展的一系列根本性问题，推动“十四五”开好局、起好步。泉港区委成立了“再学习、再调研、再落实”活动工作小组，制定《泉港区“再学习、再调研、再落实”重点专项任务》，将组建工作专班，按照任务项目化、项目清单化、清单具体化要求全盘推进落实。突出重点大干开局之年，该区将坚持目标导向，营造比学赶超氛围，把蓝图转化为行动，把课题转化为项目，对接深入开展全市“民营经济发展年”“营商环境提升年”“城市品质提升年”活动，确保全年经济社会发展目标任务顺利完成。将树好导向提升干部精气神，通过实绩实效来识别干部、使用干部。将环环相扣，抓紧抓实进度，切实以发展的成果和群众满意度作为检验的重要标准，激励全区上下奋战新征程、携手再出发，为全面深入实施“创新立区、主业强区、港口兴区、生态美区、和谐安区”新发展战略贡献智慧力量。。惠安县要求，要站位新阶段，解放思想、更新思维，提振精气神，发扬好孺子牛、拓荒牛、老黄牛精神；要培养市场化、法治化、国际化思维，适应改革发展需要；要塑造专业化能力，做到干一行钻研一行，以精准的研判、务实的举措推动工作落实；要对照新理念，查找问题、解剖麻雀，完整、准确、全面贯彻新发展理念，对照上级“点题”，从战略性、方向性的层面着眼，确定具体课题和研究方向，从科技创新、产业结构、居民收入等细分领域、关键环节进行“破题”“解题”“答题”；要构建新格局，下地干活、狠抓落实，县领导要当好“施工队长”，带头下地干活，各镇各部门要当好“班组长”，一线干部要做好“施工员”，形成一级带动一级、一级比一级具体的生动局面，做到常规性与重难点、稳增长与高质量、短平快与机制化的统一。全县各级各部门要迅速行动，边学习边调研边落实，以发展成果和群众满意度来检验活动成效。。永春县立足实际，认真贯彻省委、市委关于开展“再学习、再调研、再落实”活动部署，做到早安排、早谋划、早部署，确保活动有序推进。推进“再学习”，用好用活泉州市党内政治生活体验馆、林俊德纪念馆等载体，总结提升、传承弘扬“美岭精神”。推进“再调研”，针对产业基础、城乡统筹、民生补短板、营商环境等方面存在的问题，提出做特做强有根产业、持续推动永春乡村振兴走前列、推广农村互助养老模式、推动学前教育提档升级、优化营商环境等调研课题，通过查找薄弱环节，找准发力点，加快补齐发展短板。推进“再落实”，创新抓落实的方式，实行“交叉检查”。对推进过程中呈现出来的特色亮点及时进行总结提升，并采用“典型引路法”在全县范围内进行推广。推行“五张清单”，通过节点对账、实地查看、座谈了解等方式，深入考核干部在抓好工作落实中的实际表现情况，激励干部提神聚气，提升工作效能。,其他,0.6326576356829748,True
113,福建省,泉州市,康涛会见中国侨商联合会考察团一行,2021-04-11,http://www.quanzhou.gov.cn/zfb/xxgk/zfxxgkzl/gzdt/zwyw/202104/t20210411_2541879.htm,康涛会见中国侨商联合会考察团一行-政务要闻-工作动态-政府信息公开-政务公开-泉州市人民政府。10日，市委书记康涛会见全国政协常委、中国侨商联合会会长许荣茂带领的中国侨商联合会考察团一行，就深化合作、共同发展进行交流。省侨联主席陈式海，中国侨联相关负责人出席；市领导林万明、肖汉辉参加。。康涛对中国侨商联合会考察团一行来泉表示欢迎，并简要介绍泉州人文历史、经济社会发展等情况。他表示，广大侨商始终心系泉州，或积极牵线搭桥、招引项目，或踊跃投资兴业、捐资公益，以实际行动助力泉州高质量发展。当前，我们正深入贯彻习近平总书记在福建考察时的重要讲话精神，落实中央及省委部署，传承弘扬“晋江经验”，围绕争创全国民营经济示范城市，深入实施民营经济发展年、营商环境提升年、城乡品质提升年，持续先行先试，创新体制机制，勇当全方位推进高质量发展超越主力军。广大侨商在泉发展大有可为、大有作为，希望大家继续关心泉州、投资泉州，共享机遇、共谋发展。我们将用心用情提供一流服务保障，为大家来泉投资兴业创造更优环境。。许荣茂说，家乡日新月异的变化令人倍感骄傲和自豪。当前，泉州经济社会发展正迎来难得的历史机遇，我们将珍惜不可多得的发展机会，深入考察了解，加强对接合作，实现合作共赢。。在泉期间，考察团参加了泉州市招商推介洽谈会，还将前往石狮等地走访，了解经济政策、投资环境及重点产业项目等情况。,党史学习教育省委宣讲团宣讲报告会在泉举行-政务要闻-工作动态-政府信息公开-政务公开-泉州市人民政府。按照省委统一安排，2日，党史学习教育省委宣讲团宣讲报告会在泉州举行。省委宣讲团成员、福建师范大学二级教授、博士生导师郑又贤作宣讲报告。市委书记康涛主持并讲话。。郑又贤紧密结合习近平总书记来闽考察重要讲话精神，围绕“深入学习领会习近平总书记关于党的历史的重要论述、深刻认识党史学习教育的目的意义和总体要求、全面了解党的百年奋斗的光辉历程和历史性贡献、深刻把握开展党史学习教育的重点、学懂弄通做实习近平新时代中国特色社会主义思想”五个方面，通过一个个经典故事和党史案例，进行深入解读和系统阐述。整个报告主题鲜明、生动鲜活，比照历史与现实，联系理论与实际，兼具理论高度和全局视野，让与会同志深受教育和启发。。康涛指出，开展党史学习教育是一项重大政治任务。全市各级党组织和广大党员干部要深入学习领会习近平总书记关于党史学习教育的重要论述，深入学习领会习近平总书记来福建考察时的重要讲话精神，深刻领会和把握开展党史学习教育的重大意义，做到学史明理、学史增信、学史崇德、学史力行，不断提高政治判断力、政治领悟力、政治执行力，以学习教育的具体成效增强“四个意识”、坚定“四个自信”、做到“两个维护”。。康涛强调，要紧紧围绕习近平总书记来福建考察时提出的“在党史学习教育中做到学史明理”重要要求，学党史、悟思想、办实事、开新局，把党史学习教育不断引向深入，进一步坚定信仰信念、感悟思想伟力、砥砺初心使命、强化责任担当。要坚持把学习党史与学习新中国史、改革开放史、社会主义发展史结合起来，把学习习近平新时代中国特色社会主义思想贯穿始终，切实用党的创新理论武装头脑、指导实践、推动工作。要坚持以人民为中心的发展思想，扎实开展“我为群众办实事”“我为企业解难题”实践活动，着力解决好群众和企业“急难愁盼”问题。要全面对标对表习近平总书记来福建考察时的重要讲话精神，结合党史学习教育和“再学习、再调研、再落实”活动，找准工作着力点和突破口，把学习成果转化为全方位推进高质量发展超越的实际成效。。康涛要求，全市各级党委（党组）要加强组织领导，各级领导干部要带头学、作示范，各地各部门要因地制宜推进，高标准高质量完成学习教育各项任务。要充分挖掘利用红色文化资源，用好“泉民开讲”、党史教育基地等平台载体，开展分众化互动式宣传宣讲，推动党史学习教育体现泉州元素、泉州特色，以优异成绩庆祝建党100周年。。报告会前，康涛会见了宣讲团成员。市领导李转生、张永宁、林万明、季翔峰、洪自强、傅藏荣等分别参加会见、报告会。报告会以视频会议形式举行。市委、市人大常委会、市政府、市政协领导班子成员，市中级法院院长、市检察院检察长，地厅级离退休老同志，市直有关单位、市属高校党组（党委）主要负责同志，党史学习教育市委宣讲团成员、全市理论骨干党史学习教育培训班成员，理论工作者、高校师生、国企党员代表等参加宣讲报告会。各县（市、区）、泉州开发区、台商投资区设分会场。,其他,0.605778439974325,True
