code,province,city,topic,date,url,content,content.1,label,score,is_match
114,福建省,漳州市,王进足带队到昆明市学习考察,2024-06-24,http://www.zhangzhou.gov.cn/cms/siteresource/article.shtml?id=830625093166120000&siteId=620416811908440000,6月21日至23日，市委书记王进足带队到昆明市学习考察，走访考察企业、园区、市场等，洽谈对接项目，宣传推介漳州，促进漳州与昆明进一步深化交流合作，推动发展双赢。。云南省是肉牛养殖大省，昆明市寻甸县是国家级畜牧大县和牛羊重点基地县。如何做大“牛生意”？考察组深入考察了寻甸县牛文化展示中心、伊泰食品有限公司、听牧肉牛产业股份有限公司，了解当地国家现代农业产业园肉牛产业发展规划及加工、贸易等情况，并见证诏安县与寻甸县签订肉牛产业战略合作框架协议。王进足指出，当前，诏安县正加快建设南方肉牛集散中心，与寻甸县在肉牛产业合作方面空间广阔，希望两地加强肉牛养殖、销售、屠宰和深加工全产业链合作，构建形成肉牛产业优势互补、资源互通、利益共享的良好合作局面。。“中国花卉看云南，云南花卉看斗南”。昆明斗南花卉市场是亚洲第一的花卉市场，日交易鲜花近4000万枝。如何做优“花产业”？考察组深入考察斗南花卉市场夜市鲜切花批发、拍卖情况。王进足指出，要悉心学习斗南经验，深耕市场、用心浇灌，用“小鲜花”串起“大链条”，催生出更多“鲜花经济”增长点。考察组还前往全国鲜切花种植重要基地晋宁区，考察国际花卉综合物流中心、云天化花匠铺科技有限公司、晋宁花卉产业示范园。王进足指出，漳州是花果之乡、东南花都，“花产业”大有可为，要借鉴昆明发展花卉产业的先进经验，加强与昆明相关企业的对接合作，提升海峡花卉集散中心的发展能级，推动漳州花卉苗木产业高质量发展，实现优势互补、互利共赢。。环湖湿地在昆明滇池水环境保护、地方经济发展等方面发挥着重要作用。考察组前往昆明宝丰湿地，详细了解治理模式、水质提升等工作，表示要牢固树立“山水林田湖草是生命共同体”理念，学习治水经验，以高品质生态环境支撑高质量发展。考察组还考察了昆明历史文化街区南强街夜市特色经济示范点。王进足指出，要学习昆明发展夜间经济经验，加强策划治理，通过美食文化、街头艺术展示、文化创意产品、非物质文化遗产展示、“网红”打卡、民俗文化展示等方式打造一批特色街区，大力发展漳州古城等地夜间经济，推动人气“聚”起来、消费“火”起来。。市领导张鸿、蔡兴州，市直有关部门、单位和漳浦县、诏安县、南靖县主要负责同志等参加考察。（芝山）,6月21日至23日，市委书记王进足带队到昆明市学习考察，走访考察企业、园区、市场等，洽谈对接项目，宣传推介漳州，促进漳州与昆明进一步深化交流合作，推动发展双赢。。云南省是肉牛养殖大省，昆明市寻甸县是国家级畜牧大县和牛羊重点基地县。如何做大“牛生意”？考察组深入考察了寻甸县牛文化展示中心、伊泰食品有限公司、听牧肉牛产业股份有限公司，了解当地国家现代农业产业园肉牛产业发展规划及加工、贸易等情况，并见证诏安县与寻甸县签订肉牛产业战略合作框架协议。王进足指出，当前，诏安县正加快建设南方肉牛集散中心，与寻甸县在肉牛产业合作方面空间广阔，希望两地加强肉牛养殖、销售、屠宰和深加工全产业链合作，构建形成肉牛产业优势互补、资源互通、利益共享的良好合作局面。。“中国花卉看云南，云南花卉看斗南”。昆明斗南花卉市场是亚洲第一的花卉市场，日交易鲜花近4000万枝。如何做优“花产业”？考察组深入考察斗南花卉市场夜市鲜切花批发、拍卖情况。王进足指出，要悉心学习斗南经验，深耕市场、用心浇灌，用“小鲜花”串起“大链条”，催生出更多“鲜花经济”增长点。考察组还前往全国鲜切花种植重要基地晋宁区，考察国际花卉综合物流中心、云天化花匠铺科技有限公司、晋宁花卉产业示范园。王进足指出，漳州是花果之乡、东南花都，“花产业”大有可为，要借鉴昆明发展花卉产业的先进经验，加强与昆明相关企业的对接合作，提升海峡花卉集散中心的发展能级，推动漳州花卉苗木产业高质量发展，实现优势互补、互利共赢。。环湖湿地在昆明滇池水环境保护、地方经济发展等方面发挥着重要作用。考察组前往昆明宝丰湿地，详细了解治理模式、水质提升等工作，表示要牢固树立“山水林田湖草是生命共同体”理念，学习治水经验，以高品质生态环境支撑高质量发展。考察组还考察了昆明历史文化街区南强街夜市特色经济示范点。王进足指出，要学习昆明发展夜间经济经验，加强策划治理，通过美食文化、街头艺术展示、文化创意产品、非物质文化遗产展示、“网红”打卡、民俗文化展示等方式打造一批特色街区，大力发展漳州古城等地夜间经济，推动人气“聚”起来、消费“火”起来。。市领导张鸿、蔡兴州，市直有关部门、单位和漳浦县、诏安县、南靖县主要负责同志等参加考察。（芝山）,政府领导到其他城市考察学习或访问,0.6098068703268801,True
114,福建省,漳州市,漳州市党政代表团到泉州市考察学习,2023-11-19,http://www.zhangzhou.gov.cn/cms/siteresource/article.shtml?id=830606260406730004&siteId=620416811908440000,11月17日至18日，市委书记王进足、市长魏东、市人大常委会主任李东河、市政协主席吴文团率领漳州市党政代表团到泉州市考察学习，学习借鉴泉州在推进经济社会发展中创造的好经验好做法，进一步增强发展动力，拓宽思路视野，更好推动我市各项工作提质增效、争创一流。泉州市委书记张毅恭、市长蔡战胜分别陪同考察。。如何进一步加快工业园区标准化建设？带着思考与探索，代表团深入泉州数字经济产业园、芯智造产业园、南王科技产业园，详细了解园区标准化建设、产业招商发展、管理运营、低效用地综合治理等情况。“园区规划由谁设计？运营主体是谁？产业基金如何运用？亩均税收达到多少？”代表团看亮点、学经验，勤交流、议思路，表示将认真学习借鉴泉州的好做法，加快我市工业园区标准化改造提升，以更高标准推动工业园区向专业化、规模化、智能化方向迈进。。中国闽台缘博物馆全方位展示泉台两地“五缘”情深，是泉州深化对台交流合作的重要平台。博物馆的展陈，让代表团印象深刻，更加感受到两岸同胞同根同源的深厚情谊，也进一步增强了加快漳台融合发展的责任感使命感。大家表示，要充分发挥我市独特对台资源优势，扎实做好“通、惠、情”文章，努力打造台胞台企登陆第一家园。。近年来，泉州立足资源禀赋，因地制宜推动文旅经济发展取得扎实成效。在泉州古城，代表团考察了金鱼巷、中山中路、西街古城文创和古街巷改造提升情况，对古城的规划建设给予点赞，表示将借鉴泉州古城发展模式，做好漳州古城的活化利用文章，积极导入文旅经济新业态，不断丰富漳州古城发展内涵。梧林传统村落坚持“固态保护、活态传承、业态提升”，做到“见人见物见生活、留形留神留乡愁”，代表团行走在青石板上，触摸着古老建筑，感受到别样的海丝华侨文化和浓浓乡愁。大家表示，要学习借鉴泉州保护传统村落、延续乡愁记忆的好经验好做法，扎实推进漳州古村落保护利用，有机结合文旅产业发展，全面加快乡村振兴。。晋江经验馆以时间轴为主线，通过影片、图片、文字、模型等方式，全面讲述“晋江经验”的形成发展过程。代表团走进晋江经验馆，认真听取讲解，在珍贵图片、实物展示前不时驻足，感悟“晋江经验”的丰富内涵和实践成果。大家表示，将大力传承弘扬“晋江经验”，坚定不移发展实体经济，培育发展壮大民营经济，不断塑造高质量发展的新动能新优势。。民营经济、县域经济是泉州发展的特色所在、活力所在、优势所在。安踏集团从晋江起步，一步一个脚印，已成为全球前列的国际化体育用品集团，代表团参观了企业展厅，了解企业发展历程和科技创新成果。大家认为，只要像安踏集团那样深耕实业、专注创新，抢抓机遇、永不止步，漳州的民营企业一定能够做大做强。在中化泉州石化有限公司，代表团考察了石化产业发展、基础设施建设、产业升级等情况。大家表示，将学习借鉴泉州石化在运营管理、产业发展方面的好做法，以更大力度支持古雷突破“油头”、延伸“化尾”，加快打造世界一流绿色生态石化基地。。漳州市领导黄水木、张鸿、陈文聪、廖卓文、胡栋良、季光明、兰万安、郑立敏、余向红、林少金、肖申华、洪泰伟、马涛涛、蔡兴州，各县（区）、开发区（投资区）和市直有关部门主要负责同志，泉州市领导周小华、黄景春、张文贤、肖进才、姚飞分别参加相关活动。（记者 苏奕斌）,11月17日至18日，市委书记王进足、市长魏东、市人大常委会主任李东河、市政协主席吴文团率领漳州市党政代表团到泉州市考察学习，学习借鉴泉州在推进经济社会发展中创造的好经验好做法，进一步增强发展动力，拓宽思路视野，更好推动我市各项工作提质增效、争创一流。泉州市委书记张毅恭、市长蔡战胜分别陪同考察。。如何进一步加快工业园区标准化建设？带着思考与探索，代表团深入泉州数字经济产业园、芯智造产业园、南王科技产业园，详细了解园区标准化建设、产业招商发展、管理运营、低效用地综合治理等情况。“园区规划由谁设计？运营主体是谁？产业基金如何运用？亩均税收达到多少？”代表团看亮点、学经验，勤交流、议思路，表示将认真学习借鉴泉州的好做法，加快我市工业园区标准化改造提升，以更高标准推动工业园区向专业化、规模化、智能化方向迈进。。中国闽台缘博物馆全方位展示泉台两地“五缘”情深，是泉州深化对台交流合作的重要平台。博物馆的展陈，让代表团印象深刻，更加感受到两岸同胞同根同源的深厚情谊，也进一步增强了加快漳台融合发展的责任感使命感。大家表示，要充分发挥我市独特对台资源优势，扎实做好“通、惠、情”文章，努力打造台胞台企登陆第一家园。。近年来，泉州立足资源禀赋，因地制宜推动文旅经济发展取得扎实成效。在泉州古城，代表团考察了金鱼巷、中山中路、西街古城文创和古街巷改造提升情况，对古城的规划建设给予点赞，表示将借鉴泉州古城发展模式，做好漳州古城的活化利用文章，积极导入文旅经济新业态，不断丰富漳州古城发展内涵。梧林传统村落坚持“固态保护、活态传承、业态提升”，做到“见人见物见生活、留形留神留乡愁”，代表团行走在青石板上，触摸着古老建筑，感受到别样的海丝华侨文化和浓浓乡愁。大家表示，要学习借鉴泉州保护传统村落、延续乡愁记忆的好经验好做法，扎实推进漳州古村落保护利用，有机结合文旅产业发展，全面加快乡村振兴。。晋江经验馆以时间轴为主线，通过影片、图片、文字、模型等方式，全面讲述“晋江经验”的形成发展过程。代表团走进晋江经验馆，认真听取讲解，在珍贵图片、实物展示前不时驻足，感悟“晋江经验”的丰富内涵和实践成果。大家表示，将大力传承弘扬“晋江经验”，坚定不移发展实体经济，培育发展壮大民营经济，不断塑造高质量发展的新动能新优势。。民营经济、县域经济是泉州发展的特色所在、活力所在、优势所在。安踏集团从晋江起步，一步一个脚印，已成为全球前列的国际化体育用品集团，代表团参观了企业展厅，了解企业发展历程和科技创新成果。大家认为，只要像安踏集团那样深耕实业、专注创新，抢抓机遇、永不止步，漳州的民营企业一定能够做大做强。在中化泉州石化有限公司，代表团考察了石化产业发展、基础设施建设、产业升级等情况。大家表示，将学习借鉴泉州石化在运营管理、产业发展方面的好做法，以更大力度支持古雷突破“油头”、延伸“化尾”，加快打造世界一流绿色生态石化基地。。漳州市领导黄水木、张鸿、陈文聪、廖卓文、胡栋良、季光明、兰万安、郑立敏、余向红、林少金、肖申华、洪泰伟、马涛涛、蔡兴州，各县（区）、开发区（投资区）和市直有关部门主要负责同志，泉州市领导周小华、黄景春、张文贤、肖进才、姚飞分别参加相关活动。（记者 苏奕斌）,政府领导到其他城市考察学习或访问,0.0,True
114,福建省,漳州市,刘远带队赴浙江江苏考察学习洽谈项目,2021-03-28,http://www.zhangzhou.gov.cn/cms/siteresource/article.shtml?id=60522799225000000&siteId=620416811908440000,开阔新视野，洽谈新项目，谋求新发展，建设新漳州。结合开展“再学习、再调研、再落实”活动，3月23日至26日，市长刘远带领市、县、村三级考察团到浙江嘉兴、湖州、绍兴和江苏南京等地，考察学习浙江实施乡村振兴战略的经验做法，对接洽谈桐昆集团聚酯长丝项目和上海华昌集团漳州金山矿区生态治理—华昌大型综合体项目，通过“走出去”进一步理清全面实施乡村振兴战略的具体思路，借助“引进来”加快推动产业高质量发展。。紧追先进再学习、再调研。在“两山”理论发源地、乡村振兴先行区浙江，考察团先后参观了嘉兴市桐乡现代农业创新服务中心、石门镇墅丰村，湖州市南浔区善琏湖笔小镇、南浔古镇和安吉县天荒坪镇余村村、递铺街道鲁家村，大家看到了差距、学习了经验、解放了思想，一致认为要坚持以新发展理念指导乡村振兴战略的全面实施，认真借鉴浙江打造“村强、民富、景美、人和”美丽乡村的成功经验，通过挖掘特色、科学规划、振兴产业、整治环境、创新治理，全力提高农业生产效益、提升农村人居档次、改善农民生活品质，走出一条适合漳州实际的乡村振兴之路。。紧盯项目再落实、再深化。桐昆集团是我国排名第一的聚酯长丝龙头企业，为加快项目签约落户、延伸古雷“油头化尾”产业链条，刘远一行与福建石化集团、桐昆集团高层就项目用地、供热、原料供应等具体问题进行了深入洽谈，三方坦诚交换了具体意见，形成了“真来、真投、真干、真成”的合作共识。围绕漳州金山矿区生态治理—华昌大型综合体项目，刘远一行先后考察了上海华昌集团旗下的绍兴东方山水项目和南京龙之谷项目，并就项目建设模式、配套用地、优惠政策进行了深入洽谈，双方已达成明确的合作意向。。市领导沈志平、谢毅泰，市直有关部门和古雷开发区、台商投资区负责人分别参加相关活动。（记者 刘铭明）,开阔新视野，洽谈新项目，谋求新发展，建设新漳州。结合开展“再学习、再调研、再落实”活动，3月23日至26日，市长刘远带领市、县、村三级考察团到浙江嘉兴、湖州、绍兴和江苏南京等地，考察学习浙江实施乡村振兴战略的经验做法，对接洽谈桐昆集团聚酯长丝项目和上海华昌集团漳州金山矿区生态治理—华昌大型综合体项目，通过“走出去”进一步理清全面实施乡村振兴战略的具体思路，借助“引进来”加快推动产业高质量发展。。紧追先进再学习、再调研。在“两山”理论发源地、乡村振兴先行区浙江，考察团先后参观了嘉兴市桐乡现代农业创新服务中心、石门镇墅丰村，湖州市南浔区善琏湖笔小镇、南浔古镇和安吉县天荒坪镇余村村、递铺街道鲁家村，大家看到了差距、学习了经验、解放了思想，一致认为要坚持以新发展理念指导乡村振兴战略的全面实施，认真借鉴浙江打造“村强、民富、景美、人和”美丽乡村的成功经验，通过挖掘特色、科学规划、振兴产业、整治环境、创新治理，全力提高农业生产效益、提升农村人居档次、改善农民生活品质，走出一条适合漳州实际的乡村振兴之路。。紧盯项目再落实、再深化。桐昆集团是我国排名第一的聚酯长丝龙头企业，为加快项目签约落户、延伸古雷“油头化尾”产业链条，刘远一行与福建石化集团、桐昆集团高层就项目用地、供热、原料供应等具体问题进行了深入洽谈，三方坦诚交换了具体意见，形成了“真来、真投、真干、真成”的合作共识。围绕漳州金山矿区生态治理—华昌大型综合体项目，刘远一行先后考察了上海华昌集团旗下的绍兴东方山水项目和南京龙之谷项目，并就项目建设模式、配套用地、优惠政策进行了深入洽谈，双方已达成明确的合作意向。。市领导沈志平、谢毅泰，市直有关部门和古雷开发区、台商投资区负责人分别参加相关活动。（记者 刘铭明）,政府领导到其他城市考察学习或访问,0.7934470029968598,True
114,福建省,漳州市,魏东带队赴长江经济带开展考察学习及招商引资活动,2024-04-20,http://www.zhangzhou.gov.cn/cms/siteresource/article.shtml?id=830619476576300004&siteId=620416811908440000,4月16日至19日，市长魏东带队赴长江经济带开展考察学习及招商引资活动，走访考察企业，洽谈对接项目，宣传推介漳州，推动我市与长江经济带进一步深化产业合作、携手发展共赢。。魏东一行先后赴南京、苏州、上海，调研了南京蜂巢酒店项目、亿嘉和科技股份有限公司、江苏省未来网络创新研究院、恒力全球运营总部、苏州工业园区展示中心、峰飞航空科技（昆山）有限公司、洋山深水港四期自动化码头、滴水云厅规划展示中心、亿通国际股份有限公司和上海飞机制造有限公司，实地学习三地先进的经验做法，充分感受长江经济带蓬勃的发展活力。每到一处，魏东都有针对性地介绍漳州市基本情况和发展态势。他指出，漳州地理区位优越，资源要素充足，产业基础扎实，是中国经济实力50强城市。当前，漳州正围绕“打造福建高质量发展新的重要增长极”目标，培育壮大“9+5”产业集群，因地制宜发展新质生产力，与各企业有着巨大合作空间。希望双方发挥各自优势，密切沟通联系，以场景应用为切入点，深入探索多元化合作模式，共同推动产业做大做强。漳州将全力做好服务保障，为企业在漳发展提供良好环境。。考察学习中，魏东强调，各级各有关部门要积极抢抓机遇加快发展新质生产力，拓展产业链招商、以商招商等渠道，以“场景”带“产业”，培育壮大新材料、低空经济等战略性新兴产业，前瞻布局未来产业，抢占新赛道、塑造新动能。要扎实推进新型工业化，坚持以科技创新为引领，围绕全市“9+5”和县区“3+X”产业，加强与高校院所、科研机构对接协作，推进科技成果转化，促进产业高端化、智能化、绿色化转型。要做好“产城人”融合文章，以“功成不必在我”的境界和“功成必定有我”的担当，树牢“亩均论英雄”导向，对标学习借鉴先进地区经验，高标准高水平推进产业社区建设，谋划打造标志性片区，持续提升城市能级。。市领导郑立敏、林少金、洪泰伟、马涛涛，市直有关部门及各县（区）、开发区（投资区）主要负责同志等参加相关活动。（记者 蔡楠楠）,4月16日至19日，市长魏东带队赴长江经济带开展考察学习及招商引资活动，走访考察企业，洽谈对接项目，宣传推介漳州，推动我市与长江经济带进一步深化产业合作、携手发展共赢。。魏东一行先后赴南京、苏州、上海，调研了南京蜂巢酒店项目、亿嘉和科技股份有限公司、江苏省未来网络创新研究院、恒力全球运营总部、苏州工业园区展示中心、峰飞航空科技（昆山）有限公司、洋山深水港四期自动化码头、滴水云厅规划展示中心、亿通国际股份有限公司和上海飞机制造有限公司，实地学习三地先进的经验做法，充分感受长江经济带蓬勃的发展活力。每到一处，魏东都有针对性地介绍漳州市基本情况和发展态势。他指出，漳州地理区位优越，资源要素充足，产业基础扎实，是中国经济实力50强城市。当前，漳州正围绕“打造福建高质量发展新的重要增长极”目标，培育壮大“9+5”产业集群，因地制宜发展新质生产力，与各企业有着巨大合作空间。希望双方发挥各自优势，密切沟通联系，以场景应用为切入点，深入探索多元化合作模式，共同推动产业做大做强。漳州将全力做好服务保障，为企业在漳发展提供良好环境。。考察学习中，魏东强调，各级各有关部门要积极抢抓机遇加快发展新质生产力，拓展产业链招商、以商招商等渠道，以“场景”带“产业”，培育壮大新材料、低空经济等战略性新兴产业，前瞻布局未来产业，抢占新赛道、塑造新动能。要扎实推进新型工业化，坚持以科技创新为引领，围绕全市“9+5”和县区“3+X”产业，加强与高校院所、科研机构对接协作，推进科技成果转化，促进产业高端化、智能化、绿色化转型。要做好“产城人”融合文章，以“功成不必在我”的境界和“功成必定有我”的担当，树牢“亩均论英雄”导向，对标学习借鉴先进地区经验，高标准高水平推进产业社区建设，谋划打造标志性片区，持续提升城市能级。。市领导郑立敏、林少金、洪泰伟、马涛涛，市直有关部门及各县（区）、开发区（投资区）主要负责同志等参加相关活动。（记者 蔡楠楠）,政府领导到其他城市考察学习或访问,0.8433935469993915,True
