code,province,city,topic,date,url,content,content.1,label,score,is_match
111,福建省,莆田市,付朝阳主持召开市委常委会会议传达学习贯彻习近平总书记重要讲话精神,2022-07-23,http://www.putian.gov.cn/zwgk/ptdt/ldhd/202207/t20220723_1740816.htm,7月21日，市委书记付朝阳主持召开市委常委会会议，传达学习习近平总书记在武汉考察、在新疆考察、出席庆祝香港回归祖国25周年大会暨香港特别行政区第六届政府就职典礼时的重要讲话精神，及习近平总书记给中国国家博物馆老专家、给参加海峡青年论坛的台湾青年的回信精神，致世界互联网大会国际组织成立的贺信精神；传达学习李克强总理在东南沿海省份政府主要负责人经济形势座谈会上的讲话精神，中央政治局常委、全国政协主席汪洋出席第十四届海峡论坛时的讲话精神，研究我市贯彻意见。。会议强调，要深入学习贯彻习近平总书记在武汉考察时的重要讲话精神，坚持快准严实细，毫不放松抓好常态化疫情防控。要坚持创新驱动发展，推动人才链、创新链、产业链深度融合。要以“党建引领、夯基惠民”工程为抓手，夯实基层治理基础。。会议强调，要深入学习贯彻习近平总书记在新疆考察时的重要讲话精神，加大对口援疆工作力度，共同把新疆的工作做好。要推动发展成果惠及民生，实施惠民利民工程，把群众的事做到点子上、办在心坎上。要推动全面从严治党向纵深发展，持续构建风清气正的政治生态。。会议强调，要深刻领会“一国两制”的根本宗旨，更好地服务党中央对港工作大局。要充分发挥莆商莆侨优势，深化莆港经贸、文旅、人才等交流合作，引导广大在港莆籍乡亲继续发扬爱国爱港优良传统，积极参与支持香港经济社会建设。。会议强调，要深入学习贯彻习近平总书记给中国国家博物馆老专家的回信精神，坚定文化自信，心存敬畏，加强文物保护传承和活化利用，推动文物保护与文旅产业融合发展，更好地赓续城市文脉，充分展示我市文物和文化的独特魅力。。会议强调，要深入学习贯彻习近平总书记给参加海峡青年论坛的台湾青年的回信精神，秉持“两岸一家亲”理念，持续推进莆台经济社会互动，为广大台湾青年来莆学习生活、就业、创业提供更多便利，让他们愿意来、留得下、融得进。。会议强调，要深入学习贯彻习近平总书记致世界互联网大会国际组织成立的贺信精神，深刻把握信息化时代发展潮流，大力发展数字经济，加快“全市一张图、全域数字化”建设，以数字赋能产业，促进数字技术与实体经济深度融合。。会议强调，要把稳增长摆在更加突出位置，全面落实国家、省、市稳住经济一揽子政策举措，推动经济平稳健康发展。要持续深化改革，激发市场活力和社会创造力。要全力稳就业保民生，牢牢守住安全底线，不断增强群众的获得感、幸福感、安全感。,7月21日，市委书记付朝阳主持召开市委常委会会议，传达学习习近平总书记在武汉考察、在新疆考察、出席庆祝香港回归祖国25周年大会暨香港特别行政区第六届政府就职典礼时的重要讲话精神，及习近平总书记给中国国家博物馆老专家、给参加海峡青年论坛的台湾青年的回信精神，致世界互联网大会国际组织成立的贺信精神；传达学习李克强总理在东南沿海省份政府主要负责人经济形势座谈会上的讲话精神，中央政治局常委、全国政协主席汪洋出席第十四届海峡论坛时的讲话精神，研究我市贯彻意见。。会议强调，要深入学习贯彻习近平总书记在武汉考察时的重要讲话精神，坚持快准严实细，毫不放松抓好常态化疫情防控。要坚持创新驱动发展，推动人才链、创新链、产业链深度融合。要以“党建引领、夯基惠民”工程为抓手，夯实基层治理基础。。会议强调，要深入学习贯彻习近平总书记在新疆考察时的重要讲话精神，加大对口援疆工作力度，共同把新疆的工作做好。要推动发展成果惠及民生，实施惠民利民工程，把群众的事做到点子上、办在心坎上。要推动全面从严治党向纵深发展，持续构建风清气正的政治生态。。会议强调，要深刻领会“一国两制”的根本宗旨，更好地服务党中央对港工作大局。要充分发挥莆商莆侨优势，深化莆港经贸、文旅、人才等交流合作，引导广大在港莆籍乡亲继续发扬爱国爱港优良传统，积极参与支持香港经济社会建设。。会议强调，要深入学习贯彻习近平总书记给中国国家博物馆老专家的回信精神，坚定文化自信，心存敬畏，加强文物保护传承和活化利用，推动文物保护与文旅产业融合发展，更好地赓续城市文脉，充分展示我市文物和文化的独特魅力。。会议强调，要深入学习贯彻习近平总书记给参加海峡青年论坛的台湾青年的回信精神，秉持“两岸一家亲”理念，持续推进莆台经济社会互动，为广大台湾青年来莆学习生活、就业、创业提供更多便利，让他们愿意来、留得下、融得进。。会议强调，要深入学习贯彻习近平总书记致世界互联网大会国际组织成立的贺信精神，深刻把握信息化时代发展潮流，大力发展数字经济，加快“全市一张图、全域数字化”建设，以数字赋能产业，促进数字技术与实体经济深度融合。。会议强调，要把稳增长摆在更加突出位置，全面落实国家、省、市稳住经济一揽子政策举措，推动经济平稳健康发展。要持续深化改革，激发市场活力和社会创造力。要全力稳就业保民生，牢牢守住安全底线，不断增强群众的获得感、幸福感、安全感。,其他,0.5051749675331534,True
111,福建省,莆田市,付朝阳主持召开市委常委会会议传达学习信访工作条例精神等,2022-05-05,http://www.putian.gov.cn/zwgk/ptdt/ldhd/202205/t20220505_1722581.htm,近日，市委书记付朝阳主持召开市委常委会会议暨市委扶贫开发成果巩固与乡村振兴工作领导小组会议，传达学习贯彻《信访工作条例》精神，听取2022年我市信访工作情况，研究部署下一步工作；听取巩固拓展脱贫攻坚成果全面推进乡村振兴工作情况汇报；审议《莆田市妇女发展纲要（2021—2030年）（送审稿）》和《莆田市儿童发展纲要（2021—2030年）（送审稿）》；传达学习全省基层党建工作重点任务推进会精神、全省档案工作视频会议精神，研究我市贯彻意见。。会议指出，信访工作是反映社情民意的重要渠道，是密切党群干群关系的重要纽带。要深入学习贯彻习近平总书记关于加强和改进人民信访工作的重要思想，贯彻落实《信访工作条例》，从讲政治高度做好信访工作，切实营造安定稳定的社会环境。各级领导干部要下沉基层、真抓实干，结合实施“党建引领、夯基惠民”工程，带头落实挂钩包案督办、接访下访等机制，依法依规、用心用情解决群众信访诉求，真正做到案结事了、事心双解。。会议强调，各级各部门要深入学习贯彻习近平总书记关于“三农”工作的重要论述，切实牢记“国之大者”，以更强的责任感、更实的工作举措，持续巩固拓展脱贫攻坚成果，接续推进乡村振兴。要坚持一村一档、一村一策，紧盯乡村振兴中的短板弱项，对照年度目标任务，建立台账、逐一整改，推动乡村产业、乡村治理、乡村建设全面提升。。会议强调，要深入学习贯彻习近平总书记关于妇女儿童工作的重要论述，落实男女平等基本国策和儿童优先原则，站位全局，强化底线思维，系统推动妇女儿童事业发展。要坚持问题导向、结果导向，对重点人群、重点环节、重点场所加大投入。要建立动态监测评估机制，推动纲要落实落地，不断增强妇女儿童的获得感、幸福感、安全感。。会议强调，要牢记档案工作姓党的政治属性，认真履行“为党管档、为国守史、为民服务”职责，创新方式方法，不断提升档案服务的质量和水平。要坚持守正创新、服务发展，立足主责主业，拓展档案工作覆盖领域，讲好莆田高质量发展的故事。。会议强调，要深入学习贯彻习近平总书记关于加强基层党建工作的重要论述，聚焦基层党建重点任务，以“党建引领、夯基惠民”工程为抓手，健全基层末端组织体系，打造党建特色品牌，让党旗在一线高高飘扬。各级党委（党组）要落实好主体责任、第一责任人职责，推动基层党建工作提质增效，为全方位推进高质量发展超越提供坚实组织保证。（记者 吴琪娜）,近日，市委书记付朝阳主持召开市委常委会会议暨市委扶贫开发成果巩固与乡村振兴工作领导小组会议，传达学习贯彻《信访工作条例》精神，听取2022年我市信访工作情况，研究部署下一步工作；听取巩固拓展脱贫攻坚成果全面推进乡村振兴工作情况汇报；审议《莆田市妇女发展纲要（2021—2030年）（送审稿）》和《莆田市儿童发展纲要（2021—2030年）（送审稿）》；传达学习全省基层党建工作重点任务推进会精神、全省档案工作视频会议精神，研究我市贯彻意见。。会议指出，信访工作是反映社情民意的重要渠道，是密切党群干群关系的重要纽带。要深入学习贯彻习近平总书记关于加强和改进人民信访工作的重要思想，贯彻落实《信访工作条例》，从讲政治高度做好信访工作，切实营造安定稳定的社会环境。各级领导干部要下沉基层、真抓实干，结合实施“党建引领、夯基惠民”工程，带头落实挂钩包案督办、接访下访等机制，依法依规、用心用情解决群众信访诉求，真正做到案结事了、事心双解。。会议强调，各级各部门要深入学习贯彻习近平总书记关于“三农”工作的重要论述，切实牢记“国之大者”，以更强的责任感、更实的工作举措，持续巩固拓展脱贫攻坚成果，接续推进乡村振兴。要坚持一村一档、一村一策，紧盯乡村振兴中的短板弱项，对照年度目标任务，建立台账、逐一整改，推动乡村产业、乡村治理、乡村建设全面提升。。会议强调，要深入学习贯彻习近平总书记关于妇女儿童工作的重要论述，落实男女平等基本国策和儿童优先原则，站位全局，强化底线思维，系统推动妇女儿童事业发展。要坚持问题导向、结果导向，对重点人群、重点环节、重点场所加大投入。要建立动态监测评估机制，推动纲要落实落地，不断增强妇女儿童的获得感、幸福感、安全感。。会议强调，要牢记档案工作姓党的政治属性，认真履行“为党管档、为国守史、为民服务”职责，创新方式方法，不断提升档案服务的质量和水平。要坚持守正创新、服务发展，立足主责主业，拓展档案工作覆盖领域，讲好莆田高质量发展的故事。。会议强调，要深入学习贯彻习近平总书记关于加强基层党建工作的重要论述，聚焦基层党建重点任务，以“党建引领、夯基惠民”工程为抓手，健全基层末端组织体系，打造党建特色品牌，让党旗在一线高高飘扬。各级党委（党组）要落实好主体责任、第一责任人职责，推动基层党建工作提质增效，为全方位推进高质量发展超越提供坚实组织保证。（记者 吴琪娜）,其他,0.7718272489358001,True
111,福建省,莆田市,紧扣中心工作强化结果效果导向在打造典范机关中体现担当作为市委办理论学习中心组学习扩大会议召开,2022-02-10,http://www.putian.gov.cn/zwgk/ptdt/ptyw/202202/t20220210_1704708.htm,紧扣中心工作强化结果效果导向 在打造典范机关中体现担当作为 市委办理论学习中心组学习（扩大）会议召开。2月7日，市委常委、秘书长黄珍耀主持召开市委办理论学习中心组学习（扩大）会议，传达学习市委书记付朝阳、市长林旭阳对抓好市“两办”工作的讲话要求。。黄珍耀指出，付朝阳书记、林旭阳市长在节后上班第一天就召开会议，与市“两办”中层以上干部座谈，充分体现了对办公室工作的高度重视，对办公室干部寄予的殷切期望。要对标对表习近平总书记“五个坚持”重要要求，围绕市委中心大局，以最高的责任感和最强的责任心办好每一件事情，切实当好市委的“坚强前哨”和“巩固后院”。。黄珍耀强调，要用心学习领会，提升工作标准，树立标杆争先，着力打造典范机关。要立足岗位实际，制定行动方案，坚持工作清单化、清单责任化，梳理工作流程，完善工作机制，推动闭环管理，确保市委各项决策部署落到实处。要紧扣工作要求，围绕“强有力、高效率、善统筹、优服务”，以实干树立威信，强化结果导向、效果导向，高标准高质量完成参谋辅政、督促检查、综合协调、后勤保障以及改革等各项工作，做到刚柔并济、张弛有度，全面提升“三服务”工作质量和水平。（记者 林英）,紧扣中心工作强化结果效果导向 在打造典范机关中体现担当作为 市委办理论学习中心组学习（扩大）会议召开。2月7日，市委常委、秘书长黄珍耀主持召开市委办理论学习中心组学习（扩大）会议，传达学习市委书记付朝阳、市长林旭阳对抓好市“两办”工作的讲话要求。。黄珍耀指出，付朝阳书记、林旭阳市长在节后上班第一天就召开会议，与市“两办”中层以上干部座谈，充分体现了对办公室工作的高度重视，对办公室干部寄予的殷切期望。要对标对表习近平总书记“五个坚持”重要要求，围绕市委中心大局，以最高的责任感和最强的责任心办好每一件事情，切实当好市委的“坚强前哨”和“巩固后院”。。黄珍耀强调，要用心学习领会，提升工作标准，树立标杆争先，着力打造典范机关。要立足岗位实际，制定行动方案，坚持工作清单化、清单责任化，梳理工作流程，完善工作机制，推动闭环管理，确保市委各项决策部署落到实处。要紧扣工作要求，围绕“强有力、高效率、善统筹、优服务”，以实干树立威信，强化结果导向、效果导向，高标准高质量完成参谋辅政、督促检查、综合协调、后勤保障以及改革等各项工作，做到刚柔并济、张弛有度，全面提升“三服务”工作质量和水平。（记者 林英）,其他,0.6484798315567755,True
111,福建省,莆田市,市委常委会会议召开传达学习全国全省统战部长会议精神等,2022-01-30,http://www.putian.gov.cn/zwgk/ptdt/ldhd/202201/t20220130_1703312.htm,会议强调，要学懂弄通做实习近平总书记关于加强和改进统一战线工作的重要思想，切实提高政治判断力、政治领悟力、政治执行力，进一步筑牢共同奋斗的思想根基。要聚焦中心大局，充分发挥莆商莆侨莆人潜能，激发莆资莆能莆智活力，助力全方位推进高质量发展超越。要把党的领导贯穿统战工作全过程各方面，不断巩固深化大统战工作格局。。会议强调，贯彻落实全省2021年度市委书记抓基层党建述职评议会议精神，要突出政治建设，教育引导党员干部忠诚拥护“两个确立”、坚决做到“两个维护”。要强基固本提质，坚持问题导向、重心下移，实施“党建引领、夯基惠民”工程，强化末端组织体系建设，健全融合机制，统筹推动各领域基层党组织从有形覆盖向有效覆盖提升，确保坚强有力、畅通有效。要推动基层党建与中心工作同频共振，以高质量党建引领保障高质量发展。。会议强调，要深入学习贯彻习近平总书记关于新时代人才工作的新理念新战略新举措，牢固树立“大人才观”，在全社会营造重视人才、尊崇人才、吸引人才、用好人才的浓厚氛围。要抓好关键环节，紧扣全市经济社会发展大局，着眼问题导向、结果导向，打破惯性思维、条条框框，不拘一格荐人才、不拘形式用人才、不拘模式活人才。各级党委要把人才工作摆上重要议事日程，主要负责同志亲自抓，组织人事部门牵头抓，各有关部门密切配合主动抓，切实凝聚起做好人才工作的强大合力。。会议强调，要深入学习贯彻习近平总书记关于宣传思想工作的重要论述，把迎接、宣传、贯彻党的二十大作为今年宣传工作的主线，大力弘扬主旋律，壮大正能量。要强化主责主业，统筹做好理论武装、新闻宣传、文化文艺、精神文明建设等工作，加强对网络空间的监测、预警、会商、研判，确保管得住、管得好，营造和谐的社会氛围。要强化自身建设，全面加强宣传思想战线党的领导和党的建设，打造政治过硬、本领高强、求实创新、能打胜仗的宣传思想工作队伍。,会议强调，要学懂弄通做实习近平总书记关于加强和改进统一战线工作的重要思想，切实提高政治判断力、政治领悟力、政治执行力，进一步筑牢共同奋斗的思想根基。要聚焦中心大局，充分发挥莆商莆侨莆人潜能，激发莆资莆能莆智活力，助力全方位推进高质量发展超越。要把党的领导贯穿统战工作全过程各方面，不断巩固深化大统战工作格局。。会议强调，贯彻落实全省2021年度市委书记抓基层党建述职评议会议精神，要突出政治建设，教育引导党员干部忠诚拥护“两个确立”、坚决做到“两个维护”。要强基固本提质，坚持问题导向、重心下移，实施“党建引领、夯基惠民”工程，强化末端组织体系建设，健全融合机制，统筹推动各领域基层党组织从有形覆盖向有效覆盖提升，确保坚强有力、畅通有效。要推动基层党建与中心工作同频共振，以高质量党建引领保障高质量发展。。会议强调，要深入学习贯彻习近平总书记关于新时代人才工作的新理念新战略新举措，牢固树立“大人才观”，在全社会营造重视人才、尊崇人才、吸引人才、用好人才的浓厚氛围。要抓好关键环节，紧扣全市经济社会发展大局，着眼问题导向、结果导向，打破惯性思维、条条框框，不拘一格荐人才、不拘形式用人才、不拘模式活人才。各级党委要把人才工作摆上重要议事日程，主要负责同志亲自抓，组织人事部门牵头抓，各有关部门密切配合主动抓，切实凝聚起做好人才工作的强大合力。。会议强调，要深入学习贯彻习近平总书记关于宣传思想工作的重要论述，把迎接、宣传、贯彻党的二十大作为今年宣传工作的主线，大力弘扬主旋律，壮大正能量。要强化主责主业，统筹做好理论武装、新闻宣传、文化文艺、精神文明建设等工作，加强对网络空间的监测、预警、会商、研判，确保管得住、管得好，营造和谐的社会氛围。要强化自身建设，全面加强宣传思想战线党的领导和党的建设，打造政治过硬、本领高强、求实创新、能打胜仗的宣传思想工作队伍。,其他,0.7501543107316387,True
111,福建省,莆田市,市政府党组召开党史学习教育总结会议,2022-01-30,http://www.putian.gov.cn/zwgk/ptdt/ptyw/202201/t20220130_1703278.htm,1月27日下午，市政府党组召开党史学习教育总结会议。市政府党组书记、市长林旭阳出席并讲话。市委常委、常务副市长陈志强主持。。会议传达学习了习近平总书记重要指示精神以及党史学习教育总结会议，全省、全市党史学习教育总结会议精神，并对市政府党组党史学习教育工作进行总结。。林旭阳指出，在全党开展党史学习教育，是以习近平同志为核心的党中央立足百年党史新起点、着眼开创事业发展新局面作出的一项重大决策部署。要深入学习、深刻领会，持续增强学习运用党的历史的自觉性和坚定性，牢记“两个确立”，增强“四个意识”、坚定“四个自信”、做到“两个维护”。。林旭阳指出，一年来，市政府党组结合开展“再学习、再调研、再落实”活动，通过“学党史”坚定理想信念、“悟思想”锤炼忠诚品格、“办实事”厚植为民情怀、“开新局”提振拼搏精神，推动党史学习教育走深走实。。林旭阳强调，要强化理论武装，健全完善学党史与学理论相结合的制度机制，从科学理论中找方法、找思路、找对策。要牢记“两个确立”，心系“国之大者”，更加自觉地拥戴核心、信赖核心、忠诚核心、维护核心。要践行为民初心，健全完善“我为群众办实事”的长效机制，更好满足人民对美好生活的向往。要强化担当作为，全力抓产业转型升级、扩大有效投资、促进消费恢复，稳外贸稳外资，统筹发展和安全工作，确保社会大局和谐稳定。要推进自我革命，要始终保持赶考的清醒，以永远在路上的执着和韧劲推动全面从严治党向纵深发展。（记者 吴琪娜）,1月27日下午，市政府党组召开党史学习教育总结会议。市政府党组书记、市长林旭阳出席并讲话。市委常委、常务副市长陈志强主持。。会议传达学习了习近平总书记重要指示精神以及党史学习教育总结会议，全省、全市党史学习教育总结会议精神，并对市政府党组党史学习教育工作进行总结。。林旭阳指出，在全党开展党史学习教育，是以习近平同志为核心的党中央立足百年党史新起点、着眼开创事业发展新局面作出的一项重大决策部署。要深入学习、深刻领会，持续增强学习运用党的历史的自觉性和坚定性，牢记“两个确立”，增强“四个意识”、坚定“四个自信”、做到“两个维护”。。林旭阳指出，一年来，市政府党组结合开展“再学习、再调研、再落实”活动，通过“学党史”坚定理想信念、“悟思想”锤炼忠诚品格、“办实事”厚植为民情怀、“开新局”提振拼搏精神，推动党史学习教育走深走实。。林旭阳强调，要强化理论武装，健全完善学党史与学理论相结合的制度机制，从科学理论中找方法、找思路、找对策。要牢记“两个确立”，心系“国之大者”，更加自觉地拥戴核心、信赖核心、忠诚核心、维护核心。要践行为民初心，健全完善“我为群众办实事”的长效机制，更好满足人民对美好生活的向往。要强化担当作为，全力抓产业转型升级、扩大有效投资、促进消费恢复，稳外贸稳外资，统筹发展和安全工作，确保社会大局和谐稳定。要推进自我革命，要始终保持赶考的清醒，以永远在路上的执着和韧劲推动全面从严治党向纵深发展。（记者 吴琪娜）,其他,0.722047846123664,True
