code,province,city,topic,date,url,content,content.1,label,score,is_match
111,福建省,莆田市,市委理论学习中心组学习会召开围绕党史学习教育专题民主生活会主题开展学习研讨,2022-01-12,http://www.putian.gov.cn/zwgk/ptdt/ptyw/202201/t20220112_1697445.htm,1月11日，市委理论学习中心组学习会召开，围绕党史学习教育专题民主生活会主题，开展学习研讨，进一步统一思想、深化认识，为开好专题民主生活会打牢思想基础。市委书记付朝阳主持，市领导林旭阳、沈萌芽、季翔峰、练欣、袁素玲、陈志强、陈惠黔、郑加清、黄珍耀出席。。会前，大家进一步认真学习领会了习近平新时代中国特色社会主义思想和习近平总书记在党的十九届六中全会、党史学习教育专题民主生活会等会议上发表的重要讲话精神，以及省第十一次党代会、市第八次党代会精神等有关内容。会议开展集中研讨，并研究市委常委会班子党史学习教育专题民主生活会准备工作。付朝阳、林旭阳、季翔峰、练欣、袁素玲作交流发言。。会议指出，中央政治局召开党史学习教育专题民主生活会，为全党树立了标杆。习近平总书记的重要讲话，为我们弘扬伟大建党精神、坚持党的百年奋斗历史经验、走好新的赶考之路，进一步指明了方向、提供了遵循。我们要认真学习贯彻，在新时代新征程上展现新气象新作为。。会议指出，党的十九届六中全会以历史决议的形式作出“两个确立”重要论断，这是党的十八大以来最重要的政治成果，是推进中华民族伟大复兴最根本的政治保证。我们必须始终牢记“两个确立”，增强忠诚核心、拥戴核心、维护核心的政治自觉，把对习近平总书记的深厚爱戴之情内化于心、外化于行，一以贯之落实好习近平总书记治理木兰溪的重要理念和保护好湄洲岛的重要嘱托。。会议强调，要始终坚定历史自信。进一步巩固拓展党史学习教育成果，坚定历史自信、把握历史规律，从党的伟大成就中坚定信心决心，从党的历史经验中汲取智慧力量，增强应对挑战、克服困难、夺取胜利的志气、底气、骨气。。会议强调，要始终践行初心使命。全方位推进高质量发展超越是我们的重大历史使命，要聚焦省市党代会部署，俯下身子抓产业、一心一意谋发展，更好地统筹发展和安全，坚持人民至上，厚植情怀、换位思考、以心换心，切实解决好群众“急难愁盼”问题，让群众有更多的获得感、幸福感、安全感。。会议强调，要始终加强自身建设。市委常委会班子成员作为全市“关键少数”中的关键，要带头树牢崇高的理想信念，带头弘扬党的优良作风，带头团结一致同心同向，带头讲纪律守底线，深入实际、深入基层、深入群众，狠抓工作落实，共同打造真诚阳光、担当奉献、忠廉规矩的领导班子。（记者 黄国清）,1月11日，市委理论学习中心组学习会召开，围绕党史学习教育专题民主生活会主题，开展学习研讨，进一步统一思想、深化认识，为开好专题民主生活会打牢思想基础。市委书记付朝阳主持，市领导林旭阳、沈萌芽、季翔峰、练欣、袁素玲、陈志强、陈惠黔、郑加清、黄珍耀出席。。会前，大家进一步认真学习领会了习近平新时代中国特色社会主义思想和习近平总书记在党的十九届六中全会、党史学习教育专题民主生活会等会议上发表的重要讲话精神，以及省第十一次党代会、市第八次党代会精神等有关内容。会议开展集中研讨，并研究市委常委会班子党史学习教育专题民主生活会准备工作。付朝阳、林旭阳、季翔峰、练欣、袁素玲作交流发言。。会议指出，中央政治局召开党史学习教育专题民主生活会，为全党树立了标杆。习近平总书记的重要讲话，为我们弘扬伟大建党精神、坚持党的百年奋斗历史经验、走好新的赶考之路，进一步指明了方向、提供了遵循。我们要认真学习贯彻，在新时代新征程上展现新气象新作为。。会议指出，党的十九届六中全会以历史决议的形式作出“两个确立”重要论断，这是党的十八大以来最重要的政治成果，是推进中华民族伟大复兴最根本的政治保证。我们必须始终牢记“两个确立”，增强忠诚核心、拥戴核心、维护核心的政治自觉，把对习近平总书记的深厚爱戴之情内化于心、外化于行，一以贯之落实好习近平总书记治理木兰溪的重要理念和保护好湄洲岛的重要嘱托。。会议强调，要始终坚定历史自信。进一步巩固拓展党史学习教育成果，坚定历史自信、把握历史规律，从党的伟大成就中坚定信心决心，从党的历史经验中汲取智慧力量，增强应对挑战、克服困难、夺取胜利的志气、底气、骨气。。会议强调，要始终践行初心使命。全方位推进高质量发展超越是我们的重大历史使命，要聚焦省市党代会部署，俯下身子抓产业、一心一意谋发展，更好地统筹发展和安全，坚持人民至上，厚植情怀、换位思考、以心换心，切实解决好群众“急难愁盼”问题，让群众有更多的获得感、幸福感、安全感。。会议强调，要始终加强自身建设。市委常委会班子成员作为全市“关键少数”中的关键，要带头树牢崇高的理想信念，带头弘扬党的优良作风，带头团结一致同心同向，带头讲纪律守底线，深入实际、深入基层、深入群众，狠抓工作落实，共同打造真诚阳光、担当奉献、忠廉规矩的领导班子。（记者 黄国清）,其他,0.7689289774534432,True
111,福建省,莆田市,赓续红色血脉激发奋进力量市管领导干部学习贯彻习近平总书记来闽考察重要讲话精神专题研讨班暨市级领导班子党史学习教育专题读书班综述,2021-06-10,http://www.putian.gov.cn/zwgk/ptdt/ptyw/202106/t20210610_1619429.htm,赓续红色血脉 激发奋进力量——市管领导干部学习贯彻习近平总书记来闽考察重要讲话精神专题研讨班暨市级领导班子党史学习教育专题读书班综述。为把学习贯彻习近平总书记来闽考察重要讲话精神引向深入、把党史学习教育引向深入、把“再学习、再调研、再落实”活动引向深入，6月7日至9日，市管领导干部学习贯彻习近平总书记来闽考察重要讲话精神专题研讨班暨市级领导班子党史学习教育专题读书班举办。除主会场外，市直有关单位、各县区（管委会）设分会场收听收看，扩大了学习覆盖面。党史学习教育省委第五巡回指导组成员参加活动，进一步指导推动学习取得实效。。此次研讨班采取集中学习与个人自学、专题辅导与交流研讨相结合的形式，实现学习与工作相衔接、相促进。3天时间里，系统听取辅导，认真聆听报告，踊跃交流发言，沉心静气自学，在市博物馆开展现场教学，学员们接受精神洗礼，激发奋进力量。大家表示，将赓续红色血脉，践行初心使命，持续实施强产业、兴城市“双轮”驱动，全方位推进高质量发展超越，为奋力谱写全面建设社会主义现代化国家福建篇章作出更大贡献。。7日上午，市委书记刘建洋在开班式上强调，举办这次研讨班，就是把学习贯彻习近平总书记来闽考察重要讲话精神引向深入、把党史学习教育引向深入、把“再学习、再调研、再落实”活动引向深入，确保党中央决策部署和省委工作要求在莆田落实到位。市长李建辉在小结会上作总结讲话，提出明确要求。。刘建洋开班式上的报告，结合我市实际，对一些重大理论和实践问题进行思考和把握，让大家对习近平总书记来闽考察重要讲话精神的重大意义、丰富内涵、核心要义、实践要求有了更深的理解，对“中国共产党为什么能、马克思主义为什么行、中国特色社会主义为什么好”有了更深的领悟。大家边学边悟，更加坚定自觉地增强“四个意识”、坚定“四个自信”、做到“两个维护”。。在《赓续共产党人的精神血脉 为立党兴党强党提供滋养——中共在福建红土地上的英勇奋斗史》《“‘十四五’规划经济高质量发展重要经济主题解读》《习近平生态文明思想在福建的孕育与实践》等专题辅导报告上，学员们认真聆听，仔细记录，用心领会。党史学习教育省委宣讲团成员、省委党史方志办一级巡视员俞杰对福建红土地上英雄奋斗史的精彩解读，省委党校经济学教研部副主任、教授陈新对高质量发展重要经济的深入思考，省委党校生态文明教研部主任胡熠教授对习近平生态文明思想在福建的孕育与实践的分析讲解，让大家对党和国家的战略部署“既知其然、又知其所以然”，既深化了“怎么看”的理解，又理清了“怎么干”的思路，让大家对立足新发展阶段、贯彻新发展理念、积极服务并深度融入新发展格局的路径选择，有了更加深刻、更加到位的认识。。课堂之外，学员还以个人自学方式，认真研读了习近平《论中国共产党历史》《习近平新时代中国特色社会主义思想学习问答》《中国共产党简史》等指定书目和重点参考材料，在党史学习中感悟初心使命，汲取精神力量。。“这次研讨班，对于我们学深学透习近平总书记来闽考察重要讲话精神，深入推进党史学习教育，具有十分重要的意义。”仙游县主要负责同志说，将持续学深悟透习近平总书记来闽考察重要讲话精神，深入推进党史学习教育，扎实抓好“再学习、再调研、再落实”活动，确保上半年“三看两评”取得更优异成绩并顺利实现“双过半”，以优异成绩庆祝建党100周年。。荔城区主要负责同志说，将紧扣习近平总书记对福建提出的“一个篇章”总目标、“四个更大”新要求和“四项重点任务”，在学习领会、贯彻落实中增进共识、凝聚力量、激发斗志，把学习成效转化为推动“十四五”开好局、起好步的强大动力。,赓续红色血脉 激发奋进力量——市管领导干部学习贯彻习近平总书记来闽考察重要讲话精神专题研讨班暨市级领导班子党史学习教育专题读书班综述。为把学习贯彻习近平总书记来闽考察重要讲话精神引向深入、把党史学习教育引向深入、把“再学习、再调研、再落实”活动引向深入，6月7日至9日，市管领导干部学习贯彻习近平总书记来闽考察重要讲话精神专题研讨班暨市级领导班子党史学习教育专题读书班举办。除主会场外，市直有关单位、各县区（管委会）设分会场收听收看，扩大了学习覆盖面。党史学习教育省委第五巡回指导组成员参加活动，进一步指导推动学习取得实效。。此次研讨班采取集中学习与个人自学、专题辅导与交流研讨相结合的形式，实现学习与工作相衔接、相促进。3天时间里，系统听取辅导，认真聆听报告，踊跃交流发言，沉心静气自学，在市博物馆开展现场教学，学员们接受精神洗礼，激发奋进力量。大家表示，将赓续红色血脉，践行初心使命，持续实施强产业、兴城市“双轮”驱动，全方位推进高质量发展超越，为奋力谱写全面建设社会主义现代化国家福建篇章作出更大贡献。。7日上午，市委书记刘建洋在开班式上强调，举办这次研讨班，就是把学习贯彻习近平总书记来闽考察重要讲话精神引向深入、把党史学习教育引向深入、把“再学习、再调研、再落实”活动引向深入，确保党中央决策部署和省委工作要求在莆田落实到位。市长李建辉在小结会上作总结讲话，提出明确要求。。刘建洋开班式上的报告，结合我市实际，对一些重大理论和实践问题进行思考和把握，让大家对习近平总书记来闽考察重要讲话精神的重大意义、丰富内涵、核心要义、实践要求有了更深的理解，对“中国共产党为什么能、马克思主义为什么行、中国特色社会主义为什么好”有了更深的领悟。大家边学边悟，更加坚定自觉地增强“四个意识”、坚定“四个自信”、做到“两个维护”。。在《赓续共产党人的精神血脉 为立党兴党强党提供滋养——中共在福建红土地上的英勇奋斗史》《“‘十四五’规划经济高质量发展重要经济主题解读》《习近平生态文明思想在福建的孕育与实践》等专题辅导报告上，学员们认真聆听，仔细记录，用心领会。党史学习教育省委宣讲团成员、省委党史方志办一级巡视员俞杰对福建红土地上英雄奋斗史的精彩解读，省委党校经济学教研部副主任、教授陈新对高质量发展重要经济的深入思考，省委党校生态文明教研部主任胡熠教授对习近平生态文明思想在福建的孕育与实践的分析讲解，让大家对党和国家的战略部署“既知其然、又知其所以然”，既深化了“怎么看”的理解，又理清了“怎么干”的思路，让大家对立足新发展阶段、贯彻新发展理念、积极服务并深度融入新发展格局的路径选择，有了更加深刻、更加到位的认识。。课堂之外，学员还以个人自学方式，认真研读了习近平《论中国共产党历史》《习近平新时代中国特色社会主义思想学习问答》《中国共产党简史》等指定书目和重点参考材料，在党史学习中感悟初心使命，汲取精神力量。。“这次研讨班，对于我们学深学透习近平总书记来闽考察重要讲话精神，深入推进党史学习教育，具有十分重要的意义。”仙游县主要负责同志说，将持续学深悟透习近平总书记来闽考察重要讲话精神，深入推进党史学习教育，扎实抓好“再学习、再调研、再落实”活动，确保上半年“三看两评”取得更优异成绩并顺利实现“双过半”，以优异成绩庆祝建党100周年。。荔城区主要负责同志说，将紧扣习近平总书记对福建提出的“一个篇章”总目标、“四个更大”新要求和“四项重点任务”，在学习领会、贯彻落实中增进共识、凝聚力量、激发斗志，把学习成效转化为推动“十四五”开好局、起好步的强大动力。,其他,0.5988794214990109,True
111,福建省,莆田市,市管干部学习贯彻习近平总书记来闽考察重要讲话精神专题研讨班暨市级领导班子党史学习教育专题读书班开班刘建洋作动员讲话李建辉等参加,2021-06-08,http://www.putian.gov.cn/zwgk/ptdt/ldhd/202106/t20210608_1618483.htm,市管干部学习贯彻习近平总书记来闽考察重要讲话精神专题研讨班暨市级领导班子党史学习教育专题读书班开班 刘建洋作动员讲话 李建辉等参加。6月7日上午，市管干部学习贯彻习近平总书记来闽考察重要讲话精神专题研讨班暨市级领导班子党史学习教育专题读书班开班。市委书记刘建洋在开班式上作动员讲话，市长李建辉、市政协主席周青松、市委副书记朱子君，党史学习教育省委第五巡回指导组组长马照南、副组长陈培坚等参加。。刘建洋指出，举办这次研讨班，主要是把学习贯彻习近平总书记来闽考察重要讲话精神和党史学习教育、“再学习、再调研、再落实”活动引向深入，进一步理清工作思想、细化工作举措，确保党中央决策部署和省委省政府工作要求在莆田落实到位。。刘建洋强调，要深刻学习领悟习近平总书记来闽考察重要讲话精神，以坚定的政治态度和强烈的感恩之情抓好贯彻落实。要注重质量第一、效益优先，做实做强做优实体经济，在加快建设现代化经济体系上抓好落实。要注重发挥比较优势，推进更高水平开放，在服务和融入新发展格局上抓好落实。要注重着眼大局大势、落细落实，深化莆台各领域融合，在探索海峡两岸融合发展新路上抓好落实。要注重统筹城乡发展，建设宜居宜业城市，在创造高品质生活上抓好落实。。刘建洋强调，要扎实推动党史学习教育，从党的百年历程中汲取智慧和力量。要严格按照中央和省里要求，推动党史学习教育向广度拓展、向深度推进。要从党的百年历程中感悟真理的力量、体悟人民的力量、汲取奋进的力量，不断坚定道路自信、理论自信、制度自信、文化自信。。刘建洋强调，要深化“再学习、再调研、再落实”活动，在学懂弄通做实上取得更大成效。要深化“再学习”促学懂，紧扣贯彻习近平总书记来闽考察重要讲话精神主线，分级分类采取多种形式推动学习全覆盖。要深化“再调研”促弄通，把调研成果转化为破解难题、推动发展的思路和举措。要深化“再落实”促做实，用好项目工作法等，力戒形式主义、官僚主义。。刘建洋强调，要提振干事创业精气神，全力抓好当前各项工作。要全面落实“六稳”“六保”，全力做好“五促一保一防一控”，聚焦项目攻坚、帮扶企业、安全发展再推进，统筹抓好政法队伍教育整顿、市县集中换届等工作，确保单位运转平稳、社会平稳、发展平稳。。开班当天，党史学习教育省委宣讲团成员、省委党史方志办一级巡视员俞杰作了“赓续共产党人的精神血脉 为立党兴党强党提供滋养——中共在福建红土地上的英勇奋斗史”专题辅导报告；省委党校经济学教研部副主任、教授陈新作了“‘十四五’规划经济高质量发展重要经济主题解读”专题辅导报告。。市委、市人大常委会、市政府、市政协领导，市法院、市检察院主要负责同志，市直有关部门主要负责同志在主会场参加，市直有关部门、各县区（管委会）设分会场收听收看。（记者 黄国清）,市管干部学习贯彻习近平总书记来闽考察重要讲话精神专题研讨班暨市级领导班子党史学习教育专题读书班开班 刘建洋作动员讲话 李建辉等参加。6月7日上午，市管干部学习贯彻习近平总书记来闽考察重要讲话精神专题研讨班暨市级领导班子党史学习教育专题读书班开班。市委书记刘建洋在开班式上作动员讲话，市长李建辉、市政协主席周青松、市委副书记朱子君，党史学习教育省委第五巡回指导组组长马照南、副组长陈培坚等参加。。刘建洋指出，举办这次研讨班，主要是把学习贯彻习近平总书记来闽考察重要讲话精神和党史学习教育、“再学习、再调研、再落实”活动引向深入，进一步理清工作思想、细化工作举措，确保党中央决策部署和省委省政府工作要求在莆田落实到位。。刘建洋强调，要深刻学习领悟习近平总书记来闽考察重要讲话精神，以坚定的政治态度和强烈的感恩之情抓好贯彻落实。要注重质量第一、效益优先，做实做强做优实体经济，在加快建设现代化经济体系上抓好落实。要注重发挥比较优势，推进更高水平开放，在服务和融入新发展格局上抓好落实。要注重着眼大局大势、落细落实，深化莆台各领域融合，在探索海峡两岸融合发展新路上抓好落实。要注重统筹城乡发展，建设宜居宜业城市，在创造高品质生活上抓好落实。。刘建洋强调，要扎实推动党史学习教育，从党的百年历程中汲取智慧和力量。要严格按照中央和省里要求，推动党史学习教育向广度拓展、向深度推进。要从党的百年历程中感悟真理的力量、体悟人民的力量、汲取奋进的力量，不断坚定道路自信、理论自信、制度自信、文化自信。。刘建洋强调，要深化“再学习、再调研、再落实”活动，在学懂弄通做实上取得更大成效。要深化“再学习”促学懂，紧扣贯彻习近平总书记来闽考察重要讲话精神主线，分级分类采取多种形式推动学习全覆盖。要深化“再调研”促弄通，把调研成果转化为破解难题、推动发展的思路和举措。要深化“再落实”促做实，用好项目工作法等，力戒形式主义、官僚主义。。刘建洋强调，要提振干事创业精气神，全力抓好当前各项工作。要全面落实“六稳”“六保”，全力做好“五促一保一防一控”，聚焦项目攻坚、帮扶企业、安全发展再推进，统筹抓好政法队伍教育整顿、市县集中换届等工作，确保单位运转平稳、社会平稳、发展平稳。。开班当天，党史学习教育省委宣讲团成员、省委党史方志办一级巡视员俞杰作了“赓续共产党人的精神血脉 为立党兴党强党提供滋养——中共在福建红土地上的英勇奋斗史”专题辅导报告；省委党校经济学教研部副主任、教授陈新作了“‘十四五’规划经济高质量发展重要经济主题解读”专题辅导报告。。市委、市人大常委会、市政府、市政协领导，市法院、市检察院主要负责同志，市直有关部门主要负责同志在主会场参加，市直有关部门、各县区（管委会）设分会场收听收看。（记者 黄国清）,其他,0.6571941535343496,True
