code,province,city,topic,date,url,content,content.1,label,score,is_match
111,福建省,莆田市,加强合作实现共赢中核集团考察团一行来莆,2020-10-26,http://www.putian.gov.cn/zwgk/ptdt/ptyw/202010/t20201026_1533019.htm,10月22日至23日，中核集团产业开发与国际合作部主任王德林带队来莆考察。市长李建辉与考察团一行座谈，市委常委、常务副市长傅冬阳一同参加。。座谈会上，李建辉对考察团的到来表示欢迎，并介绍了莆田的基本情况。他说，近年来，莆田市以习近平总书记关于健康中国建设系列重要论述为指导，深入贯彻实施“健康中国”战略，发挥莆田妈祖文化、民营医疗等独特优势，高起点、高标准规划建设妈祖健康城，大力发展医疗健康产业，推动核医学产业相关项目研发，建设运营核医学产业园、妈祖重离子医院等，与中核集团有着广阔的合作空间。希望双方能进一步加强合作，强化互补，实现共赢。。王德林介绍了中核集团及成员公司的基本情况，并表示，希望与莆田常来常往，增进交流，共同搭建友好合作关系，为下一步确定具体合作项目打下基础。。在莆期间，考察团一行还前往木兰溪防洪工程奠基点、妈祖健康城等地进行实地考察。（记者 林英 陈沛达）,10月22日至23日，中核集团产业开发与国际合作部主任王德林带队来莆考察。市长李建辉与考察团一行座谈，市委常委、常务副市长傅冬阳一同参加。。座谈会上，李建辉对考察团的到来表示欢迎，并介绍了莆田的基本情况。他说，近年来，莆田市以习近平总书记关于健康中国建设系列重要论述为指导，深入贯彻实施“健康中国”战略，发挥莆田妈祖文化、民营医疗等独特优势，高起点、高标准规划建设妈祖健康城，大力发展医疗健康产业，推动核医学产业相关项目研发，建设运营核医学产业园、妈祖重离子医院等，与中核集团有着广阔的合作空间。希望双方能进一步加强合作，强化互补，实现共赢。。王德林介绍了中核集团及成员公司的基本情况，并表示，希望与莆田常来常往，增进交流，共同搭建友好合作关系，为下一步确定具体合作项目打下基础。。在莆期间，考察团一行还前往木兰溪防洪工程奠基点、妈祖健康城等地进行实地考察。（记者 林英 陈沛达）,其他,0.5361339411612437,True
111,福建省,莆田市,市委理论学习中心组学习会召开围绕习近平在福州一书开展研讨交流,2020-09-11,http://www.putian.gov.cn/zwgk/ptdt/ptyw/202009/t20200911_1523687.htm,9月9日下午，市委书记刘建洋主持召开市委理论学习中心组学习会，围绕《习近平在福州》一书开展研讨交流。市领导李建辉、李飞亭、郑春洪、傅冬阳、卓晓銮、吴立新、沈伯麟出席。。会上，郑春洪、傅冬阳、卓晓銮、吴立新、沈伯麟同志围绕会议主题作了重点发言，其他同志作了交流发言。。会议强调，要持续在细学深思上下功夫。《习近平在福州》客观再现了习近平总书记在福州工作时的生动实践，为我们进一步学习贯彻习近平新时代中国特色社会主义思想提供了鲜活教材。要反反复复学、深入思考学、联系实际学，进一步深化对习近平新时代中国特色社会主义思想理论逻辑和实践逻辑的理解和把握，真正把习近平总书记在福建工作时创造的宝贵思想财富、精神财富和实践成果传承好、弘扬好。。会议强调，要持续在知行合一上见实效。坚持把学用结合、知行合一贯彻到学习的全过程，结合莆田实际，聚焦思想上的困惑、工作中的难题，从习近平总书记的创新理念和重大实践中找方法、找对策、找答案。特别是当前，要聚焦强产业、兴城市“双轮”驱动，着眼今明、着重今年，一个项目一个项目抓落地，一个片区一个片区抓推进，以强产兴城的工作成效来检验学习的实际成果，全方位推动高质量发展超越。。会议强调，要持续在学习宣传上掀热潮。各级党委（党组）要把学习宣传贯彻《习近平在福州》等采访实录作为一项重要政治任务，特别是各级领导干部作为关键少数，要发挥头雁效应，坚持领学、带学、促学，带动全市广大党员干部学出坚定信念、学出绝对忠诚、学出使命担当、学出过硬作风。宣传部门要开展更用心、更走心的宣传活动，不断兴起学习宣传贯彻热潮，为统筹推进常态化疫情防控和经济社会发展积蓄正能量。（记者 黄国清）,9月9日下午，市委书记刘建洋主持召开市委理论学习中心组学习会，围绕《习近平在福州》一书开展研讨交流。市领导李建辉、李飞亭、郑春洪、傅冬阳、卓晓銮、吴立新、沈伯麟出席。。会上，郑春洪、傅冬阳、卓晓銮、吴立新、沈伯麟同志围绕会议主题作了重点发言，其他同志作了交流发言。。会议强调，要持续在细学深思上下功夫。《习近平在福州》客观再现了习近平总书记在福州工作时的生动实践，为我们进一步学习贯彻习近平新时代中国特色社会主义思想提供了鲜活教材。要反反复复学、深入思考学、联系实际学，进一步深化对习近平新时代中国特色社会主义思想理论逻辑和实践逻辑的理解和把握，真正把习近平总书记在福建工作时创造的宝贵思想财富、精神财富和实践成果传承好、弘扬好。。会议强调，要持续在知行合一上见实效。坚持把学用结合、知行合一贯彻到学习的全过程，结合莆田实际，聚焦思想上的困惑、工作中的难题，从习近平总书记的创新理念和重大实践中找方法、找对策、找答案。特别是当前，要聚焦强产业、兴城市“双轮”驱动，着眼今明、着重今年，一个项目一个项目抓落地，一个片区一个片区抓推进，以强产兴城的工作成效来检验学习的实际成果，全方位推动高质量发展超越。。会议强调，要持续在学习宣传上掀热潮。各级党委（党组）要把学习宣传贯彻《习近平在福州》等采访实录作为一项重要政治任务，特别是各级领导干部作为关键少数，要发挥头雁效应，坚持领学、带学、促学，带动全市广大党员干部学出坚定信念、学出绝对忠诚、学出使命担当、学出过硬作风。宣传部门要开展更用心、更走心的宣传活动，不断兴起学习宣传贯彻热潮，为统筹推进常态化疫情防控和经济社会发展积蓄正能量。（记者 黄国清）,其他,0.6307733519684903,True
111,福建省,莆田市,助力强产兴城深化合作层次中国保利集团考察团来莆,2020-08-31,http://www.putian.gov.cn/zwgk/ptdt/ptyw/202008/t20200831_1521014.htm,8月27日至28日，中国保利集团党委常委、总会计师傅俊元带领考察团来我市考察调研。市委书记刘建洋与傅俊元一行就深化项目合作等事宜进行座谈，市委常委、秘书长沈伯麟一同参加。。刘建洋表示，当前，莆田正深入学习贯彻省委十届十次全会精神，大力实施强产业、兴城市“双轮”驱动，全方位推动高质量发展超越。重点围绕新城建设和旧城更新，聚焦重点片区，全力攻坚突破，推动集聚连片发展。希望保利集团积极参与莆田城市建设，进一步扩大合作领域、深化合作层次，助力莆田将“绿水青山”更有效转化为“金山银山”。。傅俊元对我市城市建设、生态保护、招商引资、产业发展等给予了高度评价。他表示，保利集团将与莆田强化对接合作，策划生成新项目，推动重点片区综合开发建设，助推莆田城市提升、产业发展。。在莆期间，考察团一行深入考察了解我市城市发展规划、生态资源保护与开发、文旅产业发展等情况。（记者 郑已东）,8月27日至28日，中国保利集团党委常委、总会计师傅俊元带领考察团来我市考察调研。市委书记刘建洋与傅俊元一行就深化项目合作等事宜进行座谈，市委常委、秘书长沈伯麟一同参加。。刘建洋表示，当前，莆田正深入学习贯彻省委十届十次全会精神，大力实施强产业、兴城市“双轮”驱动，全方位推动高质量发展超越。重点围绕新城建设和旧城更新，聚焦重点片区，全力攻坚突破，推动集聚连片发展。希望保利集团积极参与莆田城市建设，进一步扩大合作领域、深化合作层次，助力莆田将“绿水青山”更有效转化为“金山银山”。。傅俊元对我市城市建设、生态保护、招商引资、产业发展等给予了高度评价。他表示，保利集团将与莆田强化对接合作，策划生成新项目，推动重点片区综合开发建设，助推莆田城市提升、产业发展。。在莆期间，考察团一行深入考察了解我市城市发展规划、生态资源保护与开发、文旅产业发展等情况。（记者 郑已东）,政府领导到其他城市考察学习或访问,0.0,True
111,福建省,莆田市,市委理论学习中心组学习扩大会议召开付朝阳等出席,2022-05-18,http://www.putian.gov.cn/zwgk/ptdt/ptyw/202205/t20220518_1725742.htm,为深入学习贯彻习近平总书记关于宣传思想工作的重要思想，严格落实意识形态工作责任制，进一步提升媒介素养和舆情处置能力，有效防范化解风险隐患，5月17日上午，市委召开理论学习中心组学习（扩大）会议，邀请《中国青年报》福建记者站站长陈强作“全媒体时代如何与媒体打交道”专题辅导报告。市领导付朝阳、苏永革、沈萌芽、季翔峰、练欣、袁素玲、陈超、陈志强、郑加清、郭宋玉、黄珍耀等出席。市委常委、宣传部部长陈惠黔主持学习会。。陈强是中国青年报高级记者、高级舆情分析师，长期从事新闻一线采编工作。辅导报告中，他从“与媒体打交道的误区”“人人都是记者的时代”“当前网络舆情的特点”“应对舆情危机的技巧”等四个方面，结合自身工作经历和实践经验，系统阐述了与媒体打交道的常识和处置突发舆情的技巧。报告紧扣形势、内容丰富、通俗易懂，对与会人员提升媒介素养，做好舆论引导工作具有很强的针对性和指导性。。受市委书记付朝阳委托，陈惠黔在会上强调，要深刻认识到党的新闻舆论工作的极端重要性，严格落实意识形态工作责任制和网络意识形态工作责任制，牢牢掌握工作领导权、管理权、话语权，做到守土有责、守土负责、守土尽责，创造良好的舆论生态，为党的二十大胜利召开营造安全稳定的政治社会环境。。会议以视频形式召开。市各套班子领导，市法院、市检察院主要领导，莆田学院、湄洲湾职业技术学院主要领导以及市直有关单位主要负责同志在主会场参加会议。各县区（管委会）设分会场，全市共有600多名领导干部参会。（记者 黄国清）,为深入学习贯彻习近平总书记关于宣传思想工作的重要思想，严格落实意识形态工作责任制，进一步提升媒介素养和舆情处置能力，有效防范化解风险隐患，5月17日上午，市委召开理论学习中心组学习（扩大）会议，邀请《中国青年报》福建记者站站长陈强作“全媒体时代如何与媒体打交道”专题辅导报告。市领导付朝阳、苏永革、沈萌芽、季翔峰、练欣、袁素玲、陈超、陈志强、郑加清、郭宋玉、黄珍耀等出席。市委常委、宣传部部长陈惠黔主持学习会。。陈强是中国青年报高级记者、高级舆情分析师，长期从事新闻一线采编工作。辅导报告中，他从“与媒体打交道的误区”“人人都是记者的时代”“当前网络舆情的特点”“应对舆情危机的技巧”等四个方面，结合自身工作经历和实践经验，系统阐述了与媒体打交道的常识和处置突发舆情的技巧。报告紧扣形势、内容丰富、通俗易懂，对与会人员提升媒介素养，做好舆论引导工作具有很强的针对性和指导性。。受市委书记付朝阳委托，陈惠黔在会上强调，要深刻认识到党的新闻舆论工作的极端重要性，严格落实意识形态工作责任制和网络意识形态工作责任制，牢牢掌握工作领导权、管理权、话语权，做到守土有责、守土负责、守土尽责，创造良好的舆论生态，为党的二十大胜利召开营造安全稳定的政治社会环境。。会议以视频形式召开。市各套班子领导，市法院、市检察院主要领导，莆田学院、湄洲湾职业技术学院主要领导以及市直有关单位主要负责同志在主会场参加会议。各县区（管委会）设分会场，全市共有600多名领导干部参会。（记者 黄国清）,其他,0.7236630912516316,True
111,福建省,莆田市,牢记嘱托感恩奋进始终坚守政治忠诚市政府党组理论学习中心组学习扩大会召开,2022-04-18,http://www.putian.gov.cn/zwgk/ptdt/ptyw/202204/t20220418_1718920.htm,近日，受市政府党组书记、市长林旭阳委托，市委常委、常务副市长陈志强主持召开市政府党组理论学习中心组学习（扩大）会，传达学习贯彻习近平总书记在参加首都义务植树活动时的重要讲话精神和中共中央、国务院关于印发《信访工作条例》的通知精神，并围绕“牢记嘱托、感恩奋进，奋力答好谱写‘福建篇章’的莆田答卷”主题开展研讨交流。。会议强调，要深入学习贯彻习近平总书记治理木兰溪的重要理念，牢固树立绿水青山就是金山银山的理念，坚持生态优先、绿色发展，纵深推进木兰溪全流域系统治理，打造践行习近平生态文明思想的示范样本。。会议指出，要深入学习贯彻习近平总书记关于加强和改进人民信访工作的重要思想，牢固树立“人民信访为人民”工作理念，紧盯重点领域，有效化解信访突出问题，切实把群众呼声反映好、合法权益维护好，为党的二十大胜利召开营造和谐稳定的社会环境。。会议强调，要始终如一坚守政治忠诚，抓好习近平总书记来闽考察重要讲话再学习再领悟，深刻领会其中的丰富内涵和精神实质，忠诚拥护“两个确立”，坚决做到“两个维护”。要鼓足干劲聚焦重点工作，加快建设现代化经济体系，积极服务和深度融入新发展格局，探索海峡两岸融合发展新路，大力创造高品质生活，切实把习近平总书记来闽考察重要讲话精神转化为砥砺前行的强大动力。要坚持不懈强化作风建设，结合实施“提高效率、提升效能、提增效益”行动，把贯彻落实习近平总书记来闽考察重要讲话精神抓得更实更细更有成效，以优异成绩迎接党的二十大胜利召开。（记者 吴琪娜）,近日，受市政府党组书记、市长林旭阳委托，市委常委、常务副市长陈志强主持召开市政府党组理论学习中心组学习（扩大）会，传达学习贯彻习近平总书记在参加首都义务植树活动时的重要讲话精神和中共中央、国务院关于印发《信访工作条例》的通知精神，并围绕“牢记嘱托、感恩奋进，奋力答好谱写‘福建篇章’的莆田答卷”主题开展研讨交流。。会议强调，要深入学习贯彻习近平总书记治理木兰溪的重要理念，牢固树立绿水青山就是金山银山的理念，坚持生态优先、绿色发展，纵深推进木兰溪全流域系统治理，打造践行习近平生态文明思想的示范样本。。会议指出，要深入学习贯彻习近平总书记关于加强和改进人民信访工作的重要思想，牢固树立“人民信访为人民”工作理念，紧盯重点领域，有效化解信访突出问题，切实把群众呼声反映好、合法权益维护好，为党的二十大胜利召开营造和谐稳定的社会环境。。会议强调，要始终如一坚守政治忠诚，抓好习近平总书记来闽考察重要讲话再学习再领悟，深刻领会其中的丰富内涵和精神实质，忠诚拥护“两个确立”，坚决做到“两个维护”。要鼓足干劲聚焦重点工作，加快建设现代化经济体系，积极服务和深度融入新发展格局，探索海峡两岸融合发展新路，大力创造高品质生活，切实把习近平总书记来闽考察重要讲话精神转化为砥砺前行的强大动力。要坚持不懈强化作风建设，结合实施“提高效率、提升效能、提增效益”行动，把贯彻落实习近平总书记来闽考察重要讲话精神抓得更实更细更有成效，以优异成绩迎接党的二十大胜利召开。（记者 吴琪娜）,其他,0.6354715746003327,True
111,福建省,莆田市,市委理论学习中心组学习会召开集中收看密码法专题节目,2022-04-10,http://www.putian.gov.cn/zwgk/ptdt/ptyw/202204/t20220410_1716875.htm,"4月8日下午，市委书记付朝阳主持召开市委理论学习中心组学习会，学习《中华人民共和国密码法》，收听收看密码法专题节目《守护安全，密码在你身边》。。会议强调，要强化宣传普及,把密码安全教育纳入国民教育体系和公务员教育培训体系，充分利用“全民国家安全教育日”“国家网络安全宣传周”等平台，深入开展普法活动，营造“知密码、懂密码、用密码”的浓厚氛围。。会议强调，要强化依法执行,各级密码管理部门要依法确立行政主体地位，积极配合市场监管、网信、商务、财政、发改等职能部门，建立完善事中事后监管和行政执法协作机制，在职责范围内履行好密码管理和保障职责，确保密码法落地见效。。会议强调，要强化密码应用,与我市正在推进的“全市一张图、全域数字化”结合起来，实现密码规模化部署、规范化应用，切实筑牢网络空间密码安全屏障。（记者 黄国清）","4月8日下午，市委书记付朝阳主持召开市委理论学习中心组学习会，学习《中华人民共和国密码法》，收听收看密码法专题节目《守护安全，密码在你身边》。。会议强调，要强化宣传普及,把密码安全教育纳入国民教育体系和公务员教育培训体系，充分利用“全民国家安全教育日”“国家网络安全宣传周”等平台，深入开展普法活动，营造“知密码、懂密码、用密码”的浓厚氛围。。会议强调，要强化依法执行,各级密码管理部门要依法确立行政主体地位，积极配合市场监管、网信、商务、财政、发改等职能部门，建立完善事中事后监管和行政执法协作机制，在职责范围内履行好密码管理和保障职责，确保密码法落地见效。。会议强调，要强化密码应用,与我市正在推进的“全市一张图、全域数字化”结合起来，实现密码规模化部署、规范化应用，切实筑牢网络空间密码安全屏障。（记者 黄国清）",其他,0.7292241402453637,True
111,福建省,莆田市,市委理论学习中心组学习研讨会召开围绕牢记嘱托感恩奋进奋力答好谱写福建篇章的莆田答卷主题开展研讨交流,2022-04-11,http://www.putian.gov.cn/zwgk/ptdt/ptyw/202204/t20220411_1716891.htm,市委理论学习中心组学习研讨会召开 围绕“牢记嘱托、感恩奋进，奋力答好谱写‘福建篇章’的莆田答卷”主题开展研讨交流。4月8日下午，市委书记付朝阳主持召开市委理论学习中心组学习研讨会，围绕“牢记嘱托、感恩奋进，奋力答好谱写‘福建篇章’的莆田答卷”主题，开展研讨交流。。会上，付朝阳、陈超、陈志强、陈惠黔、郭宋玉、黄珍耀同志围绕会议主题依次作了重点发言，其他常委同志作了交流发言。。付朝阳指出，在习近平总书记考察福建一周年之际，再次深入学习习近平总书记来闽考察重要讲话精神，进一步加深对其核心要义、丰富内涵和实践要求的认识理解，是一次理论武装的温习强化、目标任务的对标找差、乘势而上的加油鼓劲，更加坚定了用习近平总书记重要讲话指示精神武装头脑、指导实践、推动工作的政治自觉。。付朝阳就进一步贯彻落实习近平总书记来闽考察重要讲话精神强调，要提高站位抓落实。把学习贯彻习近平总书记来闽考察重要讲话精神贯穿到全市工作的各方面、全过程，与秉承弘扬习近平总书记在福建工作时的重要理念和重大实践，尤其是习近平总书记治理木兰溪的重要理念和保护好湄洲岛的重要嘱托紧密结合，以实际行动牢记“两个确立”、做到“两个维护”。。付朝阳强调，要对标对表抓落实。聚焦加快建设现代化经济体系，俯下身子抓产业、一心一意谋发展，加快传统产业转型升级，培育壮大新兴产业，做大做强做优“四大经济”。聚焦服务和融入新发展格局，立足外引内联，畅通内外循环，加强陆海统筹，推进港产城联动发展。聚焦探索海峡两岸融合发展新路，发挥妈祖文化纽带作用，以更大格局谋划品牌活动，促进两岸同胞心灵契合。聚焦创造高品质生活，持续办好市委市政府为民办实事项目，补齐教育、医疗、养老等民生领域短板，不断增强群众获得感幸福感安全感。。付朝阳强调，要扛起责任抓落实。各位市委常委要发挥头雁效应，既挂帅、又出征，亲自抓、亲自管，冲在前、打头阵。要完善闭环机制，对每一项工作、每一件事情、每一个任务，都要建台账、列清单、定措施、督成效，确保每个环节、每个链条都畅通有序。要结合实施“提高效率、提升效能、提增效益”行动，聚焦重点领域和关键环节，拿出硬举措、啃下硬骨头、取得新突破。当前，要统筹疫情防控和经济社会发展，统筹发展和安全，以优异成绩迎接党的二十大胜利召开。（记者 黄国清）,市委理论学习中心组学习研讨会召开 围绕“牢记嘱托、感恩奋进，奋力答好谱写‘福建篇章’的莆田答卷”主题开展研讨交流。4月8日下午，市委书记付朝阳主持召开市委理论学习中心组学习研讨会，围绕“牢记嘱托、感恩奋进，奋力答好谱写‘福建篇章’的莆田答卷”主题，开展研讨交流。。会上，付朝阳、陈超、陈志强、陈惠黔、郭宋玉、黄珍耀同志围绕会议主题依次作了重点发言，其他常委同志作了交流发言。。付朝阳指出，在习近平总书记考察福建一周年之际，再次深入学习习近平总书记来闽考察重要讲话精神，进一步加深对其核心要义、丰富内涵和实践要求的认识理解，是一次理论武装的温习强化、目标任务的对标找差、乘势而上的加油鼓劲，更加坚定了用习近平总书记重要讲话指示精神武装头脑、指导实践、推动工作的政治自觉。。付朝阳就进一步贯彻落实习近平总书记来闽考察重要讲话精神强调，要提高站位抓落实。把学习贯彻习近平总书记来闽考察重要讲话精神贯穿到全市工作的各方面、全过程，与秉承弘扬习近平总书记在福建工作时的重要理念和重大实践，尤其是习近平总书记治理木兰溪的重要理念和保护好湄洲岛的重要嘱托紧密结合，以实际行动牢记“两个确立”、做到“两个维护”。。付朝阳强调，要对标对表抓落实。聚焦加快建设现代化经济体系，俯下身子抓产业、一心一意谋发展，加快传统产业转型升级，培育壮大新兴产业，做大做强做优“四大经济”。聚焦服务和融入新发展格局，立足外引内联，畅通内外循环，加强陆海统筹，推进港产城联动发展。聚焦探索海峡两岸融合发展新路，发挥妈祖文化纽带作用，以更大格局谋划品牌活动，促进两岸同胞心灵契合。聚焦创造高品质生活，持续办好市委市政府为民办实事项目，补齐教育、医疗、养老等民生领域短板，不断增强群众获得感幸福感安全感。。付朝阳强调，要扛起责任抓落实。各位市委常委要发挥头雁效应，既挂帅、又出征，亲自抓、亲自管，冲在前、打头阵。要完善闭环机制，对每一项工作、每一件事情、每一个任务，都要建台账、列清单、定措施、督成效，确保每个环节、每个链条都畅通有序。要结合实施“提高效率、提升效能、提增效益”行动，聚焦重点领域和关键环节，拿出硬举措、啃下硬骨头、取得新突破。当前，要统筹疫情防控和经济社会发展，统筹发展和安全，以优异成绩迎接党的二十大胜利召开。（记者 黄国清）,其他,0.5905764772325034,True
