code,province,city,topic,date,url,content,content.1,label,score,is_match
76,江苏省,淮安市,县领导一周工作发布第期月日月日,2024-07-02,http://www.xuyi.gov.cn/col/896_465466/art/17197632/17199136577962m3HKk3Y.html,6月24日—25日，参加全市领导干部会议；审定全县经济运行分析暨项目攻坚推进会方案；接待纺织机械协会圆纬机行业分会企业家代表；现场调研尅街运营情况；收听收看全省警示教育会议；与金陵集团董事长一行商讨深化合作事宜；陪同市重点项目考核组考核验收。。6月26日—27日，陪同市领导调研生态环境保护督察整改工作；陪同市领导开展人大代表“进网格促和谐”和河长制巡河活动；接待某电子科技有限公司客商；赴省发改委、省林业局对接协调相关工作；参加全市高质量跨越发展“知行大讲堂”第八期专题讲座。。6月28日—30日，参加市委第六巡察组提级巡察“回头看”盱眙国联集团党总支情况反馈会、巡察盱眙县马坝镇党委情况反馈会；现场会办马坝镇污水管网建设有关问题；参加市委乡村振兴工作队见面会；研究城乡教师交流、2024年民办义务教育学校招生、托育服务中心建设等工作；督导检查城区防汛排涝工作；参加部分县区产业发展方向汇报会；召开全县经济运行分析暨项目攻坚推进会；接待某智能货架项目、某按摩仪设备制造项目客商；参加全市生态农业工作座谈会。。6月24日—25日，参加第二十四届盱眙龙虾节走进新疆一二九兵团活动，组织两地结对共建单位开展合作签约，慰问援疆盱眙人员。。6月26日—27日，陪同市委副书记赵正兰参加“进网格 促和谐”人大代表履职主题活动；接待深圳客商，加快推进项目建设；接待北京菜蓝子公司总经理王昕一行洽谈合作事宜；现场视察推进帮办企业项目建设；组织召开县十八届人大常委会第二十一次会议。。6月28日—30日，参加市九届人大常委会第十九次会议；接待中国民族贸易促进会大健康产业工作委员会副主任高燕一行调研考察养老产业；调研部署全市人大系统工作交流会服务保障工作。。6月24日—25日，接待上海电气客商来盱考察；参加纺织机械产业链专题招商推介；陪同西藏自治区政协一行来盱考察。。6月24日—25日，收听收看全省警示教育会议；参加市纪委相关会议；陪同市委巡察办来盱调研；赴新办案中心推进建设情况。。6月26日—27日，陪同市纪委相关派驻纪检监察组来盱调研；召开县纪委理论学习中心组学习会、常委会议；赴县信访局开展“一线三包”接访活动。。6月28日—30日，牵头召开县委巡察工作领导小组会议；参加全省市县纪委书记专题研修班。。6月24日，召开全县开放型经济指标“双过半”推进会；参加“省级综合残疾人之家”验收；召开岁宝翰联项目有关事项讨论会。。6月25日—26日，收听收看全省警示教育会议；召开县委依法治县办全体（扩大）会议；参加全市统战系统“七一”主题读书分享会。。6月27日—29日，出席民革盱眙小组成立大会；赴市向上对接政法工作；召开2场有关楼盘推进会；参加经济运行分析暨项目攻坚推进会。。6月24日，召开县委宣传部部长会，传达学习习近平总书记近期重要讲话精神；召开教育重点工作研讨会；做好“一线三包”工作。。6月25日—26日，参加第二十四届盱眙龙虾节纺织机械产业链专题招商推介会；收听收看全省警示教育会议。。6月27日—30日，推进高速公路沿线高炮广告牌完善出新工作；参加市委第六巡察组巡察天泉湖旅游度假区党工委情况反馈会；参加全县经济运行分析暨项目攻坚推进会。。6月24日—25日，参加教育有关工作推进会；研究制定全县经济运行分析暨项目攻坚推进会方案；陪同省安全生产督导组来盱检查；陪同市项目验收组来盱考察验收项目。。6月24日—26日，抓好省军区民兵工作检查反馈问题整改，组织全县2024年度退役军人及预备役预选对象登记，推进大学毕业生征兵报名精准宣传。。6月24日—25日，赴黄花塘镇调研农贸市场重建规划情况；调度上届工作队台账整理归档工作。,6月24日—25日，参加全市领导干部会议；审定全县经济运行分析暨项目攻坚推进会方案；接待纺织机械协会圆纬机行业分会企业家代表；现场调研尅街运营情况；收听收看全省警示教育会议；与金陵集团董事长一行商讨深化合作事宜；陪同市重点项目考核组考核验收。。6月26日—27日，陪同市领导调研生态环境保护督察整改工作；陪同市领导开展人大代表“进网格促和谐”和河长制巡河活动；接待某电子科技有限公司客商；赴省发改委、省林业局对接协调相关工作；参加全市高质量跨越发展“知行大讲堂”第八期专题讲座。。6月28日—30日，参加市委第六巡察组提级巡察“回头看”盱眙国联集团党总支情况反馈会、巡察盱眙县马坝镇党委情况反馈会；现场会办马坝镇污水管网建设有关问题；参加市委乡村振兴工作队见面会；研究城乡教师交流、2024年民办义务教育学校招生、托育服务中心建设等工作；督导检查城区防汛排涝工作；参加部分县区产业发展方向汇报会；召开全县经济运行分析暨项目攻坚推进会；接待某智能货架项目、某按摩仪设备制造项目客商；参加全市生态农业工作座谈会。。6月24日—25日，参加第二十四届盱眙龙虾节走进新疆一二九兵团活动，组织两地结对共建单位开展合作签约，慰问援疆盱眙人员。。6月26日—27日，陪同市委副书记赵正兰参加“进网格 促和谐”人大代表履职主题活动；接待深圳客商，加快推进项目建设；接待北京菜蓝子公司总经理王昕一行洽谈合作事宜；现场视察推进帮办企业项目建设；组织召开县十八届人大常委会第二十一次会议。。6月28日—30日，参加市九届人大常委会第十九次会议；接待中国民族贸易促进会大健康产业工作委员会副主任高燕一行调研考察养老产业；调研部署全市人大系统工作交流会服务保障工作。。6月24日—25日，接待上海电气客商来盱考察；参加纺织机械产业链专题招商推介；陪同西藏自治区政协一行来盱考察。。6月24日—25日，收听收看全省警示教育会议；参加市纪委相关会议；陪同市委巡察办来盱调研；赴新办案中心推进建设情况。。6月26日—27日，陪同市纪委相关派驻纪检监察组来盱调研；召开县纪委理论学习中心组学习会、常委会议；赴县信访局开展“一线三包”接访活动。。6月28日—30日，牵头召开县委巡察工作领导小组会议；参加全省市县纪委书记专题研修班。。6月24日，召开全县开放型经济指标“双过半”推进会；参加“省级综合残疾人之家”验收；召开岁宝翰联项目有关事项讨论会。。6月25日—26日，收听收看全省警示教育会议；召开县委依法治县办全体（扩大）会议；参加全市统战系统“七一”主题读书分享会。。6月27日—29日，出席民革盱眙小组成立大会；赴市向上对接政法工作；召开2场有关楼盘推进会；参加经济运行分析暨项目攻坚推进会。。6月24日，召开县委宣传部部长会，传达学习习近平总书记近期重要讲话精神；召开教育重点工作研讨会；做好“一线三包”工作。。6月25日—26日，参加第二十四届盱眙龙虾节纺织机械产业链专题招商推介会；收听收看全省警示教育会议。。6月27日—30日，推进高速公路沿线高炮广告牌完善出新工作；参加市委第六巡察组巡察天泉湖旅游度假区党工委情况反馈会；参加全县经济运行分析暨项目攻坚推进会。。6月24日—25日，参加教育有关工作推进会；研究制定全县经济运行分析暨项目攻坚推进会方案；陪同省安全生产督导组来盱检查；陪同市项目验收组来盱考察验收项目。。6月24日—26日，抓好省军区民兵工作检查反馈问题整改，组织全县2024年度退役军人及预备役预选对象登记，推进大学毕业生征兵报名精准宣传。。6月24日—25日，赴黄花塘镇调研农贸市场重建规划情况；调度上届工作队台账整理归档工作。,政府领导到其他城市考察学习或访问,0.617220316932286,True
76,江苏省,淮安市,我区党政代表团赴如皋市盐城市盐都区考察学习,2023-06-11,http://www.zghy.gov.cn/col/949_565874/art/16855488/1686474455845IiFSadVl.html,本报讯 6月10日，我区党政代表团赴如皋市、盐城市盐都区考察学习，共叙深厚情谊、共商发展大计。如皋市委副书记、市长王鸣昊，如皋市人大常委会党组书记、主任司祝建，如皋市政协党组书记、主席张元健等；盐城市副市长、盐都区委书记、盐城高新区党工委书记王娟，盐都区委副书记、区长马正华，盐都区人大常委会党组书记、主任季晓春，盐都区政协党组书记、主席王铁根等分别与代表团交流。王建军、陈张、张在明、时洪兵等区领导参加。。荷花开，荷包鼓。考察第一站，是如皋市城北街道平园池村。近年来，该村立足本村特色，深入挖掘田园生态、农耕文化、特色种植等旅游资源，大力发展乡村旅游，以“荷花的风骨，莲藕的品质”的荷藕文化为载体，打造具有地方特色的“荷韵”党建，探索出一条“文化+农业+旅游”的乡村振兴新路。在参观党群服务中心、农耕民俗文化馆、荷香民俗园时，区委书记、淮安高新区党工委书记王建军与相关负责人仔细交谈，深入了解村庄产业发展和基础设施建设等情况。他说，平园池村坚持党建引领、因地制宜和生态优先原则，创新工作机制，做强做优特色产业，不断激活乡村发展内生动力，实现高质量发展的宝贵经验值得点赞、学习。。随后，我区党政代表团还实地考察了江苏思源高压开关有限公司智能组合电器项目、南通正海磁材有限公司、江苏华夏电影胶片修复技术有限公司等。。如皋是现代化教育事业发展的沃土。座谈会上，王鸣昊对淮阴区党政代表团来如考察表示欢迎，并重点围绕建设“全域均衡、全阶优质、全面发展”的“高质量教育样板城市”，对全市办学质态、改革创新成果、教育发展成效等做了介绍。他希望不断加强两地沟通，持续深化两地合作，为高质量发展注入新活力、增添新动能。。王建军对如皋市的热情接待表示感谢。王建军说，经过半天的考察，党政代表团切实感受到了如皋市工业基础好、综合实力强、生态环境优、教育品牌响的特点。淮阴与如皋一样历史悠久、底蕴深厚，拥有崇文尚教的传统。近年来，淮阴全面贯彻党的教育方针，不断加大资金投入，大力提升教育现代化水平，努力办好人民满意的教育。希望能以此次考察为契机，进一步深化推进两地交流，在服务大局上联动互通、同频共振，在推进教育发展上互惠互利、携手共进，在推动人文往来上交流互动、同心共鸣。。下午，我区党政代表团来到盐城市盐都区，实地考察了维信电子有限公司、大因智能音视频、鸿泰精密连接器、远航锦锂高效储能电池、草房子乐园等项目。。王建军说，盐都区是淮阴区对标找差的目标对象，近年来更是在项目引建、产业发展、转型升级、城市建设等方面取得显著成效。我们要潜心学习借鉴兄弟县区推动高质量发展的视野格局、气魄胆略、经验做法，进一步对标找差、补短强特、创新实干，切实加大项目招引力度、拼出项目建设加速度。同时，要围绕构建新发展格局、推进工业现代化、强化基层治理等方面，与盐都共谋新合作、共创新未来。,本报讯 6月10日，我区党政代表团赴如皋市、盐城市盐都区考察学习，共叙深厚情谊、共商发展大计。如皋市委副书记、市长王鸣昊，如皋市人大常委会党组书记、主任司祝建，如皋市政协党组书记、主席张元健等；盐城市副市长、盐都区委书记、盐城高新区党工委书记王娟，盐都区委副书记、区长马正华，盐都区人大常委会党组书记、主任季晓春，盐都区政协党组书记、主席王铁根等分别与代表团交流。王建军、陈张、张在明、时洪兵等区领导参加。。荷花开，荷包鼓。考察第一站，是如皋市城北街道平园池村。近年来，该村立足本村特色，深入挖掘田园生态、农耕文化、特色种植等旅游资源，大力发展乡村旅游，以“荷花的风骨，莲藕的品质”的荷藕文化为载体，打造具有地方特色的“荷韵”党建，探索出一条“文化+农业+旅游”的乡村振兴新路。在参观党群服务中心、农耕民俗文化馆、荷香民俗园时，区委书记、淮安高新区党工委书记王建军与相关负责人仔细交谈，深入了解村庄产业发展和基础设施建设等情况。他说，平园池村坚持党建引领、因地制宜和生态优先原则，创新工作机制，做强做优特色产业，不断激活乡村发展内生动力，实现高质量发展的宝贵经验值得点赞、学习。。随后，我区党政代表团还实地考察了江苏思源高压开关有限公司智能组合电器项目、南通正海磁材有限公司、江苏华夏电影胶片修复技术有限公司等。。如皋是现代化教育事业发展的沃土。座谈会上，王鸣昊对淮阴区党政代表团来如考察表示欢迎，并重点围绕建设“全域均衡、全阶优质、全面发展”的“高质量教育样板城市”，对全市办学质态、改革创新成果、教育发展成效等做了介绍。他希望不断加强两地沟通，持续深化两地合作，为高质量发展注入新活力、增添新动能。。王建军对如皋市的热情接待表示感谢。王建军说，经过半天的考察，党政代表团切实感受到了如皋市工业基础好、综合实力强、生态环境优、教育品牌响的特点。淮阴与如皋一样历史悠久、底蕴深厚，拥有崇文尚教的传统。近年来，淮阴全面贯彻党的教育方针，不断加大资金投入，大力提升教育现代化水平，努力办好人民满意的教育。希望能以此次考察为契机，进一步深化推进两地交流，在服务大局上联动互通、同频共振，在推进教育发展上互惠互利、携手共进，在推动人文往来上交流互动、同心共鸣。。下午，我区党政代表团来到盐城市盐都区，实地考察了维信电子有限公司、大因智能音视频、鸿泰精密连接器、远航锦锂高效储能电池、草房子乐园等项目。。王建军说，盐都区是淮阴区对标找差的目标对象，近年来更是在项目引建、产业发展、转型升级、城市建设等方面取得显著成效。我们要潜心学习借鉴兄弟县区推动高质量发展的视野格局、气魄胆略、经验做法，进一步对标找差、补短强特、创新实干，切实加大项目招引力度、拼出项目建设加速度。同时，要围绕构建新发展格局、推进工业现代化、强化基层治理等方面，与盐都共谋新合作、共创新未来。,政府领导到其他城市考察学习或访问,0.6196083395294819,True
76,江苏省,淮安市,政协涟水县第十一届委员会常务委员会工作报告摘要,2024-01-11,http://www.lianshui.gov.cn/col/888_535372/art/17040384/1704941317454vaUd7vqJ.html,过去的一年，是全面贯彻党的二十大精神的开局之年，也是我县发展历程中极为关键、极不平凡的一年。面对内外部环境的深刻变化，中共涟水县委团结带领全县人民，对标落实习近平总书记对江苏工作提出的重大要求、赋予的重大任务，以“走在前、做示范”的果敢担当，奋力推动县域经济跨越赶超，重特大项目突破成势，在全市率先跻身全国百强县，极大提振了全县上下发展的信心和决心。。2023年，在中共涟水县委的坚强领导下，县政协坚持以习近平新时代中国特色社会主义思想为指导，深入学习贯彻党的二十大精神和习近平总书记关于加强和改进人民政协工作的重要思想，紧扣县委“2233”发展战略，以党建强引领，以协商促发展，以团结聚共识，以创新添活力，以担当树形象，在涟水圆梦百强的征程中贡献了政协智慧与力量。一年来，让我们倍感振奋的是，省政协主席张义珍专程来涟，视察重特大项目，调研政协工作，给予充分肯定，并作出专门批示，在全省政协党建工作会议上点名表扬；省政协副主席姚晓东来涟调研；省政协副主席洪慧民、张乐夫来淮调研时，我县作为县区代表交流发言；市委书记史志军点评认为涟水政协工作很有特色。全年省市政协领导来涟调研指导32批次，外地政协来涟考察学习17批次。一年来，让我们倍增信心的是，“委员为民服务超市”获评2023年度省政协优秀创新案例，经验做法在新华日报头版省政协工作综述中特别推介，全市县区唯一，与后期全国政协出台的《关于开展委员履职“服务为民”活动的意见》高度契合，具有很强的前瞻性。这得益于我们把创新贯穿履职全过程、各方面，大力实施创新工作三年行动计划，年初推出7个创新项目。一年来，让我们倍受鼓舞的是，宣传稿件数量质量实现双提升，荣登人民政协报5篇、人民政协报“政能量榜”31篇，涟水政协微信公众号连续4个月登上全国政协“商靓榜”区县级政协榜单，全国少有，在江苏政协微信公众号发表5篇，位居全省县区政协前列，全年在人民政协报、学习强国、《江苏政协》等市级以上媒体刊登稿件150多篇，涟水政协的知名度、美誉度明显提升。。始终坚持在县委领导下开展工作，持续加强党对政协工作的全面领导，确保方向正确、行稳致远。一是在思想上强化理论武装。坚持把学习贯彻习近平新时代中国特色社会主义思想主题教育作为主题主线，紧扣“学思想、强党性、重实践、建新功”总要求，及时研究、制定方案，集中学习、深入调研，积极建言、助推发展，组织“牢记嘱托、感恩奋进、走在前列，更好展示‘象征意义’”大讨论，开展党组织书记专题党课，集中交流调研成果，全年组织集中学习24场次，征集心得体会文章28篇。二是在政治上维护县委权威。严格执行重大事项请示报告制度，全年就重要会议、重要工作向县委请示报告16次。县委高度重视、全面支持政协工作，县委县政府主要领导先后21次参加政协会议、活动，22次作出指示批示；县委常委会先后5次听取政协工作汇报，审定年度协商计划，为政协事业发展提供坚强保障。三是在行动上加强组织引领。充分发挥政协党组“把方向、管大局、保落实”重要作用，压紧压实党建工作、意识形态工作和党风廉政建设“三个责任制”。设置6个专门委员会履职临时党支部和16个履职临时党小组，实现党的组织对党员委员全覆盖、党的工作对政协委员全覆盖。,2024年1-2月我县实现外贸9086万美元，同比增长10%以上，县商务局多举措不断激发外贸内生力，通过聚焦新动能不断促进外贸进出口。。一是持续践行“一企一策”“服务帮办”机制。持续践行并完善全县进出口300万美元以上重点外贸企业服务帮办制度，针对国际经济下行形式，建立外贸数据周调度、月统计专项服务，针对理士电池、正贸仓储、和跃运动、西派集团等重点龙头企业按照月度、季度进行外贸运行情况分析研判、定期走访，践行“一企一策”“重点帮办”服务内容，实时了解企业在手订单和生产经营现状，及时收集企业诉求和建议，积极帮助企业纾困解难，排查全县外贸新增长点，帮助供货出口企业、代理进出口企业积极转自营，不断优化外贸发展环境。。二是助力外贸新动能发展外贸新业态。不断完善服装鞋业、体育器材、仪器仪表、石油机械、卫生用品等产业的跨境电商模式，积极对接企业宣传外贸新业态，不断扩大外贸发展新渠道。去年以来，县商务局开设跨境电商专题培训班，组织金卫机械、和跃运动、恒力机械等20余家企业进行跨境电商南京、常州跨境电商产业园区考察学习，举办“外贸独立站推广走进金湖产业带”的跨境电商专题培训活动，鼓励企业发展电商品牌，促进汇安电子商务产业发展有限公司与伊斯坦森、全球贸易通进行深入合作，促进企业与大健云仓公司合作，以宝翔体育为典例的跨境电商企业在美国租赁海外仓28个，并通过跨境电商平台进行B2B出口，开展“跨境电商B2B出口海外仓（9810）”报关新模式。。三是惠企政策助企开拓国际市场。指导企业用好用足国家最新惠企政策和各类外经贸扶持政策。持续推进外贸企业参加“江苏优品·畅行全球”“苏新服务·智惠全球”等线上、线下活动，组织企业报名、参加134、135届广交会、跨交会等各类国际展会，不断开拓国际市场；持续做好出口信用保险宣传力度，对符合条件的小微企业进行政策宣讲；帮助企业开展外贸发展新渠道，对接市商务局参加“外贸助企行”系列跨境电商、RCEP等商务培训，帮助企业发展跨境电商；出台《关于推动外贸稳规模优结构的九条措施》，为外贸发展提供新的政策依据；充分发挥资金政策导向作用，变政策红利为外贸增长动力。去年以来，县级支持国际展会、产品认证、跨境电商外贸项目82个，不断支持企业稳增长、调结构、促发展。,其他,0.5918500021711112,True
