code,province,city,topic,date,url,content,content.1,label,score,is_match
76,江苏省,淮安市,南集镇召开年工作谋划座谈会,2012-12-07,http://www.lianshui.gov.cn/col/891_553562/art/dd7dd8943d864a2abacbb3e26e9e5456.html,为了贯彻落实县委工作务虚会精神和谋划2013年工作。12月6日，南集镇召开2013年工作谋划座谈会。镇三套班领导、各村（居）党总支书记、主要部门负责人等参加会议。 会上镇三套班领导、各村（居）党总支书记、主要部门负责人汇报了本单位一年来各项工作情况及2013年工作思路、具体举措。党委书记宋月霞逐个进行点评，肯定成绩、点出不足、指明方向。随后党委宋书记通报了近期随县党政代表团赴沭阳、江阴、宜兴等地考察学习的情况，传达了市委常委、县委书记董平在县委工作务虚会上的讲话精神，并就董书记讲话精神及考察地区经验，结合南集经济社会发展实际，提出贯彻落实的具体要求。最后对于明年工作的谋划，宋书记指出2013年，南集镇将继续牢牢把握“工作创一流，名次争上游”的奋进基调，全力主攻工业，倾力优化农业结构，着力优化发展环境，突出抓好集镇建设。 会后，与会人员集中参观了工业集中区的贝斯特鞋材、海华木业、洁珑服饰和范荡村的居家养老服务中心。,10月29日，县教育系统召开行风和效能建设推进会。会议分析了教育系统存在的一些行风问题，并就进一步加强教育系统行风建设，全面提升工作效能提出了具体的实施意见。教育局领导班子成员、局机关全体同志、全县中小学校长助理参加了会议，教育局党委书记朱崇玉主持会议。 会议提出六个“严格”，即严格执行考勤管理制度，严格规范工作行为，严格控制各种会议、检查评比和庆典活动，严格规范外出考察学习审批程序，严格执行来客招待报备制度，严格大操大办、禁止参与赌博活动。 县教育局局长鲁家宁要求全系统以转变作风、提高效能、优化服务、创新发展为主题，在干部职工中广泛开展带头讲学习、带头讲政治、带头讲正气、带头讲绩效、带头讲文明、带头讲文明、带头讲节约、带头讲团结等“七带头”活动。机关要进一步转变作风，增强服务意识；学校要加强校风、学风、教风等“三风”建设，严格工作纪律、培训纪律、招生纪律等“三律”，切实做到依法治教、以德治校。 会上，县教育局纪委书记罗时清还宣读了县纪委《关于进一步强化责任明确纪律的通知》和县教育局《关于进一步加强教育系统行风和效能建设的紧急通知》。,其他,0.6597143748291948,True
76,江苏省,淮安市,红窑镇大干当前规划明年,2012-12-05,http://www.lianshui.gov.cn/col/888_535372/art/7499c84ba1ac4b9983accee926b46a02.html,11月30日，红窑镇召开贯彻落实县委工作务虚会精神座谈会。镇三套班子领导、各村（居）党总支书记等参加会议。 各村（居）首先汇报了一年来各项工作情况及2013年工作思路、具体举措。镇党委领导逐个进行点评，随后通报了近期随县党政代表团赴沭阳、江阴、宜兴等地考察学习的情况，与大家分享了行程中的鲜明感受和深刻体会，全文传达了市委常委、县委书记董平在县委工作务虚会上的讲话，并结合红窑经济社会发展实际，提出贯彻落实的具体要求，就大干当前，确保全面超额完成各项目标任务进行部署，对明年工作进行了谋划。 2013年，红窑镇将实施“四个年”计划。一是“工业突破年”。狠抓招商引资，充分利用红窑人脉资源，组建专业招商队伍，强力招大引外。狠抓全民创业，吸引返乡创业，实现扩总量与提质量齐头并进；狠抓企业服务，促使现有企业不断做大做强。二是“镇村提档年”。巩固省级卫生镇创建成果，建立环卫长效机制，做到地域全覆盖、管理无缝隙、保洁全天候；强化规划的刚性约束，持续提升镇区绿化、亮化、美化档次，打造生态宜居的魅力家园。三是“农业特色年”。壮大现有高效农业板块，打造观光、生态、休闲农业；着力推进主要干道两侧土地的规模流转，实现连片开发。四是“民生和谐年”。大力兴办惠民实事，强化创新社会管理，充分挖掘红窑的厚重文化，丰富群众精神文化生活，实现经济发展量化指标与人民群众幸福指数同步提升。（李卫兵 宁桂龙）,下午，徐州市城管局局长曹东伟一行17人莅临我局考察学习我市创建国家卫生城市工作的相关经验做法。。李庆林局长接待了曹局长一行，并召开了座谈会。会上，焦从太副局长介绍了我局创卫工作开展情况，同时就公共厕所、粪便厂的建设管理等工作与来访人员进行了交流。随后焦从太副局长、环卫管理处朱树森处长等陪同来访人员参观市粪便处理厂、大同路公厕，通过现场参观演示的方式向客人们详细讲解粪便厂的运作工作。。考察人员表示，此次来淮学习受益匪浅，淮安创卫工作的经验，环卫设施的建设管理，对徐州市创卫工作的开展有着积极的指导意义。（环卫管理处）,其他,0.5466964754004325,True
76,江苏省,淮安市,县委组织部传达学习县委工作务虚会精神,2012-12-06,http://www.lianshui.gov.cn/col/888_535372/art/dd825cae455c4887b08a1ff4d2b83b8d.html,12月4日，县委组织部召开传达学习县委工作务虚会精神学习会。会议由县委常委、组织部长杨振龙主持。 会上，杨振龙向大家传达了此次考察学习所见所感，并将外地经验与我县实际情况进行对比，指出可借鉴之处和今后努力方向。杨振龙还对市委常委、县委书记董平在县委工作务虚会上的讲话进行了分析解读，与大家交流了学习感受，指出在今后的工作中必须牢牢抓住发展第一要务，加快发展；必须始终坚持解放思想，破解发展难题；必须努力培育工业项目，做大做强工业经济。 结合县委工作务虚会精神，杨振龙要求大家在今后的工作中，一方面要继续深入学习董书记讲话精神，将组织工作融入到县委工作中心和经济社会发展大局中，认真抓好落实；另一方面要“瞻前顾后”，围绕年初制定的目标任务，进行逐条过堂，确保不折不扣完成，并结合讲话精神统筹谋划明年工作。（涟组轩）,"4月24日，徐州市民政局社会救助处处长魏忠刚率领所辖县（区）民政局一行9人来到淮安，考察学习我市申请救助家庭经济状况核对工作。市民政局副局长周为民对徐州民政局一行表示热烈欢迎，他简要介绍了淮安市申请救助家庭经济状况认定指导中心运行情况，并希望两市在以后的工作中加强交流与沟通，相互借鉴，相互学习，取长补短。。市民政局社会救助处长薛南华介绍了淮安市申请救助家庭经济状况认定指导中心建设情况。今年以来，我市为贯彻落实《国务院关于进一步加强和改进最低生活保障工作的通知》（国发〔2012〕45号）文件精神，不断创新城乡低保管理机制，建立和完善了申请救助家庭经济状况联席会议制度，成立了申请救助家庭经济状况认定指导中心，推广了金湖县自主研发的""社会救助信息比对系统""。建立了申请救助家庭经济状况核对工作联动机制，与房产、银行、证券等多部门形成联动，共同对救助对象经济状况进行严格审查，近期我们主要对申请保障房的家庭进行了核查、比对，取得了较好效果，得到了省住建厅、财政厅和民政厅的肯定。下一步我们将对全市申请社会救助所有对象进行比对，杜绝骗救助的""伪困难户""，从而让真正需要救助的家庭得到资助。。徐州市民政局一行对淮安市社会救助工作特别是申请救助家庭经济状况核对工作给予了高度评价。他们认为淮安社会救助工作思路清晰、成绩突出，值得他们学习和借鉴。",其他,0.5462053028223116,True
76,江苏省,淮安市,年度工作总结,2014-03-14,http://gxs.huaian.gov.cn/col/7002_358316/art/sj_gxs_69030.html,年，市供销合作社在市委、市政府和省总社的正确领导下，认真学习贯彻党的十八大、十八届三中全会精神，彰显特色、创新创优，突出重点、狠抓落实，圆满完成年初确定的各项目标任务，连续5年获得全省供销社综合考评特等奖荣誉。。去年，市委市政府和省社领导高度重视我市供销合作事业发展。省社领导多次来到淮安开展调研，听取意见，指导工作。 12月4日，市委书记姚晓东、市政协主席王维凯、。参观了全市供销系统农资创新经营成果展，姚书记对市供销社近年来的工作给予了高度评价，要求继续。坚持为农方向、改革创新、争先进位，在全市为农服务工作中发挥更大作用，作出更大贡献。刚才，我们又传达学习了市委练书记、市政府赵市长的批示精神，。领导的关心重视，极大鼓舞了全系统广大干部职工干事创业的积极性和主动性。回顾过去一年，主要开展了以下几个方面的工作。。做好“放心农资下乡暨农资打假专项治理”宣传月活动，引导、督办各县（区）社、农资企业守法经营，诚信经营，严把产品质量关，确保100%无假货。及时调研统计农资价格浮动情况，指导社属企业做好农资储备，组织市供销社（集团）农资公司、市供销社（集团）千村植保种业有限公司、苏禾农资有限公司、兴农农资有限公司、江苏万里行农资有限公司等规模性企业开展连锁配送，提供现场咨询、知识培训、科普宣传等服务。市供销社（集团）农资有限公司投资开办“惠农网上庄稼医院”，并和实体店相结合，让广大农民足不出户就能接受农技专家技术指导，《农民日报》以《40万农户受益新型庄稼医院》为题专版介绍该做法；他们还在“全国庄稼医院科技服务现场会暨农村流通领域科技特派员培训班”上，作为唯一一家市县级企业单位作交流发言，得到了全国总社领导充分肯定和与会代表高度评价。。市社筹建了全市农产品经纪人协会，组织会员、合作社、中小企业参加第十五届江苏农业国际合作洽谈会。金都食品有限公司冠名的第五届“中国淮安优质农副产品博览会”成功举行，15家企业齐“上阵”，主打“安全、美味、健康”牌，现场销售总额达150万元。20余家企业、专业合作社参展 2013’海峡两岸（江苏）名优农产品展销会暨第八届无锡现代农业博览会，现场成交额达170余万元，签订交易合同近千万元。市社积极打造“农超对接”平台，组织洽谈会，让专业合作社、龙头企业与各大超市面对面交流信息，建立渠道，获得商家与消费者一致好评。市社还协办并组织相关涉农龙头企业参加第六届“优质农副产品博览会暨迎新春年货展销会”，进一步增强我市农产品推介力度，提升淮安特色农产品品牌形象。。个农业开发新型合作社示范项目（云清大豆种植合作社、盱眙县荣汇养猪合作社）得到全国总社、省社总计200万元财政资金支持，42个为农服务社获得省社54万元资金补助。。市社与信息工程学院联合开展农产品电子交易平台运用培训班，促进系统企业由传统经营向电子商务转型；集中对全系统“新网工程”建设项目申报单位进行培训，邀请专家解读国、省项目申报文件精神，辅导相关企业编制项目书，规范申报行为。全市共有7个“新网工程”项目获得省级财政补助资金590万元，项目个数、资金额度连续三年位居全省系统前列，2个2012年度国家级“新网工程”项目（分别为丁集再生资源分拣中心新建项目、 10000平方米冷冻食品批发市场建设项目）获得以奖代补、财政补助资金250万元。同时，市社通过“以商引商”大力开展农业招商，社属企业在第十一届中国优质稻米博览会上成功签约2个项目。市社还着力推进刘老庄农贸城建设，该项目总投资8000万元，规划建筑面积4.20万平方米，其中商业面积2.10万平方米，现已完成土地征用和招标摘牌等手续。,过去的一年，我市认真落实《中华人民共和国政府信息公开条例》以及国办、省办关于政务公开方面文件精神，精心组织，扎实推进，从强化组织领导、加快平台建设、完善工作制度等方面入手，不断扩大政务信息公开范围、突出公开重点，各项工作得到了快速发展。现简要总结如下：。（二）规范公开工作。一是完善工作制度。坚持把完善工作制度作为推进政府信息公开工作的抓手，不断完善规章制度，出台了《淮安市政府信息发布协调制度》，建立一系列配套措施，形成了较为完善的制度体系，为政府信息公开提供了制度保障，实现用制度来规范工作、推进工作、创新工作。二是规范依申请工作流程。按照“依法、便民、高效”原则，完善了依申请公开管理办法，进一步规范依申请公开程序，拓展群众依申请公开渠道，认真做好公民、法人和其他组织依申请公开的答复工作，满足群众获取利用政府信息的需求。全年，共受理依申请公开120件，其中，办理向市政府提请的依申请公开16件，答复率达100%，未收取依申请公开工作费用。三是严把保密审查关口。进一步完善信息公开保密审查制度，对自审送审程序以及保密审查工作流程等内容进一步规范，坚持“先审查、后公开”和“一事一审”，保证依法、及时、准确公开信息，做到了“涉密信息不公开，公开信息不涉密”。组织开展全市政府信息公开保密检查2次，开展保密知识培训2次，保证了政府信息公开的保密要求，全年没有因公开不当、工作疏忽而造成泄密的事件发生。。（三）拓展公开内容。不断加快载体平台建设，多形式、多途径、多渠道地推进政府信息公开。。三是加强与媒体勾通联系。一是建立工作联系制度。建立与市内外媒体联系制度，加强与媒体特别是市外媒体的联系，增强办公室各处室与媒体配合协作，及时互通政府宣传工作重点，共同策划开展宣传，有效提升了宣传工作的时效性与针对性。在《淮安日报》、《淮海晚报》、《淮海商报》、淮安新闻网和淮安电视台，广播电台开设“追踪、聚集、关注”栏目，下设“追踪重点工程、聚集一县一题、关注民生实事”三个子栏目。召开市内媒体及省驻淮媒体负责人召开座谈会，实现了政府工作与媒体资源共享与信息互通，建立与媒体直通车。二是政府工作宣传力度加大。各主流媒体加大了对政府工作的宣传，《淮安日报》刊登45篇，《淮海晚报》刊登58篇。三是加强网络舆情引导。建立网络舆情引导制度，成立网评员队伍，明确任务分工，完善值班浏览、舆情处置联动机制，规范回应答复。通过建立健全引导机制，有效引导网络舆情，积聚发展正能量。。四是加强信息查阅室和查阅点建设。继续加快市政务服务中心、档案馆、图书馆三个政府信息公开查阅点建设工作，设立政府信息查阅室和查阅点，既可以让群众免费登陆国务院、省、市、县（区）政府和部门网站查询政府信息，又可以接受群众依申请信息公开，极大地方便了广大群众。市、县区档案馆都新建了信息公开查阅场所，配备了查阅设备，方便市民查阅。目前，全市已设立政府信息查阅室476个、公共查阅点188个。。按照省政府下发的《关于开展行政权力网上公开透明运行深化行动实施意见》、《省政府关于加强政务服务体系建设的实施意见》等文件精神要求，以强化监督检查为抓手，以提升行权网上运行办件质量为目标，全市整体工作水平进一步得到提高。去年，在全省行政权力网上公开透明运行电子监察情况督查考核中取优异成绩，实现了全省走前列的总体目标。全市行政权力事项网上办件1885161件，其中县（区）499639件，市直部门1385522件，数据总量全省排名第三。,其他,0.853144581594572,True
76,江苏省,淮安市,我市赴常熟取农业科技发展之经,2013-06-21,http://kjj.huaian.gov.cn/kjzx/gzdt/nry/42d63ae7319d4e6198b950b3ed486a9d.html,日前，市委副书记练月琴，副市长陈涛率市科技局、农委、淮阴区一行奔赴常熟市，考察学习该市国家农业科技园区、家庭农场和城乡一体化建设经验。苏州市委副书记陈振一，副市长陆留生等陪同考察。。练月琴一行参观了常熟现代农业产业园区，认真听取园区规划、建设理念、运营机制，以及现代信息技术应用等情况介绍。她要求，考察团要把常熟现代农业产业园建设的鲜活经验带回淮安，指导我市现代农业发展，把淮阴台湾农民创业园打造成国家农业科技园区；要深挖优势产业、打造特色产品、延长产业链条，切实发挥淮安丰富的农产品资源优势、品牌优势，利用现代科技，促进农业增效、农民增收。随后，练月琴一行还考察了古里镇苏家尖村、田娘农场、坞坵农机专业合作社、常熟农科所等。练月琴强调，相关部门要充分学习借鉴常熟家庭农场、城乡一体化建设和乡村旅游开发理念，真正让常熟的成功经验在淮安开花结果。。考察团还到常熟现代渔业产业园进行了参观学习，并就现代渔业科技应用、渔业产业发展等问题进行了深入交流。 （市科技局农村处）,近日，淮阴区妇儿工委主任谈晓艳带领相关10个妇儿委成员部门负责同志来我县学习考察女性进“两委”等情况，在听取了涟水县妇儿工委和相关部门的汇报后，又实地考察了我县李集双河村“妇女儿童之家”、红窑实验学校“留守儿童之家”、现代农业科技园、云锦研究所、“好苏嫂”门店和妇女职业技能培训基地等，对我县的做法给予了充分肯定，并表示今后两家要多联系、多走动。,其他,0.5111401361573482,True
76,江苏省,淮安市,淮安日报长效管理成绩斐然,2012-02-03,http://cgj.huaian.gov.cn/cgdt/cgxw/content/70cf8ee36c8d47a48ffa88c8f1d1db67.html,“动作真够快的”，市民徐小姐没想到，她刚向市城管部门举报淮阴区一家医院非机动车停放仍收费，第二天就得到了解决。。去年10月1日起，我市开始对非机动车实现免费停放，普惠于民。市区大部分停放点积极配合，但仍有少数停放点继续收费。为此，市城管办通过明查暗访，对存在问题的停车点限期整改。到去年11月份再次检查时，这些收费点已全部整改到位。淮阴区积极同医院方协调，并联合公安、物价、城管等部门，蹲点守候，及时查处违规收费行为，并落实相关管理措施，擅自收费现象得到有效遏制。。这是我市推行“长效管理”过程中的一个案例。说起长效管理，很多市民也许感到陌生，它就像是一张无形的大网，网罗了淮安城的大街小巷、各个角落，哪里有卫生问题，哪里有交通秩序问题，哪里有流动摊点占道经营等等，总会在“长效管理”中得到解决。这张“长效管理”的大网，无声无息之中影响、改变着我们的生活环境。。实施城市长效综合管理，解决了突击式、应付式的短期效应，成功破解了城市管理难题，取得了制度化、长治久洁的管理效果，为我市巩固创建“国家卫生城市”成果、跻身“中国和谐管理城市”等作出巨大贡献，先后有60多个市、县（区）代表团前来考察学习，其中安徽蚌埠市先后三次派党政代表团、陕西榆林市先后两次派党政代表团来淮学习城市长效管理工作经验。“全国市长研修班”还三次邀请市城管办领导专题介绍城市长效综合管理机制、体制建立及实施情况，淮安“长效管理”的经验，开始走向全国，成为诸多城市学习的榜样。。2007年，我市成功创建国家卫生城市后，为巩固卫生城市创建成果，推进国家文明城市创建等工作，我市借鉴常州、绵阳等城市先进管理经验，创新管理机制，专门成立了由市长担任主任的城市长效综合管理委员会，实行城市长效综合管理，变“一家管”为“大家管”的“大城管”。。按照“市考核、区管理、街道落实、社区服务”的工作思路，我市建立“统一领导，分级负责，以区为主，条包块管，综合管理”的管理模式，实现了“市考核、区管理、街道落实、社区服务”的四级管理网络，形成了“大城管”工作机制。。依据国家卫生城市、环保模范城市、最佳宜居城市、生态城市、园林城市、文明城市等指标，市城管委将五区和市直14个部门的23项城市管理职能，细化成28项内容，量化成78个考核指标，确定城市长效综合管理标准，制订了《城市长效综合管理考评细则和计分办法》，同步建立日督查、月点评、年终兑现奖惩的考核激励机制。同时，城管委连年对考核细则进行修改和增补，不断加以完善，并建立高额保证金制度，按五个档次进行考核奖惩。。督查考核是城市长效综合管理工作的关键，四年多来，坚持每日督查交办，跟踪督办，遇到推诿扯皮等问题，及时现场会办，推进问题的有效整改。另外，我市坚持每月按期召开点评会，通过现场观摩、通报问题、公布考核结果、领导点评、部署工作等形式，使城市长效综合管理工作点评会成为真正意义上的工作汇报会，解决问题、明确责任的交办会，提升市容、改善环境的促进会，促进交流、落实长效的现场会。。在督查考核工作中，市城管办始终按照市委、市政府领导的要求，遵循公平、公正、公开的原则，做到扣分有依据，查证有实据。对现场扣分情况，在第一时间通报各单位。点评前将当月考核结果通报各单位领导，点评后第一时间将考核结果在网上、报纸上公示，实现考前考后全公开、全透明。。东大街下水道不通、淮海商业步行街脏、破、乱以及北京路“夕阳红”广场设施不配套等重难点问题，过去一直是领导关心、市民关注的热点，现在，不仅问题得到解决，有的还成为城市的亮点。,11月2日上午，副县长王成明率队考察金湖县农村环境连片整治工作。 考察期间，王成明一行在金湖县副县长梁善洲的陪同下，先后到吕良镇、前锋镇实地观摩农村环境连片整治工作。吕良镇通过多渠道筹集资金310万元，先后建起1座垃圾中转站，购买了垃圾转运车2辆，保洁车92辆，垃圾桶200个，并兴建垃圾收集池452座，已建成“组保洁、村收集、镇转运、县处理”四级转运处置模式，垃圾存放清运率达100%。前锋镇一手抓发展、一手抓环境保护，积极争取国家、省市补助，建起3座污水处理厂、1座垃圾中转站。王成明一边看、一边问，并要求随行考察人员认真总结金湖的经验和做法，结合涟水实际，把我县农村环境连片整治工作做得更细、更实，力争走在全市的前列。 县政府办、环保局、城管局、财政局、住建局、整治办、创卫办、高沟镇、红窑镇等单位负责人参加了考察学习活动。 （黄 海 陈海霞）,其他,0.5317380421161901,True
76,江苏省,淮安市,我市赴扬州考察基层司法行政工作,2009-10-19,http://sfj.huaian.gov.cn/col/8704_612664/art/1565953452178Xes7I0vX.html,14日，市委政法委副书记朱锦、市局局长金珂带领相关同志到扬州考察学习基层司法行政工作。淮安考察团走访了扬州部分县（区）司法局和基层司法所，就政法综治中心与司法所工作、基层社会矛盾调处等工作进行实地走访了解，重点考察了7种基层司法行政单位形象标识。,一是组织晚间巡逻，加大对雅马哈晚主要干道和繁华地段机动车停查处力度；二是分片包干，责任到人。严格实行责任追究制，确保违章停放得到及时纠正；三是与市城管局联合赴昆山考察学习先进管理经验；四是疏堵结合，进一步完善道路交通设施，增设道路临时停车泊位，缓解机动车停放压力。,其他,0.6077152918483343,True
