code,province,city,topic,date,url,content,content.1,label,score,is_match
76,江苏省,淮安市,市领导会见澳门中联办人事部副部长霍海斌一行,2021-05-21,http://wsb.huaian.gov.cn/xxzx/content/16197984/1621575330211AGkl6MIW.html,5月19日，副市长王向红会见了澳门中联办人事部副部长霍海斌带领的澳门优秀中青年骨干培训班一行，办领导朱钰、黄天亮、方红艳等参加相关活动。。霍海斌介绍，此次澳门中联办组织澳门各行各业的青年菁英代表来到江苏学习，是为了深入贯彻“一国两制”方针，促进澳门与内地的交流，加深澳门特区青年对国家“十四五”规划和新发展理念、国情国史以及内地经济发展实践的了解。淮安是周恩来总理的家乡，这次到淮安、到恩来干部学院培训学习，是应去年10月份王市长赴澳门的邀约。来到这里，亲身感受到了淮安作为历史文化名城、淮扬菜之乡的独特魅力，确实不虚此行。。王向红对澳门优秀中青年骨干培训班一行来淮学习表示欢迎，对去年我市经贸代表团拜访澳门中联办情况进行了回顾，并表示霍部长一行这次来淮进一步密切了双方交往、加深了双方感情。同时，介绍了淮安即将在今年金秋十月参加第十一届江苏-澳门·葡语国家工商峰会，也将会开展洪泽湖大闸蟹专场推介、“淮味千年”品牌农产品推介、淮安文化旅游宣传推介等活动，并加强美食交流，助力淮安“美食之都”申创工作。希望澳门各界优秀中青年骨干代表继续关心淮安、支持淮安。。据悉，澳门优秀中青年骨干培训班此次将先后在南京、淮安、徐州、宿迁等地考察学习。在淮期间，将在恩来干部学院进行培训，并前往淮安府署、中国漕运博物馆、周恩来故居、周恩来纪念馆进行现场教学。,根据市财政局、市扶贫办《关于下达2020年中央和省级财政专项扶贫资金的通知》（淮财农〔2020〕36号），2020年度我区获得省级财政专项扶贫（建立解决相对贫困长效机制试点补助）资金1000万元。经多次调研论证、会议讨论、区长办公会议（淮政〔17〕118号）审定等程序，确定了解决相对贫困长效机制试点专项资金使用方向。希各镇（街道）和区扶贫开发服务中心按文件要求，严格资金使用方向，按照《江苏省省级财政专项扶贫资金管理办法的通知》（苏财规〔2016〕30号）要求，管好用好财政专项扶贫资金，充分发挥资金使用效益。现将有关事项通知如下：。各镇（街道）、区扶贫开发服务中心要充分发挥项目实施主体责任，严格落实项目资金监管，并根据工作开展情况及时申请拨款。。严格执行《淮安市市级财政专项扶贫资金管理办法》（淮财农〔2017〕37号）和区政府办公室《关于进一步加强财政涉农项目和资金管理的意见（试行）》（淮政办发〔2016〕4号）文件要求，管好用好扶贫资金。各镇（街道）、区扶贫开发服务中心要切实加强资金监管，实行专账核算，规范会计核算和资金使用行为，确保专款专用，不得截留、挤占、挪用项目资金。。以村为单位，聘请扶贫网格员，进行相对贫困户的动态进退等网格化管理，专门负责该村相对贫困户的识别、退出等相关事务，全区245个行政村全覆盖，村扶贫网格员1000元/人/月；13个镇（街道）各聘请一名扶贫网格员，负责各镇（街道）扶贫网格管理，镇级扶贫网格员1200元/人/月，各镇（街道）上报扶贫网格服务方案，经区审定后进行资金拨付；另聘请区级2名扶贫网格员，统筹全区扶贫网格管理业务，区级扶贫网格员3000元/人/月；区镇村三级网格员管理服务费用共需近320万元/年。。利用阳光扶贫监管等系统，加快开发具有申报受理、信息比对、数据交换、政策落实、提醒监督等功能的管理模块，研发项目申报小程序等。不断提升平台开发、系统升级、日常维护、项目申报、硬件设备采购等平台信息化管理，为镇（街道）村配备系统运行、日常信息管理所需的电脑、打印机、高拍仪等，保障长效机制正常开展。。开展全区长效机制试点与落实业务方面的培训工作，对各职能部门、各镇（街道）及行政村从事扶贫工作的业务人员进行全覆盖培训，重点培训相对贫困对象识别监测、动态帮扶、脱贫退出及防返贫方面相关业务知识。根据需要汇编各类扶贫政策及典型推广宣传表彰活动等，组织相关职能部门、镇（街道）赴其他试点县（区、市）调研考察，学习好的经验做法，为推动解决长效机制试点工作提供淮阴特色。。主要用于中央、省、市财政专项资金实施的扶贫项目设计费、勘察费、监理费、竣工验收费等及解决相对贫困长效机制六类帮扶措施中委托第三方进行收入核查费用等。。分别用于方案内相对贫困户自身发展产业和农业新型经营主体发展产业带动相对贫困户增收，就业创业、公益性岗位、扶贫小额信贷贴息、全日制普通高校新录取的本科、专科段新生享受的学习补助等各类帮扶资金。,其他,0.8842715152561339,True
76,江苏省,淮安市,王向红副市长率队赴上海振华重工考察交流,2020-08-18,http://wsb.huaian.gov.cn/xxzx/content/202008/1597716650403ITcycH18.html,近日，副市长王向红应邀率队赴上海振华重工考察交流，拜访了振华重工总裁黄庆丰，双方就加强空港物流、智慧停车等领域合作进行了深入探讨。市政府副秘书长顾强、市外办主任朱钰等参加会见。。王向红详细介绍了近年来淮安经济社会发展情况，特别是淮安在智慧城市、交通建设、现代产业等方面的发展规划。王向红表示，淮安历史悠久、积淀丰厚，交通区位优势显著，各项重大战略机遇叠加，拥有广阔的发展前景。淮安市委市政府正在聚力聚焦打造“绿色高地、枢纽新城”，加快建设美丽淮安、开放淮安、创新淮安、幸福淮安“四个淮安”，为来淮投资兴业的公司提供效率更佳、服务更优的营商环境。希望振华与淮安围绕无人智慧停车、内河港口自动化等方面创新合作模式，实现互利共赢。。黄庆丰对王向红一行的来访表示欢迎，并感谢淮安市委市政府对振华在淮安项目公司的关心和支持。他说，今年四月，集团副总裁张健带队去淮安考察，就空港建设进行了交流，有了初步的成果。在当前疫情常态化形势下，公司正从港机、海洋重工、大重特型钢结构等传统业务向智能制造、仓储物流等新兴产业积极转型，我本人也将尽快到淮安考察学习，推动双方合作取得实质性成果。,日，市供销合作总社党组成员、理事会副主任叶海军率考察团赴泰州市供销合作总社考察学习农业农村电子商务工作。。考察团先后参观了泰州市供销优品电子商务有限公司的“优畔”智能无人便利店、衔农公社微信平台、供销优品旗舰店、衔农优品社区门店等项目。泰州市供销社副调研员李晓荣详细介绍了泰州在推进农业农村电子商务建设中好的做法，考察团也与供销优品公司开展了交流互动。。叶海军表示，泰州市供销社在电子商务方面成效显著，做法和经验很值得淮安供销系统学习借鉴。希望两地供销能继续加强沟通交流、深化合作对接，共同推动供销社电子商务发展，助力乡村振兴战略实施。,政府领导到其他城市考察学习或访问,0.0,True
76,江苏省,淮安市,对标找差深挖内涵打造乡村振兴涟水样板,2020-08-07,http://www.lianshui.gov.cn/col/887_451888/art/202008/1596762155189o1jP6Hx1.html,水泥路户户通，厕所干净卫生，村庄美丽整洁……8月6日，县委书记时勇率队赴徐州市，深入铜山区汉王镇紫山村、峨山村、小南望村，贾汪区大吴街道小吴村和潘安湖街道西大吴村、真旺村、马庄村等地，边走边看边交流，实地考察学习农村人居环境整治工作。时勇强调，要积极践行“绿水青山就是金山银山”理念，进一步对标找差，深入挖掘内涵，打造属于涟水的乡村振兴样板。徐州市委副书记徐大勇，徐州市委副秘书长杨加法，徐州市农业农村局党委书记李海峰，贾汪区委书记张克，铜山区委副书记、区长高建民等分别陪同考察。县领导李义翠、李金平、姜杰参加考察。。铜山区汉王镇紫山村依山傍水，环境优美，整体建筑将明清风格和徽派相结合，保留了历史古迹、民俗文化和原生态田园风光，留住乡村的“魂”。同时，该村以美丽经济招引美丽产业，大力发展旅游、文化、民宿及农家乐等富民产业，实现美丽乡村建设与产业融合发展。白墙褐瓦，小桥流水，凉亭花园，整洁靓丽的村容村貌，民风淳朴的美丽庭院，村民们充满幸福感的笑脸墙……看着眼前靓丽动人的景象，时勇深有感触地说，紫山村以党建为统揽，用心探索，留住了乡愁和记忆，不仅有美丽风景，更有美好“钱景”。。庭前景致如画，推窗见花闻香。走进贾汪区大吴街道小吴村，让人情不自禁地沉醉其中、流连忘返。宽广整洁的乡间道路，绿树掩映的农家院落，粉墙黛瓦的小楼别墅，门前花团簇拥，房屋干净整洁，处处散发着家的温馨与清香。近年来，小吴村根据农村人居环境整治工作要求，以“特色田园乡村”建设为契机，重点实施了“村容村貌整治提升、垃圾分类、污水治理、厕所改造”四项工程。时勇说，贾汪区山美水秀、天蓝地洁、树绝花奇，小吴村重点实施四项工程，让群众住得舒心、安心、顺心，我们有责任帮助加大宣传力度，让更多的人来贾汪观光旅游，让绿水青山真正成为金山银山。。贾汪区潘安湖原来是采煤塌陷区，经生态修复蝶变成湖阔景美的国家湿地公园。时勇感受潘安湖的变化，感叹贾汪转型实践做得好，真正实现了从“一城煤灰半城土”到“一城青山半城湖”的精彩嬗变，并把绿水青山变成金山银山。“香包多少钱一个？一天能挣多少钱？能做几个？”来到潘安湖街道马庄村，看到村民们手工制作的特色香包，时勇和村民拉起了家常，连连称赞香包“真不错”“很精致”，对该村以 “香包文化”带动村民就近、就地就业表示赞许。。跟高手学才能更高，向强者看才能更强。时勇表示，这次的学习之旅收获满满，亲身感受到徐州市在农村人居环境整治工作方面作出的创新探索、取得的显著成效和积累的宝贵经验，我们将认真总结、充分吸收，结合涟水实际，将徐州市的好经验、好做法运用到我县农村人居环境整治工作中去，全力助推乡村振兴，全面推动涟水高质量发展。。一个个鲜活的考察现场、一个个精准的创新模式、一幅幅新时代美丽乡村的“生态宜居画卷”令人神往。走进徐州，大家用眼观察、用耳聆听、用心探寻徐州独辟“绿径”经营“美丽”乡村的生动实践。发展思路决定发展出路，只有用心建设、经营好美丽乡村，才能带动美丽经济。大家纷纷表示，要用更加务实的举措进一步推进农村人居环境整治工作，让村民走上宽敞平坦的道路、用上清洁卫生的厕所、享受干净舒心的村庄环境，持续增强农民群众的获得感幸福感。,5月24日，县委常委、常务副县长洪然带领相关部门和部分镇负责同志，先后赴宿迁市泗阳县爱园镇松张口新型农村社区和盐城市建湖县九龙口镇收成新型农村社区，考察学习兄弟县区农房改善工作先进做法，交流工作经验，并就搬迁安置、建设模式、公共服务等内容进行了交流。。松张口新型农村社区积极推行“产业+社区”一体化发展模式，依托传统产业，大力推进农业结构调整，聚力发展桃果特色产业，建成加华果园、红满天果园等桃果基地12个，发展“桃果+”农旅项目，可吸纳1000余人常态务工，农民人均月工资超2000元；抓住农房改善机遇，目前22幢79套样板房已经建成，为五保户、特困户建设13套暖心房，其余221套农房12月底前可全面入住。。收成新型农村社区共有村民852户，已有630户参与农房改善，目前已建成农房111幢299套。社区努力打造具有沿荡自然风貌、历史文化底蕴、休闲旅游功能的特色田园乡村，对历史遗存予以严格保护，还原收成老街历史风貌；充分挖掘“收成八景”文化，发展民宿、采摘等具有乡土特色的乡村旅游产业，培育稳虾轮作、藕虾共作等现代高效农业，推动村集体和村民“双增收”。。洪然表示，泗阳县和建湖县高起点、高标准推进农房改善工作，大力整治村庄环境，极大地改善了农民居住环境；大力发展特色产业，完善农村基础设施，农房改善工作亮点纷呈。希望双方今后进一步加强沟通交流，互相学习、取长补短，共同推动农房改善工作再上新台阶。,政府领导到其他城市考察学习或访问,0.6857721946265919,True
76,江苏省,淮安市,交通局质监站组织质监人员外出观摩装配式建筑施工,2018-10-08,http://www.lianshui.gov.cn/col/890_578563/art/3ae8e235411347a492bef388b3e9b84b.html,日前，涟水县新建小区装配式建筑项目已经在玖龙御府（南城上院）小区悄然启动。据悉，到2020年，全省新建建筑预制装配率将要求达到30%。面对这一新生事物，作为监管部门必须提前做好工作准备。为了学习借鉴装配式建筑施工质量监管的先进经验，2018年10月2日至3日，涟水县住建局质监站组织部分监督人员赴合肥市长丰县中央公园项目进行了考察学习。。学习期间，对中央公园项目预制构件应用关键节点、装配式钢筋混凝土施工进行了现场考察学习。。每位监督人员深入学习装配式建筑的施工工艺、技术要点、吊装安全风险点，了解装配式建筑与传统建筑在平面布置、塔吊选型、工期和成本等方面的差异和控制重点，进一步拓宽了业务知识，提升了装配式建筑项目管理水平。。通过此次赴合肥市的深入交流学习，以及对装配式建筑施工现场的考察，考察组一行了解了装配式建筑工程推进情况、施工难点特点以及监管要求等。考察组成员纷纷表示，将认真学习借鉴合肥市经验，提升我县建设工程质量安全监管水平，提前谋划装配式建筑监管工作，为我县装配式建筑健康发展保驾护航。,今年以来，洪泽经济开发区为推进国有公司改革，实现政企分开，自主经营，制定了《关于深化国有公司改革的实施方案》，从企业转型、提升企业经营能力、招引人才等方面入手，采取三大措施，狠抓落实，深入推进开发区国有企业改革，取得显著的成效。。以市场竞争为导向，规范公司制度。上半年国有公司按照市场化、企业化运行要求，进行公司制度改革，着力于产权明晰、权责明确、政企分开、科学管理、资金监管等方面，提高公司在市场中的竞争力。为保证公司规范运作，开发区设立监管办，指导和推进各公司改革；公司实行董事会研究决策、法人审批、董事复核等内部控制制度。。以培养人才为重点，提升管理能力。公司经营水平高低归根结底取决于人才素质的优劣。为了选拔优秀人才，今年初，开发区通过举办竞职演说等方法，选取13名具有丰富企业管理经验的人员，构建国有公司组织体系。同时，面向全社会招聘高学历、高层次人才。为了提高经营能力和运营效率，还多次委派人员外出考察学习。。以自主经营为抓手，推动转型升级。今年上半年各国有公司纷纷开展自主经营、自负盈亏活动，取得良好效益。以代理招商、项目置换、股权投资、企业担保等多种形式，在保证自身收益基础上，为园区企业和项目开展服务工作，创新政府对高新企业的扶持方式。投发公司在保证自身收益的基础上入股三联新材料公司；与芸茹科技公司等项目合作，开展闲置土地、厂房收购等工作；下半年，公司已拟定进行土地及安置房开发等业务，推动国有资本合理流动，不断增强公司经济活力、控制力、影响力。,其他,0.6039707484287866,True
76,江苏省,淮安市,协商民主担重任共谋发展为初心县政协年工作回眸,2019-01-24,http://www.jinhu.gov.cn/col/3929_863743/art/20190124110702_oUSSJlqq.html,回望2018年，县政协与县域发展脉搏同步，为科学发展而谋，为凝聚力量而商，为民生民愿而呼，为民主和谐而议。紧扣主线、多维协商、共谋发展，县政协始终把协商民主作为履职工作主线，把服务金湖发展作为履职第一要务，协同心之力，商同向之道，为推进“五县共建”、建设“强富美高”新金湖作出了积极贡献。。一年来，县政协认真贯彻落实新发展理念，围绕全县中心工作，聚焦改革发展大局，努力为全县转型发展、跨越赶超贡献政协力量。。自觉坚持党的领导。始终把坚持党的领导作为政协履职的根本，组织推动政协各参加单位和广大委员，深入学习贯彻习近平新时代中国特色社会主义思想和党的十九大精神，认真学习领会习近平总书记关于加强和改进人民政协工作的重要思想，学习贯彻全国政协系统、全省政协系统党的建设工作座谈会精神，牢固树立“四个意识”，坚定“四个自信”，不断增强政治认同、思想认同、理论认同、情感认同，始终在思想上政治上行动上以习近平同志为核心的党中央保持高度一致。。着力服务发展大局。坚持抓大事、议大事，把政协工作紧紧融入全县大局，确立“县委想什么、政协议什么，政府干什么、政协帮什么”的履职主线，确保与党政决策部署无缝对接、合拍共振。重点围绕践行新发展理念、促进实体经济高质量发展、推动民生事业进步、加强生态文明建设等内容议政建言；认真完成县委统一部署的挂钩联系帮扶工作任务；充分发挥团结统战功能，有效激发整体履职活力，把团结的面扩得更广，团结的同心圆画得更大，把更多智慧力量汇聚到全面建成“强富美高”新金湖的大业中来。。全面提高履职质量。深入开展解放思想大讨论，坚持把提高履职质量作为提升政协话语权、影响力的关键环节和基础工程，明确“高起点谋划工作、高质量调查研究、高水平建言献策、高标准建设机关”的总体工作思路。坚持问题导向、精准履职，通过广泛征集、反复论证，研究确定调研协商等8大类60项重点工作和活动；深化调查研究，整合各方力量，集中智力攻关，不断拓展建言献策的高度和深度；大兴学习研究之风，打造学习型干部队伍，建设研究型机关，切实做到懂政协、会协商、善议政，为提高履职水平奠定坚实基础。全年共召开常委会议5次、主席会议14次、专项工作会议8次，开展专题调研视察、提案督办41次，报送建议案、专项报告、调研视察报告、社情民意信息专报等45件，许多意见建议进入党政决策程序，有效推动了相关工作的开展。。积极扩大政协影响。在市政协专题会议上，我县政协5次作交流发言，市政协两次专题会议在我县召开。在新时代政协理论研讨活动中，完成学习贯彻习近平总书记关于加强和改进人民政协工作的重要思想理论研讨文章35篇，被省政协采用1篇，上报市政协6篇，并全部获奖，其中《发挥基层政协优势，践行协商为民理念》《协商民主的光辉典范——缅怀周恩来统战工作的人格情怀》获市政协2018年度政协理论研究优秀论文一等奖。在市政协八届二次会议上，县政协副主席唐凤娥作《推进“四个一”改革，构建便捷高效公共服务体系》的大会发言，得到了市长蔡丽新的充分肯定，并作为市政府重点工作在全市推广。编辑出版《欣澹庵与金湖中医传承》《春风浩荡——庆祝改革开放40周年“三亲”文史资料》，集中展示了一批优秀政协委员在改革开放进程中建功立业的风采，较好地发挥了文史工作“存史、资政、团结、育人”的作用。《人民政协报》《江苏政协》先后15次报道金湖政协工作的特色亮点和履职成效。。为充分发挥政协民主监督的职能作用，2018年，县政协积极探索民主监督的有效形式和机制，进一步丰富监督内容、规范监督程序、拓展监督渠道，着力提高监督实效。,"目前，全市农业综合机械化水平达85%，洪泽区高标准创成省级粮食生产全程机械化示范区，入选全国农作物生产机械化示范县，金湖县达到省级示范县标准，淮安区、涟水县入围2018年度省级示范县区，建成金湖塔集等20个粮食生产示范乡镇。淮安粮食生产全程机械化工作成效得到了广泛关注，全市工作得到市委姚晓东书记点赞，形成的""12345""创建模式受到省局肯定。2018年4月6日中央电视台《新闻联播》和《新闻直播间》、淮安电视台等多家主流媒体对我市该项工作进行专题报道，《人民日报》、《新华日报》、《中国农机化导报》、《淮安日报》多次报道我市粮食生产全程机械化工作成效，省农机化信息网、市政府网站专题推介我市经验，徐州、宿迁等农机同行先后来淮考察学习。",政府领导到其他城市考察学习或访问,0.5596715205309469,True
76,江苏省,淮安市,主要成效,2018-12-14,http://www.huaian.gov.cn/col/17031_475638/art/20181214093537_tLpPWDBS.html,"目前，全市农业综合机械化水平达85%，洪泽区高标准创成省级粮食生产全程机械化示范区，入选全国农作物生产机械化示范县，金湖县达到省级示范县标准，淮安区、涟水县入围2018年度省级示范县区，建成金湖塔集等20个粮食生产示范乡镇。淮安粮食生产全程机械化工作成效得到了广泛关注，全市工作得到市委姚晓东书记点赞，形成的""12345""创建模式受到省局肯定。2018年4月6日中央电视台《新闻联播》和《新闻直播间》、淮安电视台等多家主流媒体对我市该项工作进行专题报道，《人民日报》、《新华日报》、《中国农机化导报》、《淮安日报》多次报道我市粮食生产全程机械化工作成效，省农机化信息网、市政府网站专题推介我市经验，徐州、宿迁等农机同行先后来淮考察学习。","上海农博会旨在打造全国性的农产品行业盛会，加强品牌农业建设，拓宽销售渠道，增加优质农产品供给，满足消费需求，促进农民持续增收，推动我国现代农业发展。展会立足上海、面向全国，汇聚了宁夏、浙江、湖北、福建、云南、甘肃、新疆、内蒙古、黑龙江、江苏、贵州、陕西、辽宁、山东等全国30多省的60多个市区县政府组团、530多家原产地龙头企业参展，带来了涵盖粮油、果蔬、肉禽食品、水产、豆制品、菌类、茶业、蜂产品等10多个大类2000余个品种，所有产品均为原产地优质农产品。。受上海农博会组委会和供销合作行业协会邀请，市供销社积极组织人员参加本次盛会，大家纷纷走进展馆，跟随人潮感受现代农业科技最新成果和地方特色农副产品展销两旺的热闹氛围，并与现场工作组进行了简单交流，就活动组织、展馆布置、宣传推广进行了咨询。通过参观学习，市供销社一行还了解了当前社会发展和科技创新领域的诸多新产品、新技术、新趋势，体验到现代科技对农业生产生活的影响。大家纷纷表示，要加强学习和创新，不断提升服务""三农""的综合素质和创新能力，打开视野格局，为供销系统改革发展做出积极贡献。（社务管理处）",其他,0.7673659274220525,True
