code,province,city,topic,date,url,content,content.1,label,score,is_match
139,山东省,日照市,部门解读关于建立日照市府检联动工作机制的通知,2023-09-22,http://www.rizhao.gov.cn/art/2023/9/22/art_312835_10470567.html,2021年6月，党中央印发《关于加强新时代检察机关法律监督工作的意见》，对进一步加强和改进检察机关法律监督工作提出明确要求；省委、市委跟进出台了《关于加强新时代检察机关法律监督工作的若干措施》，这些文件都对加强检察机关与行政机关的沟通协作提出了明确要求。为贯彻上级部署，2022年4月，市检察院指导岚山区检察院率先与岚山区政府建立区级层面的“府检联动”机制，历经一年实施，运转顺畅、效果显著。今年3月，市检察院组成专门考察团赴安徽宿州、合肥等地学习“府检联动”工作经验，并立足日照实际，梳理出我市“府检联动”项目19个。9月18日，市政府与市检察院召开“府检联动”第一次联席会议，进行进一步审议。9月21日，《关于建立日照市府检联动工作机制的通知》（以下简称《通知》）以正式文件形式（日政字〔2023〕48号）印发各区县政府、各功能区管委、各区县检察院，市政府各部门，中央、省属驻日照各单位执行。。全市政府部门、检察机关将按照《通知》确定的“府检联动”工作内容、工作举措，发挥政府和检察院各自职能优势，加强行政执法与刑事司法衔接，共享共商行政执法信息和检察监督信息资源，共同推进社会治理创新，共同推进法治政府建设、加强新时代检察机关法律监督工作，促进行政机关依法行政、检察机关公正司法，为推动全市经济社会高质量发展提供法治保障。。《通知》从总体要求、主要原则、重点工作、落实机制、组织保障五个方面对日照市“府检联动”工作机制做了全面且具体的规定。。《通知》要求，检察机关、政府部门要坚持党委领导、政法协力，依法依规、有机衔接，资源共享、协同联动，高效畅通、提升效能，联系群众、改进作风五项原则，健全行政执法与刑事司法衔接、公共利益协同保护、涉案企业合规工作保障协作、宽严相济刑事政策落实、大数据战略互通融合五项机制，共同做好维护国家安全和社会大局稳定、服务保障绿色低碳高质量发展、打造法治化营商环境、解决突出问题促进社会治理、加强民生领域法治保障、提升全社会法治意识六项工作。。《通知》指出，要建立“府检联动”组织机构。决定建立日照市“府检联动”联席会议制度，原则上每年召开1次。日照市委副书记、市长任总召集人，市委常委、副市长和市检察院检察长任召集人。联席会议下设办公室，市检察院分管负责同志和市司法局主要负责同志任办公室主任。要健全“府检联动”组织形式。通过联席会议、信息交流、案件协商、会签文件、专项行动等形式开展工作。要明确“府检联动”工作职责。检察机关及时向市政府有关行政部门通报、交流行政执法与刑事司法衔接协作等事项，市政府有关行政部门及时向检察机关通报、交流行政部门行政执法案件相关数据统计和情况分析等事项，市政府和市检察院共同研究协调行政复议中需要化解的重大、复杂行政争议等事项。要严格落实工作要求。联席会议成员单位须认真履行保密义务，健全常态化工作衔接机制。联席会议办公室每半年要对各成员单位落实联席会议精神、开展“府检联动”协作情况等进行检查，在一定范围内进行通报，督促工作落实。,2021年6月，党中央印发《关于加强新时代检察机关法律监督工作的意见》，对进一步加强和改进检察机关法律监督工作提出明确要求；省委、市委跟进出台了《关于加强新时代检察机关法律监督工作的若干措施》，这些文件都对加强检察机关与行政机关的沟通协作提出了明确要求。为贯彻上级部署，2022年4月，市检察院指导岚山区检察院率先与岚山区政府建立区级层面的“府检联动”机制，历经一年实施，运转顺畅、效果显著。今年3月，市检察院组成专门考察团赴安徽宿州、合肥等地学习“府检联动”工作经验，并立足日照实际，梳理出我市“府检联动”项目19个。9月18日，市政府与市检察院召开“府检联动”第一次联席会议，进行进一步审议。9月21日，《关于建立日照市府检联动工作机制的通知》（以下简称《通知》）以正式文件形式（日政字〔2023〕48号）印发各区县政府、各功能区管委、各区县检察院，市政府各部门，中央、省属驻日照各单位执行。。全市政府部门、检察机关将按照《通知》确定的“府检联动”工作内容、工作举措，发挥政府和检察院各自职能优势，加强行政执法与刑事司法衔接，共享共商行政执法信息和检察监督信息资源，共同推进社会治理创新，共同推进法治政府建设、加强新时代检察机关法律监督工作，促进行政机关依法行政、检察机关公正司法，为推动全市经济社会高质量发展提供法治保障。。《通知》从总体要求、主要原则、重点工作、落实机制、组织保障五个方面对日照市“府检联动”工作机制做了全面且具体的规定。。《通知》要求，检察机关、政府部门要坚持党委领导、政法协力，依法依规、有机衔接，资源共享、协同联动，高效畅通、提升效能，联系群众、改进作风五项原则，健全行政执法与刑事司法衔接、公共利益协同保护、涉案企业合规工作保障协作、宽严相济刑事政策落实、大数据战略互通融合五项机制，共同做好维护国家安全和社会大局稳定、服务保障绿色低碳高质量发展、打造法治化营商环境、解决突出问题促进社会治理、加强民生领域法治保障、提升全社会法治意识六项工作。。《通知》指出，要建立“府检联动”组织机构。决定建立日照市“府检联动”联席会议制度，原则上每年召开1次。日照市委副书记、市长任总召集人，市委常委、副市长和市检察院检察长任召集人。联席会议下设办公室，市检察院分管负责同志和市司法局主要负责同志任办公室主任。要健全“府检联动”组织形式。通过联席会议、信息交流、案件协商、会签文件、专项行动等形式开展工作。要明确“府检联动”工作职责。检察机关及时向市政府有关行政部门通报、交流行政执法与刑事司法衔接协作等事项，市政府有关行政部门及时向检察机关通报、交流行政部门行政执法案件相关数据统计和情况分析等事项，市政府和市检察院共同研究协调行政复议中需要化解的重大、复杂行政争议等事项。要严格落实工作要求。联席会议成员单位须认真履行保密义务，健全常态化工作衔接机制。联席会议办公室每半年要对各成员单位落实联席会议精神、开展“府检联动”协作情况等进行检查，在一定范围内进行通报，督促工作落实。,其他,0.6260789404618513,True
139,山东省,日照市,日照市城市管理条例宣传活动走进社区,2017-09-04,http://www.rizhao.gov.cn/art/2017/9/4/art_215287_10340232.html,为积极宣传《日照市城市管理条例》，有效动员广大妇女、团员青年认真学习、带头实践《条例》，9月3日，市妇联、团市委在东港区香河街道高新社区举办“宣传学习《日照市城市管理条例》 积极争创全国文明城市”进社区活动。市人大常委会副主任郑玉霞，副市长、市公安局局长张培林出席活动。。活动中，市领导向志愿者代表发放《日照市城市管理条例》。同时，志愿者们通过设置宣传台、发放宣传材料，向前来参观的社区群众介绍《条例》的主要内容，号召群众行动起来，主动宣传、学习、遵守《条例》，做知法守法遵法的好市民。此外，活动现场还开展了禁毒宣传活动，发放禁毒宣传页近千份。。据悉，《日照市城市管理条例》将于今年10月1日正式实施。这是我市获得地方立法权后制定的第一部实体性法规，也是省内首部设区的市一级城市管理综合性法规，标志着我市城市管理各项工作纳入规范化、法制化轨道。,为积极宣传《日照市城市管理条例》，有效动员广大妇女、团员青年认真学习、带头实践《条例》，9月3日，市妇联、团市委在东港区香河街道高新社区举办“宣传学习《日照市城市管理条例》 积极争创全国文明城市”进社区活动。市人大常委会副主任郑玉霞，副市长、市公安局局长张培林出席活动。。活动中，市领导向志愿者代表发放《日照市城市管理条例》。同时，志愿者们通过设置宣传台、发放宣传材料，向前来参观的社区群众介绍《条例》的主要内容，号召群众行动起来，主动宣传、学习、遵守《条例》，做知法守法遵法的好市民。此外，活动现场还开展了禁毒宣传活动，发放禁毒宣传页近千份。。据悉，《日照市城市管理条例》将于今年10月1日正式实施。这是我市获得地方立法权后制定的第一部实体性法规，也是省内首部设区的市一级城市管理综合性法规，标志着我市城市管理各项工作纳入规范化、法制化轨道。,其他,0.8700214240313104,True
139,山东省,日照市,日照市优化营商环境条解读新闻发布会,2019-12-25,http://www.rizhao.gov.cn/art/2019/12/25/art_215289_10340560.html,大家上午好！首先，我代表市政府，向参加这次发布会的媒体朋友们表示热烈欢迎！向一直以来关心关注全市营商环境建设工作的社会各界朋友，表示衷心的感谢！下面，我首先简要介绍一下《日照市优化营商环境100条》（以下简称《100条》）制定背景、过程和主要内容。。对一个城市来说，营商环境是核心竞争力和重要软实力，是吸引投资、集聚要素的先决条件。在市场经济条件下，企业和资源都是“用脚投票”，哪里环境优、哪里服务好，就会往哪里加速集聚。近年来，全国各地对优化营商环境工作越来越重视，而且越是一线城市、发达地区，重视程度越高、政策体系越全、措施也更加领先而有力。。市委、市政府对优化营商环境工作同样十分重视，围绕深化“一次办好”改革，制定出台了一系列政策文件，组织实施了“十大专项”行动，企业开办“513模式”等经验做法去年被国务院通报表彰。但对标国内、省内先进城市，我们仍存在不少亟待解决的短板和问题，特别是我市现在正在大力推进新一轮高质量招商引资招才引智，如果没有好的营商环境来保障，各项优化营商环境的措施如果不能对标达标甚至创标，双招双引就不可能取得大的成效，全市新旧动能转换和高质量发展也就失去了坚实支撑。。为此，市委、市政府今年以来进一步加大了优化提升营商环境工作力度。市委常委会、市政府常务会多次进行研究部署，主要领导同志多次作出批示指示，特别是3月14日，市政府在市政务服务大厅一线召开了第35次常务会议，对优化营商环境工作作了全面安排部署；4月4日，市委办公室、市政府办公室又印发了《进一步深化“一次办好”改革优化营商环境重点任务分工方案》，明确了8个方面27条具体措施，其中之一就是提出要制定出台营商环境一揽子精准优化提升措施。为了开展好这项工作，市政府专门成立了营商环境优化提升工作领导小组，由市委常委、副市长刘兆亮同志担任组长。根据市委、市政府要求，在市营商环境优化提升工作领导小组组织领导下，市发展改革委自4月份开始，着手牵头研究优化提升我市营商环境工作，会同18个专项工作组共同努力，形成了《日照市优化营商环境100条》。7月28日、30日，市政府常务会议、市委常委会（扩大）会议先后分别作了研究，8月11日以市委、市政府文件正式印发实施。。《日照市优化营商环境100条》，是省内16个城市中，首个对标国家营商环境评价指标体系，制定出台的优化营商环境综合性措施文件，总的目的是深化“一次办好”改革，深刻转变政府职能，营造稳定公平透明可预期的营商环境，更好服务企业发展，释放全社会创新创业创造动能，激发市场活力，增强城市投资吸引力，推动新旧动能转换和高质量发展。整个起草制定过程，是分为四个阶段压茬推进的。。（一）对标学习阶段。主要是“两个对标”。一是对标国家营商环境评价。根据党中央和国务院安排，国家发展改革委按照“国际可比、对标世行、中国特色”的原则，构建了中国营商环境评价指标体系，去年在22个城市开展了试评价，今年又选取40个城市开展了试评价工作，到明年国家营商环境评价将实现地级以上城市全覆盖。可以说，国家营商环境评价指标体系是各地推进营商环境建设的根本指引。《日照市优化营商环境100条》的制定，就是对标国家营商环境评价指标体系进行的。二是对标先进城市。坚持“对标先进、争创一流”的原则，到南京、杭州两个国家营商环境试评价城市进行对标学习，并学习了解了省内青岛、威海、潍坊等城市经验做法，确保别的地方能够办到我市也要办到，并且要办得更好。同时，于5月中上旬开展了优化营商环境“金点子”征集，共征集到各类有一定价值的意见建议60余条。,大家上午好！首先，我代表市政府，向参加这次发布会的媒体朋友们表示热烈欢迎！向一直以来关心关注全市营商环境建设工作的社会各界朋友，表示衷心的感谢！下面，我首先简要介绍一下《日照市优化营商环境100条》（以下简称《100条》）制定背景、过程和主要内容。。对一个城市来说，营商环境是核心竞争力和重要软实力，是吸引投资、集聚要素的先决条件。在市场经济条件下，企业和资源都是“用脚投票”，哪里环境优、哪里服务好，就会往哪里加速集聚。近年来，全国各地对优化营商环境工作越来越重视，而且越是一线城市、发达地区，重视程度越高、政策体系越全、措施也更加领先而有力。。市委、市政府对优化营商环境工作同样十分重视，围绕深化“一次办好”改革，制定出台了一系列政策文件，组织实施了“十大专项”行动，企业开办“513模式”等经验做法去年被国务院通报表彰。但对标国内、省内先进城市，我们仍存在不少亟待解决的短板和问题，特别是我市现在正在大力推进新一轮高质量招商引资招才引智，如果没有好的营商环境来保障，各项优化营商环境的措施如果不能对标达标甚至创标，双招双引就不可能取得大的成效，全市新旧动能转换和高质量发展也就失去了坚实支撑。。为此，市委、市政府今年以来进一步加大了优化提升营商环境工作力度。市委常委会、市政府常务会多次进行研究部署，主要领导同志多次作出批示指示，特别是3月14日，市政府在市政务服务大厅一线召开了第35次常务会议，对优化营商环境工作作了全面安排部署；4月4日，市委办公室、市政府办公室又印发了《进一步深化“一次办好”改革优化营商环境重点任务分工方案》，明确了8个方面27条具体措施，其中之一就是提出要制定出台营商环境一揽子精准优化提升措施。为了开展好这项工作，市政府专门成立了营商环境优化提升工作领导小组，由市委常委、副市长刘兆亮同志担任组长。根据市委、市政府要求，在市营商环境优化提升工作领导小组组织领导下，市发展改革委自4月份开始，着手牵头研究优化提升我市营商环境工作，会同18个专项工作组共同努力，形成了《日照市优化营商环境100条》。7月28日、30日，市政府常务会议、市委常委会（扩大）会议先后分别作了研究，8月11日以市委、市政府文件正式印发实施。。《日照市优化营商环境100条》，是省内16个城市中，首个对标国家营商环境评价指标体系，制定出台的优化营商环境综合性措施文件，总的目的是深化“一次办好”改革，深刻转变政府职能，营造稳定公平透明可预期的营商环境，更好服务企业发展，释放全社会创新创业创造动能，激发市场活力，增强城市投资吸引力，推动新旧动能转换和高质量发展。整个起草制定过程，是分为四个阶段压茬推进的。。（一）对标学习阶段。主要是“两个对标”。一是对标国家营商环境评价。根据党中央和国务院安排，国家发展改革委按照“国际可比、对标世行、中国特色”的原则，构建了中国营商环境评价指标体系，去年在22个城市开展了试评价，今年又选取40个城市开展了试评价工作，到明年国家营商环境评价将实现地级以上城市全覆盖。可以说，国家营商环境评价指标体系是各地推进营商环境建设的根本指引。《日照市优化营商环境100条》的制定，就是对标国家营商环境评价指标体系进行的。二是对标先进城市。坚持“对标先进、争创一流”的原则，到南京、杭州两个国家营商环境试评价城市进行对标学习，并学习了解了省内青岛、威海、潍坊等城市经验做法，确保别的地方能够办到我市也要办到，并且要办得更好。同时，于5月中上旬开展了优化营商环境“金点子”征集，共征集到各类有一定价值的意见建议60余条。,其他,0.7930271682699969,True
