code,province,city,topic,date,url,content,content.1,label,score,is_match
131,山东省,淄博市,青州市客人来我区考察学习,2022-08-17,http://www.linzi.gov.cn/art/2022/8/17/art_5302_2315383.html,8月17日上午，青州市委书记宋伟伟带队来我区考察学习，区委书记周婷，区人大常委会主任卢华栋，区领导康义文、郭克华陪同。。在凤凰镇西河村，客人一行详细了解了基层党建、村企联合共建、美丽乡村建设等方面的工作。在智能网联汽车产业园、临淄区产业数字化促进中心，详细了解了我区产业布局和“五个优化”等方面情况，对我区超前谋划、积极布局新兴产业，实施发展壮大村集体经济提质倍增行动等经验做法给予高度评价。。周婷对宋伟伟一行的到来表示热烈欢迎，希望双方进一步加强联系，深化各领域的合作，努力实现优势互补、共同发展。,客人一行先后到凤凰镇西河村、区政务服务中心、临淄经济开发区智能网联汽车产业园、临淄区产业数字化促进中心考察学习，对我区乡村振兴、优化营商环境、智能装备制造业发展等工作给与高度评价，希望与我区进一步强化交流沟通，促进双方共同发展。。近年来，我区统筹做好“优” 和“扩”两篇文章，以“五个优化”引领传统产业升级，以“四新壮大”引领新兴产业崛起，以“打造标杆”引领企业发展壮大，培育壮大了智能网联、无人驾驶汽车产业、大数据产业等产业集群。,其他,0.5167469709786648,True
131,山东省,淄博市,昌邑市客人来我区考察学习,2022-08-26,http://www.linzi.gov.cn/art/2022/8/26/art_5302_2317968.html,8月26日上午，昌邑市委常委、副市长窦海燕带队来我区考察学习数字农业建设工作。区人大常委会主任卢华栋，副区长王俊涛，副区长高晋陪同。。客人一行先后到朱台镇陈营村、西单村、禾丰种业进行现场观摩，详细了解我区在数字农村、数字农业、美丽乡村建设等方面的经验做法。。近年来，我区立足新时代农情，围绕推进数字技术与农业农村深度融合，不断提升数字农业生产能力，助力农业全面升级、农村全面进步、农民全面发展。目前，我区数字乡村建设正向纵深发展，深入推进智慧人社、智慧养老、智慧教育、智慧医疗等多行业应用体系建设，厚植数字民生，着力打造“活力宜居、和谐有序”的善治乡村，丰富乡村治理的数字“内涵”。,客人一行先后到智能网联汽车产业园、山东东道智能科技有限公司进行实地观摩，详细了解各企业运营管理、产品生产、智慧化管理平台建设等工作，以及我区在新兴产业培育、推动企业数字化转型、智能装备制造业发展等方面的经验做法。。蔡华刚对潍城区考察团一行的到来表示热烈欢迎，希望双方在今后的工作中不断加强交流与联系，形成更多的务实合作。,其他,0.5675593067860583,True
131,山东省,淄博市,潍坊青州市来桓台县考察学习,2022-08-26,http://www.huantai.gov.cn/art/2022/8/26/art_4853_2317622.html,8月25日，潍坊青州市委副书记、 市长田永全一行38人来桓台县考察学习工业园区等工作。县领导郑元水、陈之远陪同。。考察团实地参观氢能技术示范中心展区，对桓台县贯彻新发展理念，聚焦关键领域精准施策，培优做强氟、硅、膜、氢等新兴产业链的做法给予一致好评。一致认为，近年来，桓台县按照“紧盯前沿、打造生态、沿链聚合、集群发展”的产业组织理念，加快产业发展和项目建设，聚力主导产业转型升级，夯实高质量跨越发展基石。希望以此次考察学习为契机，进一步增进交流互动，创新合作方式、拓宽合作领域、提升合作层次，共谱两地高质量发展新篇章。,淄博市城市管理局 工作要闻 【考察学习】，潍坊市城市管理局来我局考察学习城市管理工作。8月23日上午，潍坊市城市管理局三级调研员台炳友一行6人，来我市考察共享单车管理、城市运行管理服务平台建设运营、环卫运行机制及管理模式等内容。市城市管理局副县级干部、三级调研员孟繁华陪同考察。。孟繁华介绍了全市城市管理工作理念、相关工作体制机制建设情况，并陪同参观调研了张店区、高新区典型经验做法。,其他,0.5165084216321949,True
131,山东省,淄博市,淄川区党政企考察团到淄博高新区考察学习,2022-08-10,http://www.zichuan.gov.cn/art/2022/8/10/art_4630_2313721.html,8月8日下午，副市长、淄川区委书记田兵兵带领淄川区党政企考察团到淄博高新区考察学习。高新区工委书记、管委会主任魏玉蛟陪同活动。区领导冯炳涛、王洪波、郭亦华、高建军参加活动。。田兵兵一行先后到鲁中国际陆港冷链基地、达芬骑动力科技（北京）有限公司高速电动摩托车项目、齐鲁储能谷、齐鲁智能微系统创新产业基地进行考察学习。这些项目都是科技含量高、市场前景好、发展带动力强的高端产业项目。每到一处，田兵兵都详细了解企业研发创新、产业链配套、销售经营等情况，对高新区紧盯科技前沿战略、不断提升企业智能化水平、推进工业经济高质量发展的做法给予高度评价。。座谈会上，田兵兵说，高新区抢抓新旧动能转换重大机遇，在加快产业发展和重大项目建设上取得了显著成绩，探索出了一系列好模式和好的发展思路，为淄川区发展提供了丰富的先进经验。当前，淄川区正锚定“争当全市高质量发展重要增长极”目标定位，集中精力突破交通瓶颈，加速能源结构转变，支持头部企业争创百年名企，努力推动全区高质量发展。希望双方进一步深化平台共用，加强项目联谊和交流互动，努力推动两地更高水平的共赢发展。。魏玉蛟代表高新区工委、管委会对考察团的到来表示欢迎，并介绍了高新区经济社会发展、项目推进、“双招双引”等情况，希望双方加强交流合作，链接更多资源，实现合作共赢，携手为淄博市高质量发展作出更大贡献。,日前，淄博仲裁办党组书记、主任张公博带领淄博仲裁委一行赴北京仲裁委员会、中国政法大学仲裁研究院、天津金融资产交易所、北京多元调解发展促进会等进行考察学习，着重学习先进仲裁机构运营、改革与管理，矛盾纠纷调处化解和智慧化仲裁等工作。。8月3日，考察组与中国政法大学仲裁研究院召开淄博仲裁委员会“十四五”发展规划研讨会，双方就规划进行充分研讨，重点围绕“六大能力建设”，从顶层设计、发展路径到实践举措，科学系统谋划，明确目标定位，为加速构建淄博仲裁高质量发展新格局谋篇布局。。随后，淄博仲裁办与中国政法大学仲裁研究院、天津金融资产交易所就“国际仲裁云链”合作项目举行建设发展研讨会。会议指出，“国际仲裁云链”是由法大司法存证实验室研发的致力于实现“链上证据、云上解纷”的司法存证平台。通过技术手段可以提高仲裁的效率、确保证据平台的数据留痕、确保电子送达效力，“国际仲裁云链”的研发有利于为国际商事主体提供全生命周期服务，为促进智慧仲裁发展开创新境界。。在北京多元调解发展促进会，考察组参观了调解室、Funhub联合办公空间等场所，学习了解了调解工作的先进做法和经验，并与促进会领导班子开展座谈，北京多元调解发展促进会会长翟晶敏对调促会的机构设置及工作情况进行了详实介绍，着重分享了调解、仲裁合作对接的成功经验。通过座谈，双方进一步达成合作意向，下一步将依托淄博齐仲民商事调解服务中心，积极拓宽仲裁服务领域，优化延伸仲裁服务链条，强化调解与仲裁服务的衔接，努力为当事人提供统一便利的纠纷解决服务。。在北京仲裁委员会，考察组一行受到了北京仲裁委员会秘书长林志炜等的热烈欢迎和热情接待。考察组参观了仲裁庭、调解室、立案大厅等办公区域，参观了信息化办案系统。。在随后的座谈会上，双方就仲裁员管理服务、信息化建设、专业化团队建设、改革创新发展等诸多方面的问题进行了深入的沟通交流。下一步，双方将继续保持密切沟通，加强有关工作经验的交流互鉴，共同为构建仲裁事业高质量发展新局面贡献力量。。淄博仲裁将以此次考察学习为契机，主动对标对表先进，结合淄博仲裁发展实际，不断提升仲裁服务能力建设，升级优化仲裁服务流程，打造调解仲裁“全链条”服务机制，助力构建优化法治化营商环境新格局。,政府领导到其他城市考察学习或访问,0.0,True
131,山东省,淄博市,市委常委会召开会议传达学习习近平总书记在香港考察和出席有关活动时的重要讲话精神,2022-07-09,http://www.zbdwgk.cn/art/2022/7/9/art_15589_2305494.html,淄博市党务公开网 党建要闻 市委常委会召开会议 传达学习习近平总书记在香港考察和出席有关活动时的重要讲话精神。淄博日报讯（特约记者姜东林 王泽 记者张晓军）7月8日，市委常委会召开会议，传达学习习近平总书记在考察香港科学园和出席庆祝香港回归祖国25周年大会暨香港特别行政区第六届政府就职典礼上的重要讲话精神，研究审议有关工作事项。市委书记江敦涛主持会议并讲话。。会议指出，习近平总书记的重要讲话，蕴含着对香港发展的深邃思考，体现着对香港同胞的深切关怀，为香港开创新局面、实现新飞跃指明了方向，注入了坚定信心和强大动力。各级要深入学习领会，切实增强制度自信，全面准确贯彻“一国两制”方针，以实际行动坚定拥护“两个确立”、坚决做到“两个维护”。要携手推进淄港高质量发展，不断拓展与香港在产业、科技、金融、教育、医药、文旅等领域的对接合作，打造更多淄港合作交流品牌，努力实现资源融合、优势互补、共赢发展。要以更大力度推进“五好”城市和青年发展友好型城市建设，积极举办人才创新合作及交流活动，鼓励支持香港青年、淄博籍香港高校学生等来淄返淄创业就业，为淄博城市发展提供有力人才支撑。。会议传达学习了省委书记李干杰在淄调研时的讲话要求，强调要认真抓好贯彻落实，守牢守好“一排底线”，坚决做到“疫情要防住、经济要稳住、发展要安全”。要抓严抓实防汛备汛，立足防大汛、抗大险、救大灾，盯紧盯牢黄河、水利工程、南部山区、城市、化工园区等防汛重点部位，慎之又慎、严实细致地抓好各项工作，确保实现安全度汛。要抓严抓实疫情防控，坚决克服麻痹思想、厌战情绪、松劲心态，分类抓好重点、非重点人群核酸检测，进一步擦亮做强“三个探头”，盯紧防住“四个源头”，不折不扣将国家和省明确规定的防控措施及要求落实到位，坚决巩固好来之不易的疫情防控成果。要抓严抓实安全生产，聚焦重点行业、重点区域，针对高温汛期天气特点，强化隐患排查、执法检查和源头管控，坚决筑牢保障高质量发展的安全基石。。会议审议通过了《关于高质量推进创新型城市建设的意见》，强调要切实增强建设创新型城市的责任感和紧迫感，持续深化科教创新赋能，奋力打造创新驱动的现代化新淄博。要坚持“四个面向”，加力打造高能级科创平台体系，突破一批“卡脖子”技术，扶优做强企业创新主体，培育集聚创新人才，加快构建全区域、全链条、全主体、全周期、全要素的科技创新体系。要压实工作责任，加强协同配合，凝聚形成建设创新型城市的强大合力。,考察团一行先后到日照市五莲县松柏镇美丽乡村南山片区窦家台子村、白鹭湾美术馆小镇，东港区日照海洋美学馆、中央活力区规划展示中心，招贤曲坊现代农业产业园进行了实地考察学习。。在考察学习中，大家一路走、一路看、一路想、一路议，详细了解所考察地乡村振兴、文旅融合、现代农业、城市规划等方面的成果和经验，充分感受到了他们高的标准、新的理念、实的作风，既开阔了眼界、拓展了思路，也看到了差距、激发了干劲。纷纷表示将用心学习借鉴、充分消化吸收，推动各项工作实现新突破。。回到沂源后，立即召开座谈会，结合考察学习情况，分别谈感受、谈打算，并对相关工作进行了安排部署。。会议要求，要全面践行乡村振兴工作体系，紧紧围绕党建共同体、民生综合体、果业振兴、乡村建设“四梁”和科技创新、数字驱动、金融赋能、龙头企业、支部领办合作社、“一网三联”、医养结合农村养老和人居环境乡村文明“八柱”，实施双体共建、双沿打造、双倍增收、双轮驱动、双为共富“五双行动”，推动乡村全面振兴。要立足我县文化和生态优势，努力做大做强旅游产业，助推经济社会高质量发展。要做好旅游配套设施建设，着力补齐短板弱项，不断提升旅游承载力，切实提高我县旅游行业品质和效益。要明确城市定位，积极融合全域优质旅游资源，做到串点成线、连线成片，打造全域旅游之城。要加快发展体育健身旅游，着力打造成充满活力的休闲运动之城。要持续推动产业联动发展，促进农文旅三产融合，切实带动群众致富，让群众更好分享发展红利。要坚持走高端发展路线，着力提升景区品质、丰富旅游业态，加快推进全域旅游发展提档升级。各级各部门要以高度的责任感、使命感，切实把工作做实做细做精，确保各项任务顺利推进。,其他,0.5384184990067116,True
131,山东省,淄博市,市委常委会召开会议传达学习习近平总书记在四川考察时的重要讲话精神研究疫情防控等工作,2022-06-17,http://www.zbdwgk.cn/art/2022/6/17/art_15589_2297959.html,淄博市党务公开网 党建要闻 市委常委会召开会议 传达学习习近平总书记 在四川考察时的重要讲话精神 研究疫情防控等工作。淄博日报讯（特约记者崔立帅 记者张晓军）6月16日，市委常委会召开会议，传达学习习近平总书记在四川考察时的重要讲话精神，研究我市贯彻落实意见。市委书记江敦涛主持会议并讲话。。会议指出，习近平总书记在四川考察期间，对抗震救灾、粮食安全、乡村振兴、文化自信、生态保护、就业创业、科技创新等作出重要指示，不仅对四川具有重大指导意义，也为我们做好相关领域工作提供了重要遵循。各级要提高政治站位，及时对标对表，完善工作举措，不折不扣贯彻落实，以实际行动坚定拥护“两个确立”、坚决做到“两个维护”。。会议强调，要抓紧抓牢粮食生产，深入实施“藏粮于地、藏粮于技”战略，严格落实“长牙齿”的耕地保护硬措施，以更大力度推进高标准农田建设，全力抓好抢收、抢种和抗旱应急准备，促进粮食丰产丰收，坚决守牢保障国家粮食安全底线。要抓紧抓牢科技创新，以创建国家创新型城市为引领，深化科教创新赋能，大力实施重大创新平台“提能造峰”和企业创新平台“扩量提质”工程，健全“应用型研究——工程化产品化研发——科技成果转化”创新公共服务链条，让科技创新成为新旧动能转换和高质量发展的“最大增量”。要抓紧抓牢水生态治理，持续提升河湖生态水系品质能效，对黄河沿线生态红线内的土地实施最严格的生态保护制度，努力打造山清水秀、洁净美丽的生态环境。要抓紧抓牢就业工作，加大就业优先政策实施力度，支持企业稳定和扩大岗位，千方百计帮助高校毕业生尤其是特殊困难家庭高校毕业生就业，让更多青年人才在淄博安心发展、成就事业。要抓紧抓牢齐文化传承保护和创新发展，聚焦研究阐释、典籍整理、遗址发掘保护申遗和文旅融合发展，超前谋划、抓好落实，加快实现创造性转化和创新性发展。要抓紧抓牢统筹发展和安全，全力抓好经济运行、重大项目建设和“双招双引”，坚决守好疫情防控、防汛抗洪、安全生产、信访稳定等“一排底线”，确保社会大局持续和谐稳定。要抓紧抓牢全面从严治党，深入挖掘我市红色革命文化、优秀传统文化中的廉洁元素，用好党性教育、政德教育、爱国主义教育基地和党史纪念馆等平台载体，大力推动家庭家教家风建设，营造风清气正的政治生态。。会议研究部署了近期疫情防控工作，强调要时刻绷紧疫情防控这根弦，毫不动摇坚持“外防输入、内防反弹”总策略和“动态清零”总方针，严格落实“三个到位”“三个不停”“三个保障”“三个慎重”工作要求，持续推进疫情防控能力建设，强化重点机构、重点场所防控措施，确保各项政策举措及时、精准、管用，坚决巩固住来之不易的疫情防控成果。,6月2日，聊城市城市管理局党组书记、局长李其超一行4人来我市考察学习城市精细化管理工作。市城市管理局党组书记、局长窦修刚，副县级干部孟繁华，市市政环卫服务中心主任牛汝宝陪同活动。 考察组一行先后来到积家村、中润大道带状公园、九顶山公园、双创公园城、柳泉路、尚美第三城、齐盛湖公园等地进行了实地考察，详细听取了我市全域公园城市建设、生活垃圾分类、视觉一体化改造、钟书阁海岱楼项目建设等工作情况，并就相关工作内容进行了深入细致交流。考察组对我市城市管理工作给予高度评价，认为我市在城市精细化管理过程中措施实、成效好，值得聊城认真学习借鉴。 市城市管理局表示，希望以此次考察交流为契机，建立联动工作机制，深入加强业务沟通，相互交流学习经验，探索城市管理工作新思路、新方法，推动城市管理水平再上新台阶。,其他,0.5173377127581273,True
131,山东省,淄博市,江敦涛马晓磊率我市党政考察团赴青岛市学习考察向东主动链接承接强化五个协同发展持续提升经济外向度不断增强城市开放度,2022-05-06,http://www.zbdwgk.cn/art/2022/5/6/art_15589_2285559.html,淄博市党务公开网 党建要闻 江敦涛马晓磊率我市党政考察团赴青岛市学习考察 向东主动链接承接 强化“五个协同发展” 持续提升经济外向度不断增强城市开放度。淄博日报讯（特约记者张耕语 记者张晓军）海岱不为远，共进新征程。4月28日至29日，市委书记江敦涛，市委副书记、市长马晓磊率我市党政考察团赴青岛市学习考察，学习对外开放、打造高端城市平台、集聚优质发展要素、加快产业转型升级等先进经验，拓展合作领域，强化协作质效，持续提升淄博经济外向度、城市开放度，为开创新时代社会主义现代化强市建设新局面提供充沛动能活力。省委常委、青岛市委书记陆治原，青岛市委副书记、市长赵豪志会见了我市党政考察团一行。青岛市委副书记、统战部部长邓云锋，市委常委、秘书长孙海生，青岛西海岸新区工委副书记、青岛自贸片区管委主任赵士玉；淄博市领导袁良、宋振波、闫桂新、魏玉蛟参加有关活动。。会见中，陆治原代表青岛市委、市政府对我市党政考察团表示欢迎。他说，淄博历史文化悠久，区位优势明显，产业基础扎实，干部作风务实，近年来，在新旧动能转换、产业结构调整等方面取得了显著成效，经济社会发展势头良好。当前，青岛深入贯彻落实习近平总书记对山东、对青岛的重要指示要求，坚决扛起“走在前”的使命担当，围绕“一二三四六十”的目标定位和思路举措，以更大力度抓实体经济和招商引资，抓城市更新和城市建设，抓干部队伍建设，不断激发干事创业的激情和斗志，加快建设新时代社会主义现代化国际大都市。希望双方在文化交流、外经外贸、产业协作等领域，发挥各自优势，推动资源共享，加强互动合作，为全省经济社会发展大局作出新的更大贡献。。江敦涛表示，青岛作为省内龙头城市，在产业升级、对外开放、科技创新、城市建设等各个领域，有很多好思路、好经验值得我们学习借鉴。当前，淄博正处于转型跨越发展的关键期、拐点期，经济外向度、城市开放度不够高既是突出短板，又是未来发展的最大潜力。为此，我们向东主动链接胶东经济圈，把青岛作为链接国际资源的重要平台和扩大对外开放的重要窗口，加快推动双方合作交流取得了诸多新进展、新成效。希望借势借力青岛“国际客厅”优势，嫁接青岛空港、海港、自贸区等平台资源，加快推动双方产业配套、科创转化、金融共享、物流周转、对外交流“五个协同发展”，打造携手共进新范式，开创合作共赢新局面。。29日上午，江敦涛一行拜访了青岛啤酒股份有限公司党委书记、董事长黄克兴，就深化拓展合作进行会谈。他指出，青啤在淄博早有业务布局，双方合作很有渊源。希望青啤在高锶富锶矿泉水资源保护利用、工旅农旅特色小镇开发运营等领域加大投入、加强合作，淄博一定顶格协调推进，做好要素保障文章，为项目快落地快见效提供有力支撑。 海尔集团是全球领先的美好生活和数字化转型解决方案服务商。江敦涛在集团董事局主席、首席执行官周云杰陪同下，先后到海尔卡奥斯生态体验中心和三翼鸟智能家居体验馆参观，详细了解各细分产业板块、功能平台、场景应用等情况。在随后召开的座谈会上，江敦涛说，淄博市有1700余家企业接入卡奥斯海智造工业互联网平台，今天通过参观，越发感到双方有着更为广阔的合作空间。希望在企业上云用数赋智、智慧城市建设、预制食品产业与食联网对接、医疗器械智造、能源智慧管理等领域开展深度合作，打造工赋城市新样板。受访企业负责人纷纷表示，与淄博的前期合作进展顺利、成果明显，淄博近几年的发展态势越来越好，营商环境越来越优，对淄博未来发展充满信心和期待。今后一定加大资源力量投入，与淄博共享机遇、共赢未来。,客人一行先后到齐国故城遗址博物馆、齐国故城考古遗址公园（排水道口）和齐文化博物馆参观考察，详细了解了我区在齐文化传承与创新方面的经验做法。。近年来，我区按照“研究、保护、开发、利用”方针，积极做好齐文化研究的同时，坚持产业带动，做好“文旅融合”文章，先后编制了《东部风景旅游区总体策划》《田齐王陵风景名胜区规划》《齐故城考古遗址公园规划》等项目规划，开发建设文化场馆和旅游景点，齐文化传承创新示范区建设迈出坚实步伐。,其他,0.6179030697332046,True
