code,province,city,topic,date,url,content,content.1,label,score,is_match
131,山东省,淄博市,安阳市客人来我区考察学习农村人居环境暨旱厕改造工作,2018-03-08,http://www.linzi.gov.cn/art/2018/3/8/art_5302_1360946.html,"3月8日上午，安阳市委副书记、市委统战部部长徐家平带队来我区考察学习农村人居环境暨旱厕改造工作。市委常委、宣传部部长毕荣青，区委副书记卢华栋陪同。。近年来，我区围绕“乡风民风美起来、人居环境美起来、文化生活美起来”的目标要求,结合全省村庄整治工程、移风易俗工程、“四德工程’、文化惠民工程”四大工程,按照“顶层设计、全覆盖推进、群众得实惠”三个原则,紧紧围绕群众最期盼解决的十项身边难事,探索将乡村文明行动与基层服务型党组织建设、为群众办实事、好事紧密结合起来,从2009年起,项目化、具体化、整建制实施了乡村文明“十个全覆盖”,为农村精神文明建设工作提供了新思路。。围绕让人居环境美起来,实施了农村“五化”、粮食生产“政府代作”、“旱厕改造”3个全覆盖。一是全覆盖、整建制实施了农村“五化”,政府投入1.3亿元,带动社会投入3亿元,实现小投入、大收益、得民心。在此基础上,深入推进城乡环卫一体化工作,农村生活垃圾全部实现“村集、镇运、区处理”。二是全覆盖实施了粮食生产“政府代作”,让农民从土地劳作中解放出来,秸秆全部还田。三是将目光从村内街道转向农民庭户小院,全覆盖实施了“旱厕改造”。",3月25日至28日，区委书记沙向东，区委副书记、区长刘伟率领我区党政考察团赴宿迁市宿城区、无锡市惠山区、嘉兴市海宁市考察学习，进一步解放思想、开阔眼界，对标先进、提升标杆，自我加压、奋力转型，努力开创幸福周村建设的新局面、新格局、新境界。。此次考察学习活动，涉及城市建设管理、文明城市创建、老旧小区改造、园区建设、创新发展、产业集群、新旧动能转换、传统产业改造提升、服务业发展等各个方面的经验做法。每到一处，考察团都受到热情接待，当地党政负责人陪同考察并介绍了相关情况。通过一路边走边看、边思边议，考察团一行深受触动、深受教育、深受启发、深受鼓舞，三地加快科学发展的新思路新探索、好经验好做法，给考察团一行留下了深刻印象。。在宿城区考察学习期间，考察团一行先后实地考察参观了楚街、仁恒里特色街区、亚方花园、项里城管大队、项王路、第三代公厕、中豪国际星城、邻里驿站、印象黄河景区。近年来，宿城区紧紧围绕推动产业集聚、提升城市品质、改善民计民生、深化改革发展等方面持续用力，推动全区经济社会发展不断迈上新台阶，先后荣获全国文明城市、中国优秀旅游城市、国家园林城市、全国人口计生优质服务先进区、江苏省社会治安安全（县）区、江苏省和谐社区示范区、江苏省双拥模范城等30余项称号。在惠山区考察学习期间，考察团一行先后实地考察参观了惠山区工业转型集聚区、无锡戴卡轮毂制造有限公司、无锡石墨烯产业发展示范区、无锡透平叶片有限公司、华中科技大学无锡研究院。近年来，惠山区坚持率先发展、科学发展、和谐发展，坚定不移地推进“两个率先”，在经济社会发展各个领域取得了显著成绩，连续多年名列“中国中小城市综合实力（科学发展）百强”前茅。在海宁市考察学习期间，考察团一行先后实地考察参观了鹃湖公园景观绿化工程、上海漕河泾新兴技术开发区海宁分区、天通控股股份有限公司、海宁皮革时尚小镇。近年来，海宁市围绕推动产业兴盛、强化改革创新、提升开放活力、增进文明品质等方面做文章、下功夫，现已被列入中国制造2025浙江行动试点示范城市、浙江省信息经济发展示范区、浙江省军民融合产业基地，先后荣获全国文明城市、国家卫生城市、国家园林城市、中国优秀旅游城市、国家知识产权强县工程示范市等称号。。考察学习过程中，大家一致认为，此次考察学习虽然只有四天时间，但主题明确、内容丰富、可学性强，对于谋划开展今后全区工作必将起到积极的推动作用。大家切身感受到了先进地区和先进单位时不我待、只争朝夕的创业热情，既开阔了视野、增长了见识，也更新了观念、鼓舞了斗志，真正看到了差距，解放了思想，进一步增强了奋起直追的责任感、紧迫感和使命感。大家一致表示，将把此次考察学习的所见所思所感所悟转化为干事动力，对标先进、借鉴先进、学习先进、追赶先进，以敢干的魄力、实干的行动、苦干的决心、大干的激情、巧干的智慧，为幸福周村建设作出新的更大贡献。。区大班子有关领导，各镇、街道、周村经济开发区主要负责人，区直有关部门主要负责人以及部分重点企业主要负责人参加了考察活动。,政府领导到其他城市考察学习或访问,0.7047737774444052,True
131,山东省,淄博市,我委赴德州考察学习千亿斤粮食项目管理经验,2017-11-15,http://fgw.zibo.gov.cn/art/2017/11/15/art_954_2116816.html,为扎实做好我市2018年千亿斤粮食项目，探索项目实施主体创新， 11月14日，委工会主席袁长通同志带领农经科、桓台县发改局相关同志到德州市进行考察学习。。德州市为传统的农业大市，近年来在做大做强优势农业、发展精致农业等方面取得了显著成绩，特别是近年来由发改部门牵头抓总，围绕千亿斤粮食项目管理、实施等方面探索出了一套成功的经验做法，在全省被广泛推广。。从2010年至2016年，德州市共实施了138万亩千亿斤粮食产能规划田间工程，争取中央预算内资金13亿元；2017年两次申报24万亩，争取中央预算内资金2.9亿元，已全部完成项目设计、招投标、签订合同等前期准备工作，目前正利用冬季农闲期间进场施工；2018年拟实施18万亩，计划争取资金2.2亿元。。为做到精准学习，德州市特意将考察点安排在乐陵市，该市2016年实施千亿斤粮食项目田间工程3万亩，争取资金3600万元，目前项目建设内容已高标准完成。与我市桓台县明年拟实施项目内容高度吻合，可学可借鉴。。，仔细询问每一个环节，车上与当地发改部门争相交流，就如何牵头组织项目招投标、资金管理办法及拨付、工程建设监管、档案整理、项目验收等环节进行了细致对接，通过紧张的半天考察学习，大家一致。考察期间，德州市发改委副主任马传治、乐陵市常务副市长吴峰等领导及相关负责同志陪同。,11月7日上午，河南省沈丘县副县长张艳秋带队来我区考察学习引资建设医疗中心的经验做法，副区长王功陪同。。客人一行实地参观了区人民医院区域医疗远程会诊中心、心电远程会诊中心、检验中心、区域影像会诊中心，了解了我区相关工作情况。。今年，我区与华润健康集团达成合作协议，确定采取PPP的方式共同建设临淄区医疗中心项目，项目总投资12亿元，计划3年内建成投用，5年内达到三级甲等医院水平。同时，引进华润健康集团专业化运营管理模式、顶尖医疗技术资源和多个医疗特色重点学科，建成以临淄为核心、服务周边的区域医疗中心，打造全省“区县级医改”和“区县级区域分级诊疗体系”双标杆，为人民群众提供更加便利可及、优质高效、廉价安全的医疗卫生服务。,政府领导到其他城市考察学习或访问,0.0,True
131,山东省,淄博市,栖霞龙口考察团到临淄区考察学习医联体建设工作,2017-11-02,http://ws.zibo.gov.cn/art/2017/11/2/art_1334_708947.html,淄博市卫生健康委员会 区县卫生健康局 栖霞龙口考察团到临淄区考察学习医联体建设工作。11月1日下午，栖霞市委书记陈兆宽、龙口市副市长杨文平带领栖霞龙口考察团，在华润健康集团人员陪同下，前来临淄区考察学习医联体建设工作。区委书记宋振波、区委常委、办公室主任罗建、区卫计局党委书记、局长刘先伟、副局长周丽，区人民医院院长路世勇陪同。。考察团一行先后到朱台中心卫生院、区人民医院区域医疗远程会诊中心、心电图远程会诊中心、检验中心、区域影像会诊中心进行考察学习，了解临淄区医联体的建设发展情况，并给予了充分肯定。在随后的座谈会上，宋振波书记主持并发表了重要讲话，刘先伟局长介绍了临淄区公立医院改革、医疗服务等工作开展情况，双方共同观看了临淄区医联体建设宣传片，就医联体建设工作作了深入的交流。。临淄区医联体建设从2012年开始创新探索，以“基层首诊、双向转诊、急慢分诊、上下联动”为目标，利用信息化技术与全区乡镇卫生院、村卫生室及社区卫生站建立起紧密联系，使其检验、检查、诊断和治疗水平实现与区医院同质化，拓宽了三级医院的辐射半径及服务效率。下一步，临淄区将进一步完善医联体机制，与省、市医疗资源形成共享，让更加优质、便利的医疗服务惠及全区百姓。,11月3日上午，河南省濮阳市范县县委办公室副主任、改革办副主任段其敏率考察团一行4人，到我县考察学习全面深化改革工作。。考察团一行先后现场观摩了桓台县海思堡智能工厂改革、行政服务中心“云桌面”改革、智慧桓台建设、改革在线管理平台，对桓台县以信息化推进全面深化改革的做法给予了高度评价，并表示要加强两地交流，将学习到的这些新经验新做法，应用到改革工作中。,政府领导到其他城市考察学习或访问,0.0,True
131,山东省,淄博市,栖霞龙口客人来我区考察学习医疗卫生服务建设等工作,2017-11-02,http://www.linzi.gov.cn/art/2017/11/2/art_5302_1052246.html,11月1日下午，栖霞市委书记陈兆宽、龙口市副市长杨文平带领栖霞龙口考察团，在华润健康集团有关人员陪同下，来我区考察学习医疗卫生服务建设以及华润健康集团与区人民医院合作相关工作。区委书记宋振波，区委常委、办公室主任罗建陪同。。考察团先后到区人民医院、朱台中心卫生院进行考察学习，听取了我区在整合区域医疗资源、深化诊疗体系建设方面的工作介绍。近年来，我区高度重视“健康临淄”建设，在华润健康集团等各级各界大力支持下，区域医疗卫生事业实现长足发展。特别是，着眼从根本上破解城乡卫生资源配置二元化问题，坚持资源下沉、重心下移，创新推行区域医疗联合体模式，探索了分级诊疗新路径。去年作为唯一的区县级改革案例，被省委改革办推荐到了中央改革办。我区与华润健康集团于今年达成合作协议，确定采取PPP的方式共同建设临淄区医疗中心项目，项目总投资12亿元，计划3年内建成投用，5年内达到三级甲等医院水平。同时，引进华润健康集团专业化运营管理模式、顶尖医疗技术资源和多个医疗特色重点学科，建成以临淄为核心、服务周边的区域医疗中心，打造全省“区县级医改”和“区县级区域分级诊疗体系”双标杆，为人民群众提供更加便利可及、优质高效、廉价安全的医疗卫生服务。。陈兆宽、杨文平对我区医疗卫生服务建设工作给予高度评价，表示，临淄区在医疗卫生服务建设具有良好的硬件投资设施和完善的服务体系，希望进一步积极探索，与临淄区有更深入细致的合作。。宋振波表示，栖霞市和龙口市都处在全省改革发展的最前沿，龙口市是我区的对标学习对象，两地在绿色发展、转升升级、文旅融合、新旧动能转换等方面有很多值得我们学习借鉴。希望双方继续加强合作交流，在新时代、新征程上，展现新作为、推动新发展。,10月30日，县委书记贾刚，县委副书记、县长边江风率党政考察团赴沂源县、博山区考察学习，学习两地项目建设、园区发展、产业转型等经验做法，谋划新一轮加快园区发展的思路和措施。。考察团每到一处，都受到当地党委、政府和企业的高度重视，对考察活动做出了精心安排。考察期间，大家认真听取了两地经济社会发展情况介绍，先后实地考察了沂源县的宏鼎资产经营有限公司标准厂房建设项目、创业公寓项目、瑞阳制药有限公司医用高端营养液技术开发项目和小微创业园项目，博山区的山东金祥琉璃文化艺术有限公司、乐疃村乡村旅游项目、汽车部件产业园汇强专用汽车项目、机电泵业产业园基础设施建设项目、新型机电产业园项目、机电泵业产业园宇海电子年产650万件压电陶瓷系列产品建设项目。。通过考察学习，大家真切感受到了两地在园区建设方面中的新举措、新成效、新气象、新变化，倍感振奋、深受鼓舞。沂源县高度重视园区建设，坚持高起点规划、高标准建设，不断创新体制机制，破解要素制约，加快完善基础设施，吸引了一大批科技含量高、带动能力强的大项目、好项目落户园区，特别是标准厂房、创业创新大厦和小微创业园建设，为企业发展提供了良好平台。博山区积极进行产业布局调整，大力发展园区经济，加快文旅融合步伐，充分发挥比较优势，积极开展技术创新和成果转化，延伸产业链条，切实把技术优势转化为产品优势、市场优势、规模和质量效益优势，实现了老工业区转型升级、跨越发展。。大家纷纷表示，要在学习借鉴两地好经验好做法的基础上，立足自身实际，紧紧围绕县委、县政府的工作部署，创新园区管理机制，加大园区建设力度，增强项目发展活力，真正把园区打造成为新旧动能转换，推进转型升级的主阵地、主平台。要以产业链对接为核心，突出三大工业园区主引擎地位，加快产业集约集聚发展，加快“一核两翼”规划建设，打造工业强县升级版。要把学习宣传贯彻十九大精神和全力推动当前工作紧密结合起来，围绕在全市走在前列、永争一流，进一步改进完善工作思路，对标先进提升标准，强化各项工作措施，把学习贯彻十九大精神激发出来的内发动力，转变为加快项目建设、完成全年任务、谋划明年工作的实际行动，扎扎实实地推动科学发展。要进一步谋划好明年的工作，细化具化重点项目、生态环保、民生实事等各项清单，力争明年工作有良好开局，为打造发展质量更高创新活力更强的宜业宜居新桓台作出新的更大贡献。,其他,0.5388820331966337,True
131,山东省,淄博市,安徽省政协客人来我区考察学习,2017-05-12,http://www.linzi.gov.cn/art/2017/5/12/art_5302_1051783.html,5月12日上午，安徽省政协副主席、党组副书记张学平带队来我区考察学习。市委书记周连华，市政协主席丛锡钢，区委副书记、区长白平和、区政协主席董红光陪同。。在齐文化博物馆，张学平一行了解了齐文化保护开发情况，并就更好地扩大两地文化交流合作进行了探讨。。张学平一行表示，齐文化是中华传统文化的主要源头之一，重视和加强齐文化资源研究和利用具有十分重要的现实意义。希望通过此次考察，进一步加深两地文化交流，在产业开发、学术研究等方面开实质性的合作，更好地推动两地经济文化融合发展。。近年来，我区充分发挥独具特色的文化资源优势，积极探索加快文化事业、文化产业发展的新路子，齐文化的影响力和传播力进一步提高。,淄博市司法局 区县动态 高青县司法行政系统来博山区学习考察公共法律服务体系建设情况。人来博山区学习考察司法所规范化建设、镇（街道）公共法律服务工作站建设及一村（社区）一法律顾问工作的先进经验。博山。考察组一行先后来到区公共法律服务中心、山头街道公共法律服务工作站、石马镇芦家台村法治文化广场和司法行政工作室。参观考察了博山区各级公共法律服务实体平台的建设情况以及网络平台的运行情况，翻阅查看了各项工作的档案卷宗。考察组对博山区司法行政系统场所、人员、管理和服务的规范化建设给予了高度评价，对各项创新性的工作模式表示出了极大兴趣。同时，考察组对博山区“一村（社区）一法律顾问”工作、“法律服务赶大集”等亮点工作进行了详细了解，认为博山区各项司法行政工作创新多、经验好，值得学习。博山之行，让他们对司法行政工作更好的开展有了更深刻认识，得到了更多启发。。高青县司法局党组书记、局长张年军表示，博山区的公共法律服务体系建设工作和一村（社区）一法律顾问工作开展早，创新意识强，品牌亮点多，为高青县公共法律服务体系建设和一村（社区）一法律顾问工作的开展提供了宝贵经验，希望两地能加强学习交流，共同推进各项司法行政工作的进步和完善。,其他,0.565758669224829,True
131,山东省,淄博市,安徽省界首市党政考察团来我区考察学习,2017-04-21,http://www.linzi.gov.cn/art/2017/4/21/art_5302_1051820.html,4月21日上午，安徽省界首市市委书记徐会东带领党政考察团来我区考察学习美丽乡村建设、生态环境整治、文旅发展等工作。区委书记宋振波，区人大常委会主任孙海青，区政协主席董红光，区委常委、办公室主任罗建陪同有关活动。。客人一行先后到敬仲镇农村五化联片建设项目、思远农业、天齐渊国家森林公园项目、齐都文化城进行考察学习，听取有关工作情况汇报，对我区各项工作给予高度评价。。美丽乡村建设方面，我区创新粮食生产社会化服务新模式，开展蔬菜标准园三级联创、农村集体资产股份制改革等工作，不断夯实美丽乡村发展基础。以农村环境综合整治为主线，着力提升城乡环卫一体化基础设施建设，巩固提升农村“五化”建设水平，推广农村视频监控全覆盖工程，并全面完成农村旱厕改造工作，不断提升美丽乡村宜居环境。同时，我区深入实施“乡村文明行动”创建，扎实开展扶贫开发工作和文化惠民工程，大力发展休闲农业和乡村旅游，推进城乡基本公共服务一体化建设，打造美丽乡村乐居生活。。生态环境整治方面，我区将投资22亿元，利用5年时间构建客水补源、中水利用、三河互通的生态水系，对淄河、乌河、运粮河进行水生态综合提升，通过防汛路拓宽改造、河床生态修复等工程，彻底改善河道生态环境和沿河居民的生活环境。。文旅发展方面，我区全面启动齐文化遗存最集中、最丰富的56平方公里的核心区规划建设，打造文旅产业“一带两翼四极十点”的发展格局。,4月21日下午，周村区委书记沙向东带队来我区考察学习。区委书记宋振波，区人大常委会主任孙海青，区政协主席董红光，区委常委、办公室主任罗建陪同。。客人一行先后到全区重点道路拆迁建设现场、天齐渊国家森林公园项目、南部新城建设项目进行实地考察学习，听取了有关工作情况介绍，对我区工作给予高度评价。。重点道路建设拆迁方面，全区规划建设道路重点项目45项，今年新建、在建重点项目27项，目前，11个项目已经开工，6个进入招标，其余10个正在办理手续。其余18个前期项目，将加快手续办理进度，力争年底前全面完成清表、拆迁任务。拆迁中，各有关部门、相关镇街道主动作为，担当实干，全力做好拆迁各项工作，为全区重点道路建设创造了良好的环境。。天齐渊国家森林公园项目占地2万亩，主要建设形象展示、森林运动、文化田园观光等7大功能分区，其中，项目一期重点打造“两山一崖一田一乡村”，即红螺山公园、蛟山公园、天齐渊崖壁、1000亩“一亩方田”农业区以及刘家终村特色乡村旅游，辅以湿地公园、四季花谷景观大道等景点。二期对齐王陵风景名胜区进行高标准生态环境综合提升。。南部新城是我区实施“南跨”战略的重要举措。目前，已开展的项目有合顺家园、安乐店村棚户区改造、绿茵玫瑰园限价房等；下一步将启动城南棚户区（含辛店街村、车站居委会和辛城社区）改造项目和金岭镇村庄搬迁安置项目。,其他,0.5839390506606653,True
131,山东省,淄博市,寿光市考察团来我县考察学习,2017-03-30,http://www.huantai.gov.cn/art/2017/3/30/art_4853_878764.html,3月29日，寿光市委副书记、市长赵绪春一行17人，来我县考察学习河流流域治理及马踏湖生态湿地建设工作。县委副书记、县长边江风，副县长郭凯陪同。。赵绪春一行先后到猪龙河入湖口人工湿地三期、东猪龙河综合治理工程、猪龙河入湖口人工湿地一期、马踏湖国家湿地公园进行实地考察，并召开座谈会，听取相关工作情况介绍，对我县河流流域治理及马踏湖生态湿地建设工作取得的成绩给予高度评价。。据悉，近年来，我县高度重视生态文明建设，按照打造“三横五纵两湖六湿地”生态水系总体布局，坚持“防治结合、生态优先”，推进“治、用、保”流域污染综合治理策略，深入实施生态水系修复提升工程，全面恢复区域内河流自然生态和水体功能，建立湖泊生态环境保护长效机制，实现了湿地保护和修复的规范化、制度化和科学化管理，生态环境持续改善，成为县域经济转型升级的新高地。（张运波）,3月22日，黑河市城管执法局党委书记、局长冯云一行来我市考察学习城市管理工作。市城市管理和行政执法局党组书记、局长刘丙伦，局党组成员、副局长邹宗森、邢书军等陪同考察活动。 在座谈会上，刘丙伦局长对冯云一行表示了热烈欢迎，并向对方介绍了我市的基本情况、城市管理体制改革工作推进情况、城市精细化管理先进经验、露天烧烤治理的管理模式及具体措施、美食街的设置及环保无烟烧烤车的推广和应用情况。双方围绕当前城市管理重点、难点、热点问题进行了深入交流和探讨。 随后，考察组一行先后到健康街、老帽烧烤城等处实地考察我市城市管理工作治理情况，并听取了相关负责人的情况介绍，交流了城市管理工作的先进经验做法,政府领导到其他城市考察学习或访问,0.0,True
131,山东省,淄博市,威海市乳山市考察团来我区考察学习棚户区改造工作,2017-03-12,http://www.linzi.gov.cn/art/2017/3/12/art_5302_1052035.html,3月11日上午，威海市乳山市副市长许鹏带领考察团来我区考察学习棚户区改造工作，副区长王立明陪同。。考察团一行先后到辛店街道九村居棚改项目、稷下街道徐姚片区棚改项目现场进行了学习考察。近年来，我区高度重视棚户区改造工作，将其作为扩内需、保增长、惠民生的重要抓手，将其纳入经济社会发展总体规划，摆上重要议事日程。为确保棚户区项目的稳步推进，专门成立了棚户区改造工作领导小组，统筹协调、指挥调度棚户区改造工作。住建、房管、执法，市政等多个部门密切合作，为各项工程做好服务保障。,淄博市住房和城乡建设局 工作动态 聊城市房屋征收管理办公室来我市考察学习房屋征收工作。座谈会上，市房屋征收管理办公室主任冯明介绍了我市房屋征收与补偿机构设立、房屋征收与补偿配套政策制定和征收工作实务等情况。我市严格按照房屋征收的相关政策，依法征收，和谐征收，在征收决定、评估、补偿阶段工作程序中，突出抓好房屋征收项目启动、政策完善、规范流程、矛盾调处等关键环节，一步一动，有条不紊的抓好各项工作。重点介绍了华润城市综合体房屋征收项目经验做法。双方就两市房屋征收与补偿工作进行了交流，特别就对方关心的多层住宅征收工作问题，谈了我市的一些经验和做法，并对实际操作中的一些热点、难点问题进行了深入探讨，起到了互相学习、共同促进的双赢效果，有力地促进了房屋征收工作。,其他,0.5725624472914509,True
