code,province,city,topic,date,url,content,content.1,label,score,is_match
131,山东省,淄博市,威海市考察团来我区考察学习,2024-06-14,http://www.linzi.gov.cn/art/2024/6/14/art_5302_2822091.html,6月14日上午，威海市委副书记刘树军带队来我区考察学习。市政协主席张延廷，副市长胡晓鸿，区领导蔡华刚、张召才、康义文、王俊涛陪同有关活动。。在淄博乡村好物市集，考察团了解了我区壮大村集体经济、蔬菜产业振兴、人居环境整治等情况。我区坚持“三级书记抓增收”，将集体经济增收“九策”细化为48种增收路径，助力乡村振兴。。在天辰齐翔新材料有限公司，考察团了解了企业发展和项目建设情况，观摩了公司产品在军事国防、工业电子、生产生活等方面应用生态展示。。在山东齐都药业有限公司，考察团了解了齐都药业健康产业园情况，齐都药业健康产业园总投资28.5亿元，全面投产达效后，年可新增工业总产值65亿元，新增利税13亿元，安置就业1000多人。。考察团一行还观摩了凤凰镇“两河两岸 魅力梧台”乡村振兴示范片区。近年来，我区围绕路域提升、污水治理、公园文旅、电力升级等先后实施了10个项目，实现了农村人居环境整治、村庄清洁、生态旅游、美丽乡村示范点创建齐头并进。,6月14日上午，威海市委副书记刘树军带队来我区考察学习。市政协主席张延廷，副市长胡晓鸿，区领导蔡华刚、张召才、康义文、王俊涛陪同有关活动。。在淄博乡村好物市集，考察团了解了我区壮大村集体经济、蔬菜产业振兴、人居环境整治等情况。我区坚持“三级书记抓增收”，将集体经济增收“九策”细化为48种增收路径，助力乡村振兴。。在天辰齐翔新材料有限公司，考察团了解了企业发展和项目建设情况，观摩了公司产品在军事国防、工业电子、生产生活等方面应用生态展示。。在山东齐都药业有限公司，考察团了解了齐都药业健康产业园情况，齐都药业健康产业园总投资28.5亿元，全面投产达效后，年可新增工业总产值65亿元，新增利税13亿元，安置就业1000多人。。考察团一行还观摩了凤凰镇“两河两岸 魅力梧台”乡村振兴示范片区。近年来，我区围绕路域提升、污水治理、公园文旅、电力升级等先后实施了10个项目，实现了农村人居环境整治、村庄清洁、生态旅游、美丽乡村示范点创建齐头并进。,政府领导到其他城市考察学习或访问,0.0,True
131,山东省,淄博市,青州市客人来我区考察学习,2024-06-06,http://www.linzi.gov.cn/art/2024/6/6/art_5302_2820224.html,6月5日下午，青州市委副书记、市长田永全带队来我区考察学习经济社会发展工作。区委副书记、区长蔡华刚，区领导贾继元、王俊涛、于海南陪同有关活动。。在遨博（山东）智能机器人有限公司，客人一行参观了企业展厅，了解智能制造和应用服务体系建设情况，遨博协作机器人市场占有率连续三年实现国内第一，构建以协作机器人研发设计、检验检测、智能制造为支撑的协作机器人智能制造产业化基地。在淄博鑫泰石化有限公司，客人走进中控室，了解企业重点项目建设等情况，鑫泰石化六期烷烃综合利用项目、七期绿色低碳烯烃一体化项目建成后，将成为山东省内最大的碳三深加工生产基地之一。在山东巧媳妇食品集团有限公司，客人参观了齐民要术酱文化体验馆和车间全自动生产线，巧媳妇旗下酱油、醋、酱、蚝油、料酒类产品年产量均位居全国前列。。近年来，我区坚持优扩并举，梳理确定“456”产业链群，精准延链、补链、强链，现代化产业体系全面起势，是全省工业、农业“双十强”区县，多次入选全国工业百强区、综合实力百强区。,6月5日下午，青州市委副书记、市长田永全带队来我区考察学习经济社会发展工作。区委副书记、区长蔡华刚，区领导贾继元、王俊涛、于海南陪同有关活动。。在遨博（山东）智能机器人有限公司，客人一行参观了企业展厅，了解智能制造和应用服务体系建设情况，遨博协作机器人市场占有率连续三年实现国内第一，构建以协作机器人研发设计、检验检测、智能制造为支撑的协作机器人智能制造产业化基地。在淄博鑫泰石化有限公司，客人走进中控室，了解企业重点项目建设等情况，鑫泰石化六期烷烃综合利用项目、七期绿色低碳烯烃一体化项目建成后，将成为山东省内最大的碳三深加工生产基地之一。在山东巧媳妇食品集团有限公司，客人参观了齐民要术酱文化体验馆和车间全自动生产线，巧媳妇旗下酱油、醋、酱、蚝油、料酒类产品年产量均位居全国前列。。近年来，我区坚持优扩并举，梳理确定“456”产业链群，精准延链、补链、强链，现代化产业体系全面起势，是全省工业、农业“双十强”区县，多次入选全国工业百强区、综合实力百强区。,政府领导到其他城市考察学习或访问,0.0,True
131,山东省,淄博市,县委书记边江风带队到浙江广东考察学习,2024-06-25,http://www.yiyuan.gov.cn/art/2024/6/25/art_5601_2826307.html,6月21日至24日，县委书记边江风率领党政代表团到浙江、广东考察学习，深入贯彻落实习近平总书记视察山东重要指示要求，认真学习借鉴先进地区的好经验、好做法，为沂源绿色低碳高质量发展蓄势赋能。绍兴市嵊州市市委书记裘建勇、广州市越秀区区委书记郭昊羽出席有关活动。县委副书记、宣传部部长郑舰，县委常委、副县长崔建涛，副县长于庆及相关镇街、县直有关部门单位主要负责同志参加。。代表团一行围绕科技创新、城市建设、招商引资、文旅发展、乡村振兴等方面，先后到绍兴市、广州市学习考察。。在绍兴，代表团一行先后到浙东运河博物馆、枫桥经验陈列馆、长乐镇水竹村、甘霖镇社会治理中心、甘霖镇施家岙村、越剧博物馆、越剧小镇、绍兴弗迪电池有限公司、麦地郎集团有限公司、陌桑高科股份有限公司、浙江帅丰电器股份有限公司参观考察，并进行座谈交流。边江风说，绍兴特别是嵊州在历史文化资源发掘、产业项目招引、特色品牌打造、基层社会治理、文旅融合发展等方面成果丰硕、成效显著，各相关责任部门单位要认真学习总结，充分消化吸收，理清思路、找准差距、明确方向，切实把考察学习成果转化为契合沂源实际的新思路、新举措。同时，希望两地以此次考察学习为契机，建立常态化联系机制，加强沟通交流，深化务实合作，携手推动两地绿色低碳高质量发展。会上，双方还就文旅宣传、媒体融合、城市精细化管理、特色产业培育、特色品牌打造、乡村振兴发展等方面展开深入交流。。考察团成员纷纷表示，此次考察学习拓宽了眼界、打开了思维、认清了差距，机会难得、经验可贵，将第一时间消化吸收此次考察学习成果，化压力为动力，变挑战为机遇，把学习成果转化为善谋发展、大抓发展的实际行动。,6月21日至24日，县委书记边江风率领党政代表团到浙江、广东考察学习，深入贯彻落实习近平总书记视察山东重要指示要求，认真学习借鉴先进地区的好经验、好做法，为沂源绿色低碳高质量发展蓄势赋能。绍兴市嵊州市市委书记裘建勇、广州市越秀区区委书记郭昊羽出席有关活动。县委副书记、宣传部部长郑舰，县委常委、副县长崔建涛，副县长于庆及相关镇街、县直有关部门单位主要负责同志参加。。代表团一行围绕科技创新、城市建设、招商引资、文旅发展、乡村振兴等方面，先后到绍兴市、广州市学习考察。。在绍兴，代表团一行先后到浙东运河博物馆、枫桥经验陈列馆、长乐镇水竹村、甘霖镇社会治理中心、甘霖镇施家岙村、越剧博物馆、越剧小镇、绍兴弗迪电池有限公司、麦地郎集团有限公司、陌桑高科股份有限公司、浙江帅丰电器股份有限公司参观考察，并进行座谈交流。边江风说，绍兴特别是嵊州在历史文化资源发掘、产业项目招引、特色品牌打造、基层社会治理、文旅融合发展等方面成果丰硕、成效显著，各相关责任部门单位要认真学习总结，充分消化吸收，理清思路、找准差距、明确方向，切实把考察学习成果转化为契合沂源实际的新思路、新举措。同时，希望两地以此次考察学习为契机，建立常态化联系机制，加强沟通交流，深化务实合作，携手推动两地绿色低碳高质量发展。会上，双方还就文旅宣传、媒体融合、城市精细化管理、特色产业培育、特色品牌打造、乡村振兴发展等方面展开深入交流。。考察团成员纷纷表示，此次考察学习拓宽了眼界、打开了思维、认清了差距，机会难得、经验可贵，将第一时间消化吸收此次考察学习成果，化压力为动力，变挑战为机遇，把学习成果转化为善谋发展、大抓发展的实际行动。,政府领导到其他城市考察学习或访问,0.635184652973936,True
131,山东省,淄博市,河南省安阳市到临淄区考察学习国家卫生城市长效管理工作,2023-10-12,http://ws.zibo.gov.cn/art/2023/10/12/art_1334_2751620.html,淄博市卫生健康委员会 区县卫生健康局 河南省安阳市到临淄区考察学习国家卫生城市长效管理工作。10月10日上午，河南省安阳市卫生健康委卫生健康服务中心主任常波一行13人，前来临淄区考察学习国家卫生城市长效管理工作，淄博市卫生健康委党组成员、市疾控中心党委书记李全营，临淄区人民政府副区长、区卫健局党组书记崔赟，区卫健局党组副书记、局长刘萍，临淄区卫健局党组成员、区卫生健康事业发展中心主任乔晓静陪同参观。考察组先后参观了金茵社区、太公市场、遄台中学，观摩学习临淄区在国家卫生城市创建中长效机制建设情况和管理经验。。参观结束后，召开国家卫生城市长效管理工作座谈会，李全营书记主持会议，淄博市爱卫办副主任蒋磊介绍了淄博市国家卫生城市长效管理工作情况，总结了国家卫生城市长效管理的做法经验。。临淄区综合行政执法局、区市场监管局、区商务局、区卫健综合监督执法大队等单位分别就市容环境卫生、农贸市场管理、健康教育和健康促进等方面进行了交流，互相学习在卫生城市长效管理等方面的好经验、好做法，进一步巩固创卫工作成果，推动国家卫生城市长效管理工作走深走实。,10月24日、27日，市委办公室、市委老干部局组织市级老干部赴市政务服务中心、张店区、周村区考察学习，让老干部们切身感受我市经济社会高质量发展的新变化新成就。。，老干部们零距离感受政务服务标准化、规范化、数字化、便民化带来的新变化，深入了解“一窗受理”、“一业一证”、“无证明城市”建设成果应用等创新举措。。老干部们详细了解中医传统诊疗方法，查看了中医健康综合体特色服务项目，学习了部分常用中药材鉴别方法。在张店区儿童公园，实地察看公园景观布局，真切感受到我市高品质民生建设的巨大成效。在淄博数字经济产业园，通过园区负责人对园区运营、培育、招商等情况介绍，老干部们对我市数字经济发展现状和前景未来有了更全面的了解。。山东纽澜地数字农业科技有限公司阿里巴巴数字农业中心，老干部们深刻感受到我市在以数字赋能农业产业全链条方面的新技术、新成果。在山东恒利纺织科技有限公司，参观了企业智能化监控平台和产品展厅，深入了解企业最新面料生产技术。在西铁城新景高端装备智能制造产业园，参观了超高精度排刀数控车床、自动送料机等达到国际先进水平的工业产品。在周村古商城，老干部们走街串巷，谈笑风生，边走边看，用脚步丈量百年商埠历史的厚重。。老干部们一致认为，市委、市政府锚定“走在前、开新局”，围绕高质量发展首要任务，创造性做好产业转型升级文章，全方位服务和融入新发展格局，加力提升城市品质，推动淄博城市美誉度、知名度、影响力大幅提升，新时代社会主义现代化强市建设不断取得新进展。大家纷纷表示，将一如既往地关心支持市委、市政府各项工作，充分发挥好政治优势、经验优势和威望优势，积极为破解改革发展稳定难题建言献策，为助力实现“3510”发展目标、“强富美优”城市愿景贡献力量。。大家纷纷表示，将一如既往地关心支持市委、市政府各项工作，充分发挥好政治优势、经验优势和威望优势，积极为破解改革发展稳定难题建言献策，为助力实现“3510”发展目标、“强富美优”城市愿景贡献力量。,政府领导到其他城市考察学习或访问,0.6233166988378401,True
131,山东省,淄博市,安丘市党政考察团来桓考察学习,2023-05-17,http://www.huantai.gov.cn/art/2023/5/17/art_4853_2704111.html,5月16日，潍坊安丘市委书记贾勤清带队来桓，就桓台县经济社会发展相关工作进行考察学习。县领导范伟、张敬帅、胡智慧陪同相关活动。。贾勤清一行先后到淄博华汇纸业股份有限公司、山东东岳未来氢能材料股份有限公司、农发凯盛智慧农业项目及果里镇徐斜村进行考察，详细了解我县重点项目建设、企业创新驱动发展、数字赋能农业农村发展以及党建引领乡村治理等方面的做法，并听取相关情况介绍。。县委副书记、县长范伟对安丘市考察团的到来表示欢迎，他指出，安丘与桓台产业优势互补、合作空间广阔，此次考察为两地加强交流提供了良好契机，希望两地不断增进友谊，深化交流合作，推动双方互通有无、共赢发展。。安丘市考察团对桓台县经济社会发展取得的成绩给予高度评价，表示将进一步加强交流合作，共同推动两地经济社会实现高质量发展。,"5月10日,高青县行政审批服务局党组书记、局长崔瑞虎带队到济南市章丘区和历城区考察学习，充分学习两地政务服务“一次办好”改革和政务大厅管理先进工作经验，不断提高我县政务服务水平，加快政务服务标准化、规范化、便利化建设，持续提升群众和企业的满意度。。本次考察学习采用参观与座谈相结合的方式，在章丘区，考察团一行实地参观了政务服务大厅标准化建设、窗口设置、单位进驻、硬件设施配置等情况，详细了解智慧导服、无差别一窗受理窗口、云帮办、一网通办、“一业一证”改革运行情况等多方面工作。并对“一对一指导、手把手帮办、肩并肩服务”的无柜台政务服务模式进行深入交流探讨。。在历城区，考察团一行仔细观摩了大厅运行管理、窗口设置、队伍建设、便民服务设施等方面具体措施，现场听取对政务大厅标准化建设、线上帮办中心、“一次办成”改革工作的推进情况。为进一步构架高质量政务服务生态，双方紧紧围绕优化营商环境的主题展开讨论，明确要凝聚服务能量，提高服务效率，推行全流程服务，最大限度的为企业群众提供便利条件和精准化服务。。下一步，高青县行政审批服务局将认真总结此次学习考察成果，充分吸收两地宝贵经验和特色亮点做法，结合自身实际，拓展政务服务创新举措，切实为企业群众办事提供更多便利，加快推动我县政务服务工作再上新台阶。",政府领导到其他城市考察学习或访问,0.0,True
131,山东省,淄博市,县委书记边江风带队赴西安市杭州市成都市考察学习并举行成都市淄博商会沂源商界联合会成立大会暨沂源县专场招商推介签约仪式,2023-04-18,http://www.yiyuan.gov.cn/art/2023/4/18/art_5601_2694965.html,沂源县人民政府 时政要闻 县委书记边江风带队赴西安市、杭州市、成都市考察学习并举行成都市淄博商会沂源商界联合会成立大会暨沂源县专场招商推介签约仪式。县委书记边江风带队赴西安市、杭州市、成都市考察学习并举行成都市淄博商会沂源商界联合会成立大会暨沂源县专场招商推介签约仪式。4月12日至16日，县委书记边江风带队赴西安市、杭州市、成都市考察学习并举行成都市淄博商会沂源商界联合会成立大会暨沂源县专场招商推介签约仪式，通过对接知名企业、学习借鉴先进经验、参观考察特色项目，深化认知迭代，为我县城市更新规划提升、农文旅融合、医养康养等方面注入强劲动能。县委常委、统战部部长孙前，县委常委、副县长郑峰及有关部门和企业负责人参加活动。。考察团一行分别到西安市长安十二时辰和杭州市上城埭村、安吉县余村，以及成都文旅集团、东门码头等考察学习文化旅游融合发展的成功经验和做法。。考察团还前往杭州市城市规划设计研究院、中国电建集团华东勘测设计研究院、桐乡市绿城乌镇雅园、成都彭州龙兴寺城市更新项目、七一城市森林花园、华润置地未来之城项目进行考察学习，认真听取相关情况介绍、与有关负责同志深入交流，详细了解各地在城市更新、老旧片区改造、医养康养、设施配套等方面的先进理念、经验和做法。边江风说，此次考察学习对三地进行针对性拜访对接、参观考察，深入学习了先进地区的经验做法，进一步解放了思想、开阔了视野，通过不断密切对接，努力将碰撞出的火花形成燎原之势。并强调，要在城市更新方面统筹处理好保护与开发的关系，注重细节打造，为城市发展注入新动能，实现群众居住环境改善、产业更新和历史文化保护“多赢”；要在城市建设和文旅项目中结合文化特色，精心设计项目细节，找准目标人群，高度重视并抓好项目运营；要加强文化引导，将文化业态与”吃住行游娱购”相结合，实现文化与农业、旅游、商业深度融合发展；要充分释放城市绿色资源价值，建设生态空间山清水秀、生活空间宜居适度、生产空间集约高效、地域文化特色鲜明的山水花园城市。考察团成员边走边看、边行边议，纷纷表示不虚此行，回去后将结合各自工作实际，认真思考、加强谋划，把学习成果转化为实际举措，高效率、高质量、高水平推进城市提升和文旅融合突破发展。。在成都考察学习期间，举办了成都市淄博商会沂源商界联合会成立大会暨沂源县专场招商推介签约仪式，边江风在致辞中对社会各界长期以来关心沂源发展、助推沂源建设表示衷心感谢。她说，当前，沂源上下正在中国式现代化建设的大潮中，锚定“走在前、开新局”，深入实施“三县战略”，聚力推进“四新四创”，坚定不移打造“六个高地”、实现“六个走在前列”，深化认知迭代，强化提效争先，不断推动县域绿色低碳高质量发展取得新成效、迈上新台阶。希望大家持续关注沂源发展、支持沂源建设、讲好沂源故事，让更多的人了解沂源、关注沂源、喜欢沂源、走进沂源，在发展布局中标注沂源，在项目投资中选择沂源，在深化合作中认可沂源，共同开创中国式现代化的沂源新篇。。会上，与会人员观看了沂源专题宣传片，县双招双引指挥部主要负责人作了招商引资专题推介，详细介绍了沂源招商引资政策、营商环境等情况；沂源商界联合会、成都市淄博商会主要负责人作了发言，表示，沂源发展快、变化大，蕴藏着巨大的发展潜力，将发挥职责、尽其所能积极链接各类优质资源，助力沂源经济高质量发展。。随后，举行了山东省沂源县双招双引成都联络处揭牌仪式及项目签约仪式，我县南鲁山镇人民政府、中庄镇人民政府分别与成都中建材光电材料有限公司、四川云背篓科技集团签订了合作协议。,为深入对标学习先进地市的案件办理经验，提升我院涉众型案件办理能力和水平，5月18日，淄博高新区法院赴北京一中院学习考察，围绕涉众型经济案件财产部分执行工作开展专题学习交流。党组成员、审委会专职委员王效志，党组成员、副院长李鸿飞，高新区群工部、高新区公安分局、高新区财政金融局等单位相关负责同志，以及我院执行局有关同志参加。。考察组一行首先实地参观了北京一中院诉讼服务大厅、审判法庭等，随后，双方以办理“e租宝”案件为例就涉众型案件财产部分执行方式等进行座谈交流。。座谈会上，北京一中院副院长谭劲松对我院一行表示热烈欢迎。并特别邀请北京市高院执行局法官杨朔、市公安局经侦总队刘华争参加交流座谈，北京一中院刑二庭法官范志勇、执行局一级调研员张东立、执行一庭庭长李纪红、副庭长吴广、工商银行北京分行副经理李伟娜、工商银行法律事务部李森，分别从“e租宝案件办理整体情况”“涉众型经济案件财产处置相关工作”“涉案多品种财产处置模式”“案款发还有关做法”“信访维稳”等五个方面交流介绍了经验做法。双方还围绕受损人身份认定、涉案财产处置、委托第三方辅助办理事项、信访维稳等问题进行了深入交流，通过学习交流，大家一致表示收获颇丰，对于如何办理涉众型经济案件财产执行工作有了新的认识 ，在办理思路、受损人认定、财产处置、案款发放、第三方辅助等方面受益匪浅。。王效志专委代表学习考察组一行对北京一中院的热情接待表示感谢，认为一中院在执法办案、品牌创新特别是涉众型案件审执等方面积累了宝贵经验，走在了全国法院前列，此次学习交流，既增强了法院之间的联系，又拓宽了我们的工作思路，成效显著。下一步，考察组要以此次学习调研为契机，进一步理清思路、积极谋划、主动作为，把北京一中院在处理“e租宝”案件中的工作经验“取”回家，把此次学习到的先进做法和经验，消化吸收后融入到具体案件处置工作中去，把服务大局、司法为民做得更深、更细、更到位，推动法院工作再上新台阶。,政府领导到其他城市考察学习或访问,0.0,True
