code,province,city,topic,date,url,content,content.1,label,score,is_match
131,山东省,淄博市,区党政考察团在佛山市南海区考察学习深化合作加快推动实现高质量发展,2018-08-16,http://www.zhangdian.gov.cn/art/2018/8/16/art_6078_1472105.html,"张店区人民政府 今日关注 区党政考察团在佛山市南海区考察学习 深化合作加快推动实现高质量发展。8月14日，市委副书记、区委书记马晓磊，区委副书记、区长王金栋率领张店区党政考察团继续在广东省佛山市南海区考察学习，学习他们在金融产业发展、改革创新、大数据产业发展及政府应用、传统制造业转型升级等方面的经验做法。区领导徐磊、孙激波、赵晨光、齐进山、张苗、孙宏业、宋磊等参加学习。。位于佛山南海千灯湖畔的广东金融高新技术服务区,以“金融后援基地、产业金融中心”为功能定位,旨在为科技、产业项目提供金融支持,目前已吸引人保南方信息中心、友邦金融中心等162家国内外知名金融企业落户,募集社会资金200余亿元,规模位居全国前列。考察团成员不时就有关问题与当地同志深入交流,探究扶持金融产业发展的新做法。。考察团一行还参观考察了东方精工和维尚家具两家园区企业。东方精工是国际领先的智能物流包装系统整体解决方案提供商,主攻智能包装设备、智能自动化设备、高端核心零部件三大板块,实现了传统制造向智能制造的华丽转身。维尚家具大力推进工业化与信息化融合,成功打造出基于数字条形码管理的生产流程控制系统和“秒”级加工控制评估系统,第一个创立“全球第二代整体衣柜”,第一个提出“先定家具后装修”,第一个实现“全屋家私数码定制”。考察团成员对此深受震撼,表示将用心学习他们创新园区管理体制,推动产业高端集群发展的成功经验做法。。这几天在东莞佛山等地实地观摩学习，看到他们思想解放之大，改革创新之强，发展质量之高，营商环境之优，令人振奋，催人奋进，特别是今天上午，在南海（区）看到金融中心，使我们坚定了信心，下一步，我们以开展大学习大调研大改进活动为契机，紧紧围绕全区的一条主线，四个提升，五大重点思路为目标，坚持问责导向，强力攻坚突破，坚决打赢卫生城市迎审，城市精细化管理，社区综合治理，红色物业，扫黑除恶等五大攻坚战役，为服务新区建设，建设幸福张店做出马尚担当。。和佛山相比，淄博和佛山在本省的地位应该相似，产业基础也都相同，但是这几年我们发展远远地落在了后面，尤其是佛山在经济园区发展方面的新的理念，体制方面的一些做法，值得我们认真的学习，回去以后我们将结合科技工业园的实际情况，找准突破口，找准切入点，扎扎实实地抓好落实，把我们整个全镇的镇域经济抓上去。。感觉我们南方的干部理念开放，创新善为，敢想敢干，特别是看了佛山禅城（区）他的行政审批中心以后，感触很深，首先一是它是国内首创，它的设计超前，二个它实现了一门式办理，一网式办理，尤其是它24小时无人值班的自助服务大厅，方便了群众，它们关键就是有一个强大的数据信息支持，一支服务高效的专业队伍，还有一套科学完善的管理制度，通过学习找准差距，对准差距，学习他们敢闯敢试的精神，敢为人先的闯劲，知耻而后勇，通过学，通过做，来赶超他们，来打造我们一站式一门式的服务。",8月12日上午，市委副书记、区委书记马晓磊，区委副书记、区长王金栋率领区党政考察团，启程赴东莞、佛山、无锡、济南等4市进行学习考察。。这次学习考察，是在全区上下深入学习贯彻习近平总书记视察山东重要讲话精神，贯彻落实省、市系列重要会议决策部署的大背景下，结合“大学习、大调研、大改进”和“新时代、新理念、新担当”大讨论活动开展的。外出学习的目的，就是通过现场学习，进一步开拓眼界、开拓视野、开拓思路，在对标找差中解放思想、更新观念，在比学赶超中激励担当、主动作为，以思想的解放推动思路更新，以观念的转变促进制度优化，进一步推动境界、格局、目标、标准四个提升，真正将改革创新的活力最大程度释放出来，将转型发展的潜力最大限度激发出来，不断开创全区高质量发展新局面。。考察团成员包括，区领导徐磊、孙激波、赵晨光、齐进山、张苗、孙宏业、宋磊，部分镇、街道和区直部门单位及企业主要负责同志。考察团将在5天时间内，到4市6区的23个考察点进行学习，主要学习新旧动能转换、创新驱动发展、园区建设发展、城市建设管理、营商环境优化、社会综合治理等方面的经验做法。。考察团成员一致表示，要按照区委、区政府部署要求，用心学、认真记、勤思考，学深学透先进城市的经验做法，为今后工作开展提供有益借鉴，做到学有所得、学有所悟，学以致用、学用结合，切实把学习成果转化为实际行动，转化为推动我区高质量发展的具体实践。,政府领导到其他城市考察学习或访问,0.6946132882548112,True
131,山东省,淄博市,区党政考察团赴东莞佛山无锡济南四市学习考察,2018-08-14,http://www.zhangdian.gov.cn/art/2018/8/14/art_6078_1470883.html,8月12日上午，市委副书记、区委书记马晓磊，区委副书记、区长王金栋率领区党政考察团，启程赴东莞、佛山、无锡、济南等4市进行学习考察。。这次学习考察，是在全区上下深入学习贯彻习近平总书记视察山东重要讲话精神，贯彻落实省、市系列重要会议决策部署的大背景下，结合“大学习、大调研、大改进”和“新时代、新理念、新担当”大讨论活动开展的。外出学习的目的，就是通过现场学习，进一步开拓眼界、开拓视野、开拓思路，在对标找差中解放思想、更新观念，在比学赶超中激励担当、主动作为，以思想的解放推动思路更新，以观念的转变促进制度优化，进一步推动境界、格局、目标、标准四个提升，真正将改革创新的活力最大程度释放出来，将转型发展的潜力最大限度激发出来，不断开创全区高质量发展新局面。。考察团成员包括，区领导徐磊、孙激波、赵晨光、齐进山、张苗、孙宏业、宋磊，部分镇、街道和区直部门单位及企业主要负责同志。考察团将在5天时间内，到4市6区的23个考察点进行学习，主要学习新旧动能转换、创新驱动发展、园区建设发展、城市建设管理、营商环境优化、社会综合治理等方面的经验做法。。考察团成员一致表示，要按照区委、区政府部署要求，用心学、认真记、勤思考，学深学透先进城市的经验做法，为今后工作开展提供有益借鉴，做到学有所得、学有所悟，学以致用、学用结合，切实把学习成果转化为实际行动，转化为推动我区高质量发展的具体实践。,高青县人民政府 部门动态 泰安市城市管理指挥调度中心来我县考察学习数字化城市管理系统平台建设。近日，泰安市城市管理指挥调度中心主任刘延斌等一行7人来我县综合行政执法局智慧城管指挥中心考察学习，市城市管理监督指挥中心主任张文、县综合行政执法局局长吕凯及相关负责人陪同考察。。会上考察团听取了智慧城管指挥中心城管平台系统建设、运行情况介绍，并深入交流了系统功能扩展、考核评价体系、作业情况监督、IVS视频调度共享、防汛系统应用等工作建设及运行情况。刘延斌表示，高青县在智慧城管方面的工作经验，为泰安拓宽了智慧城管的建设思路，希望双方今后加强交流，共同推进数字化城市管理系统平台建设再上新台阶。（通讯员：李新龙）,政府领导到其他城市考察学习或访问,0.0,True
131,山东省,淄博市,市党政考察团在深圳市学习考察感受创新发展提升境界理念,2018-07-20,http://gaige.zibo.gov.cn/art/2018/7/20/art_19878_2777070.html,7月18日，市委书记、市人大常委会主任周连华，市委副书记、市长于海田率领市党政考察团继续在深圳学习考察，深入学习贯彻习近平总书记视察山东重要讲话精神和省委十一届五次全会精神，认真学习深圳改革创新的好经验好做法，感受创新发展，提升境界理念，进一步解放思想、改革突破，加快推动高质量发展。深圳市委副书记、市长陈如桂会见考察团成员并介绍情况;淄博市领导丛锡钢、马晓磊、毕荣青、高庆波、盖卫星参加活动。。考察团一行首先来到深圳前海蛇口自贸片区，学习片区发展理念、制度创新、开发建设等情况。蛇口自贸片区位于深圳西部、珠江口东岸，毗邻香港，规划总用地面积约28.2平方公里。注册企业从2012年的5215家激增至2017年底的16.49万家，年均增长率高达99.5%，每平方公里注册企业增加值突破100亿元，已经成为我国发展最快、效益最好的区域之一。短短几年时间，前海从一片滩涂起步，依托制度创新实现跨越式发展的井喷态势。对此，考察团成员纷纷表示眼热心急、深受震撼。。深圳湾创业广场是深圳市倾力打造的创新创业创投创客“四创”联动主题街区，目前已引入联想之星、腾讯众创空间、京东智能等国内外一流专业孵化及创业服务机构45家，进驻互联网、智能硬件等创新创业团队200余个，诞生了思必驰、悦动圈等一批明星创业项目。在这里，考察团成员详细了解深圳市依托产业背景，改革创新体制机制，构建融合全球创新人才、创业服务要素、创投资本联盟和科技产业资源的创新创业生态系统的做法。这种政府提供阳光雨露、企业负责创新发展的理念，给大家留下深刻印象。一致表示，要认真学习借鉴好经验，研究思考以制度创新吸引创客团队、服务创新创业的思路举措。。大疆创新科技有限公司、大族激光科技产业集团股份有限公司、研祥智能科技股份有限公司、迈瑞生物医疗电子股份有限公司、腾讯计算机系统有限公司，都是全球一流、国内领先的行业翘楚，都是勇于创新、敢闯敢干的业界典范。他们始终坚持国际视野，瞄准新兴行业、未来产业，把创新作为第一动力，向创新要发展活力，唱响了创新发展主旋律。考察团一行走进企业展厅、生产车间、研发中心，边走边看、边听边记、边思边议，认真学习他们厚植人才资源优势，持续推动科技创新，将领先技术转化为竞争优势，实现高质量发展的经验做法，努力使创新成为渗入骨髓、助力转型的高度自觉。。学习过程中，考察团成员精神饱满、态度认真，不时与企业的同志就有关问题进行交流探讨，并洽谈寻找双方合作的结合点。大家一致表示，通过学习，取到了真经，看到了差距，激发了干劲，将用心学习借鉴、充分消化吸收，结合各自实际，拿出集聚人才、创新发展、破解难题的具体措施。,人来桓考察学习全面深化改革经验做法。期间，考察组现场观摩了东岳集团智能化控制中心、桓台县便民服务中心、桓台县智慧城市展厅等，并座谈交流了下一步工作思路和方法。考察组对我县全面深化改革工作给予了高度评价，并表示要学习借鉴我县好的经验和做法，希望今后两地进一步加强交流，为推进改革、加快发展作出积极贡献。,不属于政府领导到其他城市考察学习的新闻,0.5016450585111883,True
131,山东省,淄博市,淄博市党政考察团赴广东学习考察,2018-07-20,http://gaige.zibo.gov.cn/art/2018/7/20/art_19878_2777071.html,7月17日上午，市委书记、市人大常委会主任周连华，市委副书记、市长于海田率领市党政考察团，启程赴广东深圳、东莞、佛山三市学习考察。。这次学习考察，是在改革开放40周年，全市上下深入学习贯彻习近平总书记视察山东重要讲话精神，贯彻落实省委十一届五次全会、市委十二届五次全会部署要求的大背景下进行的。考察团成员包括，市领导丛锡钢、马晓磊、毕荣青、高庆波、盖卫星，各区县、高新区、经济开发区、文昌湖省级旅游度假区和市直有关部门及部分企业主要负责同志。。刚刚闭幕的市委十二届五次全会，深入学习贯彻习近平总书记视察山东重要讲话精神，贯彻落实省委十一届五次全会部署要求，作出了在全市开展“新时代、新理念、新担当”大讨论活动的决定。活动的基本目标就是，对标先进省市，坚持思想再解放、改革再深入、工作再抓实，针对思想观念陈旧、发展理念落后、工作作风不实、担当作为不力等问题，找差距、明方向、定措施，切实把思想观念转到新发展理念上来，把思维方式转到新时代要求上来，把工作作风转到敢担当善作为上来，以新的理念、新的境界、新的担当、新的作为，奋力推动淄博老工业城市转型发展、全面振兴、走在前列。这次学习考察，就是大力推进解放思想、改革开放、创新发展的具体举措。市委、市政府明确要求，要带着问题学、带着使命学、带着责任学，坚持边学习、边思考、边总结，切实做到学有所悟、学有所得、不虚此行。。下午考察团一到深圳，就马不停蹄直奔第一个学习考察点中国科学院深圳先进技术研究院。该院成立于2006年2月，创出了科研、教育、产业、资本“四位一体”发展模式，是国内海归密度最高的国立研究机构，人才引进管理使用机制灵活，创新氛围浓厚，科研成果丰硕。大家用心听取情况介绍，认真记录、拍摄资料，实地考察了大数据助力智慧城市建设平台、劳特伯医学影像—联影联合实验室、精密工程研究中心，深入了解其通过体制机制创新，紧密融合创新链、产业链、资金链，打造一流研究基地和制造业孵化基地情况。随团考察的园区和相关企业负责人，积极洽谈对接合作事宜。。考察团成员一致表示，要按照市委、市政府部署要求，认真学习他们的好经验好做法，真学真思真悟、主动对标对表，学到真经、见到行动，切实把学习成果转化为实践成效，以思想大解放、观念大转变、作风大改进促进工作大提升。,沂源县人民政府 图片新闻 甘肃省酒泉市委常委、玉门市委书记陈炎人一行到我县考察学习。7月17日，甘肃省酒泉市委常委、玉门市委书记陈炎人一行到我县考察学习，市经济合作局局长张涛，县委副书记、县长田晨光，县委常委、统战部部长武光明，县政协副主席、经协办主任张玲陪同。。陈炎人一行先后到药玻公司、卓意公司、瑞阳展厅、合力泰公司、鲁阳公司进行实地考察，详细了解我县经济园区、主导产业、企业发展、项目建设、投资环境等情况。。在随后的座谈会上，田晨光介绍了我县基本县情，表示两地产业结构互补性强，合作发展前景广阔，希望加深两地交流合作，共创美好未来。。陈炎人介绍了玉门市的总体情况，表示通过此次考察深受启发，回去将学习借鉴我县的经验做法，同时在产业项目等方面加强两地合作，促进共同发展。（记者张焱）,政府领导到其他城市考察学习或访问,0.0,True
131,山东省,淄博市,甘肃省酒泉市委常委玉门市委书记陈炎人一行到我县考察学习,2018-07-20,http://www.yiyuan.gov.cn/art/2018/7/20/art_5607_1452291.html,沂源县人民政府 图片新闻 甘肃省酒泉市委常委、玉门市委书记陈炎人一行到我县考察学习。7月17日，甘肃省酒泉市委常委、玉门市委书记陈炎人一行到我县考察学习，市经济合作局局长张涛，县委副书记、县长田晨光，县委常委、统战部部长武光明，县政协副主席、经协办主任张玲陪同。。陈炎人一行先后到药玻公司、卓意公司、瑞阳展厅、合力泰公司、鲁阳公司进行实地考察，详细了解我县经济园区、主导产业、企业发展、项目建设、投资环境等情况。。在随后的座谈会上，田晨光介绍了我县基本县情，表示两地产业结构互补性强，合作发展前景广阔，希望加深两地交流合作，共创美好未来。。陈炎人介绍了玉门市的总体情况，表示通过此次考察深受启发，回去将学习借鉴我县的经验做法，同时在产业项目等方面加强两地合作，促进共同发展。（记者张焱）,淄博市教育局 区县采风 高青县局机关第三党支部党员活动日暨学习贯彻《青岛威海潍坊教育考察报告》会。7月13日，高青县教研室召开局机关第三党支部党员活动日暨学习贯彻《考察报告》会，教研室全体人员参加了会议。会上，一是学习传达了县委常委、组织部部长蔡华刚同志对全县教育系统党建工作进行专题调研时的讲话精神和县教育局党委书记、局长张玉江同志所做的《县教育局党建工作情况汇报》的主要内容。二是全面学习解读了淄博市教育局《关于印发<青岛威海潍坊教育考察报告>的通知》《关于印发<我市部分高中校长赴莱芜一中、烟台一中教育考察报告>的通知》及考察报告。。最后教研室负责人对学习内容进行了总结点评，对局党委“一体两翼”“三驾马车”“四片六区”的总体思路进行了重新学习和解读，并结合教研室暑期重点工作、读书活动、教研方式创新、外出学习、工作纪律、工作程序及宣传工作等提出了相关要求。（索相云）,其他,0.5588403022760303,True
131,山东省,淄博市,助力创城周村区综合行政执法局赴临淄学习考察城市精细化管理工作,2018-07-02,http://cg.zibo.gov.cn/art/2018/7/2/art_410_1438953.html,淄博市城市管理局 工作要闻 【助力创城】周村区综合行政执法局赴临淄学习考察城市精细化管理工作。为深入贯彻于海田市长关于国家卫生城市迎审工作指示精神，进一步巩固前期迎接全国卫生城市复审工作成果，借鉴临淄区城市管理工作先进经验，提高城市管理水平。6月26日，周村区综合行政执法局局长胡学基带领局中层以上干部到临淄区就城市精细化管理工作进行参观学习。。首先考察组在会议室进行座谈交流，听取了临淄区城市精细化管理工作的经营介绍，并就城市管理方面的问题进行了深入的沟通交流。随后实地查看了临淄区市容容貌、公园精细化管理、烧烤城建设管理等工作。。通过参观学习，认真查找自身不足，进一步拓宽工作思路，明确工作重点和管理举措。通过实施精准对标，学习借鉴先进管理经验，激发全局凝心聚力追赶超越的动力和干劲，不断提高城市精细化管理水平。（秦雪）,为深入开展“大学习、大调研、大改进”，扎实推动供销社综合改革，积极融入乡村振兴，6月20日—21日，淄博市供销社党委书记、主任田茂庚带领市供销社领导班子成员、各区县供销社主任及市供销社各科室负责人，赴泰安市供销社学习考察供销社综合改革、村社共建和开放办社工作。。考察团一行先后参观了泰安市新泰市翟镇为农服务中心、新泰市齐云为农服务中心、新泰市北寨村村社共建项目、新泰市岳家庄为农服务中心、新泰市刘杜为农服务中心、肥城市湖屯供销社与张店村共建现场、肥城市王瓜店供销社与朱庄村共建现场、肥城市康汇现代农业服务公司中央厨房项目、肥城市老城供销社与辛屯村共建现场、肥城市供销社与王坊村共建现场、肥城市泰山新合作为农服务中心，实地听取了各项目现场的经验介绍，学习了泰安市新泰市供销社和肥城市供销社在推进“党建带社建村社共建”和开放办社方面的。田茂庚指出，泰安市供销社多项工作走在了全省系统前列，尤其是村社共建和开放办社工作，创出了样板、树立了标杆，更深刻体现了解放思想、敢为人先的创新精神，勇于担当、积极作为的实干魄力，互利共赢、开放办社的合作意识。通过此次现场学习考察，淄博市供销社系统非常震撼，收获很大，既感受到了差距，又获得了加快发展的动力。下一步，全市供销社要加大学习先进、对标发展工作力度，认真虚心学习泰安市供销社先进经验，为全系统综合改革趟出新路子。。市供销社领导班子成员、区县供销社主任、市社各科室负责人要将在泰安的所察所思所想与分管分工工作和区县实际相结合，在深入调研思考的基础上认真加以消化吸收，应用到综合改革重点工作中。。通过现场学习，考察团成员普遍感受到了工作上的差距。要正视这种差距，将差距转化为讲创新求突破的动力，把泰安市社在综合改革、为农服务、村社共建、开放办社方面的好做法嫁接过来，因地制宜糅合到已有工作体系中，助力全系统工作出现新起色、获得新突破。。要树立“有为才有位”的观念，从“精、气、神”入手，学习泰安市社开拓创新的精神和勇于担当的气魄，进一步解放思想，扎实推进开放办社，积极做好对上争取、部门协调和对下指导工作，推动全市系统投身于乡村振兴的战略实践中，打造为农服务的生力军和综合平台。,政府领导到其他城市考察学习或访问,0.0,True
131,山东省,淄博市,河北省唐山市市政府来我区卓创资讯考察学习,2018-05-08,http://www.zhangdian.gov.cn/art/2018/5/8/art_6079_1421363.html,5月8日，张店区人民政府副区长邹洪、区经信局局长王睿丰及科室相关人员陪同河北省唐山市孙文仲副市长及市政府相关各部门负责人来我区卓创资讯考察学习。。、区经信局局长王睿丰及科室相关人员陪同河北省唐山市孙文仲副市长及市政府相关各部门负责人来我区卓创资讯考察学习。,5月3日，滨州市农经站站长宋立成一行11人来我县考察学习农村土地有序流转、农村土地承包经营权抵押贷款等方面工作。市、县农业局相关负责人陪同。。县农经站负责人向考察组详细介绍了我县农村土地有序流转、农村土地承包经营权抵押贷款等方面工作开展情况，两市农经站负责人、业务人员就分管工作介绍了各自的做法、经验和体会。考察组查阅了有关档案资料，详细咨询了我县在农村土地有序流转、农村土地承包经营权抵押贷款等方面的问题及解决方法。,其他,0.515667269916866,True
