code,province,city,topic,date,url,content,content.1,label,score,is_match
82,浙江省,杭州市,平顶山党政代表团来我区考察,2017-03-14,https://search.zj.gov.cn/jsearchfront/visit/link.do?url=http%3A%2F%2Fwww.hzsc.gov.cn%2Fart%2F2017%2F3%2F14%2Fart_1267763_5961503.html&q=%E5%AD%A6%E4%B9%A0%E8%80%83%E5%AF%9F%20%E8%80%83%E5%AF%9F%E5%AD%A6%E4%B9%A0&websiteid=330100000000000&title=%E5%B9%B3%E9%A1%B6%E5%B1%B1%E5%85%9A%E6%94%BF%E4%BB%A3%E8%A1%A8%E5%9B%A2%E6%9D%A5%E6%88%91%E5%8C%BA%E8%80%83%E5%AF%9F,3月8日-9日，由平顶山代市长周斌率领的党政考察团一行，来我区考察。市政府副秘书长冯伟，区委副书记、区长金承涛，以及区相关部门负责人等陪同。。代表团一行首先参观基金小镇二期展厅，观看小镇宣传片，听取了小镇从起步建设到目前的拓展规划等相关情况介绍，并详细了解了基金小镇金融产业格局、运作管理、企业入驻、招商引资等情况。随后，来到思鑫坊、西湖大道、馒头山，实地考察我区三处提升改造工程，详细听取了项目提升改造过程介绍。。周斌表示，此次考察感触良多，受益匪浅。平顶山将认真学习小镇打造的好经验，加快发展金融业，努力打造有平顶山特色的金融新业态，也会把上城城市建设方面的好思路、好做法带回去，运用到平顶山建设管理工作的实践中去。他希望以此次考察为契机，进一步密切两地联系，并期待能有机会与上城区合作。,考察团一行参观了基金小镇一期和二期，详细了解基金小镇的起步建设、规划布局、运作管理、未来拓展等情况，并来到小镇入驻企业南方设计院，与企业负责人互动交流，了解企业发展现状。小镇内优美的办公环境、专业的管理、细致的服务等都给考察团一行留下了深刻的印象。随后，召开座谈会。。据了解，玉皇山南基金小镇自2015年挂牌至今年6月底，已快速集聚股权投资类、证券期货类、财富管理类机构1667家，管理的各类资金规模突破8750亿元，投向实体经济资本规模3226亿元。。鲍炳章对我区及基金小镇的发展表示充分肯定。他说，基金小镇在生态环境改造中充分考虑城市发展，并以人才先行理念，大力推进供给侧结构性改革，形成了极具前瞻性的战略定位，在短短几年内实现转型升级和金融集聚，这种发展模式值得徐汇区学习。当前徐汇区正重点推进城市更新、生态建设等方面工作，希望双方今后继续多学习、多交流，相互借鉴，共谋发展。,其他,0.6164803665781173,True
82,浙江省,杭州市,诸暨市考察团来我区调研,2015-09-09,https://search.zj.gov.cn/jsearchfront/visit/link.do?url=http%3A%2F%2Fwww.hzsc.gov.cn%2Fart%2F2015%2F9%2F9%2Fart_1267764_4469731.html&q=%E5%AD%A6%E4%B9%A0%E8%80%83%E5%AF%9F%20%E8%80%83%E5%AF%9F%E5%AD%A6%E4%B9%A0&websiteid=330100000000000&title=%E8%AF%B8%E6%9A%A8%E5%B8%82%E8%80%83%E5%AF%9F%E5%9B%A2%E6%9D%A5%E6%88%91%E5%8C%BA%E8%B0%83%E7%A0%94,日前，由绍兴市委常委、诸暨市委书记张晓强率领的诸暨市党政考察团一行，来我区考察玉皇山南基金小镇建设工作相关情况。区委常委、常务副区长黄爱芳，区府办、区发改经信局、区财政局、玉皇山南指挥部相关负责人陪同并召开座谈会。。考察团一行参观了位于八卦田邻近的基金小镇一期和二期，实地走访了杭州联创和南方设计院，详细询问基金小镇运作模式和入驻企业的情况。。会上，区领导对我区经济、社会、人文、历史、城市建设等方面作了简要介绍后，就我区全力打造玉皇山南基金小镇做了情况介绍。截至目前，基金小镇一期、二期区块已累计入驻金融投资类企业250余家，包括敦和资产、赛伯乐投资、天堂硅谷、杭州联创投资等一批龙头企业，管理资产规模超过1300亿元；三期、四期正在有序建设中。此外，小镇内还将集聚包括莫言在内的一批文创企业和文化人士，为资本与创意之间的碰撞搭建了平台，有效促进了金融文创的融合发展。。在听取情况介绍后，张晓强认为上城区的基金小镇建设具有独创性和先进性，在浙江乃至全国都是一流的示范样本，许多做法与经验都值得学习和借鉴。他希望，两地能加强沟通联系，相互学习、相互促进，共同发展。,5月16日上午，贵州省六盘水市人民政府政务服务管理局副局长杜瑜带领的考察团一行9人赴上城区审管办考察学习“最多跑一次”改革工作。。杜瑜一行首先来到行政服务中心大厅进行考察，并仔细察看和了解了各窗口的设置和运行情况。随后，召开座谈会，听取了区审管办主任余向平关于上城区“最多跑一次”改革工作及下步思路的情况介绍。余向平重点就“一件事”梳理、如何做到“跑一次”，以及便民服务措施、“移动办事先行区、智能服务示范区”建设、引入社会力量参与政府公共服务事项等，结合具体的案例作了深入生动的讲解，给考察团成员留下深刻的印象。。座谈会上，考察团成员还就“最多跑一次”改革工作的具体实施过程和步骤进行了详细咨询，并与区审管办深入交流。,政府领导到其他城市考察学习或访问,0.0,True
82,浙江省,杭州市,余杭区局宁波市北仑区城管局考察团一行来我局考察交流信息化工作,2021-04-02,https://search.zj.gov.cn/jsearchfront/visit/link.do?url=http%3A%2F%2Fcgw.hangzhou.gov.cn%2Fart%2F2021%2F4%2F2%2Fart_1229482841_58899275.html&q=%E5%AD%A6%E4%B9%A0%E8%80%83%E5%AF%9F%20%E8%80%83%E5%AF%9F%E5%AD%A6%E4%B9%A0&websiteid=330100000000000&title=%E4%BD%99%E6%9D%AD%E5%8C%BA%E5%B1%80%EF%BC%9A%E5%AE%81%E6%B3%A2%E5%B8%82%E5%8C%97%E4%BB%91%E5%8C%BA%E5%9F%8E%E7%AE%A1%E5%B1%80%E8%80%83%E5%AF%9F%E5%9B%A2%E4%B8%80%E8%A1%8C%E6%9D%A5%E6%88%91%E5%B1%80%E8%80%83%E5%AF%9F%E4%BA%A4%E6%B5%81%E4%BF%A1%E6%81%AF%E5%8C%96%E5%B7%A5%E4%BD%9C,3月26日上午，宁波市北仑区城管局考察团一行来我局考察交流信息化工作，局领导童笑田陪同考察，局信息指挥科、市政绿化保障中心有关负责人参加座谈交流。。座谈会上，局领导童笑田对我局数据城管系统建设、城市长效管理和环境整治、环卫保洁、垃圾分类等重点工作进行了介绍。双方还就城市管理领域数字化改革、犬类管理、停车管理等工作进行了交流探讨。北仑区城管局考察人员对我局信息化建设取得的成绩给予充分肯定，表示将学习借鉴余杭区城管局的成功经验。。会后，北仑区城管局考察团一行还听取了我局智慧城管演示汇报，了解近年来我局信息化建设取得的成果，并实地调研星桥城管中队。,8月26日，由湖北省恩施州人大常委会副主任、鹤峰县委书记王小平率领的鹤峰县考察团一行来我区考察对接东西部扶贫协作工作。27日，上城、鹤峰两地举行对口帮扶协作座谈会。。会上，鹤峰、上城双方就两地经济社会发展基本情况、扶贫协作工作开展情况进行了汇报，并围绕下一步工作的开展进行了深入交流。陈瑾书记表示，要坚决按照扶贫协作框架协议的内容做好落实，上城与鹤峰要做好优势互补、取长补短，最终实现共赢；并强调，鹤峰干部振奋的精神风貌和工作干劲值得全体上城干部学习。,政府领导到其他城市考察学习或访问,0.0,True
82,浙江省,杭州市,西安市长安区考察团赴上城区考察生活垃圾三化四分工作,2017-02-17,https://search.zj.gov.cn/jsearchfront/visit/link.do?url=http%3A%2F%2Fwww.hzsc.gov.cn%2Fart%2F2017%2F2%2F17%2Fart_1268020_35247429.html&q=%E5%AD%A6%E4%B9%A0%E8%80%83%E5%AF%9F%20%E8%80%83%E5%AF%9F%E5%AD%A6%E4%B9%A0&websiteid=330100000000000&title=%E8%A5%BF%E5%AE%89%E5%B8%82%E9%95%BF%E5%AE%89%E5%8C%BA%E8%80%83%E5%AF%9F%E5%9B%A2%E8%B5%B4%E4%B8%8A%E5%9F%8E%E5%8C%BA%E8%80%83%E5%AF%9F%E7%94%9F%E6%B4%BB%E5%9E%83%E5%9C%BE%E2%80%9C%E4%B8%89%E5%8C%96%E5%9B%9B%E5%88%86%E2%80%9D%E5%B7%A5%E4%BD%9C,2月13日下午，西安市长安区副区长李朝喜率领考察团一行来我区考察生活垃圾“三化四分”工作。李朝喜一行实地踏看了望江智慧产业园和江新苑小区垃圾分类示范点。望江街道万泰城内共有大小商户40余家，大部分为餐饮企业，上城区结合资源化利用，对其实行餐厨垃圾统收统运。江新苑小区充分利用“互联网+”，引进了智能垃圾袋发放机和太阳能智能垃圾分类可回收箱两大硬件设施，线下推广“实名制”分类投放赢积分换服务、换礼品模式，提高居民参与垃圾分类的积极性。通过实地踏看，考察团一行对上城区生活垃圾“三化四分”工作给予充分肯定。随后，考察团一行来到上城区城管局召开座谈会。会上，上城区副区长薛鸿翔介绍了上城区生活垃圾处置情况和主要做法，考察团纷纷表示，上城区在生活垃圾“三化四分”工作中，对标国际化，创新手段、多措并举、成效显著，工作经验值得学习借鉴。,7月11日上午，杭州市临安区青少年毒品预防教育基地迎接了区教育局、公安局、应急局的联合考察，同时接待了锦天社区和玲珑山社区暑假假日学校的孩子和社区工作人员的参观学习。。在禁毒教育基地讲解员的带领下，考察人员与孩子们通过文字、图片、毒品仿真模具、影音视频、动手操作，直观地认识了毒品的种类、危害以及如何拒绝毒品。。讲解员从清末的“虎门销烟”讲到全民禁毒的今天，向参观人员全面详实地介绍了中国的禁毒史，展现了党和国家坚决打击毒品犯罪的决心。在老师的提问时，同学们互相展开了激烈地讨论，交流了本次实践活动的收获与感想，巩固了学习成果。。杭州市临安区青少年毒品预防教育基地从2016年1月对外开放以来，合计接待参观人员达近万人，基地开放以来临安也未出现1例未成年人涉毒案例。,其他,0.7731762693626317,True
82,浙江省,杭州市,,2020-05-21,https://search.zj.gov.cn/jsearchfront/visit/link.do?url=http%3A%2F%2Fwww.hzsc.gov.cn%2Fart%2F2020%2F5%2F21%2Fart_1229554174_3905936.html&q=%E5%AD%A6%E4%B9%A0%E8%80%83%E5%AF%9F%20%E8%80%83%E5%AF%9F%E5%AD%A6%E4%B9%A0&websiteid=330100000000000&title=%E5%87%AF%E6%97%8B%E8%A1%97%E9%81%93%E8%BF%8E%E6%8E%A5%E5%86%85%E8%92%99%E5%8F%A4%E8%87%AA%E6%B2%BB%E5%8C%BA%E5%91%BC%E5%92%8C%E6%B5%A9%E7%89%B9%E5%B8%82%E8%80%83%E5%AF%9F%E5%9B%A2%E8%B0%83%E7%A0%94%E5%9E%83%E5%9C%BE%E5%88%86%E7%B1%BB%E5%B7%A5%E4%BD%9C,近日，内蒙古自治区呼和浩特市副市长周强一行赴凯旋街道南肖埠社区调研垃圾分类工作，杭州市市容环境卫生保障中心主任沈旻昕，区城管局分类办负责人陈峰，凯旋街道办事处副主任沈文富等陪同。。考察团实地踏看了南肖埠社区新建和改建的垃圾分类投放点、再生资源回收站点、垃圾分类评比栏等设施。在听取南肖埠社区党委书记梁旭珍详细介绍了南肖埠社区如何全面推行“桶长制”，深入践行“杭州模式”，通过党建引领，充分调动广大党员合居民的积极性，做到垃圾分类全民参与，让绿色生活蔚然成风。在再生资源回收站点，考察团详细了解了社区再生资源回收利用模式，社区通过站点的设立破解废旧物件处置“前端关口”问题，真正实现废物利用。。周强副市长充分肯定了凯旋街道垃圾分类工作，表示会积极学习加以借鉴。,"日前，下城区机关事务管理局一行赴西湖区机关事务管理局考察机关公务用车管理信息平台建设工作,并举行工作座谈会。。座谈会上，西湖区局就公务用车GPS系统平台的建设、车辆和人员管理模式、平台社会化租车等方面做了详细介绍。双方还就当前公务用车管理工作中的热点、难点问题以及今后公务用车的发展趋势和“全省一张网”工作进行了深入交流探讨。。下城区交流考察团一行认为我区车辆管理模式较为科学，制度健全完备，措施得力到位，工作经验和工作成效值得学习借鉴，并表示要把公车管理好的做法和经验带回去，为他们理顺机制，推动公车管理信息化平台建设提供更好的方向。今后两区将继续保持对接，相互学习，相互促进，进一步做好公务用车管理工作。",其他,0.5778460063398125,True
82,浙江省,杭州市,区委常委会传达学习贯彻习近平总书记重要讲话精神,2024-04-10,https://search.zj.gov.cn/jsearchfront/visit/link.do?url=http%3A%2F%2Fwww.yuhang.gov.cn%2Fart%2F2024%2F4%2F10%2Fart_1532128_59088841.html&q=%E5%AD%A6%E4%B9%A0%E8%80%83%E5%AF%9F%20%E8%80%83%E5%AF%9F%E5%AD%A6%E4%B9%A0&websiteid=330100000000000&title=%E5%8C%BA%E5%A7%94%E5%B8%B8%E5%A7%94%E4%BC%9A%E4%BC%A0%E8%BE%BE%E5%AD%A6%E4%B9%A0%E8%B4%AF%E5%BD%BB%E4%B9%A0%E8%BF%91%E5%B9%B3%E6%80%BB%E4%B9%A6%E8%AE%B0%E9%87%8D%E8%A6%81%E8%AE%B2%E8%AF%9D%E7%B2%BE%E7%A5%9E,本报讯 （记者 阮伟康 陈书恒） 前日下午，区委常委会召开会议，传达学习习近平总书记近期重要讲话精神，研究部署我区贯彻落实工作。市委常委、区委书记刘颖主持会议并讲话。。会议指出，要深刻学习领会习近平总书记在新时代推动中部地区崛起座谈会上的重要讲话精神，深刻认识推动中部地区崛起对于促进区域协调发展、构建新发展格局、扩大高水平开放，全面建设社会主义现代化国家的重大意义，结合余杭实际，持续加强与中部地区各城市、重点企业的招商洽谈和交流合作，不断深化同湖北省恩施州咸丰县、安徽省宿州市高新区的对口支援合作，助力双方经济社会发展取得更大成效。。会议强调，要深刻学习领会习近平总书记在湖南考察调研时的重要讲话精神，与学习贯彻习近平总书记考察浙江重要讲话精神结合起来，一同领会精神实质、一体抓好贯彻落实，不折不扣做好科技创新、改革开放、乡村振兴、文化文明、党的建设等各领域工作，以杭州城市重要新中心的高质量发展，奋力扛起“勇当先行者、谱写新篇章”的大区担当。。会议要求，要深刻学习领会习近平总书记在3月29日中共中央政治局会议上的重要讲话精神，坚持围绕中心工作靠前监督，以省委巡视组巡视余杭为契机，紧盯国资国企“一把手”，纵深推进全面从严治党，进一步推动国企加强风险防控、做强主责主业，为全区高质量发展提供强大动力。。会议指出，要深刻学习领会习近平总书记在集体会见美国工商界和战略学术界代表时发表的重要讲话精神，持续拓展地方交往、加强经贸合作、深化人文交流，加快打造市场化、法治化、国际化一流营商环境，为服务中国特色大国外交和国家对外开放战略大局贡献余杭力量。,月19日，社区利用党员学习之际，组织早茶读报会成员外出参观学习，丰富学习内容和形式。党员们通过参观考察吴山新旧风貌，改革开放给城市环境建设带来的巨大变化，进一步感受创先争优取得的丰硕成果。参观学习后党员们纷纷表示，活动增强了党员之间的沟通了解，开拓了视野，增长了知识，进一步增强了服务群众的意识，增强了社区党组织建设的凝聚力。,其他,0.6257420652007953,True
82,浙江省,杭州市,安吉县考察团来临考察,2016-05-20,https://search.zj.gov.cn/jsearchfront/visit/link.do?url=http%3A%2F%2Fwww.linan.gov.cn%2Fart%2F2016%2F5%2F20%2Fart_1366280_11339173.html&q=%E5%AD%A6%E4%B9%A0%E8%80%83%E5%AF%9F%20%E8%80%83%E5%AF%9F%E5%AD%A6%E4%B9%A0&websiteid=330100000000000&title=%E5%AE%89%E5%90%89%E5%8E%BF%E8%80%83%E5%AF%9F%E5%9B%A2%E6%9D%A5%E4%B8%B4%E8%80%83%E5%AF%9F,昨日下午，安吉县考察团来临考察G20峰会维稳安保工作。市委副书记、政法委书记李文钢，法、检两长，公安局政委参加活动。。安吉县考察团先后来到G20杭州峰会临安市维稳安保总指挥部、市公安局G20杭州峰会安保办参观考察，并召开座谈交流会，详细了解我市G20峰会维稳安保工作情况。临安高强度推进整治，加强重点物品和行业场所管理，强化公共安全监管，抓好反恐防暴等做法给考察团留下了深刻印象。。今年以来，我市紧紧围绕G20杭州峰会这个“圆心”，高标准组织谋划，创新载体平台，组织群众深入开展平安大巡防活动，营造了全民关注、关心、支持峰会的良好氛围。各地各部门以问题为导向，全方位排查管控，全面查补各类短板，强化社会治安综合治理，开展信访攻坚行动，各项工作推进有序，社会大局保持稳定。。通过详细考察，安吉县考察团一行表示，临安在G20杭州峰会维稳安保工作上，抓得细、抓得实、见成效，有很多好的做法和经验值得学习借鉴。两地作为近邻，以后要深化交流，加强合作，促进经济社会各项事业的共同发展。。其他 信用中国 临安新闻网 杭州市数据开放平台 临安农林信息网 临安教育网 临安区科学技术协会,2月21日下午，由江苏省镇江市委副书记、市长朱晓明率领的考察团一行，在副市长俞东来的陪同下，来我区考察交流历史街区综保工程。区委书记陈红英，区委常委叶素等陪同考察。。下午1：40，雨。上城区住房和城市建设局党委书记沈武洪、小营街道党委书记任平在五柳巷考察点等候，朱晓明一行来到建国南路，考察五柳巷历史文化街区。沈武洪介绍了五柳巷历史文化街区保护情况。五柳巷历史文化街区为杭州南宋皇城的重要地段，2002年列为拟保护历史街区之一。重点保护区范围总面积9.84公顷，建筑总面积约82857平方米、居民1176户。街区内50年以上老建筑约有100余处。为进一步提升历史建筑保护水平，推进五柳巷历史文化街区历史建筑保护工作，五柳巷历史文化街区保护工程紧紧围绕“科学保护、合理利用”原则，结合街区集中反映近代杭城传统居住文化的特点，着力将五柳巷打造成为一处体现江南水乡风景的历史街区。并充分考虑住户对防盗设施的需求，在保持街区风貌的同时，实施了安保优化与亮灯美化工程。目前，五柳巷历史文化街区已启用多个监控探头，主要包括枪机监控探头，球机监控探头，实现了街区电子监控全覆盖。亮灯美化工程也基本于今年1月底完成。。接着，朱晓明一行观看了五柳巷综保工程图片展览，并沿着东河，从斗富三桥往斗富一桥方向进行考察。考察期间，朱晓明不断肯定我区对历史街区保护和城市建设的方方面面所取得的成绩。她说，上城区的历史建筑底子好，工作基础好、起步高。城区居民对历史保护工程的拥护和支持，给人留下了深刻印象，考察收获很大，回去将学习上城的做法，把城市建设工作做好。。朱晓明一行还对二十三坊巷等进行了考察、参观。陈红英书记希望镇江市和上城区相互学习、相互帮助、相互借鉴，共同做好历史街区保护，并在经济社会发展各项工作中多交流互动，共同取得新的更大的成绩。 （危改办何敏慧）,政府领导到其他城市考察学习或访问,0.0,True
82,浙江省,杭州市,镇江市领导来我区考察历史街区综保工程副市长俞东来区委书记陈红英等陪同考察,2013-03-15,https://search.zj.gov.cn/jsearchfront/visit/link.do?url=http%3A%2F%2Fwww.hzsc.gov.cn%2Fart%2F2013%2F3%2F15%2Fart_1268023_4663330.html&q=%E5%AD%A6%E4%B9%A0%E8%80%83%E5%AF%9F%20%E8%80%83%E5%AF%9F%E5%AD%A6%E4%B9%A0&websiteid=330100000000000&title=%E9%95%87%E6%B1%9F%E5%B8%82%E9%A2%86%E5%AF%BC%E6%9D%A5%E6%88%91%E5%8C%BA%E8%80%83%E5%AF%9F%E5%8E%86%E5%8F%B2%E8%A1%97%E5%8C%BA%E7%BB%BC%E4%BF%9D%E5%B7%A5%E7%A8%8B%E2%80%94%E2%80%94%E5%89%AF%E5%B8%82%E9%95%BF%E4%BF%9E%E4%B8%9C%E6%9D%A5%20%E5%8C%BA%E5%A7%94%E4%B9%A6%E8%AE%B0%E9%99%88%E7%BA%A2%E8%8B%B1%E7%AD%89%E9%99%AA%E5%90%8C%E8%80%83%E5%AF%9F,2月21日下午，由江苏省镇江市委副书记、市长朱晓明率领的考察团一行，在副市长俞东来的陪同下，来我区考察交流历史街区综保工程。区委书记陈红英，区委常委叶素等陪同考察。。下午1：40，雨。上城区住房和城市建设局党委书记沈武洪、小营街道党委书记任平在五柳巷考察点等候，朱晓明一行来到建国南路，考察五柳巷历史文化街区。沈武洪介绍了五柳巷历史文化街区保护情况。五柳巷历史文化街区为杭州南宋皇城的重要地段，2002年列为拟保护历史街区之一。重点保护区范围总面积9.84公顷，建筑总面积约82857平方米、居民1176户。街区内50年以上老建筑约有100余处。为进一步提升历史建筑保护水平，推进五柳巷历史文化街区历史建筑保护工作，五柳巷历史文化街区保护工程紧紧围绕“科学保护、合理利用”原则，结合街区集中反映近代杭城传统居住文化的特点，着力将五柳巷打造成为一处体现江南水乡风景的历史街区。并充分考虑住户对防盗设施的需求，在保持街区风貌的同时，实施了安保优化与亮灯美化工程。目前，五柳巷历史文化街区已启用多个监控探头，主要包括枪机监控探头，球机监控探头，实现了街区电子监控全覆盖。亮灯美化工程也基本于今年1月底完成。。接着，朱晓明一行观看了五柳巷综保工程图片展览，并沿着东河，从斗富三桥往斗富一桥方向进行考察。考察期间，朱晓明不断肯定我区对历史街区保护和城市建设的方方面面所取得的成绩。她说，上城区的历史建筑底子好，工作基础好、起步高。城区居民对历史保护工程的拥护和支持，给人留下了深刻印象，考察收获很大，回去将学习上城的做法，把城市建设工作做好。。朱晓明一行还对二十三坊巷等进行了考察、参观。陈红英书记希望镇江市和上城区相互学习、相互帮助、相互借鉴，共同做好历史街区保护，并在经济社会发展各项工作中多交流互动，共同取得新的更大的成绩。 （危改办何敏慧）,日上午，一批红领巾走进了杭州市教育科学研究所附属小学。他们来自上城区各个小学，是来参加第九期“上城区少年领袖成长营”营员招募的少先队员们。这些队员们将在这里参加一系列考核，开展激烈角逐。。“上城区少年领袖成长营”成立至今已有九个年头了，旨在培养具有领袖气质和领袖才干的少先队小干部，作为区域少先队员的领袖羊，为小伙伴们树立同龄榜样，让队员们生动学会“从小学习立志，从小学习做人，从小学习劳动”。历届的领袖成长营培养了数位优秀少先队员，已然成为区域向省市输送红领巾小干部的摇篮和平台。因此，此次招募活动，上城区的家长、老师和学校都非常重视。一早，就有少先队员迫不及待地在校门口等候了。。名少先队员就开始各个环节的考核了。测试问卷环节，队员们在奋笔疾书，考察的是他们在少先队知识、时事政治等方面的综合知识。巧手比拼环节，队员们在飞针走线，完成一幅扣子作品，看，有用扣子钉出一颗爱心的，有缝出一个字母的，还有拼成一个笑脸的。老师画像环节，队员们轻描细抹，为心目中的好老师画一张画像。有队员还悉心地在画像上，送上了教师节的祝福。团队合作环节，队员们击鼓敲缶，协作合奏。每个队员分工合作，你打鼓，我敲镲，踩着节奏整体合奏，这个非常考验队员们的独立自主能力和合作探究能力。。名营员。在活动中，队员们学习自主、合作、探究的能力，体验与伙伴快乐、成长的喜悦。相信经过这一系列的考核，又一批队员们将脱颖而出，成为小伙伴中的“小领袖”们，成为队员们争相学习模仿的好榜样！,其他,0.8453642726139222,True
