code,province,city,topic,date,url,content,content.1,label,score,is_match
82,浙江省,杭州市,,2017-02-16,https://search.zj.gov.cn/jsearchfront/visit/link.do?url=http%3A%2F%2Fwww.hzsc.gov.cn%2Fart%2F2017%2F2%2F16%2Fart_1229618019_3905203.html&q=%E5%AD%A6%E4%B9%A0%E8%80%83%E5%AF%9F%20%E8%80%83%E5%AF%9F%E5%AD%A6%E4%B9%A0&websiteid=330100000000000&title=%E6%81%A9%E6%96%BD%E5%B8%82%E5%85%9A%E6%94%BF%E8%80%83%E5%AF%9F%E5%9B%A2%E8%B5%B4%E4%B8%9C%E7%AB%99%E6%9E%A2%E7%BA%BD%E8%80%83%E5%AF%9F%E5%AD%A6%E4%B9%A0,2月16日上午，恩施市党政考察团赴东站枢纽考察管理运营机制，区政协主席黄爱芳、副区长王跃强、区政协副主席、东站枢纽管委会主任杨渭贤等区有关部门负责人陪同。。恩施市委书记向前进率考察团一行先后实地踏勘了东站枢纽候车大厅、航站楼、东广场公交站、综合服务中心、出租车通道、联勤办、应急响应中心等重点区域，听取了东站管委会关于整体运营机制的情况介绍，详细了解东站枢纽管理机制、派驻机构设置、枢纽区域一体化等情况，对东站枢纽运营模式及管理理念给予高度肯定。,2月16日上午，恩施市党政考察团赴东站枢纽考察管理运营机制，区政协主席黄爱芳、副区长王跃强、区政协副主席、东站枢纽管委会主任杨渭贤等区有关部门负责人陪同。。恩施市委书记向前进率考察团一行先后实地踏勘了东站枢纽候车大厅、航站楼、东广场公交站、综合服务中心、出租车通道、联勤办、应急响应中心等重点区域，听取了东站管委会关于整体运营机制的情况介绍，详细了解东站枢纽管理机制、派驻机构设置、枢纽区域一体化等情况，对东站枢纽运营模式及管理理念给予高度肯定。,不属于政府领导到其他城市考察学习的新闻,0.5170542651252523,True
82,浙江省,杭州市,市领导赴拱墅区学习考察,2015-03-13,https://search.zj.gov.cn/jsearchfront/visit/link.do?url=http%3A%2F%2Fwww.linan.gov.cn%2Fart%2F2015%2F3%2F13%2Fart_1366280_11335552.html&q=%E5%AD%A6%E4%B9%A0%E8%80%83%E5%AF%9F%20%E8%80%83%E5%AF%9F%E5%AD%A6%E4%B9%A0&websiteid=330100000000000&title=%E5%B8%82%E9%A2%86%E5%AF%BC%E8%B5%B4%E6%8B%B1%E5%A2%85%E5%8C%BA%E5%AD%A6%E4%B9%A0%E8%80%83%E5%AF%9F,昨日下午，市委副书记、市长王敏带队赴拱墅区学习考察城市建设、重点工作推进体制机制、特色小镇建设等工作。市领导章登峰、冯镭、吴春法，有关部门负责人参加考察。 在拱墅区，王敏一行先后考察了中国（杭州）智慧信息产业园“梦立方”、大兜路历史街区、绿地中央广场项目和桥西历史街区。拱墅区委副书记、区长朱建明陪同考察。 中国（杭州）智慧信息产业园坐落于杭州北部软件园内，园区一期占地48亩，建筑面积15万平方米，2014年底投入使用。拱墅区以中国（杭州）智慧信息产业园为基础，打造智慧创新小镇，力争3至5年内实现集聚百家智慧信息企业、万名员工、百亿产值。大兜路历史街区和绿地中央广场项目位于拱墅区着力打造的运河中央商务区，该商务区以商业商务功能为主，集聚总部经济，融合金融购物、旅游休闲、文化娱乐及居住生活等多功能于一体，定位为非银行金融机构集聚的运河财富小镇。 在工作交流会上，朱建明向我市考察团介绍了拱墅区经济社会发展情况和产业布局、项目推进机制建设工作。去年，拱墅区实现地区生产总值391.4亿元，地方财政收入60.4亿元，完成固定资产投资383.9亿元。近年来，该区围绕“6+2”主导产业，在智慧信息产业园、智能电商产业园等十大产业平台建设中实施一个产业一个领导主抓、一个部门牵头、一个政策保障的“三个一”机制，有效确保产业平台落地。今年，拱墅区将政府工作全部项目化，形成9大类539个项目，实施项目联审联批机制，项目建设中实施重大项目领导承包制、征迁工作竞赛制、项目推进三色预警制、项目推进问题导向制、项目超前谋划制等五大机制，保障项目建设高效推进。 王敏介绍了临安概况后说，拱墅区经济社会发展速度快，“大好高”项目招引和建设力度强，城市面貌变化大，令人震撼。拱墅新一年的发展思路既符合未来趋势，又契合区域实际，特别是布局清晰的产业平台建设、高效服务企业的理念、政府工作项目化并实施“五大机制”强势推进，形成宝贵经验，令人印象深刻，值得临安借鉴学习。。其他 信用中国 临安新闻网 杭州市数据开放平台 临安农林信息网 临安教育网 临安区科学技术协会,昨日下午，市委副书记、市长王敏带队赴拱墅区学习考察城市建设、重点工作推进体制机制、特色小镇建设等工作。市领导章登峰、冯镭、吴春法，有关部门负责人参加考察。 在拱墅区，王敏一行先后考察了中国（杭州）智慧信息产业园“梦立方”、大兜路历史街区、绿地中央广场项目和桥西历史街区。拱墅区委副书记、区长朱建明陪同考察。 中国（杭州）智慧信息产业园坐落于杭州北部软件园内，园区一期占地48亩，建筑面积15万平方米，2014年底投入使用。拱墅区以中国（杭州）智慧信息产业园为基础，打造智慧创新小镇，力争3至5年内实现集聚百家智慧信息企业、万名员工、百亿产值。大兜路历史街区和绿地中央广场项目位于拱墅区着力打造的运河中央商务区，该商务区以商业商务功能为主，集聚总部经济，融合金融购物、旅游休闲、文化娱乐及居住生活等多功能于一体，定位为非银行金融机构集聚的运河财富小镇。 在工作交流会上，朱建明向我市考察团介绍了拱墅区经济社会发展情况和产业布局、项目推进机制建设工作。去年，拱墅区实现地区生产总值391.4亿元，地方财政收入60.4亿元，完成固定资产投资383.9亿元。近年来，该区围绕“6+2”主导产业，在智慧信息产业园、智能电商产业园等十大产业平台建设中实施一个产业一个领导主抓、一个部门牵头、一个政策保障的“三个一”机制，有效确保产业平台落地。今年，拱墅区将政府工作全部项目化，形成9大类539个项目，实施项目联审联批机制，项目建设中实施重大项目领导承包制、征迁工作竞赛制、项目推进三色预警制、项目推进问题导向制、项目超前谋划制等五大机制，保障项目建设高效推进。 王敏介绍了临安概况后说，拱墅区经济社会发展速度快，“大好高”项目招引和建设力度强，城市面貌变化大，令人震撼。拱墅新一年的发展思路既符合未来趋势，又契合区域实际，特别是布局清晰的产业平台建设、高效服务企业的理念、政府工作项目化并实施“五大机制”强势推进，形成宝贵经验，令人印象深刻，值得临安借鉴学习。。其他 信用中国 临安新闻网 杭州市数据开放平台 临安农林信息网 临安教育网 临安区科学技术协会,政府领导到其他城市考察学习或访问,0.0,True
82,浙江省,杭州市,王敏带队赴西安考察学习,2024-01-25,https://search.zj.gov.cn/jsearchfront/visit/link.do?url=http%3A%2F%2Fwww.xiaoshan.gov.cn%2Fart%2F2024%2F1%2F25%2Fart_1229778162_59097720.html&q=%E5%AD%A6%E4%B9%A0%E8%80%83%E5%AF%9F%20%E8%80%83%E5%AF%9F%E5%AD%A6%E4%B9%A0&websiteid=330100000000000&title=%E7%8E%8B%E6%95%8F%E5%B8%A6%E9%98%9F%E8%B5%B4%E8%A5%BF%E5%AE%89%E8%80%83%E5%AF%9F%E5%AD%A6%E4%B9%A0,作为“后亚运时代”打开新通道，创造新业绩的重要突破口，萧山始终坚持将招商引资作为高质量发展的关键引擎。22日-24日，市委常委、区委书记王敏带队赴陕西省西安市考察学习，加强与优质企业、科研院所沟通对接，共商合作、共谋发展。。西安市委常委、市委秘书长和文强，西安电子科技大学党委书记查显友，西安市委副秘书长濮斌锋，中国科学院西安光机所所长马彩文等陪同考察或参加座谈。区领导吴斌参加。。在西安电子科技大学，王敏与学校党委书记查显友进行座谈，对学校大力支持西电杭研院的建设表示衷心感谢。他指出，西安电子科技大学校史悠久、科研能力顶尖、校友实力雄厚，希望在西电杭研院的校地共建中，能得到学校一如既往的支持，为萧山带来更多高层次、专业性人才，吸引更多西电校友来萧投资。萧山将以高效的政务服务、灵活的市场资本服务好学校以及校友企业，实现双方的合作共赢。查显友表示，西安电子科技大学将持续加强与萧山区的紧密合作，将西电杭研院作为其培养人才、科技研发的重要支点平台，努力为萧山人才培养和经济高质量发展作出贡献。。在中科西安光机所，王敏仔细听取光机所发展历程、科技研发、成果转化等情况，调研学习光机所科技成果产业化模式。王敏在座谈时指出，希望萧山区能够携手中国科学院西安光机所，建立以需求为牵引，产学研相结合的科技成果转化体系，用市场的力量加速助推科研成果面向社会、服务大众。马彩文表示，光机所与萧山区有非常多的契合点，希望双方发挥各自优势，尽早开展合作。。在阎良区航空产业基地，王敏考察调研了中航西飞、试飞院、强度所、兴航航空等航空领域企业和院所，现场了解相关科研技术能力。（莫利锋 孔宇）,作为“后亚运时代”打开新通道，创造新业绩的重要突破口，萧山始终坚持将招商引资作为高质量发展的关键引擎。22日-24日，市委常委、区委书记王敏带队赴陕西省西安市考察学习，加强与优质企业、科研院所沟通对接，共商合作、共谋发展。。西安市委常委、市委秘书长和文强，西安电子科技大学党委书记查显友，西安市委副秘书长濮斌锋，中国科学院西安光机所所长马彩文等陪同考察或参加座谈。区领导吴斌参加。。在西安电子科技大学，王敏与学校党委书记查显友进行座谈，对学校大力支持西电杭研院的建设表示衷心感谢。他指出，西安电子科技大学校史悠久、科研能力顶尖、校友实力雄厚，希望在西电杭研院的校地共建中，能得到学校一如既往的支持，为萧山带来更多高层次、专业性人才，吸引更多西电校友来萧投资。萧山将以高效的政务服务、灵活的市场资本服务好学校以及校友企业，实现双方的合作共赢。查显友表示，西安电子科技大学将持续加强与萧山区的紧密合作，将西电杭研院作为其培养人才、科技研发的重要支点平台，努力为萧山人才培养和经济高质量发展作出贡献。。在中科西安光机所，王敏仔细听取光机所发展历程、科技研发、成果转化等情况，调研学习光机所科技成果产业化模式。王敏在座谈时指出，希望萧山区能够携手中国科学院西安光机所，建立以需求为牵引，产学研相结合的科技成果转化体系，用市场的力量加速助推科研成果面向社会、服务大众。马彩文表示，光机所与萧山区有非常多的契合点，希望双方发挥各自优势，尽早开展合作。。在阎良区航空产业基地，王敏考察调研了中航西飞、试飞院、强度所、兴航航空等航空领域企业和院所，现场了解相关科研技术能力。（莫利锋 孔宇）,政府领导到其他城市考察学习或访问,0.0,True
82,浙江省,杭州市,市领导带队赴桐庐县考察学习,2016-05-12,https://search.zj.gov.cn/jsearchfront/visit/link.do?url=http%3A%2F%2Fwww.linan.gov.cn%2Fart%2F2016%2F5%2F12%2Fart_1366284_12148523.html&q=%E5%AD%A6%E4%B9%A0%E8%80%83%E5%AF%9F%20%E8%80%83%E5%AF%9F%E5%AD%A6%E4%B9%A0&websiteid=330100000000000&title=%E5%B8%82%E9%A2%86%E5%AF%BC%E5%B8%A6%E9%98%9F%E8%B5%B4%E6%A1%90%E5%BA%90%E5%8E%BF%E8%80%83%E5%AF%9F%E5%AD%A6%E4%B9%A0,昨日，市领导王敏、冯镭、沈慧、吴洁静、王翔带领相关部门和部分镇街负责人，赴桐庐县考察招商引资、新农村建设、环境治理、旅游和民宿经济、城市建设等工作。。市委副书记、市长王敏一行先后考察了江南镇荻浦村、环溪村，海康威视安防基地、江南养生文化村项目、海陆世贸电子商务产业园及“春江渡口”众创空间，并到桐庐县城市展示中心了解城市建设发展情况。。在美丽乡村建设中，荻浦村以古建筑保护为抓手，挖掘特色古文化，着力培育“古风狄浦”；环溪村注重治理村容村貌，建设优美生态环境，倾力打造“生态环溪”；闻名遐迩的“生态明珠”既提升了农村人居环境，更让美丽环境与旅游、民宿等美丽经济相辅相成。。位于富春江科技城的海康威视安防基地面积3.48平方公里，基地不以规模拼大小，精致有效比特色，重生产、生态、生活“三生相融”，剑指千亿级产业小镇目标。正在建设中的江南养生文化村以养生村为载体，致力于为全龄段人群提供健康促进服务，现已有7个入驻项目在谈。海陆世贸电子商务产业园重硬件提升和业态整合，在集聚电商的同时，注重孵化培育服务电商发展的服务型企业。“春江渡口”众创空间顺应“双创”需求，整合导师、金融、创投、法律等12个方面的资源，为创客提供全方位、保姆式服务，着力打造桐庐“双创”发动机和新引擎，现已有27家企业入驻。。在两地工作交流会上，方毅介绍了桐庐县概况和抓发展的策略、做法。近年来，桐庐县立足生态优势，以“建设中国最美山水型现代化中等城市”为目标，狠抓生态环境、城乡环境、政务环境；力抓富春江科技城、富春山健康城、迎春商务区、富春江乡村慢生活体验区四大产业主平台和特色小镇、“双创”平台，注重传统产业互联网、物联网改造以及电子商务和快递业发展，培育产业升级。招商引资工作注重发挥平台效应，重人才招引和品质选资，实行县领导每月带队上门招商等一系列机制。旅游产业不断做大“蛋糕”，致力于打造“全域旅游”，实现“千万游客，百亿收入”。同时，政府开放日、空心村二次创业、民间融资改革试点配置、资源要素市场化配置等改革举措颇具特色。。方毅说，桐庐和临安地域相邻、文化相亲，发展有很多相似之处，希望两地多联系交流，共促经济社会更好发展。。王敏介绍了我市概况和“三美临安”建设情况。他说，桐庐城市建设规划起点高、建设手笔大，产业发展注重以重大项目支撑带动，新农村建设做到了精致精细，很多工作经验值得临安借鉴学习。两地发展特色相似，临安相关部门和镇街要进一步“对口”深化考察学习。希望两地加强交流，共同迈上经济社会发展新台阶。。其他 信用中国 临安新闻网 杭州市数据开放平台 临安农林信息网 临安教育网 临安区科学技术协会,昨日，市领导王敏、冯镭、沈慧、吴洁静、王翔带领相关部门和部分镇街负责人，赴桐庐县考察招商引资、新农村建设、环境治理、旅游和民宿经济、城市建设等工作。。市委副书记、市长王敏一行先后考察了江南镇荻浦村、环溪村，海康威视安防基地、江南养生文化村项目、海陆世贸电子商务产业园及“春江渡口”众创空间，并到桐庐县城市展示中心了解城市建设发展情况。。在美丽乡村建设中，荻浦村以古建筑保护为抓手，挖掘特色古文化，着力培育“古风狄浦”；环溪村注重治理村容村貌，建设优美生态环境，倾力打造“生态环溪”；闻名遐迩的“生态明珠”既提升了农村人居环境，更让美丽环境与旅游、民宿等美丽经济相辅相成。。位于富春江科技城的海康威视安防基地面积3.48平方公里，基地不以规模拼大小，精致有效比特色，重生产、生态、生活“三生相融”，剑指千亿级产业小镇目标。正在建设中的江南养生文化村以养生村为载体，致力于为全龄段人群提供健康促进服务，现已有7个入驻项目在谈。海陆世贸电子商务产业园重硬件提升和业态整合，在集聚电商的同时，注重孵化培育服务电商发展的服务型企业。“春江渡口”众创空间顺应“双创”需求，整合导师、金融、创投、法律等12个方面的资源，为创客提供全方位、保姆式服务，着力打造桐庐“双创”发动机和新引擎，现已有27家企业入驻。。在两地工作交流会上，方毅介绍了桐庐县概况和抓发展的策略、做法。近年来，桐庐县立足生态优势，以“建设中国最美山水型现代化中等城市”为目标，狠抓生态环境、城乡环境、政务环境；力抓富春江科技城、富春山健康城、迎春商务区、富春江乡村慢生活体验区四大产业主平台和特色小镇、“双创”平台，注重传统产业互联网、物联网改造以及电子商务和快递业发展，培育产业升级。招商引资工作注重发挥平台效应，重人才招引和品质选资，实行县领导每月带队上门招商等一系列机制。旅游产业不断做大“蛋糕”，致力于打造“全域旅游”，实现“千万游客，百亿收入”。同时，政府开放日、空心村二次创业、民间融资改革试点配置、资源要素市场化配置等改革举措颇具特色。。方毅说，桐庐和临安地域相邻、文化相亲，发展有很多相似之处，希望两地多联系交流，共促经济社会更好发展。。王敏介绍了我市概况和“三美临安”建设情况。他说，桐庐城市建设规划起点高、建设手笔大，产业发展注重以重大项目支撑带动，新农村建设做到了精致精细，很多工作经验值得临安借鉴学习。两地发展特色相似，临安相关部门和镇街要进一步“对口”深化考察学习。希望两地加强交流，共同迈上经济社会发展新台阶。。其他 信用中国 临安新闻网 杭州市数据开放平台 临安农林信息网 临安教育网 临安区科学技术协会,政府领导到其他城市考察学习或访问,0.0,True
82,浙江省,杭州市,王敏带队赴柯桥古镇学习考察,2024-03-22,https://search.zj.gov.cn/jsearchfront/visit/link.do?url=http%3A%2F%2Fwww.xiaoshan.gov.cn%2Fart%2F2024%2F3%2F22%2Fart_1302903_59098784.html&q=%E5%AD%A6%E4%B9%A0%E8%80%83%E5%AF%9F%20%E8%80%83%E5%AF%9F%E5%AD%A6%E4%B9%A0&websiteid=330100000000000&title=%E7%8E%8B%E6%95%8F%E5%B8%A6%E9%98%9F%E8%B5%B4%E6%9F%AF%E6%A1%A5%E5%8F%A4%E9%95%87%E5%AD%A6%E4%B9%A0%E8%80%83%E5%AF%9F,昨日下午，市委常委、区委书记王敏带队赴绍兴市柯桥区柯桥古镇学习考察。柯桥区委书记陈豪，萧山区领导陈龙宁、杨新程，柯桥区领导成诚参加。。作为浙江省首批十八个省级“历史文化街区”之一的柯桥古镇，于2014年底全面启动古镇保护和更新工作。柯桥古镇项目以“柯桥老底片，城市新客厅”为总体定位，在保护柯桥古镇记忆、挖掘历史文化特色基础上，把传统建筑与现代城市功能相结合，展现旧时柯桥集市的盛况。项目于2021年正式对外营业，重点策划了“柯桥古镇十二风雅集”主题活动，有效推动了城市夜经济的发展与本地文旅生活体验感的提升，成为了柯桥区的一张金名片。2023年，柯桥古镇游客接待量超520万人次。。王敏一行兴致勃勃参观了柯桥古镇“三桥四水”、丝茶雅舍、盘古化石馆等不同类型的文化空间和主题店铺，详细了解古镇业态、文旅产业运营情况。随后，王敏主持召开座谈会，与柯桥区领导、项目运营方开元旅业负责人就文旅产业发展、柯桥古镇规划建设运营进行深入交流，对柯桥古镇超前的规划布局、丰富的文旅业态以及柯桥区政企联动合力打响柯桥古镇品牌予以赞赏。。王敏指出，推动农文旅深度融合发展，是实现乡村振兴、共享美好生活的重要路径。萧山山水相宜、古今交汇，拥有不少可游、可逛、可玩、可忆的古镇资源。要认真学习借鉴柯桥古镇保护开发利用建设的先进经验，通过整合政府、社会和企业各方资源，深入谋划、高效推进萧山古镇的保护与开发，加快柯桥古镇的成功运营模式在萧山复制推广，把萧山的古镇真正打造成能让人们领略山水之美、品鉴人文之韵、引领时尚之潮的向往之地。（莫利锋 王荣）,昨日下午，市委常委、区委书记王敏带队赴绍兴市柯桥区柯桥古镇学习考察。柯桥区委书记陈豪，萧山区领导陈龙宁、杨新程，柯桥区领导成诚参加。。作为浙江省首批十八个省级“历史文化街区”之一的柯桥古镇，于2014年底全面启动古镇保护和更新工作。柯桥古镇项目以“柯桥老底片，城市新客厅”为总体定位，在保护柯桥古镇记忆、挖掘历史文化特色基础上，把传统建筑与现代城市功能相结合，展现旧时柯桥集市的盛况。项目于2021年正式对外营业，重点策划了“柯桥古镇十二风雅集”主题活动，有效推动了城市夜经济的发展与本地文旅生活体验感的提升，成为了柯桥区的一张金名片。2023年，柯桥古镇游客接待量超520万人次。。王敏一行兴致勃勃参观了柯桥古镇“三桥四水”、丝茶雅舍、盘古化石馆等不同类型的文化空间和主题店铺，详细了解古镇业态、文旅产业运营情况。随后，王敏主持召开座谈会，与柯桥区领导、项目运营方开元旅业负责人就文旅产业发展、柯桥古镇规划建设运营进行深入交流，对柯桥古镇超前的规划布局、丰富的文旅业态以及柯桥区政企联动合力打响柯桥古镇品牌予以赞赏。。王敏指出，推动农文旅深度融合发展，是实现乡村振兴、共享美好生活的重要路径。萧山山水相宜、古今交汇，拥有不少可游、可逛、可玩、可忆的古镇资源。要认真学习借鉴柯桥古镇保护开发利用建设的先进经验，通过整合政府、社会和企业各方资源，深入谋划、高效推进萧山古镇的保护与开发，加快柯桥古镇的成功运营模式在萧山复制推广，把萧山的古镇真正打造成能让人们领略山水之美、品鉴人文之韵、引领时尚之潮的向往之地。（莫利锋 王荣）,政府领导到其他城市考察学习或访问,0.0,True
