code,province,city,topic,date,url,content,content.1,label,score,is_match
82,浙江省,杭州市,桐乡市党政考察团来临考察生态文明建设,2010-10-13,https://search.zj.gov.cn/jsearchfront/visit/link.do?url=http%3A%2F%2Fepb.hangzhou.gov.cn%2Fart%2F2010%2F10%2F13%2Fart_1692259_38267925.html&q=%E5%AD%A6%E4%B9%A0%E8%80%83%E5%AF%9F%20%E8%80%83%E5%AF%9F%E5%AD%A6%E4%B9%A0&websiteid=330100000000000&title=%E6%A1%90%E4%B9%A1%E5%B8%82%E5%85%9A%E6%94%BF%E8%80%83%E5%AF%9F%E5%9B%A2%E6%9D%A5%E4%B8%B4%E8%80%83%E5%AF%9F%E7%94%9F%E6%80%81%E6%96%87%E6%98%8E%E5%BB%BA%E8%AE%BE,10月12日，由桐乡市委书记费建文、市长朱海平带领的党政考察团来我市考察学习。市领导王宏、陈法生、卞吉安、胡竑、陈林春、朱霞生、李文钢、翁东潮陪同考察并出席两地工作交流会。。考察团一行实地考察了玲珑街道浙江帝龙新材料股份有限公司和锦城街道钱王铺村，观看了省科创基地（科技城）专题片。在两地工作交流会上，市委副书记、市长王宏代表市委、市政府对考察团的到来表示欢迎。他从区域交通、生态环境、历史文化、物产资源等方面向考察团一行简要介绍了我市经济社会发展情况。王宏说，近年来，我市坚持以融入大都市为主线，依托生态优势、依靠科技创新，加快转型升级科学发展，突出做好“山绿”、“水韵”、“业兴”、“城美”、“人和”五篇文章，初步探索出了一条生态经济化、经济生态化的发展路子，着力建设生态文明；当前，全市上下正全力以赴推进省科创基地(科技城)建设。“十二五”期间，我市将以省科创基地(科技城)建设为契机，进一步高举生态和科技两面大旗，努力打造智慧临安、生态临安、幸福临安。。王宏说，临安与桐乡同处长三角重要区域，桐乡在抢抓机遇、接轨大上海、做强做大块状经济、加快城乡统筹发展，着力建设长三角的经济强市、江南水乡的文化名市、和谐发展的文明新市中创造的很多好经验、好做法，值得临安学习借鉴。希望今后两地能进一步加强交流合作，在生态文明建设之路上共同描绘美好未来。。费建文代表考察团对我市的热情接待表示感谢。费建文说，考察团对我市深抓生态文明建设所做的工作深有感触，始终坚持“生态兴市、生态立市”的发展理念令人钦佩；高举生态和科技两面大旗，发展思路十分清晰，针对性强；抓生态文明建设各项措施有力，生态建设取得了明显成效，给考察团留下了深刻印象。他希望今后双方能取长补短，共同推进两地经济社会科学发展。,会议指出，在全面贯彻落实党的二十大精神开局之年，在“八八战略”实施20周年之际，习近平总书记再次亲临浙江考察指导，出席杭州亚运会开幕式，举行一系列重要外事活动，是浙江改革发展历程中具有里程碑意义的一件大事，充分体现了习近平总书记对浙江和浙江人民的深情大爱、如山厚望，充分展现了习近平总书记治国理政的远见卓识、高超艺术。要满怀忠诚感恩之心，全面学习宣传贯彻落实，坚决把习近平总书记对浙江的深情厚爱、对浙江工作的肯定与勉励，转化为全区干部群众干在实处、走在前列、勇立潮头的强大动力和充足底气，坚定不移深入实施“八八战略”，纵深推进杭州城市重要新中心建设，奋力展现中国式现代化城市范例的头雁风采，为谱写中国式现代化浙江新篇章作出新的更大贡献。。会议强调，要牢记嘱托、感恩奋进，在学深悟透习近平总书记重要讲话精神上汲取思想伟力。要深刻认识习近平总书记考察浙江的政治意义、历史意义和现实意义，深刻感悟习近平总书记对之江大地的深情厚爱、如山厚望和关心关怀，深刻领会习近平总书记重要讲话精神的深刻内涵、精髓要义和实践要求，以实际行动坚定捍卫“两个确立”、坚决做到“两个维护”。要全面对标、真抓实干，在贯彻落实习近平总书记重要讲话精神上展现大区担当。坚决扛起大区要为大局挑大梁的使命担当，聚焦“在以科技创新塑造发展新优势上走在前列”“在推进共同富裕中先行示范”“在深化改革、扩大开放上续写新篇”“在建设中华民族现代文明上积极探索”“坚持和加强党的全面领导、加强和改进党的建设”等五方面的重要要求，全面对标对表，结合余杭实际、发挥固有优势，努力在创新驱动发展、推进共同富裕、深化改革开放、建设现代文明、全面加强党的建设上当先锋、作示范。要精心组织、周密部署，在学习宣传习近平总书记重要讲话精神上迅速掀起热潮。要把学习好、宣传好、贯彻好习近平总书记考察浙江重要讲话精神，作为当前和今后一个时期的头等大事和首要政治任务，作为开展主题教育的必学教材和党员干部理论培训的必学课程。区委常委会成员率先垂范、示范引领，带头学深悟透、带头宣传宣讲、带头深入调研、带头真抓实干，依托各类学习载体，分层次、多形式把习近平总书记重要讲话精神尽快传达到每一个党支部、每一名党员，同时要充分发挥区委党校、社科联作用，加强理论研究，确保习近平总书记重要讲话精神在余杭落地生根、开花结果。,其他,0.5845993075329866,True
82,浙江省,杭州市,,2020-12-03,https://search.zj.gov.cn/jsearchfront/visit/link.do?url=http%3A%2F%2Fwww.hzsc.gov.cn%2Fart%2F2020%2F12%2F3%2Fart_1229554174_3904740.html&q=%E5%AD%A6%E4%B9%A0%E8%80%83%E5%AF%9F%20%E8%80%83%E5%AF%9F%E5%AD%A6%E4%B9%A0&websiteid=330100000000000&title=%E6%98%86%E6%98%8E%E5%B8%82%E5%85%9A%E6%94%BF%E4%BB%A3%E8%A1%A8%E5%9B%A2%E8%B5%B4%E6%96%B0%E5%A1%98%E5%AE%89%E7%BD%AE%E6%88%BF%E9%A1%B9%E7%9B%AE%E8%80%83%E5%AF%9F%E6%8B%86%E5%90%8E%E5%9C%9F%E5%9C%B0%E7%BB%BC%E5%90%88%E5%88%A9%E7%94%A8%E6%83%85%E5%86%B5,12月2日上午，由昆明市委副书记、市长王喜良率领的昆明市党政代表团一行赴新塘06地块安置房项目，考察拆后土地综合利用情况。江干区代区长冯晶，区政府办、区城改办、彭埠街道、运河江干指挥部办公室相关负责人陪同考察。。运河江干指挥部办公室主任付选央，向昆明市党政代表团详细介绍了新塘区块拆后土地综合利用情况。双方就征迁和回迁安置政策、资金筹措和平衡方式、安置房和配套建设模式等方面进行了互动交流、深入探讨。在实地考察后，昆明市党政代表团充分肯定了江干区拆后土地综合利用相关工作的成效，并表示要学习借鉴优秀的工作方法，不断总结经验、加强工作交流。,会上，毛永欣副书记带领全体民警学习了浙江发布“浙江省委常委扩大会议贯彻习近平在浙考察重要讲话精神”一文和杭州发布“杭州市委常委扩大会议传达学习习近平在浙江、杭州考察重要讲话精神”。要求全体民警以“八八战略”为统领，推进“五位一体”总体布局，并结合派出所工作实际，不折不扣地把习近平总书记的重要讲话精神落到工作实处。,其他,0.5946228738328421,True
82,浙江省,杭州市,镇江市领导考察御街二十三坊综保工程,2013-03-25,https://search.zj.gov.cn/jsearchfront/visit/link.do?url=http%3A%2F%2Fwww.hzsc.gov.cn%2Fart%2F2013%2F3%2F25%2Fart_1267764_4467135.html&q=%E5%AD%A6%E4%B9%A0%E8%80%83%E5%AF%9F%20%E8%80%83%E5%AF%9F%E5%AD%A6%E4%B9%A0&websiteid=330100000000000&title=%E9%95%87%E6%B1%9F%E5%B8%82%E9%A2%86%E5%AF%BC%E8%80%83%E5%AF%9F%E5%BE%A1%E8%A1%97%E2%80%A2%E4%BA%8C%E5%8D%81%E4%B8%89%E5%9D%8A%E7%BB%BC%E4%BF%9D%E5%B7%A5%E7%A8%8B,2月21日下午，由江苏省镇江市委副书记、市长朱晓明率领的考察团一行，在副市长俞东来的陪同下，来我区御街·二十三坊考察历史街区综保工程。区委书记陈红英，区委常委叶素等陪同考察。朱晓明一行首先来到御街·二十三坊中的严官巷口，从严官巷步行至白马庙巷考察。“卖鱼灯、雕花、养蚕……”朱晓明看到在巷内两侧墙上，我区民间艺人为御街·二十三坊绘制的黑色简笔画，以及居民们在自家门口用柴火、磨盘等装饰营造出的旧时市井气息后说：“描绘的都是中国民间传统老手艺、老风俗，装饰得也很用心，看着特别有意境、有味道。”随后，朱晓明一行走出白马庙巷，沿十五奎巷，来到丁衙巷内的瑞石亭民居，走进居民家中进行新春问候，并倾听大家对二十三坊整治后带来舒适、便利生活的欢乐心声。考察期间，镇江市考察团对我区历史街区保护和城市建设的各个方面所取得的成绩不断表示赞赏，认为上城区的历史建筑底子好，工作基础好、起步高。城区居民对历史保护工程的拥护和支持，给人留下了深刻印象，考察收获很大，回去后将学习上城的做法，把城市建设工作做好。陈红英书记衷心感谢朱市长一行在新年后不久，就亲临我区考察指导。她希望镇江市和上城区相互学习、相互帮助、相互借鉴，共同做好历史街区保护，并在经济社会发展的各项工作中，多交流互动，共同取得新的更大的成绩。 （改善办 计慎忆）。二十三坊考察历史街区综保工程。区委书记陈红英，区委常委叶素等陪同考察。朱晓明一行首先来到御街。随后，朱晓明一行走出白马庙巷，沿十五奎巷，来到丁衙巷内的瑞石亭民居，走进居民家中进行新春问候，并倾听大家对二十三坊整治后带来舒适、便利生活的欢乐心声。考察期间，镇江市考察团对我区历史街区保护和城市建设的各个方面所取得的成绩不断表示赞赏，认为上城区的历史建筑底子好，工作基础好、起步高。城区居民对历史保护工程的拥护和支持，给人留下了深刻印象，考察收获很大，回去后将学习上城的做法，把城市建设工作做好。陈红英书记衷心感谢朱市长一行在新年后不久，就亲临我区考察指导。她希望镇江市和上城区相互学习、相互帮助、相互借鉴，共同做好历史街区保护，并在经济社会发展的各项工作中，多交流互动，共同取得新的更大的成绩。,为充分发挥知识产权行政管理部门和维权援助中心等在化解知识产权矛盾纠纷方面的积极作用，保障权利人维权，化解矛盾、构建和谐社会、促进社会管理创新，推进知识产权强市建设。6月14日-15日，冯镭副局长带领知识产权处。月14日上午，冯镭副局长一行考察了宁波知识产权综合运用和保护第三方平台及宁波市知识产权服务基地，并与宁波市知识产权局副局长杨。、宁波市科技信息研究院院长张国成、宁波市中级人民法院民四庭副厅长毛明强进行了座谈交流。。月15日上午，冯镭副局长一行考察了温州知识产权服务园、中国（温州）知识产权维权援助中心并与温州市知识产权局匡连庭副局长、温州市知识产权学院、温州市中级人民法院负责人进行了座谈交流。。通过学习调研，考察组对宁波、温州两地开展知识产权诉调对接工作以及机构设置、运作模式、工作流程和成功经验有了深入了解和认识，两地立足本地知识产权执法优势和现有第三方平台的诉调优势开展积极有效的知识产权诉调对接工作，取得的成功经验和做法值得我市学习借鉴。。我局也将利用现有的条件对建立知识产权立体保护网络，加强与法院的协作，积极开展知识产权诉调对接工作，进行有益探索和尝试。,政府领导到其他城市考察学习或访问,0.0,True
82,浙江省,杭州市,常州市考察团来临调研,2020-08-28,https://search.zj.gov.cn/jsearchfront/visit/link.do?url=http%3A%2F%2Fwww.linan.gov.cn%2Fart%2F2020%2F8%2F28%2Fart_1366281_55693610.html&q=%E5%AD%A6%E4%B9%A0%E8%80%83%E5%AF%9F%20%E8%80%83%E5%AF%9F%E5%AD%A6%E4%B9%A0&websiteid=330100000000000&title=%E5%B8%B8%E5%B7%9E%E5%B8%82%E8%80%83%E5%AF%9F%E5%9B%A2%E6%9D%A5%E4%B8%B4%E8%B0%83%E7%A0%94,26日，江苏省常州市委副书记蔡骏、副市长许峥带领考察团来临调研。区委副书记、代区长杨国正，副区长王栋陪同调研。。考察团一行实地走访了高虹镇“龙门秘境”示范型村落景区。“龙门秘境”揽聚石门、龙上、大山三个行政村，通过综合改革和项目建设，做深“生态秘境、攀岩圣地、运动山乡、传统村落”文章，全面打响“百年大梯田、千年古村落、万年峭岩壁、亿年巨石阵”乡村旅游品牌。考察团一行通过实地参观、听取介绍、切身体验等方式，全面了解和感受“龙门秘境”的规划建设和发展变化。。蔡骏在调研过程中表示，这次调研考察团收获很大。常州近年来大力推进美丽乡村建设，农村环境得到明显改善和提升，但从“建设”到“运营”还有待突破。临安在建设美丽镇村推动乡村振兴过程中有不少好做法、好模式，尤其是在联村抱团发展、市场化运营模式、特色产业培育、村落景区品牌打造等方面形成的宝贵经验，是非常有价值的。考察团要好好学习和借鉴，更好地推动乡村可持续发展。。杨国正对常州市考察团来临调研表示欢迎。他说，常州是江苏乃至长江三角洲地区中心城市之一、先进制造业基地和文化旅游名城，在城市建设、产业发展等方面有很多经验做法值得临安学习。希望两地能够在长三角一体化发展中，把握机遇，加强交流，开展多层次、多形式的互动合作。。其他 信用中国 临安新闻网 杭州市数据开放平台 临安农林信息网 临安教育网 临安区科学技术协会,仲春，惠风和煦，万物苏醒，一年之计在于春，正是学习、计划、筹备的大好时机。为了能让一年的园林彩化工作亮眼出彩，认真细致的筹办好近在眼前的钱王祠夏秋花展，3月29-30日，杭州西湖风景名胜区湖滨管理处园林线相关技术员在分管领导带领下，赴上海辰山植物园考察学习“2018上海辰山植物园国际兰展”的花展布置。期间，侧重学习花展中景观小品布置手法、花卉品种搭配应用、色彩层次设计方式以及养护管理相关措施，并学习了辰山植物园内樱花大道、郁金香花带、“琴键式”花境、专类园区的规划布置手法等。考察使得大家灵感迸发，迫不及待得想付诸于实际布展中去。。与此同时，针对夏秋花展所需植物素材，考察人员随后赴“虹越花卉基地”精心挑选新颖的铁线莲品种：包括花色呈紫绿相间的“新幻紫”，如银铃状悬挂的“小仙女”，拥有独特绿色花朵的“美岛绿”，花色纯白冰清玉洁的“爱丁堡公爵夫人”等等……,其他,0.5961538100439998,True
82,浙江省,杭州市,济南市党政代表团赴我区考察,2017-05-05,https://search.zj.gov.cn/jsearchfront/visit/link.do?url=http%3A%2F%2Fwww.hzsc.gov.cn%2Fart%2F2017%2F5%2F5%2Fart_1267763_6901701.html&q=%E5%AD%A6%E4%B9%A0%E8%80%83%E5%AF%9F%20%E8%80%83%E5%AF%9F%E5%AD%A6%E4%B9%A0&websiteid=330100000000000&title=%E6%B5%8E%E5%8D%97%E5%B8%82%E5%85%9A%E6%94%BF%E4%BB%A3%E8%A1%A8%E5%9B%A2%E8%B5%B4%E6%88%91%E5%8C%BA%E8%80%83%E5%AF%9F,5月3日下午，由山东省委副书记、济南市委书记王文涛，市委副书记、市长王忠林率领的党政代表团一行赴我区考察城市建设、规划、管理，及项目建设等情况。省委常委、市委书记赵一德，区领导金承涛、薛鸿翔、孙刚锋、毛素云等陪同。。考察团一行来到基金小镇二期展示中心，认真听取小镇从起步建设到目前的拓展规划等相关情况的介绍，对小镇为企业提供的特色服务等进行详细了解。随后，考察团一行实地走访小镇入驻企业浙银资本和杭州联创两家企业，同企业负责人热情交谈，并对将来的合作表示期待。小镇内舒适完美的办公环境、贴合企业运营模式的管理、以及充足的软硬件设施等都给考察团一行留下深刻的印象。。接着，考察团一行来到西湖大道，对我区的环境整治工程和整洁有序的街容街貌给予充分肯定，认为西湖大道作为杭城重要的迎宾大道，凸显了精巧、精细、素雅的江南韵味。沿着西湖大道前行，在口袋公园门口，区城管局的“贴心城管”志愿者正在开展送“暖心茶”活动，志愿者们热情洋溢的笑脸、细致入微的服务，赢得了考察团的点赞。。最后，考察团来到馒头山和思鑫坊。通过道路整治、落架大修、违章拆除等，馒头山从原来的破旧脏乱变成现在的白墙黛瓦、古树成荫，实现了美丽蝶变；整齐的建筑、灰色的砖瓦、独特的庭院，思鑫坊在经过整治后也告别了之前的破烂里弄，重拾优雅。考察团表示，上城区这一系列的惠民工程，给居民群众生活带来了实实在在的改善，深受启发。。赵一德说，杭州正抢抓后峰会机遇，全面推进城市建设、产业转型和社会治理，加快城市国际化步伐。我们将学习借鉴济南在城市建设管理等方面经验做法，把工作做得更精细更扎实更富成效。王文涛说，后峰会的杭州，城市建设管理水平大大提升，既有良好生态环境，又充满创新活力。希望两市相互学习借鉴，实现共同发展。,一是开展创业辅导。邀请浙临律师事务所、百酷网等单位负责人，开展初创企业相关法律讲座、创业典型经验介绍、道网村村创业服务计划推广。二是提供政策解读。邀请市信用联社、杭州团市委相关负责人进行信贷政策及金融诚信宣讲、青年就业创业政策解读；三是组织考察学习。组织农村青年，赴萧山大棚蔬菜种植基地、甲鱼养殖场以及临安名特优农产品杭州直销中心实地考察，学习创业经验。。其他 信用中国 临安新闻网 杭州市数据开放平台 临安农林信息网 临安教育网 临安区科学技术协会,其他,0.6382506581211661,True
82,浙江省,杭州市,卢春强带队赴智利阿根廷考察招商,2018-06-29,https://search.zj.gov.cn/jsearchfront/visit/link.do?url=http%3A%2F%2Fwww.linan.gov.cn%2Fart%2F2018%2F6%2F29%2Fart_1366280_18943082.html&q=%E5%AD%A6%E4%B9%A0%E8%80%83%E5%AF%9F%20%E8%80%83%E5%AF%9F%E5%AD%A6%E4%B9%A0&websiteid=330100000000000&title=%E5%8D%A2%E6%98%A5%E5%BC%BA%E5%B8%A6%E9%98%9F%E8%B5%B4%E6%99%BA%E5%88%A9%E9%98%BF%E6%A0%B9%E5%BB%B7%E8%80%83%E5%AF%9F%E6%8B%9B%E5%95%86,近日，区委书记卢春强带领区发改局、经信局及相关街道负责人，赴智利、阿根廷考察城市建设并开展招商引资活动。。卢春强一行实地考察了智利首都圣地亚哥，与圣地亚哥市长等政府官员座谈交流。圣地亚哥是智利的首都和最大城市，东依安第斯山，西距瓦尔帕来索港约100公里。它也是智利的经济中心，惠普、英特尔、可口可乐、联合利华、雀巢、微软、雅虎等一批跨国企业都将区域总部选择设在圣地亚哥，有力带动了当地经济发展。卢春强在与圣地亚哥市政府官员交流时表示，圣地亚哥有很多方面值得临安学习借鉴，希望两地加强经贸往来，并在产业发展、城市建设、社会治理等方面推进交流合作。。到阿根廷后，卢春强等实地考察了布宜诺斯艾利斯的城市建设。布宜诺斯艾利斯是阿根廷的最大城市，2007年在全球最美城市评选中名列第三。其城市规划到位，基础设施和城市功能相当完善，街道宽阔整齐，绿荫如盖，市民公共活动空间充分。同时，老城改造颇有特色，既保留历史风貌，又融合现代功能，别有韵味。卢春强在考察时指出，要深入学习布宜诺斯艾利斯城市建设和旧城改造经验，结合临安实际，更好地推进临安城市国际化。在布宜诺斯艾利斯马科斯帕兹市考察时，区领导还与当地政府官员就跨境电商合作展开交流，希望推进两地特色产品的跨境贸易。。在阿根廷，卢春强一行还前往卡拉法特，考察小镇建设。卡拉法特是阿根廷非常有特色的小镇。小镇只有一条主街，规划管控严格，全部为各具特色的低层建筑，依地势而建，较好地保留自然风貌，“城市家具”往往就地取材，与环境相融。卢春强要求，临安特色小镇建设要学习卡拉法特的成功经验，严格规划执行，深挖当地文化，在“特”字上做文章，提升核心竞争力。。在智利和阿根廷期间，卢春强还分别上门拜访了南都电源的合作伙伴智利麦丘克能源有限公司和阿根廷大数据能源有限公司，希望进一步拓展南美市场，提升临安产品的市场占有率，推动临安外贸更好发展。卢春强还鼓励南都电源，加大国际市场开拓力度，推进企业做强做大。。其他 信用中国 临安新闻网 杭州市数据开放平台 临安农林信息网 临安教育网 临安区科学技术协会,日前，临安市科技局组织镇街、部门科技分管领导和专利联络员到江苏吴江考察，双方就科技企业孵化器、知识产权等工作进行了经验交流和探讨。 在经验交流会上，我市科技局相关负责人介绍了近年来我市科技工作概况。吴江科技局主要介绍了高新技术产业发展、科创园建设、知识产权示范市建设等情况。我市科技局相关负责人最后表示，吴江的知识产权工作处于全国前列，科技工作有很多经验和做法值得临安学习和借鉴，希望能与吴江进一步加强交流与合作。 会后，考察团一行还参观了吴江科创园。 本次考察活动学习了先进地区科技工作经验，对进一步提高我市镇街、部门科技分管领导的工作水平，建设创新型城市起到一定推动作用。（临安市科技局）,政府领导到其他城市考察学习或访问,0.0,True
