code,province,city,topic,date,url,content,content.1,label,score,is_match
82,浙江省,杭州市,佟桂莉常委带队赴外地学习考察杭州城西科创产业集聚区,2014-11-07,https://search.zj.gov.cn/jsearchfront/visit/link.do?url=http%3A%2F%2Fcxkc.hangzhou.gov.cn%2Fart%2F2014%2F11%2F7%2Fart_1228965235_39965211.html&q=%E5%AD%A6%E4%B9%A0%E8%80%83%E5%AF%9F%20%E8%80%83%E5%AF%9F%E5%AD%A6%E4%B9%A0&websiteid=330100000000000&title=%E4%BD%9F%E6%A1%82%E8%8E%89%E5%B8%B8%E5%A7%94%E5%B8%A6%E9%98%9F%E8%B5%B4%E5%A4%96%E5%9C%B0%E5%AD%A6%E4%B9%A0%E8%80%83%E5%AF%9F%20-%20%E6%9D%AD%E5%B7%9E%E5%9F%8E%E8%A5%BF%E7%A7%91%E5%88%9B%E4%BA%A7%E4%B8%9A%E9%9B%86%E8%81%9A%E5%8C%BA,为认真贯彻落实省委常委会专题研究杭州工作会议精神，加快推进城西科创区整体发展、提升发展，根据全市“三转一争”活动统一部署和近期“大讨论、大对标，大调研、大对接”活动安排，近日，市委常委、杭州城西科创产业集聚区党工委书记佟桂莉带队赴外地学习考察。。在合肥市，佟桂莉常委一行专程到合肥高新区考察，先后到科大讯飞、中国科学技术大学先进技术研究院等企业、研究院调研，考察合肥高新区规划建设、产业发展等情况，并与合肥市领导进行了座谈交流。合肥市委常委、常务副市长韩冰，合肥市政府副秘书长、办公厅主任秦继平等，陪同考察和座谈。合肥高新区负责同志详细介绍了高新区近年来在规划引领、科学谋划，积极完善城市配套功能、坚持“产城融合”建设，以及建设管理模式、“智慧高新”建设等方面的成功经验。佟桂莉常委简要地介绍了杭州市经济社会发展概况，以及正在争创跨境电子商务综合试验区和国家自主创新示范区、加快推进信息经济“一号工程”等情况，着重介绍了杭州城西科创产业集聚区建设发展情况。。在松江区，佟桂莉常委一行先后考察了广富林遗址园区和泰晤士小镇。据了解，2009年5月动工开发建设的广富林遗址公园，出于对“上海之根”的保护和发掘，打造“根”文化，扩大影响力，并以此带动相关产业蓬勃发展。规划建设1平方公里的泰晤士小镇，由连续的多功能步行街以及湖畔英式广场形成的主轴线，集合商业配套、会所医院、超市教堂各类公建设施，整个小镇有20多万平方米公共配套及商业服务设施，各类创意产业生根发芽，特色小镇建设富有成效。。考察期间，佟桂莉常委强调，杭州城西科创产业集聚区一定要以省委常委会专题研究杭州工作会议精神为动力，按照市委“三转一争”活动要求，抓好“大讨论、大对标，大调研、大对接”工作，既要善于向先进看齐，更要找准自身发展优势和方向，认真谋划好明年发展思路，努力在全市争创“两区”、推进“一号工程”等中心工作中发挥更大的作用，实现高起点上的新发展，为全市、全省经济转型发展作出积极贡献。,9月27日上午，局党组召开理论学习中心组（扩大）会议，传达学习习近平总书记考察浙江重要讲话精神和上级有关会议精神，部署全市交通运输系统贯彻落实工作。会议还围绕习近平总书记在黑龙江考察时的重要讲话精神、习近平重要文章《扎实推动教育强国建设》等内容开展专题学习研讨。局党组书记、局长郑翰献主持会议并讲话。局党组成员、副局长陈健作交流发言，局机关处室、直属单位相关负责人作书面交流。局党组班子成员、局机关各处室、各直属单位负责人参加。。会议指出，习近平总书记在考察浙江时发表的重要讲话和作出的系列重要指示，为我们做好各项工作指明了前进方向、提供了根本遵循。全市交通运输系统要深入学习领会习近平总书记考察浙江重要讲话精神的深刻内涵、精髓要义和实践要求，把学习宣传贯彻习近平总书记的重要讲话精神作为当前和今后一个时期的首要政治任务，迅速掀起学习宣传贯彻热潮，不断厚植牢记嘱托、感恩奋进的忠诚与担当，坚定不移沿着习近平总书记指引的道路奋勇前进。。会议强调，要领会把握习近平总书记关于“在以科技创新塑造发展新优势上走在前列”的重要要求，努力在深化创新驱动发展上走在前、作示范；领会把握习近平总书记关于“在推进共同富裕上先行示范”的重要要求，努力在推进共同富裕示范区建设上走在前、作示范；领会把握习近平总书记关于“在深化改革扩大开放上续写新篇”的重要要求，努力在增创体制机制新优势上走在前、作示范；领会把握习近平总书记关于“在建设中华民族现代文明上积极探索”的重要要求，努力在提升文化软实力上走在前、作示范；领会把握习近平总书记关于“坚持和加强党的全面领导、加强和改进党的建设”的重要要求，努力在以高质量党建推动高质量发展上走在前、作示范。。会议强调，要用心感悟习近平总书记亲临浙江考察和出席亚运会开幕式的重大意义，切实增强坚定捍卫“两个确立”、坚决做到“两个维护”的思想自觉政治自觉行动自觉，切实把习近平总书记的关心关怀转化为干在实处走在前列勇立潮头的强大精神动力。要学习领会习近平总书记向全球可持续交通高峰论坛致的重要贺信精神，立足杭州交通实际，加快建设安全、便捷、高效、绿色、经济、包容、韧性的可持续交通体系。当前，聚焦打赢亚运攻坚仗和经济翻身仗，扎实做好杭州亚运会、亚残运会交通保障工作，确保完成全年目标任务，奋力交出高分报表。要贯彻落实习近平总书记关于防汛救灾系列重要指示精神，继续发挥专业敬业、善谋善战、担当实干、为民奉献的交通精神，全力保障人民生命财产安全。,其他,0.7128844904822474,True
82,浙江省,杭州市,增进区域交流优化健康服务贵州陕西代表团来上城区考察学习,2016-09-18,https://search.zj.gov.cn/jsearchfront/visit/link.do?url=http%3A%2F%2Fwww.hzsc.gov.cn%2Fart%2F2016%2F9%2F18%2Fart_1268020_35261708.html&q=%E5%AD%A6%E4%B9%A0%E8%80%83%E5%AF%9F%20%E8%80%83%E5%AF%9F%E5%AD%A6%E4%B9%A0&websiteid=330100000000000&title=%E5%A2%9E%E8%BF%9B%E5%8C%BA%E5%9F%9F%E4%BA%A4%E6%B5%81%20%E4%BC%98%E5%8C%96%E5%81%A5%E5%BA%B7%E6%9C%8D%E5%8A%A1%E2%80%94%E2%80%94%E8%B4%B5%E5%B7%9E%E3%80%81%E9%99%95%E8%A5%BF%E4%BB%A3%E8%A1%A8%E5%9B%A2%E6%9D%A5%E4%B8%8A%E5%9F%8E%E5%8C%BA%E8%80%83%E5%AF%9F%E5%AD%A6%E4%B9%A0,为居民建立电子健康档案、推行居家医疗服务、打造“健康医疗城”……作为杭州市建设健康城市首批试点城区，近年来，上城区在推进医疗服务建设方面成效明显，与各地区交流互动日益频繁，越来越多的地区前来学习考察。。6月7日，贵州省凯里市委常委、副市长姜永柱，副市长李玉泓一行，在杭州市卫计委党委副书记、副主任孙雍容，上城区人民政府副区长马彦等领导的陪同下考察了浙江豪懿集团旗下的“上城区建国南路中医街”项目。考察团一行参观了中医街的一批名医工作室、中医养生馆，对集中医技艺发展、文化传承、中医药旅游为一体的中医药特色街区大为赞赏。。6月21日，陕西省安康市孙矿玲副市长率领的考察团一行9人来到南星街道社区卫生服务中心考察学习医养护工作。杭州市卫生计生委家庭处处长厉敏、上城区卫计局副局长李世宏等领导陪同。李世宏副局长代表上城区就医养护一体化签约服务工作内容和特色向考察团作了详细汇报，双方就探索医养融合、全科签约服务工作进行了深入探讨。。人来到南星街道社区卫生服务中心考察学习医养护工作。杭州市卫生计生委家庭处处长厉敏、上城区卫计局副局长李世宏等领导陪同。李世宏副局长代表上城区就医养护一体化签约服务工作内容和特色向考察团作了详细汇报，双方就探索医养融合、全科签约服务工作进行了深入探讨。。近年来，上城区以中医医疗为基础，通过中医文化、名医技艺等传承，着力建设特色中医一条街，向市民朋友们展示特色中医文化，为杭州百姓乃至全国各地患者服务。同时，为提升居民健康品质，引导居民合理有序就医，上城区整合信息资源，从促进宣传、考核和人员培训“三促进”推进医养护一体化签约服务，逐步构建和完善了“社区首诊、双向转诊、康复回社区”的诊疗格局。,4月3日至4日，松阳县教育局组织全县中小学校长赴嵊州市、景宁县学习考察教师“县管校聘” 改革经验。县编办、人社、财政、教育等部门相关人员一同考察。。考察组一行分别在嵊州市和景宁县听取了相关部门、教育局和代表学校等关于中小学教师“县管校聘”管理改革工作的经验介绍，双方就学校层面组织开展“县管校聘”的具体做法，教育行政部门如何发挥主导作用，编办、人社、财政部门如何解决教育人事制度改革创新和原有制度的矛盾，各部门具体改革做法、效果等进行了讨论交流。两天的学习考察，让考察组的成员对教师“县管校聘”改革工作有了全新的认识。。嵊州市是全省首批中小学教师“县管校聘”管理改革试点区，2016年11月25日，全省中小学教师“县管校聘”管理改革试点工作现场会在该市召开。全省现场会后，省内外各地纷纷组团考察学习“嵊州样板”成功经验。景宁县是2017年丽水市“县管校聘”工作的两个试点县之一。教师“县管校聘” 制度的推行后，最大成效是引导优秀教师向农村学校、薄弱学校流动，从超编、超岗学校向空编、空岗学校流动，有效缓解了学校之间存在的结构性矛盾。教师职业倦怠问题得到了一定的改进。。改革的号角已吹响，行动的步子正迈出。下阶段，松阳县教育局将在县委县政府的指导下，完善“县管校聘”实施方案，积极宣传发动，借鉴外地先进经验，积极稳妥地推进教师“县管校聘”改革工作。真正实现教师有序流动，增强教师队伍的活力，推动学校均衡。,其他,0.5241887120116813,True
82,浙江省,杭州市,,2018-04-23,https://search.zj.gov.cn/jsearchfront/visit/link.do?url=http%3A%2F%2Fwww.hzsc.gov.cn%2Fart%2F2018%2F4%2F23%2Fart_1229249524_3909594.html&q=%E5%AD%A6%E4%B9%A0%E8%80%83%E5%AF%9F%20%E8%80%83%E5%AF%9F%E5%AD%A6%E4%B9%A0&websiteid=330100000000000&title=%E9%BB%84%E5%B1%B1%E5%B8%82%E4%BA%BA%E5%A4%A7%E5%B8%B8%E5%A7%94%E4%BC%9A%E5%89%AF%E4%B8%BB%E4%BB%BB%E4%B8%80%E8%A1%8C%E5%AD%A6%E4%B9%A0%E8%80%83%E5%AF%9F%E6%88%91%E5%8C%BA%E6%97%A2%E6%9C%89%E4%BD%8F%E5%AE%85%E5%8A%A0%E8%A3%85%E7%94%B5%E6%A2%AF%E5%B7%A5%E4%BD%9C,4月12日下午，黄山市人大常务副主任叶长荫、市人民政府副市长杨龙一行赴我区学习考察既有住宅加装电梯工作。我区人大常委会副主任干海和、凯旋街道、金秋花园社区相关负责人陪同。 黄山市人大常务副主任叶长荫一行参观了金秋花园8幢3单元加装电梯项目现场，详细了解我区既有住宅加装电梯工作政策、维保等一系列情况。在体验乘坐电梯后，对我区加装电梯取得的成绩表示高度认可，并表示要将我区的成功经验带回黄山认真研究借鉴。,河北省直工委宣传部部长阎书波一行先后实地参观了东站枢纽管委会“温馨驿站•同心圆”党群服务中心、温馨岛和微笑亭、东站枢纽联勤办及应急响应中心等“同心圆”共建基地，详细了解了东站枢纽区域化党建共建“同心圆”工程工作开展情况、机关党员干部参与同心志愿服务相关情况，认真听取了枢纽核心重点商业项目以及平安维稳、管理运营等方面的情况介绍，对东站枢纽日常运营保障工作给予肯定。。座谈会上，区委组织部副部长赵阳就江干区党建“同心圆”工作从面上开展情况做了介绍。东站枢纽管委会党工委书记、常务副主任程永群对来访领导表示热烈欢迎，介绍 了目前东站整体客流运行情况，从目标导向、问题导向、需求导向三个方面介绍了东站探索党建“同心圆”的工作起因，通过筑强组织联盟，加强文化引领、党建引领、区域统领；提高资源集聚，加强信息共享、成果共享，不断开放融合；打造智慧化服务，项目化服务和双向化服务，以服务为导向，共促和谐，分享交流了东站枢纽区域化党建共建“同心圆”工作经验。。阎书波部长一行高度评价东站枢纽的党建氛围，赞赏东站枢纽管委会以党建“同心圆”为抓手重点，把东站区域51家单位凝聚起来的方式非常值得学习，希望在今后的工作中能够多沟通交流，共同提升党建工作水平。,政府领导到其他城市考察学习或访问,0.0,True
82,浙江省,杭州市,滨江区行政服务中心接待甘肃省金昌市江苏省苏州市等地考察学习,2018-04-03,https://search.zj.gov.cn/jsearchfront/visit/link.do?url=http%3A%2F%2Fsgb.hangzhou.gov.cn%2Fart%2F2018%2F4%2F3%2Fart_1695176_39035434.html&q=%E5%AD%A6%E4%B9%A0%E8%80%83%E5%AF%9F%20%E8%80%83%E5%AF%9F%E5%AD%A6%E4%B9%A0&websiteid=330100000000000&title=%E6%BB%A8%E6%B1%9F%E5%8C%BA%E8%A1%8C%E6%94%BF%E6%9C%8D%E5%8A%A1%E4%B8%AD%E5%BF%83%E6%8E%A5%E5%BE%85%E7%94%98%E8%82%83%E7%9C%81%E9%87%91%E6%98%8C%E5%B8%82%E3%80%81%E6%B1%9F%E8%8B%8F%E7%9C%81%E8%8B%8F%E5%B7%9E%E5%B8%82%E7%AD%89%E5%9C%B0%E8%80%83%E5%AF%9F%E5%AD%A6%E4%B9%A0,为考察交流滨江区在推进办事“最多跑一次”改革进程中的具体做法，3月13日上午，甘肃省金昌市常委、常务副市长马得明一行，江苏省苏州市政府秘书长杨知评一行先后前来我区行政服务中心考察学习。区长金志鹏、行政服务中心负责人陪同。,9月12日上午，郑州市城乡建设委员会副主任金建新一行8人赴我区考察学习既有住宅加装电梯工作。区住建局、华家池社区和三叉社区等相关负责人陪同并座谈。 郑州市城乡建设委员会副主任金建新一行实地考察参观了三新家园和浙大华家池校区加装电梯项目，并乘坐交付的电梯。座谈会上，详细了解我区既有住宅加装电梯工作政策、工程质量安全监督等一系列情况，同时对江干区加装电梯取得的成绩表示高度认可，表示要将江干区的成功经验带回郑州市认真研究借鉴。,其他,0.5229769789230316,True
82,浙江省,杭州市,区委常委会传达学习李强总理在浙江杭州考察调研时的重要讲话精神,2023-10-13,https://search.zj.gov.cn/jsearchfront/visit/link.do?url=http%3A%2F%2Fwww.yuhang.gov.cn%2Fart%2F2023%2F10%2F13%2Fart_1229599531_59063049.html&q=%E5%AD%A6%E4%B9%A0%E8%80%83%E5%AF%9F%20%E8%80%83%E5%AF%9F%E5%AD%A6%E4%B9%A0&websiteid=330100000000000&title=%E5%8C%BA%E5%A7%94%E5%B8%B8%E5%A7%94%E4%BC%9A%E4%BC%A0%E8%BE%BE%E5%AD%A6%E4%B9%A0%E6%9D%8E%E5%BC%BA%E6%80%BB%E7%90%86%E5%9C%A8%E6%B5%99%E6%B1%9F%E6%9D%AD%E5%B7%9E%E8%80%83%E5%AF%9F%E8%B0%83%E7%A0%94%E6%97%B6%E7%9A%84%E9%87%8D%E8%A6%81%E8%AE%B2%E8%AF%9D%E7%B2%BE%E7%A5%9E,本报讯 （记者 阮伟康 陈书恒） 昨日下午，区委常委会召开会议，传达学习中共中央政治局常委、国务院总理李强出席杭州亚运会闭幕式等活动和在浙江杭州考察调研并主持召开数字经济和新型工业化座谈会时的重要讲话精神，研究部署我区贯彻落实意见。市委常委、区委书记刘颖主持会议并讲话。。会议指出，李强总理考察调研杭州的系列重要指示要求，对于我们准确把握中央精神、有效应对当前改革发展中遇到的新情况新问题具有十分重要的意义，充分体现了党中央、国务院对浙江、杭州和余杭的高度重视和亲切关怀。要认真学习领会，坚持以习近平新时代中国特色社会主义思想为指导，深入学习贯彻习近平总书记考察浙江重要讲话精神，认真落实李强总理在杭州考察调研时的重要讲话精神，完整准确全面贯彻新发展理念，坚持以高质量发展统揽全局，扎实推进三个“一号工程”、打好“两场硬仗”和新中心建设“十大工程”，努力在谱写中国式现代化浙江新篇章中挑大梁、当先锋、打头阵。。要持续巩固领跑优势，坚持“人才引领、创新驱动”不动摇，深入实施“创新策源工程”，加快打造全球创新策源地、创新人才蓄水池、科技成果转化首选地。要以数实融合为重点推进数字经济创新提质“一号发展工程”，深入推进新型工业化，大力发展以“产业大脑+未来工厂”为核心的先进制造业体系，推动制造业高端化、智能化、绿色化发展。要全面提升增值式政务服务水平，结合营商环境“一号改革工程”，深化“两个健康”集成改革，完善企业专项培育计划和梯队培育体系，着力打造“我负责阳光雨露、你负责茁壮成长”营商环境品牌升级版。,5月17日－18日，林友保主任（局长）到上海市浦东新区民防办学习考察地下空间开发利用工作。章国祥、张忠明副主任（副局长）和有关处（室）、直属单位负责人陪同调研。。林主任一行听取了浦东新区民防办尹长玉主任关于地下空间开发利用工作的情况介绍，实地考察了位于浦东地铁的某人防工程开发利用项目和世博园区地下空间开发利用项目。林主任表示，浦东新区地下空间建筑面积1200多万平方米，占到整个上海的四分之一，其地下空间建设、管理和开发利用工作在全国具有一定的先进性和示范意义，我们要积极借鉴吸收浦东新区的有益经验，围绕贯彻落实省政府17号文件精神，紧而又紧、实而又实地抓好规划编制、建设管理和开发利用等各项工作落实，为推进我市城市地下空间开发利用科学、有序发展作出贡献。林主任在考察时说，位于浦东地铁的人防工程的开发利用模式很好，整体租赁，方便管理，利于平战转换。同时，项目引入国内具有较大规模和影响的开发商，有效地降低了市场风险，其开发和管理模式对于我们做好环站东路0901等人防工程的开发利用具有很好的借鉴意义。,其他,0.5826592476574236,True
