province,topic,date,content,label,score,is_match,是否为“学习考察”新闻
江西省,省交通运输厅领导到上饶调研高速公路春运保障和厅定点帮扶工作,2024-01-12,江西省人民政府 部门资讯 省交通运输厅领导到上饶调研高速公路春运保障和厅定点帮扶工作。1月2日—3日，省交通运输厅党组成员、副厅长朱晗到上饶调研2024年高速公路春运保障各项准备工作情况，到厅定点帮扶村调研驻村和产业发展等工作。。1月2日，朱晗赴梨温高速公路沿线服务区和上武高速公路铅山服务区、分水关隧道等地，详细了解梨温高速沿线服务区春运服务保障举措，重点了解了服务区外场停车区规划改造施工情况和公共卫生间卫生保障、临时卫生间搭建使用计划等“停车难”“如厕难”解决措施，认真听取了上武高速养护、运营等工作。。朱晗指出，春运临近，各部门各单位要高度重视，认真部署。一是要组织专项排查，全力确保春运期间运营安全。要加强对服务区重点区域及养护薄弱环节的排查和整治，创建安全舒适的服务区整体环境，提前做好相关临时措施准备，确保春运期间高速公路安全形势平稳；二是要实施改造提升，全面提升高速运营管理水平。加快服务区提质升级及养护工程实施，按照既定方案尽快推进落实，严格管控工程质量，争取按时完工；三是要强化保障，探索建立高质量发展长效机制。通过强化制度建设、人员配置、资金投入等措施，确保各项制度落实到位，各项工作落实到位，全力推动高速公路运营管理和服务水平提档升级。。1月3日，朱晗到厅定点帮扶村上饶市广信区清水乡洪家村调研指导乡村振兴工作，看望慰问驻村工作队员。。朱晗实地察看了村组道路提升改造工程和蔬菜大棚施工现场，参观了稻油轮作和大球盖菇种植试验田和“江西交通·童心港湾”，听取洪家村“17137”乡村振兴工程和驻村帮扶以来民生实事落实情况。走访慰问了防止返贫监测户，嘱咐工作队要加强关心关爱，及时帮助群众解决实际困难。在随后召开的驻村帮扶工作座谈会上，朱晗观看了驻村工作队工作纪实视频，听取驻村帮扶工作汇报和市、区、乡相关领导对厅驻村帮扶工作的意见建议。。朱晗充分肯定驻村工作队所取得的工作成效，感谢地方各级领导对厅驻村帮扶工作的支持。他要求驻村工作队要深入学习贯彻党的二十大精神和习近平总书记考察江西重要讲话精神，继续发扬厅驻村帮扶优良传统，用心用情关心关爱群众，倾听群众呼声，多为群众办好事、解难事。要科学规划产业布局，挖掘已有产业潜力，开发新的产业项目，有效提升村产业发展水平。要与村“两委”同频共振，加强宣传教育，引导激励青少年奋发有为，激发乡村振兴内生动力。要把握难得的基层锻炼机会，继续发扬艰苦奋斗精神，再接再厉，积极开创驻村帮扶新局面。,其他,0.6480073579511281,False,否
江西省,传承红色基因促进履职担当开展红色教育主题党日活动,2024-01-11,为深入学习贯彻党的二十大、二十届中央审计委员会第一次会议精神和习近平总书记考察江西重要讲话精神，激励党员干部坚定信念，履职尽责，担当作为。近日，省审计厅党组成员、副厅长裘红洪带领厅赴宜春市审计组全体党员干部前往万载县开展“传承红色基因 促进履职担当”主题党日活动。宜春市审计局党组书记、局长周建鲜，总审计师闻清迷，厅驻村帮扶队参加活动。。首先，全体党员干部来到万载革命烈士陵园，在庄严肃穆的革命烈士纪念碑前肃立，向烈士纪念碑敬献花篮、默哀鞠躬，瞻仰烈士墙，对革命先烈致以深切的缅怀和崇高的敬意。。随后，全体党员干部来到万载革命烈士纪念馆，依次参观革命烈士纪念馆六个展厅。在一幅幅珍贵的历史照片、一份份翔实的档案实物前，认真听取讲解、频频驻足凝视、不时交流讨论，用心感悟英烈们的初心使命。。参观结束后，全体党员面向党旗，重温入党誓词。一句句铿锵有力的誓词，不断叩问入党初心，提醒党员牢记使命担当，永葆对党忠诚。。通过此次主题党日活动，全体党员干部经历了一次深刻的革命传统教育，进一步提升了党性认识，增强了历史使命感和责任感。大家纷纷表示，要牢记革命历史，不忘初心使命，坚定理想信念，聚焦“走在前、勇争先、善作为”的目标要求，积极履职尽责，勇于担当作为，不断为审计事业高质量发展贡献智慧和力量。,其他,0.91833638885999,False,否
江西省,省城镇发展服务中心年度领导班子和领导干部考核测评大会召开,2024-01-10,江西省住房和城乡建设厅 省厅信息 省城镇发展服务中心2023年度领导班子和领导干部考核测评大会召开。近日，省城镇发展服务中心召开2023年度领导班子和领导干部考核测评大会。厅一级巡视员熊春华出席会议并讲话。中心主任刘卫国代表班子作年度工作总结报告，中心党委书记梁卫明主持会议。。会议指出，在厅党组坚强领导下，省城镇发展服务中心坚持以习近平新时代中国特色社会主义思想为指导，全面学习贯彻党的二十大精神，深入贯彻落实习近平总书记考察江西重要讲话精神和对住建工作的重要指示批示精神，认真履职，主动作为，攻坚克难，高质量完成年度各项工作任务，取得较好成绩。。会议强调，开展年度考核工作，既是党组落实《党政领导干部考核工作条例》的规定动作，也是党组落实党要管党、全面从严治党的重要体现。大家要深刻认识年度考核的重要意义，准确把握年度考核的主要内容，强化年度考核结果的运用，不断优化工作方法和思路，锚定明年工作目标，在推动住房城乡建设事业高质量发展上不断取得新的进展成效。,其他,0.9047222845215408,False,否
江西省,我省与故宫博物院举行工作会谈,2024-01-09,1月8日，我省与故宫博物院举行工作会谈，就合力推动优秀传统文化创造性转化、创新性发展开展商讨。省长叶建春，文化和旅游部党组成员、故宫博物院院长王旭东参加工作会谈。。叶建春代表省委和省政府对王旭东率故宫博物院专家来赣指导工作表示感谢，介绍了江西推动赣鄱优秀传统文化传承创新发展相关工作。他说，江西人文底蕴厚重，文物资源丰富，红色、绿色、古色文化特色彰显，尤其是景德镇陶瓷文化在海内外都有很大影响。当前，江西正深入学习贯彻习近平总书记考察江西重要讲话精神特别是关于陶瓷文化保护传承的重要指示要求，全力推进景德镇国家陶瓷文化传承创新试验区建设，重振景德镇陶瓷文化辉煌，持续擦亮赣鄱文化名片。。故宫博物院是保护传承弘扬中华优秀传统文化的引领者，在文物保护、文化传承等方面有着显著的人才、技术优势。希望故宫博物院更多关注赣鄱文化传承发展，深化与江西在文物展览交流、文化人才培养、文化产业发展等方面的合作，为江西文物的发掘保护、传统文化的解读推广给予更多指导和帮助。。王旭东表示，通过实地考察，感受到江西传统文化的独特魅力、文化产业发展的蓬勃活力和干部干事创业的精气神，将充分发挥故宫博物院优势，与江西在双向奔赴、精诚合作中提升人才培养、文化推广及景德镇窑址申遗等工作的效能。,其他,0.6350214084860901,True,是
江西省,故宫博物院与省文旅厅签订战略合作协议,2024-01-10,1月8日，故宫博物院与省文旅厅战略合作签约仪式暨陶瓷展览开幕仪式在省博物馆举行。文化和旅游部党组成员、故宫博物院院长王旭东和省委常委、省委宣传部部长庄兆林出席活动并致辞，副省长陈敏出席。。王旭东表示，近年来，故宫博物院与江西文博界保持着密切联系和友好往来，开展了多方面的合作。战略合作协议的签订，以及陶瓷展览的举行，正是双方深入贯彻落实习近平文化思想的重要举措，也为双方的同道而为、合力共行开启了崭新的篇章。未来，故宫博物院将与江西省文化和旅游厅依托战略合作关系建立长效合作机制，在文物保护研究、展览交流、人才培养、文化产业、对外文化交流等领域展开合作。。庄兆林表示，江西与故宫博物院历史渊源深厚，合作前景广阔。省文旅厅与故宫博物院战略合作签约并举办陶瓷展览，对于我省推动文化遗产保护传承、讲好陶瓷精彩故事具有重要意义。要深入学习贯彻习近平文化思想和习近平总书记考察江西重要讲话精神，按照省委十五届五次全会部署要求，着力在构建保护体系、健全保护机构、完善保护机制、筑牢法治保障、推动文化交流等方面下功夫，以改革创新举措不断推动文化遗产保护传承工作取得新突破。下一步，江西将大力支持省文旅厅与故宫博物院加强交流合作、互办展览和人才培养，共同推出高水平高质量的展览展示活动，进一步讲好中国故事、江西故事。,其他,0.8468384074636356,True,是
江西省,全省市场监管工作座谈会召开,2024-01-10,会议指出，2023年，全省市场监管系统在推动经济快速复苏、维护市场秩序、保障“三品一特”安全等各项工作中展现了担当作为，为全省高质量发展作出了重要贡献。。会议强调，各地要深入学习贯彻习近平总书记考察江西重要讲话精神，全面贯彻落实中央和省委经济工作会议、省委十五届五次全会精神，深入推进质量、标准、品牌、知识产权“四个强省”建设，守牢“三品一特”安全底线，在统筹高质量发展和高水平安全上展现更大作为；要加快融入共建全国统一大市场，在打造内陆地区改革开放高地中发挥更大作用；要大力推行信用监管和智慧监管，在全面提升监管水平上取得更大突破，为奋力谱写中国式现代化江西篇章作出新的更大贡献。,政府领导到其他城市考察学习或访问,0.0,False,否
江西省,善始善终推进主题教育巩固拓展主题教育成果,2024-01-09,1月3日至8日，中央第八巡回指导组赴抚州、鹰潭两地，指导宜黄县委常委班子主题教育专题民主生活会、资溪县火车站社区第一党支部主题教育专题组织生活会和鹰潭市委常委班子主题教育专题民主生活会、贵溪市委常委班子主题教育专题民主生活会。中央第八巡回指导组组长巴音朝鲁、副组长黄宁生到会指导。巴音朝鲁强调，要深入学习贯彻习近平新时代中国特色社会主义思想，切实提升思想认识水平，持续在以学铸魂、以学增智、以学正风、以学促干上下功夫，善作善成、善始善终推进主题教育，巩固拓展主题教育成果，以实干实绩不断开创各项事业发展新局面。。巴音朝鲁指出，此次参加的专题民主生活会和专题组织生活会严肃认真、高质高效，大家会前准备扎实充分，查摆问题深刻细致，整改措施认真务实，批评和自我批评真刀真枪，达到了红脸出汗、开诚布公、见人见事见思想的效果。巴音朝鲁强调，当前，第二批主题教育即将收官，但落实“学思想、强党性、重实践、建新功”总要求，只有进行时，没有完成时。要继续深化对习近平新时代中国特色社会主义思想的学习领悟，坚定拥护“两个确立”、坚决做到“两个维护”。要把党的创新理论学习不断引向深入，持续强化学习的系统性、自觉性，深刻领悟习近平新时代中国特色社会主义思想的精髓要义。要坚持问题导向，建立健全解决问题的长效机制，狠抓整改落实。要持续用力，久久为功，推动每一个问题得到妥善解决，要发扬彻底的自我革命精神，驰而不息转作风、树新风，坚决克服形式主义，用心用情用力解决群众急难愁盼问题。要完整准确全面贯彻新发展理念，扎实推动经济社会高质量发展。进一步统一思想和行动，进一步增强改革创新意识，进一步激发攻坚克难拼劲，扎实做好经济社会发展各项工作。要深入总结主题教育经验成效，持续巩固拓展主题教育成果。切实跑好后半程，保持标准不降、力度不减，推动习近平新时代中国特色社会主义思想在江西处处扎根、遍地开花、结出硕果。。在指导资溪县火车站社区第一党支部主题教育专题组织生活会时，巴音朝鲁指出，基层党组织要开好主题教育专题组织生活会，必须坚持政治引领，把政治建设摆在首位，发挥好基层党组织的政治引领作用。必须坚持固本强基，通过主题教育凝心铸魂、汇聚力量，形成强有力的团结向上的整体，引领各项事业发展。必须坚持人民至上，持续加强和创新基层社会治理，不断优化共建共治共享的社会治理格局。巴音朝鲁强调，资溪是首批国家生态文明建设示范县、国家“绿水青山就是金山银山”实践创新基地，基层党组织要充分发挥战斗堡垒作用，深入贯彻落实习近平生态文明思想和习近平总书记考察江西重要讲话精神，让党组织成为打通“两山”转化通道的“红色引擎”。。中央第八巡回指导组在抚州、鹰潭指导主题教育专题民主生活会和组织生活会期间，还就两地主题教育开展情况进行了调研。,其他,0.6662679651278798,False,否
江西省,尹弘主持召开省委常委会会议,2024-01-08,1月5日，省委常委会召开会议，传达学习习近平总书记近期重要讲话重要指示精神和中央重要会议精神，研究我省贯彻落实意见。省委书记尹弘主持会议。。会议强调，党中央坚持每年专门听取全国人大常委会、国务院、全国政协、最高人民法院、最高人民检察院党组工作汇报和中央书记处工作报告，是坚持和加强党的全面领导的一项重要制度安排，也是维护党中央集中统一领导的重要体现。要认真学习贯彻1月4日中央政治局常务委员会会议精神，坚持真抓实干，勇于担当作为，切实把各方面的力量凝聚起来、积极性主动性充分调动起来，齐心协力把各项工作抓好做实，确保党中央决策部署落到实处。。会议强调，要认真学习贯彻中央外事工作会议和习近平总书记在接见2023年度驻外使节工作会议与会使节时发表的重要讲话精神，准确理解把握习近平外交思想的丰富内涵，全面加强党对外事工作的领导，全力服务国家总体外交大局，深入融入共建“一带一路”，加快建设江西内陆开放型经济试验区，持续深化国际交流合作，为深入推进中国特色大国外交作出江西更大贡献。。会议强调，要认真学习贯彻习近平总书记在全国政协新年茶话会上的重要讲话和二〇二四年新年贺词精神，牢铸政治忠诚，锚定奋斗目标，凝聚团结奋进力量，扎实做好各项工作，引导全省上下鼓起奋进新征程、建功新时代的精气神，一步一步把习近平总书记为我们擘画的蓝图变为美好现实。。会议听取了省人大常委会党组、省政府党组、省政协党组、省纪委省监委、省法院党组、省检察院党组2023年工作汇报。会议强调，过去一年，5家党组和省纪委省监委坚持以习近平新时代中国特色社会主义思想为指导，全面加强党的领导和党的建设，围绕中心大局、忠诚履职尽责、主动担当作为，推动中央决策部署和省委工作要求落地落实，各项工作取得了新成效。今年是新中国成立75周年，是实现“十四五”规划目标任务的关键一年，要深入贯彻党的二十大精神和习近平总书记考察江西重要讲话精神，聚焦“走在前、勇争先、善作为”的目标要求，围绕打造“三大高地”、实施“五大战略”，强化政治担当，抓好工作落实，加快推进高质量发展，不断开创各项事业发展新局面，奋力谱写中国式现代化江西篇章。。会议强调，要深入贯彻习近平总书记关于“三农”工作重要论述，持续巩固拓展脱贫攻坚成果同乡村振兴有效衔接，坚持问题导向，全面固强补弱，加强部门协同，落实重点任务，不断推动乡村全面振兴发展取得新成效。。会议强调，要坚持人民至上、生命至上，严格落实“四个最严”的重要要求，进一步健全完善食品药品安全工作制度体系，严格监督管理，加大执法力度，加强宣传引导和服务保障，扎实做好食品药品安全各项工作。。会议审议并原则通过了《关于全面加强新形势下森林防灭火工作的实施意见》，强调要全面提升防控能力，压紧压实防控责任，扎实做好森林防灭火工作，全力维护人民群众生命财产安全和国家生态安全。,政府领导到其他城市考察学习或访问,0.0,True,是
江西省,省工业和信息化厅党组书记厅长主持召开省工业和信息化厅年第次党组扩大会暨党组理论学习中心组扩大学习会,2024-01-08,江西省人民政府 部门资讯 省工业和信息化厅党组书记、厅长主持召开省工业和信息化厅2024年第1次党组（扩大）会暨党组理论学习中心组（扩大）学习会。省工业和信息化厅党组书记、厅长主持召开省工业和信息化厅2024年第1次党组（扩大）会暨党组理论学习中心组（扩大）学习会。1月4日上午，省工业和信息化厅党组书记、厅长应炯主持召开2024年第1次党组（扩大）会暨党组理论学习中心组（扩大）学习会，专题学习习近平总书记近期系列重要讲话精神，传达学习省委十五届五次全体（扩大）会议精神，研究贯彻落实意见，审议有关事项。在家的厅领导，二级巡视员，驻厅纪检监察组副组长，机关各处室主要负责同志参加会议。。会议强调，习近平总书记在上海和广西考察时、在深入推进长三角一体化发展座谈会和中央政治局学习贯彻习近平新时代中国特色社会主义思想主题教育专题民主生活会上的重要讲话，站位高远、内涵丰富，具有很强的政治性、思想性、指导性，为巩固拓展主题教育成果、全面加强党的建设、强化领导班子和队伍建设、加快构建现代化产业体系、推动高质量发展、做好安全生产和民生保障等工作提供了重要遵循。各级党组织要认真落实“第一议题”制度，及时传达、认真学习领会，做到学思用贯通、知信行统一，确保党中央、国务院决策部署和省委、省政府工作要求在我厅落地落实，以实际行动捍卫“两个确立”、坚决做到“两个维护”。。会议指出，省委十五届五次全体（扩大）会议是习近平总书记考察江西后我省召开的第一次全体会议，主题鲜明，内容丰富，任务明确，意义重大。全会在全面总结过去一年省委常委会工作的同时，进一步明确了当前和今后一个时期全省工作的总体思路、努力方向和重点任务，既旗帜鲜明宣示了省委沿着习近平总书记指引方向前进的坚定政治立场，又与时俱进制定了贯彻落实习近平总书记考察江西重要讲话精神的行动纲领，对于新征程上奋力谱写中国式现代化江西篇章具有十分重要的意义。。会议强调，全厅上下必须把推进中国式现代化作为最大政治，迅速全面深入学习领会省委全会精神，更加深刻理解领悟习近平总书记考察江西重要讲话精神的精髓要义，准确理解把握省委部署的战略目标和重点任务，自觉把思想和行动统一到省委工作要求上来。要切实把全会精神学习好、领悟好、把握好，持续推动学习贯彻习近平总书记考察江西重要讲话精神和关于推进新型工业化重要论述精神一体贯通、融合贯彻，凝聚起感恩奋进、担当实干的强大力量。要围绕省委《决定》部署要求，坚持稳中求进工作总基调，完整、准确、全面贯彻新发展理念，深化细化“1269”行动计划，统筹抓好传统产业改造升级、战略性新兴产业发展壮大和未来产业积极培育，持续巩固经济回升向好态势，谋划抓好今年全省工信工作各项目标任务，加快推进新型工业化，努力构建体现江西特色和优势的现代化产业体系。要以政治建设为统领深化推进党的各项建设，压紧压实全面从严治党政治责任，锲而不舍抓好干部作风和能力建设，不断巩固发展风清气正的政治生态，持续建设让党放心、让人民满意的模范机关。要按照省委要求组织抓好“大抓落实年”活动，以强烈的政治责任感和时不我待的紧迫感，不折不扣抓落实、雷厉风行抓落实、求真务实抓落实、敢作善为抓落实，以真督办抓硬落实，切实当好推动工业高质量发展的执行者、行动派、实干家，努力创造经得起历史和人民检验的实绩。,不属于政府领导到其他城市考察学习的新闻,0.576596674267253,False,否
