province,topic,date,content,label,score,is_match,是否为“学习考察”新闻
江西省,时时放心不下的牵挂记习近平总书记在北京河北考察灾后恢复重建工作,2023-11-13,江西省人民政府 头条 时时放心不下的牵挂——记习近平总书记在北京河北考察灾后恢复重建工作。新华社北京/河北保定11月11日电 题：时时放心不下的牵挂——记习近平总书记在北京河北考察灾后恢复重建工作。今年7月底8月初，华北、黄淮等地出现极端降雨，引发洪涝和地质灾害，造成北京、河北等地重大人员伤亡。。习近平总书记密切关注汛情，高度重视防汛抗洪救灾工作，多次作出重要指示批示，要求全力保障人民群众生命财产安全。“那段时间，我每天都关注着灾情，指导着救灾工作，心里一直惦念着受灾地区和受灾群众。”。9月7日，正在黑龙江考察的习近平总书记，来到受灾较重的哈尔滨尚志市老街基乡龙王庙村，看望慰问受灾群众，了解灾后恢复重建进展。从东北谈到华北，总书记说：“我牵挂着受灾的地方。那些地方我之后也会去看。”。11月10日，北方入冬之际，习近平总书记专程来到北京、河北受灾较重的门头沟区、保定涿州市，看望慰问受灾群众，检查指导灾后恢复重建工作。。一天时间，乘汽车、换火车，行程横跨京冀两地，足迹覆盖农村、社区、学校、市政设施、水利工程，访居民、见师生、看商铺，入农户、进麦田、上大堤，冒着严寒而往，沐着夜色而归。。“一路走下来，听到了看到了，我心里感到踏实，也是欣慰的，恢复重建工作都在按照计划进行。”。“要继续把灾后恢复重建工作一件一件落实好，继续为推动人民生活向着更好的方向前进而努力，让老百姓今后的日子过得更好！”。10日上午，习近平总书记乘车通过水峪嘴桥，在村口下车。岸边展板上的照片，记载了今夏洪水肆虐、洪峰过境时的景象。。“我们现在所站的地方，当时已被洪水淹没。大水漫过水峪嘴桥的桥面。”当地负责同志告诉总书记，因转移及时，全村群众无一伤亡，但87%的房屋受损。。走进李盟家，习近平总书记仔细察看。墙壁经过粉刷，已经看不出水淹的痕迹，一楼门窗和家具、电器也是新换的。阳光透过玻璃洒进两层小楼，亮堂堂的。。李盟告诉总书记，当时洪水把一楼淹了，满屋都是淤泥。受灾后，政府给了补贴，一家人齐心协力恢复修缮，目前已经收拾一新。。“共产党是为人民服务的党。现在我们国家经济实力增强了，更要为人民多做事情。祝你们生活越过越幸福。”总书记说。。10日下午，习近平总书记来到涿州受灾较严重的双塔街道永济秀园小区，首先察看了这里的热力站。。得知小区已于11月1日提前半个月开始供暖，总书记十分高兴：“这是应该做的，你们做得很好！”。一进屋，就感到了暖意。看了看温度计，又摸了摸暖气片，总书记笑着说：“这温度达标了。”。指着白墙上的水迹，董彩英告诉总书记，当时家里也进了水，家具家电和一些衣服被褥被淹了。如今在党员干部帮助下，房子已完成清理修缮，温暖过冬没问题。。“看到你们转危为安，大灾之后生活可以照旧，而且还能提高一点，我感到很欣慰。”总书记说。。涿州市刁窝镇万全庄村位于兰沟洼蓄滞洪区，今年汛期全村311户全部受灾，不少房子被冲倒或严重受损。。村民付俊家新建的房子即将封顶。他热情地把总书记迎进未来的新居，详细介绍房屋内部结构：“这是朝阳的4间卧室，这是厨房，那边是卫生间……”。付俊告诉总书记，房子受灾后，很快就收到了农房保险理赔款，钢筋、沙子、水泥等建材都有补贴优惠，政府还给担保联系了施工队，自己就下定决心尽快重建了。“党的政策好，赶上这个好时代，要不然就盖不起来了。”。离开村子时，村民们聚拢到村道两旁，有白发老人，也有小孩子，纷纷热烈鼓掌、高声向总书记问好。。总书记同乡亲们说：“我心里一直惦念着灾区的人民群众。今天，来这里看了看，心里踏实了，党中央的政策在各地转化为实际的举措，还是管用的。”,其他,0.6877600443649369,False,否
江西省,熊春华组织召开分管领域支部联席会议,2023-11-13,11月10日上午，厅党组成员、副厅长熊春华召集分管领域的基层党支部负责人，在省建筑业发展服务中心召开了党支部联席会议。。熊春华领学了习近平总书记考察江西重要讲话，以及全省领导干部会议精神，讲了题为《深入学习贯彻习近平总书记考察江西重要讲话精神奋力谱写住房城乡建设事业新篇章》的党课。熊春华指出，党的十八大以来，习近平总书记三次亲临江西，亲自擘画江西经济社会发展蓝图。各单位（处室）要认真学习宣传贯彻习近平总书记考察江西重要讲话精神，牢记嘱托、砥砺奋进，扎实推进全省住房和城乡建设事业高质量发展，巩固风清气正的良好政治生态。。厅机关党委、建筑监管处、城市建设处、行政审批处、城市管理处、省城镇发展服务中心、省建筑业发展服务中心、省人居环境研究院有关负责同志参会。,不属于政府领导到其他城市考察学习的新闻,0.5284277182122045,False,否
江西省,推动教育整顿进一步走深走实,2023-11-12,11月10日，全省纪检监察干部队伍教育整顿领导小组第11次（扩大）会议召开，传达学习贯彻全国纪检监察干部队伍教育整顿领导小组第4次（扩大）会议精神，交流经验做法，推动教育整顿走深走实。省委常委、省纪委书记、省监委主任马森述出席并讲话。。马森述指出，李希同志在全国纪检监察干部队伍教育整顿领导小组第4次（扩大）会议上的讲话，对高标准高质量完成教育整顿各项任务、扎实做好岁末年初各项重点工作提出明确要求、作出具体部署，是做好下一步工作的重要遵循，全省各级纪检监察机关要认真学习领会、抓好贯彻落实。。马森述指出，前期我省教育整顿工作稳步推进，取得了扎实成效，但还需要保持力度不减、节奏不变，抓住“扩大战果”关键期、“治建并举”窗口期，用纯洁思想、纯洁组织的实际成效推动纪检监察工作高质量发展。马森述强调，要持续学深悟透习近平新时代中国特色社会主义思想，尤其要深刻学习领会习近平总书记考察江西重要讲话精神，以理论学习的常学常新进一步筑牢理想信念、强化使命担当。要以专项整治为抓手，深化问题整改整治，努力把“问题清单”变为“成果清单”。要坚持实事求是，坚定稳妥做好线索处置和案件查处。要聚焦问题，有针对性堵塞制度漏洞、完善内控机制，推动构建严管严治的长效机制。要抓深抓实督导指导，努力推动主题教育、教育整顿和纪检监察各项工作有机衔接、紧密融合。要加强统筹谋划，坚持上下联动，深入实施一体化业务人才培养工程，努力锻造一支忠诚干净担当、敢于善于斗争的纪检监察铁军。,其他,0.9144135392631304,False,否
江西省,我省与国家国防科工局签署深化战略合作协议,2023-11-12,11月11日，我省与国家国防科技工业局在南昌签署深化战略合作协议。省委书记尹弘、省长叶建春会见了国家国防科工局党组书记、局长张克俭一行。。省领导史文斌、夏文勇和国家国防科工局副局长刘敬、中国核工业集团总经理顾军参加相关活动。。叶建春见证签约。他说，江西高度重视核工业发展，是传统军工大省。当前，全省上下正深入学习贯彻党的二十大精神和习近平总书记考察江西重要讲话精神，按照省委十五届四次全会部署要求，以深入实施制造业重点产业链现代化建设“1269”行动计划为抓手，大力发展特色优势产业，超前布局战略性新兴产业。希望国家国防科工局加大对江西军工核心能力建设支持力度，帮助江西提升国防特色学科建设和科研能力水平，继续加大对口支援帮扶吉水县力度；希望中核集团充分发挥产业、技术、人才等方面优势，推动与江西的合作走宽走深走实。我们将主动加强对接，提供优质保障，为深化务实合作提供良好环境。。张克俭、顾军表示，江西是红色热土，是军工业发展的重要基地，是核工业重要发源地。希望以此次签约为契机，进一步深挖合作潜力、拓宽合作领域，合力推动国防科技工业与地方经济社会高质量发展。。根据协议，国家国防科工局与我省将在发展国防科技产业、建设国家战略科技力量、实施国家涉赣战略、推进地方高校局省共建、推动军工企业改革和军工文化建设等方面进一步深化合作。,其他,0.6641328101397769,True,是
江西省,坚定发展信心强化政企联动积极开拓发展空间开创美好未来,2023-11-12,江西省人民政府 今日关注 坚定发展信心 强化政企联动 积极开拓发展空间开创美好未来。11月11日，省长叶建春在南昌市部分制造业企业调研。他强调，要深入学习贯彻习近平总书记考察江西重要讲话精神，按照省委十五届四次全会部署要求，进一步细化落实制造业重点产业链现代化建设“1269”行动计划，为企业提供实实在在的服务，引导企业坚定发展信心、明确主攻方向，积极开拓发展空间开创美好未来，努力构建体现江西特色和优势的现代化产业体系。。南昌海立电器有限公司是上海电气集团旗下空调压缩机巨头上海海立电器有限公司投资的全资子公司，是海立在异地最大的生产基地。叶建春认真察看企业系列产品及智能制造生产线，对企业绿色、节能、环保的生产理念和技术体系给予肯定。他说，海立技术创新的方向，不仅致力于提供舒适清爽的局部小空间，而且着眼于营造纯净清新的大环境，体现了企业强烈的社会担当和长远的发展眼光。叶建春着重询问企业科技研发、人才培养等情况，希望企业紧贴生产需求，将研发重心放在南昌，吸引更多研发人才集聚南昌，为南昌海立发展成为智能制造的示范企业插上创新翅膀。。在南昌欧菲光科技有限公司，叶建春详细了解企业在智能手机、智能汽车以及VR/AR和服务机器人等新领域的科技研发情况，鼓励企业抓住南昌打造VR产业生态的机遇，树立战略思维，布局新兴赛道，汇聚创新力量，久久为功、绵绵用力，下决心在VR产业达到遥遥领先的行业地位。他说，VR产业前景广阔、潜力巨大。发展好VR产业，政府有信心，希望企业也能坚定信心。政府将为企业营造良好创新环境，提供更多应用场景，帮助企业在市场竞争中抢占先机。。来到南昌华勤电子科技有限公司，叶建春听取企业发展历程、产业布局、市场开拓等情况介绍，询问企业发展中需要解决的问题，为企业坚持自动化、精益化、数字化发展取得的成效点赞。他指出，电子信息产业是江西的基础性、支柱性产业，在“1269”行动计划中占据重要位置。希望企业狠抓科技创新不放松，在精细管理、降本增效等方面取得更大实效，在江西电子信息产业链做大做强中展示更大作为。全省各级政府要为华勤这样有未来、有核心竞争力的企业提供贴心服务，为企业发展培植成长沃土、营造良好生态。,政府领导到其他城市考察学习或访问,0.5869572262074348,True,是
江西省,首届中国抚州生态康养产业发展大会开幕,2023-11-11,11月10日，2023首届中国·抚州生态康养产业发展大会在抚州开幕。全国政协副主席、民革中央常务副主席何报翔讲话并宣布大会开幕。全国政协常委、副秘书长、民革中央副主席兼秘书长李惠东为抚州授牌“民革中央康养产业实践基地”。副省长陈敏出席开幕式并讲话，省政协副主席陈俊卿主持开幕式。。何报翔指出，中共十八大以来，以习近平同志为核心的中共中央，坚持把保障人民健康放在优先发展的战略位置，作出实施健康中国战略的重大决策部署，推动全国生态康养产业进入高质量发展的新阶段。此次举办2023首届中国·抚州生态康养产业发展大会，是江西省和抚州市贯彻落实习近平总书记考察江西重要讲话精神的具体举措，是着眼经济社会发展大局作出的重要决策，更是促进生态产品价值转化、提升全民健康水平、擦亮抚州品牌形象的生动实践。希望江西省和抚州市以此次大会召开为契机，积极贯彻落实健康中国战略、美丽中国建设战略，把生态康养产业发展与推动全面绿色转型、乡村振兴统筹起来，抢抓生态康养产业发展新机遇，不断探索生态康养产业高质量发展的新路径，奋力开创生态康养产业发展新局面。。何报翔表示，民革中央将深入学习贯彻习近平新时代中国特色社会主义思想，切实履行参政议政职能，持续助力健康中国、美丽中国建设，助推抚州生态康养产业高质量发展。希望各位嘉宾以本次大会为纽带，交流经验、深化合作、共享机遇、共谋发展，合力谱写生态康养产业发展的新篇章。。陈敏指出，省政府将坚定不移支持和推动抚州康养产业发展，为拓宽“两山”转化路径，加快绿色转型发展提供有力支撑。希望省直各部门进一步聚焦产业发展、资源要素等领域，主动作为，靠前服务，齐心协力支持抚州经济社会发展。希望抚州不负众望，抢抓机遇，立足特色优势，整合各类资源，积极开拓创新，全力创建生态康养名城，走出一条革命老区高质量发展的新路子。。开幕式上，15个康养项目集中签约，总投资185.8亿元；6名专家学者分别进行了主旨演讲。会议期间还举行了政企对接、项目考察等活动。,政府领导到其他城市考察学习或访问,0.5150891159111948,True,是
江西省,上海合作组织国家扶贫研修班在江西石城开班,2023-11-10,11月6日，2023上海合作组织国家扶贫研修班在赣州石城开班。来自哈萨克斯坦、乌兹别克斯坦、吉尔吉斯斯坦等国的政府部门官员、专家、企业家代表10余人参加实地研修。江西省政府、赣州市政府相关领导出席开班仪式并致辞。。此次研修班以减贫与发展为主题，旨在落实习近平主席在上海合作组织成员国元首理事会第二十一次会议上的重要承诺，搭建国内外学习交流平台。现场观摩研修环节，重点聚焦石城县在产业扶贫、就业扶贫、社会扶贫、消费扶贫、易地搬迁扶贫和巩固拓展脱贫攻坚成果等方面颇具代表性的“石城经验”，先后参观了麒麟山创业致富带头人实训基地、赣江源镇溯源生态文旅小镇、新百伦就业帮扶基地、高田镇就业帮扶车间、江西德都食品科技有限公司、铜锣湾“进城进园”易地搬迁集中安置点等乡村和企业进行深入了解和调研。。两天的现地研修考察结束后，哈萨克斯坦共和国劳动和社会保障部社会援助司专项社会援助局局长库尔曼库洛娃说道，“上合组织国家扶贫研修班第一站我们参观了石城的乡镇，我们看到，不仅农业在发展，工业也在发展，农村贫困人口可以在各领域实现就业，这为脱贫提供了更多可能。另外我们也看到农村基础设施很完善，为人们生活提供了很多便利。”。通过现场调研，吉尔吉斯共和国劳动、社会保障和移民部索库鲁克区劳动、社会保障和移民局局长科涅舍夫表示，他们在石城看到了很多积极的脱贫案例，比如为贫困人口创造就业岗位，扶贫搬迁安置等，这些宝贵扶贫经验非常值得借鉴学习。,其他,0.6863078552242884,False,否
江西省,把殷殷嘱托转化为干事创业的强大动力,2023-11-10,11月9日下午，学习贯彻习近平总书记考察江西重要讲话精神省委宣讲团报告会在江西财经大学举行。省委宣讲团成员、省纪委分管日常工作的副书记、省监委副主任许朝杰作宣讲报告。。在近两个小时的宣讲中，许朝杰从深刻把握习近平总书记再次考察江西的重大意义、深刻把握习近平总书记对江西发展提出的新的战略定位、深刻把握习近平总书记对江西发展提出的任务要求、深刻把握习近平总书记对进一步推动长江经济带高质量发展的重要要求、深刻把握贯彻落实习近平总书记考察江西重要讲话精神的实践要求等五个方面，结合对国内形势的分析和江西省情，作了深入浅出、深刻翔实的解读。宣讲还结合江西财经大学办学实际，在纵深推进全面从严治党等方面，提出具体要求。。大家表示，宣讲报告重点突出、条理清晰、分析透彻、提炼精准，对进一步理解习近平总书记考察江西重要讲话精神的丰富内涵具有很好的指导意义。会后，许朝杰还与江西财经大学师生代表开展了座谈交流。。11月8日上午，学习贯彻习近平总书记考察江西重要讲话精神省委宣讲团报告会在省国资委举行。省委宣讲团成员，省国资委党委委员、主任肖云作宣讲报告。。“习近平总书记再次亲临江西考察指导，在开启中国式现代化建设江西实践进程中具有重要里程碑意义。”报告会上，肖云围绕“深刻把握习近平总书记再次考察江西的重大意义”等五方面作了系统解读。报告主题鲜明，思想深刻，结合国资国企改革发展工作实际，充分阐述了习近平总书记考察江西重要讲话精神的丰富内涵和重大意义，为广大干部职工提供了有力辅导。。大家表示，听完宣讲后，深受鼓舞、倍感振奋，将在今后的工作中，牢记殷殷嘱托，切实把习近平总书记考察江西重要讲话精神全面贯彻落实到推动国有经济实现量质双升上来，为谱写中国式现代化江西篇章贡献国资力量。。在近两个小时的宣讲中，余正琨围绕“深刻把握习近平总书记再次考察江西的重大意义”“深刻把握习近平总书记对江西发展提出的新的战略定位”“深刻把握习近平总书记对江西发展提出的任务要求”“深刻把握习近平总书记对进一步推动长江经济带高质量发展的重要要求”“深刻把握贯彻落实习近平总书记考察江西重要讲话精神的实践要求”等五个方面进行了全面系统、鲜活生动的阐释。。“听了今天的宣讲，深受鼓舞、倍增干劲。”赣州市委党校统战理论教研室主任、副教授严志伟表示，作为一名理论工作者，将以此次宣讲为契机，进一步加强理论研究和宣传阐释。。在两个小时的宣讲中，蒋金法围绕深刻把握习近平总书记再次考察江西的重大意义、深刻把握习近平总书记对江西发展提出的新的战略定位、深刻把握习近平总书记对江西发展提出的任务要求、深刻把握习近平总书记对进一步推动长江经济带高质量发展的重要要求、坚定不移把习近平总书记考察江西重要讲话精神落到实处等五个方面，结合宜春发展实际，进行了系统深入、精彩生动的阐释。宣讲报告主题鲜明、内涵丰富，让大家备受启发和鼓舞。。大家表示，要切实把总书记的关心关怀转化为干事创业的强大动力，扎实做好经济运行监测调度、项目建设、民生保障、安全稳定等重点工作，积极抢位发展、错位发展，加快推动宜春经济高质量发展。,不属于政府领导到其他城市考察学习的新闻,0.7335745085028132,False,否
江西省,习近平总书记在北京河北考察灾后恢复重建工作时的重要讲话温暖民心汇聚力量,2023-11-11,江西省人民政府 头条 习近平总书记在北京河北考察灾后恢复重建工作时的重要讲话温暖民心、汇聚力量。新华社北京11月10日电 题：努力把家园建设得更加美好——习近平总书记在北京河北考察灾后恢复重建工作时的重要讲话温暖民心、汇聚力量。题：努力把家园建设得更加美好——习近平总书记在北京河北考察灾后恢复重建工作时的重要讲话温暖民心、汇聚力量。10日，习近平总书记在北京、河北考察灾后恢复重建工作时强调，再接再厉抓好灾后恢复重建，确保广大人民群众安居乐业、温暖过冬。习近平总书记的深情牵挂、殷切嘱托，让受灾地区广大干部群众深感温暖、深受鼓舞。大家表示，将坚定信心，全力以赴，努力把家园建设得更加美好。。河北涿州，立冬过后，户外最低温度降到零摄氏度以下。双塔街道永济秀园小区的29栋居民楼里已经通上暖气，屋里暖意融融。。“习近平总书记进屋后，很关心我们的受灾情况和现在的生活。全家人心里暖烘烘的，感觉总书记非常亲切，始终把我们老百姓装在心中。”小区居民董彩英说，在党中央坚强领导下，大家齐心协力，就一定能够过上更加美好的生活。。今年夏天，京津冀和东北等地汛情发生后，习近平总书记一直密切关注全国汛情，始终牵挂受灾群众，走进多个受灾较重地区考察慰问。。“真没想到习爷爷会来到我们的课堂，他听得特别仔细，还和大家互动交流。”北京市门头沟区妙峰山民族学校五年级一班的学生段进熙说。因地势相对较高，今年汛期，她所在的学校作为临时避灾场所和防汛抗洪救灾人员驻地。。随父母在学校安置期间，一架架直升机将救援物资空投到操场的情景，让段进熙印象深刻：“我用黏土捏了一个直升机模型分享这段经历。我要按照习爷爷的教导，树立远大志向，做社会主义事业的建设者和接班人。”。在抗洪抢险中，一批党员干部冲锋在前，涌现出许多感人故事。门头沟区龙泉镇副镇长刘捷，在劝导群众转移避险中突遇山洪，英勇牺牲。。“习近平总书记仔细询问我们生活是否有保障，让我充分感受到了党中央的关心关怀。”泪水在刘捷的爱人刘璇眼里打转，“未来我会好好工作，督促儿子认真学习，一起努力把他爸爸舍己为人的精神传承下去。”。中铁呼和浩特局集团有限公司包头客运段青岛车队技术员赵阳，在手机上看到习近平总书记考察的消息，心里非常感动。三个多月前，在因洪水滞留的K396次列车上，身为乘务员的赵阳哽咽喊话安抚乘客的场景感动了无数人。。“习近平总书记说共产党是为人民服务的党，永远把老百姓放在心中最高位置。作为一名基层党员，我将把总书记的厚望重托转化为更大的工作动力。无论是抢险救灾还是日常工作，都会全力以赴。”赵阳说。。“习近平总书记来到我们村，关心灾后的生产生活和房屋重建情况，尤其是关心我们如何过冬。我打心里感谢总书记，感谢共产党。”回想起总书记走进自己家中的那一幕，村民杨佩然激动不已。。千里之外的黑龙江省尚志市，龙王庙村村民杨春贵对现在的生活感到踏实：“9月初总书记来看望我们的时候，家里刚贴了地砖，还在刮大白。现在房子都修好了，火炕、衣柜、橱柜都是崭新的。”。尚志市住房和城乡建设局副局长高峰说：“房屋修缮加固重建，是灾后恢复重建的头等大事，也是习近平总书记的牵挂事。在完成房屋重建基础上，我们将持续关注受灾群众的住房、生活情况，加快重建和美乡村。”。在新闻上看到总书记又一次走进农田考察灾后恢复生产的情况，金马镇镇长翟成更觉重任在肩：“农业生产不仅关系家家户户的收入，也关系国家粮食安全。我们将继续抓紧修复灾毁农田和农业设施，组织安排好今冬明春的农业生产，争取明年有个好收成。”。福建省南安市防汛办主任黄震宇对习近平总书记讲话中“完善城乡基层应急管理组织体系”感触很深。,不属于政府领导到其他城市考察学习的新闻,0.5420276236235728,False,否
