province,topic,date,content,label,score,is_match,是否为“学习考察”新闻
江西省,关于印发科技兴赣六大行动年工作要点的通知,2024-03-22,2024年是实现我省“十四五”科技创新规划目标任务的关键一年，也是实施科技兴赣六大行动的攻坚之年。根据《科技兴赣六大行动实施方案（2023-2025年）》，结合工作实际，制定科技兴赣六大行动2024年工作要点如下：。以习近平新时代中国特色社会主义思想为指导，深入贯彻党的二十大、二十届二中全会精神，全面落实习近平总书记考察江西重要讲话精神，按照省委十五届四次、五次全会部署，紧扣“走在前、勇争先、善作为”的目标要求，大力实施科教强省战略，深入实施科技兴赣六大行动，聚焦以科技创新引领现代化产业体系建设这一中心任务，有针对性地部署创新链，积极对接国家战略科技资源，全面增强科技创新驱动力，加快形成新质生产力，加速建设全国具有影响力的区域科技创新中心，为奋力谱写中国式现代化江西篇章提供科技支撑。。力争综合科技创新水平指数达到63%；全社会研发经费支出占国内生产总值比重达到1.9%；高新技术产业增加值占规模以上工业增加值比重达42%；技术合同成交额达1800亿元；研究与试验发展人员数达20万人；有效期内高新技术企业达7000家；新增国家级平台载体3个以上。。1．打造科技创新高地。（1）强化南昌在全省科技创新中的核心地位，持续支持中国（南昌）科学岛、未来科学城、南昌实验室等重大创新平台建设，推进江西创新馆、省级先进算力中心建设，推动厅市会商工作，加快打造中部地区区域科技创新中心；支持南昌围绕电子信息、航空、汽车及装备、新能源、新材料、医药健康、绿色食品、轻工纺织等制造业重点产业链开展技术创新。（2）支持赣州发挥创新优势，聚焦有色金属、生物医药等领域，布局建设重大创新平台，加快建设具有世界影响力的稀土科技创新中心和国内一流的生物医药科创中心；支持赣州围绕稀土新材料及应用、新能源、新材料、钨新材料及应用、电子信息、现代家具等制造业重点产业链开展技术创新。。2．筑牢市县科技创新基础。（1）推进鄱阳湖国家自主创新示范区建设，支持省级高新区争创国家高新区，支持市、县（区）高起点布局一批省级高新区。（2）支持井冈山国家农业科技园区升建国家农业高新技术产业示范区。（3）落实科创城创新发展建设指引，高标准建设中国中医药科创城等十大科创城。（4）支持南昌市、萍乡市、景德镇市、新余市等国家创新型城市进位赶超。指导井冈山市、南昌县、樟树市、永新县、信丰县、贵溪市等国家级创新型县（市）建设，打造具有典型示范带动作用的省级创新型县（市、区）。（5）加强对地方高校、科研机构的支持力度，深入实施科技特派员制度，健全科技人员帮扶企业创新和乡村振兴机制。。1．争创国家级科技创新平台。（1）推进国家实验室研究基地或网络成员建设，力争2-3家国家实验室研究基地或网络成员落户江西。（2）争创稀土、核资源、有色金属等领域全国重点实验室3-4家。（3）根据中央科技委的统一部署，制定方案，开展国家技术创新类平台的清理和争创工作。（4）积极创建庐山国家植物园。。2．优化省级科技创新平台。（1）选准方向，新建1-2家省实验室。（2）全面完成省重点实验室优化重组工作。（3）开展省级技术创新类平台的清理整合，加强企业研发平台布局。（4）开展科技创新平台管理提升行动，修订《江西省重点实验室管理办法》，制定《江西省实验室体系建设运行管理实施办法》《江西省重点实验室积分动态管理办法（试行）》等，开展省重点实验室积分制试点工作。（5）强化省临床医学研究中心评估和动态管理，推进国家临床医学研究中心分中心建设。（6）优化省级创新平台布局，实现产业需求和地方发展有效衔接。,不属于政府领导到其他城市考察学习的新闻,0.5463641730404505,False,否
江西省,省住房保障和公积金管理中心召开全面从严治党工作会议暨警示教育会,2024-03-21,江西省住房和城乡建设厅 工作动态 省住房保障和公积金管理中心召开全面从严治党工作会议暨“3.23”警示教育会。3月20日，省住房保障和公积金管理中心召开全面从严治党工作会议暨“3.23”警示教育会。。会议传达学习了二十届中央纪委三次全会精神、省纪委十五届四次全会精神以及省住建厅全面从严治党工作会议精神。。会议指出，2023年，省住房保障和公积金管理中心党支部深入贯彻落实党的二十大精神和习近平总书记考察江西重要讲话精神，扎实开展学习贯彻习近平新时代中国特色社会主义思想主题教育，管党治党持续发力，推动形成风清气正的政治生态，全面从严治党工作取得新成效。。会议强调，2024年是中华人民共和国成立75周年，是实现“十四五”规划目标任务的关键一年。中心上下要坚持以习近平新时代中国特色社会主义思想为指导，全面贯彻落实党的二十大和二十届二中全会精神，深入学习贯彻习近平总书记关于党的建设和关于党的自我革命的重要思想以及考察江西重要讲话精神，按照省委大抓落实年的要求，围绕全省住建工作高质量发展“三年攻坚计划”，以党的政治建设为统领，以创建“四强”党支部为抓手，持之以恒抓好政治学习、责任落实、纪律教育、监督检查，以永远在路上的坚定执着，打好全面从严治党这场攻坚战、持久战，不断开创住房保障和公积金事业发展新局面。。会上，中心党支部书记、主任熊峰结合学习习近平总书记关于党的自我革命的重要思想和做好殷美根案件以案促改工作为全体干部职工讲党风廉政教育专题党课。纪检委员、副主任肖文对中心2024年全面从严治党、廉政建设工作重点任务作出具体部署。会上还集体观看了警示教育片《持续发力纵深推进》，签订了《全面从严治党责任书》。,不属于政府领导到其他城市考察学习的新闻,0.7804961937476366,False,否
江西省,全省党史部门主要负责人会议在南昌召开,2024-03-21,3月20日，全省党史部门主要负责人会议在南昌召开。省委常委、省委组织部部长庄兆林出席会议并讲话。。庄兆林指出，过去一年，全省党史部门坚持以习近平新时代中国特色社会主义思想为指导，深入学习贯彻习近平总书记考察江西重要讲话精神，聚焦主责主业，积极担当作为，守正创新、锐意进取，各项工作取得了新进展新成效。。庄兆林强调，全省党史部门、广大党史工作者要坚持不懈用习近平新时代中国特色社会主义思想凝心铸魂，学习掌握蕴含其中的立场观点方法，把握好“党史姓党”政治方向。要把学习贯彻《党史学习教育工作条例》作为重要政治任务，在学习领会上下功夫，在浓厚氛围上下功夫，在健全机制上下功夫，扎实推进党史学习教育常态化长效化。要聚焦“走在前、勇争先、善作为”的目标要求，全力服务党委中心工作，大力推进红色基因传承，着力守牢意识形态阵地，不断提升以史鉴今、资政育人成效。要进一步凝聚工作合力，加强组织领导，强化协同联动，锻造过硬队伍，着力构建大党史格局。各级党委要将党史工作纳入整体工作部署，帮助解决好存在的困难和问题。各级党史部门要认真落实省委“大抓落实年”活动部署要求，一步一个脚印做好每一项工作，为奋力谱写中国式现代化江西篇章作出更大贡献。,其他,0.8400088068002135,False,否
江西省,吉安打好十大攻坚战吹响跨越发展号角,2024-03-22,3月20日上午，省政府新闻办、吉安市联合召开“走在前、勇争先、善作为，贯彻落实习近平总书记考察江西重要讲话精神”系列新闻发布会。会上，吉安市委主要负责人表示，吉安市将坚持把学习贯彻落实习近平总书记考察江西重要讲话精神作为首要政治任务，锚定建设革命老区高质量发展先行区、全省共富共享美好生活实践区、全国红色基因传承示范区“三区”，打好培育壮大千亿产业集群、农业标准化规模化品牌化提升等“十大攻坚战”，奋力开辟高质量发展新境界。。围绕“构建现代化产业体系”打攻坚战。吉安把培育壮大千亿产业集群攻坚战作为首要之战，锚定高端化、智能化、绿色化方向，落实全省制造业重点产业链现代化建设“1269”行动，提出“6410”计划，聚力打造电子信息、新材料、先进装备制造、生物医药、绿色食品、新能源等6条重点产业链，以及4个先进制造业集群，力争全市规上工业营收年均增长10%左右。目前，该市高新技术产业、战略性新兴产业占规上工业比重分别为59.5%和36%，居全省前列。突出重大项目带动，把2024年作为重大产业项目突破年，着力招引落地投资或产值过百亿的“双百”项目，今年以来，该市签约和在谈“双百”项目达12个。。围绕“深化对内对外开放”打攻坚战。吉安坚持以开放促进发展，深化与赣州联动发展、与东莞对口合作，深度融入粤港澳大湾区主战场，强化长三角、京津冀、海西经济区等招商力量，组建粤港澳大湾区招商服务中心，实现指挥部与一线招商队有机融合，今年共派出59支招商队奔赴招商一线。同时，打好招才引智人才集聚和重点改革突破攻坚战，推进经济、文化教育、医疗卫生全领域开放，抓好名师名校长、名医名专家“双引双培”，深化营商环境“一号改革工程”，坚持和完善“亲清连心政企恳谈会”机制，打造“吉事即办”政务服务品牌。。围绕“全面推进乡村振兴”打攻坚战。吉安以打造“井冈山”农产品区域公用品牌为重点，打好农业标准化规模化品牌化提升攻坚战，给品类众多的优质农产品赋予“井冈山”品牌，一体推进商标管理、包装设计、品牌宣传、网点布局、销售渠道“五个统一”，以品牌化带动产品增值、产业增效。同时，坚持政府主导、企业运营、协会联结、群众参与，以品牌化带动农民增收、农村发展，走出了一条红色引领、绿色发展、金色富民的乡村振兴路。据统计，2023年该市冠名产品平均实现溢价15%。。围绕“扎实推进共同富裕”打攻坚战。吉安坚持以人民为中心，着力打好做强做旺中心城区、文旅高质量建设高水平运营、重点民生品质提升等攻坚战，促进共富共享。坚持政府引导、市场化运作、群众参与，引进有情怀、有实力、有业绩的经营主体，实现文旅发展与群众增收，2023年该市景区主营业务收入增长223%。突出抓好城市功能品质提升、高质量就业创业、“一老一小”服务提升、治理强基平安护航“四项行动”，组建吉安一中、白鹭洲中学等10个教育集团，持续增进民生福祉。,政府领导到其他城市考察学习或访问,0.6639851615719594,False,否
江西省,省社联第九届理事会第四次会议召开,2024-03-21,3月20日，省社联第九届理事会第四次会议在南昌召开。会议回顾总结省社联2023年工作，部署安排2024年重点任务，选举增补了省社联理事、常务理事。。会议指出，2023年，是全面贯彻党的二十大精神的开局之年，是时隔四年习近平总书记再次考察江西指引方向、擘画蓝图的一年，也是我省社科事业实现高质量发展的一年。全省社科界围绕中心、服务大局的工作导向更加鲜明，哲学社会科学事业繁荣发展的基石更加坚实，为奋力谱写中国式现代化江西篇章提供了更加坚强的思想保证和智力支撑。2024年，是中华人民共和国成立75周年，是实现“十四五”规划目标任务的关键一年。全省社科界要深入学习贯彻习近平文化思想和习近平总书记考察江西重要讲话精神，按照省委关于“大抓落实年”活动部署要求，大兴读书学习之风、调查研究之风、改革创新之风、狠抓落实之风；要高举伟大思想旗帜，在党的创新理论研究阐释宣传贯彻上深耕细作；要主动担当作为，在推进江西现代化建设重大理论与现实问题研究上精准施策；要聚焦重点任务，在构建具有江西特色的哲学社会科学学科体系上持续发力；要加强党的全面领导，在打造让党放心、人民满意的模范机关上勇当先锋。。会议对江西省第二十次社会科学优秀成果奖获奖代表和江西首届“最美社科人”进行表彰。会议还邀请了专家作习近平文化思想专题辅导。,其他,0.8489835084297329,False,否
江西省,习近平在湖南考察时强调坚持改革创新求真务实奋力谱写中国式现代化湖南篇章,2024-03-21,江西省人民政府 头条 习近平在湖南考察时强调：坚持改革创新求真务实 奋力谱写中国式现代化湖南篇章。习近平在湖南考察时强调 坚持改革创新求真务实 奋力谱写中国式现代化湖南篇章 蔡奇陪同考察。3月18日至21日，中共中央总书记、国家主席、中央军委主席习近平在湖南考察。这是18日下午，习近平在中德合资企业巴斯夫杉杉电池材料有限公司考察。新华社记者 燕雁 摄。新华社长沙3月21日电 中共中央总书记、国家主席、中央军委主席习近平近日在湖南考察时强调，湖南要牢牢把握自身在构建新发展格局中的战略定位，坚持稳中求进工作总基调，坚持高质量发展不动摇，坚持改革创新、求真务实，在打造国家重要先进制造业高地、具有核心竞争力的科技创新高地、内陆地区改革开放高地上持续用力，在推动中部地区崛起和长江经济带发展中奋勇争先，奋力谱写中国式现代化湖南篇章。。3月18日至21日，习近平在湖南省委书记沈晓明和省长毛伟明陪同下，先后来到长沙、常德等地，深入学校、企业、历史文化街区、乡村等进行调研。。18日下午，习近平来到湖南第一师范学院（城南书院校区）考察。该校前身是创办于宋代的城南书院，近代以来培养了一批老一辈无产阶级革命家和名师大家。习近平参观青年毛泽东主题展览，了解学院发展沿革和用好红色资源等情况。在学院大厅，习近平同师生代表亲切交流。他说，国家要强大，必须办好教育。一师是开展爱国主义教育、传承红色基因的好地方，要把这一红色资源保护运用好。学校要立德树人，教师要当好大先生，不仅要注重提高学生知识文化素养，更要上好思政课，教育引导学生明德知耻，树牢社会主义核心价值观，立报国强国大志向，努力成为堪当强国建设、民族复兴大任的栋梁之材。。随后，习近平来到巴斯夫杉杉电池材料有限公司考察。这是一家主营锂离子电池正极材料研发、生产和销售的中德合资企业。习近平听取当地加快发展新质生产力、扩大高水平对外开放等情况介绍，察看企业产品展示，了解材料性能测试情况和电池生产流程。他强调，科技创新、高质量发展是企业不断成长壮大、立于不败之地的关键所在，民营企业、合资企业在这方面都可以大有作为。中国开放的大门会越开越大，我们愿意同世界各国加强交流合作，欢迎更多外国企业来华投资发展。。19日，习近平到常德市考察调研。位于沅江江畔的常德河街历史悠久，曾毁于1943年的常德战役。近年来，常德市复原老河街风貌，将此地打造成为历史文化街区。当天上午，习近平来到常德河街，察看各种特色小吃、特产、特色工艺品，同店主和游客亲切交流，并欣赏非物质文化遗产技艺展示，详细了解常德老城街道修复利用、城市规划、水环境综合治理等情况。习近平指出，多姿多彩的地方特色传统文化，共同构成璀璨的中华文明，也助推经济社会发展。常德是有文化传承的地方，这里的丝弦、高腔、号子等要以适当载体传承好利用好，与时俱进发展好。。湖南是全国13个粮食主产省之一，水稻播种面积、总产量均居全国第一。当天下午，习近平来到常德市鼎城区谢家铺镇港中坪村，走进当地粮食生产万亩综合示范片区，察看秧苗培育和春耕备耕进展，听取高质量推进农业现代化情况介绍，并同种粮大户、农技人员、基层干部一笔一笔算投入产出账。习近平强调，我国有14亿多人口，粮食安全必须靠我们自己保证，中国人的饭碗应该主要装中国粮。要建设好高标准农田，推行适度规模经营，加强政策支持和示范引领，加大良种、良机、良法推广力度，在精耕细作上下功夫，进一步把粮食单产和品质提上去，让种粮也能够致富，进而吸引更多农户参与发展现代化大农业，真正把中国特色农业现代化之路走稳走扎实。,政府领导到其他城市考察学习或访问,0.0,True,是
江西省,关于举办第二届全国乡村振兴职业技能大赛江西选拔赛暨江西省第二届乡村振兴职业技能大赛的通知,2024-03-21,"江西省人民政府 人才人事 关于举办第二届全国乡村振兴职业技能大赛江西选拔赛暨江西省第二届乡村振兴职业技能大赛的通知。关于举办第二届全国乡村振兴职业技能大赛江西选拔赛暨江西省第二届乡村振兴职业技能大赛的通知。各设区市、省直管试点县（市）人力资源社会保障局、农业农村局、乡村振兴局、总工会、团委、妇女联合会，赣江新区社会发展局，省直和中央驻赣单位，省管有关职业院校、行业（协会）和民办职业技能培训机构：。根据人社部《关于举办第二届全国乡村振兴职业技能大赛的通知》（人社部函〔2024〕13号）精神，第二届全国乡村振兴职业技能大赛将于2024年5月在贵阳举办。为做好我省参赛选拔工作，经研究决定，于2024年3月举办第二届全国乡村振兴职业技能大赛江西选拔赛暨江西省第二届乡村振兴职业技能大赛（以下简称：大赛），现将有关事项通知如下。。以习近平新时代中国特色社会主义思想为指导，深入贯彻落实习近平总书记关于技能人才工作的重要指示精神和习近平总书记考察江西重要讲话精神，推动支持乡村振兴相关领域技能人才队伍建设工作，激活“技能人才引擎”赋能乡村振兴，促进经济转型升级和产业结构优化，以更高水平就业扎实推动共同富裕，培养更多乡村高技能人才、大国工匠、能工巧匠，为谱写中国式现代化江西篇章提供技能人才支撑。。（一）大赛名称。第二届全国乡村振兴职业技能大赛江西选拔赛暨江西省第二届乡村振兴职业技能大赛。。（四）竞赛项目。大赛拟设砌筑工、汽车维修工、农机修理工、电工、美发师、养老护理员、育婴员、中式面点师、餐厅服务员、电子商务师、茶艺师、中式烹调师、手工木工、茶叶制作工等14个比赛项目（前11个为第二届全国乡村振兴职业技能大赛比赛项目，后3个为我省特设比赛项目）。。（五）办赛形式。采用集中办赛、面向社会公众开放的办赛模式，在赛事同期组织开展技能展示交流和劳务品牌展示活动。。（六）参赛方式。分全省总决赛和各设区市（行业）及以下选拔赛。全省总决赛以各设区市人力资源社会保障局、赣江新区社会发展局、省直有关厅局，相关企业和行业协会为单位组队参赛，大赛设职工组和学生组，各参赛代表队每个竞赛项目可选派2名选手参赛，其中职工组和学生组各1名，赣州市每个竞赛项目职工组可增派1名选手参赛。。（七）报名条件。具备农业家庭户籍、年满16周岁（2008年5月1日前出生）、法定退休年龄以内的人员（含灵活就业人员）均可按属地原则（在江西省内学习或工作满1年以上）报名参赛,鼓励各地脱贫人口（含监测对象）、乡村振兴重点帮扶县的人员参赛，已获得“中华技能大奖”“全国技术能手”称号或已取得“全国技术能手”申报资格的人员,不再以选手身份参赛。。（八）裁判组。大赛设置1名总裁判长和1名总裁判长助理，各项目设置1名裁判长（专家组长）、1名裁判长助理和若干名裁判员。总裁判长和总裁判长助理由组委会指定，各项目裁判长和裁判长助理从各相关单位上报的推荐材料中遴选产生，由其组织制定技术文件、命制比赛试题、确定评分标准、负责比赛评判工作等。裁判员由各参赛代表队按参赛选手人数等额推荐（同一项目同一代表队推荐裁判人数不得超过2人），确有需要的项目由组委会在具有相应执裁经验的人员中择优选择，裁判员具体要求见各项目技术文件。裁判员按照公平公正原则和裁判组分工，承担相应比赛项目的执裁和评分工作。。（一）金牌、银牌、铜牌和优胜奖。对各竞赛项目各组别获得前3名（选手排名原则上不并列）的选手，相应颁发金、银、铜牌奖牌和证书，分别给予1万元、0.8万元、0.5万元奖励。对前3名以外但排名在参赛人数1/2以内（含）的选手，颁发优胜奖证书。其他参赛选手颁发参赛证书。",其他,0.995087909538058,False,否
江西省,全省推进红色审计史料汇编课题座谈会在赣州召开,2024-03-21,3月18日，全省推进红色审计史料汇编课题座谈会在赣州召开。省审计厅党组成员、副厅长王建新，省委党史研究室副主任刘津出席会议并讲话，省审计厅二级巡视员邬晓明主持会议。省审计厅、省委党史研究室、江西人民出版社、赣州市委党史研究室及赣州、萍乡、吉安等地市审计局有关负责同志参加会议。。会议讨论了江西红色审计史料汇编课题工作方案和编辑规范，明确了课题分工、工作安排和资料整理要求，赣州市委党史研究室、江西人民出版社分别围绕红色审计史料挖掘整理及出版作交流发言，各责任单位就进一步做好江西红色审计史料收集、整理和挖掘工作达成共识。。会议指出，开展红色审计史料研究是深入学习贯彻习近平文化思想、习近平总书记关于审计工作的重要指示批示精神和考察江西重要讲话精神的重要举措，对引导激励审计干部在重温历史中传承审计基因，具有重要历史启示价值和现实指导意义。要将红色审计史料汇编课题研究作为今年一项重大审计文化建设工程和党建工作来抓，以高度的政治责任感和历史使命感完成好工作任务。。会议强调，各成员单位要组建好工作专班，把握好时间节点，明确专人落实工作事项，以“时时放心不下”的责任感、时不我待的紧迫感，充分调动大家的积极性、主动性、创造性，提高工作效率、加快工作进度，有序推进红色审计史料汇编课题方案工作任务不折不扣完成。。会议要求，要保质保量做好红色审计史料汇编研究工作，努力打造红色审计文化宣传江西精品。要坚持政治引领，突出江西作为红色审计事业发祥地的重要历史地位，突出红色审计史研究对探寻中国共产党审计工作的源头活水、传承红色审计基因的重要历史启示价值，突出红色审计史研究对江西审计事业高质量发展的重要现实意义。要确保史料质量，严格按照本次会议讨论确定的凡例、标准和要求，统一做好史料收集、整理、拓展、录入等工作，确保忠于原文，保持原汁原味。要确保编校质量，将精品意识贯穿于课题研究的全过程，争取党史和编校出版等方面权威专家的支持与指导，善用“外脑”努力打造江西审计文化精品。,其他,0.902795971388551,False,否
