province,topic,date,content,label,score,is_match,是否为“学习考察”新闻
浙江省,市党政考察团赴上海市安亭镇瑞籍在沪企业考察学习市党政考察团赴上海市安亭镇瑞籍在沪企业考察学习,2019-06-03,昨天，我市党政代表团来到江苏省吴江市进行学习考察。市委书记毛宏芳，市人大常委会主任孙钜昌，市政协主席陈建泰，市委常委、常务副市长诸晓蓓等市四套班子领导，市直有关部门和各乡镇、街道党政主要负责人参加学习考察。吴江市领导梁一波、范建坤、汤卫明等陪同考察。 吴江市位于江苏、浙江和上海三省市的交界处，市域面积1176平方公里，户籍人口80.2万，素有古运河畔“鱼米之乡”、“丝绸之府”的美称。2011年，全市实现地区生产总值1192亿元，完成地方一般预算收入112.88亿元、全社会固定资产投资521.7亿元、工业总产值超3700亿元，主要指标均居苏州各县市前列。该市先后荣获国家卫生城市、中国优秀旅游城市、全国创建文明城市工作先进市、国家环境保护模范城市、国家园林城市等20多项国家级荣誉称号。 代表团实地考察了盛泽镇、东方丝绸市场、恒力集团、滨湖新城、亨通集团。在随后举行的两地交流座谈会上，吴江市委副书记、市长梁一波对我市党政代表团到吴江市学习考察表示欢迎，并从产业发展、平台搭建、城市建设、社会事业等四个方面介绍了吴江市经济社会发展情况。 毛宏芳代表我市党政代表团感谢吴江市的热情接待。他表示，近年来，吴江始终走在全国发展“第一方阵”，创造了很多好做法、好经验，吴江的新变化、新成就令人鼓舞。通过实地考察和座谈交流，代表团全体人员深刻感受到吴江在科学发展、加快转型中呈现的高新技术产业产值比重高、企业规模大、产业特色明显、新兴产业平台搭建好等特色，内心触动很大。要认真学习吴江加快经济转型升级、高水平统筹城乡发展、大力发展社会事业等方面的先进经验和做法，助推余姚经济社会又好又快发展。,其他,0.6798183108471293,True,是
浙江省,眉山市政府考察团来我市学习考察园区建设发展工作眉山市政府考察团来我市学习考察园区建设发展工作,2020-05-15,近期，都市产业园推进办组织部门分管领导、街道分管经济副主任、企业总经理开展学习考察活动，参观、学习上海一通世界商务园在都市产业平台建设、运营等方面的先进经验和有效做法。。一通世界商务园区，紧邻虹桥枢纽，尽享虹桥商务园区、上海西郊经济开发区、国家会展中心的战略先享优势，同时汇聚航空、高铁、高速、地铁等现代化交通设施，无缝连接内环、中环、外环线，轻松实现长三角一小时经济圈。公司主营业务包括以商务园区或产业园区为主题的产业地产开发与管理，为入驻企业打造良好的发展平台。在一通世界商务园区内，首先参观入驻企业绿驰汽车，其轿跑车型“天王星”，其在外观内饰设计、智能科技配置以及人工智能的应用上都达到了相当高的标准。接下来参观紫光乐联物联网科技有限公司，紫光物联UIOT通过物联网、云计算、语音识别、人工智能技术，连接家庭电工产品、暖通舒适设备、安全和影音等系统，构建互联互通的家庭物联网。实现美好生活（家庭、酒店、办公、养老）的全面智能化，为用户创造更方便、更快捷、更舒适、更安全、更健康、更聪明、可持续发展的居住环境。。在会议过程中，大家边看、边听、边思、边议，童局一行和企业方深入互动交流，详细了解了该项目的平台建设、运营、管理等情况。童局认为，这次到上海一通世界商务园实地考察收获颇丰。一方面，一通世界商务园专注于产业园区的投资运营，在产业园区管理、企业文化创造、中小微企业服务等方面的先进经验值得嘉兴南湖区去研究，未来希望双方有更进一步的合作。另一方面，上海青浦区在为园区、企业提供优质政务服务的做法相当成熟可行，相关政策有很强的借鉴学习意义。。真切地感受到一通世界商务园强劲的发展态势，深受触动、深受教育，也深受启发。大家纷纷表示，要以此次考察学习为契机，把一通世界商务园建设管理方面的好经验、好做法带回南湖，学习好、借鉴好、运用好，结合我区发展实际，进一步明确产业集聚区发展方向、功能定位和主导产业，加大招商引资力度，促进产业集群集聚发展，加强城市建设和管理，促进经济社会持续健康发展。,其他,0.6100295193844391,False,否
浙江省,个国家学员抵奉学习考察个国家学员抵奉学习考察,2018-10-23,图为县委书记林健东和县委副书记、县长林康率领县委理论学习中心组成员参观福建省宁德市城市规划馆，听取城市、港口规划介绍。。天的考察学习，以进一步提高县委理论学习中心组成员的理论水平，找差距学经验，谋划我县“十二五”跨越发展新思路。。近几年来，温州市苍南县、瑞安市以及福建省宁德市蕉城区、福鼎市等地树立和落实科学发展观，抢抓机遇，开拓创新，在发展工业经济、茶产业、旅游产业和城市规划建设、火车站场规划建设等方面取得了较好的成效，推动了经济社会又好又快发展，同时也积累了许多成功的经验。。此次考察学习是我县进一步深化“三县并举”发展战略，推进“两区”建设，促进我县“十二五”经济社会跨越发展的一次大型外出学习考察活动，也是一次主动走出去找差距、学经验和谋发展的重大活动。考察学习期间，县委理论学习中心组成员将实地考察温州苍南、瑞安以及宁德蕉城、福鼎等地城市规划建设、主导产业发展等方面的情况，并听取各地的发展经验介绍。县委理论学习中心组成员表示，要虚心学习各地的成功经验和做法，进一步解放思想，紧密结合松阳实际，积极谋划“十二五”开局之年以及“十二五”期间促进本地经济社会发展的新思路、新举措；同时抓住松阳铁路建设契机，接轨海西，融入长三角，在发展工业经济、效益农业等方面提出合理建议和思路，更好地推进我县“两区”建设，促进松阳经济社会持续快速发展。。当日，县委理论学习中心组一行实地考察了蕉城区海上养殖场、三都澳港口和宁德城市规划馆，之后两地举行了经济社会发展情况交流会。,政府领导到其他城市考察学习或访问,0.843934170553999,False,否
浙江省,项敏率团赴温州上海学习考察项敏率团赴温州上海学习考察,2018-04-14,近日，全国人大代表、国务院学位委员会农林经济管理学科评议组召集人、南京农业大学经管学院院长朱晶教授一行5人来安吉鲁家村考察，浙江农林大学经济管理学院朱臻副教授陪同。安吉县农业农村局经管科黄德云陪同。,其他,0.9789370413805366,False,否
浙江省,县政务数据办赴海门学习考察县政务数据办赴海门学习考察,2021-03-16,经信商务局、统计局、商品交易产业园管理办公室、市场监管分局、税务局等有关部门负责人陪同。。商品交易产业园管理办公室向考察组介绍了市场发展情况。双方交流市场税收征管及社零指标统计工作，金华市金东区人民政府副区长曹国军,其他,0.874942509108215,False,否
浙江省,市党政代表团赴吴江学习考察市党政代表团赴吴江学习考察,2012-05-24,4月3日上午，海盐县政协副主席，县住建局党委书记、局长肖钰鑫率海盐县武原街道、城投集团、住建城乡建设局相关负责人一行来月河街区考察学习历史街区开发运营经验。旅发公司常务副总经理姚叶鸣、物管事业部相关负责人陪同。。肖钰鑫副主席表示，月河历史街区经过多年的运营管理，取得了良好的成效，已成为嘉兴旅游的金名片，希望通过此次考察学习，为海盐县正积极谋划推进的杨家弄区块开发建设汲取有效的开发管理经验。。在随后的交流座谈会中，常务副总经理姚叶鸣详细介绍了月河历史街区的保护开发建设、业态定位、运营管理过程及近年来在历史街区管理工作中取得成绩和先进的经验做法，并交流了目前正在积极推进的芦席汇街区保护开发、梅湾街区整治提升以及湖滨区块、“月芦文杉”片区开发建设的规划和进展。考察团成员纷纷表示，当前，嘉兴市正在全面加快城市建设步伐，尤其是月河历史街区在前期规划、后期运营管理方面有很多经验与做法值得学习和借鉴，希望进一步加强双方的沟通交流合作，不断推进各项城市开发建设工作的健康发展。,政府领导到其他城市考察学习或访问,0.0,False,否
浙江省,上海一通世界商务园学习考察上海一通世界商务园学习考察,2018-10-24,月1日上午，湘潭市发改委副主任文亦良一行七人来到市审管办，考察我市产业投资项目“企业承诺制”、模拟审批等投资项目审批“最多跑一次”改革工作。市发改委窗口负责人沈军卫、市代办中心林澎科长接待了考察组一行，并详细介绍了我市投资项目审批“最多跑一次”改革工作进展情况，双方重点就投资项目审批网上受理2.0系统建设运用情况和投资项目审批代办服务工作开展情况展开了交流。考察团表示，此次考察为湘潭市推动当地政务服务工作提供了很好的借鉴。,其他,0.8857787244162587,False,否
浙江省,县委理论学习中心组赴温州宁德等地考察学习县委理论学习中心组赴温州宁德等地考察学习,2020-07-07,代表团一行参观了横店镇迎宾大道、横黄线、万盛南街等主要道路以及梦幻谷景区入口、中兴联村尚伦庄自然村等重要改造节点，对横店近期的改造情况高度肯定。横店镇自开展风貌提升以来，不断完善基础设施，美化环境，规范秩序，并结合影视元素，积极推进产业植入等工作。在座谈会上，浦江县代表团同横店风貌提升相关工作组进行了深入交流，表示要学习借鉴横店建设经验。,其他,0.8581771948954161,False,否
浙江省,浙江农林大学赴鲁家学习考察浙江农林大学赴鲁家学习考察,2019-04-18,4月10日，嘉善公积金中心一行到我中心开展学习考察。考察主要围绕“让金回家专项服务、受托银行及延伸网点的考核与管理”两大块内容进行开展，我中心分管领导与业务负责人积极分享过往业务开展中一系列经验与成效，同时也向嘉善公积金积极学习归集扩面、信贷风险防范等方面经验。。此次交流仅为期一天，但另双方都收获满满，在之后的工作中，我中心也会加强对于优秀经验的汲取学习，积极做到“走出去，引进来”。,其他,0.774942895379696,False,否
浙江省,金华市京东区来我区学习考察金华市京东区来我区学习考察,2019-03-01,月20日至21日，张建生局长、陈志林副局长率局办公室、综合处、市场处、商贸处、外贸处、外资处等处室负责人，先后前往常熟、南通考察学习。分别与常熟市商务局、南通市商务局进行座谈交流，并实地考察了常熟服装城、南通中央创新区。。在常熟市商务局，张建生局长一行听取了常熟服装城市场采购贸易方式试点、招大引强工作情况介绍。就市场采购贸易方式中的机制建设、监管模式、扶持政策以及通过招大引强推动产业结构调整等进行了深入交流。。在与南通市商务局的座谈中，双方围绕接轨上海体制机制、外贸新业态新模式、招大引强、商贸流通、促消费等主题进行了重点交流，就如何破解发展中遇到的问题进行了深入探讨。,政府领导到其他城市考察学习或访问,0.9803137419106868,False,否
浙江省,海盐县住房和城乡建设局考察团来月河街区考察学习海盐县住房和城乡建设局考察团来月河街区考察学习,2019-04-04,6月16日上午，桐庐县司法局党组副书记、副局长陈伟明带队一行到嘉善考察学习行政执法协调监督、法治建设和大调解等工作，嘉善县司法局党组成员、副局长蒋伟，党组成员、政治处主任沈学佳，相关科室负责人等陪同。。考察组一行实地查看了县法治宣传教育中心暨青少年法治教育实践基地和县社区矫正中心，详细了解中心的基础建设及相关工作开展情况。随后，考察组一行实地走访了西塘司法所，查看了司法所的硬件设施建设，观看了司法所宣传片，详细了解了品牌调解室建设、基层法治文化建设等工作情况。。座谈会上，双方围绕行政执法协调监督工作体系、法治考核评分体系和大调解工作体系建设等内容进行了深入交流与探讨。考察组对嘉善法治建设等工作给予了充分肯定。,政府领导到其他城市考察学习或访问,0.0,False,否
浙江省,湘潭市发改委赴我市考察学习湘潭市发改委赴我市考察学习,2018-06-08,9月2日下午，区党政代表团先后前往宁波舟山港穿山港区、臻至机械模具公司、灵峰工业社区等地开展实地考察。。在宁波舟山港穿山港区，区党政代表团详细听取了港区情况介绍。据悉，宁波舟山港穿山港区岸线长约3740米，前沿水深在-17米以上，共建设有11个集装箱专用泊位及配套工程。目前共配有桥吊49台，龙门吊153台，其他流动机械近500台等各类专业集装箱装卸设备，可满足最大型的集装箱船舶的作业。。站在港区的室外平台，俯瞰港区全貌，远眺远洋轮船的装卸作业，远处海面上载满集装箱货物的万吨级船舶穿梭往来，港区内一片繁荣景象。林霞指出，该港区功能齐全，综合配套服务能力强，打造出一条港口经济发展之路，我区可学习其良好的运营管理模式，为我区港口经济发展建设推波助力。。在灵峰工业社区和臻至机械模具公司，区党政代表团详细听取了企业数字化改造和小微园区“社区化”管理模式等介绍。林霞表示，该园区在规划、园区建设、产业布局，以及优化营商环境等方面的做法，值得学习借鉴。。9月3日上午，区党政代表团先后前往宁波大榭开发区华泰盛富聚合材料有限公司、万华化学集团宁波公司等地实地考察。。据悉，万华化学是一家跨国运营的大型化工新材料上市公司，主营异氰酸酯及衍生产品的开发和生产，是国内唯一、全球第6家拥有MDI制造技术自主知识产权的企业，是首批国家创新型企业、国家技术创新示范企业。区党政代表团参观了企业展览馆，学习和了解了万华化学的发展历程、企业现状以及各阶段所取得的成就。。考察中，区党政代表团还参观了大榭开发区展览馆，了解大榭开发区建设的历史进程和产业发展等情况。,其他,0.6830375654560646,False,否
浙江省,浦江率代表团到东阳考察学习浦江率代表团到东阳考察学习,2016-06-22,9月4日，四川省经信委副主任方存好一行7人来我省学习考察，就制定四川省信息化条例与我委进行座谈交流。我委陈建忠副主任介绍了我省信息化促进条例的背景情况、经验效果以及实施过程中存在的一些困难和问题，相关处室负责人就我省制定和实施信息化促进条例过程中的创新要点、信息安全的应急处理、信息设施管理等方面进行了介绍和交流。。委信息化处、信息安全处、信息设施处、法规处、软件处、电子信息办的负责人参加了座谈交流。（欧阳苹荪）,政府领导到其他城市考察学习或访问,0.0,False,否
浙江省,嘉善公积金中心前来学习考察嘉善公积金中心前来学习考察,2024-04-19,在甬江实验室党委书记、主任崔平的带领下，叶枝利参观新型显示与感知研究中心、精准光子集成研究中心、材料分析与检测平台、先进结构陶瓷研究中心等，同科研人员面对面交流，详细了解实验室各研究领域的最新进展和成果。。座谈交流中，叶枝利详细了解甬江实验室研究领域布局、技术创新、代表性科研进展、成果转化、人才引进等情况，并就科技创新等工作开展交流。。“来甬江实验室学习考察，收获很大。”叶枝利说，甬江实验室贴近实际，将实验室成果转化为新质生产力，让科技创新有了“生命力”。当前，海曙正围绕“双创”驱动、“双链”引领，加快发展人形机器人、算法算力等未来产业，持续打响“创新创业就来甬水桥翠柏里”品牌。希望双方能进一步深化对接交流，多沟通、多了解，加强实验室科研项目同海曙资源要素匹配，争取嫁接落地更多项目成果。,其他,0.8084602721498794,False,否
浙江省,嘉兴市商务局赴江苏考察学习嘉兴市商务局赴江苏考察学习,2017-12-27,为进一步做好创新创业工作，学习先进工作经验。8月27日，市就业中心副主任刘昶带队赴宁波考察学习创新创业工作，全国大学生创新创业总部基地、定海基地、普陀基地相关人员参与调研。。上午，刘昶副主任一行与宁波市就业管理中心相关负责人进行了座谈，深入交流创业补贴受理，创业担保贷款管理等方面的做法，特别是宁波创业大赛等活动的组织工作，为我市举办创业大赛提供了先进经验。。下午，刘昶副主任一行实地调研创业孵化示范基地宁波高新区激智研究院和甬港现代科技园，详细了解园区运营模式、企业孵化工作。园区负责人就如何提高园区对入驻企业的服务能力，如何通过管理人员与入驻企业“一对一建群”的模式，加深园区方与企业方的情感联系等作了详细介绍。。下一步，我中心将吸收宁波优秀的创业工作经验，深化我市的双创氛围营造，提升新区创业环境；依托舟山全国大学生创业大赛，加强落地创业项目的服务能力，实现创业工作的创新发展。,政府领导到其他城市考察学习或访问,0.0,False,否
浙江省,桐庐县司法局赴嘉善考察学习桐庐县司法局赴嘉善考察学习,2022-06-20,近日，武义县组织森防检疫工作人员和综合行政执法生态科工作人员，专程到重大外来有害生物——红火蚁发生区学习考察，认识红火蚁，了解红火蚁习性和危害，学习防控知识，推进本地防控重大外来有害生物能力建设。。武义县目前尚未发现红火蚁入侵，但周边县市疫情不同程度发生或发生过。当天，武义县考察组一行6人来到距离武义最近的一个邻县疫点，与承包防治的第三方公司接洽，近距离观看红火蚁活体、蚁巢等，座谈交流防控技术方法，请教市森防站专家，还饶有兴趣地参观了第三方公司的实验基地，收到了公司赠送的一整套红火蚁浸渍标本，收获满满。。武义县充分认识到红火蚁防控的重要性，在国家启动林草生物灾害防控宣传周活动之际组织红火蚁防控考察学习，通过考察学习，今后将更加注重防控宣传，更加注重检疫执法，积极开展红火蚁检疫执法，依据《植物检疫条例》和《植物检疫条例实施细则》等法律法规，加强外地调运进入县境带土苗木的检疫复检，发现违法及时立案查处，做到检疫有责检疫尽责，守好红火蚁防控的第一道关口。,其他,0.9771215045841528,False,否
浙江省,区党政代表团赴宁波考察学习区党政代表团赴宁波考察学习,2020-09-07,近期，上海市普陀区人民政府办公室副主任朱天峰一行来我办参观交流，江干区政府办公室副主任胡文进、区审管办副主任娄莹等进行接待。参观团进一步了解江干区“最多跑一次”改革进展情况，学习杭州在打造“数字化”服务型政府、惠企政策亲清在线、信息化应用等方面的成功经验。,政府领导到其他城市考察学习或访问,0.5815993048171549,False,否
浙江省,四川省经信委来我省学习考察四川省经信委来我省学习考察,2014-09-10,上午，考察团一行来到了台州市委市政府所在地椒江区。一进入城区，我们就被崭新、布局合理的城市吸引住了：高楼大厦、精美住宅、宽阔的公园，丝毫不见旧城的踪迹。这座年轻而又富有活力的城市，成了现代化城市的代表。。飞跃集团总裁邱继宝的一番介绍，也让我们深受鼓舞。他经过２０年的艰辛创业，创造了世界名牌，目前企业总资产达。随后，我们又参观了工业反哺农村的典型——下陈街道牛轭村。这里，农民享受的是现代生活：漂亮的别墅、高档的公共设施等，凡是。在这里，我们参观了著名的吉利集团旗下的吉利轿车公司，由于公司注重技术创新，实现了自造汽车发动机和变速器的梦想，因此产销势头很好，目前已具备了年产。万辆轿车的水平。在参观了轿车整装车间后，参观者饶有兴致地试驾起刚刚下线的吉利金刚轿车。。随后，我们参观了污水处理厂和方林村，特别是方林村通过整合集体土地资源，发展汽车城，壮大集体经济，推进新农村建设的做法非常诱人。通过市场的建设，方林村每年获得收益。考察团成员在接受采访时纷纷表示，通过考察，看到了松阳与发达地区的差距，深感肩上责任之重大，今后务必抓住机遇，抓工业经济、抓城市建设、抓新农村建设。,其他,0.9919746132167612,False,否
浙江省,区领导赴甬江实验室学习考察区领导赴甬江实验室学习考察,2024-03-12,考察组重点考察了中国轻纺城跨境电商产业园、跨境电商综试区监管中心和中国轻纺城展示中心，并与当地商务局进行交流沟通。座谈会上，柯桥区商务局介绍了市场采购贸易试点申报工作及跨境电商“首单”情况；绍兴市商务局总经济师从体系建设、实施方案、项目建设、园区建设、政策建设、机制建设等6方面详细介绍了跨境电商综试区建设工作；钱肖华局长从如何抓运营、培训以及建立长效机制等方面进行了交流。。陈肖力局长表示，这次绍兴考察学习对我们下步实质性工作具有指导意义，希望绍兴市商务局等有关部门能大力指导台州跨境电商、市场采购工作，同时邀请绍兴同仁来台州交流，推进两地商务工作联系。。市财政局、台州海关、人民银行台州市中心支行、市邮政局等单位分管领导及处室负责人，椒江区、路桥区商务局主要领导，集聚区经科局分管领导以及市局相关处室负责同志参加考察。,其他,0.658659746891802,False,否
