province,topic,date,content,label,score,is_match,是否为“学习考察”新闻
浙江省,澳门特区文物保护和管理考察团赴杭考察学习澳门特区文物保护和管理考察团赴杭考察学习,2018-11-06,12月4日上午，由鹤壁市委副书记张然率领的考察团来我区，实地考察学习文明城市创建工作。区委常委、宣传部长朱建忠等陪同。。考察团一行先后来到衣裳街、小西街、红丰农贸市场等地，深入了解我区诚信街区、历史文化街区和文明示范农贸市场等建设工作，详细询问文明城市创建工作有关情况，对我区文明城市建设的举措和亮点给予高度评价。考察团表示，湖州吴兴成功创建全国文明城市工作力度大、成效显，经验值得学习借鉴，通过实地考察观摩很受启发。。今年是全国文明城市复评大考之年，湖州市在全国64个复评地级市中位列第一。我区在本次测评中共涉及21类、51个点位，占全市的81%和80%，全面助力了全市实现文明城市“二连冠”。工作中，我区“全面发动、全民参与、全力以赴”，深入扎实推进创建行动，抓铁有痕、踏石留印，积累了一批宝贵的经验：坚持树立“全民创建”的理念，做到协同推进、文明共建，既充分发挥党委政府在社会管理中的主导作用，又积极探索群众参与社会管理的机制和途径，形成社会治理人人参与、发展成果人人共享的良好局面；坚持聚焦“主流价值”的引领，做到成风化人、文明有礼，把培育和践行社会主义核心价值观作为一项基础性工程，让文明城市建设工作贯穿群众生活的方方面面，引导群众明礼仪、讲公德，涵养文明素质，提高道德水准；坚持构建“问题导向”的机制，做到常态长效、持久文明，完善、固化督查考核机制、部门共建机制、联合执法机制等长效机制，实现常态长效管理，让文明内化于心、外化于行。,政府领导到其他城市考察学习或访问,0.0,True,是
浙江省,区领导赴成都市考察学习区领导赴成都市考察学习,2023-10-27,邵峰主任一行先后考察了西充农产品精深加工园、南部县物流仓储中心项目、阆中市基层供销社、苍溪县五龙镇草莓基地、剑阁县白龙基层供销社、公兴镇凤凰村帮扶项目、北川县蓝莓基地等。。9月29日，浙江省供销社、四川省供销社工作座谈会在绵阳举行，交流了两省供销社工作情况和开展战略合作的意向，就推进东西部扶贫协作及蓝莓基地建设进行了商谈。邵峰表示，这次来四川，处处感受到了四川省供销社改革发展的丰硕成果，感受到了四川扶贫开发工作的丰硕成果。推进东西部扶贫协作，对于促进区域协调发展、实现共同富裕、深化系统内的联合合作具有重要意识。浙江省供销社将深入贯彻中央和浙江省委、省政府的部署要求，带着深厚感情、注重实际效果、坚持不懈地做好对口帮扶工作，促进形成共同发展的发展局面。。座谈会上，举行了四川农业会展集团、浙江蓝美农业有限公司合作协议签约仪式。四川省供销社领导杨武秀、彭刚陪同考察，省供销社、兴合集团相关部门、杭州果品集团、浙江蓝美农业有限公司负责人参加考察。,其他,0.9588094629625328,False,否
浙江省,永嘉县考察团来乐学习考察文明城市创建工作永嘉县考察团来乐学习考察文明城市创建工作,2022-07-25,为进一步加强援青工作，深化两地交流合作，格尔木市委常委、副市长、宣传部部长眭晓波率有关部门一行9人，于5月23日至24日来我市学习考察。。考察团先后赴温州市委宣传部、市委网信办、市广电中心进行考察座谈；在喜来登酒店举办“云上格尔木？玉出昆仑山”2016年格尔木旅游走进温州专场推介会；就邀请我市党政代表团届时出席“2016中国？青海绿色发展投资贸易洽谈会”(简称‘青洽会’)和“2016中国青海格尔木昆仑文化旅游节”相关活动事宜进行衔接工作。。我市市委常委、宣传部部长胡剑谨，市旅游局局长王爱香、市发改委(市对口办)副主任张祖新等参加了有关活动。,政府领导到其他城市考察学习或访问,0.9204020038759992,True,是
浙江省,鹤壁市考察团来吴考察学习文明城市创建工作鹤壁市考察团来吴考察学习文明城市创建工作,2020-12-11,会上，镇党委书记沈菊英讲话，从五个力着手，推介新塍。一是吸引力——良好的区位优势，包括大交通优势和地理优势。二是潜在力——深厚的人文资源，包括千年历史、传统美食、民俗文化和古镇开发与旅游发展。三是发展力——优美的生态环境。四是助推力——坚实的产业基础。五是亲和力——和谐的投资环境。。听了沈书记的讲话，与会人员对新塍颇有兴趣，纷纷索要新塍镇招商手册，以便考察、投资、创业。会上共发出二百份左右招商手册。。同时，浙江海利士电器有限公司开展在昆明经销12周年答谢和新品推介会。公司始建于1993年，地处长三角的经济中心地带——嘉兴市秀洲区新塍镇，交通十分便利。公司占地38万平方米，现有在岗职工1500多人，年内外销规模超10亿。公司是嘉兴市最具规模和发展潜力的冷柜、陈列柜、冰箱制造企业，也是嘉兴唯一一家获得食品冷柜(>500升)生产许可证企业，年产冷柜100多万台、冰箱50万台等。公司以多种系列制冷产品和精湛的制冷工艺满足了消费者的多层次需求，是国际著名冷柜品牌三洋、伊莱克斯等出口冷柜的唯一指定制造商。近几年，公司注重科技投入，自主研发新产品。今年6月，公司的44个型号产品入列节能产品惠民工程高效节能家用电冰箱推广目录(第一批)，成为嘉兴市唯一一家入列企业。,其他,0.8992327350335886,False,否
浙江省,邵峰主任赴四川考察学习邵峰主任赴四川考察学习,2018-10-09,11月21至22日，县委书记项乐民率党政代表团一行赴江苏省常熟市、苏州高新区、吴江区学习考察，学习当地经济社会发展的先进经验和做法。县级领导罗国建、陈健、沈志伟、陈佐平、王少华、姚夏林、陈永明、杨永林、吴志新，各镇（街道）、有关部门主要负责人参加考察活动。。考察中，一个个高端智能的工业项目、一幅幅优美的生态画卷，给考察团留下了深刻的印象，也开阔了眼界、学习了经验、树立了信心，增强了加速赶超发展的使命感和紧迫感。。常熟市是全国同类城市中首家国家园林城市、绿化模范城市和国际花园城市，城市建设可圈可点。其中尚湖作为国家城市湿地公园，实现了湖光与山色相融、生态和文化齐飞，为我县景城相融发展提供参考和借鉴。。近年来，常熟市坚持创新驱动，不断优化产业结构，取得了显著成效。丰田汽车（常熟）零部件有限公司是该市重点发展的汽车及零部件产业中的一家知名企业。考察团一行深入企业生产车间，观看汽车生产流程，听取生产工艺提升、销售市场拓展等情况。考察团成员对常熟市积极转型升级，致力于发展汽车产业，培大育强成效明显等表示肯定。。苏州胜利集团在主营业务电视、笔记本电脑、移动通讯、智能制造、新能源材料等方面均已实现行业领跑，在该企业的厂房内，机器人正挥舞蓝色“手臂”忙个不停，一台台自动化生产设备、检测设备和运输车井然有序运行着。在这里，智能制造有效提高了产品质量和生产效率，降低了能耗和成本，也推动着产业工人和技术人员的升级。。随后，考察团还参观了苏州高新区展示馆。该馆全方位展示了高新区践行“两高两新”，在科技创新、经济发展、城市建设、生态保护、民生事业等方面取得的丰硕成果。。进入吴江区，马路沿线成片的景观带和停放有序的机动车让人在细节处就能感受到城市的文明程度。在东太湖生态旅游度假区展示中心，考察团详细了解了该度假区的综合整治工程，重点项目和总体规划。。苏州博众精工科技有限公司属于智能装备制造行业，一进企业，由公司自主研发生产的机器人就热情地迎上前“打招呼”。移步生产车间，整洁有序的操作环境也让人开了眼界，更值得一提的是，公司作为国内最大的智能制造成套解决方案供应商，为客户提供客制化解决方案，参与到各个环节的一体化服务中，实现了制造业供应链中各成员企业的价值增值，这一做法让考察团成员耳目一新，频频点赞。。在苏州明志科技有限公司，企业的压铸生产、铸造技术研发、“智能工厂”等科技创新、规范管理给考察团留下了深刻印象，在监控系统前，“人机一体”的自动化操作一目了然，对我县传统制造行业如何提升智能化、降低能耗促转型等方面提供了很好的启示。,政府领导到其他城市考察学习或访问,0.0,False,否
浙江省,格尔木市学习考察团来温格尔木市学习考察团来温,2016-05-26,9月27日，由诸暨市教育局普教科副科长宣奇琴带领的诸暨考察团一行，来我市学习借鉴特殊教育“卫星班”建设工作中的先进经验和做法。市教育局教育科副科长王小强和市特殊教育指导中心主任叶圣海陪同考察。 考察团一行实地参观了乐成二小潘湖校区“卫星班”资源教室，详细询问了“卫星班”的硬件与师资配备、学生评估、课程设置和班级安置等情况，并深入课堂和课间，了解“卫星班”学生融合情况。 座谈会上，考察团听取了我市特殊教育“卫星班”建设工作的情况介绍，并给予了高度评价，还就“卫星班”运行机制、专业师资队伍建设等方面进行了深入交流。“希望通过本次考察，两地多多交流，互通有无，共同推进两地特殊教育的发展。”宣奇琴说。。考察团一行实地参观了乐成二小潘湖校区“卫星班”资源教室，详细询问了“卫星班”的硬件与师资配备、学生评估、课程设置和班级安置等情况，并深入课堂和课间，了解“卫星班”学生融合情况。。座谈会上，考察团听取了我市特殊教育“卫星班”建设工作的情况介绍，并给予了高度评价，还就“卫星班”运行机制、专业师资队伍建设等方面进行了深入交流。“希望通过本次考察，两地多多交流，互通有无，共同推进两地特殊教育的发展。”宣奇琴说。,其他,0.9846985820715682,False,否
浙江省,新塍商会赴云南学习考察新塍商会赴云南学习考察,2012-11-13,12月14日，香港岛各界社团骨干学习考察团一行20余人来我市考察交流。市政府副秘书长周宝林、市港澳办副主任张小华、越城区侨办主任陈烨雷接待客人一行。。考察团此行来绍旨在与绍兴相关社区开展考察交流。在越城区府山街道越都社区，考察团在当地社区干部陪同下参观了该社区党员之家、党建展览厅、三社联动区、藏书楼等。随后，双方还进行了座谈，越都社区介绍了本社区基本情况，并就落实网格化管理、完善网格管理考核制度、提升社区服务水平等与客人交换了意见。考察团荣誉顾问、中央政府驻香港联络办公室港岛工作部副部长范克胜先生表示，越都社区卫生、商业等管理工作协调得井然有序，为居民打造了一个宁静宜居的环境，让大家深受启发，今后两地就社会管理可以相互学习、相互借鉴。考察团团长、香港坊众社会服务中心总干事黄丹莉表示，香港社区工作与内地有很多相通相似之处，越都社区环境整洁，百姓生活和谐，对大家留下了深刻印象。,政府领导到其他城市考察学习或访问,0.7328748730987309,False,否
浙江省,项乐民率队赴苏学习考察项乐民率队赴苏学习考察,2017-11-23,为更好地营造比学赶超、奋勇争先氛围，全面推动纪检监察工作实现高质量发展，近日，市纪委监委分组赴杭州、宁波、金华、衢州开展“学经验、找差距、补短板”学习考察。。据悉，此次学习考察是今年全市纪检监察系统“三比三创”擂台赛活动的重要组成部分。考察组一行在杭州针对审查调查工作、廉政文化建设、信息化建设等方面开展学习；在宁波围绕基层公权力监督、优化营商环境、干部队伍建设等内容开展考察；在金华、衢州着重就派驻机构监督执纪、清廉文化建设等方面的工作进行交流。学习考察期间，考察组一行还分别与四地纪检监察干部座谈，面对面取经问道，探寻纪检监察工作高质量发展之路。。连日来，考察组认真看、仔细听，学先进而知不足，寻思路而谋发展。“此次学习考察令我深有感触、深受启发，四地的经验做法非常值得我们学习和借鉴。”“边走边看，边学边想，走出去看到了差距，也明确了方向，在比较中反思，在借鉴中奋进。”大家纷纷表示。。市纪委监委负责人表示，此次学习考察是一次对标先进的学习之行、开阔视野的收获之行、激发斗志的鼓劲之行。全市纪检监察系统要切实增强使命感、责任感和紧迫感，在围绕中心强化监督、加强基层党风廉政建设、护航民营经济发展、精准有效运用监督执纪“四种形态”、加强清廉文化和干部队伍建设等方面，主动对标先进、虚心求教，认真查补自身短板，把各地的好经验、好做法运用到温州实际工作中去，全面推动我市纪检监察工作高质量发展，为全市“奋战1161、奋进2019”提供坚强纪律保障。（记者 缪眎眎）,政府领导到其他城市考察学习或访问,0.0,False,否
浙江省,诸暨考察团来乐考察学习特殊教育卫星班工作诸暨考察团来乐考察学习特殊教育卫星班工作,2017-09-29,作为“后亚运时代”打开新通道，创造新业绩的重要突破口，萧山始终坚持将招商引资作为高质量发展的关键引擎。22日-24日，市委常委、区委书记王敏带队赴陕西省西安市考察学习，加强与优质企业、科研院所沟通对接，共商合作、共谋发展。。西安市委常委、市委秘书长和文强，西安电子科技大学党委书记查显友，西安市委副秘书长濮斌锋，中国科学院西安光机所所长马彩文等陪同考察或参加座谈。区领导吴斌参加。。在西安电子科技大学，王敏与学校党委书记查显友进行座谈，对学校大力支持西电杭研院的建设表示衷心感谢。他指出，西安电子科技大学校史悠久、科研能力顶尖、校友实力雄厚，希望在西电杭研院的校地共建中，能得到学校一如既往的支持，为萧山带来更多高层次、专业性人才，吸引更多西电校友来萧投资。萧山将以高效的政务服务、灵活的市场资本服务好学校以及校友企业，实现双方的合作共赢。查显友表示，西安电子科技大学将持续加强与萧山区的紧密合作，将西电杭研院作为其培养人才、科技研发的重要支点平台，努力为萧山人才培养和经济高质量发展作出贡献。。在中科西安光机所，王敏仔细听取光机所发展历程、科技研发、成果转化等情况，调研学习光机所科技成果产业化模式。王敏在座谈时指出，希望萧山区能够携手中国科学院西安光机所，建立以需求为牵引，产学研相结合的科技成果转化体系，用市场的力量加速助推科研成果面向社会、服务大众。马彩文表示，光机所与萧山区有非常多的契合点，希望双方发挥各自优势，尽早开展合作。。在阎良区航空产业基地，王敏考察调研了中航西飞、试飞院、强度所、兴航航空等航空领域企业和院所，现场了解相关科研技术能力。（莫利锋 孔宇）,政府领导到其他城市考察学习或访问,0.8620763145494799,True,是
浙江省,香港岛各界社团骨干学习考察团来绍考察交流香港岛各界社团骨干学习考察团来绍考察交流,2017-12-18,日前，为学习借鉴生活垃圾分类工作的成功经验和先进做法，由温州市政府副秘书长朱葵，鹿城区、龙湾区、瓯海区、瑞安市负责人，市有关部门负责人以及市级国有企业负责人组成考察团，赴杭州市余杭区考察学习。市综合行政执法局党组副书记、副局长徐清雨参加考察。。察团一行先后来到余杭九峰垃圾焚烧厂、虎哥回收网点及分拣中心、大地海洋电器拆解中心等节点，重点考察垃圾焚烧厂、回收网络建设及运行情况。。余杭引入第三方企业，将先进生态理念融入建设和管理，实现发电厂区“不见垃圾、未闻异味”，并通过建设智慧工厂，精细化管理，向公众开放等方式，有效破解焚烧发电厂“邻避效应”成为示范点；同时，创新实行“互联网+再生资源回收”模式，实现从前端上门回收、中端物流转移、末端资源化利用的全链条一条龙服务，并通过“一键回收”的便捷式服务，“数字监管”的智能化管理，“环保金”的激励措施，让老百姓简单分、乐意分，有效提高居民分类意愿，彻底解决中低价值回收物居民不愿分、管理不规范、利用效率低的难题。。考察团一行通过对余杭区垃圾分类先进的管理体系、创新的工作举措、完善的产业链条的专业调研，进一步拓宽了眼界、打开了思路。。朱葵在考察期间指出，垃圾分类不仅是一项长期性、持久性的工作，也是城市管理的重要一环，要认真学习先进经验和做法，结合温州实际，强化日常监管，加快完善再生资源回收利用网络，助力温州垃圾分类工作再上新台阶,其他,0.5225824419632239,False,否
浙江省,市纪委监委开展学习考察市纪委监委开展学习考察,2019-06-27,7月10日，由区府办副主任朱洪波带队，区编办、审管办、电子政务办、财政局、市场监管局等部门相关负责人组成考察团，赴嘉善县行政审批服务中心学习考察“最多跑一次”改革、窗口“无差别全科受理”工作。。考察团首先实地参观了嘉善县行政审批服务中心大厅窗口布局，走访了解24小时自助服务区、导办服务区、后场审批区等功能区的运行情况。随后考察团与嘉善县行政审批服务中心相关负责人进行了座谈，详细听取了窗口“无差别全科受理”推进过程中人员培训和管理、窗口设置、咨询导办，以及对不动产登记、商事登记等办件量较大事项办理的影响等实际情况介绍。。考察团成员一致认为，嘉善县行政审批服务中心窗口“无差别全科受理”推进较快、做法超前、力度较大，值得学习借鉴。,其他,0.9603529190483634,False,否
浙江省,王敏带队赴西安考察学习王敏带队赴西安考察学习,2024-01-25,如何科学规划下山脱贫移民异地转移安置，加强移民安置点党组织建设以及社会管理机制创新？带着这些问题，7月24日，县委副书记周劲松带领县考察团到余姚市，对该市阳光小区下山脱贫安置点建设情况进行了考察。 副县长胡卫亮，县农办、妇联以及水南、古市、四都、三都等乡镇（街道）负责人参加。,其他,0.5483480831411127,False,否
浙江省,温州考察团赴杭州考察学习垃圾分类先进做法温州考察团赴杭州考察学习垃圾分类先进做法,2022-07-13,8月16日，市人大常委会主任胡成剑，市委常委、常务副市长叶伟琼率市城中村改造工作领导小组、旧城建设办、乐成街道、城东街道、城南街道、大荆镇、雁荡镇、龙西乡主要领导及相关工作人员，以及全市城中村改造挂职干部等共260人赴梧田街道林村村考察学习城中村改造经验。。考察团一行来到林村村拆迁地块，现场察看了拆迁现状和项目展板，听取了梧田街道党工委书记徐海严关于该项目的情况介绍。据悉，林村村，地处城市中轴，南看城市湿地，分为上林、下林2个自然村，是瓯海乃至温州城中村改造的典型缩影。因城市中央绿轴公园建设需要，2015前，已陆续对下林自然村和东岸片区进行改造拆迁。剩余的上林片区共有农户403户，占地面积239亩，旧房建筑面积17.8万平方米，是瓯海大道城市走廊东段沿线最后的疤点。自7月14日启动该项目以来，用时25天完成丈量评估，48天100%完成签约任务。,其他,0.9544067946972664,True,是
浙江省,区考察团赴嘉善学习考察最多跑一次改革工作区考察团赴嘉善学习考察最多跑一次改革工作,2018-07-10,7人在总场党委书记肖建新带领下，到我县考察学习美丽乡村建设、民宿经济发展、村集体经济增收和农旅结合等工作。。考察团一行先后来到平田村、庄河村、西坑村、象一村和大木山茶园等地，通过听取相关负责人介绍及交流探讨等形式实地考察了解了我县在传统村落保护利用、民宿产业发展、村集体经济增收、美丽乡村建设方面的具体做法和经验。。考察团一行对我县美丽乡村建设、乡村旅游发展和村集体经济增收方面的情况给予了高度评价，并纷纷表示本次考察学习收获良多，。在美丽乡村建设、民宿产业发展和农旅结合等方面有着许多值得借鉴的经验，希望在今后的工作中多学习、多沟通、多交流，共同推进乡村振兴。。宜丰黄岗山垦殖场考察团是松阳县田园乡村建设培训中心成立和松阳县委党校对外培训科设立以来接待的第一批外来客人。,不属于政府领导到其他城市考察学习的新闻,0.8524360152329805,False,否
浙江省,我县组团赴余姚考察学习我县组团赴余姚考察学习,2020-07-07,月17日上午，由兰溪市市府办副主任祝勤带领的考察组一行11人来平考察学习农房确权登记发证工作。我市市府办副主任李峰，市自然资源和规划局副局长金志元陪同考察交流。。考察组一行首先前往当湖街道自然资源所，现场参观当湖街道农房确权办工作场所，查看了农房确权登记发证材料。当湖街道自然资源所负责人与工作人员也向考察组介绍了农房确权登记发证的各项工作流程和工作模式。随后在座谈会上，金志元副局长向考察组一行就平湖市农房确权登记工作从工作措施、责任落实、政策支持、存在问题、取得成效等方面做了详细汇报。自然调查和确权登记科负责人屠华中也向考察组介绍并解读了《平湖市农村宅基地及住房确权登记发证工作实施细则》相关条例。。兰溪市自然资源和规划局考察组成员听取汇报后，高度评价了我市在农房不动产确权登记发证所做的工作，同时对兰溪市农房确权登记发证工作状况与进展做了介绍，双方也就农房发证中存在的各种问题进行了深入的探讨。,其他,0.9550095932649484,False,否
浙江省,乐清市考察团赴梧田考察学习城中村改造经验乐清市考察团赴梧田考察学习城中村改造经验,2017-08-18,8月13日，市禁毒委副主任、禁毒办主任、市局党委委员、副局长金珍带队到杭州考察学习，先后实地考察隆基生物技术有限公司、浙江省（杭州市）禁毒教育馆，听取相关工作介绍，就有关问题进行深入的探讨交流。,政府领导到其他城市考察学习或访问,0.6853504072913686,False,否
