province,topic,date,content,label,score,is_match,是否为“学习考察”新闻
浙江省,省经信委组团赴粤川苏皖学习考察省经信委组团赴粤川苏皖学习考察,2013-11-15,为了学习借鉴贵镇小城镇环境综合整治的先进经验和做法，我乡决定由陈剑荣乡长带队，一行共38人，于2月21日（星期四）赴贵镇学习考察，望给予接洽，并将有关事宜致函如下：。2月21日（星期四）14点50分到达贵镇，实地考察学习贵镇小城镇环境综合整治的先进经验。,不属于政府领导到其他城市考察学习的新闻,0.6732560822826867,False,否
浙江省,嘉善县卫健局一行来北仑考察学习嘉善县卫健局一行来北仑考察学习,2020-07-20,11月上旬，为学习借鉴兄弟单位在体育工作和体育事业发展方面的成功经验和做法，进一步理清2012年工作思路，市体育局组织全市体育系统赴宁波、绍兴两地学习考察体育工作。考察组一行围绕两市体育工作和体育事业发展，与宁波、绍兴体育部门开展座谈，听取了关于公共体育服务体系建设、体育训练和体校建设、品牌赛事、社会管理创新等方面的整体情况介绍，并实地参观了宁海国家登山健身步道和建设中的绍兴市奥林匹克体育中心。此次学习考察有收获、有启示，拓宽了工作思路。,政府领导到其他城市考察学习或访问,0.516328070111106,False,否
浙江省,海宁市赴安吉县考察学习融杭工作海宁市赴安吉县考察学习融杭工作,2011-08-03,上午，集团公司副总经理朱鸿涛带领集团投资发展部负责人及相关工作人员，建设公司、旅发公司相关工作人员赴宁波城投考察学习。宁波城投副总经理沈菲君，集团战略投资部、审计考核部（纪检监察室）及宁海投资公司相关负责人接待。。会议首先由沈菲君副总经理对宁波城投公司的基本情况及各业务板块业务情况进行了介绍；宁波城投相关部门、单位负责人随后对我公司关注的承资公司年度考核指标下达、房产招租及管理工作、酒店全权委托经营管理情况等三方面内容进行了详细介绍；在此基础上，双方进行了热烈的沟通、交流。朱鸿涛副总经理表示，宁波城投与嘉城集团同属市级国资平台，在经营范围、业务类型、经营特点、工作难点等方面均十分相似，今天的考察学习获益匪浅，希望今后双方经常交流、共同发展。会后，双方一同深入宁波城投开发经营的南塘老街街区、万豪宾馆，就现场经营管理情况进行了实地考察。,其他,0.5484202933198398,False,否
浙江省,宁波市代表团在吉林延边学习考察宁波市代表团在吉林延边学习考察,2019-05-08,3月3日下午，县委书记姚激扬带领县四套班子领导前往婺城区，考察学习兄弟县市文旅项目建设、民情民访代办、跨境电商培育等工作，进一步加强对接交流，携手共创金武同城发展新局面。县领导帅朝晖、陈迎春、何俊有、李唯、李杨勇、吕霞、龚涛涛参加考察。婺城区领导蔡艳、黄国钧、朱利群、张茹先、胡小荣、何军杰、范锋鑫陪同考察。。湖边桃花源，山水林间趣。燕语湖国际垂钓中心，位于婺城区仙源湖度假区板块北部，是婺城区五朵金茶花、南山国际慢城的启动项目。作为婺城区旅游新地标，该中心利用60天时间实现从无到有、拔地而起，充分展现了“交投速度”；去年6月举办的库钓公开赛，吸引全国18个省市地区专业选手同场竞技；如今谋划建设的十二杉高端民宿、神秘花园等正蓄势待发。考察团沿着燕语湖且行且看，实地感受这一旅游项目对婺城区旅游发展的带动效应，认为婺城区文旅项目建设定位准、手笔大、站位高，值得武义学习借鉴；希望通过“金武马拉松”等创新形式，加强武义婺城两地的文旅资源对接共融，携手共同发展。。在城西街道矛调中心，如何把民情民访代办这件事做好做出彩，考察团一行向名人“和姐”宋园春取经。城西街道是婺城区老街道，下辖5个社区，常住人口2.6万人。近20年来，大范围、高强度的城改征迁工作导致街道居民人户分离现象严重，群众办事不便，同时存在拆迁遗留问题，街道长期在重点人员稳控上消耗较大精力。据宋园春介绍，矛调中心吸纳街道社区干部、律师、民警、老娘舅、和姐等社会力量，成立相对固定的专业化代表团队，并与电视台合作用真实画面展示生动案例，工作得到广大百姓广泛认可。考察团认真聆听经验介绍，翻阅现场图文材料，为城西街道调解一类、教育一片、启发一群的做法点赞。。武义作为外贸依存度高、特色产品多的工业县，如何进一步做强跨境电商行业？在金华市跨境电子商务综合服务中心，考察团寻找答案与思路。该中心以“为金华制造业企业转型跨境电商提供全方位培育服务”为目标，手把手引导制造型企业转型升级为成熟的跨境电商企业，降低创业风险与成本。“要带武义的制造业企业来看看，学习学习。”考察团表示，武义工业产业特色鲜明、产品种类丰富，兄弟县市的跨境电商产业发展模式是很好的参照。我们要进一步学习取经，推动传统外贸企业通过跨境电商转型升级，打造更多“金字招牌”。。考察团还来到婺城区矛调中心，走进群众来访接待中心、行政争议调解中心、矛盾纠纷多元化解中心等地，实地考察矛调中心建设情况。据介绍，婺城区矛调中心积极探索完善信访问题多元化解机制，全面推进数字赋能县域社会治理现代化。在多元化解全面覆盖上，按照“应入尽入、能入尽入”的原则，整合多方资源开展联动调处矛盾化解。9个中心成建制入驻，12家常驻、53家随驻事权单位、专业调解工作室共同参与，形成了集司法调解、行政调解、人民调解、行业调解为一体构建矛盾纠纷多元化解终点站。考察团指出，婺城区矛调中心建设，通过聚合各方力量，实现了信访矛盾化解“最多跑一地”，这给武义矛调中心建设巨大启示、提供了学习经验。,政府领导到其他城市考察学习或访问,0.8019707772405842,False,否
浙江省,省党政代表团在江西进行学习考察省党政代表团在江西进行学习考察,2019-06-19,3月12日下午，镇侨联组织委员赴镇先进企业宁波贝贝乐儿童用品有限公司开展学习考察活动，市委统战部副部长、侨办主任（侨联主席）黄建岳一行应邀参加。。市侨联及镇侨联一行人首先参观了宁波贝贝乐儿童用品有限公司，走进他们的车间，看到的是整齐的生产设备、亲和的车间工人，在每个生产车间都可发现他们自发的车间口号，代表着他们对工作的热情以及对这个大家庭的热爱。随后，一行人还参观了儿童座椅展厅并听取了贝贝乐企业的专题报告。交流中，贝贝乐公司充分展现了“给宝宝最贴心的礼物”的企业宗旨，以及他们的企业文化，如开展企业内部竞技评比，举办环保登山、五水共治志愿服务等公益活动，举办中秋、跨年文艺演出等，都充分展示了企业的向心力和凝聚力，近年来企业的员工流失率在8%以内。。黄建岳副部长在交流中充分肯定了贝贝乐的企业文化。他表示，一是贝贝乐企业的管理水平很高，很有底蕴，不管是从车间口号的自发来看，还是从地面的保洁度来看，都体现了企业在管理上注重人文情怀的大爱精神。二是企业专注做精做专产品，贝贝乐企业不仅拥有自己独立的品牌“贝格·贝拉”，还只专营于一个系列，真正做到了产品专而精。三是机遇是为准备的人而准备的，企业的成功取决于企业的领导人眼光的独到性及员工的配合度。。通过此次考察学习，镇侨联成员纷纷表示不仅增进了委员之间的交流沟通，也使他们开阔眼界、深受启发。,其他,0.9855681285833788,False,否
浙江省,腊口镇人大代表赴吴坑乡学习考察腊口镇人大代表赴吴坑乡学习考察,2020-09-11,近日，我街道商会一行10人赴湖南学习考察。对城市建设、旅游产业、现代服务业、特色街“一体化”发展等重要专项工作进行学习借鉴；架起政府与企业之间的桥梁，增进企业间的交流。,政府领导到其他城市考察学习或访问,0.0,False,否
浙江省,云和县党政代表团赴北仑学习考察云和县党政代表团赴北仑学习考察,2020-09-14,1月12日下午，新疆生产建设兵团第四师党委常委副师长、可克达拉市政府副市长王忠明一行到滨海新区调研生物医药产业项目。滨海新区党工委委员、二级调研员张天雄等陪同。。王忠明一行首先参观了滨海新区展示馆，观看了新区宣传片，认真了解新区在平台建设、招商引资、产城融合等方面的情况，对新区目前取得的成果表示赞赏。。随后，王忠明一行来到浙江医药股份有限公司，认真听取浙江医药关于生产经营、项目建设等情况的介绍，同时展示了新疆生物医药原材料资源优势，希望通过这次积极对接，争取开展项目合作，与滨海新区生物医药产业方面有更进一步合作发展。（经发局）,其他,0.8093981191841827,True,是
浙江省,关于赴松阳县象溪镇考察学习的函关于赴松阳县象溪镇考察学习的函发布机构淤上乡成文日期,2019-02-25,日前，由南阳市委书记穆为民率领的南阳市党政代表团一行，在市委书记赵一德和市委常委、秘书长许勤华的陪同下，来我区考察玉皇山南基金小镇和“五水共治”有关工作。区领导缪承潮、黄爱芳、宣寅陪同考察。。当了解到基金小镇已经基本完成一、二期建设和招商引资工作，累计入驻金融投资类企业100余家，管理资产规模超过1000亿元，去年实现税收4亿元时，南阳市的党政代表团们交口称赞。穆为民认为基金小镇得天独厚的创业环境和优越的政策，满足了投资基金、互联网金融等新金融业态集聚发展、协同创新的需要，是创业发展的有效载体和平台。。穆为民表示，河水清澈流动，两岸树草相间，是此次在上城区中河南段考察学习的最大感受。他说，上城“五水共治”以及生态化治理的尝试，已经探索出了一条城市内河治理的新路，为治污工作提供一个可资借鉴的新蓝本。其中，上城借着“五水共治”的东风，建立水井长效养护机制，不仅让水井外观脱胎换骨，更让水井水质得到保证，增强“全民参与五水共治”的意识，这一点值得南阳市借鉴学习。,其他,0.6363762573642968,True,是
浙江省,全市体育系统赴宁波绍兴学习考察全市体育系统赴宁波绍兴学习考察,2011-12-02,为切实提高我区美丽乡村建设水平，加快美丽乡村建设进度，4月23日至24日，由农林局副局长董明华带领科室成员，各。董明华强调各相关镇及创建村书记要认真总结，吸收外地的成功经验，把握机会、加快推进，打造南浔区平原水下特色的美丽乡村升级版。,不属于政府领导到其他城市考察学习的新闻,0.6329150554804399,False,否
浙江省,集团公司组织赴宁波城投考察学习集团公司组织赴宁波城投考察学习,2019-04-22,4月17日下午，龙游县殡仪馆一行9人在单长军主任的带领下到殡仪馆参观交流，市殡仪馆林向前主任、沈树强副主任陪同参观。。林向前主任对考察组的到访表示热烈欢迎，并陪同龙游县考察组实地参观了告别礼厅、各业务服务中心、环保设备、火化车间、灵堂。双方就新馆火化车间、灵堂构造以及内部设施、布置进行了重点的交流，双方坦诚相见，相互探讨，相互交流，达到了相互借鉴学习、分享优秀经验的目的。。参观过程中，考察组对市殡仪馆的各项建设工作予以高度评价，希望双方继续加强沟通交流。,其他,0.985988497093642,False,否
浙江省,县四套班子领导赴婺城区学习考察县四套班子领导赴婺城区学习考察,2021-03-05,"2012年4月25日，益阳市房地产管理局黄新初局长带队一行10人来市房管中心学习考察，市住建委副主任杨馥源、总工夏海明、房产权籍登记管理处处长俞仁祥、市房管中心主任沈浩、市房管中心副主任高尚全及相关人员参加了会议。会上,市房管中心介绍了宁波数字房产管理平台和个人住房信息系统联网的建设情况。双方就房地产信息的建设、对内管理、对外应用、房屋登记业务的办理、测绘管理、档案管理等方面进行座谈交流。随后，益阳市房地产管理局又实地参观考察了数字房产一期项目的运行情况和中心一、二楼大厅。。考察结束后，益阳市房地产管理局对我中心个人住房信息联网建设等方面给予极高的评价与赞赏，对数字房产项目的特色与亮点表示充分的肯定。双方表示今后要加强相互间的交流与学习，共同提高房地产信息化建设水平。",其他,0.7698352209387465,False,否
浙江省,镇侨联组织委员学习考察先进企业镇侨联组织委员学习考察先进企业,2015-04-09,本报讯 近日，海盐县环保局相关负责人、嘉兴锦浩环保科技有限公司负责人等海盐县环境科学学会会员单位代表一行18人赴诸暨环保小镇考察学习。。诸暨环保小镇是浙江省环保特色小镇，形成了以菲达、天洁、信雅达三家上市公司为龙头的环保产业示范体系，在大气污染治理设备领域有较强的技术优势，水处理等研制生产能力居于全国领先地位。环保小镇所在的牌头镇依托现有产业基础，由高端环保制造为主，向制造、研发、设计、服务、孵化等一体化产业体系提升，实现菲达环保博览园、天洁循环经济园、环保智创园和绿色生活区、科创孵化区、中心服务区的“三园三区”总体规划。。考察团一边参观，一边学习，深入了解环保小镇的创建背景、规划建设等多方面内容。在学习交流会上，双方代表分别介绍了诸暨及海盐目前环保产业发展情况及污染治理现状，对两地环保工作的共同点和不同点进行了分析，发表了一些意见和建议，并对今后环保工作的重点及方向进行了充分交流。,其他,0.8859625253022269,False,否
浙江省,小营街道商会赴湖南学习考察活动小营街道商会赴湖南学习考察活动,2009-11-13,上午，舟山市政协委员工作委员会主任刘美娣、副主任林燕敏带领舟山市普陀区、定海区、岱山县、嵊泗县政协委员工作室负责人，来到新塍镇学习考察秀洲区政协及基层联络室工作情况。市政协办公室副主任、委员工作委员会副主任秦鸿、区政协副主席徐文祥、区政协秘书长沈菊英及区政协有关人员陪同考察。。座谈会上，考察组一行首先观看了区政协推进基层民主协商专题片，听取了徐文祥关于区政协及基层联络室工作的主要做法、工作机制和取得的成效等有关汇报。随后，区政协新塍镇联络室主任吕建荣围绕“民情沟通”和民主协商两项重点特色工作作了联络室工作情况介绍。舟山市政协领导充分肯定了秀洲区政协、新塍镇政协联络室的工作，表示要借鉴秀洲区政协工作的经验和做法，创新舟山政协工作机制和思路，推动政协工作快速发展。。与会人员还围绕政协委员工作任务、工作制度、保障措施和考核机制等问题进行了坦诚友好的互动交流，并表示今后双方要进一步加强联系和沟通，就强化政协协商民主等重点工作进行探讨和交流，推进政协工作的新发展。,其他,0.9611072449881428,False,否
浙江省,新疆生产建设兵团第四师可克达拉市考察团赴新区考察学习新疆生产建设兵团第四师可克达拉市考察团赴新区考察学习,2023-01-29,为贯彻落实乐清市委、市政府关于“重振雁荡雄风”的精神，按照“一年有进步、三年上台阶、五年大变样”的要求。1月11日至13日，乐清市委常委、雁荡山管委会党委委员、副主任王金法带队赴黄山、仙居风景名胜区考察，学习借鉴两地先进的景区管理运行经验。。考察组实地考察了玉屏楼宾馆、云亼民宿、西海饭店、排云楼等新业态，并就乡村旅游、民宿管理、资源开发、旅游业态创新等进行了探讨与交流。。随后考察组赴仙居，重点考察了神仙居景区的中高山栈道、索道等项目建设，并就景区管理建设等方面进行交流讨论。。王金法在考察中指出，相关部门要以此次考察为契机，借鉴好经验、学习好做法，积极探索雁荡山文旅融合发展，加快中高山游线开发，助推雁荡山高质量发展。,政府领导到其他城市考察学习或访问,0.0,False,否
浙江省,南阳市党政代表团来我区考察学习南阳市党政代表团来我区考察学习,2016-03-01,近日，余杭林水局戴岳军副局长带队，会同余杭交通运输局相关领导赴萧山区义桥镇、戴村镇考察林区骨干林道建设工作情况。。考察组一行先后前往萧山区戴村镇中岭、义桥镇北坞考察林区骨干林道建设相关情况。近年来，萧山区政府大力投入专项资金，对萧山区南片范围内建设4条，总长为197公里林区的骨干林道及若干镇村林道。其中骨干林道建设标准为林区三级公路，路基宽度4.5米，并与现有的镇级主干道、交通干线连接形成林道网络，贯穿8个镇街。通过建设骨干林道，为挖掘山林潜力，保障森林消防工作，提高林业生产经营水平，助推森林休闲养生旅游产业及民宿经济的快速发展，创造了良好的条件。随后两地对项目实施、资金政策、立项程序、前期审批、管理模式、存在问题进行了深入的探讨与交流。。通过此次考察，考察组成员们纷纷表示萧山区的林道建设的新思路、好方法对于余杭林道建设有着十分重要的借鉴作用，为建设美丽余杭、助推“六大西进”工作提供了非常宝贵的经验。（余杭区林水局）,不属于政府领导到其他城市考察学习的新闻,0.5276069437170947,False,否
浙江省,组织赴周边考察学习美丽乡村建设组织赴周边考察学习美丽乡村建设,2018-04-26,3月20日至22日，市委书记、新区党工委书记何中伟率舟山市党政代表团赴苏州、南京学习考察。代表团深入走访调研当地的科创平台和企业，认真学习借鉴他们的先进思路、理念、做法、经验，切身感受了两座城市创业创新的活力和氛围。大家表示，要深入贯彻省委关于强力推进创新深化的决策部署，不断深化我市创业创新重点区块的规划布局，完善科技创新公共服务体系，加快海洋科技创新步伐，为现代海洋城市建设注入新活力、赋予新动力。。春意染江南，醉美姑苏城。在这座人文之城、创新之城、产业之城、宜居之城，不仅能欣赏到春光如画，更能感受到活力四射。走进苏州工业园区，在这方热土上，已累计引进外资项目超5000个，目前拥有国家高新技术企业2489家、上市企业61家、各级独角兽及准独角兽企业180家，集聚大院大所37家、中外名校33家，去年实现地区生产总值超3500亿元。代表团一行考察了苏州工业园区展示中心、人工智能展示中心、苏州纳米城，详细了解园区开发建设、人工智能及纳米技术应用产业发展等情况。园区高水平、高起点的规划定位，科学精准的产业发展思路和布局，完善的创业创新生态和服务保障体系，以及“一张蓝图绘到底”的久久为功，给大家留下了深刻印象。随后，代表团先后考察了长三角国际研发社区展示中心、苏州创业园、苏州西门子电气有限公司，详细了解产城融合、产业创新集群打造、高端人才集聚、科技成果转化、高新技术企业培育等情况。苏州在产城融合、产业创新等方面的先进理念和做法，让大家学习收获颇丰。。三月的古都南京，花红柳绿，生机勃勃。在江北新区，代表团先后考察了国家集成电路设计自动化技术创新中心、生物医药公共服务平台、研创园共享空间，了解平台建设运作、体制机制创新、“一站式”公共服务、重大项目建设等情况。作为国家级新区，江北新区近年来经济活力持续增强，创新效能加快释放，尤其是在规划布局、创新发展、开发开放等方面的好经验好做法，让大家开阔了眼界。在南京软件产业博览馆，代表团还考察了中国（南京）软件谷建设发展情况。作为我国仅次于中关村的城市区域性软件中心，这里集聚了涉软企业3842家、从业人员34万人，成为我国软件产业的聚才磁场、发展高地。。在两天时间里，市党政代表团边走边看、边学边议，深切感受到了苏州、南京两地澎湃创新动力和强劲发展活力。何中伟指出，要学习借鉴他们对科创园区的规划、定位、布局和服务业态，加快重点区块规划建设，搭建完善的公共服务平台，打造现代化创业创新社区，做好“筑巢引凤、聚势赋能”文章，为创新型企业发展和年轻人创业创新提供优良空间。要学习借鉴他们建设高能级科创平台的先进经验，围绕建设国家海洋科技创新中心目标，加快构建“一室多院”创新体系，努力打造五大产业创新中心，提升海洋科创平台能级和水平。要学习借鉴他们对产业发展方向的精准把握，立足舟山实际，突出海洋特色，集中力量在绿色石化与新材料、临港先进装备制造、海洋电子信息、海洋生物医药、海上可再生能源等舟山有基础、有优势、有潜力的产业上深耕细作，构建起海洋经济高质量发展的“四梁八柱”。要学习借鉴他们的科创园区运营模式，大力创新园区服务管理体制机制，打造“产学研用金、才政介美云”十联动创新创业生态系统，优化提升营商环境，充分激发全市的创新发展活力。。南京市、苏州市有关领导与考察团会见并座谈交流。市领导张明超、高浩孟、韩峻、张立军参加考察。,政府领导到其他城市考察学习或访问,0.9196680576510406,True,是
浙江省,龙游县殡仪馆到市殡仪馆考察学习龙游县殡仪馆到市殡仪馆考察学习,2019-04-18,为进一步优化国有资本布局，探索寻求新兴产业发展，助力海曙人才引进建设，11月24日，海曙国投集团党委书记、董事长陈晓虎带队赴嘉兴平湖考察调研，海曙区招商中心主任曾徐，集团党委副书记、总经理唐海亮参加。。浙江羲和新材料科技有限公司成立于2021年9月，是一家专营全面布局显示器用胶粘剂、封装胶等上游基础材料的高新技术企业。致力于实现国产材料自主化，促进国内材料行业健康发展，坚持自主研发，掌握核心技术，打破国外垄断，实现高机能、高附加值产品的量产。。考察团一行参观了该企业的实验室及千级无尘车间，详细了解企业的生产经营状况、产品销售情况。考察期间，双方就如何促进电子封装材料体系健康发展，促进社会经济社会发展，真正实现造福于民进行了友好亲切的交流，就更好发挥科技人才、资源、技术优势深入交换了意见。考察组一行还就如何强化产业配套协同、引进创建高层次创新平台、加快政产学研合作等问题进行了深入探讨。。下一步，国投集团将紧抓机遇，优化布局，突出重点，加快培育建设高能级产业创新载体，为提升海曙区产业链现代化水平贡献国投力量。,政府领导到其他城市考察学习或访问,0.0,False,否
