province,topic,date,content,label,score,is_match,是否为“学习考察”新闻
浙江省,省委常委会扩大会议学习贯彻习近平在浙考察重要讲话精神省委常委会扩大会议学习贯彻习近平在浙考察重要讲话精神,2020-04-02,2日上午，省委常委会召开扩大会议，传达学习习近平总书记在我省考察时的重要讲话精神。会议强调，要把学习贯彻落实习近平总书记重要讲话精神作为当前和今后一个时期的首要政治任务，坚持以“八八战略”为统领，一张蓝图绘到底，干在实处、走在前列、勇立潮头，努力成为新时代全面展示中国特色社会主义制度优越性的重要窗口。。会议指出，今年是全面建成小康社会目标实现之年、“十三五”规划收官之年、脱贫攻坚战决胜之年。当前，我们正处于统筹推进疫情防控和经济社会发展的关键时期。在这特殊时期，习近平总书记亲临浙江考察，意义影响十分重大。习近平总书记的重要讲话，进一步彰显了打赢疫情防控人民战争、总体战、阻击战的必胜信心，不仅给浙江、给全国，也给全世界战胜疫情、走出困境，提振了信心、鼓舞了斗志；进一步释放了在疫情防控常态化条件下加快恢复生产秩序的鲜明信号，为我们统筹打好“两战”，始终牢牢掌握改革发展主动权，提供了正确指引，明确了前进方向；进一步体现了对浙江工作的高度重视和对浙江干部群众的充分信任，必将激励全省上下推动浙江工作继续走在前列。我们要深刻领会、准确把握习近平总书记重要讲话的丰富内涵和精神实质，切实把思想和行动统一到讲话精神上来。。2日上午，省委常委会召开扩大会议，学习贯彻习近平总书记在我省考察时的重要讲话精神。。会议强调，学习贯彻落实习近平总书记重要讲话精神，要围绕“努力成为新时代全面展示中国特色社会主义制度优越性的重要窗口”的新目标新定位，以“两个维护”的政治自觉、“三个地”的使命担当，干在实处、走在前列、勇立潮头，充分展示习近平新时代中国特色社会主义思想的真理伟力和实践伟力。要围绕“疫情防控要慎终如始”，把外防输入、内防反弹的文章做得更扎实，尤其要把严防境外疫情防控作为重中之重，精密智控、闭环管控，不断巩固和拓展疫情防控成果。要围绕“复工复产要化危为机”，进一步稳外贸稳外资、进一步提振消费、进一步扩大有效投资、进一步做好农业生产和重要副食品保供稳价，打好高质量发展组合拳，守好安全生产底线，把复工复产的过程变为转型升级的过程，推动经济社会运行稳中向好。要围绕“改革开放要不断深化”，以实施“最多跑一次”改革和打造“一带一路”重要枢纽为突破口，全面落实长三角一体化发展国家战略，扎实推进中国（浙江）自贸区建设，把改革的步子迈得更大更快、把开放的路子拓得更宽更广，努力为全国大局探索更多的路子、贡献更多的经验。要围绕“治理体系和治理能力要补齐短板”，全面深化平安浙江、法治浙江建设，坚持发展新时代“枫桥经验”，加快推进“最多跑一地”改革，加强社区治理体系建设，推动社会治理重心向基层下移，高水平推进省域治理现代化。要围绕“发展不平衡不充分问题要率先突破”，统筹推进城乡融合、山海协作，深化“千村示范、万村整治”工程和美丽乡村、美丽城镇建设，深入实施低收入农户高水平全面小康计划，进一步提高城乡一体化发展的成色。要围绕“生态文明建设要先行示范”，牢固树立“绿水青山就是金山银山”理念，高标准打好污染防治攻坚战，高质量打通“两山”转换通道，推动习近平生态文明思想结出更多硕果，让绿色成为浙江发展最动人的色彩。要围绕“全面从严治党要走向纵深”，深入推进清廉浙江建设，探索建立“不忘初心、牢记使命”制度，激励干部担当作为、不懈奋斗，大力整治形式主义、官僚主义突出问题，进一步巩固山清水秀的政治生态。,其他,0.6289006388580677,False,否
浙江省,省人力社保厅党组理论学习中心组召开深入学习贯彻习近平总书记考察浙江重要讲话精神专题学习扩大会省人力社保厅党组理论学习中心组召开深入学习贯彻习近平总书记考察浙江重要讲话精神专题学习扩大会,2023-10-16,省人力社保厅党组理论学习中心组召开深入学习贯彻习近平总书记考察浙江重要讲话精神专题学习（扩大）会。10月12日下午，省人力社保厅党组理论学习中心组召开专题学习（扩大）会，专题研讨学习习近平总书记考察浙江重要讲话精神，持续推动学习贯彻习近平总书记重要讲话精神走深走实。省人力社保厅党组书记、厅长吴伟斌主持并讲话，厅领导班子每名成员和省社保就业中心主要负责人结合分管工作作交流发言。省直机关工委副书记、省直机关纪检监察工委书记魏祖民到会指导并讲话。。吴伟斌指出，习近平总书记在考察浙江期间作出了系列重要指示，特别是在听取省委和省政府工作汇报会上发表了重要讲话，充分体现了习近平总书记对浙江大地和浙江人民的深情大爱，对浙江工作的高度重视和亲切关怀。全厅全系统要进一步深刻领悟习近平总书记重要讲话的重大意义、丰富内涵、精神实质和实践要求，进一步增强抓好贯彻落实的责任感使命感，以习近平总书记重要讲话精神为根本遵循推动人社事业高质量发展，为奋力谱写中国式现代化浙江新篇章贡献人社力量。。吴伟斌强调，习近平总书记考察浙江重要讲话意义重大、影响深远。习近平总书记对浙江工作的充分肯定，进一步增强了我们持续推动“八八战略”走深走实的思想自觉政治自觉行动自觉；总书记赋予浙江“中国式现代化的先行者”的新定位和“奋力谱写中国式现代化浙江新篇章”的新使命，进一步增强了我们走在前列、示范引领的使命担当；总书记作出的“走在前列、先行示范、续写新篇、积极探索”重要指示，为我们在奋进中国式现代化新征程中勇当先行者、谱写新篇章提供了科学指引；总书记关于“要坚持和加强党的全面领导、加强和改进党的建设”的重要要求，为我们奋进新征程提供了坚强保障和不竭动力。我们要深刻把握总书记对我们党员干部的谆谆教诲，树立正确政绩观，敢闯敢干、善谋会干、真抓实干，努力创造经得起实践和历史检验、让人民群众有真实获得感的业绩，以实际行动坚定捍卫“两个确立”、坚决做到“两个维护”。。吴伟斌指出，要深入学习贯彻习近平总书记考察浙江重要讲话精神特别是关于人社工作的重要指示精神，扎实开展稳企拓岗增就业专项行动，并以专项行动为牵引推动人社领域各项工作高质量发展。重点做好加强部门协同扩大就业容量、积极保障民营经济高质量发展人才和用工需求、促进就业政策更好实现“直达快享”、加大就业创业支持力度、实施就业困难人员精准帮扶兜牢底线、加强省际劳务协作、发挥好社会保障在经济运行中的“减震器”和“安全网”作用、维护好劳动者合法权益营造良好营商环境等八项工作。。魏祖民对前期省人力社保厅学习贯彻习近平总书记考察浙江重要讲话精神有关情况予以高度评价，认为快学细学站位高、结合融合意识强、担当担责做得实，下一步要绷紧贯彻转化的链条，拧紧检验督导的螺丝，上紧实干争先的发条，始终干在实处、走在前列、勇立潮头，在推进共同富裕和中国式现代化建设中发挥人社作用。,不属于政府领导到其他城市考察学习的新闻,0.5020076505976749,False,否
浙江省,袁家军率浙江省代表团赴贵州学习考察倾情倾力帮扶精准脱贫袁家军率浙江省代表团赴贵州学习考察倾情倾力帮扶精准脱贫,2019-06-28,25日至27日，省长袁家军率浙江省代表团赴贵州学习考察，对接深化东西部扶贫协作工作。。山路弯弯，乌蒙磅礴。在黔期间，浙江省代表团在贵州省省长谌贻琴等陪同下深入黔西南州普安县红星村、江西坡布依茶源小镇、纳茶社区，走访慰问贫困户和易地扶贫搬迁群众，实地考察习近平总书记批示肯定的普安“白叶一号”白茶种植基地，考察长毛兔养殖小区、易地扶贫搬迁小区、镇海·普安高效农业示范园等项目。。26日上午，浙黔东西部扶贫协作工作会议在贵阳举行。贵州省委书记孙志刚主持会议并讲话，袁家军、谌贻琴分别介绍了两省经济社会发展和浙江对口帮扶黔东南州、黔西南州工作情况。孙志刚、谌贻琴对浙江长期以来对贵州的帮助支持表示衷心感谢。孙志刚说，这些年来，浙江倾情倾力帮助贵州，政治站位高、工作作风实、帮扶措施准、帮扶力度大、帮扶成效好，有力助推了贵州贫困地区脱贫攻坚，贵州干部群众深表感激。。孙志刚表示，贵州打赢脱贫攻坚战进入倒计时关键阶段，我们坚决落实习近平总书记重要指示，聚焦深度贫困地区发起猛攻，坚决夺取脱贫攻坚战全面胜利。希望浙江进一步加大帮扶支持，引导更多帮扶资源帮助解决贵州贫困地区“两不愁三保障”突出问题。希望两省进一步深化劳务协作，加强农业、工业、旅游、康养服务等产业合作，推动协作合作在新的起点上开创新的局面。。袁家军首先转达了车俊书记的亲切问候。他指出，脱贫攻坚战进入决战决胜的关键阶段。浙江将坚决扛起政治责任，全面落实习近平总书记关于脱贫攻坚工作的重要指示批示精神，坚持树典型、建模式、出亮点，精准对接受援地脱贫需求，进一步加大产业扶贫、就业扶贫、教育扶贫、人才支持、企业合作和社会帮扶的力度，着力解决“两不愁三保障”突出问题，为黔东南州、黔西南州如期全面打赢脱贫攻坚战、全面建成小康社会作出应有贡献。考察期间，袁家军叮嘱随行的浙江方面负责同志，要聚焦受援地所需所求和民生领域重点难点，聚焦“两不愁三保障”，强化特色产业发展对脱贫攻坚的带动作用，扎实做好精准扶贫支援工作。。袁家军指出，贵州山川秀美，是红色文化的热土，浙江和贵州兄弟情谊深厚，合作交流密切。我们要虚心学习贵州经济社会发展的好做法，紧紧抓住共同参与“一带一路”和长江经济带建设的机遇，充分发挥两省资源禀赋优势，聚焦大数据、云计算、智能制造、跨境电商、清洁能源、空港物流、生态农业、生命健康、文化旅游等重点领域，在“浙企入黔”“黔货入浙”“浙客游黔”等方面持续发力，全面深化产业、商贸、开放合作，助推两地高质量发展。,政府领导到其他城市考察学习或访问,0.6801256096289071,True,是
浙江省,浙江省代表团赴四川学习考察携手共谱浙川扶贫协作新篇章浙江省代表团赴四川学习考察携手共谱浙川扶贫协作新篇章,2019-10-13,四川广元市、阿坝州是我省对口帮扶地区。10日至12日，车俊一行在四川省委书记彭清华等陪同下，深入这两个地方，对接检查扶贫协作和对口支援工作，共商新时期深化对口帮扶大计。。红原县的日干乔湿地自然保护区水草丰茂、静谧秀美。80多年前，这里却是陆上“死亡之海”。红军在翻越皑皑大雪山后，从这里开始穿越草地。省代表团专程来到这里，瞻仰红军过草地纪念碑并敬献鲜花，重温《七根火柴》《金色的鱼钩》和“红军柳”等故事，追忆长征时期那段艰苦卓绝、壮怀激烈的历史，接受革命精神的洗礼。省代表团还来到汶川县映秀镇漩口中学地震遗址，向“5·12”汶川特大地震罹难同胞和抗震救灾中英勇捐躯的英雄敬献鲜花。车俊深情地说，伟大的长征精神和抗震救灾精神，是我们党红色基因和精神族谱的重要组成部分，永远值得我们敬仰。浙江作为中国革命红船起航地，要把红船精神与长征精神、抗震救灾精神等融会贯通起来，浸透骨髓、融入血脉，不断从中汲取信仰的力量、奋斗的力量，走好新时代长征路，努力干在实处、走在前列、勇立潮头。。10日，浙川东西部扶贫协作和对口支援工作座谈会在成都举行。车俊、彭清华讲话，四川省委副书记邓小刚出席。。车俊说，浙川交往源远流长，有着良好的合作基础。这些年来，四川把中央精神与本地实际紧密结合起来，创造性开展工作，推动治蜀兴川不断迈上新台阶。我们要学习四川立足自身、服务全国的政治站位，增创优势、补齐短板的特色做法，锐意改革、大胆探索的宝贵经验，拼搏实干、担当有为的优良作风。当前，浙江正自觉践行习近平总书记赋予的新期望，奋力推进“八八战略”再深化、改革开放再出发。我们将坚决扛起东西部扶贫协作和对口支援的政治责任，一以贯之落实习近平总书记在浙江工作期间提出的“坚持讲求实效、多办实事，进一步做好对口帮扶”要求，全力以赴地做好扶贫协作和对口支援各项工作。希望浙川两省充分发挥各自优势，以深化产业合作为重点推动对口帮扶工作向市场化、特色化发展，进一步形成“1+1>2”的效应。同时，浙江愿与四川加强各层面的对接，特别是加强“一带一路”建设、长江经济带发展、长三角一体化发展等国家战略的衔接，提高互联互通水平，推动两省交流合作走深走实走远。。彭清华代表省委、省政府向浙江省代表团来川考察表示欢迎，对浙江长期以来给予四川发展的帮助支持表示感谢。他说，多年来，浙江省委、省政府坚持从“两个大局”战略高度，满腔热忱开展扶贫协作和对口支援工作，为四川改善贫困地区发展面貌和贫困群众生产生活条件作出了突出贡献，四川人民始终感恩铭记。当前，四川正处在转型发展、创新发展、跨越发展关键时期，脱贫攻坚战已经进入决胜的关键阶段。希望川浙两省坚定以习近平新时代中国特色社会主义思想为指导，坚决贯彻落实习近平总书记关于扶贫工作的重要论述，进一步深化扶贫协作，聚焦深度贫困地区，聚焦“两不愁三保障”，巩固提升脱贫攻坚质量和成色；着力发挥双方资源优势，进一步加强产业对接，不断提升产业合作层次和水平；共同促进长江经济带发展合作，携手推进区域协调、拓展发展空间；紧扣增进民生福祉，在生态环境保护、服务保障农民工、公共服务共建共享等方面加强合作，持续增强人民群众获得感幸福感安全感。。考察期间，车俊、彭清华还看望了在川浙商代表，勉励大家坚定信心、稳中求进，努力把企业做强做优做大；融入四川、反哺家乡、义利并举，当好两省交流合作的桥梁纽带，为推动浙川经济社会发展作出应有贡献。。浙江省领导陈金彪、冯飞、黄建发，四川省领导曲木史哈、王铭晖、王正谱、包惠、尧斯丹、林书成参加有关活动。,政府领导到其他城市考察学习或访问,0.0,True,是
浙江省,省政府党组会议传达学习习近平总书记考察浙江重要讲话精神省政府党组会议传达学习习近平总书记考察浙江重要讲话精神,2023-09-27,9月24日下午，省政府党组第14次会议召开，传达学习习近平总书记在浙江考察时的重要讲话精神，研究部署政府系统贯彻落实工作。。会议指出，在全面贯彻党的二十大精神开局之年、主题教育开展之年、“八八战略”实施20周年和杭州亚运会盛大开幕的瞩目时刻，习近平总书记亲临浙江考察指导并出席杭州亚运会开幕式，在浙江发展历程中具有重大里程碑意义。习近平总书记在考察浙江期间作出的重要指示、发表的重要讲话，思想深邃、高屋建瓴、视野宏阔，为我们做好浙江各项工作指明了前进方向、提供了根本遵循。全省政府系统要牢记嘱托、感恩奋进，按照省委常委会会议部署，把学习贯彻习近平总书记重要讲话精神作为当前和今后一个时期的首要政治任务和头等大事，深刻领会习近平总书记重要指示重要讲话的重大意义和战略考量，深刻领会习近平总书记对浙江工作的殷切期望和信任重托，深刻领会习近平总书记对浙江发展的重要要求，深刻领会习近平总书记对坚持和加强党的全面领导、加强和改进党的建设的新要求，做到带头学习、深入学习、准确把握、全面贯彻，坚定不移沿着习近平总书记指引的方向奋勇前进，坚决做到“总书记有号令、党中央有部署，浙江见行动”，以实际行动坚定捍卫“两个确立”、坚决做到“两个维护”。。会议强调，政府就是要抓落实、强实干。要以最诚挚的感情、最坚决的态度、最迅速的行动、最有力的举措抓好习近平总书记重要讲话精神的贯彻落实，逐条逐项梳理，深入开展研究，一步一个脚印推进落实，确保落地生根、开花结果。要坚持紧抓当前、抓好当前，扎实做好经济社会发展各项工作，高质量完成全年目标任务。要深入谋划明年工作，谋准谋实具体目标任务和工作举措，尤其要牢牢抓住重大项目这个“牛鼻子”，深入谋划一批好项目大项目。要持续做好杭州亚运会、亚残运会办赛工作，确保呈现一届“中国特色、亚洲风采、精彩纷呈”的体育盛会。,其他,0.5881828131145543,False,否
浙江省,省政协党组学习贯彻习近平在浙考察重要讲话精神葛慧君主持省政协党组学习贯彻习近平在浙考察重要讲话精神葛慧君主持,2020-04-02,4月2日，省政协党组召开扩大会议，传达学习贯彻习近平总书记在我省考察时的重要讲话精神和省委部署要求。会议强调，要用心领会、用情感悟、用力落实习近平总书记重要讲话精神，以此为指导，更好在大局下思考、在大局下行动，切实把思想和行动统一到讲话精神上来，努力干出新样子、谱写新篇章。省政协主席葛慧君主持。。会议认为，习近平总书记的重要讲话，高瞻远瞩，思想深邃，内涵丰富，彰显了打赢疫情防控人民战争、总体战、阻击战的必胜信心，进一步释放了在疫情防控常态化条件下加快恢复生产生活秩序的鲜明信号。习近平总书记“浙江之行”，充分体现了对浙江工作的高度信任、关心关怀、殷切期待。习近平总书记希望浙江坚持以“八八战略”为统领，干在实处、走在前列、勇立潮头，精准落实疫情防控和复工复产各项举措，奋力实现今年经济社会发展目标任务，努力成为新时代全面展示中国特色社会主义制度优越性的重要窗口，对浙江赋予了新使命，确立了新坐标，勾画了新蓝图，指明了新方向，为浙江做好各方面工作提供了根本遵循和行动指南。。会议强调，学习贯彻习近平总书记在浙江考察时的重要讲话精神，是当前和今后一个时期的首要政治任务。全省政协系统要广泛深入抓好学习传达，深思细悟，融会贯通，内化于心、外化于行，切实增强“四个意识”、坚定“四个自信”、做到“两个维护”。要因时顺势抓好履职工作，主动对标对表，及时调整履职重点，积极创新履职方式，建好搭好履职平台，更加注重履职实效，做到反应快速、跟进主动、切点精准。要合心合力抓好团结引领，因势利导做好正本清源、宣传政策、解疑释惑、活血化瘀等工作，进一步强信心、聚民心、暖人心、筑同心，努力为转危为安、化危为机凝聚更多力量、画出最大同心圆。要从严从实抓好自身建设，继续紧绷疫情防控这根弦，严守纪律规矩，把全面从严治党的责任压紧压实。,其他,0.9129343336840268,False,否
