province,topic,date,content,label,score,is_match,是否为“学习考察”新闻
甘肃省,人民网如意甘肃携手好客山东合力谱写鲁甘山海情,2023-02-20,人民网：“如意甘肃”携手“好客山东” 合力谱写“鲁甘山海情”_媒体看甘肃_甘肃省人民政府门户。2月14日，由甘肃省各市州和兰州新区文旅部门、文旅企业、非遗传承人代表等组成的甘肃文旅推介团深入山东济南、青岛开展“双向游”系列活动，搭建鲁甘两省文化交流互鉴和旅游客源互送的桥梁纽带。。甘肃省文化和旅游厅有关负责人表示，甘肃省文化和旅游厅把春节后跨省宣传推介的第一站与落实东西部协作紧密结合，与山东省文化和旅游厅一道，通过策划开展“好客山东·如意甘肃”双向游系列活动，采取组团“走出去、请进来”的方式加大文旅宣传推广力度，用力擦亮“交响丝路·如意甘肃”金字招牌，“山东人陇上游”牵手“甘肃人齐鲁游”，持续扩大两省文旅“朋友圈”。。“狮跃龙腾歌盛世 乡村社火闹新春”陇南市2023春节社火展演。（甘肃省文旅厅供图）。据介绍，“好客山东·如意甘肃”双向游系列活动主要包括甘肃文旅推介会、鲁甘文旅协作和“引客入甘”合作签约、如意甘肃旅游优惠政策发布、陇原文艺展演展示、鲁甘文旅企业对接洽谈、甘肃文旅产品市集和非遗技艺以及文旅项目考察学习等内容，通过丰富多彩、富有成效的宣传推广和各类主题交流活动，联合打造黄河上下游“好客山东、如意甘肃”文旅协作品牌，合力谱写“鲁甘山海情”文旅协作新篇章。（记者黄帆）,不属于政府领导到其他城市考察学习的新闻,0.7233784481997274,False,否
甘肃省,我省赴苏浙粤招商收获颇丰,2021-06-04,记者从省商务厅获悉，5月24日至29日，我省赴江苏、浙江、广东开展招商考察活动，招商工作收获颇丰。。此次招商考察活动，我省在南京市、杭州市分别举行“招商引资项目现场签约仪式”，在深圳市举办“甘肃数据信息智能制造招商推介会”和“甘南州牦牛乳产业招商推介会”，共促成95个合同项目签约，投资总额415.64亿元，涉及文化旅游、商贸物流、清洁能源、精细化工、装备制造、数字信息、生物医药、现代农业等领域。并在江苏省苏商发展促进会设立“甘肃省招商引资合作基地”，在江苏省甘肃商会、浙江省甘肃商会、深圳市甘肃商会分别设立3个“甘肃省招商引资联络中心”。。我省招商考察团聚焦甘肃重大机遇、重点产业、重要优惠政策，加强宣传推介，先后赴苏宁控股集团、海康威视、海亮集团、华润集团、广东省广物控股集团等企业实地考察学习，宣传我省招商政策。华润、苏宁、海康威视、海亮、颐高等企业表示将加大对甘肃投资力度。。今年1至4月，我省招商引资到位资金603.5亿元，同比增长43.8%。下一步，我省商务部门将以此次招商考察为契机，推动签约项目落地，谋划办好第27届兰洽会、第4届药博会招商大会，组织重点招商活动，落实招商政策措施，推进各项政策措施落地兑现，用情用力服务投资项目和企业发展。(记者杜雪琴),政府领导到其他城市考察学习或访问,0.0,False,否
甘肃省,省商务厅以党史学习教育促招商引资见实效,2021-07-26,在党史学习教育中，省商务厅党组牢牢把握“学史明理、学史增信、学史崇德、学史力行”总体要求，加强组织领导，突出重点，学干深度融合，把党史学习教育成效体现在推动工作落实上，促进全省商务高质量发展。。我省商务部门立足工作实际，当好“店小二”，以服务企业为重点，以搭建平台为手段，大力提升服务意识和服务能力，积极主动为全省各市州和企业办实事，推动全省招商引资工作见实效。。围绕优势资源抓招商，紧盯重点产业引项目，今年5月，省商务厅组织我省招商引资代表团赴南京、杭州、深圳、广州四地开展招商考察，与20多家世界500强企业、600余家长三角珠三角知名企业参会交流对接。其中，在南京、杭州分别召开的“甘肃特色优势产业招商推介会”，共促成95个合同项目签约，投资总额415.64亿元。。“我们先后赴苏宁控股集团、海康威视、海亮集团、华润集团、广东省广物控股集团实地考察学习，推介我省特色优势产业和招商政策，增强企业家投资甘肃的信心。”省商务厅有关负责人表示，通过采取“线上招商”与“线下对接”结合等多种模式，有重点、有针对性地开展精准招商。。引进来，还得服务好，落到位。省商务厅完善招商引资工作推动落实机制，在招商引资重大项目包抓、成效评价、会展服务、代办服务、投资奖励、统计督查、投诉受理和涉企遗留问题化解等方面，研究制定了一系列行之有效的工作措施和工作机制，并强化对市州项目落地入库统计和考核督查，组织开展全省招商引资和涉企遗留问题专项督查，有效推动项目落地和工作落实。。同时，我省商务部门强化服务保障，持续营商环境，紧盯职能职责，严格落实支持中小微企业高质量发展58条、支持中小微企业平稳健康发展36条、促进民营经济发展49条措施等政策意见，推行“不来即享”的政策兑现机制，开展“全程式、跟踪式、保姆式”项目代办服务，大力推进涉企历史遗留问题化解专项行动，在全社会形成了亲商、富商、安商的良好氛围。（记者杜雪琴）,政府领导到其他城市考察学习或访问,0.561760806085404,False,否
甘肃省,欧阳坚在浙江考察学习,2020-09-28,欧阳坚在浙江考察学习时强调 汲取红船伟力学习浙江经验 为甘肃进位和赶超注魂赋能。9月24日至27日，省政协主席欧阳坚率住甘全国政协委员考察团赴浙江省考察学习。欧阳坚强调，要汲取红船精神伟力，学习浙江乡村振兴经验，为甘肃进位赶超注魂赋能。。根据全国政协安排，这次活动重点对乡村振兴和疫情防控进行专题考察学习。欧阳坚等先后到南湖区联丰村、秀洲区天鹅湖未来科学城，桐乡市横港村，安吉县鲁家村、余村，萧山区航民村、凤凰村，阿里巴巴集团考察学习，并瞻仰了南湖红船。其间，与浙江省委书记袁家军会见，出席考察学习座谈会。。欧阳坚每到一地，即与相关人员广泛交流，深入研究乡村振兴的路径、模式、标准、机制，仔细了解疫情防控运行机制。他指出，浙江作为习近平新时代中国特色社会主义思想重要萌发地、“两山”理论的策源地，认真践行是浙江高质量发展的成功密码。他说，要传承和弘扬红船精神，为乡村振兴注入强大精神动力。要把巩固脱贫攻坚成果与乡村振兴有机结合起来，注重制度设计，强化要素供给，全面构建乡村振兴指标体系、工作体系、政策体系、考核体系，协同推进乡村五大振兴。要顺应产业发展规律，优化布局，构建产业体系，做强产业集群，壮大新兴产业，做实利益联结，夯实产业振兴基础。要加快搭建各层次创新平台和研发基地，健全人才激励机制，吸引国内外高端人才，夯实打牢乡村振兴人才基础。要深度挖掘地域特色文化，打造文化平台，让老百姓既有物质上的满足又有精神上的富足。要深入践行“两山”理论，优化乡村规划布局，全面推动农村人居环境改善升级。要强化党建引领，切实发挥基层党组织关键引领作用，让农村发展更加均衡、协调、和谐。要注重运用大数据技术，完善疫情防控救治体系，健全重大疫情应急响应机制。。全国政协经济委员会副主任、省政协原主席冯健身，省政协副主席郝远、马文云、尚勋武、郭天康，兰州军区善后办副主任冷杰松及省政协秘书长王建太等参加考察。浙江省领导葛慧君、陈金彪、朱从玖、马光明等参加相关活动。（记者崔亚明）,政府领导到其他城市考察学习或访问,0.0,True,是
甘肃省,中国人民政治协商会议甘肃省第十二届委员会常务委员会工作报告,2021-02-10,中国人民政治协商会议甘肃省第十二届委员会常务委员会工作报告_甘肃要闻_甘肃省人民政府门户。中国人民政治协商会议甘肃省第十二届委员会常务委员会工作报告 ——在政协甘肃省第十二届委员会第四次会议上。2020年，是党和国家事业发展进程中极不平凡、取得伟大成就的一年。省政协及其常委会坚持以习近平新时代中国特色社会主义思想为指引，坚持团结和民主两大主题，在全国政协指导下，在中共甘肃省委领导下，围绕省委省政府中心任务，发挥专门协商机构作用，着力加强政治协商、民主监督、参政议政和凝聚共识的工作，为决战脱贫攻坚、决胜全面建成小康社会作出了应有的贡献。。持续强化理论武装。认真落实习近平新时代中国特色社会主义思想学习座谈会制度，深入学习党的十九大和十九届二中、三中、四中、五中全会精神，第一时间学习习近平总书记最新重要讲话和指示精神，把学习宣传贯彻习近平总书记对甘肃重要讲话和指示精神贯穿于工作全过程，始终在思想上政治上行动上同以习近平同志为核心的党中央保持高度一致。在每一项工作中都坚定维护党中央权威和集中统一领导，坚定维护习近平总书记党中央的核心、全党的核心地位。召开党组理论中心组学习会议13次，举办理论大讲堂8次，主席会议成员平均作宣讲5次以上，切实打牢增强“四个意识”、坚定“四个自信”、做到“两个维护”的思想政治基础。。加强思想政治引领。把深入学习习近平新时代中国特色社会主义思想，同学习中共党史、新中国史、统一战线史、人民政协史结合起来，让“更加崇尚学习、积极改造学习、持续深化学习”成为全省政协的鲜明特征。通过委员宣讲、学习座谈、调研视察、谈心谈话等形式，引导各党派团体和各族各界人士，切实增进对中国共产党领导的政治优势和中国特色社会主义制度优势的理解和认同，把更多的人凝聚在党的周围。。落实党对政协工作的全面领导。认真学习贯彻省委十三届历次全会等会议精神和各项部署，坚持在省委的领导下开展工作，做到了省委部署推进到哪里、政协履职就自觉跟进到哪里。严格执行重大问题请示报告制度，及时向省委汇报重要事项、重要工作和重要活动，不折不扣落实省委各项要求，做到了政协工作方向不偏、靶心不散。。围绕制定“十四五”规划开展专题协商。聚焦解决发展不平衡不充分问题，把“如何谋”“干什么”“怎么干”统筹起来，先后召开5次经济发展协商会，为制定“十四五”规划凝聚共识、资政建言。就补齐基础设施短板、发展壮大自主可控产业、共建西部陆海新通道提出的建议，有22条被省委省政府纳入了“十四五”规划。就国家优质食用油和肉类生产储备基地建设开展协商，相关建议进入了国家和省里的专项规划。。紧扣推动经济高质量发展进行协商。聚焦我省经济发展中的薄弱环节、主要矛盾和重点任务，就脱贫攻坚与乡村振兴、稳增长保就业、榆中生态创新城、开放型经济、红色旅游、有色冶金和电力行业高质量发展等问题，提出了一批有前瞻性、针对性、建设性的意见建议。倡议并举办了西北五省区政协助推向西开放协商会，联合向国家积极争取了一批政策、项目和资金。。紧盯民生改善深入一线开展协商。把解决民生难题作为协商工作的主要发力点，围绕基层矛盾纠纷化解、农村专门人才队伍、县乡垃圾分类处理、重点文物保护单位消防安全、全民健身等议题，深入调研协商，推动了有关民生问题得到有效解决。。聚焦生态这一底线性任务广泛协商。深入宣传实施黄河流域生态保护和高质量发展战略的重大意义，积极争取并承办了沿黄九省区政协协商研讨会，提出了一批打基础、利长远的建议。围绕黄河流域甘肃段生态保护和治理，召开常委会议专题协商，推动省委省政府有关部署逐项落地见效。,其他,0.9631348346361194,False,否
甘肃省,环西部火车游开启跨省旅游合作新模式,2020-08-05,8月2日21时36分，途经成都、重庆、西安、银川、西宁的Y402/3次“环西部火车游”列车从兰州车站始发。自此，由甘肃省文旅厅联合四川、重庆、陕西、宁夏、青海五省区市文旅部门共同举办的“环西部火车游”旅游专列“1+5”跨省宣传交流活动拉开序幕，跨省旅游合作新模式全面开启。。据悉，这次“1+5”跨省宣传交流活动为期7天6晚，将深入成都、重庆、西安、银川、西宁5个城市，分别举办3场（次）宣传推介会、2场（次）座谈交流会、签约60多份文旅合作和跨省“引客入甘”协议，考察学习10多个景区和企业。。兰州铁路局对“环西部火车游”品牌列车进行了精心打造，整组车体以“交响丝路·如意甘肃”为主题，将甘肃深厚的历史文化和丰富的旅游资源浓缩到专列各节车厢，使其成为流动的“甘肃文化旅游展厅”和“景点博物馆”，更加直观形象地展示甘肃文化旅游特色。（记者严存义 施秀萍 通讯员强科）,政府领导到其他城市考察学习或访问,0.0,False,否
甘肃省,武威市高起点创建全国文明城市工作综述,2020-06-03,文明，是一座城市的梦想和追求。梦想承载着人民对美好生活的向往，追求汇聚成干群砥砺奋进的坚定力量。。入夏的武威，花香四溢，美艳动人。今天，漫步武威街头，你能感受到丝路重镇、文化名城的辉煌厚重，也能见证“崇文尚德、包容创新”的强劲节拍。在经济社会稳步发展、城市建设日新月异的同时，人民群众的获得感、幸福感、安全感持续增强，全国文明城市创建成果在方方面面得以展现。文明，已经植根在这座城市里，融入广大市民的日常生活和行为当中，文明的力量正助推着全市经济社会高质量发展。。2018年2月14日，武威市入选全国文明城市提名城市名单。这是对一个城市开展文明创建工作的充分肯定，更是武威发展史上具有里程碑意义的一件大事。。创城工作开展以来，武威市委、市政府始终将其作为优化城市环境、造福人民群众、促进高质量发展的重要举措，按照“第一年打牢基础、整体推进，第二年攻坚克难、巩固提升，第三年全面冲刺、达标晋级”的目标要求，创造性地提出打造“德城”“文城”“绿城”“清城”的总体思路，持续推进“三项革命”“三项行动”，扎实开展城市建设管理“五个年”和“十大专项攻坚”行动，城市基础设施得到全方位改善，城乡环境面貌发生根本性变化，城市精细化管理水平明显提升，市民文明素质不断提升，群众对城市的获得感、幸福感、安全感、归属感、荣誉感持续增强。。核心价值观、文明创建等公益宣传广告随处可见，融入城市的景观小品、雕塑成为靓丽的风景线；斑马线前文明礼让暖心画面映入眼帘，文明出行、文明出游礼仪风尚在道路、公园、广场处处流传；农贸市场和背街小巷经过“整治美容”，跟脏乱差说再见，居民笑容灿烂……这一切源自创建全国文明城市带来的改变。。2018年2月14日，武威市成为2018年至2020年创建周期全国文明城市提名城市，争得了创建全国文明城市的“入场券”。这一喜讯迅速传遍全市三县一区、四街八巷。市民纷纷表示，要争做文明市民，做好文明示范，为努力创建全国文明城市贡献自己的力量。。“武威市入选全国文明城市提名城市，是值得全市人民为之骄傲的荣耀。我们将以此为契机，扎实开展生态文明建设和全域无垃圾专项行动，持续做好景区环境卫生整治工作，恪尽职守，乐于奉献，凝心聚力，为实现我们共同的目标而努力奋斗！”天马湖管理处工作人员赵丽如是说。。习近平总书记强调：“坚持以人民为中心的发展思想，坚持人民城市为人民。”武威市认真贯彻落实这一要求，精心谋划安排、靠实工作责任、抓好培训学习、强化督查指导，把创建为民理念落实到城市规划、建设、管理全过程，真正使得在创建全国文明城市中，不仅做靓了“面子”，更做实了“让城市更美好，让人民更幸福”的这个“里子”。。主题鲜明的社会宣传标语、图文并茂的公益广告、温馨精确的道德文明提示语……武威市开展创城工作以来，无论是城市乡村，还是大街小巷，无论是公共载体，还是临街商铺，人们总能在不经意间与这些无声的正能量面对面，它们激励着全市上下关心创城、支持创城、参与创城。。一幅幅主题鲜明的公益广告、宣传标语等出现在武威的大街小巷、学校、医院、社区……在为城市注入文化内涵的同时，提升了“创城”在居民群众中的知晓率、参与率和满意度，更潜移默化地影响着市民的一言一行，引导市民自觉成为创城的践行者、宣传者。。以社会主义核心价值观为主题设置的城市绿化景观也是惟妙惟肖、随处可见，已成为武威大街小巷的一道亮丽风景线。“这些花坛景观看起来赏心悦目，把社会主义核心价值观融入景观中，能让人在欣赏景观的同时受到熏陶教育。”市民孙丽红说。,其他,0.7920856197085248,False,否
甘肃省,兰州佛慈口罩生产线投产日产医用外科口罩万只,2020-03-07,经过一个多月的紧张准备，3月6日，兰州佛慈制药股份有限公司新建的2条口罩生产线正式开机运行，首批医用外科口罩正式下线，经过灭菌解析检验合格后将投放市场。。佛慈制药于1月29日向兰州市工信局递交了建设口罩生产线项目的申请报告，并迅速派出力量前往广东考察学习、签订采购合同、建成净化车间。。据介绍，佛慈制药计划投入2100万元，建成10条口罩生产线。其中，医用外科口罩生产线5条，N95口罩生产线5条，全部达产后将形成日产60万只口罩的能力。。“现在建成的这2条医用外科口罩生产线每天生产20万只口罩。”佛慈制药有关负责人表示，其他口罩生产线正在建设当中，预计3月底一共可建成3条医用外科口罩生产线、3条N95口罩生产线。（记者刘健）,政府领导到其他城市考察学习或访问,0.0,False,否
甘肃省,甘肃省工程建设项目审批制度改革工作实施方案政策解读,2019-08-15,工程建设项目审批制度改革是党中央、国务院在新形势下作出的重大决策，是贯彻落实新发展理念的重要举措，是推进政府职能转变和“放管服”改革的重要内容，意义深远，责任重大。习近平总书记多次强调要全面深化改革，优化营商环境；继续大力简政放权，强化事中事后监管；要不断推进国家治理体系和治理能力现代化，坚决破除一切不合时宜的思想观念和体制机制弊端，构建系统完备、科学规范、运行有效的制度体系。李克强总理在去年政府工作报告中明确提出工程建设项目审批时间再压减一半的目标要求，在今年政府工作报告中再次提出“在全国推开工程建设项目审批制度改革，使全流程审批时间大幅缩短”。。2018年5月，国务院在北京等15个城市和浙江开展改革试点。2019年3月26日，国务院办公厅发布《关于全面开展工程建设项目审批制度改革的实施意见》，在全国范围推开改革工作。3月28日，国务院召开全国工程建设项目审批制度改革工作电视电话会议，中央政治局常委、国务院副总理韩正出席会议并作了重要讲话。3月29日，住建部办公厅印发《关于印发工程建设项目审批制度改革实施方案编写要点的函》，对各地编制实施方案提出具体要求。。2018年试点工作开始后，省政府即安排住建厅积极跟踪试点省市改革工作，多次前往住建部专题汇报，赴浙江考察学习，研究起草了《甘肃省工程建设项目审批制度改革工作实施方案（征求意见稿）》（以下简称《实施方案》），2018年11月份征求了14个市州住建、规划等部门和兰州新区城乡规划建设管理局的意见。2018年12月，根据住建部安排组织14个市州政府和住建、规划、发改等部门负责人共44人前往重庆参加全国工程建设项目审批制度改革专题培训。培训结束后，结合住建部起草的《关于全面开展工程建设项目审批制度改革的实施意见（征求意见稿）》和重庆培训会精神，对我省的实施方案再次作了充实完善。。2019年2月，常正国副省长在全省住房和城乡建设工作会上对此项工作进行了安排部署，《实施方案》向参会的各省直部门和市州建设主管部门再次征求意见。2019年3月8日，省住建厅组织召开全省审批制度改革座谈会，广泛听取市场主体的意见和建议，及时关注社会感受度，研究完善了我省的实施方案。。全国工程建设项目审批制度改革工作电视电话会议结束后，按照常正国副省长的指示，省住建厅依据国办《实施意见》和住建部《编写要点》，结合国务院韩正副总理重要讲话精神，进一步修改完善细化我省《实施方案》。3月29日，再次向26个省直部门（中央驻甘单位）和14个市州及兰州新区征求意见。4月16日，常正国副省长召开由相关省直部门参加的专题会议，研究我省《实施方案》，经会议讨论，意见全部达成一致。4月19日，经十三届省政府第49次常务会议审议后，报住建部审核并根据住建部的意见修改完善后于2019年5月 日正式印发。。对工程建设项目审批制度实施全流程、全覆盖改革。改革覆盖工程建设项目审批全过程（包括从立项到竣工验收和公共设施接入服务）；主要是房屋建筑和城市基础设施等工程，不包括特殊工程和交通、水利、能源等领域的重大工程；覆盖行政许可等审批事项和技术审查、中介服务、市政公用服务以及备案等其他类型事项，推动流程优化和标准化。。2019年底前，实现全省工程建设项目审批管理系统与相关系统平台互联互通。2020年底前，基本建成全省统一的工程建设项目审批和管理体系，实现与国家审批管理体系的高度融合统一。,政府领导到其他城市考察学习或访问,0.8994214821634948,True,是
甘肃省,平凉与陕旅集团合作发展文化旅游产业,2020-06-07,近日，平凉市党政考察团赴陕西旅游集团有限公司实地考察学习文化旅游产业发展工作，并就加快推进崆峒山大景区合作开发有关事宜进行对接洽谈。。考察团一行先后考察了华山西峰索道、白鹿原影视城及咸阳市礼泉县袁家村等旅游景点，详细了解旅游规划设计、体制机制创新、旅游项目建设、景区服务管理、文化遗产保护开发等方面的成功经验和做法，并与陕西旅游集团座谈，就崆峒山大景区经营及合作进展情况、合作开发等事宜进行深入交流。。据了解，2019年平凉市与陕旅集团达成合作开发崆峒山大景区意向，合作取得了积极进展。（记者朱宇鲲）,政府领导到其他城市考察学习或访问,0.0,False,否
