code,province,city,topic,date,url,content,content.1,label,score,is_match
171,湖北省,黄冈市,天花城蝶变麻城市开展城管大会战工作纪实,2023-04-07,http://www.hg.gov.cn/zwxw/xsxw/9177942.html,国庆期间，不论是到麻城旅游观光、走亲访友的外地客人，还是返乡过节的麻城籍人士，走走逛逛之后，不由得发出一声声惊叹：陈年垃圾都不见了，到处变净了，变亮了，变美了，街道显得宽敞多了……。这惊叹，缘起4月6日，可容纳千余人的麻城市会展中心内座无虚席，一场自上而下的“创卫暨城管大会战”动员大会在此召开，以完善城市功能、提升城市形象和市民幸福指数为目标的攻坚战和持久战就此打响。。前后不过200余天，麻城人用坚定的信念、务实的作风、过硬的举措向世人证明：时间虽短，也能来一场令人惊喜的转变，脱胎换骨!。建设大别山区域性中心城市、进入全省20个新的经济增长点、打造全域旅游示范区……一个个机遇的青睐，让麻城人倍觉荣耀与自豪。。然而，低效的管理水平、脏乱差的环境、有待提升的市民素质……一项项与经济社会发展不匹配的短板，让麻城人深感无奈与彷徨。。2月，麻城市组织四大家领导及城建指挥部人员共20余人，到黄冈市区考察学习城市管理工作。。这次参观，他们看到了差距之大，也陷入了深深的思索，如何化压力为动力，提升城市管理水平，实现市民环境更美好、生活更幸福的愿望?。结合考察情况和麻城实际，他们迅速形成调研报告，上报市委常委会，经反复研究，出台了《麻城市区城管大会战工作方案》《麻城市区网格化管理工作方案》《麻城市区门前四包庭院三包工作方案》等六个方案和一个考评办法，搭建起了“城管大会战”的四梁八柱。。动员会上，麻城市委书记杨遥说：“坚定信心，迎难而上，务实重行，共同打好这场‘城管大会战’，提升市民获得感与幸福感。”。这背后，不仅彰显了民之所望、政之所向的民本情怀，更体现了攻坚克难的决心与能工巧匠的智慧。。一项机制，注重针对性、有效性。麻城成立书记、市长挂帅的城市环境综合整治指挥部，实行“市级领导挂点、市直部门牵头、相关单位参与、职能部门进驻”的网格化管理模式，实现大员上阵、高位推进，为环境整治保驾护航。。一种载体，聚焦增活力、添动力。城区18个社区网格“搭台子、组班子”，实行“一带九进”，对进驻网格的“九类人员”定人、定责、定岗、定时、定管理标准、定奖惩制度，“六定”责任制激励着麻城人一步一个脚印地解决“脏乱差”问题。。一场宣传，找准新方向、新定位。组织开展城管大会战进社区、进校园等文艺演出活动，宣传城管大会战的各项政策。各社区结合实际，有的组织“三老一小”、“1+10”等模式进行宣传，有的组织腰鼓队、义工队等到边到角进行宣传，让“城管大会战”工作深入人心、家喻户晓。。“城市环境也是生产力，通过城市环境综合整治，让市民对城市有认同感、归属感、自豪感。”麻城市城市管理执法局局长谢钢表示。。有史以来高度、深度、广度、力度空前的“城管大会战”，正引领着麻城冲破旧的管理模式，迈向城市治理的新征程。。成长中的“烦恼”，既有基础设施先天不足的毛病，又有后天管理乏力的问题。麻城如何破题?。“全市上下要高标准、高质量、高效率地打一场城市环境卫生综合整治的攻坚战，创造环境优美、生活便利、文明有序的城市环境，实现城市让生活更美好。”麻城市市长蔡绪安要求。。众志成城“治脏”。对城区主次干道、支街小巷、居民小区、单位庭院、城乡接合部开展“搬家式”大扫除、大清理、大清运，彻底清除城区陈年垃圾、卫生死角。完善环卫设施和机械设备，主次干道实行清扫保洁无缝作业。。多措并举“治乱”。城管队员和办事处、社区干部一起进网格、进社区，清理“牛皮癣”，大力整治占道经营、乱搭乱建、乱堆乱放、乱泼乱倒等乱象，共拆除违章建筑1.5万平方米，规范占道经营3000余起。。治脏、治堵、治乱、治差，最后落脚点还是靠人。麻城坚持一把手抓、抓一把手，层层传导责任和压力。,3月9日至10日，吉林省松原市委副书记、市长高材林率市政府考察团来我市，考察学习武汉经济技术开发区黄冈产业园PPP模式和大别山金融工程。。市委副书记、市长肖伏清主持座谈会，市委常委、常务副市长张社教，副市长刘仁举，武汉大学中国金融工程与风险管理中心主任叶永刚教授，武汉股权托管交易中心董事长龚波参加座谈，松原市市委常委、常务副市长李岩，副市长韩良参加座谈。。座谈会上，考察团观看了《中部黄冈》宣传片，听取黄冈产业园PPP项目、大别山金融工程基本情况介绍，并就相关问题进行了讨论和交流。。高材林说，黄冈市推广和实践PPP项目的力度大、步伐快，大别山金融工程实现了产业、扶贫攻坚、振兴社会发展与金融的大融合，许多做法都值得松原市借鉴和学习。希望两市缔结友好城市，在扶贫攻坚、旅游等方面进一步加强交流与沟通，实现共赢发展。。肖伏清对考察团一行表示欢迎，他说，当前，黄冈处在加快振兴崛起、决胜全面小康的关键时期，正在抢抓多项重大战略在黄冈实施的机遇，围绕“强工兴城、强农兴文”谋划推进“双百”项目，把招商引资作为“一号工程”来抓，实现金融与经济的共生共荣。同时，围绕推进供给侧结构性改革重点任务，打造大别山金融工程升级版，服务经济社会发展。黄冈市与松原市虽远隔千里，但市情相近、心意相通，此次考察必将开启松原和黄冈的友谊之门、交流之门、合作之门。希望双方以此次考察交流为契机，进一步加强沟通往来，密切联系协作，促进共同发展。。考察团一行实地考察了武汉经济技术开发区黄冈产业园、唐渡五路项目、科锋传动设备有限公司、唐家渡港区临港新城综合码头、伊利华中地区新建酸奶及乳酸菌饮料项目、东坡赤壁改造扩建、黄冈市金财担保公司等项目现场。(汪秀玲),政府领导到其他城市考察学习或访问,0.0,True
171,湖北省,黄冈市,吉林省松原市政府考察团来我市考察,2023-04-07,http://www.hg.gov.cn/zwxw/hgyw/8946671.html,3月9日至10日，吉林省松原市委副书记、市长高材林率市政府考察团来我市，考察学习武汉经济技术开发区黄冈产业园PPP模式和大别山金融工程。。市委副书记、市长肖伏清主持座谈会，市委常委、常务副市长张社教，副市长刘仁举，武汉大学中国金融工程与风险管理中心主任叶永刚教授，武汉股权托管交易中心董事长龚波参加座谈，松原市市委常委、常务副市长李岩，副市长韩良参加座谈。。座谈会上，考察团观看了《中部黄冈》宣传片，听取黄冈产业园PPP项目、大别山金融工程基本情况介绍，并就相关问题进行了讨论和交流。。高材林说，黄冈市推广和实践PPP项目的力度大、步伐快，大别山金融工程实现了产业、扶贫攻坚、振兴社会发展与金融的大融合，许多做法都值得松原市借鉴和学习。希望两市缔结友好城市，在扶贫攻坚、旅游等方面进一步加强交流与沟通，实现共赢发展。。肖伏清对考察团一行表示欢迎，他说，当前，黄冈处在加快振兴崛起、决胜全面小康的关键时期，正在抢抓多项重大战略在黄冈实施的机遇，围绕“强工兴城、强农兴文”谋划推进“双百”项目，把招商引资作为“一号工程”来抓，实现金融与经济的共生共荣。同时，围绕推进供给侧结构性改革重点任务，打造大别山金融工程升级版，服务经济社会发展。黄冈市与松原市虽远隔千里，但市情相近、心意相通，此次考察必将开启松原和黄冈的友谊之门、交流之门、合作之门。希望双方以此次考察交流为契机，进一步加强沟通往来，密切联系协作，促进共同发展。。考察团一行实地考察了武汉经济技术开发区黄冈产业园、唐渡五路项目、科锋传动设备有限公司、唐家渡港区临港新城综合码头、伊利华中地区新建酸奶及乳酸菌饮料项目、东坡赤壁改造扩建、黄冈市金财担保公司等项目现场。(汪秀玲),1月11日下午，黄石市建委副主任谢旭松带领黄石市规划院等工作人员一行来我市考察学习创建国家历史文化名城工作，市住建委党组副书记、副主任杨石明陪同考察。。考察组首先实地踏勘安国寺、东坡赤壁风景区、月波楼和文庙等历史文化街区。随后在住建委召开座谈会，杨石明向考察组介绍我市创建国家历史文化名城工作情况，黄州是千年古城，黄冈历史文化底蕴深厚，红色文化光辉灿烂，东坡文化驰名中外，戏曲文化积淀深厚，禅宗文化冠甲天下，李时珍引领的健康文化举世瞩目，名人辈出，声名远播。创建国家历史文化名城，是贯彻落实市委、市政府决策部署的现实需要，也是增强文化软实力、打造“兴文”升级版、提升城市综合竞争力的迫切需要。黄冈市重点从四个方面推进创建工作，一是全面启动创建工作，成立工作领导小组，明确创建工作思路和实施步骤，为创建工作指导方向;二是全力挖掘历史文化资源，积极开展市区保护性建筑普查、文物保护单位及不可移动文物普查和市区古树名木普查工作;三是着力完善名城创建规划体系，编制名城保护规划和禹王城遗址保护利用规划，划设历史文化街区，形成点-线-面结合的历史文化名城保护规划体系;四是建立健全名城创建机制，建立管理制度，完善投入机制，积极争取补助资金，为创建工作提供制度保障。。谢旭松表示黄冈创建国家历史文化名城的工作经验值得学习。他指出，黄冈市创建国家历史文化名城势头足、用力重、齐联动，体现在“四个到位”。一是组织领导到位，市委、市政府高度重视，成立了由书记、市长担任的历史文化名城保护委员会，并将创建工作纳入年终考核;二是经费保障到位，市财政局安排专项资金保障历史文化名城工作经费和规划编制费用，市区各融资平台将历史文化名城工程项目优先纳入年度城市建设计划;三是机构设置到位，黄冈市成立了黄冈市历史文化名城保护管理办公室，负责黄冈市城区历史文化名城保护工作;四是工作落实到位，不可移动文物保护、可移动文物普查、地下地下文物、历史古代建筑等工作推进有力、亮点频现。,其他,0.5016102697907545,True
171,湖北省,黄冈市,黄石市建委来我市考察历史文化名城创建工作,2023-04-07,http://www.hg.gov.cn/zwxw/bmdt/9066330.html,1月11日下午，黄石市建委副主任谢旭松带领黄石市规划院等工作人员一行来我市考察学习创建国家历史文化名城工作，市住建委党组副书记、副主任杨石明陪同考察。。考察组首先实地踏勘安国寺、东坡赤壁风景区、月波楼和文庙等历史文化街区。随后在住建委召开座谈会，杨石明向考察组介绍我市创建国家历史文化名城工作情况，黄州是千年古城，黄冈历史文化底蕴深厚，红色文化光辉灿烂，东坡文化驰名中外，戏曲文化积淀深厚，禅宗文化冠甲天下，李时珍引领的健康文化举世瞩目，名人辈出，声名远播。创建国家历史文化名城，是贯彻落实市委、市政府决策部署的现实需要，也是增强文化软实力、打造“兴文”升级版、提升城市综合竞争力的迫切需要。黄冈市重点从四个方面推进创建工作，一是全面启动创建工作，成立工作领导小组，明确创建工作思路和实施步骤，为创建工作指导方向;二是全力挖掘历史文化资源，积极开展市区保护性建筑普查、文物保护单位及不可移动文物普查和市区古树名木普查工作;三是着力完善名城创建规划体系，编制名城保护规划和禹王城遗址保护利用规划，划设历史文化街区，形成点-线-面结合的历史文化名城保护规划体系;四是建立健全名城创建机制，建立管理制度，完善投入机制，积极争取补助资金，为创建工作提供制度保障。。谢旭松表示黄冈创建国家历史文化名城的工作经验值得学习。他指出，黄冈市创建国家历史文化名城势头足、用力重、齐联动，体现在“四个到位”。一是组织领导到位，市委、市政府高度重视，成立了由书记、市长担任的历史文化名城保护委员会，并将创建工作纳入年终考核;二是经费保障到位，市财政局安排专项资金保障历史文化名城工作经费和规划编制费用，市区各融资平台将历史文化名城工程项目优先纳入年度城市建设计划;三是机构设置到位，黄冈市成立了黄冈市历史文化名城保护管理办公室，负责黄冈市城区历史文化名城保护工作;四是工作落实到位，不可移动文物保护、可移动文物普查、地下地下文物、历史古代建筑等工作推进有力、亮点频现。,“八山一水一分田”，位于大别山南麓的罗田县山多地少，但农特产品却极为丰富，板栗、甜柿、茯苓等农特产品全国闻名。。然而，由于交通闭塞，山沟里产的好东西卖不出去，农民难脱贫成了当地政府头疼的大难题。。为了谋求发展，2014年12月，县长詹红运一行到同是山区的浙江遂昌县考察学习农特产品网络销售，吹响了发展农村电商的号角。。摸着石头过河的罗田人，却在电商致富的大道上一路狂奔。2015年全县网络销售额达5.6亿元，2016年上半年的销售额突破了6个亿。。短短两年时间，罗田完成了从电商“小白”到“国家电子商务进农村综合示范县”的华丽蜕变，发展速度惊人。。今年省政府工作报告中提到，2017年将大力发展农村电商。政策喜人，罗田打造“华中电商第一县”的口号更有底气。。4年前，罗田90后大学生明茜，因一次意外双腿受创坐上轮椅，家庭随之陷入困境，她本人也变得消沉起来。。2015年9月，罗田县电商部门主动找到明茜，帮其搭建了村级服务站。明茜的世界一下打开，“电脑是政府免费安装的，宽带也进了村，村子里仿佛一下子就跟外面打通了。”。村级服务站是农村电商的“终端”，一方面帮乡亲们购买性价比高的生活用品和农用物资，另一方面还可以通过网络把村里的板栗、甜柿、手工油面等卖出去，既省钱又增收，颇受欢迎。。“自从开了村级服务站，村里的小孩儿都爱往这儿跑，家里变得更热闹了。”如今的明茜跟同龄女孩儿一样阳光活泼，村级电商服务站既方便了乡亲们，也让她足不出户就有了一份生计。每产生一个买卖订单，明茜就能获取平台奖励和提成。“最多的时候一个月销售两万多块，月平均收入两千多块钱，年收入将近三万。”。谈到罗田村级服务站的发展速度，物流配送中心的小潘深有感触：“公路沿线的3个镇近30个村，我每天都来送货取货，最多的时候一天能送200个，收到的包裹近50个，这在两年前是不可想象的。”。从无到有，像长冲畈村这样的电商村级服务站，罗田县已开设165个，2015年全县村级服务站网上代购交易650万元。农村电商的火苗，正成燎原之势。。“多亏了大自然公司和我们签订了包销协议，否则谁也不敢种这么多红米，铁定卖不出去。”花银岩村的农民周德银向记者坦言。。2015年，罗田县率先搭建电商平台的企业——大自然食品股份有限公司与农户签包销协议，将全村的贡米收购一空。由公司重新包装后在网上销售，竟供不应求，村民增加纯收31.56万，企业也获得一笔可观的经济效益。。以前村民们连3000斤都卖不出去，如今全村一年种植的产量达到20万斤。“预计明年花银岩村的贫困户将全部甩掉穷帽子。”大自然公司董事长徐德宁信心满满。。如今，大自然公司已发展成为当地的电商巨头，拥有3个自主品牌、研发生产农副土特产品130余种，公司2015年销售额增加1660万元。。去年3月份，央视新闻联播以“湖北罗田：电商打开农产品市场大门”为题，报道了罗田县电商扶贫助农增收的新闻;。这份自豪，也传到了国内各地的罗田人心里。老家在胜利镇的丁姐，曾在广州经商多年。后来回老家承包了一块地，种植天麻茯苓，每年眼巴巴等人上门收购。。2016年罗田电商创业园建起后，她立刻搬进去创办了绿野尚品公司，开始在网上卖农产品。。“创业园的配套非常齐备，本地企业享受很多政策红利，租金和税费都没有，创业成本很低，哪里去找这么好的事哦!”丁姐说，一想到坐在家里就能把农产品卖出去，自己干电商的劲头就很足。。据了解，罗田县电商创业园，目前已接收30多个回归创业和大学生创业对象、互联网公司、个体网商入驻，共计100多人集体孵化。自创业园建成后，先后有200余批来自全国各地的考察团队前来参观考察，“华中电商第一县”的名声不胫而走。(连明明),政府领导到其他城市考察学习或访问,0.7065572588183308,True
171,湖北省,黄冈市,詹旺民率团考察学习盘龙城遗址文物保护利用经验,2023-04-07,http://www.hg.gov.cn/zwxw/hgyw/8940679.html,4月19日，副市长詹旺民率团到武汉黄陂区盘龙城遗址参观考察，学习文化遗产保护开发利用经验，黄州区政府及市直涉及文物保护的部门负责人参加。。詹旺民一行对盘龙城国家考古遗址公园和遗址博物馆进行了实地参观，听取了相关情况介绍。考察团成员与盘龙城经济开发区相关部门人员进行了深入交流。。詹旺民肯定了盘龙城遗址的保护与开发、市场化的运作方式、公园的规划模式以及黄陂区重视文物保护工作的经验，要求我市考察团成员认真学习借鉴、消化吸收，结合禹王城遗址实际情况，加大文物保护力度。同时，积极争取省里支持，努力将禹王城遗址创建为国家级文物保护单位。。盘龙城遗址位于武汉市黄陂区盘龙经济开发区叶店村境内，占地面积6.55平方公里，是迄今我国发现的同时期保存最好的城址之一，因其蕴藏丰富的文化内涵和地面城垣景观而名闻中外，被誉为“华夏文化南方之源，九省通衢武汉之根。”(范小翠),罗田县抢抓国家“互联网+”机遇，从无到有，强力推进电子商务与县域经济融合发展，不仅让独特的优势资源得到市场青睐，盘活了一批农业特色产业，更创造了电子商务的“罗田速度”。。近年来，该县电子商务逐步兴起，甜柿、板栗、山野菜等各类特色农产品的市场需求呈几何式倍增。目前全县3000多家电商共计销售农特产品两亿多元。。罗田县电子商务中心主任林志伦介绍，今年以来，罗田通过电商将板栗、甜柿、贡米、老米酒、山野菜等218种农特产品上线销售，促进一批传统食品企业转型升级，有效带动我县农业特色产业的迅猛发展。。两年来，该县一些农特产品加工企业也紧紧盯着电子商务这块大市场，县大自然生物科技有限公司也因此成功转型为一家电商龙头企业，公司不仅注册了能在线上线下销售的“栗花香”、“老家味道”以及“多吉利”三个电商品牌商标，并通过与各地群众签订包销协议，鼓励群众实行订单种植，使过去的贡米、山野菜以及板栗等特色产业焕发了新的活力。。罗田县大自然食品有限公司董事长徐德宁介绍，我县贡米、山野菜、甜柿等很多特色农产品养在深山人未识，现在通过电商平台，不仅销路打开了，而且让传统农业特色产业得到了迅猛发展，像大河岸的贡米，去年总产量才不到两万斤，今年就达到十二万多斤。。近年来，该县抓住国家“互联网+”行动的机遇，坚持从无到有，不断建立完善电子商务的市场体系，探索电子商务在促进地方产业发展的新思路，实现了电子商务与县域经济深度融合发展。同时在实施精准扶贫工作中，该县不断创新电子商务理念，延伸电子商务功能，形成了电商扶贫的“罗田模式”，努力把罗田打造成华中电子商务第一县。。罗田县商务局局长徐友生介绍，在短短两年里时间内，成功创建了全国电子商务进农村综合示范县，创造了农村电商的“罗田速度”，形成了电商扶贫的“罗田模式”。一是市场体系日趋成熟，已建成了168个村级服务站，构建了县、乡、村三级公共服务和物流配送体系。二是公共服务深得人心。组织电商培训200多场25000人次，接待了国家级领导以及全国各地考察学习3000多人次，中央电视台新闻联播专题报道了我县电商发展情况。三是市场主体蓬勃发展，全县5000多家电商企业和网店微店两个网上交易额累计超过12亿元。四是电商扶贫先试先行，强力推进了“35131”电商扶贫工程，通过五大行动，助推千户贫困户脱贫致富。(何益刚),其他,0.5441045701880632,True
171,湖北省,黄冈市,我市考察学习孝感十堰美丽乡村规划建设工作,2023-04-07,http://www.hg.gov.cn/zwxw/hgyw/8982635.html,12月16日至19日，由市委副书记孙璜清带队的市委美丽乡村建设考察学习组，先后到孝感市、十堰市考察学习美丽乡村规划与建设工作。市直相关单位，各县市区负责人参加学习考察。。此次考察学习的主要任务是贯彻落实市委常委会议的决策部署，加快推进大别山旅游公路沿线美丽乡村建设和以黄州区陶店乡、团风县回龙镇、浠水县巴河镇为节点，沿城铁东站黄团浠快速通道的美丽乡村示范片建设，推动全市新农村建设的城乡一体化连线成片、提档升级。。考察组先后到孝感市考察学习了孝南区朋兴乡丹阳古镇、上魏湾村庄整治点、金卉庄园、福良山有机茶叶公司。在十堰市，先后考察学习了竹山县麻家渡镇总兵安村、溢水镇东川村，竹溪县蒋家堰镇敖家坝片区、莲花村片区以及水坪镇东沟片区，房县土城黄酒村、双柏移民小区。每到一处，考察组都详细了解美丽乡村规划建设方面的好经验、好做法以及取得的成效。在房县召开的座谈会上，双方就美丽乡村规划建设方面的经验做法进行了交流。。孙璜清在考察学习时强调，市委、市政府高度重视美丽乡村建设，各地要以十堰市竹房城镇带及孝感市的成功经验为样本，结合各地实际，融会贯通，做到高起点规划建设。要进一步增强责任意识、机遇意识、效益意识，结合美丽乡村建设、精准扶贫等工作，用好资金、政策，努力履职尽责，让老百姓能脱贫、稳得住、能致富，不负黄冈人民的期盼，让黄冈美丽乡村的规划建设经得起时间、组织、群众的检验。考察结束后要深入学习此次考察的经验，及时汇报学习成果，各县市要结合本次考察，做好本区域美丽乡村规划建设工作。(胡辉),6月15日，市委党校组织2016年上半年第二期县干班学员赴英山县开展现场教学，考察学习新农村建设经验。。学员们先后参观了英山县温泉镇百丈河村、红山镇乌云山村、金家铺镇龙潭河村新农村建设现场。近年来，英山县积极推进新农村建设，以提高农民收入和生活质量，着力提高农村组织化水平为核心，完善基层党组织建设、公共服务和村民自治，大力实施美丽乡村建设和扶贫开发，使农业强起来、农民富起来、农村美起来。英山县的新农村建设经验，给学员们留下了深刻印象。。在孔家坊乡神峰山庄、金家铺镇丽景山庄，学员们考察了山庄大力发展观光休闲生态农业，带动周边村民脱贫致富情况。通过现场教学，丰富了教学内容，开阔了学员眼界。(周玉蓉 王婷),政府领导到其他城市考察学习或访问,0.0,True
