code,province,city,topic,date,url,content,content.1,label,score,is_match
171,湖北省,黄冈市,小砖头大治理我市党政代表团走出去学习考察微观察,,https://www.hg.gov.cn/content/article/9312557,“大家看看这些砖块有什么窍门？”9月16日，我市党政代表团到江苏省溧阳市天目湖镇桂林村考察学习。在一户村民家路边的砖结构围墙前，市委书记李军杰突然停下脚步抛出了问题。。考察团成员驻足观察，只见青砖错落有致摆放整齐，垒成半人高的围墙；围墙上盆栽绿植生机盎然，与遍布青砖的绿苔相映成趣。透过砖墙的间隙，墙外的游客隐隐可以看见大人们坐在门口浆洗衣服，小孩在旁嬉戏打闹，朝行人挥手打招呼，一幅生动活泼的乡村野趣图呼之欲出。。“院墙内是私人空间，院墙外是公共空间，围墙就像一个小的生态屏风，让乡村风貌浑然一体。”站在围墙边，李军杰现场解读了砖头里的“治理密码”。。“不要小瞧这块砖，看似无意，却是有意为之。我们当干部的，要琢磨美丽乡村的味道，通过提升治理能力最大限度发挥比较优势，扮靓我们的乡村。”李军杰说，此次出来考察学习，就是要认真学习发达地区先进的治理能力和治理水平。。8月9日至10日，省委书记王蒙徽到黄冈调研时指出，要解放思想、更新观念，抓紧“走出去”，主动学习先进地区的发展理念，更好融入全国发展大局。。8月25日至9月中旬，我市党政代表团先后奔赴河南、安徽、江苏、浙江、福建等五省考察。学习的主线之一，就是提升治理能力和治理水平。。“要在一线发现问题、研究问题、解决问题，提升治理能力。”从最紧迫微小的地方入手，既有锚定目标的登高望远，也有务实、精准的脚踏实地。此前，市委市政府主要领导多次深入一线调研，结合当地实际，与干部群众一起探讨提升治理能力的基层实践。。在罗田县三里畈镇新铺村苍葭冲调研时，市委书记李军杰，市委副书记、市长刘洁询问基层干部墙面铺砖的建造工艺与成本。得知村民是就地取材，与古香古色的村庄整体风貌融为一体，既美观且成本低。李军杰说，当领导干部，就像管理一个家庭，要精打细算，会花小钱办大事，让老百姓得实惠。。同样是一块小小砖头，折射出以治理能力和治理水平现代化倒逼高质量发展的黄冈实践。而治理能力与治理水平的提升，不仅要有对地理格局的深刻观察，亦有发展格局的精准判断。。“一定要从大局着眼，小处着手，从战略布局来思考我们做什么，为什么要这么做。”李军杰说。。黄冈是农业大市、人口大市，位于武汉都市圈核心功能区，周边地区经济活跃，消费容量大；农村地区有较好的交通和公共服务设施，农村人口转移较多，农业具备规模化发展的基础条件；多式联运条件好，突出特色农产品和农文旅融合等比较优势发展都市圈农业的潜力巨大。。一个地方发展战略的选择，生动映照出“全市一盘棋”集中力量办大事的制度优势。而如何把制度优势转化为治理效能，进而成为发展势能，考验的是政绩观、是方法论。。“干部队伍治理能力是保障战略任务落实的前提和关键。”李军杰说。用好发挥好“关键少数”的作用，也是部署十个县市区推进黄冈现代化建设的深层逻辑之一。。如何用创新的办法激励干部提升能力，争当干将、闯将、猛将，为全市经济社会高质量发展夯实根基、蓄积动能？市委健全重点工作一线考察识别干部的工作机制，全面建立市县党政班子成员工作实绩档案，一人一档，一月一记，作为干部选拔任用、能上能下的重要依据。。黄冈现代化道路，每一步都在抉择、在探索。“有所为有所不为”的智慧与取舍，正是提升治理能力的关键所在。在全市高质量发展专题培训班上，市委市政府主要领导反复提到两组词——。黄冈有好山好水、好文化、好物产，也有武鄂黄黄核心功能区建设等好机遇，但发展质效和水平总体不高，最大短板是缺乏走出去看世界的开放精神，市场意识和改革开放意识不强，治理能力特别是运用市场机制破解发展难题的能力不足。。市委市政府反复强调：“要自觉打破自家‘一亩三分地’的思维定式，多打大算盘、算大账。”,“大家看看这些砖块有什么窍门？”9月16日，我市党政代表团到江苏省溧阳市天目湖镇桂林村考察学习。在一户村民家路边的砖结构围墙前，市委书记李军杰突然停下脚步抛出了问题。。考察团成员驻足观察，只见青砖错落有致摆放整齐，垒成半人高的围墙；围墙上盆栽绿植生机盎然，与遍布青砖的绿苔相映成趣。透过砖墙的间隙，墙外的游客隐隐可以看见大人们坐在门口浆洗衣服，小孩在旁嬉戏打闹，朝行人挥手打招呼，一幅生动活泼的乡村野趣图呼之欲出。。“院墙内是私人空间，院墙外是公共空间，围墙就像一个小的生态屏风，让乡村风貌浑然一体。”站在围墙边，李军杰现场解读了砖头里的“治理密码”。。“不要小瞧这块砖，看似无意，却是有意为之。我们当干部的，要琢磨美丽乡村的味道，通过提升治理能力最大限度发挥比较优势，扮靓我们的乡村。”李军杰说，此次出来考察学习，就是要认真学习发达地区先进的治理能力和治理水平。。8月9日至10日，省委书记王蒙徽到黄冈调研时指出，要解放思想、更新观念，抓紧“走出去”，主动学习先进地区的发展理念，更好融入全国发展大局。。8月25日至9月中旬，我市党政代表团先后奔赴河南、安徽、江苏、浙江、福建等五省考察。学习的主线之一，就是提升治理能力和治理水平。。“要在一线发现问题、研究问题、解决问题，提升治理能力。”从最紧迫微小的地方入手，既有锚定目标的登高望远，也有务实、精准的脚踏实地。此前，市委市政府主要领导多次深入一线调研，结合当地实际，与干部群众一起探讨提升治理能力的基层实践。。在罗田县三里畈镇新铺村苍葭冲调研时，市委书记李军杰，市委副书记、市长刘洁询问基层干部墙面铺砖的建造工艺与成本。得知村民是就地取材，与古香古色的村庄整体风貌融为一体，既美观且成本低。李军杰说，当领导干部，就像管理一个家庭，要精打细算，会花小钱办大事，让老百姓得实惠。。同样是一块小小砖头，折射出以治理能力和治理水平现代化倒逼高质量发展的黄冈实践。而治理能力与治理水平的提升，不仅要有对地理格局的深刻观察，亦有发展格局的精准判断。。“一定要从大局着眼，小处着手，从战略布局来思考我们做什么，为什么要这么做。”李军杰说。。黄冈是农业大市、人口大市，位于武汉都市圈核心功能区，周边地区经济活跃，消费容量大；农村地区有较好的交通和公共服务设施，农村人口转移较多，农业具备规模化发展的基础条件；多式联运条件好，突出特色农产品和农文旅融合等比较优势发展都市圈农业的潜力巨大。。一个地方发展战略的选择，生动映照出“全市一盘棋”集中力量办大事的制度优势。而如何把制度优势转化为治理效能，进而成为发展势能，考验的是政绩观、是方法论。。“干部队伍治理能力是保障战略任务落实的前提和关键。”李军杰说。用好发挥好“关键少数”的作用，也是部署十个县市区推进黄冈现代化建设的深层逻辑之一。。如何用创新的办法激励干部提升能力，争当干将、闯将、猛将，为全市经济社会高质量发展夯实根基、蓄积动能？市委健全重点工作一线考察识别干部的工作机制，全面建立市县党政班子成员工作实绩档案，一人一档，一月一记，作为干部选拔任用、能上能下的重要依据。。黄冈现代化道路，每一步都在抉择、在探索。“有所为有所不为”的智慧与取舍，正是提升治理能力的关键所在。在全市高质量发展专题培训班上，市委市政府主要领导反复提到两组词——。黄冈有好山好水、好文化、好物产，也有武鄂黄黄核心功能区建设等好机遇，但发展质效和水平总体不高，最大短板是缺乏走出去看世界的开放精神，市场意识和改革开放意识不强，治理能力特别是运用市场机制破解发展难题的能力不足。。市委市政府反复强调：“要自觉打破自家‘一亩三分地’的思维定式，多打大算盘、算大账。”,政府领导到其他城市考察学习或访问,0.8003173850652284,True
171,湖北省,黄冈市,马艳舟陪同荆门市代表团一行考察学习我市农业产业化工作,2023-04-07,http://www.hg.gov.cn/szf/fszmyz/zyhd/9274917.html,3月3日－4日，荆门市政府副市长刘克雄同志率团来我市考察学习农业产业化和美丽乡村建设。黄冈市政府副市长马艳舟、副秘书长吴元西，黄冈市农业农村局党组成员、副局长凌家瑞等陪同考察。。荆门市代表团一行先后到黄冈伊利乳业有限责任公司、蕲春县艾师傅手工蕲艾园、李时珍医药集团、蕲春县地标优品馆、湖北名羊科技有限公司，蕲春县漕河镇铁山村、罗田县燕儿谷等地，重点考察了农产品标准化规模化加工、农产品研发创新、产业链聚集区建设、美丽乡村建设等情况，详细了解了黄冈农业产业化的发展现状、经验做法以及重点产业链打造，并围绕美丽乡村建设与相关人员座谈深入交流。代表团一致认为，黄冈市深入推进农村一二三产业融合发展、着力构建现代农业产业体系、全力打造农业全产业链，强龙头、创品牌、延链条，以工业理念大抓农业产业化的举措和成效值得认真学习和借鉴，下一步，将围绕全面乡村振兴，加强两地合作交流，助推农业高质高效发展。,3月3日－4日，荆门市政府副市长刘克雄同志率团来我市考察学习农业产业化和美丽乡村建设。黄冈市政府副市长马艳舟、副秘书长吴元西，黄冈市农业农村局党组成员、副局长凌家瑞等陪同考察。。荆门市代表团一行先后到黄冈伊利乳业有限责任公司、蕲春县艾师傅手工蕲艾园、李时珍医药集团、蕲春县地标优品馆、湖北名羊科技有限公司，蕲春县漕河镇铁山村、罗田县燕儿谷等地，重点考察了农产品标准化规模化加工、农产品研发创新、产业链聚集区建设、美丽乡村建设等情况，详细了解了黄冈农业产业化的发展现状、经验做法以及重点产业链打造，并围绕美丽乡村建设与相关人员座谈深入交流。代表团一致认为，黄冈市深入推进农村一二三产业融合发展、着力构建现代农业产业体系、全力打造农业全产业链，强龙头、创品牌、延链条，以工业理念大抓农业产业化的举措和成效值得认真学习和借鉴，下一步，将围绕全面乡村振兴，加强两地合作交流，助推农业高质高效发展。,政府领导到其他城市考察学习或访问,0.0,True
171,湖北省,黄冈市,对标学习促提升转型发展新赛道我市党政代表团到江苏浙江福建考察侧记,,http://www.hg.gov.cn/content/article/9310383,"对标学习促提升 转型发展新赛道——我市党政代表团到江苏浙江福建考察侧记_黄冈市人民政府。9月15日至18日，市委书记李军杰，市委副书记、市长刘洁带领我市党政代表团赴江苏、浙江、福建三省考察学习。。一路走来，三省四地的转型发展之路，令代表团成员惊叹不已——眼里是绿色突围的一树繁花，是改革创新的惊涛拍岸，是久久为功的筚路蓝缕；心里是对短板和差距的新认知、新思考，是内心渴望与现实对比碰撞激发出的新举措、新打算。。金秋时节，市委六届六次全会提出，以强县工程和乡村振兴为主攻方向探索黄冈现代化建设路径。怎样走出一条现代化发展之路？黄冈和发达地区差距究竟在哪里？如何借“他山之石”攻己之玉？。4天4地，12个考察点，近3000公里的行程，代表团马不停蹄，时间安排分秒必争，在学习中对标，在对标中反思，在反思中谋划。。地处长三角重要腹地，江苏省常州市溧阳市从“九五”期间就提出经济、环境、社会可持续发展，立足“三山一水六分田”的生态之美，通过在“开放创新”“生态环境”“城乡融合”“共同富裕”“社会治理”等领域不断创新，探索县域高质量发展的生动实践。。代表团“取经”长三角，第一站来到溧阳市。带来巨大冲击波的，除了满目苍翠，更有它的另一种特质：生态创新。坐拥天目湖这颗“江南明珠”，溧阳市的天目湖生态保护市场化经验与生态产品增值模式，让大家精神一振——。溧阳、郎溪、广德三地共建苏皖合作示范区，以天目湖流域为试点，针对“特定地域单元水生态产品”开展了市场化交易的全新尝试，并在跨界流域探索上下游水生态保护量化补偿机制，搭建生态容量向生态产品转化的平台,全面激活了天目湖流域水生态产品价值变现。。“绿色发展理念之新、氛围之浓、效果之好，让我大开眼界、大受教益。”麻城市委书记汪国兵感慨道：“解放思想是最大的‘法宝’，只要不断解放思想、更新观念，革命老区同样可以高质量发展；生态资源是最大的‘财富’，只要坚持生态优先、绿色发展，大别山区同样可以打造‘两山’创新实践的示范区。”。青山环抱，清水潺潺。走进湖州市安吉县天荒坪镇余村，村口石碑上“绿水青山就是金山银山”十个大字赫然醒目。。2005年8月15日，时任浙江省委书记习近平在余村调研时，首次提出“绿水青山就是金山银山”的发展理念。十余年来，余村人在“两山”理念指导下，走出了一条转型发展、绿色发展、和谐发展之路，将生态建设与“千万工程”紧密结合起来，持续改造优化人居环境，大力建设美丽乡村。。“将深入践行‘两山’理念，学习借鉴浙江‘千万工程’，持续推进牛车河等六大片区小流域综合治理，连片开展美丽乡村建设示范。强化规划引领和刚性约束，注重整体美感，推进乡村风貌的连贯有序。”团风县委书记何永红说。。余村的绿色发展之路充分验证了这句妇孺皆知的金句——“绿水青山就是金山银山”，代表团成员对基于实践的“两山”理念有了更为生动和深刻的了解。。“我深刻认识到‘两山’理念，不单是对生态环境的要求，更是保护和发展生产力的要求，因地制宜推动生态产业化、产业生态化，才能实现生态、经济、社会的‘三赢’高质量发展。”龙感湖管理区党工委书记高维鹏说。。淳安县以县域内国有投资平台为主体，组建县乡两级“两山银行”，全面摸清山、水、林、田、湖、草等生态资源以及农村宅基地、农房、古村、古镇、老街等闲散资源“家底”，统一纳入“两山银行”，选择合适标的推向市场，盘活提升资源价值，破解生态资源资产管理和转化过程中的四大困惑——低效闲置、支农无奈、增收乏力、招商落地难。。解放思想、敢于创新带来生态资源向资产、资本的高水平转化，为沉睡的各类农村资源提供了丰润的发展土壤。","对标学习促提升 转型发展新赛道——我市党政代表团到江苏浙江福建考察侧记_黄冈市人民政府。9月15日至18日，市委书记李军杰，市委副书记、市长刘洁带领我市党政代表团赴江苏、浙江、福建三省考察学习。。一路走来，三省四地的转型发展之路，令代表团成员惊叹不已——眼里是绿色突围的一树繁花，是改革创新的惊涛拍岸，是久久为功的筚路蓝缕；心里是对短板和差距的新认知、新思考，是内心渴望与现实对比碰撞激发出的新举措、新打算。。金秋时节，市委六届六次全会提出，以强县工程和乡村振兴为主攻方向探索黄冈现代化建设路径。怎样走出一条现代化发展之路？黄冈和发达地区差距究竟在哪里？如何借“他山之石”攻己之玉？。4天4地，12个考察点，近3000公里的行程，代表团马不停蹄，时间安排分秒必争，在学习中对标，在对标中反思，在反思中谋划。。地处长三角重要腹地，江苏省常州市溧阳市从“九五”期间就提出经济、环境、社会可持续发展，立足“三山一水六分田”的生态之美，通过在“开放创新”“生态环境”“城乡融合”“共同富裕”“社会治理”等领域不断创新，探索县域高质量发展的生动实践。。代表团“取经”长三角，第一站来到溧阳市。带来巨大冲击波的，除了满目苍翠，更有它的另一种特质：生态创新。坐拥天目湖这颗“江南明珠”，溧阳市的天目湖生态保护市场化经验与生态产品增值模式，让大家精神一振——。溧阳、郎溪、广德三地共建苏皖合作示范区，以天目湖流域为试点，针对“特定地域单元水生态产品”开展了市场化交易的全新尝试，并在跨界流域探索上下游水生态保护量化补偿机制，搭建生态容量向生态产品转化的平台,全面激活了天目湖流域水生态产品价值变现。。“绿色发展理念之新、氛围之浓、效果之好，让我大开眼界、大受教益。”麻城市委书记汪国兵感慨道：“解放思想是最大的‘法宝’，只要不断解放思想、更新观念，革命老区同样可以高质量发展；生态资源是最大的‘财富’，只要坚持生态优先、绿色发展，大别山区同样可以打造‘两山’创新实践的示范区。”。青山环抱，清水潺潺。走进湖州市安吉县天荒坪镇余村，村口石碑上“绿水青山就是金山银山”十个大字赫然醒目。。2005年8月15日，时任浙江省委书记习近平在余村调研时，首次提出“绿水青山就是金山银山”的发展理念。十余年来，余村人在“两山”理念指导下，走出了一条转型发展、绿色发展、和谐发展之路，将生态建设与“千万工程”紧密结合起来，持续改造优化人居环境，大力建设美丽乡村。。“将深入践行‘两山’理念，学习借鉴浙江‘千万工程’，持续推进牛车河等六大片区小流域综合治理，连片开展美丽乡村建设示范。强化规划引领和刚性约束，注重整体美感，推进乡村风貌的连贯有序。”团风县委书记何永红说。。余村的绿色发展之路充分验证了这句妇孺皆知的金句——“绿水青山就是金山银山”，代表团成员对基于实践的“两山”理念有了更为生动和深刻的了解。。“我深刻认识到‘两山’理念，不单是对生态环境的要求，更是保护和发展生产力的要求，因地制宜推动生态产业化、产业生态化，才能实现生态、经济、社会的‘三赢’高质量发展。”龙感湖管理区党工委书记高维鹏说。。淳安县以县域内国有投资平台为主体，组建县乡两级“两山银行”，全面摸清山、水、林、田、湖、草等生态资源以及农村宅基地、农房、古村、古镇、老街等闲散资源“家底”，统一纳入“两山银行”，选择合适标的推向市场，盘活提升资源价值，破解生态资源资产管理和转化过程中的四大困惑——低效闲置、支农无奈、增收乏力、招商落地难。。解放思想、敢于创新带来生态资源向资产、资本的高水平转化，为沉睡的各类农村资源提供了丰润的发展土壤。",政府领导到其他城市考察学习或访问,0.7363817889104888,True
