code,province,city,topic,date,url,content,content,label,score
235,四川省,内江市,威远县经济信息化和科学技术局关于对县政协十一届四次会议第号提案答复的函,2024-07-15,https://www.weiyuan.gov.cn//wyx/zxwyta/202407/c487ed16f78445adb56285102ca362aa.shtml,威远县经济信息化和科学技术局关于对县政协十一届四次会议第1号提案答复的函_政协委员提案_内江市威远县人民政府。你提出的《关于推进威远工业高质量发展的建议》（政协威远县第十一届委员会第四次会议提案第〔2024〕001号提案）收悉。。你在提案中共提出建议意见6条。即：1.锚定产业新赛道，实施精准招商；2.支持本地企业发展，补链延链强链；3.创新产融模式，助推产业发展；4.强化人才支撑，做大企业家队伍；5.坚持创新引领，提升企业竞争力；6.优化营商环境，打造要素成本洼地。我单位十分重视你提出的建议意见，经与你在办前、办中的沟通协商，提案中所提建议和意见已列入计划解决，并征求县政府分管负责同志同意，现就你提出的建议意见逐条答复如下：。优化营商环境，打造要素成本洼地。我单位十分重视你提出的建议意见，经与你在办前、办中的沟通协商，提案中所提建议和意见已列入计划解决，并征求县政府分管负责同志同意，现就你提出的建议意见逐条答复如下：。我县聚焦“2+3”产业，按照“紧盯前沿、打造生态、沿链聚合、集群发展”思路，坚持开展“全域、全员、全力”招商。一是找准主攻方向。围绕推进新质生产力和“2+3”产业发展，开展细分产业研究，形成圆柱形锂电池、半导体、光通信产业分析报告10篇；印发《做好建链延链工作加快构建现代化产业体系任务清单》，组建招商引资专业化团队，进一步深化思想认识，压实工作责任，制造业明确24个细分产业发展方向、重点目标企业和产业项目，精准发力构筑现代化产业体系。二是实施精准招商。紧盯产业发展方向和产业链条，积极开展“走出去”“请进来”工作，赴江苏省、江西省等拜访企业12次，邀请苏州仕净等21批（次）企业来威考察，成功引进5亿元以上制造业项目2个；积极开展以企招商，发挥川威、威玻等龙头企业的示范引领作用以商招商，成功引进钒电解液生产项目；举办威远籍在外知名人士和招商引资企业代表迎春茶话会，鼓励在外知名人士、商协会、企业家返乡投资兴业，介绍企业来威投资。。下一步，我县将坚持锁定细分行业、细分领域招引龙头企业，持续绘制完善产业链全景图和招商路线图，瞄准上下游产业链节点项目、关键环节，有目的、有针对性地招引龙头型、基地型、延链型的产业链项目，加快形成现代产业集群。。我县支持企业聚焦主导产业，加快转型升级，鼓励企业提高产品、技术、管理等方面创新能力，着力培育专精特新企业，支持本地企业发展。一是强化基础保障，制定《威远县盘活闲置工业土地和企业厂房工作方案》，开展严陵园区低效用地及闲置厂房清理行动，初步成果已完成；规划落实严陵园区标准化厂房33亩，已完成规划及建筑设计方案；落实化工园区埃普诺标准化厂房46亩，已完成前期规划设计，计划本月底开工建设。二是探索产业发展新模式，由县领导带队，组织相关单位和远沃公司赴广东东莞市学习轻纺、电子产业“企业+卫星”模式；多次到井得毛织制衣有限公司走访，了解企业生产工艺、经营模式，帮助企业解决发展“企业+卫星”模式问题，井得现已布置卫星点位5个，使用工人80余名，卫星点位实现产值300余万元。三是加强企业培育，将培育规上、规下工业企业纳入各镇2024年度工业经济目标任务，充分发挥各镇发展工业的主观能动性，2024年已成功新增规模工业企业1户；结合五经普工作，对规下工业企业开展摸底排查并进行了产业分析；持续开展企业培育扶持，对井得制衣、威宝等就业带动力强、发展潜力较好的企业开展现场调研，助力企业发展。。亩，已完成前期规划设计，计划本月底开工建设。二是探索产业发展新模式，由县领导带队，组织相关单位和远沃公司赴广东东莞市学习轻纺、电子产业,威远县经济信息化和科学技术局关于对县政协十一届四次会议第1号提案答复的函_政协委员提案_内江市威远县人民政府。你提出的《关于推进威远工业高质量发展的建议》（政协威远县第十一届委员会第四次会议提案第〔2024〕001号提案）收悉。。你在提案中共提出建议意见6条。即：1.锚定产业新赛道，实施精准招商；2.支持本地企业发展，补链延链强链；3.创新产融模式，助推产业发展；4.强化人才支撑，做大企业家队伍；5.坚持创新引领，提升企业竞争力；6.优化营商环境，打造要素成本洼地。我单位十分重视你提出的建议意见，经与你在办前、办中的沟通协商，提案中所提建议和意见已列入计划解决，并征求县政府分管负责同志同意，现就你提出的建议意见逐条答复如下：。优化营商环境，打造要素成本洼地。我单位十分重视你提出的建议意见，经与你在办前、办中的沟通协商，提案中所提建议和意见已列入计划解决，并征求县政府分管负责同志同意，现就你提出的建议意见逐条答复如下：。我县聚焦“2+3”产业，按照“紧盯前沿、打造生态、沿链聚合、集群发展”思路，坚持开展“全域、全员、全力”招商。一是找准主攻方向。围绕推进新质生产力和“2+3”产业发展，开展细分产业研究，形成圆柱形锂电池、半导体、光通信产业分析报告10篇；印发《做好建链延链工作加快构建现代化产业体系任务清单》，组建招商引资专业化团队，进一步深化思想认识，压实工作责任，制造业明确24个细分产业发展方向、重点目标企业和产业项目，精准发力构筑现代化产业体系。二是实施精准招商。紧盯产业发展方向和产业链条，积极开展“走出去”“请进来”工作，赴江苏省、江西省等拜访企业12次，邀请苏州仕净等21批（次）企业来威考察，成功引进5亿元以上制造业项目2个；积极开展以企招商，发挥川威、威玻等龙头企业的示范引领作用以商招商，成功引进钒电解液生产项目；举办威远籍在外知名人士和招商引资企业代表迎春茶话会，鼓励在外知名人士、商协会、企业家返乡投资兴业，介绍企业来威投资。。下一步，我县将坚持锁定细分行业、细分领域招引龙头企业，持续绘制完善产业链全景图和招商路线图，瞄准上下游产业链节点项目、关键环节，有目的、有针对性地招引龙头型、基地型、延链型的产业链项目，加快形成现代产业集群。。我县支持企业聚焦主导产业，加快转型升级，鼓励企业提高产品、技术、管理等方面创新能力，着力培育专精特新企业，支持本地企业发展。一是强化基础保障，制定《威远县盘活闲置工业土地和企业厂房工作方案》，开展严陵园区低效用地及闲置厂房清理行动，初步成果已完成；规划落实严陵园区标准化厂房33亩，已完成规划及建筑设计方案；落实化工园区埃普诺标准化厂房46亩，已完成前期规划设计，计划本月底开工建设。二是探索产业发展新模式，由县领导带队，组织相关单位和远沃公司赴广东东莞市学习轻纺、电子产业“企业+卫星”模式；多次到井得毛织制衣有限公司走访，了解企业生产工艺、经营模式，帮助企业解决发展“企业+卫星”模式问题，井得现已布置卫星点位5个，使用工人80余名，卫星点位实现产值300余万元。三是加强企业培育，将培育规上、规下工业企业纳入各镇2024年度工业经济目标任务，充分发挥各镇发展工业的主观能动性，2024年已成功新增规模工业企业1户；结合五经普工作，对规下工业企业开展摸底排查并进行了产业分析；持续开展企业培育扶持，对井得制衣、威宝等就业带动力强、发展潜力较好的企业开展现场调研，助力企业发展。。亩，已完成前期规划设计，计划本月底开工建设。二是探索产业发展新模式，由县领导带队，组织相关单位和远沃公司赴广东东莞市学习轻纺、电子产业,政府领导到其他城市考察学习或访问,0.5641873242645367
235,四川省,内江市,习近平必须坚持自信自立,2024-07-15,https://www.weiyuan.gov.cn//wyx/gwyxx/202407/0e7290a1643240839bbbeb04e1d63b23.shtml,我们始终认为，各国的发展道路应由各国人民选择。所谓的“中国模式”是中国人民在自己的奋斗实践中创造的中国特色社会主义道路。我们坚信，随着中国特色社会主义不断发展，我们的制度必将越来越成熟，我国社会主义制度的优越性必将进一步显现，我们的道路必将越走越宽广，我国发展道路对世界的影响必将越来越大。。实现中国梦必须走中国道路。这就是中国特色社会主义道路。这条道路来之不易，它是在改革开放30多年的伟大实践中走出来的，是在中华人民共和国成立60多年的持续探索中走出来的，是在对近代以来170多年中华民族发展历程的深刻总结中走出来的，是在对中华民族5000多年悠久文明的传承中走出来的，具有深厚的历史渊源和广泛的现实基础。中华民族是具有非凡创造力的民族，我们创造了伟大的中华文明，我们也能够继续拓展和走好适合中国国情的发展道路。。2021年7月1日，庆祝中国共产党成立100周年大会在北京天安门广场隆重举行。中共中央总书记、国家主席、中央军委主席习近平发表重要讲话。新华社记者 鞠鹏/摄。独立自主是我们党从中国实际出发、依靠党和人民力量进行革命、建设、改革的必然结论。不论过去、现在和将来，我们都要把国家和民族发展放在自己力量的基点上，坚持民族自尊心和自信心，坚定不移走自己的路。。独立自主是中华民族的优良传统，是中国共产党、中华人民共和国立党立国的重要原则。在中国这样一个人口众多和经济文化落后的东方大国进行革命和建设的国情与使命，决定了我们只能走自己的路。。站立在960万平方公里的广袤土地上，吸吮着中华民族漫长奋斗积累的文化养分，拥有13亿中国人民聚合的磅礴之力，我们走自己的路，具有无比广阔的舞台，具有无比深厚的历史底蕴，具有无比强大的前进定力。中国人民应该有这个信心，每一个中国人都应该有这个信心。。坚持独立自主，就要坚持中国的事情必须由中国人民自己作主张、自己来处理。世界上没有放之四海而皆准的具体发展模式，也没有一成不变的发展道路。历史条件的多样性，决定了各国选择发展道路的多样性。人类历史上，没有一个民族、没有一个国家可以通过依赖外部力量、跟在他人后面亦步亦趋实现强大和振兴。那样做的结果，不是必然遭遇失败，就是必然成为他人的附庸。。我们党在领导革命、建设、改革长期实践中，历来坚持独立自主开拓前进道路，这种独立自主的探索和实践精神，这种坚持走自己的路的坚定信心和决心，是我们党全部理论和实践的立足点，也是党和人民事业不断从胜利走向胜利的根本保证。。一个国家选择什么样的治理体系，是由这个国家的历史传承、文化传统、经济社会发展水平决定的，是由这个国家的人民决定的。我国今天的国家治理体系，是在我国历史传承、文化传统、经济社会发展的基础上长期发展、渐进改进、内生性演化的结果。我国国家治理体系需要改进和完善，但怎么改、怎么完善，我们要有主张、有定力。中华民族是一个兼容并蓄、海纳百川的民族，在漫长历史进程中，不断学习他人的好东西，把他人的好东西化成我们自己的东西，这才形成我们的民族特色。没有坚定的制度自信就不可能有全面深化改革的勇气，同样，离开不断改革，制度自信也不可能彻底、不可能久远。我们全面深化改革，是要使中国特色社会主义制度更好；我们说坚定制度自信，不是要固步自封，而是要不断革除体制机制弊端，让我们的制度成熟而持久。。2024年6月18日至19日，中共中央总书记、国家主席、中央军委主席习近平在青海考察。这是18日下午，习近平在果洛西宁民族中学高一（1）班观摩“新时代、新家乡”主题思政课。新华社记者 鞠鹏/摄。※这是习近平总书记2013年1月至2024年3月期间有关必须坚持自信自立重要论述的节录。,我们始终认为，各国的发展道路应由各国人民选择。所谓的“中国模式”是中国人民在自己的奋斗实践中创造的中国特色社会主义道路。我们坚信，随着中国特色社会主义不断发展，我们的制度必将越来越成熟，我国社会主义制度的优越性必将进一步显现，我们的道路必将越走越宽广，我国发展道路对世界的影响必将越来越大。。实现中国梦必须走中国道路。这就是中国特色社会主义道路。这条道路来之不易，它是在改革开放30多年的伟大实践中走出来的，是在中华人民共和国成立60多年的持续探索中走出来的，是在对近代以来170多年中华民族发展历程的深刻总结中走出来的，是在对中华民族5000多年悠久文明的传承中走出来的，具有深厚的历史渊源和广泛的现实基础。中华民族是具有非凡创造力的民族，我们创造了伟大的中华文明，我们也能够继续拓展和走好适合中国国情的发展道路。。2021年7月1日，庆祝中国共产党成立100周年大会在北京天安门广场隆重举行。中共中央总书记、国家主席、中央军委主席习近平发表重要讲话。新华社记者 鞠鹏/摄。独立自主是我们党从中国实际出发、依靠党和人民力量进行革命、建设、改革的必然结论。不论过去、现在和将来，我们都要把国家和民族发展放在自己力量的基点上，坚持民族自尊心和自信心，坚定不移走自己的路。。独立自主是中华民族的优良传统，是中国共产党、中华人民共和国立党立国的重要原则。在中国这样一个人口众多和经济文化落后的东方大国进行革命和建设的国情与使命，决定了我们只能走自己的路。。站立在960万平方公里的广袤土地上，吸吮着中华民族漫长奋斗积累的文化养分，拥有13亿中国人民聚合的磅礴之力，我们走自己的路，具有无比广阔的舞台，具有无比深厚的历史底蕴，具有无比强大的前进定力。中国人民应该有这个信心，每一个中国人都应该有这个信心。。坚持独立自主，就要坚持中国的事情必须由中国人民自己作主张、自己来处理。世界上没有放之四海而皆准的具体发展模式，也没有一成不变的发展道路。历史条件的多样性，决定了各国选择发展道路的多样性。人类历史上，没有一个民族、没有一个国家可以通过依赖外部力量、跟在他人后面亦步亦趋实现强大和振兴。那样做的结果，不是必然遭遇失败，就是必然成为他人的附庸。。我们党在领导革命、建设、改革长期实践中，历来坚持独立自主开拓前进道路，这种独立自主的探索和实践精神，这种坚持走自己的路的坚定信心和决心，是我们党全部理论和实践的立足点，也是党和人民事业不断从胜利走向胜利的根本保证。。一个国家选择什么样的治理体系，是由这个国家的历史传承、文化传统、经济社会发展水平决定的，是由这个国家的人民决定的。我国今天的国家治理体系，是在我国历史传承、文化传统、经济社会发展的基础上长期发展、渐进改进、内生性演化的结果。我国国家治理体系需要改进和完善，但怎么改、怎么完善，我们要有主张、有定力。中华民族是一个兼容并蓄、海纳百川的民族，在漫长历史进程中，不断学习他人的好东西，把他人的好东西化成我们自己的东西，这才形成我们的民族特色。没有坚定的制度自信就不可能有全面深化改革的勇气，同样，离开不断改革，制度自信也不可能彻底、不可能久远。我们全面深化改革，是要使中国特色社会主义制度更好；我们说坚定制度自信，不是要固步自封，而是要不断革除体制机制弊端，让我们的制度成熟而持久。。2024年6月18日至19日，中共中央总书记、国家主席、中央军委主席习近平在青海考察。这是18日下午，习近平在果洛西宁民族中学高一（1）班观摩“新时代、新家乡”主题思政课。新华社记者 鞠鹏/摄。※这是习近平总书记2013年1月至2024年3月期间有关必须坚持自信自立重要论述的节录。,其他,0.7320117846721897
235,四川省,内江市,资中县文化广播电视和旅游局对县十七届人大四次会议第号建议答复的函,2024-07-01,https://www.zizhong.gov.cn/zzx/rddbjy/202407/9abe2d6840c447e29b39927540ab7031.shtml,资中县文化广播电视和旅游局对县十七届人大四次会议第45号建议答复的函_人大代表建议_内江市资中县人民政府。近年来，我县针对文旅资源丰富，但文旅产业发展薄弱的情况，在坚守与开新中助力活力文化名城建设。。组建历史文化研究会，全面系统挖掘资中历史文化，推动重龙镇、罗泉古镇、铁佛古镇等文物古迹集中的乡镇，加强区域性文物资源整合和集中连片保护利用，在文物保护区域因地制宜、依法适度发展旅游业、服务业和休闲农业，促进文化。农业的融合发展态势，融入全域旅游、乡村振兴战略，促进我县精品旅游线路的推荐、营销。挖掘状元文化，开展“状元资旅”等主题研学旅游，开发状元“资味”等系列文创产品，打造逵骧书城、状元市集等文化和旅游消费聚集区，以文促旅，延长产业链，加快文化产业发展。推动罗泉古镇项目建设，展现千年盐文化，成功创建国家。级旅游景区。推动资中木偶文化发展，建成省级研学旅行实践基地（营地）、省级非物质文化遗产保护传承基地、省级非遗体验基地资中木偶剧团，研发。余场，不断促进全县文化事业发展。通过开展资中国学文化旅游周、祭孔礼乐表演、开笔礼等活动，把文武二庙打造成国学研学基地，积极融入成渝国学研学环线，重龙山摩崖造像纳入成渝石刻研究环线。。年成功入选第四批天府旅游名县候选县初审名单。积极推进项目建设工作，落地建设罗泉旅游基础设施建设一期工程建设项目——首期启动区、资中古城核心区建设等项目。重点打造云岭金秋乡村旅游综合体、新桥水映双桥森林汤泉、资中鱼溪响水滩生态农业休闲体验区等乡村旅游项目。持续加强资中特色旅游商品研发，将本土特色农产品旅游商品化。罗泉豆腐包子、资中鲶鱼已成功入选四川省美食名单，扩大了资中美食品牌效应。。强化旅游市场监管和执法职能，规范旅游市场秩序。加强对各级领导干部的培训，统一认识，增强旅游发展指导、协调和执行力；对旅游投资业主和旅游从业人员进行专业培训，不断提升我县旅游业管理服务水平和服务质量，促进旅游业健康发展。。项具体奖补措施。锚定“加快建设成渝主轴绿色产业强县活力文化名城”的发展定位，全面梳理全县文化和旅游产业发展基础，积极包装资中古城核心区和罗泉古镇后期运营管理、乡村农文旅融合发展等招商引资项目，坚持“走出去”和“引进来”双向发力，制定招商引资计划，通过外出考察学习、以情招商、以商招商等方式，不断提升全县文化和旅游招商吸引力。。资中悠久的历史文化是宝贵遗产，我们有责任、有义务把它保护好、发展好、利用好。我们将抢抓全面融入成渝地区双城经济圈建设重大机遇，通过深挖我县文化旅游资源，加快推进文旅项目建设，积极宣传推介资中文旅品牌，不断提升资中文旅辐射面和影响力，推动全县文化旅游产业发展再上新台阶，为加快建设活力文化名城尽责、出力、做贡献。,资中县文化广播电视和旅游局对县十七届人大四次会议第45号建议答复的函_人大代表建议_内江市资中县人民政府。近年来，我县针对文旅资源丰富，但文旅产业发展薄弱的情况，在坚守与开新中助力活力文化名城建设。。组建历史文化研究会，全面系统挖掘资中历史文化，推动重龙镇、罗泉古镇、铁佛古镇等文物古迹集中的乡镇，加强区域性文物资源整合和集中连片保护利用，在文物保护区域因地制宜、依法适度发展旅游业、服务业和休闲农业，促进文化。农业的融合发展态势，融入全域旅游、乡村振兴战略，促进我县精品旅游线路的推荐、营销。挖掘状元文化，开展“状元资旅”等主题研学旅游，开发状元“资味”等系列文创产品，打造逵骧书城、状元市集等文化和旅游消费聚集区，以文促旅，延长产业链，加快文化产业发展。推动罗泉古镇项目建设，展现千年盐文化，成功创建国家。级旅游景区。推动资中木偶文化发展，建成省级研学旅行实践基地（营地）、省级非物质文化遗产保护传承基地、省级非遗体验基地资中木偶剧团，研发。余场，不断促进全县文化事业发展。通过开展资中国学文化旅游周、祭孔礼乐表演、开笔礼等活动，把文武二庙打造成国学研学基地，积极融入成渝国学研学环线，重龙山摩崖造像纳入成渝石刻研究环线。。年成功入选第四批天府旅游名县候选县初审名单。积极推进项目建设工作，落地建设罗泉旅游基础设施建设一期工程建设项目——首期启动区、资中古城核心区建设等项目。重点打造云岭金秋乡村旅游综合体、新桥水映双桥森林汤泉、资中鱼溪响水滩生态农业休闲体验区等乡村旅游项目。持续加强资中特色旅游商品研发，将本土特色农产品旅游商品化。罗泉豆腐包子、资中鲶鱼已成功入选四川省美食名单，扩大了资中美食品牌效应。。强化旅游市场监管和执法职能，规范旅游市场秩序。加强对各级领导干部的培训，统一认识，增强旅游发展指导、协调和执行力；对旅游投资业主和旅游从业人员进行专业培训，不断提升我县旅游业管理服务水平和服务质量，促进旅游业健康发展。。项具体奖补措施。锚定“加快建设成渝主轴绿色产业强县活力文化名城”的发展定位，全面梳理全县文化和旅游产业发展基础，积极包装资中古城核心区和罗泉古镇后期运营管理、乡村农文旅融合发展等招商引资项目，坚持“走出去”和“引进来”双向发力，制定招商引资计划，通过外出考察学习、以情招商、以商招商等方式，不断提升全县文化和旅游招商吸引力。。资中悠久的历史文化是宝贵遗产，我们有责任、有义务把它保护好、发展好、利用好。我们将抢抓全面融入成渝地区双城经济圈建设重大机遇，通过深挖我县文化旅游资源，加快推进文旅项目建设，积极宣传推介资中文旅品牌，不断提升资中文旅辐射面和影响力，推动全县文化旅游产业发展再上新台阶，为加快建设活力文化名城尽责、出力、做贡献。,政府领导到其他城市考察学习或访问,0.0
