code,province,city,topic,date,url,content,content.1,label,score,is_match,是否为“学习考察”新闻
296,新疆省,吐鲁番市,强信心起好步开新局复兴崛起重塑工业强市吐鲁番市党政代表团赴湖南学习考察启示二,2023-03-06,http://www.tlf.gov.cn//tlfs/c106219/202303/f20917760a9f428d9d260d15d2bf0fea.shtml,强信心 起好步 开新局 | 复兴崛起重塑工业强市——吐鲁番市党政代表团赴湖南学习考察启示（二）。2月20日下午，吐鲁番市委书记马学良率领吐鲁番市党政代表团来到湖南之行的第二站衡阳市，实地考察学习衡阳市科技创新、产业转型升级等方面的先进经验和做法，进一步拓展衡吐两地多元合作的广度深度，助力吐鲁番产业升级和经济高质量发展。。衡阳市位于湖南省中南部，古称衡州，雅称“雁城”，是国家区域重点城市、省域副中心城市。作为全国26个老工业基地之一，衡阳市的兴衰复苏始终和工业紧密相连。近年来，衡阳市全面落实“三高四新”战略定位和使命任务，推进“三强一化”建设(强创新、强开放、强集聚，区域中心化)，不断加快区域中心化进程，努力建设国家区域重点城市和省域副中心城市。衡阳市坚定不移推进供给侧结构性改革，打好转型升级系列组合拳，正在从“速度领跑”向“质量领先”华丽转变。随着衡阳市产业转型升级，一批批国之重器在这里研发生产，安装在祖国最需要的地方；一批批高科技产品销往世界各地，为“中国制造”赢得了好名声。。考察中，代表团参观了特变电工衡阳变压器有限公司、衡阳富泰宏精密工业有限公司，亲身感受了衡阳市在科技创新、产学研结合、产业转型升级、新业态发展等方面发生的蝶变，这座老工业城市正在复兴，崛起为新的工业强市。衡阳市生产总值由2012年的1603.79亿元，提升至2021年的3840.31亿元。10年间，接连跨越两个千亿关口，2022年更是突破4000亿元，实现了三连跳，工业企业实缴税金61.67亿元。。随着一扇近40米高的大门缓缓打开，一台高30米、重800吨的“巨无霸”变压器展现在人们眼前。这是特变电工衡阳变压器有限公司生产的世界最高电压等级最大容量1500MVA/1000kV特高压变压器，被誉为“国之重器”。。在特变电工衡阳变压器有限公司生产车间，随处可见处于调试阶段的大型变压器。工人们正在赶制出口到巴基斯坦、马来西亚等国的37台套输变电产品，订单金额共计2.02亿元，另有141台套已经完成装配及出厂试验的产品正等待发运。特变电工衡阳变压器有限公司被誉为“创新的魔术师”，是诸多国内外首台套输变电产品的研制者。正是依靠超强的科技创新能力，该公司海外订单迎来爆发式增长，目前已排产到了2023年12月，实现了新市场、新业务的连续突破。。作为中国输变电制造行业的领军企业，特变电工衡阳变压器有限公司特高压技术站在世界之巅。该公司是特变电工于2001年重组衡阳变压器厂成立的，先后研发重点新产品400余项，累计申请专利及软件著作权636项，参与及主持制定国家及行业标准146项，多次填补行业空白。该公司自主研制的产品远销全球70多个国家和地区，实现了由“中国制造”向“中国创造”，由“装备中国”向“装备世界”的新跨越。。科技创新彰显硬实力。创新是引领发展的第一动力，当今世界，以高新技术赋能传统产业，以新型技术驱动数字化转型已成为新产业培育、新价值创造的有力手段和有效途径。代表团一致认为，此次参观考察，不仅目睹了这些“国之重器”生产的过程，更让大家重新认识了创新研发给制造业带来的蓬勃力量和广阔市场前景。特别是特变电工衡阳变压器有限公司还是湘疆两地企业合作的典范，这让湘吐两地企业既有合作的基础，更有发展的空间与机遇，理应携手推动更大范围、更深层次的产业联动和协作，共同促进经济社会高质量发展。一直以来，吐鲁番都以“引进来”的方式，招引企业落户，希望通过学习特变电工衡阳变压器有限公司这个湘疆两地企业合作的成功典范，让更多吐鲁番优质企业能够走出去，积极开拓国内外市场，在竞争中做大做强做优。,强信心 起好步 开新局 | 复兴崛起重塑工业强市——吐鲁番市党政代表团赴湖南学习考察启示（二）。2月20日下午，吐鲁番市委书记马学良率领吐鲁番市党政代表团来到湖南之行的第二站衡阳市，实地考察学习衡阳市科技创新、产业转型升级等方面的先进经验和做法，进一步拓展衡吐两地多元合作的广度深度，助力吐鲁番产业升级和经济高质量发展。。衡阳市位于湖南省中南部，古称衡州，雅称“雁城”，是国家区域重点城市、省域副中心城市。作为全国26个老工业基地之一，衡阳市的兴衰复苏始终和工业紧密相连。近年来，衡阳市全面落实“三高四新”战略定位和使命任务，推进“三强一化”建设(强创新、强开放、强集聚，区域中心化)，不断加快区域中心化进程，努力建设国家区域重点城市和省域副中心城市。衡阳市坚定不移推进供给侧结构性改革，打好转型升级系列组合拳，正在从“速度领跑”向“质量领先”华丽转变。随着衡阳市产业转型升级，一批批国之重器在这里研发生产，安装在祖国最需要的地方；一批批高科技产品销往世界各地，为“中国制造”赢得了好名声。。考察中，代表团参观了特变电工衡阳变压器有限公司、衡阳富泰宏精密工业有限公司，亲身感受了衡阳市在科技创新、产学研结合、产业转型升级、新业态发展等方面发生的蝶变，这座老工业城市正在复兴，崛起为新的工业强市。衡阳市生产总值由2012年的1603.79亿元，提升至2021年的3840.31亿元。10年间，接连跨越两个千亿关口，2022年更是突破4000亿元，实现了三连跳，工业企业实缴税金61.67亿元。。随着一扇近40米高的大门缓缓打开，一台高30米、重800吨的“巨无霸”变压器展现在人们眼前。这是特变电工衡阳变压器有限公司生产的世界最高电压等级最大容量1500MVA/1000kV特高压变压器，被誉为“国之重器”。。在特变电工衡阳变压器有限公司生产车间，随处可见处于调试阶段的大型变压器。工人们正在赶制出口到巴基斯坦、马来西亚等国的37台套输变电产品，订单金额共计2.02亿元，另有141台套已经完成装配及出厂试验的产品正等待发运。特变电工衡阳变压器有限公司被誉为“创新的魔术师”，是诸多国内外首台套输变电产品的研制者。正是依靠超强的科技创新能力，该公司海外订单迎来爆发式增长，目前已排产到了2023年12月，实现了新市场、新业务的连续突破。。作为中国输变电制造行业的领军企业，特变电工衡阳变压器有限公司特高压技术站在世界之巅。该公司是特变电工于2001年重组衡阳变压器厂成立的，先后研发重点新产品400余项，累计申请专利及软件著作权636项，参与及主持制定国家及行业标准146项，多次填补行业空白。该公司自主研制的产品远销全球70多个国家和地区，实现了由“中国制造”向“中国创造”，由“装备中国”向“装备世界”的新跨越。。科技创新彰显硬实力。创新是引领发展的第一动力，当今世界，以高新技术赋能传统产业，以新型技术驱动数字化转型已成为新产业培育、新价值创造的有力手段和有效途径。代表团一致认为，此次参观考察，不仅目睹了这些“国之重器”生产的过程，更让大家重新认识了创新研发给制造业带来的蓬勃力量和广阔市场前景。特别是特变电工衡阳变压器有限公司还是湘疆两地企业合作的典范，这让湘吐两地企业既有合作的基础，更有发展的空间与机遇，理应携手推动更大范围、更深层次的产业联动和协作，共同促进经济社会高质量发展。一直以来，吐鲁番都以“引进来”的方式，招引企业落户，希望通过学习特变电工衡阳变压器有限公司这个湘疆两地企业合作的成功典范，让更多吐鲁番优质企业能够走出去，积极开拓国内外市场，在竞争中做大做强做优。,政府领导到其他城市考察学习或访问,0.5245740372660181,True,是
296,新疆省,吐鲁番市,吐鲁番市高标准高质量推进党史学习教育综述之五,2021-06-28,http://www.tlf.gov.cn//tlfs/c106219/202106/d77d76a84bc845bcb34cccad705d4ca3.shtml,党史学习教育开展以来，我市党员干部自觉从党的百年历史中汲取砥砺奋进的精神力量，不断提高政治判断力、政治领悟力、政治执行力，以党史学习教育的实际成效推动经济社会高质量发展，在大力实施“1065”产业升级计划、奋力建设现代化吐鲁番中展现新担当新作为。。吐鲁番经济开发区临空产业园“一带一路”吐鲁番旅游综合服务中心建设项目现场，工人正在紧锣密鼓地轧制梁筋、安装梁板，准备浇筑；。一幕幕蓬勃发展的场景是我市学史力行的真实写照，是检验我市党史学习教育成果的生动实践。。今年以来，我市深入贯彻党的十九届五中全会和第三次中央新疆工作座谈会精神，完整准确贯彻新时代党的治疆方略，牢牢扭住社会稳定和长治久安总目标，统筹发展和安全，统筹疫情防控和经济社会发展，把产业项目建设作为实施“1065”产业升级计划的重要抓手，为全市经济高质量发展打造新引擎、培育新动能。。3月上旬，我市2021年援疆项目集中开工仪式在长沙葡萄主题公园举行，葡萄产业示范园项目、传媒中心配套设施项目、网络与信息安全校企合作实训基地项目等14个援疆项目动工，吹响了我市以项目开工为抓手、加快推动高质量发展开年集结号。。随后，全市2021年招商项目观摩暨招商引资工作会议召开，相关部门进园区、走企业、看项目，通过深入现场观摩考察，引导全市上下以更高站位、更大力度、更实举措推进产业项目建设，真正把明理、增信、崇德落到力行上，把学党史、悟思想的成效体现到办实事、开新局上。。今年以来，我市千方百计引导优势资源向重大项目集中，建立完善“立项一批、开工一批、推进一批、建成一批”的重大项目推进机制，促进项目快落地、快推进、快见效，以重大项目高质量增长支撑高质量发展，为全市经济高质量发展稳住了“压舱石”。。人间天堂，丝路重镇。一次相会，碰撞出无限机遇。6月10日，“吐鲁番‘酒’是想你”——2021第十八届浙商(投融资)大会吐鲁番葡萄酒产区专场推介会在浙江杭州举行，会上举行了三大“双百”工程购销签约仪式，吸引了12家浙企、机构与吐鲁番酒庄企业签订合作协议，共计1.36亿元。。同时，由副市长、葡萄酒产业发展专班组长带领的市林草局、市商务局、吐鲁番经开区相关领导、专班工作人员及8家酒庄企业负责人，赴浙江省湖州市调研葡萄酒销售市场和吐鲁番葡萄酒馆选址工作。8家葡萄酒企业与韵达集团签订战略协议，解决酒庄企业葡萄酒销售难，运输、仓储成本高等问题。。这次考察学习，既是一次学习取经之旅，也是一次深化合作之旅，更是一次加压奋进之旅。广大党员干部在学深悟透中，自觉运用党的创新理论优化工作方法，增强开拓创新精神，破解发展“卡脖子”难题。。当前，我市正处于推动工业强基和转型升级期。市委、市政府围绕培育壮大特色优势产业，大力推进“1065”产业升级计划，重点发展石油化工、煤电煤化工、新型材料加工及装备制造、现代物流、文旅康养、农产品精深加工、葡萄酒、馕、纺织服装、热经济“十大产业”，在增强企业竞争力、提升智能制造能力、优化产业布局、完善产业生态等方面寻求更大突破。。我市各级各部门坚持党的实事求是思想路线，开展专题行动破解发展难题，保持攻坚克难劲头不懈怠。。实现依申请政务服务事项网上可办率98.3%、最多跑一次比例98.25%。持续优化营商环境，全面实现6个环节压缩到2.5个工作日内的目标，建成完善市工程建设项目审批平台，实现建设项目全流程审批时间压缩至120个工作日内的目标。同时，推行“非接触式”办税缴费服务，通过智慧微厅可办理214项“非接触式”税费业务……。在吐鲁番，一项项务实的举措正将党史学习教育成果转化为干实事、办实事、干成事的不竭动力。,党史学习教育开展以来，我市党员干部自觉从党的百年历史中汲取砥砺奋进的精神力量，不断提高政治判断力、政治领悟力、政治执行力，以党史学习教育的实际成效推动经济社会高质量发展，在大力实施“1065”产业升级计划、奋力建设现代化吐鲁番中展现新担当新作为。。吐鲁番经济开发区临空产业园“一带一路”吐鲁番旅游综合服务中心建设项目现场，工人正在紧锣密鼓地轧制梁筋、安装梁板，准备浇筑；。一幕幕蓬勃发展的场景是我市学史力行的真实写照，是检验我市党史学习教育成果的生动实践。。今年以来，我市深入贯彻党的十九届五中全会和第三次中央新疆工作座谈会精神，完整准确贯彻新时代党的治疆方略，牢牢扭住社会稳定和长治久安总目标，统筹发展和安全，统筹疫情防控和经济社会发展，把产业项目建设作为实施“1065”产业升级计划的重要抓手，为全市经济高质量发展打造新引擎、培育新动能。。3月上旬，我市2021年援疆项目集中开工仪式在长沙葡萄主题公园举行，葡萄产业示范园项目、传媒中心配套设施项目、网络与信息安全校企合作实训基地项目等14个援疆项目动工，吹响了我市以项目开工为抓手、加快推动高质量发展开年集结号。。随后，全市2021年招商项目观摩暨招商引资工作会议召开，相关部门进园区、走企业、看项目，通过深入现场观摩考察，引导全市上下以更高站位、更大力度、更实举措推进产业项目建设，真正把明理、增信、崇德落到力行上，把学党史、悟思想的成效体现到办实事、开新局上。。今年以来，我市千方百计引导优势资源向重大项目集中，建立完善“立项一批、开工一批、推进一批、建成一批”的重大项目推进机制，促进项目快落地、快推进、快见效，以重大项目高质量增长支撑高质量发展，为全市经济高质量发展稳住了“压舱石”。。人间天堂，丝路重镇。一次相会，碰撞出无限机遇。6月10日，“吐鲁番‘酒’是想你”——2021第十八届浙商(投融资)大会吐鲁番葡萄酒产区专场推介会在浙江杭州举行，会上举行了三大“双百”工程购销签约仪式，吸引了12家浙企、机构与吐鲁番酒庄企业签订合作协议，共计1.36亿元。。同时，由副市长、葡萄酒产业发展专班组长带领的市林草局、市商务局、吐鲁番经开区相关领导、专班工作人员及8家酒庄企业负责人，赴浙江省湖州市调研葡萄酒销售市场和吐鲁番葡萄酒馆选址工作。8家葡萄酒企业与韵达集团签订战略协议，解决酒庄企业葡萄酒销售难，运输、仓储成本高等问题。。这次考察学习，既是一次学习取经之旅，也是一次深化合作之旅，更是一次加压奋进之旅。广大党员干部在学深悟透中，自觉运用党的创新理论优化工作方法，增强开拓创新精神，破解发展“卡脖子”难题。。当前，我市正处于推动工业强基和转型升级期。市委、市政府围绕培育壮大特色优势产业，大力推进“1065”产业升级计划，重点发展石油化工、煤电煤化工、新型材料加工及装备制造、现代物流、文旅康养、农产品精深加工、葡萄酒、馕、纺织服装、热经济“十大产业”，在增强企业竞争力、提升智能制造能力、优化产业布局、完善产业生态等方面寻求更大突破。。我市各级各部门坚持党的实事求是思想路线，开展专题行动破解发展难题，保持攻坚克难劲头不懈怠。。实现依申请政务服务事项网上可办率98.3%、最多跑一次比例98.25%。持续优化营商环境，全面实现6个环节压缩到2.5个工作日内的目标，建成完善市工程建设项目审批平台，实现建设项目全流程审批时间压缩至120个工作日内的目标。同时，推行“非接触式”办税缴费服务，通过智慧微厅可办理214项“非接触式”税费业务……。在吐鲁番，一项项务实的举措正将党史学习教育成果转化为干实事、办实事、干成事的不竭动力。,其他,0.5412726863018542,True,是
296,新疆省,吐鲁番市,吐鲁番有个发家不忘乡亲的带头大哥,2016-06-23,http://www.tlf.gov.cn//tlfs/c106670/201606/2066df0e74c4482e86e3053c694fe573.shtml,新华网乌鲁木齐6月22日电(徐丽)盛夏时节，走进吐鲁番市恰特喀勒乡新红旗设施蔬菜种植农业专业合作社的院内，偌大的大棚王国里，少了蔬菜种植、采摘期的“繁华”，眼前所有的“功勋”大棚已进入休整、晾晒期。。吐鲁番是全国著名的干热区，素有“火洲”之称，在这个天山东部的山间盆地里，有着丰富的光热资源和独特的自然气候，也是全疆“菜篮子”“果盘子”的理想之地。如今，遍布吐鲁番盆地的大棚蔬菜已成为继葡萄、哈密瓜后全市农业第三大支柱产业。。作为吐鲁番大棚经济中弄潮儿中一员的张贤春，1967年出生于吐鲁番市恰特喀勒乡恰特喀勒村5组，从小就喝着坎儿井的水，和维吾尔族小伙伴一起长大，并说有一口流利的维吾尔族语。。2010年，张贤春用在邮政储蓄银行申请的25万元个人商务贷款承包了恰特喀勒乡15座大棚种植哈密瓜，当年大棚哈密瓜喜获丰收，收入达45万元。。张贤春所在的恰特喀勒乡位于吐鲁番市东南17公里处， 总面积为825平方公里，耕地面积58660亩，下辖7个行政村，45个村民小组，全乡总人口31000人，维吾尔人口占90%。全乡以种植葡萄、棉花、西甜瓜、蔬菜等喜光作物为主。。在张贤春的带领下，2009年他和众乡亲一道成立了吐鲁番市恰特喀勒乡新红旗设施蔬菜种植农业专业合作社，合作社成立之初只有100来座大棚，在邮储银行吐鲁番分行40万贷款的帮助下，很快大棚数量扩大到了647座，种植户也由最初的13户扩展到了226户，其中96%的种植户都是维吾尔族。在发展设施农业的同时，有效拓宽了当地农民的经济收入种类，增加了果蔬、瓜果的销售，大大提高了当地农民的收入。所种植的果蔬远销上海、广州、杭州等地……。“能带领乡亲们共同致富，要是没有邮储银行吐鲁番分行的支持，我们发展不了这么好，因为合作社社员们家庭条件有限，这几年每年贷款都是拿我个人房产抵押贷的，用做合作社发展。邮储银行服务到位的很，对我的支持力度非常大，还经常上门指导、了解发展情况，为我们解决了很多后顾之忧。”张贤春说。。如今，提起这位非亲非故、带大家一道致富的张贤春理事长，恰特喀勒乡各族农民无人不晓，无不竖起大拇指。。想农民所想，急农民所急，做农贸所需。合作是带领农民发展现代农业、增加收入的基础。几年来，为了改变当地农民的思想观念，提高合作社意识，张贤春还经常利用晚上的休息时间，找维吾尔族老乡普及合作社知识，介绍推广大棚种植技术、病虫灾害的防治、科学施肥方法，分析市场行情，利用这种轻松的交流方式，逐步引领大家走上现代农业之路，和农民建立了深厚的感情，越来越多的维吾尔族老乡愿意找张贤春同志讨论种植技术话题，提高种植技术，还愿意把生活中的困难告诉他，每年培训农民达1200多人次。。为了培养农民种植户的市场意识，2011年，张贤春自筹资金，分批组织恰乡周边农民130多人到乌市北园春市场考察学习，让大家亲临市场，感受市场，极大提高了农民的种植信心和积极性。张贤春还经常组织各族社员到吐鲁番地区管理好、种植技术好的合作社去讨教，使社员的生产能力经营意识得到了很好的提升，社员种植大棚收入每座达2.5万元，远高于当地平均水平。,新华网乌鲁木齐6月22日电(徐丽)盛夏时节，走进吐鲁番市恰特喀勒乡新红旗设施蔬菜种植农业专业合作社的院内，偌大的大棚王国里，少了蔬菜种植、采摘期的“繁华”，眼前所有的“功勋”大棚已进入休整、晾晒期。。吐鲁番是全国著名的干热区，素有“火洲”之称，在这个天山东部的山间盆地里，有着丰富的光热资源和独特的自然气候，也是全疆“菜篮子”“果盘子”的理想之地。如今，遍布吐鲁番盆地的大棚蔬菜已成为继葡萄、哈密瓜后全市农业第三大支柱产业。。作为吐鲁番大棚经济中弄潮儿中一员的张贤春，1967年出生于吐鲁番市恰特喀勒乡恰特喀勒村5组，从小就喝着坎儿井的水，和维吾尔族小伙伴一起长大，并说有一口流利的维吾尔族语。。2010年，张贤春用在邮政储蓄银行申请的25万元个人商务贷款承包了恰特喀勒乡15座大棚种植哈密瓜，当年大棚哈密瓜喜获丰收，收入达45万元。。张贤春所在的恰特喀勒乡位于吐鲁番市东南17公里处， 总面积为825平方公里，耕地面积58660亩，下辖7个行政村，45个村民小组，全乡总人口31000人，维吾尔人口占90%。全乡以种植葡萄、棉花、西甜瓜、蔬菜等喜光作物为主。。在张贤春的带领下，2009年他和众乡亲一道成立了吐鲁番市恰特喀勒乡新红旗设施蔬菜种植农业专业合作社，合作社成立之初只有100来座大棚，在邮储银行吐鲁番分行40万贷款的帮助下，很快大棚数量扩大到了647座，种植户也由最初的13户扩展到了226户，其中96%的种植户都是维吾尔族。在发展设施农业的同时，有效拓宽了当地农民的经济收入种类，增加了果蔬、瓜果的销售，大大提高了当地农民的收入。所种植的果蔬远销上海、广州、杭州等地……。“能带领乡亲们共同致富，要是没有邮储银行吐鲁番分行的支持，我们发展不了这么好，因为合作社社员们家庭条件有限，这几年每年贷款都是拿我个人房产抵押贷的，用做合作社发展。邮储银行服务到位的很，对我的支持力度非常大，还经常上门指导、了解发展情况，为我们解决了很多后顾之忧。”张贤春说。。如今，提起这位非亲非故、带大家一道致富的张贤春理事长，恰特喀勒乡各族农民无人不晓，无不竖起大拇指。。想农民所想，急农民所急，做农贸所需。合作是带领农民发展现代农业、增加收入的基础。几年来，为了改变当地农民的思想观念，提高合作社意识，张贤春还经常利用晚上的休息时间，找维吾尔族老乡普及合作社知识，介绍推广大棚种植技术、病虫灾害的防治、科学施肥方法，分析市场行情，利用这种轻松的交流方式，逐步引领大家走上现代农业之路，和农民建立了深厚的感情，越来越多的维吾尔族老乡愿意找张贤春同志讨论种植技术话题，提高种植技术，还愿意把生活中的困难告诉他，每年培训农民达1200多人次。。为了培养农民种植户的市场意识，2011年，张贤春自筹资金，分批组织恰乡周边农民130多人到乌市北园春市场考察学习，让大家亲临市场，感受市场，极大提高了农民的种植信心和积极性。张贤春还经常组织各族社员到吐鲁番地区管理好、种植技术好的合作社去讨教，使社员的生产能力经营意识得到了很好的提升，社员种植大棚收入每座达2.5万元，远高于当地平均水平。,其他,0.8061171048770195,False,否
