code,province,city,topic,date,url,content,content.1,label,score,is_match,是否为“学习考察”新闻
296,新疆省,吐鲁番市,托克逊县夏乡布拉克佰什村工作组积极引导村民发展馕产业,2016-09-04,http://www.tlf.gov.cn//tlfs/c106661/201609/fc1efd1e50c44a6abb51bf9c0ebddcc4.shtml,"今年住村以来，托克逊县夏乡布拉克佰什村工作组认真落实吐鲁番市委发展馕产业的工作思路，积极引导村民走产业化、品牌化发展道路，鼓励当地村民打造具有地域特色的馕产业品牌。。工作组在入户走访中了解到村民卡德尔·阿不都是该村的打馕能手，每天打的馕都供不应求，他希望通过自己的手艺不仅做大自己的事业，也可以带动贫困村民家庭一起致富。为了实现他的愿望，工作组和村委会通过多方协调，专门成立了伊再提古丽打馕合作社。。合作社成立后，工作组发现他仍然以传统的方式进行销售，为了让他开阔眼界、打开思路、拓宽销售渠道，工作组带着他赴高昌区馕销售一条街和夏乡色日吉力尕村的馕合作社进行考察学习，当听到赫科麦提食品农民专业合作社的馕通过各种渠道已走出县城、走进乌鲁木齐市各大超市时,对今后自己的馕产业发展有了更新的认识，力争打造出自己的品牌。。目前，卡德尔·阿不都的合作社已通过自己的努力和工作组的帮助，生产的馕在质量和产量上已初具规模。高兴的说：工作组帮助我成立合作社以来，我打的馕也有了名字，希望自己的品牌能远销疆内外，让更多的人吃到我们馕，也能更快地带领村民走致富。（图/文 周燕）","今年住村以来，托克逊县夏乡布拉克佰什村工作组认真落实吐鲁番市委发展馕产业的工作思路，积极引导村民走产业化、品牌化发展道路，鼓励当地村民打造具有地域特色的馕产业品牌。。工作组在入户走访中了解到村民卡德尔·阿不都是该村的打馕能手，每天打的馕都供不应求，他希望通过自己的手艺不仅做大自己的事业，也可以带动贫困村民家庭一起致富。为了实现他的愿望，工作组和村委会通过多方协调，专门成立了伊再提古丽打馕合作社。。合作社成立后，工作组发现他仍然以传统的方式进行销售，为了让他开阔眼界、打开思路、拓宽销售渠道，工作组带着他赴高昌区馕销售一条街和夏乡色日吉力尕村的馕合作社进行考察学习，当听到赫科麦提食品农民专业合作社的馕通过各种渠道已走出县城、走进乌鲁木齐市各大超市时,对今后自己的馕产业发展有了更新的认识，力争打造出自己的品牌。。目前，卡德尔·阿不都的合作社已通过自己的努力和工作组的帮助，生产的馕在质量和产量上已初具规模。高兴的说：工作组帮助我成立合作社以来，我打的馕也有了名字，希望自己的品牌能远销疆内外，让更多的人吃到我们馕，也能更快地带领村民走致富。（图/文 周燕）",政府领导到其他城市考察学习或访问,0.7842634827709555,False,否
296,新疆省,吐鲁番市,托克逊县近五年向困难职工发放救助金万元,2015-06-04,http://www.tlf.gov.cn//tlfs/c106302/201506/b448d0e183f742d1b6b36f99f145c29a.shtml,近五年来，托克逊县慰问各类困难职工3000人（次），发放生活救助金、慰问金及物资300万元。2010—2014年，全县各级困难职工建档人数、实际帮扶对象和帮扶支出分别是2009年以前的10倍。劳模服务管理工作不断加强，完成了全县64名各级劳模基本情况普查工作，开展劳模慰问活动60人（次），组织劳模先进考察学习68人（次），向各级劳模发放慰问金、生活救助金和大病补助10万元。,近五年来，托克逊县慰问各类困难职工3000人（次），发放生活救助金、慰问金及物资300万元。2010—2014年，全县各级困难职工建档人数、实际帮扶对象和帮扶支出分别是2009年以前的10倍。劳模服务管理工作不断加强，完成了全县64名各级劳模基本情况普查工作，开展劳模慰问活动60人（次），组织劳模先进考察学习68人（次），向各级劳模发放慰问金、生活救助金和大病补助10万元。,其他,0.7827750803847807,False,否
296,新疆省,吐鲁番市,自治区组织部分老干部赴吐鲁番市考察学习,2017-05-08,http://www.tlf.gov.cn//tlfs/c106219/201705/0e3abb12ac804f08b89cc0e1f867fbf4.shtml,“我在吐鲁番工作了三十多年，这次回来几乎都不认识了。”5月6日，自治区政协原副主席玉素甫·艾沙激动地说，“现在农民都住上了新房子，村里的路都是柏油路，到处绿树成荫。我们看了以后很高兴。我们的国家现在如此繁荣富强、和谐稳定，主要是党领导的好，我坚信中国的发展会更好。”。5月5日至7日，自治区党委组织21名退休老干部来到吐鲁番市考察学习。此次考察学习活动是自治区按照中组部统一部署，组织老干部开展“畅谈十八大以来变化、展望十九大胜利召开”和“建言十九大”主题活动的组成部分。。老干部们先后考察了鄯善县的合盛硅业公司、楼兰酒业、辟展乡大东湖设施农业园，位于高昌区的吐鲁番新能源示范区、高昌区新疆旅游纺织品服装产业基地、高昌区葡萄镇的努尔丁书屋和木纳尔社区、高昌区亚尔镇交河民族团结教育基地。。5月初的吐鲁番树绿花艳，俨然已是盛夏时节。老干部们带着感情、带着责任、带着思想，一路走、一路看、一路思考、一路谈论，大家都为吐鲁番市的经济社会发展取得的成绩兴奋不已。。自治区人大常委会民族宗教外事华侨工作委员会原主任阿不都热合曼·热合木拜说，党的十八大以来，我区社会稳定，经济快速发展，各地都发生了很大变化。通过这次考察学习，更加深了我对新疆未来发展的信心。。原新疆财经学院院长玉努斯·阿不利斯也有同样的感受。作为一名教育工作者，在整个考察中，玉努斯·阿不利斯看到的、听到的、感受最深的就是党和政府的教育惠民政策大得人心，极大地激发了各民族群众的感恩之情。“我亲眼看到了这些地方所发生的翻天覆地的变化，社会稳定、各族人民安居乐业，过着幸福美满的生活，这种画面令人鼓舞。”。交河民族团结教育基地于2016年8月建成并投入运营。教育基地员工80%为亚尔镇亚尔果勒村村民。员工由维吾尔、汉、回多民族组成，是一个民族团结的大集体。“只有社会稳定，只有各民族团结得像一家人一样，新疆才能有大发展。”自治区招商发展局党组原书记胡良才说，现在必须坚定不移贯彻落实党中央治疆方略，贯彻自治区党委的决策部署，才能确保新疆社会稳定和长治久安。作为老同志，我们要不忘初心，时时刻刻维护党中央的权威，维护自治区党委的权威。。自治区党委政法委原副书记吐尔逊·曼苏木说， 做为一名老干部，应该从政治上、思想上，特别是言行上跟自治区党委保持高度一致，要做到言行一致，尤其是在反对民族分裂、维护社会稳定、民族团结等重大问题上认识不含糊、态度不暧昧，行动不动摇。用我们的实际行动迎接党的十九大胜利召开。。大家表示要坚定不移跟党走，始终保持一名共产党员的本色。紧紧围绕总目标，发挥老干部具有较高思想素质和丰富实践经验的优势，为维护新疆社会稳定和长治久安贡献一份力量。,“我在吐鲁番工作了三十多年，这次回来几乎都不认识了。”5月6日，自治区政协原副主席玉素甫·艾沙激动地说，“现在农民都住上了新房子，村里的路都是柏油路，到处绿树成荫。我们看了以后很高兴。我们的国家现在如此繁荣富强、和谐稳定，主要是党领导的好，我坚信中国的发展会更好。”。5月5日至7日，自治区党委组织21名退休老干部来到吐鲁番市考察学习。此次考察学习活动是自治区按照中组部统一部署，组织老干部开展“畅谈十八大以来变化、展望十九大胜利召开”和“建言十九大”主题活动的组成部分。。老干部们先后考察了鄯善县的合盛硅业公司、楼兰酒业、辟展乡大东湖设施农业园，位于高昌区的吐鲁番新能源示范区、高昌区新疆旅游纺织品服装产业基地、高昌区葡萄镇的努尔丁书屋和木纳尔社区、高昌区亚尔镇交河民族团结教育基地。。5月初的吐鲁番树绿花艳，俨然已是盛夏时节。老干部们带着感情、带着责任、带着思想，一路走、一路看、一路思考、一路谈论，大家都为吐鲁番市的经济社会发展取得的成绩兴奋不已。。自治区人大常委会民族宗教外事华侨工作委员会原主任阿不都热合曼·热合木拜说，党的十八大以来，我区社会稳定，经济快速发展，各地都发生了很大变化。通过这次考察学习，更加深了我对新疆未来发展的信心。。原新疆财经学院院长玉努斯·阿不利斯也有同样的感受。作为一名教育工作者，在整个考察中，玉努斯·阿不利斯看到的、听到的、感受最深的就是党和政府的教育惠民政策大得人心，极大地激发了各民族群众的感恩之情。“我亲眼看到了这些地方所发生的翻天覆地的变化，社会稳定、各族人民安居乐业，过着幸福美满的生活，这种画面令人鼓舞。”。交河民族团结教育基地于2016年8月建成并投入运营。教育基地员工80%为亚尔镇亚尔果勒村村民。员工由维吾尔、汉、回多民族组成，是一个民族团结的大集体。“只有社会稳定，只有各民族团结得像一家人一样，新疆才能有大发展。”自治区招商发展局党组原书记胡良才说，现在必须坚定不移贯彻落实党中央治疆方略，贯彻自治区党委的决策部署，才能确保新疆社会稳定和长治久安。作为老同志，我们要不忘初心，时时刻刻维护党中央的权威，维护自治区党委的权威。。自治区党委政法委原副书记吐尔逊·曼苏木说， 做为一名老干部，应该从政治上、思想上，特别是言行上跟自治区党委保持高度一致，要做到言行一致，尤其是在反对民族分裂、维护社会稳定、民族团结等重大问题上认识不含糊、态度不暧昧，行动不动摇。用我们的实际行动迎接党的十九大胜利召开。。大家表示要坚定不移跟党走，始终保持一名共产党员的本色。紧紧围绕总目标，发挥老干部具有较高思想素质和丰富实践经验的优势，为维护新疆社会稳定和长治久安贡献一份力量。,政府领导到其他城市考察学习或访问,0.0,False,否
296,新疆省,吐鲁番市,吐鲁番首次工业学校服务地域企业发展洽谈会召开,2023-03-06,http://www.tlf.gov.cn//tlfs/c106219/202303/7a2011b5f6d345deabf7c685067d8fb5.shtml,2月28日，新疆轻工职业技术学院相关负责人为吐鲁番葡萄酒生产企业进行大学生实践教育基地揭牌。。(文/图记者田吉斌)2月28日，由吐鲁番中小企业服务中心有限公司组织的首次“工业学校服务地域企业发展洽谈会”召开，助力中小微企业发展再提速。。当天，来自新疆轻工职业技术学院食品与生物技术分院专家学者、吐鲁番经济开发区相关负责人先后前往吐鲁番亿茂酒庄有限公司、新疆楼兰情缘果业有限公司、新疆沙漠绿洲酒业有限公司等地进行考察调研，新疆轻工职业技术学院食品与生物技术分院分别与新疆楼兰情缘果业有限公司和新疆沙漠绿洲酒业有限公司签订了校企合作协议，并为两家企业大学生实训基地揭牌。。2月28日，由吐鲁番中小企业服务中心有限公司组织校企相关专家学者、负责人在吐鲁番亿茂酒庄有限公司考察学习。。新疆楼兰情缘有限公司总经理吕敬阳说：“此次签订产学研合作协议，将以实践教学基地和特色农产品精深加工为切入点，进一步构筑校企联营合作平台，为企业高质量发展增添了新动力。”。通过交流，校企双方还对未来就共建研发平台，建立就业实习基地、人才定向培养等方面开展深层次合作达成共识，为接下来校企合作及产学研深度融合发展打下坚实基础。。2月28日，由吐鲁番中小企业服务中心有限公司组织的相关专家学者、负责人在本地葡萄酒企业考察学习。。新疆轻工职业技术学院食品与生物技术分院副院长张志强说：“校企合作是当前职业教育发展的必然趋势。今后，我们将加大与吐鲁番重点企业合作，培养更多的优秀人才，进一步推动产学研一体化深度融合，为吐鲁番经济和社会高质量发展提供强力的人才支撑。”。作为吐鲁番市首个自治区级中小企业公共服务示范平台企业。近年来，吐鲁番中小企业服务中心有限公司多渠道多形式为当地中小微企业提供政策解读、融资对接等专业化服务，培育更多专精特新企业，全力助推中小企业高质量发展。。“开展校企合作既是贯彻落实吐鲁番‘工业强市’战略的重要途径，也是提升吐鲁番市中小企业创新能力，推动高校创新成果惠及中小企业的重要举措。”吐鲁番中小企业服务中心有限公司总经理张磊表示，将进一步发挥重要桥梁纽带作用，及时了解校企双向需求，探索实施“校企双聘”制度，选聘一批专家教授担任中小企业技术导师，为企业提供“一对一”的技术咨询、指导等服务，进一步提升中小企业创新核心竞争力。,2月28日，新疆轻工职业技术学院相关负责人为吐鲁番葡萄酒生产企业进行大学生实践教育基地揭牌。。(文/图记者田吉斌)2月28日，由吐鲁番中小企业服务中心有限公司组织的首次“工业学校服务地域企业发展洽谈会”召开，助力中小微企业发展再提速。。当天，来自新疆轻工职业技术学院食品与生物技术分院专家学者、吐鲁番经济开发区相关负责人先后前往吐鲁番亿茂酒庄有限公司、新疆楼兰情缘果业有限公司、新疆沙漠绿洲酒业有限公司等地进行考察调研，新疆轻工职业技术学院食品与生物技术分院分别与新疆楼兰情缘果业有限公司和新疆沙漠绿洲酒业有限公司签订了校企合作协议，并为两家企业大学生实训基地揭牌。。2月28日，由吐鲁番中小企业服务中心有限公司组织校企相关专家学者、负责人在吐鲁番亿茂酒庄有限公司考察学习。。新疆楼兰情缘有限公司总经理吕敬阳说：“此次签订产学研合作协议，将以实践教学基地和特色农产品精深加工为切入点，进一步构筑校企联营合作平台，为企业高质量发展增添了新动力。”。通过交流，校企双方还对未来就共建研发平台，建立就业实习基地、人才定向培养等方面开展深层次合作达成共识，为接下来校企合作及产学研深度融合发展打下坚实基础。。2月28日，由吐鲁番中小企业服务中心有限公司组织的相关专家学者、负责人在本地葡萄酒企业考察学习。。新疆轻工职业技术学院食品与生物技术分院副院长张志强说：“校企合作是当前职业教育发展的必然趋势。今后，我们将加大与吐鲁番重点企业合作，培养更多的优秀人才，进一步推动产学研一体化深度融合，为吐鲁番经济和社会高质量发展提供强力的人才支撑。”。作为吐鲁番市首个自治区级中小企业公共服务示范平台企业。近年来，吐鲁番中小企业服务中心有限公司多渠道多形式为当地中小微企业提供政策解读、融资对接等专业化服务，培育更多专精特新企业，全力助推中小企业高质量发展。。“开展校企合作既是贯彻落实吐鲁番‘工业强市’战略的重要途径，也是提升吐鲁番市中小企业创新能力，推动高校创新成果惠及中小企业的重要举措。”吐鲁番中小企业服务中心有限公司总经理张磊表示，将进一步发挥重要桥梁纽带作用，及时了解校企双向需求，探索实施“校企双聘”制度，选聘一批专家教授担任中小企业技术导师，为企业提供“一对一”的技术咨询、指导等服务，进一步提升中小企业创新核心竞争力。,其他,0.5661838143584799,False,否
296,新疆省,吐鲁番市,湖南省援疆前方指挥部以园区为着力点推动经济高质量发展,2020-08-07,http://www.tlf.gov.cn//tlfs/c106289/202008/69209e6210c44279becb4498087c4166.shtml,吐鲁番融媒中心讯(通讯员 石子敬)今年以来，湖南省第九批援疆前方指挥部紧紧围绕市委中心工作，积极为市委、市政府研究起草《关于进一步加快园区高质量发展的若干意见》(以下简称《意见》)建言献策，充分借鉴湖南园区发展的成功经验，并结合吐鲁番园区发展的实际需要，旨在以园区为着力点推动全市经济高质量发展。。《意见》内容包括推动园区高质量发展、科学统筹园区规划、稳步推进体制机制改革、强化重点要素保障、大力优化营商环境、实行年度绩效考核、切实加强组织保障七个方面，共20条符合当前推动吐鲁番经济高质量发展要求的各项措施。其中，在推进体制机制改革方面，园区党工委书记和管委会主任分别兼任区县相应职务，允许园区按1：1.5的比例设置园区雇员。在强化重点要素保障方面，每年设立不低于5000万元的园区发展专项资金；建立税收增量激励制度，每年园区税收增长超基数地方留存部分全额用于支持园区发展建设。在大力优化营商环境方面，采取“一枚印章管审批”“一支队伍管执法”“一站式服务”等措施。为确保意见贯彻落地，《意见》还要求成立由市委领导牵头负责的市加快园区发展工作领导小组，统筹研究涉及园区建设与发展全局性、方向性的重大事项。。湖南援疆前方指挥部将按照市委、市政府的统筹部署，会同市直有关部门抓紧做好《意见》的解读和宣传贯彻工作，组织开展到先进园区现场考察学习活动，进一步推进全市园区体制机制改革，激活内生动力，更好发挥园区在经济建设中主战场、主力军、主阵地的作用，加快推动全市经济高质量发展步伐。,吐鲁番融媒中心讯(通讯员 石子敬)今年以来，湖南省第九批援疆前方指挥部紧紧围绕市委中心工作，积极为市委、市政府研究起草《关于进一步加快园区高质量发展的若干意见》(以下简称《意见》)建言献策，充分借鉴湖南园区发展的成功经验，并结合吐鲁番园区发展的实际需要，旨在以园区为着力点推动全市经济高质量发展。。《意见》内容包括推动园区高质量发展、科学统筹园区规划、稳步推进体制机制改革、强化重点要素保障、大力优化营商环境、实行年度绩效考核、切实加强组织保障七个方面，共20条符合当前推动吐鲁番经济高质量发展要求的各项措施。其中，在推进体制机制改革方面，园区党工委书记和管委会主任分别兼任区县相应职务，允许园区按1：1.5的比例设置园区雇员。在强化重点要素保障方面，每年设立不低于5000万元的园区发展专项资金；建立税收增量激励制度，每年园区税收增长超基数地方留存部分全额用于支持园区发展建设。在大力优化营商环境方面，采取“一枚印章管审批”“一支队伍管执法”“一站式服务”等措施。为确保意见贯彻落地，《意见》还要求成立由市委领导牵头负责的市加快园区发展工作领导小组，统筹研究涉及园区建设与发展全局性、方向性的重大事项。。湖南援疆前方指挥部将按照市委、市政府的统筹部署，会同市直有关部门抓紧做好《意见》的解读和宣传贯彻工作，组织开展到先进园区现场考察学习活动，进一步推进全市园区体制机制改革，激活内生动力，更好发挥园区在经济建设中主战场、主力军、主阵地的作用，加快推动全市经济高质量发展步伐。,其他,0.5638251797960991,False,否
296,新疆省,吐鲁番市,叶友龙带领村民种韭菜致富,2022-03-22,http://www.tlf.gov.cn//tlfs/c106222/202203/c566df0840a64b10a94d5a6b35bed80b.shtml,“大家先把脚下的韭菜割出来，留出一片空地，一会车子要进来装菜……”“纸箱子准备好了没有?”3月17日下午，托克逊县夏镇喀格恰克村致富带头人叶友龙的韭菜棚内一派忙碌景象。记者看到，绿油油的韭菜铺满了大棚，30多名村民正在收割韭菜，转眼间韭菜就收割打包完毕。。多年前，叶友龙在朋友的引荐下，开始种植韭菜。他不断去周边乡(镇)考察学习，慢慢地，他想到结合大棚和大田的优势，创新研究一种种植韭菜新模式，于是喀格恰克村的第一个连栋棚便出现了。。说起连栋棚，叶友龙激动得滔滔不绝：“连栋棚最大的优势就是结合了大棚和大田优点，它具有机械化作业方便、采光好、土地利用率高的特点，再加上使用农家肥，种出的韭菜是绿色食品。韭菜品相好、口感好、韭菜味浓，消费者吃得放心。”。近年来，喀格恰克村不断调整优化产业结构，发展特色种植，集中全力发展韭菜特色种植。叶友龙借机把韭菜产业越做越大。目前，他种植了16亩韭菜，仅头茬韭菜的收益就达十多万。“今年的天气不错，所以头茬韭菜价格很好，出地就是每公斤7.5元。”叶友龙说。。叶友龙致富不忘父老乡亲，他带着村民一起利用冬闲时间发展种植业，与乡亲们共同致富。在叶友龙的大棚里，他一边装箱，一边给前来询价的村民细心地讲解割完头茬韭菜以后扣棚、施肥、田间管理等方面的工作，鼓励他们发展韭菜种植。。如今，叶友龙在政策的支持和自己的努力下，带动了全村韭菜产业发展，成为了托克逊县颇有名气的韭菜种植致富带头人。。“以后，我还会继续努力，要对得起村委会给我评的‘致富带头人’的荣誉称号。现在，党和国家的惠民政策又多又好，让我们致富更有信心，我们一定可以把小韭菜发展成为农民增收致富的大产业。”叶友龙信心满满地说。,“大家先把脚下的韭菜割出来，留出一片空地，一会车子要进来装菜……”“纸箱子准备好了没有?”3月17日下午，托克逊县夏镇喀格恰克村致富带头人叶友龙的韭菜棚内一派忙碌景象。记者看到，绿油油的韭菜铺满了大棚，30多名村民正在收割韭菜，转眼间韭菜就收割打包完毕。。多年前，叶友龙在朋友的引荐下，开始种植韭菜。他不断去周边乡(镇)考察学习，慢慢地，他想到结合大棚和大田的优势，创新研究一种种植韭菜新模式，于是喀格恰克村的第一个连栋棚便出现了。。说起连栋棚，叶友龙激动得滔滔不绝：“连栋棚最大的优势就是结合了大棚和大田优点，它具有机械化作业方便、采光好、土地利用率高的特点，再加上使用农家肥，种出的韭菜是绿色食品。韭菜品相好、口感好、韭菜味浓，消费者吃得放心。”。近年来，喀格恰克村不断调整优化产业结构，发展特色种植，集中全力发展韭菜特色种植。叶友龙借机把韭菜产业越做越大。目前，他种植了16亩韭菜，仅头茬韭菜的收益就达十多万。“今年的天气不错，所以头茬韭菜价格很好，出地就是每公斤7.5元。”叶友龙说。。叶友龙致富不忘父老乡亲，他带着村民一起利用冬闲时间发展种植业，与乡亲们共同致富。在叶友龙的大棚里，他一边装箱，一边给前来询价的村民细心地讲解割完头茬韭菜以后扣棚、施肥、田间管理等方面的工作，鼓励他们发展韭菜种植。。如今，叶友龙在政策的支持和自己的努力下，带动了全村韭菜产业发展，成为了托克逊县颇有名气的韭菜种植致富带头人。。“以后，我还会继续努力，要对得起村委会给我评的‘致富带头人’的荣誉称号。现在，党和国家的惠民政策又多又好，让我们致富更有信心，我们一定可以把小韭菜发展成为农民增收致富的大产业。”叶友龙信心满满地说。,其他,0.554686990345528,False,否
