code,province,city,topic,date,url,content,content.1,label,score,is_match
212,广西省,北海市,围绕中心凝共识服务大局助发展,2024-06-30,http://www.beihai.gov.cn/zxbhswyh/tpxw_48/t18633088.shtml,6月27日上午，市政协主席、党组书记毛艳琼主持召开十一届市政协党组第45次（扩大）会议。。会议集中学习了习近平总书记在中共中央政治局第十四次集体学习时的重要讲话精神，习近平总书记在青海、宁夏考察时的重要讲话精神，习近平总书记对进一步做好“四好农村路”建设和对防汛抗旱工作作出的重要指示精神；传达学习了全国政协十四届常委会第七次会议精神，自治区政协十三届常委会第六次会议精神，十二届全国政协副主席马培华在北海调研指示精神，自治区政协副主席何辛幸在北海调研指示精神，市委书记蔡锦军在市委常委会上听取市政协党组工作汇报时讲话精神，并结合市政协实际研究贯彻落实措施。。毛艳琼强调，要认真学习领悟习近平总书记重要讲话精神，在铸牢中华民族共同体意识中发挥政协优势作用，聚焦“一区两地一园一通道”建设，建真言、谋良策、出实招；要大力推动产教融合，促进就业，为高质量发展赋能；要扎实推进党纪学习教育，营造风清气正、干事创业的良好政治生态；要强化风险意识，切实履职尽责，督促指导包保县（区）、乡镇（街道）从严从实从细抓好防汛抢险救灾各项工作；要把思想和行动统一到中共中央决策部署上来，围绕中心凝聚共识，服务大局助力北海高质量发展；要持续在发挥政协委员“头雁”作用上下功夫，把委员自身优势转化为北海的发展优势和竞争优势，凝心聚力建设品质北海、魅力北海。。市委常委、统战部部长，副市长，市政协党组副书记龙起云，市政协副主席、党组副书记吴绚，市政协副主席、党组成员彭鸣达、黄忠东、叶宗沛，市政协秘书长、党组成员曾秀莹出席会议。,6月27日上午，市政协主席、党组书记毛艳琼主持召开十一届市政协党组第45次（扩大）会议。。会议集中学习了习近平总书记在中共中央政治局第十四次集体学习时的重要讲话精神，习近平总书记在青海、宁夏考察时的重要讲话精神，习近平总书记对进一步做好“四好农村路”建设和对防汛抗旱工作作出的重要指示精神；传达学习了全国政协十四届常委会第七次会议精神，自治区政协十三届常委会第六次会议精神，十二届全国政协副主席马培华在北海调研指示精神，自治区政协副主席何辛幸在北海调研指示精神，市委书记蔡锦军在市委常委会上听取市政协党组工作汇报时讲话精神，并结合市政协实际研究贯彻落实措施。。毛艳琼强调，要认真学习领悟习近平总书记重要讲话精神，在铸牢中华民族共同体意识中发挥政协优势作用，聚焦“一区两地一园一通道”建设，建真言、谋良策、出实招；要大力推动产教融合，促进就业，为高质量发展赋能；要扎实推进党纪学习教育，营造风清气正、干事创业的良好政治生态；要强化风险意识，切实履职尽责，督促指导包保县（区）、乡镇（街道）从严从实从细抓好防汛抢险救灾各项工作；要把思想和行动统一到中共中央决策部署上来，围绕中心凝聚共识，服务大局助力北海高质量发展；要持续在发挥政协委员“头雁”作用上下功夫，把委员自身优势转化为北海的发展优势和竞争优势，凝心聚力建设品质北海、魅力北海。。市委常委、统战部部长，副市长，市政协党组副书记龙起云，市政协副主席、党组副书记吴绚，市政协副主席、党组成员彭鸣达、黄忠东、叶宗沛，市政协秘书长、党组成员曾秀莹出席会议。,其他,0.5926859678485505,True
212,广西省,北海市,围绕中心凝共识服务大局助发展,2024-06-28,http://www.beihai.gov.cn/bhdt/bhyw/t18617350.shtml,本报讯（全媒体记者 黄金敏 实习生 宋思敏）6月27日上午，市政协主席、党组书记毛艳琼主持召开十一届市政协党组第45次（扩大）会议。。会议集中学习了习近平总书记在中共中央政治局第十四次集体学习时的重要讲话精神，习近平总书记在青海、宁夏考察时的重要讲话精神，习近平总书记对进一步做好“四好农村路”建设和对防汛抗旱工作作出的重要指示精神；传达学习了全国政协十四届常委会第七次会议精神，自治区政协十三届常委会第六次会议精神，十二届全国政协副主席马培华在北海调研指示精神，自治区政协副主席何辛幸在北海调研指示精神，市委书记蔡锦军在市委常委会上听取市政协党组工作汇报时讲话精神，并结合市政协实际研究贯彻落实措施。。毛艳琼强调，要认真学习领悟习近平总书记重要讲话精神，在铸牢中华民族共同体意识中发挥政协优势作用，聚焦“一区两地一园一通道”建设，建真言、谋良策、出实招；要大力推动产教融合，促进就业，为高质量发展赋能；要扎实推进党纪学习教育，营造风清气正、干事创业的良好政治生态；要强化风险意识，切实履职尽责，督促指导包保县（区）、乡镇（街道）从严从实从细抓好防汛抢险救灾各项工作；要把思想和行动统一到中共中央决策部署上来，围绕中心凝聚共识，服务大局助力北海高质量发展；要持续在发挥政协委员“头雁”作用上下功夫，把委员自身优势转化为北海的发展优势和竞争优势，凝心聚力建设品质北海、魅力北海。。市委常委、统战部部长，副市长，市政协党组副书记龙起云，市政协副主席、党组副书记吴绚，市政协副主席、党组成员彭鸣达、黄忠东、叶宗沛，市政协秘书长、党组成员曾秀莹出席会议。,本报讯（全媒体记者 黄金敏 实习生 宋思敏）6月27日上午，市政协主席、党组书记毛艳琼主持召开十一届市政协党组第45次（扩大）会议。。会议集中学习了习近平总书记在中共中央政治局第十四次集体学习时的重要讲话精神，习近平总书记在青海、宁夏考察时的重要讲话精神，习近平总书记对进一步做好“四好农村路”建设和对防汛抗旱工作作出的重要指示精神；传达学习了全国政协十四届常委会第七次会议精神，自治区政协十三届常委会第六次会议精神，十二届全国政协副主席马培华在北海调研指示精神，自治区政协副主席何辛幸在北海调研指示精神，市委书记蔡锦军在市委常委会上听取市政协党组工作汇报时讲话精神，并结合市政协实际研究贯彻落实措施。。毛艳琼强调，要认真学习领悟习近平总书记重要讲话精神，在铸牢中华民族共同体意识中发挥政协优势作用，聚焦“一区两地一园一通道”建设，建真言、谋良策、出实招；要大力推动产教融合，促进就业，为高质量发展赋能；要扎实推进党纪学习教育，营造风清气正、干事创业的良好政治生态；要强化风险意识，切实履职尽责，督促指导包保县（区）、乡镇（街道）从严从实从细抓好防汛抢险救灾各项工作；要把思想和行动统一到中共中央决策部署上来，围绕中心凝聚共识，服务大局助力北海高质量发展；要持续在发挥政协委员“头雁”作用上下功夫，把委员自身优势转化为北海的发展优势和竞争优势，凝心聚力建设品质北海、魅力北海。。市委常委、统战部部长，副市长，市政协党组副书记龙起云，市政协副主席、党组副书记吴绚，市政协副主席、党组成员彭鸣达、黄忠东、叶宗沛，市政协秘书长、党组成员曾秀莹出席会议。,其他,0.5501626650878256,True
212,广西省,北海市,李莉率队赴江苏安徽开展招商引资活动,2024-06-05,http://www.beihai.gov.cn/xxgkbm/bhstzcjj/gzxx_23/t18526416.shtml,5月31日至6月1日，市长李莉在江苏省徐州市、宿迁市参加全国人大重点督办建议调研及办理座谈会后，率队赴江苏省连云港市、安徽省蚌埠市和合肥市开展招商引资活动，围绕硅基新材料产业靶向对接企业，商讨合作意向，争取项目落地，以精准招商为北海产业高质量发展蓄势赋能。。连云港市东海县是全国闻名的硅材料产业基地，构建了以石英为主、门类较全、规模较大的硅产业集群，全县硅产业企业超600家。李莉此行的“首站”来到东海县，拜访硅产业专家并探讨交流产业发展现状及发展前景，参观东海县硅产业科创中心展厅、硅材料产品国家级检测中心，实地调研东海县硅产业全产业链发展历程和产业分布格局，考察相关硅产业企业，学习借鉴“他山之石”，为我市做大做强硅基新材料产业吸收经验、拓展思路。。在东海县考察调研结束后，李莉前往蚌埠市，拜访中建材玻璃新材料研究院集团有限公司，与中国工程院院士、中国建材集团首席科学家彭寿等进行座谈，双方就硅基新材料的生产和应用等进行了深入交流。李莉对彭寿院士一直以来关心支持北海经济社会发展表示感谢，并介绍了北海硅基新材料产业发展现状，希望双方能在技术创新、产业发展等方面深化合作，助推北海硅基新材料产业高质量发展。彭寿对李莉一行的到来表示热烈欢迎，认为北海有发展硅基新材料产业的基础和优势，将进一步加强与北海的沟通交流，寻找合作契机，共同推动北海硅基新材料产业升级，实现发展共赢。在拜访期间，李莉还走进蚌埠中光电科技有限公司和凯盛光伏材料有限公司，参观企业8.5代 TFT-LCD 玻璃基板生产线、铜铟镓硒（CIGS）发电玻璃生产线和信息显示模组生产线。。双杰电气是国家级高新技术企业，专注于输配电及电气控制设备的研发、生产和销售，在电气设备产品上实现了多项技术突破。在合肥市，李莉考察了双杰电气合肥有限公司，参观了企业环网柜智能化数字车间、光储充一体化充电站、“光储充换”新能源重卡换电站等项目，并与企业就推动双杰集团南部高端制造数字化生产基地项目落地北海进行深入洽谈。李莉充分肯定了双杰电气近年来取得的发展成绩，她表示，双杰电气与北海有良好的合作基础，希望企业坚定信心、选择北海，北海将以更加主动的作为和更加务实的举措，推动项目尽快签约落地。。市领导龙起云，市农业农村局、工信局、投促局，以及合浦县、铁山港区等有关部门负责人参加相关活动。,5月31日至6月1日，市长李莉在江苏省徐州市、宿迁市参加全国人大重点督办建议调研及办理座谈会后，率队赴江苏省连云港市、安徽省蚌埠市和合肥市开展招商引资活动，围绕硅基新材料产业靶向对接企业，商讨合作意向，争取项目落地，以精准招商为北海产业高质量发展蓄势赋能。。连云港市东海县是全国闻名的硅材料产业基地，构建了以石英为主、门类较全、规模较大的硅产业集群，全县硅产业企业超600家。李莉此行的“首站”来到东海县，拜访硅产业专家并探讨交流产业发展现状及发展前景，参观东海县硅产业科创中心展厅、硅材料产品国家级检测中心，实地调研东海县硅产业全产业链发展历程和产业分布格局，考察相关硅产业企业，学习借鉴“他山之石”，为我市做大做强硅基新材料产业吸收经验、拓展思路。。在东海县考察调研结束后，李莉前往蚌埠市，拜访中建材玻璃新材料研究院集团有限公司，与中国工程院院士、中国建材集团首席科学家彭寿等进行座谈，双方就硅基新材料的生产和应用等进行了深入交流。李莉对彭寿院士一直以来关心支持北海经济社会发展表示感谢，并介绍了北海硅基新材料产业发展现状，希望双方能在技术创新、产业发展等方面深化合作，助推北海硅基新材料产业高质量发展。彭寿对李莉一行的到来表示热烈欢迎，认为北海有发展硅基新材料产业的基础和优势，将进一步加强与北海的沟通交流，寻找合作契机，共同推动北海硅基新材料产业升级，实现发展共赢。在拜访期间，李莉还走进蚌埠中光电科技有限公司和凯盛光伏材料有限公司，参观企业8.5代 TFT-LCD 玻璃基板生产线、铜铟镓硒（CIGS）发电玻璃生产线和信息显示模组生产线。。双杰电气是国家级高新技术企业，专注于输配电及电气控制设备的研发、生产和销售，在电气设备产品上实现了多项技术突破。在合肥市，李莉考察了双杰电气合肥有限公司，参观了企业环网柜智能化数字车间、光储充一体化充电站、“光储充换”新能源重卡换电站等项目，并与企业就推动双杰集团南部高端制造数字化生产基地项目落地北海进行深入洽谈。李莉充分肯定了双杰电气近年来取得的发展成绩，她表示，双杰电气与北海有良好的合作基础，希望企业坚定信心、选择北海，北海将以更加主动的作为和更加务实的举措，推动项目尽快签约落地。。市领导龙起云，市农业农村局、工信局、投促局，以及合浦县、铁山港区等有关部门负责人参加相关活动。,政府领导到其他城市考察学习或访问,0.8237940162844254,True
212,广西省,北海市,市委常委会召开会议,2024-05-14,http://www.beihai.gov.cn/bhdt/bhyw/t18423448.shtml,学习习近平总书记重要讲话和重要指示精神，学习自治区有关会议和自治区领导指示精神，研究贯彻落实措施 蔡锦军主持会议。本报讯（全媒体记者 何美）5月13日，市委常委会召开会议，集中学习习近平总书记在重庆考察时的重要讲话和在新时代推动西部大开发座谈会上的重要讲话、4月30日在中共中央政治局会议上的重要讲话、对广东梅州市梅大高速茶阳路段塌方灾害作出的重要指示精神，传达学习全区产业园区建设现场推进会暨沿边临港产业园区建设工作推进会、“营商广西·桂在便利”2024年全区优化营商环境暨促进民营经济发展壮大工作现场交流会精神和房灵敏同志在北海调研时的指示精神，并研究我市贯彻落实措施。市委书记蔡锦军主持会议。。会议强调，要深入贯彻落实习近平总书记在重庆考察时的重要讲话和在新时代推动西部大开发座谈会上的重要讲话精神，深刻认识和准确把握北海在西部大开发战略中的功能定位，主动服务西部大开发战略和西部陆海新通道建设，坚持把发展特色优势产业作为主攻方向，因地制宜发展新质生产力，大力发展向海经济、临港产业，持续做大做强六大主导产业集群，加快培育海工装备等新的支柱产业，加快构建现代化产业体系，积极对接长江经济带、粤港澳大湾区、成渝地区双城经济圈等区域合作，积极服务广西打造国内国际双循环市场经营便利地和粤港澳大湾区重要战略腹地，在服务新发展格局、推动高质量发展上展现更大作为。。会议强调，要认真学习贯彻习近平总书记对广东梅州市梅大高速茶阳路段塌方灾害作出的重要指示精神，坚持“党政同责、一岗双责、齐抓共管、失职追责”和“三管三必须”要求，严格执行党政领导干部安全生产责任制，压紧压实党委政府属地管理责任、行业主管部门安全监管责任、生产经营单位主体责任，全面深入排查城镇燃气、建筑施工、危险化学品、矿区、学校、海上安全、地质灾害等领域安全风险隐患，抓实抓细汛期安全生产工作，全力以赴防范和应对各类事故灾害，确保人民群众生命财产安全和社会大局稳定。。会议强调，要认真落实中央和自治区关于推进沿边临港产业园区建设的决策部署，深化产业园区改革，全面梳理产业园区建设有关政策，抢抓机遇，加大招商引资力度，推动各项特殊优惠政策在北海落地落实，最大限度将政策红利转化为发展实效，以产业的高质量发展确保我市经济社会的高质量发展。各级各有关部门要解放思想、担当作为，以问题为导向，不断打造营商环境升级版和新高地，为市场活力充分迸发创造良好环境。。会议要求，要认真落实房灵敏同志在北海调研时的指示精神，压紧压实整治群众身边不正之风和腐败问题工作责任，围绕整治任务全面排查本地区本系统本行业存在的突出问题，以更严要求、更实举措、更高标准确保我市整治工作取得实实在在的成效。,学习习近平总书记重要讲话和重要指示精神，学习自治区有关会议和自治区领导指示精神，研究贯彻落实措施 蔡锦军主持会议。本报讯（全媒体记者 何美）5月13日，市委常委会召开会议，集中学习习近平总书记在重庆考察时的重要讲话和在新时代推动西部大开发座谈会上的重要讲话、4月30日在中共中央政治局会议上的重要讲话、对广东梅州市梅大高速茶阳路段塌方灾害作出的重要指示精神，传达学习全区产业园区建设现场推进会暨沿边临港产业园区建设工作推进会、“营商广西·桂在便利”2024年全区优化营商环境暨促进民营经济发展壮大工作现场交流会精神和房灵敏同志在北海调研时的指示精神，并研究我市贯彻落实措施。市委书记蔡锦军主持会议。。会议强调，要深入贯彻落实习近平总书记在重庆考察时的重要讲话和在新时代推动西部大开发座谈会上的重要讲话精神，深刻认识和准确把握北海在西部大开发战略中的功能定位，主动服务西部大开发战略和西部陆海新通道建设，坚持把发展特色优势产业作为主攻方向，因地制宜发展新质生产力，大力发展向海经济、临港产业，持续做大做强六大主导产业集群，加快培育海工装备等新的支柱产业，加快构建现代化产业体系，积极对接长江经济带、粤港澳大湾区、成渝地区双城经济圈等区域合作，积极服务广西打造国内国际双循环市场经营便利地和粤港澳大湾区重要战略腹地，在服务新发展格局、推动高质量发展上展现更大作为。。会议强调，要认真学习贯彻习近平总书记对广东梅州市梅大高速茶阳路段塌方灾害作出的重要指示精神，坚持“党政同责、一岗双责、齐抓共管、失职追责”和“三管三必须”要求，严格执行党政领导干部安全生产责任制，压紧压实党委政府属地管理责任、行业主管部门安全监管责任、生产经营单位主体责任，全面深入排查城镇燃气、建筑施工、危险化学品、矿区、学校、海上安全、地质灾害等领域安全风险隐患，抓实抓细汛期安全生产工作，全力以赴防范和应对各类事故灾害，确保人民群众生命财产安全和社会大局稳定。。会议强调，要认真落实中央和自治区关于推进沿边临港产业园区建设的决策部署，深化产业园区改革，全面梳理产业园区建设有关政策，抢抓机遇，加大招商引资力度，推动各项特殊优惠政策在北海落地落实，最大限度将政策红利转化为发展实效，以产业的高质量发展确保我市经济社会的高质量发展。各级各有关部门要解放思想、担当作为，以问题为导向，不断打造营商环境升级版和新高地，为市场活力充分迸发创造良好环境。。会议要求，要认真落实房灵敏同志在北海调研时的指示精神，压紧压实整治群众身边不正之风和腐败问题工作责任，围绕整治任务全面排查本地区本系统本行业存在的突出问题，以更严要求、更实举措、更高标准确保我市整治工作取得实实在在的成效。,其他,0.6196167755863378,True
