code,province,city,topic,date,url,content,content.1,label,score,is_match
208,广西省,南宁市,王小东在市委常委会上传达自治区党政代表团浙沪考察学习情况,2016-05-21,https://www.nanning.gov.cn/ywzx/ldhd/t92365.html,王小东在市委常委会上传达自治区党政代表团浙沪考察学习情况，对南宁市学好用好先进经验提出要求。5月20日，自治区党委常委、市委书记王小东主持召开市委常委会会议，传达自治区党政代表团浙江、上海考察学习情况和取得的学习成果，强调全市上下认真贯彻落实自治区党委、政府的要求，结合南宁实际，深入践行五大发展理念，学习先进找差距，破解难题促发展，自觉加压、主动作为，努力增强首府在全区经济社会发展中的支撑带动作用，勇当广西“两个建成”排头兵。。5月15日至19日，在自治区党委书记彭清华、自治区主席陈武率领下，广西党政代表团前往浙江、上海两省市考察学习。王小东说，这是在“十三五”开局之年、全区上下应对经济下行压力努力破解发展难题的关键时刻，自治区党委、政府跳出广西看广西，跳出广西谋发展的学习之旅、合作之旅、友谊之旅，对于全区进一步落实“三大定位”新使命，实现“两个建成”战略目标，深入实施“四大战略”和“三大攻坚战”，都具有非常重要的意义。。王小东指出，长三角领改革风气之先，是我国经济最发达、最有活力的地区之一。在短短几天里，代表团马不停蹄地辗转在浙沪城乡27个考察学习点，现场学习浙沪改革开放、新型城镇化、特色小镇建设、创新驱动、发展民营经济和现代服务业等方面的先进经验和做法，亲身感受两地干部群众创新发展、开放发展、生态发展、协调发展的意识，以及积极进取、昂扬向上的精神风貌。代表团成员一路看、一路听、一路思考，倍感鼓舞、深受启发，带回了加快发展的好经验，增添了发展的信心和动力。。王小东指出，改革开放30多年来浙沪发展一直走在全国前列，创造了丰富的宝贵经验，值得深思和学习，对我们应对经济下行压力，主动调控、预先谋划，做好当前各项工作有很强的指导意义。一是两省市都始终抓住发展这个第一要务不动摇，把中央的普遍性要求和当地的实际有效对接起来，克服种种困难和阶段性矛盾，按照党委出题、人大立法、政府推进、政协支持的思路，紧紧围绕发展做文章，几十年如一日、久久为功，始终走在改革发展的前列。。二是两省市都坚持不断更新、不断增强发展的动力源，始终保持强劲的发展动力，紧紧抓住每个历史阶段推动发展的“金钥匙”，把握发展机遇，并结合本地比较优势取得了快速发展。发展有先后，地域有差别，基础有好坏，但是每个发展阶段能不能抓住机会都是至关重要的。对我们来说，在经济新常态下，实现产业转型、结构调整、动力转换同样需要抢抓机遇、把准发展方向、盯住工作重点，通过创新驱动、开放合作、人才聚集来突破瓶颈、补齐短板。。三是两省市都始终注重发挥政策制度优势，并根据形势发展的需要，结合自身实际，准确把握阶段性特征和特定时期规律，动态调整和完善相关政策制度。这给我们很深的启发，抓发展搞建设既要坚持“一张蓝图绘到底”，又要不断吸收、有机结合时代发展进步的因素，与时俱进谋发展，真正实现可持续发展。全市各级各部门要自我加压，主动作为，充分发挥主观能动性，努力增强首府在全区经济社会发展中的支撑带动作用，勇当广西“两个建成”排头兵。,王小东在市委常委会上传达自治区党政代表团浙沪考察学习情况，对南宁市学好用好先进经验提出要求。5月20日，自治区党委常委、市委书记王小东主持召开市委常委会会议，传达自治区党政代表团浙江、上海考察学习情况和取得的学习成果，强调全市上下认真贯彻落实自治区党委、政府的要求，结合南宁实际，深入践行五大发展理念，学习先进找差距，破解难题促发展，自觉加压、主动作为，努力增强首府在全区经济社会发展中的支撑带动作用，勇当广西“两个建成”排头兵。。5月15日至19日，在自治区党委书记彭清华、自治区主席陈武率领下，广西党政代表团前往浙江、上海两省市考察学习。王小东说，这是在“十三五”开局之年、全区上下应对经济下行压力努力破解发展难题的关键时刻，自治区党委、政府跳出广西看广西，跳出广西谋发展的学习之旅、合作之旅、友谊之旅，对于全区进一步落实“三大定位”新使命，实现“两个建成”战略目标，深入实施“四大战略”和“三大攻坚战”，都具有非常重要的意义。。王小东指出，长三角领改革风气之先，是我国经济最发达、最有活力的地区之一。在短短几天里，代表团马不停蹄地辗转在浙沪城乡27个考察学习点，现场学习浙沪改革开放、新型城镇化、特色小镇建设、创新驱动、发展民营经济和现代服务业等方面的先进经验和做法，亲身感受两地干部群众创新发展、开放发展、生态发展、协调发展的意识，以及积极进取、昂扬向上的精神风貌。代表团成员一路看、一路听、一路思考，倍感鼓舞、深受启发，带回了加快发展的好经验，增添了发展的信心和动力。。王小东指出，改革开放30多年来浙沪发展一直走在全国前列，创造了丰富的宝贵经验，值得深思和学习，对我们应对经济下行压力，主动调控、预先谋划，做好当前各项工作有很强的指导意义。一是两省市都始终抓住发展这个第一要务不动摇，把中央的普遍性要求和当地的实际有效对接起来，克服种种困难和阶段性矛盾，按照党委出题、人大立法、政府推进、政协支持的思路，紧紧围绕发展做文章，几十年如一日、久久为功，始终走在改革发展的前列。。二是两省市都坚持不断更新、不断增强发展的动力源，始终保持强劲的发展动力，紧紧抓住每个历史阶段推动发展的“金钥匙”，把握发展机遇，并结合本地比较优势取得了快速发展。发展有先后，地域有差别，基础有好坏，但是每个发展阶段能不能抓住机会都是至关重要的。对我们来说，在经济新常态下，实现产业转型、结构调整、动力转换同样需要抢抓机遇、把准发展方向、盯住工作重点，通过创新驱动、开放合作、人才聚集来突破瓶颈、补齐短板。。三是两省市都始终注重发挥政策制度优势，并根据形势发展的需要，结合自身实际，准确把握阶段性特征和特定时期规律，动态调整和完善相关政策制度。这给我们很深的启发，抓发展搞建设既要坚持“一张蓝图绘到底”，又要不断吸收、有机结合时代发展进步的因素，与时俱进谋发展，真正实现可持续发展。全市各级各部门要自我加压，主动作为，充分发挥主观能动性，努力增强首府在全区经济社会发展中的支撑带动作用，勇当广西“两个建成”排头兵。,政府领导到其他城市考察学习或访问,0.0,True
208,广西省,南宁市,邕宁区人大系统考察组赴梧州贺州等地考察学习,2009-11-25,http://www.nanning.gov.cn/ywzx/xqdt/xqdtgd/t62572.html,为了进一步开阔视野，学习借鉴外地经验，增强做好人大工作的信心，2009年11月17日—20日，邕宁区人大常委会领导及部分常委会委员、乡镇人大领导、机关干部组成考察组，赴梧州、贺州等地考察学习。。考察组考察了梧州市的藤县、苍梧县的城镇化建设和县域经济发展情况，参观了李济深先生的故居；参观了梧州市长洲区人大机关工作、学习和文体活动场所，听取该区人大常委会领导关于加强自身建设，监督和支持政府工作的做法和经验；考察了贺州市八步区人大机关建设，并与该区人大常委会及机关干部就如何进一步加强和做好新时期人大工作进行了学习、交流，同时还参观了全国生态文化教育基地—贺州姑婆山。。考察组成员认为，此次考察活动感受颇深，收益甚大，看到了自身发展的差距，增强了发展信心。特别是对梧州市长洲区人大常委会在监督工作中敢于突破常规，创新监督方式方法以及贺州市八步区人大常委会在加强代表工作，强化服务意识等方面的做法和经验，认为值得好好学习和借鉴，表示要将他们的好经验、好做法与邕宁区人大的优势结合起来，把邕宁区人大工作提高到新的水平，促进邕宁区经济社会又好又快发展。,为了进一步开阔视野，学习借鉴外地经验，增强做好人大工作的信心，2009年11月17日—20日，邕宁区人大常委会领导及部分常委会委员、乡镇人大领导、机关干部组成考察组，赴梧州、贺州等地考察学习。。考察组考察了梧州市的藤县、苍梧县的城镇化建设和县域经济发展情况，参观了李济深先生的故居；参观了梧州市长洲区人大机关工作、学习和文体活动场所，听取该区人大常委会领导关于加强自身建设，监督和支持政府工作的做法和经验；考察了贺州市八步区人大机关建设，并与该区人大常委会及机关干部就如何进一步加强和做好新时期人大工作进行了学习、交流，同时还参观了全国生态文化教育基地—贺州姑婆山。。考察组成员认为，此次考察活动感受颇深，收益甚大，看到了自身发展的差距，增强了发展信心。特别是对梧州市长洲区人大常委会在监督工作中敢于突破常规，创新监督方式方法以及贺州市八步区人大常委会在加强代表工作，强化服务意识等方面的做法和经验，认为值得好好学习和借鉴，表示要将他们的好经验、好做法与邕宁区人大的优势结合起来，把邕宁区人大工作提高到新的水平，促进邕宁区经济社会又好又快发展。,政府领导到其他城市考察学习或访问,0.0,True
208,广西省,南宁市,车荣福率团在南京考察学习,2010-10-28,https://www.nanning.gov.cn/ywzx/tpxw/t82797.html,10月27日，自治区党委常委、市委书记车荣福率南宁市党政代表团深入南京市河西新城区、外秦淮河综治现场、全国500强企业，考察学习该市城市规划建设特别是新区开发管理、城市内河综合治理，以及经济转型、产业调整先进经验。南京市建设现代国际绿都和推动产业升级、科技创新、新兴产业发展等方面的做法给大家留下了深刻的印象。。当日上午，车荣福一行在南京市委常委、统战部部长钱继红陪同下先后到南京河西新城区、外秦淮河、雨润集团公司和南京城市规划建设展览馆考察学习。。站在101米高的南京奥体中心观光塔上放眼远眺，一个总面积94平方公里，商务、商贸、文体三大功能完美聚集的现代化新南京的标志区——河西新城展现在大家面前。。河西新城东依外秦淮河，西临长江。南京市按照“建有地铁等快速便捷的交通体系、功能完备的公共配套设施、商机无限的中央商务区、魅力独具的滨江风貌、人居和谐的住宅小区、蓄势待发的南部和西部新区”规划设计，经过持续8年的建设，累计投资约400亿元、拉动社会投资1000亿元，完成了北部20平方公里的整治提升，基本建成了中部地区21平方公里，拉开了南部地区15平方公里的开发序幕。2014年青奥会主赛场和青奥村将设置在此。。“南京市新区开发实行高起点规划、高标准建设、高强度投入、高效能管理的做法，很值得我们学习。”考察中代表团同志说，南宁正在加大五象新区开发，要好好借鉴南京的先进经验，基础设施、功能划分要在一次性科学规划框架下，逐步推进，把五象新区建设成为南宁城市发展的新亮点。。南宁正在加紧城市内河综合整治。看到南京秦淮河环境整改工程所取得的成效，大家对南宁“中国水城”建设充满信心。。秦淮河作为南京的“母亲河”，随着城市的扩张和日益严重的环境问题，影响了市民的居住环境和城市形象。近年来，南京市秦淮区按照建设“中国第一历史文化名河”目标，先后投资10亿多元，实施绿化、亮化、美化、文化等工程，精心打造了一条秦淮河风光带，改善了居民工作生活条件，营造了良好的发展环境。 一河碧水悠悠照绿都，两岸杨柳依依映高楼。从集庆门码头到石头城码头，车荣福一行乘船6公里沿途考察了外秦淮河整治情况。今日秦淮环境令人心旷神怡。大家认为，南宁市要充分发挥水资源丰富的优势，下大决心在中国绿城的基础上综合整治城内河湖，建设“百湖之城”，打造绿城水乡，进一步提高南宁宜居宜商城建水平。。创建于1993年的雨润集团是一家集食品、旅游、房地产、商贸、物流等五大产业于一体的中国500强企业，旗下拥有雨润、旺润、福润和大众肉联四大品牌，以及雨润食品、南京中商两家上市公司。。考察中，当大家得知该集团去年实现销售总额450亿元，生猪屠宰产能达到2500万头，跃居全球第一时，无不为雨润集团依靠科技创新、实施现代产业化经营带来的成效而拍手叫好。。“回去以后一定要认真学习借鉴、消化吸收南京的宝贵经验。”车荣福在南京考察结束时对代表团成员说，通过此次考察交流，学到了很多很好的经验和做法，“我们一定要结合南宁的实际，更加扎实地做好各项工作，推动南宁市自身的经济社会和城市建设发展。”。市领导谢寿堂、岑可成、周红波、胡建华、邓金玉、周家斌、吴炜、李志勇、石文怀、梁峰林等市党政代表团成员参加考察。,10月27日，自治区党委常委、市委书记车荣福率南宁市党政代表团深入南京市河西新城区、外秦淮河综治现场、全国500强企业，考察学习该市城市规划建设特别是新区开发管理、城市内河综合治理，以及经济转型、产业调整先进经验。南京市建设现代国际绿都和推动产业升级、科技创新、新兴产业发展等方面的做法给大家留下了深刻的印象。。当日上午，车荣福一行在南京市委常委、统战部部长钱继红陪同下先后到南京河西新城区、外秦淮河、雨润集团公司和南京城市规划建设展览馆考察学习。。站在101米高的南京奥体中心观光塔上放眼远眺，一个总面积94平方公里，商务、商贸、文体三大功能完美聚集的现代化新南京的标志区——河西新城展现在大家面前。。河西新城东依外秦淮河，西临长江。南京市按照“建有地铁等快速便捷的交通体系、功能完备的公共配套设施、商机无限的中央商务区、魅力独具的滨江风貌、人居和谐的住宅小区、蓄势待发的南部和西部新区”规划设计，经过持续8年的建设，累计投资约400亿元、拉动社会投资1000亿元，完成了北部20平方公里的整治提升，基本建成了中部地区21平方公里，拉开了南部地区15平方公里的开发序幕。2014年青奥会主赛场和青奥村将设置在此。。“南京市新区开发实行高起点规划、高标准建设、高强度投入、高效能管理的做法，很值得我们学习。”考察中代表团同志说，南宁正在加大五象新区开发，要好好借鉴南京的先进经验，基础设施、功能划分要在一次性科学规划框架下，逐步推进，把五象新区建设成为南宁城市发展的新亮点。。南宁正在加紧城市内河综合整治。看到南京秦淮河环境整改工程所取得的成效，大家对南宁“中国水城”建设充满信心。。秦淮河作为南京的“母亲河”，随着城市的扩张和日益严重的环境问题，影响了市民的居住环境和城市形象。近年来，南京市秦淮区按照建设“中国第一历史文化名河”目标，先后投资10亿多元，实施绿化、亮化、美化、文化等工程，精心打造了一条秦淮河风光带，改善了居民工作生活条件，营造了良好的发展环境。 一河碧水悠悠照绿都，两岸杨柳依依映高楼。从集庆门码头到石头城码头，车荣福一行乘船6公里沿途考察了外秦淮河整治情况。今日秦淮环境令人心旷神怡。大家认为，南宁市要充分发挥水资源丰富的优势，下大决心在中国绿城的基础上综合整治城内河湖，建设“百湖之城”，打造绿城水乡，进一步提高南宁宜居宜商城建水平。。创建于1993年的雨润集团是一家集食品、旅游、房地产、商贸、物流等五大产业于一体的中国500强企业，旗下拥有雨润、旺润、福润和大众肉联四大品牌，以及雨润食品、南京中商两家上市公司。。考察中，当大家得知该集团去年实现销售总额450亿元，生猪屠宰产能达到2500万头，跃居全球第一时，无不为雨润集团依靠科技创新、实施现代产业化经营带来的成效而拍手叫好。。“回去以后一定要认真学习借鉴、消化吸收南京的宝贵经验。”车荣福在南京考察结束时对代表团成员说，通过此次考察交流，学到了很多很好的经验和做法，“我们一定要结合南宁的实际，更加扎实地做好各项工作，推动南宁市自身的经济社会和城市建设发展。”。市领导谢寿堂、岑可成、周红波、胡建华、邓金玉、周家斌、吴炜、李志勇、石文怀、梁峰林等市党政代表团成员参加考察。,政府领导到其他城市考察学习或访问,0.7559765677516893,True
208,广西省,南宁市,周红波率团在南京考察学习并召开考察总结会,2014-08-22,https://www.nanning.gov.cn/ywzx/tpxw/t83060.html,8月18日至21日，市长周红波率团先后到武汉、芜湖、南京考察，学习先进经验，查找差距不足，明确前进方向，坚定发展信心。21日上午，在结束在南京市的考察后，周红波主持召开考察总结会并强调，要认真学习借鉴三市在推进改革发展中的好经验、好做法，进一步促进思想解放和观念更新，举一反三，立足实际，为努力提升南宁城市首位度，加快建设区域性国际城市和广西“首善之区”注入新的动力。。南宁市考察团在南京考察期间受到了南京市市长缪瑞林的热情接待和欢迎。正在举办第二届夏季青奥会的南京市，处处洋溢着青春的激情。8月21日上午，南宁市考察团一行先后考察了南京国际青年文化广场、青奥步行桥（南京眼）、青奥森林公园、鱼嘴湿地公园和青奥主运行中心，实地体验青奥会氛围，详细考察赛事组织情况，充分感受举办青奥会给南京城市建设和经济发展带来的巨大变化。南京市良好的赛事组织，热情文明的青年志愿者，现代、整洁、有序的城市市容，大气的城市建设和良好的人居环境，都给考察团成员留下深刻印象。。在随后召开的考察总结会上，考察团成员结合几天来在武汉、芜湖和南京三市的考察体会，有感而谈，畅所欲言，找差距、谈启发。大家一致认为，通过学习考察，最大的感受是震撼和触动，三市坚持狠抓产业发展，高起点、大手笔推动城镇建设，各级干部勇于担当干事创业的精神和激情等，都非常值得南宁市学习和借鉴。大家纷纷表示，要把三市好的经验和做法带回南宁，结合自身实际，进一步解放思想，把压力变为动力，努力实现首府经济社会发展新突破。。周红波指出，通过这次学习考察，我们深刻感受到三个城市发展意识高，创新理念强，文化优势大，。创业氛围浓，干部作风硬。在看到这三市科学发展巨大成就的同时，我们要进一步认清在经济总量、发展质量、创新能力、对外开放、县域经济等方面存在的差距和不足，进一步增强促进我市发展的责任感和紧迫感，以新的更高标准推动我市经济社会又好又快发展。。周红波强调，要认真总结运用好这次学习考察的成果，推动各项工作再上新台阶。一是要真学。要保持清醒头脑、增强忧患意识，既要看到别人的先进经验，找准我们的差距，又要充分研究我们自身的特色和优势；既要学习先进地区敢为人先、敢做善成的创新思想，更要学习他们脚踏实地、务求实效的强大执行力。二是要真抓实干。要坚定不移狠抓产业发展，加大对工业的持续投入，推动产城融合发展；要坚持创新驱动，加快体制机制和城市管理等各方面改革，不断增强城市软实力；要坚持“人才强市”战略，努力引进思路新、专业水平高、办事能力强的优秀人才，做到引才、聚才、用才、留才。三是要真努力。敢想敢干还要能落实，要坚持创新城市发展理念，努力打造城市特色品牌；要坚定不移推动改革，努力破除影响发展的制度和政策瓶颈；要勇于担当，用实绩来检验实干，不断激发干部的工作热情，切实加快赶超先进步伐。,8月18日至21日，市长周红波率团先后到武汉、芜湖、南京考察，学习先进经验，查找差距不足，明确前进方向，坚定发展信心。21日上午，在结束在南京市的考察后，周红波主持召开考察总结会并强调，要认真学习借鉴三市在推进改革发展中的好经验、好做法，进一步促进思想解放和观念更新，举一反三，立足实际，为努力提升南宁城市首位度，加快建设区域性国际城市和广西“首善之区”注入新的动力。。南宁市考察团在南京考察期间受到了南京市市长缪瑞林的热情接待和欢迎。正在举办第二届夏季青奥会的南京市，处处洋溢着青春的激情。8月21日上午，南宁市考察团一行先后考察了南京国际青年文化广场、青奥步行桥（南京眼）、青奥森林公园、鱼嘴湿地公园和青奥主运行中心，实地体验青奥会氛围，详细考察赛事组织情况，充分感受举办青奥会给南京城市建设和经济发展带来的巨大变化。南京市良好的赛事组织，热情文明的青年志愿者，现代、整洁、有序的城市市容，大气的城市建设和良好的人居环境，都给考察团成员留下深刻印象。。在随后召开的考察总结会上，考察团成员结合几天来在武汉、芜湖和南京三市的考察体会，有感而谈，畅所欲言，找差距、谈启发。大家一致认为，通过学习考察，最大的感受是震撼和触动，三市坚持狠抓产业发展，高起点、大手笔推动城镇建设，各级干部勇于担当干事创业的精神和激情等，都非常值得南宁市学习和借鉴。大家纷纷表示，要把三市好的经验和做法带回南宁，结合自身实际，进一步解放思想，把压力变为动力，努力实现首府经济社会发展新突破。。周红波指出，通过这次学习考察，我们深刻感受到三个城市发展意识高，创新理念强，文化优势大，。创业氛围浓，干部作风硬。在看到这三市科学发展巨大成就的同时，我们要进一步认清在经济总量、发展质量、创新能力、对外开放、县域经济等方面存在的差距和不足，进一步增强促进我市发展的责任感和紧迫感，以新的更高标准推动我市经济社会又好又快发展。。周红波强调，要认真总结运用好这次学习考察的成果，推动各项工作再上新台阶。一是要真学。要保持清醒头脑、增强忧患意识，既要看到别人的先进经验，找准我们的差距，又要充分研究我们自身的特色和优势；既要学习先进地区敢为人先、敢做善成的创新思想，更要学习他们脚踏实地、务求实效的强大执行力。二是要真抓实干。要坚定不移狠抓产业发展，加大对工业的持续投入，推动产城融合发展；要坚持创新驱动，加快体制机制和城市管理等各方面改革，不断增强城市软实力；要坚持“人才强市”战略，努力引进思路新、专业水平高、办事能力强的优秀人才，做到引才、聚才、用才、留才。三是要真努力。敢想敢干还要能落实，要坚持创新城市发展理念，努力打造城市特色品牌；要坚定不移推动改革，努力破除影响发展的制度和政策瓶颈；要勇于担当，用实绩来检验实干，不断激发干部的工作热情，切实加快赶超先进步伐。,政府领导到其他城市考察学习或访问,0.7751358590202598,True
