code,province,city,topic,date,url,content,content.1,label,score,is_match
221,广西省,崇左市,迟威参加不忘初心庆七一凝心聚力守边疆主题党日活动,2024-07-02,http://www.chongzuo.gov.cn/dtxx/zwdt/t18631631.shtml,凭祥讯（记者 黄沁芳）7月1日，市长迟威以普通党员身份参加市政府办第一党支部开展的“不忘初心庆七一 凝心聚力守边疆”主题党日活动。迟威强调，要始终坚持以习近平新时代中国特色社会主义思想为指导，深入学习贯彻习近平总书记关于广西工作论述的重要要求，进一步增强责任意识、担当意识、使命意识，推动我市边疆民族地区经济社会高质量发展。。当天上午，迟威首先来到凭祥市广西大洲国际物流有限公司、创晟进出口贸易有限公司，调研企业生产经营、党组织建设等情况，与企业负责人进行深入交流。迟威强调，要进一步加强基层党组织标准化、规范化建设，将党建工作全面融合到企业发展中来，为企业发展提供内生动力。要着力培育特色党建品牌，促进党建工作与企业文化建设深度融合，加大科技创新力度，推动企业持续提升核心竞争力。。随后，迟威前往凭祥市友谊镇隘口村，实地考察抵边村基层党建工作开展情况，详细了解隘口小学改幼儿园建设项目进展情况，研究解决有关问题。迟威强调，要深入学习贯彻习近平总书记关于巩固拓展脱贫攻坚成果同乡村振兴有效衔接的重要讲话、重要指示批示精神，不断深化新时代兴边富民行动，整合优势资源，因地制宜大力发展特色富民产业，充分发挥基层党组织战斗堡垒作用和党员先锋模范作用，积极引导广大群众探索“党建+直播带货”等新发展模式，促进群众增收致富，让边民安居乐业安心固守边疆。要深入学习贯彻习近平总书记关于教育的重要论述，全面贯彻党的教育方针，注重改善边境地区教育设施，加大对抵边村学校的投入和管理力度，持续提高边境学校教育教学质量，推动边疆民族地区基础教育实现高质量发展，不断增强边疆各族群众的获得感、幸福感和满意度。,凭祥讯（记者 黄沁芳）7月1日，市长迟威以普通党员身份参加市政府办第一党支部开展的“不忘初心庆七一 凝心聚力守边疆”主题党日活动。迟威强调，要始终坚持以习近平新时代中国特色社会主义思想为指导，深入学习贯彻习近平总书记关于广西工作论述的重要要求，进一步增强责任意识、担当意识、使命意识，推动我市边疆民族地区经济社会高质量发展。。当天上午，迟威首先来到凭祥市广西大洲国际物流有限公司、创晟进出口贸易有限公司，调研企业生产经营、党组织建设等情况，与企业负责人进行深入交流。迟威强调，要进一步加强基层党组织标准化、规范化建设，将党建工作全面融合到企业发展中来，为企业发展提供内生动力。要着力培育特色党建品牌，促进党建工作与企业文化建设深度融合，加大科技创新力度，推动企业持续提升核心竞争力。。随后，迟威前往凭祥市友谊镇隘口村，实地考察抵边村基层党建工作开展情况，详细了解隘口小学改幼儿园建设项目进展情况，研究解决有关问题。迟威强调，要深入学习贯彻习近平总书记关于巩固拓展脱贫攻坚成果同乡村振兴有效衔接的重要讲话、重要指示批示精神，不断深化新时代兴边富民行动，整合优势资源，因地制宜大力发展特色富民产业，充分发挥基层党组织战斗堡垒作用和党员先锋模范作用，积极引导广大群众探索“党建+直播带货”等新发展模式，促进群众增收致富，让边民安居乐业安心固守边疆。要深入学习贯彻习近平总书记关于教育的重要论述，全面贯彻党的教育方针，注重改善边境地区教育设施，加大对抵边村学校的投入和管理力度，持续提高边境学校教育教学质量，推动边疆民族地区基础教育实现高质量发展，不断增强边疆各族群众的获得感、幸福感和满意度。,政府领导到其他城市考察学习或访问,0.0,True
221,广西省,崇左市,蓝晓黄丽娟深入大新天等调研主题教育工作并召开座谈会,2024-01-04,http://www.chongzuo.gov.cn/zfxxgkzl/xxgkzn_fdzdgknr/jcxxgk_zfhy/zfhy_qthy/t17800226.shtml,崇左讯（记者 黄沁芳 崇左广播电视台记者 陈俊华）1月2日，市委书记蓝晓，自治区主题教育第十四巡回督导组组长黄丽娟率调研组到大新县、天等县调研主题教育工作并召开座谈会，深入学习贯彻习近平总书记关于主题教育系列重要讲话和重要指示批示精神，深入贯彻落实习近平总书记对广西重大方略要求，了解大新县、天等县高质量发展“四个专项行动”、为民解忧办实事等工作落实情况，听取意见建议，不断推动主题教育走深走实、见行见效。。蓝晓指出，全市各级各部门要进一步提高政治站位，全力做好主题教育规定动作，将学习好、宣传好、贯彻好习近平总书记对广西重大方略要求作为当前和今后一个时期重大政治任务，迅速组织传达学习，广泛开展宣传工作，精心抓好教育培训，确保习近平总书记重要讲话精神在崇左完整准确全面贯彻落实。要深化调查研究，扎实推进产业项目建设，精心谋划做好今年各项工作。要抓实检视整改，持续整顿软弱涣散基层党组织，以新风正气振奋人民群众发展信心。。蓝晓强调，要狠抓重点工作，合力推动高质量发展。要聚焦高质量发展“四个专项行动”持续发力，推进基础设施建设提档升级，全面推进乡村振兴战略有效实施，促进城乡融合发展，加快产业园区改革发展；践行“四下基层”为民造福，以真讲促真懂，以真访联真情，以真下察真盼，以真干解真忧，切实走好新时代党的群众路线；进一步加强城乡之间的教学交流，扩大县城基础教育办学规模，加强教师队伍建设，着力提升教育教学质量。要压紧压实责任，坚持把各项工作同贯彻落实党中央、自治区党委和市委各项决策部署结合起来，分解任务，细化措施，聚力推动主题教育取得实效。要增强干事本领，强化作风建设，加强沟通指导和跟踪排查，引导广大党员干部始终知敬畏、存戒惧、守底线。。黄丽娟充分肯定我市主题教育开展以来取得的成效，强调要抓好理论学习，始终坚持聚焦“学思想”这个首要任务，学深悟透习近平新时代中国特色社会主义思想，坚持不懈在深化、内化、转化上下功夫，巩固拓展主题教育成果，确保在以学铸魂、以学增智、以学正风、以学促干上取得更大成效。要坚持学干结合，加强统筹协调，精心组织实施，深入践行“四下基层”制度，统筹抓好高质量发展“四个专项行动”，切实抓好检视整改，扎实推进“为民解忧办实事”，着力解决群众困难事、揪心事、烦心事，不断提升人民群众的幸福感和获得感。要增强抓好主题教育的责任感紧迫感使命感，各级党组织书记要坚决扛起第一责任人责任，领导班子其他成员要更好履行“一岗双责”，坚持一切从实际出发，牢牢把握主题教育目标任务，一体推进主题教育理论学习、调查研究、推动发展、检视整改、建章立制等各项重点措施，确保主题教育善始善终、善作善成。。会前，调研组先后前往大新县下雷镇中心小学、下雷镇仁益村八角矮化种植试验基地和天等县驮堪乡卫生院、崇左市（天等县）肉牛三产融合发展示范基地项目现场、上食食品有限公司肉牛屠宰场考察调研。,崇左讯（记者 黄沁芳 崇左广播电视台记者 陈俊华）1月2日，市委书记蓝晓，自治区主题教育第十四巡回督导组组长黄丽娟率调研组到大新县、天等县调研主题教育工作并召开座谈会，深入学习贯彻习近平总书记关于主题教育系列重要讲话和重要指示批示精神，深入贯彻落实习近平总书记对广西重大方略要求，了解大新县、天等县高质量发展“四个专项行动”、为民解忧办实事等工作落实情况，听取意见建议，不断推动主题教育走深走实、见行见效。。蓝晓指出，全市各级各部门要进一步提高政治站位，全力做好主题教育规定动作，将学习好、宣传好、贯彻好习近平总书记对广西重大方略要求作为当前和今后一个时期重大政治任务，迅速组织传达学习，广泛开展宣传工作，精心抓好教育培训，确保习近平总书记重要讲话精神在崇左完整准确全面贯彻落实。要深化调查研究，扎实推进产业项目建设，精心谋划做好今年各项工作。要抓实检视整改，持续整顿软弱涣散基层党组织，以新风正气振奋人民群众发展信心。。蓝晓强调，要狠抓重点工作，合力推动高质量发展。要聚焦高质量发展“四个专项行动”持续发力，推进基础设施建设提档升级，全面推进乡村振兴战略有效实施，促进城乡融合发展，加快产业园区改革发展；践行“四下基层”为民造福，以真讲促真懂，以真访联真情，以真下察真盼，以真干解真忧，切实走好新时代党的群众路线；进一步加强城乡之间的教学交流，扩大县城基础教育办学规模，加强教师队伍建设，着力提升教育教学质量。要压紧压实责任，坚持把各项工作同贯彻落实党中央、自治区党委和市委各项决策部署结合起来，分解任务，细化措施，聚力推动主题教育取得实效。要增强干事本领，强化作风建设，加强沟通指导和跟踪排查，引导广大党员干部始终知敬畏、存戒惧、守底线。。黄丽娟充分肯定我市主题教育开展以来取得的成效，强调要抓好理论学习，始终坚持聚焦“学思想”这个首要任务，学深悟透习近平新时代中国特色社会主义思想，坚持不懈在深化、内化、转化上下功夫，巩固拓展主题教育成果，确保在以学铸魂、以学增智、以学正风、以学促干上取得更大成效。要坚持学干结合，加强统筹协调，精心组织实施，深入践行“四下基层”制度，统筹抓好高质量发展“四个专项行动”，切实抓好检视整改，扎实推进“为民解忧办实事”，着力解决群众困难事、揪心事、烦心事，不断提升人民群众的幸福感和获得感。要增强抓好主题教育的责任感紧迫感使命感，各级党组织书记要坚决扛起第一责任人责任，领导班子其他成员要更好履行“一岗双责”，坚持一切从实际出发，牢牢把握主题教育目标任务，一体推进主题教育理论学习、调查研究、推动发展、检视整改、建章立制等各项重点措施，确保主题教育善始善终、善作善成。。会前，调研组先后前往大新县下雷镇中心小学、下雷镇仁益村八角矮化种植试验基地和天等县驮堪乡卫生院、崇左市（天等县）肉牛三产融合发展示范基地项目现场、上食食品有限公司肉牛屠宰场考察调研。,政府领导到其他城市考察学习或访问,0.0,True
221,广西省,崇左市,崇左市实施千万工程加快建设宜居宜业和美乡村现场推进会召开,2023-12-29,http://www.chongzuo.gov.cn/zfxxgkzl/xxgkzn_fdzdgknr/jcxxgk_zfhy/zfhy_zthy/t17787561.shtml,崇左讯（记者 钟金炽）12月28日，崇左市实施“千村引领、万村提升”工程加快建设宜居宜业和美乡村暨全市休闲农业与乡村旅游融合发展现场推进会召开。市委副书记、市委农村工作（乡村振兴）领导小组副组长、市实施乡村振兴战略指挥部副指挥长丁东弟出席会议并讲话。。丁东弟指出，“千万工程”是习近平总书记在浙江工作时亲自谋划、亲自部署、亲自推动的一项重大决策。各级各部门要提高政治站位，增强学习运用“千万工程”经验的政治自觉和行动自觉，坚持以人民为中心，强化党建引领，因地制宜抓落实，推动我市宜居宜业和美乡村建设迈上新台阶。。丁东弟强调，要突出重点、把握关键，以实施农村厕所、垃圾、污水“三大革命”为切入点，抓好道路硬化、农村饮水安全提升工作，完善农村公共服务设施。要夯实产业基础，做好“十大农产品加工业”，推进乡村产业振兴，聚焦典型示范，推进标杆乡村创建。要深化农文旅以及一二三产业融合发展，推进乡村特色产业链条延链补链。要加强统筹，推动学习运用“千万工程”经验和休闲农业与乡村旅游融合发展落地见效。。会议通报我市学习运用“千万工程”经验工作进展、乡村旅游发展等情况。宁明县、江州区、大新县雷平镇作经验交流发言。当天，与会代表实地考察了大新县、江州区、宁明县等现场点。,崇左讯（记者 钟金炽）12月28日，崇左市实施“千村引领、万村提升”工程加快建设宜居宜业和美乡村暨全市休闲农业与乡村旅游融合发展现场推进会召开。市委副书记、市委农村工作（乡村振兴）领导小组副组长、市实施乡村振兴战略指挥部副指挥长丁东弟出席会议并讲话。。丁东弟指出，“千万工程”是习近平总书记在浙江工作时亲自谋划、亲自部署、亲自推动的一项重大决策。各级各部门要提高政治站位，增强学习运用“千万工程”经验的政治自觉和行动自觉，坚持以人民为中心，强化党建引领，因地制宜抓落实，推动我市宜居宜业和美乡村建设迈上新台阶。。丁东弟强调，要突出重点、把握关键，以实施农村厕所、垃圾、污水“三大革命”为切入点，抓好道路硬化、农村饮水安全提升工作，完善农村公共服务设施。要夯实产业基础，做好“十大农产品加工业”，推进乡村产业振兴，聚焦典型示范，推进标杆乡村创建。要深化农文旅以及一二三产业融合发展，推进乡村特色产业链条延链补链。要加强统筹，推动学习运用“千万工程”经验和休闲农业与乡村旅游融合发展落地见效。。会议通报我市学习运用“千万工程”经验工作进展、乡村旅游发展等情况。宁明县、江州区、大新县雷平镇作经验交流发言。当天，与会代表实地考察了大新县、江州区、宁明县等现场点。,政府领导到其他城市考察学习或访问,0.0,True
221,广西省,崇左市,市政府常务会议召开,2023-12-07,http://www.chongzuo.gov.cn/zfxxgkzl/xxgkzn_fdzdgknr/jcxxgk_zfhy/zfhy_cwhy/t17578657.shtml,传达学习习近平总书记近期重要讲话精神；传达学习上级有关文件精神；开展法治政府建设专题学习。崇左讯（记者 黄沁芳）12月6日，市长迟威主持召开市五届人民政府第45次常务会议，传达学习习近平总书记在上海、江苏盐城考察时的重要讲话精神和深入推进长三角一体化发展座谈会精神；传达学习《广西壮族自治区安全生产委员会办公室关于认真贯彻落实习近平总书记重要指示精神切实做好岁末年初安全生产工作的紧急通知》精神；开展法治政府建设专题学习；审议有关文件，研究部署有关工作。。会议指出，习近平总书记的重要讲话，从全局和战略高度擘画长三角一体化发展新蓝图，具有很强的政治性、思想性、针对性、指导性。全市各级各部门要以习近平总书记的重要讲话为根本遵循，结合崇左实际，充分发挥“边”的优势，大力推进中国—东盟产业合作区崇左片区和凭祥产业园区建设，主动加强与长江经济带等东部发达地区的交流合作。要深入实施创新驱动发展战略，推动特色产业向高端化、智能化、绿色化、集群化发展。要坚持生态优先、绿色发展，筑牢祖国南疆绿色生态屏障。。会议强调，要深入贯彻落实习近平总书记关于安全生产的重要论述和重要指示精神，压紧压实责任，狠抓一线岗位安全管理。要严控重点领域安全风险，强化矿山、城镇燃气、烟花爆竹等重点领域安全管控，持续深入排查化解经营性自建房、大型商业综合体等领域风险隐患。要严把安全治理质效关，统筹推进安全隐患整改工作，切实加强公众安全教育，筑牢安全生产防线。。会议邀请自治区司法厅二级巡视员李文金进行法治政府建设专题学习辅导，强调要深入学习贯彻习近平法治思想，始终坚持法治思维，认真学习法律专业知识。要严格规范公正文明执法，深入推进重点领域综合行政执法改革，健全完善覆盖城乡、便捷高效、均等普惠的现代公共法律服务体系。要深化行政行为督导检查，加强对重点执法部门和关键岗位执法的监督力度，督促严格规范行政权力运行，推动崇左法治建设不断迈上新台阶。,传达学习习近平总书记近期重要讲话精神；传达学习上级有关文件精神；开展法治政府建设专题学习。崇左讯（记者 黄沁芳）12月6日，市长迟威主持召开市五届人民政府第45次常务会议，传达学习习近平总书记在上海、江苏盐城考察时的重要讲话精神和深入推进长三角一体化发展座谈会精神；传达学习《广西壮族自治区安全生产委员会办公室关于认真贯彻落实习近平总书记重要指示精神切实做好岁末年初安全生产工作的紧急通知》精神；开展法治政府建设专题学习；审议有关文件，研究部署有关工作。。会议指出，习近平总书记的重要讲话，从全局和战略高度擘画长三角一体化发展新蓝图，具有很强的政治性、思想性、针对性、指导性。全市各级各部门要以习近平总书记的重要讲话为根本遵循，结合崇左实际，充分发挥“边”的优势，大力推进中国—东盟产业合作区崇左片区和凭祥产业园区建设，主动加强与长江经济带等东部发达地区的交流合作。要深入实施创新驱动发展战略，推动特色产业向高端化、智能化、绿色化、集群化发展。要坚持生态优先、绿色发展，筑牢祖国南疆绿色生态屏障。。会议强调，要深入贯彻落实习近平总书记关于安全生产的重要论述和重要指示精神，压紧压实责任，狠抓一线岗位安全管理。要严控重点领域安全风险，强化矿山、城镇燃气、烟花爆竹等重点领域安全管控，持续深入排查化解经营性自建房、大型商业综合体等领域风险隐患。要严把安全治理质效关，统筹推进安全隐患整改工作，切实加强公众安全教育，筑牢安全生产防线。。会议邀请自治区司法厅二级巡视员李文金进行法治政府建设专题学习辅导，强调要深入学习贯彻习近平法治思想，始终坚持法治思维，认真学习法律专业知识。要严格规范公正文明执法，深入推进重点领域综合行政执法改革，健全完善覆盖城乡、便捷高效、均等普惠的现代公共法律服务体系。要深化行政行为督导检查，加强对重点执法部门和关键岗位执法的监督力度，督促严格规范行政权力运行，推动崇左法治建设不断迈上新台阶。,政府领导到其他城市考察学习或访问,0.5534126756283484,True
