code,province,city,topic,date,url,content,content.1,label,score,is_match
210,广西省,桂林市,何文浩到我市考察调研周家斌陪同,2021-11-22,http://www.guilin.gov.cn/ywdt/zwdt/202111/t20211122_2170576.shtml,桂林市气象台13日9时50分继续发布高温橙色预警信号：预计未来24小时内市区将出现37度以上的高温天气，请做好防范。。【桂林日报讯】（记者周绍瑜）11月17日，自治区党委常委何文浩率调研组到我市，对乡村振兴、基层社会治理、漓江生态保护等工作开展考察调研，并赴湘江战役发生地全州县接受革命传统教育，传承红色基因，赓续革命精神血脉。市委书记周家斌陪同调研。。调研组一行来到位于全州县才湾镇的红军长征湘江战役纪念园，在凭吊广场举行了庄严肃穆的敬献花篮仪式，瞻仰“红军魂”雕塑，参观纪念馆。在讲解员的带领下，大家时而凝神倾听，时而驻足观看，透过一件件实物、一张张图片、一个个雕塑，了解历史事迹，追溯湘江战役的“红色之路”。何文浩指出，要深入学习领会习近平总书记视察广西“4·27”重要讲话精神，用好用活红色资源，扎实开展好党史学习教育，做到学史明理、学史增信、学史崇德、学史力行，从湘江战役的英雄身上汲取崇高信仰伟力和强大革命精神，切实转化为推动桂林高质量发展的工作动力。。随后，调研组来到阳朔县漓江杨堤码头，了解漓江流域综合治理、生态保护等情况，并乘船考察漓江阳朔段。何文浩强调，要切实贯彻落实习近平总书记对广西工作的系列重要讲话要求，深入贯彻落实习近平生态文明思想，加强生态建设和环境保护，全力呵护好桂林山水。坚持世界眼光、国际标准、广西特色、高点定位，全力打造世界级文化旅游品牌、建设世界级城市配套、构建世界级服务体系、实现世界级消费引领，高水平打造桂林世界级旅游城市。,桂林市气象台13日9时50分继续发布高温橙色预警信号：预计未来24小时内市区将出现37度以上的高温天气，请做好防范。。【桂林日报讯】（记者周绍瑜）11月17日，自治区党委常委何文浩率调研组到我市，对乡村振兴、基层社会治理、漓江生态保护等工作开展考察调研，并赴湘江战役发生地全州县接受革命传统教育，传承红色基因，赓续革命精神血脉。市委书记周家斌陪同调研。。调研组一行来到位于全州县才湾镇的红军长征湘江战役纪念园，在凭吊广场举行了庄严肃穆的敬献花篮仪式，瞻仰“红军魂”雕塑，参观纪念馆。在讲解员的带领下，大家时而凝神倾听，时而驻足观看，透过一件件实物、一张张图片、一个个雕塑，了解历史事迹，追溯湘江战役的“红色之路”。何文浩指出，要深入学习领会习近平总书记视察广西“4·27”重要讲话精神，用好用活红色资源，扎实开展好党史学习教育，做到学史明理、学史增信、学史崇德、学史力行，从湘江战役的英雄身上汲取崇高信仰伟力和强大革命精神，切实转化为推动桂林高质量发展的工作动力。。随后，调研组来到阳朔县漓江杨堤码头，了解漓江流域综合治理、生态保护等情况，并乘船考察漓江阳朔段。何文浩强调，要切实贯彻落实习近平总书记对广西工作的系列重要讲话要求，深入贯彻落实习近平生态文明思想，加强生态建设和环境保护，全力呵护好桂林山水。坚持世界眼光、国际标准、广西特色、高点定位，全力打造世界级文化旅游品牌、建设世界级城市配套、构建世界级服务体系、实现世界级消费引领，高水平打造桂林世界级旅游城市。,政府领导到其他城市考察学习或访问,0.0,True
210,广西省,桂林市,河池市四家班子到全州县开展党史学习教育周家斌李楚赵仲华陈丽华分别陪同秦春成王军莫振祖参加活动,2021-12-18,http://www.guilin.gov.cn/ywdt/zwdt/202112/t20211220_2187988.shtml,桂林市气象台13日9时50分继续发布高温橙色预警信号：预计未来24小时内市区将出现37度以上的高温天气，请做好防范。。河池市四家班子到全州县开展党史学习教育 周家斌李楚赵仲华陈丽华分别陪同 秦春成王军莫振祖参加活动。【桂林日报讯】（记者周文俊）12月16日至17日，河池市四家班子赴湘江战役发生地全州县开展党史学习教育，深入学习贯彻党的十九届六中全会精神，全面贯彻落实自治区第十二次党代会决策部署，重温红色记忆，传承红色基因，从党的百年历史、从湘江战役历史中汲取智慧和力量，奋力谱写建设新时代中国特色社会主义壮美广西河池篇章。河池市委书记秦春成、市长王军、市人大常委会主任莫振祖等参加活动；桂林市委书记周家斌、市长李楚、市人大常委会主任赵仲华、市政协主席陈丽华等分别陪同。。代表团一行首先来到习近平总书记今年4月视察广西的第一站——位于全州县才湾镇的红军长征湘江战役纪念园，在凭吊广场举行庄严肃穆的敬献花篮仪式，重温入党誓词，并瞻仰烈士雕塑和纪念林，参观湘江战役纪念馆。代表团全体人员在讲解员的带领下，时而凝神倾听，时而驻足观看，透过一件件实物、一张张图片、一个个雕塑，了解历史事迹，追溯湘江战役的“红色之路”。红军将士视死如归、向死而生、一往无前、绝境重生，迸发出不被一切敌人压倒而是压倒一切敌人的英雄气概，让大家受到深刻的革命传统教育和党性淬炼。。随后，代表团一行来到附近的才湾镇毛竹山村，考察当地葡萄产业发展、乡村风貌提升等相关工作，深切体悟习近平总书记“让人民生活幸福是‘国之大者’”的为民情怀，深刻感悟党的初心使命。。大家在参观考察中表示，一定要深入学习贯彻习近平总书记视察广西“4·27”重要讲话精神，深入学习贯彻党的十九届六中全会和自治区第十二次党代会精神，推动党史学习教育持续走深走实，始终牢记初心使命、坚定理想信念、传承红色基因，赓续共产党人的精神血脉，大力弘扬伟大建党精神、伟大长征精神，以史为鉴、开创未来，埋头苦干、勇毅前行，奋力谱写建设新时代中国特色社会主义壮美广西河池篇章。。桂林市领导彭东光、钟洪、丁东弟、唐修璇、陆智成，市中级人民法院院长杨晓春、市人民检察院检察长梁贻勇等分别陪同；河池市四家班子领导，市中级人民法院院长、市人民检察院检察长，以及有关部门主要负责同志参加活动。,桂林市气象台13日9时50分继续发布高温橙色预警信号：预计未来24小时内市区将出现37度以上的高温天气，请做好防范。。河池市四家班子到全州县开展党史学习教育 周家斌李楚赵仲华陈丽华分别陪同 秦春成王军莫振祖参加活动。【桂林日报讯】（记者周文俊）12月16日至17日，河池市四家班子赴湘江战役发生地全州县开展党史学习教育，深入学习贯彻党的十九届六中全会精神，全面贯彻落实自治区第十二次党代会决策部署，重温红色记忆，传承红色基因，从党的百年历史、从湘江战役历史中汲取智慧和力量，奋力谱写建设新时代中国特色社会主义壮美广西河池篇章。河池市委书记秦春成、市长王军、市人大常委会主任莫振祖等参加活动；桂林市委书记周家斌、市长李楚、市人大常委会主任赵仲华、市政协主席陈丽华等分别陪同。。代表团一行首先来到习近平总书记今年4月视察广西的第一站——位于全州县才湾镇的红军长征湘江战役纪念园，在凭吊广场举行庄严肃穆的敬献花篮仪式，重温入党誓词，并瞻仰烈士雕塑和纪念林，参观湘江战役纪念馆。代表团全体人员在讲解员的带领下，时而凝神倾听，时而驻足观看，透过一件件实物、一张张图片、一个个雕塑，了解历史事迹，追溯湘江战役的“红色之路”。红军将士视死如归、向死而生、一往无前、绝境重生，迸发出不被一切敌人压倒而是压倒一切敌人的英雄气概，让大家受到深刻的革命传统教育和党性淬炼。。随后，代表团一行来到附近的才湾镇毛竹山村，考察当地葡萄产业发展、乡村风貌提升等相关工作，深切体悟习近平总书记“让人民生活幸福是‘国之大者’”的为民情怀，深刻感悟党的初心使命。。大家在参观考察中表示，一定要深入学习贯彻习近平总书记视察广西“4·27”重要讲话精神，深入学习贯彻党的十九届六中全会和自治区第十二次党代会精神，推动党史学习教育持续走深走实，始终牢记初心使命、坚定理想信念、传承红色基因，赓续共产党人的精神血脉，大力弘扬伟大建党精神、伟大长征精神，以史为鉴、开创未来，埋头苦干、勇毅前行，奋力谱写建设新时代中国特色社会主义壮美广西河池篇章。。桂林市领导彭东光、钟洪、丁东弟、唐修璇、陆智成，市中级人民法院院长杨晓春、市人民检察院检察长梁贻勇等分别陪同；河池市四家班子领导，市中级人民法院院长、市人民检察院检察长，以及有关部门主要负责同志参加活动。,政府领导到其他城市考察学习或访问,0.0,True
210,广西省,桂林市,周家斌在市委常委会扩大会议暨传达学习自治区第十二次党代会精神大会上强调把学习贯彻十九届六中全会精神与党代会精神有机结合推动打造世界级旅游城市取得实实在在的成效李楚陈丽华出席,2021-12-06,http://www.guilin.gov.cn/ywdt/zwdt/202112/t20211206_2178626.shtml,桂林市气象台13日9时50分继续发布高温橙色预警信号：预计未来24小时内市区将出现37度以上的高温天气，请做好防范。。周家斌在市委常委会（扩大）会议暨传达学习自治区第十二次党代会精神大会上强调 把学习贯彻十九届六中全会精神与党代会精神有机结合 推动打造世界级旅游城市取得实实在在的成效 李楚陈丽华出席。【桂林日报讯】（记者周绍瑜）12月3日，市委常委会（扩大）会议暨传达学习自治区第十二次党代会精神大会召开，深入学习贯彻党的十九届六中全会精神，传达学习自治区第十二次党代会精神，动员全市各级党组织和广大党员，结合桂林实际，把大会精神学习宣传好、贯彻落实好。市委书记周家斌主持大会并讲话，强调要切实提高政治站位，把学习贯彻党的十九届六中全会精神、自治区第十二次党代会精神有机结合起来，全力打造桂林世界级旅游城市，为奋力谱写建设新时代中国特色社会主义壮美广西的桂林新篇章作出新的更大贡献。市委副书记、市长李楚，市政协主席陈丽华出席大会。。周家斌指出，自治区第十二次党代会是在与全国同步全面建成小康社会之后，开启全面建设社会主义现代化广西新征程的大会，是动员全区广大党员、干部群众凝心聚力建设新时代中国特色社会主义壮美广西的大会，是全区各族人民政治生活中的一件大事喜事盛事。大会精神主要体现在刘宁书记所作的题为《牢记领袖嘱托 勇担历史使命 凝心聚力建设新时代中国特色社会主义壮美广西》的报告中。报告实事求是地对自治区第十一次党代会以来的工作进行了回顾和总结，客观分析了当前的形势与任务、机遇与挑战，科学阐述了为什么建设、建设什么样的和怎样建设新时代中国特色社会主义壮美广西的目标内涵要义，系统谋划了我区未来五年和今后一个时期凝心聚力建设新时代中国特色社会主义壮美广西的工作思路、总体要求、奋斗目标、战略任务和重大举措，形成了建设壮美广西“1+1+4+3+N”的目标任务体系。。周家斌指出，学习宣传贯彻党的十九届六中全会精神，是当前和今后一个时期的重大政治任务。要深刻认识党的十九届六中全会的重大意义，准确把握全会精神的丰富内涵和核心要义。深刻领会总结党的百年奋斗重大成就和历史经验的重大意义，深刻领会党的百年奋斗的初心使命和重大成就，深刻领会中国特色社会主义进入新时代的历史性成就和历史性变革，深刻领会党的百年奋斗历史经验，深刻领会以史为鉴、开创未来的重要要求。。周家斌强调，各级各部门要切实提高政治站位，把学习贯彻党的十九届六中全会精神、自治区第十二次党代会精神有机结合起来，精心部署、周密安排，掀起学习宣传贯彻大会精神热潮。扎实做好学习宣传贯彻工作，精心组织学习培训，广泛开展集中宣讲，深入开展宣传阐释工作。扎实做好任务分解落实工作，加强组织领导，健全推进机制，强化督促检查。扎实做好工作谋划，对照党的十九届六中全会精神，对照自治区第十二次党代会部署，尤其是对桂林工作要求，进一步明确为什么打造、怎么打造、打造成怎么样的世界级旅游城市。坚持“政策为大、项目为王、环境为本、创新为要”，全面梳理打造世界级旅游城市重大事项、重大项目，以及需要中央和自治区支持的重大政策。要与加快实施“十四五”规划结合起来，系统谋划明年工作，确保早部署早安排早起步，推动打造世界级旅游城市取得实实在在的成效。。会议采用电视电话会议形式召开，市设主会场，各县（市、区）设分会场。市四家班子领导成员，市检察院检察长，其他厅级领导，副厅级以上离退休老干部代表，在桂林的党的十九大代表，市直各单位主要负责同志在主会场参加会议。,桂林市气象台13日9时50分继续发布高温橙色预警信号：预计未来24小时内市区将出现37度以上的高温天气，请做好防范。。周家斌在市委常委会（扩大）会议暨传达学习自治区第十二次党代会精神大会上强调 把学习贯彻十九届六中全会精神与党代会精神有机结合 推动打造世界级旅游城市取得实实在在的成效 李楚陈丽华出席。【桂林日报讯】（记者周绍瑜）12月3日，市委常委会（扩大）会议暨传达学习自治区第十二次党代会精神大会召开，深入学习贯彻党的十九届六中全会精神，传达学习自治区第十二次党代会精神，动员全市各级党组织和广大党员，结合桂林实际，把大会精神学习宣传好、贯彻落实好。市委书记周家斌主持大会并讲话，强调要切实提高政治站位，把学习贯彻党的十九届六中全会精神、自治区第十二次党代会精神有机结合起来，全力打造桂林世界级旅游城市，为奋力谱写建设新时代中国特色社会主义壮美广西的桂林新篇章作出新的更大贡献。市委副书记、市长李楚，市政协主席陈丽华出席大会。。周家斌指出，自治区第十二次党代会是在与全国同步全面建成小康社会之后，开启全面建设社会主义现代化广西新征程的大会，是动员全区广大党员、干部群众凝心聚力建设新时代中国特色社会主义壮美广西的大会，是全区各族人民政治生活中的一件大事喜事盛事。大会精神主要体现在刘宁书记所作的题为《牢记领袖嘱托 勇担历史使命 凝心聚力建设新时代中国特色社会主义壮美广西》的报告中。报告实事求是地对自治区第十一次党代会以来的工作进行了回顾和总结，客观分析了当前的形势与任务、机遇与挑战，科学阐述了为什么建设、建设什么样的和怎样建设新时代中国特色社会主义壮美广西的目标内涵要义，系统谋划了我区未来五年和今后一个时期凝心聚力建设新时代中国特色社会主义壮美广西的工作思路、总体要求、奋斗目标、战略任务和重大举措，形成了建设壮美广西“1+1+4+3+N”的目标任务体系。。周家斌指出，学习宣传贯彻党的十九届六中全会精神，是当前和今后一个时期的重大政治任务。要深刻认识党的十九届六中全会的重大意义，准确把握全会精神的丰富内涵和核心要义。深刻领会总结党的百年奋斗重大成就和历史经验的重大意义，深刻领会党的百年奋斗的初心使命和重大成就，深刻领会中国特色社会主义进入新时代的历史性成就和历史性变革，深刻领会党的百年奋斗历史经验，深刻领会以史为鉴、开创未来的重要要求。。周家斌强调，各级各部门要切实提高政治站位，把学习贯彻党的十九届六中全会精神、自治区第十二次党代会精神有机结合起来，精心部署、周密安排，掀起学习宣传贯彻大会精神热潮。扎实做好学习宣传贯彻工作，精心组织学习培训，广泛开展集中宣讲，深入开展宣传阐释工作。扎实做好任务分解落实工作，加强组织领导，健全推进机制，强化督促检查。扎实做好工作谋划，对照党的十九届六中全会精神，对照自治区第十二次党代会部署，尤其是对桂林工作要求，进一步明确为什么打造、怎么打造、打造成怎么样的世界级旅游城市。坚持“政策为大、项目为王、环境为本、创新为要”，全面梳理打造世界级旅游城市重大事项、重大项目，以及需要中央和自治区支持的重大政策。要与加快实施“十四五”规划结合起来，系统谋划明年工作，确保早部署早安排早起步，推动打造世界级旅游城市取得实实在在的成效。。会议采用电视电话会议形式召开，市设主会场，各县（市、区）设分会场。市四家班子领导成员，市检察院检察长，其他厅级领导，副厅级以上离退休老干部代表，在桂林的党的十九大代表，市直各单位主要负责同志在主会场参加会议。,其他,0.6644037303922231,True
210,广西省,桂林市,刘小明在我市调研时强调始终牢记习近平总书记嘱托扬鞭奋蹄建设世界级旅游城市周家斌陪同,2021-11-12,http://www.guilin.gov.cn/ywdt/zwdt/202111/t20211112_2163792.shtml,桂林市气象台13日9时50分继续发布高温橙色预警信号：预计未来24小时内市区将出现37度以上的高温天气，请做好防范。。刘小明在我市调研时强调 始终牢记习近平总书记嘱托 扬鞭奋蹄建设世界级旅游城市 周家斌陪同。【桂林日报讯】（记者周绍瑜）11月9日至10日，自治区党委副书记刘小明到我市开展党史学习教育，就漓江生态环境保护、乡村振兴和科教振兴等工作进行调研。他强调，要深入学习贯彻习近平生态文明思想和习近平总书记视察广西“4·27”重要讲话精神，特别是关于打造世界级旅游城市的重要指示要求，深入践行“两山”理念，全力以赴保护漓江、保护桂林山水，全面推进乡村振兴，奋力走出一条产业兴、生态美、百姓富的绿色发展之路。市委书记周家斌陪同。。在兴安红军长征突破湘江纪念碑园、光华铺烈士陵园，刘小明向红军烈士敬献花篮和鲜花，深切缅怀先辈的丰功伟绩。来到湘江战役中央纵队界首渡江遗址公园、红军堂、红军街，重走红军路，感悟伟大的长征精神。刘小明强调，要把即将胜利闭幕的党的十九届六中全会精神作为下一阶段学习重点，不断加强党的创新理论学习，进一步巩固扩大“我为群众办实事”实践活动成果成效，推动党史学习教育走深走实。。刘小明现场考察了兴安灵渠、灵渠展示中心，深入阳朔察看漓江生态环境保护情况和遇龙河生态环境整治情况，调研农文旅融合和田园综合体建设情况，对桂林市生态保护成效予以充分肯定。他强调，要坚持在发展中保护，在保护中发展，扬鞭奋蹄建设世界级旅游城市，不辜负习近平总书记的关心厚爱和人民群众的期待。要擘画好农业强、农民富、农村美的乡村振兴画卷，依托优势、突出特色，高标准高质量打造全域旅游升级版，引导百姓端好绿色“金饭碗”，切实把“绿水青山”变为“金山银山”。。在桂林电子科技大学，刘小明详细了解学校科技创新、思政教育和服务地方发展等情况，并主持召开座谈会，共同研究产学研用深度融合文章推动学校高质量发展。,桂林市气象台13日9时50分继续发布高温橙色预警信号：预计未来24小时内市区将出现37度以上的高温天气，请做好防范。。刘小明在我市调研时强调 始终牢记习近平总书记嘱托 扬鞭奋蹄建设世界级旅游城市 周家斌陪同。【桂林日报讯】（记者周绍瑜）11月9日至10日，自治区党委副书记刘小明到我市开展党史学习教育，就漓江生态环境保护、乡村振兴和科教振兴等工作进行调研。他强调，要深入学习贯彻习近平生态文明思想和习近平总书记视察广西“4·27”重要讲话精神，特别是关于打造世界级旅游城市的重要指示要求，深入践行“两山”理念，全力以赴保护漓江、保护桂林山水，全面推进乡村振兴，奋力走出一条产业兴、生态美、百姓富的绿色发展之路。市委书记周家斌陪同。。在兴安红军长征突破湘江纪念碑园、光华铺烈士陵园，刘小明向红军烈士敬献花篮和鲜花，深切缅怀先辈的丰功伟绩。来到湘江战役中央纵队界首渡江遗址公园、红军堂、红军街，重走红军路，感悟伟大的长征精神。刘小明强调，要把即将胜利闭幕的党的十九届六中全会精神作为下一阶段学习重点，不断加强党的创新理论学习，进一步巩固扩大“我为群众办实事”实践活动成果成效，推动党史学习教育走深走实。。刘小明现场考察了兴安灵渠、灵渠展示中心，深入阳朔察看漓江生态环境保护情况和遇龙河生态环境整治情况，调研农文旅融合和田园综合体建设情况，对桂林市生态保护成效予以充分肯定。他强调，要坚持在发展中保护，在保护中发展，扬鞭奋蹄建设世界级旅游城市，不辜负习近平总书记的关心厚爱和人民群众的期待。要擘画好农业强、农民富、农村美的乡村振兴画卷，依托优势、突出特色，高标准高质量打造全域旅游升级版，引导百姓端好绿色“金饭碗”，切实把“绿水青山”变为“金山银山”。。在桂林电子科技大学，刘小明详细了解学校科技创新、思政教育和服务地方发展等情况，并主持召开座谈会，共同研究产学研用深度融合文章推动学校高质量发展。,政府领导到其他城市考察学习或访问,0.0,True
