code,province,city,topic,date,url,content,content.1,label,score,is_match
211,广西省,梧州市,市政府党组扩大会议召开,2024-07-02,http://www.wuzhou.gov.cn/zjwz/zwdt_1/zwxx/t18633147.shtml,7月1日，市长、市政府党组书记李振品主持召开市政府党组（扩大）会议，传达学习习近平总书记近期重要讲话精神，以及中央、自治区有关会议和文件精神，研究贯彻落实措施。。会议强调，要深入学习贯彻习近平总书记在中央全面深化改革委员会第五次会议上的重要讲话精神，持续推动现代企业制度改革，深入实施国有企业改革深化行动，进一步鼓励引导民营企业改革创新，提升核心竞争力。要大力推进高标准农田建设、农机设备更新等工作，健全种粮农民收益保障机制，坚决扛稳粮食安全政治责任。要加强科技创新开放合作，积极对接大湾区等优质科创资源，围绕我市不锈钢、建筑陶瓷、医药食品等重点产业做好创新链布局，推动创新链、产业链、人才链深度融合。。会议要求，要深入学习贯彻习近平总书记在中央政治局会议上的重要讲话精神和有关文件精神，认真贯彻落实新时代党的建设总要求，坚决扛起管党治党政治责任，坚定拥护。“两个确立”、坚决做到“两个维护”。要提高全面从严治党的系统化体系化水平，认真落实清廉广西建设梧州行动各项部署要求，结合党纪学习教育，充分激发党员干部干事创业积极性主动性创造性。。会议强调，要认真学习贯彻习近平总书记在青海和宁夏考察时的重要讲话精神，立足梧州实际抓好落实。要坚定不移推进高质量发展，抓好工业振兴、六堡茶产业、靶向招商等重点工作，全力做好强产业文章。要深入开展民族团结进步工作，持续擦亮全国民族团结进步示范市的金字招牌，以民族团结进步事业助力打造。“一极三城”建设“四个梧州”。要全力办好为民办实事十大工程，尤其要抓好当前我市灾后恢复工作，帮助群众尽快恢复生产生活秩序。。会议要求，要深入学习贯彻广西新时代学校思政课建设推进会精神，坚持用习近平新时代中国特色社会主义思想铸魂育人，全面贯彻党的教育方针，深挖用好梧州红色资源，激发思政课教师队伍内生动力，深入推进大学、中学、小学思政课一体化建设，不断开创我市新时代思政课建设新局面。。会议要求，要加强靶向招商力度，深化招商引资方式，以面向大湾区为招商重点，围绕产业园区的产业布局和延长产业链抓招商，推动更多项目落地见效。要健全体制机制，加强与上级汇报对接，抢抓政策机遇，用好用足自治区细化落实的各项政策措施，务实高效推动项目招商建设，不断增强经济发展后劲。（甘沁雨）,7月1日，市长、市政府党组书记李振品主持召开市政府党组（扩大）会议，传达学习习近平总书记近期重要讲话精神，以及中央、自治区有关会议和文件精神，研究贯彻落实措施。。会议强调，要深入学习贯彻习近平总书记在中央全面深化改革委员会第五次会议上的重要讲话精神，持续推动现代企业制度改革，深入实施国有企业改革深化行动，进一步鼓励引导民营企业改革创新，提升核心竞争力。要大力推进高标准农田建设、农机设备更新等工作，健全种粮农民收益保障机制，坚决扛稳粮食安全政治责任。要加强科技创新开放合作，积极对接大湾区等优质科创资源，围绕我市不锈钢、建筑陶瓷、医药食品等重点产业做好创新链布局，推动创新链、产业链、人才链深度融合。。会议要求，要深入学习贯彻习近平总书记在中央政治局会议上的重要讲话精神和有关文件精神，认真贯彻落实新时代党的建设总要求，坚决扛起管党治党政治责任，坚定拥护。“两个确立”、坚决做到“两个维护”。要提高全面从严治党的系统化体系化水平，认真落实清廉广西建设梧州行动各项部署要求，结合党纪学习教育，充分激发党员干部干事创业积极性主动性创造性。。会议强调，要认真学习贯彻习近平总书记在青海和宁夏考察时的重要讲话精神，立足梧州实际抓好落实。要坚定不移推进高质量发展，抓好工业振兴、六堡茶产业、靶向招商等重点工作，全力做好强产业文章。要深入开展民族团结进步工作，持续擦亮全国民族团结进步示范市的金字招牌，以民族团结进步事业助力打造。“一极三城”建设“四个梧州”。要全力办好为民办实事十大工程，尤其要抓好当前我市灾后恢复工作，帮助群众尽快恢复生产生活秩序。。会议要求，要深入学习贯彻广西新时代学校思政课建设推进会精神，坚持用习近平新时代中国特色社会主义思想铸魂育人，全面贯彻党的教育方针，深挖用好梧州红色资源，激发思政课教师队伍内生动力，深入推进大学、中学、小学思政课一体化建设，不断开创我市新时代思政课建设新局面。。会议要求，要加强靶向招商力度，深化招商引资方式，以面向大湾区为招商重点，围绕产业园区的产业布局和延长产业链抓招商，推动更多项目落地见效。要健全体制机制，加强与上级汇报对接，抢抓政策机遇，用好用足自治区细化落实的各项政策措施，务实高效推动项目招商建设，不断增强经济发展后劲。（甘沁雨）,其他,0.5911328648942409,True
211,广西省,梧州市,李振品会见中国金属学会理事长张晓刚一行,2024-07-03,http://www.wuzhou.gov.cn/zjwz/zwdt_1/jrwz/t18639529.shtml,7月2日，市长李振品在南宁会见中国金属学会理事长张晓刚一行，双方就加强沟通合作、推动项目落地等方面进行深入交流。。李振品首先转达市委主要领导的亲切问候，感谢中国金属学会一直以来对梧州发展的大力支持，并介绍了梧州经济社会和产业发展有关情况。他表示，梧州地处广西广东交界，毗邻粤港澳大湾区，交通便利发达，历史文化底蕴深厚，产业基础厚实，为高端金属新材料、再生资源等产业的发展创造了良好条件。当前，梧州市深入学习贯彻习近平总书记关于广西工作论述的重要要求，坚持产业优先发展，大力推进工业振兴，加快培育新质生产力，壮大发展新动能，推动再生资源、高端金属新材料、建筑材料、食品医药和光伏电子等五大支柱产业集群发展，全市经济保持稳健向好态势，多项经济指标位居全区前列。特别是我市永达、翅冀等重点工业企业，始终坚持绿色低碳转型和节能降碳改造，工艺技术先进，发展势头强劲，已成为全市经济高质量发展的“压舱石”。中国金属学会是冶金材料领域最具影响力的学术性科技组织，是党和政府联系冶金科技工作者的桥梁和纽带，是推动我国冶金科学技术事业的重要力量，在发展冶金材料方面发挥了突出作用，与我市高端金属新材料、再生资源、新能源产业发展需求高度契合，双方合作前景广阔。希望学会发挥自身优势，推荐更多有实力的金属深加工头部企业入驻梧州，助力我市产业延链补链强链，促成学会年会及专业论坛在梧举办。同时，诚邀学会各位企业家、专家、学者到梧州考察洽谈，推动梧州高端金属新材料产业协同创新中心等项目早日落地见效。。张晓刚表示，梧州高端金属新材料产业集群优势明显，具有较强市场竞争力。中国金属学会将积极发挥资源优势，深化与梧州的合作共建，做好项目规划布局，以市场为导向，在人才技术、产业升级、装备改造、企业管理等方面给予梧州更多支持，共同致力于打造梧州高端金属新材料产业协同创新中心，为梧州经济高质量发展贡献力量。,7月2日，市长李振品在南宁会见中国金属学会理事长张晓刚一行，双方就加强沟通合作、推动项目落地等方面进行深入交流。。李振品首先转达市委主要领导的亲切问候，感谢中国金属学会一直以来对梧州发展的大力支持，并介绍了梧州经济社会和产业发展有关情况。他表示，梧州地处广西广东交界，毗邻粤港澳大湾区，交通便利发达，历史文化底蕴深厚，产业基础厚实，为高端金属新材料、再生资源等产业的发展创造了良好条件。当前，梧州市深入学习贯彻习近平总书记关于广西工作论述的重要要求，坚持产业优先发展，大力推进工业振兴，加快培育新质生产力，壮大发展新动能，推动再生资源、高端金属新材料、建筑材料、食品医药和光伏电子等五大支柱产业集群发展，全市经济保持稳健向好态势，多项经济指标位居全区前列。特别是我市永达、翅冀等重点工业企业，始终坚持绿色低碳转型和节能降碳改造，工艺技术先进，发展势头强劲，已成为全市经济高质量发展的“压舱石”。中国金属学会是冶金材料领域最具影响力的学术性科技组织，是党和政府联系冶金科技工作者的桥梁和纽带，是推动我国冶金科学技术事业的重要力量，在发展冶金材料方面发挥了突出作用，与我市高端金属新材料、再生资源、新能源产业发展需求高度契合，双方合作前景广阔。希望学会发挥自身优势，推荐更多有实力的金属深加工头部企业入驻梧州，助力我市产业延链补链强链，促成学会年会及专业论坛在梧举办。同时，诚邀学会各位企业家、专家、学者到梧州考察洽谈，推动梧州高端金属新材料产业协同创新中心等项目早日落地见效。。张晓刚表示，梧州高端金属新材料产业集群优势明显，具有较强市场竞争力。中国金属学会将积极发挥资源优势，深化与梧州的合作共建，做好项目规划布局，以市场为导向，在人才技术、产业升级、装备改造、企业管理等方面给予梧州更多支持，共同致力于打造梧州高端金属新材料产业协同创新中心，为梧州经济高质量发展贡献力量。,政府领导到其他城市考察学习或访问,0.0,True
211,广西省,梧州市,二二四年全区万企兴万村行动现场推进会在我市召开,2024-07-12,http://www.wuzhou.gov.cn/zjwz/zwdt_1/jrwz/t18686672.shtml,7月11日，2024年全区“万企兴万村”行动现场推进会在我市召开。自治区副主席、自治区工商联主席眭国华，全国工商联社会服务部副部长郭锋出席会议并讲话，市长李振品出席会议并致辞。自治区党委统战部副部长、自治区工商联党组书记雷永达主持会议。。眭国华强调，“万企兴万村”是助推中国式现代化、践行共同富裕理念的积极探索和实践。全区各地各部门要提高政治站位，在增强“万企兴万村”工作质效上下功夫、见成效，按照全国工商联和自治区党委、政府的工作部署，强化责任担当，凝聚多方合力，推进工作落实，推动全区“万企兴万村”迈上新台阶。要聚力建设铸牢中华民族共同体意识示范区，在持续擦亮“万企兴万村”行动品牌效应上下功夫、见实效，大力开展回报家乡专项行动，促进民营企业回乡投资兴业；做大做强乡村产业，增强乡村自身的造血功能；积极培育壮大特色品牌建设，实施现代农业品牌强农战略；坚持“万企兴万村”树典型、立标杆行动，鼓励更多民营企业参与。要强化服务保障，在促进民营经济发展壮大上下功夫、见成效，建立高效工作机制，做好政策宣传指引，强化金融服务支持，助力企业跨越发展，实现双赢。希望广大企业家互学互鉴，继续为广西乡村振兴作出新的更大贡献。。郭锋指出，“万企兴万村”行动启动以来，全国各地大力推进，民营企业积极参与，工作方法基本成型，参与途径不断创新，广西行动成效显著，为兄弟省市提供了宝贵经验，为全国行动增添新动力。下一步，各地要持续开展“万企兴万村”行动，深入开展调查研究，进一步优化行动做法，做好典型宣传引导。。李振品在致辞中说，近年来，在自治区党委、政府坚强领导下，梧州市深入学习贯彻习近平总书记关于广西工作论述的重要要求，全面落实自治区党委、政府关于全面推进乡村振兴的重要部署，以“万企兴万村”行动为重要抓手，发动全市3392家民营企业参与“万企兴万村”行动。希望大家以本次会议为平台，积极分享“万企兴万村”行动的好经验、好做法，为乡村振兴事业提出更多前瞻性、多样性、建设性的意见和建议，共同谱写“万企兴万村”行动新篇章。。雷永达充分肯定梧州市在“万企兴万村”行动中抓运行机制、抓产业发展、抓综合服务的做法，要求各有关部门认真传达学习本次会议精神，加强沟通协作，推进“万企兴万村”行动各方共同参与、协同发力，全面提升工作实效。。会上，自治区农业农村厅副厅长刘康、自治区工商联副主席韦永山，市委常委、统战部部长何世恰分别发言；市、县、乡和金融机构、民营企业、商会代表分别发言。与会领导为“万企兴万村”行动优秀代表授牌。。会议召开前，与会领导、民营企业家还到梧州甜蜜家蜂业有限公司、苍梧县六堡镇黑石山茶厂参观考察。。副市长杨桢，自治区各金融机构，全区14个设区市工商联、农业农村局等部门负责人参加活动。（朱元冬）,7月11日，2024年全区“万企兴万村”行动现场推进会在我市召开。自治区副主席、自治区工商联主席眭国华，全国工商联社会服务部副部长郭锋出席会议并讲话，市长李振品出席会议并致辞。自治区党委统战部副部长、自治区工商联党组书记雷永达主持会议。。眭国华强调，“万企兴万村”是助推中国式现代化、践行共同富裕理念的积极探索和实践。全区各地各部门要提高政治站位，在增强“万企兴万村”工作质效上下功夫、见成效，按照全国工商联和自治区党委、政府的工作部署，强化责任担当，凝聚多方合力，推进工作落实，推动全区“万企兴万村”迈上新台阶。要聚力建设铸牢中华民族共同体意识示范区，在持续擦亮“万企兴万村”行动品牌效应上下功夫、见实效，大力开展回报家乡专项行动，促进民营企业回乡投资兴业；做大做强乡村产业，增强乡村自身的造血功能；积极培育壮大特色品牌建设，实施现代农业品牌强农战略；坚持“万企兴万村”树典型、立标杆行动，鼓励更多民营企业参与。要强化服务保障，在促进民营经济发展壮大上下功夫、见成效，建立高效工作机制，做好政策宣传指引，强化金融服务支持，助力企业跨越发展，实现双赢。希望广大企业家互学互鉴，继续为广西乡村振兴作出新的更大贡献。。郭锋指出，“万企兴万村”行动启动以来，全国各地大力推进，民营企业积极参与，工作方法基本成型，参与途径不断创新，广西行动成效显著，为兄弟省市提供了宝贵经验，为全国行动增添新动力。下一步，各地要持续开展“万企兴万村”行动，深入开展调查研究，进一步优化行动做法，做好典型宣传引导。。李振品在致辞中说，近年来，在自治区党委、政府坚强领导下，梧州市深入学习贯彻习近平总书记关于广西工作论述的重要要求，全面落实自治区党委、政府关于全面推进乡村振兴的重要部署，以“万企兴万村”行动为重要抓手，发动全市3392家民营企业参与“万企兴万村”行动。希望大家以本次会议为平台，积极分享“万企兴万村”行动的好经验、好做法，为乡村振兴事业提出更多前瞻性、多样性、建设性的意见和建议，共同谱写“万企兴万村”行动新篇章。。雷永达充分肯定梧州市在“万企兴万村”行动中抓运行机制、抓产业发展、抓综合服务的做法，要求各有关部门认真传达学习本次会议精神，加强沟通协作，推进“万企兴万村”行动各方共同参与、协同发力，全面提升工作实效。。会上，自治区农业农村厅副厅长刘康、自治区工商联副主席韦永山，市委常委、统战部部长何世恰分别发言；市、县、乡和金融机构、民营企业、商会代表分别发言。与会领导为“万企兴万村”行动优秀代表授牌。。会议召开前，与会领导、民营企业家还到梧州甜蜜家蜂业有限公司、苍梧县六堡镇黑石山茶厂参观考察。。副市长杨桢，自治区各金融机构，全区14个设区市工商联、农业农村局等部门负责人参加活动。（朱元冬）,其他,0.6622218310587051,True
211,广西省,梧州市,李振品主持召开市十五届人民政府第次常务会议,2024-05-09,http://www.wuzhou.gov.cn/zfxxgk_2/fdzdgknr/zfhy/szfcwhy/t18400365.shtml,5月8日，市长李振品主持召开市十五届人民政府第53次常务会议，传达学习习近平总书记近期重要讲话重要指示精神，以及中央、国务院和自治区有关文件精神，听取有关工作汇报，研究贯彻落实措施。。会议强调，要深入贯彻落实习近平总书记在重庆考察时的重要讲话和在新时代推动西部大开发座谈会上的重要讲话精神，把握重点任务，主动服务和融入国家发展战略，全力以赴推动大保护、大开发、高质量发展。要围绕。“再造一个工业梧州”奋斗目标，大力推动重点产业集聚发展，因地制宜发展新质生产力，加快建设现代化产业体系。要持续筑牢生态安全屏障，加快推进绿色低碳发展，全面推进美丽梧州建设。要以大开放促进大开发，全力打造粤港澳大湾区重要战略腹地先行区，服务粤港澳大湾区的战略承载地，吸引大湾区产业转移的集聚地，服务大湾区客源的旅游目的地等“一区三地”。要统筹推进新型城镇化和乡村全面振兴，加快补齐县城基础设施和公共服务短板，在发展中保障和改善民生。。会议要求，要深入贯彻落实习近平总书记对广东梅州市梅大高速茶阳路段塌方灾害作出的重要指示精神，全面落实李强总理批示要求，按照自治区党委、政府和市委部署，压实各级领导干部。“包保”责任，确保各项防范措施落实到位。要进一步强化监测预报预警和重点领域防御，紧盯风险变化，加强会商研判，提前、广泛发布预警信息，切实做好强降雨天气过程中在建工程、危险化学品和矿山企业、旅游景区、农业生产等安全防范工作。要进一步强化值班值守人员转移避险和抢险救灾，严格落实临灾预警“叫应”机制，确保预警信息到村、到户、到人。要常态化开展防灾减灾宣传教育和自救互救技能培训，持续提升公众应急避险和自救互救能力。。会议强调，要充分认识全面清理规范专家参与公共决策事项工作的重要意义，深入贯彻落实国家、自治区的部署和要求，准确把握工作重点和时间节点，加强统筹协调和部门联动，按时按质完成相关管理制度修订及专家库调整完善等工作，严格规范专家参与各级公共决策的情形。。会议审议并原则通过《梧州市水网建设规划》，强调要加大灌区工程建设力度，切实发挥工程的民生效益、生态效益、经济效益和社会效益，为梧州经济社会高质量发展提供安全用水保障和水运支撑。,5月8日，市长李振品主持召开市十五届人民政府第53次常务会议，传达学习习近平总书记近期重要讲话重要指示精神，以及中央、国务院和自治区有关文件精神，听取有关工作汇报，研究贯彻落实措施。。会议强调，要深入贯彻落实习近平总书记在重庆考察时的重要讲话和在新时代推动西部大开发座谈会上的重要讲话精神，把握重点任务，主动服务和融入国家发展战略，全力以赴推动大保护、大开发、高质量发展。要围绕。“再造一个工业梧州”奋斗目标，大力推动重点产业集聚发展，因地制宜发展新质生产力，加快建设现代化产业体系。要持续筑牢生态安全屏障，加快推进绿色低碳发展，全面推进美丽梧州建设。要以大开放促进大开发，全力打造粤港澳大湾区重要战略腹地先行区，服务粤港澳大湾区的战略承载地，吸引大湾区产业转移的集聚地，服务大湾区客源的旅游目的地等“一区三地”。要统筹推进新型城镇化和乡村全面振兴，加快补齐县城基础设施和公共服务短板，在发展中保障和改善民生。。会议要求，要深入贯彻落实习近平总书记对广东梅州市梅大高速茶阳路段塌方灾害作出的重要指示精神，全面落实李强总理批示要求，按照自治区党委、政府和市委部署，压实各级领导干部。“包保”责任，确保各项防范措施落实到位。要进一步强化监测预报预警和重点领域防御，紧盯风险变化，加强会商研判，提前、广泛发布预警信息，切实做好强降雨天气过程中在建工程、危险化学品和矿山企业、旅游景区、农业生产等安全防范工作。要进一步强化值班值守人员转移避险和抢险救灾，严格落实临灾预警“叫应”机制，确保预警信息到村、到户、到人。要常态化开展防灾减灾宣传教育和自救互救技能培训，持续提升公众应急避险和自救互救能力。。会议强调，要充分认识全面清理规范专家参与公共决策事项工作的重要意义，深入贯彻落实国家、自治区的部署和要求，准确把握工作重点和时间节点，加强统筹协调和部门联动，按时按质完成相关管理制度修订及专家库调整完善等工作，严格规范专家参与各级公共决策的情形。。会议审议并原则通过《梧州市水网建设规划》，强调要加大灌区工程建设力度，切实发挥工程的民生效益、生态效益、经济效益和社会效益，为梧州经济社会高质量发展提供安全用水保障和水运支撑。,其他,0.7754688208685853,True
