code,province,city,topic,date,url,content,content.1,label,score,is_match,是否为“学习考察”新闻
51,吉林省,辽源市,市文广新局赴绍兴取经,2018-05-31,http://www.liaoyuan.gov.cn/xxgk/dtxw/zwlb/bmgz/201805/t20180531_309123.html,市标图案以“辽”字为主创元素，用狂草手法演变出“旭日初升、祥龙飞天、神鹿跳跃、辽水奔腾”的形态造型，巧妙蕴含了龙山、辽水、鹿乡等辽源元素，寓意辽源充满活力、充满希望、蒸蒸日上，充分体现了“皇家鹿苑”、“东辽河畔明珠”厚重的历史文化底蕴和现代化城市魅力，展现出辽源人豪迈大气，敢为人先，创新发展，勇于开拓，阔步迈向未来的时代精神。 整个市标简洁明快、动感十足、色彩标准采用红黄绿蓝渐变成五彩图腾，分别代表“五城辽源”，勾勒出辽源天蓝、日丽、水碧、山青的美丽画卷。。近日，市文广新局组织相关人员组成学习考察团赴绍兴市开展对接交流，与对口文化部门谋划合作推进事宜，通过主动对接、培训取经，推动我市文化事业、文化产业高质量发展。。考察团一行先后学习考察了绍兴市著名的伟丰文化创意产业园、绍兴市大剧院、绍兴市博物馆、绍兴市书圣故里、绍兴市奥体中心等处。绍兴市完善的公共文化设施，形式多样的文化惠民服务，丰富多彩的文化惠民活动，成果丰硕的舞台文艺事业，成效显著的文化遗产保护和融合发展的文化旅游产业，让考察团成员深切感受到推动辽源文化事业、文化产业加快发展，必须要解放思想、更新观念，做好重点工作，聚焦高质量发展，助推我市绿色转型振兴。。考察期间，市文广新局与绍兴市文广局签订了《辽源—绍兴文化交流合作协议书》。双方在共同建立对口合作机制，积极开展文化产业交流与合作、舞台文艺精品互演，积极开展历史文化资源保护、利用工作交流与合作等方面达成合作协议。,市标图案以“辽”字为主创元素，用狂草手法演变出“旭日初升、祥龙飞天、神鹿跳跃、辽水奔腾”的形态造型，巧妙蕴含了龙山、辽水、鹿乡等辽源元素，寓意辽源充满活力、充满希望、蒸蒸日上，充分体现了“皇家鹿苑”、“东辽河畔明珠”厚重的历史文化底蕴和现代化城市魅力，展现出辽源人豪迈大气，敢为人先，创新发展，勇于开拓，阔步迈向未来的时代精神。 整个市标简洁明快、动感十足、色彩标准采用红黄绿蓝渐变成五彩图腾，分别代表“五城辽源”，勾勒出辽源天蓝、日丽、水碧、山青的美丽画卷。。近日，市文广新局组织相关人员组成学习考察团赴绍兴市开展对接交流，与对口文化部门谋划合作推进事宜，通过主动对接、培训取经，推动我市文化事业、文化产业高质量发展。。考察团一行先后学习考察了绍兴市著名的伟丰文化创意产业园、绍兴市大剧院、绍兴市博物馆、绍兴市书圣故里、绍兴市奥体中心等处。绍兴市完善的公共文化设施，形式多样的文化惠民服务，丰富多彩的文化惠民活动，成果丰硕的舞台文艺事业，成效显著的文化遗产保护和融合发展的文化旅游产业，让考察团成员深切感受到推动辽源文化事业、文化产业加快发展，必须要解放思想、更新观念，做好重点工作，聚焦高质量发展，助推我市绿色转型振兴。。考察期间，市文广新局与绍兴市文广局签订了《辽源—绍兴文化交流合作协议书》。双方在共同建立对口合作机制，积极开展文化产业交流与合作、舞台文艺精品互演，积极开展历史文化资源保护、利用工作交流与合作等方面达成合作协议。,其他,0.6095407744459389,False,否
51,吉林省,辽源市,开展科技培训助推辽源市棚室经济发展,2015-07-21,http://agri.jl.gov.cn/xwfb/sxyw/201507/t20150721_4704647.html,2015年7月9-15日，辽源市农民科技教育中心在辽源市开发区向阳村举办了新型职业农民培育工程棚室经济培训班，向阳村和建新村共50名棚室蔬菜种植户参加了培训。受训大户棚室面积达到5.6万平方米。此次培训目的是为了推进现代化农业发展，转变农业发展方式，切实为农民朋友办好事、办实事，让广大的棚室蔬菜种植户通过发展棚室经济实现增收致富。。此次培训共分三个阶段，分别是七天室内理论课教学、八天参观学习考察和现场实训、两年跟踪服务，对农户发展棚室蔬菜种植进行理论讲解、经验传授、现场指导。 为了提升培训质量，培训班邀请了省、市、县各级农业专家，专家们针对温室蔬菜从品种选择、栽培技术、肥水管理、病虫害防治、市场前景等几方面进行讲授，并对草莓、葡萄、食用菌等常见品种进行了拓展培训。。参训学员纷纷表示，此次培训内容贴近实际，解答具体，既解决了生产中的难题，又开阔了视野，有信心把棚室蔬菜事业做大做强。。目前，本次培训集中理论学习已结束，50名学员全部按照省校培训方案完成了学习任务，并通过结业考试。下一步，将在8～10月份组织学员们深入到山东寿光市蔬菜高科技示范园等棚室生产示范基地学习考察。,2015年7月9-15日，辽源市农民科技教育中心在辽源市开发区向阳村举办了新型职业农民培育工程棚室经济培训班，向阳村和建新村共50名棚室蔬菜种植户参加了培训。受训大户棚室面积达到5.6万平方米。此次培训目的是为了推进现代化农业发展，转变农业发展方式，切实为农民朋友办好事、办实事，让广大的棚室蔬菜种植户通过发展棚室经济实现增收致富。。此次培训共分三个阶段，分别是七天室内理论课教学、八天参观学习考察和现场实训、两年跟踪服务，对农户发展棚室蔬菜种植进行理论讲解、经验传授、现场指导。 为了提升培训质量，培训班邀请了省、市、县各级农业专家，专家们针对温室蔬菜从品种选择、栽培技术、肥水管理、病虫害防治、市场前景等几方面进行讲授，并对草莓、葡萄、食用菌等常见品种进行了拓展培训。。参训学员纷纷表示，此次培训内容贴近实际，解答具体，既解决了生产中的难题，又开阔了视野，有信心把棚室蔬菜事业做大做强。。目前，本次培训集中理论学习已结束，50名学员全部按照省校培训方案完成了学习任务，并通过结业考试。下一步，将在8～10月份组织学员们深入到山东寿光市蔬菜高科技示范园等棚室生产示范基地学习考察。,其他,0.5960334357621473,False,否
51,吉林省,辽源市,我县召开农村人居环境整治座谈会,2019-06-11,http://www.dongfeng.gov.cn/jrdf/zwdt/201906/t20190611_381371.html,6月10日，市委副书记韩阳到我县就农村人居环境整治工作开展座谈，副县长杨鸿宝及各乡镇党委书记，村书记代表，市、县相关部门领导参加了座谈。。座谈中，与会人员结合本乡镇实际和赴梅河口市考察学习后的感受与心得做了交流发言。并就开展好下一步相关工作进行了交流探讨，提出了相应意见和建议。。市委副书记韩阳指出，农村人居环境整治是实现乡村振兴的第一仗，必须要打好，打胜！各乡镇、各部门要切增强责任感和紧迫感，层层传导压力，不断加大资金和精力投入，形成政府主导，百姓治理的长效机制。不断强化措施，着实举措，加快工作进度，做精做细，做出亮点，做出特色。。韩阳强调，整治行动的主体是农民群众。要带着农民干、做给农民看，充分发动群众、依靠群众，用实实在在的成效激发农民的积极性和主动性。要坚持实事求是，把好事办好，不搞过场、不搞形式，确保整治成效经得起实践、人民和历史的检验。同时，要不断加大宣传力度，形成浓厚的舆论氛围。各乡镇要总结好经验，树立好典型，要看先进、学先进，力争当农村人居环境整治工作的排头兵，为广大人民群众创造一个良好的生活环境。,6月10日，市委副书记韩阳到我县就农村人居环境整治工作开展座谈，副县长杨鸿宝及各乡镇党委书记，村书记代表，市、县相关部门领导参加了座谈。。座谈中，与会人员结合本乡镇实际和赴梅河口市考察学习后的感受与心得做了交流发言。并就开展好下一步相关工作进行了交流探讨，提出了相应意见和建议。。市委副书记韩阳指出，农村人居环境整治是实现乡村振兴的第一仗，必须要打好，打胜！各乡镇、各部门要切增强责任感和紧迫感，层层传导压力，不断加大资金和精力投入，形成政府主导，百姓治理的长效机制。不断强化措施，着实举措，加快工作进度，做精做细，做出亮点，做出特色。。韩阳强调，整治行动的主体是农民群众。要带着农民干、做给农民看，充分发动群众、依靠群众，用实实在在的成效激发农民的积极性和主动性。要坚持实事求是，把好事办好，不搞过场、不搞形式，确保整治成效经得起实践、人民和历史的检验。同时，要不断加大宣传力度，形成浓厚的舆论氛围。各乡镇要总结好经验，树立好典型，要看先进、学先进，力争当农村人居环境整治工作的排头兵，为广大人民群众创造一个良好的生活环境。,政府领导到其他城市考察学习或访问,0.0,True,是
51,吉林省,辽源市,辽源市多措并举助推七五普法工作,2016-08-31,http://sft.jl.gov.cn/jlspfw/fzxc/201608/t20160831_4563094.html,今年是“七五”普法开局之年，为认真贯彻落实党的十八届四中、五中全会和省委十届四次、五次全会精神，开展好全市普法依法治理工作，提高群众法治意识，辽源市依法治市办公室多措并举助推“七五”普法工作开好局、起好步。。一是对全市普法依法治理工作进行全面检查验收。从2015年12月份开始，市依法治市办公室对所辖2县3区及58家成员单位进行了“六五”普法工作的检查验收，并就全市“七五”普法的工作思路及方法进行了深入调研和广泛征求意见。。2015年12月份开始，市依法治市办公室对所辖2县3区及58家成员单位进行了“六五”普法工作的检查验收，并就全市“七五”普法的工作思路及方法进行了深入调研和广泛征求意见。。二是到外埠“六五”普法全国先进城市进行考察学习。今年5月，市依法治市办公室携县区依法治理办公室有关人员，到获得全国“六五”普法先进城市荣誉的宁夏回族自治区石嘴山市等五个城市进行了实地考察，学习其在法治宣传、法治文化、法治创建等方面的经验，结合本地实际提出改进措施，向市委、市政府提出了《关于加强依法治市工作的几点建议》。。5月，市依法治市办公室携县区依法治理办公室有关人员，到获得全国“六五”普法先进城市荣誉的。三是开展普法依法治理工作专题研讨。组织依法治市办公室全体工作人员针对当前全市普法依法治理工作及“七五”期间工作设想，开展专题研讨。研讨会结合《恪尽职守、拼搏进取，开创依法治市工作新局面》、《关于“七五”期间普法依法治理宣传工作的几点思考》等议题开展了深入研讨，明确了辽源市“七五”期间普法依法治理工作的总体思路和工作重点。。四是开展“法治宣传月”系列宣传活动。结合工作实际及法治宣传需求，在整个8月份，组织发动各县区依法治理办公室及全市各成员单位，以海报、板报、LED显示屏、宣传条幅等宣传形式，通过报刊、广播、电视以及各单位的微信、微博等宣传平台，全方位展示全市“六五”普法工作成果，与全市人民分享喜获“六五”普法全国先进城市殊荣，努力打造全民普法的新环境，为即将启动的“七五”普法营造了良好的社会氛围。。8月份，组织发动各县区依法治理办公室及全市各成员单位，以海报、板报、LED显示屏、宣传条幅等宣传形式，通过报刊、广播、电视以及各单位的微信、微博等宣传平台，全方位展示全市“六五”普法工作成果，与全市人民分享喜获“六五”普法全国先进城市殊荣，努力打造全民普法的新环境，为即将启动的“七五”普法营造了良好的社会氛围。。五是科学谋划“七五”普法工作。对于即将开展的“七五”普法，辽源市依法治市办公室提前谋划，确定了三项重点工作。推进“法律六进”示范点建设。打造一系列的“法治学校”、“法治企业”、“法治单位”等示范点，以点带面，促进全市普法工作。推进“法治文化”创建工作。力争“七五”期间建设一个“法治走廊”、一个“法治广场”、一个“法治公园”，营造全市法治深厚的法治氛围。建立健全依法治市考核机制。严格贯彻落实市委《关于全面推进依法治市的实施意见》，制定考核细则，实施年度考核并将依法治市工作纳入政府绩效考核。,今年是“七五”普法开局之年，为认真贯彻落实党的十八届四中、五中全会和省委十届四次、五次全会精神，开展好全市普法依法治理工作，提高群众法治意识，辽源市依法治市办公室多措并举助推“七五”普法工作开好局、起好步。。一是对全市普法依法治理工作进行全面检查验收。从2015年12月份开始，市依法治市办公室对所辖2县3区及58家成员单位进行了“六五”普法工作的检查验收，并就全市“七五”普法的工作思路及方法进行了深入调研和广泛征求意见。。2015年12月份开始，市依法治市办公室对所辖2县3区及58家成员单位进行了“六五”普法工作的检查验收，并就全市“七五”普法的工作思路及方法进行了深入调研和广泛征求意见。。二是到外埠“六五”普法全国先进城市进行考察学习。今年5月，市依法治市办公室携县区依法治理办公室有关人员，到获得全国“六五”普法先进城市荣誉的宁夏回族自治区石嘴山市等五个城市进行了实地考察，学习其在法治宣传、法治文化、法治创建等方面的经验，结合本地实际提出改进措施，向市委、市政府提出了《关于加强依法治市工作的几点建议》。。5月，市依法治市办公室携县区依法治理办公室有关人员，到获得全国“六五”普法先进城市荣誉的。三是开展普法依法治理工作专题研讨。组织依法治市办公室全体工作人员针对当前全市普法依法治理工作及“七五”期间工作设想，开展专题研讨。研讨会结合《恪尽职守、拼搏进取，开创依法治市工作新局面》、《关于“七五”期间普法依法治理宣传工作的几点思考》等议题开展了深入研讨，明确了辽源市“七五”期间普法依法治理工作的总体思路和工作重点。。四是开展“法治宣传月”系列宣传活动。结合工作实际及法治宣传需求，在整个8月份，组织发动各县区依法治理办公室及全市各成员单位，以海报、板报、LED显示屏、宣传条幅等宣传形式，通过报刊、广播、电视以及各单位的微信、微博等宣传平台，全方位展示全市“六五”普法工作成果，与全市人民分享喜获“六五”普法全国先进城市殊荣，努力打造全民普法的新环境，为即将启动的“七五”普法营造了良好的社会氛围。。8月份，组织发动各县区依法治理办公室及全市各成员单位，以海报、板报、LED显示屏、宣传条幅等宣传形式，通过报刊、广播、电视以及各单位的微信、微博等宣传平台，全方位展示全市“六五”普法工作成果，与全市人民分享喜获“六五”普法全国先进城市殊荣，努力打造全民普法的新环境，为即将启动的“七五”普法营造了良好的社会氛围。。五是科学谋划“七五”普法工作。对于即将开展的“七五”普法，辽源市依法治市办公室提前谋划，确定了三项重点工作。推进“法律六进”示范点建设。打造一系列的“法治学校”、“法治企业”、“法治单位”等示范点，以点带面，促进全市普法工作。推进“法治文化”创建工作。力争“七五”期间建设一个“法治走廊”、一个“法治广场”、一个“法治公园”，营造全市法治深厚的法治氛围。建立健全依法治市考核机制。严格贯彻落实市委《关于全面推进依法治市的实施意见》，制定考核细则，实施年度考核并将依法治市工作纳入政府绩效考核。,政府领导到其他城市考察学习或访问,0.5263784735602881,False,否
51,吉林省,辽源市,辽源市卫生健康委做大互联网健康医疗全面建立优质高效的数字化医疗卫生服务体系,2019-07-18,http://www.liaoyuan.gov.cn/xxgk/zwgkzdlyxx/ylws/ywgk/201907/t20190718_388027.html,市标图案以“辽”字为主创元素，用狂草手法演变出“旭日初升、祥龙飞天、神鹿跳跃、辽水奔腾”的形态造型，巧妙蕴含了龙山、辽水、鹿乡等辽源元素，寓意辽源充满活力、充满希望、蒸蒸日上，充分体现了“皇家鹿苑”、“东辽河畔明珠”厚重的历史文化底蕴和现代化城市魅力，展现出辽源人豪迈大气，敢为人先，创新发展，勇于开拓，阔步迈向未来的时代精神。 整个市标简洁明快、动感十足、色彩标准采用红黄绿蓝渐变成五彩图腾，分别代表“五城辽源”，勾勒出辽源天蓝、日丽、水碧、山青的美丽画卷。。为落实柴伟书记今年1月4日市委全会提出的“重点企业数字化研发设计工具普及率60%”以上目标，市卫生健康委积极响应，结合卫生健康领域做大“互联网+”。一是对周口、焦作、鄂尔多斯等城市信息化建设工作进行实地调研和学习考察，牵头制定了《辽源市促进互联网+医疗健康发展的实施方案》和《辽源市互联网+医疗健康便民惠民行动计划》，确定了5类20项重点任务加以推进。二是与国药控股股份有限公司进行合作，在医院信息集成平台建设、绩效管理系统建设、方便患者就医、提高支付水平等方面，利用智能诊断辅助系统提升辽源基层医疗服务能力和水平。三是与深圳市腾讯计算机系统有限公司合作全民健康信息平台项目，预计总投资1亿元，彻底解决我市卫生健康系统信息互联互通问题。四是与杭州联众医疗科技股份有限公司合作医疗影像云项目，预计总投资5000万元。五是启动我市二级及以上医院电子居民健康卡建设工作，市中心医院、市中医院和矿总院已完成应用环境改造和识别，并向全市二级以上医院推广。市中心医院作为全省第一批6家试点医院之一，在“全省医院就诊一卡通暨电子居民健康卡普及应用推进会”上做了经验介绍。下一步，将实现预约挂号、信息查询、移动支付一体化服务功能。。牵头制定了《辽源市促进互联网+医疗健康发展的实施方案》和《辽源市互联网+医疗健康便民惠民行动计划》，确定了5。医院信息集成平台建设、绩效管理系统建设、方便患者就医、提高支付水平等方面，利用智能诊断辅助系统提升。预计总投资1亿元，彻底解决我市卫生健康系统信息互联互通问题。四是与杭州联众医疗科技股份有限公司合作,市标图案以“辽”字为主创元素，用狂草手法演变出“旭日初升、祥龙飞天、神鹿跳跃、辽水奔腾”的形态造型，巧妙蕴含了龙山、辽水、鹿乡等辽源元素，寓意辽源充满活力、充满希望、蒸蒸日上，充分体现了“皇家鹿苑”、“东辽河畔明珠”厚重的历史文化底蕴和现代化城市魅力，展现出辽源人豪迈大气，敢为人先，创新发展，勇于开拓，阔步迈向未来的时代精神。 整个市标简洁明快、动感十足、色彩标准采用红黄绿蓝渐变成五彩图腾，分别代表“五城辽源”，勾勒出辽源天蓝、日丽、水碧、山青的美丽画卷。。为落实柴伟书记今年1月4日市委全会提出的“重点企业数字化研发设计工具普及率60%”以上目标，市卫生健康委积极响应，结合卫生健康领域做大“互联网+”。一是对周口、焦作、鄂尔多斯等城市信息化建设工作进行实地调研和学习考察，牵头制定了《辽源市促进互联网+医疗健康发展的实施方案》和《辽源市互联网+医疗健康便民惠民行动计划》，确定了5类20项重点任务加以推进。二是与国药控股股份有限公司进行合作，在医院信息集成平台建设、绩效管理系统建设、方便患者就医、提高支付水平等方面，利用智能诊断辅助系统提升辽源基层医疗服务能力和水平。三是与深圳市腾讯计算机系统有限公司合作全民健康信息平台项目，预计总投资1亿元，彻底解决我市卫生健康系统信息互联互通问题。四是与杭州联众医疗科技股份有限公司合作医疗影像云项目，预计总投资5000万元。五是启动我市二级及以上医院电子居民健康卡建设工作，市中心医院、市中医院和矿总院已完成应用环境改造和识别，并向全市二级以上医院推广。市中心医院作为全省第一批6家试点医院之一，在“全省医院就诊一卡通暨电子居民健康卡普及应用推进会”上做了经验介绍。下一步，将实现预约挂号、信息查询、移动支付一体化服务功能。。牵头制定了《辽源市促进互联网+医疗健康发展的实施方案》和《辽源市互联网+医疗健康便民惠民行动计划》，确定了5。医院信息集成平台建设、绩效管理系统建设、方便患者就医、提高支付水平等方面，利用智能诊断辅助系统提升。预计总投资1亿元，彻底解决我市卫生健康系统信息互联互通问题。四是与杭州联众医疗科技股份有限公司合作,其他,0.7836089895713987,False,否
