code,province,city,topic,date,url,content,content.1,label,score,is_match,是否为“学习考察”新闻
51,吉林省,辽源市,辽源市创新政务服务方式全面推行一窗受理集成服务改革,2018-02-12,http://www.liaoyuan.gov.cn/xxgk/tj/201802/t20180212_282968.html,市标图案以“辽”字为主创元素，用狂草手法演变出“旭日初升、祥龙飞天、神鹿跳跃、辽水奔腾”的形态造型，巧妙蕴含了龙山、辽水、鹿乡等辽源元素，寓意辽源充满活力、充满希望、蒸蒸日上，充分体现了“皇家鹿苑”、“东辽河畔明珠”厚重的历史文化底蕴和现代化城市魅力，展现出辽源人豪迈大气，敢为人先，创新发展，勇于开拓，阔步迈向未来的时代精神。 整个市标简洁明快、动感十足、色彩标准采用红黄绿蓝渐变成五彩图腾，分别代表“五城辽源”，勾勒出辽源天蓝、日丽、水碧、山青的美丽画卷。。新年伊始，辽源市把优化政务服务作为推进“放管服”改革的首要任务，紧紧围绕让群众和企业办事“最多跑一次”的政务服务目标，在全市和各县区创新实施“一窗受理、集成服务”改革，努力将辽源打造成全省办事效率最高、政务服务环境最优、办事群众最满意地区。。一是加强改革顶层设计。市政府从去年9月份开始，先后赴浙江、江苏两省考察学习“最多跑一次”、“不见面审批”改革经验，结合辽源实际，研究制定了《辽源市推行“一窗受理、集成服务”改革 全面提高办事效率实施方案》，明确了设置综合服务窗口、加快推进“三集中三到位”、简化优化办事流程、加快网络平台融合、延伸便民服务事项等9项改革任务，推行“前台综合受理、后台分类审批、部门数据互认、统一窗口出件”的审批服务模式，向现场办结和网上办理要效率，向流程优化要效率，向整合资源要效率，向体制机制创新要效率，努力实现让群众和企业办事“一次跑动”或“不跑动”。。三是推进更多服务事项网上办理。依托市政府网站群，统一办事服务标准和模式，将所有行政审批事项和公共服务信息在网上办事大厅集中呈现，实现行政许可事项和公共服务事项的网上申报、网上咨询、网上办理、网上支付、网上反馈、网上投诉和网上监督等；推进全市行政审批证照信息的归集和共享，实现全流程办事服务电子化、服务应用网络化，大幅度提高网上办事比例；全面推广行政审批和公共服务事项“在线咨询、网上申请、通知取件”的服务模式和移动智能终端服务模式，实施实体大厅与网上办事服务大厅的线上线下融合，为群众和企业提供方便快捷的多样化服务。。四是延伸便民服务事项。大力推进便民服务事项向基层延伸，在社区可办理民政、就业、计生、社保、医保等便民服务事项的基础上，将老年人乘车卡、居民户籍申请等便民服务事项延伸到社区，逐步实现“全城通办”；进一步梳理便民服务事项，能在社区申请办理的，尽量放在社区，进一步方便群众办事；同时，按照“先易后难、先分后总、分步实施”的原则，实行市县区联动、整体推进、因事制宜、分类指导，将复杂事项“化繁为简”，更多复杂事项实现“即来即办”，便民服务事项就近办理，为基层群众提供公平、可及的服务。,市标图案以“辽”字为主创元素，用狂草手法演变出“旭日初升、祥龙飞天、神鹿跳跃、辽水奔腾”的形态造型，巧妙蕴含了龙山、辽水、鹿乡等辽源元素，寓意辽源充满活力、充满希望、蒸蒸日上，充分体现了“皇家鹿苑”、“东辽河畔明珠”厚重的历史文化底蕴和现代化城市魅力，展现出辽源人豪迈大气，敢为人先，创新发展，勇于开拓，阔步迈向未来的时代精神。 整个市标简洁明快、动感十足、色彩标准采用红黄绿蓝渐变成五彩图腾，分别代表“五城辽源”，勾勒出辽源天蓝、日丽、水碧、山青的美丽画卷。。新年伊始，辽源市把优化政务服务作为推进“放管服”改革的首要任务，紧紧围绕让群众和企业办事“最多跑一次”的政务服务目标，在全市和各县区创新实施“一窗受理、集成服务”改革，努力将辽源打造成全省办事效率最高、政务服务环境最优、办事群众最满意地区。。一是加强改革顶层设计。市政府从去年9月份开始，先后赴浙江、江苏两省考察学习“最多跑一次”、“不见面审批”改革经验，结合辽源实际，研究制定了《辽源市推行“一窗受理、集成服务”改革 全面提高办事效率实施方案》，明确了设置综合服务窗口、加快推进“三集中三到位”、简化优化办事流程、加快网络平台融合、延伸便民服务事项等9项改革任务，推行“前台综合受理、后台分类审批、部门数据互认、统一窗口出件”的审批服务模式，向现场办结和网上办理要效率，向流程优化要效率，向整合资源要效率，向体制机制创新要效率，努力实现让群众和企业办事“一次跑动”或“不跑动”。。三是推进更多服务事项网上办理。依托市政府网站群，统一办事服务标准和模式，将所有行政审批事项和公共服务信息在网上办事大厅集中呈现，实现行政许可事项和公共服务事项的网上申报、网上咨询、网上办理、网上支付、网上反馈、网上投诉和网上监督等；推进全市行政审批证照信息的归集和共享，实现全流程办事服务电子化、服务应用网络化，大幅度提高网上办事比例；全面推广行政审批和公共服务事项“在线咨询、网上申请、通知取件”的服务模式和移动智能终端服务模式，实施实体大厅与网上办事服务大厅的线上线下融合，为群众和企业提供方便快捷的多样化服务。。四是延伸便民服务事项。大力推进便民服务事项向基层延伸，在社区可办理民政、就业、计生、社保、医保等便民服务事项的基础上，将老年人乘车卡、居民户籍申请等便民服务事项延伸到社区，逐步实现“全城通办”；进一步梳理便民服务事项，能在社区申请办理的，尽量放在社区，进一步方便群众办事；同时，按照“先易后难、先分后总、分步实施”的原则，实行市县区联动、整体推进、因事制宜、分类指导，将复杂事项“化繁为简”，更多复杂事项实现“即来即办”，便民服务事项就近办理，为基层群众提供公平、可及的服务。,政府领导到其他城市考察学习或访问,0.5688783482998667,False,否
51,吉林省,辽源市,广东省民政厅到龙山区考察社会救助工作,2014-12-01,http://www.liaoyuan.gov.cn/xxgk/dtxw/zwlb/xqdt/201701/t20170116_18440.html,市标图案以“辽”字为主创元素，用狂草手法演变出“旭日初升、祥龙飞天、神鹿跳跃、辽水奔腾”的形态造型，巧妙蕴含了龙山、辽水、鹿乡等辽源元素，寓意辽源充满活力、充满希望、蒸蒸日上，充分体现了“皇家鹿苑”、“东辽河畔明珠”厚重的历史文化底蕴和现代化城市魅力，展现出辽源人豪迈大气，敢为人先，创新发展，勇于开拓，阔步迈向未来的时代精神。 整个市标简洁明快、动感十足、色彩标准采用红黄绿蓝渐变成五彩图腾，分别代表“五城辽源”，勾勒出辽源天蓝、日丽、水碧、山青的美丽画卷。。近日，广东省民政厅社会救助处工作考察组一行10人来到龙山区学习考察社会救助工作。在龙山区事业大厅，龙山区民政局就开展“救急难”试点工作的进展情况及经验；建立临时救助制度、医疗救助制度的做法和经验与考察组成员进行了交流，同时也虚心请教了广东省的工作经验。,市标图案以“辽”字为主创元素，用狂草手法演变出“旭日初升、祥龙飞天、神鹿跳跃、辽水奔腾”的形态造型，巧妙蕴含了龙山、辽水、鹿乡等辽源元素，寓意辽源充满活力、充满希望、蒸蒸日上，充分体现了“皇家鹿苑”、“东辽河畔明珠”厚重的历史文化底蕴和现代化城市魅力，展现出辽源人豪迈大气，敢为人先，创新发展，勇于开拓，阔步迈向未来的时代精神。 整个市标简洁明快、动感十足、色彩标准采用红黄绿蓝渐变成五彩图腾，分别代表“五城辽源”，勾勒出辽源天蓝、日丽、水碧、山青的美丽画卷。。近日，广东省民政厅社会救助处工作考察组一行10人来到龙山区学习考察社会救助工作。在龙山区事业大厅，龙山区民政局就开展“救急难”试点工作的进展情况及经验；建立临时救助制度、医疗救助制度的做法和经验与考察组成员进行了交流，同时也虚心请教了广东省的工作经验。,其他,0.5148775419516595,False,否
51,吉林省,辽源市,县十八届人大二次会议举行第二次全体会议,2017-12-29,http://www.dongfeng.gov.cn/jrdf/zwdt/201712/t20171229_222872.html,12月28日上午8点30分，东丰县第十八届人民代表大会第二次会议举行第二次全体会议。。应出席县十八届人大二次会议的代表198名，因事因病请假的代表10名，出席今天会议的代表188名。符合法定人数。。今天大会的执行主席是：王军力 王铁峰 刘 丹 孙跃 李丹 张凤栋 陈嘉柱 周科 单玉君 赵志才 凌万发 程丽魁 霍明利。宋建华指出，一年来，县人大常委会在县委的坚强领导下，认真履行宪法和法律赋予的职责，紧紧围绕协调推进“四个全面”战略布局，全力落实县委“实现率先发展，建设大美东丰”决策部署，在依宪依法的前提下，积极支持“一府两院”工作，圆满完成了县十八届人大一次会议确定的各项任务。十八届人大一次会议共收到建议意见92件，通过议案审查委员会审查，归纳整理为55件，其中经县人大常委会检查组检查，已经落实了23件，正在解决或创造条件逐步解决的9件，办结率为78%。共召开常委会会议8次，开展视察、检查、调查6次，听取专项报告9项，有力促进了“一府两院”工作和“十三五”规划年度目标的完成，为推动全县经济社会发展、改善民生和民主法治建设做出了积极贡献。。2018年，十八届人大常委会将围绕县委十五届三次全会确定的目标任务，依法行使职权、开展工作，加强对“一府一委两院”的监督，维护宪法和法律权威，推进民主基层建设。要立足有效发挥监督职能，提高审议质量，尝试开展向社会公开征集监督议题和建议工作。积极适应经济发展新环境，协助县委、县政府破解经济发展难题，加强对经济领域重点工作和经济运行质量的监督，督促和支持县政府优化经济结构，提高全要素生产率，提升科学发展能力。围绕我县明年实施的重点惠民工程，认真组织开展“三查(察)”活动，督促政府部门抓各项目标任务的落实。要加强和改进司法监督工作，依法通过听取专项报告，视察、检查、调查、询问、质询、规范性文件备案审查等形式，加强行政机关、司法机关执法监督，促进“一府一委两院”严格执法、公正司法，确保法律法规得到有效实施。加强人大宣传工作，密切通上级人大的业务联系扩大同外地人大的经验交流。要加强培训工作，组织代表外出学习考察培训，进一步创新指导基层人大工作的方式方法，把我县人大工作提高到一个新的水平。,12月28日上午8点30分，东丰县第十八届人民代表大会第二次会议举行第二次全体会议。。应出席县十八届人大二次会议的代表198名，因事因病请假的代表10名，出席今天会议的代表188名。符合法定人数。。今天大会的执行主席是：王军力 王铁峰 刘 丹 孙跃 李丹 张凤栋 陈嘉柱 周科 单玉君 赵志才 凌万发 程丽魁 霍明利。宋建华指出，一年来，县人大常委会在县委的坚强领导下，认真履行宪法和法律赋予的职责，紧紧围绕协调推进“四个全面”战略布局，全力落实县委“实现率先发展，建设大美东丰”决策部署，在依宪依法的前提下，积极支持“一府两院”工作，圆满完成了县十八届人大一次会议确定的各项任务。十八届人大一次会议共收到建议意见92件，通过议案审查委员会审查，归纳整理为55件，其中经县人大常委会检查组检查，已经落实了23件，正在解决或创造条件逐步解决的9件，办结率为78%。共召开常委会会议8次，开展视察、检查、调查6次，听取专项报告9项，有力促进了“一府两院”工作和“十三五”规划年度目标的完成，为推动全县经济社会发展、改善民生和民主法治建设做出了积极贡献。。2018年，十八届人大常委会将围绕县委十五届三次全会确定的目标任务，依法行使职权、开展工作，加强对“一府一委两院”的监督，维护宪法和法律权威，推进民主基层建设。要立足有效发挥监督职能，提高审议质量，尝试开展向社会公开征集监督议题和建议工作。积极适应经济发展新环境，协助县委、县政府破解经济发展难题，加强对经济领域重点工作和经济运行质量的监督，督促和支持县政府优化经济结构，提高全要素生产率，提升科学发展能力。围绕我县明年实施的重点惠民工程，认真组织开展“三查(察)”活动，督促政府部门抓各项目标任务的落实。要加强和改进司法监督工作，依法通过听取专项报告，视察、检查、调查、询问、质询、规范性文件备案审查等形式，加强行政机关、司法机关执法监督，促进“一府一委两院”严格执法、公正司法，确保法律法规得到有效实施。加强人大宣传工作，密切通上级人大的业务联系扩大同外地人大的经验交流。要加强培训工作，组织代表外出学习考察培训，进一步创新指导基层人大工作的方式方法，把我县人大工作提高到一个新的水平。,其他,0.6699070357587393,False,否
51,吉林省,辽源市,辽源市地税局全面规范税收规范性文件制定工作,2016-06-20,http://www.liaoyuan.gov.cn/xxgk/dtxw/zwlb/bmgz/201701/t20170117_29004.html,市标图案以“辽”字为主创元素，用狂草手法演变出“旭日初升、祥龙飞天、神鹿跳跃、辽水奔腾”的形态造型，巧妙蕴含了龙山、辽水、鹿乡等辽源元素，寓意辽源充满活力、充满希望、蒸蒸日上，充分体现了“皇家鹿苑”、“东辽河畔明珠”厚重的历史文化底蕴和现代化城市魅力，展现出辽源人豪迈大气，敢为人先，创新发展，勇于开拓，阔步迈向未来的时代精神。 整个市标简洁明快、动感十足、色彩标准采用红黄绿蓝渐变成五彩图腾，分别代表“五城辽源”，勾勒出辽源天蓝、日丽、水碧、山青的美丽画卷。。为了进一步规范辽源地区地方税收规范性文件的制定和管理工作，辽源市地税局于近日制发了《辽源市地方税务局税收规范性文件制定管理办法（试行）》，全面规范了税收规范性文件的制发流程，有效推进了全市地税机关的依法行政进程。。市地税局在制定规范性文件制发制度时，注重对2015年度学习考察成果的转化运用，认真将通化和吉林地区的规范性文件制发制度进行了对比和融合，取其精华、为己所用，并结合国家税务总局和省地税局的相关规定以及辽源地区的工作实际加以改进，最终在征求了局领导和相关科室的意见后，制发了《辽源市地方税务局税收规范性文件制定管理办法（试行）》。该《办法》共三十三条，分为总则、制定规则、制定程序和附则四个部分，分别从制定规范性文件的常规性要求和起草、听取意见、会签、合法性审查、集体审议等几个程序环节，对税收规范性文件的制发流程进行了明确规定。同时，市地税局还根据各个程序环节的实际情况，配套制定了相关流程的文书表格，使各环节签批流转的要件和责任更加明晰化，全面完善了辽源地区地方税收规范性文件的制定和管理工作。,市标图案以“辽”字为主创元素，用狂草手法演变出“旭日初升、祥龙飞天、神鹿跳跃、辽水奔腾”的形态造型，巧妙蕴含了龙山、辽水、鹿乡等辽源元素，寓意辽源充满活力、充满希望、蒸蒸日上，充分体现了“皇家鹿苑”、“东辽河畔明珠”厚重的历史文化底蕴和现代化城市魅力，展现出辽源人豪迈大气，敢为人先，创新发展，勇于开拓，阔步迈向未来的时代精神。 整个市标简洁明快、动感十足、色彩标准采用红黄绿蓝渐变成五彩图腾，分别代表“五城辽源”，勾勒出辽源天蓝、日丽、水碧、山青的美丽画卷。。为了进一步规范辽源地区地方税收规范性文件的制定和管理工作，辽源市地税局于近日制发了《辽源市地方税务局税收规范性文件制定管理办法（试行）》，全面规范了税收规范性文件的制发流程，有效推进了全市地税机关的依法行政进程。。市地税局在制定规范性文件制发制度时，注重对2015年度学习考察成果的转化运用，认真将通化和吉林地区的规范性文件制发制度进行了对比和融合，取其精华、为己所用，并结合国家税务总局和省地税局的相关规定以及辽源地区的工作实际加以改进，最终在征求了局领导和相关科室的意见后，制发了《辽源市地方税务局税收规范性文件制定管理办法（试行）》。该《办法》共三十三条，分为总则、制定规则、制定程序和附则四个部分，分别从制定规范性文件的常规性要求和起草、听取意见、会签、合法性审查、集体审议等几个程序环节，对税收规范性文件的制发流程进行了明确规定。同时，市地税局还根据各个程序环节的实际情况，配套制定了相关流程的文书表格，使各环节签批流转的要件和责任更加明晰化，全面完善了辽源地区地方税收规范性文件的制定和管理工作。,其他,0.881780603217407,False,否
51,吉林省,辽源市,哈巴河县考察团到我县考察学习,2015-08-24,http://www.liaoyuan.gov.cn/xxgk/dtxw/zwlb/xqdt/201701/t20170114_3160.html,市标图案以“辽”字为主创元素，用狂草手法演变出“旭日初升、祥龙飞天、神鹿跳跃、辽水奔腾”的形态造型，巧妙蕴含了龙山、辽水、鹿乡等辽源元素，寓意辽源充满活力、充满希望、蒸蒸日上，充分体现了“皇家鹿苑”、“东辽河畔明珠”厚重的历史文化底蕴和现代化城市魅力，展现出辽源人豪迈大气，敢为人先，创新发展，勇于开拓，阔步迈向未来的时代精神。 整个市标简洁明快、动感十足、色彩标准采用红黄绿蓝渐变成五彩图腾，分别代表“五城辽源”，勾勒出辽源天蓝、日丽、水碧、山青的美丽画卷。。8月14日，新疆阿勒泰地区哈巴河县考察团一行来东丰县就农牧业发展情况进行考察学习。副县长叶尔兰· 巴彦陪同了考察。。考察团先后来到江城鹿场、鹏翔牧业、二龙山乡三资代理农民办事大厅、黄河镇均乐村、沙河镇镇政府、那丹伯镇四方顶村、东丰镇太和村等地进行了实地考察。。每到一处，考察团无不被东丰县农牧业的发展现状和远大构想所吸引，对东丰县现代农业和农业产业化发展成就给予了高度评价，并表示此次考察不虚此行，使他们开阔了眼界，受益匪浅。回去后，要认真总结我县发展经验，结合实际，加快发展当地农牧业。同时，希望今后要进一步加强两地间的交流与合作，共促两县经济又好又快发展。,市标图案以“辽”字为主创元素，用狂草手法演变出“旭日初升、祥龙飞天、神鹿跳跃、辽水奔腾”的形态造型，巧妙蕴含了龙山、辽水、鹿乡等辽源元素，寓意辽源充满活力、充满希望、蒸蒸日上，充分体现了“皇家鹿苑”、“东辽河畔明珠”厚重的历史文化底蕴和现代化城市魅力，展现出辽源人豪迈大气，敢为人先，创新发展，勇于开拓，阔步迈向未来的时代精神。 整个市标简洁明快、动感十足、色彩标准采用红黄绿蓝渐变成五彩图腾，分别代表“五城辽源”，勾勒出辽源天蓝、日丽、水碧、山青的美丽画卷。。8月14日，新疆阿勒泰地区哈巴河县考察团一行来东丰县就农牧业发展情况进行考察学习。副县长叶尔兰· 巴彦陪同了考察。。考察团先后来到江城鹿场、鹏翔牧业、二龙山乡三资代理农民办事大厅、黄河镇均乐村、沙河镇镇政府、那丹伯镇四方顶村、东丰镇太和村等地进行了实地考察。。每到一处，考察团无不被东丰县农牧业的发展现状和远大构想所吸引，对东丰县现代农业和农业产业化发展成就给予了高度评价，并表示此次考察不虚此行，使他们开阔了眼界，受益匪浅。回去后，要认真总结我县发展经验，结合实际，加快发展当地农牧业。同时，希望今后要进一步加强两地间的交流与合作，共促两县经济又好又快发展。,政府领导到其他城市考察学习或访问,0.0,False,否
