code,province,city,topic,date,url,content,content.1,label,score,is_match,是否为“学习考察”新闻
51,吉林省,辽源市,我县考察组到辽源市开展学习考察活动,2022-04-25,http://www.dongfeng.gov.cn/jrdf/jryw/202204/t20220425_606484.html,4月19日，县公安局、城管局、交通局、住建局、商务局、市场监管局等部门组成联合考察组到辽源市开展道路交通治理及城市服务管理学习考察活动。。近年来，辽源市公安局交警支队联合相关部门，通过成立公共停车场、打造严管示范街道、增设停车泊位、置换停车资源、强化执法力度等措施，使市区内乱停乱放现象得到有效遏制，市容市貌明显好转，交通管理整治工作取得显著成效。考察组在听取经验介绍后，先后来到辽源市辽河大路、中康街、吉春路等重点路段，实地参观考察停车泊位规划和交通秩序整治的工作成效，认真学习市区交通规范管理、车辆有序停放的好经验、好做法。。下一步，考察组成员单位将结合我县实际，进一步优化道路交通管理工作，改善全县交通秩序，科学规划车辆停放，严格落实交通管理整治工作，为全县人民提供安全、畅通、有序的道路交通环境。,4月19日，县公安局、城管局、交通局、住建局、商务局、市场监管局等部门组成联合考察组到辽源市开展道路交通治理及城市服务管理学习考察活动。。近年来，辽源市公安局交警支队联合相关部门，通过成立公共停车场、打造严管示范街道、增设停车泊位、置换停车资源、强化执法力度等措施，使市区内乱停乱放现象得到有效遏制，市容市貌明显好转，交通管理整治工作取得显著成效。考察组在听取经验介绍后，先后来到辽源市辽河大路、中康街、吉春路等重点路段，实地参观考察停车泊位规划和交通秩序整治的工作成效，认真学习市区交通规范管理、车辆有序停放的好经验、好做法。。下一步，考察组成员单位将结合我县实际，进一步优化道路交通管理工作，改善全县交通秩序，科学规划车辆停放，严格落实交通管理整治工作，为全县人民提供安全、畅通、有序的道路交通环境。,不属于政府领导到其他城市考察学习的新闻,0.508452351521028,False,否
51,吉林省,辽源市,年东丰县种植业基层农技推广体系改革与建设补助项目实施方案,2023-09-19,http://www.dongfeng.gov.cn/xxgk/zwxxgk/gs/202309/t20230919_662954.html,2023年东丰县种植业基层农技推广体系改革与建设补助项目实施方案--东丰县人民政府。根据《农业农村部办公厅关于做好2023年基层农技推广体系改革与建设任务实施工作的通知》（农办科〔2023〕14号要求，以及《吉林省农业农村厅 吉林省财政厅关于下发 2023 年中央财政粮油生产保障等项目实施方案（指南）的通知》（吉农联发〔2023〕20 号）—2023 年中央农业经营主体能力提升资金（基层农技推广体系改革与建设）项目实施方案的通知精神，结合我县实际，特制定2023年东丰县种植业基层农技推广体系改革与建设工作方案。。全县建立县级高标准农业科技示范基地2个，乡镇级示范基地2个，培育示范主体42户，示范推广优质高效绿色环保生产技术15项，农业主推技术到位率达到95%以上，连续5天脱产培训基层农技人员40人以上，在岗农技人员应用中国农技推广App85%以上。。农业综合服务中心拥有种植业农技人员的乡镇。县农业农村局负责组织、管理项目实施，县农业技术推广总站负责项目各项工作的具体落实。。参与项目实施的农业科技人员、科技示范主体以及承担试验示范工作的新型农业经营主体、农业种植合作组织、种植大户等。。（一）促进玉米、水稻等产业先进适用技术集成落地。聚焦主导产业需求，遴选推介优质、绿色、高效的农业主导品种和主推技术，组建主推技术指导团队，制定推广方案，依托示范基地、科技示范主体，加快先进技术入户到田。。2、主推技术（15项）玉米秸秆覆盖保护性耕作技术；半湿润区玉米秸秆全量深翻还田地力保育技术；玉米化肥减量增效术;玉米全程机械化栽培技术；玉米宽窄行交替休闲种植技术；玉米均衡营养施肥技术；玉米缓控释肥料施用技术；玉米病虫害一体化防控技术；玉米螟生物防治技术；玉米矮化病和根腐病防治技术；水稻病害防控技术；水稻二化螟绿色防控技术；水稻草害防控技术；马铃薯栽培技术；抗旱保水剂节水技术。。（二）支撑稳产保供任务落实。围绕粮食和重要农产品稳产保供的要求，组织乡镇农技人员开展主导品种主推技术试验示范、植物病虫害监测防治、农业技术培训、农业防灾减灾等技术服务，强化推广体系公益性职责履行。支撑转基因玉米产业化应用重点工作。进一步优化乡镇综合服务中心技术服务体系，充实技术力量，细化工作任务，落实人员和工作台账。。1.每个乡镇遴选3个示范带动能力强、配合工作积极性高、乐于服务村民的农民合作组织、家庭农场、种植大户等作为农业科技示范主体。加强良种良法良机良艺应用展示示范，加快推广高产优质品种和先进适用技术模式。。2.组织县乡两级农技人员组建服务团队对农业科技示范主体进行不少于5次进行技术指导、政策咨询、信息推送等综合性服务。。3.推行农技人员包村联户服务机制，各乡镇农技人员开展技术包村服务50天以上，切实做好公益性、普惠性服务。。（四）支持农业科技社会化服务发展。支持农业科技服务公司、专业服务组织、科技服务能力较强的农民合作社、家庭农场等社会化服务组织探索代耕代种、代管代收、全程托管、“互联网+农机作业”等服务模式，开展农业科技服务。引导推动示范主体规范作业标准，集成综合配套技术，提高统防统治、农机作业、投入品精量施用等科技服务水平。鼓励示范主体牵头建设区域性综合服务平台，带动小农户合作经营、共同增收。。（一）农业技术推广服务补助35.7万元，占资金总量的35%，其中用于基层农业技术人员进村入户服务的补助（含聘请农民技术员的补助）25.5万元；具体包括农技人员开展技术服务和指导、农情调查、农业生产情况调查等所发生的交通差旅费等；5名科技骨干开展线上线下培训师资费、学员交通费等。,2023年东丰县种植业基层农技推广体系改革与建设补助项目实施方案--东丰县人民政府。根据《农业农村部办公厅关于做好2023年基层农技推广体系改革与建设任务实施工作的通知》（农办科〔2023〕14号要求，以及《吉林省农业农村厅 吉林省财政厅关于下发 2023 年中央财政粮油生产保障等项目实施方案（指南）的通知》（吉农联发〔2023〕20 号）—2023 年中央农业经营主体能力提升资金（基层农技推广体系改革与建设）项目实施方案的通知精神，结合我县实际，特制定2023年东丰县种植业基层农技推广体系改革与建设工作方案。。全县建立县级高标准农业科技示范基地2个，乡镇级示范基地2个，培育示范主体42户，示范推广优质高效绿色环保生产技术15项，农业主推技术到位率达到95%以上，连续5天脱产培训基层农技人员40人以上，在岗农技人员应用中国农技推广App85%以上。。农业综合服务中心拥有种植业农技人员的乡镇。县农业农村局负责组织、管理项目实施，县农业技术推广总站负责项目各项工作的具体落实。。参与项目实施的农业科技人员、科技示范主体以及承担试验示范工作的新型农业经营主体、农业种植合作组织、种植大户等。。（一）促进玉米、水稻等产业先进适用技术集成落地。聚焦主导产业需求，遴选推介优质、绿色、高效的农业主导品种和主推技术，组建主推技术指导团队，制定推广方案，依托示范基地、科技示范主体，加快先进技术入户到田。。2、主推技术（15项）玉米秸秆覆盖保护性耕作技术；半湿润区玉米秸秆全量深翻还田地力保育技术；玉米化肥减量增效术;玉米全程机械化栽培技术；玉米宽窄行交替休闲种植技术；玉米均衡营养施肥技术；玉米缓控释肥料施用技术；玉米病虫害一体化防控技术；玉米螟生物防治技术；玉米矮化病和根腐病防治技术；水稻病害防控技术；水稻二化螟绿色防控技术；水稻草害防控技术；马铃薯栽培技术；抗旱保水剂节水技术。。（二）支撑稳产保供任务落实。围绕粮食和重要农产品稳产保供的要求，组织乡镇农技人员开展主导品种主推技术试验示范、植物病虫害监测防治、农业技术培训、农业防灾减灾等技术服务，强化推广体系公益性职责履行。支撑转基因玉米产业化应用重点工作。进一步优化乡镇综合服务中心技术服务体系，充实技术力量，细化工作任务，落实人员和工作台账。。1.每个乡镇遴选3个示范带动能力强、配合工作积极性高、乐于服务村民的农民合作组织、家庭农场、种植大户等作为农业科技示范主体。加强良种良法良机良艺应用展示示范，加快推广高产优质品种和先进适用技术模式。。2.组织县乡两级农技人员组建服务团队对农业科技示范主体进行不少于5次进行技术指导、政策咨询、信息推送等综合性服务。。3.推行农技人员包村联户服务机制，各乡镇农技人员开展技术包村服务50天以上，切实做好公益性、普惠性服务。。（四）支持农业科技社会化服务发展。支持农业科技服务公司、专业服务组织、科技服务能力较强的农民合作社、家庭农场等社会化服务组织探索代耕代种、代管代收、全程托管、“互联网+农机作业”等服务模式，开展农业科技服务。引导推动示范主体规范作业标准，集成综合配套技术，提高统防统治、农机作业、投入品精量施用等科技服务水平。鼓励示范主体牵头建设区域性综合服务平台，带动小农户合作经营、共同增收。。（一）农业技术推广服务补助35.7万元，占资金总量的35%，其中用于基层农业技术人员进村入户服务的补助（含聘请农民技术员的补助）25.5万元；具体包括农技人员开展技术服务和指导、农情调查、农业生产情况调查等所发生的交通差旅费等；5名科技骨干开展线上线下培训师资费、学员交通费等。,其他,0.8690925321517794,False,否
51,吉林省,辽源市,南屯基镇榆林村入选年吉林美丽休闲乡村,2022-12-09,http://www.dongfeng.gov.cn/jrdf/xzdt/202212/t20221209_636974.html,近日，省农业农村厅公布了“2022年吉林美丽休闲乡村”名单，南屯基镇榆林村成功入选。。榆林村青山环绕、交通便利。在县委县政府的支持下，镇村领导依托南屯基镇东丰农民画发祥地、集聚地的文化底蕴和优势，集中打造民宿、农家乐、农民画创作基地，开发“休闲一日游”精品线路，实现文化与旅游、生态与旅游、治理与旅游的有机结合。。为了发展休闲观光产业，引入达旗文旅集团，依托 21 名农民画作者组成创作人才队伍，建成占地面积1200平方米的农民画创作室和游客服务中心。集中对23户民宿进行特色改造和旅游设计，修建观景木栈道600余米，修筑观景步道2600余米，形成了“林中屯、屯间路、路边景”。村党支部牵头创办了种植专业合作社，在原有果林的基础上，栽植果树1.5万余株，发展壮大鲜果采摘项目。每到春季，漫山遍野的果树鲜花盛开；金秋时节，果树枝头硕果累累、鲜果飘香，吸引了县内外游客纷至沓来，赏花尝果、拍照“打卡”、游玩踏青，呼吸纯净的空气。。在打造景观的同时，镇村领导还在发展“农家乐”上狠下功夫。在传统农家饭菜的基础上，引进了坑烤项目。经过多方宣传，一批批游客专门前来品尝烤全羊、烤公鸡，每逢节假日，都需要提前订餐。2021年，累计带动村民增收近百万元。不少外出务工的年轻人毅然返乡，一度陷入“空心村”境地的榆林村重又焕发了生机。。经过持续打造发展，榆林村形成了环境因乡村旅游更美丽、产业因乡村旅游更兴旺、百姓因乡村旅游更富裕的振兴发展新格局，知名度、美誉度不断提升，前来学习考察的团组接踵而至。前不久，省文旅厅、省发改委发布《吉林省第三批省级乡村旅游重点村镇名录》，榆林村光荣上榜。,近日，省农业农村厅公布了“2022年吉林美丽休闲乡村”名单，南屯基镇榆林村成功入选。。榆林村青山环绕、交通便利。在县委县政府的支持下，镇村领导依托南屯基镇东丰农民画发祥地、集聚地的文化底蕴和优势，集中打造民宿、农家乐、农民画创作基地，开发“休闲一日游”精品线路，实现文化与旅游、生态与旅游、治理与旅游的有机结合。。为了发展休闲观光产业，引入达旗文旅集团，依托 21 名农民画作者组成创作人才队伍，建成占地面积1200平方米的农民画创作室和游客服务中心。集中对23户民宿进行特色改造和旅游设计，修建观景木栈道600余米，修筑观景步道2600余米，形成了“林中屯、屯间路、路边景”。村党支部牵头创办了种植专业合作社，在原有果林的基础上，栽植果树1.5万余株，发展壮大鲜果采摘项目。每到春季，漫山遍野的果树鲜花盛开；金秋时节，果树枝头硕果累累、鲜果飘香，吸引了县内外游客纷至沓来，赏花尝果、拍照“打卡”、游玩踏青，呼吸纯净的空气。。在打造景观的同时，镇村领导还在发展“农家乐”上狠下功夫。在传统农家饭菜的基础上，引进了坑烤项目。经过多方宣传，一批批游客专门前来品尝烤全羊、烤公鸡，每逢节假日，都需要提前订餐。2021年，累计带动村民增收近百万元。不少外出务工的年轻人毅然返乡，一度陷入“空心村”境地的榆林村重又焕发了生机。。经过持续打造发展，榆林村形成了环境因乡村旅游更美丽、产业因乡村旅游更兴旺、百姓因乡村旅游更富裕的振兴发展新格局，知名度、美誉度不断提升，前来学习考察的团组接踵而至。前不久，省文旅厅、省发改委发布《吉林省第三批省级乡村旅游重点村镇名录》，榆林村光荣上榜。,其他,0.7274803947503793,False,否
51,吉林省,辽源市,县委常委常务副县长邢树纲带队赴长春市考察学习,2020-08-25,http://www.dongfeng.gov.cn/jrdf/zwdt/202008/t20200825_457842.html,"8月20日、21日，县委常委、常务副县长邢树纲带领考察团一行，赴长春市就乡村振兴、农村人居环境整治等工作进行考察学习。九台区区委常委、副区长吴威陪同考察；副县长杨鸿宝及各乡镇相关部门主要领导参加考察。。在九台区龙嘉街道红光村，邢树纲与村负责人就改革引领乡村振兴模式、现代农业建设红光模式进行了深入探讨，实地参观九台区稻米产业规划展厅，观看智慧乡村演示，并沿玻璃栈道进入观稻平台，参观高标准农田示范基地——红光村稻田公园。 据了解，红光村曾荣获全国水稻全程机械化示范村、吉林省建设新农村示范村等荣誉称号。近年来，村内引进企业通过成立水稻农机化生产专业合作社的形式，让村民以土地作价入股的方式参与分红，带动了当地村民的增收致富。。邢树纲认为红光村的创新发展理念和乡村振兴工作的模式值得学习借鉴，表示要将好经验、好做法带回去，助推我县乡村振兴工作再提升。。莲花山天定山旅游度假小镇规划占地面积近600万平方米，计划总投资89亿元，是全国规模最大的冰雪小镇，分为长春冰雪新世界、天定山滑雪场、天定山生态田园综合体、天定山民宿四大板块。其中，作为四大板块之一的天定山民宿是长春首个乡村旅游民宿示范项目，是在莲花山管委会投资2000多万元妥善安置空心村原住民基础上，按照“自愿、自助、共建、共享”模式倾力打造，泉眼村依托闲置村集体宅基地资产，与吉林省建设集团采取租赁方式合作运营，实现了村集体闲置资产与旅游度假产品深度融合，形成村集体稳定收益。。邢树纲对这一独具特色旅游项目赞赏有加，认为通过发展乡村旅游民宿产业既能带动当地经济发展,还能推进全域旅游建设,更有助于激发乡村振兴的活力。他要求随行人员要认真学习、深入思考，用先进理念拓展思路，开阔眼界，根据各村发展现状，创新思维，谋良策、出实招，推动我县在乡村振兴、乡村旅游建设上取得新发展。。考察团认为此次的考察学习受益匪浅，特别是长春市在乡村发展的模式，以及在乡村环境整治中的先进经验，值得学习和借鉴。邢树纲指出，各乡镇、各部门要结合实际，把改善城乡环境特别是农村环境作为增进人民福祉的重要载体，充分利用生态、文化、土地、政策等优势，整体推进，探索出人居环境整治与乡村振兴统筹推进的高质量发展路径。","8月20日、21日，县委常委、常务副县长邢树纲带领考察团一行，赴长春市就乡村振兴、农村人居环境整治等工作进行考察学习。九台区区委常委、副区长吴威陪同考察；副县长杨鸿宝及各乡镇相关部门主要领导参加考察。。在九台区龙嘉街道红光村，邢树纲与村负责人就改革引领乡村振兴模式、现代农业建设红光模式进行了深入探讨，实地参观九台区稻米产业规划展厅，观看智慧乡村演示，并沿玻璃栈道进入观稻平台，参观高标准农田示范基地——红光村稻田公园。 据了解，红光村曾荣获全国水稻全程机械化示范村、吉林省建设新农村示范村等荣誉称号。近年来，村内引进企业通过成立水稻农机化生产专业合作社的形式，让村民以土地作价入股的方式参与分红，带动了当地村民的增收致富。。邢树纲认为红光村的创新发展理念和乡村振兴工作的模式值得学习借鉴，表示要将好经验、好做法带回去，助推我县乡村振兴工作再提升。。莲花山天定山旅游度假小镇规划占地面积近600万平方米，计划总投资89亿元，是全国规模最大的冰雪小镇，分为长春冰雪新世界、天定山滑雪场、天定山生态田园综合体、天定山民宿四大板块。其中，作为四大板块之一的天定山民宿是长春首个乡村旅游民宿示范项目，是在莲花山管委会投资2000多万元妥善安置空心村原住民基础上，按照“自愿、自助、共建、共享”模式倾力打造，泉眼村依托闲置村集体宅基地资产，与吉林省建设集团采取租赁方式合作运营，实现了村集体闲置资产与旅游度假产品深度融合，形成村集体稳定收益。。邢树纲对这一独具特色旅游项目赞赏有加，认为通过发展乡村旅游民宿产业既能带动当地经济发展,还能推进全域旅游建设,更有助于激发乡村振兴的活力。他要求随行人员要认真学习、深入思考，用先进理念拓展思路，开阔眼界，根据各村发展现状，创新思维，谋良策、出实招，推动我县在乡村振兴、乡村旅游建设上取得新发展。。考察团认为此次的考察学习受益匪浅，特别是长春市在乡村发展的模式，以及在乡村环境整治中的先进经验，值得学习和借鉴。邢树纲指出，各乡镇、各部门要结合实际，把改善城乡环境特别是农村环境作为增进人民福祉的重要载体，充分利用生态、文化、土地、政策等优势，整体推进，探索出人居环境整治与乡村振兴统筹推进的高质量发展路径。",政府领导到其他城市考察学习或访问,0.0,False,否
51,吉林省,辽源市,四平市政协来我市学习考察老旧小区改造工作,2020-10-29,http://zjj.liaoyuan.gov.cn/xxgk/bmdt/202010/t20201029_474075.html,"10月28日上午，四平市政协副主席寇春生、政协委员、旧改办工作人员一行20余人对我市老旧小区改造工作进行学习考察。市政协党组副书记副主席张恒军、副市长吴波、市政协秘书长付强、市政府副秘书长张凤宇、市政协人资环委主任王晓君、市政府办公室副主任陈明、市住建局领导和相关人员陪同考察。。寇春生副主席一行先后到国康小区、濒河苑小区进行实地考察，现场听取汇报，并详细询问了改造工作进展情况。。现场考察结束后，在市政协六楼会议室召开座谈会。会上观看了我市老旧小区改造专题片，市住建局主要领导介绍了我市老旧小区改造有关情况，副市长吴波对我市旧改前期存在问题和改造具体做法做了介绍。。考察组成员对我市旧改工作给予高度评价，并就建管结合、后续物业公司运营、管理和物业费收取等方面进行交流。寇春生副主席表示，辽源市老旧小区改造工作全面、彻底，有创新、有亮点、有成果，尤其是在建管结合，确定“谁建设，谁管理、谁运营”物业管理模式和十五年运营维护期等创新工作上，非常值得我们学习。今年四平市政协将旧改工作作为一号议题和唯一重点研究议题，通过此次考察学习，我们将借鉴贵市经验、着力强弱项、补短板、促提升，全力做好旧改这一重要民生工程，改环境、暖民心，不断提升居民居住环境和生活质量,用实际成果回应群众对美好生活的期盼。。市住建局、市财政局、市发改委、市自然资源局、市城管执法局、龙山区政府、西安区政府、市供热公司、市水务集团、华润燃气公司、供电公司、联通公司、移动公司、电信公司、吉视传媒公司、施工单位、设计单位领导及相关人员参加座谈。","10月28日上午，四平市政协副主席寇春生、政协委员、旧改办工作人员一行20余人对我市老旧小区改造工作进行学习考察。市政协党组副书记副主席张恒军、副市长吴波、市政协秘书长付强、市政府副秘书长张凤宇、市政协人资环委主任王晓君、市政府办公室副主任陈明、市住建局领导和相关人员陪同考察。。寇春生副主席一行先后到国康小区、濒河苑小区进行实地考察，现场听取汇报，并详细询问了改造工作进展情况。。现场考察结束后，在市政协六楼会议室召开座谈会。会上观看了我市老旧小区改造专题片，市住建局主要领导介绍了我市老旧小区改造有关情况，副市长吴波对我市旧改前期存在问题和改造具体做法做了介绍。。考察组成员对我市旧改工作给予高度评价，并就建管结合、后续物业公司运营、管理和物业费收取等方面进行交流。寇春生副主席表示，辽源市老旧小区改造工作全面、彻底，有创新、有亮点、有成果，尤其是在建管结合，确定“谁建设，谁管理、谁运营”物业管理模式和十五年运营维护期等创新工作上，非常值得我们学习。今年四平市政协将旧改工作作为一号议题和唯一重点研究议题，通过此次考察学习，我们将借鉴贵市经验、着力强弱项、补短板、促提升，全力做好旧改这一重要民生工程，改环境、暖民心，不断提升居民居住环境和生活质量,用实际成果回应群众对美好生活的期盼。。市住建局、市财政局、市发改委、市自然资源局、市城管执法局、龙山区政府、西安区政府、市供热公司、市水务集团、华润燃气公司、供电公司、联通公司、移动公司、电信公司、吉视传媒公司、施工单位、设计单位领导及相关人员参加座谈。",政府领导到其他城市考察学习或访问,0.0,True,是
