code,province,city,topic,date,url,content,content.1,label,score,is_match
62,黑龙江省,伊春市,铁力市委书记陈岩主持召开文明城市创建与乡村建设考察学习班座谈研讨会,2023-03-08,http://www.yc.gov.cn/ycsrmzf/c101988/202303/289173.shtml,铁力市委书记陈岩主持召开铁力市文明城市创建与乡村建设考察学习班座谈研讨会，铁力市委常委、宣传部部长张淑琳出席会议，铁力市考察学习班成员参加会议。。陈岩强调，创建全国文明城市，是贯彻落实党的二十大精神的具体实践，是检验“创建为民、创建惠民”的重要标尺。全体考察学习班成员要学习借鉴外地市创建全国文明城市、建设宜居和美乡村的优秀经验，发挥看齐意识，找短板补差距，切实把外地的先进经验运用到铁力市的城市建设、乡村振兴、融合发展等具体工作中。要进一步坚定信心，解放思想，创新工作方法，推动创城工作实现新突破、新进展。要切实把考察学习成果转化到转变作风、提升能力上来，坚守为民情怀，关注群众急难愁盼，不断提升服务意识，提升群众百姓幸福感和满意度。要进一步加强外出考察学习，持续对标外地先进、典型，学习优秀经验，推动各项工作打开新局面、迈上新台阶。。会上，张淑琳从考察学习的主要内容、经验做法、体会启示、下步工作安排及建议等几个方面，就文明城市创建与乡村建设考察学习情况进行了总体汇报。张淑琳指出，本次考察学习内容丰富，受益匪浅，既开阔了视野、认识到了差距，又受到了启迪、增强了自信。考察学习班成员要积极学习借鉴先进经验，进一步开阔视野，拓宽思路，扎实推进铁力市文明城市创建和乡村建设工作。,铁力市委书记陈岩主持召开铁力市文明城市创建与乡村建设考察学习班座谈研讨会，铁力市委常委、宣传部部长张淑琳出席会议，铁力市考察学习班成员参加会议。。陈岩强调，创建全国文明城市，是贯彻落实党的二十大精神的具体实践，是检验“创建为民、创建惠民”的重要标尺。全体考察学习班成员要学习借鉴外地市创建全国文明城市、建设宜居和美乡村的优秀经验，发挥看齐意识，找短板补差距，切实把外地的先进经验运用到铁力市的城市建设、乡村振兴、融合发展等具体工作中。要进一步坚定信心，解放思想，创新工作方法，推动创城工作实现新突破、新进展。要切实把考察学习成果转化到转变作风、提升能力上来，坚守为民情怀，关注群众急难愁盼，不断提升服务意识，提升群众百姓幸福感和满意度。要进一步加强外出考察学习，持续对标外地先进、典型，学习优秀经验，推动各项工作打开新局面、迈上新台阶。。会上，张淑琳从考察学习的主要内容、经验做法、体会启示、下步工作安排及建议等几个方面，就文明城市创建与乡村建设考察学习情况进行了总体汇报。张淑琳指出，本次考察学习内容丰富，受益匪浅，既开阔了视野、认识到了差距，又受到了启迪、增强了自信。考察学习班成员要积极学习借鉴先进经验，进一步开阔视野，拓宽思路，扎实推进铁力市文明城市创建和乡村建设工作。,政府领导到其他城市考察学习或访问,0.0,True
62,黑龙江省,伊春市,铁力市委书记陈岩主持召开市委解放思想专项工作学习领会习近平总书记考察江苏重要讲话和重要指示精神以及江苏黑龙江工作交流座谈会精神专题研讨会,2023-09-01,http://www.yc.gov.cn/ycsrmzf/c101988/202309/326345.shtml,铁力市委书记陈岩主持召开市委解放思想专项工作学习领会习近平总书记考察江苏重要讲话和重要指示精神以及江苏·黑龙江工作交流座谈会精神专题研讨会。市领导郭春光、徐利明、穆静宇、姚佳宇、李兵、任利、于国峰、孟维东出席会议。铁力市相关部门负责人参加会议。。会上学习了习近平总书记考察江苏重要讲话和重要指示精神、江苏·黑龙江工作交流座谈会精神。。会议强调，要深入领会精神要义，进一步坚定以中国式现代化全面推进中华民族伟大复兴的信心决心。要准确把握习近平总书记考察江苏重要讲话精神的丰富内涵，深入贯彻落实省委指示要求，始终牢记伊春市委“铁力在伊春现代化建设中走在前列、作出示范”的政治要求，不断提高把握新发展阶段、贯彻新发展理念、构建新发展格局的政治能力、战略眼光、专业水平，以“人无我有、人有我优、人优我特、人特我精”的精神，用心用情书写好“在推进中国式现代化中走在前、做示范”的铁力实践。。会议强调，要准确把握科学内涵，坚定不移按照习近平总书记提出的要求谋划推进。要加快推进科技创新，持续深化校地合作共建，真正让校地合作成为推动铁力市高质量发展“重要引擎”。要在强链补链延链上下功夫，持续抓好招商引资，树立“换道超车”的发展思维，全面加快项目建设，超前谋划，积极做好对上争取，为铁力市高质量发展打下坚实基础。要高质量推进文化强市建设，守护历史文化根脉，紧扣全国文明城市创建目标，坚持文明创建、文明实践、文明培育互促共融，促进新时代文明新风建设纵深发展。要大力发展文化产业，不断激发文化创新、创造活力，打造铁力文化“新名片”。要持续抓好社会治理，坚决贯彻总体国家安全观，多元化解社会矛盾纠纷，持续加强和创新乡村治理，推进试点村建设，推动乡村治理再上新台阶。。会议强调，要深入贯彻实践要求，以更加过硬的能力作风不断开辟高质量发展新局面。要在思想解放上破坚冰，在提升本领上下功夫，在狠抓落实上求成效，坚持“实”字当头、“干”字为先，不断开创铁力市高质量发展新局面。,铁力市委书记陈岩主持召开市委解放思想专项工作学习领会习近平总书记考察江苏重要讲话和重要指示精神以及江苏·黑龙江工作交流座谈会精神专题研讨会。市领导郭春光、徐利明、穆静宇、姚佳宇、李兵、任利、于国峰、孟维东出席会议。铁力市相关部门负责人参加会议。。会上学习了习近平总书记考察江苏重要讲话和重要指示精神、江苏·黑龙江工作交流座谈会精神。。会议强调，要深入领会精神要义，进一步坚定以中国式现代化全面推进中华民族伟大复兴的信心决心。要准确把握习近平总书记考察江苏重要讲话精神的丰富内涵，深入贯彻落实省委指示要求，始终牢记伊春市委“铁力在伊春现代化建设中走在前列、作出示范”的政治要求，不断提高把握新发展阶段、贯彻新发展理念、构建新发展格局的政治能力、战略眼光、专业水平，以“人无我有、人有我优、人优我特、人特我精”的精神，用心用情书写好“在推进中国式现代化中走在前、做示范”的铁力实践。。会议强调，要准确把握科学内涵，坚定不移按照习近平总书记提出的要求谋划推进。要加快推进科技创新，持续深化校地合作共建，真正让校地合作成为推动铁力市高质量发展“重要引擎”。要在强链补链延链上下功夫，持续抓好招商引资，树立“换道超车”的发展思维，全面加快项目建设，超前谋划，积极做好对上争取，为铁力市高质量发展打下坚实基础。要高质量推进文化强市建设，守护历史文化根脉，紧扣全国文明城市创建目标，坚持文明创建、文明实践、文明培育互促共融，促进新时代文明新风建设纵深发展。要大力发展文化产业，不断激发文化创新、创造活力，打造铁力文化“新名片”。要持续抓好社会治理，坚决贯彻总体国家安全观，多元化解社会矛盾纠纷，持续加强和创新乡村治理，推进试点村建设，推动乡村治理再上新台阶。。会议强调，要深入贯彻实践要求，以更加过硬的能力作风不断开辟高质量发展新局面。要在思想解放上破坚冰，在提升本领上下功夫，在狠抓落实上求成效，坚持“实”字当头、“干”字为先，不断开创铁力市高质量发展新局面。,其他,0.6175879278870593,True
62,黑龙江省,伊春市,铁力市召开发展壮大村级集体经济考察学习座谈研讨会,2023-03-27,http://www.yc.gov.cn/ycsrmzf/c101988/202303/289351.shtml,3月24日，铁力市委书记陈岩主持召开发展壮大村级集体经济考察学习座谈研讨会，铁力市委常委、组织部长尹冬钢，副市长赵晓光及考察学习班成员参加会议。。陈岩强调，要充分认识发展壮大村级集体经济的重要意义，发展壮大村级集体经济既是贯彻中央决策部署的具体行动，也是强农业、美农村、富农民的重要举措。全体考察学习班成员要学习借鉴外地发展壮大村级集体经济的好经验和好做法，找差距、补短板，把外地的先进经验运用到铁力市发展壮大村级集体经济工作之中。通过考察学习要进一步解放思想、转变观念、创新方法，扎实推动村级集体经济工作深入开展。要坚定信心，勤思多想，把所学新知识、新本领运用到基层实践中，选准突破口，找准着力点。要拓宽思想，更新理念，科学谋划发展思路，开拓增收渠道，实现农民增收和壮大村级集体经济共赢的目标。要扛起责任、敢拼、敢干、敢于奉献，因地制宜，实事求是，探索出一条适合发展壮大村级集体经济的新路径，确保铁力市发展壮大村级集体经济工作再上新台阶。。会上，尹冬钢就发展壮大村级集体经济考察学习情况进行了总体汇报。副市长赵晓光及部分考察学习班成员交流了学习体会。。据悉，为探寻村级集体经济发展新思路、新途径，推动全市村级集体经济提质增效，按照市委统一安排部署，3月14日至20日，由铁力市委常委、组织部长尹冬钢，副市长赵晓光同志带队，组织相关部门及各乡镇负责同志、部分村党组织书记、村集体经济企业代表一行33人，赴成都市学习了发展壮大村级集体经济的典型做法和成功经验。,3月24日，铁力市委书记陈岩主持召开发展壮大村级集体经济考察学习座谈研讨会，铁力市委常委、组织部长尹冬钢，副市长赵晓光及考察学习班成员参加会议。。陈岩强调，要充分认识发展壮大村级集体经济的重要意义，发展壮大村级集体经济既是贯彻中央决策部署的具体行动，也是强农业、美农村、富农民的重要举措。全体考察学习班成员要学习借鉴外地发展壮大村级集体经济的好经验和好做法，找差距、补短板，把外地的先进经验运用到铁力市发展壮大村级集体经济工作之中。通过考察学习要进一步解放思想、转变观念、创新方法，扎实推动村级集体经济工作深入开展。要坚定信心，勤思多想，把所学新知识、新本领运用到基层实践中，选准突破口，找准着力点。要拓宽思想，更新理念，科学谋划发展思路，开拓增收渠道，实现农民增收和壮大村级集体经济共赢的目标。要扛起责任、敢拼、敢干、敢于奉献，因地制宜，实事求是，探索出一条适合发展壮大村级集体经济的新路径，确保铁力市发展壮大村级集体经济工作再上新台阶。。会上，尹冬钢就发展壮大村级集体经济考察学习情况进行了总体汇报。副市长赵晓光及部分考察学习班成员交流了学习体会。。据悉，为探寻村级集体经济发展新思路、新途径，推动全市村级集体经济提质增效，按照市委统一安排部署，3月14日至20日，由铁力市委常委、组织部长尹冬钢，副市长赵晓光同志带队，组织相关部门及各乡镇负责同志、部分村党组织书记、村集体经济企业代表一行33人，赴成都市学习了发展壮大村级集体经济的典型做法和成功经验。,政府领导到其他城市考察学习或访问,0.718382958022719,True
62,黑龙江省,伊春市,铁力市开展乡村旅游民宿考察学习工作,2019-08-26,http://www.yc.gov.cn/ycsrmzf/c101988/201908/213419.shtml,为加快推进铁力市乡村旅游产业发展，打造标准化精品民宿，8月21日，铁力市副市长孙力艳率铁力市文旅局、各乡镇及民宿业主共20余人赴友好区等地考察民宿建设发展情况。。学习考察组一行先后深入到友好区和丰林县对“溪水松月”“岭尚欲雪”“自在乡里”三家民宿进行实地参观，与业主深入沟通交流，详细了解个体民宿装修风格、功能布局、经营模式、运营收益等方面内容。。学习人员对三家民宿通过旅游+农业+文化+民俗风情，打造四季旅游产品；以产业升级、产品升级的开发模式带动乡村经济和文化发展的模式有了更深刻的体会和认识，认为其超前理念，合理规划，高效建设、优品服务等诸多内容值得铁力市学习、借鉴。。同时，考察组还参观了新青国家湿地公园、中小学研学教育基地、汤旺县林居及汽车营地，学习其建设发展、资本引入、环境打造等成熟经验做法。。通过实地学习考察，大家增长了见识，拓宽了思路，仔细研究其他县区精品民宿的成功经验，畅谈如何利用本土优势发展铁力市特色民宿，将精品民宿真正做精、做细，促其发展壮大，加速旅游产业提档升级，打造铁力全域旅游新格局。,为加快推进铁力市乡村旅游产业发展，打造标准化精品民宿，8月21日，铁力市副市长孙力艳率铁力市文旅局、各乡镇及民宿业主共20余人赴友好区等地考察民宿建设发展情况。。学习考察组一行先后深入到友好区和丰林县对“溪水松月”“岭尚欲雪”“自在乡里”三家民宿进行实地参观，与业主深入沟通交流，详细了解个体民宿装修风格、功能布局、经营模式、运营收益等方面内容。。学习人员对三家民宿通过旅游+农业+文化+民俗风情，打造四季旅游产品；以产业升级、产品升级的开发模式带动乡村经济和文化发展的模式有了更深刻的体会和认识，认为其超前理念，合理规划，高效建设、优品服务等诸多内容值得铁力市学习、借鉴。。同时，考察组还参观了新青国家湿地公园、中小学研学教育基地、汤旺县林居及汽车营地，学习其建设发展、资本引入、环境打造等成熟经验做法。。通过实地学习考察，大家增长了见识，拓宽了思路，仔细研究其他县区精品民宿的成功经验，畅谈如何利用本土优势发展铁力市特色民宿，将精品民宿真正做精、做细，促其发展壮大，加速旅游产业提档升级，打造铁力全域旅游新格局。,其他,0.537394754727577,True
62,黑龙江省,伊春市,铁力市召开赴贵阳考察学习座谈会,2022-08-29,http://www.yc.gov.cn/ycsrmzf/c101988/202208/218812.shtml,8月26日，铁力市召开赴贵阳考察学习座谈会，总结学习成果和先进经验，明确前进方向，推动铁力市数字经济更好更快发展。铁力市委书记陈岩主持会议并讲话，铁力市领导吕晓光、尹冬钢、刘铁力、李严、姚佳宇、王卿江出席座谈会，铁力市相关部门负责人参加座谈会。。座谈会上，考察团成员结合赴贵阳市考察学习实际分别发言，畅谈学习心得体会，认真总结贵阳市在发展数字经济方面的先进经验和做法，查找差距和不足，并结合考察学习收获和铁力市实际情况，提出了实施体系优化工程、数字产业突破工程、传统产业赋能工程、数字政府“底线”工程和产业生态建设工程等意见和建议，为铁力市未来数字经济发展助力。。听取汇报后，就提升铁力市数字经济发展工作，陈岩强调，要进一步提高政治站位和思想认识，各单位、各部门要深刻认识发展数字经济对经济社会实现高质量发展的作用和意义，要增强认识、理清思路、坚定信心，充分把握好发展数字经济的大机遇，加快打造发展新引擎。要明确目标方向，适度超前推进数字基础设施建设，持续不断推进工作取得新进展，为推动数字城市建设打好基础。要大力推动数字产业发展，进一步强化顶层设计与部门之间的联动，有效推进铁力市数字经济基础设施建设工作，加快全市数据资源的汇聚、整合及运用，加快推动数字产业化、产业数字化，以数字经济赋能铁力市高质量发展。要加强组织领导，强化组织保障力度，增加专题学习和培训频次，结合铁力市的区位、资源优势，加快数字产业布局，完善信息通信、软件服务等数字产业链，做好数字经济发展课题，不断开创铁力市数字经济发展新局面。。陈岩强调，要以此次赴贵阳市考察学习为契机，认真总结此次考察学习的收获，为加快推进数字经济高质量发展提供有效的决策参考。。会上，组织部、网信办、人社局、工信局、财政局、公安局、智慧办等11家单位和部门负责人作了交流发言。,汤旺县委副书记、县长李东辉带领考察团来到铁力市考察学习城市公共绿地景观建设工作，铁力市园林绿化服务中心负责同志陪同考察。。考察团一行先后来到铁力市儿童公园、抗联陈列馆、骊城书院、美术馆、花卉培育基地、铁力公园、滨河健康主题公园、瞻古园、奋进园以及创业就业基地等点位，实地考察学习铁力市城市绿化建设情况。实地参观考察后，考察团成员与铁力市园林行业工作人员开展深入探讨交流，全方位了解铁力市在城市景观建设中的具体举措、典型经验和成功做法，就工作机制、重点和难点问题等进行广泛交流。。一路看、一路听、一路议、一路评。考察组一致表示，此次考察感触颇深，并对铁力市的城市绿地景观环境营造给予高度评价。希望在今后的学习交流中，两地相互取长补短，加强互动，共同实现城市品位和形象的双提升。,其他,0.5101998210102223,True
62,黑龙江省,伊春市,铁力市委书记陈岩主持召开新经济产业考察学习班座谈研讨会议,2022-06-30,http://www.yc.gov.cn/ycsrmzf/c101988/202206/218337.shtml,6月27日，铁力市委书记陈岩主持召开新经济产业考察学习班座谈研讨会议。铁力市领导王东海、尹冬钢、李兵、娄春阁及考察学习班学员和相关单位负责人参加会议。。陈岩强调，要解放思想，充分利用考察学习班的学习机会，进一步提高思想认识，深入思考，做好企业服务，坚持问计于企，助推铁力市经济发展。要真抓实干，及时将本次考察学习班中学习到的好经验、好做法进行归纳整理，总结学员意见建议，推送到各相关单位推进实施。要结合铁力市实际，深入研究铁力市基层党建、农业发展、红色旅游、园区建设、招商引资、碳汇交易等方面工作，推动铁力市各项事业再上新台阶。。陈岩强调，要进一步丰富旅游产品的多样性，精准定位目标人群，对铁力市红色资源进行整合，打造不同文旅产品，推动配套产业发展。要充分调动民间组织力量，团结引导广大文艺爱好者，发展城市文化，助推城市建设。。陈岩强调，广大党员干部要振奋精神，勤奋有为，通过考察学习，不断提升自身应对困难的能力，坚定发展信心，坚守为民情怀，热爱家乡，热爱岗位，为建设铁力贡献力量。。会上，尹冬钢就本次考察学习班考察学习情况进行了汇报，学习班成员分别结合各自工作实际，畅谈本次学习考察的心得体会，互相交流感受，共同提高学习成效。,为加快打造铁力市经济发展新引擎，进一步深化“能力作风建设”，全面提升铁力市领导干部数字化治理能力、生态文明践行能力、新经济产业培育能力，6月16日至21日，铁力市成立了由铁力市委常委、组织部长尹冬钢带队，铁力市副市长李兵，铁力市政协副主席、住建局局长赵月及铁力市相关部门、各乡镇负责人参加的新经济产业考察组，前往长沙市就智慧农业、乡村振兴、生态文明、生物经济等方面，开展了为期一周的实地考察学习。。6月17日，考察组一行先后到隆平智慧农业创新中心、土流集团考察了智慧农业、数字化土地平台等方面工作。。在隆平智慧农业创新中心，考察组成员边看边问、边听边学，认真学习当地在农业现代化工作中好的经验和做法。。在土流集团，考察组认真听取了土流集团对公司核心业务以及12年来深耕农业农村取得的主要成果与案例。在交流中，考察组一致表示，铁力市依托良好的生态环境、气候条件和黑土资源，始终坚持质量兴农、绿色兴农，不断推进农业生产由总量扩张向质量提升转变，希望在今后的工作中能够与公司进行深度合作，高效整合双方资源与优势，共同助力铁力市乡村振兴再上新台阶。。6月18日，为进一步巩固党史学习教育成果，深化“能力作风建设”，切实增强党员干部的使命感和责任感，铁力市新经济产业考察组在韶山红色教育基地开展了“传承红色基因，践行初心使命”主题党日活动，集体接受革命传统教育，缅怀革命先烈。在鲜艳的党旗前，全体成员满怀崇敬之情，重温入党誓词，不忘入党初心，再次用铿锵有力的宣誓声抒发来自内心对党忠诚的决心。同时参观和瞻仰了毛主席故居，让大家切实感受到了伟人的成长故事和领袖的故乡情怀。大家一致表示，铁力市要深挖抗联精神文化资源，全力打造具有时代特征、地域特色、文化魅力的红色文化，切实讲好铁力市红色故事。以实际行动迎接党的二十大胜利召开。。考察组听取了金洲村村落景区一体化运营中心负责人关于乡村振兴的经验做法介绍，实地感受了金洲村坚持“绿水青山就是金山银山”的发展理念和“党建引领、文旅搭台、经贸唱戏、法治护航”的发展思路。。考察组全体成员一致表示，要学习借鉴长沙县的经验，继续深入推进“党建+”工作，强化基层党组织建设、聚焦乡土人才培育、发展特色产业、深入挖掘文化特色，寻找乡村振兴发力点；不断加快工农乡酒章文创园项目建设，并以年丰乡萌宠部落等民宿为依托，深度开发户外运动、亲子游玩等特色项目，推出一批“两日游”“三日游”精品路线，助力谱写铁力市“三农”发展新篇章，绘就乡村振兴壮美新画卷。。考察组还认真听取了由中南林业科技大学林学院院长、教授李建安作的《生态文明与林业绿色发展——从“双碳”目标谈起》专题培训讲座。使大家进一步深化了对“双碳”行动及生态文明建设的理解和认识，提升了相关专业知识和能力。。听取了远大集团工作人员就企业文化、中央空调产品、空气净化产品、可建技术、建筑节能服务等内容的详细介绍，并在远大集团联网监控中心和产品展示中心，现场观看了全球客户的实时在线数据。。考察组还深入到长沙经济技术开发区进行了考察学习，长沙市经开区是湖南首家国家级经济技术开发区，现已成为中部地区工业发展的核心增长极和重要驱动力。考察组分别到九典制药公司、湖南省医药科技文化馆、湖南省普瑞玛药物研究中心有限公司进行了实地考察学习，并详细了解园区建设及进驻企业生产经营情况。。此外，考察组还对考察学习成果进行了集中研讨，联系自身工作实际找差距、谈感受、话发展，表示要切实把所见所学变成实实在在的举措落到实处，推动铁力市各项工作再上新台阶。,政府领导到其他城市考察学习或访问,0.0,True
