code,province,city,topic,date,url,content,content,label,score
39,辽宁省,丹东市,市人大十六届二次会议第号关于加强养老机构建设的建议的答复,2020-4-13,https://www.dandong.gov.cn/html/DDSZF/202004/0164163197479721.html,市人大十六届二次会议第1079号《关于加强养老机构建设的建议》的答复-市人大代表建议答复-丹东市人民政府。目前，我市共有养老机构134家，床位近万张，其中由社会力量举办的有86家，主要面向普通市民提供全日照料服务。民办机构的收费标准由机构依据设施情况、老人身体状况和市场反馈自行确定，普遍在1000元——4000元之间，基本符合我市居民的收入水平，可以满足不同阶层老年人的需求。2017年以来，我市持续开展了“养老院服务质量建设专项行动”，所有养老机构的服务质量均得到不同程度的提升，机构达标率由最初的不足30%逐步提升到2018年底的70%左右。2019年，国家颁布了《养老机构等级划分与评定》(GB-T37276-2018)国家标准，市民政局将依据上级工作部署适时开展养老机构评级工作。。市民政局和市卫健委积极推动“养老和医疗相结合”工作的开展，支持床位200张以上并符合医疗机构设施审批条件的养老机构申请开办老年病医院、康复医院、护理院、中医医院、临终关怀机构等;支持床位在200张以下的养老机构内设医务室或护理站，为老年人提供优质便捷的医疗服务。对无条件设置医疗机构、医务室或护理站的养老机构，与就近的医疗机构进行签约服务，为入住老年人建立健康档案，提供健康管理和健康指导，开辟就医绿色通道，目前养老机构签约率已达80%以上。。居家和社区养老是养老服务体系的基础与核心，直接关系到绝大多数老年人的生活质量，也是国家积极倡导的养老服务发展方向。今年市民政局党组确定以创新推进养老服务体系建设为主线，以争取国家养老服务改革试点为重点，完善以居家为基础，社区为依托，机构为补充，医养相结合的养老服务体系建设。为此，新增预算862.5万元，主要用于积极支持相关设施建设，购买第三方服务开展老年人能力评估，探索建立全市养老服务综合管理信息平台等。3月份，市民政局专门赴沈阳、盘锦、辽阳等省内已获得资助的试点城市，对居家和社区养老服务工作进行学习和考察;5月19日—24日，由市民政局局长于辉带队，市民政局相关人员及各县(市)区民政局主要领导一行13人，赴江苏省扬州、南京、苏州三地就养老服务工作特别是居家社区养老工作进行了专项学习考察。市民政局将在吸收借鉴外地先进经验的基础上，着手代市政府起草推进全市居家和社区养老服务发展的指导性文件，包括居住区(社区)养老服务设施配建、志愿服务机制、支持社会力量参与的扶持政策和“医养结合”等重点内容。届时，老人在自家门口接受“长期入住”、“短期入住”、“钟点入住”、“上门服务”将成为现实，可以逐步满足老年人多层次的养老需求。。市教育局对发挥职业教育优势，参与养老事业人才培养和技能培训十分重视。根据我市老年事业发展需要，在丹东中医药学校开设的护理专业中，开办了面向社区和老年人康复需要的专业方向，加大相关技能培训。下一步，市民政局将会同市教育局加大对职业学校在康复医养等方面的师资、设施的支持力度，引导职业学校等依托现有的相近专业和办学优势，积极开展面向老年人康复护理需求的技能培训，与社区、医疗、养老机构联合，共同开展相关从业人员的培训。。2014年以来，我市先后设立了民办非营利性养老机构运营补贴、养老机构综合责任保险补贴、养老护理员岗位补贴等多项针对社会力量兴办养老机构的优惠扶持政策，社会力量参与养老服务的积极性不断提高，近两年每年新增民办养老机构10家以上，床位1000张左右。2019年，市民政局还将研究出台民办养老机构建设补贴、护理型床位运营补贴政策，进一步加大扶持力度。,市人大十六届二次会议第1079号《关于加强养老机构建设的建议》的答复-市人大代表建议答复-丹东市人民政府。目前，我市共有养老机构134家，床位近万张，其中由社会力量举办的有86家，主要面向普通市民提供全日照料服务。民办机构的收费标准由机构依据设施情况、老人身体状况和市场反馈自行确定，普遍在1000元——4000元之间，基本符合我市居民的收入水平，可以满足不同阶层老年人的需求。2017年以来，我市持续开展了“养老院服务质量建设专项行动”，所有养老机构的服务质量均得到不同程度的提升，机构达标率由最初的不足30%逐步提升到2018年底的70%左右。2019年，国家颁布了《养老机构等级划分与评定》(GB-T37276-2018)国家标准，市民政局将依据上级工作部署适时开展养老机构评级工作。。市民政局和市卫健委积极推动“养老和医疗相结合”工作的开展，支持床位200张以上并符合医疗机构设施审批条件的养老机构申请开办老年病医院、康复医院、护理院、中医医院、临终关怀机构等;支持床位在200张以下的养老机构内设医务室或护理站，为老年人提供优质便捷的医疗服务。对无条件设置医疗机构、医务室或护理站的养老机构，与就近的医疗机构进行签约服务，为入住老年人建立健康档案，提供健康管理和健康指导，开辟就医绿色通道，目前养老机构签约率已达80%以上。。居家和社区养老是养老服务体系的基础与核心，直接关系到绝大多数老年人的生活质量，也是国家积极倡导的养老服务发展方向。今年市民政局党组确定以创新推进养老服务体系建设为主线，以争取国家养老服务改革试点为重点，完善以居家为基础，社区为依托，机构为补充，医养相结合的养老服务体系建设。为此，新增预算862.5万元，主要用于积极支持相关设施建设，购买第三方服务开展老年人能力评估，探索建立全市养老服务综合管理信息平台等。3月份，市民政局专门赴沈阳、盘锦、辽阳等省内已获得资助的试点城市，对居家和社区养老服务工作进行学习和考察;5月19日—24日，由市民政局局长于辉带队，市民政局相关人员及各县(市)区民政局主要领导一行13人，赴江苏省扬州、南京、苏州三地就养老服务工作特别是居家社区养老工作进行了专项学习考察。市民政局将在吸收借鉴外地先进经验的基础上，着手代市政府起草推进全市居家和社区养老服务发展的指导性文件，包括居住区(社区)养老服务设施配建、志愿服务机制、支持社会力量参与的扶持政策和“医养结合”等重点内容。届时，老人在自家门口接受“长期入住”、“短期入住”、“钟点入住”、“上门服务”将成为现实，可以逐步满足老年人多层次的养老需求。。市教育局对发挥职业教育优势，参与养老事业人才培养和技能培训十分重视。根据我市老年事业发展需要，在丹东中医药学校开设的护理专业中，开办了面向社区和老年人康复需要的专业方向，加大相关技能培训。下一步，市民政局将会同市教育局加大对职业学校在康复医养等方面的师资、设施的支持力度，引导职业学校等依托现有的相近专业和办学优势，积极开展面向老年人康复护理需求的技能培训，与社区、医疗、养老机构联合，共同开展相关从业人员的培训。。2014年以来，我市先后设立了民办非营利性养老机构运营补贴、养老机构综合责任保险补贴、养老护理员岗位补贴等多项针对社会力量兴办养老机构的优惠扶持政策，社会力量参与养老服务的积极性不断提高，近两年每年新增民办养老机构10家以上，床位1000张左右。2019年，市民政局还将研究出台民办养老机构建设补贴、护理型床位运营补贴政策，进一步加大扶持力度。,政府领导到其他城市考察学习或访问,0.5784288917356466
39,辽宁省,丹东市,省政协十二届二次会议关于加快我市旅游住宿业健康发展的建议第号的答复,2019-7-11,https://www.dandong.gov.cn/html/DDSZF/201907/0164162831873965.html,"省政协十二届二次会议《关于加快我市旅游住宿业健康发展的建议》（第0084号）的答复-省政协十二届二次会议2019年-丹东市人民政府。省政协十二届二次会议《关于加快我市 旅游住宿业健康发展的建议》（第0084号）的答复。近年来，我市紧密围绕“放管服”改革，通过开辟旅游市场主体准入“绿色通道”、优化简化企业网上登记程序、实施减税降费优惠政策等多种措施，鼓励和扶持各类市场主体积极参与旅游住宿业经营，旅游住宿业总量特别是经济型、民宿型住宿产品数量逐年提高，但仍难以满足旅游旺季旅丹游客的住宿需求。以2019年“五一”小长假为例，我市重点监测的星级酒店假日高峰时段床位出租率均为100%。而高峰时段过后，床位出租率立即回落，市区星级酒店为40%左右、县方星级酒店为30%左右。由此可见，除高峰时段以外我市旅游住宿总量完全能够满足游客住宿需求。。为了促进我市旅游住宿业发展供需平衡，加快推进旅游住宿业供给侧改革,以科学的政策引导产业健康发展,目前，我们正在研究启用旅游大数据监测平台相关事宜，用于科学分析研判客源分布、消费能力和住宿需求等要素，从而引导市场均衡发展一批不同形式、不同档次、不同规模和不同文化主题的旅游住宿设施，切实满足不同层次游客的住宿需求。力争于今年十一前正式应用该平台。。多年来，我市已发展了一批以温泉休闲度假为主题的旅游娱乐住宿综合体设施，如宗裕温泉度假区、北黄海温泉度假区、天沐温泉等，有效提升了我市旅游住宿综合体的规模和品质。而国际化的知名高端型旅游娱乐住宿综合体项目却仍是我市旅游住宿的短板，尽管我们一直在积极的招商引资，但效果甚微。原因是丹东属四线类城市，本地市民高端消费水平不足，并且旅游业淡旺季分明，在全国住宿行业市场利润微薄的大环境下，知名、高端品牌商看不到可观的效益，没有投资意向。。当前，我们正在全力推进本土现有的旅游住宿项目的转型升级，打造我们自有知名品牌。一是宗裕城温泉度假区启动实施了整体改造和提质升级工程，市文化旅游广电局已邀请旅游专家对其进行实地建设指导，计划于今年6月底完工并争创国家4A级旅游景区，力争打造集游览观光、餐饮娱乐和休闲度假于一体的中高端旅游住宿综合体。二是北黄海温泉度假区正在积极筹备二、三期建设工程，拟建设温泉馆、全国最大的室内造浪馆、会议中心、客房、餐厅、室外戏水区、海洋水族馆等功能区以及一座以医疗、康复、养老为主体的综合性服务中心。目前，项目正在调规阶段，力争年底前开工，三年内完工。项目建成后，将成为我市地域特色鲜明、住宿容量充足、休闲内容丰富的大型温泉度假区。。近年来，在市场需求的推动下，我市日租房、农家乐、民宿数量和规模急剧扩张。为了促进其高品质发展，我市出台了《乡村旅游发展专项规划(2018-2030)》、《沟域旅游发展专项规划(2018-2030)》，将旅游住宿业纳入乡村旅游业全局统筹规划，为乡村旅游住宿的特色化、差异化发展提供了重要参考。旅游部门还曾多次组织县区有关部门、重点乡镇村领导分批赴浙江、江苏、山东、葫芦岛等地学习考察，了解先进地区民宿旅游发展的经验，成效显著，打造出61家星级农家乐和13家精品民宿，在乡村地区形成了以景区为依托，并辐射周边的农家乐聚集区，基本满足了游客乡村旅游的住宿需求。。众所周知，“携程网”、“途家网”、“去哪儿网”等大型旅游住宿电子平台已发展的非常成熟，市场占有率很高。据统计，我市所有3星级以上酒店目前均已与这类旅游APP平台建立合作，并实现了在线服务、网络营销、网上预订、网上支付。其他非星级住宿单位的上线率也达到90%以上。","省政协十二届二次会议《关于加快我市旅游住宿业健康发展的建议》（第0084号）的答复-省政协十二届二次会议2019年-丹东市人民政府。省政协十二届二次会议《关于加快我市 旅游住宿业健康发展的建议》（第0084号）的答复。近年来，我市紧密围绕“放管服”改革，通过开辟旅游市场主体准入“绿色通道”、优化简化企业网上登记程序、实施减税降费优惠政策等多种措施，鼓励和扶持各类市场主体积极参与旅游住宿业经营，旅游住宿业总量特别是经济型、民宿型住宿产品数量逐年提高，但仍难以满足旅游旺季旅丹游客的住宿需求。以2019年“五一”小长假为例，我市重点监测的星级酒店假日高峰时段床位出租率均为100%。而高峰时段过后，床位出租率立即回落，市区星级酒店为40%左右、县方星级酒店为30%左右。由此可见，除高峰时段以外我市旅游住宿总量完全能够满足游客住宿需求。。为了促进我市旅游住宿业发展供需平衡，加快推进旅游住宿业供给侧改革,以科学的政策引导产业健康发展,目前，我们正在研究启用旅游大数据监测平台相关事宜，用于科学分析研判客源分布、消费能力和住宿需求等要素，从而引导市场均衡发展一批不同形式、不同档次、不同规模和不同文化主题的旅游住宿设施，切实满足不同层次游客的住宿需求。力争于今年十一前正式应用该平台。。多年来，我市已发展了一批以温泉休闲度假为主题的旅游娱乐住宿综合体设施，如宗裕温泉度假区、北黄海温泉度假区、天沐温泉等，有效提升了我市旅游住宿综合体的规模和品质。而国际化的知名高端型旅游娱乐住宿综合体项目却仍是我市旅游住宿的短板，尽管我们一直在积极的招商引资，但效果甚微。原因是丹东属四线类城市，本地市民高端消费水平不足，并且旅游业淡旺季分明，在全国住宿行业市场利润微薄的大环境下，知名、高端品牌商看不到可观的效益，没有投资意向。。当前，我们正在全力推进本土现有的旅游住宿项目的转型升级，打造我们自有知名品牌。一是宗裕城温泉度假区启动实施了整体改造和提质升级工程，市文化旅游广电局已邀请旅游专家对其进行实地建设指导，计划于今年6月底完工并争创国家4A级旅游景区，力争打造集游览观光、餐饮娱乐和休闲度假于一体的中高端旅游住宿综合体。二是北黄海温泉度假区正在积极筹备二、三期建设工程，拟建设温泉馆、全国最大的室内造浪馆、会议中心、客房、餐厅、室外戏水区、海洋水族馆等功能区以及一座以医疗、康复、养老为主体的综合性服务中心。目前，项目正在调规阶段，力争年底前开工，三年内完工。项目建成后，将成为我市地域特色鲜明、住宿容量充足、休闲内容丰富的大型温泉度假区。。近年来，在市场需求的推动下，我市日租房、农家乐、民宿数量和规模急剧扩张。为了促进其高品质发展，我市出台了《乡村旅游发展专项规划(2018-2030)》、《沟域旅游发展专项规划(2018-2030)》，将旅游住宿业纳入乡村旅游业全局统筹规划，为乡村旅游住宿的特色化、差异化发展提供了重要参考。旅游部门还曾多次组织县区有关部门、重点乡镇村领导分批赴浙江、江苏、山东、葫芦岛等地学习考察，了解先进地区民宿旅游发展的经验，成效显著，打造出61家星级农家乐和13家精品民宿，在乡村地区形成了以景区为依托，并辐射周边的农家乐聚集区，基本满足了游客乡村旅游的住宿需求。。众所周知，“携程网”、“途家网”、“去哪儿网”等大型旅游住宿电子平台已发展的非常成熟，市场占有率很高。据统计，我市所有3星级以上酒店目前均已与这类旅游APP平台建立合作，并实现了在线服务、网络营销、网上预订、网上支付。其他非星级住宿单位的上线率也达到90%以上。",其他,0.710556374131445
39,辽宁省,丹东市,市政协十五届二次会议第号关于加大蓝莓产业种植结构调整和扶持力度的建议的答复,2020-5-11,https://www.dandong.gov.cn/html/DDSZF/202005/0164163194579287.html,市政协十五届二次会议第1-34号《关于加大蓝莓产业种植结构调整和扶持力度的建议》的答复-市政协提案答复-丹东市人民政府。市政协十五届二次会议第1-34号《关于加大蓝莓产业 种植结构调整和扶持力度的建议》的答复。我市自1998年引入蓝莓试栽并获得成功后，我市依托独具的区位优势、良好的生态优势和丰富的资源优势，坚持突出特色，不断优化调整种植业产业结构，大力发展蓝莓产业，取得了比较明显的成效。但是蓝莓作为我市新兴的特色产业，随着生产规模的不断扩大，诸如品种、栽培方式、配套技术等方面的问题也逐渐显现，制约了蓝莓产业的发展。为有效解决这些问题，推进我市蓝莓产业的健康持续发展，重点做了以下工作。。一、加大政策扶持。积极争取国家和省级相关项目资金，扩大资金来源渠道，支持蓝莓产业发展。一是各地充分利用国家乡村振兴项目资金，支持村集体发展蓝莓产业;二是充分利用种植结构调整资金，支持发展设施蓝莓生产。对2018年在耕地上新建并保证长期稳定使用的，集中连片设施内面积5亩以上(含5亩)的日光温室、钢架冷棚小区，按实际测量的面积折标给予补贴。温室小区每亩补贴6586元，冷棚小区每亩补贴1646元，全市共补贴温室小区4275.7亩，冷棚小区3348.72亩，补贴资金3367.18万元。。二、强化科研保障。一是开展蓝莓种质资源收集、选育和栽培技术研究工作。目前全市已建立蓝莓资源圃2处，引进、收集蓝莓品种资源近30份，并对蓝莓的品种特性、配套栽培管理技术等进行研究，为不断优化调整蓝莓品种提供依据。二是总结、归纳、提升现有栽培管理技术模式，为发展蓝莓产业提供技术服务支撑。。三、加强技术培训服务。一是通过新型职业农民培育工程，加强科技实用人才的培养，开展有针对性的技术培训和指导服务，解决生产问题，提高农民生产技术水平，适应蓝莓产业发展的需要。二是通过“请进来”，聘请专家进行实地指导;通过“走出去”，组织农户进行考察学习，切实解决生产中存在的问题。。四、发挥协会和新型经营主体作用。一是充分发挥丹东市蓝莓协会的组织协调作用，适时地组织协调生产、销售和市场开发，促进生产基地间的联合发展，增强市场竞争能力，促进蓝莓产业的健康发展。二是鼓励和支持农民组建各类专业合作组织和家庭农场，规范运作行为，提高农民生产经营的组织化程度，不断提升农民参与市场竞争的能力和水平。积极培育小浆果种植、加工、销售等主营单一或混合型龙头企业，通过“企业+基地+农户”、“企业+合作社+农户”等经营模式，带动农民稳步发展蓝莓产业。三是培育建设示范基地，发挥基地的先导、示范和辐射作用，示范引导蓝莓产业发展。,市政协十五届二次会议第1-34号《关于加大蓝莓产业种植结构调整和扶持力度的建议》的答复-市政协提案答复-丹东市人民政府。市政协十五届二次会议第1-34号《关于加大蓝莓产业 种植结构调整和扶持力度的建议》的答复。我市自1998年引入蓝莓试栽并获得成功后，我市依托独具的区位优势、良好的生态优势和丰富的资源优势，坚持突出特色，不断优化调整种植业产业结构，大力发展蓝莓产业，取得了比较明显的成效。但是蓝莓作为我市新兴的特色产业，随着生产规模的不断扩大，诸如品种、栽培方式、配套技术等方面的问题也逐渐显现，制约了蓝莓产业的发展。为有效解决这些问题，推进我市蓝莓产业的健康持续发展，重点做了以下工作。。一、加大政策扶持。积极争取国家和省级相关项目资金，扩大资金来源渠道，支持蓝莓产业发展。一是各地充分利用国家乡村振兴项目资金，支持村集体发展蓝莓产业;二是充分利用种植结构调整资金，支持发展设施蓝莓生产。对2018年在耕地上新建并保证长期稳定使用的，集中连片设施内面积5亩以上(含5亩)的日光温室、钢架冷棚小区，按实际测量的面积折标给予补贴。温室小区每亩补贴6586元，冷棚小区每亩补贴1646元，全市共补贴温室小区4275.7亩，冷棚小区3348.72亩，补贴资金3367.18万元。。二、强化科研保障。一是开展蓝莓种质资源收集、选育和栽培技术研究工作。目前全市已建立蓝莓资源圃2处，引进、收集蓝莓品种资源近30份，并对蓝莓的品种特性、配套栽培管理技术等进行研究，为不断优化调整蓝莓品种提供依据。二是总结、归纳、提升现有栽培管理技术模式，为发展蓝莓产业提供技术服务支撑。。三、加强技术培训服务。一是通过新型职业农民培育工程，加强科技实用人才的培养，开展有针对性的技术培训和指导服务，解决生产问题，提高农民生产技术水平，适应蓝莓产业发展的需要。二是通过“请进来”，聘请专家进行实地指导;通过“走出去”，组织农户进行考察学习，切实解决生产中存在的问题。。四、发挥协会和新型经营主体作用。一是充分发挥丹东市蓝莓协会的组织协调作用，适时地组织协调生产、销售和市场开发，促进生产基地间的联合发展，增强市场竞争能力，促进蓝莓产业的健康发展。二是鼓励和支持农民组建各类专业合作组织和家庭农场，规范运作行为，提高农民生产经营的组织化程度，不断提升农民参与市场竞争的能力和水平。积极培育小浆果种植、加工、销售等主营单一或混合型龙头企业，通过“企业+基地+农户”、“企业+合作社+农户”等经营模式，带动农民稳步发展蓝莓产业。三是培育建设示范基地，发挥基地的先导、示范和辐射作用，示范引导蓝莓产业发展。,政府领导到其他城市考察学习或访问,0.678975877704903
