code,province,city,topic,date,url,content,content,label,score
37,辽宁省,抚顺市,新宾旅游局组织家农家乐业主赴北京考察学习,2016-11-24,https://www.fushun.gov.cn/ywdt/001002/20161124/cba35005-d4ce-4133-a970-38dae65def30.html,日前，新宾旅游局组织29位农家乐业主组成考察团，到北京开展为期三天的乡村旅游和农家乐发展考察学习。 考察团参观了北京部分旅游村落的特色庭院、民俗建筑；学习农家乐特色菜制作和饮食文化。业主们纷纷表示，此次考察为农家乐发展提供了新的思路和管理经营理念，为下一步满族特色农家院的品牌打造提供了参考。,日前，新宾旅游局组织29位农家乐业主组成考察团，到北京开展为期三天的乡村旅游和农家乐发展考察学习。 考察团参观了北京部分旅游村落的特色庭院、民俗建筑；学习农家乐特色菜制作和饮食文化。业主们纷纷表示，此次考察为农家乐发展提供了新的思路和管理经营理念，为下一步满族特色农家院的品牌打造提供了参考。,其他,0.7088433155251742
37,辽宁省,抚顺市,抚顺市供销社一行到铁岭西丰县供销社考察学习,2018-05-15,https://www.fushun.gov.cn/ywdt/001003/20180515/078fd9c8-9cbf-4a5c-886e-78985eb3e31e.html,近日，为深入推进供销社综合改革，不断提升为农服务能力和水平，市供销社理事会副主任张瑞国率领县区供销社20余人到铁岭西丰县供销社考察学习，主要学习供销社基层组织恢复重建和社有资产投资运营管理等方面工作经验。铁岭西丰县供销社的为农服务中心是通过与种植大户、农资经销企业、电商服务中心等多种形式组建的，服务项目有农资代购、搭建农户与农资生产企业对接平台；通过互联网平台进行宣传、销售地产农产品，扩大了市场面，使更多人了解本地农产品。 通过学习、交流，考察组深受启发，触动很大，大家表示要学习借鉴西丰县供销社好做法、好经验，着力在深化供销社综合改革上因地制宜，开阔思路，创新方法途径，打开突破口，形成新亮点。,近日，为深入推进供销社综合改革，不断提升为农服务能力和水平，市供销社理事会副主任张瑞国率领县区供销社20余人到铁岭西丰县供销社考察学习，主要学习供销社基层组织恢复重建和社有资产投资运营管理等方面工作经验。铁岭西丰县供销社的为农服务中心是通过与种植大户、农资经销企业、电商服务中心等多种形式组建的，服务项目有农资代购、搭建农户与农资生产企业对接平台；通过互联网平台进行宣传、销售地产农产品，扩大了市场面，使更多人了解本地农产品。 通过学习、交流，考察组深受启发，触动很大，大家表示要学习借鉴西丰县供销社好做法、好经验，着力在深化供销社综合改革上因地制宜，开阔思路，创新方法途径，打开突破口，形成新亮点。,其他,0.5108827270937549
37,辽宁省,抚顺市,省委有关部委召开会议传达学习习近平总书记在辽宁考察时重要讲话精神,2022-08-23,https://www.fushun.gov.cn/ywdt/001004/20220823/8f3f7593-d3a6-4564-a160-65a129d0b7c2.html,省纪委召开常委会扩大会议，传达学习习近平总书记在辽宁考察时的重要讲话精神及省委常委会扩大会议精神，安排部署贯彻落实工作。会议强调，要把学习贯彻习近平总书记重要讲话精神作为一项重要政治任务，同学习贯彻习近平总书记关于东北、辽宁振兴发展的重要讲话和指示精神结合起来，一体学习领会、一体贯彻落实，切实把学习成果转化为坚决落实的强劲动力、思路举措、实际成效。要深刻领会习近平总书记关于传承红色基因的重要要求，确保红色江山后继有人、代代相传。要深刻领会习近平总书记对辽宁的关怀和期待，不断增强新时代东北全面振兴的信心和决心。要深刻领会习近平总书记关于人民至上的重要要求，把时刻关心群众冷暖安危的工作做实做细，深入开展万件化访行动及基层“微腐败”大清扫，确保实现老百姓的幸福梦。要加强政治监督，全力推动习近平总书记关于奋力开创辽宁振兴发展新局面的殷殷嘱托转化为全省党员干部的实际行动。要深入推进全面从严治党，保持反腐高压态势，持续净化政治生态，用实际行动和工作成效迎接党的二十大胜利召开。。省委组织部召开部务会（扩大）会议，传达学习习近平总书记在辽宁考察时的重要讲话精神及省委常委会扩大会议精神，安排部署贯彻落实工作。会议强调，要深入学习贯彻习近平总书记在辽宁考察时的重要讲话精神，深刻领悟“两个确立”的决定性意义，增强“四个意识”、坚定“四个自信”、做到“两个维护”，坚决贯彻新时代党的建设总要求和新时代党的组织路线，不断提高组织工作质量和水平。深刻领会习近平总书记关于传承红色基因的重要要求，教育引导广大党员干部把学习党史作为必修课和常修课，从党史中汲取智慧和力量，永葆初心使命、勇于担当作为。深刻领会习近平总书记关于创新驱动发展的重要要求，落实好“十四五”人才发展规划，深入实施“兴辽英才计划”，加快建设集聚人才的创新平台，注重发现和培养青年科技人才，发挥人才对科技创新的支撑作用。深刻领会习近平总书记关于加强社区基层党组织建设的重要要求，抓好党建引领基层治理工作，做实做细社区网格化管理，加强社区工作者队伍建设，深化智慧党群服务系统建设，不断提升社区精细化治理、精准化服务水平，让群众感受到党组织就在身边。。省委统战部召开会议，传达学习习近平总书记在辽宁考察时的重要讲话精神及省委常委会扩大会议精神，安排部署学习贯彻工作。会议强调，习近平总书记始终对辽宁高度重视、深情牵挂、亲切关怀，在辽宁考察时一路殷殷嘱托、一路悉心指导、一路打气鼓劲，希望辽宁“在新时代东北振兴上展现更大担当和作为”，全省统战干部和广大统一战线成员备受鼓舞、充满干劲。全省统一战线要把学习贯彻习近平总书记在辽宁考察时的重要讲话精神作为当前和今后一个时期的重要政治任务，广泛凝聚政治共识，深刻领悟“两个确立”的决定性意义，增强“四个意识”、坚定“四个自信”、做到“两个维护”。要充分发挥统一战线重要法宝作用，深入开展“统战促振兴”专项行动，支持各民主党派开展“好参谋、好帮手、好同事”主题实践活动，进一步铸牢中华民族共同体意识，强化党外知识分子和新的社会阶层人士思想政治引领，促进“两个健康”，加强与港澳台和海外代表人士的交流交往，着力防范化解统战领域风险隐患，最大限度地凝聚人心、汇聚力量，为党的二十大胜利召开营造良好的政治、经济和社会环境。,省纪委召开常委会扩大会议，传达学习习近平总书记在辽宁考察时的重要讲话精神及省委常委会扩大会议精神，安排部署贯彻落实工作。会议强调，要把学习贯彻习近平总书记重要讲话精神作为一项重要政治任务，同学习贯彻习近平总书记关于东北、辽宁振兴发展的重要讲话和指示精神结合起来，一体学习领会、一体贯彻落实，切实把学习成果转化为坚决落实的强劲动力、思路举措、实际成效。要深刻领会习近平总书记关于传承红色基因的重要要求，确保红色江山后继有人、代代相传。要深刻领会习近平总书记对辽宁的关怀和期待，不断增强新时代东北全面振兴的信心和决心。要深刻领会习近平总书记关于人民至上的重要要求，把时刻关心群众冷暖安危的工作做实做细，深入开展万件化访行动及基层“微腐败”大清扫，确保实现老百姓的幸福梦。要加强政治监督，全力推动习近平总书记关于奋力开创辽宁振兴发展新局面的殷殷嘱托转化为全省党员干部的实际行动。要深入推进全面从严治党，保持反腐高压态势，持续净化政治生态，用实际行动和工作成效迎接党的二十大胜利召开。。省委组织部召开部务会（扩大）会议，传达学习习近平总书记在辽宁考察时的重要讲话精神及省委常委会扩大会议精神，安排部署贯彻落实工作。会议强调，要深入学习贯彻习近平总书记在辽宁考察时的重要讲话精神，深刻领悟“两个确立”的决定性意义，增强“四个意识”、坚定“四个自信”、做到“两个维护”，坚决贯彻新时代党的建设总要求和新时代党的组织路线，不断提高组织工作质量和水平。深刻领会习近平总书记关于传承红色基因的重要要求，教育引导广大党员干部把学习党史作为必修课和常修课，从党史中汲取智慧和力量，永葆初心使命、勇于担当作为。深刻领会习近平总书记关于创新驱动发展的重要要求，落实好“十四五”人才发展规划，深入实施“兴辽英才计划”，加快建设集聚人才的创新平台，注重发现和培养青年科技人才，发挥人才对科技创新的支撑作用。深刻领会习近平总书记关于加强社区基层党组织建设的重要要求，抓好党建引领基层治理工作，做实做细社区网格化管理，加强社区工作者队伍建设，深化智慧党群服务系统建设，不断提升社区精细化治理、精准化服务水平，让群众感受到党组织就在身边。。省委统战部召开会议，传达学习习近平总书记在辽宁考察时的重要讲话精神及省委常委会扩大会议精神，安排部署学习贯彻工作。会议强调，习近平总书记始终对辽宁高度重视、深情牵挂、亲切关怀，在辽宁考察时一路殷殷嘱托、一路悉心指导、一路打气鼓劲，希望辽宁“在新时代东北振兴上展现更大担当和作为”，全省统战干部和广大统一战线成员备受鼓舞、充满干劲。全省统一战线要把学习贯彻习近平总书记在辽宁考察时的重要讲话精神作为当前和今后一个时期的重要政治任务，广泛凝聚政治共识，深刻领悟“两个确立”的决定性意义，增强“四个意识”、坚定“四个自信”、做到“两个维护”。要充分发挥统一战线重要法宝作用，深入开展“统战促振兴”专项行动，支持各民主党派开展“好参谋、好帮手、好同事”主题实践活动，进一步铸牢中华民族共同体意识，强化党外知识分子和新的社会阶层人士思想政治引领，促进“两个健康”，加强与港澳台和海外代表人士的交流交往，着力防范化解统战领域风险隐患，最大限度地凝聚人心、汇聚力量，为党的二十大胜利召开营造良好的政治、经济和社会环境。,其他,0.5682227981902517
37,辽宁省,抚顺市,省委理论学习中心组召开专题学习会议深入学习贯彻习近平总书记在辽宁考察时重要讲话精神在新时代东北振兴上展现更大担当和作为,2022-08-27,https://www.fushun.gov.cn/ywdt/001004/20220827/c549e4ea-1f74-4094-b2e6-8206ca758b13.html,省委理论学习中心组召开专题学习会议 深入学习贯彻习近平总书记在辽宁考察时重要讲话精神 在新时代东北振兴上展现更大担当和作为_抚顺市人民政府。8月26日，省委理论学习中心组召开专题学习会议，深入学习领会习近平总书记在辽宁考察时的重要讲话精神，聚焦习近平总书记强调的“在新时代东北振兴上展现更大担当和作为”，谈体会谈认识谈打算，把学习贯彻工作引向深入。省委书记张国清主持会议并讲话，省委副书记、省长李乐成发言，省政协主席周波出席。。会议指出，习近平总书记在辽宁考察时的重要讲话，饱含着对辽宁人民的深情牵挂、对辽宁干部的谆谆嘱托、对辽宁工作的殷切期望，特别是要求辽宁在新时代东北振兴上展现更大担当和作为，饱含深意、催人奋进。我们要深刻领悟、把握要义，将其作为辽宁必须完成好的政治任务、必须担负起的历史使命、必须实现的目标定位，牢记“国之大者”，增强责任感使命感紧迫感，知责担责、知重负重，以更高站位、更大格局、更宽视野谋划推动辽宁振兴发展，在新时代东北振兴中发挥更大作用，不断提升维护国家“五大安全”能力，加快实现全面振兴全方位振兴新突破，形成对国家重大战略强有力支撑，以实际行动向习近平总书记和党中央交上满意答卷。。会议强调，在新时代东北振兴上展现更大担当和作为，全省各级领导干部要以身作则、以上率下，以更加昂扬向上的精神状态和顽强的斗争精神，当好辽宁全面振兴全方位振兴的骨干中坚。要有只争朝夕的拼劲，进一步增强紧迫感，养成立说立行、雷厉风行的作风，各项工作都要抓紧推进、提速提效，决不辜负习近平总书记和党中央的殷切期望。要有敢于斗争的狠劲，坚定斗争意志，增强斗争本领，直面矛盾、勇于攻坚，该做的事顶着压力也要干，该负的责冒着风险也要担，直面问题、决不“绕道”。要有狠抓落实的韧劲，长期坚持、锲而不舍，以钉钉子精神落实好习近平总书记关于东北、辽宁振兴发展的重要讲话和指示精神，一步一个脚印地把习近平总书记为辽宁擘画的振兴发展蓝图变为现实。,省委理论学习中心组召开专题学习会议 深入学习贯彻习近平总书记在辽宁考察时重要讲话精神 在新时代东北振兴上展现更大担当和作为_抚顺市人民政府。8月26日，省委理论学习中心组召开专题学习会议，深入学习领会习近平总书记在辽宁考察时的重要讲话精神，聚焦习近平总书记强调的“在新时代东北振兴上展现更大担当和作为”，谈体会谈认识谈打算，把学习贯彻工作引向深入。省委书记张国清主持会议并讲话，省委副书记、省长李乐成发言，省政协主席周波出席。。会议指出，习近平总书记在辽宁考察时的重要讲话，饱含着对辽宁人民的深情牵挂、对辽宁干部的谆谆嘱托、对辽宁工作的殷切期望，特别是要求辽宁在新时代东北振兴上展现更大担当和作为，饱含深意、催人奋进。我们要深刻领悟、把握要义，将其作为辽宁必须完成好的政治任务、必须担负起的历史使命、必须实现的目标定位，牢记“国之大者”，增强责任感使命感紧迫感，知责担责、知重负重，以更高站位、更大格局、更宽视野谋划推动辽宁振兴发展，在新时代东北振兴中发挥更大作用，不断提升维护国家“五大安全”能力，加快实现全面振兴全方位振兴新突破，形成对国家重大战略强有力支撑，以实际行动向习近平总书记和党中央交上满意答卷。。会议强调，在新时代东北振兴上展现更大担当和作为，全省各级领导干部要以身作则、以上率下，以更加昂扬向上的精神状态和顽强的斗争精神，当好辽宁全面振兴全方位振兴的骨干中坚。要有只争朝夕的拼劲，进一步增强紧迫感，养成立说立行、雷厉风行的作风，各项工作都要抓紧推进、提速提效，决不辜负习近平总书记和党中央的殷切期望。要有敢于斗争的狠劲，坚定斗争意志，增强斗争本领，直面矛盾、勇于攻坚，该做的事顶着压力也要干，该负的责冒着风险也要担，直面问题、决不“绕道”。要有狠抓落实的韧劲，长期坚持、锲而不舍，以钉钉子精神落实好习近平总书记关于东北、辽宁振兴发展的重要讲话和指示精神，一步一个脚印地把习近平总书记为辽宁擘画的振兴发展蓝图变为现实。,其他,0.507086955339018
37,辽宁省,抚顺市,斐济卫生部考察团来我区参观考察社区卫生工作,2017-12-20,https://www.fushun.gov.cn/ywdt/001002/20171220/d84eac02-7317-4dbf-8d1c-6d930c08b2de.html,近日，斐济卫生部代表团在抚顺市卫计委副主任袁莉、副区长姜红、卫计局局长邓昊等领导的陪同下，到抚顺城街道社区卫生服务中心参观、考察。抚顺城街道社区卫生服务中心主任娄晓春向参观学习的考察团介绍医院基本情况及中草药饮片和中草药颗粒制剂相关知识。中医科陈敏主任和中医科王一霖主任讲解中医怎么辩证糖尿病和糖尿病的“针灸疗法”。斐济考察团人员对此处参观学习给予感谢并同医院人员合影留念！,近日，斐济卫生部代表团在抚顺市卫计委副主任袁莉、副区长姜红、卫计局局长邓昊等领导的陪同下，到抚顺城街道社区卫生服务中心参观、考察。抚顺城街道社区卫生服务中心主任娄晓春向参观学习的考察团介绍医院基本情况及中草药饮片和中草药颗粒制剂相关知识。中医科陈敏主任和中医科王一霖主任讲解中医怎么辩证糖尿病和糖尿病的“针灸疗法”。斐济考察团人员对此处参观学习给予感谢并同医院人员合影留念！,其他,0.5164310885104649
37,辽宁省,抚顺市,吉林省延边林管局长白山森工集团到抚顺市学习考察林地经济工作,2016-04-22,https://www.fushun.gov.cn/ywdt/001003/20160422/a004267f-9e96-4edc-851b-c360b5755c63.html,4月20日至21日，吉林省延边林管局（长白山森工集团）资源开发部部长朴永春、副部长张玉国带领敦化林业局资源开发管理部部长成君、大石头林业局资源开发管理部部长丁勇、白河林业局资源开发管理部部长李保峰、安图森林经营局资源开发管理部部长王延生等一行6人到抚顺市学习考察林地经济工作。考察组一行在抚顺市林业局副局长胥维佳、产业处处长杨玉柱同志的陪同下，在清原县参观了城郊南长岭、大边沟草皮沟岭、湾甸子砍椽沟等地林下刺龙芽、刺五加、大叶芹等基地。在新宾县参观了永陵镇错草村新宾县和丰林下中药材专业合作社野山参生产、加工基地；新宾镇民主村苏子沟云杉、杂交榛子林下蕨菜生产基地；永陵镇赫图阿拉村蒋家沟黑木耳、绿化苗木、果树综合开发项目等。新宾县林业局局长贾深、清原县林业局副局长于峰分别向考察组一行介绍了全县发展林地经济的基本情况。通过实地参观考察和听取情况介绍，考察组一行对抚顺市发展林地经济工作所取得的成果给予充分肯定和高度评价，认为抚顺市在发展林地经济方面有较高的知名度，特色明显、效益突出，有许多新模式、新方法和新技术值得学习和借鉴。,4月20日至21日，吉林省延边林管局（长白山森工集团）资源开发部部长朴永春、副部长张玉国带领敦化林业局资源开发管理部部长成君、大石头林业局资源开发管理部部长丁勇、白河林业局资源开发管理部部长李保峰、安图森林经营局资源开发管理部部长王延生等一行6人到抚顺市学习考察林地经济工作。考察组一行在抚顺市林业局副局长胥维佳、产业处处长杨玉柱同志的陪同下，在清原县参观了城郊南长岭、大边沟草皮沟岭、湾甸子砍椽沟等地林下刺龙芽、刺五加、大叶芹等基地。在新宾县参观了永陵镇错草村新宾县和丰林下中药材专业合作社野山参生产、加工基地；新宾镇民主村苏子沟云杉、杂交榛子林下蕨菜生产基地；永陵镇赫图阿拉村蒋家沟黑木耳、绿化苗木、果树综合开发项目等。新宾县林业局局长贾深、清原县林业局副局长于峰分别向考察组一行介绍了全县发展林地经济的基本情况。通过实地参观考察和听取情况介绍，考察组一行对抚顺市发展林地经济工作所取得的成果给予充分肯定和高度评价，认为抚顺市在发展林地经济方面有较高的知名度，特色明显、效益突出，有许多新模式、新方法和新技术值得学习和借鉴。,其他,0.5447568364330924
