code,province,city,topic,date,url,content,content,label,score
42,辽宁省,阜新市,省交通运输厅刘俊副厅长一行来我市调研地方铁路工作,2024-07-10,https://www.fuxin.gov.cn/content/2024/925569.html,阜新，寓意“物阜民丰，焕然一新”，1940年置市。位于辽宁省西北部，东接沈阳市，南邻锦州市，西连朝阳市，北靠内蒙古自治区。全市总面积10326平方千米，其中城市建成区76.5平方千米。下辖2县5区及1个国家级高新技术产业开发区。全市常住人口173.9万人，其中城镇人口102.9万人。阜新是全国第一个资源型城市经济转型试点市、国家扶贫改革试验区，也是国家首批循环经济试点市之一、“中国优秀旅游城市”、首批全国篮球城和省级园林城市。。7月9日，辽宁省交通运输厅副厅长刘俊带领厅铁建处一行6人来阜调研地方铁路工作，到基层单位开展党纪教育宣讲活动。市政府副秘书长田阔，市交通运输局、市发改委、市路矿重组专班、中国铁路沈阳局集团有限公司锦州工程建设指挥部、巴新铁路有限责任公司等领导参加。。省厅调研组一行先后到国铁新邱站、巴新铁路白玉都站进行实地调研，考察了国铁新邱站和巴新铁路白玉都站的运行情况，参观了车辆调度室和运输场站，听取了铁路部门介绍现阶段客、货运输情况及国铁与地方铁路互联互通情况。。随后，刘俊副厅长在巴新铁路公务轨道车上与企业和部门进行了面对面交流座谈。巴新铁路有限责任公司董事长潘基平就巴新铁路当前现状、运营情况、运量和运输收入情况、长期规划等方面进行系统的汇报；市路矿重组专班副主任石玉明对巴新铁路路矿重组进展情况做了详细说明；市交通运输局局长邹亮就当前交通运输工作进展和铁路规划进行全面汇报。。最后，刘俊副厅长对本次调研工作作了重要讲话，一是提高政治站位，交通系统要全力发挥排头兵的作用，争做东北振兴当头马，为全面振兴三年行动攻坚战中贡献交通力量；二是全面加强“公转铁”运输结构调整，充分发挥铁路运输的重要作用，提高地方铁路综合运输服务能力；三是进一步加强地方铁路运营、投资方式、安全保障等方面管理措施，建立科学合理的长效机制。。调研结束后，刘俊副厅长与巴新铁路白玉都站的基层党员干部开展了党纪教育宣讲活动。通过增强党纪学习教育，认真领会《条例》内容要义，抓好交通运输工作落实，推进党纪教育取得实效等方面进行了深入交流。,阜新，寓意“物阜民丰，焕然一新”，1940年置市。位于辽宁省西北部，东接沈阳市，南邻锦州市，西连朝阳市，北靠内蒙古自治区。全市总面积10326平方千米，其中城市建成区76.5平方千米。下辖2县5区及1个国家级高新技术产业开发区。全市常住人口173.9万人，其中城镇人口102.9万人。阜新是全国第一个资源型城市经济转型试点市、国家扶贫改革试验区，也是国家首批循环经济试点市之一、“中国优秀旅游城市”、首批全国篮球城和省级园林城市。。7月9日，辽宁省交通运输厅副厅长刘俊带领厅铁建处一行6人来阜调研地方铁路工作，到基层单位开展党纪教育宣讲活动。市政府副秘书长田阔，市交通运输局、市发改委、市路矿重组专班、中国铁路沈阳局集团有限公司锦州工程建设指挥部、巴新铁路有限责任公司等领导参加。。省厅调研组一行先后到国铁新邱站、巴新铁路白玉都站进行实地调研，考察了国铁新邱站和巴新铁路白玉都站的运行情况，参观了车辆调度室和运输场站，听取了铁路部门介绍现阶段客、货运输情况及国铁与地方铁路互联互通情况。。随后，刘俊副厅长在巴新铁路公务轨道车上与企业和部门进行了面对面交流座谈。巴新铁路有限责任公司董事长潘基平就巴新铁路当前现状、运营情况、运量和运输收入情况、长期规划等方面进行系统的汇报；市路矿重组专班副主任石玉明对巴新铁路路矿重组进展情况做了详细说明；市交通运输局局长邹亮就当前交通运输工作进展和铁路规划进行全面汇报。。最后，刘俊副厅长对本次调研工作作了重要讲话，一是提高政治站位，交通系统要全力发挥排头兵的作用，争做东北振兴当头马，为全面振兴三年行动攻坚战中贡献交通力量；二是全面加强“公转铁”运输结构调整，充分发挥铁路运输的重要作用，提高地方铁路综合运输服务能力；三是进一步加强地方铁路运营、投资方式、安全保障等方面管理措施，建立科学合理的长效机制。。调研结束后，刘俊副厅长与巴新铁路白玉都站的基层党员干部开展了党纪教育宣讲活动。通过增强党纪学习教育，认真领会《条例》内容要义，抓好交通运输工作落实，推进党纪教育取得实效等方面进行了深入交流。,其他,0.5994340180045801
42,辽宁省,阜新市,郝鹏在抚顺调研时强调坚持生态优先绿色发展强化项目支撑产业富民持续推动县域经济高质量发展,2024-06-11,https://www.fuxin.gov.cn/content/2024/922216.html,郝鹏在抚顺调研时强调 坚持生态优先绿色发展 强化项目支撑产业富民 持续推动县域经济高质量发展。阜新，寓意“物阜民丰，焕然一新”，1940年置市。位于辽宁省西北部，东接沈阳市，南邻锦州市，西连朝阳市，北靠内蒙古自治区。全市总面积10326平方千米，其中城市建成区76.5平方千米。下辖2县5区及1个国家级高新技术产业开发区。全市常住人口173.9万人，其中城镇人口102.9万人。阜新是全国第一个资源型城市经济转型试点市、国家扶贫改革试验区，也是国家首批循环经济试点市之一、“中国优秀旅游城市”、首批全国篮球城和省级园林城市。。6月17日至18日，省委书记、省人大常委会主任郝鹏来到抚顺市新宾满族自治县、清原满族自治县、抚顺县调研。他强调，要深入贯彻落实习近平总书记关于东北、辽宁全面振兴的重要讲话和指示批示精神，牢牢把握高质量发展这个新时代的硬道理，坚持生态优先绿色发展，强化项目支撑产业富民，深化改革创新，持续推动县域经济高质量发展，坚决打好打赢全面振兴新突破三年行动攻坚之战。。位于新宾满族自治县永陵镇的赫图阿拉城是一座拥有400余年历史的古城。郝鹏详细了解古城维护、文物保护和文旅整合发展情况。他强调，要进一步加强文物保护利用和文化遗产保护传承，做好历史文化的挖掘阐释宣传，充分利用好特色文化资源，促进文化和旅游深度融合，为辽宁打造高品质文体旅融合发展示范地贡献更大力量。。郝鹏十分关心县域特色产业发展。在抚顺东工冶金材料技术有限公司，他走进车间，详细了解产品生产工艺流程，充分肯定企业着力引育人才，推动科技成果转化落地的做法。他指出，创新的根本在人才，要大力营造人才发展的良好环境，促进创新链产业链资金链人才链深度融合，推动县域经济高质量发展。在辽宁三友农业生物科技集团有限公司，郝鹏详细了解企业生产经营情况，实地考察菌棒生产和菌种培育过程，鼓励企业加大优势品种选育，拓展精深加工，带动群众稳定增收。。6月的辽宁省实验林场，一派绿意盎然。郝鹏登上护林防火瞭望塔远眺林区，来到全国森林经营示范林区了解林地管护情况。他说，前人栽树，后人乘凉，我们要努力把宝贵的林木资源保护好，为子孙后代造福。郝鹏深入浑河源头调研水源地生态环境保护工作。他强调，要深入学习贯彻习近平生态文明思想，深入践行绿水青山就是金山银山理念，全面落实好河长制、林长制，为高质量发展厚植生态底色。。位于清原满族自治县英额门镇的椽子沟村，全村95%的农户种植中药材，国内市场80%以上的龙胆草产自这里。郝鹏来到村委会听取工作汇报，走进致富带头人曹岩家中，与党员干部和村民围坐在一起深入交流。“椽子沟以前是‘光棍沟’，现在成了‘光明沟’。”“除了种植中药材，我们还得发展深加工。”听大家唠着创业史和“致富经”，郝鹏欣慰地说，乡村要发展，致富带头人至关重要。他充分肯定抚顺市通过“三向培养”夯实乡村振兴人才基础的经验做法，勉励村干部和致富带头人进一步发挥示范引领作用，立足资源禀赋，做好特色文章，带动更多农民增收致富。他要求抚顺市，要高质量开展党纪学习教育，深入整治群众身边不正之风和腐败问题，以整治成效提升人民群众的获得感、幸福感、安全感。,郝鹏在抚顺调研时强调 坚持生态优先绿色发展 强化项目支撑产业富民 持续推动县域经济高质量发展。阜新，寓意“物阜民丰，焕然一新”，1940年置市。位于辽宁省西北部，东接沈阳市，南邻锦州市，西连朝阳市，北靠内蒙古自治区。全市总面积10326平方千米，其中城市建成区76.5平方千米。下辖2县5区及1个国家级高新技术产业开发区。全市常住人口173.9万人，其中城镇人口102.9万人。阜新是全国第一个资源型城市经济转型试点市、国家扶贫改革试验区，也是国家首批循环经济试点市之一、“中国优秀旅游城市”、首批全国篮球城和省级园林城市。。6月17日至18日，省委书记、省人大常委会主任郝鹏来到抚顺市新宾满族自治县、清原满族自治县、抚顺县调研。他强调，要深入贯彻落实习近平总书记关于东北、辽宁全面振兴的重要讲话和指示批示精神，牢牢把握高质量发展这个新时代的硬道理，坚持生态优先绿色发展，强化项目支撑产业富民，深化改革创新，持续推动县域经济高质量发展，坚决打好打赢全面振兴新突破三年行动攻坚之战。。位于新宾满族自治县永陵镇的赫图阿拉城是一座拥有400余年历史的古城。郝鹏详细了解古城维护、文物保护和文旅整合发展情况。他强调，要进一步加强文物保护利用和文化遗产保护传承，做好历史文化的挖掘阐释宣传，充分利用好特色文化资源，促进文化和旅游深度融合，为辽宁打造高品质文体旅融合发展示范地贡献更大力量。。郝鹏十分关心县域特色产业发展。在抚顺东工冶金材料技术有限公司，他走进车间，详细了解产品生产工艺流程，充分肯定企业着力引育人才，推动科技成果转化落地的做法。他指出，创新的根本在人才，要大力营造人才发展的良好环境，促进创新链产业链资金链人才链深度融合，推动县域经济高质量发展。在辽宁三友农业生物科技集团有限公司，郝鹏详细了解企业生产经营情况，实地考察菌棒生产和菌种培育过程，鼓励企业加大优势品种选育，拓展精深加工，带动群众稳定增收。。6月的辽宁省实验林场，一派绿意盎然。郝鹏登上护林防火瞭望塔远眺林区，来到全国森林经营示范林区了解林地管护情况。他说，前人栽树，后人乘凉，我们要努力把宝贵的林木资源保护好，为子孙后代造福。郝鹏深入浑河源头调研水源地生态环境保护工作。他强调，要深入学习贯彻习近平生态文明思想，深入践行绿水青山就是金山银山理念，全面落实好河长制、林长制，为高质量发展厚植生态底色。。位于清原满族自治县英额门镇的椽子沟村，全村95%的农户种植中药材，国内市场80%以上的龙胆草产自这里。郝鹏来到村委会听取工作汇报，走进致富带头人曹岩家中，与党员干部和村民围坐在一起深入交流。“椽子沟以前是‘光棍沟’，现在成了‘光明沟’。”“除了种植中药材，我们还得发展深加工。”听大家唠着创业史和“致富经”，郝鹏欣慰地说，乡村要发展，致富带头人至关重要。他充分肯定抚顺市通过“三向培养”夯实乡村振兴人才基础的经验做法，勉励村干部和致富带头人进一步发挥示范引领作用，立足资源禀赋，做好特色文章，带动更多农民增收致富。他要求抚顺市，要高质量开展党纪学习教育，深入整治群众身边不正之风和腐败问题，以整治成效提升人民群众的获得感、幸福感、安全感。,政府领导到其他城市考察学习或访问,0.6192028531225531
42,辽宁省,阜新市,全国助残日走进习近平总书记心中这份春天的事业,2024-05-20,https://www.fuxin.gov.cn/content/2024/918513.html,阜新，寓意“物阜民丰，焕然一新”，1940年置市。位于辽宁省西北部，东接沈阳市，南邻锦州市，西连朝阳市，北靠内蒙古自治区。全市总面积10326平方千米，其中城市建成区76.5平方千米。下辖2县5区及1个国家级高新技术产业开发区。全市常住人口173.9万人，其中城镇人口102.9万人。阜新是全国第一个资源型城市经济转型试点市、国家扶贫改革试验区，也是国家首批循环经济试点市之一、“中国优秀旅游城市”、首批全国篮球城和省级园林城市。。搭建平台深化省校合作 双向奔赴携手共赢发展 辽宁省与“双一流”高校战略合作座谈会召开 共同签署省校战略合作框架协议。残疾人的生活冷暖，总书记时时记挂在心；残疾人的困难需求，总书记常常念念不忘；残疾人的梦想追求，总书记总是殷切寄望。。习近平总书记给予广大残疾人的关心关注如和煦春风，给人以奋进力量。8500万残疾人与春光同行，充满希望。。2014年，春节前夕，习近平总书记来到内蒙古呼和浩特市儿童福利院，看望住在这里的孩子们。。这里收养的孩子大多有先天残疾。为了让孩子们感受到家庭的温暖，福利院每4名孩子和一对夫妻组成一个“模拟家庭”。。那一天，习近平总书记在福利院为孩子们送上新年礼物，还同“爱心妈妈”景凤英亲切交流。。2017年11月3日，内蒙古呼和浩特市儿童福利院里，“爱心妈妈”景凤英抱着两个孩子。新华社记者 王婧嫱 摄。“希望福利院的孩子和祖国其他孩子一样健康生活、幸福成长。这是我们最大的愿望”，习近平总书记动情地说。。习近平总书记指出：“残疾人是一个特殊困难的群体，需要格外关心、格外关注。”一幕幕温情瞬间，凝结着习近平总书记对残疾人数十年不变的深情。。“多为他们‘雪中送炭’。”任福州市委书记时，习近平同志听说一位病退的残疾职工一家生活艰难，特意协调相关单位调剂了一间商业店面租给他，并为他办理了相关补助；。“残疾人家庭不要落下”。在浙江工作时，春节前看望困难群众，尽管行程紧张、需要精简，仍然专门对工作人员这样叮嘱；。“必须要考虑周全一些。”主政上海期间领导筹办特奥会，从座椅牢不牢、通道方不方便到严守食品安全底线，无不上心，只因这些运动员“都是不一样的孩子”……。念兹在兹，枝叶关情。一次次风尘仆仆的探访，只为看看残疾人家庭过得好不好；一次次及时伸出帮扶的手，只因对残疾人“要特别关心”……。习近平总书记身体力行、亲身示范，引领各级党委政府将残疾人的冷暖疾苦牢记在心，及时解决残疾人的“急难愁盼”。。在内蒙古呼和浩特市特殊教育学校的教室里，美容美发课教师王雅妮时而指着黑板上的知识点“讲解”，时而拿起美容工具熟练示范，同学们目不转睛、聚精会神。与其他课堂不同，师生们的交流都是通过手语进行的。。这是一个无声的课堂，但身处其中的人们总能“听”到一种特殊的声音：那是春苗在拔节生长。。成为一名教师是王雅妮从小的梦想，点亮这一梦想的是大约10年前那次令她难忘终生的温暖会面。。2014年1月28日，正在内蒙古考察的习近平总书记来到小雅妮所在的福利院。总书记笑容可掬地向她学手语，还鼓励她好好学习、学业有成。此后，王雅妮更加认真地看书、钻研，终于成为一名特教老师，点亮更多残疾孩子“无声”的梦想。。习近平总书记把残疾人作为社会大家庭的平等成员、坚持和发展中国特色社会主义的一支重要力量，认为“残疾人完全有志向、有能力为人类社会作出重大贡献”。。在唐山市截瘫疗养院考察时，为截瘫伤员们的演唱带头鼓掌，表示“健全人可以活出精彩的人生，残疾人也可以活出精彩的人生”；。2016年7月28日，习近平总书记在唐山市截瘫疗养院看望慰问截瘫伤员。新华社记者 兰红光 摄,阜新，寓意“物阜民丰，焕然一新”，1940年置市。位于辽宁省西北部，东接沈阳市，南邻锦州市，西连朝阳市，北靠内蒙古自治区。全市总面积10326平方千米，其中城市建成区76.5平方千米。下辖2县5区及1个国家级高新技术产业开发区。全市常住人口173.9万人，其中城镇人口102.9万人。阜新是全国第一个资源型城市经济转型试点市、国家扶贫改革试验区，也是国家首批循环经济试点市之一、“中国优秀旅游城市”、首批全国篮球城和省级园林城市。。搭建平台深化省校合作 双向奔赴携手共赢发展 辽宁省与“双一流”高校战略合作座谈会召开 共同签署省校战略合作框架协议。残疾人的生活冷暖，总书记时时记挂在心；残疾人的困难需求，总书记常常念念不忘；残疾人的梦想追求，总书记总是殷切寄望。。习近平总书记给予广大残疾人的关心关注如和煦春风，给人以奋进力量。8500万残疾人与春光同行，充满希望。。2014年，春节前夕，习近平总书记来到内蒙古呼和浩特市儿童福利院，看望住在这里的孩子们。。这里收养的孩子大多有先天残疾。为了让孩子们感受到家庭的温暖，福利院每4名孩子和一对夫妻组成一个“模拟家庭”。。那一天，习近平总书记在福利院为孩子们送上新年礼物，还同“爱心妈妈”景凤英亲切交流。。2017年11月3日，内蒙古呼和浩特市儿童福利院里，“爱心妈妈”景凤英抱着两个孩子。新华社记者 王婧嫱 摄。“希望福利院的孩子和祖国其他孩子一样健康生活、幸福成长。这是我们最大的愿望”，习近平总书记动情地说。。习近平总书记指出：“残疾人是一个特殊困难的群体，需要格外关心、格外关注。”一幕幕温情瞬间，凝结着习近平总书记对残疾人数十年不变的深情。。“多为他们‘雪中送炭’。”任福州市委书记时，习近平同志听说一位病退的残疾职工一家生活艰难，特意协调相关单位调剂了一间商业店面租给他，并为他办理了相关补助；。“残疾人家庭不要落下”。在浙江工作时，春节前看望困难群众，尽管行程紧张、需要精简，仍然专门对工作人员这样叮嘱；。“必须要考虑周全一些。”主政上海期间领导筹办特奥会，从座椅牢不牢、通道方不方便到严守食品安全底线，无不上心，只因这些运动员“都是不一样的孩子”……。念兹在兹，枝叶关情。一次次风尘仆仆的探访，只为看看残疾人家庭过得好不好；一次次及时伸出帮扶的手，只因对残疾人“要特别关心”……。习近平总书记身体力行、亲身示范，引领各级党委政府将残疾人的冷暖疾苦牢记在心，及时解决残疾人的“急难愁盼”。。在内蒙古呼和浩特市特殊教育学校的教室里，美容美发课教师王雅妮时而指着黑板上的知识点“讲解”，时而拿起美容工具熟练示范，同学们目不转睛、聚精会神。与其他课堂不同，师生们的交流都是通过手语进行的。。这是一个无声的课堂，但身处其中的人们总能“听”到一种特殊的声音：那是春苗在拔节生长。。成为一名教师是王雅妮从小的梦想，点亮这一梦想的是大约10年前那次令她难忘终生的温暖会面。。2014年1月28日，正在内蒙古考察的习近平总书记来到小雅妮所在的福利院。总书记笑容可掬地向她学手语，还鼓励她好好学习、学业有成。此后，王雅妮更加认真地看书、钻研，终于成为一名特教老师，点亮更多残疾孩子“无声”的梦想。。习近平总书记把残疾人作为社会大家庭的平等成员、坚持和发展中国特色社会主义的一支重要力量，认为“残疾人完全有志向、有能力为人类社会作出重大贡献”。。在唐山市截瘫疗养院考察时，为截瘫伤员们的演唱带头鼓掌，表示“健全人可以活出精彩的人生，残疾人也可以活出精彩的人生”；。2016年7月28日，习近平总书记在唐山市截瘫疗养院看望慰问截瘫伤员。新华社记者 兰红光 摄,其他,0.5758477172655588
