code,province,city,topic,date,url,content,content.1,label,score,is_match
121,江西省,九江市,卢治轩率队赴安徽芜湖学习考察低空经济,2024-04-10,http://www.gongqing.gov.cn/z/4/1/202404/t20240410_6490387.html,"4月8日,市委书记卢治轩率队到安徽省芜湖市湾沚区,就低空经济产业链布局、招商引资策略、低空应用场景等进行考察学习。市委副书记吴炎弘,市领导胡胃东、赵鹏参加考察。。卢治轩一行先后来到安徽航空小镇、中电科芜湖钻石飞机制造有限公司、芜湖联合飞机科技有限公司等地,详细了解湾沚区航空产业发展情况。安徽航空小镇以通航高端研发制造和运营保障为主导,以航空科教创新和航空文旅服务为支撑,打造“两核双翼”四大产业板块,构建研发、制造、维修、运营“四位一体”产业生态链。小镇落户项目百余个,连续两年入选中国特色小镇50强。中电科芜湖钻石飞机制造有限公司以通用飞机自主研发制造为基础,聚焦通用飞机、特种飞机、无人机及高性能复合材料四大类核心产品,形成通用飞机和无人机研发制造、空地信息系统集成、改装及科研试飞、高性能复合材料研发制造、飞机专业维修培训五大核心能力。芜湖联合飞机科技有限公司专业从事新一代航空器的研发、生产、试验、试飞、维修、培训和保障等业务,致力于航空技术及制造和人工智能双赛道。。考察中,大家对湾沚区航空产业发展取得的成绩表示赞赏,认为湾沚区已形成从整机、发动机、螺旋桨,到航电系统、航空维修全链条通用航空产业,带动了芜湖市更大范围航空航天产业的发展。希望两地加强交流与合作,在航空产业发展、人才交流等方面实现互利共赢。。当天,卢治轩一行还来到安徽省芜湖市弋江区,考察了艾尔达科技有限责任公司以及安徽宏泰微电子科技有限公司,详细了解企业运营及产品创新研发等情况。同时,诚邀各位企业家到共青城走一走、看一看,感受共青城发展环境,拓展企业发展空间。","4月8日,市委书记卢治轩率队到安徽省芜湖市湾沚区,就低空经济产业链布局、招商引资策略、低空应用场景等进行考察学习。市委副书记吴炎弘,市领导胡胃东、赵鹏参加考察。。卢治轩一行先后来到安徽航空小镇、中电科芜湖钻石飞机制造有限公司、芜湖联合飞机科技有限公司等地,详细了解湾沚区航空产业发展情况。安徽航空小镇以通航高端研发制造和运营保障为主导,以航空科教创新和航空文旅服务为支撑,打造“两核双翼”四大产业板块,构建研发、制造、维修、运营“四位一体”产业生态链。小镇落户项目百余个,连续两年入选中国特色小镇50强。中电科芜湖钻石飞机制造有限公司以通用飞机自主研发制造为基础,聚焦通用飞机、特种飞机、无人机及高性能复合材料四大类核心产品,形成通用飞机和无人机研发制造、空地信息系统集成、改装及科研试飞、高性能复合材料研发制造、飞机专业维修培训五大核心能力。芜湖联合飞机科技有限公司专业从事新一代航空器的研发、生产、试验、试飞、维修、培训和保障等业务,致力于航空技术及制造和人工智能双赛道。。考察中,大家对湾沚区航空产业发展取得的成绩表示赞赏,认为湾沚区已形成从整机、发动机、螺旋桨,到航电系统、航空维修全链条通用航空产业,带动了芜湖市更大范围航空航天产业的发展。希望两地加强交流与合作,在航空产业发展、人才交流等方面实现互利共赢。。当天,卢治轩一行还来到安徽省芜湖市弋江区,考察了艾尔达科技有限责任公司以及安徽宏泰微电子科技有限公司,详细了解企业运营及产品创新研发等情况。同时,诚邀各位企业家到共青城走一走、看一看,感受共青城发展环境,拓展企业发展空间。",政府领导到其他城市考察学习或访问,0.0,True
121,江西省,九江市,我县考察团赴修水县庐山市学习考察,2024-03-25,http://www.duchang.gov.cn/zwzx/tpbd/202403/t20240325_6470517.html,“他山之石、可以攻玉”，坚持以解放思想引领“五大行动”，进一步凝聚加速赶超的强大内生动力，积极推动思想之变、理念之变引领发展之变。3月21日，县委副书记王能耘、县政协主席谭四明率考察团赴修水县、庐山市学习考察，修水县委副书记马文卿、修水县政协主席王位华，修水县委常委、统战部部长董国祥；庐山市人大常委会主任刘英，庐山市委常委、纪委书记、监委主任候绍胜，庐山市委常委、工业园党工委书记周洁；都昌县领导沈承峰、江康侥、占文霞、郑为、向文花参加活动。。在修水县，都昌考察团首先来到修水鸿泰模具成型装备智造项目学习考察。现场一条条全自动化的智能生产线正在高速运转，该项目位于修水百亿模具数字产业园内，是集设计、制造、销售为一体的大型汽车模具及零配件制造企业，目前建有6条自动化生产线、两条冲压线。。随后，都昌考察团来到欧克科技锂电隔膜设备智能制造项目、宁州古城文旅项目等地现场学习考察。大家一路走、一路看、一路议，详细了解修水县招商引资、项目建设、产业转型、文旅融合发展等方面的典型经验。据了解，近年来，修水县依托资源和环境优势，形成了机械制造、绿色有机食品、矿产品精深加工三大主导产业，大力发展“归雁”经济，坚持景区旅游、乡村旅游、城区旅游“三箭齐发”，建成A级景区数量全市第一。。在庐山市，都昌考察团首先来到庐山花语世界项目学习考察。花棚内花香四溢、姹紫嫣红，一片春意盎然的景象，该项目总投资约3亿元，以“农业+旅游”建设，汇聚现代高效农业、彩色园林景观、生态旅游运营三大产业，集创意花园、苗木生产、园艺生活、研学教育、婚拍婚庆、亲子旅游于一体，致力打造成为全国乡村振兴示范项目。。随后，都昌考察团来到省港码头物流产业项目、循环产业园项目，通过听取介绍、实地参观等形式，详细了解庐山市在项目建设方面的新成效、新变化。。都昌县考察团成员纷纷表示，要以此次学习考察为契机，充分汲取兄弟县（市）的先进经验和典型做法，进一步解放思想、拓宽思路，优化营商环境，加大招商引资力度，通过产业链招商、以商招商、以情招商等方式，不断引进优质项目落户都昌，全力推进“五大行动”，为奋力实现“双争”目标勇毅前行。,“他山之石、可以攻玉”，坚持以解放思想引领“五大行动”，进一步凝聚加速赶超的强大内生动力，积极推动思想之变、理念之变引领发展之变。3月21日，县委副书记王能耘、县政协主席谭四明率考察团赴修水县、庐山市学习考察，修水县委副书记马文卿、修水县政协主席王位华，修水县委常委、统战部部长董国祥；庐山市人大常委会主任刘英，庐山市委常委、纪委书记、监委主任候绍胜，庐山市委常委、工业园党工委书记周洁；都昌县领导沈承峰、江康侥、占文霞、郑为、向文花参加活动。。在修水县，都昌考察团首先来到修水鸿泰模具成型装备智造项目学习考察。现场一条条全自动化的智能生产线正在高速运转，该项目位于修水百亿模具数字产业园内，是集设计、制造、销售为一体的大型汽车模具及零配件制造企业，目前建有6条自动化生产线、两条冲压线。。随后，都昌考察团来到欧克科技锂电隔膜设备智能制造项目、宁州古城文旅项目等地现场学习考察。大家一路走、一路看、一路议，详细了解修水县招商引资、项目建设、产业转型、文旅融合发展等方面的典型经验。据了解，近年来，修水县依托资源和环境优势，形成了机械制造、绿色有机食品、矿产品精深加工三大主导产业，大力发展“归雁”经济，坚持景区旅游、乡村旅游、城区旅游“三箭齐发”，建成A级景区数量全市第一。。在庐山市，都昌考察团首先来到庐山花语世界项目学习考察。花棚内花香四溢、姹紫嫣红，一片春意盎然的景象，该项目总投资约3亿元，以“农业+旅游”建设，汇聚现代高效农业、彩色园林景观、生态旅游运营三大产业，集创意花园、苗木生产、园艺生活、研学教育、婚拍婚庆、亲子旅游于一体，致力打造成为全国乡村振兴示范项目。。随后，都昌考察团来到省港码头物流产业项目、循环产业园项目，通过听取介绍、实地参观等形式，详细了解庐山市在项目建设方面的新成效、新变化。。都昌县考察团成员纷纷表示，要以此次学习考察为契机，充分汲取兄弟县（市）的先进经验和典型做法，进一步解放思想、拓宽思路，优化营商环境，加大招商引资力度，通过产业链招商、以商招商、以情招商等方式，不断引进优质项目落户都昌，全力推进“五大行动”，为奋力实现“双争”目标勇毅前行。,政府领导到其他城市考察学习或访问,0.7672502467757222,True
121,江西省,九江市,对标先进找差距学习交流促提升王斌率考察团赴修水县考察学习,2023-05-15,https://www.lushan.gov.cn/zwzx_194686/tpbd/202305/t20230515_6032261.html,"对标先进找差距 学习交流促提升 王斌率考察团赴修水县考察学习,庐山市人民政府,政务资讯,图片报道。为拓宽视野，转变思想，对标先进找差距、学习交流促提升，进一步加快我市美丽乡村建设步伐，5月11-12日，庐山管理局局长、庐山市市长王斌率考察团赴修水县考察美丽乡村建设、乡村振兴示范点建设等工作。修水县委书记郑庆华，修水县委副书记马文卿，修水县委副书记、副县长蔡文祥先后陪同。。如何因地制宜建设美丽乡村？考察团先后参观了修水县征村乡、漫江乡、竹坪乡、马坳镇、杭口镇等地，听取了村庄建设治理情况，感悟特色亮点做法。考察团边看边议，就规划、推进乡村治理工作进行了沟通交流。。如何发展村级集体经济促进乡村振兴？考察团来到了漫江乡宁红村、马坳镇黄溪村、杭口镇坪下村等地，实地查看村级集体经济项目发展情况。通过观摩并结合庐山市实际，大家就发展村级集体经济思路、举措、存在的问题和解决办法等方面进行了交流讨论。。每到一处，考察团成员认真听、仔细看、详细询问具体做法、深入思考，从中学习经验、受到启发。考察团一致认为，修水县在美丽乡村建设、乡村振兴示范点建设、产业发展等方面措施得当、主题鲜明，重视传统文化和自然生态相结合，特别是在乡村产业发展等方面，能够立足长远、精心谋划，值得学习和借鉴。。考察团成员纷纷表示，通过此次考察，看到了差距，开拓了思路，受益匪浅，同时也坚定了信心和决心。下一步将以此次考察学习为契机，认真思考、学以致用，围绕考察的所见所闻所感，转变工作思路，改进工作方法，总结出适合自身实际的美丽乡村发展有效途径，不断为庐山市美丽乡村建设作出更大贡献。","对标先进找差距 学习交流促提升 王斌率考察团赴修水县考察学习,庐山市人民政府,政务资讯,图片报道。为拓宽视野，转变思想，对标先进找差距、学习交流促提升，进一步加快我市美丽乡村建设步伐，5月11-12日，庐山管理局局长、庐山市市长王斌率考察团赴修水县考察美丽乡村建设、乡村振兴示范点建设等工作。修水县委书记郑庆华，修水县委副书记马文卿，修水县委副书记、副县长蔡文祥先后陪同。。如何因地制宜建设美丽乡村？考察团先后参观了修水县征村乡、漫江乡、竹坪乡、马坳镇、杭口镇等地，听取了村庄建设治理情况，感悟特色亮点做法。考察团边看边议，就规划、推进乡村治理工作进行了沟通交流。。如何发展村级集体经济促进乡村振兴？考察团来到了漫江乡宁红村、马坳镇黄溪村、杭口镇坪下村等地，实地查看村级集体经济项目发展情况。通过观摩并结合庐山市实际，大家就发展村级集体经济思路、举措、存在的问题和解决办法等方面进行了交流讨论。。每到一处，考察团成员认真听、仔细看、详细询问具体做法、深入思考，从中学习经验、受到启发。考察团一致认为，修水县在美丽乡村建设、乡村振兴示范点建设、产业发展等方面措施得当、主题鲜明，重视传统文化和自然生态相结合，特别是在乡村产业发展等方面，能够立足长远、精心谋划，值得学习和借鉴。。考察团成员纷纷表示，通过此次考察，看到了差距，开拓了思路，受益匪浅，同时也坚定了信心和决心。下一步将以此次考察学习为契机，认真思考、学以致用，围绕考察的所见所闻所感，转变工作思路，改进工作方法，总结出适合自身实际的美丽乡村发展有效途径，不断为庐山市美丽乡村建设作出更大贡献。",政府领导到其他城市考察学习或访问,0.0,True
121,江西省,九江市,汲取先进经验深化交流合作王斌率考察团到吉安市考察学习,2024-02-22,https://www.lushan.gov.cn/zwzx_194686/tpbd/202402/t20240222_6413279.html,"汲取先进经验 深化交流合作 王斌率考察团到吉安市考察学习,庐山市人民政府,政务资讯,图片报道。2月18日-20日，庐山管理局局长、庐山市市长王斌率考察团到吉安市考察学习电子信息、先进制造业、新型材料、旅游发展、乡村振兴、历史文化传承创新与书院古建筑群保护利用等先进经验。吉安市委副书记肖玉兰一同考察，吉安市委常委、宣传部部长李瑞峰,吉安市委副秘书长、办公室主任王昱陪同考察。。后河·梦回庐陵景区通过建筑空间塑造、高科技手段植入，打造沉浸式、行进式光影夜游体验。钓源古村距今1100多年，村内有保存至今的明清古建筑150余处，堪称庐陵文化的活态博物馆。白鹭洲书院为江西三大书院之一，书院全面修缮历史遗存，恢复白鹭洲书院清末建置，让观众身临其境了解书院历史的同时感受庐陵文化的博大精深。高铁新区科创中心项目吸引了国家工业信息安全发展研究中心、阿里云等知名企业入驻并开业运营。考察团表示，吉州区在古书院、古村落、古建筑文化保护发掘建设以及产业发展等方面多措并举、成效凸显，形成了独特的旅游优势，我们要虚心学习、科学借鉴、积极实践，努力推动我市古书院、古村落、古建筑文化保护发掘建设再上新台阶。。在井冈山经开区，考察团先后来到吉安生益电子有限公司、吉安市木林森实业有限公司、南亚新材料科技（江西）有限公司，每到一处大家都认真听取企业相关负责人的情况介绍。大家纷纷表示，井冈山经开区电子信息和先进制造业工作规划科学超前、基础设施配套到位、发展规模气魄较大，有力地推动了招商引资和工业经济的迅猛发展。下一步，将紧密联系自身实际，找准定位、发挥优势，把先进经验转化为推动地方发展的强大动力。。江西立讯智造有限公司主要从事高端电子产品的研发、制造、销售，拥有160多项专利，先后获得多项国家级荣誉。吉州窑遗址公园是我国保存最完好、保留遗址规模最大且最集中的窑址群，现正全力打造国家级风景名胜区和国家5A级景区。云天麓谷是集休闲垂钓、航空研学、特色民宿、果蔬采摘为一体的大型田园综合体，获评国家4A级旅游景区。考察团对吉安市推动旅游高质量发展工作给予了高度评价，一致认为吉安县积极推动“农文旅”多领域、全方位深度融合，促进“吃、住、行、游、”全要素、全链条发展，各项工作有创新、有示范、有经验，值得借鉴学习。。在安福县起凤山福海公园、江西鲁丽绿色新材料科技产业园以及兔子的老家旅游度假区，考察过程中，双方就矿山综合治理及生态修复、项目建设、生态旅游项目建设运营等情况进行了沟通交流。考察团一致认为，此次考察开阔了视野，拓展了思路，学到了方法，回去后要紧密结合本地的实际和安福的成功经验做法，谋划好工作，开拓好相关工作新局面。同时希望两地不断强化沟通交流，共同发力，为推动两地经济社会高质量发展作出新的贡献。。行程匆忙，收获颇丰。考察团借他山之石琢己身之玉，对标先进解放思想、更新观念、拓宽视野，在借鉴中奋进。王斌强调，此次考察学习的主要目的是解放思想、拓宽思路，各地各相关部门要以此次考察学习为契机，坚持以更高的站位、更广的视野、更多的思考，认真学习总结吉安市的好经验、好做法，结合庐山市实际，迅速行动起来，切实做到转变理念、转变方式、转变作风，把学习成果转化为推动庐山经济社会发展的有效实践，为做实唱响“庐山天下悠”品牌贡献力量。","汲取先进经验 深化交流合作 王斌率考察团到吉安市考察学习,庐山市人民政府,政务资讯,图片报道。2月18日-20日，庐山管理局局长、庐山市市长王斌率考察团到吉安市考察学习电子信息、先进制造业、新型材料、旅游发展、乡村振兴、历史文化传承创新与书院古建筑群保护利用等先进经验。吉安市委副书记肖玉兰一同考察，吉安市委常委、宣传部部长李瑞峰,吉安市委副秘书长、办公室主任王昱陪同考察。。后河·梦回庐陵景区通过建筑空间塑造、高科技手段植入，打造沉浸式、行进式光影夜游体验。钓源古村距今1100多年，村内有保存至今的明清古建筑150余处，堪称庐陵文化的活态博物馆。白鹭洲书院为江西三大书院之一，书院全面修缮历史遗存，恢复白鹭洲书院清末建置，让观众身临其境了解书院历史的同时感受庐陵文化的博大精深。高铁新区科创中心项目吸引了国家工业信息安全发展研究中心、阿里云等知名企业入驻并开业运营。考察团表示，吉州区在古书院、古村落、古建筑文化保护发掘建设以及产业发展等方面多措并举、成效凸显，形成了独特的旅游优势，我们要虚心学习、科学借鉴、积极实践，努力推动我市古书院、古村落、古建筑文化保护发掘建设再上新台阶。。在井冈山经开区，考察团先后来到吉安生益电子有限公司、吉安市木林森实业有限公司、南亚新材料科技（江西）有限公司，每到一处大家都认真听取企业相关负责人的情况介绍。大家纷纷表示，井冈山经开区电子信息和先进制造业工作规划科学超前、基础设施配套到位、发展规模气魄较大，有力地推动了招商引资和工业经济的迅猛发展。下一步，将紧密联系自身实际，找准定位、发挥优势，把先进经验转化为推动地方发展的强大动力。。江西立讯智造有限公司主要从事高端电子产品的研发、制造、销售，拥有160多项专利，先后获得多项国家级荣誉。吉州窑遗址公园是我国保存最完好、保留遗址规模最大且最集中的窑址群，现正全力打造国家级风景名胜区和国家5A级景区。云天麓谷是集休闲垂钓、航空研学、特色民宿、果蔬采摘为一体的大型田园综合体，获评国家4A级旅游景区。考察团对吉安市推动旅游高质量发展工作给予了高度评价，一致认为吉安县积极推动“农文旅”多领域、全方位深度融合，促进“吃、住、行、游、”全要素、全链条发展，各项工作有创新、有示范、有经验，值得借鉴学习。。在安福县起凤山福海公园、江西鲁丽绿色新材料科技产业园以及兔子的老家旅游度假区，考察过程中，双方就矿山综合治理及生态修复、项目建设、生态旅游项目建设运营等情况进行了沟通交流。考察团一致认为，此次考察开阔了视野，拓展了思路，学到了方法，回去后要紧密结合本地的实际和安福的成功经验做法，谋划好工作，开拓好相关工作新局面。同时希望两地不断强化沟通交流，共同发力，为推动两地经济社会高质量发展作出新的贡献。。行程匆忙，收获颇丰。考察团借他山之石琢己身之玉，对标先进解放思想、更新观念、拓宽视野，在借鉴中奋进。王斌强调，此次考察学习的主要目的是解放思想、拓宽思路，各地各相关部门要以此次考察学习为契机，坚持以更高的站位、更广的视野、更多的思考，认真学习总结吉安市的好经验、好做法，结合庐山市实际，迅速行动起来，切实做到转变理念、转变方式、转变作风，把学习成果转化为推动庐山经济社会发展的有效实践，为做实唱响“庐山天下悠”品牌贡献力量。",政府领导到其他城市考察学习或访问,0.0,True
121,江西省,九江市,德安县党政代表团来我市考察学习,2024-02-26,http://ls.credit.jiujiang.gov.cn/xydt_291/pzdt/202402/t20240226_6416945.html,2月21日，德安县委副书记柯剑峰带领德安县考察团来我市考察学习，市委副书记程剑陪同。。考察团先后来到花语世界、奋发集团，听介绍、参观展厅和生产车间，互动交流，详细了解项目建设、。绕“美丽中国，美好生活”的国家战略，以南方彩色观赏植物研发繁育基地建设为基础，以优美的生态环境为载体，以一二三产业融合发展，促进旅游产品、服务和运营的升级，生态为旅游赋能，推动庐山旅游高质量发展，实现由美丽到。通过参观考察，德安县党政代表团对庐山市发展所取得的成绩给予了充分的肯定，认为庐山市有很多好的经验和成功做法值得学习和借鉴，。表示要以此次考察为契机，加强交流互动，发挥自身优势，取长补短，共同推进两地经济社会高质量发展。。全市领导干部“深入学习贯彻习近平总书记考察江西重要讲话精神暨解放思想大讨论”专题研讨班开班,2月21日，德安县委副书记柯剑峰带领德安县考察团来我市考察学习，市委副书记程剑陪同。。考察团先后来到花语世界、奋发集团，听介绍、参观展厅和生产车间，互动交流，详细了解项目建设、。绕“美丽中国，美好生活”的国家战略，以南方彩色观赏植物研发繁育基地建设为基础，以优美的生态环境为载体，以一二三产业融合发展，促进旅游产品、服务和运营的升级，生态为旅游赋能，推动庐山旅游高质量发展，实现由美丽到。通过参观考察，德安县党政代表团对庐山市发展所取得的成绩给予了充分的肯定，认为庐山市有很多好的经验和成功做法值得学习和借鉴，。表示要以此次考察为契机，加强交流互动，发挥自身优势，取长补短，共同推进两地经济社会高质量发展。。全市领导干部“深入学习贯彻习近平总书记考察江西重要讲话精神暨解放思想大讨论”专题研讨班开班,政府领导到其他城市考察学习或访问,0.0,True
