code,province,city,topic,date,url,content,content.1,label,score,is_match
118,江西省,南昌市,市党政代表团赴宜春市学习考察并举行南昌市宜春市战略合作协议签约活动,2024-03-29,http://www.nc.gov.cn/ncszf/jrnca/202403/42d10c3fd2c0448cbe96f23db211bb43.shtml,3月28日，我市党政代表团赴宜春市学习考察，并举行南昌市、宜春市战略合作协议签约活动。省委常委、南昌市委书记李红军率队。宜春市委书记严允，南昌市市长万广明，宜春市市长谭赣明，宜春市领导石军英、龚法生、江东灿，南昌市领导胡晓海、梅峰、李松殿等参加有关活动。。市党政代表团在考察交流时指出，南昌、宜春两市山水相连、人文相亲、经济相融，两地交流合作的基础深厚、前景广阔。近年来，在省委、省政府的正确领导下，南昌与宜春在产业发展、社会治理、公共服务、交通设施、生态保护等领域开展了一系列合作，合作内容不断深化、合作领域不断拓展、合作成果持续扩大。当前，省委、省政府正深入实施省会引领战略，推动南昌都市圈、湘赣边区域合作示范区建设。希望两市抢抓战略机遇，推动资源互补、优势共享、经验互鉴，促进两市深化交流合作迈上新台阶。南昌将认真学习借鉴宜春市的好经验、好做法，以更加积极主动的姿态，与宜春一道，推动两地科研院所、高等院校和龙头企业围绕重点领域开展科研合作，联手构建产业协同、链群合作的现代化产业体系，共同打造资源共享、联动开发的文旅消费新高地，促进教育、医疗、文化和社会保障等公共服务共建共享，推动赣江、锦江沿线生态修复、资源保护与利用协同共治，努力开创双城联动、双城共赢的新局面。。严允、谭赣明代表宜春市四套班子向南昌市党政代表团一行表示热烈欢迎，并表示，南昌是我省发展的“火车头”“主引擎”，特别是近年来全面落实省会引领战略，省会南昌城市综合实力和发展能级全面提升。一直以来，南昌以省会城市的胸怀担当，辐射带动兄弟设区市共赢发展，对宜春丰城、樟树、高安、奉新、靖安等环南昌县市的发展更是不遗余力，扎实推进战略协同共谋、通道网络共建、产业合作共赢、生态环境共治、公共服务共享。这次两地签订战略合作协议，既是深入贯彻习近平总书记考察江西重要讲话精神的有力实践，也是认真落实省委十五届四次、五次全会精神的具体行动，标志着南昌和宜春合作进入了提质加速、全面深化的新阶段，必将加快推动两地经济社会协同发展、携手共进。宜春将以此次签约为新契机，赶搭南昌发展“快车”，搭建好协同合作平台，在园区规划、产业布局、项目建设、人才培养等方面加强务实合作，促进区域创新链、产业链、资源链、价值链深度融合，齐心协力开创两地高质量发展新局面。。根据签约内容，双方将在更高层次、更广领域开展务实合作，推动产业协同发展，开展科技创新合作，加强文化旅游联动，推动绿色生态合作，强化教育体育交流，促进会展商贸合作，推进公共事务协同，开展社会治理联防联控，携手为加快南昌都市圈建设、推动全省高质量发展作出更大贡献。。在宜春市期间，市党政代表团先后察看了宜春时代新能源科技有限公司、宜春清陶能源科技有限公司、江西国轩新能源科技有限公司、宜春宇泽新能源有限公司、江西百神药业股份有限公司和温汤镇水口村，详细了解宜春市经济社会发展、产业布局规划等情况。,3月28日，我市党政代表团赴宜春市学习考察，并举行南昌市、宜春市战略合作协议签约活动。省委常委、南昌市委书记李红军率队。宜春市委书记严允，南昌市市长万广明，宜春市市长谭赣明，宜春市领导石军英、龚法生、江东灿，南昌市领导胡晓海、梅峰、李松殿等参加有关活动。。市党政代表团在考察交流时指出，南昌、宜春两市山水相连、人文相亲、经济相融，两地交流合作的基础深厚、前景广阔。近年来，在省委、省政府的正确领导下，南昌与宜春在产业发展、社会治理、公共服务、交通设施、生态保护等领域开展了一系列合作，合作内容不断深化、合作领域不断拓展、合作成果持续扩大。当前，省委、省政府正深入实施省会引领战略，推动南昌都市圈、湘赣边区域合作示范区建设。希望两市抢抓战略机遇，推动资源互补、优势共享、经验互鉴，促进两市深化交流合作迈上新台阶。南昌将认真学习借鉴宜春市的好经验、好做法，以更加积极主动的姿态，与宜春一道，推动两地科研院所、高等院校和龙头企业围绕重点领域开展科研合作，联手构建产业协同、链群合作的现代化产业体系，共同打造资源共享、联动开发的文旅消费新高地，促进教育、医疗、文化和社会保障等公共服务共建共享，推动赣江、锦江沿线生态修复、资源保护与利用协同共治，努力开创双城联动、双城共赢的新局面。。严允、谭赣明代表宜春市四套班子向南昌市党政代表团一行表示热烈欢迎，并表示，南昌是我省发展的“火车头”“主引擎”，特别是近年来全面落实省会引领战略，省会南昌城市综合实力和发展能级全面提升。一直以来，南昌以省会城市的胸怀担当，辐射带动兄弟设区市共赢发展，对宜春丰城、樟树、高安、奉新、靖安等环南昌县市的发展更是不遗余力，扎实推进战略协同共谋、通道网络共建、产业合作共赢、生态环境共治、公共服务共享。这次两地签订战略合作协议，既是深入贯彻习近平总书记考察江西重要讲话精神的有力实践，也是认真落实省委十五届四次、五次全会精神的具体行动，标志着南昌和宜春合作进入了提质加速、全面深化的新阶段，必将加快推动两地经济社会协同发展、携手共进。宜春将以此次签约为新契机，赶搭南昌发展“快车”，搭建好协同合作平台，在园区规划、产业布局、项目建设、人才培养等方面加强务实合作，促进区域创新链、产业链、资源链、价值链深度融合，齐心协力开创两地高质量发展新局面。。根据签约内容，双方将在更高层次、更广领域开展务实合作，推动产业协同发展，开展科技创新合作，加强文化旅游联动，推动绿色生态合作，强化教育体育交流，促进会展商贸合作，推进公共事务协同，开展社会治理联防联控，携手为加快南昌都市圈建设、推动全省高质量发展作出更大贡献。。在宜春市期间，市党政代表团先后察看了宜春时代新能源科技有限公司、宜春清陶能源科技有限公司、江西国轩新能源科技有限公司、宜春宇泽新能源有限公司、江西百神药业股份有限公司和温汤镇水口村，详细了解宜春市经济社会发展、产业布局规划等情况。,政府领导到其他城市考察学习或访问,0.0,True
118,江西省,南昌市,市党政代表团赴吉安市学习考察,2023-08-07,http://www.nc.gov.cn/ncszf/jrnca/202308/5f24906a3c704dbba75bb783d9b8ddce.shtml,8月5日、6日，市党政代表团赴吉安市学习考察。省委常委、市委书记李红军，省人大常委会副主任、吉安市委书记王少玄，市长万广明，吉安市市长罗文江参加考察活动。。市党政代表团先后察看了南亚新材料科技（江西）有限公司、木林森实业有限公司、吉安生益电子有限公司以及吉安伊戈尔磁电科技有限公司，详细了解产业布局、企业发展、技术研发、产品销售等情况；瞻仰毛泽东旧居，重温党的历史，汲取智慧与力量；考察白鹭洲书院、后河梦回庐陵夜经济圈，了解吉安市活化文化传承，创新文旅融合，促进商贸消费的实践与探索。。市党政代表团指出，南昌、吉安两市同饮赣江水、亲如一家人，有着一脉相承的红色基因、历史文化，共生共荣的产业体系、生态资源，两地交流合作空间广阔、潜力巨大。近年来，吉安市聚力发展“1+4”工业，全面推进六大富民产业和全域旅游，经济社会发展成效显著。我们要认真学习吉安市的优秀经验做法，进一步深化与吉安市的全方位交流合作。要围绕电子信息、先进制造等共性优势产业，进一步强化产业协作、创新协同，促进产业链上下游、产供销配套，高效集聚发展要素，共同开展关键核心技术攻关，积极推动新技术、新产品、新场景应用落地，持续提升产业发展能级和核心竞争力。要聚焦打造内陆地区改革开放高地，合力构建更大范围、更宽领域、更深层次的开放格局，进一步提升对外开放的效率、层次和水平。要做好红色文化、优秀历史文化保护传承，共同搭建文化旅游合作平台，开拓旅游客源市场，加强旅游资源整合，推动两地文旅产业新发展。。考察交流中，双方一致认为，省委十五届四次全会准确把握江西发展的趋势性变化和阶段性特征，作出了打造“三大高地”、实施“五大战略”的决策部署，是引领江西当前和今后一个时期发展的行动纲领。南昌、吉安两地要全面贯彻落实省委全会决策部署，找准突破口和着力点，以新举措新成就激发区域协调发展新活力，以新气象新作为加快构建区域协调发展新格局，为谱写中国式现代化江西篇章作出新的更大贡献。。市领导胡晓海、王万征、梅峰、李松殿、赵捷、江新洪，吉安市领导李瑞峰、王大胜、漆海云、胡海洋等一同考察。,8月5日、6日，市党政代表团赴吉安市学习考察。省委常委、市委书记李红军，省人大常委会副主任、吉安市委书记王少玄，市长万广明，吉安市市长罗文江参加考察活动。。市党政代表团先后察看了南亚新材料科技（江西）有限公司、木林森实业有限公司、吉安生益电子有限公司以及吉安伊戈尔磁电科技有限公司，详细了解产业布局、企业发展、技术研发、产品销售等情况；瞻仰毛泽东旧居，重温党的历史，汲取智慧与力量；考察白鹭洲书院、后河梦回庐陵夜经济圈，了解吉安市活化文化传承，创新文旅融合，促进商贸消费的实践与探索。。市党政代表团指出，南昌、吉安两市同饮赣江水、亲如一家人，有着一脉相承的红色基因、历史文化，共生共荣的产业体系、生态资源，两地交流合作空间广阔、潜力巨大。近年来，吉安市聚力发展“1+4”工业，全面推进六大富民产业和全域旅游，经济社会发展成效显著。我们要认真学习吉安市的优秀经验做法，进一步深化与吉安市的全方位交流合作。要围绕电子信息、先进制造等共性优势产业，进一步强化产业协作、创新协同，促进产业链上下游、产供销配套，高效集聚发展要素，共同开展关键核心技术攻关，积极推动新技术、新产品、新场景应用落地，持续提升产业发展能级和核心竞争力。要聚焦打造内陆地区改革开放高地，合力构建更大范围、更宽领域、更深层次的开放格局，进一步提升对外开放的效率、层次和水平。要做好红色文化、优秀历史文化保护传承，共同搭建文化旅游合作平台，开拓旅游客源市场，加强旅游资源整合，推动两地文旅产业新发展。。考察交流中，双方一致认为，省委十五届四次全会准确把握江西发展的趋势性变化和阶段性特征，作出了打造“三大高地”、实施“五大战略”的决策部署，是引领江西当前和今后一个时期发展的行动纲领。南昌、吉安两地要全面贯彻落实省委全会决策部署，找准突破口和着力点，以新举措新成就激发区域协调发展新活力，以新气象新作为加快构建区域协调发展新格局，为谱写中国式现代化江西篇章作出新的更大贡献。。市领导胡晓海、王万征、梅峰、李松殿、赵捷、江新洪，吉安市领导李瑞峰、王大胜、漆海云、胡海洋等一同考察。,政府领导到其他城市考察学习或访问,0.0,True
118,江西省,南昌市,市党政代表团赴九江市学习考察并举行,2023-07-14,http://www.nc.gov.cn/ncszf/jrnca/202307/a1ddd376daca497a977b4d2989e643fe.shtml,深化昌九一体化发展战略合作框架协议签约活动 李红军万广明率队 刘文华蒋文定出席有关活动。7月13日，我市党政代表团赴九江市学习考察，并举行深化昌九一体化发展战略合作框架协议签约活动。省委常委、市委书记李红军，市长万广明率队。九江市委书记刘文华，九江市市长蒋文定出席有关活动。。市党政代表团先后察看了中石化九江分公司、九江德福科技股份有限公司、巨石玻纤新材料智能制造基地、江西科翔电子科技有限公司、江西生益科技有限公司、九江茶市，详细了解九江市经济社会发展、产业布局规划和昌九一体化发展情况。。市党政代表团在考察交流时指出，昌九两市山水相连、人文相亲、经济相融，有着深厚的历史渊源和合作基础。近年来，在省委、省政府的正确领导下，南昌和九江相向而行、同向发力，在产业协同发展、交通互联互通、文化旅游合作、社会治理协作、生态保护共治等领域共同探索，成果颇丰。九江在产业发展、科技创新、对外开放等方面的好经验、好做法值得南昌借鉴和学习。希望双方进一步深化合作交流，全面加强战略协作、功能耦合，携手争取国家或省级战略支持，合力拓宽发展空间，赢得更多红利，汇集更多资源，展现更大作为。积极推动两地市场一体循环、资源要素高效配置，更高起点、更大范围促进优势产业、基础设施、科技创新协同协作，公共事务、生态环境、文化旅游、教育体育共融共享。健全完善领导会晤交流机制、部门交流合作机制、项目洽谈推进机制，做到定期协商、无缝对接，推动双方合作落到实处、见到实效。。刘文华、蒋文定代表九江市委、市政府对南昌市党政代表团的到来表示热烈欢迎，对南昌长期以来给予九江的支持帮助表示衷心感谢。他们表示，近年来，南昌市紧紧围绕“一枢纽四中心”发展定位，深入实施强省会战略，各项工作取得显著成效，南昌先进的发展理念、开阔的战略视野、强烈的创新精神非常值得九江学习。昌九两地山水相邻、人缘相亲、经济相融，有着特殊的历史渊源、深厚的合作基础。九江将以此次合作签约为契机，主动融圈发展，抓好协议落实，深化双方务实合作，在产业布局上共下“一盘棋”，在基础设施上共建“一张网”，在公共服务上共享“一体化”，全力推进两地产业共兴、交通共建、开放共融、生态共治、文旅共热、服务共享，在双向奔赴中推动昌九一体化高质量发展。。记者从签约现场了解到，根据签约内容，双方将充分发挥两地比较优势，聚焦重点领域持续发力，围绕优势产业集群打造、现代服务业协同发展、交通互联互通、科技协同创新、文化旅游联动、教育体育合作、生态环境共保共治、医疗保障协同、公共事务协同等方面，推动两市在更高层次、更广领域开展务实合作，促进双方经济社会高质量发展，在推进全省高质量发展中作出更大贡献。,深化昌九一体化发展战略合作框架协议签约活动 李红军万广明率队 刘文华蒋文定出席有关活动。7月13日，我市党政代表团赴九江市学习考察，并举行深化昌九一体化发展战略合作框架协议签约活动。省委常委、市委书记李红军，市长万广明率队。九江市委书记刘文华，九江市市长蒋文定出席有关活动。。市党政代表团先后察看了中石化九江分公司、九江德福科技股份有限公司、巨石玻纤新材料智能制造基地、江西科翔电子科技有限公司、江西生益科技有限公司、九江茶市，详细了解九江市经济社会发展、产业布局规划和昌九一体化发展情况。。市党政代表团在考察交流时指出，昌九两市山水相连、人文相亲、经济相融，有着深厚的历史渊源和合作基础。近年来，在省委、省政府的正确领导下，南昌和九江相向而行、同向发力，在产业协同发展、交通互联互通、文化旅游合作、社会治理协作、生态保护共治等领域共同探索，成果颇丰。九江在产业发展、科技创新、对外开放等方面的好经验、好做法值得南昌借鉴和学习。希望双方进一步深化合作交流，全面加强战略协作、功能耦合，携手争取国家或省级战略支持，合力拓宽发展空间，赢得更多红利，汇集更多资源，展现更大作为。积极推动两地市场一体循环、资源要素高效配置，更高起点、更大范围促进优势产业、基础设施、科技创新协同协作，公共事务、生态环境、文化旅游、教育体育共融共享。健全完善领导会晤交流机制、部门交流合作机制、项目洽谈推进机制，做到定期协商、无缝对接，推动双方合作落到实处、见到实效。。刘文华、蒋文定代表九江市委、市政府对南昌市党政代表团的到来表示热烈欢迎，对南昌长期以来给予九江的支持帮助表示衷心感谢。他们表示，近年来，南昌市紧紧围绕“一枢纽四中心”发展定位，深入实施强省会战略，各项工作取得显著成效，南昌先进的发展理念、开阔的战略视野、强烈的创新精神非常值得九江学习。昌九两地山水相邻、人缘相亲、经济相融，有着特殊的历史渊源、深厚的合作基础。九江将以此次合作签约为契机，主动融圈发展，抓好协议落实，深化双方务实合作，在产业布局上共下“一盘棋”，在基础设施上共建“一张网”，在公共服务上共享“一体化”，全力推进两地产业共兴、交通共建、开放共融、生态共治、文旅共热、服务共享，在双向奔赴中推动昌九一体化高质量发展。。记者从签约现场了解到，根据签约内容，双方将充分发挥两地比较优势，聚焦重点领域持续发力，围绕优势产业集群打造、现代服务业协同发展、交通互联互通、科技协同创新、文化旅游联动、教育体育合作、生态环境共保共治、医疗保障协同、公共事务协同等方面，推动两市在更高层次、更广领域开展务实合作，促进双方经济社会高质量发展，在推进全省高质量发展中作出更大贡献。,政府领导到其他城市考察学习或访问,0.0,True
