code,province,city,topic,date,url,content,content.1,label,score,is_match
118,江西省,南昌市,夏文勇在昌调研,2024-01-05,http://www.nc.gov.cn/ncszf/jrnca/202401/4eccd2c8a9dc47bca5d2e72b9a6ab249.shtml,1月4日上午，副省长夏文勇率队深入南昌经开区、南昌综保区，调研重点产业高质量发展及综保区运行建设工作。省政府副秘书长熊科平，副市长赵捷陪同。。夏文勇一行先后来到南昌凯迅光电股份有限公司、欣旺达南昌动力电池生产基地、亿芯半导体（南昌）有限公司、南昌飞力达供应链管理有限公司。每到一处，夏文勇都实地察看企业生产一线，并与企业负责人亲切交流，详细了解企业产品研发、技术创新、性能提升等情况。他勉励企业要以市场需求为导向，继续加大科研创新力度，不断增线扩产，加快企业发展步伐。同时，希望企业将总部和研发中心等落户南昌，助推开放型经济高质量发展。。在随后召开的座谈会上，夏文勇先后听取了我市有关工作情况汇报及2024年工作打算，南昌经开区2024年工作打算，南昌综保区当前存在困难问题等；省工信厅、省商务厅、南昌海关等单位有关负责人就推动南昌综保区发展进行了交流。夏文勇强调，2024年伊始，在工业稳增长上开好局起好步，对于实现全年目标任务、推动高质量发展至关重要。各级各部门要深入学习贯彻习近平总书记考察江西重要讲话精神、中央经济工作会议精神，以及省委经济工作会议精神，按照省委十五届五次全会的部署，早谋深谋细谋实谋全年的工作，为加快建设江西内陆开放型经济试验区和推动工业经济高质量发展作出新的更大贡献。,12月29日，市政数局召开党组理论学习中心组（扩大）专题集体学习研讨会，深入学习习近平新时代中国特色社会主义思想，认真学习贯彻习近平总书记关于党的建设的重要思想。市政数局党组书记、局长李鑫主持会议并讲话。市政数局市管领导干部，各科室、机关党委、团委、云上南昌负责同志出席。。会前，市政数局班子成员认真自学研读了主题教育相关学习材料，学习了中央和省委党内相关法规。会上，大家结合各自工作实际，围绕学习主题进行研讨发言。。会议指出，回顾党的光辉历程，我们党之所以能够不断历经艰难困苦创造新的辉煌，很重要的一条就是我们党始终重视党的建设。习近平总书记对加强党的建设创造性提出了一系列管党治党、兴党强党的新理念新思想新战略，找到了自我革命这一跳出治乱兴衰历史周期率的第二个答案，蕴含着对解决大党独有难题的深邃思考，是习近平新时代中国特色社会主义思想的。“国之大者”，坚定拥护“两个确立”、坚决做到“两个维护”，牢牢把握中央决策部署和省委、市委工作安排，紧密结合政务服务和数据管理工作实际，以党的政治建设为统领，扎实推进党的各方面建设。要以理论思想建设为重点，深入学习贯彻习近平总书记考察江西重要讲话精神、关于党的建设的重要思想以及关于政务服务和数据管理工作的重要论述，切实将理论学习贯穿主题教育始终，做到全面系统学、及时跟进学、深入思考学、联系实际学，深刻领悟其丰富内涵和精髓要义，将其作为谋划推进各项工作的总遵循、总依据、总指引，努力做到真学真懂真信真用，自觉用以武装头脑、指导实践、推动工作。。找准党建工作与业务工作的结合点，推动党建与业务融合互促，处理好党建和业务的关系，解决好。“两张皮”问题；要围绕中心工作，坚持把政治标准、政治要求贯彻工作全过程，推动党的主张和决策部署及时转化为本单位本部门政策措施；要充分发挥基层党组织战斗堡垒和党员先锋模范作用，进一步增强为民服务意识，提升政务服务水平。要在助力推动本地经济回升向好，开展惠企纾困，解决群众急难愁盼问题上想办法、下功夫、抓落实、建机制，不断提升企业、群众对我们工作的满意度。要以干部队伍建设为基础，坚持党管人才原则，健全完善结构合理、梯次接续的高素质党员干部队伍具体举措，搭建实践锻炼平台，创新跟踪培养方式，严格日常监督管理，全方位加强干部队伍建设，落实“三个区分开来”，推动干部能上能下、能进能出，敢于担当、积极作为。要以强化作风建设为抓手，始终坚持把纪律建设摆在更加突出位置，持之以恒贯彻落实中央八项规定及其实施细则精神，坚决纠治形式主义、官僚主义。,其他,0.5822901792516406,True
118,江西省,南昌市,全市中小学校党组织书记重点培训班开班,2023-11-20,http://www.nc.gov.cn/ncszf/jyzx/202311/e1089d12610b439981913d9d44f62e60.shtml,为进一步加强全市中小学校党建工作，推动中小学校“立德树人”根本任务与党建服务中心工作紧密融合，11月20日上午，2023年全市中小学校党组织书记重点培训班在市委党校开班。市委教育工委书记、市教育局局长黄琰出席开班仪式并讲话，市委教育工委副书记、市教育局副局长何永明主持。局直属学校（单位）、市管民办、各县区教育行政部门党组织书记参加培训。。开班仪式上，黄琰就如何推动中小学校党建内涵力提升提出了三点要求。一要讲政治，在学中找准“凝心铸魂”的思想行动坐标。作为一名中小学校的党组织书记，要始终在政治立场、政治方向、政治原则、政治道路上同以习近平同志为核心的党中央保持高度一致，学深悟透习近平新时代中国特色社会主义思想，在常学常新中“明大智”，在悟深悟透中“增睿智”，在笃信笃行中“长才智”，充分发挥党对教育事业全面领导的政治优势和社会主义制度的制度优势，不断开辟教育事业发展的新领域新赛道。。二要求实效，在学中锚定办好人民满意教育的工作目标。回应使命，做有责任的教育者，以推动学校发展为己任，加快构建五育并举的教育体系，促进教育评价科学转型，营造健康安全的教育环境和生态；立足本职，做有魄力的管理者，推动建设中小学校党组织领导的校长负责制，实现以高质量党建推动高质量办学治校和教书育人；转变作风，做有思路的实干者，努力把调查研究成果转化为改善办学治校举措、助推学生全面发展的办法举措，结合实际积极探索独具特色的治学理念和办学模式。。三要当表率，在学中展现“走在前、勇争先、善作为”的榜样力量。当好“领头雁”，在思想上做表率，率先垂范、以上率下，自觉从习近平新时代中国特色社会主义思想中悟规律、明方向、学方法、增智慧；当好“主心骨”，在能力上做表率，不断激发广大教职工“带着情怀拼干劲、扛着责任拼质量”的奋斗精神，全面开创学校发展新局面；当好“排头兵”，在作风上做表率，深刻认识守住学校意识形态工作主阵地的重要作用，进一步引导全体教师常怀敬畏之心，把握纪律底线，清正校园政治生态。。此次培训为期三天，课程以深入学习宣传贯彻党的二十大精神为主线，涵盖学习贯彻习近平总书记考察江西重要讲话精神、党的基本理论、统一战线、全面从严治党等内容，采取专题教学、互动教学、现场教学等形式多样的教学手段，主题突出、特色明显。,黄喜忠指出，当前，全省上下正深入学习贯彻习近平总书记考察江西重要讲话精神，全力打造“三大高地”，实施“五大战略”，全省经济加快恢复、持续向好。此次大会召开，就是深入贯彻落实习近平总书记考察江西重要讲话精神的有力举措，必将进一步推动江西省民营经济高质量发展。。黄喜忠指出，江西是全国唯一同时毗邻粤港澳大湾区、长江三角洲和海西经济区的省份，历史文化悠久，产业基础雄厚，特别是装备制造产业有着深厚积淀和先发优势。各位企业家来赣参访考察、投资兴业，机遇无限，前景广阔。真诚希望大家常来江西指导考察，共享江西风景独好的“人文之美”、厚积薄发的“发展之势”、转型升级的“产业之机”、潜力无限的“要素之利”。我们将以热情周到的服务，让来到江西的新老朋友放心投资、安心创业、舒心发展。。安立佳指出，当前，江西正在大力实施制造业重点产业链现代化建设“1269”行动计划，南昌正在实施“8810”行动计划，其打造的重点产业链与全国工商联科技装备业商会的会员产业分布高度契合。大家要积极参与江西（南昌）现代化产业体系建设，通过资源共享、优势互补，实现大中小企业、产业链上下游企业融通发展。要加强试点示范，培育全国工商联科技创新民营企业，建设民营企业科技创新园区，为推动江西（南昌）新型工业化转型升级、助力区域经济发展、实现民营经济高质量发展贡献力量。。万广明指出，南昌是一座宜居、宜业、宜游的城市，是一片投资、开发、合作的热土，有一个亲商、护商、安商的环境。南昌战略地位凸显、综合实力雄厚、民营经济活跃，政策暖心贴心、服务优质高效、保障立体全面。真诚邀请大家多在南昌走一走，看一看，或点拨指导、或投资兴业，助推南昌开创更加美好未来。我们将努力打造市场化、法治化、国际化营商环境，让广大企业家在南昌投资放心、创业安心、发展顺心、生活舒心。,其他,0.5332845295411393,True
118,江西省,南昌市,万广明调研民营企业发展情况,2023-11-01,http://www.nc.gov.cn/ncszf/jrnca/202311/e24bfcb1c52249efb703ab1aa3275ec0.shtml,10月31日，市长万广明来到南昌高新区，深入中大控股集团有限公司，走访调研民营企业发展情况，面对面倾听企业诉求，现场办公解决实际问题。他强调，要深入学习贯彻习近平总书记考察江西重要讲话精神，全面落实省会引领战略，坚持“两个毫不动摇”，坚定企业发展信心，一以贯之重视、服务广大民营企业，全面增强民营经济综合实力和竞争力，为南昌经济高质量发展提供支撑。。中大控股集团有限公司是一家集科技研发、智能建造、装配式工业、地产置业、物业管理、矿产开发等多个业务板块于一体的多业态集团公司。来到该公司，万广明观看企业宣传视频，与公司负责人座谈交流，听取企业发展情况介绍，询问企业发展中的困难和问题。万广明对公司连续三年上榜全国民营企业500强表示赞赏。他指出，市委、市政府始终坚持“两个毫不动摇”“三个没有变”，持续营造市场化、法治化、国际化一流营商环境，全力支持民营企业发展。要求企业抢抓转型机遇，坚定发展信心，积极谋划拓展新领域、新赛道，努力做强主业、做精产品、做优特色。南昌高新区和市属各部门要结合深入开展学习贯彻习近平新时代中国特色社会主义思想主题教育，积极主动为企业提供全方位、全生命周期的“妈妈式”服务，为民营企业排忧解难，持续提升服务品质，把惠企政策落到实处，助力民营企业做大做强。,根据主题教育工作安排，10月31日，市委副书记、市长万广明到南昌市第三中学青山湖校区讲授主题教育专题党课。他强调，要深入学习贯彻习近平总书记考察江西重要讲话精神，聚焦“走在前、勇争先、善作为”目标要求，紧紧围绕“学思想、强党性、重实践、建新功”总要求，通过学思用贯通、知信行统一，把习近平新时代中国特色社会主义思想转化为坚定理想、锤炼党性和指导实践、推动工作的强大力量，深入推进“一枢纽四中心”建设，努力开创高质量发展新局面。。结合自己的学习体会，万广明以“传承弘扬中华优秀传统文化，努力成为担当民族复兴大任的时代新人”为题，深入阐释习近平新时代中国特色社会主义思想的科学体系、精神实质和精髓要义。希望广大青年学生要增强文化自信，厚植家国情怀，激扬拼搏斗志，扛起传承弘扬中华优秀传统文化的使命担当，在时代发展中找准人生目标，在国家需要中校准价值坐标。。万广明指出，全市广大教师要牢记为党育人、为国育才的初心使命，以德为先、以爱为上、以智育人，让学生从深厚文化底蕴中坚定走中国道路的决心，笃定坚持党的领导、坚定跟党走的意志，为国家培养德智体美劳全面发展的社会主义建设者和接班人。他寄语广大青年学生要仰望星空、脚踏实地，珍惜光阴、勤学博学，学会明辨是非，端正价值取向，做有理想、懂得感恩、有良好习惯的新时代青年；希望青年学生与南昌共同见证时代前进的强劲脉搏，期待同学们以“奋斗有我”的信念与姿态，学有所成，回报家乡。。来自市政府办公室机关第一党支部的全体党员、市教育局的班子成员及局属学校党组织负责同志、市第三中学的师生代表近300人聆听了专题党课。,其他,0.5591443890343637,True
118,江西省,南昌市,万广明讲授主题教育专题党课,2023-11-01,http://www.nc.gov.cn/ncszf/jrnca/202311/bec67b587c06420ca2addaad4ae290bc.shtml,根据主题教育工作安排，10月31日，市委副书记、市长万广明到南昌市第三中学青山湖校区讲授主题教育专题党课。他强调，要深入学习贯彻习近平总书记考察江西重要讲话精神，聚焦“走在前、勇争先、善作为”目标要求，紧紧围绕“学思想、强党性、重实践、建新功”总要求，通过学思用贯通、知信行统一，把习近平新时代中国特色社会主义思想转化为坚定理想、锤炼党性和指导实践、推动工作的强大力量，深入推进“一枢纽四中心”建设，努力开创高质量发展新局面。。结合自己的学习体会，万广明以“传承弘扬中华优秀传统文化，努力成为担当民族复兴大任的时代新人”为题，深入阐释习近平新时代中国特色社会主义思想的科学体系、精神实质和精髓要义。希望广大青年学生要增强文化自信，厚植家国情怀，激扬拼搏斗志，扛起传承弘扬中华优秀传统文化的使命担当，在时代发展中找准人生目标，在国家需要中校准价值坐标。。万广明指出，全市广大教师要牢记为党育人、为国育才的初心使命，以德为先、以爱为上、以智育人，让学生从深厚文化底蕴中坚定走中国道路的决心，笃定坚持党的领导、坚定跟党走的意志，为国家培养德智体美劳全面发展的社会主义建设者和接班人。他寄语广大青年学生要仰望星空、脚踏实地，珍惜光阴、勤学博学，学会明辨是非，端正价值取向，做有理想、懂得感恩、有良好习惯的新时代青年；希望青年学生与南昌共同见证时代前进的强劲脉搏，期待同学们以“奋斗有我”的信念与姿态，学有所成，回报家乡。。来自市政府办公室机关第一党支部的全体党员、市教育局的班子成员及局属学校党组织负责同志、市第三中学的师生代表近300人聆听了专题党课。,11月13日，全市数字经济创新发展培训班开班。市委常委、常务副市长胡晓海出席并讲话。。胡晓海指出，在深入学习贯彻习近平总书记考察江西重要讲话精神的关键时期，在全市上下奋战四季度的繁忙时刻，举办本次培训班，非常难得、非常重要、非常必要。希望大家通过集中学习，系统掌握数字经济相关专业知识，切实提高业务水平、实操能力，为全市建设“全省数字经济创新发展引领区、打造全国数字经济新高地”作出更大贡献。。胡晓海强调，当前，新一轮科技革命和产业变革深入开展，数字技术全面融入经济社会各领域，深刻影响着生产、生活和治理方式。要切实提高学习的主动性、积极性，自觉补齐能力短板，锤炼过硬专业素养和能力。要提升学习针对性，增强对数字经济发展趋势、规律、重点任务的理解和把握，抓准数字经济的切入点、着力点，不断提升突破主攻赛道、推动产业数字化转型、开展数字化治理的能力。要坚持学以致用，突出实效性，进一步聚焦全市16条数字经济主攻赛道，强化数字赋能产业转型升级，不断夯实数字经济底座，切实把学习成果转化为高质量推动全市数字经济发展的强大力量。,其他,0.6558664915656961,True
118,江西省,南昌市,全市数字经济创新发展培训班开班,2023-11-14,http://www.nc.gov.cn/ncszf/jrnca/202311/d6d27fafbda64d559bfaf7033645d0cc.shtml,11月13日，全市数字经济创新发展培训班开班。市委常委、常务副市长胡晓海出席并讲话。。胡晓海指出，在深入学习贯彻习近平总书记考察江西重要讲话精神的关键时期，在全市上下奋战四季度的繁忙时刻，举办本次培训班，非常难得、非常重要、非常必要。希望大家通过集中学习，系统掌握数字经济相关专业知识，切实提高业务水平、实操能力，为全市建设“全省数字经济创新发展引领区、打造全国数字经济新高地”作出更大贡献。。胡晓海强调，当前，新一轮科技革命和产业变革深入开展，数字技术全面融入经济社会各领域，深刻影响着生产、生活和治理方式。要切实提高学习的主动性、积极性，自觉补齐能力短板，锤炼过硬专业素养和能力。要提升学习针对性，增强对数字经济发展趋势、规律、重点任务的理解和把握，抓准数字经济的切入点、着力点，不断提升突破主攻赛道、推动产业数字化转型、开展数字化治理的能力。要坚持学以致用，突出实效性，进一步聚焦全市16条数字经济主攻赛道，强化数字赋能产业转型升级，不断夯实数字经济底座，切实把学习成果转化为高质量推动全市数字经济发展的强大力量。,胡晓海一行走访慰问了河林村脱贫户熊维新，详细了解他的经济来源、生活状况、子女读书与工作等情况，鼓励他要好好生活，努力把子女培养成才。随后，胡晓海来到河林村特色产业园，察看蔬果长势，询问产业园的规模、用工、营收等情况。他指出，巩固拓展脱贫攻坚成果同乡村振兴有效衔接，是全面推进乡村振兴的重要前提。要提高政治站位，深入学习贯彻习近平总书记考察江西重要讲话精神，切实担负起全面推进乡村振兴的历史使命，始终保持激情不退、干劲不减、力度不松。要主动履职尽责，坚持以人民为中心的发展思想，积极践行“四下基层、三访三促”工作机制，沉到一线听民情，上门服务解民忧，切实把主题教育成果转化成为民办实事的生动实践。要坚持发展为要，进一步立足当地资源禀赋优势，协同推进产业深度融合发展，有效夯实乡村振兴产业根基，不断激发群众内生动力，全力推动农民增收致富路越走越宽。,其他,0.6106164572113996,True
