code,province,city,topic,date,url,content,content.1,label,score,is_match
125,江西省,吉安市,全国人大代表市委书记罗文江接受香港商报专访打造全国革命老区重点城市对口合作典范,2024-03-10,http://www.jian.gov.cn/news-show-86854.html,吉安市人民政府 全国人大代表、市委书记罗文江接受《香港商报》专访 打造全国革命老区重点城市对口合作典范。2023年10月，习近平总书记考察江西时强调，要深化对内对外开放，以开放促发展，打造内陆地区改革开放高地，主动服务和融入新发展格局。处在赣中腹地的吉安，将如何释放开放信号，打好对口合作的联动牌？2024年全国两会期间，全国人大代表、吉安市委书记罗文江接受《香港商报》专访，讲述老区和湾区双向奔赴的动人故事。。粤港澳大湾区是我国开放程度最高、经济活力最强的区域之一，也是吉安市开放发展对接的主要方向。2022年5月，国家发改委印发《革命老区重点城市对口合作工作方案》，明确东莞市和吉安市建立对口合作关系，为吉安革命老区融入湾区、推动高质量发展带来重大机遇。。好风凭借力，吉安市抢抓政策机遇、主动对接，与东莞市共商合作、共谋发展、双向奔赴，对口合作不断走深走实。。2023年2月，广东和江西两省联合印发了《东莞市与吉安市对口合作实施方案（2023-2027年）》，明确双方以传承弘扬红色文化和深化文旅合作、统筹推进乡村振兴和新型城镇化、完善基本公共服务、促进生态环境保护修复和绿色低碳发展、深化产业合作发展、拓展科技创新合作发展为重点的6个方面、22条具体举措。此外吉安进一步具体化、项目化，先后推进2批次9个方面55个具体合作事项。目前，吉安各县（市、区）均与东莞市镇、街（园区）开展结对合作，两地40多个部门签订合作协议，对口合作向宽领域、多层次拓展。。同时，吉安、东莞两地建立起常态化合作机制，实行联席会议、会晤交流、协调会议三级联动工作机制。2023年8月和2024年3月，先后在东莞、吉安召开了2次对口合作联席会议，两地党政代表团开展互访交流、学习考察，各级干部互访交流150余次，去年派出第一批干部到东莞跟岗锻炼，今年第二批也即将到岗。两地还签订了专家人才库建设共享合作协议，常态化组织专家人才合作交流。。耕耘不负，终结硕果。目前，两地在推进产业互融、游客互送、干部互派、民生互惠等方面都取得了显著成效。。电子信息是两地的主导产业，吉安市积极推动产业链供应链合作，吉安42家企业与东莞142家企业建立合作关系，东莞松山湖电子科技大学在吉安组建“电子科技大学吉安实验室”。。吉安山清水秀、生态良好，优质农产品众多。吉安借此打造“井冈山”农产品区域公用品牌，在东莞举办了品牌发布会，开设了2家旗舰店，两地合作生产的矿泉水投入市场，吉安38家蔬菜水果基地成功认证粤港澳大湾区“菜篮子”，更多吉安优质农产品进入大湾区市场。。在文旅合作方面，吉安市的4A级以上景区对东莞游客实行半价优惠，并开展了大湾区万人游等活动，积极对接湾区文旅市场。春节期间，两地还联合开展双城腊味节等系列交流活动，人气热、消费旺，增进了两地交流和情感交融。。在产业融湾方面，吉安聚焦电子信息、新材料、生物医药等主导产业，深度融入产业分工，积极承接产业转移，开展产业链上下游合作，推进飞地园区建设，加快培育壮大千亿产业集群。。在科创融湾方面，吉安将更好发挥东莞科创资源优势，推动两地创新平台共建、技术协同攻关，加快建设科创飞地，促进更多创新成果转化、科技企业孵化，发展新质生产力。。在人才融湾方面，吉安积极推进两地高校人才合作、学术交流和实践教学。深化职业教育合作，共建产业实训基地，推进校企对接、产教融合，培育更多应用型、技能型人才。。在文旅融湾方面，吉安将常态化开展游客互送、品牌共创、互利共赢，推出红绿古精品旅游线路，加强旅游协会、旅行社对接，让吉安成为大湾区游客的重要旅游目的地。,吉安市人民政府 全国人大代表、市委书记罗文江接受《香港商报》专访 打造全国革命老区重点城市对口合作典范。2023年10月，习近平总书记考察江西时强调，要深化对内对外开放，以开放促发展，打造内陆地区改革开放高地，主动服务和融入新发展格局。处在赣中腹地的吉安，将如何释放开放信号，打好对口合作的联动牌？2024年全国两会期间，全国人大代表、吉安市委书记罗文江接受《香港商报》专访，讲述老区和湾区双向奔赴的动人故事。。粤港澳大湾区是我国开放程度最高、经济活力最强的区域之一，也是吉安市开放发展对接的主要方向。2022年5月，国家发改委印发《革命老区重点城市对口合作工作方案》，明确东莞市和吉安市建立对口合作关系，为吉安革命老区融入湾区、推动高质量发展带来重大机遇。。好风凭借力，吉安市抢抓政策机遇、主动对接，与东莞市共商合作、共谋发展、双向奔赴，对口合作不断走深走实。。2023年2月，广东和江西两省联合印发了《东莞市与吉安市对口合作实施方案（2023-2027年）》，明确双方以传承弘扬红色文化和深化文旅合作、统筹推进乡村振兴和新型城镇化、完善基本公共服务、促进生态环境保护修复和绿色低碳发展、深化产业合作发展、拓展科技创新合作发展为重点的6个方面、22条具体举措。此外吉安进一步具体化、项目化，先后推进2批次9个方面55个具体合作事项。目前，吉安各县（市、区）均与东莞市镇、街（园区）开展结对合作，两地40多个部门签订合作协议，对口合作向宽领域、多层次拓展。。同时，吉安、东莞两地建立起常态化合作机制，实行联席会议、会晤交流、协调会议三级联动工作机制。2023年8月和2024年3月，先后在东莞、吉安召开了2次对口合作联席会议，两地党政代表团开展互访交流、学习考察，各级干部互访交流150余次，去年派出第一批干部到东莞跟岗锻炼，今年第二批也即将到岗。两地还签订了专家人才库建设共享合作协议，常态化组织专家人才合作交流。。耕耘不负，终结硕果。目前，两地在推进产业互融、游客互送、干部互派、民生互惠等方面都取得了显著成效。。电子信息是两地的主导产业，吉安市积极推动产业链供应链合作，吉安42家企业与东莞142家企业建立合作关系，东莞松山湖电子科技大学在吉安组建“电子科技大学吉安实验室”。。吉安山清水秀、生态良好，优质农产品众多。吉安借此打造“井冈山”农产品区域公用品牌，在东莞举办了品牌发布会，开设了2家旗舰店，两地合作生产的矿泉水投入市场，吉安38家蔬菜水果基地成功认证粤港澳大湾区“菜篮子”，更多吉安优质农产品进入大湾区市场。。在文旅合作方面，吉安市的4A级以上景区对东莞游客实行半价优惠，并开展了大湾区万人游等活动，积极对接湾区文旅市场。春节期间，两地还联合开展双城腊味节等系列交流活动，人气热、消费旺，增进了两地交流和情感交融。。在产业融湾方面，吉安聚焦电子信息、新材料、生物医药等主导产业，深度融入产业分工，积极承接产业转移，开展产业链上下游合作，推进飞地园区建设，加快培育壮大千亿产业集群。。在科创融湾方面，吉安将更好发挥东莞科创资源优势，推动两地创新平台共建、技术协同攻关，加快建设科创飞地，促进更多创新成果转化、科技企业孵化，发展新质生产力。。在人才融湾方面，吉安积极推进两地高校人才合作、学术交流和实践教学。深化职业教育合作，共建产业实训基地，推进校企对接、产教融合，培育更多应用型、技能型人才。。在文旅融湾方面，吉安将常态化开展游客互送、品牌共创、互利共赢，推出红绿古精品旅游线路，加强旅游协会、旅行社对接，让吉安成为大湾区游客的重要旅游目的地。,政府领导到其他城市考察学习或访问,0.6822985175073214,True
125,江西省,吉安市,市委常委会召开会议学习习近平总书记重要讲话精神研究部署我市贯彻落实意见罗文江主持,2023-12-12,http://www.jian.gov.cn/news-show-84582.html,吉安市人民政府_市委常委会召开会议 学习习近平总书记重要讲话精神研究部署我市贯彻落实意见 罗文江主持。​ （记者郭欢）12月11日，市委常委会召开会议，传达学习习近平总书记近期重要讲话重要指示精神和中央近期重要会议精神，省党政代表团赴浙江、上海、江苏考察情况及考察小结会议精神，研究部署我市贯彻落实意见。市委书记罗文江主持。。会议指出，习近平总书记近期一系列重要讲话，涵盖科技创新、改革开放、生态文明建设、长江经济带发展、长三角一体化、文化建设、法治建设等方面，内容丰富、思想深邃，要及时跟进学、持续深入学，抓好贯彻落实。会议强调，要加快推动高质量发展，坚决打好培育壮大千亿产业集群攻坚战，深入实施创新驱动发展战略，围绕产业链布局创新链，增强创新驱动力，坚定不移走生态优先、绿色发展之路，把吉安生态优势转化为发展胜势。要全面深化改革开放，坚决打好重点改革突破攻坚战，推进开发区、GEP核算、普惠金融、营商环境等重点领域改革取得新突破，狠抓招大引强，运作好产业基金，在招引重大项目和产业链终端项目上取得突破；深化与赣州联动发展、与东莞对口合作，抓好合作有关事项落地落实。要推进文化强市建设，聚焦思想引领、传承创新、文化惠民、融合发展等重点任务，持续发力、久久为功，不断开创文化强市建设新局面。要加强法治建设，营造市场化、法治化、国际化的营商环境；大力弘扬宪法精神，扎实开展“八五”普法，提升宪法实施和监督水平，加快法治吉安、平安吉安建设。。会议传达学习省党政代表团赴浙江、上海、江苏考察情况及考察小结会议精神。会议指出，这次学习考察既是深入学习贯彻习近平总书记考察江西重要讲话精神的务实举措，也是主动对接融入长三角一体化发展的具体行动，是新时代新征程上推动江西高质量发展的现实需要，充分彰显了省委、省政府谋发展、抓发展的强烈政治担当。会议指出，通过这次学习考察，深刻感受到三省市发展态势之强，融入对接长三角大有可为；深刻感受到三省市产业层次之高，新思维新理念可及可学；深刻感受到三省市改革创新力度之大，全球视野和敢闯敢试的气魄值得钦佩；深刻感受到三省市社会治理之新，人民至上的价值理念有效落实。会议强调，要认清差距，增强加快发展的紧迫感，强化危机意识，对标先进地区，认清差距、奋起直追。要把握大势，提升开放水平，放大开放视野、拓展开放格局，以高水平开放推动高质量发展。要锚定创新，强化企业主体地位、打造新型研发平台、加强人才支撑，引领产业升级。要敢闯敢试，提升攻坚克难的能力作风。既要苦干实干，也要善干会干，学习借鉴先进地区经验，提高经济工作专业化水平，促进吉安高质量发展。。会议传达学习纪念毛泽东同志批示学习推广“枫桥经验”60周年暨总书记指示坚持发展“枫桥经验”20周年会议精神，研究我市贯彻落实意见。会议强调，要坚持和发展新时代“枫桥经验”，深入推进“治理强基平安护航行动”，加强基层综治中心实体化建设，加快“一站式”化解平台全覆盖建设，提升矛盾纠纷预防化解水平，为高质量发展创造安全稳定的社会环境。。会议传达学习全省立法工作会议精神，研究我市贯彻落实意见。会议要求，要牢牢把握地方立法工作正确政治方向，践行全过程人民民主，形成党委领导、人大主导、政府依托、各方参与的立法工作格局。要提高地方立法质量，紧扣吉安所能、发展所需、群众所盼，探索“小快灵”“小切口”立法，以高质量立法促进吉安高质量发展。,吉安市人民政府_市委常委会召开会议 学习习近平总书记重要讲话精神研究部署我市贯彻落实意见 罗文江主持。​ （记者郭欢）12月11日，市委常委会召开会议，传达学习习近平总书记近期重要讲话重要指示精神和中央近期重要会议精神，省党政代表团赴浙江、上海、江苏考察情况及考察小结会议精神，研究部署我市贯彻落实意见。市委书记罗文江主持。。会议指出，习近平总书记近期一系列重要讲话，涵盖科技创新、改革开放、生态文明建设、长江经济带发展、长三角一体化、文化建设、法治建设等方面，内容丰富、思想深邃，要及时跟进学、持续深入学，抓好贯彻落实。会议强调，要加快推动高质量发展，坚决打好培育壮大千亿产业集群攻坚战，深入实施创新驱动发展战略，围绕产业链布局创新链，增强创新驱动力，坚定不移走生态优先、绿色发展之路，把吉安生态优势转化为发展胜势。要全面深化改革开放，坚决打好重点改革突破攻坚战，推进开发区、GEP核算、普惠金融、营商环境等重点领域改革取得新突破，狠抓招大引强，运作好产业基金，在招引重大项目和产业链终端项目上取得突破；深化与赣州联动发展、与东莞对口合作，抓好合作有关事项落地落实。要推进文化强市建设，聚焦思想引领、传承创新、文化惠民、融合发展等重点任务，持续发力、久久为功，不断开创文化强市建设新局面。要加强法治建设，营造市场化、法治化、国际化的营商环境；大力弘扬宪法精神，扎实开展“八五”普法，提升宪法实施和监督水平，加快法治吉安、平安吉安建设。。会议传达学习省党政代表团赴浙江、上海、江苏考察情况及考察小结会议精神。会议指出，这次学习考察既是深入学习贯彻习近平总书记考察江西重要讲话精神的务实举措，也是主动对接融入长三角一体化发展的具体行动，是新时代新征程上推动江西高质量发展的现实需要，充分彰显了省委、省政府谋发展、抓发展的强烈政治担当。会议指出，通过这次学习考察，深刻感受到三省市发展态势之强，融入对接长三角大有可为；深刻感受到三省市产业层次之高，新思维新理念可及可学；深刻感受到三省市改革创新力度之大，全球视野和敢闯敢试的气魄值得钦佩；深刻感受到三省市社会治理之新，人民至上的价值理念有效落实。会议强调，要认清差距，增强加快发展的紧迫感，强化危机意识，对标先进地区，认清差距、奋起直追。要把握大势，提升开放水平，放大开放视野、拓展开放格局，以高水平开放推动高质量发展。要锚定创新，强化企业主体地位、打造新型研发平台、加强人才支撑，引领产业升级。要敢闯敢试，提升攻坚克难的能力作风。既要苦干实干，也要善干会干，学习借鉴先进地区经验，提高经济工作专业化水平，促进吉安高质量发展。。会议传达学习纪念毛泽东同志批示学习推广“枫桥经验”60周年暨总书记指示坚持发展“枫桥经验”20周年会议精神，研究我市贯彻落实意见。会议强调，要坚持和发展新时代“枫桥经验”，深入推进“治理强基平安护航行动”，加强基层综治中心实体化建设，加快“一站式”化解平台全覆盖建设，提升矛盾纠纷预防化解水平，为高质量发展创造安全稳定的社会环境。。会议传达学习全省立法工作会议精神，研究我市贯彻落实意见。会议要求，要牢牢把握地方立法工作正确政治方向，践行全过程人民民主，形成党委领导、人大主导、政府依托、各方参与的立法工作格局。要提高地方立法质量，紧扣吉安所能、发展所需、群众所盼，探索“小快灵”“小切口”立法，以高质量立法促进吉安高质量发展。,政府领导到其他城市考察学习或访问,0.5054942574690792,True
125,江西省,吉安市,市政府召开常务会议王亚联主持,2023-08-29,http://www.jian.gov.cn/news-show-81469.html,​ （记者任洪广）8月28日，市委副书记、代市长王亚联主持召开市五届政府第41次常务会议，传达学习习近平总书记近期重要讲话重要指示和中央近期重要会议精神，贯彻落实省委、省政府和市委有关部署要求，审议有关文件，研究安排有关工作。。会议传达学习了习近平总书记在成都第三十一届世界大学生夏季运动会开幕式欢迎宴会上的重要致辞、在中央政治局第七次集体学习时的重要讲话、对防汛救灾工作和首个全国生态日之际作出的重要指示、在8月17日中央政治局常委会上的重要讲话、2023年金砖国家工商论坛闭幕式上的重要致辞，以及金砖国家领导人第十五次会晤上的重要讲话精神。会议指出，习近平总书记近期一系列重要讲话重要指示，涵盖生态文明、扩大开放、防汛抗旱、对外工作、军事治理等各方面，内涵丰富、思想深邃，要持续学、深入学，融入日常、学在经常，结合实际抓好落实。。会议强调，要持续拓展生态优势。牢固树立绿水青山就是金山银山理念，以更高站位、更宽视野、更大力度推进新征程的生态文明建设。持之以恒打好污染防治攻坚战，积极推进生态文明制度建设和改革创新，打通“两山”转化通道，为全省打造国家生态文明建设高地贡献吉安力量。要坚定不移扩大开放。积极融入党和国家外交大局，坚定不移推进高水平开放，主动融入粤港澳大湾区，加强与东莞、赣州等地的沟通对接，促进产业发展、公共服务、基础设施、人才交流、文旅融合等多领域合作，以大开放促进大发展。要守牢安全稳定底线。以“时时放心不下”的责任感，统筹抓好防汛和抗旱工作，加强重点区域的隐患排查整治，抓好山体滑坡等地质灾害防治，坚决维护群众生命财产安全。加强耕地保护，特别是抓紧抓实补充耕地问题的项目整改，确保粮食生产安全。。会议还交流了市党政代表团成员赴赣州、东莞学习考察心得体会；专题研究了2023年7月有关县（区）上报市委工作建议的落实措施。,​ （记者任洪广）8月28日，市委副书记、代市长王亚联主持召开市五届政府第41次常务会议，传达学习习近平总书记近期重要讲话重要指示和中央近期重要会议精神，贯彻落实省委、省政府和市委有关部署要求，审议有关文件，研究安排有关工作。。会议传达学习了习近平总书记在成都第三十一届世界大学生夏季运动会开幕式欢迎宴会上的重要致辞、在中央政治局第七次集体学习时的重要讲话、对防汛救灾工作和首个全国生态日之际作出的重要指示、在8月17日中央政治局常委会上的重要讲话、2023年金砖国家工商论坛闭幕式上的重要致辞，以及金砖国家领导人第十五次会晤上的重要讲话精神。会议指出，习近平总书记近期一系列重要讲话重要指示，涵盖生态文明、扩大开放、防汛抗旱、对外工作、军事治理等各方面，内涵丰富、思想深邃，要持续学、深入学，融入日常、学在经常，结合实际抓好落实。。会议强调，要持续拓展生态优势。牢固树立绿水青山就是金山银山理念，以更高站位、更宽视野、更大力度推进新征程的生态文明建设。持之以恒打好污染防治攻坚战，积极推进生态文明制度建设和改革创新，打通“两山”转化通道，为全省打造国家生态文明建设高地贡献吉安力量。要坚定不移扩大开放。积极融入党和国家外交大局，坚定不移推进高水平开放，主动融入粤港澳大湾区，加强与东莞、赣州等地的沟通对接，促进产业发展、公共服务、基础设施、人才交流、文旅融合等多领域合作，以大开放促进大发展。要守牢安全稳定底线。以“时时放心不下”的责任感，统筹抓好防汛和抗旱工作，加强重点区域的隐患排查整治，抓好山体滑坡等地质灾害防治，坚决维护群众生命财产安全。加强耕地保护，特别是抓紧抓实补充耕地问题的项目整改，确保粮食生产安全。。会议还交流了市党政代表团成员赴赣州、东莞学习考察心得体会；专题研究了2023年7月有关县（区）上报市委工作建议的落实措施。,政府领导到其他城市考察学习或访问,0.6386017197081703,True
