code,province,city,topic,date,url,content,content.1,label,score,is_match
18,山西省,晋城市,山西党政代表团赴安徽学习考察,2023-07-20,http://www.jcgov.gov.cn/dtxx/sxyw/202307/t20230720_1825288.shtml,7月18日，山西党政代表团在科大讯飞公司考察人工智能产品研发和行业应用落地情况。本报记者史晓波摄。为深入贯彻习近平总书记关于“三新一高”的重要论述精神，向安徽学习加强科技创新、扩大对外开放、优化营商环境、促进制造业高质量发展等方面的经验做法，更好服务和融入新发展格局，推动转型发展和现代化建设再上新台阶，7月18日至19日，山西党政代表团赴安徽学习考察，并召开山西省·安徽省工作交流座谈会，进一步深化两省务实合作，共同谱写晋皖两地交流合作新篇章。山西省委书记、省人大常委会主任蓝佛安，安徽省委书记、省人大常委会主任韩俊，山西省委副书记、省长金湘军，安徽省委副书记、省长王清宪出席座谈会并参加考察。。近年来，安徽省聚焦打造科技创新策源地、新兴产业聚集地、改革开放新高地和经济社会发展全面绿色转型区战略目标，积极主动融入长三角一体化发展，在优化营商环境、强化科技创新、开展招商引资、发展新兴产业等方面形成了很多亮点做法。在皖期间，山西党政代表团先后到合肥、芜湖学习观摩考察，一路上广泛交流、深入思考、主动对接，为山西高质量发展取真经、谈合作、谋突破。在科大讯飞公司、科大国盾量子技术公司、安徽创新馆和中国视谷，代表团深入了解人工智能、量子通信等前沿技术和高新产业发展情况，学习安徽在高能级创新平台集聚、科技大市场培育、科创成果转化应用等方面的理念经验，对安徽创新型省份建设成效表示钦佩。在国轩高科公司、奇瑞生产基地和中电科钻石飞机公司，代表团实地感受安徽高端制造业蓬勃发展的强劲势头，学习了解安徽围绕产业链部署创新链、围绕创新链布局产业链、承接长三角一体化产业转移的经验做法，并就有关项目进行了交流对接。。19日下午，山西省·安徽省工作交流座谈会在合肥市举行。韩俊在交流会讲话中首先代表安徽省委、省政府对山西党政代表团的到来表示热烈欢迎。他说，近年来，山西认真贯彻落实习近平总书记“走出一条产业优、质量高、效益好、可持续的发展新路”重要要求，在煤炭先进产能建设、新能源装机规模、电力市场化改革等方面走在全国前列，为中部地区高质量发展提供了宝贵经验。当前，安徽认真学习贯彻习近平总书记关于安徽工作的重要讲话重要指示精神，充分发挥创新活跃强劲、制造特色鲜明、生态资源良好、内陆腹地广阔等优势，抢抓长三角一体化发展战略机遇，全力做好“产业＋科技＋人才＋金融”大文章，推动思想大解放、环境大优化、能力大提升、作风大转变、任务大落实，全面推进科技强省、制造强省、农业强省、人才强省、教育强省、文化强省建设，正在走出一条新时代质量更高、效益更好、结构更优、活力更足、优势充分释放的发展新路。希望两省加强能源领域合作，加强新材料、高端装备制造、节能环保等战略性新兴产业合作，在文化旅游领域联合打造精品旅游线路和旅游产品，推动重点旅游城市联合开展宣传推介活动，共同推动皖晋两省高质量发展。。山西省领导李凤岐、卢东亮、韦韬、汤志平、赵红严、杨勤荣、熊继军，安徽省领导虞爱华、张韵声、单向前参加有关活动。省直有关部门、部分省管国有企业、有关开发区主要负责同志，各市市委书记等山西党政代表团成员参加。（记者 杨文俊）,7月18日，山西党政代表团在科大讯飞公司考察人工智能产品研发和行业应用落地情况。本报记者史晓波摄。为深入贯彻习近平总书记关于“三新一高”的重要论述精神，向安徽学习加强科技创新、扩大对外开放、优化营商环境、促进制造业高质量发展等方面的经验做法，更好服务和融入新发展格局，推动转型发展和现代化建设再上新台阶，7月18日至19日，山西党政代表团赴安徽学习考察，并召开山西省·安徽省工作交流座谈会，进一步深化两省务实合作，共同谱写晋皖两地交流合作新篇章。山西省委书记、省人大常委会主任蓝佛安，安徽省委书记、省人大常委会主任韩俊，山西省委副书记、省长金湘军，安徽省委副书记、省长王清宪出席座谈会并参加考察。。近年来，安徽省聚焦打造科技创新策源地、新兴产业聚集地、改革开放新高地和经济社会发展全面绿色转型区战略目标，积极主动融入长三角一体化发展，在优化营商环境、强化科技创新、开展招商引资、发展新兴产业等方面形成了很多亮点做法。在皖期间，山西党政代表团先后到合肥、芜湖学习观摩考察，一路上广泛交流、深入思考、主动对接，为山西高质量发展取真经、谈合作、谋突破。在科大讯飞公司、科大国盾量子技术公司、安徽创新馆和中国视谷，代表团深入了解人工智能、量子通信等前沿技术和高新产业发展情况，学习安徽在高能级创新平台集聚、科技大市场培育、科创成果转化应用等方面的理念经验，对安徽创新型省份建设成效表示钦佩。在国轩高科公司、奇瑞生产基地和中电科钻石飞机公司，代表团实地感受安徽高端制造业蓬勃发展的强劲势头，学习了解安徽围绕产业链部署创新链、围绕创新链布局产业链、承接长三角一体化产业转移的经验做法，并就有关项目进行了交流对接。。19日下午，山西省·安徽省工作交流座谈会在合肥市举行。韩俊在交流会讲话中首先代表安徽省委、省政府对山西党政代表团的到来表示热烈欢迎。他说，近年来，山西认真贯彻落实习近平总书记“走出一条产业优、质量高、效益好、可持续的发展新路”重要要求，在煤炭先进产能建设、新能源装机规模、电力市场化改革等方面走在全国前列，为中部地区高质量发展提供了宝贵经验。当前，安徽认真学习贯彻习近平总书记关于安徽工作的重要讲话重要指示精神，充分发挥创新活跃强劲、制造特色鲜明、生态资源良好、内陆腹地广阔等优势，抢抓长三角一体化发展战略机遇，全力做好“产业＋科技＋人才＋金融”大文章，推动思想大解放、环境大优化、能力大提升、作风大转变、任务大落实，全面推进科技强省、制造强省、农业强省、人才强省、教育强省、文化强省建设，正在走出一条新时代质量更高、效益更好、结构更优、活力更足、优势充分释放的发展新路。希望两省加强能源领域合作，加强新材料、高端装备制造、节能环保等战略性新兴产业合作，在文化旅游领域联合打造精品旅游线路和旅游产品，推动重点旅游城市联合开展宣传推介活动，共同推动皖晋两省高质量发展。。山西省领导李凤岐、卢东亮、韦韬、汤志平、赵红严、杨勤荣、熊继军，安徽省领导虞爱华、张韵声、单向前参加有关活动。省直有关部门、部分省管国有企业、有关开发区主要负责同志，各市市委书记等山西党政代表团成员参加。（记者 杨文俊）,政府领导到其他城市考察学习或访问,0.0,True
18,山西省,晋城市,山西省党政代表团赴广东学习考察,2018-12-02,http://www.jcgov.gov.cn/dtxx/sxyw/201812/t20181202_301407.shtml,在庆祝改革开放40周年之际，11月28日至12月1日，省委书记骆惠宁率山西省党政代表团赴广东学习考察。这是我省贯彻落实习近平总书记关于高举新时代改革开放旗帜、把改革开放不断推向深入的重要指示精神，推动全省改革开放再出发的重要举措，是一次鲜活的现场培训和深刻的思想解放，学到了真经，拓宽了视野，促进了合作，为我省在“两转”基础上全面拓展新局面注入新动力。中央政治局委员、广东省委书记李希，广东省委副书记、省长马兴瑞，省委副书记、省长楼阳生，广东省委常委、深圳市委书记王伟中等出席座谈会并参加考察。。11月28日，两省工作交流座谈会在广州举行。李希代表省委省政府对山西长期以来给予广东改革发展的大力支持表示感谢。他说，山西认真贯彻落实习近平新时代中国特色社会主义思想和党的十九大精神，全面贯彻习近平总书记视察山西重要讲话精神，坚定不移推进全面从严治党，加快经济转型发展，坚持不断改善民生，推动经济社会发展不断取得新成绩。当前，广东正深入学习贯彻习近平新时代中国特色社会主义思想和党的十九大精神，认真学习贯彻习近平总书记视察广东重要讲话和对广东一系列重要指示精神，深化“大学习、深调研、真落实”工作，进一步优化完善提升“1+1+9”工作部署，把总书记重要指示要求一项一项落到实处，奋力开创改革发展新局面。我们将认真学习借鉴山西的好经验好做法，努力把广东工作做得更好。李希强调，要坚持以习近平新时代中国特色社会主义思想为指引，进一步深化粤晋全面交流合作，不断提升合作发展水平。一是在学习贯彻习近平新时代中国特色社会主义思想上加强交流、互学互鉴，增强“四个意识”、坚定“四个自信”、践行“两个维护”，共同推动习近平新时代中国特色社会主义思想落地生根、结出丰硕成果。二是加强高质量发展的对接合作。聚焦科技创新和产业变革，共同推动协同创新，强化能源化工、高端装备、新材料等产业对接，深化文化旅游开发合作，实现更高水平的互利共赢发展。三是在深化改革开放方面加强合作。在全面深化体制机制改革上加强沟通、相互启发、增进协同，紧紧抓住“一带一路”建设和粤港澳大湾区建设等重大历史机遇，实现双方优势互补、资源共享，强化互联互通、双向投资和经贸往来，推动国家重大战略落地落实。。骆惠宁对广东长期以来给予山西经济社会发展的大力支持表示感谢。他说，广东是改革开放的排头兵、先行地、实验区，在改革开放和社会主义现代化建设进程中取得了令人瞩目的发展成就。在习近平新时代中国特色社会主义思想指导下，广东以新担当新作为取得了各项事业新进步。山西正处于“两转”基础上全面拓展新局面的关键时期，我们要认真学习广东敢闯敢试、敢为人先的改革精神，在全省上下增强不断改革创新的紧迫感。骆惠宁说，晋粤两省交往源远流长，文化各具特色，经济互补性强，在改革开放再出发的大背景下，要在更宽领域更深层次开展交流合作。一要从新时代高度把握粤港澳大湾区对内地的辐射带动作用，以务实举措积极融入，借鉴移植广东自贸区特别是前海蛇口片区的创新经验，深化山西转型综改试验区建设，带动经济转型升级，实现“三大战略目标”。二要发挥各自优势，促进区域协同创新，山西将全面培育创新生态，推动更多创新成果在晋转化。支持两省企业在能源革命、新兴产业、文化旅游等方面加强合作，欢迎广东企业在晋建立生产基地。三要坚持高层务实推动，把加强与广东的合作摆到战略位置，建立省级部门间交换信息合作机制，拓展形成全方位多渠道交流合作格局。面对新形势新挑战，深化改革、扩大开放至关重要，对标一流、提高标准至关重要，不断创新、开拓市场至关重要，我们要在晋粤战略合作中，进一步提高山西改革开放的质量和水平。,在庆祝改革开放40周年之际，11月28日至12月1日，省委书记骆惠宁率山西省党政代表团赴广东学习考察。这是我省贯彻落实习近平总书记关于高举新时代改革开放旗帜、把改革开放不断推向深入的重要指示精神，推动全省改革开放再出发的重要举措，是一次鲜活的现场培训和深刻的思想解放，学到了真经，拓宽了视野，促进了合作，为我省在“两转”基础上全面拓展新局面注入新动力。中央政治局委员、广东省委书记李希，广东省委副书记、省长马兴瑞，省委副书记、省长楼阳生，广东省委常委、深圳市委书记王伟中等出席座谈会并参加考察。。11月28日，两省工作交流座谈会在广州举行。李希代表省委省政府对山西长期以来给予广东改革发展的大力支持表示感谢。他说，山西认真贯彻落实习近平新时代中国特色社会主义思想和党的十九大精神，全面贯彻习近平总书记视察山西重要讲话精神，坚定不移推进全面从严治党，加快经济转型发展，坚持不断改善民生，推动经济社会发展不断取得新成绩。当前，广东正深入学习贯彻习近平新时代中国特色社会主义思想和党的十九大精神，认真学习贯彻习近平总书记视察广东重要讲话和对广东一系列重要指示精神，深化“大学习、深调研、真落实”工作，进一步优化完善提升“1+1+9”工作部署，把总书记重要指示要求一项一项落到实处，奋力开创改革发展新局面。我们将认真学习借鉴山西的好经验好做法，努力把广东工作做得更好。李希强调，要坚持以习近平新时代中国特色社会主义思想为指引，进一步深化粤晋全面交流合作，不断提升合作发展水平。一是在学习贯彻习近平新时代中国特色社会主义思想上加强交流、互学互鉴，增强“四个意识”、坚定“四个自信”、践行“两个维护”，共同推动习近平新时代中国特色社会主义思想落地生根、结出丰硕成果。二是加强高质量发展的对接合作。聚焦科技创新和产业变革，共同推动协同创新，强化能源化工、高端装备、新材料等产业对接，深化文化旅游开发合作，实现更高水平的互利共赢发展。三是在深化改革开放方面加强合作。在全面深化体制机制改革上加强沟通、相互启发、增进协同，紧紧抓住“一带一路”建设和粤港澳大湾区建设等重大历史机遇，实现双方优势互补、资源共享，强化互联互通、双向投资和经贸往来，推动国家重大战略落地落实。。骆惠宁对广东长期以来给予山西经济社会发展的大力支持表示感谢。他说，广东是改革开放的排头兵、先行地、实验区，在改革开放和社会主义现代化建设进程中取得了令人瞩目的发展成就。在习近平新时代中国特色社会主义思想指导下，广东以新担当新作为取得了各项事业新进步。山西正处于“两转”基础上全面拓展新局面的关键时期，我们要认真学习广东敢闯敢试、敢为人先的改革精神，在全省上下增强不断改革创新的紧迫感。骆惠宁说，晋粤两省交往源远流长，文化各具特色，经济互补性强，在改革开放再出发的大背景下，要在更宽领域更深层次开展交流合作。一要从新时代高度把握粤港澳大湾区对内地的辐射带动作用，以务实举措积极融入，借鉴移植广东自贸区特别是前海蛇口片区的创新经验，深化山西转型综改试验区建设，带动经济转型升级，实现“三大战略目标”。二要发挥各自优势，促进区域协同创新，山西将全面培育创新生态，推动更多创新成果在晋转化。支持两省企业在能源革命、新兴产业、文化旅游等方面加强合作，欢迎广东企业在晋建立生产基地。三要坚持高层务实推动，把加强与广东的合作摆到战略位置，建立省级部门间交换信息合作机制，拓展形成全方位多渠道交流合作格局。面对新形势新挑战，深化改革、扩大开放至关重要，对标一流、提高标准至关重要，不断创新、开拓市场至关重要，我们要在晋粤战略合作中，进一步提高山西改革开放的质量和水平。,政府领导到其他城市考察学习或访问,0.0,True
18,山西省,晋城市,石云峰带队赴河南开展对标一流考察学习,2019-04-18,http://www.jcgov.gov.cn/dtxx/jcdt/201904/t20190418_364542.shtml,4月15日至17日，市委常委、市委政法委书记石云峰带队组织市委政法委机关干部赴河南省郑州、新乡、焦作三市开展对标一流考察学习。。石云峰一行先后到郑州市二七区三级综治中心、郑东新区公安分局视频监控中心、新乡市委政法委机关、焦作市中级人民法院等18个单位，就市域社会治理创新、雪亮工程和综治中心建设、政法智能化建设、矛盾纠纷多元化解、政法机关服务保障经济发展等方面工作进行深入学习。考察中，还召开了交流座谈会，提升了学习的针对性，促进了学习成果转化。。石云峰指出，要通过考察学习进一步开阔眼界，解放思想，树牢对标一流、争创佳绩的意识。要借鉴学习发达地区的先进经验，立足服务改善民生，提升我市市域社会治理创新水平；立足群众安全感和满意度，扎实推进平安晋城建设；立足科技进步前沿，推动政法智能化建设提档升级；立足工作机制创新，不断加强党委政法委自身建设。要强化改革创新，主动担当作为，及时将学习成果转化为推动工作的具体措施，为新时代美丽晋城高质量转型发展提供坚强的政法保障。（供稿：晋城市委政法委）,4月15日至17日，市委常委、市委政法委书记石云峰带队组织市委政法委机关干部赴河南省郑州、新乡、焦作三市开展对标一流考察学习。。石云峰一行先后到郑州市二七区三级综治中心、郑东新区公安分局视频监控中心、新乡市委政法委机关、焦作市中级人民法院等18个单位，就市域社会治理创新、雪亮工程和综治中心建设、政法智能化建设、矛盾纠纷多元化解、政法机关服务保障经济发展等方面工作进行深入学习。考察中，还召开了交流座谈会，提升了学习的针对性，促进了学习成果转化。。石云峰指出，要通过考察学习进一步开阔眼界，解放思想，树牢对标一流、争创佳绩的意识。要借鉴学习发达地区的先进经验，立足服务改善民生，提升我市市域社会治理创新水平；立足群众安全感和满意度，扎实推进平安晋城建设；立足科技进步前沿，推动政法智能化建设提档升级；立足工作机制创新，不断加强党委政法委自身建设。要强化改革创新，主动担当作为，及时将学习成果转化为推动工作的具体措施，为新时代美丽晋城高质量转型发展提供坚强的政法保障。（供稿：晋城市委政法委）,政府领导到其他城市考察学习或访问,0.713445418637685,True
