code,province,city,topic,date,url,content,content,label,score
6,河北省,邯郸市,山西省晋中市左权县政协主席吕爱鸿一行到肥乡区考察学习,2024-07-05,https://www.hd.gov.cn/m/sjqxdt/202407/t20240705_2052449.html,7月1日，山西省晋中市左权县政协主席吕爱鸿一行来肥考察学习乡村振兴、产业发展、政协党建、“政协委员之家”建设等工作，区政协主席王运成，政协副主席王学锋、米春利、刘健参加。。在西吕营镇田寨村，吕爱鸿一行察看了乡村振兴、产业发展等工作；在政协党建活动室，吕爱鸿一行详细了解了肥乡区政协党的组织架构、党员委员联系党外委员等情况；在“政协委员之家”，吕爱鸿一行参观了肥乡区政协“辉煌历程——纪念肥乡政协成立四十周年”展览、书画、摄影作品展，并详细了解委员联系界别群众、基层协商等工作开展情况。。吕爱鸿指出：肥乡区政协把“政协委员之家”打造成委员学习交流的平台、密切联系群众的桥梁、提升能力素质的阵地、了解社情民意的窗口的经验做法，具有很好的学习借鉴意义。双方希望今后能够加强交流，共同推进政协事业和经济社会高质量发展不断迈上新台阶。,7月1日，山西省晋中市左权县政协主席吕爱鸿一行来肥考察学习乡村振兴、产业发展、政协党建、“政协委员之家”建设等工作，区政协主席王运成，政协副主席王学锋、米春利、刘健参加。。在西吕营镇田寨村，吕爱鸿一行察看了乡村振兴、产业发展等工作；在政协党建活动室，吕爱鸿一行详细了解了肥乡区政协党的组织架构、党员委员联系党外委员等情况；在“政协委员之家”，吕爱鸿一行参观了肥乡区政协“辉煌历程——纪念肥乡政协成立四十周年”展览、书画、摄影作品展，并详细了解委员联系界别群众、基层协商等工作开展情况。。吕爱鸿指出：肥乡区政协把“政协委员之家”打造成委员学习交流的平台、密切联系群众的桥梁、提升能力素质的阵地、了解社情民意的窗口的经验做法，具有很好的学习借鉴意义。双方希望今后能够加强交流，共同推进政协事业和经济社会高质量发展不断迈上新台阶。,政府领导到其他城市考察学习或访问,0.0
6,河北省,邯郸市,山西省晋中市左权县人大常委会主任高儒林一行到肥乡区考察学习,2024-07-05,https://www.hd.gov.cn/m/sjqxdt/202407/t20240705_2052448.html,7月1日下午，山西省晋中市左权县人大常委会主任高儒林一行到我区考察和美乡村、产业振兴、代表站建设等工作。区人大常委会主任刘素芳、区人大常委会副主任颜学燕参加。。在西吕营镇田寨村，考察团一行察看了和美乡村、产业振兴等工作；在广安代表站，考察团一行详细听取了我区广安代表站活动开展情况、人大代表坐班值班制度、为群众办实事解难题等情况介绍。。高儒林认为，肥乡区人大代表站建设工作重视程度高、工作安排细、创新举措实、人大代表作用发挥好，非常值得学习和借鉴。高儒林表示：将认真汲取肥乡区代表站建设工作中的好经验、好做法，与左权县的工作实际相结合，创造性地抓好落地落实，全面提升代表站工作水平。,7月1日下午，山西省晋中市左权县人大常委会主任高儒林一行到我区考察和美乡村、产业振兴、代表站建设等工作。区人大常委会主任刘素芳、区人大常委会副主任颜学燕参加。。在西吕营镇田寨村，考察团一行察看了和美乡村、产业振兴等工作；在广安代表站，考察团一行详细听取了我区广安代表站活动开展情况、人大代表坐班值班制度、为群众办实事解难题等情况介绍。。高儒林认为，肥乡区人大代表站建设工作重视程度高、工作安排细、创新举措实、人大代表作用发挥好，非常值得学习和借鉴。高儒林表示：将认真汲取肥乡区代表站建设工作中的好经验、好做法，与左权县的工作实际相结合，创造性地抓好落地落实，全面提升代表站工作水平。,政府领导到其他城市考察学习或访问,0.0
6,河北省,邯郸市,市供销社张军主任带队到邢台市供销社考察学习社属企业改革工作,2024-02-23,https://www.hd.gov.cn/hdzfxxgk/gszbm/auto23700/202403/t20240305_2025238.html,2月23日下午，市供销社党组书记、理事会主任、供销集团董事长张军带队，组织部分县级领导、有关处室、单位负责同志赴邢台市供销社进行考察学习。邢台市供销社党组书记、理事会主任王永伟等全程陪同。。张军同志一行先后深入到邢台市南和区供销社三召乡1500平米综合超市、邢台供销仓储保鲜冷链物流园、邢台市五一供销广场、供销仓储折扣综合超市、供销食堂和供销文旅超市、农村产权交易中心等地实地调研，并详细了解社属企业项目建设、城乡物流配送、资产盘活、运营模式、效果及发展等经验做法。。两地供销社一致表示，坚持认真贯彻落实党的二十大精神和习近平总书记关于供销合作社重要指示批示精神，在两市农副产品互通等综合改革工作方面，互学互促、互鉴互进，加强沟通交流，广泛开展合作，积极为推动供销合作事业发展做贡献。。考察学习结束后，张军主任简要作了小结。他强调指出，邢台市社在深化市属企业改革中，强化资产管理、构建流通体系、推进项目建设、盘活闲置资产的思路做法，对加快我市供销社集团企业补齐发展短板弱项、解放思想守正创新，实现全市供销系统高质量发展具有重要的借鉴意义。。围绕服务“三农”工作大局，把高质量发展作为市供销合作社及集团企业改革发展的首要任务，大力推进经营创新、服务创新、组织创新。。围绕公司制企业现代经营机制转换，制定科学业绩评价体系，加快实施集团化经营战略，有效推动系统企业联合发展，真正把集团企业办成自主经营、自负盈亏、自我约束、自我发展的企业。。围绕企业转型升级，建立健全灵活高效的激励约束机制，逐步实现资源向传统优势产业集中，提高企业核心竞争力，做大做强骨干企业。。围绕市委、市政府“大抓项目、抓大项目”的鲜明导向，充分利用社有资产高效利用和主责主业，有针对性地谋划、包装、争跑项目，做实做细项目储备、可研、立项等前期手续，积极与省社、总社供销集团对接，做到精准对接、精准争取，切实提高争跑质效。,2月23日下午，市供销社党组书记、理事会主任、供销集团董事长张军带队，组织部分县级领导、有关处室、单位负责同志赴邢台市供销社进行考察学习。邢台市供销社党组书记、理事会主任王永伟等全程陪同。。张军同志一行先后深入到邢台市南和区供销社三召乡1500平米综合超市、邢台供销仓储保鲜冷链物流园、邢台市五一供销广场、供销仓储折扣综合超市、供销食堂和供销文旅超市、农村产权交易中心等地实地调研，并详细了解社属企业项目建设、城乡物流配送、资产盘活、运营模式、效果及发展等经验做法。。两地供销社一致表示，坚持认真贯彻落实党的二十大精神和习近平总书记关于供销合作社重要指示批示精神，在两市农副产品互通等综合改革工作方面，互学互促、互鉴互进，加强沟通交流，广泛开展合作，积极为推动供销合作事业发展做贡献。。考察学习结束后，张军主任简要作了小结。他强调指出，邢台市社在深化市属企业改革中，强化资产管理、构建流通体系、推进项目建设、盘活闲置资产的思路做法，对加快我市供销社集团企业补齐发展短板弱项、解放思想守正创新，实现全市供销系统高质量发展具有重要的借鉴意义。。围绕服务“三农”工作大局，把高质量发展作为市供销合作社及集团企业改革发展的首要任务，大力推进经营创新、服务创新、组织创新。。围绕公司制企业现代经营机制转换，制定科学业绩评价体系，加快实施集团化经营战略，有效推动系统企业联合发展，真正把集团企业办成自主经营、自负盈亏、自我约束、自我发展的企业。。围绕企业转型升级，建立健全灵活高效的激励约束机制，逐步实现资源向传统优势产业集中，提高企业核心竞争力，做大做强骨干企业。。围绕市委、市政府“大抓项目、抓大项目”的鲜明导向，充分利用社有资产高效利用和主责主业，有针对性地谋划、包装、争跑项目，做实做细项目储备、可研、立项等前期手续，积极与省社、总社供销集团对接，做到精准对接、精准争取，切实提高争跑质效。,其他,0.602600588523472
6,河北省,邯郸市,湖南省益阳市桃江县政协副主席夏末花一行来肥乡区考察学习,2024-07-12,https://www.hd.gov.cn/m/sjqxdt/202407/t20240712_2053594.html,7月10日，湖南省益阳市桃江县政协副主席夏末花一行来肥考察学习，区政协副主席米春利参加。。夏末花认为我区在移风易俗、风俗改革、政协委员活动阵地建设等工作做得好、做得实，将认真汲取我区好经验、好做法，与桃江县政协工作实际相结合，创造性地抓好工作落实。区政协副主席米春利希望两地政协在移风易俗、推动社会新风尚、加强政协委员履职能力工作中相互学习，相互借鉴，取长补短，共同提高，为推动两地经济社会发展贡献更多政协智慧和力量。,7月10日，湖南省益阳市桃江县政协副主席夏末花一行来肥考察学习，区政协副主席米春利参加。。夏末花认为我区在移风易俗、风俗改革、政协委员活动阵地建设等工作做得好、做得实，将认真汲取我区好经验、好做法，与桃江县政协工作实际相结合，创造性地抓好工作落实。区政协副主席米春利希望两地政协在移风易俗、推动社会新风尚、加强政协委员履职能力工作中相互学习，相互借鉴，取长补短，共同提高，为推动两地经济社会发展贡献更多政协智慧和力量。,政府领导到其他城市考察学习或访问,0.0
6,河北省,邯郸市,考察学习取真经对标对表谋提升邯郸市供销社主任张军赴信阳市供销社考察学习,2024-04-26,https://www.hd.gov.cn/hdzfxxgk/gszbm/auto23700/202404/t20240430_2038232.html,名称：考察学习“取真经” 对标对表谋提升——邯郸市供销社主任张军赴信阳市供销社考察学习。2024年4月23日至4月24日，邯郸市供销社党组书记、理事会主任、供销集团董事长张军带队，赴信阳市供销社对接考察学习，重点考察学习信阳市供销社在积极参与农业社会化服务、供销集团建设及当地茶产业发展等方面的先进经验和具体措施。市社三级调研员郭茶民，市社项目办、供销集团负责同志参加考察。信阳市供销社党组书记、理事会主任邹忠生参加座谈，信阳市供销社党组副书记、监事会主任闵远峰全程陪同考察。。信阳市地处鄂豫皖三省交界，位于河南省最南端，是我国南北地理、气候过渡带和豫楚文化融合区，承东启西、连南贯北，是重要的区域性综合交通枢纽和现代物流枢纽。2023年，信阳市供销社率先成立全省首个农业社会化服务联盟，与中国农业生产资料集团合作打造“1+8+N”农业社会化服务体系“信阳模式”。建成各类为农服务中心91个，开展社会化服务183万亩次，土地托管面积194万亩，综合业绩考核连续七年位居河南省供销社系统省辖市第一名。。张军一行先后到位于信阳市主城区的汇天下嘉美广场、供销隆盈进出口茶叶公司体验馆、信阳市供销优选配送公司、信阳供销社红色商圈党群服务中心及恒丰建材广场市场等地，认真参观了解信阳市社在社有资产高效利用、茶产业合作及农副产品物流配送等方面工作。在信阳供销集团总部，双方进行了深入座谈交流。。邹忠生主任首先对张军主任一行的到来表示欢迎，并详细介绍了信阳市社近年来的发展情况。他说，信阳市供销社正在实施打造“党建引领、村社共建”的乡村振兴示范、为农服务中心牵引的农业社会化服务、供销电商平台带动的农产品流通模式三大模式，并具体介绍了三大模式具体措施及供销集团在组织构架和日常运营方面的经验和做法。会上，信阳市固始县供销社介绍了与京东集团合作的“三级仓储物流中心项目”的进展情况。。张军主任对信阳市供销社近年来的良好发展和经验分享表示赞赏和感谢。他表示，信阳市供销社在持续深化社属企业改革、强化农业社会化服务、集团运营建设、大力发展当地特色农产品和项目建设等方面的具体做法，对加快邯郸市供销系统补齐发展短板弱项，实现供销企业高质量发展具有良好的借鉴意义。。一是两地供销社要加强沟通交流，实现互学互鉴互进。因为两地在本省地域位置、社有企业发展方向、积极参与农业社会化服务等方面高度相似，双方的成功经验具有双向可借鉴意义。二是借鉴信阳市社关于集团建设经验做法，加快实施集团化经营战略，探索整合资产管理模式和运营模式。因地制宜，因企制宜，科学统筹，聚焦主责主业，加快提高社有企业经济效益，增强为农服务综合实力，真正实现供销企业高质量发展。三是学习信阳市供销社开展农业社会化服务及当地特色农副产品种、产、销等成功经验，结合邯郸本地实际，加强与相关部门沟通对接，积极争取上级政策及资金支持，促进供销社综合改革更好发展。四是学习信阳市供销社成功引进京东集团农服物流合作项目落地的成功经验，加快推进邯郸市社与京东集团农服合作项目步伐。。在信阳市浉河区联农茶叶专业合作社，张军一行实地参观并详细了解了当地在茶叶种植、加工、销售、品种改良和市场信息等方面的具体做法。在与浉河区领导和专业合作社负责人的座谈会上，张军表示，信阳毛尖历史悠久，是中国十大名茶之一，被评为“中国十大茶叶区域公用品牌”，在茶产业方面有着丰富的经验。邯郸市供销社于2023年成功举办了河北省第九届茶艺师技能大赛、邯郸市首届茶艺师技能大赛，衷心希望信阳市社能够在茶产业发展、茶叶市场经营运作等方面给予指导帮助，促进邯郸当地茶产业市场更好发展。,名称：考察学习“取真经” 对标对表谋提升——邯郸市供销社主任张军赴信阳市供销社考察学习。2024年4月23日至4月24日，邯郸市供销社党组书记、理事会主任、供销集团董事长张军带队，赴信阳市供销社对接考察学习，重点考察学习信阳市供销社在积极参与农业社会化服务、供销集团建设及当地茶产业发展等方面的先进经验和具体措施。市社三级调研员郭茶民，市社项目办、供销集团负责同志参加考察。信阳市供销社党组书记、理事会主任邹忠生参加座谈，信阳市供销社党组副书记、监事会主任闵远峰全程陪同考察。。信阳市地处鄂豫皖三省交界，位于河南省最南端，是我国南北地理、气候过渡带和豫楚文化融合区，承东启西、连南贯北，是重要的区域性综合交通枢纽和现代物流枢纽。2023年，信阳市供销社率先成立全省首个农业社会化服务联盟，与中国农业生产资料集团合作打造“1+8+N”农业社会化服务体系“信阳模式”。建成各类为农服务中心91个，开展社会化服务183万亩次，土地托管面积194万亩，综合业绩考核连续七年位居河南省供销社系统省辖市第一名。。张军一行先后到位于信阳市主城区的汇天下嘉美广场、供销隆盈进出口茶叶公司体验馆、信阳市供销优选配送公司、信阳供销社红色商圈党群服务中心及恒丰建材广场市场等地，认真参观了解信阳市社在社有资产高效利用、茶产业合作及农副产品物流配送等方面工作。在信阳供销集团总部，双方进行了深入座谈交流。。邹忠生主任首先对张军主任一行的到来表示欢迎，并详细介绍了信阳市社近年来的发展情况。他说，信阳市供销社正在实施打造“党建引领、村社共建”的乡村振兴示范、为农服务中心牵引的农业社会化服务、供销电商平台带动的农产品流通模式三大模式，并具体介绍了三大模式具体措施及供销集团在组织构架和日常运营方面的经验和做法。会上，信阳市固始县供销社介绍了与京东集团合作的“三级仓储物流中心项目”的进展情况。。张军主任对信阳市供销社近年来的良好发展和经验分享表示赞赏和感谢。他表示，信阳市供销社在持续深化社属企业改革、强化农业社会化服务、集团运营建设、大力发展当地特色农产品和项目建设等方面的具体做法，对加快邯郸市供销系统补齐发展短板弱项，实现供销企业高质量发展具有良好的借鉴意义。。一是两地供销社要加强沟通交流，实现互学互鉴互进。因为两地在本省地域位置、社有企业发展方向、积极参与农业社会化服务等方面高度相似，双方的成功经验具有双向可借鉴意义。二是借鉴信阳市社关于集团建设经验做法，加快实施集团化经营战略，探索整合资产管理模式和运营模式。因地制宜，因企制宜，科学统筹，聚焦主责主业，加快提高社有企业经济效益，增强为农服务综合实力，真正实现供销企业高质量发展。三是学习信阳市供销社开展农业社会化服务及当地特色农副产品种、产、销等成功经验，结合邯郸本地实际，加强与相关部门沟通对接，积极争取上级政策及资金支持，促进供销社综合改革更好发展。四是学习信阳市供销社成功引进京东集团农服物流合作项目落地的成功经验，加快推进邯郸市社与京东集团农服合作项目步伐。。在信阳市浉河区联农茶叶专业合作社，张军一行实地参观并详细了解了当地在茶叶种植、加工、销售、品种改良和市场信息等方面的具体做法。在与浉河区领导和专业合作社负责人的座谈会上，张军表示，信阳毛尖历史悠久，是中国十大名茶之一，被评为“中国十大茶叶区域公用品牌”，在茶产业方面有着丰富的经验。邯郸市供销社于2023年成功举办了河北省第九届茶艺师技能大赛、邯郸市首届茶艺师技能大赛，衷心希望信阳市社能够在茶产业发展、茶叶市场经营运作等方面给予指导帮助，促进邯郸当地茶产业市场更好发展。,政府领导到其他城市考察学习或访问,0.0
6,河北省,邯郸市,市供销社到漯河市社考察学习,2023-12-10,https://www.hd.gov.cn/hdzfxxgk/gszbm/auto23700/202312/t20231218_2006089.html,"2023年12月4日下午，市社党组副书记、监事会主任陈永朝带队到河南省漯河市考察，学习漯河市供销社助力乡村振兴、发展农业社会化服务、基层组织建设等方面的先进经验。漯河市供销社党组副书记、监事会主任刘振阳，漯河市供销社党组成员、理事会副主任史志伟等相关人员进行陪同。。在临颍县南街村，市社考察组实地考察了南街村的高度自动化产品生产加工中心、科研所和技术中心，听取南街村的历史和发展情况汇报。考察组表示，南街村的品牌已经成为享誉海内外的驰名品牌，极大地带动了当地村民发家致富，助推南街村成为中国十大名村、著名红色旅游景点、全国农业旅游示范点、国家AAAA级旅游景区。南街村在乡村振兴、共同富裕方面的宝贵经验，对邯郸市社下一步发挥为农服务主责主业，助推乡村振兴有着重要的参考价值。。在临颍县窝城供销社为农服务中心，市社考察组参观了窝城供销社“一站式”为农综合服务平台、“搭建联合体”，了解群众生产求助热线运行情况，深入学习窝城供销社“公司+村集体+专业合作社+农户”经营模式，“党支部+为农服务中心+农户”一体化，产、供、销一条龙增收渠道的先进经验。考察组认为，窝城供销社立足主责主业，围绕农业生产社会化服务，通过盘活闲置资产和引进外部资源，建设了集托育、康养、购物、土地托管服务为一体的产业体系，一站式满足当地群众的生产生活需求，特别是通过创新模式，发展社员1900多户，通过不断提高农业技术来降低种植成本，举办专题培训提高从业者素质等方式，发展3万余亩土地托管服务，助农增收300多万元，走活了党建引领促村集体发展、农民增收、合作社增效一盘棋。。在本次考察学习过程中，陈永朝带领市社考察组深入学习漯河市社服务“三农”、乡村振兴、运作模式、商品开发等相关领域的经验做法，加强了与兄弟社之间的交流和学习，通过在比较中寻找差距，在交流中凝聚共识，在学习中相互提高、进一步开拓了工作思路，明确了提升方向, 为市社下一步工作质量整体提升奠定了良好基础。。市社四级调研员宋志杰、邯郸供销集团总经理郑延领、城郊社党委书记薛辉、曲周县供销社副主任范河岭、城兴商贸有限公司工会主席申建军等相关人员随队考察。","2023年12月4日下午，市社党组副书记、监事会主任陈永朝带队到河南省漯河市考察，学习漯河市供销社助力乡村振兴、发展农业社会化服务、基层组织建设等方面的先进经验。漯河市供销社党组副书记、监事会主任刘振阳，漯河市供销社党组成员、理事会副主任史志伟等相关人员进行陪同。。在临颍县南街村，市社考察组实地考察了南街村的高度自动化产品生产加工中心、科研所和技术中心，听取南街村的历史和发展情况汇报。考察组表示，南街村的品牌已经成为享誉海内外的驰名品牌，极大地带动了当地村民发家致富，助推南街村成为中国十大名村、著名红色旅游景点、全国农业旅游示范点、国家AAAA级旅游景区。南街村在乡村振兴、共同富裕方面的宝贵经验，对邯郸市社下一步发挥为农服务主责主业，助推乡村振兴有着重要的参考价值。。在临颍县窝城供销社为农服务中心，市社考察组参观了窝城供销社“一站式”为农综合服务平台、“搭建联合体”，了解群众生产求助热线运行情况，深入学习窝城供销社“公司+村集体+专业合作社+农户”经营模式，“党支部+为农服务中心+农户”一体化，产、供、销一条龙增收渠道的先进经验。考察组认为，窝城供销社立足主责主业，围绕农业生产社会化服务，通过盘活闲置资产和引进外部资源，建设了集托育、康养、购物、土地托管服务为一体的产业体系，一站式满足当地群众的生产生活需求，特别是通过创新模式，发展社员1900多户，通过不断提高农业技术来降低种植成本，举办专题培训提高从业者素质等方式，发展3万余亩土地托管服务，助农增收300多万元，走活了党建引领促村集体发展、农民增收、合作社增效一盘棋。。在本次考察学习过程中，陈永朝带领市社考察组深入学习漯河市社服务“三农”、乡村振兴、运作模式、商品开发等相关领域的经验做法，加强了与兄弟社之间的交流和学习，通过在比较中寻找差距，在交流中凝聚共识，在学习中相互提高、进一步开拓了工作思路，明确了提升方向, 为市社下一步工作质量整体提升奠定了良好基础。。市社四级调研员宋志杰、邯郸供销集团总经理郑延领、城郊社党委书记薛辉、曲周县供销社副主任范河岭、城兴商贸有限公司工会主席申建军等相关人员随队考察。",政府领导到其他城市考察学习或访问,0.0
