code,province,city,topic,date,url,content,content,label,score
6,河北省,邯郸市,邯郸经开区赴长沙考察学习农产品批发市场建设经验,2024-01-12,https://www.hd.gov.cn/m/sjbmdt/202401/t20240112_2014270.html,为高标准高质量推动“河北净菜”现代产业园建设，1月9日至10日，邯郸经济技术开发区党工委副书记兼管委会副主任张存良带队赴长沙考察学习农产品批发市场建设经验。 考察组先后到红星全球农批中心、黄兴海吉星国际农产品物流园，实地查看了现代农产品物流产业园总体布局、建设运营、智慧物流等情况，并详细了解了项目发展模式、技术支撑、品牌打造、销售渠道等方面情况。张存良表示，要以此次考察学习为契机，充分借鉴先进理念和做法，综合运用“互联网+”思维，以农产品运营主体为核心，打造优质特色农产品供应链，不断加大特色农产品品牌推介力度，持续提升农产品附加值，增强市场影响力，切实将我区资源优势、交通优势转化为产业优势、项目优势，推动“河北净菜”现代产业园项目高标准高质量实施，努力将南大堡蔬菜市场打造成为全国一流的农产品综合批发市场。 红星全球农批中心项目由红星实业集团有限公司投资建设，是中部地区规模最大、设施最全、产品最丰富的农副产品综合集群交易市场，采用全新数字化交易，线上与线下同步，聚力打造集进出口交易、物流、仓储、配送、清关报检、电子商务、价格形成、信息发布、拍卖、展示展销于一体的现代农批综合体。 黄兴海吉星国际农产品物流园由长沙马王堆农产品股份有限公司投资建设，以优化蔬菜城市流通、做大做强海鲜水产为主，绿色食品为辅的核心业务结构，推动传统“菜篮子”工程始终与时代发展同步，发展为线上线下结合、国内商品与国际商品互补、全省农产品互动的一站式综合农产品集散中心。。考察组先后到红星全球农批中心、黄兴海吉星国际农产品物流园，实地查看了现代农产品物流产业园总体布局、建设运营、智慧物流等情况，并详细了解了项目发展模式、技术支撑、品牌打造、销售渠道等方面情况。张存良表示，要以此次考察学习为契机，充分借鉴先进理念和做法，综合运用“互联网+”思维，以农产品运营主体为核心，打造优质特色农产品供应链，不断加大特色农产品品牌推介力度，持续提升农产品附加值，增强市场影响力，切实将我区资源优势、交通优势转化为产业优势、项目优势，推动“河北净菜”现代产业园项目高标准高质量实施，努力将南大堡蔬菜市场打造成为全国一流的农产品综合批发市场。。红星全球农批中心项目由红星实业集团有限公司投资建设，是中部地区规模最大、设施最全、产品最丰富的农副产品综合集群交易市场，采用全新数字化交易，线上与线下同步，聚力打造集进出口交易、物流、仓储、配送、清关报检、电子商务、价格形成、信息发布、拍卖、展示展销于一体的现代农批综合体。。黄兴海吉星国际农产品物流园由长沙马王堆农产品股份有限公司投资建设，以优化蔬菜城市流通、做大做强海鲜水产为主，绿色食品为辅的核心业务结构，推动传统“菜篮子”工程始终与时代发展同步，发展为线上线下结合、国内商品与国际商品互补、全省农产品互动的一站式综合农产品集散中心。,为高标准高质量推动“河北净菜”现代产业园建设，1月9日至10日，邯郸经济技术开发区党工委副书记兼管委会副主任张存良带队赴长沙考察学习农产品批发市场建设经验。 考察组先后到红星全球农批中心、黄兴海吉星国际农产品物流园，实地查看了现代农产品物流产业园总体布局、建设运营、智慧物流等情况，并详细了解了项目发展模式、技术支撑、品牌打造、销售渠道等方面情况。张存良表示，要以此次考察学习为契机，充分借鉴先进理念和做法，综合运用“互联网+”思维，以农产品运营主体为核心，打造优质特色农产品供应链，不断加大特色农产品品牌推介力度，持续提升农产品附加值，增强市场影响力，切实将我区资源优势、交通优势转化为产业优势、项目优势，推动“河北净菜”现代产业园项目高标准高质量实施，努力将南大堡蔬菜市场打造成为全国一流的农产品综合批发市场。 红星全球农批中心项目由红星实业集团有限公司投资建设，是中部地区规模最大、设施最全、产品最丰富的农副产品综合集群交易市场，采用全新数字化交易，线上与线下同步，聚力打造集进出口交易、物流、仓储、配送、清关报检、电子商务、价格形成、信息发布、拍卖、展示展销于一体的现代农批综合体。 黄兴海吉星国际农产品物流园由长沙马王堆农产品股份有限公司投资建设，以优化蔬菜城市流通、做大做强海鲜水产为主，绿色食品为辅的核心业务结构，推动传统“菜篮子”工程始终与时代发展同步，发展为线上线下结合、国内商品与国际商品互补、全省农产品互动的一站式综合农产品集散中心。。考察组先后到红星全球农批中心、黄兴海吉星国际农产品物流园，实地查看了现代农产品物流产业园总体布局、建设运营、智慧物流等情况，并详细了解了项目发展模式、技术支撑、品牌打造、销售渠道等方面情况。张存良表示，要以此次考察学习为契机，充分借鉴先进理念和做法，综合运用“互联网+”思维，以农产品运营主体为核心，打造优质特色农产品供应链，不断加大特色农产品品牌推介力度，持续提升农产品附加值，增强市场影响力，切实将我区资源优势、交通优势转化为产业优势、项目优势，推动“河北净菜”现代产业园项目高标准高质量实施，努力将南大堡蔬菜市场打造成为全国一流的农产品综合批发市场。。红星全球农批中心项目由红星实业集团有限公司投资建设，是中部地区规模最大、设施最全、产品最丰富的农副产品综合集群交易市场，采用全新数字化交易，线上与线下同步，聚力打造集进出口交易、物流、仓储、配送、清关报检、电子商务、价格形成、信息发布、拍卖、展示展销于一体的现代农批综合体。。黄兴海吉星国际农产品物流园由长沙马王堆农产品股份有限公司投资建设，以优化蔬菜城市流通、做大做强海鲜水产为主，绿色食品为辅的核心业务结构，推动传统“菜篮子”工程始终与时代发展同步，发展为线上线下结合、国内商品与国际商品互补、全省农产品互动的一站式综合农产品集散中心。,政府领导到其他城市考察学习或访问,0.0
6,河北省,邯郸市,武安市伯延镇赴邢台市考察学习电储能项目,2023-03-30,https://www.hd.gov.cn/hdyw/xqdt/wa/202303/t20230330_1857585.html,伯延镇赴邢台市考察学习电储能项目。3月26日上午，伯延镇党委、政府邀请市发改局主管副局长马双平、武安市启能新能源公司董事长，邯郸市电网公司、邯郸惠龙电力设计院等相关人员一行10人，赴邢台市500MW光伏发电配套储能项目现场考察学习。伯延镇党委书记杨博、镇长刘佳、人大副主席贾伟参加活动。,伯延镇赴邢台市考察学习电储能项目。3月26日上午，伯延镇党委、政府邀请市发改局主管副局长马双平、武安市启能新能源公司董事长，邯郸市电网公司、邯郸惠龙电力设计院等相关人员一行10人，赴邢台市500MW光伏发电配套储能项目现场考察学习。伯延镇党委书记杨博、镇长刘佳、人大副主席贾伟参加活动。,政府领导到其他城市考察学习或访问,0.0
6,河北省,邯郸市,涉县县委常委县委办公室主任梁江苏一行到磁考察学习,2023-03-29,https://www.hd.gov.cn/hdyw/xqdt/cx/202303/t20230329_1857473.html,3月19日，涉县县委常委、县委办公室主任梁江苏，涉县县委常委、宣传部部长薛顺利，涉县政府副县长李宏伟一行到磁考察学习磁县博物馆建设、布展等工作。磁县县领导李永清、王川及县委办、住建局、文广旅局主要负责同志陪同。梁江苏一行先后到北朝考古博物馆、磁州窑博物馆和磁州水墨园考察学习。每到一处，考察组成员都认真听取有关情况介绍，并与陪同人员展开交流探讨，深入学习磁县在博物馆功能定位、文旅资源新媒体推介等方面先进经验。梁江苏表示，本次考察学习，既学到了经验、开阔了视野、开拓了思路，也看到了差距。在今后工作中，要以此次考察学习为契机，进一步借鉴磁县发展文旅事业的好经验好做法，更深一步挖掘涉县优质文旅资源，探索具有涉县特色的文化旅游发展新路子。,3月19日，涉县县委常委、县委办公室主任梁江苏，涉县县委常委、宣传部部长薛顺利，涉县政府副县长李宏伟一行到磁考察学习磁县博物馆建设、布展等工作。磁县县领导李永清、王川及县委办、住建局、文广旅局主要负责同志陪同。梁江苏一行先后到北朝考古博物馆、磁州窑博物馆和磁州水墨园考察学习。每到一处，考察组成员都认真听取有关情况介绍，并与陪同人员展开交流探讨，深入学习磁县在博物馆功能定位、文旅资源新媒体推介等方面先进经验。梁江苏表示，本次考察学习，既学到了经验、开阔了视野、开拓了思路，也看到了差距。在今后工作中，要以此次考察学习为契机，进一步借鉴磁县发展文旅事业的好经验好做法，更深一步挖掘涉县优质文旅资源，探索具有涉县特色的文化旅游发展新路子。,政府领导到其他城市考察学习或访问,0.0
6,河北省,邯郸市,湖南省岳阳市人大常委会党组成员副主任赵岳平一行到邱县考察学习义务教育先进经验做法,2023-04-14,https://www.hd.gov.cn/hdyw/xqdt/qx/202304/t20230414_1861372.html,湖南省岳阳市人大常委会党组成员、副主任赵岳平一行到邱县考察学习义务教育先进经验做法 - 邯郸市人民政府。4月12日上午，湖南省岳阳市人大常委会党组成员、副主任赵岳平一行到邱县考察学习义务教育先进经验做法，市人大教科文卫工委主任邱江宾、市人大三级调研员赵剑凌，县人大常委会副主任陈小光、娄彬，县政府副县长胡桂芹，人大办、教体局负责同志陪同考察。考察组一行先后到二中附小、奥博中学，就校园文化、办学特色及管理模式等情况进行实地调研，围绕民办学校教师编制、义务教育和高中教育力量如何摆布等进行座谈交流，对我县义务教育给予高度评价。,湖南省岳阳市人大常委会党组成员、副主任赵岳平一行到邱县考察学习义务教育先进经验做法 - 邯郸市人民政府。4月12日上午，湖南省岳阳市人大常委会党组成员、副主任赵岳平一行到邱县考察学习义务教育先进经验做法，市人大教科文卫工委主任邱江宾、市人大三级调研员赵剑凌，县人大常委会副主任陈小光、娄彬，县政府副县长胡桂芹，人大办、教体局负责同志陪同考察。考察组一行先后到二中附小、奥博中学，就校园文化、办学特色及管理模式等情况进行实地调研，围绕民办学校教师编制、义务教育和高中教育力量如何摆布等进行座谈交流，对我县义务教育给予高度评价。,政府领导到其他城市考察学习或访问,0.0
6,河北省,邯郸市,经开区领导带队赴保定考察学习基础设施项目建设工作,2023-07-12,https://www.hd.gov.cn/hdyw/xqdt/gkq/202307/t20230712_1898934.html,为全面落实市委、市政府工作要求，不断提升基础设施建设水平，为全区高质量发展提供有力支撑，7月11日，区党工委副书记兼管委会副主任张存良带领相关部门负责同志，到保定考察学习基础设施项目建设工作。保定市发改委二级调研员樊运会陪同。 区领导一行先后到环城水系大本营、黄花沟公园、韩村安置区、东廉良安置区、保定深圳高新技术创新产业园、深保大道以北路网、国际医疗基地等项目现场，认真学习保定市在老旧小区改造、背街小巷改造提升、城中村改造等方面的好经验、好做法。 随后，双方召开座谈会，就基础设施项目建设工作进行深入沟通交流。樊运会对区领导一行表示欢迎，并介绍了保定市基础设施建设规划、专项债券资金使用、后期运行维护等情况。他说，保定和邯郸都是国家历史文化名城，在城市建设方面有很多共同之处，邯郸经开区是邯郸发展的先行区，在城市有机更新、基础设施建设等方面理念先进、成效明显。希望双方加强沟通交流，相互学习借鉴，加快推动基础设施建设再上新台阶，共同促进区域经济社会高质量发展。 区领导对保定市发改委的热情接待表示感谢，指出近年来，保定市抢抓机遇，大力实施城市改造提升和基础设施建设，城乡面貌焕然一新，经验做法值得学习。邯郸经开区将以此次考察为契机，持续解放思想、奋发进取，认真学习保定市先进的城市规划建设理念和管理运营经验，结合我区实际，在城市有机更新、产城融合、城乡统筹等方面积极谋划布局，特别是认真学习保定市专项债使用和政府引导、市场化运作的先进模式，切实解决基础设施建设资金不足等方面问题，扎实推动全区各项事业提质增效。 区党政办、财政局、建设局、社会事务局、经发局、综合执法局、卫健局、文教局及4个乡镇负责同志参加考察活动。。区领导一行先后到环城水系大本营、黄花沟公园、韩村安置区、东廉良安置区、保定深圳高新技术创新产业园、深保大道以北路网、国际医疗基地等项目现场，认真学习保定市在老旧小区改造、背街小巷改造提升、城中村改造等方面的好经验、好做法。。随后，双方召开座谈会，就基础设施项目建设工作进行深入沟通交流。樊运会对区领导一行表示欢迎，并介绍了保定市基础设施建设规划、专项债券资金使用、后期运行维护等情况。他说，保定和邯郸都是国家历史文化名城，在城市建设方面有很多共同之处，邯郸经开区是邯郸发展的先行区，在城市有机更新、基础设施建设等方面理念先进、成效明显。希望双方加强沟通交流，相互学习借鉴，加快推动基础设施建设再上新台阶，共同促进区域经济社会高质量发展。。区领导对保定市发改委的热情接待表示感谢，指出近年来，保定市抢抓机遇，大力实施城市改造提升和基础设施建设，城乡面貌焕然一新，经验做法值得学习。邯郸经开区将以此次考察为契机，持续解放思想、奋发进取，认真学习保定市先进的城市规划建设理念和管理运营经验，结合我区实际，在城市有机更新、产城融合、城乡统筹等方面积极谋划布局，特别是认真学习保定市专项债使用和政府引导、市场化运作的先进模式，切实解决基础设施建设资金不足等方面问题，扎实推动全区各项事业提质增效。,为全面落实市委、市政府工作要求，不断提升基础设施建设水平，为全区高质量发展提供有力支撑，7月11日，区党工委副书记兼管委会副主任张存良带领相关部门负责同志，到保定考察学习基础设施项目建设工作。保定市发改委二级调研员樊运会陪同。 区领导一行先后到环城水系大本营、黄花沟公园、韩村安置区、东廉良安置区、保定深圳高新技术创新产业园、深保大道以北路网、国际医疗基地等项目现场，认真学习保定市在老旧小区改造、背街小巷改造提升、城中村改造等方面的好经验、好做法。 随后，双方召开座谈会，就基础设施项目建设工作进行深入沟通交流。樊运会对区领导一行表示欢迎，并介绍了保定市基础设施建设规划、专项债券资金使用、后期运行维护等情况。他说，保定和邯郸都是国家历史文化名城，在城市建设方面有很多共同之处，邯郸经开区是邯郸发展的先行区，在城市有机更新、基础设施建设等方面理念先进、成效明显。希望双方加强沟通交流，相互学习借鉴，加快推动基础设施建设再上新台阶，共同促进区域经济社会高质量发展。 区领导对保定市发改委的热情接待表示感谢，指出近年来，保定市抢抓机遇，大力实施城市改造提升和基础设施建设，城乡面貌焕然一新，经验做法值得学习。邯郸经开区将以此次考察为契机，持续解放思想、奋发进取，认真学习保定市先进的城市规划建设理念和管理运营经验，结合我区实际，在城市有机更新、产城融合、城乡统筹等方面积极谋划布局，特别是认真学习保定市专项债使用和政府引导、市场化运作的先进模式，切实解决基础设施建设资金不足等方面问题，扎实推动全区各项事业提质增效。 区党政办、财政局、建设局、社会事务局、经发局、综合执法局、卫健局、文教局及4个乡镇负责同志参加考察活动。。区领导一行先后到环城水系大本营、黄花沟公园、韩村安置区、东廉良安置区、保定深圳高新技术创新产业园、深保大道以北路网、国际医疗基地等项目现场，认真学习保定市在老旧小区改造、背街小巷改造提升、城中村改造等方面的好经验、好做法。。随后，双方召开座谈会，就基础设施项目建设工作进行深入沟通交流。樊运会对区领导一行表示欢迎，并介绍了保定市基础设施建设规划、专项债券资金使用、后期运行维护等情况。他说，保定和邯郸都是国家历史文化名城，在城市建设方面有很多共同之处，邯郸经开区是邯郸发展的先行区，在城市有机更新、基础设施建设等方面理念先进、成效明显。希望双方加强沟通交流，相互学习借鉴，加快推动基础设施建设再上新台阶，共同促进区域经济社会高质量发展。。区领导对保定市发改委的热情接待表示感谢，指出近年来，保定市抢抓机遇，大力实施城市改造提升和基础设施建设，城乡面貌焕然一新，经验做法值得学习。邯郸经开区将以此次考察为契机，持续解放思想、奋发进取，认真学习保定市先进的城市规划建设理念和管理运营经验，结合我区实际，在城市有机更新、产城融合、城乡统筹等方面积极谋划布局，特别是认真学习保定市专项债使用和政府引导、市场化运作的先进模式，切实解决基础设施建设资金不足等方面问题，扎实推动全区各项事业提质增效。,政府领导到其他城市考察学习或访问,0.5214331191740199
6,河北省,邯郸市,魏县县委常委组织部长吴建宇外出学习考察人才工作,2023-05-23,https://www.hd.gov.cn/hdyw/xqdt/wx/202305/t20230523_1870282.html,近日，在市委组织部的组织安排下，魏县县委常委、组织部长吴建宇及有关同志赴深圳、武汉学习考察人才工作。。在深圳考察期间，吴建宇一行先后深圳市罗湖区人才服务中心和深圳市人才集团进行考察学习，与深圳市罗湖区组织部人才工作局副局长张玉洁，深圳市人才集团副总经理田雨及有关方面负责同志进行了座谈交流。座谈会上，张玉洁同志介绍了深圳市罗湖区人才工作的基本情况和特色做法，田雨同志主要对深圳市出台的人才政策，在人才引进培养、考核评价、激励服务等方面的经验做法进行了讲解。。在武汉，吴建宇一行先后到中国武汉人力资源服务产业园和武汉市人才集团进行考察学习，与武汉市人才工作局三处处长杨旗、武汉市人才集团副总经理肖艳及有关方面负责人进行了座谈交流。座谈会上，杨旗同志介绍了武汉市委组织部按照市委市政府的工作部署，着力引留科技人才、专业技术人才、高层次人才，通过专业化深耕、数字化转型、资本化驱动等战略举措；肖艳同志就武汉人才集团在不断完善人才创新创业生态，促进人才资源市场化配置，增强城市人才竞争力，为武汉人才强市战略提供坚实支撑方面做了讲解。会上，双方就人才引育、留用，人才规划定位及体制机制等方面工作进行了深入沟通交流。,近日，在市委组织部的组织安排下，魏县县委常委、组织部长吴建宇及有关同志赴深圳、武汉学习考察人才工作。。在深圳考察期间，吴建宇一行先后深圳市罗湖区人才服务中心和深圳市人才集团进行考察学习，与深圳市罗湖区组织部人才工作局副局长张玉洁，深圳市人才集团副总经理田雨及有关方面负责同志进行了座谈交流。座谈会上，张玉洁同志介绍了深圳市罗湖区人才工作的基本情况和特色做法，田雨同志主要对深圳市出台的人才政策，在人才引进培养、考核评价、激励服务等方面的经验做法进行了讲解。。在武汉，吴建宇一行先后到中国武汉人力资源服务产业园和武汉市人才集团进行考察学习，与武汉市人才工作局三处处长杨旗、武汉市人才集团副总经理肖艳及有关方面负责人进行了座谈交流。座谈会上，杨旗同志介绍了武汉市委组织部按照市委市政府的工作部署，着力引留科技人才、专业技术人才、高层次人才，通过专业化深耕、数字化转型、资本化驱动等战略举措；肖艳同志就武汉人才集团在不断完善人才创新创业生态，促进人才资源市场化配置，增强城市人才竞争力，为武汉人才强市战略提供坚实支撑方面做了讲解。会上，双方就人才引育、留用，人才规划定位及体制机制等方面工作进行了深入沟通交流。,政府领导到其他城市考察学习或访问,0.5241065621148886
