code,province,city,topic,date,url,content,content,label,score
31,内蒙古省,呼伦贝尔市,恩和哈达镇党委召开学习贯彻习近平总书记考察内蒙古重要讲话精神宣讲会,2023-07-20,http://www.eegn.gov.cn/News/show/1106614.html,恩和哈达镇党委召开学习贯彻习近平总书记考察内蒙古重要讲话精神宣讲会-额尔古纳市人民政府。为深入领会、全面贯彻习近平总书记考察内蒙古重要讲话精神，7月20日，恩和哈达镇党委召开学习贯彻习近平总书记考察内蒙古重要讲话精神宣讲会，会议由宣传委员王熙作主题宣讲，恩和哈达镇干部职工参加了此次会议。。宣讲员紧紧围绕《牢记嘱托 奋力书写中国式现代化内蒙古新篇章——学习贯彻习近平总书记考察内蒙古重要讲话精神》进行专题宣讲，带领大家对深刻领会习近平总书记重要讲话的丰富内涵和实践要求、推动习近平总书记重要讲话精神落地落实以及做好“五大任务”和全方位建设“模范自治区”各项工作任务等方面进行了全面系统地解读。。此次宣讲活动，让全镇干部职工对习近平总书记考察内蒙古重要讲话精神的核心要义有了更加透彻的感悟，进一步提高了恩和哈达镇干部职工的政治素养。大家一致认为，要把学习贯彻习近平总书记考察内蒙古重要讲话精神同学习贯彻党的二十大精神紧密结合起来，切实把思想和行动统一到党中央的决策部署上来，深刻理解习近平总书记考察内蒙古重要讲话的精神内涵，学深悟透核心要义，将学习成果转化为接续奋斗的不竭动力。,恩和哈达镇党委召开学习贯彻习近平总书记考察内蒙古重要讲话精神宣讲会-额尔古纳市人民政府。为深入领会、全面贯彻习近平总书记考察内蒙古重要讲话精神，7月20日，恩和哈达镇党委召开学习贯彻习近平总书记考察内蒙古重要讲话精神宣讲会，会议由宣传委员王熙作主题宣讲，恩和哈达镇干部职工参加了此次会议。。宣讲员紧紧围绕《牢记嘱托 奋力书写中国式现代化内蒙古新篇章——学习贯彻习近平总书记考察内蒙古重要讲话精神》进行专题宣讲，带领大家对深刻领会习近平总书记重要讲话的丰富内涵和实践要求、推动习近平总书记重要讲话精神落地落实以及做好“五大任务”和全方位建设“模范自治区”各项工作任务等方面进行了全面系统地解读。。此次宣讲活动，让全镇干部职工对习近平总书记考察内蒙古重要讲话精神的核心要义有了更加透彻的感悟，进一步提高了恩和哈达镇干部职工的政治素养。大家一致认为，要把学习贯彻习近平总书记考察内蒙古重要讲话精神同学习贯彻党的二十大精神紧密结合起来，切实把思想和行动统一到党中央的决策部署上来，深刻理解习近平总书记考察内蒙古重要讲话的精神内涵，学深悟透核心要义，将学习成果转化为接续奋斗的不竭动力。,其他,0.5531562884985612
31,内蒙古省,呼伦贝尔市,呼伦贝尔市教育局开展学习贯彻习近平总书记考察内蒙古重要讲话精神专题宣讲活动,2023-08-02,http://jyj.hlbe.gov.cn/News/show/1112151.html,呼伦贝尔市教育局开展学习贯彻习近平总书记考察内蒙古重要讲话精神专题宣讲活动-呼伦贝尔市教育局。按照自治区教育厅部署要求和市委宣传部工作安排，8月1日，呼伦贝尔市教育局四级调研员、机关党支部书记李晓敏以《牢记嘱托 奋力书写中国式现代化内蒙古新篇章-学习贯彻习近平总书记考察内蒙古重要讲话精神》为题，作专题宣讲。李晓敏从深切感悟习近平总书记对内蒙古的关心厚爱、深刻领会习近平总书记重要讲话的丰富内涵、深入贯彻落实习近平总书记重要讲话精神三个方面进行了全面系统的解读。,呼伦贝尔市教育局开展学习贯彻习近平总书记考察内蒙古重要讲话精神专题宣讲活动-呼伦贝尔市教育局。按照自治区教育厅部署要求和市委宣传部工作安排，8月1日，呼伦贝尔市教育局四级调研员、机关党支部书记李晓敏以《牢记嘱托 奋力书写中国式现代化内蒙古新篇章-学习贯彻习近平总书记考察内蒙古重要讲话精神》为题，作专题宣讲。李晓敏从深切感悟习近平总书记对内蒙古的关心厚爱、深刻领会习近平总书记重要讲话的丰富内涵、深入贯彻落实习近平总书记重要讲话精神三个方面进行了全面系统的解读。,其他,0.534366096960625
31,内蒙古省,呼伦贝尔市,市委宣传部对学习贯彻习近平总书记考察内蒙古重要讲话精神满洲里宣讲进行动员部署,2023-07-19,http://www.manzhouli.gov.cn/News/show/1105932.html,市委宣传部对学习贯彻习近平总书记考察内蒙古重要讲话精神满洲里宣讲进行动员部署-满洲里市人民政府。为深入学习贯彻习近平总书记考察内蒙古重要讲话精神，按照市委部署要求，市委宣传部会同相关部门组建了市委宣讲团和宣讲小分队，将于近日到全市各党委（党组）和基层开展集中宣讲。7月17日，市委宣传部召开学习贯彻习近平总书记考察内蒙古重要讲话精神满洲里宣讲动员会。市委副书记、宣传部部长王长春参会。。会议要求，要深刻认识学习贯彻习近平总书记重要讲话精神的重大意义，以高度的政治责任感和使命感精心组织开展集中宣讲活动；要全面准确深入宣讲习近平总书记考察内蒙古重要讲话精神，切实把思想和行动统一到重要讲话精神上来；要坚持全面系统准确，扎扎实实做好习近平总书记考察内蒙古重要讲话精神宣讲工作，引导广大党员干部群众牢记嘱托、感恩奋进，奋力书写中国式现代化满洲里新篇章。,市委宣传部对学习贯彻习近平总书记考察内蒙古重要讲话精神满洲里宣讲进行动员部署-满洲里市人民政府。为深入学习贯彻习近平总书记考察内蒙古重要讲话精神，按照市委部署要求，市委宣传部会同相关部门组建了市委宣讲团和宣讲小分队，将于近日到全市各党委（党组）和基层开展集中宣讲。7月17日，市委宣传部召开学习贯彻习近平总书记考察内蒙古重要讲话精神满洲里宣讲动员会。市委副书记、宣传部部长王长春参会。。会议要求，要深刻认识学习贯彻习近平总书记重要讲话精神的重大意义，以高度的政治责任感和使命感精心组织开展集中宣讲活动；要全面准确深入宣讲习近平总书记考察内蒙古重要讲话精神，切实把思想和行动统一到重要讲话精神上来；要坚持全面系统准确，扎扎实实做好习近平总书记考察内蒙古重要讲话精神宣讲工作，引导广大党员干部群众牢记嘱托、感恩奋进，奋力书写中国式现代化满洲里新篇章。,其他,0.5755416080086815
31,内蒙古省,呼伦贝尔市,牙克石市宣讲团深入一线开展学习贯彻习近平考察内蒙古重要讲话精神宣讲活动,2023-09-18,http://lcj.hlbe.gov.cn/News/show/1131017.html,牙克石市宣讲团深入一线开展学习贯彻习近平考察内蒙古重要讲话精神宣讲活动-呼伦贝尔市林业和草原局。为深入学习宣传贯彻习近平总书记考察内蒙古重要讲话精神，迅速掀起学习宣传贯彻热潮，高质量完成习近平总书记交给内蒙古的“五大任务”和全方位建设“模范自治区”两件大事，进一步推动习近平总书记重要讲话精神落地生根、开花结果。9月15日下午，学习贯彻习近平考察内蒙古重要讲话精神牙克石市宣讲团成员、牙克石市林草局副局长朱春花深入牙克石林场一线，开展学习贯彻习近平考察内蒙古重要讲话精神宣讲培训活动，林草系统干部职工参加培训。。此次宣讲会，是对习近平总书记考察内蒙古重要讲话精神的再学习、再理解、再认识。林草系统干部职工纷纷表示，作为林业工作者，一定要把总书记的讲话精神落实到生态建设、生态修复的实际行动中，持续抓实“三北”防护林建设，大力开展好草原生态恢复、森林草原防灭火等重点工作项目，坚定不移地守护好北方生态安全屏障，为打造健康、生态、美丽林都作出新贡献。,牙克石市宣讲团深入一线开展学习贯彻习近平考察内蒙古重要讲话精神宣讲活动-呼伦贝尔市林业和草原局。为深入学习宣传贯彻习近平总书记考察内蒙古重要讲话精神，迅速掀起学习宣传贯彻热潮，高质量完成习近平总书记交给内蒙古的“五大任务”和全方位建设“模范自治区”两件大事，进一步推动习近平总书记重要讲话精神落地生根、开花结果。9月15日下午，学习贯彻习近平考察内蒙古重要讲话精神牙克石市宣讲团成员、牙克石市林草局副局长朱春花深入牙克石林场一线，开展学习贯彻习近平考察内蒙古重要讲话精神宣讲培训活动，林草系统干部职工参加培训。。此次宣讲会，是对习近平总书记考察内蒙古重要讲话精神的再学习、再理解、再认识。林草系统干部职工纷纷表示，作为林业工作者，一定要把总书记的讲话精神落实到生态建设、生态修复的实际行动中，持续抓实“三北”防护林建设，大力开展好草原生态恢复、森林草原防灭火等重点工作项目，坚定不移地守护好北方生态安全屏障，为打造健康、生态、美丽林都作出新贡献。,其他,0.6120468136146583
31,内蒙古省,呼伦贝尔市,南木林业局基层党支部深入学习贯彻习近平总书记考察内蒙古重要讲话精神,2023-07-11,http://lcj.hlbe.gov.cn/News/show/1102568.html,南木林业局基层党支部深入学习贯彻习近平总书记考察内蒙古重要讲话精神-呼伦贝尔市林业和草原局。党的十八大以来，习近平总书记三次到内蒙古考察调研，五次参加全国人代会内蒙古代表团审议，留下许多饱含真情、思想深刻的金句，为新时代内蒙古发展指明了前进方向。习近平总书记在内蒙古考察时强调，要在建设“两个屏障、两个基地、一个桥头堡”上展现新作为，奋力书写中国式现代化内蒙古新篇章。。7月10日，南木林业局南木林场党支部组织召开深入学习贯彻习近平总书记考察内蒙古重要讲话精神专题学习会，传达学习习近平总书记考察内蒙古时的重要指示和加强荒漠化综合防治和推进“三北”等重点生态工程建设座谈会上的重要讲话，引发强烈反响与共鸣。党支部书记主持会议，全体党员干部职工参加会议。。会议指出，习近平总书记深入内蒙古进行考察，对内蒙古生态安全又作出了新部署、提出了新要求，为我们紧扣战略定位做好各项工作指明了前进方向、提供了科学指引。在加强荒漠化综合防治和推进“三北”等重点生态工程建设座谈会上的重要讲话精神，安排部署贯彻落实工作，全体党员要站在政治战略的高度，学深悟透习近平总书记考察内蒙古时的系列重要讲话批示精神，聚焦习近平总书记交给内蒙古的“五大任务”和全方位建设“模范自治区”两件大事，勇担使命、不畏艰辛、久久为功，自觉把习近平总书记的关怀厚爱转化为干事创业的强大动力，以实际行动拥护“两个确立”、践行“两个维护”。。会议强调，全体党员要始终牢记习近平总书记殷切嘱托，牢固树立绿色发展理念，以全部力量护航生态文明建设，积极探索现代管护员与生态保护有机结合的新机制新模式，动真碰硬解难题，真抓实干求成果，倾力呵护绿水青山，为筑牢祖国北疆重要生态安全屏障贡献磅礴力量。（尹秀杰）,南木林业局基层党支部深入学习贯彻习近平总书记考察内蒙古重要讲话精神-呼伦贝尔市林业和草原局。党的十八大以来，习近平总书记三次到内蒙古考察调研，五次参加全国人代会内蒙古代表团审议，留下许多饱含真情、思想深刻的金句，为新时代内蒙古发展指明了前进方向。习近平总书记在内蒙古考察时强调，要在建设“两个屏障、两个基地、一个桥头堡”上展现新作为，奋力书写中国式现代化内蒙古新篇章。。7月10日，南木林业局南木林场党支部组织召开深入学习贯彻习近平总书记考察内蒙古重要讲话精神专题学习会，传达学习习近平总书记考察内蒙古时的重要指示和加强荒漠化综合防治和推进“三北”等重点生态工程建设座谈会上的重要讲话，引发强烈反响与共鸣。党支部书记主持会议，全体党员干部职工参加会议。。会议指出，习近平总书记深入内蒙古进行考察，对内蒙古生态安全又作出了新部署、提出了新要求，为我们紧扣战略定位做好各项工作指明了前进方向、提供了科学指引。在加强荒漠化综合防治和推进“三北”等重点生态工程建设座谈会上的重要讲话精神，安排部署贯彻落实工作，全体党员要站在政治战略的高度，学深悟透习近平总书记考察内蒙古时的系列重要讲话批示精神，聚焦习近平总书记交给内蒙古的“五大任务”和全方位建设“模范自治区”两件大事，勇担使命、不畏艰辛、久久为功，自觉把习近平总书记的关怀厚爱转化为干事创业的强大动力，以实际行动拥护“两个确立”、践行“两个维护”。。会议强调，全体党员要始终牢记习近平总书记殷切嘱托，牢固树立绿色发展理念，以全部力量护航生态文明建设，积极探索现代管护员与生态保护有机结合的新机制新模式，动真碰硬解难题，真抓实干求成果，倾力呵护绿水青山，为筑牢祖国北疆重要生态安全屏障贡献磅礴力量。（尹秀杰）,其他,0.5408030834725421
31,内蒙古省,呼伦贝尔市,鄂温克族自治旗供销社党组传达学习习近平总书记在内蒙古考察期间重要指示精神,2023-06-15,https://www.ewenke.gov.cn/News/show/1091039.html,鄂温克族自治旗供销社党组传达学习习近平总书记在内蒙古考察期间重要指示精神-鄂温克族自治旗人民政府。6月15日，旗供销社党支部召开专题学习会议，传达学习习近平总书记在内蒙古考察期间重要指示和自治区、呼伦贝尔市、鄂温克族自治旗有关会议精神，研究部署贯彻落实工作。。会议指出，全体党员干部要高度重视习近平总书记考察内蒙古的重要意义，要坚持把学习贯彻党的二十大精神与习近平总书记在内蒙古考察时的重要讲话重要指示精神结合起来，切实把习近平总书记在内蒙古考察时的重要讲话重要指示精神贯彻落实到工作各方面。。会议强调，要牢牢把握党中央对内蒙古的战略定位，完整、准确、全面贯彻新发展理念，积极完成好习近平总书记交给内蒙古的“五大任务”，以铸牢中华民族共同体意识为主线，坚持以人民为中心的发展思想，牢记为农牧服务根本宗旨，充分发挥供销社在农村牧区商品流通中的主渠道优势，深入贯彻习近平生态文明思想，深入基层调研，全面推进乡村振兴。,鄂温克族自治旗供销社党组传达学习习近平总书记在内蒙古考察期间重要指示精神-鄂温克族自治旗人民政府。6月15日，旗供销社党支部召开专题学习会议，传达学习习近平总书记在内蒙古考察期间重要指示和自治区、呼伦贝尔市、鄂温克族自治旗有关会议精神，研究部署贯彻落实工作。。会议指出，全体党员干部要高度重视习近平总书记考察内蒙古的重要意义，要坚持把学习贯彻党的二十大精神与习近平总书记在内蒙古考察时的重要讲话重要指示精神结合起来，切实把习近平总书记在内蒙古考察时的重要讲话重要指示精神贯彻落实到工作各方面。。会议强调，要牢牢把握党中央对内蒙古的战略定位，完整、准确、全面贯彻新发展理念，积极完成好习近平总书记交给内蒙古的“五大任务”，以铸牢中华民族共同体意识为主线，坚持以人民为中心的发展思想，牢记为农牧服务根本宗旨，充分发挥供销社在农村牧区商品流通中的主渠道优势，深入贯彻习近平生态文明思想，深入基层调研，全面推进乡村振兴。,其他,0.5912299298628125
31,内蒙古省,呼伦贝尔市,陈巴尔虎旗妇联召开专题会议学习习近平总书记在内蒙古考察重要讲话精神,2023-06-14,http://www.cbrhq.gov.cn/News/show/1090419.html,陈巴尔虎旗妇联召开专题会议学习习近平总书记在内蒙古考察重要讲话精神-陈巴尔虎旗人民政府。6月13日，陈巴尔虎旗妇联召开干部职工大会，专题传达学习习近平总书记在主持召开加强荒漠化综合防治和推进“三北”等重点生态工程建设座谈会时发表的重要讲话。。会议指出，习近平总书记在内蒙古巴彦淖尔市考察时提出要牢牢把握党中央对内蒙古的战略定位，完整、准确、全面贯彻新发展理念，紧紧围绕推进高质量发展这个首要任务，以铸牢中华民族共同体意识为主线，坚持发展和安全并重，坚持以生态优先、绿色发展为导向，积极融入和服务构建新发展格局，在建设“两个屏障”、“两个基地”、“一个桥头堡”上展现新作为，奋力书写中国式现代化内蒙古新篇章。。会议要求，一是把学习宣传贯彻习近平总书记考察内蒙古重要讲话精神作为当前和今后一个时期的首要政治任务，广泛开展宣传宣讲，切实把习近平总书记对内蒙古的深情关怀和殷切期望传达到每一个基层妇联组织、传递给基层妇女群众，在全社会营造抓学习、强宣传、谋贯彻的浓厚氛围。二是学习领会习近平总书记考察内蒙古重要讲话精神，铸牢中华民族共同体意识，以实际行动拥护“两个确立”、践行“两个维护”。三是要在助力完成总书记交给内蒙古的五大任务、全方位建设“模范自治区”两件大事中找准方位、融入大局、担当作为，发挥妇女和家庭在生态文明建设中的重要作用，完整、准确、全面贯彻新发展理念，坚持以生态优先、绿色发展为导向，积极融入和服务构建新发展格局。,陈巴尔虎旗妇联召开专题会议学习习近平总书记在内蒙古考察重要讲话精神-陈巴尔虎旗人民政府。6月13日，陈巴尔虎旗妇联召开干部职工大会，专题传达学习习近平总书记在主持召开加强荒漠化综合防治和推进“三北”等重点生态工程建设座谈会时发表的重要讲话。。会议指出，习近平总书记在内蒙古巴彦淖尔市考察时提出要牢牢把握党中央对内蒙古的战略定位，完整、准确、全面贯彻新发展理念，紧紧围绕推进高质量发展这个首要任务，以铸牢中华民族共同体意识为主线，坚持发展和安全并重，坚持以生态优先、绿色发展为导向，积极融入和服务构建新发展格局，在建设“两个屏障”、“两个基地”、“一个桥头堡”上展现新作为，奋力书写中国式现代化内蒙古新篇章。。会议要求，一是把学习宣传贯彻习近平总书记考察内蒙古重要讲话精神作为当前和今后一个时期的首要政治任务，广泛开展宣传宣讲，切实把习近平总书记对内蒙古的深情关怀和殷切期望传达到每一个基层妇联组织、传递给基层妇女群众，在全社会营造抓学习、强宣传、谋贯彻的浓厚氛围。二是学习领会习近平总书记考察内蒙古重要讲话精神，铸牢中华民族共同体意识，以实际行动拥护“两个确立”、践行“两个维护”。三是要在助力完成总书记交给内蒙古的五大任务、全方位建设“模范自治区”两件大事中找准方位、融入大局、担当作为，发挥妇女和家庭在生态文明建设中的重要作用，完整、准确、全面贯彻新发展理念，坚持以生态优先、绿色发展为导向，积极融入和服务构建新发展格局。,其他,0.5796686693485619
31,内蒙古省,呼伦贝尔市,满洲里综合保税区党工委组织学习习近平总书记在内蒙古考察时的强调和讲话精神,2023-06-13,http://www.manzhouli.gov.cn/News/show/1088564.html,满洲里综合保税区党工委组织学习习近平总书记在内蒙古考察时的强调和讲话精神-满洲里市人民政府。6月9日上午，综保区党工委组织学习中共中央总书记、国家主席、中央军委主席习近平近日在内蒙古考察时强调，要牢牢把握党中央对内蒙古的战略定位，完整、准确、全面贯彻新发展理念，紧紧围绕推进高质量发展这个首要任务，以铸牢中华民族共同体意识为主线，坚持发展和安全并重，坚持以生态优先、绿色发展为导向，积极融入和服务构建新发展格局，在建设“两个屏障”、“两个基地”、“一个桥头堡”上展现新作为，奋力书写中国式现代化内蒙古新篇章。和在内蒙古自治区巴彦淖尔市考察，主持召开加强荒漠化综合防治和推进“三北”等重点生态工程建设座谈会并发表重要讲话。他强调，加强荒漠化综合防治，深入推进“三北”等重点生态工程建设，事关我国生态安全、事关强国建设、事关中华民族永续发展，是一项功在当代、利在千秋的崇高事业。要勇担使命、不畏艰辛、久久为功，努力创造新时代中国防沙治沙新奇迹，把祖国北疆这道万里绿色屏障构筑得更加牢固，在建设美丽中国上取得更大成就。。“模范自治区”结合起来一同学习，作为一项政治任务来完成，把学习成果转化成为推动综保区高质量发展的动力。,满洲里综合保税区党工委组织学习习近平总书记在内蒙古考察时的强调和讲话精神-满洲里市人民政府。6月9日上午，综保区党工委组织学习中共中央总书记、国家主席、中央军委主席习近平近日在内蒙古考察时强调，要牢牢把握党中央对内蒙古的战略定位，完整、准确、全面贯彻新发展理念，紧紧围绕推进高质量发展这个首要任务，以铸牢中华民族共同体意识为主线，坚持发展和安全并重，坚持以生态优先、绿色发展为导向，积极融入和服务构建新发展格局，在建设“两个屏障”、“两个基地”、“一个桥头堡”上展现新作为，奋力书写中国式现代化内蒙古新篇章。和在内蒙古自治区巴彦淖尔市考察，主持召开加强荒漠化综合防治和推进“三北”等重点生态工程建设座谈会并发表重要讲话。他强调，加强荒漠化综合防治，深入推进“三北”等重点生态工程建设，事关我国生态安全、事关强国建设、事关中华民族永续发展，是一项功在当代、利在千秋的崇高事业。要勇担使命、不畏艰辛、久久为功，努力创造新时代中国防沙治沙新奇迹，把祖国北疆这道万里绿色屏障构筑得更加牢固，在建设美丽中国上取得更大成就。。“模范自治区”结合起来一同学习，作为一项政治任务来完成，把学习成果转化成为推动综保区高质量发展的动力。,政府领导到其他城市考察学习或访问,0.0
