code,province,city,topic,date,url,content,content,label,score
31,内蒙古省,呼伦贝尔市,呼伦贝尔市民族工作学习考察组赴兴安盟学习考察,2022-06-14,http://mw.hlbe.gov.cn/News/show/983573.html,6月12日至14日，呼伦贝尔市民委党组书记、主任特木日胡，市委统战部副部长凌育苗带领呼伦贝尔市学习考察组一行15人赴兴安盟学习考察民族团结进步创建工作和衔接推进乡村振兴补助资金项目（少数民族发展任务）等工作。学习考察以座谈交流、实地考察等方式进行。。座谈会上，兴安盟委统战部副部长、民委主任吴长青介绍了兴安盟民族团结进步创建工作开展情况，盟委统战部副部长、宗教局局长曹善淑针对学习考察组成员提出的具体问题一一进行了解读，从细节方面详细介绍了兴安盟创建工作创新做法和特色亮点举措。兴安盟民委负责人表示，兴安盟毫不动摇坚持党对民族工作的全面领导，着力构建民族工作新格局；坚持不懈促进各民族交往交流交融，不断开创民族工作新局面；持之以恒构筑各民族共有精神家园，持续深化铸牢中华民族共同体意识宣传教育；坚定不移推动各民族共同走向现代化，稳步提升各族群众获得感、幸福感、安全感。从四个方面介绍兴安盟民族团结进步创建工作开展情况和取得的成效。。学习考察组实地考察期间，先后深入到科右前旗兴科社区、科右前旗融媒体中心、乌兰浩特市义勒力特嘎查、乌兰浩特市诚明国学幼儿园、五一会址、内蒙古党委办公旧址、乌兰浩特市和平街红云社区、扎赉特旗国家现代农业产业园、扎赉特旗音德尔第九小学等地进行了实地调研，详细了解各地区各单位根据自身特点开展民族工作的经验做法。。学习考察组对兴安盟民族团结进步创建工作给予高度评价，认为兴安盟民族团结进步创建工作内涵丰富、载体多样，有站位有特色有亮点有成效，是内蒙古唯一两次被国家民委命名为“全国民族团结进步示范盟”的盟市，为兄弟盟市学习借鉴提供了宝贵的经验。学习考察组成员纷纷表示，回去以后将积极借鉴兴安盟民族团结进步创建工作经验做法，结合自身实际，拓宽思路、创新举措、强化措施，奋力推动呼伦贝尔市民族团结进步创建工作迈上新的台阶，希望通过此次交流，两地民族工作部门进一步促进双方合作，实现双方更加密切的交往，达到互通有无、资源共享、合作共赢的良好目标。。期间，学习考察组还在五一会址开展了主题党日活动，在现场重温了入党誓词，让全体党员干部切身感受了革命伟人殚精竭力、无私奉献、为国为民的初心和使命，激励全体党员干部不懈奋斗，切实推动呼伦贝尔市民族工作高质量发展。,6月12日至14日，呼伦贝尔市民委党组书记、主任特木日胡，市委统战部副部长凌育苗带领呼伦贝尔市学习考察组一行15人赴兴安盟学习考察民族团结进步创建工作和衔接推进乡村振兴补助资金项目（少数民族发展任务）等工作。学习考察以座谈交流、实地考察等方式进行。。座谈会上，兴安盟委统战部副部长、民委主任吴长青介绍了兴安盟民族团结进步创建工作开展情况，盟委统战部副部长、宗教局局长曹善淑针对学习考察组成员提出的具体问题一一进行了解读，从细节方面详细介绍了兴安盟创建工作创新做法和特色亮点举措。兴安盟民委负责人表示，兴安盟毫不动摇坚持党对民族工作的全面领导，着力构建民族工作新格局；坚持不懈促进各民族交往交流交融，不断开创民族工作新局面；持之以恒构筑各民族共有精神家园，持续深化铸牢中华民族共同体意识宣传教育；坚定不移推动各民族共同走向现代化，稳步提升各族群众获得感、幸福感、安全感。从四个方面介绍兴安盟民族团结进步创建工作开展情况和取得的成效。。学习考察组实地考察期间，先后深入到科右前旗兴科社区、科右前旗融媒体中心、乌兰浩特市义勒力特嘎查、乌兰浩特市诚明国学幼儿园、五一会址、内蒙古党委办公旧址、乌兰浩特市和平街红云社区、扎赉特旗国家现代农业产业园、扎赉特旗音德尔第九小学等地进行了实地调研，详细了解各地区各单位根据自身特点开展民族工作的经验做法。。学习考察组对兴安盟民族团结进步创建工作给予高度评价，认为兴安盟民族团结进步创建工作内涵丰富、载体多样，有站位有特色有亮点有成效，是内蒙古唯一两次被国家民委命名为“全国民族团结进步示范盟”的盟市，为兄弟盟市学习借鉴提供了宝贵的经验。学习考察组成员纷纷表示，回去以后将积极借鉴兴安盟民族团结进步创建工作经验做法，结合自身实际，拓宽思路、创新举措、强化措施，奋力推动呼伦贝尔市民族团结进步创建工作迈上新的台阶，希望通过此次交流，两地民族工作部门进一步促进双方合作，实现双方更加密切的交往，达到互通有无、资源共享、合作共赢的良好目标。。期间，学习考察组还在五一会址开展了主题党日活动，在现场重温了入党誓词，让全体党员干部切身感受了革命伟人殚精竭力、无私奉献、为国为民的初心和使命，激励全体党员干部不懈奋斗，切实推动呼伦贝尔市民族工作高质量发展。,政府领导到其他城市考察学习或访问,0.0
31,内蒙古省,呼伦贝尔市,新巴尔虎左旗民族宗教工作考察学习组赴云南省考察学习,2024-03-29,http://www.xzq.gov.cn/News/show/1203597.html,为切实提高民族宗教工作水平，相互学习借鉴创建工作经验、做法，高质量推进全国民族团结进步示范旗创建目标，3月19日至3月26日，新巴尔虎左旗成立由旗委统战部、党校、旗民委、教育局等部门组成的考察学习组，赴云南省昆明市、大理白族自治州宾川县、丽江市白沙镇、西双版纳傣族自治州景洪市等地考察学习。考察学习以实地考察和听取汇报等方式进行。。学习考察组先后深入昆明市聂耳纪念馆，宾川县金牛二小、李伯藩先进事迹现场教学点、大理州华侨农场侨史陈列馆暨铸牢中华民族共同体意识教育基地、鸡足山佛教界铸牢中华民族共同体意识创建联盟示范点报恩寺，白沙镇玉湖村民族特色村寨示范点，景洪市大金塔寺等地，就铸牢中华民族共同体意识教育、民族团结进步创建“八进”、宗教工作、少数民族特色村寨建设等方面进行考察学习，并与当地相关负责人深入沟通交流。。考察组表示，所到之处开展的民族宗教工作内涵丰富、载体多样，站位高、有特色、有亮点、有成效，为新巴尔虎左旗学习借鉴提供了宝贵的经验。下一步工作中，一要把此次考察学习的成果转化为促进新巴尔虎左旗民族宗教工作高质量发展的好思路、创新举措的好点子、狠抓落实的好作风，以铸牢中华民族共同体意识为主线，做深做细做实民族工作。二要加强与自治区、呼伦贝尔市内外地区在民族宗教和铸牢中华民族共同体意识工作方面的进一步交流合作，达到互通有无、资源共享、合作共赢的良好目标，同时学习先进地区工作经验，拓宽工作思路，立足于自身优势和特色，在工作机制和推进模式上开辟独具特色的新巴尔虎左旗新道路。三要充分发挥大统战工作格局的体制作用，完善上下联动机制，持续加强自身建设，坚持和加强党对民族工作的集中统一领导，推动形成做好新时代党的民族工作的强大合力，推动新巴尔虎左旗民族宗教工作高质量发展。,为切实提高民族宗教工作水平，相互学习借鉴创建工作经验、做法，高质量推进全国民族团结进步示范旗创建目标，3月19日至3月26日，新巴尔虎左旗成立由旗委统战部、党校、旗民委、教育局等部门组成的考察学习组，赴云南省昆明市、大理白族自治州宾川县、丽江市白沙镇、西双版纳傣族自治州景洪市等地考察学习。考察学习以实地考察和听取汇报等方式进行。。学习考察组先后深入昆明市聂耳纪念馆，宾川县金牛二小、李伯藩先进事迹现场教学点、大理州华侨农场侨史陈列馆暨铸牢中华民族共同体意识教育基地、鸡足山佛教界铸牢中华民族共同体意识创建联盟示范点报恩寺，白沙镇玉湖村民族特色村寨示范点，景洪市大金塔寺等地，就铸牢中华民族共同体意识教育、民族团结进步创建“八进”、宗教工作、少数民族特色村寨建设等方面进行考察学习，并与当地相关负责人深入沟通交流。。考察组表示，所到之处开展的民族宗教工作内涵丰富、载体多样，站位高、有特色、有亮点、有成效，为新巴尔虎左旗学习借鉴提供了宝贵的经验。下一步工作中，一要把此次考察学习的成果转化为促进新巴尔虎左旗民族宗教工作高质量发展的好思路、创新举措的好点子、狠抓落实的好作风，以铸牢中华民族共同体意识为主线，做深做细做实民族工作。二要加强与自治区、呼伦贝尔市内外地区在民族宗教和铸牢中华民族共同体意识工作方面的进一步交流合作，达到互通有无、资源共享、合作共赢的良好目标，同时学习先进地区工作经验，拓宽工作思路，立足于自身优势和特色，在工作机制和推进模式上开辟独具特色的新巴尔虎左旗新道路。三要充分发挥大统战工作格局的体制作用，完善上下联动机制，持续加强自身建设，坚持和加强党对民族工作的集中统一领导，推动形成做好新时代党的民族工作的强大合力，推动新巴尔虎左旗民族宗教工作高质量发展。,政府领导到其他城市考察学习或访问,0.5594715761978172
31,内蒙古省,呼伦贝尔市,根河市政协考察组到鄂温克族自治旗学习考察,2023-06-13,https://www.ewenke.gov.cn/News/show/1089568.html,6月10日，根河市政协考察组一行来到鄂温克族自治旗学习考察。旗政协主席浩特勒、副主席姚继明、涂立彬等陪同考察。。考察组一行深入巴彦托海镇赛克社区政协委员工作站、巴彦塔拉达斡尔民族乡博物馆参观学习，观看了锡尼河西苏木《传承非遗文化、共育民族团结之花》文艺演出，并深入巴彦呼硕敖包、伊敏煤电公司七五三展览馆、伊敏煤电公司露天矿等地参观考察。。考察组一行对我旗在协商平台建设、民族团结进步、生态环境保护等方面的先进经验给予充分肯定，表示将以此次考察活动为契机，认真学习、吸收借鉴，在两地政协间搭起一座加强沟通与交流的桥梁，互通有无，互相促进，共同推进两地各项事业再上新台阶。,6月10日，根河市政协考察组一行来到鄂温克族自治旗学习考察。旗政协主席浩特勒、副主席姚继明、涂立彬等陪同考察。。考察组一行深入巴彦托海镇赛克社区政协委员工作站、巴彦塔拉达斡尔民族乡博物馆参观学习，观看了锡尼河西苏木《传承非遗文化、共育民族团结之花》文艺演出，并深入巴彦呼硕敖包、伊敏煤电公司七五三展览馆、伊敏煤电公司露天矿等地参观考察。。考察组一行对我旗在协商平台建设、民族团结进步、生态环境保护等方面的先进经验给予充分肯定，表示将以此次考察活动为契机，认真学习、吸收借鉴，在两地政协间搭起一座加强沟通与交流的桥梁，互通有无，互相促进，共同推进两地各项事业再上新台阶。,政府领导到其他城市考察学习或访问,0.0
31,内蒙古省,呼伦贝尔市,我旗民族工作学习考察组到兴安盟考察学习,2022-07-05,http://www.xbehyq.gov.cn/News/show/963915.html,为进一步提高民族团结进步创建工作水平，拓宽提升基层民族工作者能力素养，近日，由旗委常委、统战部长李健及创建民族团结工作成员单位工作人员组成的考察组一行赴兴安盟，考察学习民族团结进步创建工作。。考察组聆听了以 《正确认识和把握新时代党的民族工作格局有形有感有效做好新时代党的民族工作》为题的讲座，还先后深入突泉县铸牢中华民族共同体意识促进会、科右前旗兴科社区、第一小学等地现场观摩，详细了解各单位民族团结进步创建工作的先进经验做法。。考察学习中，大家学习到了先进地区创建全国民族团结示范盟的好经验、好做法，在各领域、各行业日常工作如何与创建工作有机融合方面深受启发，形成了共鸣。此次考察还进一步促进了双方的交流合作，为共同推进民族团结进步事业发展架起了友谊桥梁，达到互通有无、资源共享、合作共赢的良好目标，为拓宽我旗创建工作思路，丰富创建内容提供了保障。（审稿：红梅 来源：融媒体）,为进一步提高民族团结进步创建工作水平，拓宽提升基层民族工作者能力素养，近日，由旗委常委、统战部长李健及创建民族团结工作成员单位工作人员组成的考察组一行赴兴安盟，考察学习民族团结进步创建工作。。考察组聆听了以 《正确认识和把握新时代党的民族工作格局有形有感有效做好新时代党的民族工作》为题的讲座，还先后深入突泉县铸牢中华民族共同体意识促进会、科右前旗兴科社区、第一小学等地现场观摩，详细了解各单位民族团结进步创建工作的先进经验做法。。考察学习中，大家学习到了先进地区创建全国民族团结示范盟的好经验、好做法，在各领域、各行业日常工作如何与创建工作有机融合方面深受启发，形成了共鸣。此次考察还进一步促进了双方的交流合作，为共同推进民族团结进步事业发展架起了友谊桥梁，达到互通有无、资源共享、合作共赢的良好目标，为拓宽我旗创建工作思路，丰富创建内容提供了保障。（审稿：红梅 来源：融媒体）,政府领导到其他城市考察学习或访问,0.0
31,内蒙古省,呼伦贝尔市,我旗民族工作学习考察组到兴安盟考察学习,2022-07-04,http://www.xbehyq.gov.cn/News/show/1019885.html,为进一步提高民族团结进步创建工作水平，拓宽提升基层民族工作者能力素养，近日，由旗委常委、统战部长李健及创建民族团结工作成员单位工作人员组成的考察组一行赴兴安盟，考察学习民族团结进步创建工作。。考察组聆听了以 《正确认识和把握新时代党的民族工作格局有形有感有效做好新时代党的民族工作》为题的讲座，还先后深入突泉县铸牢中华民族共同体意识促进会、科右前旗兴科社区、第一小学等地现场观摩，详细了解各单位民族团结进步创建工作的先进经验做法。。阿拉坦额莫勒镇克尔伦社区党支部书记 格日乐 ：“今天来了这里的社区后我们收获匪浅，他们的工作非常实际，而且‘11456’这个工作模式，值得我们借鉴，我们回去以后，将这两天学习的收获，结合我们社区的实际做好做实，把铸牢中华民族共同体意识这项工作做得更好 。”。考察学习中，大家学习到了先进地区创建全国民族团结示范盟的好经验、好做法，在各领域、各行业日常工作如何与创建工作有机融合方面深受启发，形成了共鸣。此次考察还进一步促进了双方的交流合作，为共同推进民族团结进步事业发展架起了友谊桥梁，达到互通有无、资源共享、合作共赢的良好目标，为拓宽我旗创建工作思路，丰富创建内容提供了保障。,为进一步提高民族团结进步创建工作水平，拓宽提升基层民族工作者能力素养，近日，由旗委常委、统战部长李健及创建民族团结工作成员单位工作人员组成的考察组一行赴兴安盟，考察学习民族团结进步创建工作。。考察组聆听了以 《正确认识和把握新时代党的民族工作格局有形有感有效做好新时代党的民族工作》为题的讲座，还先后深入突泉县铸牢中华民族共同体意识促进会、科右前旗兴科社区、第一小学等地现场观摩，详细了解各单位民族团结进步创建工作的先进经验做法。。阿拉坦额莫勒镇克尔伦社区党支部书记 格日乐 ：“今天来了这里的社区后我们收获匪浅，他们的工作非常实际，而且‘11456’这个工作模式，值得我们借鉴，我们回去以后，将这两天学习的收获，结合我们社区的实际做好做实，把铸牢中华民族共同体意识这项工作做得更好 。”。考察学习中，大家学习到了先进地区创建全国民族团结示范盟的好经验、好做法，在各领域、各行业日常工作如何与创建工作有机融合方面深受启发，形成了共鸣。此次考察还进一步促进了双方的交流合作，为共同推进民族团结进步事业发展架起了友谊桥梁，达到互通有无、资源共享、合作共赢的良好目标，为拓宽我旗创建工作思路，丰富创建内容提供了保障。,政府领导到其他城市考察学习或访问,0.0
31,内蒙古省,呼伦贝尔市,额尔古纳市人大学习考察团来我市学习考察,2020-09-09,http://www.manzhouli.gov.cn/News/show/881913.html,日前，额尔古纳市人大常委会主任岳晓波率额尔古纳市人大学习考察团到我市学习考察。市人大常委会主任李昌武，市人大常委会副主任黄利民陪同考察。。李昌武对额尔古纳市人大学习考察团一行的到来表示欢迎，并希望在今后的工作中进一步加强两地人大的沟通与交流，共同促进人大工作再上新台阶。。岳晓波认为文明社区“人大代表之家”、综合保税区、中俄互市贸易区各项工作思路清晰、措施得力、规范有序，有许多亮点值得学习和借鉴。考察团成员也纷纷表示，回去后将积极把这些好做法、好经验进行总结，并结合当地工作实际进行推广和创新，将额尔古纳市的人大工作做得更好。（李懿倩）,日前，额尔古纳市人大常委会主任岳晓波率额尔古纳市人大学习考察团到我市学习考察。市人大常委会主任李昌武，市人大常委会副主任黄利民陪同考察。。李昌武对额尔古纳市人大学习考察团一行的到来表示欢迎，并希望在今后的工作中进一步加强两地人大的沟通与交流，共同促进人大工作再上新台阶。。岳晓波认为文明社区“人大代表之家”、综合保税区、中俄互市贸易区各项工作思路清晰、措施得力、规范有序，有许多亮点值得学习和借鉴。考察团成员也纷纷表示，回去后将积极把这些好做法、好经验进行总结，并结合当地工作实际进行推广和创新，将额尔古纳市的人大工作做得更好。（李懿倩）,政府领导到其他城市考察学习或访问,0.0
31,内蒙古省,呼伦贝尔市,呼伦贝尔市教育局组织学习考察组赴呼和浩特市包头市考察学习,2021-04-07,http://jyj.hlbe.gov.cn/News/show/361383.html,为深入贯彻落实自治区党委政府、市委市政府相关工作要求，积极稳妥推行我市各民族语言授课中小学“三科”统编教材和幼儿园使用国家通用语言开展保育教育工作，于2021年3月29日至4月2日，呼伦贝尔市教育局党组成员、政府教育督导团白金山总督学带队，由市教育局民教科及相关旗市区教育局分管领导组成的考察学习组一行赴呼和浩特市、包头市考察学习。。考察学习组先后到达呼和浩特市蒙古族幼儿园（南园）、呼和浩特市第三十中学（内蒙古师范大学附属第二学校）、新城区蒙古族幼儿园、呼和浩特市蒙古族学校、包头市蒙古族学校、九原区蒙古族幼儿园、九原区蒙小，通过走进校园，走进班级，现场观摩的方式，直面感受统编教材教育教学整体情况及校园环境建设等工作。考察学习组每到一个地方向教育局和学校的相关负责人仔细询问在当地教育局、学校、教师在推进统编教材工作中的先进做法，同时针对自身存在的问题和困难进行了深入的座谈。。座谈会上，呼和浩特市和包头市教育局有关领导对呼伦贝尔市考察团一行表示热烈欢迎并全面介绍工作开展情况。参会的当地教育局领导、校长、园长向考察组成员详细介绍了在推行使用国家“三科”统编教材工作和幼儿园推广使用国家通用语言开展保育教育工作中的经验做法，为我市工作开展提供了宝贵经验。。通过考察学习，各考察组成员满载收获，纷纷表示在接下来的工作中，按照自治区和市委市政府的部署要求，坚持以“铸牢中华民族共同体意识”为主线，坚定不移推广普及国家通用语言文字，紧密结合实际，充分吸收先进经验的各项做法，坚持分类施策，更加扎实高效推进推行使用国家统编教材和国家通用语言文字保育教育工作。。考察组部分成员到教育厅，向分管领导专项汇报了呼伦贝尔市推行使用国家统编教材和国家通用语言文字保育教育工作开展情况，并到民教处、基教处、安全处和督导室对接相关工作，为稳步推进推行使用国家统编教材和国家通用语言文字保育教育工作提供了有力保障。,为深入贯彻落实自治区党委政府、市委市政府相关工作要求，积极稳妥推行我市各民族语言授课中小学“三科”统编教材和幼儿园使用国家通用语言开展保育教育工作，于2021年3月29日至4月2日，呼伦贝尔市教育局党组成员、政府教育督导团白金山总督学带队，由市教育局民教科及相关旗市区教育局分管领导组成的考察学习组一行赴呼和浩特市、包头市考察学习。。考察学习组先后到达呼和浩特市蒙古族幼儿园（南园）、呼和浩特市第三十中学（内蒙古师范大学附属第二学校）、新城区蒙古族幼儿园、呼和浩特市蒙古族学校、包头市蒙古族学校、九原区蒙古族幼儿园、九原区蒙小，通过走进校园，走进班级，现场观摩的方式，直面感受统编教材教育教学整体情况及校园环境建设等工作。考察学习组每到一个地方向教育局和学校的相关负责人仔细询问在当地教育局、学校、教师在推进统编教材工作中的先进做法，同时针对自身存在的问题和困难进行了深入的座谈。。座谈会上，呼和浩特市和包头市教育局有关领导对呼伦贝尔市考察团一行表示热烈欢迎并全面介绍工作开展情况。参会的当地教育局领导、校长、园长向考察组成员详细介绍了在推行使用国家“三科”统编教材工作和幼儿园推广使用国家通用语言开展保育教育工作中的经验做法，为我市工作开展提供了宝贵经验。。通过考察学习，各考察组成员满载收获，纷纷表示在接下来的工作中，按照自治区和市委市政府的部署要求，坚持以“铸牢中华民族共同体意识”为主线，坚定不移推广普及国家通用语言文字，紧密结合实际，充分吸收先进经验的各项做法，坚持分类施策，更加扎实高效推进推行使用国家统编教材和国家通用语言文字保育教育工作。。考察组部分成员到教育厅，向分管领导专项汇报了呼伦贝尔市推行使用国家统编教材和国家通用语言文字保育教育工作开展情况，并到民教处、基教处、安全处和督导室对接相关工作，为稳步推进推行使用国家统编教材和国家通用语言文字保育教育工作提供了有力保障。,政府领导到其他城市考察学习或访问,0.0
