code,province,city,topic,date,url,content,content,label,score
31,内蒙古省,呼伦贝尔市,哈克镇深入学习贯彻习近平总书记考察内蒙古重要讲话重要指示精神,2019-07-29,https://www.hailar.gov.cn/News/show/219631.html,7月29日上午，哈克镇召开专题会议，学习贯彻习近平总书记考察内蒙古时重要讲话重要指示精神，研究部署全镇近期重点工作。哈克镇党政班子、机关干部职工、村（社区）两委主要负责人、非公企业和派出所等部门党员，共计60余人参加会议。。会议由镇党委主要负责人主持，并领学了习近平总书记考察内蒙古时重要讲话重要指示精神，并与参会人员就推动经济高质量发展；坚持生态优先、绿色发展；坚持保障和改善民生；扎实开展好“不忘初心、牢记使命”主题教育等方面进行深入的学习和研讨。会议强调，习近平总书记来内蒙古考察指导工作，看望慰问各族干部群众，充分体现了习近平总书记和党中央对内蒙古的关心关怀和深情厚爱，为内蒙古明确了根本遵循和工作指南。要深刻认识习近平总书记考察内蒙古的重大意义，自觉把总书记的期望嘱托作为前进的指导，把总书记的关怀厚爱转化为拼搏奋进的动力，团结带领广大干部群众，进一步增强“四个意识”，坚定“四个自信”，做到“两个维护”，不忘初心、牢记使命，凝心聚力、接续奋斗。做到抓思想认识到位，抓检视问题到位，抓整改落实到位，抓组织领导到位；必须坚持一切为民，必须弘扬优良作风，必须激发斗争精神，不辜负习近平总书记和党中央的期望重托。。会上，镇政府负责人传达了区政府副区长高名鸿同志在乡镇领导干部培训会上的讲话精神，并对近期我镇的“四项重点工作”、脱贫攻坚、农村人居环境整治、重点项目、意识形态、扫黑除恶等几项重点工作进行安排部署。。会上，镇党委主要负责人对各基层党组织提出了几点要求：一要全面开展学习，及时将习近平总书记的重要讲话重要指示讲话精神不折不扣的传达到全镇每个基层党组织和党员干部；二要把习近平总书记的重要讲话重要指示精神，作为“守初心、担使命、找差距、抓落实”的有力举措，指导我们今后的工作；三要广泛开展宣传宣讲，把学习贯彻讲话精神作为宣传思想工作的重中之重，要大力宣传习近平总书记重要讲话重要指示的丰富内涵。。此次会议为哈克镇发展指明了方向，下一步我们将深刻认识学习习近平总书记重要讲话的重大意义，认真学习领会重要讲话的精神实质，深入学、跟进学、扎实学，真正学深悟透，进一步明确方向、理清思路、把握重点，以我们的忠诚和担当推动哈克镇各项事业取得实效，强化工作举措，推动习近平总书记重要指示要求落实落地，转化为建设亮丽内蒙古、共圆伟大中国梦的生动实践。,7月29日上午，哈克镇召开专题会议，学习贯彻习近平总书记考察内蒙古时重要讲话重要指示精神，研究部署全镇近期重点工作。哈克镇党政班子、机关干部职工、村（社区）两委主要负责人、非公企业和派出所等部门党员，共计60余人参加会议。。会议由镇党委主要负责人主持，并领学了习近平总书记考察内蒙古时重要讲话重要指示精神，并与参会人员就推动经济高质量发展；坚持生态优先、绿色发展；坚持保障和改善民生；扎实开展好“不忘初心、牢记使命”主题教育等方面进行深入的学习和研讨。会议强调，习近平总书记来内蒙古考察指导工作，看望慰问各族干部群众，充分体现了习近平总书记和党中央对内蒙古的关心关怀和深情厚爱，为内蒙古明确了根本遵循和工作指南。要深刻认识习近平总书记考察内蒙古的重大意义，自觉把总书记的期望嘱托作为前进的指导，把总书记的关怀厚爱转化为拼搏奋进的动力，团结带领广大干部群众，进一步增强“四个意识”，坚定“四个自信”，做到“两个维护”，不忘初心、牢记使命，凝心聚力、接续奋斗。做到抓思想认识到位，抓检视问题到位，抓整改落实到位，抓组织领导到位；必须坚持一切为民，必须弘扬优良作风，必须激发斗争精神，不辜负习近平总书记和党中央的期望重托。。会上，镇政府负责人传达了区政府副区长高名鸿同志在乡镇领导干部培训会上的讲话精神，并对近期我镇的“四项重点工作”、脱贫攻坚、农村人居环境整治、重点项目、意识形态、扫黑除恶等几项重点工作进行安排部署。。会上，镇党委主要负责人对各基层党组织提出了几点要求：一要全面开展学习，及时将习近平总书记的重要讲话重要指示讲话精神不折不扣的传达到全镇每个基层党组织和党员干部；二要把习近平总书记的重要讲话重要指示精神，作为“守初心、担使命、找差距、抓落实”的有力举措，指导我们今后的工作；三要广泛开展宣传宣讲，把学习贯彻讲话精神作为宣传思想工作的重中之重，要大力宣传习近平总书记重要讲话重要指示的丰富内涵。。此次会议为哈克镇发展指明了方向，下一步我们将深刻认识学习习近平总书记重要讲话的重大意义，认真学习领会重要讲话的精神实质，深入学、跟进学、扎实学，真正学深悟透，进一步明确方向、理清思路、把握重点，以我们的忠诚和担当推动哈克镇各项事业取得实效，强化工作举措，推动习近平总书记重要指示要求落实落地，转化为建设亮丽内蒙古、共圆伟大中国梦的生动实践。,其他,0.7702262622474758
31,内蒙古省,呼伦贝尔市,陈旗新右旗委统战部到莫旗考察学习民族工作,2022-08-24,http://www.mldw.gov.cn/News/show/981665.html,期间，莫旗委统战部陪同陈旗和新右旗考察团先后在莫旗博物馆、图书馆、腾克民俗村和民族园，就。民族团结进步教育基地建设及利用情况和非物质文化遗产保护、民族古籍文献展阅基地建设、民族古籍和民族团结进步创建进景区及旅游促进各民族交往交流交融等工作开展情况。经过此次考察，莫旗委统战部与陈旗委统战部、新右旗委统战部相互交流了对于开展民族工作的经验和此次考察的感想，陈旗委统战部和新右旗委统战部一致认为这一次考察学习收获颇丰，希望以后能与莫旗委统战部继续保持持续的经验交流，相互学习，取长补短，共同推进全市民族工作高质量发展。。主办：莫力达瓦达斡尔族自治旗人民政府办公室 承办：莫力达瓦达斡尔族自治旗政务服务与数据管理局,期间，莫旗委统战部陪同陈旗和新右旗考察团先后在莫旗博物馆、图书馆、腾克民俗村和民族园，就。民族团结进步教育基地建设及利用情况和非物质文化遗产保护、民族古籍文献展阅基地建设、民族古籍和民族团结进步创建进景区及旅游促进各民族交往交流交融等工作开展情况。经过此次考察，莫旗委统战部与陈旗委统战部、新右旗委统战部相互交流了对于开展民族工作的经验和此次考察的感想，陈旗委统战部和新右旗委统战部一致认为这一次考察学习收获颇丰，希望以后能与莫旗委统战部继续保持持续的经验交流，相互学习，取长补短，共同推进全市民族工作高质量发展。。主办：莫力达瓦达斡尔族自治旗人民政府办公室 承办：莫力达瓦达斡尔族自治旗政务服务与数据管理局,其他,0.566705608225375
31,内蒙古省,呼伦贝尔市,旗总工会开展学习贯彻习近平总书记考察内蒙古重要讲话精神宣讲会,2023-09-04,http://www.cbrhq.gov.cn/News/show/1124610.html,8月29日，陈巴尔虎旗总工会召开学习贯彻习近平总书记考察内蒙古重要讲话精神宣讲会，会议由旗总工会党组书记、常务副主席杨立强主持，党组成员包玉荣、包君峰及全体职工参加会议。,8月29日，陈巴尔虎旗总工会召开学习贯彻习近平总书记考察内蒙古重要讲话精神宣讲会，会议由旗总工会党组书记、常务副主席杨立强主持，党组成员包玉荣、包君峰及全体职工参加会议。,其他,0.5256754991149964
31,内蒙古省,呼伦贝尔市,新巴尔虎左旗工商联率企业家赴阿荣旗考察学习,2023-09-16,http://www.xzq.gov.cn/News/show/1132284.html,9月15日，旗政府副旗长、工商联主席王兴国带队，旗工商联相关负责人及企业家代表一行8人前往阿荣旗考察学习。阿荣旗政协副主席、工商联主席衣晶，阿荣旗工商联党组书记、常务副主席周亚夫陪同考察。。王兴国一行先后走访了阿荣旗那克塔肉牛繁育场、得力其尔乡大鹅养殖基地烤鹅加工厂、尹俏德新的生活家纺有限公司柞蚕文化体验中心在建项目场地和呼伦贝尔市中荣食品有限公司，实地了解企业发展运营、生产流程、发展规划等情况，并与企业负责人进行深入交流。。随后，考察组一行赴阿荣旗复兴镇六间房村实地考察紫花脸蘑菇种植基地及饺子厂。 王兴国对阿荣旗工商联周密安排考察内容表示感谢，希望通过此次考察交流，进一步深化与阿荣旗工商联的联系，积极为两地民营企业拓宽交流渠道，并向阿荣旗工商联发出邀请，希望以此次考察交流为契机，架起两地企业家交流合作桥梁，共同推动两地民营经济持续健康发展。 参与此次考察学习的企业家们纷纷表示，通过考察学习，对阿荣旗民营企业有了更全面客观的认识，深受启发，受益匪浅，进一步拓宽了视野和思路，回来后将把学到的好经验、好做法融入到企业经营发展中，助力新巴尔虎左旗民营经济高质量发展。。参与此次考察学习的企业家们纷纷表示，通过考察学习，对阿荣旗民营企业有了更全面客观的认识，深受启发，受益匪浅，进一步拓宽了视野和思路，回来后将把学到的好经验、好做法融入到企业经营发展中，助力新巴尔虎左旗民营经济高质量发展。,9月15日，旗政府副旗长、工商联主席王兴国带队，旗工商联相关负责人及企业家代表一行8人前往阿荣旗考察学习。阿荣旗政协副主席、工商联主席衣晶，阿荣旗工商联党组书记、常务副主席周亚夫陪同考察。。王兴国一行先后走访了阿荣旗那克塔肉牛繁育场、得力其尔乡大鹅养殖基地烤鹅加工厂、尹俏德新的生活家纺有限公司柞蚕文化体验中心在建项目场地和呼伦贝尔市中荣食品有限公司，实地了解企业发展运营、生产流程、发展规划等情况，并与企业负责人进行深入交流。。随后，考察组一行赴阿荣旗复兴镇六间房村实地考察紫花脸蘑菇种植基地及饺子厂。 王兴国对阿荣旗工商联周密安排考察内容表示感谢，希望通过此次考察交流，进一步深化与阿荣旗工商联的联系，积极为两地民营企业拓宽交流渠道，并向阿荣旗工商联发出邀请，希望以此次考察交流为契机，架起两地企业家交流合作桥梁，共同推动两地民营经济持续健康发展。 参与此次考察学习的企业家们纷纷表示，通过考察学习，对阿荣旗民营企业有了更全面客观的认识，深受启发，受益匪浅，进一步拓宽了视野和思路，回来后将把学到的好经验、好做法融入到企业经营发展中，助力新巴尔虎左旗民营经济高质量发展。。参与此次考察学习的企业家们纷纷表示，通过考察学习，对阿荣旗民营企业有了更全面客观的认识，深受启发，受益匪浅，进一步拓宽了视野和思路，回来后将把学到的好经验、好做法融入到企业经营发展中，助力新巴尔虎左旗民营经济高质量发展。,政府领导到其他城市考察学习或访问,0.0
31,内蒙古省,呼伦贝尔市,呼伦贝尔市商务局赴包头市考察学习夜间经济等重点工作,2022-09-01,http://swj.hlbe.gov.cn/News/show/984337.html,8月30日，呼伦贝尔市商务局局长李风华率相关科室及旗市区负责人，赴包头市考察学习夜间经济、智慧商场、供应链等重点工作，探讨我市夜间经济发展模式。。为进一步推动我市夜间经济提档升级和繁荣发展，考察组一行在包头市商务局陪同下，重点参观考察了包百商圈的潮盒街区，对潮盒街区的集装箱新业态、3D场景体验、四至范围、经营模式、人员流量等进行了详细了解。此外，还参观了包领鲜、吾悦广场及其周边步行街，了解了供应链示范企业包领鲜依托资源整合打造的“公交”式物流配送模式、智慧商店吾悦广场智慧服务功能等。。考察中，与包头市商务局局长赵娟及相关业务负责人进行了座谈，了解包头市近年来推动夜间经济、智慧商场、供应链、电子商务等工作发展的具体做法和先进经验。。此次考察学习，为我市下一步推动夜间经济提档升级、智慧商场建设、供应链示范建设等拓展了眼界、开拓了思路。市商务局将以此次考察为契机，进一步加强夜间经济新业态新模式培育，大力推动我市夜间经济再上新台阶。,8月30日，呼伦贝尔市商务局局长李风华率相关科室及旗市区负责人，赴包头市考察学习夜间经济、智慧商场、供应链等重点工作，探讨我市夜间经济发展模式。。为进一步推动我市夜间经济提档升级和繁荣发展，考察组一行在包头市商务局陪同下，重点参观考察了包百商圈的潮盒街区，对潮盒街区的集装箱新业态、3D场景体验、四至范围、经营模式、人员流量等进行了详细了解。此外，还参观了包领鲜、吾悦广场及其周边步行街，了解了供应链示范企业包领鲜依托资源整合打造的“公交”式物流配送模式、智慧商店吾悦广场智慧服务功能等。。考察中，与包头市商务局局长赵娟及相关业务负责人进行了座谈，了解包头市近年来推动夜间经济、智慧商场、供应链、电子商务等工作发展的具体做法和先进经验。。此次考察学习，为我市下一步推动夜间经济提档升级、智慧商场建设、供应链示范建设等拓展了眼界、开拓了思路。市商务局将以此次考察为契机，进一步加强夜间经济新业态新模式培育，大力推动我市夜间经济再上新台阶。,其他,0.5038515200843243
31,内蒙古省,呼伦贝尔市,鄂温克民族苏木人大代表到巴彦哈达苏木考察学习,2022-12-05,http://www.cbrhq.gov.cn/News/show/1017313.html,为充分发挥人大代表作用，交流经验做法，聚力乡村振兴。近日，鄂温克民族苏木人大主席敖日格勒组织鄂温克民族苏木市、旗、苏木三级人大代表到巴彦哈达苏木进行考察学习乡村振兴和牧区现代化建设工作。巴彦哈达苏木人大主席毕力格及苏木相关领导陪同调研。。鄂温克民族苏木考察学习组一行先后到巴彦哈达苏木天愿生态牧业合作社和呼伦贝尔哈林扩繁场进行考察学习。代表们认真听取巴彦哈达苏木人大主席及合作社和扩繁场相关负责人就先进经验和特色做法的介绍，边走边看、边听边问，深入了解、认真学习乡村振兴和牧区现代化合作社管理等方面的典型做法和成功经验。。通过实地察看、听取介绍、交谈询问等方式对牲畜改良、饲草料加工、合作社管理、扩繁场升级等方面有了全面深入的了解。代表们表示，此次考察学习是一次凝心聚力、创新思路之行，是一次学习经验、助力发展之行。通过考察学习，大家感触很深、受益匪浅，既开阔了眼界，增长了见识，同时也进一步坚定了当一名责任担当关心人民群众的优秀代表的决心。,为充分发挥人大代表作用，交流经验做法，聚力乡村振兴。近日，鄂温克民族苏木人大主席敖日格勒组织鄂温克民族苏木市、旗、苏木三级人大代表到巴彦哈达苏木进行考察学习乡村振兴和牧区现代化建设工作。巴彦哈达苏木人大主席毕力格及苏木相关领导陪同调研。。鄂温克民族苏木考察学习组一行先后到巴彦哈达苏木天愿生态牧业合作社和呼伦贝尔哈林扩繁场进行考察学习。代表们认真听取巴彦哈达苏木人大主席及合作社和扩繁场相关负责人就先进经验和特色做法的介绍，边走边看、边听边问，深入了解、认真学习乡村振兴和牧区现代化合作社管理等方面的典型做法和成功经验。。通过实地察看、听取介绍、交谈询问等方式对牲畜改良、饲草料加工、合作社管理、扩繁场升级等方面有了全面深入的了解。代表们表示，此次考察学习是一次凝心聚力、创新思路之行，是一次学习经验、助力发展之行。通过考察学习，大家感触很深、受益匪浅，既开阔了眼界，增长了见识，同时也进一步坚定了当一名责任担当关心人民群众的优秀代表的决心。,政府领导到其他城市考察学习或访问,0.0
31,内蒙古省,呼伦贝尔市,锡尼河西苏木召开赴通辽市考察学习经验交流座谈会,2019-05-27,https://www.ewenke.gov.cn/OpennessContent/show/100485.html,5月22日，锡尼河西苏木召开赴通辽市考察学习经验交流座谈会，苏木党委书记那础格主持会议，苏木领导班子成员、嘎查两委、驻村工作队成员参加会议。。会上，四个嘎查“第一书记”对各嘎查基本情况和产业发展概况进行了介绍。特莫胡珠嘎查、巴彦胡硕嘎查赴通辽考察组讲述了考察心得。好力宝嘎查、西博嘎查嘎查达结合考察组交流心得及本嘎查具体情况作了发言。与会人员就发展现代化牧业根本道路进行了深入探讨。。那础格强调，一是要多组织学习考察活动，掌握先进科学养牛技术，结合当地特色发展养牛业；二是要引进先进机械投入当地，提高养牛产出效率。,5月22日，锡尼河西苏木召开赴通辽市考察学习经验交流座谈会，苏木党委书记那础格主持会议，苏木领导班子成员、嘎查两委、驻村工作队成员参加会议。。会上，四个嘎查“第一书记”对各嘎查基本情况和产业发展概况进行了介绍。特莫胡珠嘎查、巴彦胡硕嘎查赴通辽考察组讲述了考察心得。好力宝嘎查、西博嘎查嘎查达结合考察组交流心得及本嘎查具体情况作了发言。与会人员就发展现代化牧业根本道路进行了深入探讨。。那础格强调，一是要多组织学习考察活动，掌握先进科学养牛技术，结合当地特色发展养牛业；二是要引进先进机械投入当地，提高养牛产出效率。,其他,0.5060627608823903
31,内蒙古省,呼伦贝尔市,鄂伦春旗猎民赴阿荣旗扎兰屯考察学习,2018-12-23,http://www.elc.gov.cn/OpennessContent/show/69349.html,"为了解放思想，开拓视野，学习借鉴先进地区的工作经验，促进我旗猎区工作健康快速发展，9月28-30日，政府副旗长何雪光带领民宗局、旅游局、猎区乡镇相关人员及二十余名猎民到阿荣旗兴发乡东光村、扎兰屯南木鄂伦春民族乡就特色村寨建设及家庭游项目进行考察学习。。考察结束时，何雪光表示在我旗特色村寨建设时要坚持统筹兼顾、科学规划、因地制宜、资金整合，特色产业要最能贴近猎民生产生活实际、投资利润最大化、投资风险最小；家庭游项目要在猎民村中树立1-2户典型，并给予政策和资金扶持，让猎民看到实惠，赢得广大猎民的认可,从而带动大多数猎民致富.。猎民也纷纷表示,回去后要以此次考察学习为契机,把看到的、听到的尽快消化吸收，立足本地资源优势，把特色村寨产业和家庭游项目做细、做实，早日达到小康。","为了解放思想，开拓视野，学习借鉴先进地区的工作经验，促进我旗猎区工作健康快速发展，9月28-30日，政府副旗长何雪光带领民宗局、旅游局、猎区乡镇相关人员及二十余名猎民到阿荣旗兴发乡东光村、扎兰屯南木鄂伦春民族乡就特色村寨建设及家庭游项目进行考察学习。。考察结束时，何雪光表示在我旗特色村寨建设时要坚持统筹兼顾、科学规划、因地制宜、资金整合，特色产业要最能贴近猎民生产生活实际、投资利润最大化、投资风险最小；家庭游项目要在猎民村中树立1-2户典型，并给予政策和资金扶持，让猎民看到实惠，赢得广大猎民的认可,从而带动大多数猎民致富.。猎民也纷纷表示,回去后要以此次考察学习为契机,把看到的、听到的尽快消化吸收，立足本地资源优势，把特色村寨产业和家庭游项目做细、做实，早日达到小康。",其他,0.511946669872241
31,内蒙古省,呼伦贝尔市,旗委理论学习中心组年第六次集体学习会暨习近平总书记考察内蒙古时的重要讲话精神学习研讨会召开,2023-06-28,http://www.cbrhq.gov.cn/News/show/1096692.html,旗委理论学习中心组2023年第六次集体学习会暨习近平总书记考察内蒙古时的重要讲话精神学习研讨会召开-陈巴尔虎旗人民政府。6月27日，旗委书记赵建波主持召开旗委理论学习中心组2023年第六次集体学习会暨习近平总书记考察内蒙古时的重要讲话精神学习研讨会。旗委副书记、旗长陶丽，旗政协主席何天峰等旗委理论学习中心组成员参加会议。。会议集中学习了习近平总书记考察内蒙古时的重要讲话精神和内蒙古自治区党委《关于认真学习贯彻习近平总书记考察内蒙古重要讲话精神的通知》、新华社报道《习近平在内蒙古巴彦淖尔考察并主持召开加强荒漠化综合防治和推进“三北”等重点生态工程建设座谈会》和《习近平在内蒙古调研边境管控和边防部队建设情况》、孙绍骋书记在全区领导干部大会上的讲话精神。。会上，与会领导围绕习近平总书记考察内蒙古时的重要讲话精神、在加强荒漠化综合防治和推进“三北”等重点生态工程建设座谈会上的重要讲话精神开展交流研讨。。会议要求，全旗上下要深刻领悟习近平总书记考察内蒙古时的重要讲话精神的重大意义，用心用情体悟总书记的关怀厚爱和蓝图指引，持续在整体把握、系统领会、一体推进上下功夫，聚焦聚力办好“两件大事”。要将学习贯彻习近平总书记考察内蒙古时的重要讲话精神作为当前首要政治任务，在全旗营造浓厚氛围，以实际行动忠诚拥护“两个确立”、坚决做到“两个维护”，推动习近平总书记考察内蒙古时的重要讲话精神在陈巴尔虎旗落地落实。,旗委理论学习中心组2023年第六次集体学习会暨习近平总书记考察内蒙古时的重要讲话精神学习研讨会召开-陈巴尔虎旗人民政府。6月27日，旗委书记赵建波主持召开旗委理论学习中心组2023年第六次集体学习会暨习近平总书记考察内蒙古时的重要讲话精神学习研讨会。旗委副书记、旗长陶丽，旗政协主席何天峰等旗委理论学习中心组成员参加会议。。会议集中学习了习近平总书记考察内蒙古时的重要讲话精神和内蒙古自治区党委《关于认真学习贯彻习近平总书记考察内蒙古重要讲话精神的通知》、新华社报道《习近平在内蒙古巴彦淖尔考察并主持召开加强荒漠化综合防治和推进“三北”等重点生态工程建设座谈会》和《习近平在内蒙古调研边境管控和边防部队建设情况》、孙绍骋书记在全区领导干部大会上的讲话精神。。会上，与会领导围绕习近平总书记考察内蒙古时的重要讲话精神、在加强荒漠化综合防治和推进“三北”等重点生态工程建设座谈会上的重要讲话精神开展交流研讨。。会议要求，全旗上下要深刻领悟习近平总书记考察内蒙古时的重要讲话精神的重大意义，用心用情体悟总书记的关怀厚爱和蓝图指引，持续在整体把握、系统领会、一体推进上下功夫，聚焦聚力办好“两件大事”。要将学习贯彻习近平总书记考察内蒙古时的重要讲话精神作为当前首要政治任务，在全旗营造浓厚氛围，以实际行动忠诚拥护“两个确立”、坚决做到“两个维护”，推动习近平总书记考察内蒙古时的重要讲话精神在陈巴尔虎旗落地落实。,其他,0.5901330929270163
