code,province,city,topic,date,url,content,content.1,label,score,is_match
279,甘肃省,天水市,白银市政府考察组来天水考察金融工作,2017-02-24,https://www.tianshui.gov.cn/info/1021/828831.htm,2月21日，白银市政府副市长金玮带领市政府办公室、市政府金融办有关负责同志来我市考察经济社会和金融业发展情况，开发区管委会、市政府金融办、麦积区负责同志分别陪同考察。。考察组一行先后到华天电子集团、甘肃烟草公司天水卷烟厂、天水科技孵化大厦、美通进出口贸易公司、人寿保险麦积支公司进行了实地考察。。每到一处，考察组都认真听取介绍、询问交流，详细了解我市在推动经济转型升级、创新金融发展等方面的成功经验、企业和项目建设情况，并对企业经营管理、金融创新、金融扶贫等方面取得的成绩给予高度评价。考察组认为，在经济发展新常态下，天水市既坚持稳中求进工作总基调，又把握赶超进位总目标，注重结构优化调整、科技创新进步、产业转型升级，扎实推进供给侧结构性改革，全面落实稳增长、促改革、调结构、惠民生、防风险各项工作措施，不断促进经济社会持续健康发展，全市主要经济指标增速均高于全省平均水平，赶超进位取得了新成效。同时，综合运用信贷、直接融资等金融政策措施，持续狠抓信贷投放、企业首发上市、上市企业再融资、债券发行、新三板和区域股权市场挂牌等工作，全市重点领域的信贷支持持续增强，多层次资本市场加快发展，率先在全省实施了“双助贷”、“三户一孤”等金融助推精准脱贫创新举措，取得了良好社会效应，得到了国家和省上的充分肯定，天水市在推动经济转型升级、创新金融业发展方面取得的成绩和经验值得白银市学习借鉴。希望通过此次考察，两地能进一步加强交流学习与合作，实现共同发展。,３月２５日，临夏州委书记郭鹤立带领考察团来我市考察项目建设、城市建设及经济社会发展工作。天水市委副书记王国先一同考察。。当天，郭鹤立一行先后来到成纪新城天水有轨电车示范线项目现场、天水市体育中心、天水南站综合交通枢纽及站前广场项目、麦积翠湖公园、中航天水飞机工业有限责任公司、天水华天科技股份有限公司集团，每到一处都边走边看，听取相关情况介绍。郭鹤立对天水市近年来项目建设、城市建设及经济社会发展方面取得的成绩表示赞赏，认为天水市城市规划建设定位准、理念新、思路清、措施实，项目建设力度大、进展顺利，势头强劲，在促进区域经济社会发展方面探索积累了一些好经验好做法，值得临夏州学习借鉴，也为临夏州提供了新的建设理念和发展思路。。王国先对郭鹤立一行来我市考察表示欢迎，希望以这次考察为契机，进一步加强两地友好往来和交流合作，相互取长补短、学习借鉴、共同提高，推动两地经济社会高质量发展。,不属于政府领导到其他城市考察学习的新闻,0.5003601479652545,True
279,甘肃省,天水市,临夏州考察团来天水考察项目建设及经济社会发展工作,2020-03-26,https://www.tianshui.gov.cn/info/1021/768291.htm,３月２５日，临夏州委书记郭鹤立带领考察团来我市考察项目建设、城市建设及经济社会发展工作。天水市委副书记王国先一同考察。。当天，郭鹤立一行先后来到成纪新城天水有轨电车示范线项目现场、天水市体育中心、天水南站综合交通枢纽及站前广场项目、麦积翠湖公园、中航天水飞机工业有限责任公司、天水华天科技股份有限公司集团，每到一处都边走边看，听取相关情况介绍。郭鹤立对天水市近年来项目建设、城市建设及经济社会发展方面取得的成绩表示赞赏，认为天水市城市规划建设定位准、理念新、思路清、措施实，项目建设力度大、进展顺利，势头强劲，在促进区域经济社会发展方面探索积累了一些好经验好做法，值得临夏州学习借鉴，也为临夏州提供了新的建设理念和发展思路。。王国先对郭鹤立一行来我市考察表示欢迎，希望以这次考察为契机，进一步加强两地友好往来和交流合作，相互取长补短、学习借鉴、共同提高，推动两地经济社会高质量发展。,[水务局]2018年发展中国家雨水集蓄利用技术培训班学员来我市参观考察-天水市人民政府。9月17日-18日，由国家商务部主办，甘肃省水利科学研究院和商务部国际商务官员研修学院联合承办的“2018年发展中国家雨水集蓄利用技术培训班”学员来我市参观考察学习高效节水灌溉及农村饮水安全工程。该培训班学员由来自亚洲、非洲、拉丁美洲17个国家的56名学员组成。。学员先参观了麦积区渭南镇盛龙高效节水灌溉工程田间滴灌首部控制室、田间滴灌，详细了解了工程首部控制、施肥、田间滴灌等运行情况。。学员先后参观了张家川县渠子梁水厂、县水质检测中心、石峡水库净水车间、并深入刘堡镇丰银村入户了解农村饮水运行情况。,政府领导到其他城市考察学习或访问,0.0,True
279,甘肃省,天水市,天水市政协召开党组扩大会议,2021-06-25,https://www.tianshui.gov.cn/info/1021/749651.htm,会议学习了习近平总书记在青海考察时的重要讲话精神、习近平同志《论中国共产党历史》第32章《人民政协在建立新中国和社会主义革命、改革各个历史时期发挥了十分重要的作用》文章内容；学习了《甘肃信息要事跟进》第463期文章《天水市统筹谋划布局破解发展瓶颈》；传达学习省政协副主席、市委书记王锐调研包抓全市政协协商向基层延伸工作时的讲话精神，研究贯彻落实意见。。会议要求，要认真学习领会习近平总书记重要讲话精神和重要文章内容，转化为政协党组一班人指导工作实践，提升履职实效的工作遵循。要在今后的工作中认真学习王锐同志包抓调研时的讲话要求，高层次谋划推动，高标准狠抓落实，着力推进政协协商向基层延伸，在服务党政所需、群众所盼上做实功、见实效。要认真落实市政协领导和专委会联系包抓县区政协制度，近期深入县区开展一次包抓督导活动。要加强对委员参与政协基层协商工作的服务指导，做好委员下沉基层工作，充分发挥委员的主体作用。要认真挖掘整理基层协商经验做法，加大宣传力度，树立先进典型，营造全社会参与支持政协基层协商的良好氛围。。市政协党组副书记、副主席苏定武，市政协党组成员、副主席郭明兴、王祥林、高媛瑾，市政协党组成员、秘书长郭世文，市政协党组成员贾忠慧出席会议，市政协副主席屈光平，市政协一级巡视员王振宇列席会议。,7月2日下午，市政府党组书记、市长王国先主持市政府党组理论学习中心组2021年第8次学习，全文学习了习近平总书记在庆祝中国共产党成立100周年大会上、“七一勋章”颁授仪式上、中央政治局第二十九次集体学习时的重要讲话和参观“不忘初心、牢记使命”中国共产党历史展览时、青海考察时的重要讲话精神及2021年第12期《求是》杂志刊发的习近平总书记重要文章、中共甘肃省委办公厅关于印发《省委党的建设工作领导小组2021年工作要点》的通知等内容。市政府党组副书记赵四辈，市政府党组成员景丹、逯克宗、张栋梁、汪小娟、郭庆祥、王永祥参加，副市长彭剑鸣列席。。会议强调，习近平总书记在庆祝中国共产党成立100周年大会上的重要讲话是习近平新时代中国特色社会主义思想的最新成果和重要组成部分。全市政府系统要把深入学习领会习近平总书记在庆祝中国共产党成立100周年大会上的重要讲话作为当前和今后一个时期一项重要政治任务，迅速掀起学习热潮，引导党员干部准确把握习近平总书记重要讲话的重大意义、科学内涵和实践要求，增强“四个意识”、坚定“四个自信”、做到“两个维护”，不断提高政治判断力、政治领悟力、政治执行力，推动党中央、国务院和省市各项决策部署要求不折不扣落实落地，努力开创全市经济社会高质量发展的新局面。。会议要求，要深入学习领会习近平生态文明思想，牢牢扛起生态文明建设政治责任，坚定不移走生态优先、绿色低碳的高质量发展道路，严守生态环境保护底线，深入打好污染防治攻坚战，认真实施天水市黄河流域渭河支流生态保护和高质量发展规划，持续改善生态环境质量，推动生态文明建设不断取得新成效。。会议强调，要深入学习贯彻习近平总书记关于党的建设的重要论述，全面落实新时代党的建设总要求和新时代党的组织路线，纵深推进全市政府系统党的建设，切实增强党组织的政治功能和组织力，为全市经济社会高质量发展提供坚强保证。,其他,0.5486748818480413,True
279,甘肃省,天水市,王国先主持天水市政府党组理论学习中心组学习,2021-07-06,https://www.tianshui.gov.cn/info/2691/833971.htm,7月2日下午，市政府党组书记、市长王国先主持市政府党组理论学习中心组2021年第8次学习，全文学习了习近平总书记在庆祝中国共产党成立100周年大会上、“七一勋章”颁授仪式上、中央政治局第二十九次集体学习时的重要讲话和参观“不忘初心、牢记使命”中国共产党历史展览时、青海考察时的重要讲话精神及2021年第12期《求是》杂志刊发的习近平总书记重要文章、中共甘肃省委办公厅关于印发《省委党的建设工作领导小组2021年工作要点》的通知等内容。市政府党组副书记赵四辈，市政府党组成员景丹、逯克宗、张栋梁、汪小娟、郭庆祥、王永祥参加，副市长彭剑鸣列席。。会议强调，习近平总书记在庆祝中国共产党成立100周年大会上的重要讲话是习近平新时代中国特色社会主义思想的最新成果和重要组成部分。全市政府系统要把深入学习领会习近平总书记在庆祝中国共产党成立100周年大会上的重要讲话作为当前和今后一个时期一项重要政治任务，迅速掀起学习热潮，引导党员干部准确把握习近平总书记重要讲话的重大意义、科学内涵和实践要求，增强“四个意识”、坚定“四个自信”、做到“两个维护”，不断提高政治判断力、政治领悟力、政治执行力，推动党中央、国务院和省市各项决策部署要求不折不扣落实落地，努力开创全市经济社会高质量发展的新局面。。会议要求，要深入学习领会习近平生态文明思想，牢牢扛起生态文明建设政治责任，坚定不移走生态优先、绿色低碳的高质量发展道路，严守生态环境保护底线，深入打好污染防治攻坚战，认真实施天水市黄河流域渭河支流生态保护和高质量发展规划，持续改善生态环境质量，推动生态文明建设不断取得新成效。。会议强调，要深入学习贯彻习近平总书记关于党的建设的重要论述，全面落实新时代党的建设总要求和新时代党的组织路线，纵深推进全市政府系统党的建设，切实增强党组织的政治功能和组织力，为全市经济社会高质量发展提供坚强保证。,10月25日至28日，县委常委、兴国镇党委书记王明，县政府副县长辛召东带领县政府办、组织部、民政局及兴国镇大城社区、映南社区、杨坪社区负责人，赴天津市津南区咸水沽镇、小站镇和葛沽镇进行考察，并就城市党建和社区规范化建设方面的典型经验和做法进行了交流学习。。考察组一致认为，津南区城市基层党建工作领导有力，机制健全，格局新颖，组织领导核心地位和党建工作整体效应突出；社区建设投入力度大，功能齐全，服务全面，特别是“村居并行”“智慧社区”“网格化”管理等“美丽社区”建设模式，非常值得借鉴学习。双方表示，将以此次考察学习为起点，进一步加强沟通交流、互访互动，共同促进城市党建和社区建设各项工作再上新水平。,政府领导到其他城市考察学习或访问,0.680102242148243,True
279,甘肃省,天水市,冯文戈主持召开市委常委会会议,2022-07-26,https://www.tianshui.gov.cn/info/2741/28721.htm,7月25日下午，天水市委书记冯文戈主持召开市委常委会会议，传达学习习近平总书记在湖北武汉考察时的重要讲话精神、尹弘同志在全省强县域行动工作推进会上的讲话、《甘肃省巡视整改和成果运用办法》《中共甘肃省委巡视工作规划（2022—2026年）（试行）》，研究部署贯彻落实工作。。会议强调，全市各级各部门要认真学习贯彻习近平总书记重要讲话精神，与学习贯彻习近平总书记对甘肃重要指示要求结合起来，立足天水实际，切实办好自己的事情。要全力推动省第十四次党代会关于“强科技”行动的安排部署，不断完善科技创新政策，优化科技创新生态，充分发挥科技创新的引领和带动作用。要坚持党建引领基层社会治理，聚焦社区、农村基本治理单元，着力抓好网格化管理、精细化服务、信息化建设，不断提升基层应急反应能力和管理服务水平。要坚决贯彻党中央“疫情要防住、经济要稳住、发展要安全”重要要求，高效统筹疫情防控和经济社会发展，进一步提高科学防控、精准防控水平，为加快经济恢复和重振夯实基础。要高度重视安全生产工作，抓紧抓细防汛工作，坚决防范化解重大安全风险，坚决遏制重特大事故发生。。会议强调，各县区要按照《甘肃省强县域行动实施方案》明确的目标任务、发力重点、责任分工等，立足资源禀赋和产业发展基础，发挥各自比较优势，找准定位、选好“赛道”，坚持项目带动强县域，聚焦具有市场发展潜力、能够带动群众就业增收的产业，着力打造县域首位产业，培育壮大县域市场主体，增强县域经济发展活力。要坚持全市一盘棋，加强协作交流，打好特色牌，走好特色路，形成特色鲜明、功能互补、梯次合理的县域发展新格局。。会议强调，全市各级党委（党组）要充分认识做好新时代巡视巡察工作的重大意义，切实把思想和行动统一到中央决策部署和省委的工作要求上来，增强做好巡察工作的政治自觉、思想自觉和行动自觉。要牢牢抓住新时代巡视巡察工作的“纲”和“魂”，更好地发挥政治监督、政治导向作用，持续释放政治巡察的震慑、遏制和治本效应。要认真对照省委巡视工作五年规划，调整完善我市巡察工作五年规划，统筹开展常规巡察，深化三大攻坚战等专项巡察，强化“机动式”巡察，加大“回头看”力度，确保高质量完成八届市委巡察全覆盖。要深化巡察监督与纪律监察、派驻监督的贯通，进一步压紧压实主体责任，加强巡察成果运用，推动形成立体聚焦、系统集成、协同高效的巡视巡察监督格局。,6月13日，秦安县人大常委会副主任宋捷带领秦安县各乡镇人大主席组队赴张家川县观摩考察。张家川县人大常委会主任李肖锋、县人大常委会副主任汪丽琴、县人大常委会代工委负责人陪同观摩考察。。考察组先后深入龙山镇马河村、大阳镇闫庄村、张川镇赵川村，通过听取汇报、翻阅资料、实地查看等方式，就张家川县“人大代表之家”和人大代表微信平台建设情况进行了考察学习。。每到一处，考察组成员都认真听取工作人员关于张家川县“人大代表之家”的创建、作用发挥、规章制度的建立、活动方式、取得的实际效果的介绍，详细了解张家川县人大代表微信平台建设和使用情况。。考察组成员表示，张家川县人大在推进 “人大代表之家”工作上创新工作方式方法，规范代表培训、代表履职、代表视察等工作的好经验、好做法值得借鉴和学习。今后要结合实际，打造高质量、高水平的“人大代表之家”，积极发挥人大代表微信平台的上下互动作用，积极探索，开拓创新，努力为人大代表履行职责提供一流的服务。同时，加强沟通交流，扩展合作领域，互通有无，取长补短，不断创新工作机制，改进工作方法，努力推动两地经济社会快速健康发展。。据悉，张家川县根据省、市人大常委会的统一部署，结合我县“人大代表之家”建设“十有四好三上墙”的具体要求，县乡人大坚持建、管、用并举，积极推进“人大代表之家”建设，确保“人大代表之家”真正成为代表学习交流、联络议政和闭会期间开展履职活动的重要阵地。在全县15个乡镇和部分行政村建成“人大代表之家”95个，为代表依法履职搭建了有效平台；积极指导帮助每一个“人大代表之家”建立健全人大代表小组各项制度，有效地推动了闭会期间人大代表活动制度化、规范化；定期或不定期组织开展学习交流活动，尤其是一些乡镇开通了微信平台、QQ群，将全国、省、市人代会精神、代表履职知识和开展履职活动等内容上传到代表微信圈、QQ群供代表学习掌握。自“人大代表之家”创建以来，人大代表在“家里”先后接待选民660余人次，收集提交意见建议520余条，既促进了一大批热点、难点问题的有效解决，又密切了党群干群关系，充分发挥了“人大代表之家”的桥梁纽带作用。（沈维民）,政府领导到其他城市考察学习或访问,0.0,True
279,甘肃省,天水市,张掖市甘州区考察团来天水市考察,2018-03-08,https://www.tianshui.gov.cn/info/1021/799091.htm,"3月5日至6日,由张掖市委常委、甘州区委书记成广平带领的张掖市甘州区考察团来天水,就我市脱贫攻坚、农业产业和文化旅游产业发展、美丽乡村建设、城市生态修复、成纪新城开发建设等工作进行参观考察。市委常委、秦州区委书记雷鸣,副市长张建杰陪同考察。 两天来,考察团一行先后深入武山县、甘谷县、秦州区和麦积区等地,就脱贫攻坚、美丽乡村建设、城市建设、新区开发等进行了详细参观了解。每到一处,考察团成员都仔细听、认真看,并就相关情况与我市陪同人员进行探讨交流。 考察团一行对我市近年来经济社会发展所取得的成绩给予了高度评价,认为天水市各县区发展思路清晰、措施有力、态势良好,尤其在蔬菜产业发展、美丽乡村建设等方面特色鲜明、成效显著,甘州区将认真学习借鉴天水探索积累的一系列好经验、好做法。并希望双方以此次考察为契机,不断加强交流合作,共同开创两地发展更加美好的明天。（天水日报全媒体记者吴丽娜）",５月２４日，省委常委、兰州市委书记李荣灿带领兰州市党政考察团来我市考察城市规划建设工作。。李荣灿一行先后来到藉河生态治理（一、二期）、有轨电车示范线工程（一期）、翠湖公园、麦积山景区游客服务中心、市体育中心等项目现场，认真听取相关项目情况介绍，详细查看项目规划设计方案和理念，深入了解天水城市规划建设情况和取得的成效。。李荣灿对天水市近年来城市建设项目方面取得的成绩表示赞赏，认为天水市城市规划建设谋划长远，定位准、理念新、起点高、思路清、措施实，通过灵活配置和有效管理，有效解决了城市建设发展中人口、资源、环境协调发展问题，建筑风格既展现了地域特色，也彰显了深厚的历史文化底蕴、令人耳目一新。特别是在城市规划建设中，处处都体现了以人民为中心的发展思想和高起点站位、大手笔谋划、快速度发展及谋事创业的精神状态，让考察组人员真切感受到了天水城市经济社会繁荣发展的美好前景，值得兰州市学习和借鉴。。王军对李荣灿一行来我市考察表示热烈欢迎，并简要介绍了天水近年来城市建设发展情况。希望兰州持续发挥省会城市的引领作用，对天水市经济社会发展多提宝贵意见，并以这次考察为契机，进一步促进两地交流学习，共同提高，推动两地城市建设取得新的更大成绩。,政府领导到其他城市考察学习或访问,0.0,True
