code,province,city,topic,date,url,content,content.1,label,score,is_match
279,甘肃省,天水市,王军率天水市政府考察组在成都市考察学习,2019-10-18,https://www.tianshui.gov.cn/info/1021/775391.htm,"10月15日至17日,天水市委副书记、市长王军率天水市政府考察组在成都市考察学习。在蓉期间,成都市委常委、常务副市长谢瑞武会见考察组一行。天水市委常委、常务副市长赵四辈,副市长逯克宗,市政府秘书长王祥林参加会见并一同考察学习。。会见中,谢瑞武首先介绍了成都市情及发展情况。他说,成都是一座宜居宜业宜游之城,也是一座创新创业之城,更是一座开放包容之城。目前,我们正聚焦新时代成都“三步走”战略目标,坚持“一干多支、五区协同”“四向拓展、全域开放”的战略部署,加快建设国家中心城市、美丽宜居公园城市、国际门户枢纽城市和世界文化名城。天水和成都交流交往基础较好,合作空间和潜力很大。希望双方进一步加强交流、增进合作,优势互补、互相促进,推动双方实现互利共赢发展。。王军对成都市关注支持天水发展表示感谢。他说,天水在历史文化、生态环境、交通区位、产业基础等方面具有独特优势,是西部打通南向通道的重要枢纽,对接融入成渝经济区有着较好基础。此次来蓉考察学习,既是深入贯彻习近平总书记视察甘肃重要讲话和指示精神的具体举措,也是全面落实《甘肃省人民政府办公厅关于支持天水陇南对接融入成渝经济区的意见》精神的实际行动,对于深化两市交流合作、促进天水经济转型创新和高质量发展将起到重要推动作用。天水市将认真学习成渝地区先进的发展理念,紧抓共建“一带一路”历史机遇,探索建立长效合作机制,深入推进双方在文化旅游产业、农产品加工销售、社会民生事业发展等方面的务实合作。真诚欢迎成都市领导多来天水考察指导、传经送宝,帮助我们做好城市规划、公园城市建设、大数据产业发展等方面的工作。同时,也希望更多成渝地区的企业家到天水考察投资,合作共赢,共谋发展。。考察组一行在新经济活力区·双创服务平台、交子金融科技中心,详细了解了构建科技创新生态体系和创新创业平台、培育新兴产业等情况;在成都市网络理政中心,参观学习了提升城市治理智慧水平的先进经验;在成都规划馆,全面了解了城市历史文脉、变迁发展、未来规划等情况;在桂溪生态公园、天府新区规划厅、天府新区公园城市展示厅,感受并学习了城市绿道及公园城市规划建设的创新实践;在泰康之家·蜀园、春熙路、太古里、宽窄巷子,实地考察了医养结合产业、夜间经济发展、历史文化街区及商业发展等工作;在中铁八建总部,交流对接了城市建设有关合作项目。王军说,成都市近年来坚持以新发展理念统揽城市工作全局,深化改革开放,聚力创新发展,很多工作都走在了西部地区乃至全国前列。我们要多领悟、多学习,努力把成都创新发展的先进理念和经验做法,转化为推动自身高质量发展的新举措,不断将各项事业引向深入。","10月15日至17日,天水市委副书记、市长王军率天水市政府考察组在成都市考察学习。在蓉期间,成都市委常委、常务副市长谢瑞武会见考察组一行。天水市委常委、常务副市长赵四辈,副市长逯克宗,市政府秘书长王祥林参加会见并一同考察学习。。会见中,谢瑞武首先介绍了成都市情及发展情况。他说,成都是一座宜居宜业宜游之城,也是一座创新创业之城,更是一座开放包容之城。目前,我们正聚焦新时代成都“三步走”战略目标,坚持“一干多支、五区协同”“四向拓展、全域开放”的战略部署,加快建设国家中心城市、美丽宜居公园城市、国际门户枢纽城市和世界文化名城。天水和成都交流交往基础较好,合作空间和潜力很大。希望双方进一步加强交流、增进合作,优势互补、互相促进,推动双方实现互利共赢发展。。王军对成都市关注支持天水发展表示感谢。他说,天水在历史文化、生态环境、交通区位、产业基础等方面具有独特优势,是西部打通南向通道的重要枢纽,对接融入成渝经济区有着较好基础。此次来蓉考察学习,既是深入贯彻习近平总书记视察甘肃重要讲话和指示精神的具体举措,也是全面落实《甘肃省人民政府办公厅关于支持天水陇南对接融入成渝经济区的意见》精神的实际行动,对于深化两市交流合作、促进天水经济转型创新和高质量发展将起到重要推动作用。天水市将认真学习成渝地区先进的发展理念,紧抓共建“一带一路”历史机遇,探索建立长效合作机制,深入推进双方在文化旅游产业、农产品加工销售、社会民生事业发展等方面的务实合作。真诚欢迎成都市领导多来天水考察指导、传经送宝,帮助我们做好城市规划、公园城市建设、大数据产业发展等方面的工作。同时,也希望更多成渝地区的企业家到天水考察投资,合作共赢,共谋发展。。考察组一行在新经济活力区·双创服务平台、交子金融科技中心,详细了解了构建科技创新生态体系和创新创业平台、培育新兴产业等情况;在成都市网络理政中心,参观学习了提升城市治理智慧水平的先进经验;在成都规划馆,全面了解了城市历史文脉、变迁发展、未来规划等情况;在桂溪生态公园、天府新区规划厅、天府新区公园城市展示厅,感受并学习了城市绿道及公园城市规划建设的创新实践;在泰康之家·蜀园、春熙路、太古里、宽窄巷子,实地考察了医养结合产业、夜间经济发展、历史文化街区及商业发展等工作;在中铁八建总部,交流对接了城市建设有关合作项目。王军说,成都市近年来坚持以新发展理念统揽城市工作全局,深化改革开放,聚力创新发展,很多工作都走在了西部地区乃至全国前列。我们要多领悟、多学习,努力把成都创新发展的先进理念和经验做法,转化为推动自身高质量发展的新举措,不断将各项事业引向深入。",政府领导到其他城市考察学习或访问,0.553359422037568,True
279,甘肃省,天水市,王军率队在成都市考察学习,2020-07-10,https://www.tianshui.gov.cn/info/1021/763531.htm,７月８日至９日，天水市委副书记、市长王军率队在成都市考察学习。成都市副市长刘筱柳、市政府办公厅副主任吴玮骐等参加有关考察活动。天水市政府秘书长王永祥，秦州区、麦积区、武山县、甘谷县、清水县以及市发改、自然资源、住建、招商、商务、名城公司等部门单位负责同志一同考察学习。。天水世茂国际生态城项目在第２５届“兰洽会”上签约，该项目将引入世茂集团自有品牌五星级酒店。王军一行参观了世茂成都茂御酒店，同世茂集团负责人座谈，就推进合作项目进行交流。王军说，世茂集团理念超前、业态丰富，具有很强的品牌影响力，希望能充分发挥自身优势，结合天水需求和实际，进一步优化完善设计方案，切实以项目建设提升城市品位，促进天水旅游业和现代服务业发展。我们将全力做好服务保障，确保项目顺利推进。世茂集团西部区域公司董事长牛伟星表示，世茂集团将全面梳理天水方面提出的意见建议，进一步修改完善设计方案，努力将酒店打造成天水城市新地标。。成都全球跨境电商服务资源中心是全国首个以跨境电商服务资源为主题的楼宇型产业地标，着力于推进大平台、大数据、大通道、大资本等跨境电商服务资源集聚共享。在成都全球跨境电商服务资源中心，王军一行参观了大数据展示中心、政策自助查询平台、“买全川·卖全球”数据中心以及部分入驻企业，听取“中心”从政策助推、服务资源集聚到知名企业引领等方面的详细介绍。王军说，天水今年已正式获批设立跨境电子商务综合试验区，迎来了跨境电商发展的大好机遇。有关方面要认真学习借鉴成都跨境电商发展的成熟经验，积极抢抓天水陇南抱团发展融入成渝经济区的有利契机，争取把成都模式“复制”到天水，发展具有天水地域特色的跨境电商。。王军一行还参观考察了成都宽窄巷子，与成都文旅集团、宽窄巷子公司负责人座谈交流。王军说，天水历史悠久，人文灿烂，自然风光秀美，旅游资源富集，是一座名副其实的宜居宜业宜游之城。近年来，我们坚持把文化旅游作为首位产业来打造，目前，正在实施的天水古城西关片区改造与利用项目，是我们立足古民居建筑群保护打造的全新历史文化街区。宽窄巷子作为成都乃最具代表性的文旅名片，正是我们保护开发天水古城学习的标杆和参照。我们诚挚邀请成都市相关部门及宽窄巷子公司负责人前来天水考察指导，为天水古城的开发运营传经送宝。同时，希望两地能建立完善合作交流机制，进一步加强旅游资源和产品的互推互荐，携手实现更高水平发展。,７月８日至９日，天水市委副书记、市长王军率队在成都市考察学习。成都市副市长刘筱柳、市政府办公厅副主任吴玮骐等参加有关考察活动。天水市政府秘书长王永祥，秦州区、麦积区、武山县、甘谷县、清水县以及市发改、自然资源、住建、招商、商务、名城公司等部门单位负责同志一同考察学习。。天水世茂国际生态城项目在第２５届“兰洽会”上签约，该项目将引入世茂集团自有品牌五星级酒店。王军一行参观了世茂成都茂御酒店，同世茂集团负责人座谈，就推进合作项目进行交流。王军说，世茂集团理念超前、业态丰富，具有很强的品牌影响力，希望能充分发挥自身优势，结合天水需求和实际，进一步优化完善设计方案，切实以项目建设提升城市品位，促进天水旅游业和现代服务业发展。我们将全力做好服务保障，确保项目顺利推进。世茂集团西部区域公司董事长牛伟星表示，世茂集团将全面梳理天水方面提出的意见建议，进一步修改完善设计方案，努力将酒店打造成天水城市新地标。。成都全球跨境电商服务资源中心是全国首个以跨境电商服务资源为主题的楼宇型产业地标，着力于推进大平台、大数据、大通道、大资本等跨境电商服务资源集聚共享。在成都全球跨境电商服务资源中心，王军一行参观了大数据展示中心、政策自助查询平台、“买全川·卖全球”数据中心以及部分入驻企业，听取“中心”从政策助推、服务资源集聚到知名企业引领等方面的详细介绍。王军说，天水今年已正式获批设立跨境电子商务综合试验区，迎来了跨境电商发展的大好机遇。有关方面要认真学习借鉴成都跨境电商发展的成熟经验，积极抢抓天水陇南抱团发展融入成渝经济区的有利契机，争取把成都模式“复制”到天水，发展具有天水地域特色的跨境电商。。王军一行还参观考察了成都宽窄巷子，与成都文旅集团、宽窄巷子公司负责人座谈交流。王军说，天水历史悠久，人文灿烂，自然风光秀美，旅游资源富集，是一座名副其实的宜居宜业宜游之城。近年来，我们坚持把文化旅游作为首位产业来打造，目前，正在实施的天水古城西关片区改造与利用项目，是我们立足古民居建筑群保护打造的全新历史文化街区。宽窄巷子作为成都乃最具代表性的文旅名片，正是我们保护开发天水古城学习的标杆和参照。我们诚挚邀请成都市相关部门及宽窄巷子公司负责人前来天水考察指导，为天水古城的开发运营传经送宝。同时，希望两地能建立完善合作交流机制，进一步加强旅游资源和产品的互推互荐，携手实现更高水平发展。,政府领导到其他城市考察学习或访问,0.6462010819917317,True
279,甘肃省,天水市,王国先带队赴金川集团考察学习,2022-02-14,https://www.tianshui.gov.cn/info/2741/29901.htm,按照市委统一安排部署，近日，天水市委副书记、市长王国先带领武山县和工信、自然资源、国资委、经开区、国投公司等部门单位负责人，赴金川集团公司实地考察学习，洽谈对接合作项目。副市长胡志勇一同参加。。王国先一行先后到金川集团选矿厂一选车间、铜业公司铜电解二分厂、镍合金公司高精镍合金板带材、镍都实业公司高精铜带、镍都实业公司电子引线框架等项目现场，进行实地考察。随后，双方召开座谈会，就进一步深化合作进行了洽谈交流。。座谈会上，金川集团党委书记、董事长王永前说，金川集团按照中央经济工作会议和省委、省政府安排部署，紧紧围绕“强工业、强科技、强省会、强县域”行动战略，注重党建引领，充分发挥“领头雁”作用，勇担工业强省“排头兵”，以创新为路径，切实发挥国企最大优势。今年年初，金川集团到天水市交流学习，成功开启双方全方位高水平交流与合作。此次座谈交流，充分体现了天水市对双方合作的重视与诚意。王永前表示，双方要本着市场是主导、企业是主体、法治是基础、政府是保障的准则，聚焦产业规模化发展、产业结构优化和创新资源共享，充分发挥优势协同发展，同向发力攻克难题，助推合作项目尽快落地，合力谱写产城融合高质量发展新篇章。。王国先说，金川集团是甘肃省唯一的世界５００强企业，拥有世界级的矿产资源和强大的技术、资金、人才、市场优势，在全球同行业中具有很强的影响力。通过实地考察，切身感受到几代金川人艰苦创业的奋斗历程和新时代创新创业的辉煌成就，体现了金川集团作为大型国有企业的使命责任与担当作为，双方合作发展潜力巨大、前景广阔。希望金川集团能够充分发挥资源优势和技术优势，进一步深化务实合作，全面提升互利合作实效。王国先表示，天水市将严格按照省委、省政府“强工业、强科技、强省会、强县域”行动战略部署，紧紧围绕“建强副中心、走出新路子”的发展方向和打造“五区五中心”的目标定位，秉持“只要企业定了干，一切手续政府办（除了安全和环保）”理念，确定专人专班，加强与金川集团的对接，采取一对一、保姆式服务，全要素全流程高效率做好合作项目服务保障工作，确保合作项目早日落地、尽快开工建设，为实现高质量发展提供有力支撑。。金川集团公司党委副书记、总经理李尚勇主持座谈会，副市长胡志勇通报了天水市与金川集团合作项目前期进展情况。,按照市委统一安排部署，近日，天水市委副书记、市长王国先带领武山县和工信、自然资源、国资委、经开区、国投公司等部门单位负责人，赴金川集团公司实地考察学习，洽谈对接合作项目。副市长胡志勇一同参加。。王国先一行先后到金川集团选矿厂一选车间、铜业公司铜电解二分厂、镍合金公司高精镍合金板带材、镍都实业公司高精铜带、镍都实业公司电子引线框架等项目现场，进行实地考察。随后，双方召开座谈会，就进一步深化合作进行了洽谈交流。。座谈会上，金川集团党委书记、董事长王永前说，金川集团按照中央经济工作会议和省委、省政府安排部署，紧紧围绕“强工业、强科技、强省会、强县域”行动战略，注重党建引领，充分发挥“领头雁”作用，勇担工业强省“排头兵”，以创新为路径，切实发挥国企最大优势。今年年初，金川集团到天水市交流学习，成功开启双方全方位高水平交流与合作。此次座谈交流，充分体现了天水市对双方合作的重视与诚意。王永前表示，双方要本着市场是主导、企业是主体、法治是基础、政府是保障的准则，聚焦产业规模化发展、产业结构优化和创新资源共享，充分发挥优势协同发展，同向发力攻克难题，助推合作项目尽快落地，合力谱写产城融合高质量发展新篇章。。王国先说，金川集团是甘肃省唯一的世界５００强企业，拥有世界级的矿产资源和强大的技术、资金、人才、市场优势，在全球同行业中具有很强的影响力。通过实地考察，切身感受到几代金川人艰苦创业的奋斗历程和新时代创新创业的辉煌成就，体现了金川集团作为大型国有企业的使命责任与担当作为，双方合作发展潜力巨大、前景广阔。希望金川集团能够充分发挥资源优势和技术优势，进一步深化务实合作，全面提升互利合作实效。王国先表示，天水市将严格按照省委、省政府“强工业、强科技、强省会、强县域”行动战略部署，紧紧围绕“建强副中心、走出新路子”的发展方向和打造“五区五中心”的目标定位，秉持“只要企业定了干，一切手续政府办（除了安全和环保）”理念，确定专人专班，加强与金川集团的对接，采取一对一、保姆式服务，全要素全流程高效率做好合作项目服务保障工作，确保合作项目早日落地、尽快开工建设，为实现高质量发展提供有力支撑。。金川集团公司党委副书记、总经理李尚勇主持座谈会，副市长胡志勇通报了天水市与金川集团合作项目前期进展情况。,政府领导到其他城市考察学习或访问,0.0,True
279,甘肃省,天水市,张掖市考察组来天水市考察学习职业教育工作,2020-07-17,https://www.tianshui.gov.cn/info/1021/762651.htm,７月１５日，张掖市副市长马斌带领相关部门和职业院校负责人一行８人来我市考察职业教育发展情况，副市长汪小娟、市政协副主席王祥林一同考察。。考察组一行先后深入华天电子集团、天水市卫生学校、天水市职教园区、甘肃机电职业技术学院，参观了华天电子集团的展览馆、生产车间，天水市卫生学校护理、康养实训室，天水市职教园区建设工地，甘肃机电职业技术学院加工中心、３Ｄ打印体验中心、工业机器人实训室等，详细了解学校专业设置、人才培养、“双师型”教师队伍建设、校企合作等情况。实地考察结束后，在华天电子集团召开了座谈会，大家就加强校企合作、深化产教融合改革，推动职业教育高质量发展工作做了深入交流。培黎职业学院和华天电子集团就实训基地建设、人才培养、教师培训达成初步合作意向。。考察期间，汪小娟详细介绍了天水市委、市政府紧紧围绕新时代西部大开发、“一带一路”、“南向通道”建设、“关中平原城市群”建设等重大战略，建设职教园区、整合职业教育资源、优化教育布局等一系列大力发展职业教育的重大举措。。、“南向通道”建设、“关中平原城市群”建设等重大战略，建设职教园区、整合职业教育资源、优化教育布局等一系列大力发展职业教育的重大举措。。马斌表示，天水市文化底蕴深，工业基础雄厚，有华天科技等一批国内领先、国际知名的企业，为职业教育发展提供了得天独厚的发展条件，天水市职业教育专业特色鲜明、实训设施先进、校企深度融合、服务经济发展能力凸显。通过学习考察，拓宽了视野，更新了观念，为张掖市探索发展职业教育提供了新思路、新路径，今后将进一步加强与天水交流学习，深化校企、校校合作，促进张掖市职业教育快速发展。,７月１５日，张掖市副市长马斌带领相关部门和职业院校负责人一行８人来我市考察职业教育发展情况，副市长汪小娟、市政协副主席王祥林一同考察。。考察组一行先后深入华天电子集团、天水市卫生学校、天水市职教园区、甘肃机电职业技术学院，参观了华天电子集团的展览馆、生产车间，天水市卫生学校护理、康养实训室，天水市职教园区建设工地，甘肃机电职业技术学院加工中心、３Ｄ打印体验中心、工业机器人实训室等，详细了解学校专业设置、人才培养、“双师型”教师队伍建设、校企合作等情况。实地考察结束后，在华天电子集团召开了座谈会，大家就加强校企合作、深化产教融合改革，推动职业教育高质量发展工作做了深入交流。培黎职业学院和华天电子集团就实训基地建设、人才培养、教师培训达成初步合作意向。。考察期间，汪小娟详细介绍了天水市委、市政府紧紧围绕新时代西部大开发、“一带一路”、“南向通道”建设、“关中平原城市群”建设等重大战略，建设职教园区、整合职业教育资源、优化教育布局等一系列大力发展职业教育的重大举措。。、“南向通道”建设、“关中平原城市群”建设等重大战略，建设职教园区、整合职业教育资源、优化教育布局等一系列大力发展职业教育的重大举措。。马斌表示，天水市文化底蕴深，工业基础雄厚，有华天科技等一批国内领先、国际知名的企业，为职业教育发展提供了得天独厚的发展条件，天水市职业教育专业特色鲜明、实训设施先进、校企深度融合、服务经济发展能力凸显。通过学习考察，拓宽了视野，更新了观念，为张掖市探索发展职业教育提供了新思路、新路径，今后将进一步加强与天水交流学习，深化校企、校校合作，促进张掖市职业教育快速发展。,政府领导到其他城市考察学习或访问,0.0,True
279,甘肃省,天水市,天水市政府考察组在重庆市考察学习,2019-10-21,https://www.tianshui.gov.cn/info/1021/775501.htm,"10月17日至18日,天水市委常委、常务副市长赵四辈率天水市政府考察组在重庆市考察学习。重庆市南岸区副区长陈炯,天水市副市长逯克宗、市政府秘书长王祥林一同考察。。在考察组与重庆市经开区、南岸区举行的座谈会上,南岸区委常委、常务副区长黄红介绍了南岸区经济社会发展情况以及大数据、智能制造和文化旅游产业发展等方面的先进理念和成功经验。。赵四辈说,天水与成渝经济区相邻,发展优势互补性强,有着广阔的合作发展空间。真诚欢迎重庆市经开区、南岸区各级领导和社会各界人士到天水参观考察、交流洽谈,谋划和推进重大合作项目,为推动两地经济社会高质量发展、更好地造福两地人民、共同推动陆海新通道建设作出更大贡献。。在重庆期间,考察组一行先后详细了解了大数据、智能制造、电子信息产业、绿色发展、生态文明建设等方面的情况。","10月17日至18日,天水市委常委、常务副市长赵四辈率天水市政府考察组在重庆市考察学习。重庆市南岸区副区长陈炯,天水市副市长逯克宗、市政府秘书长王祥林一同考察。。在考察组与重庆市经开区、南岸区举行的座谈会上,南岸区委常委、常务副区长黄红介绍了南岸区经济社会发展情况以及大数据、智能制造和文化旅游产业发展等方面的先进理念和成功经验。。赵四辈说,天水与成渝经济区相邻,发展优势互补性强,有着广阔的合作发展空间。真诚欢迎重庆市经开区、南岸区各级领导和社会各界人士到天水参观考察、交流洽谈,谋划和推进重大合作项目,为推动两地经济社会高质量发展、更好地造福两地人民、共同推动陆海新通道建设作出更大贡献。。在重庆期间,考察组一行先后详细了解了大数据、智能制造、电子信息产业、绿色发展、生态文明建设等方面的情况。",政府领导到其他城市考察学习或访问,0.0,True
