code,province,city,topic,date,url,content,content.1,label,score,is_match
282,甘肃省,平凉市,王旭带队在临夏州考察学习,2023-08-11,http://zzb.pingliang.gov.cn/szyw/art/2023/art_8aec25fc719c4304962e55d362988e78.html,8月10日至11日，市委书记王旭带领我市党政考察团在临夏州临夏市、临夏县，考察学习和美乡村建设、特色产业培育、乡村旅游发展、农村人居环境整治等工作。。走进临夏县新集镇苗家村、先锋乡前韩村，乡间庭院错落有致，房前屋后鲜花盛开，富民产业各具特色，风景如画的和美乡村跃然眼前。苗家村坚持就地培育与外出创业、治乱拆旧与建新画美、党建引领与村民自治相结合，全面提升产业质效、扮靓村庄颜值。前韩村是刘家峡库区移民村之一，打造了基础设施城市化、富民产业规模化、基层治理智能化“三化”并具的和美乡村。临夏州在和美乡村建设上探索的路子、创造的经验，让考察团成员深受启发和触动。一致表示，将把临夏州的好经验好做法吸收复制到平凉乡村建设中，进一步做优规划、做实产业、做强基础，全面提升基层治理水平，高质量建设宜居宜业和美乡村。。临夏市百益亿农国际鲜花港项目是临夏市实施的“高精尖”现代农业重点项目之一，运用“数字智控”、LED植物补光系统、无土绿色栽培等先进技术，年产值可达1.8亿元。折桥镇树莓产业园采取“合作社+农户+企业”模式，以科技赋能促进产品增值，在深度加工上做足文章，推动树莓、旅游和美食产业融合发展。折桥村盖碗巷以茶文化为主题，串联农耕体验、休闲采摘、垂钓、餐饮、生态观光等多元业态，创造了乡村旅游发展新模式。因地制宜、科技支撑、市场运营、串点成链的现代农业发展模式，为培优做强特色产业提供了有益借鉴。考察团成员纷纷表示，将做足做好无中生有、有中生优的文章，坚持用工业化思维谋划农业，以现代生态循环农业整市建设试点和农业精品培育示范区建设为牵引，力促特色产业优化升级、精深加工，实现农业增效、助推乡村振兴。。在考察交流过程中，大家深刻感受到临夏浓厚的发展氛围和敢谋善干、创新进取的实干精神，将深入学习借鉴临夏州的经验做法，进一步提振干事创业精气神，高标准推进和美乡村建设，加快特色产业提质增效，不断提升基层治理能力和治理水平，奋力推动经济社会高质量发展。,为深入贯彻落实平凉市党政考察团赴河西学习考察总结会议精神，9月21日至9月25日，平凉市供销联社主要负责人带领各县（区、市）供销社主任、市社相关科室人员组成供销系统考察学习团，赴武威、金昌、张掖考察学习供销合作社综合改革先进经验做法。。考察学习期间，先后深入武威市民勤县、金昌市永昌县、张掖市甘州区实地学习考察了供销社现代流通服务体系建设、“三会”制度建设和“三位一体”建设10个典型基层供销合作社及专业合作社的先进做法及经验。考察过程中，大家边走边看，边听边悟，解放了思想，开阔了眼界，拓展了思路，也看到了差距，受到了启发，明确了我市供销工作发展的方向和目标。。考察结束后，考察团召开了座谈交流会，交流了此次学习过程中的体会与感悟。大家一致认为，此次考察学习，大家全面了解了兄弟市县的先进做法，看到了深化供销合作社综合改革的开阔视野和创新思路，悟出了破解我市供销合作社事业发展难题的切入点和着力点，通过考察学习，进一步明确了今后的供销工作要继续坚持从“三农”大局出发，牢记为农服务根本宗旨，着眼脱贫攻坚和乡村振兴战略实施，持续深化综合改革，结合我市实际和当前改革进展，把这次考察学习的收获与学到的先进经验运用到开拓创新、推动我市供销事业发展的实际中，力争在推进供销合作社综合改革的重点难点方面有新的突破，努力开创我市供销合作事业发展新局面。,其他,0.5722043269897957,True
282,甘肃省,平凉市,赴河南洛阳开封市学习考察的感想与收获,2012-11-19,http://dx.pingliang.gov.cn/xydt/art/2022/art_7916bc5b33854184adc47095228e0950.html,2012年10月31日，平凉党校工作研究会第十届年会在河南洛阳召开。来自市县（区）委党校常务副校长和年会论文代表共23人齐聚洛阳，上午参观考察了洛阳市委党校，听取他们创建“党校第二课堂”的经验介绍，下午全体与会人员出席了年会。会上传达了甘肃省委书记王三运同志在庆祝甘肃省委党校建校60周年大会上的讲话，传达了平凉市委副书记、党校校长张军利同志在市委党校校委会上的讲话，同时还传达了《平凉市委党校贯彻张军利同志在市委党校校委会上的讲话精神实施意见》；交流了论文，对本届年会上获奖的论文及作者进行了表彰奖励；举行了《我们走过十年——平凉市党校工作研究会获奖论文集》（光明日报出版社出版，2012年9月）的发行仪式；各县（区）委党校常务副校长还就上午参观考察洛阳市委党校情况，特别是对他们开展“党校第二课堂”等内容开展了研讨。最后，市委党校常务副校长杨俊虎同志讲话，他回顾总结研究会十年来党校工作与发展变化，并强调指出办好党校，党委重视是做好党校工作的基础；培育党校文化，是党校永立思想理论前沿的保证；加强学习，是党校工作的永恒主题；解放思想、更新观念，是党校工作充满活力的重要条件；坚持改革创新，是党校事业发展的不竭动力；坚持自力更生办党校，是党校人应有的品格；加强队伍建设，是党校工作的灵魂。11月1日与会人员又赴开封，参观考察了开封市委党校。。本届年会是继去年第九届年会（内蒙古鄂尔多斯）“走出平凉”的基础上成行的，选择在具有深厚文化底蕴的河南省洛阳和开封召开党校工作研究年会，既学习了他们的办学经验，开阔了眼界，也看到自身与外面的差距。河南洛阳、开封之行，与会同志感受颇多。。河南位于黄河中下游，因大部分地区在黄河以南，故名河南。2000多年前，为中国九州中心之豫州，故简称为“豫”，且有“中州”、“中原”之称，河南为中华民族主要发祥地之一，孕育了中华文明灿烂的文化，河南省的人口列全国各省之首人数超过1亿，约占全国总人口的1／13。进入改革开放以后，随着人口流动性的加快，许多人外出谋生，个别人弄虚作假、坑蒙拐骗，加上媒体的不当宣传，使国人对河南人的印象不好。但我们这次来到河南，留下的印象却截然相反，他们勤劳、善良、好客，他们做事认真，他们说话实在，他们待人不落俗套。特别是洛阳这个城市还被评选为中国十大魅力城市，新区街道整洁宽敞、高楼林立、规划的十分现代，街道两旁摆放整齐的自行车成为一道风景，市民不乱闯红灯、乱丢垃圾也说明河南人的素质提高了，这都说明河南人在城市建设方面、在精神文明建设方面成就斐然，让我们刮目相看。。河南地处中原大地，是一个农业大省，但其经济并不滞后。2011年全省地区生产总值为26931.03亿元，城镇居民人均可支配收入18194.80元，农民人均纯收入6604.03元。三大产业结构比为12.9：58.3：28.8，粮食生产实现了“八连增”，连续6年超千亿斤，为国家粮食安全做出了重要贡献。同时，物流、文化、旅游等现代服务业加快发展，经济迅速发展使得其经济总量连续多年稳居全国第五，居中西部之首。洛阳市由于工业基础雄厚，年财政收入达178亿，开封年财政收入50多亿。城乡面貌发生巨大变化，人的素质得到有效提升，各项事业发展成效明显，与我们甘肃、平凉相比差距明显。洛阳是13朝古都，国家“一五”期间100个基础项目在洛阳就有7个。开封更是以7朝古都而闻名，可谓人文荟萃，现在这两个城市又以洛阳牡丹、开封菊花吸引着国内外的游客，带动文化、旅游、宾馆、餐饮等消费性服务业的大发展。,"8月15日，陇南市礼县人大常委会副主任武全祥、王小强带领考察团，对我县扶贫产业、劳务产业发展和扶贫车间建设等脱贫攻坚工作进行考察。县人大常委会副主任杜福林，县人大常委会法制司法民侨内务工委、县人社局负责人陪同考察。 考察团一行先后深入甘肃金沃森生物科技有限公司扶贫车间、灵台县绿源公司绿芦笋种植基地、绿源肉牛养殖场、灵台县盛丰农牧综合开发有限责任公司、甘肃齐翔农业科技有限公司有机苹果生产基地暨劳务产业基地、西屯镇万吨果蔬气调库和柳家铺养殖农民专业合作社进行了实地考察。 考察团认为，灵台县脱贫攻坚工作推动措施有力，工作成效显著，在加快牛果菜和劳务产业发展中探索形成了“党组织+国有公司+龙头企业+合作社+农户”“党组织+劳务公司+企业+贫困户”“党组织+合作社+农户”等多种发展模式,实现了党组织引领，企业、村集体、农户互动融合发展的格局，特别是劳务产业助推脱贫攻坚、扶贫车间建设及苹果产业“四新”机制等经验，对礼县脱贫攻坚工作有很大的启迪。 考察团表示，将以此次考察为契机，充分学习借鉴灵台县的先进经验和典型做法，推进礼县的脱贫攻坚工作。考察团希望今后工作中两县进一步加强交流合作，互相学习借鉴，共同促进两地经济社会发展。。考察团一行先后深入甘肃金沃森生物科技有限公司扶贫车间、灵台县绿源公司绿芦笋种植基地、绿源肉牛养殖场、灵台县盛丰农牧综合开发有限责任公司、甘肃齐翔农业科技有限公司有机苹果生产基地暨劳务产业基地、西屯镇万吨果蔬气调库和柳家铺养殖农民专业合作社进行了实地考察。。考察团认为，灵台县脱贫攻坚工作推动措施有力，工作成效显著，在加快牛果菜和劳务产业发展中探索形成了“党组织+国有公司+龙头企业+合作社+农户”“党组织+劳务公司+企业+贫困户”“党组织+合作社+农户”等多种发展模式,实现了党组织引领，企业、村集体、农户互动融合发展的格局，特别是劳务产业助推脱贫攻坚、扶贫车间建设及苹果产业“四新”机制等经验，对礼县脱贫攻坚工作有很大的启迪。。考察团表示，将以此次考察为契机，充分学习借鉴灵台县的先进经验和典型做法，推进礼县的脱贫攻坚工作。考察团希望今后工作中两县进一步加强交流合作，互相学习借鉴，共同促进两地经济社会发展。",政府领导到其他城市考察学习或访问,0.0,True
282,甘肃省,平凉市,郭承录带队赴泾源县杨岭村考察学习脱贫攻坚工作,2019-03-21,http://zzb.pingliang.gov.cn/szyw/art/2022/art_2ab1374a6bbb46b18febc211f6d9f8e9.html,"3月20日,市委书记郭承录赴宁夏自治区泾源县大湾乡杨岭村考察学习脱贫攻坚工作。固原市委副书记杨刚、泾源县委书记张立君陪同考察。市委办、市扶贫办负责人一同考察学习。。杨岭村位于曾经“苦甲天下”的西海固地区,是六盘山集中连片特困地区的腹地。长期以来,山大沟深、土地贫瘠、交通不便、产业滞后等因素制约着当地群众脱贫的步伐。2016年7月18日,习近平总书记视察泾源县大湾乡杨岭村后,该县按照总书记的指示,引进文旅集团、六盘山牧业、天山牧业等投资主体,投资1.8亿元发展乡村旅游和生态养殖,因村因户制宜,推进目标对象、基础设施、产业政策、技能培训、金融扶贫、社会保障“六个全覆盖”,培育形成了草畜、苗木、旅游、中蜂、劳务五大脱贫致富主导产业,村容村貌、群众生活发生了巨大变化,成为泾源县26个脱贫销号村之一。。当日下午,郭承录来到杨岭村,走进村民马克俊、马占贵、姚果林家,与他们深入交流,问收入、问产业、问发展。在该村扶贫车间和肉牛养殖场,郭承录对企业和合作社的生产经营、合作模式、群众务工等进行了详细了解。在杨岭村村史馆,郭承录在展出的一幅幅图片、一件件实物前驻足细看,认真听取介绍,深入了解村庄发展变迁、脱贫措施的制定落实、产业培育等详细情况。。郭承录在考察时表示,泾源县近年来在经济社会发展和脱贫攻坚工作中取得的成就令人赞赏,特别是在脱贫攻坚工作中探索出了符合实际、行之有效的发展思路和办法,为平凉市打赢打好脱贫攻坚战提供了有益经验。平凉市将以此次考察学习为契机,认真贯彻落实习近平总书记重要指示精神,积极借鉴泾源县在脱贫攻坚工作中的好理念、好做法、好经验,结合平凉实际,突出攻坚重点,持续用力抓好脱贫富民产业培育,大力补齐短板弱项,切实提升全市脱贫攻坚质量。",为了学习借鉴兄弟县区推动经济社会发展的先进经验，进一步解放思想，更新观念，拓宽视野，加快我县经济社会发展，10月23日至26日，县委副书记、县长王廷佐，县委常委、纪委书记景忠科，县人大常委会副主任陈德学，县政府副县长赵小军、完新义，县政协副主席王自力，县循环经济产业园区党工委书记刘潇甫带领各乡（镇）、温泉开发区党委书记、乡镇长（主任）及部分县直部门负责人，赴灵台、崇信、华亭、庄浪、静宁、崆峒及平凉工业园区进行了考察学习。。这次考察活动得到了兄弟县区和工业园区的高度重视和大力支持，通过考察学习，进一步开阔了视野，启迪了思维，看到了差距，明确了方向，坚定了加快发展的信心和决心。,政府领导到其他城市考察学习或访问,0.0,True
282,甘肃省,平凉市,王大睿带队赴陇南市开展主题学习教育活动并考察学习政协信息化建设工作,2019-07-04,http://zx.pingliang.gov.cn/zxdt/art/2022/art_faf1bb03c19448c08ee4218a4a9ed1d0.html,，市政协主席、党组书记王大睿带领市政协机关全体干部赴陇南市开展主题学习教育活动并考察学习政协信息化建设工作。中共陇南市委书记孙雪涛，市委副书记、市长崔景瑜亲切接见并进行了深入交流。陇南市政协主席、党组书记张昉全程陪同。。开展了“缅怀革命先烈、传承红色基因、弘扬革命精神”主题党日活动，向烈士塑像敬献了花篮，共同重温了入党誓词，参观了两当兵变事件、红色革命传承和习仲勋光辉一生三个展厅。通过开展主题。活动，进一步加深了对光荣革命历史的认识和了解，坚定了共产主义理想信念，树牢了为共产主义事业奋斗终身的信心和决心，大家一致表示，在今后的工作中要不忘初心、牢记使命，勇于担当、认真履职，不断为建设绿色开放幸福美好新平凉和人民政协事业创新发展作出新贡献。。在陇南市政协机关，王大睿一行详细了解了机关信息化规划、建设、维护、机制等工作，并与该市政协部分领导干部进行了座谈交流。王大睿表示，陇南市委、市政府和市政协高度重视信息化建设工作，在大数据平台建设、云数据分析、电商平台发展、政协APP软件开发、公众号平台维护和机制建设等方面均探索了有益经验，是兄弟市州政协学习的榜样和典范。平凉市政协将以这次考察学习为契机，认真学习借鉴陇南市政协“1223”信息化建设工作思路和成功经验，加快提案办理系统、委员履职系统、社情民意信息系统建设步伐，推动政协履职和互联网深度融合发展，不断提升政协工作信息化水平。。领导干部进行了座谈交流。王大睿表示，陇南市委、市政府和市政协高度重视信息化建设工作，在大数据平台建设、云数据分析、电商平台发展、政协。软件开发、公众号平台维护和机制建设等方面均探索了有益经验，是兄弟市州政协学习的榜样和。”信息化建设工作思路和成功经验，加快提案办理系统、委员履职系统、社情民意信息系统建设步伐，推动政协履职和互联网深度融合发展，不断提升政协工作信息化水平。。陇南市委常委、武都区委书记田广慈，陇南市委常委、两当县委书记梁英，陇南市政协副主席、党组副书记佘东鹏、郑作栋，秘书长、党组成员剡蛟龙及两当县、徽县有关负责同志陪同。市政协领导朱建国、席君忠、陈黎萍、闫虎明、邢建军、禹文长、李旺军、练生辉一同参加。。陇南市政协副主席、党组副书记佘东鹏、郑作栋，秘书长、党组成员剡蛟龙及两当县、徽县有关负责。陪同。市政协领导朱建国、席君忠、陈黎萍、闫虎明、邢建军、禹文长、李旺军、练生辉一同参加。,12月27日，市政府副市长杨恭带队赴固原市考察学习海绵城市建设工作，崆峒区政府、市发改委、市财政局、市住建局、市水务局、市自然资源局、崆峒区住建局相关人员陪同考察学习。。杨恭一行先后现场观摩了固原市玫瑰苑小区海绵化改造项目，SCO调蓄池建设项目，西南新区丝路海绵公园，清水河固原市区段综合治理项目，第三污水处理厂建设项目，并与固原市住建局、财政局、水务局、海绵城市建设中心、项目公司负责人就海绵城市申报，方案编制，老旧小区、现有绿地海绵化改造，政策性、规范性配套文件起草，海绵功能项目谋划，工程项目实施，资金筹措与保障，管理运营模式探索、风险规避、第三方公司技术指导和业务咨询等内容进行了学习交流。。杨恭指出，固原与平凉山水相邻、文化相通，在此次考察学习的过程中精心安排，热情服务，为平凉市申报全国海绵示范城市提供了可借鉴、可学习的经验和做法，使我们进一步理清了工作思路，明确了工作目标。希望能以此次考察学习为契机，加强两市的沟通交流，助力平凉市申报全国海绵建设示范城市。。杨恭要求，在平凉申报2022年全国海绵建设示范城市的工作中，崆峒区政府及各部门要切实加强同固原市的沟通交流，借鉴固原市成功做法，相互配合，大力支持，对照国家系统化全域推进海绵城市建设示范城市申报条件和要求，在今年5月份省级竞争性评审各项工作基础上，查缺项，补短板，进一步精准谋划建设项目，完善基础资料，健全法规制度和保障机制，全力做好国家系统化全域推进海绵城市建设示范城市申报工作。,其他,0.5547224796256374,True
282,甘肃省,平凉市,杨恭带队赴固原市考察学习海绵城市建设工作,2021-12-28,http://zjj.pingliang.gov.cn/xwzx/gzdt/art/2022/art_2d1330dfd95347ff97e153814ac3b388.html,12月27日，市政府副市长杨恭带队赴固原市考察学习海绵城市建设工作，崆峒区政府、市发改委、市财政局、市住建局、市水务局、市自然资源局、崆峒区住建局相关人员陪同考察学习。。杨恭一行先后现场观摩了固原市玫瑰苑小区海绵化改造项目，SCO调蓄池建设项目，西南新区丝路海绵公园，清水河固原市区段综合治理项目，第三污水处理厂建设项目，并与固原市住建局、财政局、水务局、海绵城市建设中心、项目公司负责人就海绵城市申报，方案编制，老旧小区、现有绿地海绵化改造，政策性、规范性配套文件起草，海绵功能项目谋划，工程项目实施，资金筹措与保障，管理运营模式探索、风险规避、第三方公司技术指导和业务咨询等内容进行了学习交流。。杨恭指出，固原与平凉山水相邻、文化相通，在此次考察学习的过程中精心安排，热情服务，为平凉市申报全国海绵示范城市提供了可借鉴、可学习的经验和做法，使我们进一步理清了工作思路，明确了工作目标。希望能以此次考察学习为契机，加强两市的沟通交流，助力平凉市申报全国海绵建设示范城市。。杨恭要求，在平凉申报2022年全国海绵建设示范城市的工作中，崆峒区政府及各部门要切实加强同固原市的沟通交流，借鉴固原市成功做法，相互配合，大力支持，对照国家系统化全域推进海绵城市建设示范城市申报条件和要求，在今年5月份省级竞争性评审各项工作基础上，查缺项，补短板，进一步精准谋划建设项目，完善基础资料，健全法规制度和保障机制，全力做好国家系统化全域推进海绵城市建设示范城市申报工作。,9月21日下午，临夏州供销社党组书记、理事会主任马宏海一行20余人，来静宁县供销社考察学习农业社会化服务、流通网络建设、基层组织建设等情况。静宁县委常委、副县长陈平，平凉市供销社理事会副主任郭军峰及市县供销社相关负责人陪同。。考察团一行先后到双岘镇供销合作社综合改革示范点、食用菌产业园、中部乡镇综合服务社（武高驿站）、苹果鸡生态园示范点、静宁供销惠农服务中心、静宁供销集采集配中心等，实地查看了静宁县社开展基层组织建设、农业社会化服务、县域流通服务网络建设情况。。9月22日上午，考察团一行深入县社机关和农发公司，查阅相关资料，并召开了交流座谈会，静宁县供销合作社党组书记、理事会主任李双雄对马宏海一行到静宁县考察表示热烈欢迎，详细介绍了近几年静宁县供销社在深化供销综合改革方面的工作和成效，并围绕社有企业经营发展、项目建设、产业发展进行了深入交流。马宏海表示，此次到静宁县考察学习收获颇丰，静宁县在基层组织建设、流通体系建设、为农服务体系建设工作中，积累的经验和有效做法值得临夏州供销合作社认真学习借鉴。希望双方进一步加强学习和交流，着力推进供销社综合改革走深走实。。新华财经报道：“甘肃静宁：深入推进供销合作社综合改革 全面提升惠“三农”服务水平”,政府领导到其他城市考察学习或访问,0.0,True
