code,province,city,topic,date,url,content,content.1,label,score,is_match
282,甘肃省,平凉市,市公安局召开外出考察学习成果分享会,2024-06-07,http://gaj.pingliang.gov.cn/xwdt/gayw/art/2024/art_ecf150d845384baba4285321b550e608.html,近日，市公安局召开外出考察学习成果分享会，分享交流赴陇南市公安局学习考察体会感受，开拓视野、寻找差距，提振信心、固本浚源，助推全市公安事业高质量发展。副市长、市公安局党委书记、局长寇正德出席会议并讲话，市局党委副书记、分管日常工作的副局长任志成主持会议。。会议强调，全市公安机关要用好用足考察学习成果，不断开阔视野、开阔胸襟、开阔思路，扎实走争创一流之路、主动创稳之路、务实求实之路、改革创新之路，用新理念、新方法，激发新动能，解决新问题，推动实现“静水深流”向“积健为雄”的质变，步履不停向“五个争创西部一流”目标迈进。。会议以视频形式开至县级公安机关。市局指挥中心作整体学习考察工作报告，3个县（市、区）和3个部门（警种）作分享交流发言。市局党委班子成员、各部门（警种）主要负责同志在主会场参会，各县（市、区）公安机关党委班子成员、各部门（警种）负责同志在各自分会场参加。,学习借鉴他山之石拓宽思路促发展 ——我市文化旅游产业考察团赴豫深川地区学习考察综述。为贯彻落实市党政考察团赴河西考察学习总结会议精神，学习借鉴河南、深圳、四川等地推动文化旅游产业发展的先进做法和成功经验，促进全市文化旅游产业提质增效和高质量发展，9月20日至26日，市委常委，宣传部部长、统战部部长马琦带领各县（区）委或政府分管领导，市文旅局、崆峒山大景区管委会、大云寺·王母宫大景区管委会主要负责同志，市、县（区）文旅局和相关文旅投公司及省列乡村旅游“样板村”建设单位主要负责同志，利用7天时间，赴河南省开封市、驻马店市，深圳华侨城集团，四川省成都市、都江堰市四市一集团学习考察。考察团先后实地考察了开封市清明上河园景区运营管理及旅游演艺打造，驻马店市皇家驿站项目引进建设，深圳华侨城集团东部华侨城、华侨城大侠谷、甘坑新镇、欢乐海岸、创意文化园文化旅游全业态开发经营，成都市大邑县花水湾温泉小镇建设、郫都区农科村、战旗村乡村旅游示范点建设和都江堰市国家首批全域旅游示范区创建。详细了解了四市一集团在文化旅游资源开发、体制创新、融资模式、融合发展、项目建设、景区经营管理、全域旅游创建等方面的成功经验和做法，并与驻马店市皇家驿站投资开发管理单位伟光汇通公司召开了座谈交流会，与华侨城集团文化旅游科技公司进行座谈招商会。。9月26日上午，考察团在成都举办了平凉市文化旅游重大项目招商及宣传推介会。世界研学旅游组织中国区首席代表、成都来也旅游发展股份有限公司、成都飞扬联动科技有限公司、成都川行天下旅行社等川渝两地的27家文旅企业和旅行社负责人应邀出席推介会。市委常委，宣传部部长、统战部部长马琦致辞推介重点文旅招商项目，并与世界研学旅游组织中国区首席代表田志奇先生签订开发研学产品、推进研学旅游战略框架合作协议；市文旅局与成都来也旅游发展股份有限公司签订全域旅游发展战略合作协议；崆峒山大景区管委会、平凉文化旅游产业投资集团有限公司、甘肃城乡投文旅产业有限公司分别与当地旅行社签订游客导入协议。。中共平凉市委常委、宣传部部长、统战部部长马琦出席文化旅游重大项目招商及宣传推介会（成都）并致辞。中共平凉市委常委、宣传部部长、统战部部长马琦与世界研学旅游组织中国区首席代表田志奇先生签订研学产品开发战略框架合作协议。市文旅局局长尚高明与成都来也旅游发展股份有限公司董事长杨丛源签订全域旅游发展战略合作协议。崆峒山大景区管委会主任罗大将与四川省星伴旅国际旅行社总经理晏必忠先生签订输送游客协议。平凉文旅投集团副总经理刘飞、甘肃城乡投文旅产业有限公司副总经理李文生分别与成都川行天下旅行社总经理李文龙、四川省中国国际旅行社西北专线经理杨柳先生签订崆峒古镇康养旅游合作框架协议和输送游客协议。考察所在四市及相关县（区）分管领导、文旅局负责人和华侨城集团文化旅游科技公司主要负责人陪同考察。。考察团一路走、一路看、一路听、一路思考、一路推介招商，既看到了四市发展文化旅游产业的显著成果，也了解到许多可学习可借鉴可复制的成功经验，切身感受到了考察各地时不我待、竞相发展的浓厚氛围，进一步看到了平凉文化旅游产业发展差距、存在不足，增强了加快平凉文化旅游产业发展的使命感、紧迫感，学到了一些值得平凉市文化旅游业发展借鉴的成功做法和经验。。平凉市庆祝中华人民共和国成立71周年暨第五届 “平凉画家画平凉”美术作品展隆重开幕,政府领导到其他城市考察学习或访问,0.5728979660800457,True
282,甘肃省,平凉市,政务速递华亭市党政考察团赴周边县区考察学习,2023-10-25,http://www.gsht.gov.cn/zwdt/JRHT/art/2023/art_572c4858d1a3456a8b231b62e7b2fce9.html,为推动华亭市经济社会各项工作高质量发展，10月23至24日，华亭市委副书记张骞带领我市党政考察团赴平凉工业园区、崆峒区、静宁县、庄浪县、崇信县、泾川县、灵台县考察学习。。考察过程中，每到一处，大家都认真听、仔细看、虚心学，详细了解各县（市、区）在产业布局、项目建设、园区打造等方面的成功经验和典型做法。同时深入企业和生产车间，就项目投资、生产经营、发展模式等情况与企业负责人进行深入交谈。。考察团认为，兄弟县（市、区）工作谋划起点高、部署早、行动快，产业链培育、城市更新、乡村建设等项目建设体量大、标准高、机制新、成效好，通过考察学习进一步解放了思想、开阔了视野、找到了差距、激发了干劲，增强了干事创业的信心和决心。大家纷纷表示，将以此次考察为契机，认真学习借鉴兄弟县（市、区）的先进经验和有效做法，将学习到的好经验、好做法付诸于实践，锚定发展目标，坚定信心，鼓足干劲，奋力推动全县经济社会高质量发展。。华亭市领导刘贵明、王志君 、党雪菁、魏磊及各乡镇、各部门负责人参加学习考察活动。（作者 何蓉 苏亚斌 审核 李潇 编辑 邓淑琴）,"9月1日,内蒙古鄂尔多斯市达拉特旗政协副主席苏忠、林冬梅一行考察学习崆峒区生态环境保护工作，崆峒区政协副主席庞军刚陪同考察。 考察组一行深入太统--崆峒山国家级自然保护区，通过听取情况介绍、实地查看等方式，详细了解了我区生态环境保护方面的经验做法。 考察组一行对我区在生态环境保护方面取得的成绩给予了高度评价。并希望进一步加强两地政协之间的交流，相互学习、共同努力，为两地经济社会高质量发展贡献政协智慧和力量。。考察组一行深入太统--崆峒山国家级自然保护区，通过听取情况介绍、实地查看等方式，详细了解了我区生态环境保护方面的经验做法。。考察组一行对我区在生态环境保护方面取得的成绩给予了高度评价。并希望进一步加强两地政协之间的交流，相互学习、共同努力，为两地经济社会高质量发展贡献政协智慧和力量。",政府领导到其他城市考察学习或访问,0.0,True
282,甘肃省,平凉市,崇信县学前教育考察团赴西安市长安区幼儿园考察学习,2019-06-27,http://jyj.pingliang.gov.cn/xwzx/xqdt/art/2022/art_caefc698eca540a384474507cbf1f2ad.html,为加快全县幼儿园建设，促进学前教育高质量发展，学习借鉴先进地区学前教育经验做法，6月25日，由县政协副主席黄新人带领部分教育界政协委员，会同县政协宣教民族委员会、文化文史资料和学习委员会、县政协办公室及县教科局负责人、部分幼儿园园长，共计18人组成学前教育考察团赴西安市长安区进行考察学习。。考察团一行在长安区政协副主席王栓民，区教育局党委书记、局长李鹏程，区教育局党委委员董文利陪同下，先后深入郭杜街道茅坡新城幼儿园、大兆街道中心幼儿园实地参观。每到一处，考察团成员都认真听取经验介绍，详细了解办园理念和硬件设施配备，认真参观园容园貌，现场观摩了保教方式、幼儿活动等内容。长安区郭杜街道茅坡新城幼儿园园长张彩萍就园所文化、教师队伍、园本课程等方面做了经验分享，大兆街道中心幼儿园园长李晶、后勤管理教师成建峰分别就园所发展、省级示范幼儿园创建、幼儿园后勤管理作了题为所《立足规范求发展，提升内涵创品质》和《践行精细化管理，书写幼教人无悔青春》专题经验报告，考察团成员仔细聆听，受益良多。。实地考察学习后，长安区教育局组织召开了座谈会，会上，李鹏程详细介绍了长安区学前教育的基本情况，重点围绕政府主导、规范发展、鼓励扶持、提质创优等方面，交流了长安区在推进学前教育优质普惠、科学发展的做法经验。县政协副主席黄新人表示，崇信县考察团本次到长安考察学习收获很大，拓展了视野，提升了理念，将结合当地实际，积极推广长安区的成功经验和做法，促进学前教育持续向好发展。县教科局负责人表示，将积极主动加强与长安区教育局的联系沟通，增进交流，互通有无，积极借鉴长安区学前教育的先进经验和做法，努力推动崇信学前教育优质普惠发展。。本次考察活动，为崇信县和长安区搭建了交流学习的平台，是两地相互交流学习的难得机遇。考察团成员一致认为，两所幼儿园办园理念新、园所管理精、师资队伍强、保教质量高。纷纷表示，通过这次考察，既学到了经验、开阔了视野，又看到了差距、感到了压力，进一步增强了我们加快发展学前教育的危机感和紧迫感。,11月20日至11月23日，应天津滨海汽车工程职业学院邀请，县政府副县长周葆宁带领灵台县考察团赴天津滨海汽车工程职业学院进行考察学习，与天津滨海汽车工程职业学院理事长贾秀芳、院长许国强，天津市津南区合作交流办主任李忠祥，天津市津南区葛沽镇党委书记张树生进行会谈。。考察团先后考察了学院教学楼、图书室、学生宿舍、学训中心、实训基地等建设情况，并召开座谈会就双方职业教育发展及两校合作事宜进行了深入交流。一致认为该校精细化的管理模式、以人为本的办学追求、合理精准的专业设置、全新的教育方式、广阔的就业渠道等，有许多值得学习借鉴的好思路、好经验。。考察组表示，将认真学习借鉴天津滨海汽车工程职业学院在教育管理、师资培养、产学结合、实训就业等方面的先进经验。同时，将以这次考察学习为契机，推动两地校际之间在更大范围、更多层次的交流与合作，特别是加强合作办学、招生就业、交流培训等方面的联系对接，在深化交流合作中互利共赢、共同发展。。县教育局、县职业中专主要负责同志；天津市津南区葛沽镇、天津滨海汽车工程职业学院负责同志一同参加考察交流活动。,政府领导到其他城市考察学习或访问,0.0,True
282,甘肃省,平凉市,华亭市外出学习考察陶瓷特色古镇建设及对接招商引资项目,2020-04-13,https://mp.weixin.qq.com/s/ZnMlCQ9Wj4I3QUhCH7Y40A,4月1日至3日，华亭市委常委王宁宁、副市长靳智德带领安口镇、招商中心负责人赴陕西省铜川市印台区、渭南市富平县和陇南市成县学习考察、对接项目。。考察组先后到印台区陈炉镇考察学习陶瓷特色古镇建设，参观了王家瓷坊、李家瓷坊传统手工艺品制作；在富平县参观了富乐国际陶艺博物馆，考察了庄里镇觅子工业园区华达陶瓷生产线建设项目，与园区负责人和6家陶瓷生产企业进行了座谈交流，听取了该园区发展历程和相关陶瓷企业家对目前陶瓷产业发展的意见建议，对接洽谈了陶瓷生产线项目；在成县学习考察了金瑞农业科技公司投资建设的现代农业示范园项目，并与新金瑞危废矿渣处理公司负责人就危废矿渣处理技术进行了交流，并就投资事宜进行了对接洽谈。。经考察，陈炉陶瓷古镇历史悠久，家族传承有序，政府保护完好，市场运营效果好，值得我们学习借鉴；庄里镇觅子工业园区陶瓷企业引进方向明确，陶瓷生产种类齐全，企业形成了良好的互补发展格局，待疫情结束后，相关企业将前来我市实地考察洽谈项目；新金瑞危废矿渣处理项目技术先进，理念超前，对我市发展高端陶瓷产业有很强的推动作用，下一步待我市废弃矿渣、陶土等样品化验结果出来后，进一步深度对接合作事宜。本次考察学习既开拓了视野，又为我市安口镇陶瓷古镇建设陶土资源综合开发,为学习借鉴兄弟乡镇美丽乡村建设、村庄环境整治、特色产业开发的成功经验，进一步开阔视野，增长见识，提升我乡新农村建设和产业发展的整体水平。12月2日，丰台乡组织全体乡领导班子成员，各村支书（主任），集中利用一天时间，先后赴玉都、党原、汭丰、窑店、飞云等乡镇实地考察学习。。考察学习中，通过现场看点、听取解说、探讨交流等方式详细了解了兄弟乡镇在新农村建设、产业发展、村庄环境整治及典型培育等方面好的经验和做法。通过考察学习，乡村干部看到了差距，明确了认识，纷纷表示将针对本乡、本村实际，借鉴兄弟乡镇的好经验、好方法，振奋精神，探索创新，扎实工作，全力推动全乡经济社会事业持续健康发展。,其他,0.516568651349174,True
282,甘肃省,平凉市,政务速递市考察团前往周边县区考察学习城市管理工作,2023-07-13,http://www.gsht.gov.cn/szfzzxxts/art/2023/art_f9c9991710be454a84e4b13f0d096f50.html,7月11日，市委常委、组织部部长赵小灵，市委常委、副市长郭建辉带领我市考察团先后前往崆峒区、崇信县、庄浪县考察学习城市建设管理工作。。考察组先后前往崆峒区平华路海绵停车场项目、柳湖中路精品示范街路，崇信县南滨河路休闲景观带、龙泉寺4A级景区连接线项目，庄浪县智慧停车指挥中心、城区环境卫生管理等现场进行了实地考察学习。每到一地，考察团成员都详细询问了解各县区在市容市貌、园林绿化、智慧停车、城管执法、城市更新等方面工作经验和做法，给考察团成员留下深刻印象。。考察团成员一致表示，通过这次考察学习，理清了思路，明确了方向，今后将认真学习借鉴各县区城市建设的思路和举措，依托华亭资源禀赋和生态优势，坚持高起点规划、高标准建设、高水平运营，全力打造高品质现代城市。（作者 马斯梦茹 审核 李潇 编辑 邓淑琴）,为拓展教师视野，提高知识水平，更新教学理念，激发工作动力，不断提升我县初中教师课堂教学水平，促进我县中考成绩再上新的台阶，7月18日至23日，县教育局组织34名初三级科任教师赴湖北省鄂州市考察学习。。学习期间，老师们观摩了华中师范大学附属梧桐湖学校、鄂州三中、鄂州市梁子湖区太和中学。观看了鄂州三中名师工作室主持人宛亚仙老师课堂教学视频，并与之进行了交流研讨。聆听了《班主任》杂志封面人物、鄂州市中学语文学科带头人、鄂州一中教师熊燕的报告《沟通从心开始》。鄂州市教育局教研室数学教研员陈国胜就提高课堂教学效果给我县学员作了辅导讲解。鄂州市梁子湖区太和中学副校长谢海炎做了《高效课堂建设》专题报告。湖北省教科所语文教研员、中国教育学会中学语文专业委员会秘书长蒋红森老师做了《教学内容的学生针对性》讲座。整个考察学习安排紧凑，内容丰富，达到了预期目的。。本次暑期考察学习让老师们收获颇深，通过看、听、问等方式，使大家学到了发达地区学校骨干教师授课的先进教学理念、教学方法与教学手段，深入反思了自身存在的问题与差距，引发了对如何提高课堂教学效果的诸多思考，必将为进一步改进教育教学方法，提升教育教学水平起到很好的促进作用。,其他,0.8474216274465877,True
282,甘肃省,平凉市,王旭白振海率团赴榆林开展招商引资考察学习活动,2023-02-10,http://zsj.pingliang.gov.cn/zhyw/art/2023/art_8121e87769e546f8ac7e1b09c58c156b.html,人勤春来早，实干启新程。为迅速落实省委、省政府关于招商引资部署，2月6日至8日，市委书记王旭，市委副书记、市长白振海率市党政考察团赴榆林市开展招商引资考察学习活动，学习先进经验，促进交流合作，加速项目落地，树立大招商、招大商的鲜明导向，加快推动全市经济社会高质量发展。 陕西省政协副主席、榆林市委书记张晓光，市委副书记、市长张胜利，市委副书记李雄斌，市委常委、常务副市长陈忠，市委常委、神木市委书记杨成林，市委常委、统战部部长王华胜，市人大常委会副主任、市委秘书长冯光宏等榆林市领导分别参加相关活动。 考察团先后来到榆林高新区、榆林经济开发区、神木市锦界工业园区和靖边县，实地考察了国能榆林化工公司等14个企业和项目。每到一处，考察团成员都认真听、仔细看，边思考、边讨论，与相关负责人深入交流、听取介绍，积极提问、记录拍照，详细了解资源深度转化、关键技术研发、产品市场应用等工作，认真学习煤化工产业体系建设等情况，并与当地企业负责人就能源项目合作进行深入对接洽谈。大家纷纷表示，此次招商引资考察学习之行收获很大、触动很深，不仅看到了差距、感到了压力，也理清了思路、坚定了方向，将对标先进，进一步更新观念，把等不住的紧迫感、坐不住的责任感转化为发展动力，以区域争先进位助推高质量发展。 考察中，王旭表示，榆林是国家级能源化工基地，资源优势突出，煤化工产业发展迅猛，对于平凉加快推进陇东综合能源基地建设具有重要借鉴意义。要认真学习榆林市推动煤炭高端化、多元化、低碳化发展的经验做法，大力推进强工业行动，坚持稳步扩煤、加快转电、突破化工，布局新能源，进一步做大做强煤炭清洁高效利用产业链。要深入实施“引大引强引头部”行动，以开局就是决战、起步就是冲刺的拼劲，提高招商精准度和落地率，跑出招商引资加速度。同时，希望两地依托双方产业基础和资源优势，深化合作交流，拓展合作领域，增进产业融合互动，促进产业集群集聚。 副市长齐鹏及市委秘书长李强、市政府秘书长汝登国，有关县（市、区）党政主要领导、市直相关单位主要负责同志参加活动。。胡昌升在皋兰县调研时强调 不误农时抓春耕打牢粮食丰收基础 做大产业强县域确保发展稳步开局,2月7日至11日，县委副书记李永红带领县农业农村局、汭丰镇、平凉巨星集团相关负责同志赴山东省寿光市、青州市实地考察蔬菜产业发展，学习借鉴蔬菜发展模式、种植技术、生产管理、利益联结等先进经验。。考察组先后到寿光市洛城街道丹河设施蔬菜标准化生产示范园、稻田镇崔岭西村现代农业高新技术实验示范基地、寿光市全国蔬菜质量标准中心、中荷无土栽培研究所、山东好优蔬菜有限公司和青州市南小王村蔬菜产业园、山东众禾九州种植基地、九州农庄蔬菜专业合作社、山东省乡村振兴示范村南马兰村、丰禄蔬菜交易市场、中国（青州）花卉苗木交易中心实地观摩学习。每到一处，大家边看边问、边听边议，认真学习掌握蔬菜栽培、病虫害防治等技术，探讨交流蔬菜基地建设、生产管理、产品销售等方面经验，既增长了见识，也开阔了视野，达到了坚定信心、凝聚力量的目的。。李永红表示，山东蔬菜种植历史久远、种类繁多、品质优良，经过多年发展，形成了高端、完整的蔬菜产业集群，通过这次考察学习不仅学习了先进的做法和经验，也为两地交流合作搭建了良好的桥梁，对推动泾川设施蔬菜产业与现代农业产业高质量发展具有重要意义。李永红强调，要充分借鉴学习寿光、青州蔬菜生产经验，认真分析我县蔬菜生产工作中存在的短板和问题，转变思路，创新理念，因地制宜，精准定位，积极探索设施蔬菜产业发展的新路径、新模式，进一步延伸产业链条、完善产业体系，推动“产、供、销”一体化发展，全面提升我县蔬菜产业规模化、产业化、品牌化发展水平。,政府领导到其他城市考察学习或访问,0.6705643295421088,True
