code,province,city,topic,date,url,content,content.1,label,score,is_match
282,甘肃省,平凉市,郭承录赴中国农业科学院北京畜牧兽医研究所考察学习并就开展合作事宜进行商谈,2018-04-03,http://nync.pingliang.gov.cn/xwdt/nyyw/art/2022/art_c6e30e63f6e5404c852b63f100db0f9d.html,为进一步促进平凉红牛产业转型升级、提质增效，4月2日，省政协副主席、市委书记郭承录带领市农牧局、市牛办负责同志赴中国农业科学院北京畜牧兽医研究所考察学习，并就开展院地合作事宜进行深入交流和探讨。。郭承录一行现场考察了中国农业科学院北京畜牧兽医研究所奶产业实验室、动物营养学国家重点实验室、中心实验室、国家肉牛遗传评估中心，随后召开了座谈会。。中国农业科学院北京畜牧兽医研究所所长秦玉昌、党委书记马莹及有关牛产业专家陪同考察并参加座谈会。。座谈会上，郭承录介绍了平凉市基本市情、平凉红牛产业发展现状及优势。他指出，平凉红牛是在本土牛种的基础上通过长期改良形成的一种可产高档优质牛肉的肉牛类群，经过多年的发展，产业规模不断扩大，品牌效应初见成效，种、养、加、贸一体化发展格局基本形成，已成为农民脱贫增收的主导产业之一。但囿于投入、人才、技术等方面，品种培育、优质饲草料开发、产业化经营、品牌提升等相对滞后。他表示，为了把平凉红牛的产业优势转化为品牌优势和市场竞争优势，希望北京畜牧兽医研究所能与平凉市开展院地合作，在平凉建立产学研基地，借助研究所高端的人才和优秀的科研成果，有效促进平凉红牛产业高质量发展。。。他指出，平凉红牛是在本土牛种的基础上通过长期改良形成的一种可产高档优质牛肉的肉牛类群，经过多年的发展，。秦玉昌指出，北京畜牧兽医研究所一直致力于动物遗传资源和育种、动物生物技术与繁殖、动物营养和饲料、草业科学等方面的开发研究与应用，着重解决国家全局性、关键性、方向性、基础性的重大科技问题，已累计取得科研成果226项，其中获奖成果122项，为全国畜牧兽医发展做出了积极贡献。他表示，北京畜牧兽医研究所与平凉建立院地合作关系，对研究所和平凉的发展都具有积极意义，争取今年上半年派出专家团队到平凉考察调研，进行深入对接洽谈，尽快确定合作事项，为平凉红牛产业发展作出贡献。。草业科学等方面的开发研究与应用，着重解决国家全局性、关键性、方向性、基础性的重大科技问题，已累计取得科研成果226项，其中获奖成果122项，为全国畜牧兽医发展做出了积极贡献。他表示，。建立院地合作关系，对研究所和平凉的发展都具有积极意义，争取今年上半年派出专家团队到平凉考察调研，进行深入对接洽谈，尽快确定合作事项，为平凉红牛产业发展作出贡献。。座谈中，秦玉昌还就平凉红牛产业下一步的发展提出了建设性的意见。他指出，要准确把握市场定位，注重提升品种品质品牌文化，高层次制定全产业链规划，构建形成科学的育种、繁育、饲养体系，建立健全高效的营销模式，推动平凉红牛产业不断发展壮大。与会的北京畜牧兽医研究所党委书记马莹和其他专家也为平凉牛产业发展积极建言献策。（李锋）,为深入贯彻落实省生态及地质灾害避险搬迁领导小组第二次会议暨工作推进会议精神，把生态及地质灾害避险搬迁这项为民实事办好办实，9月7日至9日，灵台县委常委、县政府副县长江小兵带领县搬迁办负责人及乡镇主要负责人，赴张掖市考察学习生态及地质灾害避险搬迁工作。。考察组先后深入山丹县永宁新村、恒昌华府、老军乡潘庄村、陈户镇、民乐县南丰渠湾村展尹组、县城崇文嘉苑、三堡集镇和乐民新城安置点现场进行了参观学习。山丹县按照“搬迁一个村寨、发展一个园区、打造一个景区、激活一个集镇、致富一批群众”的思路，完成搬迁1万户2.8万人，打造了山丹县智慧农业试验示范基地、农村产业融合发展示范园、高原夏菜产业园、羊肚菌试种产业园、现代肉羊融合发展产业园、焉支山旅游基地、高庙乡村旅游基地等一批富民产业，为拓宽搬迁群众创业就业渠道、持续稳定增加收入引来源头活水，切实解决群众后顾之忧，让搬迁群众吃上“定心丸”；民乐县抢抓“强县域”行动机遇，把搬迁工作与县城配套设施提质增效、市政公用设施提档升级、公共服务设施提标扩面、环境基础设施提级扩能相统筹，推进“以搬促产、以产促城、以城兴业”的产城融合进程，提升了8369户33188名搬迁群众平等享受高质量公共资源、公共服务的能力。。在整个观摩学习过程中，考察组成员认真聆听当地领导工作介绍，深刻领会张掖市的先进经验及做法，通过现场观摩学习，思想得到解放，对生态及地质灾害避险搬迁有了更深刻的认识，学到了山丹县、民乐县搬迁工作的精髓，为推动灵台县生态及地质灾害避险搬迁工作积累了宝贵的经验办法。。大家一致表示，将认真总结领会这次考察学习成果，充分认识实施生态及地质灾害避险搬迁的重大意义，进一步靠实工作任务，抢抓省上实施生态及地质灾害避险搬迁项目的重大机遇，吃透政策精神，坚持实事求是，科学规划，统筹推进，有力有序推进生态及地质灾害避险搬迁工作落实。将不断优化搬迁安置计划和方案，破解制约因素，紧盯时间节点，倒排工期，在保证工程质量的前提下，加快项目建设进度，确保9月底前高质量、按时限完成安置搬迁工作。认真写好搬迁后续“文章”，扎实做好产业配套和教育、医疗、文化等公共服务保障工作，完善附属工程和配套设施，持续强产业、帮就业、促振兴，确保搬迁群众“搬得出、稳得住、能发展”。同时，做好“提前量”，打好“主动仗”，全力推进明年400户搬迁的提前开工实施工作。,政府领导到其他城市考察学习或访问,0.5592633851661842,True
282,甘肃省,平凉市,津诚所至协作同甘甘肃省党政代表团赴天津学习考察侧记,2023-04-20,http://fgw.pingliang.gov.cn/gsyw/art/2023/art_5f95641f36554f69b096d4072267b614.html,百合、花椒、蜂蜜、苹果、牦牛肉……一件件优质的甘肃特产从这里走进天津市民的生活，甘肃味道越来越被当地人喜爱，成为“津”味中的独特元素，逐渐融为一体。。4月17日下午，这里迎来了甘肃省党政代表团，带来了家乡的问候与支持，增添了这里当好津甘消费帮扶“纽带”的信心和动力。。自1996年党中央决定天津帮扶甘肃以来，天津市以强烈的政治担当和“宁可自己苦一点、也要帮扶多一点”的深情厚谊倾力支持甘肃，“津甘山海情”感人至深。。满怀感恩之心、感激之情、感谢之意，甘肃党政代表团再次来到天津，共叙友情、共话合作、共谋发展。。这既是一次表达感激、学习取经、对接协作之行，更是深入开展学习贯彻习近平新时代中国特色社会主义思想主题教育的具体行动。。一个深处黄土高原，一个位于渤海之滨，跨越1000多公里的两地，因东西部协作结下不解之缘。。我们不会忘记——在甘肃脱贫攻坚的关键时期，天津投入财政援助资金42.17亿元，实施协作项目2000余个，助力甘肃全面脱贫，撕掉了“苦瘠甲天下”的历史标签。。我们不会忘记——1996年以来，天津向甘肃投入的财政援助资金累计达79.4亿元。天津在我省实施协作项目4047个，天津食品集团、天士力集团等一大批企业在甘投资达36.2亿元。。我们不会忘记——天津在劳务输转、消费帮扶、教育培训、医疗卫生、人才交流等方面都对我省给予很大帮助，援建703个乡村工厂，为当地群众创造了近5.7万个家门口就业岗位。开展多种渠道的消费帮扶，去年采购甘肃农特产品39.11亿元。。我们不会忘记——开展协作帮扶以来，450多名挂职干部、5300多名专业技术人才千里奔赴、支援甘肃。。“甘南州是天津东西部协作和对口支援帮扶甘肃省的重点市州之一。近年来，天津市及社会各界立足甘南所需，倾天津所能，从项目建设、产业帮扶、教育卫生、人才援助等方面进行全方位支援，为甘南打赢脱贫攻坚战、实现全面小康、推进乡村振兴提供了无私奉献和大爱援助，我们始终铭记在心，一定在新时代新征程上实干苦干、砥砺奋进，全力推动合作事项落地见效，决不辜负天津各级各方面的深情厚谊。”甘南州委书记何谋保说。。天津对于甘肃的帮扶是真情实意、真金白银，覆盖7个市州、34个县区市。受援地区对此有着更加真切的感受。。“庆阳与天津是东西部协作和革命老区重点城市对口合作城市，是‘亲上加亲’的关系。”庆阳市委书记黄泽元说，近年来天津对庆阳的直接财政投入达14.7个亿，帮扶实施各类项目786项，派出干部和各类技术人员2600多人，输转贫困劳动力4000多人，消费扶贫超10亿元。“我们要把感激之情化为实干动力，在拓展和深化上持续加力，建立常态化长效化合作机制，‍‍加快建设津庆产业园，促进两地在各领域的协作，推动庆阳全域加快发展。”黄泽元说。。天水市委副书记、市长王国先说，天津用真情、拿真金、下真功支持天水发展，两地形成了市、县区、街镇、社区、企业“五位一体”的对接全覆盖，实现东西部协作帮扶工作的制度化、常态化和精准化，为天水提供了全方位、宽领域、多层次帮扶。。代表团在津学习考察期间，谈的最多的是对天津的感激，体会最深的是亲如一家的情谊，情感在交流中持续升腾，合作在共商中不断深化。。在甘肃加快传统产业转型升级、培育壮大战略性新兴产业过程中，推进产业数字化、数字产业化尤为重要。。在天津卓朗科技发展有限公司和中电科蓝天科技公司，代表团实地察看了云计算、工业互联网、先进电能源技术体系和产品等。。对于深化东西部协作，王旭表示，下一步要加大产业协作力度，创新人才协作模式，深化社会协作领域，推动天津与平凉产业互补、人员互动、技术互学、思想互通、作风互鉴，推动区域经济协同发展。,考察组一行先后前往庆阳市西峰区解放路街道、西安市高新区丈八街道等11个典型社区，实地了解学习当地党群服务中心建设、智慧社区建设、基层治理水平等方面的情况。在西峰区解放路街道，考察组一行与当地负责人就基层党建引领社区服务体系建设情况进行了深入探讨，在交流座谈会上，相关领导就数字化治理发展情况做了详细介绍，从发展定位、实施措施以及服务保障体系等方面进行了深刻阐述，并现场连线楼院网格员，在线视讯开展入户走访工作，“一屏看全域，一网管全城”的工作理念，让社区管理与服务更为便捷。在西安市碑林区环南路社区，考察组一行与社区书记邓菊梅一起深刻探讨了基层干部要树立的“大服务”理念，即练好本领、守住初心。邓菊梅的先进事迹也让现场观摩组成员肃然起敬，深受感动，倍受鼓舞。。凤仪社区书记李霞动情地说：“有人努力奔跑，用全力以赴的冲刺突破极限；有人砥砺前行，以一日复一日的坚守辛勤耕耘。邓书记的故事催人奋进。我也是一名社区书记，对比邓书记，我还有很多不足。今后我一定要做个实干家，一步一个脚印，一项一项落实，全力以赴，不负组织，不负人民。”。本次外出学习考察，不仅增长了见识，开阔了视野，联系到实际工作，也检视了自身工作差距，并对今后社区发展有了更坚定的信心。积极吸收、借鉴先进社区机制创新方面的经验、先进的工作理念和管理典型经验，重新审视社区发展目标定位，提升单位工作人员的工作能力水平和服务理念认识水平，努力让完善的基本公共服务设施、健全的社区管理机制、不断提升的物业服务、更加智慧的数字平台建设等措施成为社区高质量发展的新引擎，进一步推动社区各项工作发展再上新台阶。（作者：白雪艳 审核：张文欢 编辑：袁晓娟）,政府领导到其他城市考察学习或访问,0.0,True
282,甘肃省,平凉市,习近平在上海考察时强调深入学习贯彻党的十九届四中全会精神提高社会主义现代化国际大都市治理能力和水平,2019-11-04,http://www.xinhuanet.com/politics/leaders/2019-11/03/c_1125187413.htm,习近平在上海考察时强调 深入学习贯彻党的十九届四中全会精神 提高社会主义现代化国际大都市治理能力和水平-新华网。11月2日，中共中央总书记、国家主席、中央军委主席习近平在上海市考察。这是习近平来到杨浦滨江公共空间杨树浦水厂滨江段，同正在这里休闲健身的群众亲切交谈。 新华社记者 谢环驰 摄。新华社上海11月3日电 中共中央总书记、国家主席、中央军委主席习近平近日在上海考察时强调，要深入学习贯彻党的十九届四中全会精神，坚持稳中求进工作总基调，全面贯彻新发展理念，加快改革开放步伐，加快建设现代化经济体系，加大推进三大攻坚战力度，扎实推进长三角一体化发展，妥善应对国内外各种风险挑战，勇挑最重担子、敢啃最难啃的骨头，着力提升城市能级和核心竞争力，不断提高社会主义现代化国际大都市治理能力和治理水平。。11月2日至3日，习近平在中共中央政治局委员、上海市委书记李强和市长应勇陪同下，深入上海杨浦滨江、古北社区，就贯彻落实党的十九届四中全会精神、城市公共空间规划建设、社区治理和服务等进行调研，同基层干部群众亲切交流。。2日下午，习近平来到杨浦区滨江公共空间杨树浦水厂滨江段，结合视频和多媒体演示听取黄浦江两岸核心区45公里公共空间贯通工程基本情况和杨浦滨江公共空间建设情况汇报。近年来，上海市推动黄浦江两岸贯通及滨江岸线转型工作，杨浦滨江逐渐从以工厂仓库为主的生产岸线转型为以公园绿地为主的生活岸线、生态岸线、景观岸线，昔日的工业锈带变成了生活秀带，为上海增添了一道靓丽的风景线。习近平指出，文化是城市的灵魂。城市历史文化遗存是前人智慧的积淀，是城市内涵、品质、特色的重要标志。要妥善处理好保护和发展的关系，注重延续城市历史文脉，像对待“老人”一样尊重和善待城市中的老建筑，保留城市历史文化记忆，让人们记得住历史、记得住乡愁，坚定文化自信，增强家国情怀。。11月2日至3日，中共中央总书记、国家主席、中央军委主席习近平在上海考察。这是2日下午，习近平在杨浦区滨江公共空间杨树浦水厂滨江段，同正在休闲健身的市民亲切交谈。 新华社记者 谢环驰 摄。习近平沿滨江栈桥步行察看黄浦江两岸风貌，了解人文历史和城乡变迁，走进雨水花园实地考察城市环境综合治理和海绵城市建设等情况，并乘车沿途察看渔人码头、杨树浦港旧址等地标景观，对杨浦区科学改造滨江空间、打造群众公共休闲活动场所的做法表示肯定。在参观途中，遇到许多正在休闲健身的市民，习近平同他们亲切交谈。习近平指出，城市是人民的城市，人民城市为人民。无论是城市规划还是城市建设，无论是新城区建设还是老城区改造，都要坚持以人民为中心，聚焦人民群众的需求，合理安排生产、生活、生态空间，走内涵式、集约型、绿色化的高质量发展路子，努力创造宜业、宜居、宜乐、宜游的良好环境，让人民有更多获得感，为人民创造更加幸福的美好生活。。位于浦江岸边的人人屋党群服务站是一个开放式党建服务平台，习近平向服务站工作人员和居民详细询问这里开展基层党建和公共服务情况。一位年近九旬的老党员、老劳模激动地向总书记介绍说，自己是土生土长的上海人，见证了上海从旧中国到新中国、再到新时代的巨大变化，为中国共产党和中国特色社会主义感到无比自豪。习近平鼓励她多向年轻人讲一讲，坚定他们对中国特色社会主义的道路自信、理论自信、制度自信、文化自信。。3日下午，习近平听取了上海市委和市政府工作汇报，对上海各项工作给予肯定。他希望上海认真贯彻落实党中央重大决策部署，持之以恒，再接再厉，奋力创造新时代新奇迹。,为学习借鉴兄弟乡镇在富民产业培育方面先进经验做法，提升全镇蔬菜产业发展层次和水平，积极引导广大贫困群众发展稳定增收产业，全力打好打赢脱贫攻坚战。7月27日，汭丰镇组织各村“三个带头人”、贫困户代表及部分镇村干部共计110多人，赴王村镇、泾明乡考察学习蔬菜产业发展、农村“三变”改革等方面的先进工作经验。。通过参观学习，干部群众对王村镇、泾明乡在富民产业培育方面的先进经验做法和超前思维意识感触颇深，纷纷表示，在今后的工作中将持续对标先进，紧盯短板弱项，深入反思差距和不足，认真学习兄弟乡镇好的工作思路和经验方法，以过硬的措施和扎实的作风推动蔬菜产业发展、农村“三变”改革等各项工作任务落实见效，再上新台阶，为全面打赢脱贫攻坚战役凝聚强大干群合力。,政府领导到其他城市考察学习或访问,0.0,True
282,甘肃省,平凉市,陶卫方带队赴兰州市考察学习国家食品安全示范城市创建工作,2023-11-08,http://scjg.pingliang.gov.cn/gzdt/sjxw/art/2023/art_9e42d185abaf4c0ebe1591e32c989834.html,11月6日至7日，市委常委、市政府副市长陶卫方带队赴兰州市考察学习国家食品安全示范城市创建工作。兰州市政府副市长阮强、杨平分别参加相关活动，兰州市政府副秘书长白万恩及食药安委办主任、市场监管局局长张栋梁一同考察。。学习考察团先后深入甘肃食品商业广场、甘肃世纪正源餐饮管理有限公司、国芳综超东方红广场店、兰州树屏众创城食品产业园、兰州嘻烧食品科技有限公司、兰州麦仕德精酿啤酒公司、兰州甜美香积领晟食品科技有限公司、兰州奇正生态健康品有限公司等示范点位，通过听取介绍、实地参观、阅看资料、问询交流等方式，详细了解创建点位规范提升、“示范引领”项目打造、食品安全综合治理、特色食品产业培育、“两个责任”机制落实、创建氛围营造等方面的成功经验和创新做法。。考察结束后，召开座谈会，交流考察学习成果，研究下一步工作举措。大家一致表示，兰州市作为全省首批国家食品安全示范创建城市，创建工作专业化程度高、规范监管水平高、统筹协调层次高、氛围营造力度大，亮点打造非常务实，创建效果十分明显。将以此次学习考察为契机，坚定信心、自加压力、主动作为，紧密结合自身实际，把学习到的好做法、好经验转化为谋划工作的新思路、新举措，找准找实工作的发力点和突破口，真抓实干、真督实查，进一步提升我市创建工作质量和水平，努力交出首创首成的合格答卷。。市市场监管局主要负责同志和各县（市、区）政府分管领导、市场监管局局长等参加考察。（作者：薛明春 审核：贾明宇 责任编辑：孙斌）,10月26日，固原市人民政府副秘书长徐虎带领考察组来我市考察学习数字政府和智慧城市建设工作。市委常委、市政府副市长郭建辉陪同。。考察组一行参观了数字政府运营指挥中心、市政务服务中心，听取了数字政府建设情况介绍，现场了解了政务大厅的各个功能区建设、单位入驻、事项办理等情况，双方就推动数字政府建设有关做法进行了深入交流。。考察组认为，我市数字政府建设模式新、推进速度快、建设成效明显，在政务服务方面作出了积极探索和实践，对固原市推动数字政府建设工作具有重要的借鉴意义。双方表示，下一步将在推进数字政府建设、开展政务数据汇聚共享、提升数字化治理水平和服务能力等方面加强协作交流，共同推进数字政府建设健康有序发展。（李英）,不属于政府领导到其他城市考察学习的新闻,0.5008440554506153,True
282,甘肃省,平凉市,政务速递固原市来我市考察学习数字政府建设工作,2023-10-26,http://www.gsht.gov.cn/zwdt/JRHT/art/2023/art_95cf9d276ee54564a6317bc8e4b89d97.html,10月26日，固原市人民政府副秘书长徐虎带领考察组来我市考察学习数字政府和智慧城市建设工作。市委常委、市政府副市长郭建辉陪同。。考察组一行参观了数字政府运营指挥中心、市政务服务中心，听取了数字政府建设情况介绍，现场了解了政务大厅的各个功能区建设、单位入驻、事项办理等情况，双方就推动数字政府建设有关做法进行了深入交流。。考察组认为，我市数字政府建设模式新、推进速度快、建设成效明显，在政务服务方面作出了积极探索和实践，对固原市推动数字政府建设工作具有重要的借鉴意义。双方表示，下一步将在推进数字政府建设、开展政务数据汇聚共享、提升数字化治理水平和服务能力等方面加强协作交流，共同推进数字政府建设健康有序发展。（李英）,我县党政考察团赴崇信县、泾川县、崆峒区、平凉工业园区考察学习重点项目和产业链建设等工作。考察团一行围绕产业上下游加快补链、延链、强链，打造特色优势产业集群，提高全县经济效益和核心竞争力的目标，先后深入崇信县、泾川县、崆峒区、平凉工业园区，参观学习了各县区在全产业链建设、果蔬畜牧和工业发展、改善民生等方面的先进经验和做法。。每到一处，县考察团认真听取相关兄弟县区负责人项目建设总体情况介绍，详细了解了项目引进、落地、建设中好的经验和做法。并走进企业、展厅、车间等处，深入了解了各重点项目的投资额度、厂区规划建设、生产经营等情况。考察团成员一路看、一路听、一路思考、一路交流工作措施和经验，通过考察学习大家进一步解放了思想、开阔了视野、激发了干劲，增强了干事创业的信心和决心。。此次考察让考察团成员感受颇深，大家纷纷表示，回去以后要认真学习各地先进的发展思路和超前的规划意识，用好考察成果，全面促进链长制各项任务落地落实，为提升县域经济发展水平、实现高质量发展提供有力支撑。,不属于政府领导到其他城市考察学习的新闻,0.5102582631085445,True
