code,province,city,topic,date,url,content,content.1,label,score,is_match
282,甘肃省,平凉市,团市委召开理论学习中心组学习扩大会议专题传达学习平凉市党政考察团赴河西学习考察总结会精神,2020-09-10,http://tsw.pingliang.gov.cn/tqkd/art/2022/art_dce7b23d2bda4bd0bf707abad381c71a.html,团市委召开理论学习中心组学习（扩大）会议专题传达学习平凉市党政考察团赴河西学习考察总结会精神。9月9日，团市委召开理论学习中心组学习（扩大）会议，专题传达学习平凉市党政考察团赴河西学习考察总结会精神。团市委在家班子成员及全体干部参加会议。。会上，认真传达学习了市委书记郭承录、市委副书记、市长王奋彦讲话精神，以及《赴河西学习考察报告》，并研究了团市委贯彻落实意见。。会议指出，这次学习考察总结会，既是一次学习经验、解放思想的会议，更是一次启迪思路、谋划发展的会议，对于共青团组织进一步开拓思维、优化工作举措、改善工作作风、提振精神状态具有重要意义。。会议强调，要把学习贯彻落实好本次会议精神作为当前一项政治任务，深入开展“大学习”、“大讨论”，以更加昂扬的斗志、务实的作风，推动共青团各项工作取得新的更大的成效。一是要围绕中心大局，对标会议提出的目标要求，找差距、补短板，并对共青团四届三次全委会提出的年度工作思路再梳理、再细化，研究制定更加具体的措施办法，确保高质量完成年度既定的各项目标任务。二是要进一步解放思想，学习借鉴先进地区的发展理念和兄弟市州的经验做法，破除陈旧观念和思维定势，勇于攻坚克难，积极开拓创新，打造出具有平凉特色的共青团工作亮点。三是要进一步改善工作作风，始终秉承“人无我有、人有我优、人优我先”的精神状态和工作热情，把学习会议精神的所思所悟尽快落实到实践中、体现在成效上，充分展现共青团作为党的助手和后备军的担当。。助力就业扶贫 加强对接交流——平凉团市委联系推动珠海市香洲区、格力电器来平开展劳务协作考察交流,团市委召开理论学习中心组学习（扩大）会议专题传达学习平凉市党政考察团赴河西学习考察总结会精神。9月9日，团市委召开理论学习中心组学习（扩大）会议，专题传达学习平凉市党政考察团赴河西学习考察总结会精神。团市委在家班子成员及全体干部参加会议。。会上，认真传达学习了市委书记郭承录、市委副书记、市长王奋彦讲话精神，以及《赴河西学习考察报告》，并研究了团市委贯彻落实意见。。会议指出，这次学习考察总结会，既是一次学习经验、解放思想的会议，更是一次启迪思路、谋划发展的会议，对于共青团组织进一步开拓思维、优化工作举措、改善工作作风、提振精神状态具有重要意义。。会议强调，要把学习贯彻落实好本次会议精神作为当前一项政治任务，深入开展“大学习”、“大讨论”，以更加昂扬的斗志、务实的作风，推动共青团各项工作取得新的更大的成效。一是要围绕中心大局，对标会议提出的目标要求，找差距、补短板，并对共青团四届三次全委会提出的年度工作思路再梳理、再细化，研究制定更加具体的措施办法，确保高质量完成年度既定的各项目标任务。二是要进一步解放思想，学习借鉴先进地区的发展理念和兄弟市州的经验做法，破除陈旧观念和思维定势，勇于攻坚克难，积极开拓创新，打造出具有平凉特色的共青团工作亮点。三是要进一步改善工作作风，始终秉承“人无我有、人有我优、人优我先”的精神状态和工作热情，把学习会议精神的所思所悟尽快落实到实践中、体现在成效上，充分展现共青团作为党的助手和后备军的担当。。助力就业扶贫 加强对接交流——平凉团市委联系推动珠海市香洲区、格力电器来平开展劳务协作考察交流,其他,0.5777275666459315,True
282,甘肃省,平凉市,临夏州考察团考察学习我市民族团结进步创建工作,2021-05-26,http://mzw.pingliang.gov.cn/xwdt/bmdt/art/2022/art_bc848a3138d74f06ac87ae5f0e6b7042.html,5月24日至26日，临夏州副州长屠剑影带领考察团来我市就民族团结进步创建和少数民族流动人口服务管理等工作进行观摩考察。平凉市人民政府副市长张京红陪同考察。。考察团一行先后到庄浪县梯田纪念馆民族团结进步教育基地，庄浪县第五幼儿园民族团结进步示范点、宏达淀粉加工有限公司民族团结进步示范点、庄浪县南城社区党建统领民族团结进步示范点、庄浪韩店镇石桥村民族团结进步示范点，崆峒区新生巷社区、秦陇寺、南河道派出所、十里铺村永顺花园社区、上阳乡小岔村等地，通过听取汇报、实地观摩等方式，详细考察了我市民族团结进步创建和少数民族流动人口服务管理等工作开展情况，共同探讨、学习交流民族团结进步创建工作中的一些做法和经验，签署了《临夏州和平凉市共同做好少数民族流动人口服务管理工作协议书》。同时，在泾川县吴焕先烈士纪念馆开展了党史学习教育。。考察团一致认为，平凉市紧扣“中华民族一家亲，同心共筑中国梦”总目标，以铸牢中华民族共同体意识为主线，把创建工作与党史主题教育、乡村振兴等工作有机结合，着力从宣传教育上营造创建氛围、从社会事业发展上搭建创建平台、从乡村振兴上夯实创建基础、从培育示范典型上打造创建品牌、从强化执法监督上确保创建秩序，不断推进民族团结进步创建工作走深走实，创建工作中的经验做法值得学习和借鉴。考察团表示将继续加强与平凉市民族工作的联系和交流，共同推动新时代民族团结进步事业再上新台阶。。平凉市各地举办民族宗教理论政策专题培训班扎实推进“国好·法大”教育 实践活动走深走实,5月24日至26日，临夏州副州长屠剑影带领考察团来我市就民族团结进步创建和少数民族流动人口服务管理等工作进行观摩考察。平凉市人民政府副市长张京红陪同考察。。考察团一行先后到庄浪县梯田纪念馆民族团结进步教育基地，庄浪县第五幼儿园民族团结进步示范点、宏达淀粉加工有限公司民族团结进步示范点、庄浪县南城社区党建统领民族团结进步示范点、庄浪韩店镇石桥村民族团结进步示范点，崆峒区新生巷社区、秦陇寺、南河道派出所、十里铺村永顺花园社区、上阳乡小岔村等地，通过听取汇报、实地观摩等方式，详细考察了我市民族团结进步创建和少数民族流动人口服务管理等工作开展情况，共同探讨、学习交流民族团结进步创建工作中的一些做法和经验，签署了《临夏州和平凉市共同做好少数民族流动人口服务管理工作协议书》。同时，在泾川县吴焕先烈士纪念馆开展了党史学习教育。。考察团一致认为，平凉市紧扣“中华民族一家亲，同心共筑中国梦”总目标，以铸牢中华民族共同体意识为主线，把创建工作与党史主题教育、乡村振兴等工作有机结合，着力从宣传教育上营造创建氛围、从社会事业发展上搭建创建平台、从乡村振兴上夯实创建基础、从培育示范典型上打造创建品牌、从强化执法监督上确保创建秩序，不断推进民族团结进步创建工作走深走实，创建工作中的经验做法值得学习和借鉴。考察团表示将继续加强与平凉市民族工作的联系和交流，共同推动新时代民族团结进步事业再上新台阶。。平凉市各地举办民族宗教理论政策专题培训班扎实推进“国好·法大”教育 实践活动走深走实,政府领导到其他城市考察学习或访问,0.0,True
282,甘肃省,平凉市,市住建局组织学习平凉市党政考察团赴河西学习考察总结会议精神,2020-09-11,http://zjj.pingliang.gov.cn/xwzx/gzdt/art/2022/art_770850f465734b4682613b3bf2b0813c.html,9月10日，市住建局召开党组理论中心组学习（扩大）会，专题传达学习平凉市党政考察团赴河西学习考察总结会议精神。市直住建系统全体县级干部、局属单位主要负责同志及机关全体干部参加会议。局党组书记、局长岳东生主持会议并讲话。。岳东生强调，市住建局全体干部要对照市委书记郭承录同志在河西学习考察总结会上的讲话精神，进一步把思想和行动统一到市委要求上来、把工作重心聚焦到全市发展大局上来、把全部心思用到改革创新抓落实上来，坚定信心、鼓足干劲，全面落实市委四届四次全会的战略部署，牢固树立大开发、大建设、大经营、大管理的理念，认真学习借鉴河西五市好的经验做法，全力抓好城市经营建设管理各项工作。一是认真谋划推进重大项目建设。加快推进泾河干流综合治理、天门塬综合开发、城市黑臭水体示范城市、西城区集中供热等重点项目。围绕功能完善、生态治理，认真谋划城市开发建设重大项目和基础设施补短板项目，着力打造旅游城市、生态宜居城市，促进城市建设提档升级。二是全力做好棚户区改造工作。加快棚改土地腾退，做好中心城区棚改未出让土地地块设计，力促尽早竞拍出让，实现棚改良性运转。加强协调配合，推动征拆清零等各项任务落实。全力加快老旧住宅楼棚户区改造、老旧小区改造和老旧住宅楼加装电梯工作进度，确保全面完成年度任务。三是巩固农村危房改造成果。加快符合政策的新增危房改造进度，强化农村住房动态监管，进一步提升群众幸福感和满意度。四是加强城市经营运筹。加快城市建设用地基础设施配套，提升土地升值空间。完善公共设施，改善城市生态环境，加大土地出让力度，为城市建设发展筹集更多资金。清理整顿、整合利用停车场、户外广告、供水、供热、供气、商砼等各种资源，加快特许经营步伐，规范特许经营管理，加强资本化、市场化运作，实现城市经营效益。五是提升城市精细化管理水平。强化工作统筹，使城市规划建设管理融为一体，大力开展建设行业、市政设施、市容市貌、违法建设、城市执法整治提升行动，多管齐下、综合施治，通过管理提升城市建设水平，彰显城市魅力。六是提高工作落实能力和效率。进一步解放思想、创新理念，不断加强自身学习，切实改进弱项短板，做到干部能力再提升，担当意识再锤炼、工作效率再提速，从政策中、从法律中找支持，确保城市经营建设管理各项工作高标准落实见效。。把全部心思用到改革创新抓落实上来，坚定信心、鼓足干劲，全面落实市委四届四次全会的战略部署，牢固树立大开发、大建设、大经营、大管理的理念，认真学习借鉴河西五市好的经验做法，全力抓好城市经营建设管理各项工作。。加快推进泾河干流综合治理、天门塬综合开发、城市黑臭水体示范城市、西城区集中供热等重点项目。围绕功能完善、生态治理，认真谋划城市开发建设重大项目和基础设施补短板项目，着力打造旅游城市、生态宜居城市，促进城市建设提档升级。。加快棚改土地腾退，做好中心城区棚改未出让土地地块设计，力促尽早竞拍出让，实现棚改良性运转。加强协调配合，推动征拆清零等各项任务落实。全力加快老旧住宅楼棚户区改造、老旧小区改造和老旧住宅楼加装电梯工作进度，确保全面完成年度任务。。加快符合政策的新增危房改造进度，强化农村住房动态监管，进一步提升群众幸福感和满意度。。加快城市建设用地基础设施配套，提升土地升值空间。完善公共设施，改善城市生态环境，加大土地出让力度，为城市建设发展筹集更多资金。清理整顿、整合利用停车场、户外广告、供水、供热、供气、商砼等各种资源，加快特许经营步伐，规范特许经营管理，加强资本化、市场化运作，,9月10日，市住建局召开党组理论中心组学习（扩大）会，专题传达学习平凉市党政考察团赴河西学习考察总结会议精神。市直住建系统全体县级干部、局属单位主要负责同志及机关全体干部参加会议。局党组书记、局长岳东生主持会议并讲话。。岳东生强调，市住建局全体干部要对照市委书记郭承录同志在河西学习考察总结会上的讲话精神，进一步把思想和行动统一到市委要求上来、把工作重心聚焦到全市发展大局上来、把全部心思用到改革创新抓落实上来，坚定信心、鼓足干劲，全面落实市委四届四次全会的战略部署，牢固树立大开发、大建设、大经营、大管理的理念，认真学习借鉴河西五市好的经验做法，全力抓好城市经营建设管理各项工作。一是认真谋划推进重大项目建设。加快推进泾河干流综合治理、天门塬综合开发、城市黑臭水体示范城市、西城区集中供热等重点项目。围绕功能完善、生态治理，认真谋划城市开发建设重大项目和基础设施补短板项目，着力打造旅游城市、生态宜居城市，促进城市建设提档升级。二是全力做好棚户区改造工作。加快棚改土地腾退，做好中心城区棚改未出让土地地块设计，力促尽早竞拍出让，实现棚改良性运转。加强协调配合，推动征拆清零等各项任务落实。全力加快老旧住宅楼棚户区改造、老旧小区改造和老旧住宅楼加装电梯工作进度，确保全面完成年度任务。三是巩固农村危房改造成果。加快符合政策的新增危房改造进度，强化农村住房动态监管，进一步提升群众幸福感和满意度。四是加强城市经营运筹。加快城市建设用地基础设施配套，提升土地升值空间。完善公共设施，改善城市生态环境，加大土地出让力度，为城市建设发展筹集更多资金。清理整顿、整合利用停车场、户外广告、供水、供热、供气、商砼等各种资源，加快特许经营步伐，规范特许经营管理，加强资本化、市场化运作，实现城市经营效益。五是提升城市精细化管理水平。强化工作统筹，使城市规划建设管理融为一体，大力开展建设行业、市政设施、市容市貌、违法建设、城市执法整治提升行动，多管齐下、综合施治，通过管理提升城市建设水平，彰显城市魅力。六是提高工作落实能力和效率。进一步解放思想、创新理念，不断加强自身学习，切实改进弱项短板，做到干部能力再提升，担当意识再锤炼、工作效率再提速，从政策中、从法律中找支持，确保城市经营建设管理各项工作高标准落实见效。。把全部心思用到改革创新抓落实上来，坚定信心、鼓足干劲，全面落实市委四届四次全会的战略部署，牢固树立大开发、大建设、大经营、大管理的理念，认真学习借鉴河西五市好的经验做法，全力抓好城市经营建设管理各项工作。。加快推进泾河干流综合治理、天门塬综合开发、城市黑臭水体示范城市、西城区集中供热等重点项目。围绕功能完善、生态治理，认真谋划城市开发建设重大项目和基础设施补短板项目，着力打造旅游城市、生态宜居城市，促进城市建设提档升级。。加快棚改土地腾退，做好中心城区棚改未出让土地地块设计，力促尽早竞拍出让，实现棚改良性运转。加强协调配合，推动征拆清零等各项任务落实。全力加快老旧住宅楼棚户区改造、老旧小区改造和老旧住宅楼加装电梯工作进度，确保全面完成年度任务。。加快符合政策的新增危房改造进度，强化农村住房动态监管，进一步提升群众幸福感和满意度。。加快城市建设用地基础设施配套，提升土地升值空间。完善公共设施，改善城市生态环境，加大土地出让力度，为城市建设发展筹集更多资金。清理整顿、整合利用停车场、户外广告、供水、供热、供气、商砼等各种资源，加快特许经营步伐，规范特许经营管理，加强资本化、市场化运作，,其他,0.5703460675586548,True
282,甘肃省,平凉市,平凉市政企考察团赴兰石重装华天科技考察学习,2022-02-17,http://zsj.pingliang.gov.cn/zhyw/art/2022/art_1aee5736507242b99f74b806627b23ad.html,2月12日至13日，市委常委、统战部部长、市政协党组副书记辛少波、市政府副市长齐鹏带队赴兰石重型装备股份有限公司、天水华天科技股份有限公司考察学习。市发改委、市科技局、市工信局、市政府国资委、市招商局、市政府金融办、市工商联、市侨联、市产投集团负责同志及甘肃红峰机械有限责任公司、甘肃虹光电子有限责任公司相关负责同志参加考察学习。。考察团一行先后深入兰石重装、华天科技生产一线和企业展馆，详细了解企业发展历程、生产经营、产品营销、技术研发等情况。并召开座谈会，就企业在完善法人治理结构、建立现代企业制度、找准市场定位、制定发展战略、谋划实施项目、创新驱动战略、人才队伍建设、企业文化建设等方面的先进经验进行深入交流。在煤化工装备制造、产品周边配套等方面达成了初步合作意向。。考察结束后，辛少波主持召开了座谈交流会。辛少波指出，通过这次考察，大家的思想都有了触动，达到了开阔视野、增长见识、启迪思维、转变观念的目的。辛少波要求，红峰公司、虹光公司要认真吸收总结考察经验，以推动企业上市为目标，理清发展方向，明晰发展战略、完善管理制度、加强创新研发、拓展产业链条；要主动加强与上下游企业的联合，尽快融入全市装备制造产业链。各部门要树牢服务意识，在政策扶持、项目建设、科技研发等方面做好服务。相信在企业主动作为、实干快干的努力下，在各部门的支持下，企业一定能够尽快摆脱困境，走上高质量发展道路。,月21日，庄浪县科技局韩俊芳局长一行4人对静宁县省级农业科技示范园创建及苹果等产业进行考察学习，县科技局负责同志陪同。。考察组参观了界石铺红军长征纪念馆，通过瞻仰历史文物、观看照片、聆听革命故事，重温了党的风雨历程，回顾了艰苦卓绝的峥嵘岁月，缅怀了毛泽东等老一辈无产阶级革命家的丰功伟绩，真切感受到革命先烈们在苦与乐的抉择、血与火的洗礼、生与死的考验中展现出的为了革命事业而顽强不屈的斗争精神。。随后考察组深入德美地缘现代农业集团有限公司、果树研究所，通过实地考察，听取汇报的方式，详细了解了我县省级农业科技示范园区及苹果产业发展情况。庄浪县对我县在农业科技示范园区建设、农业产业发展、科技成果转移转化等方面所做的工作给予了充分的肯定，并表示要学习借鉴静宁先进经验，改变本县农业发展缓慢、发展模式单一等问题。韩俊芳局长对我县企业创新发展给予高度评价，希望两县科技局进一步加强联系沟通，围绕共性技术需求加强深入合作。双方还就科技支持政策、创新平台建设、技术转移转化等进行了深入探讨和交流。,其他,0.5387996345602867,True
282,甘肃省,平凉市,我市组团外出考察学习建议提案办理工作,2018-09-28,http://zx.pingliang.gov.cn/zxdt/art/2022/art_f4f3da08e70a40afb27fb6d7316d771e.html,近日，市人大、市政府、市政协组成考察组，外出学习人大代表建议和政协委员提案办理工作。。考察组一行先后赴陇南市、兰州市和省财政厅、交通厅、扶贫办，通过实地查看、翻阅资料、座谈交流等方式，详细了解了建议提案办理工作制度机制建设以及交办催办、联合承办、答复反馈、监督考核等方面创新性的经验和做法。。这次考察学习活动既交流了工作经验，深化了对外联系，也从纵横两方面找到了自身差距和问题，对推动我市建议提案办理工作具有重要意义。特别是陇南市建立的建议提案办理工作“两纳入一评议”督考体系和量化考核办法、兰州市建议提案答复分管副市长审签和市人大市政府市政协共同筛选重点提案制度、省财政厅规范化办理工作台账、省交通厅“三个结合”办理机制、省扶贫办“四会”督办方式等等，都为我市加强和改进建议提案办理工作提供了遵循和参考。,10月25日至29日，平凉市民宗委随市委统战部赴河西武威、金昌、张掖等三市开展了为期五天的考察学习，此次活动由市委统战部分管日常工作的副部长杜晓荣带队，市委统战部部分班子成员和干部，市民宗委主任张天岩、副主任吕国民、高亮及有关业务科室负责同志参加。。此次考察学习得到了武威、金昌、张掖三市统战部高度重视和精心安排，考察点涉及多个方面，内容丰富，极具代表性。。考察了天祝县全国民族团结进步示范县创建馆、藜麦科技扶贫产业园、古浪县八步沙“六老汉”治沙纪念馆、民族团结进步示范县创建馆、武威丝路寒旱农业示范基地、凉州会盟纪念馆、伊利绿色生产及智能制造示范应用项目、武威市博物馆等8个考察点。。考察了金昌宇恒镍网股份有限公司、金川区龙泉景观带民族团结进步文化长廊、金川公司科技馆、甘肃莫高阳光环保股份有限责任公司、永昌县北海子民族团结主题公园等5个考察点。。考察了海升现代智能温室工业化栽培生态示范项目、民乐现代丝路田园综合体项目、滨河酒文化产业园、张掖智能制造产业园、新墩镇双塔村乡村振兴示范点、丹霞生态康养谷暨城乡融合发展试验区、肃南裕固族自治县康白集镇等7个考察点。。在学习考察期间，大家谦虚学习，用心思考，切实感受到“小康路上一个民族也不能少”这一真理，明确了民族团结进步创建工作的重要性和紧迫性，同时也更加深刻地理解了自己肩负的使命，看到了差距，明确了努力方向，坚定了信心，增强了做好平凉市民族团结创建工作，打赢脱贫攻坚战的责任感和使命感。。大家一致表示，将以此次考察学习为契机，进一步深入学习贯彻落实中央和省委文件精神、中央第七次西藏工作座谈会、第三次中央新疆工作座谈会精神，学习借鉴河西地区在促进民族团结进步创建及打赢脱贫攻坚工作中的先进经验和典型做法，立足实际谋发展，把先进经验、做法和亮点运用到实际工作中，进一步建立完善民族团结进步创建的长效机制，为打造平凉市民族团结进步样板贡献力量。,政府领导到其他城市考察学习或访问,0.0,True
