code,province,city,topic,date,url,content,content.1,label,score,is_match
222,海南省,海口市,海南省考察团在广东自由贸易试验区考察学习,2018-04-20,http://www.haikou.gov.cn/zfdt/hkyw/201804/t322404.shtml,本报4月19日讯 连日来，省委组织11个考察团分赴全国11个自贸区考察学习。4月17日至19日，第一团赴广州南沙新区、珠海横琴、深圳前海蛇口考察学习中国（广东）自由贸易试验区建设以及广州市和珠海、深圳两个经济特区的发展经验。期间，两省在广州召开座谈会，就进一步学习贯彻习近平总书记重要讲话精神，深化两省合作，共商改革发展进行交流。广东省委书记李希，海南省委书记刘赐贵出席座谈会并参加有关活动。广东省委副书记、广州市委书记任学锋介绍情况并全程参加考察。。李希代表广东省委、省政府对海南长期以来给予广东经济社会发展的大力支持表示感谢。他指出，习近平总书记出席庆祝海南建省办经济特区30周年大会并发表重要讲话，充分肯定经济特区建设的历史功绩，对新时代深化改革、扩大开放提出明确要求。总书记对海南的重要指示要求对广东同样具有重大的历史意义和现实意义，海南改革发展的历史性机遇也是广东的重大机遇，两省深化交流合作站在了新的历史起点上、蕴含着前所未有的巨大潜力。我们要认真贯彻落实好总书记的重要讲话精神，自觉扛起沉甸甸的历史责任，把深化改革扩大开放的工作扎扎实实抓好。。李希说，海南深入贯彻习近平新时代中国特色社会主义思想，推动经济社会发展取得了令人瞩目的成绩，广东要认真学习借鉴海南的好经验好做法。当前，广东正深入学习贯彻习近平新时代中国特色社会主义思想和党的十九大精神，认真落实总书记参加全国两会广东代表团审议时重要讲话精神。希望两省在以习近平同志为核心的党中央坚强领导下，进一步深化各领域交流合作，在更高水平上实现互促共进。一是在改革创新上互学互鉴，加强在自贸区建设等方面的交流合作。二是充分发挥博鳌亚洲论坛、广交会等重大平台作用，加强粤港澳大湾区建设的对接合作，携手提升对外开放水平。三是深化重点领域和重点产业交流合作，共同做大做强特色优势产业。四是建立更加紧密的交流合作机制，更好促进两省互利共赢发展。。刘赐贵在座谈会上对广东省委、省政府多年来给予海南工作的大力支持和对此次考察的周到安排表示衷心感谢。他说，在新时代支持海南全面深化改革开放，是习近平总书记亲自谋划、亲自部署、亲自推动的重大国家战略。特别是明确支持海南在全岛建设自由贸易试验区，逐步探索、稳步推进中国特色自由贸易港建设，为海南改革开放发展指明了方向、注入了强大动力，对新时代经济特区提出了明确要求，也向世界宣示了我国继续深化改革开放的坚定决心和鲜明态度。这些都饱含着习总书记和党中央对经济特区、对海南的厚爱与期望，我们深感振奋、备受鼓舞，同时也深感责任重大。海南愿与广东一道，以舍我其谁的使命感和只争朝夕的紧迫感，进一步发扬特区精神，加快推进自由贸易试验区建设，更好担当起新时代全面深化改革开放的新使命。。刘赐贵表示，广东是改革开放的排头兵、先行地、实验区，为我国深化改革开放提供了很多宝贵经验。考察团此行将认真学习、汲取广东在自贸区建设等各方面的好经验好做法，下一步还将组成“小分队”，就专项问题学习请教，真正学深学透。。衷心希望广东在海南新一轮改革开放中给予更多的指导和支持，同时继续深化两省重点领域合作，实现互利共赢。。在两天半的时间里，考察团马不停蹄考察了广州、珠海、深圳三地18个点位。同时，利用晚上时间召开工作座谈会，交流学习体会，研讨推进自由贸易试验区建设的具体举措。一个个特色鲜明的项目、一项项改革创新的举措、一片片蓬勃发展的新区，让考察团成员们深受触动、获益匪浅。,本报4月19日讯 连日来，省委组织11个考察团分赴全国11个自贸区考察学习。4月17日至19日，第一团赴广州南沙新区、珠海横琴、深圳前海蛇口考察学习中国（广东）自由贸易试验区建设以及广州市和珠海、深圳两个经济特区的发展经验。期间，两省在广州召开座谈会，就进一步学习贯彻习近平总书记重要讲话精神，深化两省合作，共商改革发展进行交流。广东省委书记李希，海南省委书记刘赐贵出席座谈会并参加有关活动。广东省委副书记、广州市委书记任学锋介绍情况并全程参加考察。。李希代表广东省委、省政府对海南长期以来给予广东经济社会发展的大力支持表示感谢。他指出，习近平总书记出席庆祝海南建省办经济特区30周年大会并发表重要讲话，充分肯定经济特区建设的历史功绩，对新时代深化改革、扩大开放提出明确要求。总书记对海南的重要指示要求对广东同样具有重大的历史意义和现实意义，海南改革发展的历史性机遇也是广东的重大机遇，两省深化交流合作站在了新的历史起点上、蕴含着前所未有的巨大潜力。我们要认真贯彻落实好总书记的重要讲话精神，自觉扛起沉甸甸的历史责任，把深化改革扩大开放的工作扎扎实实抓好。。李希说，海南深入贯彻习近平新时代中国特色社会主义思想，推动经济社会发展取得了令人瞩目的成绩，广东要认真学习借鉴海南的好经验好做法。当前，广东正深入学习贯彻习近平新时代中国特色社会主义思想和党的十九大精神，认真落实总书记参加全国两会广东代表团审议时重要讲话精神。希望两省在以习近平同志为核心的党中央坚强领导下，进一步深化各领域交流合作，在更高水平上实现互促共进。一是在改革创新上互学互鉴，加强在自贸区建设等方面的交流合作。二是充分发挥博鳌亚洲论坛、广交会等重大平台作用，加强粤港澳大湾区建设的对接合作，携手提升对外开放水平。三是深化重点领域和重点产业交流合作，共同做大做强特色优势产业。四是建立更加紧密的交流合作机制，更好促进两省互利共赢发展。。刘赐贵在座谈会上对广东省委、省政府多年来给予海南工作的大力支持和对此次考察的周到安排表示衷心感谢。他说，在新时代支持海南全面深化改革开放，是习近平总书记亲自谋划、亲自部署、亲自推动的重大国家战略。特别是明确支持海南在全岛建设自由贸易试验区，逐步探索、稳步推进中国特色自由贸易港建设，为海南改革开放发展指明了方向、注入了强大动力，对新时代经济特区提出了明确要求，也向世界宣示了我国继续深化改革开放的坚定决心和鲜明态度。这些都饱含着习总书记和党中央对经济特区、对海南的厚爱与期望，我们深感振奋、备受鼓舞，同时也深感责任重大。海南愿与广东一道，以舍我其谁的使命感和只争朝夕的紧迫感，进一步发扬特区精神，加快推进自由贸易试验区建设，更好担当起新时代全面深化改革开放的新使命。。刘赐贵表示，广东是改革开放的排头兵、先行地、实验区，为我国深化改革开放提供了很多宝贵经验。考察团此行将认真学习、汲取广东在自贸区建设等各方面的好经验好做法，下一步还将组成“小分队”，就专项问题学习请教，真正学深学透。。衷心希望广东在海南新一轮改革开放中给予更多的指导和支持，同时继续深化两省重点领域合作，实现互利共赢。。在两天半的时间里，考察团马不停蹄考察了广州、珠海、深圳三地18个点位。同时，利用晚上时间召开工作座谈会，交流学习体会，研讨推进自由贸易试验区建设的具体举措。一个个特色鲜明的项目、一项项改革创新的举措、一片片蓬勃发展的新区，让考察团成员们深受触动、获益匪浅。,政府领导到其他城市考察学习或访问,0.0,True
222,海南省,海口市,年月,2022-01-25,http://www.haikou.gov.cn/sq/hkdsj/2021hkdsj/202201/t415640.shtml,1日 市委副书记、市长丁晖深到客运车站、项目工地、农贸市场等地，看望慰问节日期间坚守一线的工作人员，调研检查国庆期间安全生产、重点项目建设、“菜篮子”保供惠民等重点工作。。2日 市政府党组书记、市长丁晖主持召开市政府党组（扩大）会议，研究调度协调重点项目建设，谋划明年项目策划储备工作。。3日 市委副书记、市长丁晖到龙华区调研重点项目建设并主持召开现场办公会议，就抓项目、扩投资等工作进行调度、协调、部署。。4日 市委副书记、市长丁晖调研江东新区、美兰区、桂林洋经济开发区重点项目建设，他强调，要全力以赴落实服务保障、只争朝夕加快推进，确保高质量高标准完成全年投资目标任务，系统谋划好明年项目建设计划。。同日 市委副书记、市长丁晖调研高新区、琼山区重点项目建设及固定资产投资工作，他指出，千方百计抓重点破堵点解难点，促进项目建设提速提质提效。。6日 市委副书记、市长丁晖调研综保区、秀英区重点项目建设工作，他指出，对标海南自贸港建设阶段性目标任务，把抓项目、稳投资作为经济工作重要着力点，以项目建设实效展现担当，推动发展。。7日 市委副书记、市长丁晖主持召开全市防御热带低压专题部署会议，按照省委、省政府部署及市委要求，研究部署防御应对热带低压工作。。同日 市委副书记、市长丁晖主持召开市政府专题会议，对抓项目扩投资工作再研究再调度再部署。。8日 受台风“狮子山”影响，琼州海峡从10月6日20时起全线停航。省委常委、市委书记何忠友主持召开专题会议，研究部署进一步做好台风防御期间琼州海峡停航服务保障等工作。。9日 省委常委、市委书记何忠友主持召开海口市建设项目推进会，研究贯彻落实省委、省政府的部署要求，抓紧抓实抓好我市投资和项目建设工作，坚决完成全年目标任务。。10日 省委常委、市委书记何忠友主持召开海口市生态环保工作推进会，贯彻落实习近平生态文明思想，研究部署抓好中央生态环境保护督察及国家自然资源督察海洋专项督察反馈问题整改等重点工作。。11日 市委理论学习中心组（扩大）学习会召开，学习贯彻习近平总书记“七一”重要讲话精神，就认真学习领会习近平总书记关于防范化解重大风险重要论述，坚持底线思维，强化忧患意识，发扬斗争精神，把防范化解重大风险工作做细做实做好进行专题学习研讨。省委常委、市委书记何忠友主持会议并讲话。。同日 市人大常委会党组理论学习中心组（扩大）学习会召开，专题学习《中华人民共和国海南自由贸易港法》。市人大常委会主任韩英伟出席会议。。12日 省委常委、市委书记何忠友主持召开全市防御第18号台风“圆规”部署视频会议，就做好我市台风防御各项工作、全力保障人民群众生命财产安全进行安排部署。。13日 省委常委、市委书记何忠友到美舍河东风桥段、海甸二东路、恒大美丽沙、龙昆北等地检查指导台风“圆规”防御工作，他要求，把各项防御措施落细落实落地，确保城乡运行有序和群众生命财产安全。。同日 我市以挂牌方式出让江东新区2宗国有建设用地使用权，由海口江东新居第贰置业有限公司分别以成交价7488万元、13226万元竞得。该项目总面积51714.68平方米，将建设江东新区安置房项目。。14日 省委常委、市委书记何忠友到重点项目建设一线，就贯彻落实省委、省政府的部署要求，抓好项目建设、促进有效投资，确保完成全市全年目标任务进行调研。。15日 市区、镇两级人大代表换届选举投票日，全市158万选民在488个区级选区、704个镇级选区依法行使民主权利，将选举产生新一届区人大代表1046名、镇人大代表1635名。。21日 海口市龙华区金贸街道文华农贸市场商圈党组织暨党群服务驿站揭牌。 是全省首个农贸市场商圈党组织。,1日 市委副书记、市长丁晖深到客运车站、项目工地、农贸市场等地，看望慰问节日期间坚守一线的工作人员，调研检查国庆期间安全生产、重点项目建设、“菜篮子”保供惠民等重点工作。。2日 市政府党组书记、市长丁晖主持召开市政府党组（扩大）会议，研究调度协调重点项目建设，谋划明年项目策划储备工作。。3日 市委副书记、市长丁晖到龙华区调研重点项目建设并主持召开现场办公会议，就抓项目、扩投资等工作进行调度、协调、部署。。4日 市委副书记、市长丁晖调研江东新区、美兰区、桂林洋经济开发区重点项目建设，他强调，要全力以赴落实服务保障、只争朝夕加快推进，确保高质量高标准完成全年投资目标任务，系统谋划好明年项目建设计划。。同日 市委副书记、市长丁晖调研高新区、琼山区重点项目建设及固定资产投资工作，他指出，千方百计抓重点破堵点解难点，促进项目建设提速提质提效。。6日 市委副书记、市长丁晖调研综保区、秀英区重点项目建设工作，他指出，对标海南自贸港建设阶段性目标任务，把抓项目、稳投资作为经济工作重要着力点，以项目建设实效展现担当，推动发展。。7日 市委副书记、市长丁晖主持召开全市防御热带低压专题部署会议，按照省委、省政府部署及市委要求，研究部署防御应对热带低压工作。。同日 市委副书记、市长丁晖主持召开市政府专题会议，对抓项目扩投资工作再研究再调度再部署。。8日 受台风“狮子山”影响，琼州海峡从10月6日20时起全线停航。省委常委、市委书记何忠友主持召开专题会议，研究部署进一步做好台风防御期间琼州海峡停航服务保障等工作。。9日 省委常委、市委书记何忠友主持召开海口市建设项目推进会，研究贯彻落实省委、省政府的部署要求，抓紧抓实抓好我市投资和项目建设工作，坚决完成全年目标任务。。10日 省委常委、市委书记何忠友主持召开海口市生态环保工作推进会，贯彻落实习近平生态文明思想，研究部署抓好中央生态环境保护督察及国家自然资源督察海洋专项督察反馈问题整改等重点工作。。11日 市委理论学习中心组（扩大）学习会召开，学习贯彻习近平总书记“七一”重要讲话精神，就认真学习领会习近平总书记关于防范化解重大风险重要论述，坚持底线思维，强化忧患意识，发扬斗争精神，把防范化解重大风险工作做细做实做好进行专题学习研讨。省委常委、市委书记何忠友主持会议并讲话。。同日 市人大常委会党组理论学习中心组（扩大）学习会召开，专题学习《中华人民共和国海南自由贸易港法》。市人大常委会主任韩英伟出席会议。。12日 省委常委、市委书记何忠友主持召开全市防御第18号台风“圆规”部署视频会议，就做好我市台风防御各项工作、全力保障人民群众生命财产安全进行安排部署。。13日 省委常委、市委书记何忠友到美舍河东风桥段、海甸二东路、恒大美丽沙、龙昆北等地检查指导台风“圆规”防御工作，他要求，把各项防御措施落细落实落地，确保城乡运行有序和群众生命财产安全。。同日 我市以挂牌方式出让江东新区2宗国有建设用地使用权，由海口江东新居第贰置业有限公司分别以成交价7488万元、13226万元竞得。该项目总面积51714.68平方米，将建设江东新区安置房项目。。14日 省委常委、市委书记何忠友到重点项目建设一线，就贯彻落实省委、省政府的部署要求，抓好项目建设、促进有效投资，确保完成全市全年目标任务进行调研。。15日 市区、镇两级人大代表换届选举投票日，全市158万选民在488个区级选区、704个镇级选区依法行使民主权利，将选举产生新一届区人大代表1046名、镇人大代表1635名。。21日 海口市龙华区金贸街道文华农贸市场商圈党组织暨党群服务驿站揭牌。 是全省首个农贸市场商圈党组织。,政府领导到其他城市考察学习或访问,0.5495050588054338,True
222,海南省,海口市,美兰考察学习美丽乡村建设,2017-11-13,http://www.haikou.gov.cn/zfdt/hkyw/201711/t320617.shtml,本报11月12日讯 12日上午，副市长、美兰区委书记龙卫东率领区有关领导和部门主要负责人，各镇、村干部等100多人赴秀英区永兴镇考察学习电商扶贫、美丽乡村建设等工作，学习借鉴兄弟区好经验、好做法，推进扶贫攻坚工作及乡村振兴战略更好开展。。在永兴电商扶贫中心，考察团成员详细了解了该平台特色农产品生产、包装及销售情况，认真学习“企业+合作社+贫困户+互联网”的产业扶贫模式。在冯塘绿园，考察团成员实地察看了产业扶贫、民宿建设等情况，仔细了解美丽乡村规划建设、开发以及运营管理模式等情况。。考察团要求，美兰区各级领导干部要牢固树立“采他山之石以攻玉，纳百家之长以厚己”的思想，虚心学习借鉴兄弟单位的好经验好做法。要结合考察学习，认真贯彻落实党的十九大精神，大力推进乡村振兴战略，创新形式开展精准扶贫工作，坚决打赢打好扶贫攻坚战。要按照“三个三”的要求做好美丽乡村建设，即完善三张图：村庄规划图、村庄风貌管控图、单体建筑式样图；强化三项基础设施建设：强化垃圾收集与处理、强化农厕防渗漏改造、强化生活污水处理；抓好三项主要工作：做好村庄风貌管控、大力发展电商、鼓励具备条件的村庄发展民宿。要充分发挥村干部能人带头作用，积极构建村民和谐团结局面，激发群众内生动力，加快培育适宜的特色产业，以精准扶贫工作提升美丽乡村指数。,本报11月12日讯 12日上午，副市长、美兰区委书记龙卫东率领区有关领导和部门主要负责人，各镇、村干部等100多人赴秀英区永兴镇考察学习电商扶贫、美丽乡村建设等工作，学习借鉴兄弟区好经验、好做法，推进扶贫攻坚工作及乡村振兴战略更好开展。。在永兴电商扶贫中心，考察团成员详细了解了该平台特色农产品生产、包装及销售情况，认真学习“企业+合作社+贫困户+互联网”的产业扶贫模式。在冯塘绿园，考察团成员实地察看了产业扶贫、民宿建设等情况，仔细了解美丽乡村规划建设、开发以及运营管理模式等情况。。考察团要求，美兰区各级领导干部要牢固树立“采他山之石以攻玉，纳百家之长以厚己”的思想，虚心学习借鉴兄弟单位的好经验好做法。要结合考察学习，认真贯彻落实党的十九大精神，大力推进乡村振兴战略，创新形式开展精准扶贫工作，坚决打赢打好扶贫攻坚战。要按照“三个三”的要求做好美丽乡村建设，即完善三张图：村庄规划图、村庄风貌管控图、单体建筑式样图；强化三项基础设施建设：强化垃圾收集与处理、强化农厕防渗漏改造、强化生活污水处理；抓好三项主要工作：做好村庄风貌管控、大力发展电商、鼓励具备条件的村庄发展民宿。要充分发挥村干部能人带头作用，积极构建村民和谐团结局面，激发群众内生动力，加快培育适宜的特色产业，以精准扶贫工作提升美丽乡村指数。,政府领导到其他城市考察学习或访问,0.0,True
222,海南省,海口市,深入学习京津冀三地经验推进海口高质量发展,2019-06-01,http://www.haikou.gov.cn/zfdt/ldhd/201906/t351521.shtml,本报5月31日讯 今天上午，市委副书记、市长丁晖主持召开十六届市政府第66次常务会议，传达中央、省有关会议和文件精神，深入学习海南省党政代表团在北京、天津、河北雄安三地的学习考察精神，研究部署近期重点工作。。丁晖指出，各区各部门要深入学习此次海南省党政代表团在北京、天津、河北雄安三地的学习考察精神，借鉴三地高质量发展的大思路、大手笔和新成就、新气象，进一步增强使命感、责任感、紧迫感，用实际行动体现“四个意识”“四个自信”“两个维护”。。丁晖要求，当前要重点抓好经济工作，做到底数清、任务明、措施实，建立每周经济分析制度，查找问题、分析原因、挖掘潜力，层层压实责任。要狠抓项目建设，紧盯项目开工，做好要素保障，确保集中开工和签约项目按序时推进。要提升招商工作水平，学习外地大手笔大力度招商的经验做法，对好项目要以如获至宝的态度全力做好服务保障。。要切实优化营商环境，持续推进“放管服”改革，健全制度创新机制和项目库，重点在商事制度、行政审批、政策兑现等领域解决好痛点堵点问题。要大力推进征地拆迁、闲置土地清理等工作，为江东新区、临空经济区等重点片区和符合海口产业发展方向的项目提供要素保障。要做好汛期防风防汛工作，强化安全生产，严防安全事故发生。。会议讨论审议并原则通过了《制度创新成果考核评估办法》《海口市优化营商环境工作联席会议制度》《海口市政府系统制度创新项目库》等文件。,本报5月31日讯 今天上午，市委副书记、市长丁晖主持召开十六届市政府第66次常务会议，传达中央、省有关会议和文件精神，深入学习海南省党政代表团在北京、天津、河北雄安三地的学习考察精神，研究部署近期重点工作。。丁晖指出，各区各部门要深入学习此次海南省党政代表团在北京、天津、河北雄安三地的学习考察精神，借鉴三地高质量发展的大思路、大手笔和新成就、新气象，进一步增强使命感、责任感、紧迫感，用实际行动体现“四个意识”“四个自信”“两个维护”。。丁晖要求，当前要重点抓好经济工作，做到底数清、任务明、措施实，建立每周经济分析制度，查找问题、分析原因、挖掘潜力，层层压实责任。要狠抓项目建设，紧盯项目开工，做好要素保障，确保集中开工和签约项目按序时推进。要提升招商工作水平，学习外地大手笔大力度招商的经验做法，对好项目要以如获至宝的态度全力做好服务保障。。要切实优化营商环境，持续推进“放管服”改革，健全制度创新机制和项目库，重点在商事制度、行政审批、政策兑现等领域解决好痛点堵点问题。要大力推进征地拆迁、闲置土地清理等工作，为江东新区、临空经济区等重点片区和符合海口产业发展方向的项目提供要素保障。要做好汛期防风防汛工作，强化安全生产，严防安全事故发生。。会议讨论审议并原则通过了《制度创新成果考核评估办法》《海口市优化营商环境工作联席会议制度》《海口市政府系统制度创新项目库》等文件。,其他,0.5357113464293,True
