code,province,city,topic,date,url,content,content.1,label,score,is_match
222,海南省,海口市,王众孚围绕人来做文章加强基层组织建设,2009-09-06,http://www.haikou.gov.cn/zfdt/hkyw/200909/t300594.shtml,昨天上午，市委副书记、市委学习实践活动领导小组副组长陈军，市委常委、组织部长、市委学习实践活动领导小组副组长兼办公室主任陈宏芬陪同以王众孚为组长的中央学习实践活动第二巡回检查组，实地考察检查了琼山区红旗镇委、红旗村党支部第三批学习实践科学发展观活动准备工作情况，并召开座谈会。。红旗镇共有基层党支部21个，党员1017名，其中农村党员690名。该镇镇委从6月初开始就介入调研工作，摸清了参加第三批学习实践活动单位和活动对象的基本情况，确定了“践行科学发展观，发展生态循环经济，构建富裕和谐新红旗”的学习活动主题。。红旗镇将围绕主题，突出实践特色，引导养殖户发展沼气，结合农村沼气建设，发展“猪—沼—作物”“牧草—牛”“羊—热作水果”等生态循环经济模式。该镇还将在第三批学习实践活动中，强化中心镇支撑产业，采取“政策驱动，自身滚动，公司带动”的做法，实现市里下拨的首期启动资金的滚动增值，再利用滚动增值的资金投入红旗大道、文化公园及新农村住宅小区建设。同时以公司带动的方式建设农产品批发市场，形成以农副产品收购、储藏、冷冻、保鲜、包装、运销为主体的中心镇支撑产业，并着力解决群众反映较强烈的教学质量不高、看病难、看病贵、困难群体救助救济等民生问题，构建起城乡经济社会发展一体化新格局。。在随后召开的座谈会上，王众孚对红旗镇第三批学习实践活动的准备情况给予了充分肯定。他认为，作为基层党组织如何把科学发展观学习活动落到实处，使学习活动取得实效尤为重要。。王众孚说，红旗镇、红旗村对第三批学习实践活动的准备很充分，很早就已着手调研部署，制定学习方案，听取红旗镇委、几个村支部的工作汇报后，很受教育。他说，将现代科学发展的思路延伸到基层，反映了以胡锦涛为总书记的党中央对农村发展、基层党组织建设的重视，农村基层组织在学习中要围绕人来做文章，把精辟的社会主义理论变成基层党员易懂、易接受的理论去学习。学习过程中，基层党组织要善于树立先进典型，宣传先进典型，推广先进典型，使第三批学习活动真正取得科学发展生产力，加强基层党组织建设的效果。,晚报8月29日讯（记者湘竹通讯员李能）28日晚，省委常委、市委书记陈辞在海口新国宾馆会见并设宴访问海航集团的坦桑尼亚航空代表团成员一行。海航集团副董事长兼CEO王健会见时在坐。。陈辞向坦桑尼亚客人简要介绍了海航集团的情况，他表示，海南省是中国最大的经济特区，一直以来都是国家改革开放的窗口，而成功运营的海航正是经济特区与改革开放下的产物。陈辞指出，海航最大的优势在于体制活、观念新及其优秀的服务品质，正是这些优势使之能在短短的十几年时间发展成为中国第四大航空集团，还是惟一一家熟悉热带地区航空运营和机场管理的航空公司。。坦桑尼亚航空代表团团长Enos Steven Bukuku先生表示，坦桑尼亚一直以来都十分重视与中国的合作，中国对坦桑尼亚如同兄弟姐妹般的关爱，为彼此间的合作和发展创造了许多新的机会。他希望在海航的支持下，开通航线构筑空中桥梁。他说，坦桑尼亚需要学习中国的改革开放和海航的运营模式，并邀请中国的投资者能赴坦桑尼亚进行基建设施等各方面的援助建设。。王健表示，希望双方能在新的道路上展开合作，通过飞机运力投放非洲，并在此基础上分享航空运营经验，共同构建空中的桥梁。。据悉，此次来访的坦桑尼亚航空代表团主要由坦桑尼亚航空公司和坦桑尼亚机场当局组成，来访目的是为了考察与学习海航的运行及管理，并寻求双方在航空、机场方面的合作空间。,其他,0.5042996180231007,True
222,海南省,海口市,坦桑尼亚航空代表团访问海航,2007-08-30,http://www.haikou.gov.cn/zfdt/hkyw/200708/t293183.shtml,晚报8月29日讯（记者湘竹通讯员李能）28日晚，省委常委、市委书记陈辞在海口新国宾馆会见并设宴访问海航集团的坦桑尼亚航空代表团成员一行。海航集团副董事长兼CEO王健会见时在坐。。陈辞向坦桑尼亚客人简要介绍了海航集团的情况，他表示，海南省是中国最大的经济特区，一直以来都是国家改革开放的窗口，而成功运营的海航正是经济特区与改革开放下的产物。陈辞指出，海航最大的优势在于体制活、观念新及其优秀的服务品质，正是这些优势使之能在短短的十几年时间发展成为中国第四大航空集团，还是惟一一家熟悉热带地区航空运营和机场管理的航空公司。。坦桑尼亚航空代表团团长Enos Steven Bukuku先生表示，坦桑尼亚一直以来都十分重视与中国的合作，中国对坦桑尼亚如同兄弟姐妹般的关爱，为彼此间的合作和发展创造了许多新的机会。他希望在海航的支持下，开通航线构筑空中桥梁。他说，坦桑尼亚需要学习中国的改革开放和海航的运营模式，并邀请中国的投资者能赴坦桑尼亚进行基建设施等各方面的援助建设。。王健表示，希望双方能在新的道路上展开合作，通过飞机运力投放非洲，并在此基础上分享航空运营经验，共同构建空中的桥梁。。据悉，此次来访的坦桑尼亚航空代表团主要由坦桑尼亚航空公司和坦桑尼亚机场当局组成，来访目的是为了考察与学习海航的运行及管理，并寻求双方在航空、机场方面的合作空间。,"海口晚报网11月19日讯（记者湘竹）记者从18日在琼海博鳌举行的中国电子海南生态软件园奠基典礼上获悉，在适当的时机，中国电子集团将与海口市合作建设面向政府信息化提供支撑和服务的海口软件园区，构建“一园两地”建设模式。。据了解，今年6月6日省政府与中国电子集团在海口签定了《关于信息化建设与信息产业发展全面战略合作协议》后,中国电子集团领导6至7月间，先后3次到海南进行中国电子海南生态软件园选址工作，对海口等地进行了实地考察，尽管最终我市与中国电子海南生态软件园失之交臂，但海口的综合实力给中国电子集团领导留下了深刻的印象，为合作建立海口软件园区留下伏笔。。据悉，目前，我市为海口软件园区建设正在进行大量的准备工作，本月初，我市相关部门领导随省长助理李国梁率领的中国电子集团、省工信局、琼海市相关负责人组成的考察团，专程赴上海浦东软件园和大连软件园进行调研考察，学习借鉴国内先进软件园建设经验。",政府领导到其他城市考察学习或访问,0.6419879552985425,True
222,海南省,海口市,陈成会见印尼驻华大使,2004-03-23,http://www.haikou.gov.cn/zfdt/hkyw/200403/t282816.shtml,海口晚报3月22日讯（记者黎光）今天上午，市长陈成在宝华海景大酒店会见印尼驻华大使库斯蒂亚一行3人。 陈成表示，去年的印尼巴厘岛之行给他留下了很深的印象。他说，巴厘岛的旅游资源丰富、生态保护良好、旅游景点规划合理、旅游市场开发到位、服务游客热情周到，有许多方面值得海口学习。为了加强海口与巴厘岛省会登巴刹市的合作，双方还就建立友好城市签订了意向书。 陈成表示，海口与巴厘岛在地理气候环境等有相似之处，同时还具有不少独特的优势。在自然环境方面，海口的空气质量名列全球空气十佳城市第五名，经济总量相对较大，还保持了无疫区的称号；在产业方面，海口适宜发展生物制药、热带高效农业等高科技产业。陈成欢迎大使先生组织印尼的企业家来海口考察、参观、投资，进一步加强双方在旅游、科技等方面的交流合作。 库斯蒂亚大使表示，登巴刹市与海口市建立友好城市的工作正在推进之中，双方今后的合作前景广阔。 市外事办、对外经济贸易合作局、经济贸易局负责人会见时在座。,"按照预算管理有关规定，目前我市部门预算编制实行综合预算制度，即全部收入和支出都反映在预算中，我局及海口市农业技术推广中心；海口市农民技术学校；海口市农机监理所；海口市农业机械学校；海口市动物防疫检疫站；海口市农业科学研究所；海口市农机管理办公室；海口市扶贫管理办公室等8家下属预算单位收支均包含在部门预算中。。根据2016年1月27日海口市财政局批复2016年市本级预算，本局2016年预算总收入74,955.26千元。其中，一般公共预算收入53,242.46千元,包括经费拨款收入、国库管理的行政事业性收费收入、专项收入、国有资源（资产）有偿使用收入、罚没收入、其他收入；政府性基金收入零元；财政专户管理的行政事业性收费收入零元；。2016年预算安排3万元，与上年预算持平。主要原因是根据工作计划，省农业厅拟安排出国（境）2人次，目的学习国（境）外先进农业技术和宣传促销农产品活动。。2016年预算安排7.8万元，较2015年预算下降14%，下降的主要原因是根据相关规定和接待任务减少。2016年公务接待费计划主要用于接待农业部检测机构对海口市农产品农药残留抽检和外省来我市调研考察等费用。",政府领导到其他城市考察学习或访问,0.0,True
222,海南省,海口市,研究部署中共琼崖一大旧址保护利用工作,2019-11-25,http://www.haikou.gov.cn/zfdt/ldhd/201911/t351633.shtml,本报11月24日讯 今天下午，市委副书记、市长丁晖主持召开专题会议，研究部署中共琼崖一大旧址保护利用工作。他强调，全市各级各相关单位要深入学习贯彻习近平总书记关于革命文物保护利用作出的系列重要批示指示精神，结合“不忘初心、牢记使命”主题教育，精心谋划、系统推进，将中共琼崖一大旧址打造成展示建党光辉历程和伟大建党精神的文化地标。。会上，国内知名建筑师林霄、张谨、俞孔坚团队有关负责人，省博物馆馆长陈江，先后从传统文化保护、历史文化街区改造、革命文物保护利用等角度，提出了意见和建议。。丁晖指出，中共琼崖一大旧址是琼崖革命“二十三年红旗不倒”的策源地，是革命传统和爱国主义教育的重要基地。全市上下要进一步提高政治站位，本着对历史负责、对未来负责的态度，积极主动作为，真正将中共琼崖一大旧址保护好、传承好、利用好。。丁晖要求，一是提升认识。市区有关部门要高度重视、精益求精，在国家和省文物部门的指导下，将中共琼崖一大旧址的标志性、独特性、辐射性充分展现。二是精准定位。属地和有关部门要主动担当、深入研究，把中共琼崖一大旧址与骑楼老街、海口湾有效串联起来，注重处理好内外结合的关系、点面结合的关系、远近结合的关系。三是统筹推进。市委宣传部牵头，龙华区、市旅文局、市城建集团等单位密切配合，建立健全工作推进机制，制定时间表、路线图，做到每周有进展；立即启动中共琼崖一大纪念馆和片区规划设计比稿工作，汇集国内知名专家团队，优中选优，遴选最佳方案。,从责成政府部门优化办事流程到帮助商户协调减免租金，从督促地方政府做好企业跟踪服务到解决噪音扰民问题，从封堵新冠疫情防控漏洞到督查“六稳”“六保”政策落实……2019年4月以来，有了海南省网上督查室这把“利器”，一批困扰企业、群众的难点堵点痛点问题得到解决。。督查督查，如何督，怎样查？群众足不出户即可反映问题，通过“一张网”进行跟踪督办——作为推进治理体系和治理能力现代化的一项有效探索，海南在全国首创全省党委、政府及部门督查一体化部署的网上督查室，构建起线上线下“一盘棋、一张网、一体化、一杆子”的立体督查新格局。海南省网上督查室上线两年来，始终坚持以人民为中心的督查理念，大范围拓宽了社情民意反映渠道，提高督查实效，有效解决企业群众诉求，助力海南营商环境优化，提升群众获得感满意度。网上督查室建设创新经验获得国务院肯定并向全国推广，荣获首届“海南省改革和制度创新奖”。。“信息时代，企业群众的意见往往在网上反映，政府的许多工作、服务也走到网上，督查也应该走到网上。”省政府督查专员税军介绍，2018年3月，我省在考察学习外地先进经验的基础上，结合海南实际需求，完成政府系统网上督查室框架的搭建。。这一覆盖省级党委政府、省直部门、市县、乡镇，实现“多督合一”“一张网”的做法，不仅是海南首创，迄今仍然是全国唯一。网上督查室一方面有效推动省委、省政府决策部署落实落地，另一方面架好督查为民的“连心桥”。。人群违法聚集、小区封闭管理不到位、过度设卡影响居民生活……有了网上督查室，去年新冠疫情防控吃紧期间，我省充分动员群众提供疫情防控问题线索并及时协调解决，真正展开全员防控、同心抗疫，构筑了海南疫情防控的“防护网”。群众纷纷点赞网上督查室“解决问题不仅速度快，而且质量高！”。税军介绍，网上督查室构筑了全省统一的督查数据库，充分运用大数据和人工智能技术，首创“督查查重”机制，减少重复督查、多头督查，运行两年来督查事项压缩88.7%，减少重复督查事项225项，减少非必要实地督查100多次，有效减轻了基层负担。。两年来，网上督查室已形成主要领导、分管领导、督查部门、承办处室的多层级督查体系，多方、多层级联动，对全省督查任务进行全局、实时掌控，建立了全天候、全覆盖、无缝隙的全省“一张网”，“横到边纵到底，线上线下联动”的大督查格局。。2020年底，一家从外地迁入海口的高科技企业向网上督查室反映，企业经海口市委托的招商公司引进后，后续服务没有跟上，相关手续办理存在困难。省政府督查室立即责成海口市有关部门跟进服务，积极为企业解答疑难，成功促成企业落地经营。。建设自贸港，营造良好的营商环境是重中之重。有了网上督查室这个“顺风耳”“千里眼”，我省可及时了解市场主体诉求，为它们排忧解难，构筑更加顺畅的发展环境。。市场主体“冷暖”多了知心人关照人。去年复工复产期间，在接到海口龙华区某百货大楼个体商户符女士反映的“希望政府帮助协调减免两到三个月房屋租金”信息后，省政府督查室核查发现，该百货大楼经营者为民营企业，属政府鼓励减租企业范围。随即督促龙华区协调双方互相体谅共渡难关，达成租金减半收取的协议，累计为278户商户减免租金178万元。。企业困惑多了“答疑人”。海口一家企业反映，企业改为股份制并在海南股权交易中心挂牌，在资本市场进行融资后，符合相关政策规定可获得奖励奖金，却未能成功申领。经网上督查室转交线索，省财政厅就我省相关政策情况耐心为企业答疑解惑，并引导企业成功向海口市申领奖金。。接到省政府督查室转交的督办线索后，海口市公安局海垦派出所民警随即到场告诫，要求店铺采取整改措施，并安排民警对该区域加强巡逻。,政府领导到其他城市考察学习或访问,0.5465109132368072,True
222,海南省,海口市,海口市区镇领导班子换届工作会议暨业务培训会议召开,2021-06-17,http://www.haikou.gov.cn/zfdt/ldhd/202106/t352195.shtml,本报6月16日讯 6月16日，海口市区镇领导班子换届工作会议暨业务培训会议召开。会议深入学习贯彻习近平总书记关于做好换届工作的重要指示精神，贯彻落实党中央关于市县乡换届工作的决策和省委部署，动员部署我市换届工作。省委常委、市委书记、市区镇换届工作领导小组组长何忠友出席会议并讲话。省换届风气第一巡回督查组副组长刘乔志到会指导。。何忠友强调，要深入学习贯彻习近平总书记重要指示精神，把思想和行动高度统一到党中央决策部署上来。深刻把握做好换届工作的重要意义和具体要求，深刻把握省委关于换届工作的安排部署，切实增强政治责任感和历史使命感，结合海口实际抓好贯彻落实，推进换届工作有序开展，为坚决扛起高质量高标准建设海南自贸港的省会担当提供坚强组织保证。。何忠友要求，要突出抓好“五个好”目标任务，高标准高质量完成换届工作。总结成绩、谋划未来，绘出好蓝图，用好蓝图凝聚人心、汇聚力量；坚持政治标准和事业为上，选出好干部，严格落实“信念坚定、为民服务、勤政务实、敢于担当、清正廉洁”好干部二十字标准，把符合海南自贸港建设和海口高质量发展的好干部选出来、用起来；注重增强整体功能，配出好班子，选优配强党政正职，加大优秀年轻干部选拔力度，做好女干部、少数民族干部和党外干部配备工作；激励担当作为，树立好导向，坚持在大战大考一线考察识别使用干部，坚持以事择人、人岗相适；严明换届纪律，形成好气象，把纪律和规矩挺在前面，坚持全程从严监督，坚持从严从快查处违法违纪行为，确保换届工作风清气正。要压紧压实责任，全面加强对换届工作的领导。加强组织领导，加强统筹推进，加强思想工作，营造良好氛围，不折不扣完成好换届各项任务。。省换届风气第一巡回督查组成员，市区镇换届工作领导小组副组长韩英伟、郭燕红、鲍剑、王艳萍、林海宁、冯汉芬参加会议。,昨天，省委书记、省人大常委会主任卫留成在临高调研时指出，临高加快发展的条件和时机已逐步成熟，他要求临高领导班子要进一步增强紧迫感和危机感，抢抓国际旅游岛建设机遇，解放思想，加大步伐，真抓实干，尽快找准发展突破口，推动临高经济社会加快发展。。在短短一天的时间里，卫留成一行顶着烈日，先后来到金牌港经济开发区、博厚镇文明生态村片区、临高角旅游度假区、文澜江岸等地，对当地基础设施、新农村建设、市政设施和保障性住房建设等情况进行实地考察。。在项目总投资10.8亿元、首期工程已基本完工的金牌威隆船舶修造厂，卫留成认真听取了项目建设情况。他希望临高依托金牌港的港口优势，积极策划引进境外游艇建造大型企业，加快推进大型船舶修造业发展，同时要加大对本地劳动力的培训力度，通过项目建设有效解决本地农民的就业问题。。在博厚镇洋大、三省、永顺文明生态村片区，卫留成强调指出，要把发展生产、增加农民收入作为文明生态村建设的着力点。卫留成与当地村民进行亲切交谈，详细询问了大家的生产生活情况，鼓励大家要多种高效的瓜果菜，积极探索有效的合作生产模式，联合生产共同致富。。卫留成非常关注全省保障性住房建设情况，在临高实地察看了新落成的临城糖厂廉租房小区，并听取了正在建设中的政法小区、党校小区等保障性住房建设情况介绍，要求当地政府要切实抓好保障性住房这个一号民生工程，做到土地、资金和领导责任的“三落实”，对落实不好的坚决问责，切实解决好当地群众的保障性住房问题，让老百姓从国际旅游岛建设中得到实惠。。在听取了临高县委书记陈创福代表县委、县政府做的工作汇报后，卫留成对临高近年克服基础条件差等困难，经济社会发展发生明显变化给予了肯定。。在和参加座谈会的临高干部共同分析了临高当前发展面临的机遇和条件后，卫留成说，随着海南国际旅游岛建设成为国家战略，全省已进入了经济社会发展的快车道，他希望大家清醒意识到，与全省各地加快发展的形势相比，临高的发展仍有较大差距。他要求大家要以为历史负责、为人民负责的态度，大胆突破条条框框，步子快一点，少一些争论，多一些实干，不断在实践中统一思想，在统一思想中加速发展。。在谈到临高的产业发展时，卫留成指出，要加快农业产业结构调整，实现从传统农业向高效农业转变，从粗放生产向精耕细作转变;充分发挥优势，进一步加快渔港建设、渔船修造和渔具加工和水产品购销等配套产业建设，加快从渔业大县向渔业强县迈进;要紧紧依托金牌港经济开发区，加快招商引资，加快发展新兴工业;在旅游房地产方面要加快选准突破口，引进大企业带动大发展。。卫留成指出，要实现快速发展的目标，需要一支高素质的干部队伍。他要求县委四套班子成员及各级干部要加强学习新知识，研究新问题，少说空话，脚踏实地地多干事。各级干部要进一步提高学习能力、判断能力、决策能力、执行能力和影响能力，从而提高思想理论水平和领导经济社会科学发展的水平。要抓好基层组织建设，扎实推进基层组织的强核心工程。,政府领导到其他城市考察学习或访问,0.0,True
