code,province,city,topic,date,url,content,content,label,score
225,海南省,儋州市,温龙率我市学习考察慰问团赴三沙慰问配组图,2017-05-27,https://www.danzhou.gov.cn/danzhou/ywdt/tpxw/201705/t20170527_1728550.html,温龙率我市学习考察慰问团赴三沙慰问（配组图） -- 图片新闻 -- 儋州市人民政府。5月26日，由市委常委、宣传部长温龙任团长的我市学习考察慰问团一行赴三沙市永兴岛，慰问该市机关干部群众和驻岛军警部队官兵，并送上慰问品和节日祝福。图为慰问捐赠仪式现场。。儋州新闻中心消息 情系永兴岛，粽子传温情。在端午节临近之际，5月26日，带着儋州市委、市政府的关怀厚爱和全市百万人民的深情厚谊，市委常委、宣传部长温龙，市人大常委会副主任王大辉，市政协副主席侯启江率儋州学习考察慰问团一行，赴三沙市永兴岛，看望慰问三沙市机关干部群众和驻岛军警官兵，并送上儋州粽子等慰问品和浓浓的节日祝福。。三沙市委常委、常务副市长冯文海在慰问捐赠仪式上讲话时指出，近年来，儋州在经济发展、民生改善、教育卫生、文化宣传等方面成绩显著，创造了儋州经验和儋州模式，值得三沙市学习和借鉴。三沙设市近五年来，在党中央、国务院的亲切关怀下，在省委省政府的正确领导下，在兄弟市县及社会各界的大力支持和帮助下，深刻领会中央战略意图，全面落实习近平总书记指示精神，不怕条件艰苦、不怕情况复杂、不怕没有先例，主动服从维护国家主权和海洋权益需要，主动适应三沙维权建设新常态，以特殊方式方法破解特殊困难，完成特殊使命，岛礁建设发生了翻天覆地的变化，维权维稳保护开发各项工作取得了骄人成绩。 冯文海表示，今后将继续在全省各兄弟市县的帮助下，以一天也不耽误的精神加快三沙维权建设发展，为建设主权三沙、美丽三沙、幸福三沙作出更大贡献。。温龙指出，三沙市和儋州市都是我省的新生地级市，一直保持着良好的战略合作关系。近年来，在省委和三沙市委的坚强领导下，三沙市紧紧围绕“主权三沙、美丽三沙、幸福三沙”的宏伟目标，克服了特殊环境和条件以及重重困难，开展了许多卓有成效的工作，实现了国家的战略意图和战略部署。三沙的发展变化日新月异，三沙的影响力与日俱增，尤其在维权维稳、保护开发以及“双拥”共建等方面体现出来的家国情怀，深深地鼓舞着我们，三沙正以崭新的形象和面貌呈现在全国乃至全世界人民面前。 温龙说，近年来，儋州紧紧抓住升格为地级市的历史新机遇，大力推进海南西部中心城市建设，各项工作取得了重要进展，经济社会发展进入了快车道。特别是省第七次党代会召开以后，儋州市委市政府以省党代会精神为指导，进一步统一思想、找准定位、理清思路、明确发展方向，提出了深入实施新兴增长极和新型城镇化的“双新”发展战略，经济社会呈现出良好的发展势头。三沙和儋州都是我省重要的地级市，在全省发展战略中承担着极其重要的作用。希望以此次学习考察慰问活动为契机，进一步加强两市之间，特别是在海洋产业、民生事业、双拥工作等方面的交流与合作，促进两地经济社会健康持续快速发展。。市委常委、宣传部长温龙给三沙市机关干部群众和驻岛军警部队送上儋州粽子等特色农产品。。当天，儋州学习考察慰问团给三沙市机关干部群众及驻岛军警部队官兵赠送了5000个儋州粽子和一批儋州特色农产品。同时，学习考察慰问团还在三沙市部队小礼堂为官兵献上了一台极具儋州文化特色的文艺节目。。以下组图为儋州学习考察团为三沙市机关干部群众和驻岛军警部队官兵表演儋州调声等文艺节目。。据了解，此次学习考察慰问活动是我市为了贯彻落实儋州市和三沙市战略合作协议，主动为三沙发展建设服务，促进双方在产业发展、民生建设、双拥工作等方面深入合作而实施的具体举措。（特派记者冼贺 编辑范志平）,温龙率我市学习考察慰问团赴三沙慰问（配组图） -- 图片新闻 -- 儋州市人民政府。5月26日，由市委常委、宣传部长温龙任团长的我市学习考察慰问团一行赴三沙市永兴岛，慰问该市机关干部群众和驻岛军警部队官兵，并送上慰问品和节日祝福。图为慰问捐赠仪式现场。。儋州新闻中心消息 情系永兴岛，粽子传温情。在端午节临近之际，5月26日，带着儋州市委、市政府的关怀厚爱和全市百万人民的深情厚谊，市委常委、宣传部长温龙，市人大常委会副主任王大辉，市政协副主席侯启江率儋州学习考察慰问团一行，赴三沙市永兴岛，看望慰问三沙市机关干部群众和驻岛军警官兵，并送上儋州粽子等慰问品和浓浓的节日祝福。。三沙市委常委、常务副市长冯文海在慰问捐赠仪式上讲话时指出，近年来，儋州在经济发展、民生改善、教育卫生、文化宣传等方面成绩显著，创造了儋州经验和儋州模式，值得三沙市学习和借鉴。三沙设市近五年来，在党中央、国务院的亲切关怀下，在省委省政府的正确领导下，在兄弟市县及社会各界的大力支持和帮助下，深刻领会中央战略意图，全面落实习近平总书记指示精神，不怕条件艰苦、不怕情况复杂、不怕没有先例，主动服从维护国家主权和海洋权益需要，主动适应三沙维权建设新常态，以特殊方式方法破解特殊困难，完成特殊使命，岛礁建设发生了翻天覆地的变化，维权维稳保护开发各项工作取得了骄人成绩。 冯文海表示，今后将继续在全省各兄弟市县的帮助下，以一天也不耽误的精神加快三沙维权建设发展，为建设主权三沙、美丽三沙、幸福三沙作出更大贡献。。温龙指出，三沙市和儋州市都是我省的新生地级市，一直保持着良好的战略合作关系。近年来，在省委和三沙市委的坚强领导下，三沙市紧紧围绕“主权三沙、美丽三沙、幸福三沙”的宏伟目标，克服了特殊环境和条件以及重重困难，开展了许多卓有成效的工作，实现了国家的战略意图和战略部署。三沙的发展变化日新月异，三沙的影响力与日俱增，尤其在维权维稳、保护开发以及“双拥”共建等方面体现出来的家国情怀，深深地鼓舞着我们，三沙正以崭新的形象和面貌呈现在全国乃至全世界人民面前。 温龙说，近年来，儋州紧紧抓住升格为地级市的历史新机遇，大力推进海南西部中心城市建设，各项工作取得了重要进展，经济社会发展进入了快车道。特别是省第七次党代会召开以后，儋州市委市政府以省党代会精神为指导，进一步统一思想、找准定位、理清思路、明确发展方向，提出了深入实施新兴增长极和新型城镇化的“双新”发展战略，经济社会呈现出良好的发展势头。三沙和儋州都是我省重要的地级市，在全省发展战略中承担着极其重要的作用。希望以此次学习考察慰问活动为契机，进一步加强两市之间，特别是在海洋产业、民生事业、双拥工作等方面的交流与合作，促进两地经济社会健康持续快速发展。。市委常委、宣传部长温龙给三沙市机关干部群众和驻岛军警部队送上儋州粽子等特色农产品。。当天，儋州学习考察慰问团给三沙市机关干部群众及驻岛军警部队官兵赠送了5000个儋州粽子和一批儋州特色农产品。同时，学习考察慰问团还在三沙市部队小礼堂为官兵献上了一台极具儋州文化特色的文艺节目。。以下组图为儋州学习考察团为三沙市机关干部群众和驻岛军警部队官兵表演儋州调声等文艺节目。。据了解，此次学习考察慰问活动是我市为了贯彻落实儋州市和三沙市战略合作协议，主动为三沙发展建设服务，促进双方在产业发展、民生建设、双拥工作等方面深入合作而实施的具体举措。（特派记者冼贺 编辑范志平）,政府领导到其他城市考察学习或访问,0.5490632415764015
225,海南省,儋州市,市委宣传部组织宣传干部赴兄弟市县考察学习配组图,2012-04-23,https://www.danzhou.gov.cn/danzhou/ywdt/jrdz/201204/t20120423_1763160.html,市委宣传部组织宣传干部赴兄弟市县考察学习(配组图) -- 今日儋州 -- 儋州市人民政府。儋州新闻中心消息 以力推学习型党组织建设、文明大行动和文明生态村建设为内容，4月18日至22日，市委宣传部组织全市宣传委员和宣传部干部赴三亚、琼海、保亭等市县考察学习，进一步拓宽视野、转变观念、创新工作，为儋州跨越发展做出新贡献。 考察期间，考察组先后到五指山、保亭、三亚、万宁、琼海、定安等市县的文明生态村、文化广场、文化活动场所、创建学习型党组织等先进单位考察，学习他们的先进经验和做法。每到一处，考察组成员都详细了解先进单位创建情况、经验做法和发展成果。 五指山市南圣村，原是一个落后的村庄，开展创建学习型党组织后，联合省农林科技学校在村里设立基层农业学校，开设种植、养殖、农业经济管理等专业，提高农民种养技能，改变农民的思想观念，使南圣村成为学习型党组织建设一面旗帜。保亭县注重城市规划建设，突出黎苗风情，在保城东河西岸建设了以黎族船屋为造型，集购物、休闲、娱乐、餐饮、文化、景观为一体的风情一条街，整个街道干净、舒适、温馨；七仙广场融入本地独特景观和黎苗文化特色，将地方性和国际性相结合，整个建设和谐、美观大方，凸显民族风情。三亚市槟榔新村，在新农村建设中加快产业转变发展方式，整村连片，集购物、休闲、娱乐、餐饮、文化、景观为一体，建设有黎苗博物馆、商业街、农家乐等，吸引了众多游客。定安百里百村结合本地实际，建设独特的景观，开展了农家乐、自行车游等旅游项目，吸引了游客纷至沓来。 经过几天实地考察学习，考察组成员深受启发，受益颇多。大家认为，一个地方的发展，关键在解放思想、更新观念，坚持科学发展，切实转变经济发展方式，以思想大解放推动经济社会发展。 市委宣传部副部长蒲永朝对记者说，当前，儋州正处于经济发展的大好时期，宣传工作要先行。宣传工作者要牢牢把握主题和主线，把握时代精神，以科学理论武装人，为儋州又好又快发展提供强有力的精神支撑。通过开展此次活动，拓宽了宣传工作者视野，更新了观念，为我市69个重点项目建设和文明大行动宣传造势，营造真抓实干的良好氛围。（记者梁灵杰 编辑王霞）,市委宣传部组织宣传干部赴兄弟市县考察学习(配组图) -- 今日儋州 -- 儋州市人民政府。儋州新闻中心消息 以力推学习型党组织建设、文明大行动和文明生态村建设为内容，4月18日至22日，市委宣传部组织全市宣传委员和宣传部干部赴三亚、琼海、保亭等市县考察学习，进一步拓宽视野、转变观念、创新工作，为儋州跨越发展做出新贡献。 考察期间，考察组先后到五指山、保亭、三亚、万宁、琼海、定安等市县的文明生态村、文化广场、文化活动场所、创建学习型党组织等先进单位考察，学习他们的先进经验和做法。每到一处，考察组成员都详细了解先进单位创建情况、经验做法和发展成果。 五指山市南圣村，原是一个落后的村庄，开展创建学习型党组织后，联合省农林科技学校在村里设立基层农业学校，开设种植、养殖、农业经济管理等专业，提高农民种养技能，改变农民的思想观念，使南圣村成为学习型党组织建设一面旗帜。保亭县注重城市规划建设，突出黎苗风情，在保城东河西岸建设了以黎族船屋为造型，集购物、休闲、娱乐、餐饮、文化、景观为一体的风情一条街，整个街道干净、舒适、温馨；七仙广场融入本地独特景观和黎苗文化特色，将地方性和国际性相结合，整个建设和谐、美观大方，凸显民族风情。三亚市槟榔新村，在新农村建设中加快产业转变发展方式，整村连片，集购物、休闲、娱乐、餐饮、文化、景观为一体，建设有黎苗博物馆、商业街、农家乐等，吸引了众多游客。定安百里百村结合本地实际，建设独特的景观，开展了农家乐、自行车游等旅游项目，吸引了游客纷至沓来。 经过几天实地考察学习，考察组成员深受启发，受益颇多。大家认为，一个地方的发展，关键在解放思想、更新观念，坚持科学发展，切实转变经济发展方式，以思想大解放推动经济社会发展。 市委宣传部副部长蒲永朝对记者说，当前，儋州正处于经济发展的大好时期，宣传工作要先行。宣传工作者要牢牢把握主题和主线，把握时代精神，以科学理论武装人，为儋州又好又快发展提供强有力的精神支撑。通过开展此次活动，拓宽了宣传工作者视野，更新了观念，为我市69个重点项目建设和文明大行动宣传造势，营造真抓实干的良好氛围。（记者梁灵杰 编辑王霞）,政府领导到其他城市考察学习或访问,0.5843122481751108
225,海南省,儋州市,我市各校传达学习习近平总书记考察海南时的重要讲话精神,2022-04-22,https://www.danzhou.gov.cn/danzhou/ywdt/jrdz/202204/t20220422_3179581.html,我市各校传达学习习近平总书记考察海南时的重要讲话精神 -- 今日儋州 -- 儋州市人民政府。儋州市融媒体中心消息 4月15日，南大附中市一中召开会议，学习《习近平在海南考察时强调 解放思想开拓创新团结奋斗攻坚克难 加快建设具有世界影响力的中国特色自由贸易港》，重温《在庆祝海南建省办经济特区30周年大会上的讲话》《中共中央国务院关于支持海南全面深化改革开放的指导意见》的精神。。月15日，南大附中市一中召开会议，学习《习近平在海南考察时强调 解放思想开拓创新团结奋斗攻坚克难 加快建设具有世界影响力的中国特色自由贸易港》，重温《在庆祝海南建省办经济特区30周年大会上的讲话》《中共中央国务院关于支持海南全面深化改革开放的指导意见》的精神。。会议要求，在推进海南自贸港建设和儋洋一体化发展的背景下，要加大力度提高学校教育教学质量和水平，持之以恒抓好理想信念教育，为培育和弘扬社会主义核心价值观，广泛开展群众性精神文明创建活动，不断提升人民文明素养和社会文明程度，贡献儋州一中力量。。4月15日，市第三中学组织全体党政干部、工会团委领导和年级组组长开展学习会，传达学习习近平总书记在海南考察时的重要讲话精神。。会议指出，要深入学习宣传贯彻习近平总书记考察海南时的重要讲话精神，以习近平总书记重要讲话精神为指引持续做好学校各项重点工作，奋力推进教育教学高质量发展。。4月16日至18日，那大实验小学茶山校区结合实际，通过党员干部集中学习会等形式，传达学习习近平总书记考察海南时的重要讲话精神。。会议要求，要深刻领悟习近平总书记考察海南时的重要讲话精神的重要性，坚定不移沿着习近平总书记指引的方向奋勇前进，打造茶山校区城区结合区域特色小学，努力开创儋州洋浦一体化高质量发展新局面。（儋州融媒全媒体记者符武月 编辑符灵基）,我市各校传达学习习近平总书记考察海南时的重要讲话精神 -- 今日儋州 -- 儋州市人民政府。儋州市融媒体中心消息 4月15日，南大附中市一中召开会议，学习《习近平在海南考察时强调 解放思想开拓创新团结奋斗攻坚克难 加快建设具有世界影响力的中国特色自由贸易港》，重温《在庆祝海南建省办经济特区30周年大会上的讲话》《中共中央国务院关于支持海南全面深化改革开放的指导意见》的精神。。月15日，南大附中市一中召开会议，学习《习近平在海南考察时强调 解放思想开拓创新团结奋斗攻坚克难 加快建设具有世界影响力的中国特色自由贸易港》，重温《在庆祝海南建省办经济特区30周年大会上的讲话》《中共中央国务院关于支持海南全面深化改革开放的指导意见》的精神。。会议要求，在推进海南自贸港建设和儋洋一体化发展的背景下，要加大力度提高学校教育教学质量和水平，持之以恒抓好理想信念教育，为培育和弘扬社会主义核心价值观，广泛开展群众性精神文明创建活动，不断提升人民文明素养和社会文明程度，贡献儋州一中力量。。4月15日，市第三中学组织全体党政干部、工会团委领导和年级组组长开展学习会，传达学习习近平总书记在海南考察时的重要讲话精神。。会议指出，要深入学习宣传贯彻习近平总书记考察海南时的重要讲话精神，以习近平总书记重要讲话精神为指引持续做好学校各项重点工作，奋力推进教育教学高质量发展。。4月16日至18日，那大实验小学茶山校区结合实际，通过党员干部集中学习会等形式，传达学习习近平总书记考察海南时的重要讲话精神。。会议要求，要深刻领悟习近平总书记考察海南时的重要讲话精神的重要性，坚定不移沿着习近平总书记指引的方向奋勇前进，打造茶山校区城区结合区域特色小学，努力开创儋州洋浦一体化高质量发展新局面。（儋州融媒全媒体记者符武月 编辑符灵基）,其他,0.5839519895558434
225,海南省,儋州市,市卫生局组织系统单位到海口市考察学习,2011-05-23,https://www.danzhou.gov.cn/danzhou/ywdt/jrdz/201105/t20110524_1757109.html,儋州新闻中心消息为了做好我市卫生系统机关效能建设以及惩治和预防腐败工作，推进我市卫生系统对公立医院行风建设责任制和医疗卫生机构绩效评价制度工作顺利开展。5月17日，市卫生局组织市内几家医院到海口考察学习相关工作。 当天，市卫生局组织市第一人民医院、那大农垦医院、市中医医院、市妇幼保健院四家负责党风廉政建设的领导一行8人先后到海口市卫生局、海口市第一人民医院学习取经。分别听取了海口市卫生局、海口市第一人民医院对惩治和预防腐败工作的主要做法、典型经验。我市参加学习人员纷纷表示这次出来学习参观，深受启发，为市卫生系统做好机关效能建设以及惩治和预防腐败工作提供了良好的学习和借鉴的经验。回去后将围绕党风廉政建设和反腐败工作的要求，认真按照市委党风廉政建设和反腐败工作部署，积极推进本系统和本单位的党风廉政建设各项任务的落实，以党风廉政建设的成果推动全市卫生事业的发展。（记者黎有科 通讯员邢? 编辑李晓晖）,儋州新闻中心消息为了做好我市卫生系统机关效能建设以及惩治和预防腐败工作，推进我市卫生系统对公立医院行风建设责任制和医疗卫生机构绩效评价制度工作顺利开展。5月17日，市卫生局组织市内几家医院到海口考察学习相关工作。 当天，市卫生局组织市第一人民医院、那大农垦医院、市中医医院、市妇幼保健院四家负责党风廉政建设的领导一行8人先后到海口市卫生局、海口市第一人民医院学习取经。分别听取了海口市卫生局、海口市第一人民医院对惩治和预防腐败工作的主要做法、典型经验。我市参加学习人员纷纷表示这次出来学习参观，深受启发，为市卫生系统做好机关效能建设以及惩治和预防腐败工作提供了良好的学习和借鉴的经验。回去后将围绕党风廉政建设和反腐败工作的要求，认真按照市委党风廉政建设和反腐败工作部署，积极推进本系统和本单位的党风廉政建设各项任务的落实，以党风廉政建设的成果推动全市卫生事业的发展。（记者黎有科 通讯员邢? 编辑李晓晖）,其他,0.5573742520992424
225,海南省,儋州市,东方市学习组到我市考察反电诈工作,2018-01-21,https://www.danzhou.gov.cn/danzhou/ywdt/jrdz/201801/t20180122_1788229.html,据《今日儋州》消息 1月18日下午，东方市委政法委常务副书记、市综治办主任王文学率领该市综治办、公安局、工信局等单位负责人共10人组成的考察学习组到我市考察学习打击治理电信网络新型违法犯罪工作，并举行交流座谈会。 座谈会上，市公安局相关负责人详细地介绍了我市电信网络新型违法犯罪的发展趋势、规律特点及打击治理电信网络新型违法犯罪的情况和下一步工作设想。 王文学表示，通过此次交流学习，学习组感受到儋州在打击治理电信网络新型违法犯罪上做了大量的工作，反“电诈”的决心大、动作大、力度大，为东方市下一步开展打击电信网络新型违法犯罪工作提供了宝贵的经验。学习组一定把这次交流学习到的经验与东方市的实际情况结合起来，推动东方市打击治理电信网络新型违法犯罪工作的深入开展。 在会上，学习组还观看了我市打击治理电信网络新型违法犯罪工作汇报片《儋州在行动》，仔细观摩我市打击电信网络诈骗信息管理系统演示。 当天，东方市学习组一行还分别深入到市反电信诈骗中心和东风社区，实地查看反电信诈骗接警处置区，金融、运营商工作区，宣传栏和大数据分析中心，并查阅相关台账资料和档案，参观学习我市在打击电信网络新型违法犯罪方面的工作经验。市反电信诈骗中心还向东方市学习组赠送了《儋州在行动》光盘及《文件资料汇编》、《宣传基础工作》等书籍。（记者王家隆 编辑唐凤霞）,据《今日儋州》消息 1月18日下午，东方市委政法委常务副书记、市综治办主任王文学率领该市综治办、公安局、工信局等单位负责人共10人组成的考察学习组到我市考察学习打击治理电信网络新型违法犯罪工作，并举行交流座谈会。 座谈会上，市公安局相关负责人详细地介绍了我市电信网络新型违法犯罪的发展趋势、规律特点及打击治理电信网络新型违法犯罪的情况和下一步工作设想。 王文学表示，通过此次交流学习，学习组感受到儋州在打击治理电信网络新型违法犯罪上做了大量的工作，反“电诈”的决心大、动作大、力度大，为东方市下一步开展打击电信网络新型违法犯罪工作提供了宝贵的经验。学习组一定把这次交流学习到的经验与东方市的实际情况结合起来，推动东方市打击治理电信网络新型违法犯罪工作的深入开展。 在会上，学习组还观看了我市打击治理电信网络新型违法犯罪工作汇报片《儋州在行动》，仔细观摩我市打击电信网络诈骗信息管理系统演示。 当天，东方市学习组一行还分别深入到市反电信诈骗中心和东风社区，实地查看反电信诈骗接警处置区，金融、运营商工作区，宣传栏和大数据分析中心，并查阅相关台账资料和档案，参观学习我市在打击电信网络新型违法犯罪方面的工作经验。市反电信诈骗中心还向东方市学习组赠送了《儋州在行动》光盘及《文件资料汇编》、《宣传基础工作》等书籍。（记者王家隆 编辑唐凤霞）,政府领导到其他城市考察学习或访问,0.0
