code,province,city,topic,date,url,content,content,label,score
225,海南省,儋州市,洋浦检察院传达学习习近平总书记在海南考察时的重要讲话精神,2022-04-18,https://www.danzhou.gov.cn/danzhou/ywdt/jrdz/202204/t20220418_3176645.html,洋浦检察院传达学习习近平总书记在海南考察时的重要讲话精神 -- 今日儋州 -- 儋州市人民政府。儋州市融媒体中心消息 4月14日上午，洋浦检察院召开党组理论中心组学习（扩大）会议，重温习近平总书记“4•13”重要讲话精神，传达学习习近平总书记近期在海南考察时的重要讲话精神。 会议要求，要提高政治站位，充分认识习近平总书记亲临海南、亲临洋浦经济开发区考察的重要意义，认真学习领会、贯彻落实好习近平总书记的重要讲话精神，激发强大工作热情和内生动力，更好更实担当检察使命，为洋浦建设海南自贸港先行区示范区、打造亮丽“海南名片”贡献检察力量。 会议强调，要以习近平总书记在洋浦经济开发区考察为新的起点，深入贯彻习近平法治思想，以高度的政治自觉、法治自觉、检察自觉，依法履行法律监督职责，着力推动洋浦检察工作高质量发展。要聚焦检察主责主业，紧紧围绕“保安全、护稳定”这一主线，全力做好检察环节维护国家政治安全和社会大局稳定各项工作。要认真履行批捕、起诉、监督职能，深入开展扫黑除恶专项斗争常态化、打击治理电信网络诈骗犯罪三年大会战以及新一轮禁毒三年大会战收官战等专项活动，助力推动更高水平的平安海南建设。要聚焦护企安商，依法严厉打击损害企业合法权益的刑事犯罪，强化涉企合法权益保障法律监督，服务保障企业正常生产经营活动，助力营造法治化营商环境。积极探索涉案企业合规改革试点工作，通过办理企业合规案件，推动健全完善各方参与、客观中立的第三方监督评估机制，帮助企业防范法律风险、依法合规经营和持续健康发展。（儋州融媒全媒体记者王家隆 夏佟 通讯员刘石坚 编辑李晓晖）,洋浦检察院传达学习习近平总书记在海南考察时的重要讲话精神 -- 今日儋州 -- 儋州市人民政府。儋州市融媒体中心消息 4月14日上午，洋浦检察院召开党组理论中心组学习（扩大）会议，重温习近平总书记“4•13”重要讲话精神，传达学习习近平总书记近期在海南考察时的重要讲话精神。 会议要求，要提高政治站位，充分认识习近平总书记亲临海南、亲临洋浦经济开发区考察的重要意义，认真学习领会、贯彻落实好习近平总书记的重要讲话精神，激发强大工作热情和内生动力，更好更实担当检察使命，为洋浦建设海南自贸港先行区示范区、打造亮丽“海南名片”贡献检察力量。 会议强调，要以习近平总书记在洋浦经济开发区考察为新的起点，深入贯彻习近平法治思想，以高度的政治自觉、法治自觉、检察自觉，依法履行法律监督职责，着力推动洋浦检察工作高质量发展。要聚焦检察主责主业，紧紧围绕“保安全、护稳定”这一主线，全力做好检察环节维护国家政治安全和社会大局稳定各项工作。要认真履行批捕、起诉、监督职能，深入开展扫黑除恶专项斗争常态化、打击治理电信网络诈骗犯罪三年大会战以及新一轮禁毒三年大会战收官战等专项活动，助力推动更高水平的平安海南建设。要聚焦护企安商，依法严厉打击损害企业合法权益的刑事犯罪，强化涉企合法权益保障法律监督，服务保障企业正常生产经营活动，助力营造法治化营商环境。积极探索涉案企业合规改革试点工作，通过办理企业合规案件，推动健全完善各方参与、客观中立的第三方监督评估机制，帮助企业防范法律风险、依法合规经营和持续健康发展。（儋州融媒全媒体记者王家隆 夏佟 通讯员刘石坚 编辑李晓晖）,其他,0.5628056356815931
225,海南省,儋州市,市旅文局传达学习习近平总书记考察海南时重要讲话精神,2022-04-18,https://www.danzhou.gov.cn/danzhou/ywdt/jrdz/202204/t20220418_3176691.html,市旅文局传达学习习近平总书记考察海南时重要讲话精神 -- 今日儋州 -- 儋州市人民政府。儋州市融媒体中心消息 4月17日下午，市旅文局召开局党委扩大会议，传达学习习近平总书记考察海南时的重要讲话精神及省市重要会议精神，研究部署市旅文系统贯彻落实工作。 会议指出，全市旅文系统要充分认识习近平总书记考察海南的重大意义，深入学习宣传贯彻习近平总书记的重要讲话精神，进一步解放思想、开拓创新、团结奋斗、攻坚克难，努力办好人民满意和自贸港建设需要的旅文业，为加快推进海南自贸港建设和儋洋一体化发展贡献旅文智慧和力量。 就下一步如何贯彻落实工作，会议要求，一要把学习贯彻落实习近平总书记在海南考察时的重要讲话精神作为当前及今后一段时期的学习重点和工作指南，切实增强旅文干部职工服务自贸港建设和儋洋一体化发展的思想自觉和行动自觉。二要把坚定捍卫“两个确立”、坚决做到“两个维护”作为贯彻落实习近平总书记的重要讲话精神的着力点，结合旅文工作实际，找准工作结合点和切入点，全局的各项重点工作实行项目化、工单化管理，将习近平总书记重要讲话精神不折不扣落实到旅文工作各个环节，推动自贸港建设和儋洋一体化旅文工作高质量发展。三要切实将学习成果转化为促进各项工作高效开展的强大动力，结合“能力提升建设年”活动，着力创新工作方式方法、及时调整工作状态，以严的纪律和实的作风，全力抓好第六届省运会筹备工作、乡村旅游、非物质文化遗产传承等各项重点工作，加快推进旅文事业产业协调发展，坚决扛起自贸港建设和儋洋一体化发展的旅文担当。（儋州融媒全媒体记者林晓云 通讯员周秋雨 陆盼盼 编辑李晓晖）,市旅文局传达学习习近平总书记考察海南时重要讲话精神 -- 今日儋州 -- 儋州市人民政府。儋州市融媒体中心消息 4月17日下午，市旅文局召开局党委扩大会议，传达学习习近平总书记考察海南时的重要讲话精神及省市重要会议精神，研究部署市旅文系统贯彻落实工作。 会议指出，全市旅文系统要充分认识习近平总书记考察海南的重大意义，深入学习宣传贯彻习近平总书记的重要讲话精神，进一步解放思想、开拓创新、团结奋斗、攻坚克难，努力办好人民满意和自贸港建设需要的旅文业，为加快推进海南自贸港建设和儋洋一体化发展贡献旅文智慧和力量。 就下一步如何贯彻落实工作，会议要求，一要把学习贯彻落实习近平总书记在海南考察时的重要讲话精神作为当前及今后一段时期的学习重点和工作指南，切实增强旅文干部职工服务自贸港建设和儋洋一体化发展的思想自觉和行动自觉。二要把坚定捍卫“两个确立”、坚决做到“两个维护”作为贯彻落实习近平总书记的重要讲话精神的着力点，结合旅文工作实际，找准工作结合点和切入点，全局的各项重点工作实行项目化、工单化管理，将习近平总书记重要讲话精神不折不扣落实到旅文工作各个环节，推动自贸港建设和儋洋一体化旅文工作高质量发展。三要切实将学习成果转化为促进各项工作高效开展的强大动力，结合“能力提升建设年”活动，着力创新工作方式方法、及时调整工作状态，以严的纪律和实的作风，全力抓好第六届省运会筹备工作、乡村旅游、非物质文化遗产传承等各项重点工作，加快推进旅文事业产业协调发展，坚决扛起自贸港建设和儋洋一体化发展的旅文担当。（儋州融媒全媒体记者林晓云 通讯员周秋雨 陆盼盼 编辑李晓晖）,其他,0.6856549287410648
225,海南省,儋州市,市审计局传达学习习近平总书记考察海南时的重要讲话精神,2022-04-20,https://www.danzhou.gov.cn/danzhou/ywdt/jrdz/202204/t20220421_3178203.html,市审计局传达学习习近平总书记考察海南时的重要讲话精神 -- 今日儋州 -- 儋州市人民政府。儋州市融媒体中心消息 4月18日，市审计局召开党组（扩大）会议，传达学习习近平总书记考察海南时的重要讲话精神。。4月18日，市审计局召开党组（扩大）会议，传达学习习近平总书记考察海南时的重要讲话精神。。会议强调，全局干部职工要把学习宣传贯彻习近平总书记考察海南时的重要讲话精神作为当前和今后一段时间的首要政治任务，迅速兴起学习宣传热潮，牢记嘱托，凝心聚力、踔厉奋发，不折不扣推动中央和省委各项决策部署在儋州落地。要以习近平总书记重要讲话精神为指引，围绕儋州洋浦一体化高质量发展的新要求，以强化审计质量为核心，以提升审计价值为导向，进一步做实做细研究型审计。要持续加大对重点领域、重点资金、重点部门的审计监督力度，积极推进审计全覆盖，认真履行审计监督职能。要结合“能力提升年”活动，继续深入实施“强审力”工程，持续打造一支学习能力强、业务水平高的审计干部队伍，为推动儋洋一体化高质量发展新局面提供审计担当。（儋州融媒全媒体记者韦雪梅 通讯员郭文凯 编辑朱建花）,市审计局传达学习习近平总书记考察海南时的重要讲话精神 -- 今日儋州 -- 儋州市人民政府。儋州市融媒体中心消息 4月18日，市审计局召开党组（扩大）会议，传达学习习近平总书记考察海南时的重要讲话精神。。4月18日，市审计局召开党组（扩大）会议，传达学习习近平总书记考察海南时的重要讲话精神。。会议强调，全局干部职工要把学习宣传贯彻习近平总书记考察海南时的重要讲话精神作为当前和今后一段时间的首要政治任务，迅速兴起学习宣传热潮，牢记嘱托，凝心聚力、踔厉奋发，不折不扣推动中央和省委各项决策部署在儋州落地。要以习近平总书记重要讲话精神为指引，围绕儋州洋浦一体化高质量发展的新要求，以强化审计质量为核心，以提升审计价值为导向，进一步做实做细研究型审计。要持续加大对重点领域、重点资金、重点部门的审计监督力度，积极推进审计全覆盖，认真履行审计监督职能。要结合“能力提升年”活动，继续深入实施“强审力”工程，持续打造一支学习能力强、业务水平高的审计干部队伍，为推动儋洋一体化高质量发展新局面提供审计担当。（儋州融媒全媒体记者韦雪梅 通讯员郭文凯 编辑朱建花）,其他,0.5577627291653293
225,海南省,儋州市,市委党校传达学习习近平总书记考察海南时的重要讲话精神,2022-04-22,https://www.danzhou.gov.cn/danzhou/ywdt/jrdz/202204/t20220422_3179578.html,市委党校传达学习习近平总书记考察海南时的重要讲话精神 -- 今日儋州 -- 儋州市人民政府。儋州市融媒体中心消息 4月18日下午，市委党校召开全校干部（教师）职工大会，传达学习习近平总书记考察海南时的重要讲话精神和儋州市委常委会（洋浦工委）扩大会议精神，强调全校干部（教师）职工要充分认识习近平总书记此次深入考察海南的重大意义，为加快建设中国特色自由贸易港扛起党校担当。 会议要求，要把学习习近平总书记考察海南时的重要讲话精神作为当前和今后一个时期的重要政治任务，持续深入学习贯彻习近平总书记重要讲话精神，深刻领悟，专题研究讨论，做到学懂弄通；要把习近平总书记重要讲话精神贯穿到党校工作的各个方面，具体体现在党校的教学工作、科研工作、理论宣讲等领域；要聚焦海南自贸港建设和儋洋一体化发展等热点，谋划好干部教育培训、科研资政、理论宣讲等工作，争取出一批高质量的理论成果，推动建设高质量、高水平的地级市一流党校。 与会人员纷纷表示，在今后的工作中要始终坚持“党校姓党”，做到“两个维护”，进一步解放思想、开拓创新、团结奋斗、攻坚克难，以“能力提升建设年”活动为契机，扎实推进当前各项工作，努力为海南自贸港建设和儋州洋浦一体化发展贡献党校智慧和力量。（儋州融媒全媒体记者夏佟 编辑王竞）,市委党校传达学习习近平总书记考察海南时的重要讲话精神 -- 今日儋州 -- 儋州市人民政府。儋州市融媒体中心消息 4月18日下午，市委党校召开全校干部（教师）职工大会，传达学习习近平总书记考察海南时的重要讲话精神和儋州市委常委会（洋浦工委）扩大会议精神，强调全校干部（教师）职工要充分认识习近平总书记此次深入考察海南的重大意义，为加快建设中国特色自由贸易港扛起党校担当。 会议要求，要把学习习近平总书记考察海南时的重要讲话精神作为当前和今后一个时期的重要政治任务，持续深入学习贯彻习近平总书记重要讲话精神，深刻领悟，专题研究讨论，做到学懂弄通；要把习近平总书记重要讲话精神贯穿到党校工作的各个方面，具体体现在党校的教学工作、科研工作、理论宣讲等领域；要聚焦海南自贸港建设和儋洋一体化发展等热点，谋划好干部教育培训、科研资政、理论宣讲等工作，争取出一批高质量的理论成果，推动建设高质量、高水平的地级市一流党校。 与会人员纷纷表示，在今后的工作中要始终坚持“党校姓党”，做到“两个维护”，进一步解放思想、开拓创新、团结奋斗、攻坚克难，以“能力提升建设年”活动为契机，扎实推进当前各项工作，努力为海南自贸港建设和儋州洋浦一体化发展贡献党校智慧和力量。（儋州融媒全媒体记者夏佟 编辑王竞）,其他,0.5572271019425524
225,海南省,儋州市,市教育局传达学习习近平总书记考察海南时的重要讲话精神,2022-04-20,https://www.danzhou.gov.cn/danzhou/ywdt/jrdz/202204/t20220421_3178204.html,市教育局传达学习习近平总书记考察海南时的重要讲话精神 -- 今日儋州 -- 儋州市人民政府。儋州市融媒体中心消息 4月18日，市教育局召开局党委（扩大）会，集中学习习近平总书记考察海南时的重要讲话精神，传达省委省政府、市委市政府相关会议部署要求。。4月18日，市教育局召开局党委（扩大）会，集中学习习近平总书记考察海南时的重要讲话精神，传达省委省政府、市委市政府相关会议部署要求。。会议要求，全市教育系统要认真学习领会习近平总书记考察海南时的重要讲话精神，进一步提高思想认识，增强“四个意识”、坚定“四个自信”、做到“两个维护”，抢抓机遇、真抓实干，坚定不移沿着总书记指引的方向奋勇前进，努力开创儋州洋浦一体化教育高质量发展新局面。要把学习宣传贯彻习近平总书记考察海南时的重要讲话精神作为当前和今后一段时期的重大政治任务，迅速掀起“大学习”热潮，引领广大党员干部全面系统学、深入思考学、联系实际学，推动学习宣传贯彻活动深入开展，确保学深学透。要组织上下结合省、市的宣讲团队开展宣讲，确保宣传学习有力有效。要强化责任担当，围绕大局推进中心工作。要以党建为统领推进教育事业发展，改进干部、校长、教师队伍的作风建设，提高专业能力，把基层党组织建设成坚强堡垒，营造良好的政治生态。（儋州融媒全媒体记者符武月 编辑朱建花）,市教育局传达学习习近平总书记考察海南时的重要讲话精神 -- 今日儋州 -- 儋州市人民政府。儋州市融媒体中心消息 4月18日，市教育局召开局党委（扩大）会，集中学习习近平总书记考察海南时的重要讲话精神，传达省委省政府、市委市政府相关会议部署要求。。4月18日，市教育局召开局党委（扩大）会，集中学习习近平总书记考察海南时的重要讲话精神，传达省委省政府、市委市政府相关会议部署要求。。会议要求，全市教育系统要认真学习领会习近平总书记考察海南时的重要讲话精神，进一步提高思想认识，增强“四个意识”、坚定“四个自信”、做到“两个维护”，抢抓机遇、真抓实干，坚定不移沿着总书记指引的方向奋勇前进，努力开创儋州洋浦一体化教育高质量发展新局面。要把学习宣传贯彻习近平总书记考察海南时的重要讲话精神作为当前和今后一段时期的重大政治任务，迅速掀起“大学习”热潮，引领广大党员干部全面系统学、深入思考学、联系实际学，推动学习宣传贯彻活动深入开展，确保学深学透。要组织上下结合省、市的宣讲团队开展宣讲，确保宣传学习有力有效。要强化责任担当，围绕大局推进中心工作。要以党建为统领推进教育事业发展，改进干部、校长、教师队伍的作风建设，提高专业能力，把基层党组织建设成坚强堡垒，营造良好的政治生态。（儋州融媒全媒体记者符武月 编辑朱建花）,其他,0.565285487914034
