code,province,city,topic,date,url,content,content,label,score
225,海南省,儋州市,云南省政协到儋州考察调研学习借鉴推广儋州经验推动橡胶产业提质增效李学林率队,2023-04-12,https://www.danzhou.gov.cn/danzhou/ywdt/jrdz/202304/t20230413_3397881.html,云南省政协到儋州考察调研 学习借鉴推广儋州经验 推动橡胶产业提质增效 李学林率队 -- 今日儋州 -- 儋州市人民政府。4月11日，云南省政协副主席李学林率调研组到儋州，围绕海南省天然橡胶产业发展情况开展考察调研。。当天，调研组来到海胶集团西联分公司橡胶种植基地、海胶集团中化橡胶加工厂、中国热带农业科学院儋州院区等地，就海南省天然橡胶产业发展情况，包括天然橡胶生产保护区暨标准化胶园建设、基础设施建设、橡胶种植管理、生产加工、市场主体培育、科技创新等情况，以及相关支持政策的出台和落实情况，遇到的问题和下一步工作重点等方面内容开展考察调研。。调研中，李学林表示，儋州橡胶在种苗、种植、加工、贸易、科技等领域取得的发展成果为云南橡胶产业的发展提供了可复制、可推广的经验。调研组将把儋州橡胶产业发展的好经验、好做法进行归纳、总结和梳理，对标云南橡胶的关键问题，为橡胶全产业链建设提供有效建议，推进橡胶产业转型升级，提升橡胶产业效益。。黎秀全表示，天然橡胶是国家战略物资和战略资源，儋州作为海南省最大的天然橡胶产区，橡胶产业一直是农业的重要支柱产业。近年来，儋州从建设好天然橡胶生产保护区、实施好天然橡胶价格保险、建设好国家现代农业产业园等方面开展工作，推动橡胶产业高质量发展。希望今后云南省政协与儋州建立畅通有效的沟通渠道，为儋州橡胶产业给予指导，协调研究相关政策，共同推动两省天然橡胶产业持续健康发展。（儋州融媒全媒体记者盘悦华 编辑李常）,云南省政协到儋州考察调研 学习借鉴推广儋州经验 推动橡胶产业提质增效 李学林率队 -- 今日儋州 -- 儋州市人民政府。4月11日，云南省政协副主席李学林率调研组到儋州，围绕海南省天然橡胶产业发展情况开展考察调研。。当天，调研组来到海胶集团西联分公司橡胶种植基地、海胶集团中化橡胶加工厂、中国热带农业科学院儋州院区等地，就海南省天然橡胶产业发展情况，包括天然橡胶生产保护区暨标准化胶园建设、基础设施建设、橡胶种植管理、生产加工、市场主体培育、科技创新等情况，以及相关支持政策的出台和落实情况，遇到的问题和下一步工作重点等方面内容开展考察调研。。调研中，李学林表示，儋州橡胶在种苗、种植、加工、贸易、科技等领域取得的发展成果为云南橡胶产业的发展提供了可复制、可推广的经验。调研组将把儋州橡胶产业发展的好经验、好做法进行归纳、总结和梳理，对标云南橡胶的关键问题，为橡胶全产业链建设提供有效建议，推进橡胶产业转型升级，提升橡胶产业效益。。黎秀全表示，天然橡胶是国家战略物资和战略资源，儋州作为海南省最大的天然橡胶产区，橡胶产业一直是农业的重要支柱产业。近年来，儋州从建设好天然橡胶生产保护区、实施好天然橡胶价格保险、建设好国家现代农业产业园等方面开展工作，推动橡胶产业高质量发展。希望今后云南省政协与儋州建立畅通有效的沟通渠道，为儋州橡胶产业给予指导，协调研究相关政策，共同推动两省天然橡胶产业持续健康发展。（儋州融媒全媒体记者盘悦华 编辑李常）,政府领导到其他城市考察学习或访问,0.0
225,海南省,儋州市,全市领导干部学习贯彻习近平总书记考察海南重要讲话和省第八次党代会精神专题培训班举办配图,2022-05-21,https://www.danzhou.gov.cn/danzhou/ywdt/jrdz/202205/t20220521_3198508.html,全市领导干部学习贯彻习近平总书记考察海南重要讲话和省第八次党代会精神专题培训班举办（配图） -- 今日儋州 -- 儋州市人民政府。5月20日下午，由市委组织部和市委党校联合举办的儋州市领导干部学习贯彻习近平总书记考察海南重要讲话和省第八次党代会精神专题培训班在市大戏院开班。儋州融媒全媒体记者 符武月 摄。儋州市融媒体中心消息 5月20日下午，由市委组织部和市委党校联合举办的儋州市领导干部“学习贯彻习近平总书记考察海南重要讲话和省第八次党代会精神”专题培训班在市大戏院开班。。此次培训班邀请省委政策研究室宣传思想研究处处长董三仁前来作专题辅导。董三仁以《省第八次党代会报告精要》为题，紧紧围绕省第八次党代会的精神实质和重要内涵，从报告的起草过程，报告的特点、要求、目标和重点工作任务等，为学员做了全面系统的讲解。整场专题报告主题鲜明、内容丰富、讲解精辟、具体深入，既有宏观指导，也有对下一步工作的启示思考，具有较强的指导性和针对性，对学员深刻理解和准确把握省第八次党代会精神有很大帮助。。培训班要求，要把深入学习贯彻习近平总书记考察海南时的重要讲话精神与学习贯彻省第八次党代会精神结合起来，围绕省第八次党代会确定的“一本三基四梁八柱”战略框架，切实把思想和行动统一到党中央和省委决策部署上来，坚决做到“六个深刻领会”“四个准确把握”“三个坚定不移”，切实把省第八次党代会确定的各项目标任务落实好，在推进儋州洋浦一体化高质量发展中不断展现新作为，让“儋州因洋浦而更加开放，洋浦因儋州而更有深度”。。各镇党政主要领导、各办事处班子成员，以及市直机关、市各人民团体和直属企事业单位副处级以上领导干部参加培训学习。（儋州融媒全媒体记者符武月 编辑李常）,全市领导干部学习贯彻习近平总书记考察海南重要讲话和省第八次党代会精神专题培训班举办（配图） -- 今日儋州 -- 儋州市人民政府。5月20日下午，由市委组织部和市委党校联合举办的儋州市领导干部学习贯彻习近平总书记考察海南重要讲话和省第八次党代会精神专题培训班在市大戏院开班。儋州融媒全媒体记者 符武月 摄。儋州市融媒体中心消息 5月20日下午，由市委组织部和市委党校联合举办的儋州市领导干部“学习贯彻习近平总书记考察海南重要讲话和省第八次党代会精神”专题培训班在市大戏院开班。。此次培训班邀请省委政策研究室宣传思想研究处处长董三仁前来作专题辅导。董三仁以《省第八次党代会报告精要》为题，紧紧围绕省第八次党代会的精神实质和重要内涵，从报告的起草过程，报告的特点、要求、目标和重点工作任务等，为学员做了全面系统的讲解。整场专题报告主题鲜明、内容丰富、讲解精辟、具体深入，既有宏观指导，也有对下一步工作的启示思考，具有较强的指导性和针对性，对学员深刻理解和准确把握省第八次党代会精神有很大帮助。。培训班要求，要把深入学习贯彻习近平总书记考察海南时的重要讲话精神与学习贯彻省第八次党代会精神结合起来，围绕省第八次党代会确定的“一本三基四梁八柱”战略框架，切实把思想和行动统一到党中央和省委决策部署上来，坚决做到“六个深刻领会”“四个准确把握”“三个坚定不移”，切实把省第八次党代会确定的各项目标任务落实好，在推进儋州洋浦一体化高质量发展中不断展现新作为，让“儋州因洋浦而更加开放，洋浦因儋州而更有深度”。。各镇党政主要领导、各办事处班子成员，以及市直机关、市各人民团体和直属企事业单位副处级以上领导干部参加培训学习。（儋州融媒全媒体记者符武月 编辑李常）,不属于政府领导到其他城市考察学习的新闻,0.5043015396650601
225,海南省,儋州市,学习贯彻习近平总书记考察海南重要讲话精神儋州调声山歌首场巡回宣讲举行配图,2024-04-09,https://www.danzhou.gov.cn/danzhou/ywdt/jrdz/202404/t20240409_3642129.html,“学习贯彻习近平总书记考察海南重要讲话精神”儋州调声山歌首场巡回宣讲举行（配图） -- 今日儋州 -- 儋州市人民政府。儋州市融媒体中心消息 “儋洋大地春潮涌，环岛公路通车马，任你看车水马龙……”4月8日晚，由市委宣传部主办，儋州那大三宝歌剧团承办的“学习贯彻习近平总书记考察海南重要讲话精神”儋州调声山歌首场巡回宣讲在市新时代文明实践中心广场举行。 当晚，演出在洪亮有力的《开场舞》中拉开帷幕，来自儋州那大三宝歌剧团的演员们紧紧围绕习近平总书记考察海南重要讲话精神，以儋州调声、儋州山歌等艺术形式，带来了歌舞《儋洋一体满门红》、山歌剧《遗产》等文艺节目，用群众喜闻乐见的传唱方式，将习近平总书记考察海南重要讲话精神唱给群众听，多样化展示儋洋一体化以来经济社会发展的新变化新气象新面貌。 优美的调声、山歌吸引了许多群众驻足观看，“这种演出，非常接地气，通俗易懂，我们老百姓很喜欢，听得懂，又好记。”市民郑女士告诉记者，演出从晚上8时开始，一直持续到10时才结束，她一直在现场观看，演出结束后她仍然觉得意犹未尽。 “接下来，山歌剧巡回宣讲还将陆续举办9场，在儋州洋浦各镇（办事处）进行演出，激励更多的儋洋人民自信自强、守正创新，以实际行动为儋洋一体化发展和海南自贸港建设作出贡献。”国家级非物质文化保护项目儋州调声传承人、儋州那大三宝歌剧团团长唐宝山说。（儋州融媒全媒体记者何万常 编辑朱建花 校对王丽华 审核王诗波）,“学习贯彻习近平总书记考察海南重要讲话精神”儋州调声山歌首场巡回宣讲举行（配图） -- 今日儋州 -- 儋州市人民政府。儋州市融媒体中心消息 “儋洋大地春潮涌，环岛公路通车马，任你看车水马龙……”4月8日晚，由市委宣传部主办，儋州那大三宝歌剧团承办的“学习贯彻习近平总书记考察海南重要讲话精神”儋州调声山歌首场巡回宣讲在市新时代文明实践中心广场举行。 当晚，演出在洪亮有力的《开场舞》中拉开帷幕，来自儋州那大三宝歌剧团的演员们紧紧围绕习近平总书记考察海南重要讲话精神，以儋州调声、儋州山歌等艺术形式，带来了歌舞《儋洋一体满门红》、山歌剧《遗产》等文艺节目，用群众喜闻乐见的传唱方式，将习近平总书记考察海南重要讲话精神唱给群众听，多样化展示儋洋一体化以来经济社会发展的新变化新气象新面貌。 优美的调声、山歌吸引了许多群众驻足观看，“这种演出，非常接地气，通俗易懂，我们老百姓很喜欢，听得懂，又好记。”市民郑女士告诉记者，演出从晚上8时开始，一直持续到10时才结束，她一直在现场观看，演出结束后她仍然觉得意犹未尽。 “接下来，山歌剧巡回宣讲还将陆续举办9场，在儋州洋浦各镇（办事处）进行演出，激励更多的儋洋人民自信自强、守正创新，以实际行动为儋洋一体化发展和海南自贸港建设作出贡献。”国家级非物质文化保护项目儋州调声传承人、儋州那大三宝歌剧团团长唐宝山说。（儋州融媒全媒体记者何万常 编辑朱建花 校对王丽华 审核王诗波）,其他,0.6192350508157586
225,海南省,儋州市,致公党儋州市支部委员会传达学习习近平总书记考察海南时的讲话精神,2022-04-24,https://www.danzhou.gov.cn/danzhou/ywdt/jrdz/202204/t20220424_3180138.html,致公党儋州市支部委员会传达学习习近平总书记考察海南时的讲话精神 -- 今日儋州 -- 儋州市人民政府。儋州市融媒体中心消息 4月22日，致公党儋州市支部委员会召开全体党员大会，传达学习习近平总书记在海南考察时的重要讲话精神，并对致公党儋州市支部下一阶段重点工作进行部署。 会议强调，在全岛封关运作准备工作加快推进的重要时刻，习近平总书记亲临海南考察指导，并发表了立意高远、思想深刻、内涵丰富的重要讲话，赋予海南新的使命，提出更高要求，意义重大、影响深远。致公党儋州市支部委员会将发挥“直通车”作用，找准在儋州洋浦一体化发展的功能定位，重点围绕“努力实现‘儋州因洋浦更加开放、洋浦因儋州更有深度’”开展深入调研，积极建言献策。 会议要求，致公党儋州市全体党员在当前儋洋一体化的形势下，要提高政治站位，夯实思想政治基础；加强自身建设，提高自身综合能力；发挥特色优势，履行参政议政职能。以饱满的热情和昂扬的斗志，积极、深入的参与到支部各项工作中，推动致公党儋州市支部工作打开新格局。（儋州融媒全媒体记者王敏权 通讯员王怀佳 编辑朱建花）,致公党儋州市支部委员会传达学习习近平总书记考察海南时的讲话精神 -- 今日儋州 -- 儋州市人民政府。儋州市融媒体中心消息 4月22日，致公党儋州市支部委员会召开全体党员大会，传达学习习近平总书记在海南考察时的重要讲话精神，并对致公党儋州市支部下一阶段重点工作进行部署。 会议强调，在全岛封关运作准备工作加快推进的重要时刻，习近平总书记亲临海南考察指导，并发表了立意高远、思想深刻、内涵丰富的重要讲话，赋予海南新的使命，提出更高要求，意义重大、影响深远。致公党儋州市支部委员会将发挥“直通车”作用，找准在儋州洋浦一体化发展的功能定位，重点围绕“努力实现‘儋州因洋浦更加开放、洋浦因儋州更有深度’”开展深入调研，积极建言献策。 会议要求，致公党儋州市全体党员在当前儋洋一体化的形势下，要提高政治站位，夯实思想政治基础；加强自身建设，提高自身综合能力；发挥特色优势，履行参政议政职能。以饱满的热情和昂扬的斗志，积极、深入的参与到支部各项工作中，推动致公党儋州市支部工作打开新格局。（儋州融媒全媒体记者王敏权 通讯员王怀佳 编辑朱建花）,其他,0.5224816544366414
225,海南省,儋州市,团市委赴海口市考察学习青年创新创业工作服务青年创业激发创新思维,2024-03-11,https://www.danzhou.gov.cn/danzhou/ywdt/jrdz/202403/t20240311_3615492.html,团市委赴海口市考察学习青年创新创业工作 服务青年创业 激发创新思维 -- 今日儋州 -- 儋州市人民政府。儋州市融媒体中心消息 近日，团市委一行赴海口市青年创新创业孵化基地和海南港澳青年创新创业服务中心参观考察学习，以实际行动全面参与儋洋一体化高质量发展，助力优化海南自贸港营商环境。。考察组一行参观海口市青年创新创业孵化基地，听取基地相关负责人详细介绍基地办公环境，运营基本情况、服务成效、“1+2+2”服务模式、分类服务典型案例、海口创业项目库及入库项目产品等工作内容。该基地由海口市青年创业创新促进会负责日常运营，致力于将孵化对象转变创业服务合作伙伴，把服务对象有价值的项目转化成孵化基地项目库资源，使得孵化基地的创业服务形成循环式的闭环服务。通过精细化服务持续擦亮共青团青创服务品牌，更好地支持城市高质量、可持续发展，让“青年因城市而聚，城市因青年而兴”的理念生根发芽，开花结果。。随后，考察组一行来到海南港澳青年创新创业服务中心参观学习港澳青年交流平台运行模式。该服务中心设有七大功能区域，深度对接琼港澳三地信息资源，负责人详细介绍服务中心的主要服务内容，有座谈会议、服务保障、合作共赢、考察交流、文体活动等多种形式。2023年共计开展各类交流活动35场，超1000人次港澳青年参与，在港澳青年创业圈具有一定的影响力，为港澳青年来琼创业提供落地综合服务、招商考察、活动策划、项目路演、商务会务等一站式创业服务，成为港澳青年在海南自贸港创新创业的“最佳拍档”。。团市委副书记姚俊表示，希望未来与海口各类青年创业基地加强联系交流，依托双方资源平台优势，通过整合资源，进一步加大港澳青年人才在儋州洋浦创新创业服务工作力度，带动青年创业创新工作上下游协同发展。（儋州融媒全媒体记者何万常 编辑朱建花 校对王明当 审核王霞）,团市委赴海口市考察学习青年创新创业工作 服务青年创业 激发创新思维 -- 今日儋州 -- 儋州市人民政府。儋州市融媒体中心消息 近日，团市委一行赴海口市青年创新创业孵化基地和海南港澳青年创新创业服务中心参观考察学习，以实际行动全面参与儋洋一体化高质量发展，助力优化海南自贸港营商环境。。考察组一行参观海口市青年创新创业孵化基地，听取基地相关负责人详细介绍基地办公环境，运营基本情况、服务成效、“1+2+2”服务模式、分类服务典型案例、海口创业项目库及入库项目产品等工作内容。该基地由海口市青年创业创新促进会负责日常运营，致力于将孵化对象转变创业服务合作伙伴，把服务对象有价值的项目转化成孵化基地项目库资源，使得孵化基地的创业服务形成循环式的闭环服务。通过精细化服务持续擦亮共青团青创服务品牌，更好地支持城市高质量、可持续发展，让“青年因城市而聚，城市因青年而兴”的理念生根发芽，开花结果。。随后，考察组一行来到海南港澳青年创新创业服务中心参观学习港澳青年交流平台运行模式。该服务中心设有七大功能区域，深度对接琼港澳三地信息资源，负责人详细介绍服务中心的主要服务内容，有座谈会议、服务保障、合作共赢、考察交流、文体活动等多种形式。2023年共计开展各类交流活动35场，超1000人次港澳青年参与，在港澳青年创业圈具有一定的影响力，为港澳青年来琼创业提供落地综合服务、招商考察、活动策划、项目路演、商务会务等一站式创业服务，成为港澳青年在海南自贸港创新创业的“最佳拍档”。。团市委副书记姚俊表示，希望未来与海口各类青年创业基地加强联系交流，依托双方资源平台优势，通过整合资源，进一步加大港澳青年人才在儋州洋浦创新创业服务工作力度，带动青年创业创新工作上下游协同发展。（儋州融媒全媒体记者何万常 编辑朱建花 校对王明当 审核王霞）,政府领导到其他城市考察学习或访问,0.0
225,海南省,儋州市,市科协专题学习习近平总书记在河南考察并指导第二批主题教育时重要指示精神,2019-09-27,https://www.danzhou.gov.cn/danzhou/kxjsxh/kxdt/201909/t20190927_2678572.html,市科协专题学习习近平总书记在河南考察并指导第二批主题教育时重要指示精神 -- 科协动态 -- 儋州市科协技术协会。年9月22日上午，市科协利用周末召开党组理论学习中心组（扩大）学习会议，专题学习习近平总书记在河南考察并指导第二批主题教育时重要指示精神。会议指出，学习好、贯彻好、落实好习近平总书记重要指示精神，是当前和今后一个时期首要政治任务，要进一步提高政治站位，增强“四个意识”，坚定“四个自信”，做到“两个维护”，迅速掀起学习宣传新热潮，要用心学进去、用情讲出来、用力做起来。全面学习传达、贯彻落实习近平总书记重要指示精神，要做到五个结合起来。。一是与学习贯彻习近平总书记对科协科普工作的重要指示批示精神结合起来。二是与学习贯彻习近平总书记关于打赢脱贫攻坚战、实施乡村振兴战略的指示精神结合起来。三是与贯彻落实市委市政府、省科协有关重大工作部署结合起来。四是与做好第二批“不忘初心、牢记使命”主题教育结合起来。五是与加强作风建设、传承发扬红色精神结合起来。。会议还组织学习了《海南省第二批“不忘初心、牢记使命”主题教育实施方案》，省委常委、组织部长彭金辉同志在全省第二批 “不忘初心、牢记使命”主题教育工作会议上的讲话精神。,市科协专题学习习近平总书记在河南考察并指导第二批主题教育时重要指示精神 -- 科协动态 -- 儋州市科协技术协会。年9月22日上午，市科协利用周末召开党组理论学习中心组（扩大）学习会议，专题学习习近平总书记在河南考察并指导第二批主题教育时重要指示精神。会议指出，学习好、贯彻好、落实好习近平总书记重要指示精神，是当前和今后一个时期首要政治任务，要进一步提高政治站位，增强“四个意识”，坚定“四个自信”，做到“两个维护”，迅速掀起学习宣传新热潮，要用心学进去、用情讲出来、用力做起来。全面学习传达、贯彻落实习近平总书记重要指示精神，要做到五个结合起来。。一是与学习贯彻习近平总书记对科协科普工作的重要指示批示精神结合起来。二是与学习贯彻习近平总书记关于打赢脱贫攻坚战、实施乡村振兴战略的指示精神结合起来。三是与贯彻落实市委市政府、省科协有关重大工作部署结合起来。四是与做好第二批“不忘初心、牢记使命”主题教育结合起来。五是与加强作风建设、传承发扬红色精神结合起来。。会议还组织学习了《海南省第二批“不忘初心、牢记使命”主题教育实施方案》，省委常委、组织部长彭金辉同志在全省第二批 “不忘初心、牢记使命”主题教育工作会议上的讲话精神。,其他,0.648318277513213
