code,province,city,topic,date,url,content,content,label,score
225,海南省,儋州市,我市经贸考察团在粤学习考察张耕率团,2015-05-21,https://www.danzhou.gov.cn/danzhou/ywdt/jrdz/201505/t20150521_1778372.html,据《今日儋州》消息 5月19日至20日，市委副书记、市长张耕率我市经贸考察团先后到广东省广州市、深圳市开展经贸交流与合作学习考察活动，宣传推介儋州投资发展环境，洽谈投资合作项目。 市委常委、统战部部长唐龙海，市人大常委会副主任林明忠，市政府秘书长肖发宣参加考察。 广东广物房地产开发有限公司是一家致力于房地产开发的大型混合所有制股份企业，目前在儋州建设光村雪茄风情小镇项目。 19日上午，考察团在该公司总部考察时详细了解了公司情况。张耕说，广物地产参与雪茄风情文化的打造与建设，再一次践行了广物地产公司“每到一座城市，奉献一座品质地标”的品牌价值，光村雪茄风情小镇的打造，不仅可以充分发挥雪茄文化的优势，以文化带动旅游，用旅游创造新价值，同时也将把儋州的旅游文化建设推上了一个新高度。希望广物地产公司进一步明确建设方向和工作思路，充分发挥企业的主导作用，进一步整合项目，优化配置资源，提升产业内涵，以产业支撑风情小镇建设，带动地方经济发展和农民增收，实现可持续发展。市相关部门大力支持雪茄风情小镇建设，千方百计帮助解决项目推进建设中存在的困难和问题，特别是在水、电、气等基础设施建设和土地供应上要重点给予扶持，凝聚合力，为加快项目建设进度，推动儋州发展作出新贡献。 随后，考察团一行还考察了香港豪德集团、香港东方宏基集团有限公司、广州市大誉瑞兴资产管理有限公司、深圳市立航货运有限公司、广州智慧谷艺术建材科技有限公司等企业。张耕说，作为海南西部中心城市，儋州与洋浦经济开发区融为一体，境内公路铁路贯通，港口航运连接四海，投资开发面向东南亚，区位优势明显，是海南西部地区的交通枢纽，特别是海南西环高铁、海南西部机场、“田”字型高速公路等省重大基础设施项目或在建，或将开工建设，这都为儋州构建完善的“海陆空”交通奠定了坚实基础，也为儋州发展产业提供了良好条件。近年来，儋州加大招商引资力度，大抓项目、抓大项目，引进了一批大企业、大项目，通过项目建设带动经济社会跨越发展，促进了全市产业升级，也为企业投资儋州提供了绝佳的发展机遇。真诚希望各企业把目光聚焦儋州，尽早到儋州考察、投资、兴业，共同携手开创互惠双赢的美好未来。市委、市政府将积极协调有关部门，为企业发展提供一流的政策和服务环境，助力企业发展壮大。 在粤考察期间，考察团还与广州市、深圳市儋州籍企业家座谈，祝愿儋州籍企业家在外发展得越来越好的同时，把握发展良机，把先进的思想理念和管理经验、成熟的科学技术和优秀团队带回儋州，在儋州投资置业发展，共同见证儋州科学发展快速崛起。（特派记者韦雪梅 编辑范志平）,据《今日儋州》消息 5月19日至20日，市委副书记、市长张耕率我市经贸考察团先后到广东省广州市、深圳市开展经贸交流与合作学习考察活动，宣传推介儋州投资发展环境，洽谈投资合作项目。 市委常委、统战部部长唐龙海，市人大常委会副主任林明忠，市政府秘书长肖发宣参加考察。 广东广物房地产开发有限公司是一家致力于房地产开发的大型混合所有制股份企业，目前在儋州建设光村雪茄风情小镇项目。 19日上午，考察团在该公司总部考察时详细了解了公司情况。张耕说，广物地产参与雪茄风情文化的打造与建设，再一次践行了广物地产公司“每到一座城市，奉献一座品质地标”的品牌价值，光村雪茄风情小镇的打造，不仅可以充分发挥雪茄文化的优势，以文化带动旅游，用旅游创造新价值，同时也将把儋州的旅游文化建设推上了一个新高度。希望广物地产公司进一步明确建设方向和工作思路，充分发挥企业的主导作用，进一步整合项目，优化配置资源，提升产业内涵，以产业支撑风情小镇建设，带动地方经济发展和农民增收，实现可持续发展。市相关部门大力支持雪茄风情小镇建设，千方百计帮助解决项目推进建设中存在的困难和问题，特别是在水、电、气等基础设施建设和土地供应上要重点给予扶持，凝聚合力，为加快项目建设进度，推动儋州发展作出新贡献。 随后，考察团一行还考察了香港豪德集团、香港东方宏基集团有限公司、广州市大誉瑞兴资产管理有限公司、深圳市立航货运有限公司、广州智慧谷艺术建材科技有限公司等企业。张耕说，作为海南西部中心城市，儋州与洋浦经济开发区融为一体，境内公路铁路贯通，港口航运连接四海，投资开发面向东南亚，区位优势明显，是海南西部地区的交通枢纽，特别是海南西环高铁、海南西部机场、“田”字型高速公路等省重大基础设施项目或在建，或将开工建设，这都为儋州构建完善的“海陆空”交通奠定了坚实基础，也为儋州发展产业提供了良好条件。近年来，儋州加大招商引资力度，大抓项目、抓大项目，引进了一批大企业、大项目，通过项目建设带动经济社会跨越发展，促进了全市产业升级，也为企业投资儋州提供了绝佳的发展机遇。真诚希望各企业把目光聚焦儋州，尽早到儋州考察、投资、兴业，共同携手开创互惠双赢的美好未来。市委、市政府将积极协调有关部门，为企业发展提供一流的政策和服务环境，助力企业发展壮大。 在粤考察期间，考察团还与广州市、深圳市儋州籍企业家座谈，祝愿儋州籍企业家在外发展得越来越好的同时，把握发展良机，把先进的思想理念和管理经验、成熟的科学技术和优秀团队带回儋州，在儋州投资置业发展，共同见证儋州科学发展快速崛起。（特派记者韦雪梅 编辑范志平）,政府领导到其他城市考察学习或访问,0.7581868991376716
225,海南省,儋州市,张耕率考察团在苏沪学习考察配组图,2015-09-11,https://www.danzhou.gov.cn/danzhou/ywdt/jrdz/201509/t20150911_1779279.html,9月9日至10日，我市考察团到江苏省无锡市进行学习考察，并与该市党政班子领导座谈。图为市委副书记、市长张耕与无锡市委副书记、市长汪泉在交谈。,9月9日至10日，我市考察团到江苏省无锡市进行学习考察，并与该市党政班子领导座谈。图为市委副书记、市长张耕与无锡市委副书记、市长汪泉在交谈。,政府领导到其他城市考察学习或访问,0.0
225,海南省,儋州市,我市考察团赴无锡学习考察张耕参加座谈,2015-09-10,https://www.danzhou.gov.cn/danzhou/ywdt/jrdz/201509/t20150910_1779274.html,儋州新闻中心消息 9月9日至10日，我市组成考察团飞赴江苏省无锡市进行学习考察，并与该市党政班子举行座谈，就进一步推进两地今后加强合作、促进经济社会发展进行深入交流。 市委副书记、市长张耕，市政府秘书长肖发宣参加座谈。 无锡市委副书记、市长汪泉，副市长王进建，市政府秘书长叶勤良出席座谈会。 座谈时，汪泉代表无锡市委、市政府对儋州考察团一行的到来表示欢迎。随后简要介绍了无锡市的经济社会发展情况。 据了解，无锡是中国吴文化、中国民族工商业和中国乡镇企业的发祥地。近年来，该市把全面建设小康社会作为经济社会发展的主旋律，以建设国家创新型城市、社会主义现代化新农村和国家生态园林城市为目标，以加强党的建设为保障，大力开展“科教兴市、人才强市”促进年活动，全面推广“昆山、华西、尚德”经验，加快推动经济社会发展模式创新，着力落实建设“富裕无锡”、打造“文化名城”、调整经济结构、优化考评指标四项任务，经济社会发展连年跃上新台阶，先后荣获“中国优秀旅游城市”、“全国环保模范城市”、“国家园林城市”、“全国科教兴市先进城市”、“创建全国文明城市工作先进城市”、“中国十大最具经济活力城市”等称号。 在听取无锡市的情况介绍后，张耕代表市委、市政府和考察团对无锡市委、市政府热情周到的安排表示感谢。在简要介绍儋州的投资环境以及近年来经济社会发展情况，他说，近年来，无锡市深入贯彻科学发展观，从实际出发，改革创新，开拓进取，推动经济社会实现了又好又快发展，成绩巨大，令人振奋。无锡的发展思路新、起点高、气魄大、成效显著，特别是在开展“大拆违”、“大建设”提升城市形象；大力实施“工业立市”战略增强工业经济实力；多举措推进园区经济发展等方面的做法和经验，值得儋州学习借鉴。 张耕表示，此次儋州组团来无锡学习考察，不仅看到了与无锡等先进发达地区的差距，也开阔了眼界和视野，增强了发展的危机感、紧迫感。儋州与无锡都是历史悠久的城市，特点类似、条件相近，积极推进两地交流合作意义深远。我们热切希望两地以此为新起点，进一步增进了解、深化友谊、扩大合作，携手迈向新高度。同时也真诚地希望无锡的市民和企业，能到儋州看一看、走一走，给儋州传经送宝、共叙友谊，与儋州共谋合作、共图发展。 市政府办、发改委、工信局等部门负责人参加了座谈会。（记者李秋欢 编辑范志平）,儋州新闻中心消息 9月9日至10日，我市组成考察团飞赴江苏省无锡市进行学习考察，并与该市党政班子举行座谈，就进一步推进两地今后加强合作、促进经济社会发展进行深入交流。 市委副书记、市长张耕，市政府秘书长肖发宣参加座谈。 无锡市委副书记、市长汪泉，副市长王进建，市政府秘书长叶勤良出席座谈会。 座谈时，汪泉代表无锡市委、市政府对儋州考察团一行的到来表示欢迎。随后简要介绍了无锡市的经济社会发展情况。 据了解，无锡是中国吴文化、中国民族工商业和中国乡镇企业的发祥地。近年来，该市把全面建设小康社会作为经济社会发展的主旋律，以建设国家创新型城市、社会主义现代化新农村和国家生态园林城市为目标，以加强党的建设为保障，大力开展“科教兴市、人才强市”促进年活动，全面推广“昆山、华西、尚德”经验，加快推动经济社会发展模式创新，着力落实建设“富裕无锡”、打造“文化名城”、调整经济结构、优化考评指标四项任务，经济社会发展连年跃上新台阶，先后荣获“中国优秀旅游城市”、“全国环保模范城市”、“国家园林城市”、“全国科教兴市先进城市”、“创建全国文明城市工作先进城市”、“中国十大最具经济活力城市”等称号。 在听取无锡市的情况介绍后，张耕代表市委、市政府和考察团对无锡市委、市政府热情周到的安排表示感谢。在简要介绍儋州的投资环境以及近年来经济社会发展情况，他说，近年来，无锡市深入贯彻科学发展观，从实际出发，改革创新，开拓进取，推动经济社会实现了又好又快发展，成绩巨大，令人振奋。无锡的发展思路新、起点高、气魄大、成效显著，特别是在开展“大拆违”、“大建设”提升城市形象；大力实施“工业立市”战略增强工业经济实力；多举措推进园区经济发展等方面的做法和经验，值得儋州学习借鉴。 张耕表示，此次儋州组团来无锡学习考察，不仅看到了与无锡等先进发达地区的差距，也开阔了眼界和视野，增强了发展的危机感、紧迫感。儋州与无锡都是历史悠久的城市，特点类似、条件相近，积极推进两地交流合作意义深远。我们热切希望两地以此为新起点，进一步增进了解、深化友谊、扩大合作，携手迈向新高度。同时也真诚地希望无锡的市民和企业，能到儋州看一看、走一走，给儋州传经送宝、共叙友谊，与儋州共谋合作、共图发展。 市政府办、发改委、工信局等部门负责人参加了座谈会。（记者李秋欢 编辑范志平）,政府领导到其他城市考察学习或访问,0.0
225,海南省,儋州市,邓泽永率市政协考察团赴琼海考察学习配组图,2016-05-17,https://www.danzhou.gov.cn/danzhou/ywdt/jrdz/201605/t20160518_1781487.html,邓泽永率市政协考察团赴琼海考察学习（配组图） -- 今日儋州 -- 儋州市人民政府。据《今日儋州》消息 5月16日，由市政协党组书记、主席邓泽永率领的市政协考察团一行到琼海，考察学习琼海美丽乡村和风情小镇建设情况。通过考察，考察团成员一致表示要认真学习借鉴琼海的先进经验和做法，积极为推进儋州美丽乡村和风情小镇建设献言献策，努力探索出适合美丽与生态并行的乡村发展道路。 市政协党组副书记、副主席王应才，市政协党组成员、副主席陈星影，市政协副主席谢群峰及市政协副秘书长谢盛江一同考察。 当天，考察团先后考察了琼海市万泉水乡风情小镇、会山黎苗风情小镇、嘉积镇北仍村、会山镇加脑村的美丽乡村建设。每到一处，考察团成员都认真了解琼海在风情小镇建设和美丽乡村建设中的做法和经验，并就如何结合地方特色资源和特色文化，因地制宜打造特色风情小镇、推进美丽乡村建设与琼海市相关领导深入交流。 邓泽永在考察时表示，在打造特色风情小镇、推进美丽乡村建设工作中，琼海坚持“不砍树、不拆房、不占田，就地城镇化”原则，在定位规划、资源整合、完善基础设施建设、打造乡村特色等方面的做法令人印象深刻。同时该市因地制宜，结合生态环境资源、业态资源和地方文化特色，从宜业、宜居、宜游、宜文的战略高度，高起点高品位规划建设风情小镇和美丽乡村，创建出各具特色风情小镇和美丽乡村的做法经验，值得儋州学习借鉴。他要求参加考察的政协委员要学习借鉴琼海的经验做法，集思广益，为儋州打造风情小镇和推进美丽乡村建设出谋划策，为探索出适合儋州的乡村发展道路贡献力量。 当天，考察组还参观考察了琼海镇博鳌机场。 琼海市政协党组副书记、主席符平陪同考察。（记者李绍远 编辑何焕翠）。5月16日，市政协党组书记、主席邓泽永率领市政协考察团到琼海市考察。图为考察团成员在万泉水乡风情小镇考察时的情形。。市政协党组书记、主席邓泽永在万泉水乡风情小镇考察时向有关人员了解情况。 图片由记者 李绍远 摄,邓泽永率市政协考察团赴琼海考察学习（配组图） -- 今日儋州 -- 儋州市人民政府。据《今日儋州》消息 5月16日，由市政协党组书记、主席邓泽永率领的市政协考察团一行到琼海，考察学习琼海美丽乡村和风情小镇建设情况。通过考察，考察团成员一致表示要认真学习借鉴琼海的先进经验和做法，积极为推进儋州美丽乡村和风情小镇建设献言献策，努力探索出适合美丽与生态并行的乡村发展道路。 市政协党组副书记、副主席王应才，市政协党组成员、副主席陈星影，市政协副主席谢群峰及市政协副秘书长谢盛江一同考察。 当天，考察团先后考察了琼海市万泉水乡风情小镇、会山黎苗风情小镇、嘉积镇北仍村、会山镇加脑村的美丽乡村建设。每到一处，考察团成员都认真了解琼海在风情小镇建设和美丽乡村建设中的做法和经验，并就如何结合地方特色资源和特色文化，因地制宜打造特色风情小镇、推进美丽乡村建设与琼海市相关领导深入交流。 邓泽永在考察时表示，在打造特色风情小镇、推进美丽乡村建设工作中，琼海坚持“不砍树、不拆房、不占田，就地城镇化”原则，在定位规划、资源整合、完善基础设施建设、打造乡村特色等方面的做法令人印象深刻。同时该市因地制宜，结合生态环境资源、业态资源和地方文化特色，从宜业、宜居、宜游、宜文的战略高度，高起点高品位规划建设风情小镇和美丽乡村，创建出各具特色风情小镇和美丽乡村的做法经验，值得儋州学习借鉴。他要求参加考察的政协委员要学习借鉴琼海的经验做法，集思广益，为儋州打造风情小镇和推进美丽乡村建设出谋划策，为探索出适合儋州的乡村发展道路贡献力量。 当天，考察组还参观考察了琼海镇博鳌机场。 琼海市政协党组副书记、主席符平陪同考察。（记者李绍远 编辑何焕翠）。5月16日，市政协党组书记、主席邓泽永率领市政协考察团到琼海市考察。图为考察团成员在万泉水乡风情小镇考察时的情形。。市政协党组书记、主席邓泽永在万泉水乡风情小镇考察时向有关人员了解情况。 图片由记者 李绍远 摄,政府领导到其他城市考察学习或访问,0.5386957306830026
225,海南省,儋州市,外出考察学习真本领谋产业扶贫新路径和庆镇赴定安县龙湖镇考察学习扶贫产业,2019-07-07,https://www.danzhou.gov.cn/danzhou/zfxxgkzl/xz/hqz/gkml/201907/t20190707_2625426.html,外出考察学习真本领 谋产业扶贫新路径——和庆镇赴定安县龙湖镇考察学习扶贫产业 -- 儋州市人民政府网。日，市人大常委会副主任王安仍、王建斌带领我镇人大代表、驻村工作队等三十余人，赴定安县龙湖镇考察学习沉香产业和食用菌产业。。察学习组成员首先到达定安县文笔峰脚下的香岛沉香种植基地。在基地现场，考察学习组成员认真学习了解沉香的品种特质、结香技术、管理方法、市场需求等内容，探讨沉香产业在和庆落户发展的可行性。紧接着考察学习组到达海南沉香博物馆参观学习沉香文化发展史，直观深入了解沉香文化价值与市场需求。沉香作为海南珍贵乡土树种，浑身是宝，是珍贵的中药材和香料，具有良好的市场价值。。随后，学习考察组到达龙湖南科食用菌有限公司生产基地，学习以食用菌为纽带的循环生态农业发展模式。。此次考察学习，让和庆镇人大代表、驻村工作队进一步开拓了视野，坚定了和庆镇产业发展的信心。镇人大代表纷纷表示将进一步深入结合实际情况探索产业发展方向，积极参与扶贫产业发展，积极推进村级产业扶贫项目建设，组织有条件的代表通过“企业,外出考察学习真本领 谋产业扶贫新路径——和庆镇赴定安县龙湖镇考察学习扶贫产业 -- 儋州市人民政府网。日，市人大常委会副主任王安仍、王建斌带领我镇人大代表、驻村工作队等三十余人，赴定安县龙湖镇考察学习沉香产业和食用菌产业。。察学习组成员首先到达定安县文笔峰脚下的香岛沉香种植基地。在基地现场，考察学习组成员认真学习了解沉香的品种特质、结香技术、管理方法、市场需求等内容，探讨沉香产业在和庆落户发展的可行性。紧接着考察学习组到达海南沉香博物馆参观学习沉香文化发展史，直观深入了解沉香文化价值与市场需求。沉香作为海南珍贵乡土树种，浑身是宝，是珍贵的中药材和香料，具有良好的市场价值。。随后，学习考察组到达龙湖南科食用菌有限公司生产基地，学习以食用菌为纽带的循环生态农业发展模式。。此次考察学习，让和庆镇人大代表、驻村工作队进一步开拓了视野，坚定了和庆镇产业发展的信心。镇人大代表纷纷表示将进一步深入结合实际情况探索产业发展方向，积极参与扶贫产业发展，积极推进村级产业扶贫项目建设，组织有条件的代表通过“企业,政府领导到其他城市考察学习或访问,0.0
