code,province,city,topic,date,url,content,content.1,label,score,is_match,是否为“学习考察”新闻
16,山西省,阳泉市,传达学习贯彻习近平总书记在湖南考察时重要讲话精神,2024-03-29,http://www.yq.gov.cn/ywdt/snyw/202403/t20240329_1859703.shtml,研究巩固拓展主题教育成果、加强党的建设、老干部等工作 省委书记唐登杰主持召开省委常委会会议。3月28日，省委召开常委会会议，传达学习贯彻习近平总书记在湖南考察时的重要讲话精神，传达全国老干部局长会议精神，研究我省贯彻落实意见，审议《关于贯彻落实〈中共中央办公厅关于巩固拓展学习贯彻习近平新时代中国特色社会主义思想主题教育成果的意见〉的若干措施》《中共山西省委2024年落实全面从严治党主体责任暨党建工作领导小组工作要点》，对春季森林草原防火工作作出部署。省委书记唐登杰主持会议。。会议指出，要深入学习贯彻习近平总书记在湖南考察时的重要讲话精神，牢牢把握我省在构建新发展格局中的战略定位，切实扛牢国家资源型经济转型综改试验区建设、深化能源革命综合改革试点、推动黄河流域生态保护和高质量发展、打造内陆地区对外开放新高地等重大使命任务，在推动中部地区崛起中奋勇争先，奋力谱写中国式现代化山西篇章。要深入实施创新驱动发展战略，以科技创新引领产业创新，积极培育和发展新质生产力，努力做大做强先进制造业，着力改造提升传统产业，加快构建体现山西特色优势的现代化产业体系。要纵深推进能源革命综合改革试点，着力建设新型能源体系，为保障国家能源安全作出更大贡献。要进一步全面深化改革，扩大高水平对外开放，积极参与全国统一大市场建设，助力国家战略腹地建设，更好服务和融入新发展格局。要抓住种子和耕地两个要害，加快种业、农机关键核心技术攻关，积极发展“特”“优”农业，扛牢维护国家粮食安全重任。要学习运用“千万工程”经验，畅通城乡要素双向流动，落实防止返贫监测帮扶机制，推进乡村全面振兴和城乡融合发展。要更好担负起新的文化使命，加强文物和文化遗产保护，繁荣发展文化事业和文化产业，发展新型文化业态，推动文旅深度融合，加快建设文化强省。要加强和改进党的建设，巩固拓展主题教育成果，持续深化整治形式主义为基层减负，按照党中央统一部署组织开展好党纪学习教育，引导党员干部在全省高质量发展和现代化建设中担当作为、干事创业。。会议指出，要把巩固拓展主题教育成果作为重大政治任务，建立健全以学铸魂、以学增智、以学正风、以学促干的长效机制，持续做好学习贯彻习近平新时代中国特色社会主义思想的深化、转化工作，推动以自我革命精神解决党风方面的突出问题，大兴务实之风、弘扬清廉之风、养成俭朴之风，提振广大党员干部干事创业、狠抓落实的精气神，为全省高质量发展和现代化建设凝聚强大力量。各级党委（党组）要扛牢主体责任，加强评估问效，切实将我省在主题教育期间形成的有效做法运用到日常工作的研究谋划、督促指导和推进落实中，推动各方面工作高质量发展。党员领导干部要以更高标准和更严要求走在前、作表率，以自身学习贯彻和问题整改的实际成效，带动全省广大党员干部自觉做习近平新时代中国特色社会主义思想的坚定信仰者和忠实实践者。。会议强调，各级党委（党组）要深入学习领会习近平总书记关于党的建设的重要思想和关于党的自我革命的重要思想，认真落实全面从严治党主体责任，加强对本地区本部门全面从严治党各项工作的领导，不断提高党的建设质量和水平。党委（党组）书记要履行好抓党建第一责任人职责，班子成员要履行好“一岗双责”，切实形成齐抓共管的强大合力。。会议强调，当前正处于春季森林草原防火的紧要期，全省各级各部门要坚持安全第一、预防为主，抓好火源管控、预警监测、宣传引导、值班值守、应急处置等各项工作，全力守护人民群众生命财产安全。,研究巩固拓展主题教育成果、加强党的建设、老干部等工作 省委书记唐登杰主持召开省委常委会会议。3月28日，省委召开常委会会议，传达学习贯彻习近平总书记在湖南考察时的重要讲话精神，传达全国老干部局长会议精神，研究我省贯彻落实意见，审议《关于贯彻落实〈中共中央办公厅关于巩固拓展学习贯彻习近平新时代中国特色社会主义思想主题教育成果的意见〉的若干措施》《中共山西省委2024年落实全面从严治党主体责任暨党建工作领导小组工作要点》，对春季森林草原防火工作作出部署。省委书记唐登杰主持会议。。会议指出，要深入学习贯彻习近平总书记在湖南考察时的重要讲话精神，牢牢把握我省在构建新发展格局中的战略定位，切实扛牢国家资源型经济转型综改试验区建设、深化能源革命综合改革试点、推动黄河流域生态保护和高质量发展、打造内陆地区对外开放新高地等重大使命任务，在推动中部地区崛起中奋勇争先，奋力谱写中国式现代化山西篇章。要深入实施创新驱动发展战略，以科技创新引领产业创新，积极培育和发展新质生产力，努力做大做强先进制造业，着力改造提升传统产业，加快构建体现山西特色优势的现代化产业体系。要纵深推进能源革命综合改革试点，着力建设新型能源体系，为保障国家能源安全作出更大贡献。要进一步全面深化改革，扩大高水平对外开放，积极参与全国统一大市场建设，助力国家战略腹地建设，更好服务和融入新发展格局。要抓住种子和耕地两个要害，加快种业、农机关键核心技术攻关，积极发展“特”“优”农业，扛牢维护国家粮食安全重任。要学习运用“千万工程”经验，畅通城乡要素双向流动，落实防止返贫监测帮扶机制，推进乡村全面振兴和城乡融合发展。要更好担负起新的文化使命，加强文物和文化遗产保护，繁荣发展文化事业和文化产业，发展新型文化业态，推动文旅深度融合，加快建设文化强省。要加强和改进党的建设，巩固拓展主题教育成果，持续深化整治形式主义为基层减负，按照党中央统一部署组织开展好党纪学习教育，引导党员干部在全省高质量发展和现代化建设中担当作为、干事创业。。会议指出，要把巩固拓展主题教育成果作为重大政治任务，建立健全以学铸魂、以学增智、以学正风、以学促干的长效机制，持续做好学习贯彻习近平新时代中国特色社会主义思想的深化、转化工作，推动以自我革命精神解决党风方面的突出问题，大兴务实之风、弘扬清廉之风、养成俭朴之风，提振广大党员干部干事创业、狠抓落实的精气神，为全省高质量发展和现代化建设凝聚强大力量。各级党委（党组）要扛牢主体责任，加强评估问效，切实将我省在主题教育期间形成的有效做法运用到日常工作的研究谋划、督促指导和推进落实中，推动各方面工作高质量发展。党员领导干部要以更高标准和更严要求走在前、作表率，以自身学习贯彻和问题整改的实际成效，带动全省广大党员干部自觉做习近平新时代中国特色社会主义思想的坚定信仰者和忠实实践者。。会议强调，各级党委（党组）要深入学习领会习近平总书记关于党的建设的重要思想和关于党的自我革命的重要思想，认真落实全面从严治党主体责任，加强对本地区本部门全面从严治党各项工作的领导，不断提高党的建设质量和水平。党委（党组）书记要履行好抓党建第一责任人职责，班子成员要履行好“一岗双责”，切实形成齐抓共管的强大合力。。会议强调，当前正处于春季森林草原防火的紧要期，全省各级各部门要坚持安全第一、预防为主，抓好火源管控、预警监测、宣传引导、值班值守、应急处置等各项工作，全力守护人民群众生命财产安全。,其他,0.6757288423067865,False,否
16,山西省,阳泉市,深入学习贯彻习近平总书记在全国科技大会和在青海宁夏考察时的重要讲话精神,2024-06-28,http://www.yq.gov.cn/ywdt/snyw/202406/t20240628_1915783.shtml,研究部署防汛抗旱、耕地保护和粮食安全、巩固拓展脱贫攻坚成果同乡村振兴有效衔接等工作 省委书记唐登杰主持召开省委常委会会议。6月27日，省委召开常委会会议，传达学习贯彻习近平总书记在全国科技大会上、在青海宁夏考察时的重要讲话精神和对防汛抗旱工作的重要指示精神，听取我省耕地保护和粮食安全责任制工作落实、2023年度市县党委和政府巩固拓展脱贫攻坚成果同乡村振兴有效衔接考核情况汇报，审议通过《山西省2023年度国家巩固拓展脱贫攻坚成果同乡村振兴有效衔接考核评估反馈问题整改工作方案》。省委书记唐登杰主持会议。。会议指出，习近平总书记在全国科技大会上的重要讲话，为做好新时代科技工作指明了前进方向、提供了根本遵循。要深刻领会习近平总书记重要讲话精神的丰富内涵、精髓要义和实践要求，立足山西实际，发挥比较优势，不断强化科技的战略先导地位和根本支撑作用，为加快实现高水平科技自立自强、建设科技强国作出山西贡献。要扎实推动新型举国体制山西实践，完善党对科技工作领导的体制机制，积极融入国家战略科技力量建设，构建具有山西特色的区域科技创新体系。要推动科技创新和产业创新深度融合，强化企业科技创新主体地位，因地制宜培育和发展新质生产力。要以高质量建设晋创谷等创新平台为抓手，加强创新资源优化配置，进一步完善省域科技创新布局。要深化教育科技人才体制机制一体改革，完善科教协同育人机制，加快培养造就创新型人才队伍。要加强科技领域对外开放合作，主动对接国内外创新资源，更好承接产业转移和人才流动。。会议指出，要把深入学习贯彻习近平总书记在青海、宁夏考察时的重要讲话精神，同学习贯彻习近平总书记对山西工作的重要讲话重要指示精神结合起来，坚持以科技创新引领产业创新，加快构建体现山西特色和优势的现代化产业体系。着力深化重点领域改革，打造更具竞争力的内陆地区对外开放新高地。加强普惠性、基础性、兜底性民生事业建设，不断增进民生福祉。全方位、全地域、全过程开展生态文明建设，筑牢黄河中游和京津冀地区重要生态屏障。全面贯彻新时代党的民族工作大政方针和宗教工作理论、方针政策，切实维护宗教和顺、社会和谐、民族和睦。深入开展党纪学习教育，持续深化整治形式主义为基层减负，以优良党风凝聚人心、引领社会风气。。会议指出，要认真贯彻落实习近平总书记对防汛抗旱工作的重要指示精神，准确把握今年汛情旱情的复杂性严峻性，强化风险意识、底线思维，进一步强化监测预警，排查风险隐患，备足装备物资，完善工作预案，认真做好防汛抗旱各项工作。当前要扎实抓好抗旱保灌溉保供水工作，确保城乡居民饮水安全。。会议指出，要深入学习贯彻习近平总书记关于耕地保护和保障国家粮食安全的重要论述，提高政治站位，心怀“国之大者”，落实党政同责，深入实施藏粮于地、藏粮于技战略，持续推进耕地保护整治提升行动，加大高标准农田建设投入和管护力度，着力提升粮食生产能力，为保障国家粮食安全作出山西贡献。。会议指出，要全面贯彻落实党中央关于巩固拓展脱贫攻坚成果同乡村振兴有效衔接的决策部署和工作要求，扎实推进防止返贫动态监测帮扶、强化产业就业支撑、促进脱贫人口持续稳定增收、建设宜居宜业和美乡村等重点工作，较真碰硬抓好问题整改，牢牢守住不发生规模性返贫的底线，长效巩固拓展脱贫攻坚成果，为推进乡村全面振兴打下坚实基础。,研究部署防汛抗旱、耕地保护和粮食安全、巩固拓展脱贫攻坚成果同乡村振兴有效衔接等工作 省委书记唐登杰主持召开省委常委会会议。6月27日，省委召开常委会会议，传达学习贯彻习近平总书记在全国科技大会上、在青海宁夏考察时的重要讲话精神和对防汛抗旱工作的重要指示精神，听取我省耕地保护和粮食安全责任制工作落实、2023年度市县党委和政府巩固拓展脱贫攻坚成果同乡村振兴有效衔接考核情况汇报，审议通过《山西省2023年度国家巩固拓展脱贫攻坚成果同乡村振兴有效衔接考核评估反馈问题整改工作方案》。省委书记唐登杰主持会议。。会议指出，习近平总书记在全国科技大会上的重要讲话，为做好新时代科技工作指明了前进方向、提供了根本遵循。要深刻领会习近平总书记重要讲话精神的丰富内涵、精髓要义和实践要求，立足山西实际，发挥比较优势，不断强化科技的战略先导地位和根本支撑作用，为加快实现高水平科技自立自强、建设科技强国作出山西贡献。要扎实推动新型举国体制山西实践，完善党对科技工作领导的体制机制，积极融入国家战略科技力量建设，构建具有山西特色的区域科技创新体系。要推动科技创新和产业创新深度融合，强化企业科技创新主体地位，因地制宜培育和发展新质生产力。要以高质量建设晋创谷等创新平台为抓手，加强创新资源优化配置，进一步完善省域科技创新布局。要深化教育科技人才体制机制一体改革，完善科教协同育人机制，加快培养造就创新型人才队伍。要加强科技领域对外开放合作，主动对接国内外创新资源，更好承接产业转移和人才流动。。会议指出，要把深入学习贯彻习近平总书记在青海、宁夏考察时的重要讲话精神，同学习贯彻习近平总书记对山西工作的重要讲话重要指示精神结合起来，坚持以科技创新引领产业创新，加快构建体现山西特色和优势的现代化产业体系。着力深化重点领域改革，打造更具竞争力的内陆地区对外开放新高地。加强普惠性、基础性、兜底性民生事业建设，不断增进民生福祉。全方位、全地域、全过程开展生态文明建设，筑牢黄河中游和京津冀地区重要生态屏障。全面贯彻新时代党的民族工作大政方针和宗教工作理论、方针政策，切实维护宗教和顺、社会和谐、民族和睦。深入开展党纪学习教育，持续深化整治形式主义为基层减负，以优良党风凝聚人心、引领社会风气。。会议指出，要认真贯彻落实习近平总书记对防汛抗旱工作的重要指示精神，准确把握今年汛情旱情的复杂性严峻性，强化风险意识、底线思维，进一步强化监测预警，排查风险隐患，备足装备物资，完善工作预案，认真做好防汛抗旱各项工作。当前要扎实抓好抗旱保灌溉保供水工作，确保城乡居民饮水安全。。会议指出，要深入学习贯彻习近平总书记关于耕地保护和保障国家粮食安全的重要论述，提高政治站位，心怀“国之大者”，落实党政同责，深入实施藏粮于地、藏粮于技战略，持续推进耕地保护整治提升行动，加大高标准农田建设投入和管护力度，着力提升粮食生产能力，为保障国家粮食安全作出山西贡献。。会议指出，要全面贯彻落实党中央关于巩固拓展脱贫攻坚成果同乡村振兴有效衔接的决策部署和工作要求，扎实推进防止返贫动态监测帮扶、强化产业就业支撑、促进脱贫人口持续稳定增收、建设宜居宜业和美乡村等重点工作，较真碰硬抓好问题整改，牢牢守住不发生规模性返贫的底线，长效巩固拓展脱贫攻坚成果，为推进乡村全面振兴打下坚实基础。,其他,0.6065211582384548,False,否
