code,province,city,topic,date,url,content,content,label,score
79,江苏省,镇江市,徐州市教育代表团来镇考察我市智慧校园建设,2018-03-29,http://jyj.zhenjiang.gov.cn/jyj/jyyw/201803/7e913682f44443cc81434eee61eaaefa.shtml,3月27日，徐州市电化教育馆组织辖市区电教中心主任、“智慧校园”试点校校长一行十五人来镇江进行为期一天半的”智慧校园“建设工作考察学习活动。 27日下午市教育信息化中心向考察团分享了我市智慧校园创建过程的相关做法，遇到的困难，取得的成果和经验。我市在创建过程中形成的”守住底线，适度超前，应用为王，彰显特色“的理念以及创建工作全过程的扎实推进等方面给考察团留下了深刻的印象。大家还就关心的一些共性问题进行了深入交流。 28日考察团先后考察了我市中华路小学，市外国语学校。在学校考察团听取了润州区电教中心区域推进智慧校园建设的报告，两个学校的创建情况介绍，参观了学校信息化设施设备和相关应用。 我市学校创建的理念、做法、成果引发了大家热情的讨论。考察团一行认为，我市创建工作起步早，建设过程扎实，成效高，有许多成功经验值得学习。,您提出的关于打造特色影视服务产业链的提案收悉，首先感谢您对我市影视服务产业的关心和支持。经研究现答复如下：。镇江影视服装产业发展历史悠久，在国内演艺界有一定的影响力，据我们了解，目前镇江从事影视服装道具大规模生产的企业有3家，分别是镇江影剧服装工艺厂有限责任公司、三戚舞台服饰道具有限公司和金霓影视服饰道具工艺厂。其中镇江影剧服装工艺厂生产规模最大。镇江影剧服装工艺厂2001年成立，位于丹徒新城恒园路12号，占地面积3万平方米，拥有自主品牌“霓裳”，是江苏省著名商标、江苏省名牌产品。平均年销售额6000万元，占据国内市场的40%。设计制作的演出服参与到北京奥运会开幕式、广州亚运会、香港东亚会、沈阳全运会等国际国内大型赛事，以及国家大剧院歌剧《图兰朵》、杭州实景演出《宋城千古情》等大型表演。三戚舞台服饰道具有限公司目前入驻在文旅国际文化创意产业园内，它在营销推广上较为灵活，不仅开通公司网页进行作品展示、服装租赁等，还在横店影视基地开设分公司，为各摄制组在拍摄现场提供服装制作、租赁专线服务。金霓影视服饰道具工艺厂位于润州区鲇鱼套产业基地，占地约2000平米，公司自2003年成立以来，先后制作参与《武烈王》、《詹天佑》、《新隋唐英雄传》等一百多部影视剧。。镇江最早从事影视服装的人员，都是国营镇江影剧服装工艺厂的职工，后因企业改制、经营管理、市场等原因，许多人走出来独立经营，形成了现在这样的格局。由于各家都是民营企业，又分散在不同的辖区，政府从宏观上进行整合比较困难，我们更多地在政府服务上下功夫。根据您的提案建议，下一步我们将加大对我市影视服装产业发展的研究，并结合我们工作实际，推动影视服务产业发展壮大：。一是鼓励和支持影视服装产业创新融合发展。依据国家和省文化产业鼓励扶持发展方向，引导企业扩大经营范围，创新经营方式。组织影视服装企业家“走出去”，考察学习，开阔视野。对服装道具生产改扩建、成立影视服装创意设计中心，打造影视服装道具体验中心等项目，我们积极帮助申报国家、省文化产业引导资金，在市级文化发展引导资金给予倾斜。对有融资需求的项目，我们优先列入“镇文贷”项目储备库，通过“镇文贷”解决企业转型发展中的资金问题，促进企业做大做强。2012年帮助镇江影剧服装工艺厂的中国影视、舞台表演服饰文化产业基地项目争取到省级文化产业引导资金120万元。。二是加大对外宣传力度。利用好各类展馆资源，优先支持企业参加苏州创博会、深圳文博会、义乌文交会、无锡文博会等全国性展会。策划主办或承办影视戏剧服装道具交易博览会，搭建行业学习交流平台，促进更大合作。文化产业招商活动中重点推介，吸引高校、行业协会、企业联合开展培训学习、衍生品创意设计、体验消费等基地建设，形成多条产业链。2017年金霓影视服饰先后参展扬州文博会和无锡文博会，受到了现场游客的关注和好评。。三是推动影视服装产业集聚区建设。目前，镇江文旅集团在镇江新区打造文旅国际文化创意产业园，该园区初步设想以镇江三戚舞台服饰道具有限公司影视服装为龙头，整合影视服装上下游产业链，推出镇江影视服装展示平台，打造影视服装特色产业集群。下一步我们将积极做好园区的跟踪服务指导工作，加强政策宣讲、资金扶持、宣传推介，版权保护等工作，努力营造良好的产业发展环境，推动形成集聚下的规模效应。,其他,0.6278239163954367
79,江苏省,镇江市,扬州教育代表团来省镇江一中考察拔尖创新人才培养工作,2018-03-20,http://jyj.zhenjiang.gov.cn/jyj/jydt/201803/0fb80cd538f2427b9d4d182ef19ddded.shtml,3月16日，扬州市教育代表团由扬州市教育局周应华局长带队，各区县教育局长，江苏省扬州中学、扬大附中、5所县中高中校长以及市局相关人员一行19人，在镇江市教育局刘元良局长陪同下，到省镇江一中考察学习拔尖创新人才培养经验。 校领导向代表团成员介绍了学校围绕创新人才培养开展的系列工作和取得的成绩，代表团对学校近4年学校取得的辉煌成绩感到惊叹，同时对学校在创新人才培养上以国家人才发展战略、学校创建高品质示范高中为契机，在建构模式上形成了三“课”合一的模式，并逐步形成“基础课程、拓展课程、卓越课程”三个层次的立体化核心课程体系产生了浓厚的兴趣。 考察后双方表示，扬州镇江两地要继续加强交流与合作，为学生发展、教师成长提供更多共赢平台。,2月1日，如东县文明办副主任缪恒、骆舒洪率如东江海义工联合会、海洲文化发展公司一行近30人，在镇江市文明办领导陪同下，来到镇江崇实女子中学，考察学习该校文明礼仪养成教育的做法。 如东客人参观了女中校园、养正学堂“八大中心”、“汉推”基地等，边走边拍边记，还一路询问相关情况，对崇实女中文明礼仪养成教育所做的工作和所取得的成绩表示赞赏。 崇实女中针对女孩子生理、心理特点进行了文明礼仪养成教育和体育的融合研究，向省教育厅成功申报了“花样体育”课程基地。花样体育课程基地的建设，能让更多的女孩子从优秀走向优雅，是实施更高水平文明礼仪养成教育的创新之举。女中依托学校养正学堂、建设花样体育课程基地开展“八礼四仪”养成教育的经验和做法受到了省市有关部门的高度肯定和赞誉，日前受江苏教育频道《凡事讲礼》节目邀请，到南京参加了以“培育阳光女孩，成就优雅女性，让女生从优秀走向优雅”为主题的访谈节目的录制。,政府领导到其他城市考察学习或访问,0.0
79,江苏省,镇江市,扬州市卫计委卫监系统赴镇参观学习,2018-03-08,http://wjw.zhenjiang.gov.cn/wjw/zcfgpd/201803/fe5c8abca558401e93c0b16836c4cbc8.shtml,为更好地拓展思路，共同推进两市卫生计生协管工作再上新台阶，近日，扬州市卫计委赴镇开展卫生计生监督协管交流互动。。座谈交流会上，委政策法规处张道驹处长对扬州市各位同仁的到来表示热烈欢迎。市卫生监督所陈国年所长详细介绍了我市卫生计生监督协管组织架构、队伍建设、工作模式、主要做法等总体情况。。京口区所陈刚所长、新区分所陈国银所长分别结合当地协管工作实际作了交流发言。其中，京口专职卫生监督员管理模式，新区分所“监督员+协管员”双轮驱动等模式令人印象深刻。。双方就当前卫生监督协管工作中，如何调动卫生计生监督协管员的工作积极性，更好地发挥协管作用、做好基本公共卫生计生监督协管服务等核心问题，进行了深入探讨和互动。下午，扬州市卫计委一行赴扬中市进行现场实地考察学习。。此次两地交流互动，为今后两地群策群力、携手进一步加强卫生计生监督协管队伍建设、能力建设、机制建设等方面提供了宝贵的经验。,1月31日，市文广新局周文娟局长率队赴上海博物馆、上海市历史博物馆考察学习博物馆陈列布展工作。。2018年，完成镇江博物馆改扩建工程列入了市政府为民办好“10件实事”。为高标准、高起点、按时做好陈列布展的各项工作，市文广新局组成考察组到上海进行了考察学习，借鉴学习陈列布展的先进经验。考察组在上海博物馆与馆领导进行了座谈交流，听取了博物馆及东馆建设等情况介绍，咨询交流了博物馆陈列设计理念、文化创意、社会教育等方面构想，参观了山西博物院藏古代壁画艺术展、俄罗斯国立特列恰科夫美术馆珍品展。考察组在上海市历史博物馆与馆领导进行了座谈交流，听取了博物馆建设及陈列布展的情况介绍，参观了试开放的基本陈列。考察组对上海博物馆、上海市历史博物馆在功能布置、陈列布展、文化创意、社会教育等方面的新理念、新方法留下了深刻印象，下一步，将会吸收借鉴其中的好经验好做法，把镇江博物馆改扩建工程做成精品工程。（文物处）,其他,0.5216353879028517
79,江苏省,镇江市,镇外团队赴宁波二中考察学习智慧课堂,2018-03-13,http://jyj.zhenjiang.gov.cn/jyj/jydt/201803/22c327e2098a43c781e5616ac5188c97.shtml,近日，镇外团队一行七人前往宁波二中，重点考察该校的教育信息化创新——“智慧课堂”，以及智慧校园建设和应用情况。 据悉，宁波二中正逐步推进智慧教育大数据平台建设，智慧教学课堂应用建设。此次镇外团队重点观摩了畅言智慧课堂应用情况。畅言智慧课堂实现了教学决策数据化、评价反馈即时化、交流互动立体化、资源推送智能化，创设有利于协作交流和意义建构的学习环境，通过智慧的教与学，促进全体学生实现符合个性化成长规律的智慧发展。 此次考察交流活动，团队一行深切感受了智慧课堂的魅力，也为学校后期深入推进“智慧课堂”的建设，拓宽教师信息化应用的视野提供了宝贵的实践经验。,2018年度中国人民政治协商会议镇江市委员会新区工作委员会预算公开 | 镇江新区管理委员会。1.组织辖区内的镇江市、京口区政协委员学习、贯彻党的路线、方针、政策，学习、贯彻省、市和新区党工委的决议、决定，按照市政协的工作部署，结合新区实际开展工作。。2.组织辖区内的政协委员，就全市和新区经济社会发展中的重点工作、事关人民群众根本利益的重大问题和群众关注、反映的重要问题，开展专题协商、专项视察和调查研究，提出意见和建议，审议通过以政协新区工委名义提出的建议案、提案、视察调研报告。。3.督查由新区管委会办公室承办的政协委员提案，督促相关部门加大提案办理工作力度，提高提案办理质量。。4.组织和指导镇、街道开展政协工作。指导镇、街道政协联络委员会完善工作机制，履行政协职能，落实本工委有关工作部署和任务。。5.召集辖区内的市政协委员出席市政协全体会议，参加市政协组织的重要会议和活动，协助市政协开展有关视察、调研活动。组织辖区内的政协委员参加新区有关重要会议和活动。。6.协助统战部门团结、联系新区有关统战对象，配合新区党工委、管委会做好协调关系、维护稳定的工作。。2．从预算单位构成看，纳入本部门2018年部门汇总预算编制范围的预算单位共计1家，具体包括： 中国人民政治协商会议镇江市委员会新区工作委员会部门本级。。1.认真组织民主协商，全力服务发展大局。切实发挥政协作为民主协商重要渠道作用，选择全面深化改革、加强科技创新、发展现代农业、推进绿色低碳发展、完善城市功能等在新区经济社会发展中具有综合性、全局性和前瞻性的重点工作、重要工程和重大项目建设，作为专题协商的重点。组织政协委员充分利用多种协商形式，开展实地考察，广泛调研，讨论会商，提出有价值、有分量、有针对性的意见和建议。为新区党工委、管委会落实现代化建设任务、加快跨越发展建言献策。约请党工委、管委会分管领导以及相关职能部门负责人，就协商事项充分交换意见。做好协商事项办理情况的跟踪、督办工作，确保协商结果的落实、转化。。2.深入开展参政议政，凝聚合力建言献策。组织政协委员围绕产业发展、创新创业、生态环保、环境提升、集成改革、社会民生、扶贫助困等主题，开展4次以上集中视察活动。挑选提升教育产业发展质效、深化商事制度改革、推进安全生产监督管理等重点课题，以委员活动小组为单位开展专题调研，形成一批高质量的调研成果，供新区党工委、管委会决策参考。组织开展“政协委员接待人民群众日”活动，组织委员深入城乡社区、产业园区，零距离收集社区居民、企业投资经营者、基层组织负责人对经济社会发展、社会民生事业等方面的意见建议，做好分类归纳，转交相关部门和单位办理。。3.扎实推进民主监督，助推工作贯彻落实。结合“倡导低碳方式、共建绿色家园”政协委员主题活动，继续深入推进政协工委八大低碳主题行动。根据新区党工委、管委会确定的年度中心工作，发挥政协委员职能作用，重点对“两减六治三提升”专项行动的推进情况开展民主监督，进行专项评议，帮助打好“三治三清”攻坚战，提升生态建设质效。深入贯彻落实市委办公室《关于加强和改进人民政协民主监督工作的实施意见》，进一步完善提案建议督办促办机制和办理结果满意度回复制度。认真实施与新区督查部门的联动监督机制，组织政协委员参与全区“三重”事项督查，全力在督准、督实、督深、督严上做文章，确保党工委、管委会各项决策部署落地生根。组织召开政协委员监督员工作座谈会，支持推荐委员担任、受聘各部门、行业的特邀监督员、行风评议员、听证代表等，充分发挥政协委员在改进工作作风、推动部门工作等方面的积极作用。,其他,0.6690251935713611
79,江苏省,镇江市,黄石市铁山区来丹考察学习,2018-03-02,http://www.danyang.gov.cn/danyang/dyxw/201803/a6cea1db5b1b4d2591874f9d733d6f91.shtml,昨日上午，湖北省黄石市铁山区委副书记、区长晏勇带领党政代表团一行来丹，考察学习我市工模具项目建设和科技创新、转型升级先进经验和做法，市领导周东明、刘宏程接待了代表团一行。 座谈会上，市委常委、丹北镇党委书记周东明介绍了我市经济社会发展情况，并交流了我市在转型升级、科技创新等方面的工作经验和工作方法。据了解，经过长期发展，我市逐步形成了具有地方特色的传统特色产业，其中，眼镜产业已形成集研发设计、生产销售、休闲观光、商贸旅游于一体的完整产业链，成为丹阳的产业符号和城市名片；汽车零部件产业已形成了集研发、生产、检测、物流、培训、专业园区于一体的产业体系，全市现有整车及零部件生产企业1000余家；木业产业现拥有国内同行业十大品牌中的圣象、肯帝亚、双凤三大品牌，所开发的前沿产品，绿色环保、市场占有率高；五金工具产业，以高速工具钢、金刚石锯片、餐具、锁、高精五金配件等为主要产品，并涌现了天工等一批规模企业。在大力发展传统特色产业的同时，我市精心培育了一批新兴产业，在新材料产业、生物医药和医疗器械产业、高端装备制造产业等方面形成一批创新型增长点，促进了产业的转型升级。 随后，晏勇介绍了铁山区的经济社会发展情况。铁山区位于湖北省黄石市西部，矿产丰富，以盛产铁矿石而得名，是中国近代钢铁工业的摇篮。 考察组一行先后参观了中国（丹阳）国际眼镜城以及天工集团，详细了解了我市眼镜产业、眼镜风尚小镇建设以及天工集团发展情况。,1月16日下午，市工商局局长邓国平，副局长周君梅、赵剑萍，注册处、企业处、信用处、民营经济协会负责同志赴泰州市工商局考察学习。泰州市工商局局长孙群、副局长唐龙础及相关处室、协会介绍了他们的经验和做法。 2017年泰州市工商局主动作为，会同市编办（审改办）、法制办等部门积极试点“证照分离”改革，取得突破性进展；重点抓、抓重点，企业年报率跨越式提升至设区市第一名；“双随机一公开”工作由试点到全面推开，积累了许多经验；民营经济发展和民营经济协会工作成效明显。 邓国平表示泰州市工商局在工商注册便利化改革、加强事中事后监管、服务民营经济发展等方面做了大量工作，取得了优异成绩，积累了许多经验，展现出良好的精神风貌，值得镇江工商人学习和借鉴。双方还就许多关心的问题进行了深入地探讨。(注册处)。2017年泰州市工商局主动作为，会同市编办（审改办）、法制办等部门积极试点“证照分离”改革，取得突破性进展；重点抓、抓重点，企业年报率跨越式提升至设区市第一名；“双随机一公开”工作由试点到全面推开，积累了许多经验；民营经济发展和民营经济协会工作成效明显。。邓国平表示泰州市工商局在工商注册便利化改革、加强事中事后监管、服务民营经济发展等方面做了大量工作，取得了优异成绩，积累了许多经验，展现出良好的精神风貌，值得镇江工商人学习和借鉴。双方还就许多关心的问题进行了深入地探讨。(注册处),其他,0.5214004711352066
