code,province,city,topic,date,url,content,content,label,score
79,江苏省,镇江市,仪征市委老干局和镇江市场监管局赴丹阳局考察学习离退休干部党建工作,2020-07-16,http://wgl.zhenjiang.gov.cn/wgl/wlzx/202007/7f33cde91c184db9825bf45868d01b25.shtml,仪征市委老干局和镇江市场监管局赴丹阳局考察学习离退休干部党建工作 | 镇江市文化广电和旅游局。为进一步拓宽老干部工作思路，探索各项重点工作的创新举措，7月13日、14日，扬州仪征市委老干部局和镇江市场监督管理局考察学习组在有关领导带领下赴丹阳市文体广电和旅游局考察学习离退休干部党建工作。丹阳老干部局主要领导张志明陪同调研。。考察学习组参观丹阳市文体广电和旅游局老干部政治活动中心，详细了解“六有一提升”达标创优工作的情况，相互交流了老干部活动阵地建设的相关经验。考察组随行的老同志，对丹阳文体广电和旅游局针对机构合并和老同志多的特点，整合资源并建立专门政治活动中心的做法，给予一致的好评。。通过此次交流学习活动，不仅加深了三地老干部深厚的兄弟情谊，而且通过相互学习、相互交流，各自取长补短，对做好新时代老干部工作有了更深刻的认识。双方一致认为，将以此次交流学习活动为契机，在今后的工作中进一步加强沟通联系、深化交流学习，相互借鉴好的经验做法，不断开拓工作思路，达到共同学习进步、共同提高工作的目的，共同推进老干部工作创新发展、迈上新台阶。（丹阳市文体广电和旅游局）,仪征市委老干局和镇江市场监管局赴丹阳局考察学习离退休干部党建工作 | 镇江市文化广电和旅游局。为进一步拓宽老干部工作思路，探索各项重点工作的创新举措，7月13日、14日，扬州仪征市委老干部局和镇江市场监督管理局考察学习组在有关领导带领下赴丹阳市文体广电和旅游局考察学习离退休干部党建工作。丹阳老干部局主要领导张志明陪同调研。。考察学习组参观丹阳市文体广电和旅游局老干部政治活动中心，详细了解“六有一提升”达标创优工作的情况，相互交流了老干部活动阵地建设的相关经验。考察组随行的老同志，对丹阳文体广电和旅游局针对机构合并和老同志多的特点，整合资源并建立专门政治活动中心的做法，给予一致的好评。。通过此次交流学习活动，不仅加深了三地老干部深厚的兄弟情谊，而且通过相互学习、相互交流，各自取长补短，对做好新时代老干部工作有了更深刻的认识。双方一致认为，将以此次交流学习活动为契机，在今后的工作中进一步加强沟通联系、深化交流学习，相互借鉴好的经验做法，不断开拓工作思路，达到共同学习进步、共同提高工作的目的，共同推进老干部工作创新发展、迈上新台阶。（丹阳市文体广电和旅游局）,政府领导到其他城市考察学习或访问,0.0
79,江苏省,镇江市,区领导率队赴扬州南通学习考察街道集成改革,2020-07-10,http://www.jingkou.gov.cn/jingkou/jkyw/202007/5432548d8135438584acbed9c61b2c71.shtml,考察组一行先后来到扬州市邗江区槐泗镇为民服务中心、西湖镇指挥调度中心，南通市崇川区学田街道社会治理现代化指挥中心、文峰街道中央商务区社区公共服务中心，详细考察了一体化指挥平台建设和使用、审批服务执法力量配置、综合行政执法、网格治理等工作的开展情况。。考察过程中，考察组分别就基层审批服务便民化改革、平台资源共享、网格工作人员配备、考核等方面进行了深入交流。。杨国平指出，此次考察的相关镇和街道改革工作起步早、措施实、成效好，具有很强的学习借鉴作用。下一步，要结合我区实际，把考察中的好思路、好做法带到工作中去，尽快拿出各街道工作实施方案，系统推进基层“三整合”改革，加快构建简约高效的“1+4”基层治理新模式。。主办单位：镇江市京口区人民政府办公室 承办单位：镇江市京口区区域社会治理现代化指挥中心,考察组一行先后来到扬州市邗江区槐泗镇为民服务中心、西湖镇指挥调度中心，南通市崇川区学田街道社会治理现代化指挥中心、文峰街道中央商务区社区公共服务中心，详细考察了一体化指挥平台建设和使用、审批服务执法力量配置、综合行政执法、网格治理等工作的开展情况。。考察过程中，考察组分别就基层审批服务便民化改革、平台资源共享、网格工作人员配备、考核等方面进行了深入交流。。杨国平指出，此次考察的相关镇和街道改革工作起步早、措施实、成效好，具有很强的学习借鉴作用。下一步，要结合我区实际，把考察中的好思路、好做法带到工作中去，尽快拿出各街道工作实施方案，系统推进基层“三整合”改革，加快构建简约高效的“1+4”基层治理新模式。。主办单位：镇江市京口区人民政府办公室 承办单位：镇江市京口区区域社会治理现代化指挥中心,政府领导到其他城市考察学习或访问,0.0
79,江苏省,镇江市,扬中市西来桥镇打造非公企业高质量发展红色引擎,2020-07-08,http://www.zhenjiang.gov.cn/zhenjiang/qxdt/202007/d58c3926d9934be5bdc8519bc8c88694.shtml,镇江市人民政府办公室关于2024年第二季度政务新媒体和政府网站政务公开栏目检查情况通报。镇江市人民政府关于印发镇江市推动大规模设备更新和消费品以旧换新行动方案（2024~2027年）的通知。“嘟……”伴随着声声鸣笛，日前，由位于西来桥镇的大津重工建造的8000吨散装货运船缓缓驶离码头，远赴俄罗斯。“没有党建引领，没有党员先锋，没有红色动能，我们肯定抢不回受疫情耽搁的造船工期，按期完成了两条俄罗斯8000吨的散装货运船。”在大津重工党群活动中心，副总经理、党支部书记屠亚龙感慨万千。“红色动能”激发“大津速度”，“红色引擎”则驱动西来桥奔腾起来。近年来，西来桥镇切实找准非公党建工作的着力点，让非公企业党建有组织、有阵地、有人抓、有人管，实现了党建与非公企业发展的“双赢互促”，为全镇经济高质量发展提供了动力支持。。该镇党委组织统战委员唐玲介绍，该镇现有非公党支部（含社会组织）17个。从2019年开始，西来桥镇将非公企业党建作为书记项目，抓牢抓实。成立党建指导员队伍，对全镇所有党支部开展“手把手教学、点对点督导、实打实反馈”的党建工作指导，推进基层党建上台阶、提层次。开展党员义工志愿服务，引导机关党组织结合工作职责，开展为民为企服务，为企业发展、职工生活等提供帮助和服务，形成良性的互动关系。。筑牢基层党建的工作基础，提升工作能力。以“五有”机制为抓手，即组织有力覆盖、阵地有序提标、活动有机整合、队伍有机奖励、作用有效发挥，将非公企业党建的基础一步一步打牢、夯实。开展阵地提标升级，实现非公企业党建阵地差异化建设，打造出亿阀党群综合体、大津党群活动阵地这样的高标准阵地，同时对小微企业、党建基础相对薄弱的企业，按照“六有”标准，规范建设基本党建阵地。开设“书记沙龙”，组织非公企业党组织书记赴威腾实地考察学习非公企业党建阵地和品牌，参观友好村宽心圩等红色教育基地，邀请专家、领导围绕《支部工作条例》、“不忘初心、牢记使命”主题教育目标要求、习近平新时代中国特色社会主义思想等专题进行学习培训，提高非公企业党务工作者政治素养和实务操作水平。。西来桥海晟党支部提出了“三服务”理念——服务企业我先行、服务职工我先行、服务社会我先行，将党员职工的命运与企业发展、社会进步、服务群众相结合，在企业发展中党员发挥了强有力的示范引领作用。。近年来，该镇积极推进非公企业党建与企业发展的融合度，增强党建促发展水平。融合企业增效，推动非公企业党组织与企业经营管理层“双向进入、交叉任职”，让党组织及时了解掌握企业的发展战略、重要决策，把企业的发展目标转化为党组织的工作目标，参与企业的生产经营决策，让企业党组织的生命力得到提升，双向双赢。广泛开展“我为企业发展献一计”“党员示范班组”“党员项目”等创建活动，引导广大党员成为企业科技研发、项目升级的助理和骨干，同时在生产经营骨干中培养发展党员，壮大企业党员队伍。,镇江市人民政府办公室关于2024年第二季度政务新媒体和政府网站政务公开栏目检查情况通报。镇江市人民政府关于印发镇江市推动大规模设备更新和消费品以旧换新行动方案（2024~2027年）的通知。“嘟……”伴随着声声鸣笛，日前，由位于西来桥镇的大津重工建造的8000吨散装货运船缓缓驶离码头，远赴俄罗斯。“没有党建引领，没有党员先锋，没有红色动能，我们肯定抢不回受疫情耽搁的造船工期，按期完成了两条俄罗斯8000吨的散装货运船。”在大津重工党群活动中心，副总经理、党支部书记屠亚龙感慨万千。“红色动能”激发“大津速度”，“红色引擎”则驱动西来桥奔腾起来。近年来，西来桥镇切实找准非公党建工作的着力点，让非公企业党建有组织、有阵地、有人抓、有人管，实现了党建与非公企业发展的“双赢互促”，为全镇经济高质量发展提供了动力支持。。该镇党委组织统战委员唐玲介绍，该镇现有非公党支部（含社会组织）17个。从2019年开始，西来桥镇将非公企业党建作为书记项目，抓牢抓实。成立党建指导员队伍，对全镇所有党支部开展“手把手教学、点对点督导、实打实反馈”的党建工作指导，推进基层党建上台阶、提层次。开展党员义工志愿服务，引导机关党组织结合工作职责，开展为民为企服务，为企业发展、职工生活等提供帮助和服务，形成良性的互动关系。。筑牢基层党建的工作基础，提升工作能力。以“五有”机制为抓手，即组织有力覆盖、阵地有序提标、活动有机整合、队伍有机奖励、作用有效发挥，将非公企业党建的基础一步一步打牢、夯实。开展阵地提标升级，实现非公企业党建阵地差异化建设，打造出亿阀党群综合体、大津党群活动阵地这样的高标准阵地，同时对小微企业、党建基础相对薄弱的企业，按照“六有”标准，规范建设基本党建阵地。开设“书记沙龙”，组织非公企业党组织书记赴威腾实地考察学习非公企业党建阵地和品牌，参观友好村宽心圩等红色教育基地，邀请专家、领导围绕《支部工作条例》、“不忘初心、牢记使命”主题教育目标要求、习近平新时代中国特色社会主义思想等专题进行学习培训，提高非公企业党务工作者政治素养和实务操作水平。。西来桥海晟党支部提出了“三服务”理念——服务企业我先行、服务职工我先行、服务社会我先行，将党员职工的命运与企业发展、社会进步、服务群众相结合，在企业发展中党员发挥了强有力的示范引领作用。。近年来，该镇积极推进非公企业党建与企业发展的融合度，增强党建促发展水平。融合企业增效，推动非公企业党组织与企业经营管理层“双向进入、交叉任职”，让党组织及时了解掌握企业的发展战略、重要决策，把企业的发展目标转化为党组织的工作目标，参与企业的生产经营决策，让企业党组织的生命力得到提升，双向双赢。广泛开展“我为企业发展献一计”“党员示范班组”“党员项目”等创建活动，引导广大党员成为企业科技研发、项目升级的助理和骨干，同时在生产经营骨干中培养发展党员，壮大企业党员队伍。,政府领导到其他城市考察学习或访问,0.0
79,江苏省,镇江市,蒋勇赴南通崇川区南京玄武区考察学习总部经济工作,2020-07-09,http://www.runzhou.gov.cn/runzhou/ywzx/202007/c1ce5201413b4dc98738ac045dcf33db.shtml,7月6、7日，润州区委常委、区政府常务副区长蒋勇率队赴南通崇川区、南京玄武区，专题就深耕总部经济发展考察学习。。蒋勇一行参观了崇川区江苏龙源振华海洋工程、南通国际贸易中心、通富微电子以及玄武区汇通达网络、铁北创新孵化集群项目等企业，现场了解了企业开展相关业务和项目运营管理等情况，并对企业在产业集聚、楼宇经济和海外拓展等方面取得的成绩表达了赞赏。。区经发局、区商务局、税务润州分局、七里甸街道、官塘桥街道、宝塔路街道负责同志和区政府办、区财政局分管领导参加考察学习。,7月6、7日，润州区委常委、区政府常务副区长蒋勇率队赴南通崇川区、南京玄武区，专题就深耕总部经济发展考察学习。。蒋勇一行参观了崇川区江苏龙源振华海洋工程、南通国际贸易中心、通富微电子以及玄武区汇通达网络、铁北创新孵化集群项目等企业，现场了解了企业开展相关业务和项目运营管理等情况，并对企业在产业集聚、楼宇经济和海外拓展等方面取得的成绩表达了赞赏。。区经发局、区商务局、税务润州分局、七里甸街道、官塘桥街道、宝塔路街道负责同志和区政府办、区财政局分管领导参加考察学习。,政府领导到其他城市考察学习或访问,0.0
79,江苏省,镇江市,西来桥打造非公企业高质量发展红色引擎,2020-07-07,http://www.yz.gov.cn/yangzhong/zjqxw/202007/bb6d55c400f346b68ffe747a6641010a.shtml,“嘟……”伴随着声声鸣笛，日前，由位于西来桥镇的大津重工建造的8000吨散装货运船缓缓驶离码头，远赴俄罗斯。“没有党建引领，没有党员先锋，没有红色动能，我们肯定抢不回受疫情耽搁的造船工期，按期完成了两条俄罗斯8000吨的散装货运船。”在大津重工党群活动中心，副总经理、党支部书记屠亚龙感慨万千。“红色动能”激发“大津速度”，“红色引擎”则驱动西来桥奔腾起来。近年来，西来桥镇切实找准非公党建工作的着力点，让非公企业党建有组织、有阵地、有人抓、有人管，实现了党建与非公企业发展的“双赢互促”，为全镇经济高质量发展提供了动力支持。 该镇党委组织统战委员唐玲介绍，该镇现有非公党支部（含社会组织）17个。从2019年开始，西来桥镇将非公企业党建作为书记项目，抓牢抓实。成立党建指导员队伍，对全镇所有党支部开展“手把手教学、点对点督导、实打实反馈”的党建工作指导，推进基层党建上台阶、提层次。开展党员义工志愿服务，引导机关党组织结合工作职责，开展为民为企服务，为企业发展、职工生活等提供帮助和服务，形成良性的互动关系。 筑牢基层党建的工作基础，提升工作能力。以“五有”机制为抓手，即组织有力覆盖、阵地有序提标、活动有机整合、队伍有机奖励、作用有效发挥，将非公企业党建的基础一步一步打牢、夯实。开展阵地提标升级，实现非公企业党建阵地差异化建设，打造出亿阀党群综合体、大津党群活动阵地这样的高标准阵地，同时对小微企业、党建基础相对薄弱的企业，按照“六有”标准，规范建设基本党建阵地。开设“书记沙龙”，组织非公企业党组织书记赴威腾实地考察学习非公企业党建阵地和品牌，参观友好村宽心圩等红色教育基地，邀请专家、领导围绕《支部工作条例》、“不忘初心、牢记使命”主题教育目标要求、习近平新时代中国特色社会主义思想等专题进行学习培训，提高非公企业党务工作者政治素养和实务操作水平。 西来桥海晟党支部提出了“三服务”理念——服务企业我先行、服务职工我先行、服务社会我先行，将党员职工的命运与企业发展、社会进步、服务群众相结合，在企业发展中党员发挥了强有力的示范引领作用。 近年来，该镇积极推进非公企业党建与企业发展的融合度，增强党建促发展水平。融合企业增效，推动非公企业党组织与企业经营管理层“双向进入、交叉任职”，让党组织及时了解掌握企业的发展战略、重要决策，把企业的发展目标转化为党组织的工作目标，参与企业的生产经营决策，让企业党组织的生命力得到提升，双向双赢。广泛开展“我为企业发展献一计”“党员示范班组”“党员项目”等创建活动，引导广大党员成为企业科技研发、项目升级的助理和骨干，同时在生产经营骨干中培养发展党员，壮大企业党员队伍。,“嘟……”伴随着声声鸣笛，日前，由位于西来桥镇的大津重工建造的8000吨散装货运船缓缓驶离码头，远赴俄罗斯。“没有党建引领，没有党员先锋，没有红色动能，我们肯定抢不回受疫情耽搁的造船工期，按期完成了两条俄罗斯8000吨的散装货运船。”在大津重工党群活动中心，副总经理、党支部书记屠亚龙感慨万千。“红色动能”激发“大津速度”，“红色引擎”则驱动西来桥奔腾起来。近年来，西来桥镇切实找准非公党建工作的着力点，让非公企业党建有组织、有阵地、有人抓、有人管，实现了党建与非公企业发展的“双赢互促”，为全镇经济高质量发展提供了动力支持。 该镇党委组织统战委员唐玲介绍，该镇现有非公党支部（含社会组织）17个。从2019年开始，西来桥镇将非公企业党建作为书记项目，抓牢抓实。成立党建指导员队伍，对全镇所有党支部开展“手把手教学、点对点督导、实打实反馈”的党建工作指导，推进基层党建上台阶、提层次。开展党员义工志愿服务，引导机关党组织结合工作职责，开展为民为企服务，为企业发展、职工生活等提供帮助和服务，形成良性的互动关系。 筑牢基层党建的工作基础，提升工作能力。以“五有”机制为抓手，即组织有力覆盖、阵地有序提标、活动有机整合、队伍有机奖励、作用有效发挥，将非公企业党建的基础一步一步打牢、夯实。开展阵地提标升级，实现非公企业党建阵地差异化建设，打造出亿阀党群综合体、大津党群活动阵地这样的高标准阵地，同时对小微企业、党建基础相对薄弱的企业，按照“六有”标准，规范建设基本党建阵地。开设“书记沙龙”，组织非公企业党组织书记赴威腾实地考察学习非公企业党建阵地和品牌，参观友好村宽心圩等红色教育基地，邀请专家、领导围绕《支部工作条例》、“不忘初心、牢记使命”主题教育目标要求、习近平新时代中国特色社会主义思想等专题进行学习培训，提高非公企业党务工作者政治素养和实务操作水平。 西来桥海晟党支部提出了“三服务”理念——服务企业我先行、服务职工我先行、服务社会我先行，将党员职工的命运与企业发展、社会进步、服务群众相结合，在企业发展中党员发挥了强有力的示范引领作用。 近年来，该镇积极推进非公企业党建与企业发展的融合度，增强党建促发展水平。融合企业增效，推动非公企业党组织与企业经营管理层“双向进入、交叉任职”，让党组织及时了解掌握企业的发展战略、重要决策，把企业的发展目标转化为党组织的工作目标，参与企业的生产经营决策，让企业党组织的生命力得到提升，双向双赢。广泛开展“我为企业发展献一计”“党员示范班组”“党员项目”等创建活动，引导广大党员成为企业科技研发、项目升级的助理和骨干，同时在生产经营骨干中培养发展党员，壮大企业党员队伍。,政府领导到其他城市考察学习或访问,0.0
79,江苏省,镇江市,邳州来丹考察文明城市创建,2020-04-29,http://www.danyang.gov.cn/danyang/dyxw/202004/2d04d58b16b84eb189d2522ef1ed0097.shtml,27日下午，邳州市创文考察组一行22人来到我市，就文明城市创建及新时代文明实践中心建设工作进行考察学习。 邳州考察组一行首先参观了市规划展示馆和市新时代文明实践中心，在“文明使者”语音机器人的引导和讲解下，参观了百姓名嘴孵化室、金山讲习所理论讲堂，听取了“一云四屏”介绍，观看了线上中心指挥演示，还了解了丹阳的城市概况、历史文化、规划前景等内容。整个过程中，“文明使者”语音机器人的讲解让大家耳目一新。据介绍，“文明使者”语音机器人是市新时代文明实践中心于疫情期间推出，已经接待了好多批参观者，能够让参观者更好地了解文明实践活动开展情况，既节省了人力成本，又提升了讲解效率。 在开发区高楼社区新时代文明实践站，邳州考察组一行详细了解了实践站志愿活动开展情况。据介绍，高楼社区新时代文明实践站现有志愿者300多人，每年开展各项活动100余场次。此外，实践站正在打造社区新时代文明实践广场和社区文化宣传阵地，将集中展示其核心理念、组织结构、服务项目、服务标准及服务成果。 在丹金农贸市场，邳州考察组一行就农贸市场管理进行了考察，并详细查看了快检室，浏览了消费者投诉登记表。 随后举行的座谈会上，双方就文明城市测评体系等进行了详细的交流。,27日下午，邳州市创文考察组一行22人来到我市，就文明城市创建及新时代文明实践中心建设工作进行考察学习。 邳州考察组一行首先参观了市规划展示馆和市新时代文明实践中心，在“文明使者”语音机器人的引导和讲解下，参观了百姓名嘴孵化室、金山讲习所理论讲堂，听取了“一云四屏”介绍，观看了线上中心指挥演示，还了解了丹阳的城市概况、历史文化、规划前景等内容。整个过程中，“文明使者”语音机器人的讲解让大家耳目一新。据介绍，“文明使者”语音机器人是市新时代文明实践中心于疫情期间推出，已经接待了好多批参观者，能够让参观者更好地了解文明实践活动开展情况，既节省了人力成本，又提升了讲解效率。 在开发区高楼社区新时代文明实践站，邳州考察组一行详细了解了实践站志愿活动开展情况。据介绍，高楼社区新时代文明实践站现有志愿者300多人，每年开展各项活动100余场次。此外，实践站正在打造社区新时代文明实践广场和社区文化宣传阵地，将集中展示其核心理念、组织结构、服务项目、服务标准及服务成果。 在丹金农贸市场，邳州考察组一行就农贸市场管理进行了考察，并详细查看了快检室，浏览了消费者投诉登记表。 随后举行的座谈会上，双方就文明城市测评体系等进行了详细的交流。,其他,0.6065862918948729
