code,province,city,topic,date,url,content,content,label,score
79,江苏省,镇江市,我市组织考察团考察学习乡村振兴服务站点助力农村电商发展,2023-12-05,http://www.yz.gov.cn/yangzhong/dzswjnczhsfzl/202312/78a0410b04b546f2bb56626a0fdcdcb6.shtml,11月，扬中市商务局会同市交通运输局（邮政管理局）、油坊镇相关村（社区）书记及分管负责同志、三茅街道相关村（社区）书记及分管负责同志考察学习乡村振兴服务站点。 考察团一行先后前往八桥镇永胜村、红光村、八桥村乡村振兴服务点参观考察，详细了解服务站点建设运营及叠加服务情况。。永胜村乡村振兴服务点可为村民提供物流服务、代购代销、农资等业务。建设电商服务点之后，不仅在村中形成了多功能的农村电商便民服务点，而且代收、代发快递等业务为村民提供了更多的便利性，水果店的人流量也随之增加，生意越来越好，在做电商获利的同时，提升了自己实体店铺的生意。。八桥镇红光村乡村振兴服务点作为扬中市国家电子商务进农村示范项目，是扬中市交通运输局（邮政管理局）、扬中市商务局与红光村携手打造的生活服务平台，位置设于新韩通服务区，面积约为80平方米。以便民利民为出发点，以菜鸟驿站为搭建主体，融合资源，发挥优势，辅以“巧媳妇”手工花坊、馨语工作室等村级特色，按照“交通+邮政快递+社区”农村寄递物流服务模式，通过做加法提质增效，真正打通“快递进村”服务的“最后一公里”。 在红光村乡村振兴服务点，每天总能见到热闹繁忙的景象：收拿快递、取钱汇款、购物消费……群众不用到处跑，在家门口的服务站就能“一站式”解决，“零距离”的幸福感满满。服务点距离当地的一家大型船舶企业不到300米，是直抵近5000名员工内心的“直通车”。。为做强服务经济，进一步提升便民惠民力度，八桥村积极探索“快递+物流”新模式，充分发挥临街物业用房优势，今年9月，占地350平方米、投资约100万元的乡村振兴服务点“开张大吉”。在揽收寄件的同时，还搭载“美团优选”、小额取款、帮购帮销、代缴代办等功能，实现一站多能、一点多用，真正惠及群众。整个服务点分为东、中、西三部分。东面是快递的寄取区，目前东区快递点引进了2家快递公司，每天的寄存量大概在100件左右；中区是普惠金融点，更方便于老百姓取出2000元以下的存款，医疗保险、养老保险、水电费等也可以在这里缴纳；西区是名特优产品选购区，天南海北的美食集中在这里。 我市将进一步推进乡村振兴服务点建设工作，依托“村企共建”资源优势，推广“党建+电子商务+寄递服务”模式；同时，点位设置注重“服务全覆盖”，在提供快递寄取的同时积极拓展便民服务的宽度和广度，为乡村振兴发展注入新动能。,11月，扬中市商务局会同市交通运输局（邮政管理局）、油坊镇相关村（社区）书记及分管负责同志、三茅街道相关村（社区）书记及分管负责同志考察学习乡村振兴服务站点。 考察团一行先后前往八桥镇永胜村、红光村、八桥村乡村振兴服务点参观考察，详细了解服务站点建设运营及叠加服务情况。。永胜村乡村振兴服务点可为村民提供物流服务、代购代销、农资等业务。建设电商服务点之后，不仅在村中形成了多功能的农村电商便民服务点，而且代收、代发快递等业务为村民提供了更多的便利性，水果店的人流量也随之增加，生意越来越好，在做电商获利的同时，提升了自己实体店铺的生意。。八桥镇红光村乡村振兴服务点作为扬中市国家电子商务进农村示范项目，是扬中市交通运输局（邮政管理局）、扬中市商务局与红光村携手打造的生活服务平台，位置设于新韩通服务区，面积约为80平方米。以便民利民为出发点，以菜鸟驿站为搭建主体，融合资源，发挥优势，辅以“巧媳妇”手工花坊、馨语工作室等村级特色，按照“交通+邮政快递+社区”农村寄递物流服务模式，通过做加法提质增效，真正打通“快递进村”服务的“最后一公里”。 在红光村乡村振兴服务点，每天总能见到热闹繁忙的景象：收拿快递、取钱汇款、购物消费……群众不用到处跑，在家门口的服务站就能“一站式”解决，“零距离”的幸福感满满。服务点距离当地的一家大型船舶企业不到300米，是直抵近5000名员工内心的“直通车”。。为做强服务经济，进一步提升便民惠民力度，八桥村积极探索“快递+物流”新模式，充分发挥临街物业用房优势，今年9月，占地350平方米、投资约100万元的乡村振兴服务点“开张大吉”。在揽收寄件的同时，还搭载“美团优选”、小额取款、帮购帮销、代缴代办等功能，实现一站多能、一点多用，真正惠及群众。整个服务点分为东、中、西三部分。东面是快递的寄取区，目前东区快递点引进了2家快递公司，每天的寄存量大概在100件左右；中区是普惠金融点，更方便于老百姓取出2000元以下的存款，医疗保险、养老保险、水电费等也可以在这里缴纳；西区是名特优产品选购区，天南海北的美食集中在这里。 我市将进一步推进乡村振兴服务点建设工作，依托“村企共建”资源优势，推广“党建+电子商务+寄递服务”模式；同时，点位设置注重“服务全覆盖”，在提供快递寄取的同时积极拓展便民服务的宽度和广度，为乡村振兴发展注入新动能。,其他,0.6156963544410566
79,江苏省,镇江市,把脉中央厨房服务产业强市,2024-01-26,http://www.yz.gov.cn/yangzhong/spypaq/202401/99b11e2631da4743bd975734e5be3d8c.shtml,近日，扬中市市场监管局党委委员、副局长盛艳带队，邀请镇江市市场监管局餐饮所副所长王蕊赴泰州市嘉和中央厨房配餐有限公司考察学习，推动我市“中央厨房”项目落地建设。。考察组一行参观了嘉和公司生产线、操作间，详细了解“中央厨房”的布局、经营管理、研发、配送等情况。泰州市市场监管局在座谈会上介绍了“中央厨房”的监管经验，泰州11家中央厨房均接入泰州局“互联网+ 明厨亮灶”监控系统，实现“视频监控、全程监督、智能抓拍、精准监控”。。回扬后，考察组一行随即赶赴江苏凯锋食品有限公司建设现场，实地察看场所及建设进展情况，交流图纸修改意见，凯锋公司表示将严格按照规范要求建设集中配餐生产线，落实主体责任和食品安全相关工作。。下一步，扬中市市场监管局将围绕服务产业强市“一号战略”，开展暖企帮扶行动，持续精准服务，及时化解企业在项目建设中遇到的难题，打好服务企业“组合拳”，确保人民群众“舌尖上的安全”。,近日，扬中市市场监管局党委委员、副局长盛艳带队，邀请镇江市市场监管局餐饮所副所长王蕊赴泰州市嘉和中央厨房配餐有限公司考察学习，推动我市“中央厨房”项目落地建设。。考察组一行参观了嘉和公司生产线、操作间，详细了解“中央厨房”的布局、经营管理、研发、配送等情况。泰州市市场监管局在座谈会上介绍了“中央厨房”的监管经验，泰州11家中央厨房均接入泰州局“互联网+ 明厨亮灶”监控系统，实现“视频监控、全程监督、智能抓拍、精准监控”。。回扬后，考察组一行随即赶赴江苏凯锋食品有限公司建设现场，实地察看场所及建设进展情况，交流图纸修改意见，凯锋公司表示将严格按照规范要求建设集中配餐生产线，落实主体责任和食品安全相关工作。。下一步，扬中市市场监管局将围绕服务产业强市“一号战略”，开展暖企帮扶行动，持续精准服务，及时化解企业在项目建设中遇到的难题，打好服务企业“组合拳”，确保人民群众“舌尖上的安全”。,其他,0.539779411402083
79,江苏省,镇江市,司徒镇商会举办年年会,2024-01-22,http://www.danyang.gov.cn/danyang/zqdt/202401/c24345f7942c431098dff207a3a1fe7a.shtml,司徒镇商会成立于2023年3月，首批商会成员有58家企业，主要以司徒镇规模以上企业和具有影响力的老牌企业为主，涵盖了眼镜（隐形眼镜）制造、自行车制造、生猪养殖、新科技材料、餐饮等十多个行业。成立以来，商会积极发挥桥梁作用，优化“政商企”沟通机制，强化企业交流，助力企业拓展市场，以培训会、座谈会、考察学习等形式开展各项活动，不断拓宽服务领域，提升服务层次，有效调动会员的积极性，提升了会员的凝聚力和荣誉感，为司徒镇经济发展提供了有效支撑。,司徒镇商会成立于2023年3月，首批商会成员有58家企业，主要以司徒镇规模以上企业和具有影响力的老牌企业为主，涵盖了眼镜（隐形眼镜）制造、自行车制造、生猪养殖、新科技材料、餐饮等十多个行业。成立以来，商会积极发挥桥梁作用，优化“政商企”沟通机制，强化企业交流，助力企业拓展市场，以培训会、座谈会、考察学习等形式开展各项活动，不断拓宽服务领域，提升服务层次，有效调动会员的积极性，提升了会员的凝聚力和荣誉感，为司徒镇经济发展提供了有效支撑。,其他,0.5611505174506868
79,江苏省,镇江市,千里取经问道撷芳归来谋新高校集团董事长率队赴苏州独墅湖科教创新区招商考察,2023-12-19,http://gzw.zhenjiang.gov.cn/gzw/gzjg/202312/d824f8e63a5847c983c194e30380ecea.shtml,千里取经问道 撷芳归来谋新——高校集团董事长率队赴苏州独墅湖科教创新区招商考察 | 镇江市人民政府国有资产监督管理委员会。为适应新形势下高校集团战略转型发展需要，充分学习借鉴其他优秀企业在园区服务保障、资产经营、招商引资等方面的好理念、好经验、好做法，切实为集团高质量发展蓄力赋能，近期，高校集团董事长张玉龙率队赴苏州独墅湖招商、考察。。在新建元集团总部和兆佳巷邻里中心，考察组一行观看了集团的发展历程，详细了解了产业园区的未来发展战略、产业载体建设、招商运营模式、资金运作方式、区域要素保障等方面。在科教公司，考察组一行参观了文缘公寓、公共学院、纳米大学科技园，随后，就产学研平台搭建、科技成果转化、产业人才服务、后勤服务保障等方面与对方进行了深入的交流研讨。。下阶段，高校集团将坚持贯彻“走出去”战略，聚焦产业规划、资产运作、项目运营、服务保障等方面，加强与国内先进园区、一线企业交流，持续对标找差，为集团可持续、高质量发展提供力量源泉。,千里取经问道 撷芳归来谋新——高校集团董事长率队赴苏州独墅湖科教创新区招商考察 | 镇江市人民政府国有资产监督管理委员会。为适应新形势下高校集团战略转型发展需要，充分学习借鉴其他优秀企业在园区服务保障、资产经营、招商引资等方面的好理念、好经验、好做法，切实为集团高质量发展蓄力赋能，近期，高校集团董事长张玉龙率队赴苏州独墅湖招商、考察。。在新建元集团总部和兆佳巷邻里中心，考察组一行观看了集团的发展历程，详细了解了产业园区的未来发展战略、产业载体建设、招商运营模式、资金运作方式、区域要素保障等方面。在科教公司，考察组一行参观了文缘公寓、公共学院、纳米大学科技园，随后，就产学研平台搭建、科技成果转化、产业人才服务、后勤服务保障等方面与对方进行了深入的交流研讨。。下阶段，高校集团将坚持贯彻“走出去”战略，聚焦产业规划、资产运作、项目运营、服务保障等方面，加强与国内先进园区、一线企业交流，持续对标找差，为集团可持续、高质量发展提供力量源泉。,政府领导到其他城市考察学习或访问,0.0
79,江苏省,镇江市,新农人戴志雨实验室里育苗忙,2024-01-16,http://www.zhenjiang.gov.cn/zhenjiang/sdbd/202401/d524d9862d2f43be84cd1c718763d476.shtml,镇江市人民政府办公室关于2024年第二季度政务新媒体和政府网站政务公开栏目检查情况通报。镇江市人民政府关于印发镇江市推动大规模设备更新和消费品以旧换新行动方案（2024~2027年）的通知。近日一大早，句容市白兔镇草莓种植户戴志雨早饭都没顾得上吃，刷个牙、洗把脸就开车直奔几公里外的草莓育苗室。“这几天一直在外学习，凌晨4时才从山东赶回来，最近气温不稳定，今天必须去实验室看看。”。到达实验室，戴志雨熟练地脱下外套、穿上白大褂，通过风淋室，来到一排排放满玻璃容器的育苗架前。“实验室育苗要求高，不仅要恒温、恒湿，还要通过灯光来模拟自然光的亮度，每隔12小时这里的亮度就要重新调整。”看着实验室里的草莓苗长势旺盛，戴志雨悬着的心定了下来。。45岁的戴志雨是白兔镇当地人，“别看我是农村的，但农活基本没怎么干过。”20多岁时，戴志雨就去城里闯荡，在文化馆干过，还当过代课老师，“后来在安徽一家上市企业工作，一直干到管理层。”。“在企业工作一年收入少说有20万元。”但常年在外漂泊的戴志雨，因为不能在年迈的父母身边尽孝，也不能照看子女，时常感到愧疚。2017年，戴志雨决定回乡创业。“一个中年男人放弃自己熟悉、收入又不错的行业二次创业，这个决定很难下，家人都不同意。”。但铁了心的戴志雨瞒着家人递交了离职申请。“选择种草莓是因为白兔镇是远近闻名的‘草莓之乡’，从种植技术到销售渠道都很成熟。”戴志雨胆子大，一上来就租了30亩地，投资40万元建了草莓大棚，“后来又陆陆续续搞了基础设施，增加了火龙果、香瓜等品种，总投资超过300万元。”。“完全从头学起，谁种得好我就跟谁学，镇里的种植户都是我的老师。”戴志雨不仅跟当地的“土专家”学，还前往溧水、山东等地学习技术和管理经验，“干一行就得钻一行，有时间我就出去请教，闲不住。”几年下来，戴志雨掌握了从草莓选苗到种植管理的“秘籍”，不仅自家的草莓亩均收益超过6万元，他还时常帮助周边农户销售。。苗好七成收。这两年，在白兔镇政府和行业协会的支持带动下，戴志雨开始自主培育草莓苗，开展草莓脱毒组培项目，进行脱毒种苗培育，通过技术手段去除种苗中影响草莓生长的病毒，为草莓栽培中出现的品种退化、连作障碍、品质下降、病虫危害等棘手问题提供解决方案。。“你看，这些净化台、臭氧发生器等设备和育苗场地都是政府免费提供的，育苗成功后不仅亩产有望提高，在农药、化肥使用量上相较以往也将降低不少。”戴志雨透露，在草莓上市期，他每个月都要有一周以上的时间在外考察学习。最近，他还报名参加了去日本参观交流的培训班，这个月即将启程。（顾辉 郑德阳 张凤春）,镇江市人民政府办公室关于2024年第二季度政务新媒体和政府网站政务公开栏目检查情况通报。镇江市人民政府关于印发镇江市推动大规模设备更新和消费品以旧换新行动方案（2024~2027年）的通知。近日一大早，句容市白兔镇草莓种植户戴志雨早饭都没顾得上吃，刷个牙、洗把脸就开车直奔几公里外的草莓育苗室。“这几天一直在外学习，凌晨4时才从山东赶回来，最近气温不稳定，今天必须去实验室看看。”。到达实验室，戴志雨熟练地脱下外套、穿上白大褂，通过风淋室，来到一排排放满玻璃容器的育苗架前。“实验室育苗要求高，不仅要恒温、恒湿，还要通过灯光来模拟自然光的亮度，每隔12小时这里的亮度就要重新调整。”看着实验室里的草莓苗长势旺盛，戴志雨悬着的心定了下来。。45岁的戴志雨是白兔镇当地人，“别看我是农村的，但农活基本没怎么干过。”20多岁时，戴志雨就去城里闯荡，在文化馆干过，还当过代课老师，“后来在安徽一家上市企业工作，一直干到管理层。”。“在企业工作一年收入少说有20万元。”但常年在外漂泊的戴志雨，因为不能在年迈的父母身边尽孝，也不能照看子女，时常感到愧疚。2017年，戴志雨决定回乡创业。“一个中年男人放弃自己熟悉、收入又不错的行业二次创业，这个决定很难下，家人都不同意。”。但铁了心的戴志雨瞒着家人递交了离职申请。“选择种草莓是因为白兔镇是远近闻名的‘草莓之乡’，从种植技术到销售渠道都很成熟。”戴志雨胆子大，一上来就租了30亩地，投资40万元建了草莓大棚，“后来又陆陆续续搞了基础设施，增加了火龙果、香瓜等品种，总投资超过300万元。”。“完全从头学起，谁种得好我就跟谁学，镇里的种植户都是我的老师。”戴志雨不仅跟当地的“土专家”学，还前往溧水、山东等地学习技术和管理经验，“干一行就得钻一行，有时间我就出去请教，闲不住。”几年下来，戴志雨掌握了从草莓选苗到种植管理的“秘籍”，不仅自家的草莓亩均收益超过6万元，他还时常帮助周边农户销售。。苗好七成收。这两年，在白兔镇政府和行业协会的支持带动下，戴志雨开始自主培育草莓苗，开展草莓脱毒组培项目，进行脱毒种苗培育，通过技术手段去除种苗中影响草莓生长的病毒，为草莓栽培中出现的品种退化、连作障碍、品质下降、病虫危害等棘手问题提供解决方案。。“你看，这些净化台、臭氧发生器等设备和育苗场地都是政府免费提供的，育苗成功后不仅亩产有望提高，在农药、化肥使用量上相较以往也将降低不少。”戴志雨透露，在草莓上市期，他每个月都要有一周以上的时间在外考察学习。最近，他还报名参加了去日本参观交流的培训班，这个月即将启程。（顾辉 郑德阳 张凤春）,政府领导到其他城市考察学习或访问,0.0
