code,province,city,topic,date,url,content,content,label,score
79,江苏省,镇江市,我委王为华副主任带队赴青岛调研低碳城市建设,2014-06-09,http://fgw.zhenjiang.gov.cn/fgw/fgdt/201406/6fd8b4d7add8461aa2f24b5e3b6f1ca8.shtml,为学习借鉴青岛市低碳城市建设，特别是碳交易市场建设方面的先进做法和成功经验，以推动我市低碳城市建设，探索建立碳交易市场。6月3日-5日，市发改委副主任王为华带队，市编办、财政局、南京擎天科技等代表一行赴青岛市考察学习低碳城市建设。。座谈会上，青岛市发改委节能办副主任林群介绍了近年来青岛市低碳城市试点工作情况、碳交易市场阶段性成果和下一步工作打算。随后考察组一行实地参观考察了中德生态园、昌盛日电太阳能公司和太阳能生态小镇等。。中德生态园相关负责人介绍，中德生态园不仅仅是传统意义上的经济园区，同时也是遵循中国特色新型城镇化建设，着力打造的宜居宜业的第四代园区。园内社区全部采用按照国家绿色二星级建筑标准进行建设，达到了国内安置小区中的最高标准。同时，还将集中采用园区内的资源、能源、环境、智能四位协同的全新泛能网，充分利用太阳能、地源热泵、冷热电三联供等分布式能源，以清洁的天然气为主，以风、光、地源热、水源热等可再生能源为辅，融合智能化控制和云计算技术，为小区提供足够清洁、低碳的能源。。青岛市还打造了一二三产相结合的太阳能生态小镇，综合考虑新农村建设中遇到的问题，结合昌盛日电在光伏、农业领域的实践，在光伏农业科技大棚的基础上，发展太阳能小镇模式。这种模式是光伏综合应用的延伸，也能解决城镇化过程中面临的问题。,12月20日，泰州市人民医院党委书记黄俊星一行赴市一院考察交流。 泰州市人民医院是泰州地区最大的综合性医院。市一院常务副院长蒋鹏程向考察团一行表示了欢迎，并简要介绍了市一院的基本情况；泰州市人民医院党委书记黄俊星对市一院的热情接待表示衷心的感谢，希望双方就信息化建设进一步加强交流。随后，黄俊星一行考察了市一院移动查房、移动护理工作站、电力病历等信息化建设成果。本次考察学习对加强市一院与泰州市人民医院的交流合作、提升双方信息化建设水平和管理水平有重要意义。。。随后，黄俊星一行考察了市一院移动查房、移动护理工作站、电力病历等信息化建设成果。本次考察学习对加强市一院与泰州市人民医院的交流合作、提升双方信息化建设水平和管理水平有重要意义。,不属于政府领导到其他城市考察学习的新闻,0.5099686127569061
79,江苏省,镇江市,镇江新区教育国际化迈向纵深,2014-05-08,http://www.zhenjiang.gov.cn/zhenjiang/qxdt/201405/ff8b5a113c5b4425baa7a9d5079633e9.shtml,镇江市人民政府办公室关于2024年第二季度政务新媒体和政府网站政务公开栏目检查情况通报。镇江市人民政府关于印发镇江市推动大规模设备更新和消费品以旧换新行动方案（2024~2027年）的通知。石桥幼儿园来了金发碧眼的外国小朋友就读，大港中心小学开设了“外国课”，而核心湖畔镇江枫叶国际学校则被称为“家门口的加拿大学校”……在镇江新区社会发展局负责人看来，这正是新区教育阔步迈向国际化的特征。。昨天早上吃过早饭，家住姚桥镇古桥村的陈受兴，与往常一样送5岁的外孙女到石桥幼儿园上学。引人注目的是，他的外孙女方丹·安吉丽娜是个金发碧眼的“老外”。。“去年安吉丽娜刚上幼儿园时，每次送她到幼儿园都会吸引众多路人惊奇的目光。现在时间长了，大家都知道安吉丽娜是法国人呢。”陈受兴告诉记者，他的女儿大学毕业后到上海创业，认识了来自法国里斯的女婿。因为工作需要，女儿女婿将安吉丽娜送到石桥幼儿园上学。。隔着窗子，记者看到漂亮的安吉丽娜正和其他小朋友一道，静静地听老师上课，并与其他小朋友一样不时举起小手，与老师互动……看见记者拍照，安吉丽娜老练地举起右手摆了一个“胜利”的手势。。石桥幼儿园不只安吉丽娜一个“老外”，还有一个来自韩国首尔的小朋友魏正旭。魏正旭的妈妈是首尔人，大学毕业后来到上海，认识了儒里村到上海创业的魏正旭的爸爸。从上海赶回的魏正旭的妈妈对记者说，在家里她也会教魏正旭韩语，在教育上她尊重幼儿园的教学，但在幼儿园时期还是应让小孩多玩为主。。石桥幼儿园园长李海琴告诉记者，这两个“小老外”，一开始有些“闷”，与同学们有些距离，小朋友们对他俩也很好奇，但现在已经打成一片了。在教学上，与本地小朋友接受相同教育的同时，尊重他俩的个性发展，并给予更多的关注。。新区社发局相关负责人告诉记者，在新区中小学（幼儿园）中，现有17名境外小朋友。他们的到来，着实给新区的校园平添了道道靓丽色彩。他们也和本地孩子一起，在美丽的新区校园里幸福、健康、快乐成长，收获人生的精彩！。大港中心小学创办于1920年，至今已走过了90多年的历程，现有学生1300多人。走近大港小学，记者看到红红的外墙上题写着“让大港走向世界、让世界了解大港”。。徐亚琴是大港小学六年级的语文老师，与学校很多老师一样，她还兼任着学校“外国课”的课程教学。徐亚琴告诉记者，金东、奇美等国际大公司内有许多外国人工作，他们的小孩也就来到大港小学就读。与此同时，大港本地的小朋友也渴望多多了解外面的世界。2012年起，学校决定开设“国际理解教育港小论坛”活动，以“国际理解教育”为主题，就世界名胜、中外饮食、国际礼仪、艺术欣赏、宗教信仰和时事政治等六个方面内容，通过诗歌朗诵、歌曲演唱、服装绘画、手抄报制作以及世界名胜图片展等活动，教给孩子国际知识，培养孩子关注的意识、研判的意识和实践的意识。徐老师说：“我教的课程是国际礼仪，现在中国人越来越成为‘国际人’，与此相适应，需要我们有‘国际人’的胸怀和视野，要了解和懂得国际礼仪。所以让学生了解国际礼仪，就是为他们今后在世界舞台演绎精彩‘打底子’。”。大港小学副校长朱梅告诉记者，“国际理解教育港小论坛”活动每周举行一次，一年级开设的是“世界名胜”，二年级开设的是“中外饮食”，三年级开设的是“国际礼仪”，四年级开设的是“艺术欣赏”，五年级开设的是“时事政治”，六年级开设的是“宗教信仰”。通过连续多年潜移默化的熏陶，使学生了解并热爱中华优秀传统文化的同时，尊重、了解其他国家、民族、地区文化的基本精神及风俗习惯，学会尊重、理解、合作，了解世界多元文化，成为有国际视野的人。,镇江市人民政府办公室关于2024年第二季度政务新媒体和政府网站政务公开栏目检查情况通报。镇江市人民政府关于印发镇江市推动大规模设备更新和消费品以旧换新行动方案（2024~2027年）的通知。昨天，河南省开封市委书记祈金立、市长吉炳伟率党政代表团来镇考察，学习交流现代化建设经验。市委书记杨省世，市政协主席李国忠，市委常委、秘书长李雪峰参加会见并陪同考察。。会见交流时，杨省世对代表团的到来表示欢迎，并简要介绍了镇江市情和经济社会发展情况。他说，镇江区位优势明显，自然禀赋独特，人文底蕴深厚，科教资源丰富，科技创新能力较强，高端装备制造、新材料、新能源及新一代信息技术等新兴产业蓬勃发展。当前镇江正积极抢抓全面深化改革、长三角区域发展一体化、苏南现代化示范区建设和宁镇扬同城化发展等重大战略机遇，大力推进产业强市、生态立市和人才兴市，加快建设令人向往的现代山水花园城市。杨省世表示，开封市近年来经济社会发展成绩突出，希望两地在文化旅游、农业发展、城市建设等方面相互借鉴经验，深化交流合作。。祈金立代表开封市党政代表团对我市的热情接待表示感谢。他说，镇江和开封都是国家历史文化名城，两地发展有许多相似相通之处，交流合作的空间非常广阔。祁金立在简要介绍了开封概况和近年来文化、旅游等产业发展情况后说，与镇江发展相比，开封在先进制造业发展、重大项目建设等方面还有差距。这次来镇江，就是来学习镇江发展经验，加快推进产业升级，更好地谋划和推动开封现代化建设。。下午，开封市党政代表团一行首先考察了金山湖、金山文宗阁和西津渡历史文化街区，对镇江悠久的历史文化、良好的生态环境和优美的自然风光很是赞赏。位于镇江新区的中云科技有限公司、云神科技股份有限公司、江苏奥瑟亚新材料有限公司和中节能太阳能有限公司等企业，在新技术、新材料、新能源等领域展现出的先进水平，让代表团产生了浓厚兴趣。平昌新城是镇江新区在探索城乡一体化发展中，着力改变传统农村散居模式，重点推进公共服务均等化、推动农民有序转市民的最新实践成果，也是目前全省单体建设规模最大的拆迁安置小区，其完善的基础公共配套设施以及“中心社区+基层社区”的管理新模式，给代表团留下了非常深刻的印象。,政府领导到其他城市考察学习或访问,0.5661653824123558
79,江苏省,镇江市,无锡市人民医院赴市一院参观交流,2014-04-24,http://wjw.zhenjiang.gov.cn/wjw/ywdt/201404/29d808c583ab4cff968a6f52a05db72c.shtml,市一院副院长贡浩凌向客人的来访表示了热烈的欢迎并简要介绍了市一院的基本情况；随后，市一院护理部副主任王辉就护士能级管理、科室类别设置、护士绩效分配等方面向客人做了详细介绍，宾主双方就相关问题进行了细致而深入的探讨；最后，来访客人还参观了市一院的部分临床科室。。本次考察学习对加强市一院与无锡市人民医院的交流合作、提升双方护理管理水平有重要意义。市一院相关科室人员参加了接待活动。,国土局窗口自行政服务处整建制进驻中心运作以来，已经整整两年了。这期间，在中心领导和管理人员的悉心指导和大力支持下，我局窗口从原来的2人小窗口变成8人大窗口，办件从原来的3项增加到现在的15个大项，23个子项，审批服务模式也从原来的单一受理逐步发展到现在包括土地测量中介服务在内的完整的审批服务链。我们良好的行政审批服务流程也得到了同行的好评，2007年，先后有4批省内外国土资源局来我局考察学习“镇江模式”。可以说，我们是因为有了中心的平台而精彩。其实，“创新服务、提升内涵”的又何止我们一个，“公开、规范、高效、便民”的宗旨体现在各个窗口。“一站式”服务，“六条龙”联审会办，为申请人量身定做的“绿色通道”，让人看到一个真实的服务型政府。。环境的影响力是巨大的，在这样的氛围中，我们没有理由不努力。于是，我们窗口的岗位职责、首问负责制、一次性告知制、“一张笑脸，一声你好，一腔热情，一流服务”的四个一服务规范、“讲尊重、讲细节、讲业务技能、讲服务艺术”的四讲服务礼仪、局内部的并联审批办法等都应运而生。更为重要的是，局领导要求的“全局全力支持窗口、窗口全力服务社会”的理念得到了很好的贯彻落实，窗口运行畅通、规范有序、高效快捷。2007年，我们把改进服务态度、提高服务水平，努力争创“党员示范岗”作为提升行政效能、树立部门形象的着力点，以建设和谐窗口、一流窗口为目标，不断创新服务手段，拓展服务功能，在政治素质、作风建设、窗口建设、业务建设四个方面提出了新的要求，办件水平逐步提高。全年一门受理率、按时办结率、群众满意度均为100%，基本建设项目现场办结率达到市政府规定的水平。。虽然我们做了一些工作，但与领导给予我们的荣誉相比，却是微不足道的。2008年我们将围绕中心党组提出的巩固完善全面提升年活动，继续以依法行政、创新服务为主线，在服务中树形象，在服务中立诚信，在服务中出成绩，努力实现“四个提升”：。实行网上查询、网上审批是提高服务效率的重要举措，2007年我们做了一些尝试，局域网已经与中心接通。为配合中心二期电子政务建设，今年我们将以此为重点，积极争取局领导和相关业务处室的大力支持，利用局域网的优势，构建信息传递、咨询查询、行政审批的快速通道，努力完善现代化办公途径。。在市委、市政府不断加强重大项目和政府重点工程推进力度的形势下，我们将变被动服务为主动服务，及时跟踪重大项目和政府重点工程的进展情况，提前做好用地单位的需求调查，帮助企业缓解用地矛盾，引导企业不走弯路，决不让企业发展因窗口服务不到位而受阻。。在行政服务处整建制进中心办公的基础上，对确需相关业务处室参与现场勘查或技术论证的，由窗口牵头，相关人员每周一、三、五进中心现场办公，分管领导每周进中心办公不少于一次，特殊情况，特事特办。。不断加强窗口工作人员思想道德建设，树立求真务实、清正廉洁、热情周到的良好形象。积极开展 “服务优胜窗口”和“优质服务个人”争创活动，大力倡导文明服务，礼仪服务。巩固完善窗口各项工作制度，达到“态度热情、管理规范、服务到位”的要求，努力造就一支高素质的干部队伍，为优化全市经济发展环境增光添彩。。在过去的一年里，工商局窗口始终坚持“公开、规范、高效、便民”的服务宗旨，以开展创新服务提升内涵年活动为载体，以“优质服务百日竞赛” 和“星级岗考评”为抓手，在完善制度、规范登记、强化一次性告知、优化审批环节等方面下功夫、求突破，不断提升服务内涵，窗口建设得到了进一步加强，被省人事厅和省工商局表彰为“全省工商系统先进集体”。,其他,0.5095411690279478
79,江苏省,镇江市,市司法局组织赴上海考察学习司法鉴定工作图,2014-04-22,http://sfj.zhenjiang.gov.cn/sfj/jckt/201404/59bee8427b6846af9d7a676a773a9d66.shtml,为进一步提升司法鉴定工作质量，提升司法鉴定规范管理水平，4月17-18日，镇江市司法局组织全市司法鉴定机构负责人赴上海，考察学习司法部司法鉴定科学技术研究所司法鉴定工作。。考察组听取了该所关于机构建设、管理理念、科研项目、业务发展、队伍培养等方面的经验介绍，参观了该所的发展史室、法医病理学、法医临床学、司法精神病学、法医毒物化学、刑事技术、道路交通事故技术鉴定和司法鉴定制度与法规研究室等场所，了解了该所的发展历史、建设目标、开拓未来的思路。。此次考察学习将有效提升我市司法鉴定工作在机构建设、规范管理和发展理念等方面的水平。,镇江市人民政府办公室关于2024年第二季度政务新媒体和政府网站政务公开栏目检查情况通报。镇江市人民政府关于印发镇江市推动大规模设备更新和消费品以旧换新行动方案（2024~2027年）的通知。11月18日-19日，在副市长李世收的带领下，我市科技代表团前往深圳考察学习，重点参加了第十五届中国国际高新技术成果交易会（简称“高交会”），并赴华大基因研究院、南山区科技创业服务中心交流学习。。高交会作为“中国科技第一展”，是中国规模最大、最具影响力的科技类展会。我市共有两家企业参展，分别是江苏东恒空港高新技术产业园和江苏博远电子有限公司。李世收询问了两家企业参加高交会的有关情况，同时，对随行的各辖市区分管领导提出要求，希望在以后的高交会上能看到更多镇江企业展示自己的科技成果。,政府领导到其他城市考察学习或访问,0.0
79,江苏省,镇江市,我市赴外地考察学习现代农业产业园区建设,2014-04-21,http://snyncj.zhenjiang.gov.cn/nyncj/gzdt/201404/85a92ebfaa91441dbe242a93c65eb4e2.shtml,考察组一行先后赴苏州常熟董浜蔬菜园区、南通通州景瑞农业园区、盐城东台仙湖农业园区和盐都潘黄农业园区、稳强生态农业园及盐都台创园进行了实地考察。考察采取观摩现场和座谈讨论相结合，详细了解了各地现代农业园区发展新思路、新模式和新做法。常熟董浜农业园区高效节水灌溉工程模式、公共服务平台，通州瑞景农业园区台创园建设及江苏省瑞景农业科技发展有限公司对接多家大型超市，发展订单农业，带动周边种菜农户致富的做法，江苏省东台仙湖农业园区的整合全市资源，集中投入，打造精品园区的做法，让考察组一行收益匪浅，收获颇多。 围绕这次考察，荆国芳副主任要求各地农委系统、园区认真总结吸收以上几家园区好的经验做法，创新举措，狠抓落实，进一步明确现代农业产业园区建设发展方向和工作思路；把握关键和重点，推动现代农业园区建设取得新进展。。围绕这次考察，荆国芳副主任要求各地农委系统、园区认真总结吸收以上几家园区好的经验做法，创新举措，狠抓落实，进一步明确现代农业产业园区建设发展方向和工作思路；把握关键和重点，推动现代农业园区建设取得新进展。,春华秋实冬又来，喜看中心满目新。2006年市行政服务中心伴随着全市“建设新镇江，全面达小康”的前进步伐，以“提速增效优质便民年”活动为载体，进一步加大改革创新力度，不断探索行政服务的新模式、新方法、新手段，机制建设更趋完善，体制创新持续推进，服务能力和服务水平全面提升。。今年以来，全国各地有50个城市的考察团到中心考察学习“两集中、两到位”工作，其中省内17个，省外33个 。华东三省一市（苏、浙、皖、沪）已有10多个城市学习借鉴我市的经验并开始推进这项工作。。2006年1月22日，《新华日报》登载了《建设现代服务型政府的有益探索——镇江市行政服务中心改革纪实》，详细介绍我市的“两集中、两到位”工作。。2006年10月30日，在温州举行的苏浙皖沪三省一市行政（审批）服务中心主任联席会议上，专门安排中心党组书记解宪荣介绍我市“两集中、两到位”工作的做法和成效，引起很大的反响。。“两集中、两到位”得到四方同仁的充分肯定。绍兴市政府副秘书长、便民服务中心主任楼铁谔认为：镇江推进“两集中、两到位”突破了中心发展的体制性障碍；宁波市审改办主任、中心管委会主任李光认为：镇江的“两集中、两到位”在全国树起了一面旗帜，非常了不起，让我们坚定了建设好行政服务中心的信心。前来考察学习的浙江、上海、河南、安徽、山东、辽宁、青海等地的同仁将“两集中、两到位”工作的理念播撒到全国各地，也为我们进一步完善“两集中、两到位”工作提供了动力。。实践证明，推进“两集中、两到位”工作，是现阶段转变政府职能、优化投资环境、提升中心服务效率的一个核心环节。。表彰了29个先进集体和54名先进个人，一批部门（单位）的负责人分别被记二等功、三等功，进一步鼓舞了士气、增强了信心。。“两集中、两到位”工作， 3月9日，镇江市“两集中、两到位”工作检查验收领导小组下发了《关于落实“两集中、两到位”回头看工作的通知》。3月下旬，中心与市委办督查处、市政府办督查处、市人大内司委、市政协提案委、市纪委（监察局）、市编办一起，对有关部门（单位）的“两集中、两到位”回头看工作进行检查。针对各相关部门（单位）的工作实际，提出了完善和改进的要求。通过开展回头看，“两集中、两到位”工作得到进一步的巩固和深化。。今年以来，中心出台了6个联审会办操作办法。截止11月底，中心共受理联审会办项目4267个，成功组织了10多次大项目报批咨询论证会，为业主“量身定做”《服务指南》。。基本建设项目、外商投资企业设立、企业和个体工商户注册、城市道路挖掘许可、户外广告设置许可、园区工业项目行政许可快速通道。出台了《镇江市基本建设项目联审会办操作办法》、《镇江市企业和个体工商户注册联审会办操作办法》等5个文件。是中心集中办事的优势所在，是中心发挥集约功能的主要措施，是便民利民、优化投资软环境的重要途径。以企业设立联审会办为例，中心对。中办件量较大的10类具有不同前置审批的办件，分别编制了办事流程，明确总牵头窗口、主办窗口和协办窗口的衔接程序和工作职责。需要进行现场踏勘的，分别由卫生、公安、文化、交通等5个主办窗口组织联合踏勘，当场确定是否符合筹建条件，或者当场提出整改要求。参加。合踏勘的工作人员，按照中心要求带齐各自的空白表单和《办事须知》，当场发给符合筹建条件的办事人，办事人根据需要准备相关申报材料，大大减少了办事人员的麻烦，提高了办事效率，充分显示了中心窗口由物理组合上升为有机化合的集约效应。。12日至13日，市行政服务中心的ISO9000质量管理体系顺利通过中国方圆认证中心的审核验收。此举进一步促进了行政服务的规范化、程序化和标准化，提高了行政服务的质量,其他,0.5124341191304324
