code,province,city,topic,date,url,content,content,label,score
137,山东省,泰安市,市领导率考察团赴淄博学习考察,2018-08-23,http://www.taian.gov.cn/art/2018/8/23/art_46736_4058385.html,8月22日，市委副书记张涛带队赴淄博市临淄区，学习考察在乡村振兴、脱贫攻坚等方面的先进经验做法。淄博市委常委、统战部长李明陪同考察。。考察团一行先后到朱台镇西单村、敬仲镇白兔丘北村和皇城镇小铁佛村进行了实地考察，认真听取经验介绍，详细询问有关乡村振兴及脱贫攻坚工作情况，并就工作中的热点、难点问题进行了交流探讨。近年来，这三个村通过建机制、强组织，选优建强村级班子，着力发展蔬菜大棚、特色养殖、桂花种植、玫瑰种植等产业，积极推进村庄“五化”、旱厕改造、“气代煤”改造等基础设施建设，大力弘扬优秀文化，培育了良好的村风家风民风，村容村貌、精神文明、群众收入不断提升。。随后，考察团来到皇城镇思远农业公司和玫瑰特色小镇，考察产业发展情况。思远农业开发有限公司是一家农业社会化服务机构，以自主研发的现代农业标准化生产模式为核心，依托“互联网+农业社会化服务”体系，为农户提供产前、产中、产后，全方位、保姆式，农业生产技术服务，实现年营业额5518万元。 玫瑰创新小镇占地1.2万平方米，内含多功能厅、玫瑰主题馆、植物护肤观光式工厂、项目体验展示中心、开放式办公中心、智能定制组装展示中心等功能区域，依托玫瑰小镇，皇城镇规划设计了创新创业孵化平台，形成了独特的发展机制和企业文化。。通过学习，考察团成员对乡村振兴及脱贫攻坚工作有了更深的认识和感悟。纷纷表示，将认真贯彻落实上级安排部署，严格按照市委、市政府要求，结合实际，打造亮点，全力推进乡村振兴及脱贫攻坚各项工作。。市人大常委会副主任、宁阳县委书记刘学保，泰山景区党工委书记姚霆，各县（市、区）、泰安高新区、泰山景区和市委农工办、市扶贫办等有关单位负责同志约150人参加考察。,8月22日，市委副书记张涛带队赴淄博市临淄区，学习考察在乡村振兴、脱贫攻坚等方面的先进经验做法。淄博市委常委、统战部长李明陪同考察。。考察团一行先后到朱台镇西单村、敬仲镇白兔丘北村和皇城镇小铁佛村进行了实地考察，认真听取经验介绍，详细询问有关乡村振兴及脱贫攻坚工作情况，并就工作中的热点、难点问题进行了交流探讨。近年来，这三个村通过建机制、强组织，选优建强村级班子，着力发展蔬菜大棚、特色养殖、桂花种植、玫瑰种植等产业，积极推进村庄“五化”、旱厕改造、“气代煤”改造等基础设施建设，大力弘扬优秀文化，培育了良好的村风家风民风，村容村貌、精神文明、群众收入不断提升。。随后，考察团来到皇城镇思远农业公司和玫瑰特色小镇，考察产业发展情况。思远农业开发有限公司是一家农业社会化服务机构，以自主研发的现代农业标准化生产模式为核心，依托“互联网+农业社会化服务”体系，为农户提供产前、产中、产后，全方位、保姆式，农业生产技术服务，实现年营业额5518万元。 玫瑰创新小镇占地1.2万平方米，内含多功能厅、玫瑰主题馆、植物护肤观光式工厂、项目体验展示中心、开放式办公中心、智能定制组装展示中心等功能区域，依托玫瑰小镇，皇城镇规划设计了创新创业孵化平台，形成了独特的发展机制和企业文化。。通过学习，考察团成员对乡村振兴及脱贫攻坚工作有了更深的认识和感悟。纷纷表示，将认真贯彻落实上级安排部署，严格按照市委、市政府要求，结合实际，打造亮点，全力推进乡村振兴及脱贫攻坚各项工作。。市人大常委会副主任、宁阳县委书记刘学保，泰山景区党工委书记姚霆，各县（市、区）、泰安高新区、泰山景区和市委农工办、市扶贫办等有关单位负责同志约150人参加考察。,政府领导到其他城市考察学习或访问,0.0
137,山东省,泰安市,广东省政协来泰学习考察,2016-06-15,http://www.taian.gov.cn/art/2016/6/15/art_46736_4063057.html,6月13日，广东省政协副主席唐豪带领考察组来泰学习考察。市政协副主席谭业刚陪同活动。。唐豪一行实地考察了泰安市博物馆、如意科技时尚产业园、泰山玻纤、大汶口国家考古遗址公园等现场，听取了相关情况汇报。唐豪对泰安市政协工作进行了充分肯定。他指出，泰安政协港澳台侨和外事委创新履职形式，充分发挥独特的资源优势，以泰山文化为引领，积极开展海内外联络联谊工作，扩大交流，促进合作，为增进共识、汇聚力量、推动经济社会发展发挥了积极作用。,6月13日，广东省政协副主席唐豪带领考察组来泰学习考察。市政协副主席谭业刚陪同活动。。唐豪一行实地考察了泰安市博物馆、如意科技时尚产业园、泰山玻纤、大汶口国家考古遗址公园等现场，听取了相关情况汇报。唐豪对泰安市政协工作进行了充分肯定。他指出，泰安政协港澳台侨和外事委创新履职形式，充分发挥独特的资源优势，以泰山文化为引领，积极开展海内外联络联谊工作，扩大交流，促进合作，为增进共识、汇聚力量、推动经济社会发展发挥了积极作用。,政府领导到其他城市考察学习或访问,0.0
137,山东省,泰安市,泰安党政考察团赴枣庄济宁考察学习,2019-04-01,http://www.taian.gov.cn/art/2019/4/1/art_46736_5155551.html,全省新旧动能转换项目落地第二次现场观摩会结束后，3月29日至30日，泰安市党政考察团即赴枣庄、济宁考察学习两市在新旧动能转换项目落地上的新思想、新路径和新方法。市委副书记张涛带队，市委常委、常务副市长展宝卫，副市长成丽参加活动。。29日，考察团一行在枣庄市先后察看了墨子科创园精密机床研发孵化制造基地、中材高性能锂电隔膜研发制造项目、互联网小镇-浙江大学山东工业技术研究院、智光光纤制造和鲁南大数据中心，听取了相关工作情况介绍，详细了解了枣庄市双招双引、重点项目建设、新旧动能转换等工作开展情况。考察团成员看到，枣庄市这些产业门类齐全的前沿产业不仅投资规模大、科技含量高，而且还具有很大的带动能力和市场潜力。。30日，考察团一行在济宁市先后察看了华为大数据产业园、如意全产业链智能制造系统工程、尼山圣境一期项目，听取了项目情况汇报，仔细询问济宁大数据平台在项目管理调度、问题解决督导以及可视化分析研判等方面的具体举措；在如意集团科技艺术中心的高科技沙盘前，考察团成员详细听取了集团产业链布局、生产线分布、产业园项目规划等情况介绍，并参观了工程技术研究中心。在尼山圣境一期项目，考察团详细了解当地在传承弘扬、创新发展优秀传统文化方面所做的探索。。考察过程中，考察团详细了解当地有关工作情况和经验做法，与当地相关领导、部门、企业就双招双引、培育新动能等进行了深入探讨交流。大家一路走、一路看，一路比、一路议，找差距、找问题、学经验、学做法，收获满满，深受触动。期间，张涛主持召开座谈会，相关区县和部门负责同志对考察之行的所思所想、所感所悟进行了深入交流，进一步解放了思想、明确了目标、找到了方法、坚定了信心。张涛指出，两个地市取得较好发展的经验、做法值得考察团认真学习借鉴。考察团成员们要看清楚差距、看清楚门道、看清楚规律，要突出重点、精准施策，围绕产学研用结合、打造发展平台、双招双引、产业集群等方面，拿出切实可行的解决方案、推进举措。要在抢抓机遇上敢为人先，解放思想，担当作为，乘势而上对标各部门的工作中的实际，找准下一步的目标和方向，制定追赶的措施，最后落实到“实干”上来，加快推动新旧动能转换。,全省新旧动能转换项目落地第二次现场观摩会结束后，3月29日至30日，泰安市党政考察团即赴枣庄、济宁考察学习两市在新旧动能转换项目落地上的新思想、新路径和新方法。市委副书记张涛带队，市委常委、常务副市长展宝卫，副市长成丽参加活动。。29日，考察团一行在枣庄市先后察看了墨子科创园精密机床研发孵化制造基地、中材高性能锂电隔膜研发制造项目、互联网小镇-浙江大学山东工业技术研究院、智光光纤制造和鲁南大数据中心，听取了相关工作情况介绍，详细了解了枣庄市双招双引、重点项目建设、新旧动能转换等工作开展情况。考察团成员看到，枣庄市这些产业门类齐全的前沿产业不仅投资规模大、科技含量高，而且还具有很大的带动能力和市场潜力。。30日，考察团一行在济宁市先后察看了华为大数据产业园、如意全产业链智能制造系统工程、尼山圣境一期项目，听取了项目情况汇报，仔细询问济宁大数据平台在项目管理调度、问题解决督导以及可视化分析研判等方面的具体举措；在如意集团科技艺术中心的高科技沙盘前，考察团成员详细听取了集团产业链布局、生产线分布、产业园项目规划等情况介绍，并参观了工程技术研究中心。在尼山圣境一期项目，考察团详细了解当地在传承弘扬、创新发展优秀传统文化方面所做的探索。。考察过程中，考察团详细了解当地有关工作情况和经验做法，与当地相关领导、部门、企业就双招双引、培育新动能等进行了深入探讨交流。大家一路走、一路看，一路比、一路议，找差距、找问题、学经验、学做法，收获满满，深受触动。期间，张涛主持召开座谈会，相关区县和部门负责同志对考察之行的所思所想、所感所悟进行了深入交流，进一步解放了思想、明确了目标、找到了方法、坚定了信心。张涛指出，两个地市取得较好发展的经验、做法值得考察团认真学习借鉴。考察团成员们要看清楚差距、看清楚门道、看清楚规律，要突出重点、精准施策，围绕产学研用结合、打造发展平台、双招双引、产业集群等方面，拿出切实可行的解决方案、推进举措。要在抢抓机遇上敢为人先，解放思想，担当作为，乘势而上对标各部门的工作中的实际，找准下一步的目标和方向，制定追赶的措施，最后落实到“实干”上来，加快推动新旧动能转换。,政府领导到其他城市考察学习或访问,0.6253545037673627
137,山东省,泰安市,滨州市政协来泰学习考察,2016-03-11,http://www.taian.gov.cn/art/2016/3/11/art_46736_4063403.html,近日，滨州市政协学习考察组在滨州市政协副主席史东、商玉昌带领下来泰学习考察。市政协副主席张甲军陪同活动。。滨州市政协学习考察组先后到泰安规划展览馆、泰山国际会展中心、万达广场、泰安高铁新区等地进行实地考察。张甲军对滨州市政协一行的到来表示欢迎，他指出，近年来，泰安市政协在中共泰安市委的正确领导下，围绕中心，服务大局，扎实履行政治协商、民主监督、参政议政职能，各专委会坚持改革创新，不断加强自身建设，切实发挥专委会基础性作用，为全市改革发展稳定大局作出了积极贡献。他希望加强与滨州市政协的沟通交流，共同推动政协工作迈上新台阶。。滨州市政协考察组认为，泰安市政协积极改进活动方式，拓展工作领域，创新履职形式，工作中形成了一批新经验、新亮点，希望双方进一步加强交流，学习更多先进经验，进一步提升政协工作科学化水平。,近日，滨州市政协学习考察组在滨州市政协副主席史东、商玉昌带领下来泰学习考察。市政协副主席张甲军陪同活动。。滨州市政协学习考察组先后到泰安规划展览馆、泰山国际会展中心、万达广场、泰安高铁新区等地进行实地考察。张甲军对滨州市政协一行的到来表示欢迎，他指出，近年来，泰安市政协在中共泰安市委的正确领导下，围绕中心，服务大局，扎实履行政治协商、民主监督、参政议政职能，各专委会坚持改革创新，不断加强自身建设，切实发挥专委会基础性作用，为全市改革发展稳定大局作出了积极贡献。他希望加强与滨州市政协的沟通交流，共同推动政协工作迈上新台阶。。滨州市政协考察组认为，泰安市政协积极改进活动方式，拓展工作领域，创新履职形式，工作中形成了一批新经验、新亮点，希望双方进一步加强交流，学习更多先进经验，进一步提升政协工作科学化水平。,政府领导到其他城市考察学习或访问,0.0
137,山东省,泰安市,市纪委理论学习中心组学习研讨,2017-08-17,http://www.taian.gov.cn/art/2017/8/17/art_46736_4060960.html,8月14日，市纪委理论学习中心组进行集体学习研讨，深入学习习近平总书记在省部级主要领导干部专题研讨班上的重要讲话精神。市委常委、市纪委书记郝红主持并讲话。。市纪委常委结合思想和工作实际谈了学习体会，一致认为，习近平总书记重要讲话，深刻阐释了新的历史条件下坚持和发展中国特色社会主义的一系列重大理论和实践问题，为党的十九大胜利召开奠定了重要政治基础、思想基础、理论基础。会议强调，全市各级纪检机关和全体纪检干部，要旗帜鲜明讲政治，把学习贯彻重要讲话作为一项重大政治任务，认真学习研读，强化学思践悟，准确把握讲话深刻内涵和精神实质。。会议要求，全体纪检干部要紧密联系纪检监察工作实际，以讲话精神为指导，要把维护党的政治纪律和政治规矩放在首位，强化党内监督，持之以恒纠正“四风”，保持惩治腐败高压态势，严肃查处侵害群众利益问题，推动全面从严治党向纵深发展、向基层延伸，为党的十九大胜利召开贡献力量。,8月14日，市纪委理论学习中心组进行集体学习研讨，深入学习习近平总书记在省部级主要领导干部专题研讨班上的重要讲话精神。市委常委、市纪委书记郝红主持并讲话。。市纪委常委结合思想和工作实际谈了学习体会，一致认为，习近平总书记重要讲话，深刻阐释了新的历史条件下坚持和发展中国特色社会主义的一系列重大理论和实践问题，为党的十九大胜利召开奠定了重要政治基础、思想基础、理论基础。会议强调，全市各级纪检机关和全体纪检干部，要旗帜鲜明讲政治，把学习贯彻重要讲话作为一项重大政治任务，认真学习研读，强化学思践悟，准确把握讲话深刻内涵和精神实质。。会议要求，全体纪检干部要紧密联系纪检监察工作实际，以讲话精神为指导，要把维护党的政治纪律和政治规矩放在首位，强化党内监督，持之以恒纠正“四风”，保持惩治腐败高压态势，严肃查处侵害群众利益问题，推动全面从严治党向纵深发展、向基层延伸，为党的十九大胜利召开贡献力量。,其他,0.7683211878365839
137,山东省,泰安市,西藏及四省藏区基层组织和政权建设学习考察团来泰,2011-05-31,http://www.taian.gov.cn/art/2011/5/31/art_46736_4078234.html,5月25日至26日，民政部援藏援疆工作领导小组组织和政权建设办公室主任、民政部基层政权和社区建设司副司长汤晋苏带领西藏及四省藏区基层组织和政权建设学习考察团，来我市考察社会管理服务工作。省民政厅巡视员李玉亮、副市长闫新建陪同活动。 考察团先后参观了泰山区慈善超市现场和市流浪儿童救助保护中心。我市爱心慈善超市成立以来，连锁营销网点已达10处，成为一个机制健全、管理规范，对困难群众实行二次、三次救助的有效载体。市流浪儿童救助保护中心创新的“159”救助模式，以其为服务对象提供最人性化的管理和亲情化的服务救助理念，被民政部命名为“泰安救助模式”。,5月25日至26日，民政部援藏援疆工作领导小组组织和政权建设办公室主任、民政部基层政权和社区建设司副司长汤晋苏带领西藏及四省藏区基层组织和政权建设学习考察团，来我市考察社会管理服务工作。省民政厅巡视员李玉亮、副市长闫新建陪同活动。 考察团先后参观了泰山区慈善超市现场和市流浪儿童救助保护中心。我市爱心慈善超市成立以来，连锁营销网点已达10处，成为一个机制健全、管理规范，对困难群众实行二次、三次救助的有效载体。市流浪儿童救助保护中心创新的“159”救助模式，以其为服务对象提供最人性化的管理和亲情化的服务救助理念，被民政部命名为“泰安救助模式”。,政府领导到其他城市考察学习或访问,0.0
137,山东省,泰安市,第二期领导干部培训班赴东平考察学习,2013-05-31,http://www.taian.gov.cn/art/2013/5/31/art_46736_4072399.html,考察团先后参观了东平博物馆、万里图书馆、东平文化馆、文秀大剧院、水浒影视城、东平工委纪念馆(万里故居)。学员们每到一处，认真学习，听取讲解，对东平近几年文化事业突飞猛进的发展、经济社会日新月异的变化而赞许和感叹。,考察团先后参观了东平博物馆、万里图书馆、东平文化馆、文秀大剧院、水浒影视城、东平工委纪念馆(万里故居)。学员们每到一处，认真学习，听取讲解，对东平近几年文化事业突飞猛进的发展、经济社会日新月异的变化而赞许和感叹。,其他,0.5872999344118867
137,山东省,泰安市,我市组织政务公开考察团赴潍坊烟台德州济宁四地考察学习,2022-07-14,https://mp.weixin.qq.com/s/tY7PDQ1kmRwf4MW15xFejw,为对标先进、学习经验，全面推进全市政务公开工作水平大提升，6月28日至7月1日，市政府办公室政务公开办以及各县（市、区）政务公开科室负责同志和工作人员一行赴潍坊、烟台、德州、济宁等地考察学习，参观部分县（市、区）政务公开专区建设、政务服务中心等场所，详细了解先进地市在体制机制建设、公开平台运行维护、依申请公开、市县统筹、政策解读等方面的先进经验和主要做法。。在潍坊市，通过座谈交流方式，详细了解潍坊市在政务公开网站建设、人员配备、评估考核等方面的情况，并到潍城区政务服务大厅、坊子区政务公开专区进行实地参观，了解触控一体智慧云平台建设、惠企惠民政策平台、公开专区数据建设等内容，感受数据集成带来的优势。。在烟台市，召开“市县统筹”交流座谈会，烟台市9个市（区）的政务公开负责同志参会，栖霞、莱山等市（区）作了典型经验交流。两地的县（市、区）工作人员就工作中遇到的难点痛点问题进行了热烈探讨，取得较好的效果。。在德州市，参观考察宁津县农业数据共享中心、工业经济数据中心、城市数据中心等场所，学习德州在大数据、融媒体等资源与政务公开紧密融合方面的先进经验；在融媒体中心，听取负责同志就政务公开与新媒体有效结合、拓宽政务公开渠道方面开展的有益尝试，进一步启发了工作思路。。在济宁市，实地了解任城区政务公开专区建设情况，并组织开展座谈交流，学习济宁市在政务公开培训和轮训、政策解读、政策主动推送等方面的经验和做法，对开展下步工作提供了参考。。泰安市将以这次考察学习为契机，认真学习借鉴先进地市的经验做法，创新思路，在“优化平台建设、健全制度机制、强化组织保障、创新业务培训、加大督导考核力度”上下功夫、求突破，力争今年全市政务公开工作实现大突破、大提升。,为对标先进、学习经验，全面推进全市政务公开工作水平大提升，6月28日至7月1日，市政府办公室政务公开办以及各县（市、区）政务公开科室负责同志和工作人员一行赴潍坊、烟台、德州、济宁等地考察学习，参观部分县（市、区）政务公开专区建设、政务服务中心等场所，详细了解先进地市在体制机制建设、公开平台运行维护、依申请公开、市县统筹、政策解读等方面的先进经验和主要做法。。在潍坊市，通过座谈交流方式，详细了解潍坊市在政务公开网站建设、人员配备、评估考核等方面的情况，并到潍城区政务服务大厅、坊子区政务公开专区进行实地参观，了解触控一体智慧云平台建设、惠企惠民政策平台、公开专区数据建设等内容，感受数据集成带来的优势。。在烟台市，召开“市县统筹”交流座谈会，烟台市9个市（区）的政务公开负责同志参会，栖霞、莱山等市（区）作了典型经验交流。两地的县（市、区）工作人员就工作中遇到的难点痛点问题进行了热烈探讨，取得较好的效果。。在德州市，参观考察宁津县农业数据共享中心、工业经济数据中心、城市数据中心等场所，学习德州在大数据、融媒体等资源与政务公开紧密融合方面的先进经验；在融媒体中心，听取负责同志就政务公开与新媒体有效结合、拓宽政务公开渠道方面开展的有益尝试，进一步启发了工作思路。。在济宁市，实地了解任城区政务公开专区建设情况，并组织开展座谈交流，学习济宁市在政务公开培训和轮训、政策解读、政策主动推送等方面的经验和做法，对开展下步工作提供了参考。。泰安市将以这次考察学习为契机，认真学习借鉴先进地市的经验做法，创新思路，在“优化平台建设、健全制度机制、强化组织保障、创新业务培训、加大督导考核力度”上下功夫、求突破，力争今年全市政务公开工作实现大突破、大提升。,政府领导到其他城市考察学习或访问,0.9163514913767151
