code,province,city,topic,date,url,content,content,label,score
137,山东省,泰安市,市人大常委会党组理论学习中心组开展集体学习,2020-12-02,http://www.taian.gov.cn/art/2020/12/2/art_46736_10077904.html,12月1日上午，市人大常委会党组理论学习中心组开展集体学习。市人大常委会党组书记、主任唐福泉，党组副书记、副主任张书盈，党组成员、副主任陶长江、曹步山，党组成员、秘书长朱杰参加学习。。会议集体学习了中央全面依法治国工作会议精神、新华社学习材料《全面准确认识当前形势努力完成今年经济社会发展目标任务》《中国共产党机构编制工作条例》（以下简称《条例》），并研究贯彻落实意见。。唐福泉要求，要把学习宣传贯彻中央全面依法治国工作会议精神特别是习近平法治思想，作为当前和今后一个时期的重大政治任务，不断增强“四个意识”、坚定“四个自信”、做到“两个维护”，自觉把依法治国工作放在全市工作大局中来考虑、来谋划、来推进，与人大工作有机结合起来，确保习近平法治思想在人大各项工作中落实、落地。要坚持围绕中心、服务大局，做好人大年度收尾工作，做好市十七届人大六次会议筹备工作，及早谋划好明年的立法、监督、代表等工作，确保“十四五”开好局、起好步，推动新时代地方人大工作与时俱进、创新发展。要充分认识机构编制工作的重要性，扎实开展《条例》的学习宣传，准确掌握《条例》基本精神和主要内容，切实用《条例》统一思想、规范工作，以求真务实的作风坚决把党中央的各项决策部署不折不扣落到实处。,12月1日上午，市人大常委会党组理论学习中心组开展集体学习。市人大常委会党组书记、主任唐福泉，党组副书记、副主任张书盈，党组成员、副主任陶长江、曹步山，党组成员、秘书长朱杰参加学习。。会议集体学习了中央全面依法治国工作会议精神、新华社学习材料《全面准确认识当前形势努力完成今年经济社会发展目标任务》《中国共产党机构编制工作条例》（以下简称《条例》），并研究贯彻落实意见。。唐福泉要求，要把学习宣传贯彻中央全面依法治国工作会议精神特别是习近平法治思想，作为当前和今后一个时期的重大政治任务，不断增强“四个意识”、坚定“四个自信”、做到“两个维护”，自觉把依法治国工作放在全市工作大局中来考虑、来谋划、来推进，与人大工作有机结合起来，确保习近平法治思想在人大各项工作中落实、落地。要坚持围绕中心、服务大局，做好人大年度收尾工作，做好市十七届人大六次会议筹备工作，及早谋划好明年的立法、监督、代表等工作，确保“十四五”开好局、起好步，推动新时代地方人大工作与时俱进、创新发展。要充分认识机构编制工作的重要性，扎实开展《条例》的学习宣传，准确掌握《条例》基本精神和主要内容，切实用《条例》统一思想、规范工作，以求真务实的作风坚决把党中央的各项决策部署不折不扣落到实处。,其他,0.7734291149772229
137,山东省,泰安市,市人大常委会党组理论学习中心组开展集体学习,2020-07-30,http://www.taian.gov.cn/art/2020/7/30/art_46736_9479784.html,7月29日上午，市人大常委会党组理论学习中心组开展集体学习。市人大常委会党组书记、主任唐福泉，党组副书记、副主任张书盈，党组成员、副主任陶长江、刘学保、曹步山，党组成员、秘书长朱杰参加学习。市人大常委会副主任王淑玲列席活动。。会议传达学习了习近平总书记在中央政治局第二十次、第二十一次集体学习时的重要讲话精神，《中共中央组织部关于认真学习贯彻习近平总书记在中央政治局第二十一次集体学习时重要讲话精神的通知》《泰安市深入贯彻习近平总书记重要指示精神勇做新时代泰山“挑山工”》，市委常委会扩大会议有关精神及新档案法有关内容，并进行学习交流。。唐福泉对如何学习贯彻市委常委会扩大会议精神，做好人大工作，讲了意见和要求，要求市人大机关认真学习会议精神，结合年度工作要点，把立法、监督、视察、执法检查和代表工作同市委中心工作有机结合起来，突出重点，增强实效，确保与市委工作部署同频共振。要加大对民法典的学习宣传贯彻力度，增强贯彻实施民法典的政治自觉、思想自觉和行动自觉；扎实开展宣传教育，持续开展普法活动；认真抓好贯彻实施，更好地维护人民群众合法权益。要认真贯彻落实新时代党的组织路线，抓好学习、抓好制度、抓好队伍，确保党中央决策部署和省、市委要求在人大机关落实落地。要勇做新时代泰山“挑山工”，加强机关作风建设，扎实做好人大各项工作。要深入学习新档案法，准确把握精神实质，做好人大的档案工作。,7月29日上午，市人大常委会党组理论学习中心组开展集体学习。市人大常委会党组书记、主任唐福泉，党组副书记、副主任张书盈，党组成员、副主任陶长江、刘学保、曹步山，党组成员、秘书长朱杰参加学习。市人大常委会副主任王淑玲列席活动。。会议传达学习了习近平总书记在中央政治局第二十次、第二十一次集体学习时的重要讲话精神，《中共中央组织部关于认真学习贯彻习近平总书记在中央政治局第二十一次集体学习时重要讲话精神的通知》《泰安市深入贯彻习近平总书记重要指示精神勇做新时代泰山“挑山工”》，市委常委会扩大会议有关精神及新档案法有关内容，并进行学习交流。。唐福泉对如何学习贯彻市委常委会扩大会议精神，做好人大工作，讲了意见和要求，要求市人大机关认真学习会议精神，结合年度工作要点，把立法、监督、视察、执法检查和代表工作同市委中心工作有机结合起来，突出重点，增强实效，确保与市委工作部署同频共振。要加大对民法典的学习宣传贯彻力度，增强贯彻实施民法典的政治自觉、思想自觉和行动自觉；扎实开展宣传教育，持续开展普法活动；认真抓好贯彻实施，更好地维护人民群众合法权益。要认真贯彻落实新时代党的组织路线，抓好学习、抓好制度、抓好队伍，确保党中央决策部署和省、市委要求在人大机关落实落地。要勇做新时代泰山“挑山工”，加强机关作风建设，扎实做好人大各项工作。要深入学习新档案法，准确把握精神实质，做好人大的档案工作。,其他,0.8109421058776141
137,山东省,泰安市,市政协党组理论学习中心组开展集体学习研讨,2021-01-09,http://www.taian.gov.cn/art/2021/1/9/art_46736_10285484.html,1月8日上午，市政协党组理论学习中心组围绕深入学习贯彻习近平新时代中国特色社会主义思想，学习贯彻党的十九届五中全会精神，进行学习研讨。。市政协党组理论学习中心组成员参加会议，围绕学习主题，结合前期自学内容，紧密联系思想和工作实际进行了交流发言。市政协党外副主席列席会议。。会议要求，要持续深入学习贯彻习近平新时代中国特色社会主义思想，更加自觉地用习近平新时代中国特色社会主义思想武装头脑、指导实践，在学懂弄通做实上持续用力，加强专门协商机构建设，把人民政协制度优势转化为社会治理效能，不断巩固和发展大团结大联合局面。要认真做好民主生活会准备工作，以中央政治局民主生活会为标杆，落实市委安排部署，坚持从严从实要求，精心组织安排，开展严肃认真的批评和自我批评，确保民主生活会开出高质量好效果。要精益求精做好市政协十三届五次会议筹备工作，统筹做好安保和疫情防控工作，切实把各项筹备工作落细落实落到位，确保大会顺利召开、圆满成功。,1月8日上午，市政协党组理论学习中心组围绕深入学习贯彻习近平新时代中国特色社会主义思想，学习贯彻党的十九届五中全会精神，进行学习研讨。。市政协党组理论学习中心组成员参加会议，围绕学习主题，结合前期自学内容，紧密联系思想和工作实际进行了交流发言。市政协党外副主席列席会议。。会议要求，要持续深入学习贯彻习近平新时代中国特色社会主义思想，更加自觉地用习近平新时代中国特色社会主义思想武装头脑、指导实践，在学懂弄通做实上持续用力，加强专门协商机构建设，把人民政协制度优势转化为社会治理效能，不断巩固和发展大团结大联合局面。要认真做好民主生活会准备工作，以中央政治局民主生活会为标杆，落实市委安排部署，坚持从严从实要求，精心组织安排，开展严肃认真的批评和自我批评，确保民主生活会开出高质量好效果。要精益求精做好市政协十三届五次会议筹备工作，统筹做好安保和疫情防控工作，切实把各项筹备工作落细落实落到位，确保大会顺利召开、圆满成功。,其他,0.6649582732464968
137,山东省,泰安市,市人大常委会党组理论学习中心组开展集体学习,2019-07-03,http://www.taian.gov.cn/art/2019/7/3/art_46736_6779367.html,7月2日上午，市人大常委会党组理论学习中心组开展集体学习。市人大常委会主任唐福泉主持会议并讲话，副主任张书盈、王淑玲、陶长江、曹步山，秘书长李起峰参加学习。。会议重点学习了中央纪委办公厅《印发〈关于贯彻落实习近平总书记重要批示精神深入落实中央八项规定精神的工作意见〉的通知》精神及贯彻落实建议的汇报、关于印发学习贯彻《关于激励干部担当作为的若干措施》的通知、省委办公厅关于五起不按规定向省委请示报告重要事项的通报、党委中心组学习参考第3期和泰安市庆祝中国共产党成立98周年暨新时代泰山“挑山工”先进集体先进个人表扬大会精神。。唐福泉要求，市人大常委会党组和机关全体党员干部要进一步提高政治站位，深入学习习近平总书记近期就推动作风建设在新时代向纵深发展作出的重要批示精神，结合“不忘初心、牢记使命”主题教育，研究贯彻落实意见，推动作风持续改进。要积极开展弘扬新时代泰山“挑山工”精神和“七赛七比”活动，围绕市委的中心工作和全市大局，寻标对标，制定实施方案，切实提高人大工作的水平。要担当作为，干事创业，对于市委交办的重大改革事项和人大自身工作，大胆创新，担当尽责，努力开创人大工作新局面。,7月2日上午，市人大常委会党组理论学习中心组开展集体学习。市人大常委会主任唐福泉主持会议并讲话，副主任张书盈、王淑玲、陶长江、曹步山，秘书长李起峰参加学习。。会议重点学习了中央纪委办公厅《印发〈关于贯彻落实习近平总书记重要批示精神深入落实中央八项规定精神的工作意见〉的通知》精神及贯彻落实建议的汇报、关于印发学习贯彻《关于激励干部担当作为的若干措施》的通知、省委办公厅关于五起不按规定向省委请示报告重要事项的通报、党委中心组学习参考第3期和泰安市庆祝中国共产党成立98周年暨新时代泰山“挑山工”先进集体先进个人表扬大会精神。。唐福泉要求，市人大常委会党组和机关全体党员干部要进一步提高政治站位，深入学习习近平总书记近期就推动作风建设在新时代向纵深发展作出的重要批示精神，结合“不忘初心、牢记使命”主题教育，研究贯彻落实意见，推动作风持续改进。要积极开展弘扬新时代泰山“挑山工”精神和“七赛七比”活动，围绕市委的中心工作和全市大局，寻标对标，制定实施方案，切实提高人大工作的水平。要担当作为，干事创业，对于市委交办的重大改革事项和人大自身工作，大胆创新，担当尽责，努力开创人大工作新局面。,其他,0.7212801703725381
137,山东省,泰安市,市政府党组理论学习中心组开展集体学习研讨,2019-08-13,http://www.taian.gov.cn/art/2019/8/13/art_46736_6939530.html,8月12日上午，市政府党组理论学习中心组召开会议，围绕龚正省长在省政府第43次常务会议上的讲话等内容开展集体学习研讨。市委副书记、市长、市政府党组书记张涛主持会议并讲话。市政府党组副书记展宝卫，市政府党组成员鞠向群、成丽、赵德健、张韧出席会议。副市长袁久党列席会议。。张涛指出，目前，全年时间已过大半，抓好今后几个月的工作至关重要。我们要紧紧围绕省委确定的“八大发展战略”，按照“抓准、抓细、抓实”的工作要求，聚焦聚力新旧动能转换、产业升级、“双招双引”、项目建设、流程再造、制度创新等重点工作，出实招、硬招、管用的招，大干三季度，决战四季度，确保如期完成确定的重点工程，确保圆满完成人代会确定的目标任务，确保在省考核中能够保七进位。。张涛强调，要抓好有效投资，强化“双招双引”和重点项目建设，深入研究提高项目的“亩均效益”“亩均投资”的措施办法，提高招引项目的“含金量”，用好“新动能重大项目可视化督导服务平台”，切实解决好企业和项目单位反馈的问题。要抓好产业转型升级，加快十一个产业规划的组织实施，集中力量抓好“双50强”企业培育，持续强化对实体经济的金融支持，加快实施乡村振兴战略。要抓好流程再造，纵深推进“一窗受理·一次办好”改革，加快实现政务大厅“一窗受理”、关联事项“一链办理”、政务服务“一网通办”、政务热线“一线联通”、贴心帮办“一次办结”等“五个一”。要抓好脱贫攻坚、环保督察以及“回头看”反馈问题整改、“增信贷、降不良、打逃债、树诚信”专项行动三大攻坚战，着力办好“十件实事”，全面升级改造“12345”民生服务热线。要抓好责任落实，强化责任担当，咬紧牙关，自我加压，打紧板、往前冲，争一流、求突破，确保圆满完成年初确定的各项目标任务。,8月12日上午，市政府党组理论学习中心组召开会议，围绕龚正省长在省政府第43次常务会议上的讲话等内容开展集体学习研讨。市委副书记、市长、市政府党组书记张涛主持会议并讲话。市政府党组副书记展宝卫，市政府党组成员鞠向群、成丽、赵德健、张韧出席会议。副市长袁久党列席会议。。张涛指出，目前，全年时间已过大半，抓好今后几个月的工作至关重要。我们要紧紧围绕省委确定的“八大发展战略”，按照“抓准、抓细、抓实”的工作要求，聚焦聚力新旧动能转换、产业升级、“双招双引”、项目建设、流程再造、制度创新等重点工作，出实招、硬招、管用的招，大干三季度，决战四季度，确保如期完成确定的重点工程，确保圆满完成人代会确定的目标任务，确保在省考核中能够保七进位。。张涛强调，要抓好有效投资，强化“双招双引”和重点项目建设，深入研究提高项目的“亩均效益”“亩均投资”的措施办法，提高招引项目的“含金量”，用好“新动能重大项目可视化督导服务平台”，切实解决好企业和项目单位反馈的问题。要抓好产业转型升级，加快十一个产业规划的组织实施，集中力量抓好“双50强”企业培育，持续强化对实体经济的金融支持，加快实施乡村振兴战略。要抓好流程再造，纵深推进“一窗受理·一次办好”改革，加快实现政务大厅“一窗受理”、关联事项“一链办理”、政务服务“一网通办”、政务热线“一线联通”、贴心帮办“一次办结”等“五个一”。要抓好脱贫攻坚、环保督察以及“回头看”反馈问题整改、“增信贷、降不良、打逃债、树诚信”专项行动三大攻坚战，着力办好“十件实事”，全面升级改造“12345”民生服务热线。要抓好责任落实，强化责任担当，咬紧牙关，自我加压，打紧板、往前冲，争一流、求突破，确保圆满完成年初确定的各项目标任务。,其他,0.7507362163010439
137,山东省,泰安市,市委常委会进行两学一做学习教育集体学习研讨,2016-07-07,http://www.taian.gov.cn/art/2016/7/7/art_46736_4063226.html,"根据市委常委参加“两学一做”学习教育有关工作安排,市委常委会7月6日下午进行集体学习,重点学习《中国共产党章程》之总纲及部分内容,《习近平总书记重要讲话文章选编》之《认真学习党章，严格遵守党章》、《严明政治纪律，自觉维护党的团结统一》等文章。。市委书记王云鹏主持会议,市委副书记、代市长李希信，市人大常委会第一副主任、党组书记陈刚及市委常委出席会议。。王云鹏就做好“两学一做”学习教育工作提出要求。他指出，市委动员部署“两学一做”学习教育以来，全市各级党组织和广大党员干部认真贯彻中央和省委、市委工作要求，学习教育总体开局良好、进展有序。下一步，各级要按照市委《工作方案》的部署，强化措施，狠抓落实，推动学习教育深入开展。要坚持领导带头，从市委各常委做起，各级党员领导干部要发挥好示范引领和传导带动作用。要坚持即知即改，将解决问题贯穿学习教育全过程，确保学习教育不走过场、收到实效。要两手抓、两促进，把学习教育同做好改革发展稳定各项工作结合起来，努力把学习教育成果转化为推动发展的强大动力。","根据市委常委参加“两学一做”学习教育有关工作安排,市委常委会7月6日下午进行集体学习,重点学习《中国共产党章程》之总纲及部分内容,《习近平总书记重要讲话文章选编》之《认真学习党章，严格遵守党章》、《严明政治纪律，自觉维护党的团结统一》等文章。。市委书记王云鹏主持会议,市委副书记、代市长李希信，市人大常委会第一副主任、党组书记陈刚及市委常委出席会议。。王云鹏就做好“两学一做”学习教育工作提出要求。他指出，市委动员部署“两学一做”学习教育以来，全市各级党组织和广大党员干部认真贯彻中央和省委、市委工作要求，学习教育总体开局良好、进展有序。下一步，各级要按照市委《工作方案》的部署，强化措施，狠抓落实，推动学习教育深入开展。要坚持领导带头，从市委各常委做起，各级党员领导干部要发挥好示范引领和传导带动作用。要坚持即知即改，将解决问题贯穿学习教育全过程，确保学习教育不走过场、收到实效。要两手抓、两促进，把学习教育同做好改革发展稳定各项工作结合起来，努力把学习教育成果转化为推动发展的强大动力。",其他,0.6841335362369064
137,山东省,泰安市,市人大常委会党组理论学习中心组进行集体学习,2019-04-01,http://www.taian.gov.cn/art/2019/4/1/art_46736_5155435.html,3月29日下午，市人大常委会党组理论学习中心组进行集体学习。市人大常委会副主任张书盈主持会议并讲话，副主任陶长江，秘书长李起峰参加学习。。会议采取逐人领学、集体学习的方式，重点学习了习近平总书记在省部级主要领导干部坚持底线思维着力防范化解重大风险专题研讨班上的重要讲话精神、《中共中央关于加强党的政治建设的意见》和《保密违法违纪行为处分建议办法》。。张书盈要求，市人大常委会及机关全体党员干部要深刻领会、贯彻落实好习近平总书记重要讲话精神和《中共中央关于加强党的政治建设的意见》要求，强化人大常委会机关“首先是政治机关”的意识，在工作生活中时刻对标查摆，整改短板弱项，不断提高自身综合素质，在推动市人大机关全面加强党的政治建设中取得实效。要提高保密意识和法律意识，落实和强化保密责任，按照《保密违法违纪处分建议办法》开展保密工作，确保机关保密工作有序开展。,3月29日下午，市人大常委会党组理论学习中心组进行集体学习。市人大常委会副主任张书盈主持会议并讲话，副主任陶长江，秘书长李起峰参加学习。。会议采取逐人领学、集体学习的方式，重点学习了习近平总书记在省部级主要领导干部坚持底线思维着力防范化解重大风险专题研讨班上的重要讲话精神、《中共中央关于加强党的政治建设的意见》和《保密违法违纪行为处分建议办法》。。张书盈要求，市人大常委会及机关全体党员干部要深刻领会、贯彻落实好习近平总书记重要讲话精神和《中共中央关于加强党的政治建设的意见》要求，强化人大常委会机关“首先是政治机关”的意识，在工作生活中时刻对标查摆，整改短板弱项，不断提高自身综合素质，在推动市人大机关全面加强党的政治建设中取得实效。要提高保密意识和法律意识，落实和强化保密责任，按照《保密违法违纪处分建议办法》开展保密工作，确保机关保密工作有序开展。,其他,0.7299652738467954
137,山东省,泰安市,市人大常委会党组理论学习中心组开展集体学习,2018-12-18,http://www.taian.gov.cn/art/2018/12/18/art_46736_4781645.html,12月17日，市人大常委会党组理论学习中心组开展集体学习。市人大常委会主任唐福泉主持会议并讲话，副主任张书盈、陶长江、曹步山，秘书长李起峰参加学习。。会议采取逐人领读的方式学习了《长期坚持、不断完善人民代表大会制度——改革开放40年坚持和完善人民代表大会制度的成就和经验》和《关于扎实开展“埋头苦干、争创一流，勇做新时代泰山‘挑山工’”主题实践活动的实施方案》。。唐福泉指出，今年工作接近尾声，市人大常委会及机关要按照中央和省、市委重大决策部署，在创新发展、科学谋划、做实做细上下功夫，做好今年工作总结和明年工作安排。要围绕全市工作中心，强化人大监督“法律巡视”责任，增强监督实效，搞好立法、代表、人事任免等重要工作。要高度重视政治理论和业务学习，规范学习制度机制，做到学习有计划、有记录、有总结。要认真制定常委会机关主题实践活动实施方案，确保活动取得成效，在人大机关掀起勇做新时代泰山“挑山工”的热潮，形成埋头苦干、争创一流的良好工作氛围。,12月17日，市人大常委会党组理论学习中心组开展集体学习。市人大常委会主任唐福泉主持会议并讲话，副主任张书盈、陶长江、曹步山，秘书长李起峰参加学习。。会议采取逐人领读的方式学习了《长期坚持、不断完善人民代表大会制度——改革开放40年坚持和完善人民代表大会制度的成就和经验》和《关于扎实开展“埋头苦干、争创一流，勇做新时代泰山‘挑山工’”主题实践活动的实施方案》。。唐福泉指出，今年工作接近尾声，市人大常委会及机关要按照中央和省、市委重大决策部署，在创新发展、科学谋划、做实做细上下功夫，做好今年工作总结和明年工作安排。要围绕全市工作中心，强化人大监督“法律巡视”责任，增强监督实效，搞好立法、代表、人事任免等重要工作。要高度重视政治理论和业务学习，规范学习制度机制，做到学习有计划、有记录、有总结。要认真制定常委会机关主题实践活动实施方案，确保活动取得成效，在人大机关掀起勇做新时代泰山“挑山工”的热潮，形成埋头苦干、争创一流的良好工作氛围。,其他,0.7273786403980496
