code,province,city,topic,date,url,content,content,label,score
44,山东省,盘锦市,盘锦乌鲁木齐共话综合素质评价深化教育改革谱新篇,2019-05-13,https://jyj.panjin.gov.cn/2019_05/13_08/content-65050.html,5月9日，乌鲁木齐市教育局副局长张德宏带领市教育研究中心和市教育信息服务中心负责人、学校领导及骨干教师一行7人，对盘锦市初中学生综合素质评价工作进行考察学习。盘锦市教育局局长宋全明，盘锦市教育事业发展服务中心主任刘玉军等领导陪同考察。。宋全明指出，盘锦市做为辽宁省中考改革唯一的试点城市，综合素质评价是其重要内容之一。综合素质评价是培育学生良好品行、发展个性特长、促进学生全面发展的重要手段，是深入推进素质教育的一项重要教育方法。2018年5月至今，盘锦市通过统一建设综合素质评价信息化平台，全市61所初级中学在日常工作中应用平台，初步形成了科学、可持续发展的综合素质评价工作体系。该评价体系已经充分融入到各所学校的实际办学工作中，在提升学校管理质量、培养学生良好的行为习惯、提升教师应用信息化教学能力、引导学生家长的家庭教育等方面均起到了显著的促进作用。在全市综合素质评价工作开展稳定和成熟之后，盘锦市会将学生初中阶段综合素质评价成果与中考成绩相结合，共同用于全市高中招生录取工作，改变 “唯分数论”的教育评价现状，达成深化考试招生制度改革的工作目标。。他强调综合素质评价是一项需要长远规划和长期推进的工作，并从四个方面介绍了我市综合素质评价工作经验：一、综合素质评价工作要符合国家教育改革的工作要求，遵守全面发展的素质教育原则，更要与本市的教育实际相融合凸显本地教育特色，更好的根植于一方教育土壤，能够更长久更高效地为本地教育服务，实现办人民群众满意教育的根本目标。二、强调综合素质评价工作需要建设一个完善并且能够与当地教育发展和教育需求同步，能够持续优化的信息化平台，同时平台功能设计要符合教育原理并且操作方法便捷、简单、易习得，便于教师、学生、家长的日常使用。三、市教育局在全市范围内做好工作规划和部署，指导各校建立本校的综合素质评价工作组织构架，组织全市范围校长、学校平台管理员、普通教师、学生、家长的各层用户的使用培训，帮助各个评价角色掌握平台操作技能。四、要有专业、持续的学校服务体系，派遣专业人员对各所学校实际工作进行持续指导和培训，帮助各所学校将综合素质评价工作融入办学和教学实际，形成综合素质评价校园文化氛围，进而带动全体师生和学生家长形成综合素质评价工作习惯。交流现场盘锦市教育局基础教育科综合素质评价工作负责人刘孝谭向来访人员详细介绍了盘锦市综合素质评价工作规划、平台建设、服务体系和学校实践等实际工作内容，并现场解答了来访人员具体工作问题。。张德宏副局长介绍了新疆乌鲁木齐教育的基本情况，双方围绕如何深入推进高中招生制度改革、如何建设综合素质评价信息化平台、如何形成具有本地教育特色的综合素质评价工作体系进行了深入、热烈的讨论和交流。宋全明局长认真听取了张德宏副局长对于新疆乌鲁木齐相关工作的介绍，充分肯定了新疆乌鲁木齐的教育改革成效，希望盘锦与乌鲁木齐市双向学习，不断加强交流。。交流会后，刘玉军陪同考察组一行，深入到盘锦市魏书生中学、双台子区第三初级中学以市、区、校三级汇报形式展开进一步的考察和交流。盘锦市魏书生中学吴献新校长、双台子区第三初级中学宝海民校长都深入介绍了本校综合素质评价工作实践经验并展示了所取得的阶段性成果，这两所学校的案例给考察人员留下了深刻的印象。,5月9日，乌鲁木齐市教育局副局长张德宏带领市教育研究中心和市教育信息服务中心负责人、学校领导及骨干教师一行7人，对盘锦市初中学生综合素质评价工作进行考察学习。盘锦市教育局局长宋全明，盘锦市教育事业发展服务中心主任刘玉军等领导陪同考察。。宋全明指出，盘锦市做为辽宁省中考改革唯一的试点城市，综合素质评价是其重要内容之一。综合素质评价是培育学生良好品行、发展个性特长、促进学生全面发展的重要手段，是深入推进素质教育的一项重要教育方法。2018年5月至今，盘锦市通过统一建设综合素质评价信息化平台，全市61所初级中学在日常工作中应用平台，初步形成了科学、可持续发展的综合素质评价工作体系。该评价体系已经充分融入到各所学校的实际办学工作中，在提升学校管理质量、培养学生良好的行为习惯、提升教师应用信息化教学能力、引导学生家长的家庭教育等方面均起到了显著的促进作用。在全市综合素质评价工作开展稳定和成熟之后，盘锦市会将学生初中阶段综合素质评价成果与中考成绩相结合，共同用于全市高中招生录取工作，改变 “唯分数论”的教育评价现状，达成深化考试招生制度改革的工作目标。。他强调综合素质评价是一项需要长远规划和长期推进的工作，并从四个方面介绍了我市综合素质评价工作经验：一、综合素质评价工作要符合国家教育改革的工作要求，遵守全面发展的素质教育原则，更要与本市的教育实际相融合凸显本地教育特色，更好的根植于一方教育土壤，能够更长久更高效地为本地教育服务，实现办人民群众满意教育的根本目标。二、强调综合素质评价工作需要建设一个完善并且能够与当地教育发展和教育需求同步，能够持续优化的信息化平台，同时平台功能设计要符合教育原理并且操作方法便捷、简单、易习得，便于教师、学生、家长的日常使用。三、市教育局在全市范围内做好工作规划和部署，指导各校建立本校的综合素质评价工作组织构架，组织全市范围校长、学校平台管理员、普通教师、学生、家长的各层用户的使用培训，帮助各个评价角色掌握平台操作技能。四、要有专业、持续的学校服务体系，派遣专业人员对各所学校实际工作进行持续指导和培训，帮助各所学校将综合素质评价工作融入办学和教学实际，形成综合素质评价校园文化氛围，进而带动全体师生和学生家长形成综合素质评价工作习惯。交流现场盘锦市教育局基础教育科综合素质评价工作负责人刘孝谭向来访人员详细介绍了盘锦市综合素质评价工作规划、平台建设、服务体系和学校实践等实际工作内容，并现场解答了来访人员具体工作问题。。张德宏副局长介绍了新疆乌鲁木齐教育的基本情况，双方围绕如何深入推进高中招生制度改革、如何建设综合素质评价信息化平台、如何形成具有本地教育特色的综合素质评价工作体系进行了深入、热烈的讨论和交流。宋全明局长认真听取了张德宏副局长对于新疆乌鲁木齐相关工作的介绍，充分肯定了新疆乌鲁木齐的教育改革成效，希望盘锦与乌鲁木齐市双向学习，不断加强交流。。交流会后，刘玉军陪同考察组一行，深入到盘锦市魏书生中学、双台子区第三初级中学以市、区、校三级汇报形式展开进一步的考察和交流。盘锦市魏书生中学吴献新校长、双台子区第三初级中学宝海民校长都深入介绍了本校综合素质评价工作实践经验并展示了所取得的阶段性成果，这两所学校的案例给考察人员留下了深刻的印象。,其他,0.5908371749051605
44,山东省,盘锦市,葫芦岛市卫健委来双台子区考察学习健康促进区创建工作,2019-04-11,http://www.pjgjj.com/2019_04/11_14/content-202827.html,葫芦岛市卫健委来双台子区考察学习健康促进区创建工作_动态要闻_盘锦市住房公积金管理中心。通过观看创建健康促进区相关宣传片，现场观摩双台子区社会福利院、双河社区、生态岛等健康场所，实地翻阅创建资料，并就相关问题进行互动交流，葫芦岛市卫健委考察组表示，双台子区创建健康促进区工作的谋篇布局、统筹引领、政策聚合、资源整合、社会融合等方面的举措以及健康促进医院、健康促进机关、健康促进企业、健康社区（村）、健康家庭评选和健康支持性环境等方面打造的先进经验和典型做法，为葫芦岛市提供了可复制、可借鉴的经验。,葫芦岛市卫健委来双台子区考察学习健康促进区创建工作_动态要闻_盘锦市住房公积金管理中心。通过观看创建健康促进区相关宣传片，现场观摩双台子区社会福利院、双河社区、生态岛等健康场所，实地翻阅创建资料，并就相关问题进行互动交流，葫芦岛市卫健委考察组表示，双台子区创建健康促进区工作的谋篇布局、统筹引领、政策聚合、资源整合、社会融合等方面的举措以及健康促进医院、健康促进机关、健康促进企业、健康社区（村）、健康家庭评选和健康支持性环境等方面打造的先进经验和典型做法，为葫芦岛市提供了可复制、可借鉴的经验。,其他,0.5451432785872011
44,山东省,盘锦市,营口市生态环境局来我市考察学习农村小型污水处理设施建设相关工作,2019-07-08,https://sthjj.panjin.gov.cn/2019_07/08_15/content-225385.html,营口市生态环境局来我市考察学习农村小型污水处理设施建设相关工作_农村环保_盘锦市生态环境局。为切实做好农村生活污水处理工作，全面改善提升农村生态环境质量，打造宜居生产生活环境，7月6日，营口市环境保护局、营口市财政局、盖州市副市长田东宝、盖州市生态环境分局、鲅鱼圈区生态环境分局相关领导及工作人员、各乡镇村主要负责人一行20人先后来到我市大洼区榆树街道曾家村、田庄台镇新村考察学习农村小型污水处理设施建设和运行情况。市生态环境局局长李勇、副局长李可伟、大洼区环保局局长何玉中、市生态环境局农业科科长刘勇进一道陪同。市生态环境局工作人员向考察组介绍了我市农村小型污水处理设施建设运营情况、工作原理、技术模式、建设内容及项目建设工作经验。。通过考察学习，营口市考察组的各位领导和工作人员均对我市农村小型污水处理设施工作给予了充分肯定，表示感受颇深，盘锦市的小型污水处理设施建设工作将为营口市农村生活收集处理工作提供良好的借鉴，对下一步开展农村污水处理设施建设工作的开展扩宽思路、积累经验，具有重要的现实意义。,营口市生态环境局来我市考察学习农村小型污水处理设施建设相关工作_农村环保_盘锦市生态环境局。为切实做好农村生活污水处理工作，全面改善提升农村生态环境质量，打造宜居生产生活环境，7月6日，营口市环境保护局、营口市财政局、盖州市副市长田东宝、盖州市生态环境分局、鲅鱼圈区生态环境分局相关领导及工作人员、各乡镇村主要负责人一行20人先后来到我市大洼区榆树街道曾家村、田庄台镇新村考察学习农村小型污水处理设施建设和运行情况。市生态环境局局长李勇、副局长李可伟、大洼区环保局局长何玉中、市生态环境局农业科科长刘勇进一道陪同。市生态环境局工作人员向考察组介绍了我市农村小型污水处理设施建设运营情况、工作原理、技术模式、建设内容及项目建设工作经验。。通过考察学习，营口市考察组的各位领导和工作人员均对我市农村小型污水处理设施工作给予了充分肯定，表示感受颇深，盘锦市的小型污水处理设施建设工作将为营口市农村生活收集处理工作提供良好的借鉴，对下一步开展农村污水处理设施建设工作的开展扩宽思路、积累经验，具有重要的现实意义。,政府领导到其他城市考察学习或访问,0.0
44,山东省,盘锦市,葫芦岛市卫健委来到盘锦市双台子区考察学习健康促进区创建工作,2019-04-11,https://wjw.panjin.gov.cn/2019_04/11_10/content-52801.html,葫芦岛市卫健委来到盘锦市双台子区考察学习健康促进区创建工作_动态要闻_盘锦市卫生健康委员会。通过观看创建健康促进区相关宣传片，现场观摩双台子区社会福利院、双河社区、生态岛等健康场所，实地翻阅创建资料，并就相关问题进行互动交流，葫芦岛市卫健委考察组表示，双台子区创建健康促进区工作的谋篇布局、统筹引领、政策聚合、资源整合、社会融合等方面的举措以及健康促进医院、健康促进机关、健康促进企业、健康社区（村）、健康家庭评选和健康支持性环境等方面打造的先进经验和典型做法，为葫芦岛市提供了可复制、可借鉴的经验。,葫芦岛市卫健委来到盘锦市双台子区考察学习健康促进区创建工作_动态要闻_盘锦市卫生健康委员会。通过观看创建健康促进区相关宣传片，现场观摩双台子区社会福利院、双河社区、生态岛等健康场所，实地翻阅创建资料，并就相关问题进行互动交流，葫芦岛市卫健委考察组表示，双台子区创建健康促进区工作的谋篇布局、统筹引领、政策聚合、资源整合、社会融合等方面的举措以及健康促进医院、健康促进机关、健康促进企业、健康社区（村）、健康家庭评选和健康支持性环境等方面打造的先进经验和典型做法，为葫芦岛市提供了可复制、可借鉴的经验。,其他,0.5529519584876949
44,山东省,盘锦市,借鉴浙江成功经验推进盘锦全域旅游,2019-04-23,https://wlgdj.panjin.gov.cn/2019_04/23_10/content-192839.html,5月23—27日，省旅发委主要领导率领部分市旅发委负责人赴浙江省杭州、丽水和绍兴三市进行学习考察。我们通过与三地旅游主管部门和相关行业企业代表深入交流，对杭州西溪湿地、法云安曼民宿、开元旅游集团、大连海昌杭州项目和丽水古堰画乡小镇、绍兴酷玩小镇及巧克力小镇等有代表性的核心旅游产品进行了实地察看，深刻感受到了三座城市不断促进区域旅游投资和消费，加快旅游产业转型升级，旅游业呈现出独特吸引力、综合竞争力和国际影响力，经过多年实践形成了一系列切实有效、系统成熟的统筹旅游发展的思路套路和道路。他们的经验和做法为我们提供了有益的借鉴。。（一）牢牢把握各自特色优势，从总体规划布局入手，以国际化视野明确目标定位，是三地统筹推进全域旅游发展关键前提。杭州早在2001年，就已出台《城市总体规划（2001——2020年）》，明确了“现代化国际化风景旅游城市”定位，实施“旅游西进”战略和旅游国际化战略，并将其作为全市经济社会发展五大战略之一。自此，杭州市从西湖的“一枝独秀”，发展为“三江五湖一山一河一溪三址”的全面开发开放，拉开了城市大旅游发展框架。十二五末期，《杭州市十大产业发展总体规划》进一步明确了旅游“战略性支柱产业”“现代服务业龙头产业”地位。丽水2007年编制《丽水市旅游发展规划（2008—2020）》，提出进一步把旅游业作为支柱产业来培育，2011年提出用十年左右时间把旅游业打造成第一产业；2013年把旅游业定位为“第一支柱产业”。当前，丽水市以浙江省首个旅游综合改革试验区为契机，把生态旅游业打造成为全市第一战略性支柱产业，进而使其成为丽水经济社会发展的第一推动力。绍兴2007年完成《绍兴市旅游发展总体规划》的修编工作，提出“把绍兴建设成为国际性文化与商务旅游目的地、中国最具文化特色的旅游目的地和浙江旅游核心动力圈的副中心城市”的目标。。（二）充分发挥政府引导优势，加大政策供给力度，立足差异化明晰发展思路，是三地统筹推进全域旅游发展的中心任务。杭州将旅游意识、旅游产业、旅游品牌、旅游开发建设和旅游管理巧妙地融入到城市建设以及文化传承和发展中，将景点和城市空间融合，以城市综合体带动，加速文化和城市商业的融合，最终形成了独具特色的城市、文化、旅游一体化的旅游发展模式。首先是2002年“免费西湖”的旅游创新政策，每年免了门票5000万元，催生杭州市旅游总收入1200亿元，翻了两番，开始了从“观光城市”到“休闲城市”的产业升级；紧接着抓住城市水系，做好水文章，构建了整个城市的休闲旅游骨架；再到如今打造“旅游综合体”，发展城市的核心圈层结构，整体形成了多核心的集商务、观光休闲、生活宜居的国际化大都市。短短的10年间，杭州旅游发展经历了三次提档升级，实现了质的飞跃。丽水大力推进旅游发展全域化综合改革，按照生态旅游全域化、旅游服务全程化、休闲旅游智慧化、乡村环境景观化、城乡生活品质化的“五化”发展思路，围绕观念革新、体制改革、功能分区、项目建设、要素保障、产业融合、品牌打造、基础配套、部门联动、队伍建设10个方面重点突破，积极通过旅游项目之间的串联、整合，改变低、小、散局面，全力打造城市中的5A景区、5A景区中的城市。绍兴先后提出“建设经济强市、文化名市、旅游大市”“江南古城看绍兴、江南风情看绍兴、江南文化看绍兴”等理念，强调要像抓工业经济一样抓旅游发展，像支持工业项目一样支持旅游项目，以千年古城、文化名城、江南水城作为旅游发展的品牌，其旅游规划、开发建设和市场营销均紧紧围绕这三个中心来实施。。随着我国经济社会发展进入新常态，全域旅游已经成为国民经济战略性支柱产业，是经济社会发展的,5月23—27日，省旅发委主要领导率领部分市旅发委负责人赴浙江省杭州、丽水和绍兴三市进行学习考察。我们通过与三地旅游主管部门和相关行业企业代表深入交流，对杭州西溪湿地、法云安曼民宿、开元旅游集团、大连海昌杭州项目和丽水古堰画乡小镇、绍兴酷玩小镇及巧克力小镇等有代表性的核心旅游产品进行了实地察看，深刻感受到了三座城市不断促进区域旅游投资和消费，加快旅游产业转型升级，旅游业呈现出独特吸引力、综合竞争力和国际影响力，经过多年实践形成了一系列切实有效、系统成熟的统筹旅游发展的思路套路和道路。他们的经验和做法为我们提供了有益的借鉴。。（一）牢牢把握各自特色优势，从总体规划布局入手，以国际化视野明确目标定位，是三地统筹推进全域旅游发展关键前提。杭州早在2001年，就已出台《城市总体规划（2001——2020年）》，明确了“现代化国际化风景旅游城市”定位，实施“旅游西进”战略和旅游国际化战略，并将其作为全市经济社会发展五大战略之一。自此，杭州市从西湖的“一枝独秀”，发展为“三江五湖一山一河一溪三址”的全面开发开放，拉开了城市大旅游发展框架。十二五末期，《杭州市十大产业发展总体规划》进一步明确了旅游“战略性支柱产业”“现代服务业龙头产业”地位。丽水2007年编制《丽水市旅游发展规划（2008—2020）》，提出进一步把旅游业作为支柱产业来培育，2011年提出用十年左右时间把旅游业打造成第一产业；2013年把旅游业定位为“第一支柱产业”。当前，丽水市以浙江省首个旅游综合改革试验区为契机，把生态旅游业打造成为全市第一战略性支柱产业，进而使其成为丽水经济社会发展的第一推动力。绍兴2007年完成《绍兴市旅游发展总体规划》的修编工作，提出“把绍兴建设成为国际性文化与商务旅游目的地、中国最具文化特色的旅游目的地和浙江旅游核心动力圈的副中心城市”的目标。。（二）充分发挥政府引导优势，加大政策供给力度，立足差异化明晰发展思路，是三地统筹推进全域旅游发展的中心任务。杭州将旅游意识、旅游产业、旅游品牌、旅游开发建设和旅游管理巧妙地融入到城市建设以及文化传承和发展中，将景点和城市空间融合，以城市综合体带动，加速文化和城市商业的融合，最终形成了独具特色的城市、文化、旅游一体化的旅游发展模式。首先是2002年“免费西湖”的旅游创新政策，每年免了门票5000万元，催生杭州市旅游总收入1200亿元，翻了两番，开始了从“观光城市”到“休闲城市”的产业升级；紧接着抓住城市水系，做好水文章，构建了整个城市的休闲旅游骨架；再到如今打造“旅游综合体”，发展城市的核心圈层结构，整体形成了多核心的集商务、观光休闲、生活宜居的国际化大都市。短短的10年间，杭州旅游发展经历了三次提档升级，实现了质的飞跃。丽水大力推进旅游发展全域化综合改革，按照生态旅游全域化、旅游服务全程化、休闲旅游智慧化、乡村环境景观化、城乡生活品质化的“五化”发展思路，围绕观念革新、体制改革、功能分区、项目建设、要素保障、产业融合、品牌打造、基础配套、部门联动、队伍建设10个方面重点突破，积极通过旅游项目之间的串联、整合，改变低、小、散局面，全力打造城市中的5A景区、5A景区中的城市。绍兴先后提出“建设经济强市、文化名市、旅游大市”“江南古城看绍兴、江南风情看绍兴、江南文化看绍兴”等理念，强调要像抓工业经济一样抓旅游发展，像支持工业项目一样支持旅游项目，以千年古城、文化名城、江南水城作为旅游发展的品牌，其旅游规划、开发建设和市场营销均紧紧围绕这三个中心来实施。。随着我国经济社会发展进入新常态，全域旅游已经成为国民经济战略性支柱产业，是经济社会发展的,政府领导到其他城市考察学习或访问,0.529152979445576
