code,province,city,topic,date,url,content,content,label,score
44,山东省,盘锦市,四川省绵阳市机关事务管理局一行来盘考察学习,2023-04-19,http://pjsjgswglj.com.cn/2023_04/19_17/content-409438.html,四川省绵阳市机关事务管理局一行来盘考察学习_盘锦市首批党员干部教学实训基地_盘锦市机关事务管理局。实现了全面质量管理，提升了机关事务治理效能，真正为全国机关事务系统树立了新的里程碑。。中心将以此次考察为新的契机，不断探索机关事务改革发展新路径，永无止境追求卓越，为推进机关事务治理体系和治理能力现代化贡献力量。,四川省绵阳市机关事务管理局一行来盘考察学习_盘锦市首批党员干部教学实训基地_盘锦市机关事务管理局。实现了全面质量管理，提升了机关事务治理效能，真正为全国机关事务系统树立了新的里程碑。。中心将以此次考察为新的契机，不断探索机关事务改革发展新路径，永无止境追求卓越，为推进机关事务治理体系和治理能力现代化贡献力量。,政府领导到其他城市考察学习或访问,0.0
44,山东省,盘锦市,青海省机关事务管理局市场监管局省委党校一行来盘考察,2023-05-09,http://pjsjgswglj.com.cn/2023_05/09_16/content-411202.html,青海省机关事务管理局、市场监管局、省委党校一行来盘考察_全国首个省级政府系统卓越质量管理推广基地_盘锦市机关事务管理局。青海省省直机关事务管理局节能管理处副处长多杰卓玛，青海省委党校改革发展研究所博士、硕士研究生导师王孔容，青海省市场监督管理局办公室副主任陈建峰一行，。来到全国首个机关事务标准化实训基地、全国首个省级标准化质量管理实训基地，考察学习机关事务标准化体系及标准化质量管理体系建设的先进经验，对简单可共享。1号食堂、行政中心A楼、政通集团、机关事务智慧管理平台等处进行实地考察学习，参观了盘锦市机关事务发展历程展馆，观看了《标准之路 质量花开》宣传片。。“盘锦经验、盘锦模式”有了更深入的了解，真切感受到盘锦市以标准化为基础，深入推进体系化、数字化、品牌化建设，通过成功申报中国质量奖提名奖，实现了全面质量管理，提升了机关事务治理效能，真正为全国机关事务系统高质量发展提供了实践样板。。盘锦市机关事务中心将继续秉持创新、协调、绿色、开放、共享的理念，持续发挥两个体系、三个模式、四个国家级试点及五大基地的优势效能，为推进机关事务治理体系和治理能力现代化贡献力量。,青海省机关事务管理局、市场监管局、省委党校一行来盘考察_全国首个省级政府系统卓越质量管理推广基地_盘锦市机关事务管理局。青海省省直机关事务管理局节能管理处副处长多杰卓玛，青海省委党校改革发展研究所博士、硕士研究生导师王孔容，青海省市场监督管理局办公室副主任陈建峰一行，。来到全国首个机关事务标准化实训基地、全国首个省级标准化质量管理实训基地，考察学习机关事务标准化体系及标准化质量管理体系建设的先进经验，对简单可共享。1号食堂、行政中心A楼、政通集团、机关事务智慧管理平台等处进行实地考察学习，参观了盘锦市机关事务发展历程展馆，观看了《标准之路 质量花开》宣传片。。“盘锦经验、盘锦模式”有了更深入的了解，真切感受到盘锦市以标准化为基础，深入推进体系化、数字化、品牌化建设，通过成功申报中国质量奖提名奖，实现了全面质量管理，提升了机关事务治理效能，真正为全国机关事务系统高质量发展提供了实践样板。。盘锦市机关事务中心将继续秉持创新、协调、绿色、开放、共享的理念，持续发挥两个体系、三个模式、四个国家级试点及五大基地的优势效能，为推进机关事务治理体系和治理能力现代化贡献力量。,政府领导到其他城市考察学习或访问,0.0
44,山东省,盘锦市,浙江省温州市机关事务管理局一行再次来盘考察学习,2023-04-12,http://pjsjgswglj.com.cn/2023_04/12_15/content-409555.html,人，来到全国首个机关事务标准化实训基地、全国首个省级标准化质量管理实训基地，考察学习全国首部机关事务标准化体系和全国首部机关事务标准化质量管理体系建设的先进经验，对简单可共享。1号食堂、行政中心A楼、政通物业集团、智慧平台等处进行现场考察学习，参观了盘锦市机关事务发展历程展馆，观看了《标准之路 质量花开》宣传片。。中国质量奖提名奖，实现了全面质量管理，提升了机关事务治理效能，真正为全国机关事务系统树立了。中心将以此次考察为新的契机，不断探索机关事务改革发展新路径，永无止境追求卓越，为推进机关事务治理体系和治理能力现代化贡献力量。,人，来到全国首个机关事务标准化实训基地、全国首个省级标准化质量管理实训基地，考察学习全国首部机关事务标准化体系和全国首部机关事务标准化质量管理体系建设的先进经验，对简单可共享。1号食堂、行政中心A楼、政通物业集团、智慧平台等处进行现场考察学习，参观了盘锦市机关事务发展历程展馆，观看了《标准之路 质量花开》宣传片。。中国质量奖提名奖，实现了全面质量管理，提升了机关事务治理效能，真正为全国机关事务系统树立了。中心将以此次考察为新的契机，不断探索机关事务改革发展新路径，永无止境追求卓越，为推进机关事务治理体系和治理能力现代化贡献力量。,其他,0.5756634937542912
44,山东省,盘锦市,沈阳市沈北新区机关事务保障中心来盘考察学习,2023-04-06,http://pjsjgswglj.com.cn/2023_04/06_16/content-408057.html,1号食堂、行政中心A楼、政通物业管理集团、智慧平台等处进行现场考察，参观了盘锦市机关事务发展历程展馆，观看了《标准文化》宣传片，全面系统了解了我市机关事务标准化体系和标准化质量管理体系建设历程和建设成效。,1号食堂、行政中心A楼、政通物业管理集团、智慧平台等处进行现场考察，参观了盘锦市机关事务发展历程展馆，观看了《标准文化》宣传片，全面系统了解了我市机关事务标准化体系和标准化质量管理体系建设历程和建设成效。,其他,0.5703232306098135
44,山东省,盘锦市,温州市机关事务管理局一行来盘考察,2023-03-09,http://pjsjgswglj.com.cn/2023_03/09_17/content-404854.html,，参观了盘锦市机关事务发展历程展馆，观看了《标准文化》宣传片，全面系统了解了我市机关事务标准化体系和标准化质量管理体系建设历程和建设成效。。“两个体系”，承接了中国社科院“两个课题”，形成了“三个模式”，建成了全国首个机关事务标准化培训实践基地等“四个基地”，。1.0标准化体系到4.0标准化质量管理体系的新跨越。首创赋能型标准化人才体系，内部培养、聘任首席质量官、首席标准官20人，培养标准化讲师200人，课程体系完备、培训经验丰富。。成熟的试点、基地建设经验，在标准化质量管理方面优势显著，始终处于行业引领地位。同时探索出了标准化质量管理向企业、高职院校、政府系统赋能的新模式。。一行对“盘锦模式”有了更加深入的了解，充分肯定了我中心首创的“9123”标准化质量管理模式，在标准化建设和标准化质量管理方面确实走在了全国同行业的前列，为机关事务领域开创了新的里程碑。。为全国提供可复制、可推广、可共享的标准化质量管理新模式，为推动机关事务治理体系和治理能力现代化贡献盘锦力量。,，参观了盘锦市机关事务发展历程展馆，观看了《标准文化》宣传片，全面系统了解了我市机关事务标准化体系和标准化质量管理体系建设历程和建设成效。。“两个体系”，承接了中国社科院“两个课题”，形成了“三个模式”，建成了全国首个机关事务标准化培训实践基地等“四个基地”，。1.0标准化体系到4.0标准化质量管理体系的新跨越。首创赋能型标准化人才体系，内部培养、聘任首席质量官、首席标准官20人，培养标准化讲师200人，课程体系完备、培训经验丰富。。成熟的试点、基地建设经验，在标准化质量管理方面优势显著，始终处于行业引领地位。同时探索出了标准化质量管理向企业、高职院校、政府系统赋能的新模式。。一行对“盘锦模式”有了更加深入的了解，充分肯定了我中心首创的“9123”标准化质量管理模式，在标准化建设和标准化质量管理方面确实走在了全国同行业的前列，为机关事务领域开创了新的里程碑。。为全国提供可复制、可推广、可共享的标准化质量管理新模式，为推动机关事务治理体系和治理能力现代化贡献盘锦力量。,其他,0.6530686035491334
44,山东省,盘锦市,庄河市机关事务服务中心来我中心考察学习,2022-11-22,http://pjsjgswglj.com.cn/2022_11/22_15/content-392643.html,一行先后来到辽东湾会议中心、机关1号食堂、行政中心A座、智慧平台、政通集团等处进行实地考察学习，参观了盘锦市机关事务发展历程展馆，观看了《标准文化》宣传片，全面系统了解了我市机关事务标准化体系和标准化质量管理体系建设历程和建设成效。。参观考察期间，市委副秘书长、中心党组书记、主任魏旭阳向参观人员详尽介绍了八年多来，我中心是如何运用标准化的思维、理念、方法指导机关事务各项工作，构建了全国首部机关事务标准化体系和标准化质量管理体系，并在持续改进创新的路上永无止境。一行对我中心在标准化和标准化质量管理建设方面超前的工作思路和取得的丰硕成果给予了高度,一行先后来到辽东湾会议中心、机关1号食堂、行政中心A座、智慧平台、政通集团等处进行实地考察学习，参观了盘锦市机关事务发展历程展馆，观看了《标准文化》宣传片，全面系统了解了我市机关事务标准化体系和标准化质量管理体系建设历程和建设成效。。参观考察期间，市委副秘书长、中心党组书记、主任魏旭阳向参观人员详尽介绍了八年多来，我中心是如何运用标准化的思维、理念、方法指导机关事务各项工作，构建了全国首部机关事务标准化体系和标准化质量管理体系，并在持续改进创新的路上永无止境。一行对我中心在标准化和标准化质量管理建设方面超前的工作思路和取得的丰硕成果给予了高度,其他,0.5484385715786476
44,山东省,盘锦市,黑龙江省佳木斯市机关事务中心一行来盘考察学习,2023-03-13,http://pjsjgswglj.com.cn/2023_03/13_16/content-405102.html,一行先后到辽东湾会议中心、机关1号食堂、行政中心A楼、政通物业管理集团等处进行现场考察，参观了盘锦市机关事务发展历程展馆，观看了《标准文化》宣传片，全面系统了解了我市机关事务标准化体系和标准化质量管理体系建设历程和建设成效。。“盘锦模式”有了更加深入的了解，充分肯定了我中心首创的“9123”标准化质量管理模式，在标准化建设和标准化质量管理方面确实走在了全国同行业的前列，为机关事务领域开创了新的里程碑。。“只有高标准 才有高质量”的质量文化价值观，筑牢“标准必须有效，质量必须稳定”的质量管理理念，为全国提供可复制、可推广、可共享的标准化质量管理新模式，为推动机关事务治理体系和治理能力现代化贡献盘锦力量。,一行先后到辽东湾会议中心、机关1号食堂、行政中心A楼、政通物业管理集团等处进行现场考察，参观了盘锦市机关事务发展历程展馆，观看了《标准文化》宣传片，全面系统了解了我市机关事务标准化体系和标准化质量管理体系建设历程和建设成效。。“盘锦模式”有了更加深入的了解，充分肯定了我中心首创的“9123”标准化质量管理模式，在标准化建设和标准化质量管理方面确实走在了全国同行业的前列，为机关事务领域开创了新的里程碑。。“只有高标准 才有高质量”的质量文化价值观，筑牢“标准必须有效，质量必须稳定”的质量管理理念，为全国提供可复制、可推广、可共享的标准化质量管理新模式，为推动机关事务治理体系和治理能力现代化贡献盘锦力量。,其他,0.6121848020414161
44,山东省,盘锦市,辽河石油职业技术学院来我中心就深度合作进行洽谈,2022-06-22,http://pjsjgswglj.com.cn/2022_06/22_16/content-376589.html,6月22日，辽河石油职业技术学院副院长王辉等一行三人来我中心进行学习考察，并就与我中心及政通集团深度合作事宜进行进一步洽谈。。王辉副院长一行先后到来到辽东湾会议中心、盘锦机关事务发展历程展馆、机关1号食堂、政通集团等处进行参观学习。通过参观对我中心在标准化体系建设和标准化质量管理体系建设工作的思路和取得的丰硕成果表示赞叹。。随后，王辉副院长一行与我中心及政通集团代表就未来合作事宜进行了洽谈。通过洽谈，三方就合作战略框架协议达成初步共识。未来我中心将与辽油职院共同建设“飞地共享”教育模式，以建设标准化质量管理产业学院为远景目标，共同研发标准化质量管理方向专业课程，面向各类企事业单位、学员进行标准化质量管理培训赋能，实现在中心、企业、院校三方深度合作方面走出一条既符合实际又可以产出实效的好路径。,6月22日，辽河石油职业技术学院副院长王辉等一行三人来我中心进行学习考察，并就与我中心及政通集团深度合作事宜进行进一步洽谈。。王辉副院长一行先后到来到辽东湾会议中心、盘锦机关事务发展历程展馆、机关1号食堂、政通集团等处进行参观学习。通过参观对我中心在标准化体系建设和标准化质量管理体系建设工作的思路和取得的丰硕成果表示赞叹。。随后，王辉副院长一行与我中心及政通集团代表就未来合作事宜进行了洽谈。通过洽谈，三方就合作战略框架协议达成初步共识。未来我中心将与辽油职院共同建设“飞地共享”教育模式，以建设标准化质量管理产业学院为远景目标，共同研发标准化质量管理方向专业课程，面向各类企事业单位、学员进行标准化质量管理培训赋能，实现在中心、企业、院校三方深度合作方面走出一条既符合实际又可以产出实效的好路径。,其他,0.5368930563104541
44,山东省,盘锦市,省标准化研究院朝阳县营商环境建设局盘锦光合蟹业有限公司来我中心考察学习,2022-07-20,http://pjsjgswglj.com.cn/2022_07/20_10/content-379649.html,省标准化研究院、朝阳县营商环境建设局、盘锦光合蟹业有限公司来我中心考察学习_工作动态_盘锦市机关事务管理局。7月20日，省标准化研究院研究中心主任曲波带领2021年省级标准化试点立项单位——朝阳县营商环境建设局、盘锦光合蟹业有限公司人员来我中心，对标准化试点建设经验进行考察学习。。朝阳县营商环境建设局副局长孙红阁、盘锦光合蟹业有限公司副总经理柴永庆分别带领考察人员先后来到辽东湾会议中心、机关1号食堂等处进行实地考察学习，参观了盘锦市机关事务发展历程展馆，观看了《标准文化》宣传片，全面系统了解了我市机关事务标准化体系和标准化质量管理体系建设历程和建设成效。。参观过程中，市委副秘书长、中心党组书记、主任魏旭阳以《构建标准体系 提升治理效能》为题，为考察人员进行授课赋能。围绕机关事务八年多来的实践经验，深入浅出地讲解了从1G标准化到7G标准化质量管理体系的探索之路，结合实践工作中的经典案例，教授了如何运用标准化的思维、理念、方法指导工作，打造高标准、赢得高质量，实现所在行业领域的治理体系和治理能力现代化。。考察团人员表示，通过此次参观，感受到了国家级标准化试点的实力与魅力，学习和理解了标准化在实际工作中的运用与作用，为进一步在各自领域构建标准体系，提升治理效能，争创省级标准化试点提供了经验范本。。中心也将继续发挥好“三个基地”的培育赋能优势和“四个国家级试点”的示范引领作用，全面推广荣获中国质量奖提名奖的机关事务标准化质量管理模式，放大机关事务标准化品牌效应，为全省标准化建设助力高质量发展贡献盘锦力量。,省标准化研究院、朝阳县营商环境建设局、盘锦光合蟹业有限公司来我中心考察学习_工作动态_盘锦市机关事务管理局。7月20日，省标准化研究院研究中心主任曲波带领2021年省级标准化试点立项单位——朝阳县营商环境建设局、盘锦光合蟹业有限公司人员来我中心，对标准化试点建设经验进行考察学习。。朝阳县营商环境建设局副局长孙红阁、盘锦光合蟹业有限公司副总经理柴永庆分别带领考察人员先后来到辽东湾会议中心、机关1号食堂等处进行实地考察学习，参观了盘锦市机关事务发展历程展馆，观看了《标准文化》宣传片，全面系统了解了我市机关事务标准化体系和标准化质量管理体系建设历程和建设成效。。参观过程中，市委副秘书长、中心党组书记、主任魏旭阳以《构建标准体系 提升治理效能》为题，为考察人员进行授课赋能。围绕机关事务八年多来的实践经验，深入浅出地讲解了从1G标准化到7G标准化质量管理体系的探索之路，结合实践工作中的经典案例，教授了如何运用标准化的思维、理念、方法指导工作，打造高标准、赢得高质量，实现所在行业领域的治理体系和治理能力现代化。。考察团人员表示，通过此次参观，感受到了国家级标准化试点的实力与魅力，学习和理解了标准化在实际工作中的运用与作用，为进一步在各自领域构建标准体系，提升治理效能，争创省级标准化试点提供了经验范本。。中心也将继续发挥好“三个基地”的培育赋能优势和“四个国家级试点”的示范引领作用，全面推广荣获中国质量奖提名奖的机关事务标准化质量管理模式，放大机关事务标准化品牌效应，为全省标准化建设助力高质量发展贡献盘锦力量。,政府领导到其他城市考察学习或访问,0.0
44,山东省,盘锦市,安徽中科美络信息技术有限公司一行来我中心学习考察,2022-03-03,http://pjsjgswglj.com.cn/2022_03/03_16/content-364224.html,3月3日，安徽中科美络信息技术有限公司总经理罗建飞一行四人来我中心，就机关事务标准化信息化建设盘锦经验、盘锦模式进行学习考察。。罗建飞总经理一行先后来到辽东湾会议中心、机关1号食堂、机关事务智慧管理平台等处进行考察，参观了盘锦市机关事务发展历程展馆，全面系统了解了我市机关事务标准化体系和标准化质量管理体系建设历程和建设成效，对盘锦经验和盘锦模式展开了深度调研。。罗建飞总经理一行对市直机关综合事务中心标准化作为全国标准化信息化“两化融合”试点所开展的工作和起到的引领作用给予高度认可，对我中心首创的“两个体系”即机关事务标准化体系和机关事务标准化质量管理体系予以充分的赞扬。中心通过不断的夯实标准，执行标准，切实提升了工作质量，取得的成效是显而易见的。创造总结的标准化信息化“两化融合”盘锦经验、盘锦模式值得在全国推广。。中心将以此次参观考察为契机，继续以践行“盘锦模式”、守护“盘锦模式”、传播“盘锦模式”为己任，不断追求卓越，突破创新，为推动机关事务高质量发展再上新台阶贡献力量。,3月3日，安徽中科美络信息技术有限公司总经理罗建飞一行四人来我中心，就机关事务标准化信息化建设盘锦经验、盘锦模式进行学习考察。。罗建飞总经理一行先后来到辽东湾会议中心、机关1号食堂、机关事务智慧管理平台等处进行考察，参观了盘锦市机关事务发展历程展馆，全面系统了解了我市机关事务标准化体系和标准化质量管理体系建设历程和建设成效，对盘锦经验和盘锦模式展开了深度调研。。罗建飞总经理一行对市直机关综合事务中心标准化作为全国标准化信息化“两化融合”试点所开展的工作和起到的引领作用给予高度认可，对我中心首创的“两个体系”即机关事务标准化体系和机关事务标准化质量管理体系予以充分的赞扬。中心通过不断的夯实标准，执行标准，切实提升了工作质量，取得的成效是显而易见的。创造总结的标准化信息化“两化融合”盘锦经验、盘锦模式值得在全国推广。。中心将以此次参观考察为契机，继续以践行“盘锦模式”、守护“盘锦模式”、传播“盘锦模式”为己任，不断追求卓越，突破创新，为推动机关事务高质量发展再上新台阶贡献力量。,其他,0.5673536610716955
44,山东省,盘锦市,辽勤集团来我中心学习盘锦模式,2022-01-18,http://pjsjgswglj.com.cn/2022_01/18_16/content-359086.html,1月17日，辽宁省辽勤集团八方实业有限公司总经理胡哲一行4人来到盘锦市市直机关综合事务中心，考察学习机关事务标准化质量管理盘锦经验、盘锦模式。。辽勤集团一行人先后来到辽东湾会议中心、机关1号食堂等处进行参观考察，全面系统了解了我市机关事务标准化质量管理体系建设历程和建设成效，学习了通过集约化、体系化、数字化、品牌化融合发展，使得机关事务标准化多角度运行机制和效益不断强化的全过程。参观考察期间，政通集团董事长莫大国详尽介绍了疫情常态化严防严控的标准化措施；讲解了如何运用标准化减少人力、财力、时间投入，延长物品使用寿命，实现降低成本、提高质量的目的。辽勤集团一行人表示通过此次参观考察，对“盘锦模式”有了更深的理解和认识，对标准化2.0的思维、理念、方法给予充分赞誉。。中心也将以此次外来学习考察为契机，继续深入贯彻新发展理念，注重标准化实践，充分发挥事务支撑政务的职能作用，以“构建标准体系，提升机关事务治理效能”质量管理“盘锦模式”助力机关事务工作高质量发展，为全国机关事务标准化工作作出应有贡献。,1月17日，辽宁省辽勤集团八方实业有限公司总经理胡哲一行4人来到盘锦市市直机关综合事务中心，考察学习机关事务标准化质量管理盘锦经验、盘锦模式。。辽勤集团一行人先后来到辽东湾会议中心、机关1号食堂等处进行参观考察，全面系统了解了我市机关事务标准化质量管理体系建设历程和建设成效，学习了通过集约化、体系化、数字化、品牌化融合发展，使得机关事务标准化多角度运行机制和效益不断强化的全过程。参观考察期间，政通集团董事长莫大国详尽介绍了疫情常态化严防严控的标准化措施；讲解了如何运用标准化减少人力、财力、时间投入，延长物品使用寿命，实现降低成本、提高质量的目的。辽勤集团一行人表示通过此次参观考察，对“盘锦模式”有了更深的理解和认识，对标准化2.0的思维、理念、方法给予充分赞誉。。中心也将以此次外来学习考察为契机，继续深入贯彻新发展理念，注重标准化实践，充分发挥事务支撑政务的职能作用，以“构建标准体系，提升机关事务治理效能”质量管理“盘锦模式”助力机关事务工作高质量发展，为全国机关事务标准化工作作出应有贡献。,政府领导到其他城市考察学习或访问,0.0
