code,province,city,topic,date,url,content,content.1,label,score,is_match
148,河南省,平顶山市,鹰城要闻对标先进找差距真抓实干谋发展奋勇争先开新局我市党政代表团赴洛阳市学习考察,2023-05-24,https://www.pds.gov.cn/contents/4/154137.html,5月22日至23日，平顶山市党政代表团赴洛阳市，带着“等不起”的紧迫感、“慢不得”的危机感、“坐不住”的责任感，深入学习考察城市规划建设管理、产业转型、项目建设、科技创新、文旅文创和城乡融合发展等方面的先进理念、经验做法，以更宽视野、更大力度、更实举措奋力开创我市经济社会高质量发展新局面。。省委常委、洛阳市委书记江凌，平顶山市委书记陈向平、市长李明俊，洛阳市市长徐衣显参加活动。。“我们这次学习考察的主要目的，就是要进一步解放思想、更新观念、开拓创新，对标先进找差距，真抓实干谋发展，奋勇争先开新局。”陈向平掷地有声。。这是一次开阔视野的学习之行，也是一次对照先进的醒脑之行，更是一次拉高标杆的奋进之行。如何抓好城市规划建设管理？如何以科技创新引领产业转型升级？如何让文旅文创事业火。“出圈”？如何统筹推进城乡融合发展？代表团一行带着思考学、带着问题看、带着收获行，不放过任何一个细节，努力从点滴中寻找答案。。城市规划建设管理，关乎城市长远发展和群众美好生活。代表团一行先后到洛阳市规划展示馆、中央公园、伊滨区立雪社区体育公园、宜阳县城市展示馆和洛龙区石油社区、兴洛湖城市驿站等处，了解洛阳时代变迁、发展现状和远景规划，学习洛阳如何有效解决城市规划、建设、管理中存在的突出矛盾和难点问题，更好建设充满活力、富有特色、宜居宜业的现代化城市的先进理念和经验做法。。“在理念上更加注重以人为本，规划起点很高，功能设施完备，建设品质高端，管理精细精致，环境清爽干净，让人眼前一亮、印象深刻。”代表团成员表示，洛阳在城市规划建设管理实践中有很多好的思路举措和经验做法，值得深入学习借鉴，运用到我们的城市规划建设管理中，着力打造高品质魅力之城，不断擦亮“近悦远来”的城市名片。。洛阳产业发展如春潮涌动，勾勒出河洛大地气象万千的新图景。作为新中国重点建设的老工业基地，洛阳市工业基础坚实，现有规模以上工业企业。1947家，其中主营业务收入超百亿的9家，形成先进装备制造、新材料两个千亿级产业集群和石油化工1个准千亿级产业集群，入选国家产业转型升级示范区……这一系列成绩背后，正是洛阳市这座“千年古都”推动产业转型升级的生动写照。代表团一行先后到中州时代新能源生产基地、九创航空装备产业园、航空航天装备智创产业园、中航光电科技股份有限公司等处，仔细看项目、认真听介绍，感受洛阳市项目建设、产业转型所取得的成效。“河南西部（洛阳—平顶山）产业转型升级示范区是国家批复的全国第二批产业转型升级示范区，洛阳与平顶山产业关联性强、互补性强、协同性强，推进联动发展大有可为，符合国家区域协调发展战略，符合省委、省政府部署要求，符合两地当前发展实际，也是双方人民群众的共同期盼。”陈向平说，希望两地密切联系、加强合作，深化体制机制创新，推动装备制造等产业成为关键环、处在中高端，形成要素集聚、优势互补、特色鲜明的区域协调发展新格局。。随着新一轮科技革命和产业变革加速演进，区域竞争实质就是创新发展的竞争。洛阳坚持把以科技创新引领产业升级作为现代化建设的首要任务，把创新落到产业上、产业落到。行走河洛大地，城乡互融互促、县域竞相发展的美好画卷徐徐展开，给代表团一行留下了深刻的印象。代表团考察了宜阳县韩城镇、前进大桥等处，学习洛阳集镇建设、乡村振兴等城乡融合发展工作，表示将坚持改革创新双轮驱动，深入推进以人为核心的新型城镇化战略，促进空间融合、要素融合、产业融合，走好共同富裕之路。,5月22日至23日，平顶山市党政代表团赴洛阳市，带着“等不起”的紧迫感、“慢不得”的危机感、“坐不住”的责任感，深入学习考察城市规划建设管理、产业转型、项目建设、科技创新、文旅文创和城乡融合发展等方面的先进理念、经验做法，以更宽视野、更大力度、更实举措奋力开创我市经济社会高质量发展新局面。。省委常委、洛阳市委书记江凌，平顶山市委书记陈向平、市长李明俊，洛阳市市长徐衣显参加活动。。“我们这次学习考察的主要目的，就是要进一步解放思想、更新观念、开拓创新，对标先进找差距，真抓实干谋发展，奋勇争先开新局。”陈向平掷地有声。。这是一次开阔视野的学习之行，也是一次对照先进的醒脑之行，更是一次拉高标杆的奋进之行。如何抓好城市规划建设管理？如何以科技创新引领产业转型升级？如何让文旅文创事业火。“出圈”？如何统筹推进城乡融合发展？代表团一行带着思考学、带着问题看、带着收获行，不放过任何一个细节，努力从点滴中寻找答案。。城市规划建设管理，关乎城市长远发展和群众美好生活。代表团一行先后到洛阳市规划展示馆、中央公园、伊滨区立雪社区体育公园、宜阳县城市展示馆和洛龙区石油社区、兴洛湖城市驿站等处，了解洛阳时代变迁、发展现状和远景规划，学习洛阳如何有效解决城市规划、建设、管理中存在的突出矛盾和难点问题，更好建设充满活力、富有特色、宜居宜业的现代化城市的先进理念和经验做法。。“在理念上更加注重以人为本，规划起点很高，功能设施完备，建设品质高端，管理精细精致，环境清爽干净，让人眼前一亮、印象深刻。”代表团成员表示，洛阳在城市规划建设管理实践中有很多好的思路举措和经验做法，值得深入学习借鉴，运用到我们的城市规划建设管理中，着力打造高品质魅力之城，不断擦亮“近悦远来”的城市名片。。洛阳产业发展如春潮涌动，勾勒出河洛大地气象万千的新图景。作为新中国重点建设的老工业基地，洛阳市工业基础坚实，现有规模以上工业企业。1947家，其中主营业务收入超百亿的9家，形成先进装备制造、新材料两个千亿级产业集群和石油化工1个准千亿级产业集群，入选国家产业转型升级示范区……这一系列成绩背后，正是洛阳市这座“千年古都”推动产业转型升级的生动写照。代表团一行先后到中州时代新能源生产基地、九创航空装备产业园、航空航天装备智创产业园、中航光电科技股份有限公司等处，仔细看项目、认真听介绍，感受洛阳市项目建设、产业转型所取得的成效。“河南西部（洛阳—平顶山）产业转型升级示范区是国家批复的全国第二批产业转型升级示范区，洛阳与平顶山产业关联性强、互补性强、协同性强，推进联动发展大有可为，符合国家区域协调发展战略，符合省委、省政府部署要求，符合两地当前发展实际，也是双方人民群众的共同期盼。”陈向平说，希望两地密切联系、加强合作，深化体制机制创新，推动装备制造等产业成为关键环、处在中高端，形成要素集聚、优势互补、特色鲜明的区域协调发展新格局。。随着新一轮科技革命和产业变革加速演进，区域竞争实质就是创新发展的竞争。洛阳坚持把以科技创新引领产业升级作为现代化建设的首要任务，把创新落到产业上、产业落到。行走河洛大地，城乡互融互促、县域竞相发展的美好画卷徐徐展开，给代表团一行留下了深刻的印象。代表团考察了宜阳县韩城镇、前进大桥等处，学习洛阳集镇建设、乡村振兴等城乡融合发展工作，表示将坚持改革创新双轮驱动，深入推进以人为核心的新型城镇化战略，促进空间融合、要素融合、产业融合，走好共同富裕之路。,政府领导到其他城市考察学习或访问,0.0,True
148,河南省,平顶山市,鹰城要闻刘江带队到漯河市学习考察沙河复航工程建设及港口运营情况,2021-01-25,https://www.pds.gov.cn/contents/4/126770.html,（记者 程颖 实习生 郭璇璇）1月21日下午，副市长刘江带领市政府办、交通运输局相关负责人，到漯河市学习考察沙河复航工程建设及港口运营情况。。刘江一行先后到漯河市军李航运枢纽和漯河港，实地察看了工程建设进度，学习考察港口运营谋划情况。双方就加强沟通协作、加快工程建设、争取沙河复航项目早日全线贯通，作了深入交流。。刘江指出，沙河复航工程对弥补平顶山市内河航运短板，形成综合交通运输体系，促进大宗货物外运和外部货物的进入具有重要意义。平顶山市各有关部门要进一步提高认识，凝聚共识，加快推进港区、航道和码头建设；要在全面完成码头、堆场工程的基础上，加大与相关单位的协调力度，确保剩余航道工程在军李航运枢纽工程建成蓄水前全部完成；要同步谋划港区运营工作，做好水运与公路、铁路运输的有效衔接，着力减少货物落地周转环节，提升转运速度，降低运输成本，争取尽可能多的货物通过沙河水运通江达海，为我市打造豫西南综合交通枢纽提供有力保障。,（记者 程颖 实习生 郭璇璇）1月21日下午，副市长刘江带领市政府办、交通运输局相关负责人，到漯河市学习考察沙河复航工程建设及港口运营情况。。刘江一行先后到漯河市军李航运枢纽和漯河港，实地察看了工程建设进度，学习考察港口运营谋划情况。双方就加强沟通协作、加快工程建设、争取沙河复航项目早日全线贯通，作了深入交流。。刘江指出，沙河复航工程对弥补平顶山市内河航运短板，形成综合交通运输体系，促进大宗货物外运和外部货物的进入具有重要意义。平顶山市各有关部门要进一步提高认识，凝聚共识，加快推进港区、航道和码头建设；要在全面完成码头、堆场工程的基础上，加大与相关单位的协调力度，确保剩余航道工程在军李航运枢纽工程建成蓄水前全部完成；要同步谋划港区运营工作，做好水运与公路、铁路运输的有效衔接，着力减少货物落地周转环节，提升转运速度，降低运输成本，争取尽可能多的货物通过沙河水运通江达海，为我市打造豫西南综合交通枢纽提供有力保障。,政府领导到其他城市考察学习或访问,0.0,True
148,河南省,平顶山市,加快推进百城建设提质工程胡荃周斌率我市党政考察团赴沈丘虞城兰考商丘学习考察脱贫攻坚和百城建设提质工程工作,2017-08-24,https://www.pds.gov.cn/contents/11334/69836.html,胡荃、周斌率我市党政考察团赴沈丘、虞城、兰考、商丘学习考察脱贫攻坚和百城建设提质工程工作。﻿（记者华谦）怀着学习先进、追赶提升的强烈愿望，带着打赢攻坚战、同步奔小康的紧迫感和责任感，。日，市委书记胡荃、市长周斌率领我市党政考察团先后到沈丘县、虞城县、兰考县和商丘市学习考察脱贫攻坚和百城建设提质工程工作。。周口市委书记刘继标、市长丁福浩，商丘市委书记王战营、市长张建慧，开封市委常委、兰考县委书记蔡松涛等先后陪同考察。。市级领导李萍、段玉良、黄庚倜、杨克俊、葛巧红、李建民、古松、冯晓仙、魏建平、齐俊禄和各县（市、区）、市城乡一体化示范区、高新区，市直有关部门负责同志参加考察。。多个考察点，认真学习各地在脱贫攻坚和百城建设提质工程方面的经验做法，在思想观念上经历了一次又一次的冲击和震动。。作为国家扶贫开发工作重点县，沈丘县按照建档立卡的信息，针对每一村、每一户不同情况精准施策，采取干部驻村、基础推动、产业带动、金融扶贫、社会帮扶等形式，从。日上午，代表团一行先后到河南凯旺电子股份有限公司、大唐融合（河南）信息服务有限公司、石槽集乡虎头村产业扶贫示范基地、周营乡恒升源养殖扶贫基地、付井镇赵口村、纸店镇赵腰庄村产业扶贫基地实地考察。。个项目。考察团一行考察了凯旺电子数据线缆组件加工基地、光伏发电站等产业扶贫项目运行和带动贫困群众就业增收情况，对该县把扶贫车间建到群众家门口、增强贫困群众。（帮扶政策公开化、帮扶计划责任化、帮扶措施具体化、帮扶成效长效化）管理新举措推动精准帮扶工作的情况介绍，对该村。不久前，虞城县代表河南省接受国家脱贫攻坚巡查，受到充分肯定。一分部署，九分落实。近年来，在脱贫攻坚战中，虞城广大党员干部把责任扛在肩上，把任务紧紧抓在手上，把措施条条落到实处，一步步把蓝图变成现实。。万吨液态奶生产流程、科迪集团纯净水和速冻食品生产线、利民镇奶牛扶贫工程集中饲养基地、稍岗镇韦店集村九大工程和。通过认真听取情况介绍，详细了解脱贫攻坚做法，考察团成员对虞城县重基础、强产业，多种扶贫方式并举的脱贫攻坚路子给予高度评价，认为该县产业扶贫变。古宋河两岸生态护坡工程正在紧张施工，汉梁文化公园二期工程微地形正在加紧堆砌，归德古城内保护性修复工程正在精雕细琢。近年来，商丘市以增强百姓幸福感、获得感为出发点，持续提升城市发展品质，大力推进百城建设提质工程，城市新形象、新面貌日益提升。。日上午，考察团一行先后来到商丘中心城区宋城公园、日月湖广场、文化艺术中心、运河三商桥、商都公园、古宋河、汉梁文化公园、商丘古城等处进行考察。看到该市城区河道经过清淤、护坡、景观绿化等一系列整治，呈现出河畅、水清、岸绿的新形象，考察团成员由衷赞叹，纷纷拿出手机拍摄蓝天下的河岸美景。看到商丘古城修复性保护与展示工作力度大、场面壮观，大家极为触动，认为商丘在城市建设方面，特别是在棚户区改造工作上，起点高、思路清、力度大、速度快、工作实，探索总结出了很多好经验、好做法，值得学习借鉴。。这是一片精神高地，激励亿万人奋进的焦裕禄精神在这里诞生；这是一方脱贫攻坚重地，它的每一步变化都牵动各方关注。近三年来，兰考县上下同心、全力以赴，像当年焦裕禄带领兰考人民治理。日下午，考察团一行实地考察参观了兰考县城市会客厅、惠安街道爱心超市，并到兰考县展览馆参观兰考脱贫攻坚纪实展，深入谷营镇霍寨村察看脱贫攻坚档卡建设，深入堌阳镇徐场村参观民族乐器加工产业，学习扶贫产业推进的举措。每到一处，考察团都详细了解兰考县精准扶贫方面取得的成功经验，询问精准识别、政策扶持、产业支撑、体制机制等方面的情况，就精准扶贫工作中的好做法、好经验进行了深入交流。,胡荃、周斌率我市党政考察团赴沈丘、虞城、兰考、商丘学习考察脱贫攻坚和百城建设提质工程工作。﻿（记者华谦）怀着学习先进、追赶提升的强烈愿望，带着打赢攻坚战、同步奔小康的紧迫感和责任感，。日，市委书记胡荃、市长周斌率领我市党政考察团先后到沈丘县、虞城县、兰考县和商丘市学习考察脱贫攻坚和百城建设提质工程工作。。周口市委书记刘继标、市长丁福浩，商丘市委书记王战营、市长张建慧，开封市委常委、兰考县委书记蔡松涛等先后陪同考察。。市级领导李萍、段玉良、黄庚倜、杨克俊、葛巧红、李建民、古松、冯晓仙、魏建平、齐俊禄和各县（市、区）、市城乡一体化示范区、高新区，市直有关部门负责同志参加考察。。多个考察点，认真学习各地在脱贫攻坚和百城建设提质工程方面的经验做法，在思想观念上经历了一次又一次的冲击和震动。。作为国家扶贫开发工作重点县，沈丘县按照建档立卡的信息，针对每一村、每一户不同情况精准施策，采取干部驻村、基础推动、产业带动、金融扶贫、社会帮扶等形式，从。日上午，代表团一行先后到河南凯旺电子股份有限公司、大唐融合（河南）信息服务有限公司、石槽集乡虎头村产业扶贫示范基地、周营乡恒升源养殖扶贫基地、付井镇赵口村、纸店镇赵腰庄村产业扶贫基地实地考察。。个项目。考察团一行考察了凯旺电子数据线缆组件加工基地、光伏发电站等产业扶贫项目运行和带动贫困群众就业增收情况，对该县把扶贫车间建到群众家门口、增强贫困群众。（帮扶政策公开化、帮扶计划责任化、帮扶措施具体化、帮扶成效长效化）管理新举措推动精准帮扶工作的情况介绍，对该村。不久前，虞城县代表河南省接受国家脱贫攻坚巡查，受到充分肯定。一分部署，九分落实。近年来，在脱贫攻坚战中，虞城广大党员干部把责任扛在肩上，把任务紧紧抓在手上，把措施条条落到实处，一步步把蓝图变成现实。。万吨液态奶生产流程、科迪集团纯净水和速冻食品生产线、利民镇奶牛扶贫工程集中饲养基地、稍岗镇韦店集村九大工程和。通过认真听取情况介绍，详细了解脱贫攻坚做法，考察团成员对虞城县重基础、强产业，多种扶贫方式并举的脱贫攻坚路子给予高度评价，认为该县产业扶贫变。古宋河两岸生态护坡工程正在紧张施工，汉梁文化公园二期工程微地形正在加紧堆砌，归德古城内保护性修复工程正在精雕细琢。近年来，商丘市以增强百姓幸福感、获得感为出发点，持续提升城市发展品质，大力推进百城建设提质工程，城市新形象、新面貌日益提升。。日上午，考察团一行先后来到商丘中心城区宋城公园、日月湖广场、文化艺术中心、运河三商桥、商都公园、古宋河、汉梁文化公园、商丘古城等处进行考察。看到该市城区河道经过清淤、护坡、景观绿化等一系列整治，呈现出河畅、水清、岸绿的新形象，考察团成员由衷赞叹，纷纷拿出手机拍摄蓝天下的河岸美景。看到商丘古城修复性保护与展示工作力度大、场面壮观，大家极为触动，认为商丘在城市建设方面，特别是在棚户区改造工作上，起点高、思路清、力度大、速度快、工作实，探索总结出了很多好经验、好做法，值得学习借鉴。。这是一片精神高地，激励亿万人奋进的焦裕禄精神在这里诞生；这是一方脱贫攻坚重地，它的每一步变化都牵动各方关注。近三年来，兰考县上下同心、全力以赴，像当年焦裕禄带领兰考人民治理。日下午，考察团一行实地考察参观了兰考县城市会客厅、惠安街道爱心超市，并到兰考县展览馆参观兰考脱贫攻坚纪实展，深入谷营镇霍寨村察看脱贫攻坚档卡建设，深入堌阳镇徐场村参观民族乐器加工产业，学习扶贫产业推进的举措。每到一处，考察团都详细了解兰考县精准扶贫方面取得的成功经验，询问精准识别、政策扶持、产业支撑、体制机制等方面的情况，就精准扶贫工作中的好做法、好经验进行了深入交流。,政府领导到其他城市考察学习或访问,0.7874574061737469,True
