code,province,city,topic,date,url,content,content.1,label,score,is_match
146,河南省,开封市,开封市城管局召开局长办公会扩大会贯彻落实四大班子考察学习成果,2021-06-03,https://www.kaifeng.gov.cn/kfsrmzfwz/bmdt/pc/content/content_1737176817114324992.html,开封市城管局召开局长办公会（扩大会）贯彻落实四大班子考察学习成果 - 开封市人民政府网站。为贯彻落实四大班子考察学习成果，5月31日下午，市城管局召开局长办公（扩大）会，局领导班子成员、局机关科室负责人、局属单位负责人参加会议。。会上，局党组书记、局长孔羽同与会人员交流分享了考察学习情况，传达了市委书记高建军、市长李湘豫对我市城市建设管理、经济社会发展等方面的总体部署，就如何把学习成果转化为工作实效提出具体要求。。会议分析了当前城市管理工作应该怎么看、怎么办、怎么干，起到了审视工作、明晰差距、校准举措、追赶超越的积极作用。。会议提出，城市管理行业多、专业杂、摊点大、分布广，是一项综合的、复杂的、庞大的系统工程，要求城管系统要以时不待我、只争朝夕的精神，乘势而进、久久为功，对标对表、找出差距、学习经验、补齐短板，全面提升城市品质。。会后，市城管局印发了《六月份城市管理工作要点》，对6月份工作进行了细化，做到前置任务进程、细化责任分工、确保任务落实，营造出干事创业的浓厚氛围。,开封市城管局召开局长办公会（扩大会）贯彻落实四大班子考察学习成果 - 开封市人民政府网站。为贯彻落实四大班子考察学习成果，5月31日下午，市城管局召开局长办公（扩大）会，局领导班子成员、局机关科室负责人、局属单位负责人参加会议。。会上，局党组书记、局长孔羽同与会人员交流分享了考察学习情况，传达了市委书记高建军、市长李湘豫对我市城市建设管理、经济社会发展等方面的总体部署，就如何把学习成果转化为工作实效提出具体要求。。会议分析了当前城市管理工作应该怎么看、怎么办、怎么干，起到了审视工作、明晰差距、校准举措、追赶超越的积极作用。。会议提出，城市管理行业多、专业杂、摊点大、分布广，是一项综合的、复杂的、庞大的系统工程，要求城管系统要以时不待我、只争朝夕的精神，乘势而进、久久为功，对标对表、找出差距、学习经验、补齐短板，全面提升城市品质。。会后，市城管局印发了《六月份城市管理工作要点》，对6月份工作进行了细化，做到前置任务进程、细化责任分工、确保任务落实，营造出干事创业的浓厚氛围。,其他,0.7520205769413102,True
146,河南省,开封市,高建军带队到扬州市考察学习,2023-07-07,https://www.kaifeng.gov.cn/kfsrmzfwz/zwyw/pc/content/content_1737170838054281216.html,7月5日至6日，市委书记高建军带队到扬州市考察学习古城保护利用、文旅文创融合发展、城市更新等工作先进经验。高建军强调，要深入贯彻落实习近平总书记关于历史文化保护传承的重要论述和指示批示精神，坚定文化自信、担当使命、奋发有为，赓续历史文脉、谱写当代华章，凝聚合力把开封打造成为黄河运河国际文化旅游目的地、都城型国家历史文化名城、高品质生态宜居活力古城。。扬州市委副书记、代市长潘国强等扬州市领导参加考察活动。市领导张松文、邵华、黄腾、肖文兴、袁钢等参加考察活动。。在扬州期间，高建军一行来到文汇阁、北护城河项目、宋夹城体育休闲公园、平山堂、瘦西湖清水活水工程、中国大运河博物馆、三湾湿地公园、江都水利枢纽工程、仁丰里历史文化街区、东关历史文化街区等地，深入了解扬州市古城保护利用、水生态保护、基础设施建设、文商旅融合发展、经济发展、城市规划建设管理、城市更新等情况。。扬州已有2500多年的建城史，与大运河同生共长、兴衰相依。现有两座国家历史文化名城、4个中国历史文化名镇，大运河扬州段有6段河道、10个遗产点列入世界文化遗产名录，是大运河沿线城市之最。扬州古城（扬州城遗址）由明清历史城区和古城遗址区组成，面积约18.25平方公里，是国家级大遗址之一，是历史文化要素最集中、保护最完好的地区，是中国特有的历史城市动态演变、连续发展的典型代表。。高建军强调，扬州市委、市政府高度重视古城保护工作，始终按照“护其貌、美其颜、扬其韵、铸其魂”的保护思路，不断深化古城保护理念，着力把历史文化资源“理出来、保起来、串起来、靓出来、活起来、传下来”，致力于打造“大运河文化带建设、历史文化名城保护和精致传统生活体验的扬州样板”，创造了许多值得认真学习借鉴的先进经验。要坚持保护为主、抢救第一，把古城保护好、利用好，加大重要遗址考古发掘力度，努力在中华文明探源工程上取得新进展、新突破。要坚持守正创新，活化历史，深入挖掘丰富历史文化资源，发挥开封古城历史文化遗产特色，突出做好宋东京城遗址、黄河文化相关遗产、大运河遗址、“城摞城”地下遗址等展示工作，让开封的历史文化遗产“活”起来，同时强化创意驱动、科技赋能，做优传统业态，培育新兴业态，引入高端业态，优化产品供给，提供多元化服务，加快特色化、集群化、品牌化发展，打造文旅文创高地。。市直相关单位负责同志，城乡一体化示范区党工委和相关区委负责同志等参加考察。（记者 魏东柱）,7月5日至6日，市委书记高建军带队到扬州市考察学习古城保护利用、文旅文创融合发展、城市更新等工作先进经验。高建军强调，要深入贯彻落实习近平总书记关于历史文化保护传承的重要论述和指示批示精神，坚定文化自信、担当使命、奋发有为，赓续历史文脉、谱写当代华章，凝聚合力把开封打造成为黄河运河国际文化旅游目的地、都城型国家历史文化名城、高品质生态宜居活力古城。。扬州市委副书记、代市长潘国强等扬州市领导参加考察活动。市领导张松文、邵华、黄腾、肖文兴、袁钢等参加考察活动。。在扬州期间，高建军一行来到文汇阁、北护城河项目、宋夹城体育休闲公园、平山堂、瘦西湖清水活水工程、中国大运河博物馆、三湾湿地公园、江都水利枢纽工程、仁丰里历史文化街区、东关历史文化街区等地，深入了解扬州市古城保护利用、水生态保护、基础设施建设、文商旅融合发展、经济发展、城市规划建设管理、城市更新等情况。。扬州已有2500多年的建城史，与大运河同生共长、兴衰相依。现有两座国家历史文化名城、4个中国历史文化名镇，大运河扬州段有6段河道、10个遗产点列入世界文化遗产名录，是大运河沿线城市之最。扬州古城（扬州城遗址）由明清历史城区和古城遗址区组成，面积约18.25平方公里，是国家级大遗址之一，是历史文化要素最集中、保护最完好的地区，是中国特有的历史城市动态演变、连续发展的典型代表。。高建军强调，扬州市委、市政府高度重视古城保护工作，始终按照“护其貌、美其颜、扬其韵、铸其魂”的保护思路，不断深化古城保护理念，着力把历史文化资源“理出来、保起来、串起来、靓出来、活起来、传下来”，致力于打造“大运河文化带建设、历史文化名城保护和精致传统生活体验的扬州样板”，创造了许多值得认真学习借鉴的先进经验。要坚持保护为主、抢救第一，把古城保护好、利用好，加大重要遗址考古发掘力度，努力在中华文明探源工程上取得新进展、新突破。要坚持守正创新，活化历史，深入挖掘丰富历史文化资源，发挥开封古城历史文化遗产特色，突出做好宋东京城遗址、黄河文化相关遗产、大运河遗址、“城摞城”地下遗址等展示工作，让开封的历史文化遗产“活”起来，同时强化创意驱动、科技赋能，做优传统业态，培育新兴业态，引入高端业态，优化产品供给，提供多元化服务，加快特色化、集群化、品牌化发展，打造文旅文创高地。。市直相关单位负责同志，城乡一体化示范区党工委和相关区委负责同志等参加考察。（记者 魏东柱）,政府领导到其他城市考察学习或访问,0.0,True
146,河南省,开封市,高建军带队到绍兴市考察学习,2023-07-06,https://www.kaifeng.gov.cn/kfsrmzfwz/zwyw/pc/content/content_1737170817867096064.html,7月4日至5日，市委书记高建军带队到绍兴市考察学习古城保护利用、文旅文创融合发展、城市更新等工作先进经验。高建军强调，要深入学习习近平总书记在文化传承发展座谈会上的重要讲话精神，认真贯彻落实2023全省文旅文创发展大会精神，坚持在保护中发展、在发展中保护，深入实施文旅强市战略，推动形成文旅文创深度融合新格局，让开封更加宜居宜业宜游，为推动文化繁荣、建设文化强国、建设中华民族现代文明尽责任、作贡献。。绍兴市委书记温暖等绍兴市领导参加考察活动。市领导张松文、邵华、黄腾、肖文兴、袁钢等参加考察活动。。在绍兴期间，高建军一行来到绍兴市城市展示馆、仓桥直街历史文化街区、鲁迅故里、迪荡湖城市综合公园、蔡元培广场（孑民图书馆）、蔡元培故居、阳明故里综合保护项目、徐渭故里历史文化街区等地，深入了解绍兴市历史文化、古城保护利用、文商旅融合发展、经济发展、城市规划建设管理、城市更新等情况。。绍兴建城2500余年，迄今城址未变。在约9.09平方公里的绍兴古城范围内，有着8片历史文化街区、两个历史地段、9处国家级文保单位、7处省级文保单位、78处文保点与55处历史建筑，被称为“没有围墙的博物馆”。近年来，绍兴围绕古城“一城一桥三故里”总体布局，贯彻原汁原味的保护、原模原样的恢复、有根有据的重建、有脉有络的创新等大原则，先后实施了32个文商旅项目，总投资近300亿元，推动产、城、人相融互促，努力打造长三角最具文化标识度的城市。。高建军强调，开封与绍兴历史相通，文脉相承，宋文化如同一条纽带将两地紧密地联系在一起。近年来，绍兴市坚持高标准谋划、高品质建设、高水平管理，逐步探索出了一套适合自身发展的古城保护利用模式，先进经验值得认真学习借鉴。开封要与绍兴在互学互鉴中携手共进，深化两地常态化对接合作，担负起新时代新的文化使命。要把历史文化保护利用作为一项重大政治任务来抓，深入挖掘开封历史文化的历史价值、时代价值，擦亮开封历史文化名城的金字招牌。要进一步科学处理好城市改造开发和历史文化名城保护的关系，通过历史遗产的有效保护与合理利用推动开封高质量发展，进一步提高开封在国内外的综合影响力，加快建设近悦远来的世界历史文化名都和国际文化旅游名城。。市直相关单位负责同志，城乡一体化示范区党工委和各区委负责同志等参加考察。（记者 魏东柱）,7月4日至5日，市委书记高建军带队到绍兴市考察学习古城保护利用、文旅文创融合发展、城市更新等工作先进经验。高建军强调，要深入学习习近平总书记在文化传承发展座谈会上的重要讲话精神，认真贯彻落实2023全省文旅文创发展大会精神，坚持在保护中发展、在发展中保护，深入实施文旅强市战略，推动形成文旅文创深度融合新格局，让开封更加宜居宜业宜游，为推动文化繁荣、建设文化强国、建设中华民族现代文明尽责任、作贡献。。绍兴市委书记温暖等绍兴市领导参加考察活动。市领导张松文、邵华、黄腾、肖文兴、袁钢等参加考察活动。。在绍兴期间，高建军一行来到绍兴市城市展示馆、仓桥直街历史文化街区、鲁迅故里、迪荡湖城市综合公园、蔡元培广场（孑民图书馆）、蔡元培故居、阳明故里综合保护项目、徐渭故里历史文化街区等地，深入了解绍兴市历史文化、古城保护利用、文商旅融合发展、经济发展、城市规划建设管理、城市更新等情况。。绍兴建城2500余年，迄今城址未变。在约9.09平方公里的绍兴古城范围内，有着8片历史文化街区、两个历史地段、9处国家级文保单位、7处省级文保单位、78处文保点与55处历史建筑，被称为“没有围墙的博物馆”。近年来，绍兴围绕古城“一城一桥三故里”总体布局，贯彻原汁原味的保护、原模原样的恢复、有根有据的重建、有脉有络的创新等大原则，先后实施了32个文商旅项目，总投资近300亿元，推动产、城、人相融互促，努力打造长三角最具文化标识度的城市。。高建军强调，开封与绍兴历史相通，文脉相承，宋文化如同一条纽带将两地紧密地联系在一起。近年来，绍兴市坚持高标准谋划、高品质建设、高水平管理，逐步探索出了一套适合自身发展的古城保护利用模式，先进经验值得认真学习借鉴。开封要与绍兴在互学互鉴中携手共进，深化两地常态化对接合作，担负起新时代新的文化使命。要把历史文化保护利用作为一项重大政治任务来抓，深入挖掘开封历史文化的历史价值、时代价值，擦亮开封历史文化名城的金字招牌。要进一步科学处理好城市改造开发和历史文化名城保护的关系，通过历史遗产的有效保护与合理利用推动开封高质量发展，进一步提高开封在国内外的综合影响力，加快建设近悦远来的世界历史文化名都和国际文化旅游名城。。市直相关单位负责同志，城乡一体化示范区党工委和各区委负责同志等参加考察。（记者 魏东柱）,政府领导到其他城市考察学习或访问,0.0,True
146,河南省,开封市,高建军主持召开开封市赴绍兴扬州考察学习交流会,2023-07-07,https://www.kaifeng.gov.cn/kfsrmzfwz/zwyw/pc/content/content_1737170840684109824.html,为深入贯彻2023全省文旅文创发展大会精神，在年中这个时间节点全面对标国内先进城市、全面检视开封高质量发展各项工作，7月4日起，市委书记高建军带队对同为国家历史文化名城的绍兴市、扬州市，以古城建设、文旅文创融合发展等为重点，进行了实地考察，行程满满，收获满满。7月6日晚，开封市赴绍兴、扬州考察学习交流会在扬州市召开，在3个多小时的时间里，大家结合所看、所学、所思谈感受，讲下一步该怎么干，如何把工作干得更好。高建军主持会议并讲话，强调要深入贯彻习近平总书记关于文化旅游工作的重要论述和视察河南重要讲话重要指示，认真落实省委、省政府决策部署，坚持制造立市和文旅强市双轮驱动，坚定信心，把握重点，狠抓落实，推动开封文旅文创融合走在前列，勇做全省新时代高质量发展开路先锋。。高建军强调，要统一思想，坚定信心，立足开封独特优势推动文旅文创融合高质量发展。厚重的历史，灿烂的文化，丰厚的文化旅游资源是历史文化名城开封的独特优势和资源禀赋。高标准高质量做好古城保护利用工作，推动文旅文创融合高质量发展，是省委、省政府对开封提出的要求和寄予的厚望，也是开封坚持制造立市、文旅强市战略双向发力的必然要求。要把握重点，紧扣关键，准确把握文旅文创融合高质量发展的方法和路径。积极学习借鉴绍兴、扬州等地的先进经验，转变理念观念，勇于改革创新，进一步高水平谋划规划全市文旅文创融合高质量发展，科学制定目标、原则、战略、任务，推动整体工作量化细化具体化，明确时间节点、责任单位和责任人。推动“吃住行游购娱”延链补链强链，重点做好特色餐饮、酒店住宿、文化创意等工作，创新发展会议、会展、节会、赛事，推动文旅文创与科技、金融、城市更新、水利、文明创建等深度融合，强力实施一批重大文旅项目，做强做优做大文旅龙头企业，进一步擦亮开封文旅金字招牌。要加强领导，狠抓落实，全力以赴实现文旅文创融合高质量发展最佳效果。成立市委、市政府主要领导任组长的宋都古城文旅融合高质量发展领导小组，抽调精兵强将，组建工作专班，坚持系统观念，深入实施系列专项行动，压实责任，密切配合，协调联动，以文旅文创融合高质量发展不断为开封经济社会高质量发展注入强劲动力，加快开封高水平建设世界历史文化名都的步伐。。与会市领导，城乡一体化示范区党工委和相关区委负责同志，市委宣传部相关负责同志，市文广旅、住建、城管、资源规划、水利、商务等部门负责同志，开封文投集团、宋都古城文化产业园区负责同志等作了发言。（记者 魏东柱）,为深入贯彻2023全省文旅文创发展大会精神，在年中这个时间节点全面对标国内先进城市、全面检视开封高质量发展各项工作，7月4日起，市委书记高建军带队对同为国家历史文化名城的绍兴市、扬州市，以古城建设、文旅文创融合发展等为重点，进行了实地考察，行程满满，收获满满。7月6日晚，开封市赴绍兴、扬州考察学习交流会在扬州市召开，在3个多小时的时间里，大家结合所看、所学、所思谈感受，讲下一步该怎么干，如何把工作干得更好。高建军主持会议并讲话，强调要深入贯彻习近平总书记关于文化旅游工作的重要论述和视察河南重要讲话重要指示，认真落实省委、省政府决策部署，坚持制造立市和文旅强市双轮驱动，坚定信心，把握重点，狠抓落实，推动开封文旅文创融合走在前列，勇做全省新时代高质量发展开路先锋。。高建军强调，要统一思想，坚定信心，立足开封独特优势推动文旅文创融合高质量发展。厚重的历史，灿烂的文化，丰厚的文化旅游资源是历史文化名城开封的独特优势和资源禀赋。高标准高质量做好古城保护利用工作，推动文旅文创融合高质量发展，是省委、省政府对开封提出的要求和寄予的厚望，也是开封坚持制造立市、文旅强市战略双向发力的必然要求。要把握重点，紧扣关键，准确把握文旅文创融合高质量发展的方法和路径。积极学习借鉴绍兴、扬州等地的先进经验，转变理念观念，勇于改革创新，进一步高水平谋划规划全市文旅文创融合高质量发展，科学制定目标、原则、战略、任务，推动整体工作量化细化具体化，明确时间节点、责任单位和责任人。推动“吃住行游购娱”延链补链强链，重点做好特色餐饮、酒店住宿、文化创意等工作，创新发展会议、会展、节会、赛事，推动文旅文创与科技、金融、城市更新、水利、文明创建等深度融合，强力实施一批重大文旅项目，做强做优做大文旅龙头企业，进一步擦亮开封文旅金字招牌。要加强领导，狠抓落实，全力以赴实现文旅文创融合高质量发展最佳效果。成立市委、市政府主要领导任组长的宋都古城文旅融合高质量发展领导小组，抽调精兵强将，组建工作专班，坚持系统观念，深入实施系列专项行动，压实责任，密切配合，协调联动，以文旅文创融合高质量发展不断为开封经济社会高质量发展注入强劲动力，加快开封高水平建设世界历史文化名都的步伐。。与会市领导，城乡一体化示范区党工委和相关区委负责同志，市委宣传部相关负责同志，市文广旅、住建、城管、资源规划、水利、商务等部门负责同志，开封文投集团、宋都古城文化产业园区负责同志等作了发言。（记者 魏东柱）,政府领导到其他城市考察学习或访问,0.9083325104083922,True
