code,province,city,topic,date,url,content,content.1,label,score,is_match
146,河南省,开封市,李湘豫带队到西安考察学习,2023-06-16,https://www.kaifeng.gov.cn/kfsrmzfwz/zwyw/pc/content/content_1737170365905674240.html,6月14日至15日，市长李湘豫带队，深入西安考察学习历史文化名城保护和传承、文旅行业管理以及文旅文创融合发展等工作的先进经验。他强调，要深入学习习近平总书记在文化传承发展座谈会上的重要讲话精神，坚定文化自信自强，深化古都互学互鉴，为在新的起点上继续推动文化繁荣、建设文化强国、建设中华民族现代文明作出开封贡献。。西安与开封一样，历史文化底蕴深厚，文物遗址遗迹众多。李湘豫一行来到西安博物院、西安城墙永宁门、大明宫国家遗址公园等处，考察文化遗产保护利用工作。他指出，要学习借鉴西安经验，在留住古都“根”和“魂”的同时，在活化利用上下更大功夫，加强文化标识保护和沉浸式体验场景建设，既保护好文物文化遗产，又展示好历史文化名城肌理，推动文化“活”起来。。易俗社文化街区是西安新打造的展示城市魅力的重要窗口和名片。回民街、永兴坊等各类特色小吃吸引着络绎不绝的游客。李湘豫一行详细了解了夜市、文化街区等经营模式、管理理念、特色小吃以及民俗文化的发掘保护和活化利用等工作，对标先进找差距，研究对策促提升。他指出，要下大力气抓好城市特色街区建设，引进更多的新业态、新场景，大力发展夜经济，提升城市烟火气。要壮大以创意为内核的文化产业，发展特色鲜明的全链条文旅业态。。从博物馆之城到演艺之都，从打造文旅新场景新业态到夜游经济的全面激活，从推动文物保护科技创新到“互联网+中华文明”深入实施，从文旅融合“西安样板”到“西安经验”输出……近年来，西安市促进文化旅游深度融合，走出了一条独树一帜的文旅产业高质量发展之路。一路走，一路看，李湘豫对西安文旅融合发展的先进经验和创新模式表示赞赏，叮嘱各级各相关部门认真学习借鉴，尽快消化吸收，把学习成果转化为推动开封文旅产业高质量发展的火热实践。。李湘豫强调，深入推进文旅文创融合发展，必须在开封历史文化的保护和传承中探索切入点，在服务中华民族伟大复兴的文化强国建设中探索契合点，在新时代新征程中探索历史文化古城复兴复振的实践路径。要全面落实党中央关于文旅工作的各项战略部署，更有效地推动中华优秀传统文化创造性转化、创新性发展，更有力地推进中国特色社会主义文化建设。要深入学习借鉴“西安经验”，统筹推进开封文旅强市建设，深度挖掘开封深厚的文化底蕴，全面提升文旅市场品质。要在打造开封文旅品牌等方面狠下功夫，既要充分发挥开封文旅独有优势，叫响“宋文化看开封”等靓丽名片，又要在形式和内容上大胆创新、敢试敢闯，更要注重特色文旅项目的孵化，不断丰富沉浸式、体验式旅游业态，夯实文旅产业柱石地位。。副市长袁钢，龙亭区、鼓楼区、顺河回族区及市资源规划、住建、商务、文广旅等相关部门负责同志参加考察。（记者 叶森）,6月14日至15日，市长李湘豫带队，深入西安考察学习历史文化名城保护和传承、文旅行业管理以及文旅文创融合发展等工作的先进经验。他强调，要深入学习习近平总书记在文化传承发展座谈会上的重要讲话精神，坚定文化自信自强，深化古都互学互鉴，为在新的起点上继续推动文化繁荣、建设文化强国、建设中华民族现代文明作出开封贡献。。西安与开封一样，历史文化底蕴深厚，文物遗址遗迹众多。李湘豫一行来到西安博物院、西安城墙永宁门、大明宫国家遗址公园等处，考察文化遗产保护利用工作。他指出，要学习借鉴西安经验，在留住古都“根”和“魂”的同时，在活化利用上下更大功夫，加强文化标识保护和沉浸式体验场景建设，既保护好文物文化遗产，又展示好历史文化名城肌理，推动文化“活”起来。。易俗社文化街区是西安新打造的展示城市魅力的重要窗口和名片。回民街、永兴坊等各类特色小吃吸引着络绎不绝的游客。李湘豫一行详细了解了夜市、文化街区等经营模式、管理理念、特色小吃以及民俗文化的发掘保护和活化利用等工作，对标先进找差距，研究对策促提升。他指出，要下大力气抓好城市特色街区建设，引进更多的新业态、新场景，大力发展夜经济，提升城市烟火气。要壮大以创意为内核的文化产业，发展特色鲜明的全链条文旅业态。。从博物馆之城到演艺之都，从打造文旅新场景新业态到夜游经济的全面激活，从推动文物保护科技创新到“互联网+中华文明”深入实施，从文旅融合“西安样板”到“西安经验”输出……近年来，西安市促进文化旅游深度融合，走出了一条独树一帜的文旅产业高质量发展之路。一路走，一路看，李湘豫对西安文旅融合发展的先进经验和创新模式表示赞赏，叮嘱各级各相关部门认真学习借鉴，尽快消化吸收，把学习成果转化为推动开封文旅产业高质量发展的火热实践。。李湘豫强调，深入推进文旅文创融合发展，必须在开封历史文化的保护和传承中探索切入点，在服务中华民族伟大复兴的文化强国建设中探索契合点，在新时代新征程中探索历史文化古城复兴复振的实践路径。要全面落实党中央关于文旅工作的各项战略部署，更有效地推动中华优秀传统文化创造性转化、创新性发展，更有力地推进中国特色社会主义文化建设。要深入学习借鉴“西安经验”，统筹推进开封文旅强市建设，深度挖掘开封深厚的文化底蕴，全面提升文旅市场品质。要在打造开封文旅品牌等方面狠下功夫，既要充分发挥开封文旅独有优势，叫响“宋文化看开封”等靓丽名片，又要在形式和内容上大胆创新、敢试敢闯，更要注重特色文旅项目的孵化，不断丰富沉浸式、体验式旅游业态，夯实文旅产业柱石地位。。副市长袁钢，龙亭区、鼓楼区、顺河回族区及市资源规划、住建、商务、文广旅等相关部门负责同志参加考察。（记者 叶森）,政府领导到其他城市考察学习或访问,0.5146224755661267,True
146,河南省,开封市,焦作市考察组莅汴考察学习应急管理工作,2023-04-15,https://www.kaifeng.gov.cn/kfsrmzfwz/zwyw/pc/content/content_1737168901544124416.html,4月12日，焦作市副市长宗家桢率焦作市应急管理局考察组莅汴考察应急管理工作。市应急管理局党委书记、局长郑连成参加活动。。考察组来到市应急管理局，了解和观看我市应急管理视频调度、防汛监控等系统演示，并与市应急管理局座谈交流，详细了解我市安全生产、应急管理体制机制建设、防灾减灾等工作经验做法。随后，考察组来到河南省综合救援基地（开封），现场了解应急救援装备和防汛救灾物资储备情况，并观看救援人员排涝训练。。考察组对我市应急管理工作给予高度评价，表示将积极吸收我市先进工作经验和做法，促进焦作市应急管理工作再提升。双方表示，将继续加强两地交流学习，互相分享经验，共同推动应急管理事业高质量发展。（见习记者 李宇航 实习生 赵一融）,4月12日，焦作市副市长宗家桢率焦作市应急管理局考察组莅汴考察应急管理工作。市应急管理局党委书记、局长郑连成参加活动。。考察组来到市应急管理局，了解和观看我市应急管理视频调度、防汛监控等系统演示，并与市应急管理局座谈交流，详细了解我市安全生产、应急管理体制机制建设、防灾减灾等工作经验做法。随后，考察组来到河南省综合救援基地（开封），现场了解应急救援装备和防汛救灾物资储备情况，并观看救援人员排涝训练。。考察组对我市应急管理工作给予高度评价，表示将积极吸收我市先进工作经验和做法，促进焦作市应急管理工作再提升。双方表示，将继续加强两地交流学习，互相分享经验，共同推动应急管理事业高质量发展。（见习记者 李宇航 实习生 赵一融）,政府领导到其他城市考察学习或访问,0.0,True
146,河南省,开封市,晋城市考察组莅汴考察学习医保垂直管理改革和长期护理保险工作,2022-07-05,https://www.kaifeng.gov.cn/kfsrmzfwz/zwyw/pc/content/content_1737165135952519168.html,晋城市考察组莅汴考察学习医保垂直管理改革和长期护理保险工作 - 开封市人民政府网站。7月3日至4日，晋城市副市长黄登宇一行，来我市考察学习医保垂直管理改革和长期护理保险工作。副市长王秋杰会见考察组一行。。在我市组织召开的座谈会上，王秋杰首先代表市委、市政府对考察组一行的到来表示欢迎，并就我市医保垂直管理改革和长期护理保险工作等方面的经验做法及工作成效进行介绍。随后双方进行了积极的探讨交流。。考察组对我市医保垂直管理改革和长期护理保险工作给予高度评价，认为我市工作力度大、举措实、效果好，许多好的经验和创新性做法值得学习和借鉴。希望在今后的工作中进一步加强沟通了解，深入推进交流合作，努力推动两地互相交流，更好更快发展。座谈会后，考察组还到我市福寿康养老服务公司进行了实地调研。（记者 王予杰）,晋城市考察组莅汴考察学习医保垂直管理改革和长期护理保险工作 - 开封市人民政府网站。7月3日至4日，晋城市副市长黄登宇一行，来我市考察学习医保垂直管理改革和长期护理保险工作。副市长王秋杰会见考察组一行。。在我市组织召开的座谈会上，王秋杰首先代表市委、市政府对考察组一行的到来表示欢迎，并就我市医保垂直管理改革和长期护理保险工作等方面的经验做法及工作成效进行介绍。随后双方进行了积极的探讨交流。。考察组对我市医保垂直管理改革和长期护理保险工作给予高度评价，认为我市工作力度大、举措实、效果好，许多好的经验和创新性做法值得学习和借鉴。希望在今后的工作中进一步加强沟通了解，深入推进交流合作，努力推动两地互相交流，更好更快发展。座谈会后，考察组还到我市福寿康养老服务公司进行了实地调研。（记者 王予杰）,政府领导到其他城市考察学习或访问,0.0,True
146,河南省,开封市,长垣市领导到开封市考察学习黄河生态廊道建设工作,2021-03-17,https://www.kaifeng.gov.cn/kfsrmzfwz/bmdt/pc/content/content_1737175740990136320.html,3月16日，长垣市市委常委、副市长刘文君带队到开封市考察学习黄河生态廊道建设工作。市发展改革委党组成员、副主任门大勇出席调研活动，开封第一河务局局长潘佳良陪同调研。。调研组一行先来到南浦码头，听取了黑岗口引黄调蓄水库整体建设情况汇报，观看了开封市黄河流域生态保护和高质量发展工作汇报片，并沿途察看了西干渠、红枫大道、樱花园、生态廊道建设情况，详细了解了驿站建设情况、单车驿站功能。随后在黑岗口黄河河势观测台察看了治黄文化保护传承弘扬情况。长垣市市委常委、副市长刘文君高度称赞开封市黄河流域生态保护和高质量发展工作，并就好的工作经验做法进行了探讨学习。,3月16日，长垣市市委常委、副市长刘文君带队到开封市考察学习黄河生态廊道建设工作。市发展改革委党组成员、副主任门大勇出席调研活动，开封第一河务局局长潘佳良陪同调研。。调研组一行先来到南浦码头，听取了黑岗口引黄调蓄水库整体建设情况汇报，观看了开封市黄河流域生态保护和高质量发展工作汇报片，并沿途察看了西干渠、红枫大道、樱花园、生态廊道建设情况，详细了解了驿站建设情况、单车驿站功能。随后在黑岗口黄河河势观测台察看了治黄文化保护传承弘扬情况。长垣市市委常委、副市长刘文君高度称赞开封市黄河流域生态保护和高质量发展工作，并就好的工作经验做法进行了探讨学习。,政府领导到其他城市考察学习或访问,0.0,True
146,河南省,开封市,李湘豫带队到成都市考察学习,2021-05-19,https://www.kaifeng.gov.cn/kfsrmzfwz/zwyw/pc/content/content_1737158633837600768.html,九天开出一成都，万户千门入画图。5月17日至18日，市长李湘豫带队来到成都市，深入贯彻落实习近平总书记关于城市工作的重要讲话精神，就城市更新等工作进行考察学习，持续提升城市品位、增进群众福祉，推动我市城市更新工作争当标杆示范。成都市副市长刘玉泉陪同考察。 国开行河南省分行副行长甘伟红、刘建梅，副市长黄玉国参加考察。 李湘豫一行先后来到望平坊、下涧槽社区、中车·共享城、北门里·爱情巷、宽窄巷子等处实地考察，并来到成都规划馆，了解成都市总体规划及“一心两翼三轴多中心”市域网络化空间结构。随后，李湘豫来到成都市住建局，就重点工作进行交流，深入了解成都市推动城市更新“一个专项规划、一套政策法规体系、一个工作推进机制、一个基金、一个融资模式”等“五个一”模式。 望平坊是猛追湾市民休闲区一期工程的示范区，以“工业文明和现代时尚交相辉映，美食文化与文创产业共生共融”为打造理念，打造“最成都·文创美食合集”，进一步丰富夜游锦江消费新场景。下涧槽社区通过整合资源，精心打造三大功能空间和24处邻里交往空间，从“人、文、治、地、景、产”六大维度，构建社会企业孵化新平台、社区生活新场景、社区服务新业态、社区文化新生态，探索基层社会治理新模式。中车·共享城是主城首个以文化为基调，涵盖商业、生态、教育、医疗、立体交通为一体的核心城区优质人居微城市。北门里·爱情巷将以前单纯的建筑立面改变为以消费场景营造和产业植入为主导的特色街区，植入浪漫的文态业态，展现以爱情文化为主题，以夜间经济为主业，彰显“市井味、时尚范”的成都首条爱情文化主题街区。宽窄巷子是北方胡同文化与川西民居四合院融为一体的建筑风格在中国南方城市的“孤本”，是成都平原宜居休闲与时尚生活的最典型代表和中国首个院落式情景消费生活体验最原真的标本。一路走，一路看，大家在一个个成功运营的项目中开阔了视野、拓宽了思路。 李湘豫指出，城市更新“成都模式”实事求是、实实在在，取得了实绩实效，充分体现了习近平总书记对成都市的重要指示要求，是成都市建设践行新发展理念的公园城市示范区的具体实践；充分体现了以人民为中心，打造了共建共治共享格局，增强了群众的获得感幸福感；充分体现了高质量发展特别是可持续发展的要求，以政府主导、市场主体、商业逻辑，投融资规建管一体化推进片区综合开发，实现了更新单元经济价值、社会价值与生态价值的全面提升。同时，做好了有为政府和有效市场“两个结合”和生态、生产、生活“三生融合”。成都市的探索实践走在了全国前列，为开封做好城市更新工作提供了有益借鉴，为我们进一步明确了战略方向、提供了操作指引。大家要进一步解放思想、学习经验、创新工作，坚持新发展理念，突出共建共享、策划谋划、谋动联动，推动城市更新工作走在全省前列。 在蓉期间，李湘豫还拜会了国开行四川省分行相关领导，就做好城市更新工作进行了深入交流。 市政府办公室、市政府督查局、兰考县、城乡一体化示范区、鼓楼区、龙亭区、禹王台区、顺河回族区、市自然资源和规划局、市住建局、市财政局及文投集团负责同志等参加活动。（记者 叶森）,九天开出一成都，万户千门入画图。5月17日至18日，市长李湘豫带队来到成都市，深入贯彻落实习近平总书记关于城市工作的重要讲话精神，就城市更新等工作进行考察学习，持续提升城市品位、增进群众福祉，推动我市城市更新工作争当标杆示范。成都市副市长刘玉泉陪同考察。 国开行河南省分行副行长甘伟红、刘建梅，副市长黄玉国参加考察。 李湘豫一行先后来到望平坊、下涧槽社区、中车·共享城、北门里·爱情巷、宽窄巷子等处实地考察，并来到成都规划馆，了解成都市总体规划及“一心两翼三轴多中心”市域网络化空间结构。随后，李湘豫来到成都市住建局，就重点工作进行交流，深入了解成都市推动城市更新“一个专项规划、一套政策法规体系、一个工作推进机制、一个基金、一个融资模式”等“五个一”模式。 望平坊是猛追湾市民休闲区一期工程的示范区，以“工业文明和现代时尚交相辉映，美食文化与文创产业共生共融”为打造理念，打造“最成都·文创美食合集”，进一步丰富夜游锦江消费新场景。下涧槽社区通过整合资源，精心打造三大功能空间和24处邻里交往空间，从“人、文、治、地、景、产”六大维度，构建社会企业孵化新平台、社区生活新场景、社区服务新业态、社区文化新生态，探索基层社会治理新模式。中车·共享城是主城首个以文化为基调，涵盖商业、生态、教育、医疗、立体交通为一体的核心城区优质人居微城市。北门里·爱情巷将以前单纯的建筑立面改变为以消费场景营造和产业植入为主导的特色街区，植入浪漫的文态业态，展现以爱情文化为主题，以夜间经济为主业，彰显“市井味、时尚范”的成都首条爱情文化主题街区。宽窄巷子是北方胡同文化与川西民居四合院融为一体的建筑风格在中国南方城市的“孤本”，是成都平原宜居休闲与时尚生活的最典型代表和中国首个院落式情景消费生活体验最原真的标本。一路走，一路看，大家在一个个成功运营的项目中开阔了视野、拓宽了思路。 李湘豫指出，城市更新“成都模式”实事求是、实实在在，取得了实绩实效，充分体现了习近平总书记对成都市的重要指示要求，是成都市建设践行新发展理念的公园城市示范区的具体实践；充分体现了以人民为中心，打造了共建共治共享格局，增强了群众的获得感幸福感；充分体现了高质量发展特别是可持续发展的要求，以政府主导、市场主体、商业逻辑，投融资规建管一体化推进片区综合开发，实现了更新单元经济价值、社会价值与生态价值的全面提升。同时，做好了有为政府和有效市场“两个结合”和生态、生产、生活“三生融合”。成都市的探索实践走在了全国前列，为开封做好城市更新工作提供了有益借鉴，为我们进一步明确了战略方向、提供了操作指引。大家要进一步解放思想、学习经验、创新工作，坚持新发展理念，突出共建共享、策划谋划、谋动联动，推动城市更新工作走在全省前列。 在蓉期间，李湘豫还拜会了国开行四川省分行相关领导，就做好城市更新工作进行了深入交流。 市政府办公室、市政府督查局、兰考县、城乡一体化示范区、鼓楼区、龙亭区、禹王台区、顺河回族区、市自然资源和规划局、市住建局、市财政局及文投集团负责同志等参加活动。（记者 叶森）,政府领导到其他城市考察学习或访问,0.6706109263438537,True
146,河南省,开封市,山东省聊城市委政法委副书记杨国强一行赴我市考察学习,2020-08-12,https://www.kaifeng.gov.cn/kfsrmzfwz/gzdt102/pc/content/content_1737108604187877376.html,8月11日，山东省聊城市委政法委副书记杨国强一行10人赴我考察学习市域社会治理现代化工作，特别是基层社会治理“一中心四平台”作用发挥及“雪亮工程”建设。开封市委政法委副书记张振国陪同观摩。。考察团一行到尉氏县张市镇综合指挥室、两湖街道综合指挥室，对我市基层社会治理“一中心四平台”机制建设和治理效能进行了考察学习。。在示范区杏花营农场、杏花营镇，考察团参观了服务大厅、分析研判室、心理咨询室等，听取相关负责人介绍，并对“雪亮工程”建设情况，“一中心四平台”事件流转、事件办结等情况进行了提问，了解了“双向吹哨”机制。。最后，观摩了示范区综合指挥中心，通过PPT讲解、现场连线、雪亮工程功能演示，介绍了“一中心四平台”的建设打破了传统自上而下的派单式模式，将基层社会治理的工作重点和重心下移，充分激发基层活力，在基层社会治理方面发挥了重要作用。杨国强副书记对我市“一中心四平台”工作和“雪亮工程”建设高度评价，并表示此行学习收获颇多。,8月11日，山东省聊城市委政法委副书记杨国强一行10人赴我考察学习市域社会治理现代化工作，特别是基层社会治理“一中心四平台”作用发挥及“雪亮工程”建设。开封市委政法委副书记张振国陪同观摩。。考察团一行到尉氏县张市镇综合指挥室、两湖街道综合指挥室，对我市基层社会治理“一中心四平台”机制建设和治理效能进行了考察学习。。在示范区杏花营农场、杏花营镇，考察团参观了服务大厅、分析研判室、心理咨询室等，听取相关负责人介绍，并对“雪亮工程”建设情况，“一中心四平台”事件流转、事件办结等情况进行了提问，了解了“双向吹哨”机制。。最后，观摩了示范区综合指挥中心，通过PPT讲解、现场连线、雪亮工程功能演示，介绍了“一中心四平台”的建设打破了传统自上而下的派单式模式，将基层社会治理的工作重点和重心下移，充分激发基层活力，在基层社会治理方面发挥了重要作用。杨国强副书记对我市“一中心四平台”工作和“雪亮工程”建设高度评价，并表示此行学习收获颇多。,政府领导到其他城市考察学习或访问,0.0,True
